id,dialect,text
1149237178129690624,SA, ما عندهم حرية في كل شي  أليس من حقة أن يصيح متى مايشاء وبالعدد اللذي يريد  بعدين ارقامة مميزة   ترى عندنا دياكا تصيح أكثر من هذا الديك ماحاكمها أحد قرقور وأمثاله 
1149353003905949568,SA, الخسارة هذة العقل اللتي فوق  رؤسهم  ياحسافة لبسها مفروض بدالها جزم
1149386362094850048,SA, ما أقدر افيدك لكن ننتظر اللي يفيدنا كلنا أنا غشيم في السناب يا ابو علي
1150511094470971392,SA, اللي نعرفه انها تراث هندي دخيل على المجتمع الحجازي
1150546122026487808,SA,"  يا ابو مطلق نبي نختبر شاعريتك 
نبي هنا بيتين مدح وغزل بنفس الوقت عشان نحاول نقنع ابو ناصر ياخذ منك القصيده"
1150660416177168384,SA, النظام عندنا في السعودية يستقطع من الراتب  من الراتب وبعد  شهر تقدر تاخذ مؤجل تسدده بعد ماتخلص تمويلك كامل او اعادة من جديد يسددون اللي عليك ويطلع لك جديد
1150689399035834368,SA, عمر هالتطبيق من تو الشعب يعطيه وجه لدرجة ان اللي حملوه خلال الـ ساعه الماضية اكثر من مليونين و الف
1150823868816343040,SA, انا دفعت مبلغ وقدرة عشان جوله اول ماطبيت فيه اول ماحرك قلت وقف بموت الموظفين انجنو حلل فلوسك قلت مابي نزلوني 
1150825781666430976,SA, اكره البحر وهالشي وراثي فيني وفي اخواني كلنا واذا اضطرينا نطلع تشوفينا متوترين طول الطلعه بس نبي نرجع البيت والمسابح بعد 
1150827092554203136,SA, هذي هي المسبح اقدر اطلع هين ليتك تدرين ان رحنا مدينة مائية مافيها عرب الا انا وخوياي اثنين الاجانب خلو الالعاب وقعدو يتفرجون فينا صياحنا هز الارضلوهي خفيفه نشرق
1150837226516942848,SA,لك بالرياض محبه اه لو تدري 
1150885106392928384,SA,  جميله اسواق بالي مطاعمهم وكافيهاتهم فنون ابداعيه ف الديكور
1150969729235980416,SA, ياليتك جد تطبق البايو حقك وتحترم نفسك عيب اللي تسويه بنفسك 
1150970448961855616,SA,خلاص اعقل رديت عليك بحسابك الثاني م في داعي تسوي حسابات وهميه 
1151003690557476864,SA,"مجيد فيذا يالله حيوه 
 وش هالصبح الفخم "
1151007629856190464,SA, نسف في ذا القهاوي اكثر من المويه ماتجي  ونص الاانا فاصل ع الشريك
1151047287449227264,SA,حنا في بلد قانون واللي ماتربى يربيه القانون ماعندنا استعداد نتحمل عقدكم وازماتكم النفسيه يارخو انت وياه دامك واثقه من نفسك وماسويتي شي كبتشري الشاشة وارفعي فيه قضية تهديد واستفزاز وتحرش ويتلونه بااقل من  ساعه لاابو هالعينات الرخيصة 
1151061060931194752,SA, جهزوا فطوري الخميس بجيكم 
1151091609511092224,SA,  اتفق معك لكن ياعبدالرحمن والله بعضهم قليل فيه ودك يلنزخ على عينه بقضية سب وقذف يعرف ربه مو مجبورين نتحمل عقد البعض ونقص عقولهم
1151092284827590784,SA,مو مجبورين نتحمل عقدكم النفسيه في السوشل ميديا علموا عيالكم وبناتكم ان السب والقذف كبيرة من كبائر الذنوب وخطيئه دنيوية يعاقب عليها القانون ويجرمها حذيفه قواك الله مع هالعينات اللي ماتستاهل الاحترام والتقدير يعني يقالك بيسوي شو يتهم خلق الله علنا تحت مسمى طقطقه 
1151543564054212608,SA, كلهم ينسخون نفس الكلام الله يحفظهم  خواتي نعيم الدنياع طول ادري انهم مجتمعين
1151546478390894592,SA,احب جوه واهنيه بس صراحة ماعرف اسوي كذا انا اسافر اتعيجز اشيل شنطتي تبوني اطبخ هذا غير اني احب السيتي اكثر من الطبيعه 
1151926637631549440,SA, الصحيح من يسئ ويتجاوز على الناس مامنه فايده وفرقاه مكسب لاتفك
1152164282299273216,SA, نبغى استفتاء تطرحه هنا في حسابك عن هذا الترفيه اللذي اختصرته كله في الأغاني هل هو مرغوب فيه  ولا غير مرغوب فيه  والشعب بيحكم  يالله اتحداك تسوي استفتاء  ننتظر
1152180231446388736,SA, نوظفهم الصباح ويسبون بلدنا وحكامنا بالليل ويحول للحوثي ولحسن زميره
1152879482354786432,SA, ومن باقي يروح سياحة لبلد الزباله
1152977624299462912,SA,      اخي مرشد ماصورت وسم الناقة  حتى يعرفها راعيها من وسمها ولو نحرتها انت او كلمت مسلخ ووزعت لحمها على نية راعيها كسبت معروف واجر راحتها من هذا الكسر وجزاك الله خير وممكن تكون ضايعه مالها راعي اذا كانت غير موسمه 
1153719776650436608,SA, الله يبارك فيه ويصلحه
1154121210281779200,SA, ليش ماتحط الهاشتاق  وتغرد فيه السلسله عشان نغرد في الهاشتاق
1155109867218178048,SA,"اجازهالمعلمينطويله
اللهم إني اعوذ بك من الحسد والنفاق تجاهلو كل مايقدمة المعلمـه طوال السنة من جهد وصبر على عيالهم اللي بعضهم ما صبر عليهم في بيته وهم عياله "
1155401517437988864,SA, ماتشوف باس وبجد يومين ماغردت  يوميا لازم اشقر على الحساب
1155914432188485632,SA, والسلق اللي واقفين خلفها توني وعبد الزهرا ليش ما وظفت بدالهم سعوديات او سعوديين 
1156699109434298368,SA,   ياخوي اللي يسمعك يقول الخليج كشك خشب على الرصيف متى مابغت ايران تقصفه قصفته  من جهة العقوبات شف النفط الايراني متكدس في المواني  الظاهر انت ماتابع الا قناة الخنزيره
1159230377996824576,SA,   فارس كان من حقك تبدي رأيك لكن تتكلم باسمنا وتتهم ابو علي وانت مجرد طرطور حسابه جديد ومتخفي مثل الصرصور هنا نقول انثبر ولاتمثلنا ولانتشرف بالسفله امثالك مجرد كلب حوثي
1159606839224483840,SA, نزلت الفديو انت مالقيت غير نايفكو هذا قسم بالله اني اكرهه في الله
1159643406752276480,SA,    هذه تكلم عنها ابوها وهو اعرف بها منكم وفديو موجود لكن انتو من وكلكم بالكلام عنها  ولا انتو شلتها اللذي تسببتو في انحرافها حتى على ابوها واهلها 
1159921719215345664,SA," عندهم سعر الكوب يمكن بالفين ريال وحبه شكولاته ب 
وفي المحل اللي جنبهم الكوب ب ريال واطعم وحبة الشوكلاته بريالين وانظف  مشكلة الاسر المنتجه السعر المبالغ فيه على الفاضي"
1161053343692787712,SA,     فعلا موجعتكم الامارات ههههه الله يحفظهم ولاتفكرون انكم بتسوون بينا فتنه هههههه  واحنا والامارات شي واحد اصبعين في كف
1161458274258096128,SA, جمهوريةايراناللااسلامية
1161488809143557888,SA, هذا ابن سمسار الاراضي الخاين متربي على الخيانة
1161840392503013376,SA," صدق وهو كذوب 
الذبابه تعيش وتموت وهي ذبابه"
1163074631214993408,SA, طلعة سالفة الطاقيه قديمه لابس رياضة وطاقيه 
1163649678166110208,SA," كمل الجمله 
وتدخل تمنشن فايز المالكي  الله يكون بعونه ابو راكان كل منشنه فواتير"
1164072700576509952,SA, وانت بتغريدتك هذه فتحت المجال بس للمنافقين والكذابين اللي مالهم اي دور سوا النفاق بين الناس والحسد الله يهديك اذا بينك وبينهم شي حله بينك وبينهم لا تكن وسيله لكل منافق وشف الفرحين بالسالفه هل تظن انه حب فيك لا والله  لا انت ولا اللي ذكرتهم فقط يكرهون كل من يدعسهم ويدافع عن بلدنا
1164138722415271936,SA,  اقوى واحلا استفتاء شفته نفس طريقة بحر الرياض 
1165293771833184512,SA," التلبيه لله سبحانه 
شفلك اي صيغه ثانيه"
1165562109389889536,SA, متبطحين في الفنادق ويستلمون رواتب ما استلمو مثلها من الله خلقهم  ليش يترك النعمة ويحرر بلده  تبيه يقطع رزقة بيدة  بعض فتح محلات حتى في تركيا وهرب حتى القات للبلد وهو ممنوع عندنا ويصنف من المخدرات المنشطه
1165582011760816128,SA,  يغدر بك  ومنهو اللي تأمر مع القذافي  ومنهو اللي قناتة تنبح ليل نهار على المسلمين ومجمعين شذاذ الافاق  غير الخنزيرة  ومن فجر الصومال ومكالمة المهندي  طلع جاهل وغبي اذيتونا الله يوذيكم فقلنا الباب يقعد اذاك عندك فعلا فيكم غباء ولا تستغبون الناس  فارق دام هذا فكرك
1170963813136551936,SA, طبعا البوكلين كان طالع فوق المبنى يشم هواء بس وبينزل
1174300688219852800,SA,  فشيله وخيبه ودليل فشل ذريع
1175232372763181056,SA,"  سؤال خارج الموضوع 
ليش تعلجون اللغة العربيه كيذا هذة من اي قاموس  ولا انتو نفس شلة اللي يكتبون العربي بالانقليزي  هل هو فن ولا ثقافه ولا موضه  فلا تركب على اللغة اللغه حرف لازم تهتمون فيها وخاصة اللغة العربيه بدل ماتكتب كيذا اكتبها صح كذا لانك شوهت اللغة"
1175242947312459776,SA,   مو سالفة فاضي لا والله ولو كتبت كلمة وحصل فيها خطأ إملائي مقبول وعادي لكن انا قصدي تعمد كتابة الكلمة بالخطأ ترى غيرة على اللغة العربيه مو فضاوه واشوفها منتشره بجد حبيت اقدم لك نصيحه انه خطأ وتقبل تحياتي 
1175488535413100288,SA, مفبركة في قناة الخنازير
1176090798338772992,SA,   ايه شفتها حالتة صعبة
1176092185621610496,SA, أي عراق  اللي يحكم العراق سليماني وكلاب ايران الاسم فقط عربي
1176092631769788416,SA, ااه ممكن تضامن العراق جاسوس يوصل معلومات لسيده الخميني
1176120903412986112,SA,"  يحمل المواطن ديون زودا على فواتير ه اللي بلشان فيها 
وشو على شانه قال موسم  الله يريحنا منك فأنه على كل شئ قدير"
1176130361421639680,SA, احسنو الظن الرجل عنده مرض مانعه من الزواج ويمكن راح للعلاج ولافيه اي اشكال ان يلبس ثوبه اللي يرتاح فيه
1177098651824472064,SA,هذا التسجيل ابو علي اللي انا تكلمة عنه  
1178027320449409024,SA,  لا هذه فقط عقول اهل اللطم من بعد ماحكمو العراق صار نعال
1000133622417051648,SA,صلالهالان اللهم احفظ عمان واهلنا بعمان يا رحمن 
1000780479191273600,SA,  لعنك الله ولعن الله المثلي ارغان الكلب وانتو تنبحون ليل نهار ياعيال الكلب على بلاد الحرمين اللي مطبقة الشريعه وليس لها علاقة مع اللي محتلين بلدك فسر لنا هذا التناقض يا كلب اردغان
1051513620562149376,SA,  دولتنا ماهيب دويلة شرق سلوى يهددها اي احد 
1051666038067216384,SA,  سوسا هانم او الكلبه خميني اسمك الكلبه خميني ماتسوين نعال يوسف علاونة القديمة اللي راميها بالزباله يا سوسا خميني
1053001184297058432,SA,  سمعت انهم بينقلونه مع الطائره اللي تنقل حليب الحمير
1053359542954852352,SA,رفرفي وارقي سنودي الولاللهثماخواننوره 
1053361055106297984,SA,الولاللهثماخواننوره     ايه انا سعودي وحب اراضيها 
1053746981384937600,SA,"وإن حكى فيك حسادك ترى
مادرينا بـهرج حسادك ابد

 السعوديونصفواحدخلفقيادتهم "
1054854133847654400,SA,"  خلك على القات  خزن وبوس ارجل السيد ابن الخميني اللي بالجحر 
خل السعوديه بتصرف نفسها بدون حاجة احد "
1055205511040327552,SA,السعوديهالعظميتعانقالسماء الله اللي عزنا ما لأحد  منه  
1055954894975369216,SA, والله يا الاجودي الفشيله فشيله في ليل ولا في نهار  بعدين انتو ماجينا يمكم بشي احنا نبي الكلاب والمرتزقة اللي ينابحون ليل نهار على السعودية  وينهم هل اصابهم الخرس  ولا الهدف غير  هنا السؤال يا ابو وضح النهار
1055973391969202176,SA," يارجال عزيمة عشاء بس وبيمشي هههههههههههههههههههههههههه
تخيل بس لو كان الاستقبال بالرياض الله يكرم الرياض عنهم  يارجل كان تويتر طلع له كرشه من الكلاب النابحه اللي خرسو وماتو الان ماله حس "
1058307931471597568,SA,"  لماذا الحكم على الناس بسوء الظن  
اذا كان مابتفعل مثل فعله فاخدمنا بسكوتك ماندري ماهي مصلحتك من هذا التزييف للحقائق  رجل يدافع ليل نهار عن الدين والدوله وانت مثل الكلب اللي ينبح الضيف رايح وينبحه جاي انثبر الله ياخذك وياخذ امثالك اللي مامنهم الا النقص"
1059176881596125184,SA, للاسف معطيني حذر صورو التغريده
1074015543064182784,SA, كل ماسبق وزياده المذيعين الحمير في القناة اللي يعشقون السباحه في بحر الثمامه
406524319729086464,SA,"من روائع ابن فطيس 
مال حبك طب مدامه تفشى
في عروق اللي ورى العوج النحايف 
لبسك الحشمه وبالعفه تغشى
بس عيبك منت بمحاكيك رايف"
412021573995233280,SA,"انا ودي بس اعرف من قال ان السفن يروووق 
اللي اعرفه ان السفن مشرووب امساك
ههههههه قوووسم اني اشربه للغرض هذا صوتلبطلالروقان"
412307834643034112,SA,"اليوم برد غير طبيعي  
ومن قوة البرد مر من قدامي ذبااانه  شايله  حطب 
هههههه"
412686458818797568,SA,"فيه ناس ماأدري وش تحس فيه 
يتابعك اليومويلغي بكره
يعني تبي تسوي كشخه يتابعك أكثر
ياخي ما دخلنا تويتر نكشخ  دخلنا نسولف ونستا نس 
حقيقه"
413151011444776960,SA,شيتتمناهيتحقق كثير أشياء نتمناها تتحقق ولكن بالنهاية ماراح تاخذ الا نصيبك من الدنيا 
415007800515776512,SA,"حياك يا صبح تنفس بنوره 
أدفى حنيا اللي من الليل بردان
من بسمته قامت تغني طيوره
انغامها تطرب خفى كل ولهان
صباحالنورقلمي"
415564525295788032,SA,"يا عالم فيه ناس بتجنني  قسم يتابعني دقيقتين وكراع  طبعا الكراع  نص دقيقه  ثم يلغي  
ابي افهم وش سالفته  بس 
حقيقه"
416131181168431104,SA,"ماذاتقوللنفسك 
يا نفس هيدي لاتزيدين  الأوجاع
كافي من الدنيا  نشوف  العجايب"
417966868993802240,SA,"وينبتكوناليومالساعهاثنعش 
اتوقع بكون منسدح  على الفراش وحاط رجل فوق رجل وانتظر حلم يجي منا ولا منا واقوم اصبح اعلمكم فيه    "
419508630258339840,SA,"مادريوالله  
ما ادري والله وش تحسون فيه 
يا جماعة متابعة  دقائق مادريوالله"
420554354408443904,SA,"شيتسمعبهولاشفته 
هذا اللي يصرصر  بالليل   نسمع صوته ولا نشوفه
"
423900667292295168,SA,"واحد أحول 
أستقبل اخوه بالمطار 
سلم على الشنطة  وأشتال أخوه     "
425544135534055424,SA,"مصطفي زعل من الصداقه
يا اللي تبرشم ما نبي لك صداقه صداقتك ما غير يومين وتروح
تنصب علينا وفي كلامك لباقة ولا الحقيقه ماتبي غير مصلوح
وناسه"
425970477794738176,SA,"وقفةاحترامللبنتاللي 
ما عندكم شغل الا البنات  انتم فكوهم شركم وهم بخير بناتنا فيهم الخير والبركة 
وإذا فيه وحده سيئة تمثل نفسها"
425984456285904896,SA,"اشياءاكتشفتهابنفسي
اكشفت ان السعيد اللي بحياته معتبر واكشفت ان البشر لا شيء من غير الخلق"
448230445579518016,SA,"تخيلوالوكناعائلةوحدة 
يا هي ورطه 
احنا بلشنا باللي معنا في البيت 
تبي تجيب الثانين اللي بعضهم تشوفه بالتلفزيون تقفله من سماجته"
448517462964072448,SA,"كمهلاليفيعائلتك 
العائلة الله يخارجنا 
واحد الاتحاد 
واحد الهلال 
والشيخ اللي هو أنا نصراوي يا حبيبي نصراوي ومن قدي متصدرلاتكلمني"
457447870673981440,SA,"هيحصلأيه 
مش ح يحصل حاقه    "
466164437959725056,SA,"كلام الرمزيات هذا  ما كل واحد يفهمه 
تكلم بوضوح ولا  فعلا كأنك تسولف مع نفسك  
هات السالفة كاش خل عنك التفاريد  "
467033100875075584,SA,"اربع فيران 
يلعبون بلوت قال الأول  
قال بس 
انحاشوا كلهم 
وناسه
ههههههههههه"
478718224725725184,SA,"صباح الخيرات
والدلة والتميرات  "
827292898110664704,SA,صفقة جديدة للنصر سبق وأن قالها كحيلان اللاعب اللي يحتاجه النصر سنوقع معه قول وفعل أهلا بك بالنصر أسد عرينه وليدعبداللهنصراوي 
830122772051398656,SA,الاهليالزمالك  ألف مبروك للزمالك  وجماهيرية بطولة السوبر هاردلك للأهلي وجماهيرية السوبر للفريق السوبر
831970365656150016,SA,ريالمدريدنابولي  مالها الا كروس الهدف الثاني لمدريدنا 
837054856825356288,SA,ريالمدريدلاسبالماس  بيل أحمر طرد  
841024136180838400,SA,ريالمدريدبيتيس أخيرا الدون يسجل ويعادل النتيجة  
841037719232999424,SA,كالعادة المنقذ راموس  يسجل  الهدف الثاني  ريالمدريدبيتيس 
841049270488825856,SA,ريالمدريدبيتيس  ياويل اللي ماعنده راموس الف مبروك جماهير مدريدنا فوز وصدارة 
841398219309535232,SA,كانتي لاعب تكتيكي يقطع يمرر يراوغ يسجل مكسب كبير لشيلسي تشيلسيمانشستريونايتد 
855500734237954048,SA,النصرالباطن جندلونا وفازوا علينا الباطن يقلب الطاولة على نصرنا ويفوز ب  درينا مافي بطولة هالموسم ورضينا تاليها خلونا نحلم  بمقعد أسيوي  
858323225033531392,SA,ريالمدريدفالنسيا يانكون اللي نبي ولا ياعسانى مانكون مباراة لا بديل غير الفوز حتى نصل الى سقف الطموح بطولة الليغا بالتوفيق للريال 
859029167408590848,SA,اينبديلفيصلبنتركي يا كثرهم وقت الكلام والثرثرة حب أضواء وفلاشات وفشخرة وياقلهم وقت الفعل مال النصر غير رجاله لقال فعل حب ولاء وأنتماء 
859031670925795328,SA,اينبديلفيصلبنتركي وينكم  كثر كلامكم وقل أفعالكم اللي مو قدها لايكثر كلام مأكول خيرة لم يتقدم أحد لأن مافيه أحد أتركوا السفينة لربانها
860984093269528576,SA,برشلونهفياريال لقطه المباراة وختام اليوم روقان ومتعة وفوز التنافس مستمر بين الريال والبرشا عل خطف لقب الدوري 
866375979517833216,SA,"الهدف الثاني بنزيماخلاص الليغا بنزيما حسمها الف مبروك جمهور الملوك 

 ريالمدريدملقا "
866413442219069440,SA,ريالمدريدملقا الرقم الصعب لموسم صعب ساعة الحسم أوجد الفارق و الحسم 
870682986168983552,SA,من داره لداره حياه  الله وابقاه محمدبنزايدينورالسعوديه 
896435229757505536,SA,النصرفياولمباراهبالدوري السهلاوي هدف  
896439611089661952,SA,"النصرفياولمباراهبالدوري
اذكروا الله وقولوا ماشاءاللهالهدف الثالث 
فهدالجميعه بطل قادم 

النصرالفيصلي "
904846464144338944,SA,اعتزازالفيصل  الله يعزك قدر ومقدار  
905192620925865984,SA,"والله مامثلك بهالدنيا بلد 

 الاخضرفيروسيا "
917252709992095616,SA,السعوديهكلهامصر  أفرح يا شعب عملوها الرجاله عقبال ما نفرح بتونس والمغرب  
920384596025532416,SA,حظرلحسابفيصلبنتركي رجل النصر الأول عمل ودعم وفعل كلنا معك ومع النصر   
920652901680402432,SA,"انا اشهد انك كفو طز بشنب رجال مايفتخر فيك مرزوقالغانم 

 "
925807182137974784,SA,الهلالالشباب الكورة خارج الملعب في المرمى هدف انسى المباراة وركز على الاسيوية وخلصها ثم تعال وروق  بما هو محلي بالتوفيق يا هلال يازعيم 
935196801103261568,SA,تعرفسيلفا جحفلي يمسيكم بلخير
947380882255613952,SA," ابو علي سوال 
 بخبرتك ومعرفتك ماتقدر تتواصل مع احد من ايران يعطينا الاخبار والصور  سكايب او اي طريقه"
947947363741642752,SA,اقالهفيصلبنتركي 
951770524803371008,SA," لايهمونك 
وبالنسبة لعقيدتهم انكشفت وعرفوها العالم اصلا فضحهم الله في سوريا والعراق"
952656483103145984,SA,"الدوري الاسباني  هدف يدرس بسلاسة تيكي تاكا 
 برشلونهريالسوسيداد 
 "
953358027809345536,SA,"  ان دل على شي يدل على فشل اهل الدار 
اللي طردهم الفار 
لا امتنعو من الفار ولاسلم من فزع لهم من اذاهم"
957480234286067584,SA, صار العاشق وذيب القايله سوا 
959347817339916416,SA, مادرى عنكم احد  الله يخلف بس
960201669198872576,SA,الباطنالهلال مايمديك تسجل في المرمى الهلالي هدف الا ويجيك الرد أهداف أشكال وألوان  رتم الدورى مع الهلال ولع ولع ولع متصدر والجمهور الهلالي في المدرج فرح وطرب
960211199718805632,SA,  من عطاكم رقم جوالي 
961967617341841408,SA," بصراحة حركتهم على الحدود هذي سخافه وضعافه 
اولا السعودية ماتعتدي على احد والشعب القطري اهلنا واخونا والمشكله مع طميم وحزبه بس هذا اولا وثانيا لو السعودية بتهاجمه مايتحمل حتى  ساعة قسم بالله"
962116278579355648,SA,  فعلا الشعب القطري ضحية سياسه خاين لجيرانه وقناتهم شغلها الشاغل دول الخليج شي ماينصبر عليه يكفي مجامله دول الخليج صبرت عليهم  سنة لاكن ذيل الكلب مايتعدل
