id,dialect,text
655813530663440384,EG,"الحقيقة انا فرحان في الكائنات السيس جدا
كل يوم بيعدي بيتأكدوا انهم قربوا ينقرضوا 

محدشراح"
656167208511500288,EG,"امبارح محدشراح
النهاردة الوضع اختلف تماما برضومحدشراح
"
656379334459027456,EG,"فيه حاجة مهمة هي اللى خلت الناس ماتروحش الانتخابات
سيتي ستارز ماقفلش إمبارح
"
657107545736290304,EG,"يسعد صباحكم كلكم ياشغالين
الشمس طالعة بابتسامة الامل
شعلة ياقوت زي الخدود وقت الخجل
بتقول يا نايم قوم بدا وقت "
657173380811091968,EG,"قواعد الدعوة السلفية باعوا حزب النور في الإنتخابات
وده مؤشر مش كويس  مش للحزب اللي كلنا عارفين مين بيشغله  لأ "
658641127554179072,EG,"معظم اللى عايزين يدمروا البلد ويسقطوا العواميد بتاعتها
إعتزلوا  لأنها مش محتاجة "
658798783430569984,EG,جميع اللى ماتوا  عيالى الصغار جميع اللى عاشوا  ملوك القمار
660161251218210816,EG,"جينا الدنيا في لفة
وخارجين منها في لفة

وبين اللفتين بناخد فيها لفة 
  "
661644205916295168,EG,"مافيش حاجة بقت بتبسطني  صورة وصوت عمرو وماهر وعادل ورامي مش بيفارقوني
بافتكر ولاد ماهر وأنا باشوف ولادي
وبافتكر "
664037495013810176,EG,"ربنا مايرضاش بالظلم  ولما أكبر هاضربكم 

مش باقولكم فقرة كوميدية من تاريخ مصر "
666018310362947584,EG,"مش قادر أكتب حاجة لأني فعلا مرعوب من اللي جاي وخايف على بلدنا وأحلامنا الكبيرة اللي حطمها نظام العواجيز 
اللهم إحفظ مصر والمصريين"
666565364956925952,EG,"ضد الملل و عمرى ما هسيب 
حزنى يزيد يبقى جبل
عندى اللى يفتح لى بيبان الفرح
أنا عندى أمل

و اجمل ما عندى ايمان بالله
و نقول يارب تكون بالعون"
666644214109851648,EG,"عارف هياكل الفراخ اللي الناس بتشتريها بالكيلو وتعملها أكل للقطط والكلاب اللي بتربيها
دي أصبحت وجبة البروتين "
667831542333345792,EG,"كانت الحقيقة واضحة وكان باين مين اللي بيقود الثورة المضادة 
كانت الفرصة مواتية للقضاء على رؤوس الفساد وإجهاض "
668111953315909632,EG,"هو إيه حكاية سفارة المانيا اللي كل ما أسأل حد يقولي رايح بكره أسأل على إجراءات الهجرة و سايبنهالكم
بلدك بيك أولى يا شاب منك ليه"
668863269944193024,EG,"حد يطمنني على العرس الديمقراطي يا جماعة 
محدشراح ولا ايه
انا سامع ان المرشحين بيدفعوا لحد  جنيه في الصوت
"
668916503677419520,EG,"عندنا مشاكل مع كل الدول اللي على حدودنا
ليبيا والسوادان وقطاع غزة
بس الحمد لله علاقتنا فوق الممتازة مع الكيان الصهيوني "
669077717539753984,EG,"تركيا وقعت طيارة روسية
باينه هايبقى مرار طافح "
670961301267603456,EG,"احلامي حلوة يا ناس للكل نعيش انا وانت زي الفل
احلامي دايما منبوذة في وسط عقول عجوزة
كان ذنبي ايه اشيل الهم وغلطتي "
671688772237570048,EG,"الكائنات السيس اللي لسه لم تنقرض
مش عارف كان إيه موقفهم وعصام حجي اللي الأذرع الإعلامية قالوا عليه خاين وعميل "
671968814511300608,EG,"إحنا لازم نحتوي الشباب يا أحماااه
عايزين نبني سجون جديدة "
673783121851064320,EG,فيه ناس كتير من اللي حلموا ببلد محترمة وحياة آدمية ونظام حكم محترم محبطين وزعلانين من الحالة المتدنية اللي وصلنا 
673924805276512256,EG,"هههههههه
من الحاجات القليلة اللي ضحكتني جامد من فترة  "
674493861704564736,EG,"الحكاية لسه ماخلصتش والراية لسه ماترفعتش

صباحكم مقاومة  وماترفعوش الراية البيضاء لفضة المعداوي وشركائها  "
675020505867558912,EG,"وهي الثورة المضادة كسبانة من شوية
ده كفاية اللي محسوبين على الثورة عاملينه في بعض 
عموما كله هايطلع في الغسيل "
675407717306114048,EG,تحس إن الزمن واقف  كلام من سنتين زي مايكون النهاردة 
677409990068584448,EG,"الفرجة والفرحة
الحقيقة أنا فرحان ومبسوط جدا من اللي بيحصل من الطفح اللي طلع على وش البلد بعد  يوليو
أحمد ناموسة "
678573351082815488,EG,قولتلك من سنتين يا فندم 
678601604736688128,EG,"ولاد البلد عارفين أصول الخناق
مافيش ضرب في المحاشم وماتخليش ظهر اللي بتتخانق معاه في الحيط

واللي مابيلتزمش "
679376014359810048,EG,"مع كامل تأكدي من فسادهم رؤوس النظام جميعا 
بس فيه فرق كبير بين اللي حارب الصهاينة واللي اتفرج على الحرب فيديو"
682655557438849024,EG,ياترى الإمارات هاتفرقع بكام مليار صواريخ وبمب النهاردة 
683618284521021440,EG,كل واحد يخلي باله من لغاليله  
683642272618049536,EG,"إحنا ماعندناش حمائم علشان تتصارع مع الصقور
إحنا عندنا صقور بتتصارع مع صقور"
684129848772669440,EG,"عاجبني قوي الشخصيات السياسية اللي إندهشت وإتفاجأت من كلام حازم عبدالعظيم عن إنتخابات البرلمان

من الواضح إن ناس "
684740504341344256,EG,"إحنا ربنا مدينا حاجات مش عند أي دولة
جيبلي بدل يحيط بيها بحر أحمر وبحر متوسط  جيبلي بلد 
ماتعرفوش إن الجيليد "
686089624771530752,EG,فيه ناس غلابة بتاكل من الزبالة علشان فيه ناس زبالة بتاكل حق الغلابة
686183647003701248,EG,"مش كفاية علينا البرطمان اللي جوه
كمان طلع لنا برطمان بره

أين أنت يا تاهيتي "
686816041360584704,EG,"ليه خايفين م الكلمة  يا عباد المأمور
لسه الحق مجاش ومفيش دم بلاش
قطر الناس قشاش  مين مستني الدور
مش قابلين "
687602201196367872,EG,"إحنا فينا اللي مكفينا  بس ماحدش يقول علينا

إستراتيجية النظام في محاربة الفساد "
688135930645884928,EG,"أعظم حاجة اللي عملتها في حياتي ولي الفخر اني كنت واحد من من الألاف اللي إبتدوا
اناشاركتفيثورةيناير"
688473601931112448,EG,"هدوم غالية وناس رخيصة
وكله هايص أكيد في الهيصة"
689714975674359808,EG,"شيكا بيكا وبولوتيكا 
صباحكم زي مابتتمنوه للناس "
692001829736071168,EG,"إنت إزاي تقل أدبك على واحد مستقوي عليك بالسلاح وقتل صاحبك وحبس أخوك وضرب زميلتك
مافيش أخلاق خلاص "
693717859021787136,EG,تحية لكل كائن سيس لم ينقرض حتى الأن  صامد رغم كل الفشل والكذب والفساد وأعاصير الحقيقة اللي بتهبدك  قفا كل 
694063562822672384,EG,"صفحة الورقة  إسلام جاويش كان عدد متابعينها إمبارح الصبح مليون وربع شخص النهاردة وصلت مليون وألف 
صباحكم "
695152802423791616,EG,"اللي مش عاجبه ان الأطباء يعملوا إضراب في المستشفى اللي الداخلية ضربتهم وأهانتهم فيها
يبقى ينزل أمه تقف في الإستقبال طول الليل 
"
695548602563850240,EG,"ننزل بقه نصلي الجمعة ونشوف المهيب الركن عايز يقولنا ايه النهاردة
"
695725319748198400,EG,من سنتين  للأسف ماعندوش  
696397133071704064,EG,"بلحة عنده إصرار عجيب على تكرار كل مشاهد التخلف والجنان اللي حصلت في منتصف القرن الماضي 
بلحة كده كده رايح ومش "
696995947969175552,EG,"ليه تسكتى زمن اتكلمى
ليه تدفعى وحدك التمن اتكلمى
وتنامى ليه تحت الليالى اتكلمى "
697801931868278784,EG,زي دلوقتي من  سنين 
698136531517771776,EG,طب وهندسة  إيد واحدة  
699184497808576512,EG,"يا ريت يا جماعة ماحدش ياخد الدائري من  أكتوبر  فيه دبابة مقلوبة بس  إنتوا عارفين السرعة وطيش الشباب
"
699343343629770752,EG,"واحد من سنتين كان بيقولي إهدوا شوية بقه وسيبوا البلد تمشي وكان خايف قوي على المهيب الركن
قابلته من يومين وقالي "
699647279968468992,EG,"أنا مش فاهم إيه قصة أزمة الدولار دي  ماتمدوا إيديكوا في خزنة قناة السويس اللي مليانة مليارات الدولارات بعد حفر القناة الجديدة 
  "
699649054435889152,EG,"الأحد  الدولار ب  جنيه
الإثنين  الدولار ب  جنيه
الثلاثاء  الدولار ب جنيه 

ياترى مين اللي وراء "
699893082532220928,EG,مش شمتان في كل اللي دعم وآيد القمع والتشويه والإعتقالات والقتل المستمر من سنتين ونصف وحاليا بيتعذب وبيعاني من 
701419517428289536,EG,"ماحدش عارف مين بيقبض على مين ليه فين 
وده قمة الإعجاز الأمني"
701673527838121984,EG,"نستلف  مليون دولار بفوايدهم نقوم نتبرع ب منهم لنفس اللي إحنا إستلفنا منه 
لا تخرج قبل أن تقول سبحان الله "
701894726996328448,EG,"عزيزي الكائن السيس اللي لسه عايش ولم ينقرض حتى الأن

كل سنة وإنت طيب النهاردة الذكرى التانية لإعلان إختراع الكفتة 
 "
703346046345351168,EG,"شنبو في المصيدة

يلا اللي بعده
"
704692784482099200,EG,"نفسي أفضي دماغي 
حاسس إنها بقت عاملة زي هارديسك مليان على الأخر وبيزن ومش راضي يسكت

"
705128223588421632,EG,"مش مشكلة الناس بتتكلم عن العكش كأنه شخصية عامة ونائب برلماني بجد 
المشكلة إنهم بيقولوا على السيرك القومي برلمان"
706744507023421440,EG,المثل بتاع الحلو حلو لو صاحي من النوم ده مثل حقيقي لحد كبير  بس بالكثير في خلال ساعة من الصحيان بعد كده ما نقدرش نحكم
706942339403653120,EG,في أحد الهايبرات الشهيرة واقف عند الكاشير ورا ولد عنده بالكتير  سنة والكاشير الثلاثيني بيقوله ليك جنيه إعتبر 
707564118702739456,EG,ساعات كتير بتبقى عربية مليانة خدوش وتجريح وصاحبها مش بيفكر يصلحها وبيستنى لحد ماتتخبط خبطة جامدة أو تعمل حادثة كبيرة وساعتها بس بيقرر يصلحها
707926614433202176,EG,"والجيار قاعد في الشقة  تقوله شغل يقولك لأ
"
546570039496024064,EG,"وأرد بأي كلام واقول والله تمام
واسيبهم وامشي عشان
ما اسمعش سؤالهم تاني
ويا دنيا جرالك إيه بتعاندي معانا ليه
أحنا "
546619402607919104,EG,"عزيزي السيس  معلش أنا عارف إنك مش ملاحق من اللي بيحصل
بس كنت عايز أباركلك على الصلح مع قطر العميلة الصهيونية "
546933600286171200,EG,"ده اللى راح لو كان كويس
كنت ازعل يوم ما راح
ما تشوف بعنيك كويس
ده كويس انه راح"
547417243345489920,EG,"يا رسول الله يا عالى  أفديك بكل غالى
عمري ما انسأك دايما فى بالى
ياربى صلى على الهادي نبينا"
547665620851228672,EG,"سكوتي مش ألم فيا     وضعفك ليا حنية 
يا أول صورة في عيوني  يا ساكنة جوه تكويني 
أنا من الغربة ما أتأثر      سكوتك "
548580108140048384,EG,"داعش بتعمل كماين في سيناء وبتوقف العربيات وتشوف بطايق ورخص  وماحدش من الجهات الأمنية بيقرب منهم 
هما بس لو "
550197169593262080,EG,"انا كنت ناوى أخش يمين قالولى خش شمال أحسن
انا قولت دول طبعا فاهمين بصيت لقيت نفسى في مدفن
ده اللى يسال فى بلدنا ربنا يعوض عليه"
551119416059244480,EG,"يا     ف
    
     
      "
551677246893989888,EG,السكرتيرة معاها بي إم  كده مش حلو خالص 
552478645068247040,EG,"لسه برضه ساكتة مش هتقولي حاجة
بكرة هتقومي بالسلامة
ياللي شيلتي الهم ياما
ترجعيلنا يامه زي زمان بهية"
553642346961960960,EG,"لما الشتا يدق البيبان لما تنادينا الذكريات 
لما المطر يغسل شوارعنا القديمة والحارات"
554276673311744000,EG,"فيه كائنات هاتقول تستاهل هي إيه اللى وداها هناك
وفيه كائنات تانية هاتقول ده نتيجة الكفر والبعد عن الدين

لكن "
555004721489264640,EG,إنتوا مش عارفين إنكوا نور عنينا ولا إيه   لا صحيح  
556808178273644480,EG,"النهاردة ذكرى إنتفاضة الخبز   اللى قال عليها النظام إنتفاضة الحرامية
وقبضوا على الشباب ودكاترة الجامعة وعدد من الكتاب والفنانين"
557199425765130240,EG,مش كل اللى بتشوفه حقيقة  ومش كل اللى مابتشوفوش كذب 
557539572994031616,EG,هو الدولار بكام النهاردة 
558696019723292672,EG,"بيقولك الراجل الجديد هايبقى مفيد أكتر 
عنده زهايمر وكل مايخد منه منحه أو تمويل هاينسى "
558967412218150912,EG,"من مات مات وأفضى إلى ماقدم 
خليكوا في اللى عايشين"
559413156947046400,EG,"الدائرة تتسع خوفك ومشيك جنب الحيط مش هايخليك بعيد
بكره هاتدور عليك وغيرك هايعمل زيك"
559795540360450048,EG,"الكائن السيس هو اللي صعبان عليه التاكسي اللي اتحرق وفرح قوي بخبر أن محلب هايجيب لصاحبه واحد بداله
ومش مأثر فيه أن "
559831896256172032,EG,"ماهرعادلدومة 
بكرة  يناير جلسة النقض لو القاضي حكم بالقانون مش بالتليفون هايخرجوا"
560021280590929920,EG,"ياحماااااااا  باقولك  صحي شاهين 
الراجل بتاعنا مستنيه يكلمه بقاله  ساعات
الحكمبعدالمكالمة"
561803377785712640,EG,"اللى بيحصل في سيناء مالوش علاقة بالصراع السياسي
ولا هما مخابرات ولا هما إخوان 
فيه خطر حقيقي على البلد من تنظيم "
561856191408930816,EG,الكوميديا السوداء إن معظم اللى بيهاجموا المعارضين للفشل الأمني الواضح وبيتهموهم بمهاجمة الجيش  مادخلوش الجيش ولا حتى شافوه فيديو
563081229235675200,EG,"الخناق في الشارع ليه أصول  وأهم حاجتين إتعلمناهم 
الأولى  إنك ماينفعش تضرب في المحاشم  ودي ليها معنى "
563822738432081920,EG,"تأمل الصورة جيدا 
كلهم شباب وبنات وولاد 
مش فارقة دين أو إنتماء 
كلهم في الظلم سواء "
564179031072202816,EG,"ماتنسوش وانتوا بتنشروا التسريبات أن فيه ملايين من أخواتنا وقرايبنا وصحابنا شغالين وعايشين في الخليج
اللي بيحصل ده مش في مصلحتنا كلنا"
564525072476803072,EG,"دلوقتي علشان تعرف النظام عايز يقول إيه تتفرج على  و  أوالحياه
وعلشان تعرف اللى بيحصل تتفرج على الشرق ومكملين أومصر الأن
"
565119134837772288,EG,"المتظاهرين إخوان  ولما يتقتلوا يبقى الإخوان اللى قتلوهم
الألتراس إخوان  ولما يتقتلوا يبقى الإخوان اللى قتلوهم

يوميات كائن سيس"
565913964727787520,EG,مالكش تمن يا مصري لا جوه ولا بره  
566848014535655424,EG,جرب توصل ولادك الصبح المدرسة  هاتشوف حاجات جديدة 
567291928610603008,EG,داخل الشغل الصبح واحدة من اللى شغالين معانا قابلتني والضحكة مرسومة من الودن للودن وبتقولي ألف مبروك ياباشمهندس 
567731858251988992,EG,لأنهم غلابة ومساكين وطول عمرهم بيتم التلاعب بيهم وإستغلالهم لأن هدف يومهم هو توفير لقمة العيش ليهم وللي في رقبتهم 
568298341890703360,EG,"إمبارح مشغلين أحلف بسماها على قنوات رجال الأعمال
والصبح مشغلين النشيد الوطني في أو البرنامج بتاع راديو مصر

مش "
569151227864453120,EG,"قولنا كده من الأول 
الخبر من ديسمبر اللى فات 
النهاردة الدستورية قررت عدم دستورية القانون "
569390069959815168,EG,"اللي كان مش عاجبهم تدخل مصر في ليبيا عاجبهم تدخل تركيا في سوريا
واللى رفضوا تدخل مصر في ليبيا لم يرفضوا تدخل "
569565478517116928,EG,"انا مابحبش احلف بس اقسم بالله التسريبات بتاعتي مش انا اللى قولتها

صادق يابوسريع"
569761946398040064,EG,"من أجمل تعليقات الكائنات السيس اللى شوفتها 
أحلى حاجة في الخطاب هو الكلام اللى ماتقالش 
  "
570619203184664576,EG,مكتب إستشاري كبير كان زمان مطلع عنينا لما كنت شغال في شركتى القديمة اللى كانت مقاول  كان أكبر رأس فيهم 
570685621943046080,EG,معظم الكائنات السيس اللى بتفرح في قتل البني ادمين اللى مختلفين معاهم زعلوا على قطط نادي الجزيرة واتأثروا من حادثة كلب شارع الهرم
571007720456896512,EG,"ي الوقت اللى البني آدمين بيهتموا بالناس اللي بيتقتلوا  في الشارع وفي السجون بالرصاص والشضتعذيب
الأذرع الاعلامية "
572093636944535616,EG,يا بخت من زار وخفف  
572519074082775040,EG,"البلد دي محتاجة رئيس عسكري علشان يرجع الأمن والأمان 
مش معقولة كمية التفجيرات دي"
572822540080570368,EG,"ناس كتير مش لاقية تفسير ليه المؤيدين مش شايفين الحقيقة وحتى مش عايزين يشوفوها

عارف انت بيعملوا ايه في البهيمة "
573429767044776000,EG,"يابخت اللى عنده أصحاب رجالة 
جملة حقيقية  ومايعرفهاش غير الرجالة"
574589237070331904,EG,"البلد مش هتتقدم إلا بمواجهة أخطاءها مش عيب إننا نبقا بلد متخلف 
لكن العيب الحقيقى اننا نحط راسنا فى الرمل "
574855994246852608,EG,الحقيقة موضوع مقزز ومقرف إن لسه فسه ناس عندهم عقل مش مخ  بيرددوا كلام الأذرع الإعلامية إن  إبريل بتتلقى 
574856646993776640,EG,"أول إشارات الثورة المضادة ومين كان بيقودها
كانت زي النهاردة من  سنين
كشوف العذرية وسلخانة المتحف المصري

أنا مش ناسي"
575320785834868800,EG,الحقيقة أنا ماعنديش مانع وبالوم اللى بيدور على أكل العيش وعايز ياكل ويشرب وينام ويمشي جنب الحيط وبيحاول يستفيد من 
576762010043580416,EG,"الراجل بتاع الإمارات بيقولك إدينا مصر  مليار دولار في سنتين 
وتم عمل مشروعات شفافة بيهم  علشان كده ماحدش شافهم "
577788713700356096,EG,"في بلاد الجوع و الطوع والخوف والزيف والسيف والزينة
أحنا ولاد أحزان وفساد وفشل ده احنا ولاد لازينة
من بؤس حالتنا "
578221268387950592,EG,"هما مناظر بالمزيكه
والزفه وشغل البولوتيكا
ودماغهم طبعا استيكه
بس البركه فى النياشين
حزر فزر شغل مخك
شوف مين فينا "
578226884003123200,EG,بس أكيد العاصمة الإدارية الجديدة هاتغير كتير من التقييمات دي  
578505095853289472,EG,"فيه فرق كبير بين الدببة والدباديب 
الدباديب  اعلام كداب
والدببة  واقفين ع الباب
الدببة  يلبسوا نياشين "
580044988244983808,EG,"المياه بتيجى مصر بأمر من ربنا 
وربنا مايرضاش بالظلم "
583531822061072384,EG,"يا جدعان واللله هذا البوست خيالى ولا يعبر عن الحقيقة
ده كان كدبةابريل وكل سنة وإنتوا طيبيين  "
585054749231284224,EG,"وفي ابريل إحنا إتولدنا 
سبع سنين ومكملين   الانطلاقةالثامنة"
585877692014325760,EG,وكل يوم في حبك بتزيد الممنوعات 
586497254812442624,EG,حمزاوي طلع مع خيري على سي بي سي إمبارح  ده تطور نوعي على فكرة
586521240464187392,EG,"يعني علشان فيه شارع واحد أو إتنين بيبيع مخدرات  يبقى الشارع كله بتاع مخدرات
توقفوا عن التعميم والترديد  شغل الجزء اللى فوق رقبتك شوية "
586852218168594432,EG,أردوغان بيطالب بالإفراج عن مرسي بعد ما كان بيطالب لعودته للرئاسة  ده تطور نوعي برضه على فكرة
587252599759462400,EG,"شيئ مميز إن يكون عندك حد في حياتك بيشاركك وبيساعدك وبيساندك في كل خطواتك حتى لو مش عاجباه 
اللى عنده الحد ده يخلي باله منه كويس"
588632974133854208,EG,"واهو كله بيعدي افهم بقى يا افندي
مش واقفة على حاجة ولا حتى محتاجة  ان انت تزعل كل ده
حمزه"
588715566808100864,EG,"من المشاكل العظمى اللى لازم تشغل الجماهير دلوقتي 
إسلام البحيري ومناظرته مع الشيوخ
الوزير قال لموظفة عنده لازم "
590531539173244928,EG,"عدى النهار و المغربية جاية
تتخفى ورا ضهر الشجر

وعشان نتوه في السكة
شالت من ليالينا القمر

الأبنودي"
591173147883401216,EG,"صباح الفل
دلوقتي فيه خناقة بين المحامين والداخلية 
وكان فيه خناقة بين النيابة والداخلية
وفيه خناقة بين الصحافة "
591724535893856256,EG,ماحدش لقى قمر صناعي تايه يا ولاد الحلال 
591942498370609152,EG,"عزيزي الكائن السيس
مالك ساكت كده ماحدش سامعلك صوت 
مش تنشف كده وتقف مع البلد فين الوطنية والانتماء   ماشربتش من نيلها "
592288136119595008,EG,"ده القمر الصناعي الثاني على التوالي اللى بيضيع مننا يا جدعان 

أنا مش هاسمحلك تقول إن القمر الصناعي ضاع تاني "
592640124690812928,EG,"بعض الناس قالبة الدنيا علشان مبارك عمل مداخلة تليفونية مع أحمد موسى
أنا بالعكس تماما  فرحت وكنت شمتان الصراحة "
593320894338072576,EG,"صباح الأمل

راجعين بقلب حديد  راجعين أمل بيزيد
خطر يروح لأمان  شجر يقول أناشيد "
