id,dialect,text
1077162479451623424,KW, اللي يمدحها وحده من الثنتين يا انه متنفع من وراها او انهم وافدين داشيين باسماء وطنيه ويدافعون عنها  مافي احد عاقل يدافع عن وزيره حاربت اليد الوطنيه وضايقت بنات الديره في معاشاتهم مستحييل
1077164374115184640,KW, اللي يدافع عنها يا تلقينه من الوافديين داخل بنكات كويتيه وقاعد يمدح فيها  ولا تلقينه من اللي متنفعين من وراها ويطبل لها  الاكيد ان شعب الكويت كله اتفق انه مايبيها ولا يحبها وفرقاها عيد علي قولتج
1077169781885886464,KW, حسابها عند اللي ماتنام عينه  مو محللينها لادنيا ولا اخره
1077175355922882560,KW, اللي يمدح معروف شنو اهوا  يا متنفع من وراها  او من ربع بص حضرتك داخلين بحسابات وطنية ويعززون لها ويدافعون
1082451534091374592,KW,هذا الاكاونت الاحتياطي تعالولي بهالاكاونت   
919526418681421824,KW,"الجهراءتاجراسك 
الجهراء تاريخ وأصاله مهما همشتوها
وأهلها طيبين ناس ينحطون علي الراس
شي ماتعرفه ياخريج هارفرد لاتتكلم فيه 
الجهراء خط احمر"
919538635787169792,KW,  يبي يرقع بس ماتترقع 
919540067286306816,KW, يبون يرقعونها  واهيا واضحه وضوح الشمس مستخسر بخريجي هارفرد يشتغلون بالجهراء الشهاده تنقاس عندهم بالمكان
919540484086816768,KW, شكووو مو قصده  انتي سمعتي المقطع تري قال خريج هارفرد ويقطونه بالجهراء ظلم  ماتترقع تري
919605529357496448,KW,  منو قال ان احنا محتاجيين  عامل  احنا نبي نفتك من اللي متكدسين عندنا والاخت قاعده تورد بمزاجها ولا وتتشرط بعد  عطيهم رسوم صحيه انتي
919641295060176768,KW, شكوووو هارفرد بالمسافه  بسكم ترقيع ماتترقع
919641715056828416,KW, هذي نتيجه اللي يتحرش بأهل الجهراء ما يرحمونه 
919650696349323264,KW, انت اللي لازم تشوفه لان واضح انك ما استوعبته للحين  عموما مو مشكلة دافع عنه اكيد لك اسبابك 
919777907110707200,KW, اسمها محروق ياحمار شنو محروك حتي عربي ماتتكلمون ولما تييب طاري عمامك السعوديين تحط ايدك علي راسك يامجوسي لو فيك خير ماخليت ايران تحتل عراقك
919779010409885568,KW, روح قول لايران انطمي يا جبان  محتلين ارضك ومنتهكين عرضك وقاعد تنبح اهني مالت بس
919780304272883584,KW, اكيد تصير فيها حروب اذا ايران موجوده فيها هي وحرسها الطائفي والحشد والخونه من العراقيين وين تبيها تصير دولة أمان
919785191614435200,KW, مدري شنو يقول بس الله ينصرهم
919788382749937664,KW,  كلها ايام وينحط الحرس الطائفي بقائمه الارهاب وخلونا نشوف لطمكم لما تجيكم العقوبات وساعتها خلوا ايران تنفعكم يا بهايم ايران
919798288118886400,KW, واحنا شردناكم فوق  سنه شفت الفرق
919801900584914944,KW, يا ربااااه انت يبيلك ترجمه علي هالكلمات المتقاطعه  جمله وحده ماتعرف تكتب مو منك من التحالف طير العقل الباقي براسك
920008128460218368,KW,"يناديكمفالحجمعانالعازمي
الله يرده لاهله سالم غانم ويفرح الكويت برجعته  ومو بعيد ايران مخليته عندها عشان تقايض فيه احد من خلايا العبدلي"
920294678544748416,KW, اهم بديرتهم مايعرفون الا الباصات  ماعرفوا السيارات الا عندنا من صالحنا هالقرار ياليت يطبقونه وكاهي الباصات متوفره
920436857732812800,KW,"صرخهكويتيات
الملايين اللي قاعدين تدزونها لدول اول مرة نسمع فيها  عيال الكويتيه اولي منهم بخيرها وهم الأحق  لمتي تظلمون المرأة الكويتية"
920983867288416384,KW,"الزناحريهشخصيه
بالله هذا هاشتااق تتداولونه عيب 
واللي يقبل النقاش فيه ماعنده سالفه
ارتقوا بأنفسكم عن هالمهازل اللفظية"
921334148090007552,KW,  الكويتي غلطان انه ما يدفع له  لكن جريمه المدرس اكبر ممنوع الدروس الخصوصيه بالعقد  بياخذ حسابه من الكويتي لكن بينتهي عقده ويتسفر 
921334721904349184,KW, محد يعدل امور البلد غير الاستاذه صفاء  محد معطي مشاكل المواطنين اهميه ويحطها اول اعتباراته الا الاخت صفاء  النواب الباجيين وينكم لاحس ولاخبر
923348882985312384,KW, انا كويتيه واقولكم هالشرذمه التافه لايمثلنا  والله يحفظ السعوديه والامارات وحكامها من كل شر لاتعطونه اكبر من حجمه مصيره بيطيح بشر اعماله
924042703658192768,KW, الحين هابين باغنيه ويه ويه ويه عيوش
924774220269281152,KW,  اثنين بس اللي طلعوا والباجي مجرد ارقام
924778790366085248,KW,"الكويتالسعوديهعينينبراس
الله لايفرقنا يارب وماعاش من يزرع بينا التفرقة والخصام احنا اهل واخوان قبل لانكون جيران وخليجنا واحد "
925920697611890816,KW,  منو قالج ان احنا ساكتين علي هالمدمغ  هذا قاعد ينبح من قطر والقضايا كل يوم تزيد عندنا بالكويت ضده  ومصيره بيرجع لا كملت البيزات وبيتحاسب
926784717592104960,KW, بتحتاج تتكلم عربي عشان نعرف انك لبناني او ايراني  لانك لو تعرف عربي كان سمعت انه قال مهدد بالاغتيال من حزب الشيطان ومابتلام الاكس تهرب منك
926785604041560064,KW, اكبر اهانه لكم الاحتلال الفارسي اللي هو اهانه للحريه والاستقلال  وبعدين هو معرض للاغتيال شي طبيعي يتكلم من براا حرروا ارضكم من حزب الشيطان
926830350285676416,KW, نفس البيان اللي يقراه حسن زميره ويضحك فيه علي امثالك واللي كتبته له ايرانواذا استقال من منبر سعودي فهذا شرف للعروبه ودليل علي حبه للبنان
926924508287684608,KW, الفال لنا نطهر الكويت من الفاسدين وسراق المال العام والتجار اللي مايخافون الله فينا وبعض النواب القبيضه ولكل من باع ذمته عشان فلوس ورشاوي
927163067770732416,KW,  بلدي مو تابع لاحد  انت اللي بلدك تابع لايران الفارسيه المفروض ماتحكي لبناني احكي فارسي وبهيك تكون ختمت الخيانه العظمي صح والجهل مزروع براسك
927352206394871808,KW,  والله ان حالته تحزن  شوفوا حركاته مو صاحي  بذمتكم هذا ريال تشرهون عليه وتعطونه اكبر من قيمته  مصحه نفسيه مكانه الطبيعي هالاشكال لاتمثلنا
927852704772362240,KW, ماينلامون الفكرة بروحها تخوف 
928203999932755968,KW,  ما ابليس الا الاسد تبعك ياعبد يامأجور يا اللي بعت سوريا لايران الفارسيه  فيك خير حرر ارضك من روسيا وايران  لان واحد بموقغك المفروض ماله وجه يحكي عن الحريه وتحرير البلاد ووطنه مغتصب من دول لو فتح فمه داسوا علي اهله وعايلته وشرفه اخرس ياكلب بشر انت بلا كرامه او شرف انت خاين لبلدك
928210710164799616,KW,"بياعالرقيعقوبهالفدينار
قطع الاعناق ولا قطع الارزاق خافوااا الله فيهم وينكم عن تجار الفساد ماحطيتوا عليهم عقوبات ولاحيلكم بس علي الفقاري خلوهم يكسبون رزقتهم بالحلال ليش تحدونهم علي الحرام  الف اهما لاقيين ياكلون عشان يدفعون لكماتقوا الله فيهم لايسخط علينا رب العباد"
928211508097618048,KW, الحين هالفقاري بيخربون علي التجار  صج مايستحون حتي بالرقي مناشبينهم قطيعه
928661500012716032,KW,  انا اقول خليكي بالميكب والشعر وخلي السياسه لاهل السياسه يا ختياره  ولما بتجيبي سيره السعوديه تحطي ايدك علي راسك وعون المبسوطه فيه ماهو الا بهيمه تتبع حزب الشيطان  والمسيحين الشرفاء ولائهم للبنان فقط وليس لايران انتي مجرد تافهه وخائنه لبلدك لبنان  خلي ايران تنفعك لاصرتي لاجئه
937700425712664576,KW,"عليعبداللهصالح  
الفال لبشار الكلب ودجال الضاحيه وخامنائي الشيطان وترتاح البشريه من هالاشكال اللي جسدت الطائفيه بكل انواعها"
939880891484123136,KW, يا ربي متي نفتك من وجودها هذي مانبيها صارت حلاو مو وزاره مناشبه هالعالم عليها 
939882050492026752,KW,"التشكيلالحكوميالجديد
من صجهم هذيل جمال براا الوزاره ليش عشانه حارب الفساد وازعج المتنفعين  عيب والله انسان اصلاحي مثل هالانسان مايكون بالوزاره محد سنع الوزاره غيره وحفظ حقوقنا وفكنا من طمع الوافديين عيل الحربي براا وهند الصبيح موجوده شنو هالقرارات العشوائيه الغير منصفه"
939988536123645952,KW, والله انج بلسم علي الروح يا اخت صفاء  من كثر ما احنا مقهوريين من اللي قاعد يصير بحقنا ككويتيين من تمييز وتفرقه الا انه صوتج ومواقفج واستجابتج السريعه لاي طارئ شي  يشرف الصراحه عساج علي القوة دائما
940224414901325824,KW, من هالحال واردي  ان شاء الله طول عمره يكون ذليل ويموت ذليل قاتل الاطفال النعجه
940369651577638784,KW,  الله يحشرك معااه وشدعوه كنا ننطر تحررونا يا مصري الله يخلي الخليج ودول العالم اللي حررت الكويت  ولو هي واقفه عليكم كان للحين محتلين ومشاركتكم مجرد شكل صوري وبمقابل مو ببلاش ولاتنسي ان كويتيين برضو شاركوكم بالنكسه ووقفوا معاكم شوف التاريخ قبل لاتتكلم بشي ماتعرفه
942437163039428608,KW, ماصدقنا علي الله الزحمه تخف والمواعيد تصير قريبه وافتكينا من طمع هالناس اللي لو رحنا ديرتهم كل شي بفلوس  منو قالهم ديرتنا سبيل لمتي واحنا نتاذي من هالقرارات العشوائيه  افضل قرار لمصلحه الكويتيين خذاه الوزير السابق  الحربي ولا نبيه يتغير حيلج فيهم يا صفاء يادرع الكويتين انتي
942910553508515840,KW,الكويت اصبحت مافيا لتجار الخدم محد قادر يوقفهم عند حدهم البوق علني وماكو تغيير يخدم المواطن جشع هالناس اللي ماتخااف الله مستمر بلا حسيب ولا رقيب التكلفه الحقيقه ماتتجاوز  عيل ال  حق شنو  سرقه عيني عينك صج وقاحه  من وين له هالمواطن البسيط هالمبالغ الدرهللعمالهالمنزليه
945228888078155776,KW, لكل شخص يقول الله يرحم صدام  الله يحشرك معاه يارب ناس ماتستحي المصيبه انهم يهالوه مايعرفون التاريخ صدام ماغزا الكويت بس صدام كان ناوي علي السعوديه ودخلت قواته لجزء منها واكو شهداء وايد من السعوديين احترموا موتاكم علي الاقل تترحمون علي جلب بدل مايحرر فلسطين غزا الكويت استحوا
945304684994101248,KW, زعلان يابو فازلين علي خمس سنين تري قضيه وحده اللي خذت فيها حكم وعليك الالاف القضايا يعني بالمجمل بتاخذ فوق ال سنه سجن  خلك مشرد احسن لك هذي نهايه اللي يترك ديرته ويدخل نفسه في مواضيع اكبر منه وعشان شنو  عشان الفلوس سود الله ويهك فوق ما اهو اسود
945624492537204736,KW, الف سلامه عليج  عين ماصلت علي النبي ارتاحي يعله بعدوينج واللي يكرهونج يارب  نبيج ترجعين لنا قويه ومصحصحه لان الحكومه يبيلها مجابل 
945949916853145600,KW, شنو هالفنانات التافهات اول وحده تسب عامل نظافه وماتبي تعطيه صدقه والثانيه ماخذه مسافط ذوي الاحتياجات الخاصه وترادد الشرطي وتهينه وهو محترم معها  لمتي هالنوعيات ماتتحاسب ولا علي راسهم ريشه  المفروض تتخالف لو اي مواطنه ثانيه عاديه جان خذت مخالفه ولاهذي لها واسطه وحنا ماندري هزلت
946441358251909248,KW,"السعوديهعمان
السعوديه ماهان عليها تخلي الكويت بروحها 
قالت احنا والكويت سواا وبنطلع سووا 
احي الروح الرياضيه السعوديه 
 شرايكم فيني وانا ارقع لكم "
947142538980397056,KW,           انحاش الخروف المسخره مصيرك يا خامنئي حبل المشنقه واللي بيعدمك هو شعبك المظلوم
948613565971419136,KW,  ابتلشنا بهالخبول الاثنين  محد مضيعنا غيرهم مستغربه كيف هم حكام لدول كبيره وعقولهم صغيره مثل الاطفال
948632276757303168,KW, مافي احد بلندن يسوي فينا خير ويحط عظمه بحلج هااجلب الاجرب  تعال الكويت ناطرتك الاحكام الحلوه  مشرد وحالتك حاله هذي تاليه اللي يغلط علي اخواننا السعوديين والاماراتيين والكويت كلها متبريه منك ومن افعالك القذرة
949380468004278400,KW, صاير جنه بقره تخاور مالت حتي مالت منو طلب رايك ياالتافه لكن مقيوله الحشيمه لاهل الامارات ولا انت منت كفوو اصلا ينرد عليك
949399786830131200,KW, اكيد والله لايفرقنا ابدطول عمرها الكويت والسعوديه واحد وان شاء الله دوم المحبه  
950102501960929152,KW,  غير موافقه شنو هالتخبط   الحين الكويت كل فتره متبرعه بملايين لدول كثيره حتي دول اول مره نسمع فيها والحين تبي تقترض ليش  شلي حادها وهيا كل يومين توزع بهالملايين
951632089316777984,KW, المفروض من الاول اي كويتي يتزوج غير كويتيه مالها حق بالجنسيه تحتفظ بجنسيتها الاساسيه فقط ولها كافه الحقوق وتعامل معامله الكويتي فقط شكو تتجنس  الكل حاط الكويتي شماعه يتعلق فيها عشان ياخذ الجنسيه وكثير جنسيات داشه علي طمع فلبينيات وسلانييات حاطين راسهم براسنا ويقولون كويتيات
955913614807977984,KW," طحتي من عين شعب الكويت يا صفاء 
كنتي الصوت الحي لمطالب الكويتيين واليوم خيبتي الظن بموقفج اللي صدم كل الارامل والمطلقات وذوي الاعاقه اللي حاطيين الثقه فيج  حسافه موقفج اليوم نقطة سوداء في تاريخج السياسي والوطني"
955914724520136832,KW, كنتي الامل الوحيد اللي متعلق فيه كل مواطن حر انظلم بهالديره والكل عارف ان عند الصبيح ظلمت وايد ناس وفضلت وافديين علي عيال ديرتها  توقعنا انج اول صوت راح يطرح الثقه فيها باللي سوته فينا كمواطنيين صدقناج لما قلتي المواطن اهم واحق من الوافد وكله طلع حجي صرتي حكوميه من يوم وليله 
955918818756432000,KW,"استجوابالصبيح 

وخزيااااااااه  من صجكم  والله مافيكم خير لو ماطرحتوا الثقه فيها صرتوا كلكم حكوميين  والشعب اللي صوتلكم عشان تدافعون عنه  "
956145049095548800,KW, ماتيوز من الجذب يا مسيلمه الكذاب  استح علي ويهك يابوفازلين صرت مسخره لكل من هب ودب  وعلي قوله اخواننا السعوديين تبطي وتخسي تخرب العلاقات بين الاخوان مهما حاولوا الشرذمات امثالك  الكويت والسعوديه واحد ومايفرقهم جلب مشرد مثلك  تعال بس ناطرينك بالكويت عليك احكام  سنوات يالتافه
959431668590407552,KW, الا بسأل تركي ال الشيخ متزوج الفنانة آمال ماهر ولا السالفه اشاعه
960137148610629632,KW, المصيبه ان اللي براسك مو عقل الا جوتي ويكرم الموجويين الا انت طبعا  البربره الزايده والحجي الفاضي واستعطاف الناس ما راح يغير الاحكام الللي عليك  المفروض تسكر حلجك يابو فازلين وتنطم وبسك مسوي القوي اللي مايهمه شي يا جيفاار عصرك ومحد درا عنك  الكل باعك اقبل هالحقيقة المره واختفي
960138022225350784,KW, الكويت كانت محايده يا امعه شكووو تدافع عنها  المفروض تاخذ موقف بلدك وتلتزم الحيااد ما تصير اراقوز بين الدول وتتحدث بالسنتهم يا فازلين  شكوو تدافع عن ديره مو ديرتك ماكو اعلاميين قطريين يحلون مكانك بالبرنامج
960143731650367616,KW, لاترجع للكويت عادي  خلك مشرد بلندن بس السؤال شراح تسوي هناك ما اتوقع الامن البريطاني بيحطك بحراسه مشدده يا جيفارا  ولندن متروسه خلجيين سعوديين واماراتيين وكويتيين لو شافوك هناك شنو تتوقع بيصيرلك انا رائي تعيش بالارياف مع اابقر وخلك منعزل طول عمرك اليما تموت 
962047916947914752,KW,"الرييسالفلبيني  
عايش الدور بو فلبن اخذهم الله ياخذ روحك شلاقين فيهم غير البلاوي والمصايب يمكن ديرتنا تنظف من هالاشكال شبعوا الحين وكبروا راسهم قطيعه  اكو جاليات كثيره تتمني تجي الكويت  خلوا رامبو فلبين ينبح بروحه باجر يدور الفلوس لاطاحوا بجبده هالعماله وطاح اقتصادهم"
965215104529821568,KW,"قضيهدخولالمجلس 
الحمدلله حمدا كثيرا  وقرة عينكم يا اهل الكويت ومبرووووووك مليون لاخوااننا الحين عيدنا صار عيدين بطلعة اخواننا واهلنا الحمدلله"
973412823219961984,KW,"عبداللهالباروني
الله يرحمه يارب  مات من شنو توه شباب لاحول ولاقوة الا بالله"
979679423183114240,KW, لو قاعد علي تحياتي واشواقي مو اشرفلك لابس لي وردي استح علي ويهك شخليت للبنات  مشرد بلندن وحالتك حاله وعلي قوله امنا العوده خبزن خبزتيه يالرفله اكليه
981887419338362752,KW,"   لانه قليل أصل وخاين مانستغرب منه هالتصرفات
مشرد بلندن بلاهويه وعليه احكام بالحبس تعدت ال سنه
هيعيش ذليل ويموت ذليل"
986352149868240768,KW,"تنظيفالسوشلميديا
محتاجيين هالحملة بعد البلاوي اللي قاعدين نشوفها كل يوم "
986352921829888000,KW,"تنظيفالسوشلميديا 
بنات الكويت وبنات السعوديه ولاهانوا بنت الخليج كله همتكم الهدف واحد وهو نتخلص من الظواهر السلبيه الدخيلة علي مجتمعنا وعلي ديننا واللي مايقبلها عقل ولا منطق"
986609874309173248,KW, لحم اكتافه من ااخليج اللي عزته وخلته بني ادم ولا كان بيصير مشرد بشوارع بيروت  هالنوعيه قذرة بلامبادئ ولا اخلاق اطفال سوريا يموتون من الكيماوي وهو يذهب ليصفق لهم هذا المرتزق حسابه عند ربه عسير الله ينتقم منه ويشوفه بعائلته وابناءه
987632328615882752,KW,"الفلبين 
المفروض دول ااخليج توقف معانا ضد الفلبين وتخلي كلمتنا وقراراتنا وحده مايصير جذي صايرين طوفه هبيطه للاهبل الفلبيني والمافيا مالته  لازم تصرف سريع كرد للاعتبار سمعه الكويت بخطر انتم جذي تخلون الساقط والاقط يتجرأ علينا مو لازم خدم منهم اكو دول ثانيه كثيره تتمني فرصه"
988206445702283264,KW, توبي انتي ذنوب علي الفاضي لا ويه ولاقفا  وواصله سن اليأس بسج حركات المراهقه والبنت الصغيره توبي ياعيوز النار وراج قبر
988217362473193600,KW, عيوز النار شعندها حاطه دوبها بدوب السعوديه  كله عشان طليقج السعودي اللي شاتك  ماينلام والله شيبي بعيوز مترهله مثلج  توبي يا عيوز وراج قبر
988228222801318016,KW,  لانك قي فاكيد متاكد ياخروف  مو بعيد تحط الميكب تبع اختك بعد
998557619982913536,KW,"سعودالمسلم 
الله يرده لاهله سالم غانم باذن الله ويفرحهم برجعته مشكورين لكل اخواننا الابطال اللي شاركوا في البحث عنه  قواكم الله"
998644628864806784,KW, حلقه موت بنتك ماخوذه من فيلم امريكي لام بنتها تموت وهي تكلمها بالتلفون نفس المشهد بالضبط  مافي افكار للدرجه هذي
1021747256783974400,KW, اي اللي يقول ستانسلافسكي ايطالي
971537311455416448,KW,خلاص قررت اهاجر بس خل القى مليون دينار طايحه مو مالت احد وانا اعلمكم
971651673448992768,KW,بمناسبه يوم المراه  احب اهني امي واقولها اليوم يومج  مادري صح ولا لا اللي قلته 
971744061353754624,KW,افا طلع مالهم كلمه ومعصبين عالفاضي  
972119697591332864,KW,وين راح نوصل مع هالحكومه اللي كل ماهددوها الاسلامين ارضخت ونوخت  تبا لكم انتو والتيار المتأسلم
972472818272210944,KW, لا ياخوي اتغشمر لا ياخذون كل شي جد
972482455650361216,KW,  انتو شنو معاي ولا ضدي
972605850102661248,KW,رساله الى وزير الكهرباء لا انت ولا غيرك يمنع السفر او يحجز على الممتلكات انت مو قاعد تتعامل مع حيوانات الشعب الكويتي بشر وحر وهذا التعسف مرفووووووووووووووووض  بس الشرهه مو عليك عالنواب اللي مافلحوا بولاشي يخص المواطن اللي ماقدر على مكاتب الخدم مانترجى منهم خير 
972742997682122752,KW,ياجماعه اللي قاعدين تدقون علي من سوريا وفلسطين والله ودي اساعدكم بس مفلس لا تحرجوني كل شوي داقين
