id,dialect,text
1028073656835104768,JO,"

ما باليد حيله بس باليد قهوة "
1028073938969026560,JO, يسعد قلبك من ذوقك
1028177544208637952,JO,"صباحكم خير  وحالكم
 زين 
ودووم بخير وعوافي 
ولكم الود كله"
1028412219976044416,JO, يامساء الطيب و الـــورد وعبيــره
1029528162441592832,JO, يحلي اياامك ي رب
1029640230842912768,JO,"من بعد مزح ولعب  
اهو صار حبك صحيح
وأصبحت مغرم عيون  
وأمسيت وقلبي طريح"
1029642136441040768,JO,يمر طاريك وأسولف ييييييييك
1029642307841286016,JO, كفووك الطيب ي بعد حيي
1029995416719380352,JO,"السكوت أقوى من رماح السهام
دام فيني احساس عيا لا يموت
"
1030004574470504448,JO,ما يمر قلبك ضيم دام ضي عينك بدويه 
1030959432174383232,JO,"وأهل الوفاء جوني من البعد عانين
ومن زارني حبيت خشمه وعينه
أما أهل الترمس مع أهل البسيتين
 مافيهم اللي صافحتني يمينه"
1032003517244944384,JO,"من يغتني عنا نسومه على رخص 
و من صد من كيفه  نجازيه بالزود"
1032004741751025664,JO,مـن صد عنا مامشينا خلاف  نصد  عن ولا ورانا مطاليب  ومـنو وقف في صفنا مانعاف ل عندنا ميزان حشم وترحيب
1032429133563867136,JO,"يقول 
يا بختهم شافوك مع كشخة العيد
زود على زينك  تروح متزين"
1032433967293779968,JO,"ماكل من نفارقه مابغيناه 
ياكم فراق هد حيل باغيه "
1032442933709099008,JO,"جيت لي مثل السحابه على كبد الظمياان 
وجيت لك قلب بدويه على الشيمه وصيه"
1034238508108574848,JO,الا يامسيل الدم للضيف والجيعان لابس عقال خوا مخاوي خويه رحمه تزفك  يجمعني بيك ارحمآن ثارك ترا ضيفي اذبح لو سريه
1035910725024325632,JO,جابني الشيب وقال تمنى  قلت لهـ سمعهـ طيبهـ
1037114739200016384,JO,"ليته يدري ويحس وش بداخلي  
والله لينصدم بحب ماا درا عنه "
1037163118235930624,JO,"ياحلوهاا 
شرهة العاشق لـ جاتك بـ اغنية"
1037163922871213952,JO,"للشرق يجذبني سنا بارق مال
قمت اتلفت فالسما عل اخيله "
1037164563307945984,JO,"لاتدور لنفسك عن مرامك عذر
النفوس العظيمه موتها عذرها "
1037164816908148736,JO," تجرعتك ندآمه و إمتلى صوت الكلام عتاب
بغيــتك لن النـفس العزيزه شلـت أقـدامي "
1037647449807118336,JO,بنت على تبسـامها تلين كل الصعآيب 
1037826430401429632,JO,انا لو عرفت أسباب حـبك  قدرت انهيه 
1037831987061551232,JO," تقدر تمر  
هاتك من أوقات الجفا 
دقيقة وحدة ما تضر "
1040021680842829824,JO,"أغار لو بالزين قد ذكر مثلك  واغار لو غيري سبقني لك شعور  غيرتي غيرة بدو  والله يعين اغار والغيره على مثل  جنون 

اغار غيرة بدو ولا غاروا البدو على من يحبون يا كبرها من مصيبة

"
993600101837926400,JO,      ـ ـ ـ ـ ـ    ـ ـ ـ ـ  ــ ـ ـ 
993603038857302016,JO,اللي يشب النار لا يزعل على دخانها
993610698944077824,JO," مشافى بعون الله كفووووو 
بني صخر ما يخلون حق ولدهم 
والوعد قدام"
993784907984982016,JO,عزوتي ياقف لها الماضي و الحاضر تحيه
993918240408658048,JO, يسعد قلبك وما عليك زوود حي الاصل والعشيره
994020065963061248,JO," كفوو ي ولد العم 
ي الله حيك مليون ي العزوه"
995108616217808768,JO,حلوة العلاقة اللي ملهاش علاقة بالعلاقات المتعلقة بعلاقتنا 
995650310352855040,JO,"آلبعد مثل آلقيض والقيض جانا
 وآلوصل مثل البرد وآلبرد روح "
996180218418225152,JO,"الهوى صفح دفتر والمشاعر حبر
والهواوي قلم والحب سم  زحاح 

من يلوم المولع تحت ضوح القمر
يرتجي شوف خله قبل حل الصباح"
996375782212685824,JO,"ان الكرام على الجياد مبيتهم
فدعي الرماح لاهلها وتعطري"
997632741721206784,JO,"عسآ بليت ريقك يآزين وأفطرت
جعل ألفطور أللي كليته عوآفي"
997635199289692160,JO,عشق الخيل مايلحقه ضيم 
918980866365419648,JO,الشتا وبصوت ميحد لي يغني ياب لك طاري بعد كل الجراح ياغرام الشوق وين الشوق مني والشتا كنه يتساءل وين راح
919697871699668992,JO,"

الــجـو غــيم وبـين نــفـسي أردد 
هـو الــسـحـاب إللــي أشـوفـ يــشـوفـ "
920244514018783232,JO,"
  أبيك تدري وآنت ب الفعل تدري 
آني أحبك لو غلبني بهآ الصمت"
920936102437015552,JO, اظن الجواب ديود الناقه
921354145747144832,JO,الفعول الطيبه والمراجل مقياس للرجال المفاليح تعرف معادنها بافعالهاو تثبت في الشدايد وتثني حمووولها
922165533604237184,JO,"ياحسافه  يا آبتسامات السخافه  
ياثقافه جيل مايدري وش أساس الثقافه "
922245477726384000,JO,"طواه الشك  و ظنونه تقوده للقطيعة قود
 وانا صافي ضمير ورفقة الغالين حاميها  "
922430398210158592,JO,"لا تاخذ  الا هرجة  الراس للراس
صف الظنـون  وكل واحد وظرفه 
من كثر هرج الناس في غيبة الناس
مـرات  تكره  واحد  ما تعرفه"
922431070049636352,JO,"     
    
كل م شفته قلت 
    
حي وجه 
كل م العالم تردى 
زاد طيبه "
