id,dialect,text
1173123194867343360,OM,   هذي علوم الرجال ما يعرفها غير الرجال
1173301844627656704,OM," والله هالشي سمعته بروحي

قال ركبت مع يمني إلى صنعا في نقطة التفتيش تبع الحكومه طلع لهم بطاقه عسكريه ان في جيش الحكومه وبعدهم بكم متر نقطة تفتيش الحوثي طلع لهم بطاقه عسكريه انه تبع جيشهم

يقول انصدمت وقلت لا والله هالحرب مب مخلصه عند ذيلا "
1173303803698978816,OM,"    عشان كذا انا رافض اني اصوت نهائيا

المجلس شو فايدته اذا محد يستجيب له"
1173304457892913152,OM,"صحارالعروبه

يعني عمان ما فيها عروبه 

شو هالعقليات العروبه في صحار بس"
1173408834649559040,OM," 

طلعت مباراه

اتحراها عنصريه وله شي"
1173410648786690048,OM,"مسقط وأهلها بغداد أهلها خانوا حاكمهم وباعو بلدهم 

والله انك ما تعرف شي عن عمان  "
1173454046981742592,OM,"      شكرا على النصيحه

بس عطني فايده وحده تقنعني أشارك

يقولك الحكومه ما تستجيب للمجلس

يعني ليش أشارك عشان الخارج يقولون عندنا انتخابات مثلا "
1173503036804743168,OM, احسن لك عمي علي ارتحت منه
1173522570219610112,OM, اهم شي حكت الشنب 
1173525879458324480,OM," هو لو سوى شي كان محد قال له ارحل
ينتظره يسوي اي شي اصلا "
1174323475974107136,OM," وليش ما تحلون مشاكلكم ب وحكم

شحاته وقلت ذوق وله كيف"
1174566974808121088,OM,"   انا حاظرنه

بس قولوا له اهتم بشؤون بلدك"
1175056989203902464,OM,"محدشنزل

امال هما فين"
1175152242527297536,OM, صح لسانك وصح لسان قايلها استاذ احمد
1175704458912784384,OM,"  انا ما اعرف شو هذا ام ريدر

بس هذا أو هذي كيف بيشتغلون بعد التخرج اذا ما يبون يجتهدون من الحين

شو بيفهمون في مقابلاتهم"
1175714563846823936,OM,  انتو من الشماجه مب من العايله 
1175715840169320448,OM," احمد منصور انت حمار

انت ما تعرف الله عشان اقولك اتق الله
ولا عندك وطن عشان اقولك خاف على وطنك
ولا أعتقد عندك شرف عشان اقولك صون شرفك"
1175729017523249152,OM," متى بعد 

الجماعة كملوا  سنوات ودفعوا لكم مليارات ممليره"
1175729605136830464,OM, هذا في تايلند وهذي مب حرمه 
1175735503569772288,OM,"اليومالوطنيالسعودي

من دار قابوس المعظم ارسل تحية
إلى دار سلمان الحزم وشعبه الوافي

تحية من بلاد السلام توصلكم نديه
والغلا اللي تعرفونه لكم هو  بخافي

من يلومني في حبكم يالسعودية
وحبكم علينا فرض مافيها خلافي"
1176032369217810432,OM, تخبركم انها ذكيه وشاطره وتفهم
1176054693509914624,OM," درب السلامه

ردوا السلام على أهل المريخ وايد
وبلغوهم هالبيتين

جيناكم من الأرض حب وسلام
يا شعب المريخ مااظن تجهلونا

حنا هل الأرض ومنا سيد الانام
وانتو من انتو اذا تبغوا تعرفونا"
1176076924118065152,OM, عيون عبدالرحمن بن مساعد
1176077413740097536,OM, هذا حول مب حور بو شهاب
1176122112651747328,OM, هذي فطره مب تعلم
1176264651702702080,OM," الحمد لله من قناعتي ما احسب حساب للي يطالعني لا من فوق ولا من تحت

مقتنع بلبسي ونفسي

والمريض الله يشفيه"
1176277588622434304,OM,  انا ف عمان واقرب اقولك أقرب البيت تعال كان فيك شده
1176557061603307520,OM,"كلمةتحتالسطر

حبك نعم وأكثر من خيال العاشقين
واللي انظلم حبي اللي يتمنى الحنين
انا انجرح قلبي سنين انا انجرح
شفت الفرح برق لمح شفت الفرح
واللي ما يوم انجرح ما جرب العشق
مرتبي ايام حسيت ان الشهاده ف كفي
مرتبي ايام ورتني الجروح ضعفي
ومن ذا وذا هذي حيات العاشقين"
1176834110171619328,OM,  حلولي وبعدين قولوا ما وظفونا والاختبار صعب
1176924556763815936,OM, هذيلا ذكور الله يحفظك مب رجال
1177175222094573568,OM,  يمسح القشره من اول غسله
1177203148739489792,OM,"  بعدين مب اي واحد حاط د يعني دكتور وفاهم يمكن يكون مثل ما قال اخونا السعودي يمكن تعني دلخ
وله دثوي
ويمكن مثلي انا

درايفر "
1177211852805300224,OM,  كنت ماخذ غفوة بن عمي 
1177318401078890496,OM, الحين بيروح بلاد الغرب وبيشتم عمان من هناك وبيقولون ربعنا اللي اعرفهم نفر نفر ان محمد بن زايد يدعمه
1177390418805383168,OM," قبل سويعات مغرد عن هذا الموضوع

بعده ما وصل أمريكا"
1177634775336665088,OM,  عشان كذا هي يمكن ما عندها بيت للحين
1177635960252747776,OM,"سالمحميدالزطي

هاشتاق سيئ جدا

ما يهمني من يدير هذا الحساب زطي او ولد عرب بس ليش هالبشر كلها مستعنيه

هههههههههه"
1177636540123680768,OM,"سالمحميدالزطي

الزط عرق مب جنسيه تراها انتبهوا"
1177710105640521728,OM," هذيلا  يهال يلعبون بالتلفون
واحد يشتم ويروح
الثاني يعتذر عن شتيمة الأول ويروح
يرجع الأول يتفاجئ ان شتيمته انحذفت وان هناك اعتذار
يقول يمسح الاعتذار ويكمل اللي بدأه من قبل وبيروح بيرجع الثاني الصبح وبيتفاجئ الاعتذار انمسح

عاد متى بيدخل ابوهم وامهم وبيشل التلفون عنهم

الله اعلم"
1177750163101818880,OM, يطلقهن الثنتين ويتزوج جديده ويسافربها
1178149905279438848,OM, خلاص منعوه يقولون يسكر
1153273234307133440,OM, اسأل الله لها الشفاء هذي شكلها انصدمت بقوه وأثر على نفسيتها
1153960564525322240,OM,"  منطر هههههههه

من  سنه ما سمعت هذا المصطلح"
1155028835605372928,OM,  سلامي عليج وديمه وبيض الله ويهج عرفتي تختاري
1155548851723485184,OM," ما شفناكم في باص 

ادا رحلتكم ناقصها شي"
1155552644519383040,OM," انت واحد من الإنتاج من اللي معنا

شو رايك فالانتاج"
1156418354019753984,OM, اطلع من البيت وافتك من حشرتها
1156457343607037952,OM," نفس السنه

بالذات اذا عنده اطفال"
1156726607224168448,OM," سمعت قصيده لشاعر سعودي
بهذي المناسبه تذكرت اخر بيت في القصيده يقول

وحجاجهم لو بغوا يحجون
الفندق اللي شرق مكه كفاهم

يقصد أهلنا في قطر طبعا"
1156773833426255872,OM,"  وايد مهتم فيهم

هذيلا شلة صايعه وطايشه وتربوا في بيئه سيئه ما لهم أي تأثير"
1157564660373213184,OM," كله دعايه

اصلا انا لو امي ف غرفه وانا ف غرفه احس بوجودها

هذي ام مب موظفة التأمينات"
1157695775226433536,OM, خلك على ما انت فيه صباح واترك عنك هذي الامور
1157729655836876800,OM, واذا ما حولت شو بتسوون
1157885955988218112,OM, محد جاب الشتيمة لعمان والاستنقاص منها غير المغفلين والحاقدين اللي بيننا
1158042890377080832,OM, تغير الفطره سيء ولا يوجد فيه خير
1158093865313869824,OM, محد قال لج تروحين القمر
1158095401137954816,OM," عيل لا اتمي تتشكى ف تويتر

"
1158096462376525824,OM," محد بيفهم اللي تقولينه غير المقصود بالكلام

القمر مالش "
1158129256221880320,OM," انا اللي اغليك من بد اهاليك
حبيتك يوم اني خالفت شوري"
1158371650821414912,OM," عندي اللي احلى منها

خديجه
و
سارة"
1158657659756797952,OM," كلامه صحيح ودقيق

شو اللي تغير استاذ عبدالله في الخمس سنوات الماضيه ما بقول لك من الخريف الماضي

شو الجديد اللي حصل خلال الخمس سنوات الماضية"
1158987119823589376,OM," محد قالك تعبى من عندهم

روح شل وله المها"
1159122593292738560,OM, كنت مرقد فالدختر مسوي عمليه تجميليه لخشمي
1159127600557674496,OM," عندنا اخت صار لها  سنوات تنتظر النقل من صلاله إلى البريمي

هي محسوبيه او أرقام التنقلات وهميه وله شو بالضبط"
1159152923881816064,OM, ما اعرف شو السالفه بس من اسم شباب البوب والمصطلحات اللي ذكرتها شكله موضوع صايع ابعد اطفالك عنها الله يحفظهم
1159167652998320128,OM,"اذا حسيت انك تبي تصيح

لا تكابر وتقول الرجال ما يصيحون

والله نصيحه

اجلس لوحدك وعاتب نفسك وخذ راحتك

صيح و صيح وصيح

بتحس براحه كبيره"
1159180266650373888,OM, شكلك ما تصيح بو غنيم 
1159188733469573120,OM,   محد أحبط سلمان العوده غير ولده ومحد تناحس عليه كثر هالولد
1159747620740456448,OM,   يبى يشتري وزره وفوانيل وخيفان يزخونه فالحدود قال الين السير
1159755241035829248,OM," انت اسرائيلي كيف يعني

بسألك انت تتعاطى شي وله هي عقليتك كذا

عنده جواز اسرائيلي وكان مترشح لرئاسة إسرائيل وينتقد التطبيع  

هذا من فتح له حساب ف تويتر"
1159800633446359040,OM,   لا من وين هذا ما يقدر يزور دبي مول كله غالي هذا حده سوق نايف وجبرت الفجيره
1159810990839607296,OM," بعدين شو يعني نخلص من قطر

انت على قطر اللي اصغر من ولاية السويق مب قادر بتقدر على دوله عمرها من آلاف السنين"
1159813815871184896,OM,  ابشر من يجهز بيتي اللي ابنيه من سنتين
1159831276154576896,OM," كذبة  ان سبب عدم التوظيف بسبب الاستثمار او بسبب الوضاع الماليه

التوظيف للوافدين يوميا نستقبلهم ف المطار بالعشرات اللي جاي مسقط واللي رايح الدقم من غير مناطق الامتياز

توقف التوظيف على العمانيين فقط"
1159871605759193088,OM,"يومالترويه

غاليه علينا المملكة و السعود
وجهودهم ف خدمة الحج معروفه
والخير لأهل الخير بعد موجود
يحفظون الحرم و الشر ما يلوفه "
1159875117259939840,OM,"اصلا العيد حلو ف الدوام

اللي بيروح صلاله عندي

رحلة صباح العيد إلى صلالةعاصمةالمصايفالعربية
مع حافلات مواصلات 
تشرفونا
الفخامهالعمانيهتعايدكم"
1159880629959442432,OM,  كل يوم اروح شرفونا
1159880953872945152,OM,  يوم اروح ويوم ارجع على هذي الشغله بس متعه السفر
1159893111742586880,OM,"العيون
اللي تخون
واللي هواها
عليها يهون
تلقى الجفى
والقلب
مهما عفى

غريب"
1160111890338648064,OM," اي  امدادات

وين المشاريع اللي فالبريمي وله اهل البريمي ياخذون الماي ببلاش"
1160303381375795200,OM, لومي أخضر وله يابس
1160473551947915264,OM, اللبس يزين بلباسه مهما كان
1160807487777452032,OM, مبتسم بس قايم من النوم
1160863910066606080,OM," دام الباديه ما كان فيها سلام
اكيد النهايه بتكون بلا وداع"
1160898314012909568,OM, الله يسلمج سيده ملعقه وانتي بخير وعافيه
1160909854619381760,OM,"نطالبباقالهعليالمهري

بعد العيد بتابع موضوعه

حاضرين ابشروا

اقصد من على المهري ووين يشتغل وشو مسوي بعد

احيد المهره ناس طيبين وناس اهل شيمه ومعروف

"
1160918710988824576,OM, بعدني ما وصلت باقي ساعتين عن صلاله
1160932977666416640,OM,  ترانا شعب الله الحساس
1160944505308274688,OM," لا والله مبتسم طول عمري

اصلا حد يحصل يداوم فالعيد"
1160963388811464704,OM,"   الله يقطع سوالفج

اتحراه صحن مشاوي طل دوار"
1160992692266029056,OM,  لاني احبهم يالغالي واحب هالنوع من الخلافات
1161265915318669312,OM," منور بو سعيد

وين متحلق بنروح نقتل الحلاق"
1161266697283788800,OM," انا قلت كذا

كيف مشويكم"
1161268035828817920,OM, ما عليك زود بو 
1161535681656762368,OM,"بما اني فاضي قلت اروح سمائل حيت الشماجه أخابرهم واطمن على الصغيرين وامهم وبيبيتهم واعايدهم واضرب معهم شوا العيد

تقريبا اني تكلمت مثلهم 
يا حبي لهم ولرمستهم"
1161544065994973184,OM, صاني اقولش رايح أخابرهم حموه بعد انتي نوبه
1161596187797008384,OM, مره متخدر وعلى دوام ليل 
1161715743353974784,OM, يعني يوم رسلتوا المشوي والمشاكيك ما احترموا اللي مداومين 
1161717127130341376,OM, ما اسوق الحين متسدح
1161717427941584896,OM, خلاص جرحتني وبرد لك القضى هذا الخط والفجر بيوصلك جمال صلاله الاصاله وخل المضبي ينسيك لاهوب الجو 
1161725577788907520,OM, نعم والله مشوي اهل سمايل غير ما اعرف شر يسوون فيه
1161726979382624512,OM, الله يعزج انسه منشن
1161819944180490240,OM, يجيك اسهال من الغصه
1162111304217309184,OM, روحي محضه يقولون فيها امطار
1162384137401118720,OM,"من زمان
وانت عن
العيون غايب

وبغيابك كم
صابتني
مصايب
للغالين"
1162386764696358912,OM, انت شوف بروفايلها ووين تشتغل بتفهم تغريدتها
1162389553409404928,OM, هذا فغل يسوي حكه اذا لمسته
1162813398855409664,OM,"     

هذيلا صاحين بالله عليكم

خاطف نافخ عمره وعنده مطيرزيه

يبالهم فحص"
1162815777776558080,OM,"  طبعا مب باب العابه وليس الاستهزاء معاذ الله

والله ان النيه صافيه"
1162998469885407232,OM," من وين جبتي هالكلام

نحن في غنى عن هذي الاقاويل
واللي يريد شيخ يسأله مب لازم يكون صاحب منصب او من نفس جنسيته"
1163046359970324480,OM,  بنييب لها بف باف من عند عبدالله العذبه وله حمد المزروعي
1163057200543256576,OM,"  الله ياخذها هي وياهم

والله ما بلانا بهالاشكال غير تويتر"
1163066810448658432,OM,الأماكن كلها مشتاقه لك
1163167080964919296,OM,هذيلا الناس اللي متأثرين ومندمجين في الأفلام الاجنبيه اكثر من الممثلين ومخرج الفلم  
1163787493348696064,OM, الحين بيتصلون بك الديوان تستاهل
1164170835994787840,OM, انت خل الناس تعرف من وين انت تغرد اول شي عقب خبرهم من وين الحسابات تغرد
1164245877290143488,OM,"وكان الناس من حولي حجر
امي وهل بعد امي من بشر

نبعالحنان"
1164335170830385152,OM," بنختنق معها
بعد شو نسوي"
1164361240984129536,OM," عادي يضربك شلل رباعي  فتاق  ارتجاج ف المخ

اهم شي يصح الدسك"
1164371353740423168,OM," هذي دولة الإمارات العربية المتحده مب قناة وناسه

هذا دكتور يدرس السياسه "
1164554111787962368,OM," تشرفنا في البريمي من طلعتك لين توصل مليون مرحبا
وان ما شلتك البريمي تشلك العيون الله يحفظك د محمد"
1164555254366703616,OM, تشريف فاي وقت واي مكان الله يحفظك
1164557168382828288,OM," هذي بالذات عندي طلبها

وصلوا لها الكلام هذا وانا جاهز"
1164779961028206592,OM,  بس انتظر موعدك سنه
1164791070837751808,OM, محد يتصل  مرات تقول لي موظفة الكول سنتر بيتصلون وآخرها امس وللحين محد اتصل
1164988845164773376,OM, متنومس بو عسكور الله يحفظه
1165132505105743872,OM," العيون اللي تخون واللي هواها عليها يهون
تلقى الجفى والقلب مهما عفى"
1165163706701025280,OM, هذي بلايستيشن بس فس سواقين كذا
1165168355755642880,OM," للصبر اخر

خلاص عافكم الخاطر

حاولت اسامح اسامح

ولكن ماني بقادر
خلاص عافكم الخاطر "
1165295634901078016,OM, تجمل اوصف لي صيدليه وبروح لهم بروحي اليوم مريت  صيدليات ما حصلته وقالوا لي موقف من المصنع
1165457343376777216,OM, امين ويبارك فيكم اخوي محمد
1165539544852324352,OM," قولن لعماركن

ويوم يردن قالن الريايل ما فيهم خير"
1165671610650640384,OM,"  ومن مقطعنهن مب عيالنا

لو علمناهم يحافظون على كتبهم كان استلمهن اللي بعده بأحسن حال"
1165677590889345024,OM,"من بعد مزح ولعب
اهو صار حبك صحيح
أصبحت مغرم عيونك
وامسيت وقلبي طريح
واخجل اذا جات عينك
صدفه بعيني واطيح"
1165686792827412480,OM,"في عيني اليمنى من الورد بستان

وفي عيني اليسرى عجاج السنين

والبس نظاره عشان اشوف الورد"
1165687343682117632,OM," لا

ولا تسألين ليش"
1165861001163616512,OM,"ماذاتعرفعنالحب

يجيب الدوده الزايده"
1166065757916139520,OM, على عدد ايفونات عادل علي بن علي
1166370510445383680,OM,"معذورة الخطوة لو تعشق دروب الجراح
معذورة البسمة لو تنسى الفرح اللي راح
دمعة ألم هلت على وقتي العنيد
غير الندم مالي في هالدنيا عضيد

ترسم من جروحي طيوف
يسهر معي يمكن يشوف
هي الحياه فيها جديد

كلمهللحبالقديم"
1166370756915318784,OM, فاهمني بو غنيم الله يحفظك
1166372585434730496,OM," 

لا تكلمني انا حزين
"
1113642433022169216,OM, يروح يتزوج خل عنك الاصمعي ترى بيقتلك
1113753474825510784,OM,  انا مدوام وماسك خط صلاله 
1113757120799760384,OM, والله حرام هالشعرات البيض اللي ف وجهك تكون على عقلية طفل
1113832930365923200,OM,"   الله يسلمكم يالربع

سد وذخر"
1113871014130343936,OM, شكلهم سألوا بس طلع ولد هوامير وزوجوه
1114202158830882816,OM, ابو شبك هذي مب سيارة
1114204323460726784,OM,  يستوي طاسة حلوى عمانية بعد تراهن يحبنها
1114229595580973056,OM," كل  مب 

هذا التلفون شيب شكله يباله تغيير 

يكتب ع كيفه"
1115305635187310592,OM,"  صاحبنا ما تكلم عن  مليون 

يقولون واحد من الجماعه البوس مال الحرامية وهو يدور اعذار"
1116586889744506752,OM,  بيبنوه على شكل قلعه
1116765491429642240,OM," هههههه

يقولك يعطونهم  درهم"
1117464338070216832,OM," والله يا جماعة الخير 
يفترض اللي ينقذوه من الوادي

اول شي يتحمدون له بالسلامه وعقب يمغطونه بخيزران لكل دقيقة انقاض  جلدات"
1117476956872871936,OM,"  ماشي منه 

اركب رنج وبتلفت نظر الشجر والحجر"
1117658424957906944,OM," امين ويرزقكم

ننتظر الثانية"
1117680965390930048,OM," قريب ان شاء الله 

بس العروس بعدها تتغلى"
1117719985797968000,OM,  بتوصلك بو نواف لا تحاتى ههههه
1117746463067508736,OM,  حتى انا بعد محد بيعزمني
1117751546459062400,OM,   خلى يقرا على السنة بدل التنطع عقب فهمه انه لازم يقرا باخلاص
1117771717282287616,OM,"حبيتها وتهت يا ناس
فين المشاعر والاحساس

حبيتها   وحبتني
عشقتها  وعشقتني
ياللي في قلبك 
رقة  واحساس  وحنان
ياللي في جنبك 
ابغى لي احلى مكان

خاص"
1117798571821158400,OM," والله يا سعيد جداد ما عند شي يوسف حالتك

ولكن ترى قابوس اللي مب عايبنك هو الشعب العماني والشعب العماني هو السلطان قابوس  لا يعيش بدونه حتى يأخذ الله امنته

واذا شاء الله بأخذ الأمانة بعد عمر طويل بيذكره التاريخ في صفحات المجد والعليا ورمز أنه احد رموز زمانه ومكانه"
1117850045066309632,OM,"خلني في جوي كيف ما ابى الجو
وخلك انت في جوك كانه صفا لي

وخلنا نعيش السعاده بين ذاك وهو
ودام حظي في وجودك السعاده لي

يا نرجس وفل ي يا عقد بلولو
دام السعادة معي ليش تلالا لي 

اعشقك من سنين ما هو بعشق تو
استمري حتى الممات لانه انكتب لي

خاص"
1117850050560815232,OM,"استغلي جو العشق دام ابتدى الجو
واثبتي لحظه عشق دامه تهيأ لي

من عرفتك وانت شمعه ما لها ضو 
نورها نفخت خدودك لا تبسمت لي

اسالك يالله يا من تحب تعفو
تحفظه طول السنين ويكون بس لي

خاص"
1118122883497095168,OM," شو المشكله تراها هذا دبي مب الجنه 

ترى بس الجنه ما فيها سلبيات اما الأرض والدنيا اكيد سلبياتها أكثر من الإيجابيات 

يعني على سبيل المثال الإيجابيات النادرة على كوكب الارض دبي والسلبيات اللي على الأرض انت واشكالك

عسى فهمت شرحي"
1118127347150884864,OM," وش أسباب التعب كله والهموم 
   اكتبي دام لنا ف قلبج مساحه"
1118132059577491584,OM," ومن يرجعون البيت يقول لها ما شاء الله عليج ملسونه تعرفي تجادليهم هههههه

والله مب من الحريم من الذكور اللي يبتلين فيهم"
1118171073021792384,OM,"    هههههههه

الله يرحم جدك وجدي"
1118604270046195584,OM," ليش تتعب نفسك اخي منصور 

من يتابع هذا الحساب من فترة يعرف ان اللي يديره اخونجي والجميع يعلم ما هو دين الاخونجيه"
1118743337866076160,OM, يبغى فلوسه ما يياله سؤال
1118744125648646016,OM,"   الورقه

ويقولون كان حساس الله يرحمه"
1119824801282109440,OM, ننتظر عزيمة العرس وله خلاص عرست
1120035717315530752,OM,"شوشتني ذكرياتك والخواطر
وابتديت الشعر في وصف الخليل"
1120037169899417600,OM,"حطني في عيونك وغمض
خلني أعيش في عيونك
الحذر ان رمت لا تلمض
احتذر لا يطيح مرهونك"
1120703693396086784,OM," اربعيني وتريد وحده عمرها   

انا عمري  ومستحيل اتزوج وحده تحت "
1120712809715785600,OM, احس انك هزبتني هههههههه
1121373184488542208,OM, يعني شوفوني انا اللي رديت عليه ودافعت عنكم وهزمته
1122882244232663040,OM," وبلد أمن وأمان وفيها النظام قبل كل شي والسائح له اولوية من ناحية التعامل والشعب عايش ف حاله ومولات وتقدر تروح جورجيا بسيارة 

عملتهم اسمها مانات"
1122916328216465408,OM," عمري ما شفت ريال يلبس سوارة

هذيلا ذكور"
1123895604827046016,OM, بشوفه لك ف البريمي
1123902117071270016,OM, خلنا نكسب اجر هههههههه
