id,dialect,text
1025760431628070784,EG,"سعوديهلميشوالك
إزاي السعوديين ساكتين على إهدار اموالهم بالطريقه دي
المال نعمه كبيره لكن لما نروح لإيد اللي ميستحقهاش تبقى نقمهوتسبب خراب"
1026482610325926016,EG, لا إله إلا الله وفين يس يااخ فيصل الشعب اللي انا شتمته انا بقول ليه الشعب السعودي ساكت على إهدار ماله انا زعلانه عشانكم فين الشتيمه بس
1026601537450201216,EG,"ولحدامتي
هنفضل مستحملين الشخص اللي اسمه تركي الشيخ ده يبيع ويشتري فينا ويهين كرامتنا كمصريين بالطريقه دي ملعون ابو الفلوس االي تعمل كدة"
1026602556406091776,EG,"ولحدامتي
مصر هتفضل في الحال دهانا بجد تعبت وبتعب اكتر لما بشوف الدول حوالينا عماله تتقدم وإحنا عمالين ننزل للقاع لحد ما نزلنا تحت الارض"
1026605383257927552,EG, ودة بقى هيحصل امتى وهتروح قدامه ارواح قد إيه
1026611483164205056,EG,"ديناالشربيني
البنات غيرانين منها وبيحقدوا عليها بطريقه غريبهوبصراحه انا اولهم يعني إيه عمرو دياب يحبك ويعيشك ف العز ده كله كده حرااااااام"
1027207438896914432,EG, متزعلش في ناس مش بتفرق بين تركي ال الشيخ والشعب السعوديعموما متزعلش مرة تانيه
1027223169587965952,EG,"بيراميدز
الشوال جايب فهدالعتيبي يعلق على المباراةوالله ورخصت ياتفاحوالنبي لو جبت الشوالي بردو مش هنتابع القناه"
1027338534435340416,EG, طيب انت زعلان ليهعشان تركيطيب ينفع اللي هو بيعمله ده انت ترضى حد مصري يبهدل الرياضه في بلدكم ويهين رموزها زي ما عمل معانا تركي
1027338814069637248,EG, العصابه اللي بتحكم بلدنا هي اللي وراه
1027339047537180800,EG, لا مش حلو يعني بامانه ده فهد العتيبي اللي على   
1027587251960721408,EG, استفزاز وتعمد للإهانه مش فاهمه إيه الهدف منه ولا اظن انه لإشغال الرأي العامحاسه إنه سبب تاني
1027590042041163776,EG,"تعرف فلاناه اعرفه
قابل تركيآلالشيخ لأ
يبقى متعرفوشمنقول"
1028041861389332352,EG,"اوقاتبنشتاقل
فترة معينه فاتت من حياتي كنت فاكراها ايام وحياة عاديه بس مع مرور الوقت اكتشفت انها اجمل ايام حياتي اللي مش ممكن تتعوض ابدا"
1028376353358458752,EG, بيتف على مين ده
1028432322062942208,EG,    انتي مغلبه نفسك ليه في الرد على كل واحد يا رودينا منه لله مرتضى اللي جايب لنا الكلام من اللي يسوى واللي ميسواش
1028437715388440576,EG,    انا كنت زيك كدة ازعل واكتب واقول إحنا مش كدة وف الاخر اكتشفت إنه مش بيجيب نتيجه بيجيب حرقة دم وبس
1028670007176249216,EG,"سماالمصري
منك لله يازبالة الحريم بنتعاير بيكي وبامثالك برا مصر شوهتوا سمعتنا كلنامش عارفه عمالين يقبضوا على المحترمين وسايبين اشكالك ليه"
1029335689425506432,EG,"تامرعبدالمنعم 
خلاص اشتغل مهندسافتحلك عيادهالشغل كتير بس انت ركز يا تمورةساميكمال "
1029336424900907008,EG,"رونالدينهوفيبيراميدز
اللي بيحصل ده كتير بصراحهياترى بقى ياعم تركيآلالشيخ في مباراته مع الاهلي هيجيب مين مش قادره اتوقع بصراحه"
1029745537732538368,EG, يا غبيه الاهلي بيصرف على نفسه بقالوسنه تركي مين ده اللي هنستناه يصرف على الاهلي انتي حافظه مش فاهمه وجبتي لنفسك ولاهلك الشتيمه
1029801330288807936,EG, تركي مول الحمله الانتخابيه بتاعت الخطيب ودي مساعده شخصبه للخطيب الاهلي ملوش علاقه بيها انت كمان اهبل وحافظ مش فاهم
1029874463788150784,EG,"هناالزاهد
ليله بكى فيها نص شباب مصر وهشام جمال وعلي ربيع
فرحانه عشان هنا انا بحبها بس يارب يكون احمد فهمي بيحبها بجد لان شكله هوائي "
1030568914785329152,EG,"افريقيايااهلي 
مهما كان الواحد في مود زفت ومدايقالاهلي كفيل إنه يخرجه من المود ده لاحلى فرحة الحمد لله على نعمة الاهلي"
1030580907990806400,EG,  يخربيت الجبهه اللي طارت
1030587999556386816,EG, إنت اللي برنس جدا ا
1030860945155923968,EG,"مرتضيمنصور
انا مش إيه علاقتك إنت بالكره بص اشتغل مهندسطيب افتحلك عيادهصدقني ياضاضا الكار دة مش كارك"
1031003341067833216,EG, ههههههههه ليه كده طيب ده انا طيبه والله
1031004073171009536,EG, لا طبعا انا عن نفسي اكره النوع ده من الرجاله وعمري ما اتمناه زوج ليا إيه القرف ده
1031203448472125440,EG, اه  انا بحسب  في بنات بتحب  الخو دول
1031211127609409536,EG,"على فكرة اسلوبك ده هيخسرك ناس كتييير
مايغورو في داهيه عادي إيه المشكله"
1032341743763632000,EG,رجعوني عينك لايامك الزباله اللي زيك يازبالهامكلثوم 
1032766952085901184,EG, عندي نفس الإحساس الممل ده
1032768644034580352,EG, مش عارفه والله بخاف احكي مع حد يفضل يقولي ارضي انتي احسن من غيرك زهقت بطلت احكي حتى مع نفسي لاكون زي ما بيقوله عندي عدم رضا
1033125727682617216,EG, والناس اللي بتقول الحارس اداها هديه للاهلي فحصلت قبل كده في نهائي السوبر وكانت غلطه اكبر من كده المهاجم المميز يهدف من نص فرصه
1033128753461960832,EG, ليه كده ده إنت اهلاوي امال الزملكاويه يقولوا إيه
1033129928139661184,EG, انا مش فاهمه كله كاتب نقاط حرامطيب نعمل إيه نروح نختمها من الازهرولا نجيب نقاط متوضيه مصطلح غريب اوي من اول الدوري بتاع نقاط حرام ده
1033130119014109184,EG, كدة إنت مقتنع ولا لأ مش فاهمه
1033130721760685952,EG, هو إنتي ليه مانتحرتيش بعد ما شوفتي الصورة دي 
1033134189619622016,EG,  لا ابدا صفحة الاهلي دلوقتي عملت تصويت لافضل لاعب في المباراه ومعظم الناس صوتوا لازارو مش بننسى فضله ابدا
1033140664471625600,EG, يعني إنت سبت الموضوع الاساسي وزعلت من كلمة مميزما هو عشان الجون فاضي وده خطأ مش بيتكرر كتير كان لازم يجبها
1033142476826206208,EG, ربنا يديم الانبساط دايما لسه الدوري طويل وهننبسط كلنا
1033511395411853184,EG, ع العباسيه عدل اوعى تتاخر عشان حالتك صعبه
1033840163963719552,EG,"سعدلمجرد
إيه ده هي إيه اللمه اللي هناك دي
مفيش ياسيدي سعد اغتصب واحده تالته
يالهوووووي صحتك ياسعد مش كدة 
لا تعليقغيرو"
1034551094574235648,EG,"افريقيايااهلي
عمري ما احب غير الاهلي ولا في غيره يفرحني
اه والله مافي غيره بيفرحني
يارب تكمل بالبطوله  ياااااااارب
ازارو كوليبالي"
1034553020539912192,EG, إنت بصراحه استاذ انا سالتك بعد هزيمته الاولى من كمبالا وقولتلي الاهلي هيكسب كل المباريات وهيصعد شكرا لانك ادتني الامل ده واتحقق
1034580213827596416,EG, ههههههه بلاش والتبي الرئيسه الشرفيه دي عشان بتفكرني بواحد بكرهوا اوي اوي اوي
1034582516244668416,EG,  هو إحنا بنحب فلسطين من شويه حبايبنا انتم
1034840004210684032,EG,"مجديعبدالغني
هههههههه دي سرقة التيشرتات طلعت بتجيب طيارات خاصه امجدي "
1034908471169372160,EG,صح والله الراجل بيسأل سؤال منطقي جداااا 
1035995468541710336,EG,"ديناالشربينى
كلهم بيقولوا كده في الاول والكلام الحلو بيتحول
في إيه ياعمرو هو إحنا اللي هنقولك ولا إيه
ده إحنا متعلمنها منك "
1035996502131437568,EG,"رضويالشربيني
هتفضل تعقدكم من الرجاله لغاية ماتلاقوها ماسكه في إيد حبيبهاولو بنت حاولت تعاتبهاهتقولها والنعمه ما انا دي اختي منىهتشوفوا"
1036035315239215232,EG,"دلعيهيدلعك
داليا اختفي بسرعه رضوى الشربيبني لو عترت فيكي هتدبحكإنتي كده بتضيعلها شقى العمر كله في هاشتاج"
1036035892182433792,EG,"دلعيهيدلعك
وبالنسبه للسناجل اللي بتشوف الهاشتاج ونفسها تشارك "
1036036840359424000,EG,    الجايزه دي كل ما لاعب يفوز بها بعدها عالطول يصاب إصابه خطيره الموضوع ده تكرر كتييييييرعشان كده هما متشائمين خايفين على ازارو من الإصابه
1036038795882320000,EG,    اكيد هما بيهزروا بس
1036041411026673664,EG,    بسبب الضغط اللي بيكون عليه ازارو اكتر لاعب في الاهلي حصل عليه ضغوط من اول يوم جاء فيه للاهلي ممكن ده سبب عصبيته
1036054893319127040,EG, ياااااه ده انتي استنيتي كتير اوي
1037396093884157952,EG,ناس بتستغرب تركيآلالشيخ بيجب فلوسه منينطب والله مش فلوسه دي فلوس طال عمرهاللي لو قطع عن تركي المصروف هيشحت و بيراميدز هيقلب سوبر ماركت
1037441299031511040,EG, ابتديت اخاف عليك خايفه نصحى في يوم نسمع خبر اعتقالك
1037450258874343424,EG, لا قول عادي الناس كلها عارفه
1038024993781821440,EG, هيروحوا ينافقوا ويطبلوا لغيره الناس دي مبتغلبش على كل لون يعني بس يكفي انهم نزلوا من نظرنا للابد
1038039636193488768,EG, لا اكيد موجودين بس إحنا معندناش الحظ الكافي عشان نقابلهم
1038539094610075648,EG,"مصرالنيجر
لما تشوف منتخب مصر وهو بيهاجم
مكنتش مصدقه اني هعيش واشوف اليوم ده "
1038813078639521792,EG,"مصرييفطرمعسعوديه
الحاكم يشرب الخمر ويزني نص ساعه على الهواء مينففش نعترض عليه ولازم ندعيله بالهدايه
لكن واحد يفطر مع زميلتهيترحل فورا"
1000072786877010048,EG,  الجنيه دي روح اديها لامكاللي بتسرح بالغنم
1000073177924538368,EG,  قهر وذله لا يا امور دي اسمها كرامه وانتم تكرهوا ان الناس تعيش بكرامه نفسكوا الناس كلها تبقى عبيد لكن فشرت بعيد عن عينك 
1000073750761689216,EG,  إحنا الفلسطنين  والعرب يكرهونا و يحبوكم هههههههه ضحكتني ومصر اللي بتقول عليها مش عرب ذكرت في القرآن باسمها اكت  من مره يا جاهل
1000076545225035776,EG,  مالكيش دعوة بكرامتي انا اعرف ارد كويسوانا مش بطالع في رزق غيري انا عيني مليانه والحمد لله مش شبع من بعد جوع
1000076803413823616,EG,  مش فاهمه إيه الضحك دة كله هي نكته ولا حاجه صحيح واحد اهبل
1000077365731524608,EG,  إنت اللي كلب وستين كلب والدنيا دواره زي ما انتم من سنه كنتوا بنبعتلكم فضلات اكلنا النعمه لا تدوم متخافش هترجعوا تشحتوا زي زمان
1000078195381751808,EG,  عادي ترامب اخد هو وبنته كل اللي في الخزنه وهترجعوا تشحتوا تاني النعمه لا تدوم خصوصا للمغرورين اللي زيكم
1000079305035132800,EG,اللي عمله تركيآلالشيخ مع الخطيب كلها ايام او شهور ويعمله بن سلمان مع السيسي وبسبب الزباله دول يتقال ان المصريين بلا كرامه و متسولين 
1000079897467998208,EG,  الفلوس دي تحطيها ف ياريت تكوني فهمتي وعلى فكره انتي اللي كلبه وستين كلبه
1000080293682929664,EG,  لا يا حبيبي انا مكالتش منكم ولا سبيتك غير لما انت غلطت فيا الاول مش معقول هتغلط فيا واسكتلك 
1000085705568157568,EG,  لما تتعاملوا معانا اننا عبيد نباع ونشترى بالفلوس لازم ارد كدة 
1000089025502416768,EG,  وعلى فكره اقسم بالله انا لا بحسدكم ولا بحقد عليكم وانا بتمنى ازور السعوديه واعمل حج وعمره فيها بس الإهانه بتجيب إهانه
1000089362191839232,EG,  وزي مانت اتحرقت على بلدك انا كمان من حقي اتحرق على بلدي لكن اكره اللي يقول علينا اننا بنتسول وعبيد هي دي الحكايه الغلط بيجيب غلط 
1000091580202668032,EG,  تركي اول مل دخل الاهلي كنا بنحبوا ودعمنا واخد رئاسة الاهلي الشرفيه لكنه اهان النادي الاهلي جدا والهاشتاج دة من صدمة جمهور الاهلي فيهللتوضيح
1000095406150307840,EG,  محدش بيدفع مبلغ زي دة بدون مقابل ولو ده حصل يبقى ههدار مال عام سعودي لازم يحاسب عليه تركي وزي مانت قلت الحقائق هتبان
1000096107261779968,EG,هو ليه لو الواحد قطع شرايين إيده يموتولو كف إيده كله اتقطع ميموتشحد عنده تفسير بطريقه مبسطه يقولهولي
1000120037523501056,EG,  لا شكرا خد امك وخليها تتمشى فيها هي
1000121235504795648,EG,بهدلنا الخطيب الله ينتقم منه مرمط بكرامة الاهلي الارضيارب الكابوس اللي إحنا فيه دة ينتهي بقى 
1000476216581861376,EG, لا دة مجرد سؤال مش ناويه اعملها
1000490262920159232,EG,"راموسالكلب
روح اتشطر على ميسي اللي مأكلك نجيلة الكامب نو رايح جايوالله لا استبعد ابدا ان يكون حد من الاشقاء دافعلك عشان تعمل كده منك لله "
1000491920081203200,EG,"راموسالكلب
روح اتشطر على ميسي اللي ماكلك نجيلة الكامب نو رايح جاي يالي معندكش شرف حسبي الله ونعم الوكيل
محمدصلاح كلناصلاح "
1000492668642824192,EG, بس يا سامح عشان انا مدايقه بجد
1000493218344198016,EG, انا مش زعلانه عشان الخساره انا زعلانه عشان الإصابه وكلامي عن كاس العالم مش عن المباراة دي ياريت تفهم التويته الاول
1000511635700711424,EG, ومين قالك اننا بحلم ناخد كاس العالم مثلا بس اتا وانت والناس كلها عارفه ان من قوة منخب مصر تأتي من وجود صالح في الملعب وهيفرق معانا جدا
1000512004791111552,EG, وعلى فكره انا من مشجعي الريال وكنت متاكده انهم هيكسبوا لكن تعمد الإصابه لاهم لاعب في الفريق المنافس دي اسمها قذاره مش رياضه ابدااا
1000804613162000384,EG, الله ينور عليك بالذات المطبلاتي شوبير والرقاص شلبوكه إنت زملكاوي بس عندك ضمير وبتنطق الحق حتى لو للنادي المنافس شابوووووه
1000873089331277824,EG,"تريكهاسطورهعربيه
نفسي افهم الراجل قال إيه للهجوم دة كله عليه
مفيش كلمه واحده قالها تسئ لاي حدعقول ونفسيات مريضه بتكره اي حد نضيف"
1000876799620984832,EG,"تريكهاسطورهعربيه
إيه يا جماعه دهده شوال الرز طلع عنده لجان إليكترونيه اكتر من لجان السيسيابو تريكه لسه بيجيب اجوال حتى وهو معتزلهههه"
1001169237472436224,EG,  انا مش فاهمه إيه دة
1001173431600205824,EG,طول عمري بستغرب إزاي لاعب زي شيكابالا مأخدش فرصته والنجوميه اللي يستحقها لاعب بموهبتهبس بعد ما شفت اخلاقه والعصبيه الاوفر فهمت ليه
1001215017600024576,EG,كل اللي فهمته من مسلسل نسرالصعيد لحد الان إنه بيحاول يحسن صورة ضابط الشرطه اللي بقت زفت في شخصيةزينوضابط الحربيه في شخصيةمنصوربس كدة
1001215791805685760,EG, والله إحنا مخدوعين في شخصيات الوسط الفني والوسط الرياضي وفاكرينهم ملايكه دول ازبل فئه في المجتمع غيرهحقدطمعقلة ادب مش زي ماحنا فاكرين
1001217219160920064,EG, مفيش حرامي محترم يا دعاء ولا قليل ادب نضيف الاتنين ميركبوش على بعض انا فاهمه انك تقصدي بالاول الخطيب وبالتاني شيكا بس تركيبه عجيبه بصراحه
1001567412796444800,EG,"الزمالكالاكثرشعبيهفيمصر
نعمده اللي هو إزاي يعني "
1001885352020316160,EG,كنت مفكره الوسط الفني اوسخ وسطتابعت سياسه لقيتها اوسخ بطلت اتابعهاتابعت رياضه لقيتها اوسخ من الاتنينحقد غيرهفساد مفيش حاجه كويسه خالص
1001891978710278016,EG," هههههههه يارب يخليك 
شايف القرف اللي بيحصل في الوسط الرياضي والردح بتاع كل يوم"
1001893778356101248,EG,"الشواليفسدالرياضهالعربيه
هو إيه اللي بيحصل دهالمشكله بين تركي والخطيب إيه علاقة الشعوب تشتم ف بعضهاياناس الفتنه اشد من القتلإحنا إخوه"
1001899287872229376,EG, لا ميرضينيش بس إيه علاقة الشعوب نشتم في بعضها
1001951557049602048,EG,"قومياصلاح
هههههههههههه إيه الضحك دة "
1001954596741419008,EG, ربنا يخلصنا منهم كلهم إن شاء الله
1002266886699208832,EG, ههههههههههه إيه ده صحكأنه اتوبيس مدرسة بنات في الإعداديه
1004075727245979648,EG,  دة المشهد دة في مياراة إيه حد يقولي
1004108413947785216,EG,ههههههههلا بس مرسي كان هيضيعنا ولا إيه 
1005525060193542016,EG, مالها بس مصر يا اخي إن شاء الله تيجي مصر انت كمان وتحب العيشه في بلدك التاني
1008775809182597248,EG,ايوه هشجع تونس و المغرب لانهم بيحترمونا وبيحبونا وعمرهم ما قالوا عنا شحاتين ولا تكبروا علينا ولامفكرين انهم ممكن يشتروا كل حاجه بفلوسهم
1009175512416169984,EG, انتم كمان فوزكم فوزنا واللي مقدرتش تعمله مصر يعمله المغرب بإذن الله
1009175825143517184,EG, كللم صح اكيد بس في ناس من وقت ما جائتهم النعمه اهانوا كل من حولهم
1009184137998229632,EG,"مصرروسيا
مش بعتوا فيفي عبده تقول للاعيبه خمسه امواههي ولميسليلى علويوابو لمونه وكل حرامية اللقطه دولوكنتوا مستنين نكسب هههههه غلابه"
1009185796866363392,EG, لو قاعد على البورد بتكتب دلوقتي ف الشحاتين دول اللي علموك الكتابه
1009197843251388416,EG, هههههههه وذكرونا إحنا المصريين بالاهرامات التلاته
1009200922822619136,EG,"مصرروسيا
بوحدوز مصر احمد فتحي
بس بعيد عن النقد والسخريهربنا ما يكتب على حد اللي حاسوا بيه بوحدوز وفتحيبلاش مبالغه في القسوه
المغرب "
1009216021792804864,EG,"مصرروسيا
مهما قالوا عنك ستظل الجوكر ومش هننسى تاريخك الكبير المشرف عشان غلطه اكبد مش مقصودةبكرهكم يا ناكرين الجميلاحمدفتحي "
1009499868262535168,EG, ففلا ده انت حاله نادره بقى
1009501494272544768,EG, امين يارب اتمنى ربنا يصلح حالنا والامه العربيه كلها
1009515636639371264,EG, هههههههه بنحب الضحك والسخريه حتى من حالنا
1009516049748971648,EG, انا عن نفسي اتوقع شئ زي كدة من هذا الرجلمش بعيده والله عليه
1009555487854137216,EG,"مصراولالمغادرينللمونديال
ينفع كدة نغادر المونديال بعد ايام بس
دة إحنا لو مسافرين بلطيم كنا قعدنا اكتر من كدة"
1009898137987805184,EG,   هههههههههه دمك خفيف اوي
1009909943493947392,EG, ربنا يديم عليك الضحكه والفرحه دائما
1009911498238562432,EG,"ارحلياسيسي
ارحل عشان لو جاء اليوم دة مره تانيه مش هيكون في رحمهوالدماء هتملاكي يامصرارحل عشان نعيش حياة بشر بجد مش عبيدارحلارحلارحل "
1009913756665700352,EG, هههههههههه ليه كدة شكلهم مدايقنك جدانص الدعوة الاول تمام لكن ليه غيرت مسارها في الاخر
1009915207655870464,EG, مهيب دة اصلا خساره فيه يضرب جرس مدرسهإزاي بيسافروه في اهم الاحداث الرياضيه يغطيهابني ادم قفيل ودمه تقيل اوي
1009916091190169600,EG, اوك ياسيديمسائك حلو
1009918088966533248,EG, إزاي بس منتخب الارجنتين عندهم اسماء كبيره يمكن اكبر واحسن من اللي فالبرتغال وميسي من يوم لعبه لمنتخبه وهو عالحال دة الوضع دة مش جديد عليه
1009918804783136768,EG, المشكله انهم عارفين إن الناس مش بتحبه واللاعيبه بتتريق عليه بس تحس إنهم بيبعتوا بيعاندوا الناس بيه
1010867727161069568,EG,بتابع من بدري الانتخاباتالتركيه هو مفيش حد بيرقص قدام اللجان ليه واكيد طبعا الفائز مش هيفوز بنسبة  انتخابات ملهاش طعم خالص
1010989265885581184,EG,احمدموسى بيقول الانتخاباتالتركيه مش نزيههههههههههه نزيهه دي تبقى خالتك انت بالذات متتكلمش عشان نزيهه لو شافتك هتف فوشكمعتزمطر
1011008114420838400,EG,"انامعصلاح
طيب لو هما بيستغلوك سياسيا إحنا ذنبنا إيه
إنت كدة بتعاقبنا إحنا كجماهير مش بتعاقب دوله هما مش هتفرق معاهم عندهم طبالين كتير"
1011288189955387392,EG,"السعوديهمصر
محمدصلاح هيخلوه يشرب مخدراتبجد إيه القرف اللي إحنا بنعيشوا والنكد ده مش كره بس كل حاجه بقت تقرف زهقت وتعبت والله "
1013476227980627968,EG,"اسبانياروسيا
اللهم لا شماتهبس بصراحه مش قادره ابطل شماته فيك ياراموسمفيش لاعب روسي رخم يطلعلك لسانه ويغيظك زي ما عملت مع صلاح "
1013477679675461632,EG,اوحش كاسعالم دة ولا إيه 
992097986732736384,EG, ونسيتي تقولي لو مبعتهاش اعرف ان الشيطان هو اللي منعك
992110996398444416,EG,هو مسلسل قيامةارطغرل بقى نكد كدة ليهالله يسامحك يا معتزمطر إنت خلتني اتابعهانا راضيه ذمتك ينفع يموتوا اصليهان وحليمه ويسبولنا هايماه 
