id,dialect,text
986443172187426816,EG,  احنا بعذاب من اول فبراير تضيق قله الخضار اغلب الادويه مش موجوده ابسط حقوق اطفالنا الالبان مش متوفره والمواصلات بنروح الشغل بعذاب والله في ناس بتروح الشغل بنص نقل تخيلي لما يبقي شغلي كيلو واروح بالنص نقلرغم اني لم اخاطر بنفسي بها تخيلي كم الناس اللي بتهاجر برا سيناء بالامر
986446341273505792,EG," لزوم لبس الصيفي والشتوي والمصيف وركوب المواصلات يوووه بقي هنفسن علي الناس دول غلابه وساده الشعب 
الشعب الغلبان واللي هيموت من الجوع ولما نزل المواطن يشتري فسيخ ساله المذيع تامر بيه جبتم الفلوس الفسيخ منين كان بالحلال يا باشا بالحلال يا مذيع مش من دم الشعب"
986549008142348416,EG,"ارحمونا من الصبح رزع وهبد الحيطان اتشرخت حرام عليكم 
سيناء"
986549398837526400,EG,"تعبنا من الفجر وانتم بتفجروا ارحموووووونا
سيناء"
986645255222067200,EG,  باعتذر غاده اذا سببت لك احراج بس والله نفسي تحسو باللي عايشينه في سيناء
986659499988701184,EG,يضحك العالم والسيناويه يبكون
986682949453037568,EG,  احنا وطنيين ومصريه اكتر من اي حد
986683087701475200,EG,  ربي يرد كل غائب يا ايمي واعذرينا من قهرنا
986683671980556416,EG, اوقات كتير بنخاف نكتب مش اكذب عليكي الوضع عندنا مو متحمل بيكفي ما نحن فيه كل بيت سيناوي يوجد معتقل وشهيد ومطارد ومختفي
986684071542534016,EG,  تسلمي غاده من زوقك
1160888736986648576,EG,  يمكن قصدها فراخ بنت المفكوكه
1162300743778525184,EG,لو عندنا حكومه محترمه بصحيح اللاجئ اللى مايحترمش أهل البلد اللى انياه و يتثبت عليه كده المفروض  ساعه و يكون مترحل على الخرابه اللى جاي منها
1163102684410515712,EG, عارف انا المفاجئات بنت الكلب دى
1163104280225751040,EG,طب مفهمش الزمالك اللى انت بتشجعه  
1163182814268968960,EG,احااا مكافاه الاتحاد للاعيبه  جنيه لكل لاعب احاااا
1163183471067566080,EG,احتيين ده مفيش اصلا لائحه للمكافئات
1163183614185607168,EG,لا هتلاقيهم بيلعبوا تحت اسم بلد تاني 
1163184279511339008,EG, اه و معاهم واحده بيبسي 
1163187310017560576,EG, انا بقولك رئيس الاتحاد المصرى مش حسن مصطفى و ممكن تسمع مكالمته مع عمرو أديب و فريق الشباب  العالم مخدش مكافاه لسه
1163187608844943360,EG, و ايه علاقه الريس  ده اللائحة
1163187850516606976,EG, لسه هيطلب من الوزير يطلعلهم مكافات من الوزاره 
1163512675525115904,EG,انت حافظ يا حبيبى كل بطوله نفس الكلمتين طب فى روسيا و طلعتوا اتكلمتوا و هنا بعد الهنا بسنه و بطوله الامم خلصت طالع تقول 
1163555633792266240,EG, أكيد مش هيتكتب كده من فراغ يعنى
1163774157433331712,EG,اكتر حد معصبنى فى جهاز الكوره فى الاهلى وجود طارق سليمان
1163799529159892992,EG,الخطيب لو جوز ام مرتضى مش هيطلع يتكلم عنه كل  دقايق بالشكل ده  جوز امه ده الكلمه المودبه 
1165569881292574720,EG,طبعا أنت هتقولنا احنا عارف  
1166121674489679872,EG, و ليه تفتكرى اهى قدامي قولتلها انا 
1166122594896138240,EG,معلش تربيه حمو بيكا بقى 
1166122955103002624,EG, التجمع الاول منور اهو 
1166384602581295104,EG,انهارده مرتضى هيطلع يشخر لما يموت  
1166386073490120704,EG, بتاع جهينه ده صح
1166386595253145600,EG, يا عمى عادى كسمه على كس ام الزمالك 
1166770968133537792,EG,و ده ملحد خول ملناش دعوه بيه 
1167745357851369472,EG, جوزيه تقريبا مكنش عنده  قوى أصلا
1168067989729665024,EG,قهاوى و كافيهات مصر السنه اللى فاتت كلها كانت بتسب الدين لماني عشان انانى
1168649029703688192,EG, أنتي بتقارني مرتضى و ولاده اللى كل  دقايق يشتموا فى الاهلى و الخطيب بى واحد بيرد على الشتيمه بى تريقه 
1168649855847325696,EG, لا اللى بتقوليه مش صح هو المفروض ان مرتضى و ولاده يشتموا و يطلعوا يتكلموا على مدرب الاهلى الجديد و لاعيبه الاهلى و لما سيد يتريق تحطى الاتنين فى نفس الكفه 
1168650205006376960,EG, طب تخيلى كده ان مفيش تصريحات من مرتضى و ولاده سيد هيطلع يتكلم 
1168650707295232000,EG, ياريت محدش يطلع يرد على ولاد الشرموطه اللى اسمهم اولاد منصور
1168651187064836096,EG,  رغي على مدرب الاهلى و كل شويه شتيمه فى الخطيب  ده لو الخطيب بينيك امه مش يطلع يتكلم كل ده عليه
1168652679159144448,EG, لكن هو يطلع يهين امهات الناس عادى مش مشكله 
1168662302394130432,EG, ده فاتح رجله اكتر من رجلهم اساسا 
1168926489389273088,EG,لسه شايف تعليق تركى الشيخ  كسمه عن مدرب الاهلى مش عارف الأهلى عاملهم ايه لكل ده سعودى مسئول عن الترفيه فى بلده و مالك لنادى إسباني مال امك بى فريق فى مصر 
1168983143807889408,EG,هى صفحه المختلط دي بيصرف عليها مرتضى و ولاده 
1168983656192495616,EG, اااه  واضح ان حد بيمليهم يكتبوا ايه
1169322653754302464,EG,لا دماغ و فكر الشخص هو اللى بيغرق 
1169363957611675648,EG,من مش متابع و قرن الفلفل و يا مين يعيش و يشوف الاهلى على ما ياخد الدوري الى الانتاج الحربى عشان مش لاقى نادي يتعاقد معاه 
1169774186908323840,EG,بالمناسبه كل اللي ليهم شغل مع الجيش عارف ان الواد ده كداب و اتسوح و عليه فلوس مش اكتر من كده
1170797367337136128,EG,بما ان جماهير الزمالك بتشتم فى الاهلى مش عارف ليه ف ممكن بنقول هتاف قبيح بس حلو لشيكابالا بفكر افكرهم بيه 
1173742477578309632,EG, و الله ما اعرف حاجه  طب هى الثوره دى هتنزل الشارع ولا ايه 
1173742652300386304,EG, طب فى مزز ولا رجاله بس 
1173742949664022528,EG, و دول نازلين امتى يا بوسي معلش
1173743614813491200,EG, انا اللى اعرفه ان الجمعه معزوم على كتب كتاب و عاوز ازوغ منه و فى السوبر الساعه  ولا اتاجل ولا ايه
1173743676163534848,EG, ايه ده باسم يوسف ظهر
1173744311227342848,EG, فيش مزز قلعت طيب 
1173744738400428032,EG, لا خلينا فى اللى فى القاهره احنا لسه هنسافر 
1174983414593835008,EG,الكومنتات اللى علي التويته  
1175136762454319104,EG,احااا مش ده اللى كان احسن من ميسي و رونالدو مجتمعين 
1175137460109664512,EG,شيكابالا فى اى ماتش حاسم للزمالك فى اى بطوله مابيجيش و ده من زمان على فكره و فى ماتشات الاهلى تحديدا بيكون سراب 
1175163953175027712,EG,ما إللى هيجى هينيكك زى ما السيسي ناكم مفيش جديد ف استمتع بالسيسي عشان مس هيمشي 
1175164769772408832,EG,كده الزمالك مش هياخد بطولات تاني 
1175188926035832832,EG,مش عارف شغاله نفسك بمصر ليه   
1175189150464708608,EG,محمد كان بيتفرج على ماتش تانى تقريبا  
1175198615192711168,EG,الحقيقه لا سيسي ولا غيره انا اللي هشوفه فى الشارع بيقول يسقط هنيكه  كفايه قرف يا ولاد المتناكه
1175377741488840704,EG,و ده كان اكونت محن قبل دلوقتى 
1175419780498677760,EG,  يعنى لو مفيش فيديوهات الحرامى كان برضو فى عشرات من الناس نزلت يوم الجمعه 
1175421971049394176,EG,  بالظبط الا اذا منال تعرف حاجه احنا منعرفهاش ولا أخدنا بالنا منها  ان النزول مش بسبب الحرامى
1175422320153944064,EG,  فعلا  طب ما قنوات الاخوان ليل نهار بتكلم فى المليارات  قصه الجزيرتين ولا كل ده كان فوتوشوب و الحرامى فكرهم فجاه و لا ايه
1175435844410363904,EG,  عموما شويه و هنعرف ايه اللى نزلهم
1175468482466635776,EG,السيسي اول ما ينتزل من الطياره للعيال اللي نزلت  جرى ايه يا ولاد المتناكه
1176187218689482752,EG,عموما ماكنش المفروض ان حد يشمت فى الاهلى بس كسمه احتياطي لو كان ناوي يعنى 
1176232893259091968,EG,متشتروش مسكات يا جدعان  
1176243560657620992,EG,حد هنا شغال فى مبيعات شركه بيبسي يا جدعان  عاوز حد ضروري
1176637549021937664,EG, ممكن تحط رقمها عشان محدش يبلسها
1176638464122609664,EG, طبعا مش هتديها لحد بس القصد ان تحط رقم الورقه عشان محدش تانى يلبس  مزوره  من يومين حد قالى على الرقم اللى فى الصوره دى هل هو نفس رقم الورقه ولا لا 
1176640544447115264,EG,الصقور هتقفش ألدي ام  تعالي البيت ع طول 
1177527826590981888,EG, لا مش بطل  حرام عليكى
1177576312011182080,EG,احم احم انا معترض على الراجل اللي فكر فى موضوع المنصه و الاتوبيسات اللي بتلف في الشوارع  معترض علي فكره الحشد و الحشد المضاد  كبرنا علي الكلام ده
1177646176725798912,EG,طب امك هناك عشان اروح 
958831417714233216,EG,            تمهيدا الي ايه تاني كفايه سيناء بتنزف دم
961743111276957568,EG,  موجوده عندنا بسينا وتسمي الرجله
962134064990998400,EG, سلمتي من كل سوء اخيتي
963528581291937792,EG,"محجوزين بقالنا ايام  قلت استاذن انزل اشتري اكل للاولاد لاقيت بالسوق والله العظيم
بصل اخضر وموز ياتري بينطبخوا ازاي دول
فين عربيات الخضار 
مافيش 
فين الجاز والبنزين
مافيش
وين السيناوي
مافيش"
963535025315700736,EG,مافيش بيت بسيناء الا فيه معتقلين
963791112531009536,EG,الحمدلله علي كل حال يا سيناء
963791814665887616,EG,تخيلوا كل بيوتنا اصبحت خاليه من اقل شي ممكن تتخيلوا البطاطس الطماطم البصل ولا يوجد شي بالسوق ادخل ع المكرونه والفول والعدس خالي من ااسوبر ماركت داخلين ع حرب الاباده
963798977379471360,EG, وين جايب هالحكي انت  انت كنت معنا ولا شايفهم وشايفنا
963888348875100160,EG,يا اعلام قذر اتقوا الله فينا
963890626612858752,EG,"انا وبلسان كل سيناويه وسيناوي عايزين نتنفس ونحس اننا بني آدمين لينا حقووق احنا بنقدم واجباتنا من تقدير 
للوضع وتحملنا له برغم ان اي حد اخر مش هيتحمل تحملنا عايزين نعيش بسلام وامان عايزين نحس اننا بشر 
احنا مصريين والله العظيم مصريين 
ودمنا مصري "
964263927193497600,EG,"حزينه عليكي يا بلدي 
لو هنهاجر هنروح فين"
964721388178345984,EG, يا راجل والله بتفكر برضو
964923363411013632,EG, والبصل الاخضر لو سمحت
964996095939108864,EG, كل شي بالبيوت خلص سيناء تحارب المجاعه
965005206328086400,EG,"هو قالها ومش كذب 
مافيشششش مافيششش مافيشششش
وسيناء فعلا مافيشششش"
965360343399747584,EG,انتو ايه مش فاهمه ازاي تاخدو قرار كده مصير بنتي واولادنا ايه والله ياعالم احنا مصريين ووطنيين 
965689470912811008,EG,مصدومه باللي بيحصل لينا
966112613204725760,EG, المتحدث العسكري نفي ذلك يووووه عيب نفتري عليهم هما صح واحنا غلط
966353592524377984,EG,  اليوم الطيران كان بيقصف جامد وماحد عارف فين
966364011473330176,EG,"اكتئابختناقحالة من البؤسلا امل لهم سوى ان هذا الوقت سيمضي بهم للافضل
متقولش ليناعادي واستحملوا ادعيلهم احسن علشان احنامستحملين بالعافية ومحدش بيجيب سيرتنا بخير واحنااهل الخير نفسه
ومحدش هيحس بينا غير الي ليه غالي جوة العريش بيستني الشبكةعلشان بس يطمن 
ويسمع صوتهم بس
يارب فرجك"
966397837226496000,EG,"الي بيقولوا محصلش حاجه في منطقه الزهور تشوف الي الناس بتشوفوا امين كما تدين تدان
ده صاروخ بالخطأ "
966730245733744640,EG,الشبكه لسه راجعه بعد غياب ساعه
966795737056141184,EG,ما أضيقها من أيام
967117094427996160,EG,يامصلح الحال يا الله
967159383678504960,EG,لمصلحه مين مذله مواطن سيناوي ليه بتذلونا وبمنتهي الاهانه هيعربيات خضار هتكفي مين ولا مين والتنسيق مع بتوع التموين اللي بصوا ع الناس وهي بتحارب علشان الاكل انتم ايه حسوا بينا احنا بشر مش ارهابيين
967163734371328000,EG,"اهالى العريش فى انتظار الخضار  وطار طار 
اسبوعين ولا اكل ولا بضايع بتدخل ولا بنزين ولا ادوية وياعالم لأمتى 
لسة مطحناش من الاردب كيلة 
يا مثبت العقل والدين والانتماء  ثبتنا يارب "
967170775701688448,EG,"في ناس خلصت انبوبه الغاز ولا يمتلوا سوا اتنين وخلصو هيعملوا ايه وممنوع دخول وخروج اي شي من سيناء 
ليه بتهينو فينا"
967174060391260160,EG,"يا جماعه المشكله مش مشكله اكل وشرب كفايه اهانه ومذله المشكله الناس الارزاقيه وفي بيتهم مريض بيصرفوا عليه حالهم واقف من الشغل والله اعرف ناس مش معاهم مصروف يجيبو شي 
اللهم اصلح احوالنا
سيناء و مذله اهلها"
967504606673735552,EG,"فتحنا بيوتنا واخدتو تليفوتنا وقلنا مصلحه البلد واكلناكم وشربناكم واستقبلناكم بالادب بكرم السيناويه اخدتو اولادنا وقلنا معلش هيرجع باذن الله منعتو الاكل وقلنا معلش لمصلحه البلد منعتونا من السفر وقلنا مش مهم نموت فيكي يا بلد 
اما نتذل ونتهان لا  والف لا"
967509308866023424,EG,انا عايزه سينا بتعت زماااااان
1142438001286496384,EG,حلوه نغمه انهارده بتاع الكوره لعبه الفقراء 
1143812379731464192,EG,  احاااااا  نقصه ايه ابن القحبه ده عشان يشقط  ما فى يونان ينام مع واحد كل يوم بالفلوس 
1143842403243188224,EG,اسكندرانى بقى هنعمله ايه 
1144316482756763648,EG,هو احنا هنتغفل انهارده باليل ولا ايه 
1144317321705664384,EG, ربنا يرزقك و يكرمك يارب و يسد ما عليكى و علينا يارب
1144320104085282816,EG,لما دول على الدكه  امال مين اللى كان بيلعب  
1144566300343177216,EG,كسمك  شوفى حد يترجمهالك بالمكسيكى بقى 
1144567522685083648,EG, طبعا شو و هاصت الجوز متصاحبين و زى الفل  ده لا يمنع انه عيل هيجان بس هو و صاحبته احرار
1144568905039589376,EG,المزز اللى بتبعت نودز فى الدى ام ياريت متهاجمش صلاح اصلا
1144574976525291648,EG, بالظبط هى هيصت و المكسيكية هيصت و الفيمينست مصدقوا و حاجه كده اللهمصلىعالنبى  بعيدا طبعا عن ورده اللى مضيع نفسه
1144635870844248064,EG,لاعبيه الكوره الميديا جننتها و بقت بتهبش فى بعض علنى 
1144999284892491776,EG, اليونان  ده الخلايجه لما بينزلوا مصر بيخربوها ستات قبل الرجاله 
1144999800947060736,EG,  بس برضو متحكميش على اللى بتشوفيهم فى كايرو فيستفال و ما شابه
1145262529372917760,EG, حتى ميريهان كان الكلام رايح جاى
1145294542905720832,EG,فين المشير طنطاوى و الريس عدلى منصور 
1145296291070697600,EG, الواد بقى تريد مارك خلاص  الله يخربيت امه 
1145743341138653184,EG, كمان  ده احنا هنلبس جامد
1145798482114044032,EG,هو انا لو شتمت ابو تريكة هيقفلولى الاكونت زى هشام منصور
1145799045509721984,EG, انا بحبه فشخ بس بقى بزياده و كمان معرصينه بقى كتير اوى
1146192232388734976,EG, اه بس لو عدينا الباقى صعب
1147061063864803200,EG,نفس تويتات السنه اللى فات و نفس الاسئله تموتوا فى الهرى
1147062240308322432,EG, انشفى كده لسه فى يناير كمان 
1147062761211351040,EG, ههههههه لا بهرج معرفش هنعيش اصلا ليناير ولا ايه
1147063628748796032,EG,  انا قولت كده و بكره فى ماتش و كده ابن الجزمه جاحد 
1147216003627180032,EG,حقك رجعلك يا زعبله 
1147613890337038336,EG,"لاعيبه وسخه و مدرب اوسخ و اتحاد كوره وسخ 
خلينا فى الخطيب و مرتضى و تركى و الزباله دى"
1147781507760689152,EG, ياعم ده الخول التانى المحمدى
1147942299466424448,EG,طبعا يا نجم انت بتفهم اكتر من كل بتوع الدورى الانجليزي و بتوع أوروبا و افريقيا  انت برنس 
1148575275606847616,EG, دى محتاجه تخس بتاع  كيلو
1148733136018256000,EG, لسه راجع من اسكندريه من ساعه  الرطوبة عندكوا صعبه قوى  حاجه تلزيق بزياده
1149596642695208960,EG,  الواحد كل ما يشوف فريقه بتلعب دمه بيتحرق والله
1149597686699421568,EG,عاوزنها راجل مش ست  عشان الستات نكديين 
1149604023101616000,EG, بس يا شاطره بس 
1150008728399298560,EG, مش عارف دول لسه بيشجعوا كوره جديد ولا ايه
1150009192159354752,EG,و طبعا لو الجزاير خسرت الماتش هيكسروا الملعب و الامن هيتدخل و هتبقى مناحه هنا من شراميط الكوره الجداد
1150010559020044416,EG, الله يخربيت ام الثورة دى 
1150010790138797952,EG, المفروض فعلا قوات خاصه  مش هينفع معاهم الامن المركزى الكيوت بتاعنا ده
1150012301573050368,EG,و الشعب بيقولك كسمك 
1150016224237105152,EG, عمرى ما سمعت صويت فى إستاد القاهره  بقت حاجه تعر 
1150018670267179008,EG, هنخلص  بس مش بسرعه كده  ديباسيتو شويه
1150024193431494784,EG,  بس نور بس ده انتوا كنتوا مسخره 
1150469543304859648,EG,اللى كان ماسك علم مصر فى مدرجات السنغال يمثلنى 
1150519879658852352,EG, ليه يا عمرو محسسنى ان جمهور الجزائر كيوت و جميل و مؤدب مش ولاد وسخه يعنى
1151065338659913600,EG,فى ناس طبيعية بتنتقد تعيين حسن شحاته و فى ناس تانيه بيسبوا الدين ليه معرفش ليه عاوزين تجيبوا مدرب معين ولا عاوزين ابو تريكه هو المدرب
1151068134218043392,EG, طبعا متفق معاكى بس اللى بتكلم عليهم نظريتهم مختلفه
1151246895551041536,EG,له على اعتبار اننا اللى اخترنا القائمه ولا انتوا ولو انت مخترتش كملت معاهم ليه  بس يا عم هانى الله لا يسيئك 
1151247119694618624,EG, و ده ابنه ولا حاجه تانيه لامواخذه
1151247440026189824,EG, يبقوا لامواخذه مفهمش راجل
1151253844883582976,EG,  بوظتوا الواد  ربنا يسامحكم 
1151254037603454976,EG,ايوه ايه اللى حصل بقى  
1151254483642568832,EG,  متكلمش راموس عشان ضربك  احنا فى حضانه  تلاحم ع الكوره وقع و اتكسر عادى يعنى
1151255229234593792,EG, ما كل الناس بتصور و اللى طلعت ترقص عارف انها بتتصور و بعدين هو مش شاطئ سيدات ده ميكس ليه قذر يعنى
1151255507035938816,EG, اصل انا عندى كافيه صغير كده فبيعدى علينا الحاجات دى كتير
1151255789606187008,EG, هى عارف انها بتتصور و لامواخذه أدت طيزها للناس اللى بتصور هى و صافيناز  مش فاهم ليه الشخص اللى صور قذر
1151256165407440768,EG, بتقاوحى انتى يا بوسي
1151257610051555200,EG,تاريخ مين ياض انت خول 
1151259342177546240,EG, الواحد جاب اخره بصراحه من لت و عجن المصاطب ده  ما كل خول يمسك لسانه عشان ننسي حتى
1151453309707923584,EG,صوره بتشوف فيها وقفتك فى الماستر اللى فى الصحراوى و سنترال العجمى و انت داخل على بيانكى وحاليا اخر طريق العلمين و انت شايف البحر من مارينا  
1151455015002918784,EG,تاريخك هو احتياطى لى احمد فتحى ده اللى انا فاكره 
1151455726260412416,EG,محدش شاف الناس اللى بتهاجم و تفشخ المحجبات لما تصور البنات اللى بتلبس مايوه  اصل فى واحد بمايوه مصوره وحده بنقاب و بتتريق عليها ولا دى على المزاج 
1151462245580324864,EG,حضرتك دى مش بتتقال غير للاهلى مش اى فريق و خلاص 
1151469623377837952,EG,بس يا خول انت كمان 
1152618184807239552,EG,بتوصل  واحده عشان عمل بلوك  
1152619276307763200,EG, هى كاتبه الرساله اللى بعد المقابله اهم من المقابله و انا بقولها هتوصل صح واحده بس عشان عمل بلوك 
1153034230433230848,EG,احااا مش ده اجمد واحد فى مصر 
1153584784817475584,EG,أنا بشتم الستات اللى بتسوق و ماسكه الموبايل 
1153800771311304704,EG,"أن شاء الله لو ربنا كتب الفوز بكره للنادي الاهلي أتمنى يكون بالسيناريو ده 
ضغط واستحواذ من المقاولون طول المباراة سوء حظ غريب ليهم ويضيعوا فرص سهله النتيجه تكون  والحكم يحسب  دقايق وفي الدقيقه  يحسب ضربة جزاء غير صحيحه للأهلى ييجي منها هدف الفوز بالدوري ال يااه ع المتعه"
1153804014359728128,EG,  طبعا لما بنهيص كده هنتغلب وش
1154106577059819520,EG, طب هو انت بتتفرج على الاهلى ليه  مش بتتفرج على الزمالك ولا واثق من فوز الزمالك على الاسماعيلى 
1154113174075052032,EG,اهو الشحات ابو  مليار اللى جاب الدورى 
1154115085381640192,EG,كس ام اللى كان مستنى ياخد الدورى ولا طالشي 
1154115376231407616,EG,هو فين الخول ده عاوزينه شويه  
1154118548199006208,EG,احنا الاهلى  انتوا مين 
1154127801336901632,EG,قالك لو هفك الشوق انا مستنيك فوق  ادينى طلعت و ركبتك
1154128596509843712,EG,كان نفسي اخبط فى حد زمالكاوى ع التايملاين عشان اقول صياحكم طرب بس مش لاقى 
