id,dialect,text
1025352839902703616,KW, ع باله بيرد للبرلمان مره اخري بعد ماكتشفوه ااخوانا الشيعه ع طوه طاف دور غير اللعب ع المذهبيه العب غيرها 
1025388760064770048,KW,خللي بالك هو حضرتك لو قعدت تحتها ان قلب ثمرها شرري ابعد عنها يسترها معاك  
1025389085555343360,KW,والغيره سبايب ب فراق الحبايب  
1025392238833152000,KW, ويلومووووني العذال بتحب مصر ليييييه اكيد مسحور  اقول لهم سحرها عاجبني وانتم مالكم 
1025396870712057984,KW,ماهو ع شان كددددا  بنقول سحرها عاجبني واللي مش عاجبه ي شرب من ترعة المريوطيه  
1025442993388572800,KW,بيع الكضيه واقبض من دبش  
1026218368423157760,KW,اللي تسأل عن اسمه هو حنفي متولي عبد الصبور  
1026218755507068800,KW, ماني قلت لكم اسمه حنفي متولي عبد الصبور  ولا حد ياكل صبور 
1026221954137825152,KW,حتى ما احد يقول شنو انا هندي  
1026790594998415360,KW, وش لون بالصناعيه ونا شايفك بالجليب عند سوق الحراميه 
1029802571349852160,KW,للآن اشرب من راح نهر النيل ولكن عندي ماء قلبان مغره احلا وهذا قلبي يوم شفت قلبان مغره ماجداي كود التوجد واجر من الونين 
1030028414038822784,KW,هلا ومية هلا بالقلب لنا مانقدر  نسميك جدام اهلنا  
1032259752817029248,KW,يقوولون الاسد المنفلت ماحد صاده غير كرباج 
1032959436934061952,KW,اكو مثل عربي قال خيل الخيل عام الاول قال له لأ خيل الخيل حاضر ب حاضر دور بدوي ي عربها لك  
1032985934906753024,KW,هم خوال كرباج راحو السعوديه  انا خابرهم ورا خضر الما  
1034094216325066752,KW,هذا شنو ومنين طلع لنا هو ونخاريره بعد ناقصيييين  
1034732342898777984,KW, اشوووف الزبيدي رخيص يمكن لو ينحدق ل قلت من صيد الأنيق افندي 
1034733535175815168,KW,اعزمني مره ع الحداق معاك بس ترى ماعرف اعوووم  لا تخليني ابو الغيرا  
1037220426764705792,KW, تقووول مسوي رجيم وتريق  شباتي وماعون تكه وبعد ثنتين جعله مسهل ع جبدك عفوا قصدي عوافي 
990519572234203136,KW,رح له وقله الوات ساب خربان وادريبك عازمني وخذ معك قدير للفرووووخ  
991236249825427584,KW,   خله مايجيب الصاع كود صاع ونص ولاعبناهم واليله ب درهم 
991929896275464192,KW,عجاج ورياح عاتيه ومطر وبردي يعني كوكتيل واختلط الحابل بالنابل  
991982116928999424,KW,انا سمعت انه راعي بعارين بس طمعوا بالبل وخذوها وقالوا راعي غنم  
991986799017897984,KW,فعلأ اللي مايسمع هالعزف ع العود ماعنده اذن موسيقيه ب يندم وعاشت الأنامل الذهبيه والصوت الرخيم  
993144169500684416,KW,راح ي جد ويرأ بأم عينه وضعهم ممتاز واحسن من وضعهم ب بلدهم عسى ينقل الحقيقه ولا يحرفها لو ي خاف الله  
994510756749115392,KW,لييييه وليييه ي علي علمنا ووضح   
996308986965217152,KW,اجل انا ب حفر الباطن وقريب عندكم مرووو علينا  
998488603943686016,KW,وان كان بينا من بعض البشر فيه جرب وحرمنه بعد ويش نسويله نعزله ولا نعالجه ب احدى الدول الاوربيه  
998707188003635200,KW, مايبون يغثونك به شيره زايده
998986758514708352,KW,ودي امشي في هـ المووول بس اخاف ياخذون فلوس ع المشي  
999375816629866368,KW,عساكم ع القوه شباب الكويت اهل فزعه ويقدرون يسون شي وشويات والله يعقل سعود ويرده سالم لاهله ان شالله اللهم آمين  
966373789301960832,KW, ي خرطي ي هملالي انت وين والمزاين وين بس مو مزاين الابل 
966375202631319552,KW,مساكين الرجال مظلومييين مايعرفون الخيانه  علي النعمه ماكو اخون منكم ي مجمع الرجال  
966376923285901184,KW,بس لو رحت ادخل برج القاهره طالما زين ب علم بلادي ياخذو مني سعر مضاعف ليييييه  مايخلوهـ فري مثلأ  
966379340576579584,KW,ادريبك تدور الزلات ع الشرطي لو يعود بي الزمن ل كل يوم اجلدك ب  مخالفه حتى اخليك تبيع هدومك  
966992087962083200,KW,ماكوووو فايده بخييييل جلده  
966994976856072192,KW,ازلق لحيتي لو قدرت تجي وللا ماعزمتك  
966995978489344000,KW,تعال ب سيارتك ع شان تمر ع الخفجي وان وصلت ابشر ب عزك  
966999856039497600,KW,هذاك اول الاول تحوووول  تعال بس ولا تكابر  
967003946324816000,KW,البركه ب سراقين المال العام اللي ماعندهم مخافة الله  
967343972061450240,KW, ولووو الوسم فات  اشهد ان مطرها اليوم عندنا وسم وان ربيعها فات اعيادنا اليوم ربيع كأنه اول الوسم 
967362859033382784,KW,هو انت اللي لابس سديري فسفوووري اقووول مشبه عليك  
967365976718180352,KW,كرباج ماعنده صميل ي عطيك شنينه قل تبي قيمر عراقي سمكه شبوط قطان ابشر وغيره ي فتح الله  
967411213910061056,KW,عرفووووك وصت النقوشي اللي معاها حتى تحرم تحرش ب خلق الله  
968088047240843264,KW,كفووووو بناخيي طلعت ع خالك  وثلثين الولد ع خواله  
968089865433812992,KW,الزين والحلا كله ع السمر فدوه لهالبسمه يلوووموني لو حبيت الخوال  
968091140695187584,KW,الله كريم وان شالله ب زووود ع شان نطيح قروض اهلنا وجماعتنا  
968201705895608448,KW,ان شالله الفال لنا ونخلص من بعض اللي نايمييين ع بودنا  
969089462318895232,KW,مايبي الشعراء يدري هذرتهم واجد وبعدين يقطونه ع صخر  
970220353455837184,KW,هالقطه تبي لها بيتين شعر من ابو صفوق  
970308250745933824,KW,وحنا عرفنا السفوف ع شان نعرف اللهوم حنا الحضر ترجموها لنا تراكم ابلشتونا ي هالبدوان  
971295216870227968,KW,البعض منهم متعود ع الحرام وفلوسه وان ماسرق يموت  
972132952556654592,KW,لاء رشهم بالديتي مال اول اقوى ع شان ماحد يلبط منهم  
972134812780724224,KW,خلووووها تاكل اللي تبي  بس لاتقصر ب رجلها تكفوووون  
972442898024353792,KW,مدام تنحن ابو الكباتن بس ترى اهل الجهرا مووو كلهم مصوتين بالعشا هذولاك نعرفهم زييييين  
972443699526455168,KW, ويش تقووول بالمحنتش المفنتش اللي فاتل شاربييييه  ماهي هـوتي يدل حتى الجهرا 
972445985443106816,KW,ابشر ي ابو الكباتن ي بعد الردي  
972548939101692032,KW,شعندهم حاطين حطه ع الكويت والكويتيين هذيل ماعندهم بلاوي سودا بلدهم يتكسبون ع سمعة الكويت اخزاهم الله ردو ي علام  
972836609015066624,KW, وبتلشنا ب طلايبكم ي هـ البدوان ويلومني البطران ويقووول ليه وجهك اصفر 
972857015105187840,KW,ومن الأقوال المأثوره ي دليم قله هلامن قالها علموووني تراني مادري 
972909487949537152,KW,ع بالي يلعب الدحه ماهو الدوح الله ي كفينا شره وياك ولا تبي ادوحك ب بيت شعر دوحأ  
973259094894301184,KW, ي حليلها  تبي تعلم تروج وتسوق لبضاعتها واعمتها الله يخلف ع اللي تسوقين له 
975758339475984384,KW,مو اخاف يقولون هذا خبل يوزع ابتسامات  
976788309916700800,KW, مايتغدا خطيه  ماتدرووون يقفل الباب وياكل ب اديه الثنتين 
976789242201374848,KW,افا والله قام يهز مكيوته خربت المرجله والمراجل  
976791121908125568,KW,ماهو مقصر الشايع حتى دبي له مشاريعه الناجحه هناك وله صيدليه بعد وقلت ابي دوا آخر اليل عطوني مع الخصم وصرت حصان  
976869167923163136,KW,غزل فرعوووني هذا يخوف خلووونا بالغزل البدوووي ارحم حد الله بينا وبينكم  
977166318788071424,KW,الله يحل السلق عليهم ع الاقل السلق به فووود ولا هم قرووود شوفتها تضحك  
977231157220737024,KW,عندي شاليييه بالصبيه بس ترى عشه وعليييه ازاله تراني بياع  
977232276248518784,KW, ابو الكباتن لا تحرش فيني 
977233037216964608,KW,يقوووولون ابو متيح شمري ابن عمك صج   
977233889096761216,KW,الله ابرك من الكل  
977283105957601152,KW,ربنا ي جبر ب خاطرك انا منذ شهر ماحد صبح ولا عبرنا احد  
977283865457905664,KW,بلاش شتايم احسن تروحي النار  
977286625129529216,KW, نكت المصرييين حتى لو بايخه مقبوله ب امتياز 
977288035422363648,KW,ما تخليها ترضه هي يمكن يطلع مسلم بالرضاعه  
977289972616237056,KW, عم خميس عندنا واحده ب تتوحم ع فسيخ تبعتلي كام كيلو تكسب ثواب 
977291074535292800,KW,طيب اعدي ع حضرتك أخذهـ بس مامعاي فلوس  
977883347170062336,KW,يكفينا شرها ان شالله قطعا تطيح شمال شرق ديرتنا قولوووو آمين  
978001389807984640,KW,موووو انتي بدونهم ماتسويييين قشر بصله لادعين عليهم ي خبله  
978002356183937024,KW,هوووو انت لم الحين مابعت عباتك والفروه بعد  
978150147896107008,KW, بطلت من الباه وخبز التنور اللي انت خابره 
978644184050651136,KW,عرفنا الفطير والعسل بس الحجرين القص شنو سالفتهن  
979085052549255168,KW,من زمان ونحن طايحين بين حراميه وعيارين ونحن نتفرج ولا باليد حيله  
979086730807607168,KW,الله يحل عجاج وغبار الكويت جتنا عجه وغبار مصري مهول يمكن يمر ع الكويت والسعوديه باكر الله يحفظ ديرتنا من شره 
979087996552138752,KW,لقيت لي مصري ظفيري يقول انا ابن عمك بس مصري يطلب كارت زياره مني قلت له ابشر بس يصير خير يعني  اقبض من دبش ي ابن العم 
979089655072284800,KW,واحد قابلته باحد الفنادق الكبرى ب مصر وحظني وسلام حار ومطق حب قلت انت تعرفني قال امان انت حبيبي ب تويتر طلع فلوو من هـ السيبنديه 
979115641104936960,KW,اقول لها اخييييه هو انا كداااا 
979120113831038976,KW,وزووولك بين الازوال مملوحه  
979120934446600192,KW,وليييه التجني هذا ما حنا فتحنا اتجاه واحد ب دوار البدع  
979643046332653568,KW,ي ترى عسى فاهمه الكلمات والتعبير الخليجي  
979665251582070784,KW,والله وثلاثين نعم ي بني هاجر  
979780787770937216,KW,ي كثر هـ الأشكال والنماين اللي عايشه بيننا ولابسين لبس بني آدمييين والحقيقه هم قروووود  
980715738792124416,KW,  لايطوووفكم ترى الماي مقررررري عليه 
980716867605139584,KW,والله مووو بعيد تحط به الماخوووذ الابيض صناعة بنقال ومكتوب عليه صنع بالجليب  
980717643362598784,KW,انا اشووف هـ الزحمه اثاري افتتاح بوتيك كرباج  
980719797141991424,KW,ترى كذوب ماكو خصم انا من ضمن العشره ماعطاني لوووون  
980742616076705792,KW,اشهدوووا ويقوول ماييعرف الكذب مره  
980743768822476800,KW,ماندري انت حجام وشلاع ضروووس مره محامي عن الرجاجيل ومره فاتح بوتيك وتبيع سمووولك فيه علمنا ويش انت  
980744855247884416,KW,دوووختنا كل ماشفتووا بدووي قلتوا هيلق ويش انتم جايين من بلد الواق واق  
980745816632643584,KW,هذولا مأجرهك كرباج من الجهرا اعرفهم  
980746574329413632,KW,  لاحدد  يقرب يمه تعديكم فيها جنون البقر شوفوها تعل 
981971511086141440,KW,ي صويحبي جعل الجراده توطاك ولا زهيون لا بلسه جواتي مادري منو هـ الشاعر الفلته منووو ولها تكمله ماتحضرني الان   اللي يعرفه يقولي 
982164015076884352,KW, انا شفته لابس وزاااار 
983014894000885760,KW,نسمع جعجعه ولا نشووف طحين البطاقه المذكوره مجندها اشهر ورحت المطار الكويتيه واتخطيت الطابور مفتن بالبطاقه وطردوني 
983289336669106176,KW,ولك انت بروووحك شبهه واللي يجندك خسراااان  
983292640430051200,KW,بعد شني حبوب لاريكا قمنا نسمع عن بلاوي الله لايبلا لزم علينا لو شرينا حبوب من الصيدليه نوقعه تعهد ونصوره حتى نسلم 
984408244478201984,KW,مايصير واسطه مامعه تطعيم  
984716681976131584,KW, ادوخونا هالبدوان ماينامووون عوذذذذا  
984717248819580800,KW,اثاريك مانتي سهله تخوفيييين  
984719285082841216,KW,درب المحبه ادله ترى بالجليب خلف سوووق الحراميه  
984719599794118784,KW, ماحد يدله غيري ولاني معلم 
984815986024108032,KW,ي مسى الرضا همس الندا السعيد  
984819566089048064,KW,لاء ولاء وليييه شاربين ماي مقروووؤ عليه  
984823462471634944,KW,ي راجل وان سرق جوالك ح تنسى الكل قل رمزها ب قلبي ماحد يسرقه  
985210906752815232,KW,ذكرتني  حيك مطر  صيف مايبلل اللي يمشون   
985215088222265216,KW,يجيهم وليييه مايجيهم ان اقبل علينا تفرق وان عدانا تقارن وهلل وخذ ي مطر  فينا بلا الله لايبلا  
985870726803664768,KW,الله كريم الله يجيب الخير اللي مابووو شر  
985873340048007168,KW,كرباج نصير الاكل والنضد اسمعووو كلامووو ولاء وليا للرجيم  
985876561500037248,KW,هالله الله الفزع لولد اخوي لاتخلووونه ي الرفاقه  
985877126531420160,KW,  فزعتك ي كرباج انخى متابعيك لايخلون مرشد  
985899411581661184,KW, ومطرت تراني بالسياره ع سا مايطرحوني الشرطه ونا اكتب 
985907417111322624,KW,اشوووفك واصنيديق الطماط والسميكات ولكم وين موديهن لا تقول ل نافع  
985908015349030784,KW,عوذاااا هذي اصبع كرباج الله لايبلانا  
985910653562114048,KW, ويش ينفخووون بعد ع لمنا 
986508125653135360,KW,اطمأنوووو ي بنات حواء ترى خطوات قليله ونوصل ل هـالمرحله الي قلة بها المراجل والرجوله للأسف  
988326455066152960,KW,لا تعطيه عييين ثم يبيع مجمعه وبعدين يصير راعي غنم اذكر الله  
989088513990774784,KW,يمكن صارت العسكريه وصمت عار حتى لو تقاعدنا التأمينات يعاملونا للآن  انت عسكري  
989092617538494464,KW,شكوووو بيها جيبله بعد سميات وصنيدق طماط ع دربك  
989774007934238848,KW,من يتجرأ ع الكويت وقوانينها ف ليرحل غير مأسوووف علييه  
990169089510436864,KW,ربع الدوانيه كلهم عيال بطنها عدا انا لفوووو احدهم قال ع بالي عياي اسم شيخ  بالله وش اقوله  
947568124513136640,KW,تجي لحالك لاتجيب كرباج معاك هذا مسجل خطر ويشبهنا  
948112763821412352,KW,يعطونا بيتين مره واحده  هم خيمتين بالبر ماعطونا كل يوم هاجدينا قسم الأزالات وارحل ماترحل وطلايب حتى بالبر  
948114704693686400,KW,تكفى ي ابو الكباتن صارت بي خرعه كل ماسمع صوت الكرين اقول جوكم ترى وخذنا وحال عدوك  
948851572037111808,KW,العن ابو هـاشوارب هذول ماهم شيوخ البدوان الا رعيان للشيوخ اي خسون ويعقبووون  
948950953339875200,KW, اشوووف برق وغيم يلوح بالشمال يمكن يمر ع المخيم 
948951858546184192,KW, جيرانا الأخساء بالمخيم الآخر يقولون جاهم مطر ويش معنا حنا ليييه 
948953295707570176,KW, اشوووفك متحمل حيل ع السعوديه  وليه ايران ماتجيب طاريها 
948957320154935168,KW,قطر عيني والسعوديه عيوني الثنتين وايران شعبها ع العين والراس وغير ذلك لا وال ف لاء  
949255307917758464,KW,انا اشوووف واحد عقبني يركض منحاش يمكن هوووو  
949287692528967552,KW,ذبنا اشوى خاف يحولوك عنز ويربطوك مع تيس شامي  
949289402446032768,KW,هو فيييه احلا من هالابتسامه الخجوله هذه  والغمازه طبيعيه ي حلاوه  
949290126714245248,KW,وتلقى ورعان الفريج يركضون وراك ع بالهم انهبلت الله لا يبلانا  
950388071782068224,KW,الحب  الحب آهـ  افتكرت هو فيييه حاجه اسمها الحب فكريني كويس ع شان انا ب انسى وحياتك هو سؤال حضرتك ايييه والنبي  
950389575603638400,KW,تنصحنا نهج وانت الدووور اللي به حريم وتزاحمهم كانك تعرف ستار بكس من سنين  
950392075358490624,KW,انا دووووم ارد بس يكثر زعلك عليييينا مادري حنا مانعجب ي ترى  
950393646351896576,KW,طالما الطرفان مش نكدييين اومان من الطرف الثالث النكدي اوعي تقوولي الشيطان ع شان هو مايحب النكد برضه  
950685846658830336,KW, وعززززاه وصلت ل هـالمواصيل وين المراجل 
950965887145824384,KW,وعزززاه ليييه حرمتوا كرباج من غداه  
950969477373579264,KW,هذا ريوققك انا خابرك ماتريق كود باه  
950972502418870400,KW, مو ادريبك انت خوش ولد 
950976091283447808,KW,هذا هوووو صانع المعجزات مايعرف شئ اسمه مستحيل  
951548707505393664,KW,وانا اقووول ويش هالمصك اللي يتدربى اثاريه انت  عوووذا الله لايبللى  
951839172968550400,KW,عليك ب دوا خوالك  اصعلك قلاصين من ابو كلبه  ويغدي شرك  
952229094183329792,KW,هذا لو انا وبديرتي واقول للماره تكفوون ي لجاويد ساعدوني ب غتر لبسوني عقالي عندي مقابله اتوقع منهم ي تصلوا بالشرطه 
952584793237188608,KW,لا هذا اللي جاب راس قليص مادريت  
952957285889925248,KW,ياهـ هـ دانتي قنوعه قوووي  
953516390434078848,KW,شفتك تريقت مطعم الصليبيه بس ماعرفتك  
953517329035464832,KW,وهذا السؤال اللي يبي جواب يجمد ع الشارب   علمونا انتم مع صدام ولا معانا  
953517609135243264,KW,اهب ي القشر اثاري مانت ب سهل  
953523812699656192,KW,هوووا بس للحلووين واللي مثللي ماله نصيييب يعني  
953726670397214848,KW,من يسبحهم ويريقهم الزغار هذول اللي كاسرين خاطرك الله يسلم البديله العامله المنزليه خلهم يروحون التجنيد ابرك  
953728657457123200,KW,ومن قالك ي عرس عليها وهي مجنده ومتعلمه فنون القتال  كود عايف عمره مع عروسة راح تكن مرحومه  
953885013371736064,KW,بعض الرجال فشلووونا بكثر كذبه يوري حبيبته حنطه ويبيعها شعير ولو دور البوم صور مبايله تلقى العشرات غيرها  
953897289965240448,KW, شوووف ترى الراعي اليوم مضيع ناقه من انياقي ومحتر واصله عندي جنبني لا حط الحره فيك 
953900517356396416,KW,وااعزاااااهـ اصبحت الدار هيييما والمززززار بعيييييد  
953910083422949376,KW,يالله اقبض ويقووولون امريكا بلد الديمقراطيه وحقووق الانسان والأنسانيه هذه لو عندنا فضحونا ورقصوا ع جراح اطفالنا 
953939408956346368,KW, ي حسافه ع الفروووه اللي شريتها خوفأ من البر تكفون ماحد يشتريها لو ب نص الغيمه 
953988301765083136,KW,صدق من قال رزق القطاوه ع الخاملات خلوووا مجدي ي ترزق الله ع الخبووول  
953989136431616000,KW,كل ماقلتيييه صحيح والآن خططي ل مستقبلك ولو عايزه اخطط معك واساعديك اديني رنه  
953989622081703936,KW, انا ب شووور عليك وش رايك بالبصره 
953994381639454848,KW,وتحسدني حماتي ع قصري وطول عباتي  وعزززاه اثاري كرباج محسوود تعال اقرأعليك  
953995601817014400,KW,مو لوعزمتك اخاف تحسدني ادريبك احسد من الغراب  
954162146174230400,KW,يحليل انتي بعد وتدعين عنزيه ي بيضه انتي  اقولك الخلا اخلا هدوووو  
954166743303360384,KW,ول اشكد انتي حلو بالبرقع  حس بالي سميرا توفيق ل خاطر الله  
954276778498982016,KW,وليييييه هو بس الكويتي اللي يسكر  والباقين ايتصللى ع شلانهم  
954277108536283136,KW,ويش تبي من الكويتي تبيه يسويلك اقامه مثلا  
954335302788833152,KW,ويش وراك غير العجاج والغبار ماتبشر ب قافلة التمر  
954339242947301376,KW,شكلهم يدورون الحجج ع الكويت ويرمونا بالتهم جزافأ لو انتحر واحد او من بين  الف ماهو مقياس سؤ معاملة اهل الكويت  
954373661472866432,KW,ي ولد الناقه غاديه من امس وادورها ب هالعجاج وانت تبي بعد تبي تشتكي علي عزة الله وخذنا  
954670797280423936,KW,انت السبب انت وشواربك اللي عم علينا وخليت الماخوذ هذا يزعل علينا ويمنع الفلبن  ترى ماعليهم حسيفا هم الخسرانين  
954672025804697600,KW, اتركه ي كرباج هو الخسران قطع نهر الدولارات اللي تجيه منا ومن الدول الخليجيه الله لايردهم بدالهم غيرهم 
954997361868267648,KW,ولييه تاوه وبيضتين اللا  ينام بالمطبخ وقرييييب كل شي عنده بس بدون العامله المنزلييييه  
956180517866672000,KW, شوووف وجه العنز واحلب لبن 
956512951615225984,KW,ولوووو واحد مقرفني وعايز اديلوووو ع قفاه واديه بالفناقر من ميدان رمسيس ل حد شارع الهرم اعمل اييييه  
957165435845271552,KW,الضحكه ماحد يسلفها الدفع فوري وكاش والا ي فتح الله  
957167092133957632,KW,وووووخذها كاش والكلام اللي يجمد ع الشارب ي هذا 
957603736154713984,KW,وهو يصلح المربى بدون قشطه بقى صباح مش ولابد  
957636562942034048,KW,ماهو اصلي احب الدسم والدسومه بعيد عنك  
957647083430957056,KW,اشهد ن مايدفيييه كووود رص  جوفن على جوووف  
957651752001720448,KW,هوتي هواك راح يدووور بديل الله ي هون عليك  
957652966441472000,KW,خله يدري وثم يعلم ويدري حتى لو ماقالها لك ولو بالصمت  
957654264784056448,KW,حب تويتر ماله لزوووم مثل العطشان يركض ورا السراب  
