id,dialect,text
658285701310599168,JO,بتزكر في ناس عالمفرق تنطر ناس وتشتي الدني ويحملو شمسية وانا بايام الصحو ما حدا نطرني 
659062259528941568,JO,بعتذر لكل شخص حكتله بشوف وبردلك خبر
659072515961200640,JO,واختلفنا مين يحب يعاند اكثر
659648082586546176,JO, مش كأنه بكره منصحى موقتين مش اليوم 
659656150137311232,JO,سنين فاتت  وعشرة هانت  وناس على اصولها بانت 
660373447713910784,JO,الروتين الي انا فيه من كثر ما هو متكرر صرت اعرف شو بدو يصير كمان شوي
660400638069743616,JO,ما حد بيعرف يدايقني زي ما انا بدايق حالي
660804302684995584,JO,بقولك احكيلي شو المشكلة وما عليك وبس تحكيله بقولك والله ياخي مشكلة  شكرا بيض الله وجهك
662228424237457408,JO, لو يشغلوني عندهم والحق علي ههههه
662587337424166912,JO, البنت الي بكون هدفها جذب ولفت فصراحة غبية بتكون هههه
666227204808949760,JO, فعلا وماسكينلك بمصطلح انا صريح انو كمبرر
666951058569232384,JO,"ما بدي تعذرني ما بدي ابررلك 
خد عني فكرة سيئة والله معك"
667240087575511040,JO,"اغبى موقف لما تودع شخص وتقوله ياللا مع السلامة 
وتمشو بنفس الاتجاه هون بتبطل تعرف تحكي معاه ولا تعمل حالك ما بتعرفه"
667241318037512192,JO, ههههههههه ما انت ما بتكون عارف طريقة وبتتوكل بتنصدم انه ماشي لسا معك
669855069811163136,JO,"بالأخربتقتنع انونفسيتك صحتك وأحلامك لازم تدافع عنها يوميا ضد النكد والإحباط اللي الناس عايشة فيه
وإلابتصير متل الاغلب عايش بس لانو لازم تعيش"
670909971035504640,JO,"مليآنة الدنيآ نآس حلوة  
بسس احنآ مآ بيجي حظنآ الا مع البهآيم "
670951017333268480,JO,انا بكره مداوم بس انت معطلل   
672770989688770560,JO,في تويتات في التايم لاين حاليا مليانة غبرة
674209057415282688,JO,انا مش حشيش عشان أخلي كل الناس مبسوطه مني
674605824845750272,JO,"غلطت وحكيت قدام امي انو عيوني بوجعوني 
كوت تويت بسيناريو البهدلة"
676379508828672000,JO,من الأشياء اللي تفتن القلب صديق يتخطى كل الجالسين عشان يجلس جنبك
678545299200221184,JO,"ألف شب بيتمناكي   إلا الشب اللي حاطة عينك عليه
ههههههههههه "
678546720561758208,JO,الدنيا حلوه بس الناس اللي نختارهم بقر
682730065235472384,JO,يعني كنت بدبي براس السنة وما قدرت اوصل برج خليفة
687345568717365248,JO,وأنا ببني بمستقبلي انسرق الاسمنت
689024243976253440,JO,"كوت تويت بمشكلتك اذا حد حكالك كلام الحلو 
 ما بتصدقو 
 ما بتعرف ترد"
689753252867502080,JO,"بتعجبني البنت الي ازا سالتيها مالك متدايقة
 بتحكيلك جوعانه هاي الي فاهمة الدنيا صح 
مو الي بترد بحبه وما بحبني حبها قرد هي وياه"
689754448365785088,JO,رح خبي شمسي بعيونك و انتي غفيها  لو مره شرقت من دونك شو بدي فيهآ
689766644923678720,JO,تعريف الدلع عندنا  ما تعرف تطبخ تحب اللون الوردي وتحب النوتيلا وعندها إعاقة بالمشي وشلل بالنطق 
696659133081251840,JO,"كون كتير كتير منيح
رح تندم كتير كتير بعدين "
699527079138873344,JO,"أنا اذا عصبت 
اكسر  اشوت  ارمي اللي في يدي 
بس اذا مسكت الجوال احسه يقولي
آتحداك  
 حبيبي انت غير الناس عندي
انت عندي شي كبيير "
702831427965100032,JO,"من مواهبي اني اعطيك تعابير الحماس بوجهي
وانا مش عارفة شو بتحكي اصلا "
702831788037677056,JO,"النهاية السعيدة الوحيدة اللي أعرفها هي نهاية الإسبوع
الخميسسسسس "
712567103157628928,JO,"بتعجبني الشخصيات إلي بتضل ساكتة ساكتة بس لما بتحكي بتخرس الكل  
بسبقول"
713744083915771904,JO,"بدي أعطي نفسي مهلة هالسنةإما تزبط أيامي وحظي 
وإلا بتشوفوني أصفق بقناة وناسة "
714027798596292608,JO,"لوو الوااحد بدو يعآامل النااس على قدعقلها 
رح يمشي وهوو يوزع بلاالين  ومصااص 
على خلق الله "
728115609293062144,JO,شكرا لكل شخص عمل حاله مش شايفني لما عملت حالي مش شايفته عشان ما النا نفس نسلم ع بعض
728140021304188928,JO,              
729277977763184640,JO,قلو عيونو مش فجأة بينتسواضحكات عيونو ثابتين ما بينقصوا
729546034968469504,JO,"يا رب انا موكله كل اموري الك  اختارلي اللي فيه الخير 
صباحالخير"
731079919191625728,JO,"انا ما عندي اشي اسمه تقدير لعشرتك وسنينك معي
 انا عندي مواقفك معي اما بترفعك عندي او بتنزلك اسفل السافلين"
731185851749814272,JO,نجمه الاسبوع راح تكون حديث الاسبوع
732506688645959680,JO,"طب هاي الشمس اللى بتحرق نافوخنا 
ما بينفع تحرق معاها شوية  
طب شوية   
طب    طب ناس لئيمة أذتنا  
طب اي شي يعني"
732863286379700224,JO,"الشب بس يكون سايق وتيجي اغنية حزينة  
بعلي الصوت قال وبخبط عالستيرنغ وبميل جسمه عالباب  وبعطيهآ بنزين 
قال انهآ اجت عالجرررررررررح "
732865590919073792,JO,"نفسيتي تحتاج على الاقل اركب الطيارة و ارجع انزل
"
732942424583077888,JO,انا احل المشكلة بمشكلة ثانيه  زي البلديه تدفن الحفره تصير مطب
733232452395753472,JO, عيش حياتك بشكل اللي يخلي كل اللي حولك يسألونك أنت ما تحس 
734313707761717248,JO,كل شلة لازم تلاقي فيها حد بيسأل أسئلة غبية على طول 
734314205071966208,JO,في إشي اسمه فن اختيار الايموشن الي بمشي مع الكلام  ما عدا هاد   بيمشي مع اي شي 
734359619552878592,JO,"لمابترمي طفل بالسما بيضحك لأنو عارف إنك رح تمسكو
هيك الثقة بتكون 
مشان هيك خلي دائما عندك ثقةأنو وين ما رماك القدر
رحمة ربك رح تمسكك "
735078260061704192,JO,"لو ما في كلمة  بعين الله  مش عارف كيف بدنا نخلي الشخص الي قدامنا يخلص كلامه
"
735091500179197952,JO,وين المشكله اذا وريتك شي بموبايلي و كان بايدي 
735094491053457408,JO,  كلام دراسه هاي مش من عندي 
737988781790355456,JO,"عارفين الرسالة الي بتيجيك بنص حزنك و بتفرحك و بتخليك مبسوط 
عمرها ما اجتني الصراحة
"
739446664625328128,JO,انا اذا زعلت بالسياره ما بيضل محل ما بقرأ اسمه
1008853757717893248,JO,  انا قتلك اصبر رح بحكي الاسماء من دون الغاز مافي اساءة بعدين ناسي انه هاظ مثل ومزح بينا الاردنية عادي ليش اخذت ع خاطرك يازلمة
1009299524597231616,JO, فعلا ماعاد الها وقت لانه تقلب وقت النوم قلب مزاجنا عالقهوة
1010265955895738368,JO, المشكله انها بتصحصح وبتقلل النوم
1010624163483144192,JO, اصلا مافي نكهة للمونديال من دونهم
1010645510544347136,JO, دائمآ الحب والقى صدفة ودائما هالصدفة بتتعمق فينا
1010647396219531264,JO, بالبداية مع التوافق والهنا رح بكون عظيم بعدين مع الغدر والكذب رح تكرهيه وان شاءلله بتكوني مع الخيار الاول ويبعد عنك الخيار الثاني لانه وقتها مفهوم الحب عندك  رح بروح بمسار مابليق فيه
1010651060334157824,JO, هيك بدك تسمحيلي مشاعرك واحاسسيك مالها علاقة بحب الاهل والاكتفاء يعني بدك تقنعيني انه قلبك رح يدق عشان اهلك والاصدقاء مش معقولة انتي بتحكي عن الحب بتغريداتك وبتناقضي بكومنتات
1010653429163872384,JO, ههههههه شوفي نحنا منتهرب من الحقيقة بالعادة بس ليش يعني الحب حرام ولا عيب بالعكس اصلا يابخت مين بحب هالايام وانا بحاول اشوف ردتت فعلك تجاه مفهومك ونظريتك للحب بس العفو منك لو ازعجتك
1010729874795958400,JO, صحيح كلامك نادر ماحد يفهم الحب الي اغلبنا بدور عليه حب خالي من كل عيب خالي من النقص ويتمتع بالمصداقية والثقة العالية بين الطرفين وان شاءلله ربي بيكتبلك النصيب الافضل سوا بالحب او الزوج الصالح يارب
1010961786919669760,JO, روح شجع معهم بدل ماانت قاعد تتحسر
1010990267938328576,JO, ولا رح تنسي ولا رح تحبي تنسي بالعكس بتذكريها باادق التفاصيل اخ بس على الذكريات سوا حلوة او مو حلوة مابتنتسى
1010994418969731200,JO,"يقول خالد الفيصل  
أتصبر وأقول إني على البعد قاوي والله أعلم بقلب فيه الأشواق حيه "
1012009569646727168,JO, كلهم اكم واحد ولله عندهم كبرياء اكثر من اي بلد
1014400216416612352,JO,"حتى أنا يابو نوره 
 صرت خايف لاتجيني لحظه يذبل فيها قلبي "
1014702745784373248,JO, تعال عالرمثا كل يوم بجيك هزات
1020649915704402048,JO, كوفي المطبخ مافي غيره
1036313818153078784,JO,"  اسمها عثمانية
ولا نفس محمد افندي
ولا ايش"
1036323772255678464,JO,  حتى بتحبي الكتب مثلي
1036749460385280000,JO,  لانه الشخص الثاني طالب قهوة والمراة مامعها سكين عشان تقطع الاكل 
1038404042890899584,JO, حلوة بس مكرره نقصت شوية بهار
1040637833445355648,JO,"لكن كلو ما عم يمنع اشتقلك
ما دام كل سنه في خريف "
1042323343007985664,JO, لما تتعب على اشي من البداية لاتخلي النهاية تروح تعبك من البداية يعني خلي البداية صح حتى النهاية عشان المواطن كل ماارتاح بتطلع من قلبه دعوة تكون خيره للجميع
1043121049787932800,JO,"تجي ونعيد أيامنا لو يوم 
اسطنبول "
1043917137667068032,JO,"صدفة  و في نفس المكان التقينا 
            اللي  جمعنا يوم انا و هي خلان 

مرت  و حار الدمع في ناظرينا 
    انا اسكن انسانه وهي تسكن انسان "
1045805934407290752,JO, غياب الشعور لانه لو غاب الجسد الشعور  قادر يرجعه اما اذا غاب الشعور مابعود ابدا
1054092234533072768,JO,"يارب و انت اقرب من الواحد لقلبه 
وانا اللي في خاطري ماهوب في يديني  "
1054112533274091648,JO,  ولله اتوقعت عجلون بس فيها شوي من السلط
1055852910209318784,JO, شيخ رايت انه اخوي بحكيلي باقي  يوم عن العمره قعدت احسب اي يوم رح يكون برمضان بس قلقان من دوامي مايزبط
1056320234087440384,JO, ولا واحد الحب من طرفين والمشاعر اذا ما كانت بين  ماله لزوم الحب ولا اله لزوم يتسمى حب 
1061057623792013184,JO, الله لايوفق الي حاجزه الله ينتقم منه ويفك اسر الشيخ كرامة لسيدنا محمد يارب
1065695240596668416,JO," وعليكم السلام 
ممكن تفسرلي رؤية 
رايت انه بسوي عجين وكل مره مايزبط معي عجنت ثلاث مرات وماكان يزبط"
1071144481548877824,JO, شيخ ماكملت تفسير لما قتلك احلمت انه اسمعت دقات قلب شخص وسالتني اذا تحب هاذ االشخص جاوبتك اها وماكملت التفسير
1078726657199009792,JO, احلمت انه اسمعت دقات قلب شخص لما مسكت ايده شو تفسيرها
1089701732706340864,JO, عزة النفس وراثة وفراسه
1102308643167449216,JO, تفسير سماع دقات قلب شخص لما مسكت ايده اكثر من مره طلبت تفسيرها
1103745611919253632,JO, تفسير سماع دقات قلب شخص لما مسكت ايده شو تفسيرها
1108072706707214336,JO, تفسير سماع دقات شخص لما مسكت ايده
1115951691923427200,JO, على طريقتي احلى اشي
1116477235026911232,JO, سكر ثمك خليني اعرف اسولف
1119188840500084736,JO,  الرؤيا انه شخص بعرفه مسكت ايده لما مسكتها اسمعت دقات قلبه بتنبض وكان الصوت واضح هيك الرؤيا
1119669281002799232,JO, شيخ احلمت انه الشيخ صالح آل طالب رجع يصلي بالحرم ولما اسمعت بالخبر اتشجعت عشان العمرة برمضان وقلت هسا صار لازم اتشجع للعمرة
1119844255634264064,JO," الرؤيا انه شخص بعرفه مسكت ايده لما مسكتها اسمعت دقات قلبه بتنبض وكان الصوت واضح هيك الرؤيا
فسرلي"
1121005745049341952,JO, هاي رؤيا كاملة انا والشخص جالسين لما قرر يمشي مسكت ايده واسمها دقات قلبه بتنبض وصوت واضح دقات قلب بتنبض
1121904567418011648,JO,منهو غيرك اللي خلا الدنيا دنيا وغير ألوان الحياة وانبت الورد بدروبي وغرد بروحي هواه 
1135774075593330816,JO, يخرب بيتك سكرت الحرم وضاقت فينا وبتدعي باتجاه مين
1138904986002309248,JO," يالزعوب انتو من ايام العزاوي
جاركم من دونه  سيوف صقيلة"
1139908337745715200,JO, شوف هاي عند البدو نسبه قليله صفى اما عنا بتعمل هيك بس مش قبل الفجر ولا كل يوم بتعجن مره بالأسبوع كافي
1140352072489013248,JO, قرف كل النسوان صارن نسخه وحده من وراء التجميل
1141162216223334400,JO, ربي يرحمها ويحسن اليه 
1142004904137043968,JO,  انتو بس خذو من ثقته وايمانه
1142250609241993216,JO, من صفات الثعلب المكر تايحصل على فريسته والباقي عندك الزلمه شغال بسياسه وحده بوحده بسند وبرجع بكسر رجل بكل معنى الكلمه
1143017765500067840,JO, ترى ماخترته اجاكو ملك غصب عن كل الشعب بطلو هبل
1143019254209548416,JO, صورة قديمه عاملين هاشتاق من كل عقولهم 
1144658965890064384,JO, حلمت اني في حقل قمح
1144770070972964864,JO, كم دفعله محمد عشان هالحركة
1144823745179262976,JO, الله ينصرك و تمسح فيهم الارض عشان كل واحد يعرف قيمته
1144824156791410816,JO, قمة الذكاء يعني بطريقته وصل انه بالقمة
1148736188481703936,JO, صح صدفه بعدين مزحه
1148984603455045632,JO, بتتفسقي الميزان كفتين وحده للكيلو وحده للوزن انتي مثل الكيلو
1150055196678131584,JO,تصالح مع نفسك بفنجان قهوة  
1150142532795469824,JO, اذا تقيمك للحب حياة او موت بحب احكيلك انت فاشل بالحب ولا تقدر تحب
1150143177069879168,JO, كأنك شاد كثير من كثر الشد ما بتقدر تعطي حالك فرصه تفكر صح
1150144045102112768,JO, بتعرف انت لو حبيبي وعقليتك هيك بشتكي عليك لحقوق الإنسان مع احترامي الك بس لازم تغير شوي من تفكيرك لانه كثير شديد وتعصب
1150145096488280064,JO, اوووه واو شو نوع قلبك مستعد يموت عشان حبيبته ولابتركها تموت من عصبيته
1150145990147682432,JO,  انا عن نفسي ولا يمكن اتخلى عن الي بحبه هو حقي انا ملكي انا مشاعره وقلبه ملكي ولا ممكن اتخلى مهما حكو عنه اهم اشي اسمع لقلبي مااسمع من الناس شو قيمة القلب اذا ما سمع لقلبه وصدق قلبه القلب بشوف أكثر من العين
1150146757550063616,JO, ربنا لما يختار كل اثنين لبعض بكتب قدرهم من ضمن المكتوب في الحلو والمر وفي اختبارات وفي عسر ويسر وفي كل التجارب  بطريقه حتى ربنا يكرمهم ببعض لازم يمرقو بكل تجارب الحياة لانه احنا بااختبار وليس بسياحه
1150149749028376576,JO,  مافي اشي اسمه انتهى في اشي اسمه عقل الله وهبك اياه عشان تميز الصح من الغلط في اشي اسمه زمن اذا ضاع مابتعوض وفي اشي اسمه فرصه واختيار فيك تعطيك حالك فرصه تتعوض الي راح
1150150000887914368,JO, طيب لو فرضنا خان انت شفت بعينك جاوبني بصراحه
1150151003792171008,JO,  انت بردودك بتحسسني انك بحرب انت متاكد انك حبيت من قلبك
1150154087683563648,JO,"  ياشيخ شو تعبت ما تعبت أنا بحكيلك الحياة تجارب وصعوبات وانت من اول الطريق بتحكي أتعبت وين صبرك 
طيب كيف رح يكون للحب طعم اذا ماكان فيه جنون وحواجز وصعاب كيف رح تحس اله طعم اذا مافهمت طعمه من بعد الصعاب انت اذا اكلت بمطعم من بعد ما اشتغلت بتعبك كيف رح تحس بقيمة تعبك"
1150155197009801216,JO,  الحب ببكي صح بس اذا شخص متمسك فيك وما قادر يبعد عنك لانه اختارك من بين الكل وقدر فيك يشوف الدنيا ويشوف حاله فيك يستاهل التضحيه
1150155829326339968,JO,  الواضح حبيبتك ما بتعرف عن اشي شكلك كتوم ومابتواجهها ولابتناقشها
1150156645865074816,JO,  طيب شو المشكله انت بتحكي باعت شو عملت حتى زعلان عليها هيك
1150157342060818432,JO,  يعني ندمان انك حبيتها وبتستسلم
1150157892919713792,JO,  كم إلها علاقتك معاها كم سنه
1150160549071769600,JO,  كل  بحسو ببعض وبحب بعض وكثير ومشاعرهم صادقه بس الظروف بتكون اقوى منهم
1150161545843957760,JO,"  المهم عشان خاطر الي بينكو وخاطر العشره وخاطر الحب أعطو بعض فرصه ولاتضيعو الحب الي عشتوه نصيحه كرامه لمشاعركم
واتصالحو وبلاش تخسرو بعض وانا عازمكو ع كنافه حلوان المحبه"
1150163410669228032,JO,   ترى هو بحكي انه مابتحبه ليش
1150167757117427584,JO,   مالكو على الزلم شو القصه
1150168532119937024,JO,   وحضرت جنابك ليش تحب بنت مابتحبك وليش بتجاكر فيها بنت مابتحبك شو ناطر منها
1150170743315021824,JO,"   هاظ الحكي الصح يلا كل واحد يجيب لي طبق كنافه ويترك أثر حلو بصفتي كافي بهدلتوها
اطلعت بااشي حلو"
1150173749712498816,JO,   طيب عمر الله يسعدك أنت بطل تحبها وتركها لحبيبها هو بين ايديه جوهرة يابضيعها وبخسر يابحتفظ فيها هو وشطارته هو وعقله لكن الله يكون معاها ويرزقها الحظ الحلو
1150174145302413184,JO,   انتي تستاهلي كل أنواع الحلووو معاها قهوة بعرفك بتحبي قهوة كم احلام عندي
1150175114031484800,JO,"   المهم انت روق وخلي العصبيه ع جنب هههههههههه
كمان نقاش بتصير غير شكل"
1150176043489214464,JO,   لازم ولله شاء فهم بسيط بضيعنا عمر كامل
1150177284327972864,JO,   روح نام انت والمريض اتسلى فيه مش ناقصينك
1150177845941035008,JO,   عندي حبيب مش ناقصني بعدين كلنا بنحب وكل واحد فينا متمسك بحبيبه
1150178326767705984,JO,"   لأنك عارف حالك 
بنت ما بدها اياك وبتحكيلك بكرهك ليش باقي تحبها مش عارف الله يوفقها ويخليه لحبيبها"
1150178742884605952,JO,   ويخليلك الي بتحبها يارب احلى اشي بالحياة الحب ولي ما بحب يعتبر حاله مش عايش
1150179053510549632,JO,"   انت ماعليك كل واحد حر بحاله قلنا تصبح على خير 
وقلنا تسلى بالمريض احنا بدنا انام"
1150378029044129792,JO, ترى اسمه بالقرآن مش بشهادة ميلاد حتى تفكري تغيريه
1151853972405330048,JO, من همالة الرجال وفشلهم بالحياه
1151854152450019200,JO, الله يحفظه ويمد بعمره ويعطيه الصحه والعافيه يارب
1152194327894007808,JO, ان شاء لله ربي بيسعدك
1152335294970118016,JO,حجي وينك اختفيت بس ما يكون صاير معك اشي اتصالحتو 
1152933329316003840,JO, تفسير رؤية شخص يشتري شي وبعد ما يخلص يوقع عقد على ورقة شو يعني
1153346928228425728,JO,  الله يلعنك انتي وأشكالك منافقه
1153348822103461888,JO, ولله تركيا صارت مستهدفة بطلت تعجبكم هسا الكل قالب ضدها لكن ان شاء لله الي رح يكون خلفية العرب اوردغان
1154390130762932224,JO,واو يسلم ايدك على هالصورة 
1154431217212821504,JO," يزم ولله ماانت طبيعي
وراك اشي"
1000011609681661952,JO, بالعكس احيانا السلبيين بكونوا سبب تغيرنا للافضل ودائما السلبي بكون شايف وجهة نظر صح لانه اغلب الناس بدها تعمل حالها شخصيه ايجابيه حتى تخفي الجانب السيء لانه الايجابي احيانا بكون مستسلم للواقع وبسوي فيها إيجابي ومني عارف شو وبكون اكثر واحد سلبي
1000198874949209984,JO,  زينة العقل والحكي المزبوط
1000433502968565760,JO, ان شاءلله دوم الهنا 
1000445435461456000,JO,شوق وشقى وقلة لقى بالله قولي وش بقى 
1000750378361720832,JO," الحب 
لان الصداقة بتنتهي اذا انتهى الحب"
1000852872471433216,JO, ان شاءلله دوم يارب الله يخليكو لبعض دايم بإذن الله
1001959018288607232,JO, عمره مارح يحس فيك الي بتركك من اول مره النيه تكون على طول
1001994511642448000,JO, ولا بتفسرو بتضحكو علينا كل مرة
1002348581754474368,JO, رايت الملك عبدالله ملكنا سلمت عليه وحكيتله انك بتشبه خالي وذكرت شو بيشتغل وشو اسم الشركه شو تفسيره
1002355404154834944,JO," لو كان مقدرلك بالحب خير كان ربنا كتبلك نصيب بهالحب 
الخيرة دايما اختيار ربنا مع الوقت رح تتاكدي"
1003031170676920448,JO, الله يكتبلك ايام احلى مابتتخيلي يارب
1004554692540665984,JO, يزم يسعد دينك ابن العم وان شاءلله الاردن كلها معك والله يوفقك ويرفع قدرك
1008204453202349952,JO,"كنا وكانت حلو الايام تنعد
رحتم وراحت حلو الايام عنا "
1008802534935465984,JO,  اذا كان الواحد بقصد اشي يوصل شو ذنبه اذا الاغلب مافهم
1094677609127051264,JO,انتو متخيلين اليوم الاحد يعني اول الاسبوع احنا 
1094698443585605632,JO, شو ببيع قصدي مين هاد
1094698632668958848,JO, الغلط من المعده اكل الشارع مناعهعه
1095379394389049216,JO,  اصحححابي حبيبه قلبي والله الك احلى عشا باذن الله لو انباعو
1095577883102322816,JO,اوف الله يرحمك يا حبيبي ويهون عقلبي فراقكك 
