id,dialect,text
993642992308313984,BH,"اسهر واجر حسرات وبعيني دمعه 
مشتاق اريد اليوم صوتك اسمعه "
993644603340402816,BH,"قدر الله وصرت لغيري نصيب 
وعظم الله اجر من حبك عمر "
993646255342588032,BH,"إذا ناوي على الفرقا عساك بدنيتك مبسوط 
تذكر أجمل أوقاتي وسولفها على غيري "
993647460831694848,BH,"اشغلتني ماكن بالكون غيرك 
يالله عساك تموت وارتاح منك "
993958605362745216,BH,"متى قلبك متى ممكن يصافح بالوله قلبي 
متى هالبال يتطمن على احساسي وعلى حبي 
ابي هذا الغلا معلن تعبت احب واخبي "
994028471113453568,BH,"ودك إن الغالي اللي داري إنه غالي 
ما يقوم يكرر الغلطات وانت تحبه "
994341631645101952,BH, بتضربونهم لو كالعادة جبناء 
994395832194686976,BH,احجز ليي الشقه اللي على شارعين  
994396430369542016,BH,"الله حسيب الشوق والليل الطويل 
والله حسيب إللي يغيب ولا يحن "
994738192585756800,BH,"فلم كوميدي على طريقة جريمة وغموض في قالب جميل كجمال البطلة 
تقييمي للفلم 

 
"
995123176962183168,BH,"كل فرقى عند الناس تتعدى وتهون 
بس فرقتك تيزاب طاحت بالعيون "
995170364643790848,BH,اذا النكته حدها قويه  
995858900015607808,BH,  حاول تغير نوعيه الجقاره اللي تشربها صاير كلش
995861338349072384,BH, تذكرت نهاية رجل شجاع 
996073944447881216,BH,"مالي على عقل المخاليق سلطـان 
كلن فـراسه عقل يعرف خلاصـه 
درع المبادي يفرق انسان وانسان 
واللي نزع درعه تجيــه الرصاصـه "
996193814057545600,BH,"فلم كوميدي جيد فقط  يحكي معاناة الاب في تنظيم حفل زواج محترم لابنته الباكستاني اللي في الفلم هو افضل ممثل 
تقييمي للفلم 

  
"
996197885782917248,BH,"حداني على الفرقا حظي المقرود 
وانا داري اني بـ اتوفى وانا أحبه "
965860812068999168,BH, فوز عليهم ولك عشا
966211325625012224,BH, فعلا  لو تاخذ مركز كرزكان الصحي كمثال  تشوف فيه الف جنسيه تقول مطار مو مستشفى قريه 
966265669531701248,BH,ثاني اجمل عيون شفتها في حياتي  
966272788368642048,BH," وانا اكتبها اقول في شي غلط 
تسلم استاذ محمد ما مقسوم الي ما مقسوملي"
966274724232925184,BH,"  
بهالمناسبه انسمعكم اياها 
وجستن بيبر وسيلينا قوميز بينخطبون  "
966633900360503168,BH,"هووو ووو ووو 
كلش مو يم القاري 
محد جايب له طاري 

بصوتمحمدعبده"
966638253460816000,BH, ترجمي لينا ويش سويتين فيه بالفرنسي هههههه
966638651571671040,BH, طبعا لو بسالك من هالاديب ما بترد عليي لانها من جيسك 
966968057154494464,BH,"يا مشاعر  اركدي بس اركدي 
القصايد ما تجيب اللي نبيه "
967166357275111424,BH,"يسمونه ثوب نوم
وهو مايخلي به مكان مايروح فيه
وإذا جاء وقت النوم 
فصخة ونام 
هههههههههههههه"
967310173764227200,BH,"طلقني اريد ارتاح والغايب الكم 
بس ابني يبقى ويا ما يبقى عندكم  

ما اطلقكج لو اموت لو مو رغبتج 
اخذ عليج اثنين واخذ غرفتج  

بكل عقلك انت تريد تاخذ واخليك 
شوية نفط عالراس وبموتي ابليك  

بالعكس راح ارتاح حسبالج اهتم 
باخذ عليج اثنين وانتي بجهنم  "
967332083092902016,BH,  بالضضضضضبك وين كزبلانكا اهناك خاس فيها  بس صارت موديرن الحين وما يجونها الا فاشينيستات هههههههههه
967733236049830016,BH,"لو نيوتن كان بدوي يوم طاحت التفاحه
كان قال

طاح قلبي في هوى زين الوصايف 
مثل تفاحتن على الرمضا تطيحي 

وكان الحين لا فيزياء ولا كيمياء
لكن اليهودي يهودي"
968454960718508032,BH,اتوقع بتقولون الصدق والا  
968460593761062784,BH,"ربتني الفرقى  و ضقت و تحملت 
و الحين جيتي يوم جرح الهوى طاب 
 متى نرد أحباب   قالت و انا قلت 
للموت  ما نرجع انا و إنتي أحباب 

معنجج"
968826692247670784,BH,"للود والمعروف ماني بجاحد 
بس اظن الخفوق ما يعشق اثنين 
المحبه لواحد والقلب لواحد 
ما ارضى شريك لي لو فيك قلبين "
968994108843970560,BH,"اه  يا صوتي ويا كثر  الكلام 
وانت يا قلبي من العالم وحيد 
استر دموعك واسترني  ونام 
يعني انسان يتغير  شالجديد "
969394250763984768,BH,"            

الترجمة
 احترق وجهنا ومافي فايدة "
969502992679538816,BH, عندك صديق مسلم  لعنه تلعنك انت وهو 
969503810593984384,BH,"ولما دعوته ما استجيبت  راح وباقها 

انا في كرزكان وما ليي شغل "
969744805810069632,BH,"       

الترجمة
 مجروح اليوم باجر يجي اقوى "
969748639533993984,BH,"قومي تا نمشي سوا و نكمل المشوار 
مجنون بينادي الدرب وينك يا مجنوني "
969889859790934016,BH,جابوا طاريك تبسمك وبكيت 
969903915897704448,BH," وماركيز الحاصل على النوبل ماله رواية  
اللسته الظاهر من جيسك"
970111521824092160,BH,"اذا نامت عيوني للأبد 
عيونك بس لا يبكيها احد "
970273215359660032,BH, هذا اللي ما حسبت حسابه ههههه
970427156982632448,BH,"الحمير انواع  

 الحمار الاليف
 الحمارالوحشي 
 اللي يسوق في السيد اليسار وحالف ما يغير سيده"
970626724722544640,BH,"قمنا نتعالج بالبكي بس الالم يكثر 
من غير احباب القلب عالعيشه ما نقدر "
970651361774882816,BH,انا بطالع الفيديو بس صعب الناس تصدقكم  
970652345779539968,BH,من اجمل الاخبار اللي الواحد يصبح عليها  
970664098026409984,BH," حتى المحجه اكو ذبانه تلحق وراهه 
والحل "
970664311185080448,BH, ومغطيه شعرها وكاشفه رجايلها ههههههههه
970778019152396416,BH, ههههههه عدال يا سلندر الاكسجين
971192594188382208,BH,"شخبار النوم وياكم  هههههههه
"
971197261807054848,BH,  وش المطلوب  يعتزلون اللاعبين  انت وش تبي 
971198485855948800,BH,"واحد يطمنا على ناصر الخليفي بس  
خايف عليه تجيه سكته 
ناصرالخليفي"
971203503304724352,BH, لا مو هيجي يابه ههههههه
971209219813838848,BH,"يا عزيز الروح شنهو ذنبي وياك 
انا الربيتك وتعبت في رباك 
اريد من ربي يا ترف يبلاك 
مثل هالبلوة بابا اللي بيها باليني "
971389719757099008,BH,خلاص له  الناس ما عم بتسدئكوم 
971392723788943360,BH,"تظلم لو تجرح يا زمن 
ما عاد يأثر بيا 
إذا أغلى الناس خانوا 
شتعوض أنت ليا "
971395206087151616,BH,تسلم تسلم جبتها عالجرح  
971559862500020224,BH,"هو مـنيتي وهو سبايب علتي 
يا فجعتي يا فجعتي يا فجعتي "
971752186278563840,BH,"روح روح الله اللي يسامح 
أني ما عندي سماح 
روح روح الملح والزاد خنته 
الوفاء وياك راح "
972605329719681024,BH, حلوه  بس ساعات تصير مليق 
972898147470118784,BH,"   كان يقدر يبسط مصلى ويعزف عليها قيتار 
ندري حلال بس بعد اللبس ليه مكانه ومكانته 
بس ما ندري ويش الرساله اللي بيوصلها الشيخ 
فبناخذه على  محمل "
973294485282029568,BH,"مو كل الصدف تجمع الأحباب 
و كل الصدف دايم عجيبة 

احيانا يكون وراك درزن أجياب 
و مافي قدامك لفه قريبة 

نزار ستراوي "
973619903067549568,BH,"اذا صفالك زمانك عل ياضامي 
اشرب قبل لا يحوس الطين صافيها "
973742429911310336,BH,"هاي تاليها لا ضحكه ولا كلام 
لا تمر يمي ولا تسلم سلام "
973742644605091840,BH, يا رباااااااه  هذا اللي بيرجع الامجاد 
974056058753900416,BH,"لعنبوها شيبت برموش عيني 
دلوعة حسبي على اللي خلفوها 
أنا ابيها وهي تقول انت ما تبيني 
فهموها قبل لا العن ابوها "
974060147080343552,BH,"شفتها بالسوق والعالم خليط 
كنـها الماس في وسط الطقم 
المطوع جاها بينصحها بشريط 
من حلاها داخ واعطاها الرقم "
974063437671256064,BH,"أضيق لي شفتك مع الناس مرتاح 
وارتاح لا ضاقت عليك الوسيعه "
974372480000446464,BH,"يا قطو ياللي منسدح في البراميل 
ما شفت خلي يوم كب الزباله "
974381129594757248,BH,"كرتنت حبك في كراتين وخياش 
والزود عندي حاشره في قواطي "
974477784612470784,BH,"      

الترجمة
 لازم تروح الحمام "
974808685460574208,BH,"بالنت صدق حبيت حبيت بخبال 
تاليها فتحت الكام طلعتلي رجال "
975366383491014784,BH, واخرتها ما بجي النصر 
975500229112926208,BH,احبه واحب كل من يحبه  
975526908317270016,BH,"وحيد ومهتني بالليل 
واسولف لـ السماء عنك 
واذا ظنك أحبك حيل 
ابد خلك على ظنك "
975527556911960064,BH,"مو غريبة 
لو نسى قلبك حبيبه 

وما بقى له إي مكان
واحنا في غير الزمان
فيه لو توفي مصيبة 

صاير الطيب وحيد
وتستغل الناس طيبه "
975750864764854400,BH,"حرامي عصبي دخل على ناس ضربهم وسرق بيتهم وهو طالع شاف واحد نايم قعده وعطاه كف وقاله
عشان لا قمت بكرة ماتهايط وتقول ليتني كنت قاعد ويا ليتني كنت قاعد "
975807779620388864,BH,"حبيبي وكل الله لا تحسبني بليد شعور 
لو انت المستحيل الصعب ما ابدي لك معاذيري 
احبك من هنا حتى طلوع الفجر حتى النور 
صحيح انك قدر محتوم بس أجمل مقاديري 
احد ربي يحطك له حبيب وما يجيه غرور 
انا ليه التفت للناس وعيونك جماهيري "
975808619932540800,BH,"شنهو الجمال ال بيك خبرنا عنه 
شايل جمال الكون شمخلي إلنه "
976108516418179200,BH,الحين نمبي نعرف اسرائيل عدو لو مو عدو  
976111666269245440,BH,"وابي اعرف اذا باقي 
في بحرك موج اكسر فيه مجدافي  "
976273287205539840,BH,كيف أصير النوم وأستوطن عيونه النايمه 
976645505911574400,BH,"ياليتها في يدي واغير ظروفك 
او ليتني ماعرفت الحب بالمره 
العام في كل لحظة اقدر اشوفك 
واليوم ما اقدر اشوفك بالعمر مره 

دينزلبنواشنطن "
976827459881635840,BH,"الحين الجلب يطوف عليك ما يسوي شي  
وانت من يطوف عليك جلب قمت تنابح  

منهو الجلب الحين "
977167619315896448,BH,دكتور يسمونه  عبد الله المقابي  
977406663807438848,BH,اخ لو بس عنده مهاجم صح  
978062593905643648,BH,"في وحدة كاتبة لعمتها
عزيزتي عمتي لاتنصحيني كيف أربي أولادي أنا عايشة مع واحد من اولادك وشايفة تربيتك 

 صاروخ بعيد المدى   

ردت عليها عمتها وقالتلها والله إنك صادقة وكلامك عالجرح اصلا أنا لو ربيته صح ماكان أخذك

 تم تدمير موقع انطلاق الصاروخ بالكامل 

نكتهاخرالليل"
978068222032441216,BH,"عنده رنج روفر  ومشغل اغنية
يلعن ابوك يالفقر 

ياخي العن ابوك انته ههههههههههه"
978274298032021632,BH, جيبها في ابيات تكون اقوى
978276484971409408,BH,بلاوي ههههههه احسن من نفسيات واجد من الناس  
978379920656228352,BH,"اللي مسوي الهاش تاق بسالك  ويش تشيش 

كلالحيواناتاليفهالاالبنات"
978626319423627264,BH," تخيلوا كيف كانت غزة بدون اسرائيل 
مو هيك بتنكتب احلى يا حيوان "
978941918674550784,BH,هذي النفسيات الصح الواحد يحب يقعد وياها  مو انتون حبيته وما حبني جرحته وما جرحني  مالت  
979012664247676800,BH, ههههههه واضح النفسيه تعبانه
980211295185186816,BH, ريحة البترول بعد بلاوي 
980253367258763264,BH,"نام الكلام و ما بقى غير أحبك 
يالله أحبك يا حبيبي على خير "
980254582076071936,BH,"قوطية الاسكريم اللي في الفريزر لا تصدق فيها اسكريم 

كذبةابريل"
980458356660989952,BH, مشكل مشويات صغير من الرفاعين وواحد حمص وواحد متبل 
980570063857225600,BH,"في وحده اسمها زينه راحت عرس علقوها على الطوفه 

نكتهاخرالليل"
980912129367859200,BH, ان تسكت يا شمس 
980913837619675136,BH,"صدمة عمر مرت علي ولا حسبت حسابها 
يالله دخيلك يا ولي مدري وش الي جابها 
دنيا تدور لزعلي صكت فوجهي بابها 
لاقلت هم وينجلي زادت علي اتعابها "
982085058977820800,BH, تفضل كمل شرحك في النقطة عجبتني وادعمها بالامثله 
982272943643348992,BH," سبحن الله تقدر تشوف كل شي  
الا حيونتك ما تشوفها  صح "
982677200754413568,BH,"قبل انه اعرفك زين وزينه امورك
وبعد الزواج شلون وصف شعورك 

رتله وطرش بالذان وجماله عوره
المرته هيج اوصاف شتظن شعوره

طبع العمر ياخوي ساعاته يمشي
عوف الشكل شيفيد الاخلاق اهمشي

هم حقي مثل الناس هم لازم اشتاق
ادري بتوالي اللي ششبق بالاخلاق

تتمه  "
982677429474021376,BH,"والله انت ما تنلام حقك يا مقرود
لو بيه بيك الصار قطعت لخدود

يا خد ويا ثوب ظل ما درعته
ما قمت اطب البيت كلش كرهته

طلقها بالعباس واحسن لك ارتاح 
قط ما سمعت لك شاب ماخذ له تمساح

خلف الله عالتمساح هم يسبح بماي 
ما مر جلدها الماي من مطرت شتاي"
982798564232433664,BH,"يا كيف نامت عيونك وانت واحشني 
وآنا عيوني تعاف النوم لو تزعل "
983069433718628352,BH,هههههههه شلون اقنعها امبي اعرف  
983069933713154048,BH,نفس القصه بس وحده ايرلينديه  شنو اسلوبه بس امبي اعرف  
984308601132081152,BH,"بسمة حلوه منك انته 
غيرت في الحب كياني 
كلمة حلوه منك انته 
حققت لي الاماني 
إنت شايف كنت خايف 
انو غيري جوه قلبك 
وإنت عارف كنت واقف 
انتظر كلمة احبك "
985159297410756608,BH,"ما عندي غير اثنين اتسله بيهن 
حسره وشيشه بليل عايش عليهن "
985931801070891008,BH,"انا وجيبي تلاطمنا وبجينا 

فرشنا الخلق عالقاع وقعدنا 
ليلة فقر هذي الليله عدنا 
حسافه الباق يا خويا بلدنا 
احنا جيوبنا صغار
ما تاخذ الدولار 
ومن ضيم الحراميه انسبينا 

انا وجيبي تلاطمنا وبجينا  "
986282800151236608,BH,"عضت شفايفها وانا جاني المـوت 
تغمز بعين   وزادت  الطيـن  بله 
كن الثنايا ثلج  وتعض في تـــوت 
ومن خدها تقطف من الورد سله "
986411527681998848,BH,فهد اهررررررب  فهد وينه  
986588160003100800,BH, جارنا للحين عايش  حارسه لما يموت وخد عضامته 
986589006015225984,BH, تصبر عليه شوي تاخده بولاده  بعد دينصورات بس ما نشوا 
986647651058827264,BH,ههههههه حشيشه نوعه نادر كولش  
872940414952763392,BH,"مديت له قلبي  وروح وخلاه
الظاهر انه ماعرف وش عطيته"
880713601656532992,BH,ترفق على قلب تلوع بك ولا تاب  
882157677807325184,BH, واضحه مو غاندي  هذي من جيسك 
882886544931123200,BH,العجايب سبع  وثامنها عيونك 
884566337472917504,BH,"فيها شريط علي بحر 
وصورة لبوب مارلي القمر "
885104533143257088,BH, تقدر تقول لينا نص القانون اللي يسمح للحكومة هدم منزل 
887617407866589184,BH,"لا تحرم المشتاق لذة حكاويك 
مايكفي انك مبتعد عن عيونه "
888204132137521152,BH,"اول اسولف لك اذا زارني ضيق 
والبارحه سولفت للـضيق عنك "
888204630164996096,BH,"جيت لك صفحة جديدة 
ودي اسمع لك جديد 

وافلت ايديني من ايده 
وقمت من نومي وحيد 

اكثر أحلامي سعيده 
وإلا انا ماني  سعيد "
888342821211697152,BH," رساله بدون توقيع وبدون صوره للمصاب  
يمكن امك كاتبتنها  شلون بنعرف "
889297484509585408,BH, صاده ساحر اعظم منه 
890413059478609920,BH,"لو رجع عمري  ابرجع ابـتـديـك 
يشهد الله انك أجمل مـاحـصـل "
