id,dialect,text
1099974707321995264,AE, هذا ولا شئ بالنسبه اللي نشوفه ديكورات و ضيافة لمده أسبوع وتصف أغراض البيبي البراندات تعرضها للضيوف اعوذ بالله ناس ماتفكر اللي بتباهي والفشخره وآخر شئ ساحبه سلفيه من البنك ولا كاسره ظهر الريال المسكين عشان فلانه وعلانه سوت وعشان تصور 
1104394546048352384,AE, ما عليك زود يا فتى لندن
1104395610571112448,AE, آه يا لندن  و مالت غلى بو سيف
1106580031910932352,AE, ان شاء الله حاس بالثلاثية بإذن الله
1113698730723750016,AE,   ريحه ايديك عقب الغسول و عليها اثار ريحه آجار الهمبا 
1116618811514347648,AE, كانت السوالف جدا حلوه و بالأخص موضوع الجيم لازم نعيد النظر
1116627698875416576,AE, انا بتغدا هناك اليوم
1116637693171994624,AE, هذا هو الصح لازم اراحه الفريق بالكامل
1116704613875486848,AE,الحين انا متعجب اشلون انا يزتلج  
1121717131584913408,AE, عنصري صدق حرام عليه أطفال شوفوا نظراتهم كسر قلوبهم الله يكسر قلبه  متى تنقرض هالاشكال
1123923749269639168,AE,  ياليت يكون اجازه هذا شهر عباده واليهال مساكين مايتحملون الصيام وقومه الصبح لين الظهر وهم صيام والجو الحار ياليت تتم دراسه الموضوع
1124585413396586368,AE, وأصور الماضي لنفسي وأسليهـا 
1130591317149585408,AE,     علم اخر بطولة لين الحين محتفظ فيه بيرفر ان شاء الله فوق البيت
1134485062186143616,AE, الله يعافيها و يشفيها و يقومها بالسلامة
1134709977912872960,AE, حني إيد اليوم و الايد الثانية باجر
1135792279661273216,AE, كل عام و انته بخير متى اساي الغالي
1139292902050414592,AE, موفج خير ولد عمي الغالي
1140998273316077568,AE,"ماخبرت يجي في الارض حور 
لين شفت الي يحير به النظر
كامل بالزين وافي ما يبور 
ما خلق مثله مع كل البشر"
1146692940040851584,AE,   رايك بو عبدالله من الأفضل
1154814566355914752,AE, الله يأخذهم و يأخذ كضيتهم ملاعين الصير
1158315795266592768,AE, ستي سنتر بيفتح قريب
1162259125499130112,AE, تستاهل الحب نجدية رفيعة الشان عجابه
1163500643270705152,AE,محمدبنزايد الله يحفظه و يبارج في عمره 
1174961680842813440,AE, دائما مميز في طرحك 
1176161152021253888,AE, لأنهم زباله و حكومتهم ازبل منهم
1176501949962870784,AE, عسى عسى الله يسمعك منك يارب
1178238153011945472,AE, سهج العنفوز يشل البيت شل 
925749452685692800,AE, اتحاد فاشل و ما يون الا بتويتر 
926414898405498752,AE, بشتريها عنك في كيمكس
932590369266691968,AE, علم الهند بارك الله فيك
944995788278652800,AE, مبدع ما شاء الله عليك
947482426158321664,AE, تشرفنا بشوفتك اخوي عبدالناصر
948104705280003968,AE, باذن الله تعالى و هذا مب غريبة على جمهور الازيرق الحبيب 
948107290267267200,AE, الأزرق الأزرق كله و لازعلك كابتن 
948793122745667584,AE, الله يلعنه و يلعن نظامة
950060985620008960,AE, كيف يعني تفداه الف بطوله على حساب منو
956504315321049216,AE, الله يزيد و يبارك
970528429585174400,AE, صدمني والله الأكثريه يتوقعون حرمة اللي كانت تغني ذكريات وماضي جميل 
970680843659350016,AE, يمكن والله كل شي جايز في هالوقت 
971299286263779200,AE,"يحفظك ربي  يابوسلطان على سبع الاراضين
انت ذخر لبلاد لا بل عمدها
احنا كلنا لك محبين
مأخذ من ابونا زايد طبع الرشاده
نذخربك على مر السسنين  "
972035236635774976,AE, صلاه السنة يا حمار
973068761665241216,AE, سويتلك منشن و ما طلع ما ادري ليش حمق و طلع
976336181917986816,AE, لاحول ولاقوة الا بالله مش لهدرجة شوه الجراءة اللي فيهن يوصلن للمحاكم  
979107437885247616,AE, اللهم امين و الله ياخذك يا حمار
982025365689372800,AE, هههههههه  مايفهم وين الله حاطه دليم  الصدمه كانتةقوية وضربت  الجي بي اس  عنده
982726340687392768,AE,     ياشمروخ الغدر خليناه لكم ومب فاضي اعد غدراتكم اللي ماتنعد من مكالمات بن جاسم الى مالانهاية  وباحشم نفسي ومب راد عليك اكثر 
982726961788342400,AE,     الشبك الشبك  الله يعز ال خليفة  و تستاهل بلوك ايراني 
982861023077109760,AE, ياليت هالاجازة اللي كانت في شهر ثلاثه اخروها وخلوها لرمضان العيال مساكين يصومون والوقت قيض حر المفروض شهر رمضان تكون اجازه للطلاب
983334623982780416,AE,الله يرحمك يابوي ويطول بعمرج يا أمي  
983763420309807232,AE,"شو هالمقابلة اللي ماخوذ خيرها  مفيش فايدة  

أبوظبيالرياضية"
983966487181451264,AE, لو كانت الخميس أفضل هالسنه الاجازات مخالفة تي في الويكند 
985220168585498624,AE, رتويت تشجيع وننتظر المزيد بوعبدالله
986261395661606784,AE, ايه والله ما دام شهر  احسنت
986315425721077760,AE, كفيت ووقيت  وجهد طيب
986493943541006336,AE, وين المشكله  يتزوج  فوقها و يرجع بيتها
986495659984420864,AE,  الله يعزك ياعبدالله البندر  جعلكم ذخر وسند دوم
987722202543021952,AE,"المنطق يقول الدوري عيناوي  مبروك للزعماء 

 الثالثةعشربتوقيتالزعيم"
989224061514539008,AE, الف مبروك للوصل  عيناوي محب
989247455253487616,AE, مايحتاج يابن نافع  قاتل الله الحسد 
990657339077353600,AE, ساعة قضيتها بدون هاتف متحرك ذكي ايفون   تجربه صعبه وصعب اكررها 
991979574069219200,AE, المشكله انها تتكرر وباذكرك يابوعيسى  كل مباراة جماهيريه كبرى في الامارات تحدث مشكله في تنظيم المباراة خصوصا الجزئية اللي تتعلق بالطرف الاضعف  الجمهور
992047983758921600,AE,  وربي غلطان اللي يسير الملعب 
994417707041874048,AE,  يارب ألطف فيهم الله يشفيهم ويصبر ابوهم
592034993334984704,AE,"من صغرنا ما أثر القول فينا 
نعرف مقام نفوسنا ونحشمها 

من  يعجبه طبعنا   يجينا 
ومنهو  يطب حدودنا يحترمها"
375323714474094592,AE,ربي اكتب للعازبات دبله الماس وفستان ابيض وطرحه ومعرس يفتح النفس وطفل يتربى بعزهم ويسمونه على اسمي   هاه موافقين ولا استغفر
896581084481114112,AE,    العمر كله ياقلبي عقبال  سنه
919644545285001216,AE,  الله يرحمة ويغفرله ويصبر هله
937615779201273984,AE,  ذبحك  الطمع يالخسيس الغدر يمشي في دمكم
955736584472682368,AE, مسكينه مايسوى عليها اللي سوه فيها  ان الله جميل يحب الجمال 
627160559595556864,AE,"انتو شو مسوين في أوروبا
هاذيلا اذا ازعلوا يسوون حرب عالميه 

"
