id,dialect,text
805508926498283520,KW,وين بومشعل لاقلت ياشيخ                     تلفت روس الرياجيل لمجيه                  رفضاحتجاجالعربيوالسالميه
853022383590051840,KW,كل الكويت تحبك الله يرحمك يا الاسطورة ذكريوفاهالمرحومسميرسعيد
857165857541283840,KW,  صعب يتكرر بس شرايك في رضا هاني مو قريب منه
866358146654253056,KW,رغم الظروف يا الاصفر وفشل الادارة والعجز المالي والتشكيلة العشوائية متصدر  القادسيهالكويت
880204672312659968,KW,    عز الله هذا النادر الله يرحمه
920057880706826240,KW,  اسأل الله العظيم رب العرش العظيم ان يشافيه ويعافيه
929791124306256000,KW, هلا بالنوخذه  مبرووك زواجك المستقبلي
938468220716982400,KW,         حاضر ما دريت اللي متأخر وإلا  كان مشاركين بكأس العالم
954837257373999232,KW, انت فخر يا بومجبل
954838936295108608,KW,اجملصورهمنتصويرك 
962469032090796032,KW," تغيرت هذا الشتا
اكثر كلامك بالحنين
جدد حياتك لي متى
لا تسمع اصوات الونين

اي شي"
969641893339586560,KW,كالعادة القادسية يفوز رغم الظروف  القادسيهالكويت
972219425918251008,KW, راح عبدالفتاح العلي  الله يذكره بالخير
984818674489090048,KW, يا سلام شي عجيب
991799406138675200,KW, الله يشافيها ويعافيها ويطول عمرها على الطاعه
993180355275444224,KW,الله يرحمه ويغفرله بوجاسم شالع الباب  محمدمفرجالمسيلم
254638514023575552,KW, الله يستر من عينك يابوفهد عينك والقبر
255021927968673792,KW,هدف ميسي روعه يذكرني في مقصيد
255988344020938752,KW, يجب عليك ان تقول اعزني الله بالاسلام ثم في بني عبس ونعم القبيلة اللي تعتزي فيها
259046517304860672,KW, بولايش شفيك على رونالدو انت اشكره عنصري عشان ميسي حبلاني تحبه وتشجعه
259365830645653504,KW,خايف لبكره يجينه ياخدنا من ليالينا قصه عذاب تاه فيها احباب احباب كتير ابلينا منا خايف خايف
260484954742476800,KW,انا اليوم غير الامس المعزه ضاعت وش بقا ياروحي
260485750330634240,KW,انت ظالم وهذي اطباعك ما اتبدل انا لي وجودي ولي كياني ما اجامل من نساني المعزه ضاعت وش بقا ياروحي
260879649201061888,KW,خن اتوتر بتويتر قبل لا انام
260892122885017600,KW, يا حرام تشجع الهلال تكسر الخاطر ياشيخ راح تحتر وتتحسر هالسنه واجد
261264877857960000,KW, مو شيعة بغداد انت رزيتهم هذول من شيعة ابو الخصيب
262563523899560000,KW, وانا اقول من داس عصعصك
262567611248812032,KW, ادافع عن مربيه الكلاب اكيد لك عصعص
263075852361797632,KW,"  ضميري حي ضميري مات
ضميري مسجون بأمن الدوله
مسلم حر وين ما بات
مسلم حر على وكره"
264002741209288704,KW, ثلثين الولد على خاله
264072587322220512,KW,الوقفه اللي وقفها شباب الكويت مع مسلم البراك هي اللي تخلي الدول العربية تخشى من وجود أي رمز شعبي
264084411178446848,KW,"استانس لما اسمع صوت مسلم البراك 
جعل صوتك ما ينقطع يابوحمود"
264818999488049152,KW, دائما عايشين على الغير
265320623847374848,KW,  يالله شنسوي بعد مثلكم صباح الخير
265322911714385920,KW, مو شرط ينام انت تعرف بوخلي صديق سليمان من سنه  منام
265324337324765184,KW, شرايك انصبح على الحوطي كونه مسافر علاج في الخارج م الساعه نقوله صباح او مساء الخير
265529502241800192,KW,"   اشكرك يا الشفيق 
يعني رفيق"
265531058651529216,KW,    راح اشوف مهاراتك مثلا اذا تعرف تشربكها او تصفر وتصفق بنفس الوقت
265531512500408320,KW,    تبي الصراحه اخوي فهد الحزب ناقصه واحد صوته فيه بحه
265670684292816896,KW,"صباح الخير 
صباح الفل 
صباح النور 
اختر الصباح اللي يناسبك"
265685691474788352,KW,م الساعه بديرة الحوطي
265686537495252992,KW, هذي آخرتها هيلين كيلر يدري اني ما احبه ويعاند يكتب عنه
265687397193371648,KW, بوعلي نبي قصايد وطنيه وسالفه وقصيده مو كله سياسه نبي نستانس م الساعه تبلش القناه
265688240290414592,KW, الله يستر عليك مخك نظيف
265689996403540000,KW, اول اربع اصوات الآن صوت واحد وبينه وبينهم اربع ساعات يعني الساعه نص إلا وحده
265690621472301056,KW, شمعنا فسطاطين ليش ما تقول قسمين او شريحتين او فرقتين ليش التفلسف بوعمر
265692941316677632,KW, كل اطراق بتعلومه تغير المثل كل اطراق بحسابه
265693902122655712,KW, تذبح او تضرب نفس الشئ  دينار اطراق احسن
266345544748789760,KW,   منو مشتهي الحداق اللي عشانه ما شفتوا مانشستر
266691720773791712,KW,"سبحان اللــه

هالفيديو المفروض
يوزع بفلوس شوفوه دامه مجانررررررروووووووعة
"
268232689000271872,KW, يارجال الخيمه جاهزه والمكان ما يحتاج تحطب من قريب
268234241857437696,KW, انت عزم وشيش احمد ومالك شغل بالسوق مريت اشوفك
268247452635779072,KW,  البر حلاته برد تو الناس على الكشته
268248534392926208,KW, صديق قديم في الدوام سابقا بوخلف
268248768405700608,KW,  عذبي فكنا من شرك اذكر الله
268251806046494720,KW,   بالفيحاء تشربون القوة حتى الموت اهم شي القهوه مو صايده
268254243809525760,KW,   بديوانيتكم بس واحد يقدر ياكل القهوه ويشربها ويطير فيها
268417527145701376,KW," الكشته تبي ربع شقرديه 
هذا يحطب وذاك كل شي عليه 

سوالف طيبه وقصايد ورديه 
ربع تنافس من غير نفسيه
بوخلف"
269748828389924864,KW,قالت لزوجها المشغول بالايفون ليتنا مثل الايفون بين يدين ازواجنا ومتعلقين فيهم طول الوقت التفت عليها وقال آمين عشان يصير إصدار جديد كل سنه
269754309674143712,KW,يقولك الكويتي اذا حس انه خسران بالنقاش  يبدي يصيد بدليات
270775847986790400,KW, الجو مال خيمه شراع
271488924797505600,KW,"تعريف  النشبه  هم مجموعه من البشر سهل التعرف عليهم صعب التخلص منهم 

وإذا صرفته يقولك انتظرك عادي"
272944765794914304,KW,"امطري ياغيوم المحبه على ارض الكويت السعيده 
طق يامطر طق 
بيتنا يديد مرزامنه حديد"
273318228472770560,KW, صباحك نور ونوير رغم اني قدساوي
273686403282509824,KW, انا بالصابريه جيب معاك تنكر ماي نبي نغسل الفناجيل
273717978418270208,KW, خلاص بومشاري بوتركي جاب تنكرين ماي واحد للفناجيل والثاني للطبخ
276826630138232832,KW,مو حرام الي يصير في البلد
276827015473160192,KW,خلو وزير الداخليه ينام
276829783881564160,KW,كل يوم مسيره ضغط ضغط ضغط على الخصم لين يجي الهدف وبعدين حافظ على الهدف كارلس البرتو
276833244975087616,KW,"سلميه سلميه الله يكفين شرها من كلمه ودرت دول عربيه 
انتبهوا"
277174180905095200,KW,"سلميه سلميه كلمه شريه 
سلميه سلميه العاده حريه 
علام علينه انعفسنا موليه 
خلاص عديها الكويت بنيه 
اشفيج سلميه اموجه عليه"
280177465995972608,KW,"حسناك ياخالق الخلق ياوالي 
ياممشي الدنيا ياخالق الناس
تحفظ لنا الكويت والبيرق العالي
الاول بالطيب ومرفوعه الراس"
281125994709016576,KW, دشت المربعانيه وما جانه البرد ومنتخبنا طلع من غرب آسيا
282452460986040320,KW, ضحكتني لما قلت ماني قادر استوعب عسكر معارض
282615321771274240,KW,"       
اذا طاح الجمل اكثرت ساينه"
289087326334894080,KW," آكو مثل الكويت 

مستحيل"
304344470227410944,KW,"هذا ميلان اللي نعرفه 
لولا ميلان ما عرفنا ايطاليا"
327506054718033920,KW," قبل السروه
آكو مثل الكويت "
328631219292078080,KW, راح اشوف مشكلتك واحلها شسمه هو كاريك
341098876679360512,KW, واضحه من تصريحهم الاخير عن الدعم الايراني المادي قل ولم ينقطع يبون فلوس ماهمهم اللي الفلوس
346224841185173504,KW,خلاص حسبها قول كمل المباراة وشارك وغير النتيجة لايفوزون ويرجع المجلس الفاشل ويجر البلد الي الفشل
346367184982929408,KW,سنة  اعتزل فيها السير و العود احمد السعدون مقاطع وحسني مبارك مسجون عزاااااااه
348569854074302464,KW, انت حتى كوت بوسته مقاطع فيك خير شارك خايف تخسر ها اقتنعت
349822395495890944,KW,مو معقوله مجلس وزراء مو عارف يصدر قرار مرسوم الدعوة للانتخابات
361723022790504448,KW, صباح الخير ياكويت مثل هالديره ماألقى وين مارحت وجيت على ارض ما أشقى
363152649190768640,KW,  وديه او رسميه مسجله او مباشر او  اعتزال  او مهرجان  شالسالفه علمنا شصار وش جرا
367616181303115776,KW, الله يذكرك بالخير ياحسني مبارك
372403729016033280,KW, شكو مو واضح اللاعب نازل عل الكرة   تذكر اليوحه
374961513146384384,KW,  مو بس الاتحاد الاوروبي حتى الفيفا
375027854729572416,KW, فؤاد الهاشم يبرد البد في الدفاع عن الكويت في مقالاته
375063194638639104,KW, ياسلام عليك على كل رتويت منك
375815705435701248,KW, معروفه مايحتاج شرح دفاع برشلونة ينزل سلايت وريال مدريد ما يوصخ ملابسه ههههه
376008118322606080,KW, صح كلامك  تروح الرياض عند الرجال وبعدين نعتمر
376457460569358400,KW, صورتك قديمة اذكرها قبل الغزو بيوم
381812574108778496,KW,ول ول ول ول 
419709208406528000,KW," تعلمتمنالمطر

كل شي لازاد عن حده انقلب ضده"
420196293990838272,KW, ماشاء الله الصورة روعه وين مصورها
427761443845705728,KW,"  عشان يصير الرئيس المشير  احلى 
مصر باضت"
428199889554509824,KW,  حكم ما يعرف يركظ
428202780931932160,KW,"المباراة خايسه 
خلاص ما نبي الكأس"
447797906800910400,KW,"مبروك برشلونة
آسف دزيتها مبر"
459790160994254848,KW, متى سجل هدف شتعوه جاسم يعقوب
462902371006554112,KW," الوضع في البلد والخلافات مثل هوشة البنغال الكل يطق
المواطن والوطن لك من يحبك"
484104932136472576,KW, صح كلامك برويز مبدع
484434769086644224,KW,"الداخلية سكرت الشوارع اللي تودي الي منزل مسلم البراك 
تحقيق الشوارع تسكرت 
حافظوا على ضميركم"
485159538878730240,KW,السلق اللي بايقه تطلع
485275822412947456,KW," 
اخ مصعب المفروض يحطون ببطاقتك المدنية الشريف مصعب"
485276399918268416,KW," 
الله يحفظك ويكثر من امثالك 
ابي صورتك ابروزها واحطها بالديوانية لانك رمز الشرف والامانة"
487023970705620992,KW, مرض الفري منتشر بالديره روح عالج
487045620457172992,KW, ياشيخ يجوز اعطي الزكاة للخدم اللي في بيوتنا وخاصة اللي يصرف على اكثر من اسرة
544071522940243968,KW, اذا زقارته بيده العسمه ترى ذاب كبير
547322042303799296,KW,"قمنا انتواصل يابوحمد بالواتساب
وإلا بتويتر تسمع اخبارنا كلها
خلاص نسكر الديوان ومانفتح الباب
ما عاد للوصل داعي وادلالنا خلها"
567621513373696000,KW, صهيل الخيل ولا صوت انباح  الروح لا راحت ما لها ردي
579774039721271296,KW,"وين رايح يا بلد الله يحميك
لا تخلينا بدونك ابد ما نعيش 
يا بلد كل شي تغير قلي وش فيك
كل حر في دارك على وكره ماله ريش"
581915771544031232,KW,"يا شيخ هذا زمان كله انعامي 
الذيب جايع وشبعانه حصانيها"
1049206880164352000,KW,"   للعلم الكويتيات اللي ابنائهم مجهولين النسب عيالها ياخذون الجنسية
والمتزوجة زواج شرعي من خليجي او بدون وابنائها شرعيين ماتاخذ ولا شي "
1049252577211297792,KW,   من باب الانصاف اليمن تعطي الجنسية لابناء المواطنه لم يبقى الا اللي ذكرتهم
1049313208144748416,KW,"   على فكره ابناء الكويتي المتزوج غير كويتيه عياله عندهم جنسية امهم

والكويتية اذا تزوجت سعودي او بدون يعتبر غير كويتي بعد مو شرط ايراني وعراقي على قولتك"
1051247676145184768,KW,"  والكويتية المتزوجة غير كويتي مستكثرين عليها قرض 
قرض يعني يرد فلس فلس للحكومة
وياليت لو سددت تقدر تورثه لعيالها

يبيعونه بالمزاد العلني

وفوق هذا مستكثرينه عليها"
1051270203470958592,KW,   الله يستر على الكويت من هالآفه
1051928625228992384,KW," وين اللي يقولون الجنسية تنسب للاب 

هذولا اطباء خذوها على شهادتهم

تتوقعون بالجنسية مكتوب رياض الطبيب او محمد الطبيب

متى تفهمون ان النسب كلش ماله علاقة بموضوع جنسية ابناء الكويتيات

التجنيس قانون وحقوق وليس نسب يكتب بخانة الاسم

مع العلم النسب للام والاب معا وليس حق للاب فقط"
1052642201858125824,KW,"       يبدو انك طفل

عيالنا كبرك على الاقل شويه حيا بالكلام
لكن ان شا الله تكبر وتعقل"
1052642781590638592,KW,"       اوك القانون غير دستوري وغير انساني وين المشكلة 
خلاص نقعد نعبد القانون مع انه مبهذل حياه اسر كاملة عشان سنة  ما اضافوا هذا الحق "
1053352122639630336,KW,"  يعني لما اذكر آيه تفتح المصحف وتعطيني الايه اللي تطلع معاك هههههه

لما ذكرت الايه قصدت ان الانسان مايحذف رأيه فقط
كل راي له حساب عند رب العالمين
ان كان فيه ضرر لاشخاص رب العالمين ياخذ حقهم منك
مع انك غير موجود بالحكومة ولا صناعة القرار
لكن ماخذلك ذنب مجانا"
1091101709156450432,KW,"مرزوقالغانميكشفهم

بغض النظر عن التنابز بين الجميع

اللي يهم الشعب يا بوعلي هو القضايا اللي فيها ظلم ومعاناة

نتمنى ان تكون الحلول لقضية الاخوان البدون منصفة وواقعية

وندعوك انك ماتنسى قضايا ابناء خواتك الكويتيات
تجنيسابناءالكويتيات"
1091103546148355968,KW," للامانة هذا لغز حاولت افكر فيه
ماتوقع تجنيس ناس عندهم اثباتات من اكثر من  و  سنة بيشكلون خطر على الهوية الوطنية 

الرحمة هي باعطاء الحق المنطقي والعقلاني وهو المواطنة في بلدهم اللي انولدوا فيه هم وابائهم واجدادهم البدون"
1091112780139323392,KW,"  الدول الذكية كلما يزيد الشعب الاقتصاد يصير اقوى ويجنسون ناس لا منهم ولا فيهم

بس البدون ناس مظلومين بعيدا عن الفكر الاقتصادي يعني حتى لو مالهم فايدة اقتصادية الجنسية حق من حقوقهم"
1092160080848523264,KW,    لان في نوعيات عندنا للاسف تحسد العطشان على شربه الماي
1093367951837880448,KW," لاتنسى ان الكويتي اللي يتزوج غير كويتية من حق ابنائه يحصلون على جنسية امهم وهذا الشي مطبق في  دولة في العالم من بينهم مصر والمغرب وتونس وغيرهم

هذي مو ازدواجية وخلط جناسي "
1093371960149663616,KW,"  والكويتي اللي يتزوج مصرية ومغربية وحسب قوانين هالبلدان الولد ياخذ جنسية امه  المفروض ما ياخذ جنسية الكويت بعد 

على فكرة  دولة بالعالم تعطي الحق للام بتمرير جنسيتها لعيالها"
1101926136894893952,KW," الحكومة تتزهب تبي تحذفنا الكويتيات المتزوجات بغير كويتي بنص البر ببيوت منخفضة التكاليف كأننا مخيم لاجئين وتبي منهم انصاف يا اخ صلاح

الله يستر علينا بس هذا اللي نقوله "
1107492167277252608,KW,"المرأة ماتبي منكم مساعدات اجتماعية بديرتها
المرأة تبي حقها الاسكاني
وتبي تجنيس ابنائها حالها حال دول العالم "
1107740910803214336,KW,"  الدول اللي بالابيض كلهم يجنسون ابناء المواطنة هذا فقط للعلم

عشان ماتقول هذا معروف
يعني الكويتي اللي يتزوج مصرية او مغربية او اي دول من هالدول عياله ياخذون جنسية امهم "
1107742373688340352,KW,"   غالبية المتزوجات غير كويتي متزوجات بدون او سعوديين عشان ماتغمز وتلمز

بس ماقلتلي عيال الكويتي اللي متزوج مصرية وفلبينية ومغربية مع كامل الاحترام لكل الجنسيات
شفيهم زود عن عيال الكويتية "
1107743353901404160,KW,"    هههههه
نتكلم عن قانون وحقوق مواطنة ويقولي اسكن عند اهلي ويسكن عند اهله
لكن الله يلطف فينا ويكفينا شر خلقه"
1108094335403413632,KW,   شنو الحقوق اللي عندها ومايحصل عليها الرجل 
1108096101587079168,KW,"  اولا منو قالك اني مع او ضد هالقانون
ثانيا هذا القانون للمرأة اللي عندها ابناء
يعني اللي ماعندها ابناء خدمتها مثل الرجل تماما
ثالثا غالبية النساء حاليا يكملون  سنة خدمة حتى مع وجود هالقانون"
1108097480393219968,KW,"   معاش الشؤون للمرة الكبيرة بالسن
ومافي مرة ماتشتغل بهالزمن
وموضوع الجمع بين التقاعد وراتب الاب مو صحيح هذا
غير ملزومة قانونيا لكن فعليا تدفع دم قلبها حق عيالها

خلاصة الكلام تجنيس ابناء الكويتية مافيه سلب حق من احد لان الحكومة اساسا تجنس ابناء الارملة والمطلقة
فشنو تفرق المتزوجة "
1108098556202795008,KW,"   جنسيته عبسي 
اخوي الجنسية قانون حديث بالعالم كله ما صارله  سنة

وعلى موضوع الحديث الله مكثر المواقع الاسلامية واليوتيوب عشان ماتظلم الناس بالكلام"
1108103549014151168,KW,"  شلون حللت ان عيالي عندهم جنسية 
عيالي بدون لكن انا اتكلم مع حقوق الكل
العيب والفشلة مالها شغل
اللي له شغل مشاعر الابناء اللي انولدوا بالكويت وعاشوا بالكويت ودرسوا بالكويت وكلامهم كويتي
بس لما يتعدى  سنة الدولة تقوله اسمحلنا مانبيك دبر عمرك ومالك حقوق في البلد اللي تعتبره وطنك"
1108104616661663616,KW," مو انا اللي اصيغ القوانين
وانا ضد كل انواع التمييز
وبنفس الوقت الدولة من واجبها ترعى الضعيف والمحتاج والمكسور

تجنيس ابناء الكويتيات حق من حقوقهم وحقوق امهم وهم حاليا محرومين منها

ماني شايفة اي علاقة بين قوانين تتعلق بالتأمينات وغيرها من الهيئات مع هالقضية"
1108118042624647168,KW," قانون الجنسية يمنح ابناء الكويتيات الجنسية على فكرة لكنه يشترط الطلاق او الترمل احنا نطالب بحذف هذه الفقرة وجعلها عامة
وعلى فكرة الكويتي اللي يتزوج من الجنسيات اللي تشوفهم بالصورة بالابيض
كلهم يعطون ابناء المواطنة الجنسية يعني عيال الكويتي ياخذون جنسيات امهم بعد "
1108122045936820224,KW,"    لا حول ولا قوة الا بالله
والله شي مضحك اللي صاير

المشكلة علامتنا مايعرف كوعه من بوعه ويفتي في امر العامة 
امرنا لله سبحانه وحده لا شريك له"
1108325333198098432,KW,"   ذلفك الله تكلم مثل الاوادم
انت اللي مناشبهم برزقهم مو العكس عسى الله يقطع رزقك جانك تبي تقطع رزق المساكين
الكويت ديرتهم غصب عليك وعلى امثالك"
1108913033215123584,KW,"  وصلوا  حريم قبل شنو سوو لنا 
ولا شي
لاعطونا حقوقنا بالاسكان
ولا حقوقنا بتجنيس عيالنا
ولا عطوا عيالنا حق تملك بيت امهم بعد وفاتها

الوضع من سيء الى اسوأ"
1109956974232432640,KW,"  والله ياختي معصومة المبارك متزوجة غير كويتي
وصارت نائبة ووزيرة
مع هذا ما كانت بمستوى الطموح

ياليت يجي الشي هالشي من الحكومة بعيد عن تعقيدات المجلس"
1111609527886102400,KW," اغلبهم يسوون نفسهم وطنيين ودافعهم ديني وقومي

وبالواقع حسد وخوف ان رزقهم بيروح وانانية
وبعدها يدورون من رب العالمين البركة "
1111781793294925824,KW," شترجين من شخص يحتقر دور امه واخته بالحياة 

يعني هو همش اللي ولدته وربته تبينه ينصفنا 
مجتمعنا يحتاج سنين من الثقافة للاسف"
1118584053635190784,KW,"اما آن الاوان ان ينجلي الظلم في وطني 
الى متى والناس حقوقهم مهدرة 
الى متى نتعامل مع بعضنا بالحس العنصري ونعتقد اننا احسن من غيرنا 

مو قادرة اتخيل شلون دول اوروبية تجنس الكويتيين البدون اللي عاشوا معانا  سنة وأكثر واحنا مو قادرين نعطيهم الحق بالحياة 
 قانونحقوقالبدون"
1118772666750722048,KW," هذي للامانة قلة حياء
وما ادري شلون ابتدعوها "
1120310122952175616,KW,"  اولا عيالي بدون
ثانيا بعد التعليم اللي تقول عنه شيصير
يتوظف
يتملك بيت بديرته اللي عاش فيها طول عمره
يقدر يفتح مشروع يسجله باسمه
خل كل هالاشياء بيت امه اللي شرته بحلالها عشان يكون عون لعيالها بعد عينها يقدر يورثه
للاسف كل هالاسأله جوابهم لا
بالتاليمن حق الام تجنيس ابنائها"
