id,dialect,text
1051195095121362944,KW, للأمانه ماكو شي ببالي بس أوكي
1051408463736262784,KW,  شخصيتي اليديده اعطي بلوك على طول ف قريبا راح يحوشهم
1051409567308009600,KW,  وايد واثقه من نفسج حبي شكلج راح تكلميني من تلفون صديقه قريبا
1051429242477715584,KW, عيل كل يوم صبحي ب ويهي
1051879377863085952,KW,الحمدلله بديت أصير طالبة جامعية صج والدراسة تمصخرني شكرا
1000472959818064000,KW,"ياللي بدا وصلك معاي يتباخر
لا ترتجي من صاحبك ضحكة حجاج"
1001141545259630592,KW, لما خلصتوا كل الفحم والبخور اللي بالدنيا انتي ولميا 
1001233895105458176,KW, وانتي بخييير حياااتي احبج اكثر شي بالدنيا بعد مستقلة طبعا
1001235353011879936,KW, وانتي بخير قلب قلبي لطوووف
1001236284688470016,KW, وانتي بخير شروفة قلبي
1001237511526592384,KW, ثانكيووووو أنا بعد أحب
1001238176319623168,KW, وانتي بخيييير حصة قلبي أحبج أكثر شي بالدنيااااا
1001238629069541376,KW, انا احبج اكثر من كل شي تخيلي بس
1001243016961589248,KW, وانتي بخيييير صديقة اختي اللي احبها اكثر من كل هندسة
1001427853903388800,KW, مثل ما عقلتي بعقل لا تحاتين بس بالوقت المناسب
1001438528629288960,KW, حبيبتي خالتي وانت بخير
1001555281288056832,KW, وانتي بخير أروى حياتي لوووف يووو اددد الدوونيااا
1001861011920576384,KW,مبوس بيت دانة الذويخ يفووووز
1001871638814654464,KW, الله يخلي كوماري بس
1004920318685859840,KW, أنا أقول نامي أحسن
1004920482972471168,KW, ما اقدر اشوف اخر شي
1005194732169986048,KW, طول عمري ثقيله محد يقدر ينكر هالشي
1007033480230985600,KW,"الا ياليت الدنيا بكل مافيها
تشبه وجه  أبوي  السمح"
1007410093472800768,KW,  بعدين تييلج الحاله تقعدين من النوم معصبه وتطلعين فجأه مالنا خلق
1007410835357159424,KW,  امبيه دانه ذويخ قاعده تعيب عليج بالقروب
1007412491587084416,KW,   ليش حاطه حق اسماء والاء قلب ولطيفه لأ
1007420266715238400,KW, ليش مو عيدكم مبارك  
1007429376852586368,KW, ماراح ننطر سوري مو متريقين من شهر
1007432129469386752,KW, كيفنا متى ما نبي
1008334691328544768,KW, عادي تردين ولهت عليج
1008337013626560384,KW,  والله قام ارد بس شسوي 
1009162483502854016,KW,  خلاص متزعلش اهم شي شاركتوا وانشاءالله تفوزوا على السعودية
1009168473765957632,KW, كلش ولا زعلج عاد
1009169393786544000,KW, زين والله حسبالي نسيتي الضحك
1009178148498534400,KW, درسي عشان ماتنهارين باجر على كويز
1009225178939907968,KW,ليش أقعد هالحزه ما فهمتني
1009546070353989632,KW, للأسف مسويلي بلوك ولا ان تصرفت معاه
1009720251875983360,KW, تعالي الكلية أنا أقول
1009827432604585984,KW, تبي تعبر تصرفوا معاها  
1009867594650869760,KW,             وايد عجيبه كليه حنونه تحسها من قلبك قريبه  كلمات دندن دناو دندن
1009868164887404416,KW,            البوق مو عندنا حبيبتي القائمة الغلط
1009869461153869824,KW,            صحيح صفصف يقولج دانه صايره تنخش وقت الهواش
1009869704628985984,KW,  الوعد يوم السبت نسمعها ونبي
1009869805803974784,KW,            خلي برازي تقولج السالفه راح تنصدمين
1009870116606050432,KW,            لا مو وناسه بسرعه تستسلم وبعدين خشي الهواش اللي فيج ورانا تسجيل نحتاجج
1009872129498771584,KW,             جب جب ولهت عليج
1009872544902647808,KW,             تذكرين يوم كانت وظيفتي اعدل بدلياتج هههههه المهم شوي واوصل فوق
1009886912746835968,KW,تعبت من فرح صج صج تعبت
1009944313885810816,KW, مو شخصيت كلش تحطين ذي
1009944824789729152,KW, أقولج شتسوين بدال الملل
1009945327519100800,KW, اتمنى تغيرينها لي السبت عزيزتي ماتحمل دراما زياده كافي اللي فيني
1010132773233922048,KW, بس ذي أكتب ب تويتر عشان ما يحسدوني وبعدين تعرفين بنت عمرها ما تأخرت
1010623934612627584,KW, نامي لا أصعد ل
1010631222618411008,KW, أقول لا تكثرين ورجعي بسرعه لا أييل تركيا والله
1011147585925599232,KW,  انتي ما تنصادين المشكله
1011621854686179200,KW, محد  دقايق تعالي لا أييلج
1011681451140697984,KW,      عندي صوت لميا ولا صوته ترى
1011682199794483200,KW,      وانتي اخر حبه من الحلويييييين
1011682692079988736,KW,      اكتشفت انه العايلة كلها عندها مشكلة ب حرف ال غ و ق
1011689911337078784,KW, هم نطبع لج نوتات ونوصلهم بيتكم وهم تبين قهوه
1011692341353156608,KW, يقولون انتي بتوصلينهم صج
1011694810078556160,KW, انا اكيد بس انتي توديني
1012101879042596864,KW, الحمدلله على سلامتها ومبروك ماياكم
1012290293763379200,KW,هالإسبوع أكثر اسبوع صار فيه أفلام بس أمس يفوز للأمانه
1013185060932071424,KW,  احلى وحده تسوق انتي
1013718152394493952,KW,  شرح زين بس الدرجات لا
1013773153661804416,KW,يارب نوره الهديه تتخرج لأنه راسي يعورني
993548909585862784,KW, ودي ايي بس اصلا ما ادرس
993574476385341440,KW,  فطومه بلا دراما ما يبي
993920775617961984,KW, شفتي شلون حدي أكسر الخاطر بس ابيها تكون ساكته هذا هدفي الوحيد
993963889279848448,KW, اها يعني ما تنسين تسوين نفسج ناسيه
994292209460699136,KW, اقص ايدي اذا قريتي صفحه
994313362896031616,KW, شنو مسيه اسمي ليش قاصته
994314621283651584,KW, امبيههه شنوووو اسمييي قاااعدهه افكررر
994314789047472000,KW,  اسماء حمدي ربج حاطه اسمج انا شكلها سابتني
994317854601302016,KW,   انتي شنو كاتبه افحميني
994318892972630016,KW,   ما هقيتها من بنيتي
994319903149654016,KW, لا تهدديني ترا اقط كتابج وتعيدين الماده وما تتخرجين
994320075598508032,KW,    شروفه ولهت عليج مادري ليش حسبالي للحين ب مكه
994321547484680192,KW,  ابدا مو متأكده حياتي وتصبحين على خير حسيت اني كثرت
995029777231831040,KW,          انتي المفروض الأخيره يلاااا
995030527878066176,KW,          الله يصبرني عليج بس
995030704605024384,KW,          اريج لو مو صايره حادثة ال ان انتي الأولى ب قلبي بس صار اللي صار
995031160114827264,KW, تسوين لي فلاتر سناب لي الساعة  بليل
995031417552822400,KW, طلعت عينج اصلا م يوم كنت حاقرتج
995031812794667008,KW, راح أرد الثانوي عشان تتعلمين تكتبين عدل حبي
995033470626942976,KW,  شفيكم قلبتوا علي أنا خوش وحده ترى
995033685748539392,KW, صايره حسوس ما اذكر هالاشياء تأثر فيج
995059202254163968,KW,  يعني من كثر ما ضحكت رجعت عععع
995059565568851968,KW, ترى محد يسولف جذي ويع
995060653181362176,KW, فلتر سناب ما يزعل بس ثوب الصلاة يزعل
995419061470269440,KW,ولهت على آلاء وأحمد أكثر من كل شي بالدنياااا
996108941733089152,KW,وإيه معنى الحياة لو مش معاك 
996125498425135232,KW, نعم اعرفج لما تعرفيني عدل تعالي كلميني
996127647053827968,KW, سؤال صعب بحط شخص احبه هالفترة
996134762862530560,KW, شنو اللي مو انا
996871286650482816,KW,  طلعوا من حياتي عالأقل بس برمضان
997593339401854976,KW, رديت حياتي مابي دراما
997598665324851200,KW,  استخدمي الايموجي الصح عشان ما نخسر بعض
997601361779920768,KW,  صايره اكره واتساب كلميني اي مسج
997604780729126784,KW,  حتى صورتج ماتتخيلين شكثر تشوق
998571319989080064,KW,  الظاهر الصيام مأثر عليها مو متعوده اشوفها عصبيه
999809913399410816,KW,   عندي دليل صوره بالاوبن داي
999810865946914816,KW,   قاعده اتخيل متتتت احس انا راح انخش بالرابطة ومصطفى وام دي يساعدونج
999811011791216640,KW,   ترى حصان ما يبي
1034909669565911040,KW," عندك كرش 
مسببالك ثقل بالحركه 
حابب تتخلص منها وتحافظ على صحتك 
الحل عندى وبشكل آمن وطبيعي 
تواصل معى خاص  وحتلاقي الحل  "
1035812882099916800,KW,"  مشاكل السمنه تعبتك 
الكرش والترهلات زادت عندك 
مشاكل القولون والمعده مسببالك قلق 
لقينالك حل آمن وطبيعي حتى تتخلص من  كيلو وأكتر
تواصل معى خاص  حتى افيدك  "
1038767102759497600,KW," بتعانى من السمنه 
كرشك تاعبك
 مشاكل القولون والامساك والمعده دايقوك
 عندنا الحل الآمن والصحي والطبيعي 
تواصل معنا خاص حتى نفيدك بأسرع وقت "
1040695556224569216,KW," نفسك تتخلص من الكرش 
الترهلات تعبتك وحابب تشد جسمك 
القولون تاعبك وبدك ترتاح 


اخسر أكثر من  كيلو بوقت قصير وبشكل طبيعي 
ابعت طولك ووزنك خاص حتى افيدك بالمناسب الك "
1042533177787658240,KW," عندك كرش  عندك ترهلات  وزنك تاعبك  

حابب تخسر أكتر من  كيلو من وزنك بوقت قصير 

بمنتج أمن وطبيعي وصحى 

ابعت وزنك وطولك ع الخاص حتى افيدك بالمناسب الك "
1131706860485128192,KW, الله يبارك فيك بوفواز والفال لعيالك
1134434217847349248,KW,"صح لسان شاعرها 

ياليت لي قدره على فعل ثنتين

ولاهي علي من الأمور الكليفه

تسديد دين اللي يعاني من الدين

وتوظيف ناس ودها بالوظيفه"
1134968909625511936,KW, مبروكين بومشعل والله يبلغك فيها
1135123496055574400,KW,  هذا رقم التسلسل كلش ماله شغل بالتفوق  البنت ما عطوها حقها
1141883213725544448,KW, الشر ما يجيك بوعوض
1142095197658066944,KW, الله يبارك فيك بوشاهين
1142095445981876224,KW, الله يبارك فيك بونايف  والله يسلمك من الشر
1142352175215140864,KW, الله يبارك فيك بومشعل والفال لولدك أن شاءالله
1143264965979246592,KW, يستاهل التكريم  وعلمه غانم مع ربعه
1145322185327878016,KW,   الشر ما يجيك بوجراح
1145335892090990592,KW,  تستاهل الطيب بوصقر  والشر ما يجيك يا الغالي
1150322858914131968,KW,"لاصرت مستانس وعايش حياتك
فلا عليك من العرب وش يقولون 

إكسب رضا والديك وإحفظ صلاتك
مالك ومال الناس صاحي ومجنون"
1150323504820211584,KW,"يا صاحبي ركــز  ف قولي بوصيك
بعطــيك حـــرف وخله يـكون عنــدك

ضـلك وهــــو ضــلك يصـد ويخليك
مــا ينفعك هالـــوقت يــا غيـــر ربك"
1152815908454313984,KW, الله يرده بالسلامة مشافى معافى  ما يشوف شر بوبدر 
1155234348066660352,KW,  كلام طيب ولمزيد من الدعم والتشجيع
1161009708985192448,KW,  ونعم بوسلمان سيف مجرب
1161958223555022848,KW, الله يفك عوقه ويرجع ديرته بين أهله ومحبيه  النادر اللي بالوجود ماله تواصيف  
1163143042330779648,KW,"احذر تجافي أربعة في حياتك
أختك وأخوك ووالدينك ومسكنك

ووصل الرحم خله صفة من صفاتك
وقريبك أسال عنه لو ماسال عنك

وحافظ على مبداك واحفظ صلاتك
اللي نسى ربه ترى عيشته ضنك

والغلطة من العالم أن كان جاتك 
صد وتغافل و المواقف لا تحزنك"
1163727750743678976,KW, مبروك  يستاهل بوعبدالعزيز والله يعينه ويوفقه
1163727924144553984,KW, مبروك  يستاهل بوعبدالله والله يعينه ويوفقه
1163788580134752512,KW, مبروك  تستاهل والله يعينها ويوفقها
1165640920232013824,KW, مبروك  منها للأعلى يستاهل بوعبدالرحمن
1167054260179259392,KW, الفال لك بوصقر وأنت تستاهل أعلى المناصب
1167775773383634944,KW, الله يخليهم لك ويرزقك برهم
1169608471425294336,KW, مبروكين والله يتمم عليهم 
1170430837860524032,KW,  الله يجزاه خير  بس ما كملت مافيه مراقبة بشهادة الدكتور  حمد المطر
1170439012080914432,KW,الدراسة قربت  الله يجزاه خير توزيع مجاني للمحتاجين  
1172044356045475840,KW,"عش يومك الحالي ولو فيه مافيه
واللي ماهو مكتوب ماهوب جايك

كلن من همومه معه مايكفيه
دنياك ماقالت لاحد ويش رايك"
1172187454578802688,KW,"صبرك على الدنيا ولوكنت مهموم
كثر الزعل  ماجاب للنفس راحه
تزعل وترضى والقدر شي محتوم
والعبد يلقى بالتوكل فلاحه
والله كتب للخلق ماكان مقسوم
ماضاقت الدنيا وفيها مساحه
سامح وبايح واترك الحقد واللوم
خلك كريم وفيك عفوا وسماحه"
1173835473816567808,KW,"لاضاق صدرك والهموم أسرفت فيك
وصابك من أوضاعك وحالك كآبه
قم واطلب اللي ساعة الضيق ينجيك
الواحد اللي من دعاه استجابه"
1175500711037145088,KW, مشكور يا أسطورة أنت وأخوانك اللاعبين فرحتونا بالفوز على الغريم التقليدي وخذيتوا الثلاث نقاط  جنكم خذيتوا الدوري
1175689910638063616,KW," مبروكين دكتور والفال لدرع الدوري 
القادسيهوطن"
1177586709623652352,KW,   مبروووكين بوعبدالعزيز والله يتمم عليهم
1178001143798087680,KW, والنعم بونواف  يستاهل والله يوفقه
979389836070137984,KW, برب باكل سيباس مو فاضيه
979708817549164416,KW, انا بعد ولهانه عليج حياتي
979709005055524864,KW, باقي بالرابطه لافندر من ويك وطني روحي اخذيه غيره ماعندي
979737969480425600,KW,"أريج هالفترة صايره معاي 
افهمك لوما تكلمت افهمك  مافي قلبك في عيونك ينرسم
ماتزيل الشك ضحكة مبسمك  يفضحك وجدان واشجان وندم
افهمك لو ما تكلمت افهمك"
979739891885072384,KW," انتي الله يسلمج ما يمثلج هالفتره الا
"
979744366590873600,KW,"  انتي وضعي معاج هالسنه
آه مـنـك منقـهـر  ولا بقى عندي صبـر
لا تبرر لي خطـاك  ما أبي أسمـع عـذر"
979810576753885184,KW," تمثل علاقتنا هالفترة وبقوة
"
979811280134594560,KW,   لملم ماله داعي اشرح لج ليش هالإغنيه 
980025565666271232,KW, امج مشغوله حياتي دقي مره ثانيه ما تعرفين
980026247471386624,KW, مادري شنو يعني عجاج بس لا تخليني اعصب واسويلج اكبر عجاج بالدنيا
980026634093899776,KW, صج عاد لما اعصب تصير عاصفه ويمكن اطيرج ف راضيني
980026884292476800,KW, ما فهمت وبعدين غيري صورتج مااتحمل اتهاوش معاج جذي واعصب
981245300785537024,KW,أريج غير عنكم كلكم وشكرا
981245676213424000,KW, اللي بسناب يبقى بسناب
981245799744114816,KW,  اي ويكند والاوبن داي منو يجابله يدتي
981246006728814592,KW,  اذا جذي بحجزززز معاااكمممم
981246934022270976,KW,   مالج شغل فيها اسوم هذي سوالف قديمه من  مو مهمه
981247217901195264,KW,   احنا ادارية ما نحسب جامعات خاصه سوري
981247540736806784,KW,    اذا تعطينا تان ببلاش اوكي ارضى
981247732915589248,KW,    بس احطه زينه بغرفتي مايمديتي اسوي
981248192284102784,KW,  هذا اكشخ شي عندنا اكتشفت حدنا حرااااام
981248473172463616,KW,  اليوم اريج ودتني افينيوز اليديد صورت مع كل العواميد حسبالي سافرت مو مصدقه طالعه
981249140729548800,KW,   ما ارضى نسافر بدون دانه الذويخ هذي شعلة القائمة 
981250538749776000,KW,    نظمي حياتج انا اقول
981251138564644864,KW,    احبج وانتي فاهمتني دناديش
981251290805231616,KW,     بس طولج ما يسمح تصيرين محرم
981251553779638400,KW,     ابل مو من صالحج تعيبين علي
981251661694988416,KW,     قلبي بنيتي اموووووت عليييج اناااا
981623818170060800,KW, اتفقي مع لملم اخاف تصير هوشه منو يمرني 
981625144937533440,KW,"أمي يا أميرة قلب يا شوق للقلب
والله ما مثل في هالعالم اثنين"
981974386734522368,KW,   كيفها جنى تسوي درامااااا
981978575346823168,KW,   اسرار اذا وديتينا بياخذونج قبلنا تخيلي بس
981978664161116160,KW,   وانتوا حدكم محترين مناا
