id,dialect,text
1147102856224354432,AE, الحمدلله ما تربينا نكون بمكان ونسمع هالرمسة ونتم ساكتين المرة الأخير رمست الريال وقلتله عيب حشم عمرك واليالسين عطاني نظرة انت من وين نازلنا و رد يسب قلت زين ما سبني يدام ولدي بعد
1147422087897899008,AE, همهن الفستان الأبيض عالكوشة بالبداية وعقبها الملحقات تحول الحلم لكابوس الله يقدرني أربي بناتي ويرضون يتزوجن من المليج لبيت ريلها
1147445430889930752,AE, سرتهم من سنة وكان روعة الطعم استغربت ما حاطين الموقع فضفته عالخارطة وحطيت تفاصيله 
1147502136256806784,AE,  كلامه صحيح اللي مرابع شلة معينة مع الوقت بيتقبل أشياء ما كام يتقبلها بالسابق ومع الوقت تتغير المبادئ والقناعات إيجابا أو سلبا
1147731972367818752,AE,  اذا عرف السبب بطل العجب ممكن تخليهم بالبيت يتخبرون من الباقين اذا حد مسلفنها  صارت وياي بالبيت وبالدوام
1147903166920495232,AE,   أختي بارك الله فيج واحد ماسك مشتريات توصل المليار تتوقعين راتبه  ألف وعبالج المواطن اللي عنده هالمسؤولية وعنده الخبرة المطلوبة بيرضى بهالمبلغ الراتب طبيعي جدا
1147945428639518848,AE,  هههههههههههههه حرام عليك تكسر مياديفهم بهالطريقة
1148625798213099648,AE,   موجود عندهم الكثير في  ممكن اذا دورت بتقرأ عنه زرتهم من فترة وانبهرت
1148677757775286400,AE,    الغالي أتفق معك وأنا أتكلم عن ما تم تطبيقه كبراءات تحولت لمشاريع تجارية ملموسة ومربحة
1150126986561544192,AE,  كان يبالك تهزبه وتعطيه درس ما ينساه
1150128334984142848,AE,  اختي الغالية ما تقدرين تعممين شفت بعيني بنات توظفو بالاستقبال وبعد  شهور قالو نبا ترقية ولا حولونا لإدارة ثانية وشردات وحواطة وأبشرج قامت البنية تسير موترها تضرب مدواخ وترد المكتب
1151009787590696960,AE,  صارت وياي قلتله اتصل بالشرطة وأوعدك يعبولك البترول بلاش
1152884766158532608,AE, من سنة بس قطعته مصخوها عاد اشوفه من  سنة ويقولولك توه واصلين نص القصة
1152895828736000000,AE, لااااا تحاول ما برد اشوفه الحين ببجي ماكل الجو
1152901407160381440,AE,    هناك حلول عدة لتحويل هذا الإرهاق على الأجيال اللي بعدها مش من كثرهم اذا ما قارنا بعدد العاملين اليوم مقارنة بالماضي ما ننسى ان لهم فضل كبير باللي نحن فيه من نعمة الزيادة اذا ما كانت مناسبة لمواجهة الغلاء راح تكون عالفاضي المفروض الحد الأدنى عالاقل يكون الضعف
1153258740390473728,AE,  مانع عيالي يرمسون انجليزي بالبيت  لكن المصيبة اللي طلعتلي ان بنتي حصة الله يحفظها عمرها  سنين وما ترمس غير انجليزي من طول يلستها على نتفلكس أرمسها عربي ترد بالانجليزي ليتها يلست على قنواتنا للأطفال العربية ولا تعلمت شي من قنواتنا الاسلامية
1153474591433613312,AE,  حالنا أحسن عن حال جيل التسعينات اللي حاسين ان كل واحد بيصير وزير ولا سفير أما جيل الألفين ضايع من الحين بين المناهج  بالمدرسة وحقوق المثليين في نتفلكس 
1103553779314634752,AE,  مشت وياي لريلها وهزبته تقوله ليتك شرات أخوي وتتعلم منه طبعا الريال الشرار بعيونه وما عرف شو يرد هههههههه قالها والله هو متحديني الأسبوع الماضي يطبق كتاب عليج فرحت زيادة وقالت فديته يحاول يتقرب من خواته وانت شو سويت ههههههه
1103554395164327936,AE,  الزبدة كنت كاتب بالورقة شو النعال اللي لابسته بتفاصيله وتفاصيل الشنطة وتفاصيل اللبس بدقة حتى الأسبوع اللي عقبه أخبرها ان لبسج حلو بس الأسبوع الماضي أحلى كانت متهكمة وقالت على أساس تعرف شو لبست يوم عطيتها تفاصيل التفاصيل انبهرت الكتاب فيه ان المرأة تحب التفاصيل الدقيقة
1103567557653684224,AE,  جرب وما بتندم الحين أم عبدالله بتقرا اللي كاتبه وبتقولي وينك عن هالسوالف ولا بس فالح ويا خواتك قبل ما تعرس ههههه لازم أمسح التغريدات بسرعه
1104285778656575616,AE,  لاحظت ان الموقع شرات سوقكوم عندهم أشياء أضعاف السوق وأشياء أرخص قمت أقارن الفترة الماضية وانصدمت من النصب اللي حتى بكارفور وبالذات الجمعية
1104641414091194368,AE, يعني اذا عندك صداع لاااازم تسير المستشفى الصيدلاني ما يقصر يعطيك بندول اللي قامو يبيعونه بالدكاكين بعد الدكاترة الا من رحم ربي يعطونك كيس أدوية ويشبعونك تحاليل مالها داعي
1104644081387491200,AE, نسأل الله العافية اللهم لا شماتة بس صج يستاهل هو وربعه كلهم
1104645309962092416,AE, والله حسيت بالضيق وأنا أشوف ردود معظمهن لهالدرجة الانحطاط الأخلاقي وصل ببعضهن والباقيات المثالية مقطعتهن لين ما قامن يردن على الدكتورة بكل وقاحة وين تقبل الرأي اللي نسمع عنه
1104778258258845568,AE, شهادات في الاستشارة الأسرية والاجتماعية والنفسية ويطلع منها هالكلام  
1104780216017318016,AE,  أحيد هاييج اللي طلعتلنا وتزاعج أنا مشهوورة
1105482312261738368,AE, دخلت مطعم وسألت أكلكم حلال قام يصارخ بويهي يقول نحن مسلمين أكيد حلال دقيقتين رد عندي وماسك غرشة يسألني رد واين من الغيظ صرخت بويهه نحن مسلمين 
1105484112113086464,AE, عادي كنت مع الوالدة من كم يوم وصارلي اللي تقوله  كل شوي تشوفني وين أشوف حسستني اني مراهق  بس آآآخ
1106868199805673600,AE, لا بأس عليك جبار بإقتدار بس لازم تشرب ماي أكثر حتى تعوض كمية السوائل اللي بتخسرها 
1106933636350312448,AE, ليش ما أقدر أشوف التغريدة حطلنا كابجر
1106934169068847232,AE, أحلى شي انه قاعد يسحب ربعه شوي شوي  كم واحد منهم صامدين بصراحة لا يأيدون ولا يذمون ولا كأنهم طايحين بتويتر وشايفين شي
1107029099464269824,AE, اللي كاتبته في وادي والردود بوادي آخر الله المستعان الله يجعلج من مفاتيح الخير ومغاليق الشر
1107383356646457216,AE,  أبشرك بيت الوالد ما انقفل لله الحمد وبيبانه مشرعة من وعيت عالدنيا
1107502918842892416,AE,  صادق تذكرت الموقف بكيس خبز وأوقات بكيس الزبالة حتى صارت موضة يومها  أهم شي كنت أضارب أبا الكيس اللي من غير شعار البلدية 
1107564293191597952,AE,   سلامي عاللي يرد من فرنسا
1108278158263050240,AE,  لا تجاهر بالمعصية أخوي دايفر تعال عالخاص 
1108814503544872960,AE, أخوي الغالي ما عليك من الدعايات وهالرمسة سؤال واحد نسأله من بداية المشروع لليوم هل ارتفعت كمية المياه بالدولة أو نقصت بشكل حاد ما نبا نعرف عدد المرات اللي تدخلو فيها لحقن الغيوم نبا نعرف نسبة المياه
1109231239884624000,AE,   ضاحي خلفان جزاه الله خير قال كل اللي بخاطرنا وما عندنا شي نزيده 
1109679209151115264,AE,  ههههههه صدقت عيبني التشبيه شايل رجله في جيس زبالة
1110978116216860800,AE, هههههه سويتها مرتين وخبرتهم  الموضوعين كبار ولكن الرد كان لا لا مو معقول وحدة تطلقت بعد شهرين والثانية ماعرف شو صار وياها
1111585153397215232,AE, أول بوسة مفبركة والثانية مفبركة والثالثة بعد صعبة 
1112066851264233600,AE, هههههههه أحس فيك غصة
1112969927873396736,AE,   محد يقدر ينصح وين لأن كل نوع له طريقة ومعظم الطرق يتم يجربونها عالمريض ويشوفون تجاوبه اللي أعرفهم شفوا من المرض أكدولي السبب هو فضل من الله ثم تعديل نمط أكلهم جذريا والمعنويات العالية أكبر مصيبة يوم الواحد ينصحهم بالتوقف عن أي نوع من العلاجات
1113519731192074240,AE," الوالد علاق خيزران ملاس حزام عقال واير تيلفون صحون نعال تيلفون واير مكيف حجرتي حتى تكون عقوبتي الضرب والحرمان من المكيف كاسيت الفيديو هوز الماي
الوالدة القرصة بأعلى الفخذ أو منطقة الإبط  تحط بحلجي شي خايس يسمونه صبار اذا سبيت أو جذبت"
1113550313494069248,AE,  هههههه كان يقولي ليش ما تطلع ويا هالمطاوعة اللي يقولون يخرجون للدعوة  كنت أقوله بسير وياهم وكنت آخذ عيالهم أخليهم يشردون وياي نهيت بالشوارع  أنقذهم من هالخربطان
1113551365425516416,AE,  و يحفظ غاليك أبشرك الصبار الوالدة كانت حاطته بزجاج على شكل قنبلة 
1113664329864364032,AE, ما أعرف حد سواها الا استفاد أنا أسويه كل  سنين تقريبا
1113665644850032640,AE,  من فترة الوالد شاف ولدي غلط فطلب مني معاقبته حضنت ولدي وقلتله ليش اللي سواه غلط فقام اعتذر لاحظت عيون أبوي بتدمع فقالي سامحني كنت كثير أضربكم ضحكت وقلتله والله ولدك هذا اذا ما كنت تضربه كان بيكون مبدع وقدوة بالانحراف فجزاك الله خير عرفت تربيني 
1113734266159021952,AE, انتم مو ويه عزايم
1113838802710216832,AE,  عيل روح الفلبيني واطلب كاجون بحري ولوبستر مشوي و ادعيلي
1113884967434620800,AE,   أتفق معك أخوي فهد مجرد تضليل وتأجيج الرأي العام كثيرين يكملون دراستهم على حسابهم ويدرسون عن بعد
1114125117485928448,AE, يا أخي أحس طاعون يحاول يلقى خرم يدخل منه لمجتمعنا الخليجي بس الحمدلله ردة الفعل تطمن ان الشعب ما زال ثابت على دينه
1114235764353773568,AE, بخبرك سالفة عيل من كم يوم داق علي ريال عمره ما تذكرني يترجاني أتوسط له عند ريال أعرفه يتنازل عن قضية على واحد من جنسية عربية تميت أسحب رمسة لين ما انصدمت ان مجموعة من الشباب يشترون خدمات هالريال يكتبلهم كتب ورسالة الدكتوراة وأعمدة بالجرايد والمصيبة يوم عرفت وين يداومون
1114259805454118784,AE,  انت بالذات لو تبا الحرام كنت عالبراااااد من دوامك صرت ملياردير  
1114416662579687424,AE,   أتفق معك ولكن المصيبة اذا اللي بشتكي عليهم بالمكان اللي المفروض أشتكي فيه  أبسط شي بيقولولي عطنا الدليل وأعرف ناس منهم مسوين أعمارهم بروفيسورية في تويتر وماسكين مركز وما يعرفون شو كاتبين بكتبهم يقولون عفا الله عما سلف يوم فضحوهم على التناقضات اللي بالأساس سببها اللي ذكرته
1114434728231415808,AE,   ياينهم الدور ان شاء الله السرابيين التنويريين فاضحين أعمارهم وما يحتاي نصدع راسنا وياهم والباقين مساكين نحن غررنا فيهم بسؤالنا عن الشهادة قبل الفكر ما أقول غير الله يهدينا ويهديهم
1114765623450578944,AE,  أول شي خطر ببالي ههههههه
1114853835279884416,AE,    هههههه هو هو ما سرتي بعيد وأبشرج ولده يايب العيد بمؤتمر يلقي الكلمة الافتتاحية ويحليله افتشل وفشلنا كلنا أبوه اللي أقصد ما يعرف شو اللي بكتابه
1115872189490827264,AE,  والله انك تسويها الحمدلله ما مسكت دورية ولا فضحتنا
1116080013298810752,AE,      شباب عيب عليكم  ما شفت شي طرشولي الصور اذا عندكم ولا حطوه
1116297192858378240,AE, اوووووه ما كنت أعرف اذا سويت رتويت يبين البوست  يا سلام عليك 
1116646492490669952,AE,  تكا بالروب مع رز واستكانة شاي وادعيلي
1116649011321163776,AE,  الله يبارك فيكم وشكرا على المحاضرة الجميلة اللي استمتعت فيها بس المرة الياية بسير من غير الحرمة أول ما دخلت السيارة ضاربتني تبا فلوس وقالتلي رزقي اللي تكلم عنه الشيخ هذا  عطيتها أكثر عن اللي طلبته أظن بدون ما أقول بتعرفون شو موضوع المحاضرة الياية تكون 
1117118300142678016,AE,  أخوي اللي تقوله مختلف تماما لأننا ما نتكلم الا عن أفكاره وهي واضحة بالعلن بفيديوهاته وبرامج مؤسساته اللي تصادم بشكل كبير فكرنا وعقيدتنا
1119986393353195648,AE,  ياااااااا الله شو هالضحالة بفهم القرآن والسنة والتأليف اللي على كيف كيفك بالتعليقات الله يهديهم ويتجاوز عنهم ويعافينا
1120519952182726784,AE, أخوي الغالي نصيحة من أخوك لا تقارن عن تجربة واحتكاك مباشر بالكثير من الوزراء ومتخذي القرار واللي تحتهم أقولك ان ظروف كل مؤسسة تختلف عن الثانية وتحدياتها ما تكون واضحة لنا متأكد ان الوكيل اللي تتكلم عنه بعد عليه انتقادات أكبر بس يعتمد تاخذ العلوم من منو الله يوفقهم لكل خير
1120547075022884864,AE,  وصلنا لمرحلة نشمئز فيها من هذا التعالي والهمز واللمز الا بهالمواضيع ما بنحسن الظن قسما بالله بس قريت اللي كتبه بدون ما أنتبه انه ممنشن بو فارس فقلت بخاطري لا يكون الحبايب ماخذين لفة وناوين يرمون بو فارس من بعيد الله يرد كيدهم ويعافينا من شرهم
1120555042929631232,AE, صدقني يوم أقولك اللي تشوفه ما له خص بالواقع 
1120674059975581568,AE,   الغالي اللي اجتمعت معاهم كانو ممثلين من مجموعة جهات تشكل فريق العمل يعني اذا فيها واسطة تكون لزيادة الأعباء بدون مردود مادي 
1120729080129818624,AE,   معك في هذا الموضوع أخوي وأتفق معك بشكل كبير بموضوع النقاب اللي ما لقيت أي أمر رسمي يمنعه حسب علمي هي اجتهادات شخصية من بني لبرال اللي كبر راسهم يوم فلان انتقد المنقبات واللي مطلقين لحاهم والباقين اعتبروها من الوطنية تبني الفكر حتى صار من العرف عند موظفينهم
1120730131406913536,AE,   قصدي من السؤال التوضيح ان مسبار الأمل عائده أكبر بكثير من مجرد توفير كم وظيفة هي ثورة في إلهام الأجيال الإماراتية والعربية وفيه دفعة للابتكار والاهتمام بالبحث والتطوير وكسر كل الحواجز لهم أجيالنا بيستفيدون من هالخطوة الجبارة كذلك المبادرات اللي نشوفها بخلق الوزارات
1120884844119064576,AE,  محد بيجاوبك هالتفاصيل الا اذا عليا تداوم بتسهيل 
1121257098535407616,AE, مشروع ضخم واستراتيجي ومتأكد انه يعد شي بسيط مقارنة بحجم مشاريع البلدية اللي متعودين انها تعمل بصمت بعكس المؤسسات الثانية اللي طالعة كل يوم بخبر ومحد يتأكد من مصداقيتها في الإنجاز نتمنى الإستمرار بعرض المشاريع وبالتوفيق ان شاء الله
1121600757529288832,AE, غريبة للحين ناس يتطالعون التلفزيون حتى الوالد ما يفتحه هههههه تذكرت جدي يتابع الأخبار عالتلفزيون
1121619801225383936,AE,  كل الأجانب بالادارات العليا اللي احتكيت وياهم يقولولي المواطن مظلوم بشكل كبير وعكس اللي نسمعه وهو بأشواط أفضل من الجنسيات الأخرى والشواذ للأسف اللي انتم ترفعونهم بالمجاملات
1121621663747952640,AE,  أخوي الغالي التخبط مستفحل والمبادرات اللي تطلع تزيد فرص و وظائف للأجانب أكثر من المواطنين بحجة انها جديدة بندرب فيها المواطن الغلط منا هو السماح بهذا التخبط من يومين كنت بإجتماع لمناقشة مبادرة كنت طاير من الفرح وأنا أشوف مسؤولين  مواطنين يجلدون بالمتحدث ومنعوه من الاستمرار
1121704458331705216,AE,   يالشحي الله يهديك ما تشوف هاييل اللي يعلقون كلهم داشين تويتر من يومين بس عالسالفة هاي ههههههه
1122420100144013184,AE,  أول ما أشوف سلوكيات غلط منه بغض النظر شو هي أقوم أشوف منو ربعه وأبدأ أضيق عليه بطلعاته ويا هالشلة حتى يختار شلة ثانية وأعطيه بدائل بدون ما يحس حتى ما ينفر مني الواحد فينا اذا بغى شي يبدع فيه بقدر حبه لهذا الشئ فما بالكم بعيالنا الضرب أسهل الطرق ولكن له سلبيات أكبر
1122469024426856448,AE,  استغربت من الدعاية اللي مسوينها عالفلم ضيعت  ساعات عالفاضي
1122471191908946048,AE,  انا ساير ويا الحرمة و اثنين من عيالنا  الحرمة قامت تلعب بالتلفون وأنا كل شوي أشوف الساعة أقول معقولة باقي هالكثر مع ان القصة خلصت وكل شوي يطلعون بشي يمط الفلم بنتي قامت تترجاني بعد ساعة ونص نرد البيت ولدي معطنها هالسدحة اللي ما أعرف شاف الفلم ولا كان راقد
1122574653082484736,AE, يوم أموت وربيعي يلوت الصندوق اللي حذاي 
1122940356599980032,AE, معلق بالمكتب شهادة الماجستير من الجامعة الأسترالية واللي من الجامعة الصينية بويهي من أفتح كبتي حتى أتذكر اللي تعلمته بحياتي خلال هالفترة الشهادة مالها قيمة بقدر التجربة
1123110713625649152,AE, الله يبارك في عمره وصحته ويعينج على بره  تخيلت يوم الوالد يشوف المباراة كل أخواني يمشون على أصابعهم حتى ما ينغصبون يشوفون معاه
1123112071082782848,AE,"   حسستونا يايبين شي يديد نرفع شكوى على الازعاج المتكرر بالدعايات تقولولنا من اختصاص الشرطة غاسلينا يدينا منكم
يبالكم
"
1123434766307667968,AE, تستاهل يا عبيد بالبركة 
1123791453996617600,AE,   أخوي محمد الحياء شئ جميل أعتقد مشكلتنا بفهم معنى الخطبة اللي تتضمن فترة للتعارف بضوابط
1123802367391088640,AE,  جرب تاخذ برجر الجبن من مكدونالدز بالمطار وحطه بشنطة الظهر وكله بالطيارة وعيش الجو
1123810045513355264,AE,  انت لو تعرف كيف الحال تغير بفضل من الله بعد ما طلعت الدريول حتى اليهال استانسو من كثر ما قمت أشوفهم وأقضي وقت معاهم وجود الدريول له مساوئ بقدر ما له منافع
1123811738665857024,AE,  انت بنعمة عيل انا اليهال والحرمة كانو كارفينه كل شوي يبونه بشغله يسويها لهم بس باقي ولدي يقوله اشترلي اسكنات من فورتنايت 
1124364484334821376,AE,  تبارك الله من أجمل القراءات اللي سمعتها بحياتي
1124682311382065152,AE,  اسأله أي سؤال من كتابه وبتنصدم انه ما شافه
1124741313079971840,AE, عقبال السبال اللي مشتهي يتروض
1124895196943200384,AE,  للأسف طمع عيال البلاد وعدم احترامهم لحرمة الجار بعد ما يطلعون من بيوتهم هي السبب
1124926709873217536,AE, اجازتك من رصيدك ولا من مخباه
1125728386649939968,AE, بيقولون انها تقية خوفا من بطش الحكام
1125796593435840384,AE,  اللي ماخذه سعره عادي جدا وما شاء الله وزن اللي عندك قريب  كيلو  اذا كان همبه بيكون سعره  درهم
1126052003182989184,AE, الله يبارك فيك وفي علمك أستاذي للأسف تعال فهم اللي يايبنه
1126357815147344000,AE,   اتق الله منو قال انها عملية تجميل الناس اللي يعانون من انحراف يكون وياهم صداع قوي وصعوبة في النوم وغيرها من المشاكل اقرأ اللي كتبته مرة ثانية وشوف منو اللي يحتاي نصيحة
1126363467135557632,AE,  الجمعية أغلى عن اللولو تقريبا  وببعض المنتجات  وأغلى عن كارفور  تقريبا احسب بالسنة كم تدفع وقارن
1126438019286950016,AE,  انت لو تعرف لمنو يشترون بتنصدم
1126580395724738560,AE,   ما بتحصل الخضار بالزراعة المائية والعضوي الاماراتي الا بالجمعية وأسعاره ممتازة
1126588664153350016,AE,  وخلينا بالمرة نتعرف عالمراقص واللي فيها حتى نحذر عيالنا منها مبدأ غريب
1126776323207090176,AE, والله يمكن لو شفته بصفقله وبنقع ضحك المول مصكر وماشي حد حب يستعرض عند ربعه بدون ما يضر حد 
1126829158787690368,AE, اييييه يحليليهم اللي سويناه بأيامنا أضعاف اللي تشوفيه 
1127341816012001152,AE, اذا يبون خبرات بنوعية مختلفة عندنا شباب خريجين قانون من كبرى الجامعات العالمية وعندهم خبرة بمكاتب محاماة خارج الدولة أعتقد ان القضاء من الوظائف اللي المفروض يكون التوطين فيها 
1127939603212787584,AE, بكل بساطة أوديها أحلى مطعم بخاطرها تستاهل
1128531417007304832,AE,"  دخلت حساب اليوتيوب ابداع تبارك الله يمكن الصيام مأثر عليكم ومو قادرين تستوعبون عمق التحليل
"
1128785937092272000,AE, أنا ما همني شو تقول رمسة هل البحرين الله يحفظهم غييير
1128919888951762944,AE, عن تصير الرمسة على حبيبنا  أخوي الغالي دايفر صدقني ما تسوا عليك ضحكنا وخلاص بند الموضوع ولا تسويها 
1128933777047216000,AE,  ما طلعت تعويض من وراه 
