id,dialect,text
1164290731202285568,QA,"سعوديونباخلاقالمزروعي
سلمانكم يالوح كله عذاريب
يسوقكم للموت سوقة نعاجه
ولا تميمالمجد يفخر به الطيب
ماهو مثل منهو حلبه الخواجه
جرحت يدك كذب تبي المعازيب
يصخون يعطونك عظام الدجاجه
العيب من مثلك مايعتبر عيب
لانك تبيع الدين  وتسد حاجه "
1164316726835777536,QA, كفوك الطيب وصح بدانك يالشيخ
1164476001658769408,QA,"تميمالمجد
قاله قايدنا ولاحدد 
ابشروابالعزوالخير
لك الولا دايم يجدد
نقولها من دون تفكير 
عزك ترى عزنا يحدد
ولأمركم حنا طوابير
أضرب وبإذن الله مسدد
ضربة سموك بالعدو غير
خله يجي صاغرويتوجد
يبي يعتذر ولامعه تبرير
تومازانمرماها "
1164581720726876160,QA,"    أسمه  تميمالمجد  نرخص له عيال
وش عاد لوهو تعزوا راعي العليا "
1164607366798761984,QA," ماني بشاعر لكن الحق ينقال
ولاني مطبل كذب قليل حيله
مواقف الطيبين مضرب للأمثال
ولاني بناكر فعلهم والجميله
"
1164613074436931584,QA,  ياخوي يارباح محد بقطر ماله اهل ولا خوال ولا نسايب وقرابه بالسعوديه يعني مسأله التعميم لا تطري ولا نرضاه لا عليكم ولا على انفسنا
1164628182823256064,QA, اللهم لا شماته ياخوي ترى اللي على الحد مغبونين ولا بديهم شي نعرفهم ونتواصل معاهم بس اللي مثل هالخايس مدعوس علباه ويطبل ندعسه زياده اقصد اللي بالفديو
1164628842788602112,QA,  وجهك ابيض يصالح هذي مافيها شكه
1165083899225153536,QA,"اناقطريوأفتخر
تميمعزوةقطر
اول وقالوكلمة مضرب أمثال
وتناقلوها حكمة به عداله
 بالك تعيل ولتراخى لمن عال 
والمرجله بالك ترخي حباله
ادحم لو قبالك رجاجيل وارتال
ترى الطويله تعشق اللي عنى له
عز ورثته بعتني فيه لو مال
الوقت للرديان ولا الحثاله "
1165298510612303872,QA,  هالكلام ينطبق على الحياة بشتى مجالاتها عزالله صدقت يالوايلي
1165373995677564928,QA, ليش ماتضيف اللي يضيفونك يامجننهم 
1165679322516152320,QA, يفداتس الاش يابعد كل عفنه
1165703393907810304,QA,"ادحم بنا يابوحمدوارقى سنود
لأجلك رجال  ماتهاب  المنايا
دون الوطن وأميرنا حنا نذود
نرخص الأرواح ونهديها هدايا
ماهمناالخاين ولا فينا جحود
حبك قطر والله وسط الحنايا
أشر لنا يأمير وتلقانا أسوود
نفترس منهو نوى سودالنوايا
واقول للي غرهم كثر الجنود
حنا عصى موسى وانتم حيايا
فهدالعراك "
1165705409635782912,QA,  عزالله لونكتب دواوين مايكفن ولا نوفي حق قطر و تميمالمجد
1167952301677350912,QA,"يامرحبا باللي همومه مواويل
يمدور عني وانا عنك سالي
بآخر مشاوير السهر والغرابيل
شفني مع اللي ماتركني لحالي
بوح جديد وهمس شعروشذى هيل
هن راس مالي هن اغلى حلالي
انت الوحيد اللي جفى العدل للميل
حتى سقيته مر من بعد حالي
نبي الغلا  ماهي بشقرا مع الخيل
نبيه عز يرفع الراس عالي
بوح"
1167955390903943168,QA," 
هيضت شعري يالبحر طيب القاف
خذ القصيده كامله واعتمدها
هذا تميمالمجد به كل الأوصاف
هاز النوايف والطويله صعدها
خلى عدوه يرتعش يرجف رجاف
ولا ألتفت لأعدادها أو عتدها
حاكم حكيم وياخذ الحق بإنصاف
يوم الشقيقهقام ينبح ولدها
 قطر  الكويت "
1167995572768391168,QA," الله يهداك سناد حكرتها بأز
وان قلتلك ابداع ماني بزيدك
جيتك اجاري يالخوي راكب البنز
واقول عطنا يالسنافي جديدك"
1168000525637279488,QA,  صح لسانك عزالله ماظلمت حظك ويستاهل ابو ضاري وماتوفيه لوتكتب معلقه
1168102844966289408,QA,  مافيه كاش  بعدين اخوي سناد ترى حتى بالقص واللصق فيه ابداع الإختيار
1168175492148731904,QA,"    خذها وانا من روس قوم حشيمين
ولا انت يالمسكين خادم فخامه
وان كان تفهم انت تحلب إلى الحين
فلوس نفطك روحت به حمامه
نصيب بنت ترمب هبشة ملايين
اللي على الحد الجنوبي علامه
واللي نشوفه نصفكم بالزنازين
مسجون راي ومايثمن كلامه
الحزم مامن حزم لكم اربع سنين
وقذايف الحوثي تعدت تهامه 
أسد "
1168238558878031872,QA,    اقول ليته ممرح عند الغنم هاك الليله
1168462003360468992,QA," يشيخ راعي الطيب وبكل جداره
واللي يقول الراي فوق الستاره
واللي يرد المايله عن مساره
ومنهو يعامل ربعه بصدق الإحساس

ردك على العايل ماهي بعيله
وقول الحقيقه مفخره مو فشيله
خص ليا قلته ماتبي اي حصيله
وكل بمكنونه بيحكم على الناس"
1168524746633502720,QA,"انتم كذا مابين راقص وقواد
بلا شرف وبيوتكم للوناسه
قدوتكم المقبور سكير منقاد
اطهركم اللي يدرسون النجاسه
وندري بمعظمكم مروح بطراد
ورى جبل طهران مصقاط راسه
صرتوعلى الأشراف شرطي وجلاد
وعاديتوا الإسلام بحقد وخساسه
علمتكم بالعلم  وان زدتوا نزداد
بالعز والنوماس وفطنه وفراسه
فيروز "
1168537529995407360,QA, صح بدنك يعصابة راسي
1168713498907566080,QA,"لأنه تميمالمجد قال وتزهل
اللي بفعل يمناه نلنا الصداره
ثابت على المبدأ ماعمره يزل
ماتنحذف ياكود زاهي ثماره
خير الحكي ياشيخ ماقل ويدل
الصدق واضح مايبيله اشاره
ابوحمد لا قال كلمه يزلزل
عرش الشبوك مصدرين الدعاره
بالحق يذبحهم ماهويجامل
اهل الردى ومدورين الإثاره
شعارمونديالقطر "
1169219649118134272,QA,"  مقعادنا بالثريا لو يقال اللي يقال
 المركز الأول لنا خل الردي يشبع زعل"
1169388136012689408,QA,علي النعمه  الراغل دا بيتكلم صح كفايه ماشبعتش مت  ارحلياسيسي إرحليياعصابةالعسكر 
1169544577356877824,QA,"بعض البشر لامن حشمته يقدرك
ولا الردي بكثر احترامك تردى
لاتحشم الثاني واحفظ مشاعرك
لاتدمح أخطائه تراه يتعدى
ترى الطبع غلاب لو هو يبادرك
من جاب قول فلان لفلان ودى
لاتجامل الهافي لو اخوك يجبرك
قبل يتعشى فيك انته تغدى
واقعتجربهويقين"
1169933709438570496,QA,"حنا و تميمالمجد بروس المشاريف
مانحترم شرواك خاين بلاده
ندعس على راسك ولانطري الحيف
ونعلمك بالظبط معنى السياده
ياذيل ابن زايد خل السواليف
منت بكفو للمجد ولا للقياده "
1170093440924835840,QA,"انششششهد
 وان تعدى حدودنا في يوم عايل
غرته دنياه وقرب للمنيه
نفدي قطر واميرنا لوقال قايل
كلنا عز وسطر والنار حيه
 كلنا حضر وبدو ولا عوايل
صف واحد صفنا ساعة الهيه
عدونا بيشوف أنواع الهوايل
ونحرمه نومة العين الهنيه
تميمالمجد "
1170295484050812928,QA,"من جدك الأول للوالد حمد
وانتم سلالة مجد عز ومرجله
تاريخكم نوماس شايب مع ولد
يا تميمالمجد  راعي الأوله
زرعكم طيب من يزرع حصد
علم يجمل والكفو مايجهله
فعلكم واضح كونتوا بلد
هذي قطر عزيزة ومجمله
بالتقدم والحضاره تجتهد
من يزوره لازم انه تذهله "
1170297729827987712,QA,"يا تميمالمجد شعبك يرخص أعماره
لأجل عين قائدنا يضحي الواحد بعمره
وشهي حياة الرجل مايحمي دياره
من الدنياتعلمنا وخذينا من الزمن عبره "
1170377184558665728,QA,"يكرم تميمالمجد سقم المعادين
دبك ولدسلمان اكبر اكذوبه
ابو حمد بالطيب ساد الميادين
وانتم بيد ترامب صرتو ا العوبه
خنتوا عروبتكم وبعتوا فلسطين
وايضا على الإسلام خضتوا حروبه
لا عبكم صهيون لعب الوراعين
هنتو  شرفكم والكلاب لعبوبه "
1170479773681889280,QA,"الحلفيالوجبة 
يا تميمالمجد كفيت ووفيت
يوم الصباحي دعى للصلح لبيته
ثابت على المبدأ ياكاسب الصيت
والخاين الخداع  زابن بويته
طعن الظهر شغله وهمه الرتويت
وانت الكفو والمدح غصبا خذيته
ياعزنا يافخرنا ياعذاب الطواغيت
شعبك معك صامل على ماهقيته "
1171473377187393536,QA,"عز ورثته بعتني فيه لو مال
الوقت للرديان ولا الحثاله
ماهمني كلمة من الاش لوقال
القوم واجد وش تبي بالعباله
داري قطرأرخص له الروح والمال
وأنطح كبار القوم لاجا مجاله
والحمد لله مرتكيلي على جبال
ربي وهبني عزوة حي فاله
ولاني بطماع ولا الله بمحتال
على جبيني مولد وارتحاله
فهدالعراك"
1171676177347555328,QA, صح بدنتس اختي هارد
1172720215798497280,QA,"  اولا اللي فالمقطع كلهم من بقيق
ثانيا تناقض واضح في كلامك كيف حريق صغير والماء المستخدم في الإطفاء يغرق بلد "
1173074598998491136,QA,  الكذب مهو غريب عليهم  مليون وسويتهم  
1173108917389406208,QA,"يامطبل لاتنابح مايأثر نبحكم
غدركم واضح تشوفه كل عين
لا تغطي بالمهايط شينكم
افعالكم صارت سواد بالجبين
الخيانه طبع في سلمانكم
اليهودي بالحرم والله يعين
اهل قطر وافين و اشرف منكم
في تميمالمجد والله واثقين
المجد واضح للملا مومثلكم
اللي على الحوثي منتم قادرين "
1173134663247966208,QA,   لا ماي منقع بوزار ريكي
1173311892988846080,QA," احس بعض أحيان انك دوا لي
تطيب كل امراض قلبي بوصالك
كلمة احبك ياوليفي ترى شوي
ماتوصف اللي من ضميري صفالك"
1173349899133444096,QA,"في حقكم والله محنا موفين
مهما كتبنا من القصايد والأشعار
أميرناالوالد  جعل تبطي سنين
يامأسس النهضه ياباني الدار
علمك يجمل وانتشر بالميادين
خيرك مغطي دارنا وكل الأقطار
وقفت مع غزه لأجل المساكين
دعمت راعي الحق بحجةالإعمار
يظل حبك عز وبأرقابنا دين
مايكرهك غير الردي شايل العار "
1173640423023267840,QA,"عزوة تميمالمجد وايضا عضيده
على اسم جده والجمايل حصدها
ماهو غريب العز عن اهل العقيده
اللي مع اهل الحق صادق وعدها
ابن حمد  شيخ المزايا الفريده
علمه يجمل والنوايف صعدها "
1176771842448789504,QA,"ارحلياسيسي
السيسيمخصي  عشان كذا بيبني قصور لإنتصار عشان ترضى عليه  "
1176777070615158784,QA, شكل سعيد مارضى يجي يطبل معهم هههههه 
1176870275155144704,QA,"تميمالمجد 
ادحم بنا يابوحمدوارقى سنود
لأجلك رجال  ماتهاب  المنايا
دون الوطن وأميرنا حنا نذود
نرخص الأرواح نهديها هدايا
ماهمناالخاين ولا فينا جحود
حبك قطر والله وسط الحنايا
أشر لنا يأمير  وتلقانا أسود
نفترس منهو نوى سودالنوايا
واقول للي غرهم كثر الجنود
حنا عصى موسى وانتم حيايا "
1177407489400348672,QA,   يعقب سلمان وكلابه عن الحجلان لقب طيور شلوى اللي وقفو شوكه بحلقه وحلوق جدوده السروق  كلهم
1002219161504878592,QA," كلام سليم  وبس  وين العقول الي تفهم وتعرف الحلال من الحرام 
ناس تفهم وناس عقولهم على قد حجمهم 
وناس تقذف  وتسب  ولا تدري انها محاسبه على كل كلمه تقوله 
بس الهمج عمره يقعد همج مهما وضحت له "
1003148889778741248,QA,"   لا اخوي وين الكذب  في الموضوع اختي مريم ماجابت شي من عندها ولا انت  ماتشوف الا الشي الزين بس  
وش تسمي بقطع الارحام  
وتهجير الابل 
وطرد الملسلمين من بيت الله  
بقى شي ماسووه 
واكبر شي هو طرد المسلمين من بيت الله وهو بيته عشان يطرد خلق الله 
بعد قول كذب  وافتراء خلاص تعودنا"
1007195692098637824,QA,"مباشر
هالسنة صارت أشياء في مكة والمدينة 
أنا وانت كمسلم نستغربها 
ماكنا نشوف هالاشياء في السنين 
الي راحت وان صار وشفنا كنا نشوف 
الجهات المعينة تتخذ اجراء صارم 
مع هالحثالة "
1011292414051483648,QA,"فضايح جديده بعد غيبه طويله 
ياكثر الي راح ينبحون الحين لما يشوفون الفيديو  اقول لكم من الحين مع نفسكم  "
1118923282349215616,QA,"تبقى قطر  في وجه الأنذال
مخطوطه
يصعب عليكم حلها يالسكرجيه
تاريخهاموثق ولاهي بشخبوطه
انشد على خنور تعرف العلم يالديه
ولاأنته علومك شكثر فدبي شرموـه
وش عرفك بعلوم الأجواد والهيه
يوم  معازيبك خلو الميدان وشروطه
متنكرين بلبس الحريم و غشوة  بنيه كاسزايدللانديهالابطال "
1118970524187746432,QA,"عادي تراها يولد فطيم عادي
ماحزت الخاطر طفاس السوايا
مايأثر بسنجار حذف الهوادي
ولا ضيقت بديار نجد القرايا
وان جت لشلفا وضرب الهنادي
تموت ماتلحق لآخر مدايا
تاريخنا معروف في كل وادي
في موقعة خنور تعرف الخبايا
يوم صايحكم  بصوته  ينادي
خليتو الميدان بلبس الصبايا
تميمالمجد 
خنور "
1119052596143120384,QA,  صح بدنك  بيترجم له عجوزالعوجا اللي قرأ الف كتاب
1129429111586328576,QA,"كاسالأمير
قطر 
يا تميمالمجد كفيت ووفيت
نادى على العز داعي وانت لبيته
ثابت على المبدأ ياكاسب الصيت
والخاين الخداع  هادم بويته
طعن الظهر شغله وفنان بالرتويت
وانت الكفو والمدح غصبا خذيته
ياعزنا يافخرنا يا عذابالطواغيت
شعبك معك صامل على ماهقيته "
1129429966008004608,QA, صح بدنك يالعزوه وتستاهل الطيب
1130618802599846016,QA,"تميمالمجد 
وان جت لشلفا وضرب الهنادي
تموت ماتلحق على اخر مدايا
تاريخنا معروف في كل وادي
في موقعة خنور تعرف الخبايا
يوم صايحكم  بصوته  ينادي
خليتو الميدان بلبس الصبايا
حنا بأخو روضه سقم المعادي
كسابت للطيب جزال العطايا "
1132012061033205760,QA, اقول روح كمل نوم يامغيب
1132113624233857024,QA,  وسيميوسففيليوانالمديفر مالك لوا يالوايلي  النعاشه حلمانه حلم وراح يفسر الحلم ولا يتفنش وتنسحب جنسيته ويرجع يشتغل  بدك شسمه  
1132117082169139200,QA,  صح لساااااااااااانك ابدعت يالعزوه
1133123650666864640,QA,"نغردمجددا 
ندمح الزله عفو وللصبر رفعه وقيمه
عند القروم اللي ينومس فعلها
والردي من يفسر صبرنا بأنه هزيمه
ويتطاول على الأجواد ويبخس حقها
ردنا بيجيه ملجم حتى لو كلمه يتيمه
لله در المريخي قد سبقنا وعدها
يوم اللجم القطان اللي اخلاقه عديمه
عند حدك يامسيكين منتبقدها "
1133168571541074048,QA,"الشعبيفديتميمالمجد
يا تميمالمجد شعبك يرخص أعماره
لأجل عين قايدنا يضحي الواحد بعمره
وشهي حياة الرجل مايحمي دياره
من الدنيا تعلمنا وخذينا من الزمن عبره
شنيت لاجل الوطن غاره بأثر 
غاره
ووسمت كبد العدو  بالميسم الجمره "
1133365664280977408,QA, ههههههه اشوف ترامب بعد ماحلبكم بكم صفقه راح يعرض على ايران التفاوض صح نسييت انك مغيب بهالإعلام الواطي اللي يسوقكم سوق مثل مايبي
1133384576607371264,QA,"الشعبيبايعتميمالمجد
يا تميمالمجد يالحر العديم
شعبك الوافي يجدد بيعته
وين نلقى مثلكم حاكم حكيم
فوق الثريا والنجم مكانته
وقفت وقفة عز رديت الخصيم
سموكم يمشي وحاسب خطوته
يابوحمد والله والله والله العظيم
انكم سقم المعادي وطب لعلته "
1133916384663146368,QA,"          شف نظرتة يانظرة الحر العديم
يبي العشى وعلى الفريسه شفقته
القمةالخليجيةالعربية 
عبداللهبنناصرآلثاني "
1134204361431814016,QA, عجوزالعوجا  يبي يصور وعطاه الذيب الأمعط طااااااف هههه
1134207638063976448,QA,           على ايييه يالدلعاااادي ذبانه مصريه يفندم
1135533449119490048,QA,"تميمشعبكيهنيكبميلادك
عاد عيدك ياعسى عمرك مديد
يا تميمالمجد مامثلك احد
حاكم عادل متواضع فريد
يالشهم يالزيزوم ياوافي الوعد
بسياستك ياشيخ هالعالم يشيد
سموكم خليت خصمك يرتعد
حنا معك يأمير ولاعنه نحيد
نرخصلك الروح شايب مع ولد
نقولها ونعيدها ويفهمبليد
لك الولاوالشعب معكم متحد "
1135544855168524416,QA,"يااارجااااااااااااال قل قسم 
شر البلية مايضحك انتم علموهم بالصدق اول وش سبب الإنقطاع يمكن اذا عرفو الحقيقه يطلع فيهم وطنجيه ويقولون مانبي تعويض لأجل  الوطن و الدبالداشر  مع اني أشك في مسألة التنازل عن التعويض ان وجد "
1135545874870866048,QA, ماراح ارد عليك انا بخلي عبودكا  يقولك اللي تعودت اذنك على سماعه  
1135860726160080768,QA," سلمانكم يفلان كله عذاريب
يسوقكم للموت سوقة نعاجه
ولا تميمالمجد يفخر به الطيب
ماهو مثل منهو حلبه الخواجه
جرحت يدك كذب تبي المعازيب
يصخون يعطونك عظم الدجاجه
زابن بهالخندق وتقول انا الذيب
الكلب من يعوي بدون مايواجه
العيب من مثلك مايعتبر عيب
لانك تبيع الدين  وتسد حاجه "
1135895015337660416,QA,  صح بدنتس والله مادريت عنه الهايف انا ردي على الواوي اللي فالمقطع
1135901147749855232,QA,   صح بدنتس اختي هارد ومن العايدين والفايزين
1136031328351268864,QA,   طقعان ابوك واللي خلفوك  يالهطف
1136263230869975040,QA,"مرورسنتينعلىالحصار
سلامي على اللي ماتهاون ولا هون
ثابت على المبدأوشف عدوانه تعاني
تميمالمجد قايدناوالتاريخ له دون 
سطور عز وكرامه يشهد قاصي وداني
لامن نطق بالحق وجوه الغدر تتلون
في كلمتك ياشيخ درس النبل مجاني
حاصرتهم بالسياسه محنك  وتتفنن
وعيشتهم في تخبط يصفق واحد الثاني "
1136303264163618816,QA,"يابعض حكام الخليج المهابيل
الخير مامن خير والشر فيكم
منهو تبعكم مايحصل محاصيل
غير المهانه والسواد يغشيكم 
ماعندكم غير الحكي والتعاليل
وشعوبكم ضاعت وهي ترتجيكم
غزواتكم ماغير رقص ومواويل
استعدلوا قبل المنايا تجيكم
ذكرىحصارقطرالخامسمنيونيو "
1136308805376102400,QA," صمله   هذا المتسابق اخوي طلال يقول كنت اتدرب قبل البطوله جري يومياوكنت اسمع شومي لهوفي البطوله كذا مره أوصل مرحله اجهاداي واحد يكلمني بنسحب
لكن كل مره يطري بيت يقول
ودي له يامزنة عقب المطر ودي لهسلام شعب صادقه نياته ودي له
كان يشجعه انه يواصل وكمل وكسر رقمه اللي العام "
1136315163253051392,QA, صح بدانك  صدقت  ولكن قبل المنايا تجيكم نبرة تهديد 
1137813898768330752,QA,"ادحم بنا يابوحمدوارقى سنود
لأجلك رجال  ماتهاب  المنايا
دون الوطن وأميرنا حنا نذود
نرخص الأرواح نهديها هدايا
ماهمناالخاين ولا فينا جحود
حبك قطر والله وسط الحنايا
أشر لنا يأمير تلقانا أسوود
نفترس منهو نوى سودالنوايا
واقول للي غرهم كثر الجنود
حنا عصى موسى وانتم حيايا
فهد العراك "
1137842184789667840,QA,"  كلب نبح عند الغنم ينطر الشيك
يمكن  معازيبه ماتعشي كلابها
كلامك اللي يشبهك منك وعليك
لا تقرب الداب ومايعضك نابها
يمدور الشرهات ماعاد يمديك
ترامب روح بالخزينه ومابها
شحاذ لكنك بأجنده وتكتيك
ارجع ترب دلال ياصبابها
فهد العراك "
1137846398215495552,QA,    اقول يالحربي شأخبار ثار بنتكم اللي في المجمع التجاري بجده ابن سعود قصوه ولا للحين اللهم لا شماتهلا صرتوا رجال تحمون نسوانكم تكلموا مع الرجال
1137870559751155584,QA,"  احشم لسانك يارعد ولد شلال
ندري ترى جنسيتك بدلوها
وهاللحين لاوالله مانته برجال
ياحيف بالدرهم ذمتك منشنوها
نفسك دنيه مشترينه وبريال
وغديت نعاشه بالنقوط ملكوها
أعرف ترى الطيب يلطم العيال
وشلون عايش لحيتك لعن ابو ها
لا مانعيل ولانتراخى لمن عال 
وأسأل معازيبك ترى جربوها
رعدالشلال"
1138285495535001600,QA,"بندفنايفضحشعراءقطر
 انتم كذا مابين راقص وقواد
بلا شرف  ودياركم  للوناسه
يسوقكم دحلان جاحد ومنقاد
اطهركم اللي يدرسون النجاسه
واطيب شنب فيكم كاذب و جحاد
يخون ميثاقه ويدعي انه سياسه
ندري بمعظمكم مروح بطراد
ورى جبل طهران مصقاط راسه



 عيالالنعاشه  وكلابهم "
1138442440250220416,QA,"خذها وانا من روس قوم حشيمين
ولا انت يالمسكين كلب لعمامه
يارب تفهم انت تحلب إلى الحين
وفلوس نفطك روحت به حمامه
اللي نشوفه نصفكم بالزنازين
مسجون راي ومايثمن كلامه
الحزم مابين لكم اربع سنين
وقذايف الحوثي تعدت تهامه
غاراتكم دايم تصيب المساكين
ولا على الحوثي برد وسلامه
بطحادينك  "
