id,dialect,text
1049741103795240960,KW," يا اخي بديت أشك فيكم
مو قادر امشيها  
يوسف جمال أسامة باسل 
الإخوان من لبنان مو من السكان "
1049916083820515200,KW,"  ابواحمد خل البناخي يغرد على كيفه 
والله اني استمتع بكل حرف وليس كل كلمه يكتبها 
روووووووح دربك أخضر يابوناصر "
1050028397781507968,KW,"   حظووووظ 
حظك يركض قدامك يابوعبداللطيف 
وحنا بس كوابيس 

ما شاء الله تبارك الله عشان ما تقول حسدوني"
1050436305816100864,KW, الخيام لازم لها سبب وورقه ترفع
1051117035135086592,KW," لنفترض السيناريو السيئ أن المملكة هي التي خطفت أو قتلت أو قطعت المواطن السعودي جمالخاشقي 
انت يا كلب انت وإياه شنو حشركم في الموضوع سعودي مع دولته اللي ممكن يزعل جدلا هم الأتراك 
أما حشرات تويتر الثانية ايش حشركم
وبالذات الاخونجية وخلايا عزمي 
لا أبوكم لابو من جمعكم"
1051554826709081984,KW, ما يشوف شر يا ابوفيصل ولا بأس طهور إن شاء الله
1052193913136533632,KW," الأجهزة اللي خبركم تاج رأسك 



بصوت تن اكس اس ماكس 
يخرب بيته اسمه طويل ومعقد"
1052194357111971840,KW, النوت باقي اصدارين وتصير الشاشة بوصه 
1052272016965939200,KW,"أجمل تغريدة
لازم فحص طبي  واضح الصنف مغشوش    "
1052301756108017664,KW,"أعزائي وكلاء وزارة التربية 
ترى الكرسي اللي انت جالس عليه على كف عفريت
سالفة الديباجة و الاسطوانة المشروخه
كلهتماميافندم إنتهت
وما مصير الوكلاء قبلكم عنكم ببعيد
وقد اعذر من انذر  "
1054411721991950336,KW," 
يا كثرهم نوعية سحيةالليل 
بس مهابد"
1055084260896452608,KW," حبيبي قاعدين بالشموس وحب خشوم وترجي وعيونا خايفه من كبسة كأن الواحد حرامي 
وطالبينك ونبي بس هالمره 
وآخر شي تقول لي ما كو  حل  

اررررررحل يابوشبيب "
1063523119791579136,KW,"ترامب شلونك
العصملي طيب بس طال عمرك خاشقجي
ترامب ماعلينا شلون الوضع السوري
العصملي طيب بس خاشقجي خدروه
ترامب درينا بس شخبار الديون عليك
العصملي ملحوقه بس خاشقجي ذبحوه
ترامب ادري بس شخبار الأكراد
العصمليدمرناهم بس خاشقجي قطعوه
ترامب الشرهه مو عليك الشرهه على اللي داق عليك "
1065903758545170432,KW, لباااااااا قلب هالضحكة وراعيهااا 
1066678658256044032,KW," تغريدتك هذه باب رزق ممكن الواحد المحتاج يحصل من وراها  دينار تعويض
باعتبارها إهانة وادعاء باطل وووووالخ 
يالله يا شباب من المطيريين اللي محتاج يرفع عليه قضية 
فاعلخير "
1148829329285156864,KW,من الساعه  وانا ناطر اخلص معاملتي بمحكمة حولي  ماكو موظف  والمكاتب مشكوره  ومراقبه يصرفك والفراش  اهو الكنترول والأمر الناهي 
307241541037076480,KW,"ام فيصل انتي تاج على راسي وافتخر فيج  مع اني ما اعرفج

السفهاء اشكال وانواع"
307909299080945664,KW,"  ليش ما عندي بيت وعمري طليش ك  وزود  
  ليش بدل الايجار  دك  "
308133452266500096,KW," اتوقع بعد شوي 
د عبيد راح يقعد مكان القاضي ويحاكم القاضي والله انك اتعبتهم 
"
308155755155030016,KW,صاجين والله انكم قبادات قويه وصاجه وهذا العشم فيكم يا ابطال يا مانهابون احد حتن الي غزانه  
308332645799034880,KW,محصول الطماطم من الزراعه من غير تربه 
308333316132712448,KW,الفلفل الحار الاخضر والاحمر محصول الزراعه بدون تربه 
308457735551320064,KW," 

الله يوقج وانا معجب باسلوبج والواحد لمن يشوف مشاكل  "
310202332279341056,KW,"  من اجمل الصور اللي راح تسوون لها
رتويت وتشهد لكم يوم القيامه  "
310754600124825600,KW,"  تبون الاجر  انشرو هذي الصوره 

 "
310994984910331904,KW,"الزمديق ياسر الحبيب يطيح حظ المطي مقتدى الصدر 

 

ربي حط حيلهم بينهم خل زنادقه المجوسييين احفاد السشيطان"
311178323785031680,KW,يا جماعه صاير شئ علي حدودنا مع العراق
311373168570933248,KW, محشش رومانسي يقول لزوجته تدرين وش يصير في الدنيا اذا غابت الشمساستحت ونزلت راسها وقالتوش يصير ياحياتي قاليأذن المغرب
311426455194177536,KW," و بعدين اللي ماخذ قرض من  او حتى 

اذا ما سدد الفوائد باقي عليها شويه

تقصون على منو

الناس مو أغبياء"
311426766059229184,KW,"يا اهلي وناسي انتوا كويتين مو عراقبين في فرق    

فهمتوها"
311520518891266048,KW,  بنوته  صغيره   تقطع القلب تبي تسوى عمليه  
312168160453328896,KW,"اذا كنت شيعي وعندك رجوله اسمع هالمقطع و عطني تعليقك 

 "
312601766501949440,KW,"  هل وصلنا لهذي المرحله بالكويت

ام ان الصوره مفبركه "
312912755000766464,KW,وين صايره  القريه التراثيه او كويتي وافتخر
314113496239448064,KW,زهور من الزراعه بدون تربه 
314334494217867264,KW,احمد قاعد يسشور سثشعره عند سيد الحلاق 
314703530164371456,KW,احمدو يتريق بمطعم هندي 
315824693817008128,KW,لاي استشاره بالهيكل الاسود التشطيب التكسيات الديكورات والاصباغ الخ التواصل معي على الوتساب 
316221013010575360,KW,اعمال الجبس والكهرباء المخفيه 
316222376931115008,KW,سلم استيل مع جام 
323810197439131648,KW, عبدالحميد دشتي خوش ديره صدق من قال مامثلها ديره  
330565251684790272,KW,  صورة  مجوسي رافضي يقطع راس سوري حر ويفتخر  
330571281361690624,KW," الزراعة خطة لكويت خضراء 

توكم زايلين حدايق الناس ومكسرينها البلديه وين تبونها خضره"
330572868985438208,KW,"  سأل المذيع الطفل 
أنت حمود ناصر اللي تغني 

اسمع الرد 

علموا وربوا أبنائكم  "
330876741717475328,KW," الفزعه يالربع 

أقسم بالله قفل مخي مع هاللغز 

ـ 

فسيفساء"
331051780332982272,KW, هالصوره قبل خمس دقايق في غرفه ولد الديره 
331630742012583936,KW," لانك طائفي قذر ما راح تأثر فيك هذي الصوره

غردبصورة "
338373649432199168,KW,"والله انتوا معطين حسن نصر الشيطان  اكثر من  حجمه  خلوا ينالح ولد السلق بيته من زجاج وقاعد يحذف حصي ولد الهبله 

الله محي الجيش الحر"
339950253216251904,KW,  ممكن طلبلاتسكر تويتر إلا وأنت مسوي  
342191208686313472,KW,"استعراض جيتي  
جدام الشرطه   

بصراحه هذا الشعب ماله حل كلش

"
342259867412746240,KW,     اتضحكني  ومشكور على اسلوبك
342268608304517120,KW,"  ضربنا ودمرنا ولا عقبها صاحين
على الله  "
342269303497818112,KW,  جثث منهم  صباط إثنين منهم برتية ملازم أول و  
342371804968542208,KW,"  رتويت   خل كل اللي بتويتر يدعي عليه
ويقولون أمين "
342745963795984384,KW, طفل رضيع مصلوخ جلده ورجله محروقه  وبعيونه كلام  
343265988176920576,KW,  اتخسي يا ولد المتعه
343359816552562688,KW,   جب يا ولد المتعه
344208634005295104,KW,   لك انتو حيوانات مو بشر او بالاحرى وحوش عايشه  
344411676034072576,KW,من ابداع قسم الديكور ت  
351162576727580672,KW,  أنا شخص بدونعندي عائله ومحتاج شقهملحق  
