id,dialect,text
1171726258960576512,QA,"نااااس تحب وناااس تنحب 

وانا أقشر فستق "
1171726478624665600,QA, انا احبج  شتبين بعد اكثر 
1171729449001410560,QA,"خلاااني احجي بالمقلوب 

ياااااهوووووه"
1171738674138099712,QA, احسن من يذبحونهم وهم صاحين ع الأقل يحسون نفسهم حلمانين 
1171763871746576384,QA, يا مرحبا شعندك مسوي نيو لوك 
1171862405602795520,QA,"عطيتك قلب لو غيرك خذاه
ماينام الليل من خوفه عليه "
1171867458245976064,QA,"ياطير لا تبطي عن كفوف راعيك
ترا الليالي من عذابه تقهويه

ياطير لوتدري عن احوال مغليك
عفت الحياة وجيت عنده تواسيه"
1171870587351904512,QA,"ماقدر أنساك لو أنك نسيت وسليت 
فاقد الوصل  ماني فاقد الذاكره "
1172038426352394240,QA,"ف عيون سرت من امس ولا عودت 

"
1172038977882329088,QA,"وينهن امهات الحمضيات الحارة ف الصيف 

شنو جوكم "
1172039860519165952,QA, هلا بالمهلي فديت قلبج 
1172057147695423488,QA, خلاص بنتظر العصفور ف الشتا 
1172065993679679488,QA, لما تكتب عدل بعدين بنخليك تجرب 
1172076955002384384,QA, ابي ع الأقل شمعة 
1172077491936251904,QA,  عشان اوزعهم ف الحوش 
1172099272642375680,QA,معاه أمشي ف دربه احب الي يحبه 
1172100534687457280,QA,علي يفرض ميوله و يتشرط بكيفهشسوي حبه أقوى رقبتي رهن سيفه 
1172104090790350848,QA,  أنا ما ادرس بس اسطر 
1172104809299742720,QA,  مافي سفر بنسجلك عندها تدرس صيفي 
1172441791280214016,QA,ا  سـ ى ا ا  ى آ  أ 
1172524808866869248,QA,     يا عمري و حياتي  فديت قلبج و يستاهلون البقايا فديتهم احلى غنادير تويتر 
1172528843820797952,QA,    ليش جي يالعنقا حرامية وحدة اللحين بسرقها منج و بكتب انا كتبتها 
1172529874164178944,QA,"الي بيسرق يسرق عدل 

غيروا ف احرف التغريدة الي بتسرقونها فهمتوا ولا حراميه وحدين "
1172590313048817664,QA,لما يكون طلب الطاولة اللي جنبك احلى  من طلبك 
1172594141131399168,QA,  المفروض يكتبون كل مشروك مبرووك 
1172613355640676352,QA, أي والله خاطرهم يقعدون معانا 
1172621784077746176,QA, سح بس قاعدين يصورونه
1172621977355542528,QA,  تضحكين ليش روينا صورتج
1172803028904218624,QA, كل يوم اعطيكم نسايح بس مافي فايده 
1172819589299879936,QA,  وصباحج ورد و جوري 
1172933409380978688,QA,"أولويات المحبه   فـ البشر فطريه
والوجيه اللي تصنع حبها مكشوفه
      
ضحكة الوجه  البشوش وطيبين النيه 
ماهي بـ مثل الوجيه الودره المعروفه "
1172933618836135936,QA,"تدري الحب شسوو بياااا

جننني لعب بيااااا

يوووووووووه "
1172934526382858240,QA,"عن كل خلق الله معاك أسلى
ومن دونك   أنا أتوه من دونك

وبعيونك أشوف الحيـاة أحلى  
الللللله لا يحرمني من عيونك "
1172935898922663936,QA,"وش حيلة اللي حده الشوق لاقصاه
ساكت ولو قلبه من الاشواق مملي"
1172947045981835264,QA, شنو هالمسخرة  يعتذر حق الحمار  و البني ادم يعتذر حق حيوان بس عشان بريطاني اشتكى عليه امحق قانون عندهم 
1172948001729519616,QA,  هذي اعتقادات عندهم و مثل عادات عندهم اذا انولد ولد يسون له جي و يذوق من البارود
1002810550944845824,QA,مشكلة اذا الواحد سوى نفسه فاهم وقام يتهم الناس ويشكك في وطنيتهم  وعلى فكرة لا انت ولا غيرك له الحق بتخوين الناس  عطني دليلك يوم حطيت حسابي من ضمن القائمة ولا بس تبي تشتهر على حسابنا 
1002813904454635648,QA, صدق عندكم المفتاح زين زين عشان اذا قفلوا عليكم تقدرون تطلعون
1004708334497234944,QA,من اللي أدخلنا العزلة شعبنا شفيه   مالت عليك حتى مالت عليك 
1004709081477570560,QA,اذا في شي مب ناسينه بتكون ثوارتك 
1006052007939960832,QA,  اتمنى لك عام من القهر وانت تشوفنا من انجاز لإنجاز وعسى ماتجيك سكته قبل  عشان تشوف افتتاحنا وتزيد قهر
1008739033881640960,QA, وليش ماكتبت عريضة ضد بلادك اللي تعاقدت مع  عشان تنقل لكم المباريات ولا وظيفتك ذبانة لتحريض السعوديين
1008794813481639936,QA,حشى زهيوية وذبان  مب شعب  
1008795276578938752,QA, ظل كل اللي ضللتهم بيمشي وراك لين يوم الدين يالدجال
1008795633900085248,QA, اصحاب السماء والاودية محشومين لكن اصحاب عقول السراديب أشكالك مالهم دوا
1010436475974873216,QA, انزين ياسوسن ماعلقتي عن براءة علي بن سلمان اللي طلعت بلاعيمج وانتي تنابحين ان مجرم ومتعاون مع قطر
1011570393197531136,QA,  مب كفو تسكره واكو كل يوم يفتح ويسكر ومافي حد يدشه ويشتري عود ماينوبه الا الابجار اللي يدفعه غصبن ورى خشمه
1016552258006331392,QA, اللي عمره ماتبخر  تبخر واحترق
1016554557298630784,QA, على فكرة ترى المعلم موظف في الدولة حاله حال موظفين باقي الوزارات والهيئات وشي طبيعي ان الوزارة تحط قراراتها الحين مع نهاية العام الأكاديمي عشان يمديهم يقرون القرارات ويطبقونها يوم يرجعون من الإجازة  بس مشكلة بعض الناس ان لهم نظرة سوداوية ويحبون ان كل العالم تشوف بنفس طريقتهم
1018011691005693952,QA, قصدج يكرهون شعبكم بس ماينلامون من اللي تسونه في بلادهم من يستحملكم انتو  سنين واحنا نروح تركيا وعمرهم ماتعرضو لنا بكلمة بالعكس تتعاملين مع اتراك أريح من التعامل مع عربي عايش بتركيا
1018719253623496832,QA,  يمدحج يقولج يالمنسورية يعني عندج قوة النسور  اما هو  ديايه 
1018724456179486848,QA, مايبونك توصخ بيتهم  يخافون تدش وماترضى تطلع
1018837707357749248,QA,   الله يعينك شكلك تعبت وانت تدور بديل لكتارا قطر  واللي مايطول العنب 
1018838508302024832,QA,  عوافي واحنا كلنا عندكم درابيل ماتحلى الا بالمباركية بعد وجبة دسمة من داري حمد  الله يخلصكم من هالاشكال مثل ما افتكينا منهم  وشعبهم المحترم حياهم الله  عندنا وعندكم
1018839583834832768,QA,   ذحين  معليه يصير خير  الغباء وراثي عندكم
1021649693174976384,QA, زين اخيرا لبسوه عدل المهرج ولا واللي وراه شاده حيلها شكلهم دافعين لها زيادة 
1021992171493367808,QA,  عجل الإماراتيين اللي موجودين عندنا الحين شتصنفهم حضرتك
1021995944928272384,QA,كل اللي عرفتهم مثلك ومايمثلونا كشعب قطري 
1021996959756902400,QA,محد يدور على نفسه غيرك وكل اللي حققته حساب في تويتر تبنبع فيه ولا وتوهم وتوعد وتتوعد على خرطي  وفوق هاي كله صاير طنازة في ميالس هل قطر 
1022217981747650560,QA, مقعاد بهالديرة وين نصرفها
1027774970808557568,QA, تغريداتك تبين لنا كمية القهر اللي فيك بتموت تبي الجواز القطري 
1027779954887426048,QA, بالضبط نفس التاريخ المزور اللي يكتبونه بعض الناس  عنتر وكابتشينو
1027789172730253184,QA,    خف علينا ياحاتم الطائي  لو ماكانت لك حاية كان ماذبحت ولا تعنيت
1028137802653782016,QA,  على فكرة الملاهي الليلية والخمور في تركيا اللي ينشط اقتصادها السعوديين 
1028194794420326400,QA, شي طبيعي ان شعب بعض الناس اللي يدورون الرخص بيغزونكم في العيد عقب ماطاح سوقكم وصارت أسعار تذاكركم في الارض وسعر الليلة في الفنادق صار  درهم من عقب ما كان بالالف والالفين 
1029230608214634368,QA,مشكلة اذا كان العدو اهبل ويطلع سوالف من دلاديقه  الحمدلله على نعمة حكومة قطر اللي ثقفتنا كشعب وما خلتنا مثل عقول بعض الناس يسهل استحمارها 
1029834669519396864,QA,الشعب القطري مشرد  صج لي قالوا كلن يرى الناس بعين طبعه 
1029940874606604416,QA, الله يعينكم على القهر اللي فيكم  سلمان عطاكم راتبين اول ما استلم والحين يحلب اضعافه منكم عشان يعطيه ترامب والباقي حق ولده يشتري فيه يخوت وانتو لكم التبن
1029947166767235200,QA,يا ساكن الزبالة مالك على هل الزبارة راي  حدك بيبان الدعارة تحسب اللي رايح واللي جاي 
1029951849174953984,QA,  شتبين يسمونه عيل  البلا منكم وفيكم كل عملية ارهابية في العالم وراها سعودي
1029962303083430016,QA,   هل الدوحة ينامون وبيبانهم مفتوحة  الله يديم علينا نعمة الأمن والامان  الحمدلله احنا شعب شايفين خير ونعمة
1030088912172183552,QA,    قصدك طباخ السم لازم يذوقه واللي يزرع المذله والظلم يلقى الارهاب في شوارعه واللي يزرع العدل والعزه يلقى الأمان عند شعبه
1030879806907449216,QA,  ترى الموضوع جدا عادي وهذا شي يصير بالتفاهم بين الواحد وزوجته يعني اذا انتي تشوفينه مب عدل غيرج يشوفه عدل  اذا كل اثنين متزوجين تمو يحسبون حساب نظراتكم ونظرياتكم محد بيعيش حياته 
1030880348635324416,QA,  شرايج بعد يطلبون العشا في البيت ومايطلعون  
1031566084422262784,QA, اللي حج يمكن قطريين عايشين في السعودية
1032110990773514240,QA,  اضحكي اضحكي عسا محد يضحك الا القطريين وربعنا اللي على قلبنا
1032863052062851200,QA,  المهلكة صار لها فضل وجمايل علينا   اقول مافي داعي تفتح هالباب وخل فضلها وجمايلها يوصل شعبها بالاول عشان يوصلنا  مالت عليك من ذبابة
1033746937873346560,QA, الاقربون عايشين بخير ونعمة
1041515869778501632,QA, والله مايضحك في الموضوع الا انت يالمطنزة
1042622055588548608,QA,  يوم وقعت على عقد الوظيفة وشافت المهام ماعترضت لانها تبي الوظيفة اخوي فيصل المعلم من أصعب المهن عالميا  وكل وظيفة لها ظروفها والواحد يختار اللي تناسب قدراته
1043013179410800640,QA, للعلم فقط راتبج وعلاواتج اكثر من قطر فاونديشن ولو تساويتي معاهم بطيح ربع راتبج
1043405804936646784,QA, كل بنت تحدد الأفضل اللي يناسبها ومحد  يقدر يعمم لان كل بنت لها شخصيتها ففي بنت تبي الدراسة والوظيفة وفي بنت تبي الزواج والعيال وفي منهم يبون الاثنين وكل يعيش حياته باللي يناسبه
1043441883660345216,QA, السؤال اخ فيصل شلي يخليك متاكد ان الوضع ماتصلح من ذاك اليوم لين اليوم وهل اطلعت على اللائحة الجديدة وهل شفت القوانين اللي تعدلت  للعلم الحال في الشفلح اليوم احسن من قبل بوايد فياريت تحري الحقيقة قبل التغريد
1044480097200234368,QA, رفض المبادرة حق على كل قطري وتعتبر استفزاز للمشاعر وليست حرية تعبير واللي اليوم يهنيهم بكرة يسايرهم
1044486608592896000,QA,الصلحخير مع من مع من غدرو فينا في رمضان مع من كانت نيتهم يوقفون الحليب عن الاطفال والمواد الطبية عن المرضى ولا مع اللي طردوا القطريين ولا مع اللي ماسلمت المطايا من تسلطهم ولا مع اللي فرقوا العوايل ولا مع اللي كانت نيتهم يغزونا اللي يدور رضاهم اليوم بكرة يسايرهم ويبيع نفسه
1044862500808921216,QA,   ماله عذر ولا احنا محليلينه والله بياخذ حقنا منه يوم القيامه
1045158201837178752,QA, الواد قلبوا بيوجعوا  في الفيفا محدش عبروا  مسكين اللي كان ينطر كرت الدعوة 
1049882094053281792,QA, حضرتك امس نزلت تغريدة مغلوطة عن منهج الصف الاول  ولاتعبت نفسك انك تتحقق من مدى صحة المعلومة اللي وصلتك وسؤالي لو انك تاكدت ان المعلومة غلط هل بتنزل تغريدة اعتذار للوزارة 
1050233222355922944,QA,    مبدأ انا بنتقد وبشهر فيكم وانتو اسعو ودوروا الحل المفترض قبل لا تقدمين الانتقاد تتحققين من صحة الخبر وتدرسين الموضوع وتطرحين وجهة نظرج مع الحل المقترح
1053276073109135360,QA, قعدت ولا طلعت حق نفسك   وطول ما تنشر تغريدات مغلوطة بتلقانا نصحح لك الغلط 
1053490837395390464,QA,أنزين قلفعوك بروحك ولا جيش الذبان معاك  علم سعود واللي وقف ورى سعود ان قطر دوم عالي شانها 
1053491263557664768,QA,   الذبانه من الصدمة شاد حيله في التغريدة يخاف ينشال عقب سعود
1053491729775526016,QA,    انزين الحين يوم شالو سعودان من حطو بداله يقودكم ياجيش الذبان
1053492426331971584,QA,   انتي سقتي سيارة ولا للحين  قاعدين ننطر خبرج بقرة ساقت ودشت في الشبة
1053502146660904960,QA, احلف عاد انت بالاول ارفع راسك من الحذاء اللي تنضرب في على راسك وعقب دوس الناس  
1054222756546560000,QA,  صحيح جدي الله يرحمه كان يقولنا عن هالمطرة وشلون راحو الناس وسكنوا المدارس
1062925985086091264,QA,    التوقع صار حقيقة وحكومتج اعترفت انهم اللي ذابحينا يعني بالعربي طلعتو اغبيا شكرا على الشفافية
1066549239587586048,QA,ولاة الامر مفروض يسكرون المدرسة اللي تخرجت منها 
1075619147579621376,QA, احنا الحمدلله وصلنا ورفعنا راس بلادنا كقطريات وماشفنا التفاهات اللي انتي كاتبتها عائق  
1090799785790054400,QA, على فكرة المورد القطري ماراح يستورد من عندكم لان بكل بساطة الشعب القطري سيرفض انه يشتريها لان لقى الافضل في السوق فليش يورط نفسه مع بضايع ماعليها طلب
1091052720142848000,QA,  يعلكم بهالحال واردى وعسى حرتج ماتبرد  والوعد بكرة انصحج بحبوب الحموضة مفعولها اقوى من بعض الناس
1091055200364838784,QA, واحليلها الشرهه توها واصلة من  ساعات عيب عليهم تاخروا مادفعولج المصروف بدري معذورين كانوا يدورون نعلهم في الملعب 
1091373904235544576,QA, تستاهل الفوز يابوحمد وتستاهل الدوحة الفرحة
1091669309464739840,QA, الجمهور الرياضي سيتذكر انكم شجعتوا كل منتخب لعب مع قطر وسيتذكر دموعكم اللي غرقت الملاعب ونعلكم اللي لقطوها من الملعب وصدقني ان الجمهور يدعي لكم الله يخفف عليكم تاثير فوزنا ونشكر لاعبين منتخبنا اللي خذو الكاس بجهودهم اما فالكم خلوه لمنتخبكم
1091915531547013248,QA, تدري ان تغريداتك دليل على القهر اللي فيك والله يزيدك قهر  وعساك تنام وماتقوم من القهر  وبيجي اليوم اللي بتنقط فيه قطة الكلب مثل غيرك من مهرجين الحكام كلها مسالة وقت ولاتحاتي  بنتشمت فيك
1092263502381752448,QA, كانوا يدورون ثيران حق برنامج الحصن عسى سجلت اسمك
1093105627885436800,QA, ان كنت ناسي افكرك  الله ياخذك وياخذ كل من عاونك 
1093106850554396800,QA,  على اساس ان احنا في قطر بنموت نبيكم ونبي تسامحكم الله يزيدكم على اللي فيكم
1096031050143334400,QA,ياقطرية ياضد الفساد الصورة صورة شوارع وشرطة دولة من الدول اللي وازينج  اكتبي في جوجل شرطة قطر وبتتعرفين على شرطتنا 
1097112368004415616,QA,عفوا بس شالفرق بين انهم يؤدون  الاوبريت في مول او مسرح او قاعة  اللي رافض الفكرة اصلا من الاساس رفض مشاركة بنته لالرقصالبناتفيالمولات
1143790485338820608,QA, نهنئ دريمة على التميز  ونجاحها نجاح للمؤسسة وكل مراكزها والحمدلله الاستقرار موجود في معظم مراكز المؤسسة واستغرب حكمك اللي ماعرف على اي اساس استندت عليه وهل انت زرت كل المراكز وعرفت طبيعة شغلها والانجاز اللي تحققه كل سنه 
1169712652831997952,QA, كل يوم نؤطة ما تعبت
1169713011445178368,QA,"البارحة خدي على الجوال 
وخدك فوق  كفينك
تنام وسهر عيني طال 
يا بخت النوم  في عينك

واخرتها نايم بدري والجوال في الصاله يشحن "
1169713905024798720,QA, اووووه انا قطيتها بحر صبر بروح ادورها 
1169892038000529408,QA, صباحج ورد يا ورد 
1170062746983030784,QA,تألمت فتعلمت فقمت فأكلت ولاا جنه صاير شي
1170063401806118912,QA,"الناس في وادي وأنا بـ وادي 
 مدري وش أهديلك بهذا الليل 

ودي أقول  بـ صوتي الهادي
كل عام وأنت اللي أحبه حيل "
1170063949934542848,QA,"

قهوني مـن يـدك فنجآل المحبه 
جعلني فدوه لـ فنجالك وكفك "
1170066185121124352,QA,"يقول سعدعلوش 

كـم مرتن  دورت شي اكرهه في
والـيا لقـيته صـرت فـجأه  احــبه 

"
1170066525501513728,QA,"سعدعلوش 






أنا ومن بعدي الدنيا تلف وتدور "
1170069198493687808,QA,"عزيزتي الزوجه

 اذا زوجك فصخ ثوبه وعلقه فالدولاب معناته فيه فلوس 
واذا فصخه وحذفه على الفراش معناته مفلس 
واذا لف ثوبه وحذفه بالغسالة معناته متزوج عليك بالسر

تعبت وأنا أساعدكم "
1170071263613767680,QA,نفسيتحباللي يدلعها 
1170071750572466176,QA, البنت مسكينة دايما وأبدا 
1170074715974721536,QA,"نفسيتحباللي

يخليني اول اهتماماته "
1170075613249658880,QA,"نفسيتحباللي

ما يخلي للزعل فرصة بيني و بينه "
1170081253716123648,QA, ما اقدر  اخاف من العين 
1170084459208749056,QA,"نفسيتحباللي

حبيت التاق "
1170086131523887104,QA, ليش عيل حاطه روج بعد يعتبر غش امسحيه 
1170247488248451072,QA, ايام زمان بأااا  و ارقع يا زمان 
1170248149803442176,QA, اي والله يقولج ما عنده ماي ف الثلاجة 
1170317802445709312,QA, عبالج ما عندنا الا السمج 
1170323316810362880,QA,"علمني الليل كيف احلم على كيفي
وعلمني الصبح بإن احلامنا تكذب "
1170323627943874560,QA," ترا اللي غلاته غير تاتي طعونه غير
علامات سكينه مع الوقت ما تبرى "
1170323886245892096,QA,"وينك عن الأشواق 
مر الوصل  مره 

وتلومني  لا ضاق 
صدري من الحرة 

دايم وأنا المشتاق 
إشتاق لي  مررره "
1170326099382996992,QA,"لـو ان القـصـيد الي نقوله بدون شعور 
ماتـلـقئ جمـاهير ومـجـاريح تسـمعنا"
1170350752902107136,QA,  اهم شي حلوه ع يدي وانتو كيفكم
1000693913642925952,QA, عام من الفخر ببلادي اللي وقفت في وجه  دول مب كفو تواجه ومعتمده على نكرة مثلك وشلة ارجوزات
1002797204556271616,QA,المحمياتالملكية السؤال هل الشبك يحاوط المحمية ولا يحاوط بيوت الناس اللي ساكنين حول المحمية
1002804617736908800,QA,الملخص الإعلامي يا قرقاش يوضح شقد شعبكم مغيب وجاهل ومحتاج للفلوس لدرجة انكم ممكن تشترون ذمتهم وتخلونهم يغردون بشي هم مب فاهمينه مقابل كم فلس  ولا انت ولا معازيبك تقدرون على شبر من قناة الجزيرة والله يقدرنا على زيادة قهركم اكثر وأكثر  
973400825161658368,QA, ها سوسني ماطلعتي تنابحين عن ماخفي اعظم  شفتي فعايل موكلي في 
973530301359116416,QA,    الظلم اللي انتو تسونه  وعلى فكرة حتى يوم كنتوا تأخذون إجازات مع الطلاب بعد ماكان عاجبكم وكنتوا تشتكون  كل واحد يبي يفصل قانون على هواه  وكل واحد يبي يستلم راتبه وهو  ارباع السنه في البيت بحجة الاجازات المرضية 
973533829771288576,QA,     يوم عمل تعادل  أسابيع يعني نضيف عليها  يوم اجازة أسبوعية فتصير  يوم عمل اذا خذتيها متصلة وتطلع اكثر اذا خذتيها منفصلة وعلى سبيل المثال يعني لو خذتي كل اسبوع بروحه بيطلع رصيدج في المرة الوحدة  ايام يعني اجمالي  يوم واذا خذتيها أسبوعين بأسبوعين وأسبوع يطلع الاجمالي 
973534830276300800,QA,    واذا خذتيها أسبوعين بأسبوع وأسبوع وأسبوع تطلع  يوم خافوا الله ياجماعة
973536400028176384,QA, هالكلام قرقش فيه عن معزبك
973574766840942592,QA,     والويكند اللي قبل الإجازة أو اللي عقب الإجازة ماحسبتيه
973619368302014464,QA,  لا تلومها من القهر  شفت مناظر عيالهم 
973771008585928832,QA,            هاللي ناقص طرارة المحرق تبي تعلمنا السنع  روحي علمي بناتكم ورياييلكم هاي اذا عندكم رياييل السنع بالاول  والا اقولج دوري دبره حق بناتكم عقب ما انقطعت ارزاقهم وتبدد حلمهم الوردي ان ياخذهم قطري
973773801392570368,QA,مساكين هل جزيرة الريتويت مطلعين هالهاشتاق يبونا نحررهم من بوجاكيت حمر ونضمهم للدوحة  تميمقايدناوحمدعدونا
973884196161761152,QA,  وانت زعلان عشان اللبن اللي طاح في كبدكم ولا عشان هلك ماكانو من ضمن البقر المستورد
973884876863819776,QA,  على الأقل نصور اخبار بلدنا اللي تشرف مب مثلكم تصورون خياس بناتكم ونجاستهم يا ارذل شعب على وجه الكرة الارضية
974133556959170560,QA,صباح الخير  من قطر اللي حارقة أعصاب بعض الناس جدا جدا جدا 
