id,dialect,text
1141323091261448192,KW," السؤال هو ماذا يعرف فاعل الخير هذا من معلومات نحن لا نعلمها
و لصالح من فعل هذا الخير
اللي بالجدر يطلعه الملاس علينا فقط أن ننتظر"
1141430600332664832,KW,"رحت فيلم علاء الدين مع عائلتي واستانسنا بصراحة لغاية ما خلص الفيلم وأضيئت الصالة تفاجأت من كمية القمامة من أكياس وفشار وبطول ماء فتعكر مزاجنا وظليت اتحلطم لين وصلت السيارة
صج النظافة ثقافة"
1142136985617883136,KW,على العموم بإنتظار اجتماع المسؤولين
1142705625203392384,KW,"إذا صح الخبر
لن أتذمر على هذا السلوك المشين اللي   قام به الملازم ولكن ما هو السبب وراء هذا السلوك وتفشيه على مستوى اغلب مؤسسات الدولة سواء تقاضي رشوة أو عمولة
هل مجرد جشع  ام شافوا اللي اكبر منهم يبوق ويترقى وما يتطبق عليه القانون وأن الأمين والمخلص ماله مكانه ولا مستقبل  "
1142712054983417984,KW,"لا أفهم كيف يتصرف بعض المسؤولين اللي عندهم خير وسلطة ونفوذ ولكنهم حرامية مع مرتبة الشرف
مفروض عليهم هالشئ احد ماسك عليهم مماسك ويهددهم فيها اذا ماطاعوا الأوامر
ام هم مرضى نفسيين ويحتاجون علاج
عجيب أمرهم "
1142719331857522816,KW,"تعتقدون لو طبقوا حد قطع يد السارق بعدالة على الكبير قبل الصغير شنو ممكن يصير
مجرد تخيلات"
1143093642736914432,KW, الله يعينك بو طلال وانشاءالله مافي الا الخير اتمنى
1146776098748940416,KW,"وزارة الشؤون في القلب حي بس ناطره يطوف هالاسبوع وتتضح اكثر الامور
"
1146790625121120384,KW,"ياليت يتطوع  نيل بوش احد المدافعين عن لازاريفا لمناصرة  قضية البدون أو اللي سماهم الجهاز المقيمين بصورة غير قانونية  يمكن تفتك عقدة البعض وينصلح حال هالمظاليم
الشقر لهم هيبه "
1146794418051190784,KW,"قالت لي امي وياحلوها من ام
ثلاث لا تعطينهم بال
مداح نفسه 
واللي  ساعة ينصح ويعظ الناس 
واللي يتكلم في الناس من وراهم 
صح السان الغالية"
1149049433855803392,KW,يا ليت تكتشفون بعد اللي باعوا الجوازات المزورة للبدون وبعلم الحكومة مثل ما ذكر ذلك بعض نواب البرلمان 
1149298237947486208,KW,اجابل الوالدة الله يحفظها ابرك من هالشحن العنصري البغيض
1150156064324763648,KW,"ما ادري اتابع قضايا الفساد اللي كل يوم عندنا قصة ورواية ولا هالمعتقلين المساكين من البدون اللي فضفضوا وابتلشوا ولا الوضع الإقليمي اللي شديد التقلب
نسيتوا الشهاداتالمزورة
وهل من مستجداتقضيةلازاريفا"
1150343211661058048,KW, بس وايد أعطو للموضوع حجم كبير ويقدرون يتعاملون معاه من خلال قنوات أخرى ودون كل هذا التضخيم اللي صرح مذيعة وليس مسؤول حكومي كي يصل صداه لمجلس امتنا
1150347009423024000,KW," اساسا كل اللي قاعد يصير هو تأجيج الشعوب على بعضها باستخدام وسائل الإعلام الموجهة
للأسف ويقولون خليجنا واحد وشعبنا واحد شتتو الخليج والدور على الشعوب"
1150407645242822784,KW,"ناس يغرفون وناس يكرفون
عدالة عرجاء"
1152912374657163264,KW," لا ماني مصدقه طبعا لين اشوف بعيني
مجرد أرشيف"
1167432761633845248,KW,"السياسة بحر متلاطم الأمواج والعليمي فيه غريق

تكسبات انتخابية"
1167435047332450304,KW,شصار على ديكابريو الكويت 
1170667707039199232,KW," المفروض بيانات مثل هذه تكون متاحة للجميع
المفروض"
1173229509119754240,KW,"في حوار مع احد الاصدقاء قال لي
كل اللي تشوفينا مخطط له مسبقا هالعافور اللي قاعدين نحوس فيه من فساد وتخبط وتقييد للحريات ما هو إلا اسلوب من أساليب الضغط لشل مخكم
حتى المعارضة اللي تشوفونها مجرد أدوات إلا قلة قليلة لازالت نظيفة ولكنها مقموعة
الله يسامحه ياب لي الاكتئاب"
1050381033558950016,KW," والله يا فرح هذا التصرف معيب بصراحة  وإذا كانوا يبونها مقتصره على فئة معينة كان من الأجدر ما يسمونها صرخة الشعب بل صرخة الفئة الفلانية
بيرد شنو بيقول مثلا والدعوة للجميع 
لا تضايقين ويكفي انك عرفتي بنفسك من هؤلاء
الوطنية افعال ومواقف مو شعارات ونقطة"
1050806639018864640,KW,"شلة مرتزقة ومتحايلين تحت غطاء الدين متخفين  سلمتيهم يا رشيدة الخيط والمخيط لين باعوا ثوبك الغالي المزركش بالترتر وألبسوك ثوب بالي ومهتري ومهلهل
متى تصحين"
1051347921130655616,KW," البعض فاسد بالفعل والبعض الآخر صامت خوفا على مصالحه أو ما يبي يعور راسه
قليلين جدا من يتألمون على حال الوطن"
1052177529392570368,KW,"يا كويت عزك عزنا
هذه الجملة المفروض ما تطيح من إلسانك حتى لو شفت الهوايل والسرقات والهدر جدام عينك
يبونك لا ترى ولا تسمع ولا تتكلم فقط تهز راسك بالرضا والامتنان
عجيب"
1052252499816665216,KW, ابتلشنا يا كريمة لعبهم صار بايخ ومكشوف
1052259460272480384,KW, تسلم الشر ما يجيك
1052268746738466816,KW, الشر ما يجيك عزيز
1053687975400431616,KW,يا كثر مساحين الجوخ ويا شين مواقفهم
1057231365555609600,KW,"في بلد الألف قناع تسرق حقوقك وتطالب بالتصفيق 
هلوسة"
1057748517429620736,KW,اللي فاهم شنو قاعد يصير يفهمنا 
1057938226424545152,KW,للمستبدين اللي بقى عندهم القليل من العقل حلوا مشاكلكم بالتصالح مع شعوبكم وارساء العدالة والمساواة وإفساح المساحة للحريات قبل ان يصبح الموضوع امر محتوم ويفرض عليكم مالا تحبون ولا تطيقون
1058388686256177152,KW,"تقطيع وتذويب 
يا ساتر"
1059757610071662592,KW, شكرا لك وخطاك اللاش
1059810909416275968,KW,"  أتكلم بشكل عام
 والقانون العادل هو اللي يبين الفاسد من الصالح"
1061197509291401216,KW,"مفقود
نزاهة المقاول  ورقابة الحكومة  تطبيق القانون

بنيه تحتيه هشه"
1061198725719171200,KW,"الضرائب على الأبواب 
تخيل انك تدفع مقابل الخدمات اللي ما تحصل عليها
إتاوة"
1062388152059527168,KW,ديرة لا فيها التاجر راضي ولا الفقير راضي
1068174437780995968,KW," ادفع فلوووسك واجد 
مغير تصرصرهن
خل زين تنفعكم 
بصوت فيفا "
1069587773802328064,KW," أمس تفاجأت انهم حاطين لي خدمة نغمه الإتصال اللي تطلع لأي واحد يدق علي
دقيت عليهم وقلت ليش حاطينها وانا ما طلبتها
قال طال عمرك هذه هدية من الشركة بمناسبة مرور سنوات
قلت حبيبي ما يهرول الذيب عبث هذه الخدمة بلاش أو بفلوس
قال اسبوع مجاني وبعدها فلوس
قلت شيلها حبيبتي شيلها انا مو"
1070046140492595200,KW,"زين طمنتني 
مبرووووووك يا شباااااب  "
1070996148599562240,KW,"غداء الوالدة ربي يحفظها
بحري "
1071781158688563200,KW," باعتباري رجل متقاعد
أرفض قانون التقاعد المبكر
المفروض التقاعد بعد خدمة  سنة وعمر لا يقل عن  سنة
واللي تقاعدوا قبل القانون  يهنيهم "
1071858644508123136,KW, يسلمك من كل شر
1072141670748209152,KW, مبرووووووك مبرووووووك مبرووووووك مبرووووووك مبرووووووك مبرووووووك
1072762009177997184,KW,"  تعلم يا المطيري من ذهانه هالعنزي 
ترى بيت الذايدي فلووووس كتير كتييير 
اختصرها لك "
1073104966972260352,KW,"الحكومة تعطي باليمين وتاخذ بالشمال
تذكروا 
زادو القرض الإسكاني وفي المقابل ارتفعت كل أسعار مواد البناء وارتفع سعر الديزل وعفسوا المواطن 
 لو اسقطوا القروض وأنا استبعد ان الحكومة تسويها شنو بيسوون بالأوادم
ودي اصفي النية بس الحكومة  تاريخها خابط و  عكر وغير قابل للتصفيه"
1073164209523998848,KW,بودي ينصلح الحال بس من يقدر يصيد الصقر اللي طار بالغنايم الخرافية
1075457542803910784,KW," قال استقالات جماعية قال 

بلي بلي عيني بلي"
1076435649568350208,KW,"ليش ما عندنا قمر صناعي من باب التقدم العلمي
إلا شخبار  مؤسسة التقدم العلمي وشنهي آخر انجازاتها
الكويت"
1076436035846979584,KW, صح هذا اللي كان ناقصنا
1076519714602606592,KW," ما شاء الله تبارك الله مبرووووووك مبرووووووك مبرووووووك مبرووووووك مبرووووووك مبرووووووك مبرووووووك مبرووووووك مبرووووووك مبرووووووك 
الفال للعالمية بإذن الله "
1076545556296712192,KW," الشكوى لله 
المقطع قدامك صب خرسانه وانت تقول جاهزه
اترك عنك نقالة الكلام
شوف بعينك واحكم"
1076567562291474432,KW," التوزيع بالقرعة 
وإذا انت بايع في  فأنت بإذن الله في شرق تيماء بنسبة "
1078373692017725440,KW, الله يبارك في والشكر على ثقت
1078615527042494464,KW, يبارك فيك واتمنى التوفيق للجميع
1082013358172315648,KW, يدرون زين بكل شي ويتعورون بعد  بس يبيلهم نفس عميق
1082286811009961984,KW,"دام ان الموضوع معلوم عندكم  فليش ما تحولونه للقضاء
وليش ما سمعنا عن محاسبة السماسرة والمسؤولين اللي سهلو المهمة على من تدعون بأنهم مزورين
من حق الشعب ان يعرف من يبيع الوطن "
1082605982482657152,KW,نبي استفتاء شعبي بشأن درجة الرضا عن مجلس الأمة والحكومة وياليت بعد تعطونا شوية صلاحيات يمكن نقدر نسوي اللي انتم عجزتم عنه او  تجاهلتوه عن قصد 
1082630946568966016,KW,"التقاعد المبكر فلم مفبرك
يبون يعوضون خسائر سوء الإدارة المرصودة في تقارير ديوان المحاسبة من جيبك يا شعب
هذا مجلسكم اللي المفروض يدافع عن حقوقكم
ارجوكم احسنوا الاختيار واتركوا عنكم سوالف خشمك وعمك وقبيلتك ومذهبك  وابحثوا عن الكفؤ"
1083098989682143232,KW,"اللي ابي افهمه مبلغ بهذه الضخامة كيف يخرج من الميزانية من دون رصد ديوان المحاسبة
وان كان مرصود ليش أنسكت عنه
علمونا شنو قاعد يصير بالديرة ووين رايحين  "
1083267753736314752,KW,"اقتراح جيد ويبين بوضوح من اللي قلبه على الشعب
وهقوهماستقيلوا "
1083275531758518400,KW,دام انهم يعرفون وعندهم مستندات مثل ما يدعون ليش ساكتين ولمصلحة من  
1083729069420826624,KW,"في السابق لمن كنا نسمع ان مواطن مد ايده على مبلغ صغير من المال العام ننبهر ونستغرب ونستااااء
أما اليوم وتحت هذه الإدارة اللي فاقده بوصلتها واللي صارت فيها السرقات والانتهاكات كجرعات الدواء لم يعد للانبهار والاستغراب مكان 
غصة "
1084540611565375616,KW,"هذه اللي المفروض يحطون لها شارع يخلد اسمها
الله يرحمها ويرحم جميع شهداء الكويت "
1084920725587324800,KW, الضمير صار له سعر
1085187173479927808,KW,"كم من المليارات هدرت من المال العام وكم من الفساد مورس بلا استحياء وما هي النتيجة هروب بعض السراق والفاسدين وتنصيب البعض الآخر مناصب مرموقة اين هي العدالة اللي يسجن بها مواطن غاضب ومحترق دمه من اللي يشوفه من فساد وانتهاكات في وطنه وحاول فقط ان يعبر عن رأيه
حصاد"
1085240093349216384,KW,لا زلت مؤمنة إن في الدنيا خير 
1085881137254227968,KW,"من هو المقاول  اللي خله الحكومة تصك آذانها وما تسمع صوت من عارض هدم الصوابر
 انقذواالصوابر"
1088179571579674624,KW, كل سنة وأنت بألف خير يا أغلى أخت
1088958253160124416,KW,"سلام ياشيخ تربى على الطيب 
سلام يارجل عزيز وغالي 
تعيش ياحر تعلى المراقيب 
حر ولد حر على الرجم عالي 
يحتار فيه الشعر تشريق وتغريب 
رجل عزيز النفس ماله مثالي 
رجل الوقفات راع المواجيب 
صلف على الصكات مابه جدالي
الشيخأحمدالفهدالصباح "
1089887534220525568,KW,"الشاحنات مو لهم توقيت معين للقيادة
شوارعنا فوق انها مكسرة وزحمة والشاحنات أشوفهم على مدار الساعة بالشوارع ولا حسيب ولا رقيب
وزارةالداخلية شوفو لكم صرفه"
1089892730300493824,KW, هذا اللي صار لي اليوم 
1089917746534641664,KW,كل مجتمع فيه الصالح وفيه الطالح بس المصيبة لمن الطالح يأخذ مقلب في نفسه ويعيش دور الصالح
1090616594135465984,KW,"  يا ماشي بدرب الزلق لا تآمن الطيحه دربك عوي مو عدل وماخذنا بالصيحه
 احمد القطامي   
من التراث"
1090651551855726592,KW,"ادارة دايخه ما تعرف تفكر ولا تعقل الأمور  حولت النقد لإساءة  وعاقبت الناس على الظنون والنوايا عبالها بهالطريقه انها تقدر تردع الناس وتخليهم يفكرون بدل المره الف مره قبل لا ينطقون 
السجن مو مؤسسه اصلاحية بل مؤسسة تدميرية تخرج اما إنسان ميت  او مستبيع "
1090651653576016000,KW,وهجرة عيالنا فتحت عيون المنظمات الحقوقية والإنسانية اللي الكويت تصرف المليارات عشان تحتفظ بلقب الإنسانية  الحل مو صعب بس يحتاج ان تفهم الإدارة  معنى كلمة المواطنة وان تلتزم بمبادئ الحقوق الإنسانية وتبعد عن سياسة فرق تسد اللي قسمت المجتمع وأنهكت الوطن
1090712628740178048,KW, مو عنك عني انا
1091076740863197184,KW,"مره أخرى يقول مرزوق الغانم ان في زيادة في عدد السكان غير طبيعية 
إذا عندكم الحالات والمستندات ليش ما تحولونهم للقضاء ليبت في أمرهم
وماذا عن مشكلة البدون اللي صار لها اكثر من  سنه كيف بتحلونها"
1092010028108861440,KW,"اللي في الجدر يطلعه الملاس

ننتظر و نرى
 "
1092023761480515584,KW,"مواطن ينطر حول  سنه ايجار على ما يطلع بيته عياله يكبرون ويشتري لهم سيايير ومصروف وغيره وللحين ما طلع البيت وان طلع البيت يأخذ قروض عشان يكمله وما يكفي لان أسعار المواد ارتفعت بلا حسيب ولا رقيب
كيف تلومونه لمن يطلب اسقاطالقروضلليوم 
بيت بلا ذكريات"
1094638282204479616,KW," اتوقع انه ابوسعد منحاش من ام سعد 
مقرود قايل لها أنه رايح عمره "
1096746946373529600,KW," يصرح من كيفه يعني
ما اقول الا الله يحفظ الديرة"
1097852571404984448,KW," اسمحوا لنا ما نقدر 
لو فواز المطيري نازل ممكن ندعمه 
نزلوا فواز المطيري وابشروا"
1101803723913875584,KW, زدت كيلوين من يا هنو جدا لذيذ 
1101825233856679936,KW,    ضريبة النفس الحلو بالطبخ 
1104332537181155200,KW,"  من الشاري ومن البائع
عسى بس مو ربعنا في هيئة الاستثمار "
1110827105951064064,KW,"شنو السبب اللي خله مواطنين يلجؤون للتحاليل وتزوير شهاداتهم 
الشهاداتالمزورة"
1111592365712703616,KW,"الخصخصة ماشيه والضريبة على وشك التطبيق ولازالت مؤسسات البلد مترهلة وبعض النواب اللي توسمنا فيهم الخير ليسوا إلا أدوات تسير لصالح من يدفع أكثر
حفظ الله الكويت"
1111895802652360832,KW,مشكلتنا ليست بتشدد المتشددين ولا بتسيب المتسيبين بل هي بادارة تملك كل المقدرات و غير راغبة في التغيير
1113044666927276032,KW," ما استبعد
حطوا القوانين المقيدة عشان ياخذون راحتهم ويشقون ويخيطون من غير ما احد يداحرهم"
1114091324926504960,KW, أغلبيتهم مجرد أدوات تستخدم لاغراض سياسية بحته
1114861172594020352,KW,  ثقافة من سبق لبق
1115711170055475200,KW,"من المسؤول
ومن اللي استفاد من وراء هذا المشروع
ارحموا الكويت "
1115908703532855168,KW,"ليتنا نبعد عن السخافات ونفكر كما يفكرون هؤلاء
العلم نور "
1116334184333758464,KW," لا حول ولا قوة الا بالله
تركوا الناس بحالها وشوفوا الديره اللي قاعد تتصفى
وبلاش اسلوب دغدغة المشاعر اللي ما شفنا من وراه إلا الكوارث"
1116656084662538240,KW,"شاركناصورتكوانتصغير
الحياة صعبة يا جدعااااان  "
1117081349855297536,KW, تسلم مهندسنا وانت بخير واتمنى لك المزيد من التفوق والنجاح 
1117758317546307584,KW, صح بدنك شكرا مهندسنا
1126236449957924864,KW,"وما هي الأعراف الدينية اللي تمنع مشاهد كل اللي فيها فئات متعايشة معانا منذ نشأة الكويت
واين احترام الاختلاف اللي تصدح به منابر مسؤولين الحكومة والمجلس
كويت جديدة  "
1127995130873548800,KW, نعم صحيح المصالح هي الأساس الدين مجرد وسيلة للتوجيه بدليل موجات التحريم والتحليل اللي قاعدين نشوفها
1128663196338880384,KW,"قالوها لي من قبل السلطة بيدها الخيط والمخيط والمجلس مجرد شكل ديمقراطي وأغلب المعارضين هم مجرد أدوات لها لا أكثر ولا أقل
ما صدقتهم حزتها بس للاسف هذا هو الواضح"
1130939876512358400,KW, ما يهمهم المهم البيزات اللي ياخذونها
1131156717289517056,KW,المسؤول الفاسد ما يحب يوظف تحته إلا اللي اردى منه وهكذا تحبط الكفاءات وتزيد الاختلاسات ويعم الفساد
1131327384353955840,KW," ابوعبداللطيف إذا ناوي تضبط أسنانك على آخر عمرك مالك إلا اللي يضبط
عيادة أسنان راقية جدا واحترافية وشغل عدل
عيادةنائلالهزيم في برج التجارية وأنا اضبطك بخصم خاص بإذن الله إذا من طرفي
أنا مشتغل لي ولعيالي
ونس نفسك العمر فاني والفلوس من حظ الورثة"
1132037204031803392,KW,"  ابوفيصل دير بالك 
ترى صلاح يشرب دخان  "
1133655347498016768,KW,"تذكرون استبيان الأولويات اللي طرح في  ماذا أنجز منه
الكويت "
1134200886610333568,KW,     دائما رجاع للحق يابوراشد 
1134202419573866368,KW,"     هذه الهقوة يابوراشد
وهذا هو العهد بك "
1134555930614480768,KW, نبي شرح عميق إذا تكرمت 
1134614655542943616,KW,"عطني يدك خل المصايب على جنب
واذا تقهوينا نحل المصايب

شهر كريم ورحمه ومغفرة ذنب
واللي يجينا بـ شر  بـ يروح تايب

القمةالخليجيةالعربيةالإسلامية "
1134798859253768192,KW,"يا حلو  شوارع جارتنا الشقيقة دبي
جودة اداءهم هي من تتحدث
شفيهم اللي عندنا متكبرين ما يبون يتعلمون
مو عيب"
1135590343339139200,KW," مطير ما ترجع ورى 
عنصريةتايم"
1137844428549316608,KW," ممكن شرح مبسط
عشان دماغي مصدعه ومش قادر استوعب "
1138603529940193152,KW,  فايز الحساب اللي في  لك أو لا
1146053875155263616,KW,"  كيفنا شبكتنا واحنا أحرار 
وإذا كتبت تغريدة ثانية راح ارجعك على 
احمد ربك نخليك تفتح جوجل وتويتر"
1146060206117228416,KW,"  يعني انت تأخذ الخدمة بفلوسك
انا فكرتها ببلاش واحنا تصدقنا عليك فيها
عشان كذا احنا نتمنن عليكم ونقدم خدمة مشي حالك
اعذرني اخوي لجهلي
معك حق العميليأتيأولا"
1146423937984815232,KW," 
عيب عليكم يا شركة فيفا
السرعة تعبانة عندي على  
في سعدالعبدالله  "
1156225205372686336,KW, ترامب  أنا الأقل عنصرية في العالم  
1163213760997318912,KW,"ما ادري ليش لما شفت هذه الصور تذكرت فرقة حريمالسلطان اللي تنبح على كل شي في الكويت و السعودية أيام سيول الأمطار واتهام البلد بالفساد
اشوفهم نظام اعملنفسكميت أمام سيولتركيا عشان عيون الخليفة اردوغان
فساد وإلا مش فساد يا متعلمين يا بتوع المدارس "
1171080803612266496,KW," تهقاااا ابوسعد يسويهااا 

مالك أمل "
1012211557516955648,KW," شر البلية ما يضحك
أشبه بتصرف اطفال
مشتكي وزعلان عليك لأنك ما تكلمني "
1017841769881440384,KW,"   ممكن اعرف ايش هو العيب المصنعي في  
اللي عندي      "
1017919685818544000,KW,"استنفار الشرطة والجيش في الكويت 
 أمر طبيعي ومفروض 
بسبب أحداث مظاهراتالبصرة 

المهم نصيحة يا اخوان لا نصير طابور خامس وننشر الاشاعات ونثير الرعب بين الناس 
مو كل خبر ننقله ولا كل مقطع ننشره
وكذلك الاخوة العسكريين اللي يصورون المقاطع 
اتقوا الله وحافظوا على السرية في عملكم"
1033410379739803648,KW,"بأي صفة تستجوبه طال عمرك 

هل لسبب شخصي أو سياسي 
وعن أي وزارة تستجوبه 
عودةاحمدالفهدمطلبشعبي
راعيالحرشا
أبناءالشهيد "
1036180035676372992,KW," حالي من حالك 
انا راح ادخل شهر انتظار 
جوازات عيالي كلهم ما خلصت"
1044165887706779648,KW," ودي أقول لك السبب يالعشير
بس مالي خلق تجيني ردود من سفهاء
وإلا الحل والطريق والآلية هم يعرفونها منذ سنوات"
1047079285532582016,KW," 
طيب دكتور 
واللي لم يحضر هذا العشاء ومع ذلك عطاك صوت حبا وقناعة بشخصك "
