id,dialect,text
1116871373346021376,BH,"ويش انت سويت يا اغلى من تمنيته
كبر الخطا الي لفاني منك بالعاني
ياكبر شي جرحني يوم  انك سويته
ابغي اتلاحق خطاك بس ممداني
ودي ادور لك عذر للاسف مالقيته
كيف تطعني وانت الاول بالمحاني
سمرالبحرينية"
1116903937188204416,BH,"انا ماني قليل تبيني ليش اتبعك
ولاني ناقص ولا  ابيك تكملني
انا اقدر اطرحك وارجع اجمعك
غلطان اذا ظنيت بيوم بتامرني

سمرالبحرينيه"
1117465615386796032,BH, حبيبه قلبي ام عثمان ماعليج شر اجر وعافيه  عين ماصلت عالنبي 
1117893433241276416,BH,"انا ماجيت ادور بقايا احساسك الباقي
وسؤالي عنك مجرد عشان ابري  الذمه
على وعدي بتلقاني مثلما كنت لك راقي
لاتفكر جيتي ضعف ولاتزيد منه وملامه 
وعدتك انقذك دوم مع انك ناوي اغراقي 
حتى لورحلت بتبقى من اشيائي المهمه

سمرالبحرينية "
1118501049608941568,BH,"تخيل صرت حتى انكر اني بيوم عرفتك
لوتمر قدام عيني بسوي نفسي ماشفتك
من الاخر انت غلطه بحياتي ويمكن اكثر
وانا ادري اني شي عمره مايتكرر بحياتك 

سمرالبحرينية"
1119077071173509248,BH,"فقط في البحرين

تسأل صديقك تعرف فلان بن فلان 
يقولك شنو سيارته 
وإذا قلتله السياره يقولكك بس عرفته

كمبيوتر مرور مو اوادم "
1119160411083792384,BH,"تشوقني على قربك وتشفقني على لقياك
اجيك وتبعد احساسي تجرحني على كيفك
تكسر خاطري قليبي تصده وهو مثل ضيفك
تسد بابك وتقسى واظل اتسال من علي قساك
سمرالبحرينية"
1119954725766664192,BH,"كنت ودي ورسمت فيك احلامنا
جملتك بعيني وبشين طبعك ذبل
من تغير علينا لازم  نجنب عنه دربنا
انت موناقص احباب وانا موناقص علل

سمرالبحرينية"
1120717074089828352,BH,"هذا وجهك والا جبر خاطر 
عيونك تروي قلبي والنواظر
الود ودي اجوعك ما اشبعك
وحدك حبيبي بقلي حاضر

سمرالبحرينية "
1120924831703343232,BH,"عزيز اللي جمعني فيك
سعيد بصدفته واغليك 
يانور الدنيا في اسمك
وعيوني ماتغلى عليك 

سمرالبحرينية"
1122767673467834368,BH,"احسن مني اجاملك او كذب عليك
غلطتي  كنت بالحيل واضح  معاك
وانت ماقدرت لي عشره الله يهديك
ماغير تصدمني بافعالك وتزيد خطاك
طيبي ماجاز لك بس دمعي الي يرضيك
اقرب لك بكل مافيني ومالقيت الا جفاك
سمرالبحرينية"
1123121858281447424,BH,"ما اصدق كثر حبي لك صار جرحك لي
ولاظنيت بعد هالعشره عادي انك تخليني
البلا اني فاقدك وابكيك وابيك ترجع لي
والمشكله انك نهيت كل شي بدون تسمعني
وجعت قلبي وكسرت ظهري وهديت حيلي 
والقهر انك معاند ولا انت راضي تفهمني 

سمرالبحرينية"
1123130715472846848,BH,"بالعكس مو مثلك انا ولايمكن
استسهل الجرح وارضاه للغير
قبلت طعونك برحابه صدر لكن 
زرعت بداخلي حزن راقي كبير

وقت الاذى تلقاني ملاذك الآمن
تخطي واعدي واقول توه صغير
تعطيني من وقتك بقايا وعلي تمن
واعطيك كلي وعن كلي كنك ضرير

سمرالبحرينية"
1123154601061101568,BH,"انت لو بس اعتذرت 
وقلت لي بصدق اسف
كان مابيومها رحت 
ولاقلبي بيكون عايف 
 
لانك انت من رحلت 
كثرت بقلبي السوالف
وكله منك سمحت 
تبيعني وانت شايف

جاوبني تكفى لوسمحت
اعترف لاتصير خايف 
ليش بقلبي غدرت 
قدام عيني وشايف 

سمرالبحرينية"
1124065017232601216,BH,"تروا على قلب منك منصاب
يبغى  وصالك  وعيا  ينولك 
يشكي الوقت والوقت غلاب
يشوفك حلم ومايقدر يطولك 

سمرالبحرينية "
1124065721078681600,BH,"تكسر جناحي وانا فيك متامل 
تاخذني لملاذك وتشيل احزاني
يوم شافك القلب كان متفائل
انك تبيع الكون كله عشاني 

ليتك تحس بقلب منك متألم
يشكي جروحه لحاله بروحه 
راضي بوضعه ولقلبك مسلم
ينتظر تلملم شتاته وجروحه 
سمرالبحرينية "
1127604708921815040,BH,"ياقلبي  لاتتعب  وخلك  معاي 
اوعى بعد تحب ثاني وتاذيني
ابد لاتتعلق  وتعشق الا سواي
حبني بس انا ياقلبي واحتويني
تعبت اصون واتعبني ممشاي
درب الوفا ضاع وضاعت سنيني
 اللي خذلني مابيه يطير بسماي
واذا شفته بطريق ابيه يصد عن عيي
انا وفيت واللي كسرني هو وفاي
واقتنعت ان حب نفسي يكفيني"
1127902359307341824,BH, بعد حنه وطحنه وعوار راس
1127903358591827968,BH, خوش اخوان كفو عليهم
1127903847215710208,BH,"كنت  ذوق  مع  وجيه  ماتعرف  الذوق 
حشمتها شيمه ومن رداها ماحشمت
ماهو ذنبي مكانهم تحت ومكاني فوق
طبع الانذال لي حست بالطيب اهجمت 
سمرالبحرينية"
1127929148301877248,BH,ترا عادي تسولفون وتضحكون  احنا برمضان مو بعزا خالتك 
1127930002639659008,BH,"هم انا مصدوم من نفسي ومدري ليه
ذاك الغريب اللي بسرعه بعثر كياني 
اللي بلحظه صارت قصايدي عليه 
وصارت شوفته اليوم اغلى الاماني
سمرالبحرينية"
1128524307058036736,BH,"غلطت والغلط فادح 
توقعته بيوم مايهجر
لكن غدره لي واضح
بلحظه عالجفا قرر 

سمرالبحرينية"
1128658738372587648,BH, كنهم هاربين منالمدرسه  وبعدين عادي تعودنا على الفاظهم الي موعدله ذاك يطنز عالفقاره والثاني مايحتاج تسافرون  والله مشكله حديثي النعمه وبعدين خلصت مصالحهم من المواطن الفقير من جذي هربوا  خرج ولم يعد  مالت عالبمبر
1129563859470168064,BH,"صرت اجهلك وانا اللي اكثر انسان اعرفك 
صرت مافهم شعورك بعدماكنت افهمك 
تخوفني رده افعالك واخاف انك تخليني
ياهي حيل صعبه بعد هالحب ما اهمك 
سمرالبحرينية "
1129635896867872768,BH,"يوووووه توك تحس بحقي اخطيت
فجاه صحى ضميرك الميت اللحين
وشاورت عقلك وبكل سهوله رديت
تبي ارجع لك وتقول نتفاهم بعدين

تظن حالي على حطه يدك وابيك
واني مازلت احبك وهمي رضاك 
تكفى استوعب وتلفت حواليك 
وعشان بس تصدق قلبي نساك 

سمرالبحرينية"
1129904071626973184,BH,"يا اجمل حلم حققته ولا تفكر تصحيني
خلني بعينك وابد لاتشوف شي ثاني

سمرالبحرينية"
1130067155125460992,BH,مسلسلدفعةالقاهرة ولااااااااااااغلطه  جبار بمعنى الكلمه  وكل اللي فيه بدعوا الصراحه يفوز باجمل مسلسل خليجي هالسنه
1130950858856894464,BH,"من عرفتك صار كل الحكي كلمه 
 كل ما جيت اتكلم  قلت احبك"
1133321237986500608,BH,"بلا ادنى شك انا  فعلا احبك
ولاياخذك ظنك ابتعد عنك
ومتاع الدنيا مايعوضني قلبك
وحتى قلبي احسه منخلق منك
سمرالبحرينية"
1133473964255252352,BH,"علامي منسرق منيولاني صاير الزمني
"
1133597560696954752,BH,"ادري انك بالخفا تراقبني وتقراني 
تفتش عن اي حاجه فيها تخصني
اي اخترت تبعد بس عجزت تنساني
وعيا الزمن يعطيك ويعوضك حضني

سمرالبحرينية"
1134007815968870400,BH,الف مبروووك يا ام فاهد تبلغين فيه وفي خواته وتشوفينهم باعلى المناصب يارب 
1135126996542009216,BH,"تظلم شعوري  تقسى وتعيب فيني
يذبح كلامك حيل وتنسى جميلي 
تطعني بظهري وانا تشيلك يميني 
وجروحي من غدرك ترا تشتكي لي

سمرالبحرينية "
1135313168803213184,BH,أتمنى اللي يزعل مني هالفترة ينساني ومايرضى
1136551907135283200,BH,"يعني عندك هذي غلاتي
تبيع الود فجاه هذي جزاتي
وانا اللي بعت الناس لجلك 
تجيني بكل برود تدمر حياتي
سمرالبحرينية "
1136916295700680832,BH,"انت فيك اشياء واجد تخليك محسود
فوق زينك  فيك شيمه وقيمه وقبله"
1137154310557589632,BH,فؤادي خيل ماساسه سوا وصلك 
1137846126370009216,BH,"ادري فقدتك ولابتعود ثاني 
والله يعوضني على فرقاك خيره
اضحك واكابر وانا منك اعاني 
ربي حسيبك وياويلك من الله
سمرالبحرينية"
1137918693529325568,BH,"تظن بعدك ببكي واصيح
مسكن انت واكيد غلطان 
ولاتعتقد بعدك ببقى جريح
انا عديت جرحك من زمان

وتدري اشكثر غيرك يجوني
بس انا كنت مسوي لك قدر
وانت عارف اشكثر يبوني 
وانت  خلك محترق  بالقهر

سمرالبحرينية"
1138234345783738368,BH, طلقتي دايما تفوز معاج يا ام فاهد  وانا سعيده جدا بهذا النجاح  وكالعاده انتي الطلقه  
1138781837340413952,BH,"تظلم وجودي وتسيء الظن فيني
تقسى على قلبي و هديت حيلي 
تطعن بظهري وانا تشيلك يميني 
وجروحي من غدرك ترا تشتكي لي
سمرالبحرينية"
1140496964947234816,BH,"يامن تنسيني ملامح واسامي
يامن تغيرني من احوال لاحوال
طالت وانا ماقلتلكعن هيامي
وما اقسى على العاشق من الشوق لاطال
قلي مدامك تستحي من كلامي
اشتقتلك بالصمت وشلون تنقال"
1140979983457718400,BH,في اوادم من اشوف تغريداتهم يجيني غثيان تغريداتهم كلها نغزات وطاقات سلبيه وتحلطم ونكد بس شكله الانفولوا قريب
1141806585943080960,BH,"طبعي عنيد وكل البشر عارفينه
الا معاك انت لك اخضع واليين

سمرالبحرينية"
1142031092867829760,BH,  من اجمل الاصوات اللي لن تتكرر مره ثانيه بالوطن العربي
1142033799901065216,BH,"بتروح والا بتبقى ماجبرتك
انت حر وضميرك يمشيك
ما اسيطر انا وهذي حياتك
بتبيعني كيفك ماني شاريك

انا ماعدت ابقى على احد
عاهدت نفسي اعز نفسي 
وخذيت على نفسي عهد 
ما انزل دمعتي ولا راسي 

سمرالبحرينية"
1142208267835379584,BH,"مستاء من اللي تسويه 
متضايق وهم قلبي يبيك
واقصى طموحي بس تداريه
والحل معاك ذابحني تغليك 

سمرالبحرينية"
1142935108523085824,BH,الثواره مايبي لها راس مال
1142944604129509376,BH,"جيتك وعانيت ليش ترخص حنيني
الهقوه خابت فيك يا اغلى من لي
تطعن بظهري وانا تشيلك يميني 
وجروحي من غدرك ترا تشتكي لي
سمرالبحرينية"
1142944827321065600,BH,"بس اللي صدمني باخر لقا كنت تضحك
ودعتني  وانا  مادري انك  كنت توادعني
كنت مبيت النيه ومعزم تتعبني بجرحك 
حضنتني باخر لقا وانت عارف  بتتركني

سمرالبحرينية"
1142945486313263232,BH,"شفتك وفز قلبي ودمعت عيني
ياكبرها فرحه وكبر مقدارك
ياللي غرامك بالحيل يعنيني
يكفي تبيني وقلبي اختارك 
كم لي احبك وانت مشقيني 
محتار قلبي منكوي بنارك 
ليه القسى والصد يابعد عيني
ارجع ولو كذبه واقبل اعذارك 
ياكم بكيت ارجوك حس فيني
ماذكرك شوقي ولابكت دارك

سمرالبحرينيه "
1142945882733764608,BH,"الشعور اللي احسه معاك 
موطبيعي ويمكن احلم  
لذه   احساسي   بهواك 
انت   جنه   والله  اعلم 

من  تظنه  يوازي غلاك
فدا راسك جعله  يسلم
ومليون عين جعلها فداك
ولبى حبيبي لامنه  تكلم 
سمرالبحرينيه "
1142946758277959552,BH,"الله يعوضك ويسعدك فيهم 
اللي بعتني لجل ترضيهم
اخدعوك    والعبوا  براسك 
حسبي  الله عليك  وعليهم 
يوم  صدقت  حكي  عني 
وكثير  اشياء ماهي  فيني
رحلت  وخليتني  بلا سبب
وانا  مسميك  نظر  عيني
كنت   متوقع  انك   تجيني
ولا فكرت انك بيوم تخليني

سمرالبحرينيه"
1142947187439153152,BH,"غيرتني ياجرح بالحيل صرت ثاني 
حزنك رتب اوجاعي وعلمني كثير
علمني ما اضحي واصير اناني
واهجرك ياللي كنت بعيوني كبير

سمرالبحرينية"
1143589053180403584,BH,"في بعض العلاقات بعدما  تفل  تحس انك يامسحور  او مطقوق على راسك بمطرقه يا انك مكفخ  والا منطقيا  مستحيل عقلك يتقبل هالاشكال اساسا  في شي غلط بالموضوع ياجماعه 

سمريات "
1143762946771881984,BH,"غيرتني ياجرح بالحيل صرت ثاني 
حزنك رتب اوجاعي وعلمني كثير
علمني ما اضحي ابد واصير اناني
واهجرك ياللي كنت بعيوني كبير

سمرالبحرينية"
1144568513669009408,BH,صح الله بدنج شاعرتنا الفذه وعسى علمنا دايم فووووق  
1146590213495558016,BH,"داليا قدمت اغنيتين تراحقي ودربالمضيع الصراااااااحه ابداع ومن اجمل الاغاني اللي سمعتهم سنه  
داليامبارك تفووووووووووووز "
1146623304838652032,BH,"حسيت بنظرته شي مختلف
صارت الارض فيني تدور وتلف
صدقوني ياعالم مابي احلف 
اجمل شعور الكون في عينه

سمرالبحرينية "
1146623492034572416,BH,"سرقني بضحكته وسيطر بعد
ملك قلبي وعيني اظن للابد
شوفوني ما اكذب والله صدق
صاروا الناس بعده زياده عدد 

سمرالبحرينية "
1147462045572509568,BH,"لاتعاتبني ولاتقول ليش وليش 
قول احبك وانتهى كل الخلاف
انت حياتي ودونك مقدر اعيش
وانسى الزعل واحضني ولاتخاف 

سمرالبحرينية "
1147601929561939968,BH,"أرتجي وصلك مع شوفك عشان
أقدر آعيش العمر يا اغلى ضنين
صاحبك  يطمع من  ايدينك حنان
لا تخلي الشوق  في قلبك  دفين

سمرالبحرينية "
1147643918856720384,BH,"تواضعك لازاد ينقلب ضدك
ولا اي عابر ممكن تبتسم له
البعض يجيك لاشاف صدك 
والبعض يدوسك لوتحترق له
 يخذلك اغلى  انسان عندك 
اللي عشانه بعت هالكون كله 
واحيان تكتشف عدوك يودك 
واقرب صحابك يبي منك زله 

سمرالبحرينيه "
1147714255363485568,BH,"الله يكفينا شر النفوس المريضه
اللي تنافق والوجوه اللي بأقنعه 
مالها علاج الاالدعاء بكل فريضه
مالها غير الحقران ومكانهم نشلعه

سمرالبحرينية "
1148075432224460800,BH,"منت بكفو حلو الكلام واعذبه
من شعورك ماخذيت الا اكذبه
مابي حاجه منك ولابي اسمعك
منك ضاعت حياتي وقلبي تعذبه 

سمرالبحرينية "
1148132375760646016,BH,"خلاص اعزم على الفرقا ولا لك في رقبتي دين ترى حنا تعدينا         الخطوط الاستوائيه 

تفاهمنا على حسم الامور وكلنا راضين
وتوادعنا ما كن قلوبنا خضر وهواويه 

ومع هذا عجزت اسـج وانسى واترك المقفين
اغصب القلب لكن        الغلا قدره الآهيه"
1148463990072365056,BH,"محتاج لك والشوق الله وكيلك
مليان  فيني  احساس  وغرام 
وينك  ترا  بموت  منك  دخيلك 
مشتاق لك وعيوني بعدك ماتنام

سمرالبحرينية "
1148782410651394048,BH,"مو  سهل  انك  تغيب وتبتعد
ومو  سهل اواجه  دونك دنيتي
صعب  علي مثلك انسى واصد
ترا اهمالك جبرني اكابر بوحدتي 

ذبحني  قرارك  ولكن سو اللي تحب 
هذا اختيارك تبي تروح عني بلاسبب
برودك  جبرني  اكابر  واخنق عبرتي 
ومقدر اجبرك تبقى وتحبني غصب

سمرالبحرينية"
1150219135684665216,BH,"حرمت اجيك وابكي غيابك
وانت عالفرقا حالك مستقر 
هى دمعه ندم مو من غيابك
متحسف انا ايه ومنك منقهر

سمرالبحرينيه "
1150219241859223552,BH,"انا عنك خذاني الغير
تالم حس بالتقصير 
عيوني نامت وفرحت
تحب اللي عليها يغير

قدري لاتظنه صغير 
واذا فكرت لامايصير
تبيني اتبعك وارجع
اكيد عقلك ماهو بخير

سمرالبحرينيه "
1150219363250770048,BH,"انت  داري  مالك  بقلبي  مكان
وغيمه  احزانك  عن سماي  حلها
انت  الي بعد حب سنه راح  وخان 
بلاسبب رحت ونسيت عشرتنا كلها
لاتشكي اوجاعك ولاتقول من الزمان
وانت بسيوف غدرك بوجهي تسلها
لاترتجي نرجع سوا انت مامنك امان
اترك جروحي وروحي  ولغيرك خلها 

سمرالبحرينيه"
1150219506104643584,BH,"ابي اعرف ليش توجعني
وانا حالف ابد ما اجيك 
ليش بكل مره تكلمني 
العبره بصوتي ترضيك
غريب امرك ابي تعلمني
مو انت الي قلت بخليك
ترجع لي وبعدها تتركني
وبكل مره اقول الله يهديك
حبيبي كافي كمل اهجرني
عذابك لي صاير مايكفيك
كمل جميلك وابتعد عني 
وانا بصد عنك ولابناديك

سمرالبحرينيه "
1150219650183127040,BH,"والله مايسوا احبه ودمعي عليه كثير 
خلاني بلا سبه وذكرى لجرح كبير
احساسه طلع كذبه اناني بليا ضمير
انا الغلطان كبرته وهو مايسوا ترابي 

سمرالبحرينيه "
1150219996448075776,BH,"سايرت الفراق والحزن جاملته 
جاريتك باللي تبيه وعنك ابعدت
اقفيت بجرح لكن غصب تحملته
والا انا ماكان ودي ولوعلي كملت
منك  يصيح  الجرح  والقلب  اذبلته 
تصوبني   بسهم  غادر  ولا  تكلمت
قلت  باكر  بتعقل وبنسى اللي  قلته
واشوفك تحتري طيحتي واناماطحت

سمرالبحرينية"
1150220118393102336,BH,"مرتاح طيب وانثر البوح 
ما اثرت فيني كثر الجروح
مابي  سوا  يرتاح  بالي 
بس ابي طيفه عني يروح 

      سمرالبحرينية"
1150220256167809024,BH,"احترت فيك صاير شخص ثاني
ماهو انت ولا هذي نطره عيونك 
يابرودك ياقساك صرت اناني
تبيع قلبي وروحي اللي يبونك
جيتك بشوق والهم منك جاني
بالنهايه صدقت اللي يخدعونك
الله فوقك يوم تظلمني وتنساني
ورحت تركض ورا اللي مايحبونك

سمرالبحرينيه "
1150220352104128384,BH,"تخيل وش بقى فيني  
بعد هجرك بعد غدرك
ذكرى جروح تبكيني 
تعاني من اثر شرك 

وقف قلبي عالسراب
ضميان يعميه الشقى
ماغير يسقيه الغياب 
ومن عذابك وش بقى

سمرالبحرينيه"
1150220495914176384,BH,"غبت عني وانا باقي على ذكراك
ولابارك الله الفراق وساعه الفرقى
ودي مثلك اقفى واروح وانساك
بس القلب  عايش امل  عالملقى
انا ماني قليل لجل اركض وراك
ماهو اناا اللي  اتوسلك  تبقى
كنت مهما كنت والله  ماتحراك
شوفني كيف عنك اصد وارقى
سمرالبحرينية"
1150220875356102784,BH,"ليله جرح  ماعدت على خير 
ودموع  فرقا عالخد  طاحت 
اي صاراللي خفت انه يصير
حاولت اداري دمعه وساحت
كنت اتمنى تكون لي انت غير 
ياكثرها اشياء احبها وراحت
حتى انت  ياللي حبيتك  كثير 
وكثر ماعشقتك عيني صاحت
محبتك اكبر خطا وكلها ضير
حتى النفس منك اليوم عافت

سمرالبحرينية"
1150221057086939136,BH,"هالك  من اسبابك  محتار  فيك 
الى متى وانا  الشوق يضناني
حاسب  ضميرك  واذكر  لياليك
وان ماهزتك ذكرى طيب عشاني

سمرالبحرينية "
1150221501939048448,BH,"اسامح  على كل فعل  جارح 
معقوله بعد اللي جرا اسامح
وليش اصلا بهالرجعه اجازف
اصلا كلامي معك خطا فادح

سمرالبحرينية"
1150623825689808768,BH,"كلنا  فدا  البحرين والله   العظيم 
مانهاب   الموت   ونعشق  ارضها 
للعدا  حنا  سيوف  الموت  وضيم 
نقطع عروق اللي  من نوا  شر  بها

سمرالبحرينية"
1151139417811280000,BH,في امان الله لو مالك امان
1151483880349818752,BH,"جديديغيركخذاني 
غناءبدرالحسن
كلماتيسمرالبحرينية
لحن وتوزيعيوسفالمال "
1151549980622118784,BH,"سولف خلني بصوتك اعيش
خذني لك واهمس لي طرب
شوف عيني ولاتسالني ليش
احبك بطيش وبداخلي حرب 

سمرالبحرينية "
1151982976806412416,BH,"في اشياء ندري انها كذب  وندري بكل شي غلط يدور حوالينا بس نمشي ونعدي بمزاجنا عشان راحه بالنا  ولانه غلط نخلي عقلنا ينزل لمستوى بعض التفاهات
 احترموا مستوى ذكائنا 

سمريات"
1151983890313240576,BH,ساعات نسكت عن بعض الكذبات مو لانه مصدقين  بس لازم نسلك ونعطي كل واحد على جوه لين يجي الوقت المناسب ونقلب الطاوله على روسهم وعقولهم الزيتونيه عشان مره ثانيه يكونون محترفين اكثر بالكذب احتراما لعقولنا 
1065569526841057152,BH,مشكلتي مو اني متسامحه وطيبه مشكلتي اني انسى انت شمسوي فيني 
1066663326283980800,BH, اهااا يعني جاريه لوعبده عند السي السيد واذا الزوج ماعنده اخلاق ياشيخ وشنو حقوقها من هالمعركه كلها
1069322970957516800,BH,والله ياصديقي كلنا نعاني من نفس المشكله  والمصيبه انهم معانا ومو محسسينا بأي شي   
1069388172365361152,BH,إنت لوتدري عن شعوري تجاهك تترك الدنيا على جنب وتجيني
1070151936391958400,BH, عالجرح والله جبتيها عالعوق
1070156792590712832,BH,العيب انك تظن لبس ساعات التقليد هو محاولة لإخفاء الفقر بدل ما تلوم المجتمع المادي اللي بيحط قيمتك بالمظاهر و العقول الفارغة اللي مستعدة تدفع راتبها كامل على قطعة كمالية بس حتى تنال القبول  نقعد نلوم المسكين اللي نفسه يكون مثل غيره عشان يلاقي القبول
1070769791680552960,BH,"ماهو ضروري تشوفهم كل يوم
عيوني محتاجه تشوفك كل ساعه"
