id,dialect,text
1134155969397776384,SA,"   السويلم افعال وليس أقوال 
خلاكم كوشه 
 ثلاثه روساء وثلاث مدربين في موسم 
 قلبتو حياة الفهد من كثر الصياح
 خلا ناديكم بدون رئيس ولا مدير ولا مدرب 
اعكس نومك حتى صرت ماتدري انت في نهار او ليل 
السويلم ماشي على مبداء قدم الغشيم وألحقه 
عارف ليه عشان نستمتع بصياحكم  شهور "
1134192665292095616,SA, أكيد ماتقصد الموجودين في الصورة 
1134193453443796992,SA,"  بدل حريه 
مافيش ذوق  مآخذه في نفسها مقلب وكل ماسبق"
1134209363365826560,SA,"   عارف من يقصد يا سنفور ياشين اللقافه ياخي عالمي يمزح مع عالمي 
صحيح الي على رأسه بطحاء يحسحسها ويحس عليها"
1134285209124376576,SA,   الله يسامح التويتر الي خلانا نقراء للمتردية والنطيحة
1134290536494456832,SA,"   نظرية بطن الكوره 
وهدف حمد الله الثالث في الاتفاق بصراحة اقنعني انه غير صحيح لما مثل ارتقاء  حمدالله افي الاستديو"
1134293653994823552,SA,   كلنا نفس الشي لكن انا انصح الأخ الهلالي انها كوره وما توصل
1134307067454300160,SA,"            المادة هاذي مافيها خطاء طبي الله يهديه وقع في المحظور وباذن الله يكون درس له لانه خساره للكره السعوديه كلها 
لكن فرحتكم المبالغ فيها بصراحه مالها اي تبرير"
1134307453225512960,SA,"            لا كذا كثير تمرين 
متى اخر مره فزت فيها دوري على النصر  "
1134528385689018368,SA,"   والله المغفل الي يشوفك ويسمعك 
ولا يضحك ولا يحمد الله على نعمة العقل "
1134648747399569408,SA,  هذا مو حساب المريسل
1134694248912228352,SA,"   هذا نكته نضحك يالهزازه 
ولا بتزيد عدد بطولات هزك في العيد ولا ايش بالضبط"
1134929847350890368,SA," أتوقع 
تحالفهم مع شريفه والأتراك 
اثر على اللغة عندهم فا مايفرق بين حصار ومقاطعة"
1135390286790778752,SA,"عزيزي بطل الدوري الإستثنائي 

 كل ما قل حماسك في الطقطقة شف هالفيديو هذا وتذكر أن هالأشكال كانت بتحتفل ويطقطقون عليك "
1136153735326032000,SA,"   افترضنا ان كلامك صحيح 

 وطبعا كله غير صحيح كذب وانت عارف كذاب 
هذا عطني وأحد على كلامك  وياليت مو من تلفزيون الجنزيرة
ثانيا السنع الحمدلله نعرف السنع 
البلا في طرد موطنين قطر سحب جناسيهموشردهم واكل حلاله ا
لي قلب على ابوه وبلغ  عليه بيسجنه 
مايقلب عل شعبه"
1152264880742895616,SA," في زمنا 
المال وانا اخوك"
1152265773626343424,SA,     هههههه خلك في فريقك المحلي وعطنا أخباره وقصة عشق عموري مع الهلال
1152298189917216768,SA,  من ذا واكثر يارب
1152298968501706752,SA,"  يعني انت الي تسوى ريال رياضيا 
وبعدين أعصابك طول عمركم مصخره يا محلي"
1166048606509588480,SA,ربع ساعه أولى النصر نار ناقصها هدف  النصرالسددورياسيا
1166302466268454912,SA," متعودين ابو عزام منهم 
مو شي جديد عليهم"
1172594960413204480,SA, اهم شي العصاء ثابته
1172927807170723840,SA, عرفت  وانا اخوك وين العصاء واقفه من العام
1007780006938972160,SA, اقتنعت انك طفشان  ما في احد الا و رديت عليه
1009103837054013440,SA, تذكر السوبيا اول رمضان نفس الأعراض
1009167657994719232,SA, الصدق في شبه  بس الاجمل معروف منو هو  و رزقك الله كل خير
1010525673407111168,SA," يا كلب الإعلام وينك مختفي 
بهذله بهذله بهذله الخ "
1010639055594369024,SA, دخلت جوء يا ليتني كنت معزوم 
1011553408501854208,SA,  شكرا لك و لكن خلاص ماهم راجعين ودي ألغيهم من حسابي
1011711177821507584,SA, هلا لي يومين ناقل عامل الى اسمي نزل في ابشر و باقي ما نزل في حسابي بوزارة العمل
1012027999481483264,SA," اطلب شهادة من الموقع المنشأة و لا تظهر لي مع انه يكتب اني منتظم و استحق  
و كيف أغير ايميلي الى إيميل اخر لانه يرفض"
1032059421961199616,SA, كل عام و انت بخير يا وجه السعد
1036284357445668864,SA, خدمة تسويق هواوي في خميس مشيط جدا سيئه و في تفضيل بين المحلات من قبل مندوبي هواوي ارجوا الانتباه حتى لوحة محلي هواوي الغيتها بسبب حركات المندوبين و التفضيل
1046517816059416576,SA, مبرووووك لك و لنا كجمهور وصلاوي تأهل الإمبراطور
1057026836570534016,SA,  الاخوان في سكاي نيوز  قسم بالله خسارة على الفاضي وجوده محد يتابعه تحياتي الناصح لكم
1057950907986526208,SA," للأسف  ما زال سوق كوم الأفضل ثم موقع علي بابا  
موقع ن جدا الداتا سيئه فيه موقع كبير و لكن الداتا سيئه 
اتمنى تطويره"
1057956644833902592,SA,   لازم اشهر فيك حتى ترد  اعرف أجيبك
1065147192766279552,SA, ابو ناصر حتى انا مجبور زيك   
1065747511414071168,SA, و الله انك تستأهل  التواضع يرفع الإنسان و انت من من يشهد لك الناس بالتواضع مبرووووك
1071448958373937152,SA, سجده اخر الليل و ندعي على من ظلمنا  الحكم ظلم الهلال و انت تمدحه
1079833142435999616,SA,    يا رب ضمك يصعد
1088072990259060736,SA,  معليك ما هو مسوي شيء يحتاج الملعب لكم مبارة
1089968898315825152,SA, طيب ابها ما لها نصيب
1090653261059768448,SA, عديها يا عبدالرحمن الاتحاد السعودية ما عندك احد و انتم في كل جولة لازم تسوون مشكلة الملعب و ملعبنا  عملتو مشكلة من مواضيع تافهه
1092224519522185216,SA, يمه  الصوت يخرع طميم
1092229213099307008,SA, تعيش قحطان  و النعم فيهم  نعم الاصحاب منهم  اهل كرم و جود و مواقف 
1093981280688131968,SA,  تكفى نبي بيومي فؤاد
1096137568847048832,SA, الف مبروووك ابو لطيفة
1098674332044324864,SA, ليله انتصر فيها الهلال و الوصل فأكيد جميلة
1101240791329054848,SA,   لو جيت عندنا وش بتقول من كثر الحفريات ضيعت بيتنا  الحصن 
1102134770971172864,SA,  صديقك الإيطالي بما انه خطير و كذا أساله البيتزا كم يبي لها وقت حتى تكون جاهزة
1104885846589796352,SA,بالتوفيق للنصر السعودي   النصرذوباهن
1105244133436862464,SA, يا ماجد عارف انك مقهور و لكن باقي ما شفت شيء
1109043569095069568,SA, ما صغيرة و كبيرة الا و تدخل فيها  و النتيجة  مكشوف
1118928298472607616,SA,  الفريق سيئ سنحاسبه اما ماسك كورة و يجي حكم  عبيط  لا و الله لا نرضى
1121834753966186368,SA,احسن  زوران المفرج محمد بن فيصل   الهلالالتعاون
1129180582980857984,SA,  قلت لك يا الدحمي  بس
1129798553327546368,SA,"جدار محسن جدار قصير من بغاه نط عليه 
 العاصوف"
1131873154639507584,SA, معروف  على الخاص ابشر
1132458967534374784,SA,"وش رأيكم يبارك للمحلي مثلا 
  فيفايباركلبطلالدوري"
1132464020328464384,SA,  هما الكوشة فلابد يبخرو ويصورو ثم يسلموه للعريس
1132464645527277568,SA,  على طاري الزرف هم رجعو الكاس النسخة ولا مارجعوه
1132466778913878016,SA," سبحان الله 
فعلى كل واحد يشوف الناس بعين طبعه 
لكن فيه شي محيرني الغباء الي فيك جينات متوارثه وزادت بعد حليب الحمير 
ولا هو نفس الحال قبل وبعد الحليب"
1132483395609612416,SA,   دارين انك تدري ومسوي نفسك ماتدري
1132491337155186816,SA,  حنا فرحنا ببطولة غيرنا فرح بهدف تعادل 
1132709031351586816,SA,الله يمسيكم بكل خير 
1143202176271097984,SA, و النعم في اخوي طلال يكفي انك زعيم هلالي
1147342052306411648,SA,  العفو اخوي طلال  و اي خدمة حاضرين
1172859510370664448,SA,  أنا أقول ليه فزنا  طلع الشيخ احمد بن جلاله موجود  الله يوفقكم كلنافارسالجنوب
900779785189810176,SA, و لك مثال واضح  حمد و تميم  واحد عاق و واحد ثور
901842002211430400,SA,مهما يصير  مافي المراعي  
902442694181625984,SA, تذكرت تاجر كبير في خميس مشيط  أملاكه على مد البصر و لا يوم شفت عنده مؤظف سعودي واحد  عرفته 
902640778652131200,SA,  تذكر هالصورة  هي لوحدها عار على حاكم تابع لعمك عزمي  سيادة يا ورع 
902840542622560384,SA, أعطوني وحده هدية زي ما عمل الراجحي مع صاحبه وقتها اعرف و اقول للعشاق كيف هي
904430696332222464,SA, الرجال يناطح أصحابه في الجزيرة في الاعلام تحدي مين يسب اكثر
905153328589529216,SA,الف مبرووووك يا وجه السعد 
905155875022798848,SA,  وش دخلك  خليك بالخياس
905173741621129216,SA,هذا الحمار وش يبي  مصير قطر ترجع و انت و امثالك عار على الخليج نهايتكم قد قربت 
905790017678839808,SA,"        
مقر مسرحية شنو بطولة عزمي و عياله "
906240495520710784,SA, بارك الله فيك معلومات و دروس مفيدة جدا
906275844225683584,SA,راحوا و تعبوا من اول نقول   الحلفيالرياض
906954401717391360,SA, احسنت اخي يعقوب بفك تشفيرت الحقود عزمي بياره
907575198081220608,SA,   يعني الغرامة علي جايه جايه  و انا أسدد كل شهر بأنتظام الحمدلله شكرا على المعلومة  هل لي الحق اني اعترض 
908634278015234048,SA,"احبابي في السعودية انا اغرد من المريخ  القهوة معنا  بأنتظاركم 
يا شين حليب الحمير "
909735948077993984,SA, أعلان تسويقي جميل اخ نايف  بس في غلاء
909830291761565568,SA, كفو يا طراد  هالحسابات يبي لهم شغل و ننظف تويتر منها
912987144662241152,SA, ههههههههه اضحك الله سنك 
912994727850541056,SA, وين سيارتي الفيلكس  ظالمين سيارتي ليه
914883117235785600,SA,شوفوا مين يتكلم  أكبر منافق عرفته الكويت  على فكره الصالح هرب من الكويت و يطالب بن فطيس بالعودة  
916328271322722432,SA, يا ليت عزمتني  التذاكر مرتفعه و الفنادق صارت فوق
921140273886920832,SA, اعرف عائلة جدا فقيرة ما عندهم بيت  وش رأيك تكلم ربعك يساعدوهم
921729073990324224,SA, مبدع اخي فايع الله يوفقك
922202547959541760,SA,"من اول مقاطعهم  أسعار نار 
في الحارة عندنا ب  ريال و طعم خطير  انااقاطعبيتزاهت"
934392674437787648,SA,سالم اخر سنة  ياسر اعتزل اصبحت فأل سيئ  مختار و لا هجمه  المعيوف شكرا  دياز  ما قصرت  جحفلي حسنة وحدة و الف غلطة  نواف بن سعد شكرا  المفرج خلاص ريحنا و اطلع  ميلسي غلط ضيعت الحلم   الهلال بحاجة الى مهاجم مع عمر
938077220672823168,SA, و انت فارسي و انت شريفة و انت جاحد و انت غبي و انت نصاب و انت ساقط في الخليج
941669295024680960,SA,كفو يا ناشئين ضمك  الفريق الاولى لو تلعبوا مكانه يكون احسن 
941923015427846016,SA, خسارة فلوس عالفاضي  و المشكلة عندهم ازمة اقتصادية الان شعب مهايطي
942079376790827008,SA,  بيختفي و لا يرد  زي العادة الا تركيا و قطر لا يقدر ان ينتقدها و اذا فعل بيفقد الشيكات و الهدايا
942420121687134208,SA, على حسب فلوسك و مكاتب فرسان تخدمك اذا انت برى الرياض و الدمام و جدة
942426250236350464,SA,  دولتهم حبيبة شريفة كلها مهكره و مفبركة تأثير حليب الحمير مفعوله زاد 
943831503129206784,SA, عاملين لي بلوك  ما اقدر اشوف و اغرد
944304721095004160,SA," الي يبي ورق عنب يتواصل مع وجه السحليه هذا

حررنا دول و هذا ما يمنع ندعمهم  
لا تغلط على شعب المملكة يا طفل عزمي فرع الاعلام"
944357432515596416,SA, لو سمحت يالطيب  حطلي معك ملفوف  نقنقه 
944649868403933184,SA,القناة بحاجة لمدير سعودي متمكن و ثقه  عندنا سلمان الدوسري و عضوان الاحمري مع اني اتمنى نايفكو يديرها لانه بيسوي جلطه لجماعة اردوغان و الحمدين و الصحوة   وزارهالاعلامتنذر
944872764317552640,SA,هذا الاردوغان مأخذ مقلب بنفسه  شين و قوي عين 
948965130917826560,SA, المزور نسى علامة التوثيق 
949939851276832768,SA, ما زرت فرع الا و اشوف اخواننا من مصر فيه  من مصر و واحد سعودي و بعضها ما في
956516746294382592,SA," انتبه لدوامك و لا تنشغل بتويتر و التعدد قبل  العشاء ينتهي دوامك و بعدها غرد حتى الفجر 
المدير العام "
960828163692654592,SA,كلهم كبار سن  ما آمون عليهم كثير الله يحفظهم   منتحباكثرخوالكولاعمانك
961002772165529600,SA, طيب انا صاحب مؤسسة متوسطه دخلها ما يزيد عن  شهريا و مطلوب مني  ريال  و عندي رسوم تجديد رخصة و سجل و اقامات و عندي تأمينات  وش رأيك تضمني مع العاطلين و خلي الفلسفه تنفعك يا دكتور اقسم بالله مبلغ كبير علينا و العطالة بتكون اقرب من ان أواصل التجارة
961003196591362048,SA,  انا اقدر اعطي راتب  لأجنبي و لكن ما اقدر اعطي راتب  لسعودي لا تجبرني على راتب معين ما اقدر اعطيه
961179079708958848,SA, كنت انتظر تعليقك  لأن لك تأثير سليم اقسم بالله طلع علي  ريال و مدري كيف اسددهم 
961900738971684864,SA," مثل ما تحاربنا بإسلوبك هذا و تحليلك الغير منطقي اسأل من الله انه يحطك يوما ما مكاننا  لعلمك دخلنا ما يتجاوز  ريال شهريا بعد تسديد كل ما يلزم و تأتي الان تفتي بدون علم 
طيب سجلني عاطل جديد"
961909328075743232,SA, عادي  خلوه يرتاح حتى نهاية الموسم
963031032290316416,SA,مطبق   لوبتسميبنتكعلياخرشياكلته
964498230498209792,SA, لازم اضبطه  نص مليون ماهي سهله
964524156829273984,SA, المشكلة جايبين حواجز  يعني مشكلة على مشكلة و صار مشكل بالفرن
964524742966431616,SA, لا تنساني بواحد مخلوط
966438986083393536,SA, انا هلالي و عناد فيك يا حزام الغبي بأدعم النصر بدعم النادي ب  ريال شهريا وش دخلك فينا يا عميل الحمدين
970745266893676416,SA, انت المتهم و حاضر عن نفسك اي مكان تروح له تسبب ازمة على المندي عاد لو جيت الجنوب عندنا بتسبب ازمة على الحنيذ 
990237628334211200,SA,   انصحك فيك عبدالرحمن الجوني من ابها مبدع و كل شغلنا عنده
990890783992672384,SA, اكثر من  أسبوع تقريبا 
1005089490275307648,SA," على أساس الأجنبي بيجيك معرب الجدين وطاقها لطمه 
بالفعل أنت جنرال جنرال في الإساءة"
1005149668932808832,SA,"أجمل  دقيقه يقدمها الأخضر بكامل ودياته
تقدر يالأخضر "
1005153402475687936,SA,"اللي قاعد يقدمه سالم في الفترة الحالية شيء جبار ونضج وتطور كروي عالمي 
السعوديةالمانيا
معاكيالاخضر "
1007285843218837632,SA,"مستحيل اللي قاعد يسويه عمر هوساوي مع كل كرة تصل إلى أقدامه
ثقافة الإنبراش والتشتيت "
1007287645091836032,SA,عمر كارثي ودفاع مرتبك الثاني لروسيا 
1011075410048815232,SA,"اللي أقوله يختلف عن كلامي
ماكل كيف الحال قصدي بها الحال
أحيان كيفك تعني القلب ظامي
وأحيان وينك تعني البعد قتال"
1013113688839065600,SA, أسطورتنا وقائدنا أبو البندري ممكن نشوفك بالتدريب بعد هالمسيرة الكبيرة والمجد اللي حصدته 
1015242456005300224,SA," تواجد ليمار بيغير الكثير
خسارة يكون عندك مارسيال وليمار واحد بالدكة وواحد مخليه باليونايتد "
1015877331355885568,SA," يعني نقدر نقول ظروف المباراة تعطي  من شكل الفريق
ممكن نشكل عمل المدرب على نسبة  "
1017813952586289152,SA," مستحيل تفكر فيه دام الشيوخ ماعطوه الضوء الأخضر
علاقته مع شيوخ العين أكبر من العقود"
1030885183652855808,SA,"علي البليهي يقدم مباراة للعمر
تفكرون بمدافع أجنبي ثاني ولديكم سد منيع كهذا "
1030905684341215232,SA, يبارك فيك يامايسترو الهلال يحتاجك ويفتقد سلمان العازف عد لنا 
1032771461000454016,SA,"الصورة موجعه
قدامك العافية يابو ناصر 
سلامتكتركيآلالشيخ "
1044271113373732864,SA, اعتذر يافواز للأسطورة محمد سرررررييييعععع 
1045720914946658432,SA," هههههههههههههههههههههههههههههههههههههههههههههههههه منت صاحي والله 
بس لو ذبحت اللي امس "
1047445427019296768,SA,"  اول الليل نبني فالسماء كبري  واخر الليل لا رحنا ولا جينا
امدحوني"
1048676328764055552,SA, الله لا يلومهم ارثع بهم طال عمره 
1050839123458752384,SA,"سلم لي على العمل اللي تقدمه ياشيخ 
حسين جناح بعمر  عام
مدرب كل تغييراته وتكتيكه طلع ظهير ودخل ظهير 
وحارسك مصطفى ملائكه رجيع الدرجة الأولى"
1053695431736287232,SA, يارب اتمنى انخذل باحساسي 
1133042441471352832,SA," أنساك  دا كلام أنساك  يا سلام
أهو دا اللي مش ممكن أبدا
ولا أفكر فيه أبدا
دا مستحيل قلبي يميل ويحب يوم غيرك أبدا"
1133068270947504000,SA, وش تتوقع مجهز الغالي لنا 
1133071365056204800,SA,  والحين اللي يصلون يهود بني قريضة 
1133885338529800192,SA, ماهو منك من اللي سحبوا علينا 
1135221122167967616,SA,  اللي صدق يستاهل الواحد يطالب فيه عباس إبراهيم ويرجع بقوة للساحة
1135222859633234048,SA,"  على حسب قوله أسباب شخصية 
بس بإذن الله فيه وعود أنه راح يرجع أعظم مستقبل للأغنية السعودية"
1161665509940695040,SA," وين كلامك هذا أيام كوزمين وحملتكم النتنه عليه 
مبادئ بريالين"
1175079244822732800,SA, ترى مافيييه تحضير اشبع نوم 
1175467911722536960,SA, ما يمديك تكمل للأسف
872509188798373888,SA,  بالله عليك  انت حجمك مثل اصغر حي عندنا  مافي تأثير  لا تنسى تعلمهم انك بعت ارضك للفرس و الترك و دعمت ارهاب الاخوان و القاعدة
872982190447001600,SA, مسكين يا خالد  انا متأكد انك تبي تبين جرم قيادتك  بس خايف على نفسك و اهل بيتك من الحرس الثوري الايراني المتواجد عندك
877216397184684032,SA,عزمي هرب  و يوسف ورى مصلحته  و حمد راح فيها  و تميم ما زال يدفع  هذه هي النتيجة   سيلفي
877331806940389376,SA,مهما يصير  ما في المراعي   قطرمخترقهبالايفون 
879758802949734400,SA," هياط  كل السياح الموجودين  واحد و عملتوا هياط 
بعيد عندك و عن غيرك توصل مثل دبي و جدة"
882027197380349952,SA," تبي الصدق عندي أصدقاء قطريين كثير  كل شوي سب بالسعودية  
لبن الحمير لعب فيهم لعب"
882181622971469824,SA, ما زال النائب البلدي يغرد  يا حمد مش مستغربه منك و كلمة حصار ستندم عليها بعد رحيل طميم 
882216884640391168,SA, عاشت السلطنة و عاش سلطانها  اهل الطيبه و المحبه
882227923079581696,SA, كفوووو تصميم رائع و تستأهل أرابتك
883676281547706368,SA, طلعت واصل مثلك ما منعوا عني تويتر حححح هاشتاق غبي
885027838180683776,SA,"اليوم ما يبدأ بعد طلعة الشمس
يبدأ معك وإذا أنتهى ينتهي فيك

يالي ورى جفونك بدا وأنتهى أمس
اصحى بنبدأ يومنا الله يخليك

لشاعرها "
885473885013106688,SA,"من منتصف الموسم الماضي مزعجينا بالأرقام والأرقام على ياسر
اليوم هوامير الغفلة يقولون وش علينا من الأرقام ليست مقياس "
885561490132086784,SA, الله يشفيه يوصل بالسلامة
887438712262598656,SA, ريالهم القطري ما يسوى شيء من عندي  الف درهم لو يبي يبيع  بس مشكلة ريالهم صار وسخ من دعم الارهاب
890630336182276096,SA,بلنتي واضح يا حكم قدام عيونك 
893458944328437760,SA,"مساكم الله بالخير
الشباب وين حصل هالخيشة وسدد كل شيء "
893843661431222272,SA, أبشر بالسعد يابو راكان وخل دليم والبندق يقعدون بقناتهم اللي يدورون ثغرتها 
894972341620551680,SA,دياز جاهزين محليا وخارجيا  ميليسي نفكر بالموسم ككل  صحيفة المرمى  
895015238420103168,SA,هذا وقت رونالدو واسينسو يازيزو عقم هجومي من بيل وبنزيما 
897525432760795136,SA,"الوالي 
تكفى يادياز خيبري بديل العابد"
898976964760829952,SA,   صورة ثانية له و هو خايف  الوزير نامق 
899093873422675968,SA,صار منتفخ مثل ابوه الكذاب  الظاهر من كثر اكل الموز 
899171600049852416,SA,سلتوحة موزه  تعبد الريال القطري لدرجة تبي تتزوج تميم 
899176122168090624,SA,ليبيا تنتصر  تونس تنتصر اليمن تنتصر  بعد خروج الأفعى قطر
899392084557385728,SA,ما له حس وجه النكبه   تميميحاصرحجاجقطر 
899942761021014016,SA, انت نص شعبك بدون اثبات  هذا و عندكم بترول
900021260536745984,SA, ممكن كان اقتنع و لا يسأل احد غيري
902591898644250624,SA,"وش اللي يصير 
أتمنى يخذلني بتغييراته الغريبة"
907370536057163776,SA,"صورة عظيمة 
تصبحون على خير "
910929884016513024,SA,شوط أول سيء للهلال الخلل واضح عطيف بديل الخيبري لبناء الهجمة وتنظيم وسط الملعب 
910934238815453184,SA," ي رجل وش انت خاف ربك 
الدولة لازم تستغل هالموهبه الكبيرة "
912726507495272448,SA,"من طول الغيبات جاب الغنايم 
الله اكبر يا عمر
ياكبير يا سالم
ياكبير يا سالم "
