id,dialect,text
1054841957413982208,EG, انا اللينك فتح عندي انا كنت مفكراه عربي مش غربي
1054848019844292608,EG, ربنا يستر في النهائي لو لعبو بالمستوى ده هتبقى كارثة
1054848354369310848,EG, كل واحد ومقامه ويرجع ويقول انا نادي الكرن الحكيكي
1054851475644600448,EG,معتزمطر ممكن تسأل استاذ حمزة هو ليه بيعمل ريتويت على التويتات اللي بيكون فيها اساءه له
1038847537237696384,EG,عبداللهالسعيد هيجي الزمالك يقعد ع الدكه لإنه جاي بناء على رغبة مرتضى مش رغبة جروس زيه زي النقاز وساسي واحداد بالرغم انهم لاعيبه جامده
1038864729685602432,EG, اقولك الحمر دول يبقوا إيه وماتزعليش
1039181728160641024,EG,  انتو بتكتبوا اخبار عننا ليهانا داخله اعلق على خبر الاهلي مالي انا ومالكم
1039549478137680000,EG,محدش يسلفني مليون دولار ووعد هرجعهم تاني إن شاء الله
1039552547084808192,EG,"صالحسليم
ناس كتير اختلفوا على طباعه وشخصيتهلكن اللي اتقق عليه الجميع إنه إداري ناجح بامتياز والاهلي في عصره كان في فتره ذهبيهالله يرحمك "
1039676971842772992,EG, عيب وان هضحك عليك يعني
1040023498511527936,EG,"تركيالالشيخ
قلبي حاسس إنها تمثيليه هابطه وفي مصايب جايه كتير"
1040207544311078784,EG, هههههههههه انا بتقطع من جوايا ونسيت طعم الفرحه
1040209173840048000,EG, اللي دايما واقف في ضهر الاهلي جماهيره عشان كده الاهلي عمر ضهره ما هيبقى مكشوفوإعلاميين بيراميدز معظمهم زملكاويه هما ولاعيبة النادي 
1040268153572544384,EG, مش بيقولك الغربال الجديد له شدهاساس اي نادي الجماهير فقط مش الإعلاميين سواء اهلي او زمالك هيفضلوا حائط سد قدام بيراميدز
1041030432769417216,EG,"عايز تعرف إيه اللي مزعلها
إنت إتجننتإذا كان هي نفسها مش عارفه إيه اللي مزعلها"
1041356422393593984,EG,"ابعادالالشيخياوليالعهد
الجماهير السعوديه ماسكه تركيآلالشيخ وهاتك يا دعك وشكله هياخد استماره ستهوبتوع بيراميدز هيسرحوا بمناديل"
1041393830002651136,EG, امتى بقى نسمع إنه غار في داهيه
1041414298420035584,EG, كل الفلوس اللي بيصرفها دي بياخدها على حس منصبه الكبير في السعوديه دي مش فلوسه الشخصيه لو تم إعفائه مش هيبقى في فلوس من غير حساب زي دلوقتي
1041415520086617984,EG, بس اللي دفع لهم دول مبيشبعوش لو بطل يدفع هتقلب معاهم بقلة اصل واولهم ضاضا اللي كل يوم بيصحى الصبح يبوس إيده لو بطل يدفعله هيقولو سيديهاتك
1041811099216240640,EG,"الدوريالمصري
دوري مرجان احمد مرجان المال نعمه كبيره لكن لما تروح في إيد اللي ميستحقهاش بتبقى نقمه وسبب رئيسي في الظلم والفساد"
1042181074745479168,EG,"ليفربولباريس
انا بحب فيرمينو ده اووووووي وبفرح لما بيجيب جول زي ما بفرح لصلاح "
1042182116799336448,EG, اعظم محلل مصريمش عارفه إزاي إنت بره مصر وسايبين لنا شلبي وشوبير والناس العار دي كلها
1042187883736690816,EG,  اكيدهو ده الحب والتضحيه ولا بلاش
1042188240667770752,EG, هههههههه الافلام الرعب بوظت دماغنا
1042199964338843648,EG,  منافسهحلوين اوي انتو في التبرير لنفسكم
1042481316179136384,EG, هههههههههه حرام عليك بطني وجعتني من الضحك
1042483733289468032,EG,مرتضيمنصور بيقول إحنا عاملين توأما مع نادي بيراميدزإمش متخيله الام اللي تجيب مرتضى وتركي دي عامله إزايصحيح متخفش من الهبله خاف من خلفتها
1042543188932800384,EG,"مدحتشلبيافضلمذيععربي
مدحت شلبي افضل منااااااافق عربي
بيرقص في كل الافراحوبياكل من كل الاطباق
شخصيه وسخه وشغال على كل لون"
1042800324451487616,EG, طيب والنتيجه كانت إيهخلى واحد زي ده مرمط سمعته ف الوحل
1042801308401655808,EG, ههههههه يستاهلوا اكتر من كده
1042801433270210560,EG, من زماااااااان مش جديد عليه
1042802644698492800,EG, صح يولعوا قريب إن شاء الله هما الاتنين
1042802773182636032,EG, هي السلاله دي مش هتنتهي ولا إيه
1042803802921987968,EG,"امالماهر
بعد الشوال ما كتبلها برج الحوتضربها وهو ورا قرار المنع ده في بلد المهلبيهياريت الخدامين بتوع بيراميدز يعرفوا إن غدره قريب اوي"
1042804466620276736,EG, ههههههههه صح حلوه دي
1042833064743895040,EG,"السوبرالمصريالسعودي
طيب وبعدين ف القرف وقلة القيمه دي
بعد كل اللي حصل ده هتروحوا تلعبوه هناك
الله يلعن اليوم اللي شوفناك فيه يا شوال"
1042878570031394816,EG, معلش هنعمله التعريص زي مرتضى
1042878905546407936,EG, بعد كل اللي حصل من تركي ومن الاتحاد السعودي مكانش ينفع المباراة تتلعب هناك او هنا ابعد عن الشر وغنيله
1042879167350677632,EG, انا وانت عارفين إن الموضوع بقى ف إيد الدوله مش ف إيد بيبو
1042912730112552960,EG, معاك حق في دي هوالسبب في دخوله النادي لكن اللي ييحيوا الاهلي بجد مكانوش فرحانين بالعكس قعدوا يحظروا بس للاسف محدش سمع
1042913582881689600,EG, اه من جيل ابو تريكه وبعدين مين عبده البقال ده انا بتكلم فإيه وانت بتتكلم فإيهلو الاهلي كان زي الزمالك سداح مداح مكانش تركي مشي منه
1042915655241093248,EG, لا مش عايزه اعرفوبعدين لو كان بيتدخل زمان ف الاهلي لإنه كان رئيس شرفي إنما الهوب هوب كنتالوب اللي بيعمله في الزمالك ده يبقى إيه
1042915824380592000,EG, في مثل حلو اوي بيقول لا تعايرني ولا اعايرك الهم طايلني وطايلك 
1042921652965859200,EG, ويفرحك إنت كمانالمشكله إن اللي بيحصل مبقاش رياضه بقيت إهانه لمصر بحجة الرياضه الموضوع اكبر من اهلي وزمالك
1042922001889984384,EG, لا معلومه غلط تركي تاني سعودي يدعم الاهلي بعد الامير فيصل في السبعينات او الثمانينات مش فاكره إمتى بالظبط
1043167356040740864,EG, في الشارع قدام بيتها في المعادي وعملتلو محضر وبعدها اتنازلت عنهويقال إنه كان متجوزها ف السر
1043167483815964800,EG,  عادي مش اول مره إيه الجديد
1043169296778711040,EG, هههههههه لا طبعا لامال هانم
1043263673962323968,EG, مرتضى لبخ ف الخطيب وعبد الحفيظ قطعه وقاله معندناش رئيس نادي بيعمل مداخلات اكتر ما بيدخل الحمام وكلام من ده كتير
1043535547480912000,EG, صح معاك حق ربنا يخلصنا من القرف ده
1043610356420173824,EG,"افريقيايااهلي
جماهير رايحه عشان بتحب وتعشق النادي بجدومش بيغيرو مبادئهمولا بيروحوا يشجعوا عشان وجبه وجنيه
الاهلىحوريا "
1043610968079654784,EG, مش جايبه همها خلينا نفرح شويه
1043613289287221248,EG, الله يخليكويفرحك إنت كمان
1043637580414242816,EG, خليهم بقى يروحوا يرجعوا تيشرتات هورويا ويشتروا بتمنها مولتو عشان عندهم مدارس بكره ههههههههه
1043638975733350400,EG,"افريقيايااهلي
ياريت الاخوه اللي اشترو تيشرتات هورويا يروحوا يرجعوها بقى ويجيبوا بتمنها شيبسي ومولتو عشان المدارس بكره ههههههههههههه"
1043640913522774016,EG,  كله حاجه وابو الهول حاجه تانيه خاااالص هههههههه فن بجدهههههههههه
1043876443866968064,EG,آمالماهر اموت واعرف إنتي إزاي كنتي متجوزه اللي اسمه تركيالشيخ دهجبتي نفس منينده شبه اتوبيس الحضانه
1043881715830345600,EG,وليدازارو إمبارح كان نفسه يسجل وحارس كوناكري سايبها سداح مداحومش بيتالق غير قدام ازارو حرقة دم بصراحه الاهلىحوريا 
1044250483618181248,EG,  بس الامر بقى مكشوف
1044385375278518400,EG,"تركيالالشيخ
ماتجمد كده يا تركي إنت فرفرت من اول شتيمه ليه كده "
1044385686487539584,EG,"تركيالالشيخ
لما تيجي الحته بتاعت الرئيس السيسي اتدخل وحل المشكله ابقوا صحوني عشان الحته دي حلوه اوي اوي اوي
معتزمطر"
1044388888763158400,EG,"تركيالالشيخ
ربنا يستر على الاهلي وجمهوره الايام الجايه ديحاسه إن الموضوع ده مش هيخلص بالسهل ابداوفي إجراءات إنتقاميه هتحصلاستر يارب"
1044602009544994816,EG, يااخي إحنا ضد التجاوز لكن مافعله تركي في مصر وفي الرياضه المصريه صعب جدا ولو كان واحد مصري عمله ف السعوديه كنتوا هتعملو اكتر من كده
1044603901108981760,EG,"الاتركيالالشيخ
في إشاعات كده والله اعلم إن حسامالبدري بعد غلق بيراميدز بيفكر بفتح مشروع تين شوكي في كندا
سلملي ع اللي بيغيرو مبادئهم"
1044604525481472000,EG,"الاتركيالالشيخ
تووووووووووووركي رايح وسايبنه لمين يا تووووووووووركي ده إحنا غيرنا مبادئنا علشانك "
1044605563554869248,EG,"الاتركيالالشيخ
السعوديين اللي عايشين فيها دور الملايكه وام تركي امنا جميعاوصفه الشيخهموزه ام امير قطر باقذر الالفاظ بلاش بقى تمثيل"
1044606891886874624,EG, تمام وقتها كنا بندعمه لما كان بيظهر حسن نيتهلكن بعد كده إيه اللي حصل شتيمه وبهدلت رموز النادي وتشهير في كل القنوات المطلوب نفضل ندعمه تاني
1044610036377559040,EG,"الاتركيالالشيخ
طيب والجماهير العريضه دي هتعملوا فيها إيه
هتوزعهم على الانديه هما كمان زي اللاعيبه
طالعمره مدحتشلبي "
1044612184205144064,EG, ممكن بردو اصل قطع العيش وحش
1044641560565075968,EG,  متشتموش انا كده كده عملتله بلوك
1044641880556867584,EG, كدابه بهدلتوها وتويتر مليان فضايح
1044642402458357760,EG,  سيبك منهم دول مش بيشوفو غير غلط غيرهم وفاكرين نفسهم ملايكه
1044645172334788608,EG, ماليش دعوه بالمسئولين ولا الإعلام انا بتكلم عن الناس العاديه
1044678249488494592,EG,  بردو امك اسمها فوزيه
1044684184328056832,EG,"القمه الناراللي إعلام العار هيرغي فيه سنين قدام
ترامب جزمتك حلوه يا سيسي
السيسى لون شعرك يجنن يا ترامب
بس كدهاه امال إنت فاكر إيه"
1044684952653246464,EG, ده ماتش في البطوله العربيه بيرعاها وبيديرها تركي
1044969846994292736,EG, ههههههه بجد في برنامج إيه وامتى
1044972689906172032,EG,"الالشيخ
ليه بس كده يا تركيهو وشك الاولاني باظ من الشتيمه ولا إيهطالعمره "
1044973464958972032,EG, قال إيه جت ف اول الحلقه ولا في الاخر عشان اشوفها ع اليوتيوب
1045001341691719552,EG,بيعجبني دايما في عمرودياب إنه بعيد عن ااسياسه والمشاكل والقرفبس المره دي حسبها غلط  صوره مش مناسبه خالص وف وقت غيي 
1045057823334445056,EG, لإنه النقطه البيضه الوحيده في وسط السواد اللي عايشين ومصممين يهدموه لكن ده مستحيللما يشوفو قفاهم إن شاءاللهالاهليفوقالجميع 
1045066965239378048,EG, احب ابشرك إن احتمال إن الاهلي يخسر كبييييير جدا تركي معين حكم للماتش اتوقف اكتر ما حكم مباريات وزمته اوسع من خرم الاوزون ماشاءالله
1045105785070604416,EG,"الاهليفوقالجميع
انا الاهلي اللي كان والحاضر انا الاسم اللي هد جبال من الاول لحد الاخر هيفضل مصنع الابطال
انزلعشانالاهلي "
1045403237476683776,EG,"مينقالمافيناللاهلي
الهاشتاخ وتعليقات اللبنانين حلوه اويوفرحتهم إنهم خسروا بس تخليك فخور اوي بالاهلي
دمت فخرا لنا يا اهلي"
1045404026446262400,EG,"مينقالمافيناللاهلي
هو يعني إيه ما فينا للاهلي"
1045438844756217984,EG, تركي بيكتب اغانيرلعمرو والتاني ده ملحن او موزع تقريبا
1045985243117867008,EG,"اليومالعالميللقهوه
احلى يوم ده ولا إيه
انا من عشاق القهوه"
1046106503835504640,EG,"مرتضيمنصور
خلي طالعمره يجيبلك عقد عمل في السعوديه احسن ما نقعد السنه دي في البيت يا ضاضايالا في داهيه"
1046423435138740224,EG,"زعيمتويترفلورزالاحد
وتيجي واحده مقشفه تقولك ما عمري شفت مصريات جميلاتها شوفتي ولا لسه "
1046549975725997952,EG,يااااااااه يا عمرو حتى انت طلعت بتحب الرزده التعريص ملى الكيسلا سحيح ملى الكيس يعني عمرودياب طالعمره 
1046550745343029248,EG, للاسف صح حتى اللي مش محتاج يعمل كده بقى يعمل
1046776719749844992,EG, انا كمان بسأل نفس السؤال ليه ليعمل كده وهو عارف ان عدد كبيييير من جمهوره هيزعلمتقوليش صداقه والنبي
1046777833098551168,EG, حضرتك تركي خارب الدنيا في مصر وبمهدل آمال ماهر وهو يعرفوا من زمان ليه الحب الأوفر ده دلوقتي
1046778972242137216,EG, بيكتبله من زمان وعمره ما نزل صوره معاه ولا هو بيستفز جمهور الاهليوبعدين مشاكله مش بس مع الاهلي انت مسمعتكش بهدلته آمال ماهر و عيلتها
1046782302548881408,EG,بالرغم اني اهلاويه جدا لكن بصراحه بحب وبحترم حازمامام جدا هو مش بس من الشخصيات المحترمه في الزمالك لا ده من الشخصيات المحترمه في مصر كلها حاجه تشرف بجد 
1046787823939010560,EG, هو طول عمره بعيد عن المشاكل اللي من النوع دهليه يجاوب المرة دي وسط المشاكل اللي مع تركي دي كلها
1046788178122874752,EG, اه مقتنعةهو يعرفه من سنه وأول مرة نشوف الحب والصداقة للزياده دي
1046810634208378752,EG, انا كمان مش عاجبني التصرف بس بسمع عمرو وسمعت الألبوم امبارح ومش تبطل احبه ده حاجه وده حاجه
1046810979823230976,EG, ياعم مالك انت زعلان كده ليه ايه جمهورنا  وجمهوركم قسمتنا اتنين ليه
1046851384048590848,EG,بعد كل اللي بيحصل مع الاهلي وجماهيره بعد شتيمة طالعمره اللي ممشي  المسئولين في مصر بالفلوس المسئول  اللي هسمعه تاني مره بيقول مصر دوله ذات سياده هقوله سياده دي تبقى امك لا مؤاخذه 
1046853654706356224,EG, ولا رايق ولا حاجه الواحد هيطق من اللي بيحصل فينا ده
1046858494413033600,EG,الواحد بقى يصحى كل يوم يدور في تويتر ايه المصيبه الجديده اللي حاصله في البلد النهارده للاسف مصر مبقتش بلد العجايب دي بقيت بلد المصايببورسعيد
1046887432954830848,EG,الناس اللي مصدقه ان تركيالالشيخ شاعر وهو فعلا اللي بيكتب الاغاني ديهي نفسها الناس اللي شايفه إنجازات السيسيهما نفسهم اللي بينافقوا سيدهم وكل ما يديهم على عينهم يقولواشالوط سعادتك خطوه للإمام يا فندمعمرودياب
1046913084198129664,EG, للاسف اللي تحت رجل تركي مش محتاجين رز لو فقرا ممكن تعذرهم لكن دول مليونيرات
1013500638548909952,EG, ممكن اسالك على كلمتين بشوف دايما اصدقائي المغاربه كاتبينهم ومش فاهماهمكلمة غادي و كلمة واخا وكلمة مغاديش ممكن 
1014928384344887168,EG, انت مش عايش معاتا ولا إيه
1016711081258049536,EG,"محمدفضلمديرتعاقداتفاشل
اول ماتلاقي ااشوال عامل هاشتاج مخصوص يسئ فيه لكابتن فضل يبقى القفا كان جامد اووووووي
في ريحة رز بيشيط يا جماعه"
1016711599644729216,EG,"اسطوانهالامهات
بتضرب اخواتك الصغيرين من دلوقتي
امال لما اموت هتعمل فيهم إيه"
1017156284787945600,EG,النهاردة في احد المستشفيات كان في واحد معرض بياخد حقنه ف العضل قام وقف فجأه عند عزف النشيد الوطني قامت الحقنه اتكسرت فيه ياعينيمعتزمطر
1017158470125138048,EG,"كرواتياانجلترا
شجعت كرواتيا عشانكمثال للنجاح وحب الوطن بجد اللي بيقول المراه متعرفش تدير دوله يشوف الست دي عملت إيه لبلدهاربنا يوعدنا "
1017421170679975936,EG, ههههههههههه رئيسه يارب يخليك شوفت كل فريق كرواتيا  اخر اسمه تتش  وماشاء الله مجتهدين ومش بيتعبوا فقلت اغير اسمي يمكن ابقى زيهم
1017421696586919936,EG, ههههههههه حلوة اوي دي
1017471547563528192,EG, انا كمان نفس الرأيولما قلت كدة ساعة مشكلة عبدالله السعيد ناس زعلت مني مع اني اهلاويه بس إحنا في زمن كرة الاحتراف مش انتماء عادي يعني
1017542255060639616,EG, طيب خليها ماس كهربائي كانت ممكن تتصدق لكن تقول إيه لابو 
1017543326340349952,EG,"مطارالقاهره
لما تيجي الحته بتاعت الإخوان هما السبب في الانفجار ابقوا صحوني عشان بحب الحته دي اوي اوي اوي
معتزمطر"
1017802998322483200,EG,"البدرشين
مش هتطلع لميس مرات الراجل الاقرع تقول السيسي مش قد الشيله متشلشزي ما قالتها لدكتور مرسي
ولا إيه يا إعلام العار"
1018277945620795392,EG, بتفكرنا ليه ماصدقنا نسينا
1018279363106824192,EG, انا بعد ماشوفت المنتخبات الكبيره بتلعب إزايانا مش بس نسيت الكره المصريه انا ناويه ادفنها واردم عليها بالتراب  للابدبذمتك إحنا بنلعب كره
1019674756109488000,EG,سؤالهو ليه لما بيجيلي رساله ع الخاص في تويتر او فيسبوك وامسحهاوافتح الايميل بتاعي من جهاز تاني غير جهازي تكون موجودهحد عنده تفسير
1019676399773331584,EG,هو موضوع الصلح بين الخطيب وتركيالالشيخ دة صحيارب يطلع إشاعه
1019941146120933376,EG, إيه علاقة دة بالسؤال انا بجد عايزة اعرف إيه التصرف الصح
1019943165619507200,EG, لو عايزين يشغلوا الرأي العام ياعزير هيشغلوه بممثله لبست ملابس مكشوفه او اتطلقتلكن مش هيشغلوا بوزير سعودي والاهلي الموضوع سياسي بامتياز
1020464556798291968,EG,"تابوتالاسكندريه
ايوه صح وكان معاهم ورقه برديه مكتوب عليها تحيا مصر مراتوبرديه تاتيه مكتوب فيه السيسيزعيميوأفتخر 
ارحمونا بقى يخربيتكم "
1020686133502578816,EG,"مرتضيمنصور
 انا اسمع ان الواحد ممكن يأجر عربيهبدلهفستاتدي جي لكن يأجر قناه لأ دي جديده بقىويقولك مفاجأه من العيار التقيلمفاجأه زفت"
1021474415635300352,EG,"يوليو
منكم لله انتو طلعتولنا من انهي داهيه
اللي هشوفه بعد كدة بيقول ثورة يوليو المجيده
هقوله مجيده دي تبقى امك
قال مجيده قال "
1021476094711681024,EG,"يوليو
منك لله يا انجي انتي السبب
كنتي سبتيه يقتلوا يا انجي ويخلصنا منه "
1021542206551875584,EG, مش قصدي انا اقصد ان دول عسكريين مش بيفهموا غير ف السلاح والحروب ولو حكموا بيفشلوا اتمنى لمصر نظام مدني متداول زي كل الدول المتقدمه
1021731367116107776,EG, اتفق معاك شوف تركيا كمان مثال رائع
1023300497816604800,EG,"افريقيايااهلي
قالوا صفقات الاهلي من الدرجه التانيه
الدرجه النانيه جاب جول وفوز غالي جدا
اما نشوف صفقاتكم اللي من الدرجه الاولى هتعمل إيه "
1023303792668934016,EG,"ارحلياسيسي
زعلان من هاشتاج ارحلياسيسي طيب ارحلياسيسي ارحلياسيسي ارحلياسيسي لحد ماترحل بجد مش عارفه بتفكرنا ليهجبتوا لنفسك"
1023308433020338176,EG,"ارحلياسيسي
بيعايرنا ويقولنا خرجتكم من مرحلة العوز والفقروهو كاذب وخلانا مسخرة الامم
هاراسوح امال لو كان عمل كده بجد كان شتمنا بالاب والام"
1023309255674421248,EG,"افريقيايااهلي
طيب ما الإنسجام طلع بيحصل من اول وتاني ماتش اهو
مش لازم يقعد سنتين ع الدكه عشان ينسجم يعني
منك لله ياللي ف باليكوليبالي"
1023314789731377152,EG, لا ياعم وامسك مكانه انا ليهمصر مليانه رجاله قد المسئوليه بس إحنا اللي ملناش حظ
1023997288279158784,EG,"مصربالنسبالكاي
بفضل اقنع نفسي اني مش بحبها ومش عايزة اعيش فيها
بس لو اي حد قال عنها كلمه وحشه دمي بيتحرق وبتجنن 
حاجه غريبه"
1024020033884876800,EG, انتو ابو الذوق والادب كله يا عزيز
1024021746352095232,EG, عادي بيزودا علينا من غير كيكي والله هو لقاها حجه بس
1024310948063064064,EG,"الدوريالمصري
عامر حسين بيقولك مشجع لكل فريق في المباريات
طب والنبي ياعم بحبحها شويه وخليها 
انت فاكر الانديه كلها بيراميدز ولا إيه"
1025132746480467968,EG,إيه ده يا شلبوكه إنت غيرت اسم برنامجك من مساء الانوار لمساء بيراميدزو هتفرق ف إيه الانوار من بيراميدزكله تعريضكله تعريضمدحتشلبي 
1025133979203260416,EG, لا ارد انا عمري ماكنت إخوان وعمري ما قيدتهم لكن اللي بيحصل معاهم ومع البلد كلها ظلم والرجل كان هيتقبض عليه عشان هو معارض مش نصاب
