id,dialect,text
1101011422056759168,AE,  ترا حتى و كريس موجود كنا نخسر  و  و غيرها ترا حتى و كريس موجود بس فزنا ب  لليغا ترا حتى و كريس موجود ما خذنا الكأس من فترة طويله يلعن ام النفاق بس تنتظرون الريال يتعثر عشان تنسفون كل تاريخه
1101013036687609984,AE, الا له دخل المدريدي ابدا ما يتشمت في مدريد و يوقف معاه في اصعب الظروف و ما يحول يشجع نادي ثاني عشان لاعب انتقل له
1101013903788728448,AE, انشهد والله الله يعيين جمهور اليوفي عليهم
1101018996000899200,AE, ماشي كلام فاضي ما بتشجعون مدريد الانديه كثيره حولوا عليهم و شجعوا عادي ترا مدريد ما يوقف على لاعب معين الفريق محتاج مهاجمين و تعزيزات كثيره
1101020181374087168,AE, محتاجين تعاقدات كثيره بالفريق والله يمكن هالخساره بعد كانت في صالحنا ان نطلع بموسم صفري ع الاقل قرصه لبيريز عشان يستوعب و يعزز الفريق بالصيف
1101021096730677248,AE,  ما اتكلم عنج اتكلم عن الي مثل فيصل و غيره يعني مدريد واقف عليهم اذا ما شجعوه بيقفلون النادي 
1101021716187365376,AE, من حقج هيه تنتقدين بس مب من حقج او حق غيرج تنسفون الريال او تعتقدون انه بس خلاص نهاية المطاف انه وقف على لاعب معين لا بابا الريال محتاج صيف قوي و تعزيزات مثل ما قلت كلنا نحب كريس لكن حاليا هو يوفنتي يعني مشجعين اليوفي لازم يفكرون بالي راح يقدمه لفريقهم مب مشجعين الريال
1101022418041298944,AE, في كثير مغادرين بالصيف و كوفاستش و خاميس شكلهم بيردون و اعتقد هازارد شهر  بيكون مدريدي يعني صيف قوي و تعديل الوضع في الفريق يمكن لو فزنا بيريز بيقول مب محتاجين تعاقدات
1101026352487170048,AE, كلنا من عشاقه لكن حتى و بوجوده  لليغا و حتى و بوجوده غبنا عن الكأس لسنوات طويله حتى و بوجوده خسرنا بهالنتايج الريال محتاج تعزيزات مب محتاج مشجعين كل شوي يصيحون على اسطورتهم سابقا و لاعب اليوفي حاليا المفروض اليوفنتي يفكر شو بيقدم له كريس مب المدريدي قلت لك من اول منشن
1101026516589314048,AE, اتفق والله بمليون مره
1101031071511134208,AE,  والله ما زعلنا كل ما حد ذكر اسمه و ما نكرنا كريس لكن هو حاليا في اليوفي يعني اذا صحتوا عليه راح يرد الريال و يعزز الهجوم ما ذبحت عمري الا نحن واقعيا ما نصيح ع الاطلال مثل غيرنا 
1101031748668981248,AE,  ذبحتي عمرج و انتي تكررين راموس كان سيء على بالج يعني بقول كلام غير هالكلام مثلا ثانيا كريس راح اليوفي هالشيء لازم انتي و غيرج تستوعبونه نحن خلاص تقبلنا انه من الماضي ما بيرد الريال محتاج مهاجمين و تعزيزات المبزره ما يفهمون شيء 
1101032231987003392,AE,  والله ما جحدنا كرستيانو لكن شبيحته زباله كل ما خسر الريال طلعوا و تشمتوا فيه
1101033134596988800,AE,  انا ما ارفض النقد بس ما احب الصياح و التشمت في الريال كلما خسرنا
1101034205146955776,AE, والله ما انولدنا في مدريد و لله الحمد لكن مب متلونيين و نصيح على لاعب حاليا صار من نصيب فريق ثاني و هم الي لازم يفكرون بالي راح يقدمه للريال مب نحن  روح و اتحداك انت و غيرك الي طلعتوا فجاه تحبون كريس حتى لما كان عندنا تنتقدونه من يتاخر بالتسجيل طلع لي تغريده و انا انتقده
1101036206412959616,AE,  خذوها بايجابية يمكن بيريز يدخل صيف قوي
1101040774685298816,AE,  هههههههههههههههههههههههههههههههههه كنت بزعل لو سويتها بدون ما تخبرني
1101041278777729024,AE, ما اعرف والله بس مدريدي و يتشمت في مدريد و ماخذ فكره ان تشجيع مدريد بيوقف غليه
1101043348922683392,AE, يا ويلك يا نافاس انزين هو سبب فوزنا بالابطال سامحيه هالمره
1101043775823138816,AE, خاني التعبير واحد من اسباب فوزنا بس انتي سامحيه خلاص لانه بيطلع شكله
1101045087725858816,AE, فعلا خروجنا وارد لعلها خيره
1101047157002514432,AE, ما عاد تفرق بس المهم نقدم مستوى طيب لان البطوله منتهيه مبروك للبرشا الدوري و الكأس لازم نركز ع الابطال مع خروجنا وارد جدا و يمكن هالامور كلها تكون خيره و في مصلحه الريال و نشوف دخول صيف قوي من التعاقدات
1101047378797305984,AE, هههههههههههههههههههههههههههههههههههههههههه يا ليت لو الحرامي خبرنا عشان نحول بيته لكوخ مفخخ و نرتاح منه
1101054264414224384,AE, ههههههههههههههههه وراحت السيديات عساه يروح و ما يندل درب مدريد
1101059009522688000,AE,  اي والله و نحن الحظ معاندنا هالفتره
1101081574416752640,AE, عاد انتوا بس شاطرين على راموس ليش ما تعاقبون بيل لو فيكم خير
1101082287347851264,AE,  والله امس اكتسحنا ام الملعب لكن للاسف أضعنا  الى  فرص لاهداف غير طبعا البلنتي المسروق لذلك برشلونه ما كان الافضل بلا فلسفه
1101141427176771584,AE, تحس قلبه ع الفريق و حاول يقدم كل مهاراته و مت قصر بعد عكس القرد و البغل الله ياخدهم
1101157961974669184,AE, قسم بالله انكم مصخره
1101167714918387584,AE, هاردلك لنا الاداء و لهم النتيجه عليهم حظ يكسر الصخر والله
1101362902555086848,AE, عقولهم صغيره و ما عندهم تربيه صعب القطو العود ما يتربى 
1101408758641684352,AE,اتمنى الريال ما يجهدون عمرهم في مباراة الكلاسيكو يوم السبت لان الدوري محسوم لبرشلونه يحاولون يطلعون باقل الأضرار لان بعد  ايام من المباراة بتكون مباراتنا بالابطال نركز ع التاهل للدور القادم افضل
1101431617422348416,AE, لا ابدا مب مضمون نتيجة  و في غياب راموس المباراة بتكون صعبه علينا و خصوصا فريق اياكس فريق مقاتل و شفنا المباراة الاولى لعبوا برتم قوي جدا
1101431764264910848,AE, هيه ما راح يلعب ضد اياكس و اذا تأهلنا بعد في الدور القادم ما بيلعب مباراة
1101432039537033216,AE, انا بالنسبه لي الاهم نقاتل على فرصتنا بالابطال افضل بكثير من ان نفوز او نخسر لاعبينا في كلاسيكو ما راح يغير من الموضوع شيء البطوله راحت لبرشلونه
1101433351037243392,AE, ما اعتقد ان برشلونه بيتعثر و اذا تعثر في الحكام يساعدونهم و يطلعونهم من الورطه بطولة الابطال هي الاهم المفروض نقاتل ع فرصتنا فيها و لاعبينا ما تيهم اصابه و خصوصا الفرق في الابطال مستواياتهم كلهم عاديه
1101433698489192448,AE, عقبال المليون يا رب 
1101435684907290624,AE,  برشلونه ما بيفوز بالابطال و اذكرك اخر الموسم  بس ما اعتقد نحن لنا فرصه بالدوري الفريق  نقاط ولا تعتقد برشلونه ممكن يتعثر في كل المباريات اقل شيء لازم تفوز  مباريات و هم يتعثرون في  عشان تتساوى وياهم
1101435955783876608,AE, الله يسمع منك بس واقعيا اشوفها صعبه حاليا علينا الابطال الاهم عندي والله
1101438510735732736,AE, حتى انا مثلك بعد لكن لعل و عسى تكون هالامور كلها في صالح الفريق بالنهايه
1101438604428091392,AE,  يا رب الله يسمع منك و تصير
1101439218264563584,AE, تمام بخير يا بعدي انتي 
1101447797965049984,AE, عندنا كل شيء في كل يوم ماشي معين
1101448324958380032,AE, الاغلب ما يحبونه والله
1101455420584091648,AE, احلى ثنائي بالنسبه لي من حسن حظي معاصرتي لهم
1101469568437010432,AE, مادري ليش احس العكس عموما الله يسمع منك و ناخذ لليغا
1101482910165680000,AE, الله يبعده عنا يا رب
1101487841924784000,AE, اصبر على مينونك احسن و أبرك لك
1101488241209950208,AE, يسويها والله هذا مب صاحي
1101488478548881408,AE, امييين الله يبعده عنا يا رب 
1101490192039530368,AE, الله ياخذك يا سولاري والله اشتقنا لايسكو
1101548364783648768,AE, كلنا خايفين انه يلعب اساسي
1101551045350736000,AE, يا رب اميييين يا رب يا قادر على كل شيء
1101574944218071040,AE, تصحيح مب مدريدي محايد بالعكس متلون حسب الظروف وقت الفوز هلا مدريد و وقت الخساره يتشمت في مدريد مع بعض المتخلفين من شبيحة الدون عشان رتويت و تفاعل
1101710637296766976,AE, كاس العالم للانديه  مب 
1101827067677720576,AE,  أصلا كريس كان شايل الهجوم و مغطي على عيوب بيل و بنزيما
1101873458106064768,AE,    خلاصة الكلام هلا مدريد و لا شيء اخر و الاسطورة كرستيانو رونالدو عم القرد بيل والبغل بنزيما حبيتوا ولا لا هو قوة هجوميه كبيره فقدها الريال هذا الموسم لكن بالنهايه مافي اسم اكبر من فريق ريال مدريد نقطه
1101884580779487232,AE, يا رب تصير والله
1101912025112948736,AE, يا ربي وش هالبلشه
670844169003241472,AE, راح الحيا والسنع والحشمه والعيب وكل شي جميل
672406738516115456,AE,  كلن له حريه التعبير عن رايه اخوي غصاب
672443549716054016,AE,"دنيا غريبه والبشر صاروا اشباه
كلن ينادي بإختلافه عن الــــغير

يذكر خطا غيره وينسى سواياه
كنه مطهر عن الذنب تــطهير"
1099646762942414848,AE,   الزعيم لا يتقارن بغيره نشوفكم بعدين
1099646933457666048,AE,  هلا فيك اتمناه لليونايتد و يا رب تتحقق
1099679238469443584,AE,  وهمي هالحساب لا ترد عليه انا حظرته شكله طفل قليل ادب مب متربي قال بقل ادبي ع الناس
1099744637445640192,AE, طنشهم بتعيش مرتاح البال شدخلهم في الناس ما تفهم
1099760530242396160,AE,حلو لعبكم بس ركزوا تكفون
1099761779155128448,AE, بعد شنسوي الله كريم
1099762483466780800,AE, ليش ما تلعب ايسكو يا سباك
1099765336876953600,AE, والله تحس مالهم رغبه بالفوز مستسلمين كانهم
1099768818266710016,AE, زين الفار وقف بصفنا هالمره
1099773054882889600,AE, بالضبط الاهم نفوز و ناخد  نقاط
1099774516929200000,AE, والله يحق له لو قرر يطلع بالصيف
1099775332897431552,AE,بنزيما يبي يقلد راموس
1099779703240577024,AE,اكتملت المغثه القرد بيدخل
1099781140456587264,AE,بعد القرد مسوي فيها شايف نفسه و ما يحتفل مع الاعبين انقلع زين الله ياخذك و نفتك تفو
1099782181898121216,AE, ههههههههه الله يخلي كاسيميرو الي صنع البلنتي لا و القرد مب عاجبه بعد ما يحتفل معاهم فضل عنه و عن الي يدافع عنه
1099783113150996352,AE, والله تعبت هالموسم وايد
1099783740119748608,AE,يا رب تعدي المباراة ع خير و تعدي هالظروف و تصير ماضي تعبنا
1099784561154764800,AE, هههههههههههههههههه ظل راموس يسواه و يسوى طوايفه لجده العاشر بعد هذا العاثر
1099784991058337792,AE, زعلان بعد روح انقلع زين
1099785192334606336,AE, يخسي هالمنتهي يسوى راموس 
1099785524099907584,AE,الحمدالله ع  نقاط ولا الاداء زفت و القادم اجمل باذن الله الحين خلاص لازم يركزون ع كلاسيكو الكأس اكثر
1099785965802016768,AE, والله مباراة تجيب الهم
1099786319960686592,AE, والله يا علاء الكلاب تبح و القافله تسير خلهم يصيحون لين ينقعون
1099786662937276416,AE, اتحمل ع شو عشان نطلع من كل البطولات انتي تتكلم من جد والله تمزحين عشان افهم لنا
1099786913551126400,AE, اي والله ما يستاهل يلعب اساسا ينقلع و يفكنا
1099788077361438848,AE, ايوا عشان يصير فينا مثل مباراة اليوفي العام شوي و كنا بننطرد بسببه يعله الموت و نفتك منه تفو عليه و على يأبه للريال و على لعبه الزباله العاهه النكبه
1099794370239320064,AE, اي منافسه الدوري طار يا بابا يا سبووك تبيني اسبك يعني ركز ع الكأس و الابطال
1099794810314076160,AE, المفروض يشوف المباراة و هو في بيته
1099795474075267200,AE,  الله ياخذه هو وياه
1099797345217191936,AE, اي يصير خير بس
1099898613403185152,AE, ههههههههههههههههههههههههههههههههههههههههههههههههههههههههههههههههههههههههههههههههههههههههههههه ياخي الخال مب هين بعد
1099917051748118400,AE, اي تكفى ركزوا في الكأس
1099922294116355968,AE,  اتفق معاك وفي ناس بعد ما تستحي على ويها من شهور كانوا يشجعون الريال و الحين يشجعون كل الخصوم ضد الريال ويوم الأربعاء بيشجعون برشلونه الله يفكنا من المنافقين و نرتاح بس
1099923719890325632,AE, الله يعدي الموسم ذا ع خير هذا اذا بقى لنا خير فيه
1099924411833073664,AE,  يا رب يجلدهم و يطلعهم من الابطال حتى المرض عندهم شماته اخلاقهم زباله
1099925548732690432,AE,  هذا الاسطورة و كلنا نعرفه زين و كل الي انجلدو يعرفونه و اتليتكو علو راسهم بعد
1099932495758413824,AE, هالاعب نكبه الله يعينا ضد اياكس بدون راموس
1099933190595272832,AE, اجلد اجلد جمهورنا اذا يبي ينفخ لاعب  وهو منتهي 
1099950491105218560,AE, حساب قذر و تافهه و مبين انه برشلوني خرا عاد فضايحهم حدث ولا حرج
1099950940390608768,AE, ههههههههههههههه والله التجديد ينصح فيه خصوصا اذا شفتهم صاروا ضد ريال مدريد اشوتهم و اشرب ماي بارد وراهم
1099951288186519552,AE,   طلع خاين طلع جذاب انا عيناويه
1099955554796163200,AE, تبون اكثر ولا بس يكفي 
1099968265814765568,AE, تكفي هالصور ولا تبون اكثر 
1099969016641323008,AE, لان البعض قاعد يتصيد للريال بس توضيح للعينه هذي ترا المستفيد الأكبر معروف
1099991145768239232,AE, الرتويت يخليك تسوي عمرك مصخره  هذا بعد واحد ثاني  
1100008940228759552,AE,  ههههههههههههههههههههه ايوا ايوا صح صح الخطه ب مصدقينك نحن شوف الباقين
1100017467005566976,AE,فديتها و فديت ارضها و سماها و حكومتها و شعبها الكويت 
1100017744723042432,AE, كل عام و انتوا حبايب قلوبنا يا اهل الكويت 
1100050397408964608,AE, كل عام و انتوا بخير حبايبنا عزوتنا و سندنا
1100051742509666432,AE, ههههههههههههه الي اعرفه ان شبيحة كرستيانو بيستلمونه
1100052346141372416,AE, يا ويله احسن هالمره انا وياهم عساهم يجلدونه جلد 
1100053043897347968,AE, يا ويلك بيستلمونك شبيحة الاسطورة كرستيانوو رحت فيها يا العنز
1100282966327078784,AE, الشيء راجع لك والله مب انك تامن فيها حتى مجرد قرأتها تدخل في الشرك بالله انا نصحتك من معزتك بس لاني احب الخير للكل مثل ما احبه لنفسي و تحياتي
1100285698152771584,AE, هههههههههه الله يستر لا يتحمسون ربعنا و يحطون شيخة كورة معلقه عندنا 
1100285921704976384,AE,  والله انا بعد كنت احبهم بس بعد ما طلع الدون هو خربها جلب ع الريال و لاعبينه و قلل منه عشان جي جلدت و بلكني
1100286402808504448,AE, عاد التعليق و بنت نحن بالغصب متحملين يوسف سيف و احمد الطيب 
1100286616818601984,AE,  صح يضحك و اعتقد هو أردني بس فيما يخص ريال مدريد ما عنده مهنيه
1100286806778617984,AE,  اي والله يعني بنتحمل تتكلم و تمزح و كل شيء الا الاستنقاص من الريال ابدا ما اتقبله 
1100289131249352832,AE,  تبي تشتهر و تأخذ رتويت قلل و سب ريال مدريد و لاعبينه و خذلك رتويت من بعض شبيحة ميسي و الكتلان و بعض شبيحة كرستيانو و طبعا باقي جماهير الانديه
1100289273897631616,AE, جمهور سكران بالفطره باليل كلام و بالنهار كلام ثاني الله يصبرنا بس
1100289645752053760,AE, بنشوفه الحين بكلاسيكو الكأس و الدوري وش بيسوي هو و القرد
1100290079497601024,AE, اي والله اصلا احس اذا بنفوز يا فاسكيز ولا راموس ولا ريغليون يمكن القول عن طريقهم
1100297179472822400,AE, ذاك بيبي مب كروس
1100300360659488768,AE, بعض الناس هي الي تخليك يا تصير نفسيه وياهم او تكون مروق و مستانس معاهم 
1100300576745766784,AE, والله متوترين مثلي مثلك الله يعين اووف لو الامير يعطيهم وحده من تسديداته و يسجل
1100301069756874752,AE, بيرجع لانه تشيلسي ممنوعين من التعاقدات 
1100303344411860992,AE, يا رب باذن الله ينقلع
1100305248298635264,AE,  والله كلنا نحبه لكن الوطن اكبر من اي ركن كان عجبكم حياكم الله ما عجبكم طز و في ستين داهيه و ع اليوفي و فكونا
1100305691733041152,AE,  لانك واضح طفل قاعد تدور رتويت روح عند الهوامير و قول عصبت وحده من متابعين ريال مدريد عشان يعطونك رتويت
1100306387542990848,AE,  هيه تدور ريتويت ولا كلنا نحب كرستيانو و من عشاقه لكن بعض من شبيحته الاغبياء يطلعون يبون يتفلسفون قلنا جزء من أركانه يعني أسطورته و ايقونه للملكي
1100306756956291200,AE, الله ياخذك انت و هو اذا بتبدا فيه اساسي
1100310695017676800,AE,  بتكون له بصمه لكن ع الجمهور مب في المباراة بيسبب لنا ازمه و بيحرق اعصابنا
1100313746176700416,AE, من يقدر يمسحه من قلوبنا و عقولنا كان و راح يبقى فيها للابد رسميا صرت اكره بعض من شبيحته
1100315966976724992,AE, هي جميله بس ذوقها و كشختها زباله 
1100317584711393152,AE,  تصريحه صح انشلوتي بيل لاعب اناني و زباله و نفسيه ما عنده اخلاق و كلنا شفناه جدام ليفانتي قرد و شايف نفسه بعد مشكله
1100319228652064768,AE,  والله هذا موضوع ما يخصك فيه يا دول
1100320058826473600,AE,  اهل السودان على راسنا لكن هالاشكال طبعا لا
1100320325751971840,AE,  ههههههههههههههههههههههههههههههههههههههههههههه طيب روح انتحر
1100339933842165760,AE, الاسطورة جزء كبير من هالوطن الكبير
1100340850645762048,AE, اهم شيء القرد ما يكون اساسي و يعتمد على فينيسيوس اساسي
1100341923884220416,AE, للابد و حتى النهايه هلا مدريد
1100358296790355968,AE, ذل هازارد يا رب يتعاقد معاه بالصيف
1100369653455618048,AE,   ولا حد نكره ولا حد جحده بس انتوا تعالوا استنقصوا من الريال و قولوا حق المدريديين انتوا لا تتكلمون عنه طبيعي بتطلع فئه و تهاجمه المشكله مب في الدون لانه اسطوره ريال مدريد لكن المشكله في بعض من شبيحته الزباله الي ينكرون الفريق كله و يستنقصون منه و في الي مسوي عمره مدريدي و هو منافق
1100384999373717632,AE, شوفي هذا هو الحل 
1100388040323842048,AE, و للابد يفتخر بالملكي
1100390243545563136,AE,  حليله كلكم غاسلين ايديكم منه
1100471914349379584,AE, هههههههههههه خايفين نحقق  مصخوها ربعنا عطوهم فرصه هالمره ع الاقل
1100485959735488384,AE, نقول يا رب مع ان اخر فتره نلقم اهداف بطريقه غبيه
1100486437210865664,AE, اهم شيء ما يبدأ بالقرد و يغثنا
1100486699807854592,AE, يصير انا اذبحه و ادفنه تحت البحر و الله يغفر لي
1100486882448850944,AE, ههههههههه يعني من زود الخيارات الموجوده عندنا خليها ع الله بس
1100632134174339200,AE, حسبي الله عليك يا سولاري ماكل حلال ابوك الولد و نحن ما نعرف
1100641488109735936,AE, باذن الله نفوز و نتأهل للنهائي
1100641619169239040,AE, ان شاءالله يا رب نفوز و نتأهل للنهائي
1100641736001507200,AE, باذن الله تنتهي  لنا يا رب
1100646082919436416,AE, باذن الله نفوز و نتأهل 
1100647307480043648,AE, شكلك تبي بلوك صح
1100647572887298048,AE, لا مب مزح اخرتها تطلعون ع حقيقتكم ضد مدريد
1100647724666552448,AE, روح صور بسرعه و الحق على سلط و سيف خلهم يرتوتون لك بتكون مسوي إنجاز
1100648197750435840,AE, انت تعرف و انا اعرف و كلهم يعرفون انكم تقللون من الريال عشان الرتويت و أغلبكم وقت الفوز مدريد و وقت الخساره مع الشبيحه تتمصخرون ع مدريد و الدليل الصوره الي حطيتها فوق
1098550722050830336,AE, اذا عبروا بيكون عن طريق الدون ولا اعتقد صعبه عليهم خصوصا و اتليتكو دفاعي و متقدم  و ضيع الكثير من الفري
1098551337573408768,AE, مسا السعاده بو تركي
1098552601224888448,AE, كارديف اعتقد لان حساب برشلونه كانوا كاتبين قادمون يا كارديف بس شكله طيارتهم ضاعت بعدهم ما وصلوا 
1098553094131064832,AE, يا هو طقطقت عليهم طقطقه العمر والله عشان جي مستحيل انسى
1098565777941237760,AE, مع انك عبد رتويت ابلع رتويت
1098582715555827584,AE, غارث بيل وهو يعرض مهاراته على تشلسي روح و فكنا بس 
1098586838565048448,AE,   سمعت بيدخل بصفقه ايركسن
1098592201775464448,AE,  انقلع الله ياخذك فكنا
1098594304635883648,AE,   بيروح تشلسي اخيرا بيفكنا غارث بيل يعرض مهاراته  
1098595256315113600,AE,   ينقلع الله يفكنا منه وش يقعد على قلوبنا 
