id,dialect,text
1112595551697145984,AE,  انا في بوظبي وما شفت
1112627939223445632,AE,هيه والله ضارين على السرى والدوب  
1112675879652679552,AE,  ليتني دكتوره  كلنا اهل
1112728685482782848,AE,  من طيب احسانج   ان شاء الله الإيجازات ياية
1114864544290099200,AE,  الحمدالله الكل كان مبسوط
1115153706138439552,AE, مشكوره يا خالوه نوره 
1115710529652310016,AE,"السيتي اكبر من رياض محرز  

اشوفه لاعب عادي"
1115880862258798592,AE,شو ها اللوث اللي ابتلينا فيهم 
1116076371191705600,AE,فيدال صفقه غير موفقه ومش مقنع على شو برشلونه تعاقد معاه 
1116083305974259584,AE, عيل يطلع ارثور ويدخل بداله روبيرتو  أما غبي بصحيح ها المدرب 
1116087754465709952,AE, أمره غريب ها الكوتينهو
1116234899634179968,AE, صدارة ترتيب الدوريات ف اسيا على شو والمدرجات مهجورة 
1116270592414617600,AE,  الموضوع مطول وايد وايد وايد
1116430969375010816,AE," شيخ الشباب فزاع قبل شويه حطها ف سنابه  
جميله جدا جدا"
1116432662762348416,AE, سمعتها اكثر من مره 
1116725445628657664,AE,  قالها طيب ام سهيل بنسويلها اضافة
1116750120685584384,AE,الحمدالله نسيت شي اسمه الوصل خل يشبعون فيه
1116758099971444736,AE,  سيره بلا رده هو واللي يأبه
1116768042380226560,AE,"ماشاءالله الفريق ما يتنازل عن رقم  

الله يهني سعيد بسعيدة"
1116768535710175232,AE, محد بيطلع لانه يشوفون انهم على حق والوحيد اللي له سلطه عليهم شيخنا احمد والا هذي الاداره ما عندها ذرة كرامه عايبنهم الوضع
1116768656241852416,AE,  مسلسل مكسيكي بعده مطول
1117095210146783232,AE,  العين والوصل مب مترقعين السنه
1117106321529212800,AE, صدقني لو ما يطلع قرار الدوامات ما ترحم
1117112956695797760,AE, محد يسمع الكلام وإذا استوت مصيبه تطلع القرا ات
1117115950103445632,AE, لازم يتم التحديد من غير المعقول تخلي الموضوع مفتوح
1117116520176455552,AE,منو بعض المدارس وفي اي إمارة  
1117116738003447808,AE, مب انا بس وايدين 
1117120728862789632,AE,  الفيديو صحيح ف منطقه شعم ب راس الخيمة 
1117141905849114624,AE, منو مسوي اجتماع طارى 
1117815330448003200,AE,  صدقني طالما انته مخلص في عملك راح تتقنه وتخاف الله وتعطي لكل شي قيمته ووزنه وإذا قصرت مب عيب انه الواحد يقول انا حاولت ولكن ما استطعت محد راح يلومك بالعكس راح نثني عليه ونقوله ما قصرت فتحت المجال لغيرك بالعمل
1118544419156832384,AE, عايبنهم  انتو بس موتوا قهر
1118545947053707264,AE, ماشي فايده يام سالم الجماعة ما يبون يطلعون  ما ادري ليش الجماهير حارقه أعصابها 
1118624979464195968,AE, هيه والله شي يزعل بس بحول الله ميسي بيعوضنا
1118792629473501184,AE, ولا اطشه ما عليك من الإشاعات هههههههه
1118912698291576832,AE,"هدف النجم الساحلي هدف صحيح لانه اللاعب اللي لمس الكره ما كان متسلل 

الهلال لازم يعاتب مدربه ولاعبيه على سوء الاداء"
1118921684571107200,AE, كم يسوى وجود بوخالد بينهم  الله يحفظه ويمد ف عمره
1118928076380020736,AE,"وإدارة الوصل صامده بعدها  

الله يصبرنا يارب "
1158233822036746240,AE,  استخدم معاها لغه الحوار بلطف وحب واسألها عن أسباب اهمالها  وبين رغبتك في انها تهتم فيك اولا وفي بيتها وعيالها ثانيا وان رفضت البوح او التغيير اختار الدرب اللي يريح فؤادك 
1159032574087434240,AE,    وقت الملام الحكومه محذره من السفر لتركيا وكثير فيديوهات طلعت وبينت لنا سوء تعاملهم مع الخليجيين ليش تعرضون الحكومه للإحراج ونحن في وضع صعب معاهم خلصت البلدان تروحون تركيا
1159033459668598784,AE, كلامك صحيح يروحون ويضربون بالتحذيرات عرض الحائط وبعدين عاملونا بشكل سيء وتعرضنا للعنف وساعدونا يالسفاره
1160125677913477120,AE, نشوف فيك عجائب قدره ربنا يارب
1163050738848845824,AE, الحقد والحسد والغل اللي في قلوبهم يعمي عيونهم عن خير الخليج عل عيونهم العمى يارب
1163152344344924160,AE, الإجابة على سؤالك لا ما يعتبر قذف دام الغريب تمادى وتجرأ فالقريب أولى 
1164041863390740480,AE, الله يشتت شملهم يارب ويرد كيدهم في نحرهم وينتقم منهم أشد انتقام يارب ونشوف فيهم عجائب قدرته يارب لعنه الله عليهم وحفظ الله جنودنا الأبطال
1164410386415783936,AE, أتمنى يخلون الكلام بفلوس عشان نشوف بياعين الكلام شو بيقولون لعنه الله عليهم
1171320884931551232,AE, أكيد يهمنا يا مبدعه مبروك وربي يوفقج ويسعدج ويعطيج حتى ترضين
1173434954564415488,AE, السلام عليكم ورحمه الله بوابات جامعه زايد للبنات متى الحل كل يوم تاخير عن الكلاسات وزحححمه ساعه تقريبا للدخول وهذا كله في الشمس اشتكينا ولا حصلوا حل فالحل اما إلغاء نظام البطاقه او زياده عدد بوابات الدخول مايصير بوابتين على العدد الهائل من البنات ولا وكل يوم عطل
1173582478226939904,AE,  شو تتوقع من اللي مافيه خير لوطنه وأرضه بيكون فيه خير لوطن ضمه وآواه وعاش عيشه ما يحلم بها في بلاده لكن اللوم على ولد البلاد اللي يركن عيال بلاده ويحتوي ويشجع مثل هالاشكال لعنه الله عليها وعلى كل من هم مثل شاكلتها
1173991163013029888,AE,  الله يشافيج ويعافيج يارب ويطرح في جسدج العافيه والصحه يارب عليج بالحجامه خاصه ايام السنه وربي يشفيج
1176884159630983168,AE, للأمانه العتب مش عليهم العتب على ولد البلاد اللي سمح للغريب انه يتكلم عن دمه ولحمه
1178227543918428160,AE,"سهيلبنمباركالكتبي 
الله يرحمه ويغفر له ويصبر قلب أهله وأحبابه يارب "
1002834400663474176,AE, الله يرحمه ويصبر أهله شو الحكمه من التهور والسرعه
1018453429948157952,AE,  لو حددوا لهم ساعات معينه وأيام معينه بدل الحرمان أفضل لان الأسلوب هذا ممكن يدفع الأطفال الى طريق غير سوي وبعدين ممكن يخبون عن اهلهم واااايد أمور عشان ما ينحرمون منها
1024530993317912576,AE, عندي مبدأ ان السعاده في البساطة دون تكلف وفعلا عن تجربه وشوف كيف بتضحك من خاطرك وكيف انه دمعتك بتنزل فرح وحزن في وقت واحد المظاهر غيرت الناس وايد للأسف
1025775466932830208,AE, خلاااااااص كفااااااااايه لازم يطلع قانون ممنوع السفر بالبر لصلاله ارواح عيالنا واهلنا واخوانا غاليه علينا
1033566786028007424,AE, المدارس الأسبوع الياي باذن الله 
1038421910802100224,AE, الله يخليها ويطول عمرها ويبارك لها فيج ويرزقها برج امين 
1042367566000386048,AE,  المفروض السكيورتي ما يسمح لأي وحده بالدخول بلبس غير محتشم
1049034889465618432,AE, ويسعد فوادج يا حبيبه
1049351105392590848,AE, ابعد عنها واسمع شور هلك عشان ما تندم بعدين وإذا انته عارف هلك ليش كملت مع البنت روح في طريق وحلها تتيسر يمكن بعدها خير لك ربنا ما يكتب الا الخير للعبد
1050117667716251648,AE,شفت السعاده يوم عيني شافتك 
1050292346200449024,AE, بالرغم من التحذيرات الا ان في ناس لحد الحين يزورون تركيا  ليش  شو فيها زود يعني  يقولون ابعد عن الشر وغني له
1052075160835186816,AE, اتفق معاك جدا لان الحب حشمه وحياء وغيره
1052412303633670016,AE, بالعكس الزواج هو قمه السعاده لان الزواج تكمله لنصف الدين
1052414335278960640,AE, ما بتحس بالسعاده فعلا الا بالزواج 
1063645188357271552,AE, دايما مبدعه ودايما حروفك تلامس الإحساس الداخلي ربي يسعدج ويوفقج يا اميره الكلمه والإحساس يا مبدعه 
1069538355162038400,AE, الله يحميج ويسعدج وكفو من رباج يا بنت زايد 
1071084115884150784,AE, كلن يحكي عن تربيته بأفعاله
1071378116650647552,AE, ماعندهم خير عشان ينهبونه عيال الحرام
1075635981418672000,AE, مرحبا انتوا ليش وااااااااايد تزيدون في الفاتوره  عندي باقه معاكم وادفع الدبل ليش
1076062833077563392,AE, افتكروا السعوديه احتلتهم يوم شافوا العلم عليهم من عذاب الله مايستحقون الانجاس
1083785608609362048,AE, بلاد الحرمين سما ومحد يطولها
1084033312736321536,AE, ربي يسعدج ويبعد عنج كل وجع
1085858991203217408,AE,  والله الواحد صار يعمل الخير مانعرف لوجه الله ولا رئاء الناس
1090270043902959616,AE, مدفوع له مبلغ محترم
1092429704299204608,AE, دااااااسوووووووه دوس وغير كلامه 
1095027331360538624,AE, مش حلوه التغريده في حق المذيع بكل امانه
1097854221033058432,AE, ما ينخاف عليهم عندهم ألف وألف طريقه ربي يبعدهم عنا
1106480696661606400,AE,  لو سكت أبرك وأشرف للشهداء اعوذ بالله فعلا اعوذ بالله
1133314884156960768,AE, لا تتكلم في شيء وانته جاهل فيه الله يعطيهم العافيه خذوه بكل هدوء وبعد الفحص تبين انه رجل ولكن هرمونات الانوثه زايده عنده كفايه تتكلمون في اللي يعنيكم واللي ما يعنيكم
1138322330030096384,AE, شو اللي يضحك في الموضوع  على الأقل ما استسلم للمرض وكافح ما تخافون ربي يبليكم بنفس مرضه ربي يبعده عنكم خافوا الله
1152894551406841984,AE, إنكم ا ل ع د و المستتر تحت قناع الجيره
1155053087616327680,AE,  لعنه الله عليهم المفروض ماتوصلهم مساعدات ابد وخل يحترقون ربي يحرقهم يحسدهم وحقدهم يارب
1155097386567524352,AE, لا تتوقع من شخص مافيه خير لوطنه يذكر خير غيره وخاصه الجنسيه هاي الحقد اللي فيهم على الخليج حقد غير طبيعي الله يحرقهم بنار حقدهم يارب
1155097825698615296,AE, لعنه الله عليكم انجاس خمه
672844704090882048,AE, شو يخص نزوله في البنات لو راح السياره اقرب له
673165326452809728,AE, الله يشفيها يارب ولا يحرمك من بركتها يارب ما حييت
674152790277685248,AE, مساك سعاده من ارض السعاده 
674153886400299008,AE,  التم المتعوس على خايب الرجا علهم الحرق
674243931194925056,AE, الله يجمعك معاها في جنات النعيم يارب
674282200125194240,AE, أكيد انته واحد منهم
674423344821858304,AE,الله يجمعني معاج في الفردوس يا أطهر قلب  
674432720206868480,AE,ربي يشفيك ويعافيك يارب ولا يحرمنا طله محياك يا نبض الإمارات  
674439029350379520,AE, ماعليك زود العين ما تعلى على الحاجب
674667668209799168,AE, الله يفكك منهم قريب يارب
674823194549854208,AE,   ربي يحفظ من رباك يابوراشد كفو عليك وبيض الله ويهك
674885108336214016,AE, ربي يسعدج بس نحن هذا حاكمنا طال عمرج 
675043923954425856,AE, الوضع مايشجع على السفر 
675874664779005952,AE,"يالله عطفك ولطفك والأجر والثواب
من مبتدا عمري الفاني إلى آخره 

خلقتني من تراب ومرجعي للتراب 
يارب رحمتك فـ الدنيا وفـ الآخره "
676034861564567552,AE, شوفتك تسوى الدنيا ومافيها يا الغلا
676080647497207808,AE, يعل حياتك فرح وسرور أمين كلك ذوق وربي يسعدك
676084849753653248,AE, ماعرف اتحرش بحد انا 
676086261568917504,AE,   مشاهير التواصل الاجتماعي اللي قاصين على عمارهم
676087959989444608,AE,   اممم تحط قناع على ويهها ماتعرفها ابد
676088561704284160,AE,"  سبلان وانتوا بكرامه والله 
سناب لا حيا ولا مستحى ولا سنع ولا تربيه"
676088884317528064,AE,   والله محد متخلف غير الناس اللي فأهمه ان قله الحيا تطور
676287524701097984,AE,  فعلا كلامك صحيح والله
676341081282228224,AE,"على الأقل انا لا اشتري متابعين يالمثقف الفاهم
للشخص اللي يغلط عليه على الخاص"
676480848284229632,AE," كفو عليك وعلى من رباك 
بيض الله ويهكم يارجال زايد 
انتم مدرسه للوفاء والحق والنصر والفخر"
676745397998518272,AE,"لا تغرك طيبتي  خلك حذر
قبل تآخذهـا عن عيوبك غطا

إذا كررت الخطا  لا تعتذر
العذر أسهل كثير من الخطأ"
676765071171821568,AE, الله يبيدهم يارب ثارنامايبات
676766397905690624,AE,  باذن الله مابتشوف الا أخلاق عيال زايد الكفؤ
676769844973449216,AE,  يسلم من رباك أستاذي الفاضل 
676808897819254784,AE,  الله يرزقك برها بعد وفاتها يارب ويجمعك معاها في جنات الفردوس يارب 
677358362292523008,AE, فديت الصباح اللي يبدأ بشوفهم 
677882841997398016,AE, ياتاج راسي وراسهم فديت طلتك يا بوخالد
678086134702960640,AE, الكحلي لو مميز وفخم ورايق
678556831992561664,AE,"يابعدهم كلهم ياسراجي بينهم 
عطني من دنياك حبك واترك الباقي لهم
مساكم حب "
679326028125335552,AE,  الله يرد كيدكم في نحركم يالانجاس
679365150785282048,AE, احسن عشان المدخن اللي يضر نفسه يراجع حساباته
679510732245962752,AE, امين يارب العالمين شكرا لك اخوي وعلى شعورك الطيب اتجاهي 
679528339565101056,AE,  الله يطمنك عليه ويفرحك بسلامه رجوعه يارب
679677575308902400,AE, الله يعطيك خيرها ويكفيك شرها اي لون خذت
679760623643656192,AE,"بالنسبه للأشخاص المعترضين على الكريسمس
سوال خداماتكم المسيحيات في البيت شو وضعهم  ولا هذا حلال وامور ثانيه حرام"
679928089833553920,AE,امين يارب ربي يحفظها ولا يحرمكم من شوفها يارب  
680101866060034048,AE,   يمكن يدخلون الجنه والسبب الناس اللي حاطينهم في رأسهم
680112639557632000,AE,شو مستوي  شو صاير  التغريدات كلها الغاز ليش
680470263176232960,AE,"هي كلمتين بخاطري بقولها لك 
ان ماقدرت تفرحني دخيلك لاتضايقني"
680476388474941440,AE,"النـفــس طـابـت   والكرامه  كرامه
ومن عافته نفسي حشا مالتفت فيه

قلـبــ وروحـ  رافقتهـا السلامه
وكـلـن عـلـى كـيـفـه ونـفـسـه تـوديـه"
680619959253336064,AE, الأحلام بلاش خله يحلم دام الشي هذا يسعده
681191528568623104,AE,  ربي يبارك لكم فيه ويدومه ذخر لوطنه وقادته واهله ويكون عون للوطن والمواطن
681327308561461248,AE,الله ينصرهم ويسدد رميهم ويشد ازرهم يارب  
681337827108503552,AE,  الله يسعدكم مع احبابكم ووقت سعيد دايما يارب
681339119889420288,AE,  الله يشفيكم يارب ويعطيكم الصحه والعافيه
681340092414300160,AE, صباحك سعاده ياويه الخير
681345688454721536,AE,  ربي يحفظها لج يارب ويطول بعمرها ويدومها بركه لج ما حييتي يارب
681351548052594688,AE,"المراجل تشبه الرجم الطويل 
ما رقاها إلا زحازيح العرب 

لا تفكرها مثل ماي السبيل
من بغاها مد يمنا و شرب"
681361903734648832,AE, حاليا ماتشوف أنثى الا مسويه سمكره بالكامل الا من رحم ربي
681362265262702592,AE, مسكين الرجل والله ياخذ وحده تقليد كل شي فيها مغشوش
684004548919205888,AE," الامارات أتعبتك يا نجس
علو نباحك دليل على حقدك يانجس"
684643350079651840,AE, سنه جميله في حياتج وربي يسعدج ويحقق أمانيج ويحفظ لج أحبابج يارب
685298045055971328,AE,ياخليفه الحب والعز انت فخرنا وسعدنا وبطلتك أيامنا اجمل لاخلا ولا عدم من هالشوف ياربي 
686023421101273088,AE, ياسلااااام أجمل وأغلى وأروع وطن 
686756581946601472,AE,"  ربنا ياخذ ويعطي 
كل إنسان عنده شي ينقصه"
687126902415294464,AE, ربي يحفظهم وينصرهم ويرجعون سالمين غانمين يارب
687177827590995968,AE,    بيض الله ويهك اخوي احمد ماقصرت وربي يسعدك ويحقق امانيك وأيسر كل امورك يارب 
689385887818375168,AE,امين يارب ربي يحفظها ويرزقك برها ما حييت  
952820222720925568,AE, إنتوا فعلا نكته والله تضحكون العالم عليكم 
954959942578069632,AE, الله يحفظه ويرعاه ويحميه ويسعده ويخفف عنه ونكحل العيون بشوفته فديت بابا خليفه
961239486712729600,AE, شو جاب الثرى للثريا
1100649626875674624,AE, ما احب انا هالنوع من المزح و خاصه صور الكلاب ع فانيله الريال ما اعتقد كنت تقصد فيها اي نوع من المزح ولا تمزح معاي بهاي الطريقه مره ثانيه زين
1100652334965756032,AE,شفتوا طلعنا بالنهايه نحن المتقدمين عليهم 
1100658651126263808,AE, هلا مدريد يا رب نفوز و نتأهل للنهائي
1100669325558591616,AE, بالتوفيق للملوك باذن الله نفوز و نتأهل لكنه بيكون فوز صعب
1100671885115883648,AE, القهر ايسكو ما يلعب و بيل يلعب
1100679710055518208,AE,  شكرا ع الصور استمر بالتوفيق
1100684654531747840,AE, يا رب باذن الله نتأهل
1100695493267648384,AE,  يا رب باذن الله نفوز
1100726987730096000,AE,  ياخي ليش تحبون تغثون غيركم انت مب متفائل كيف لا تخرب عليي يومي
1100762938091204608,AE, عاداته والله في اي وقت المهم نفوز
1100769161029079040,AE, لازم اتليتكو يقدمون احتجاج ع القرار لازم يتعاقب الصراحه لآخر الموسم
1100772782646927360,AE,محطهمصر الله يرحم شهدائهم و يشفي المصابين و يصبر اهلهم 
1100773230242074624,AE, بس شاطرين على سيرجيو راموس انتوا ليش ما تعاقبون القرد و نفتك منه
1100799377701064832,AE, النحس سولاري ما بيلعب ايسكو نام احسن
1100802976841633792,AE, سكر الباب وراك تكفى
1100803910007169024,AE, الحمدالله ع نعمة ريال مدريد و تشجيعه و الله هالاطفال لوعوا جبدنا الله يعيين جماهير اليوفي عليهم الحمدالله فكه
1100805092729671552,AE,  مادري ليش مستصعبين الموضوع دام كرستيانو عندكم اكبر من الريال و الريال ما يسوى شيء عندكم خلاص ريحوا عمركم و شجعوا اليوفي و ريحوا جماهير الريال منكم
1100805762903953408,AE,  بالضبط كلنا نحب كرستيانو و هو جزء كبير من تاريخ ريال مدريد و اسطورتنا لكن ريال مدريد نادي عظيم حتى قبل ولادة كرستيانو زودوها
1100808347656351616,AE,الي يقول الكلاسيكو ماله طعم تكفى انت وياه تابعوا غيرها من المباريات و اتركو جماهير ريال مدريد و برشلونه يتابعونها لحالهم بتكون بدون ازعاج 
1100809307380244352,AE, بالضبط عاد تعال و فهم الي مسوي عمره مدريدي و يقلل منها الحين
1100810053307768832,AE, بالضبط والله الله يعينا عليهم
1100810735163269248,AE, و انا وش قلت يعني في منهم الاثنين و مليت و انا اكررها بس بسالج سؤال مدون
1100811895144103936,AE, اها خلاص عيل نحن كمدريديين نحب كريس و نموت عليه بس اكيد نفضل ريال مدريد يفوز فيها يعني بنكون بهالطريقه جحدنا كريس
1100813285971111936,AE,  والله لو ما صارت هالمشاكل كنا بستمتع مع فريقنا ريال مدريد و بالأسطورة بعد لكن مصخوها بعض من شبيحة كريس و بعض من شبيحة الريال
1100814313281986560,AE,  اتفق معاك و يحطون صورهم افتارات و يحطون النتائج و يتمصخرون ع الفريق طيب شجعوا كرسيتيانو بدون ما تتعرضون للريال و خلاص تابعوا اليوفي و فكونا نحن جماهير الريال
1100822661729529984,AE,   ما شفنا حد قال جي غير جمهور الاسطورة كريستيانو و مب كلهم بعد بعضهم عشان ما نطلع ظالمين عموما ترا كرستيانو مدريديستا يعني الي راح و شجع اليوفي عليه بالف عافيه بس الي تشجعونه يشجع الريال
1100825767821361152,AE,  تكفى الحين نروح ننتحر لأنكم مادريتوا عنا
1100826587405127552,AE, يا رب ما يتفلسف و يطبل لغارث بيل 
1100826825893314560,AE, مجرد وجوده يعني خلاص بنخسر
1100827229817319424,AE, الله ياخذه والله كارهينه
1100870563558375424,AE,انتهت خلاص مبروك برشلونه هاردلك لنا كالعاده يضيعون فرص كثيره و هم من فرصتين قولين
1100879015760588800,AE, يلعنهم من فئه قذره
1101005160183226368,AE, من كثر ما نجلدكم يا عمي الحكم ولا انتوا طل
1101008804450390016,AE,  الله كريم و يمكن خسارة الكأس و الدوري و احتمال خروج من الابطال تكون في صالحنا عشان يتحرك الشايب و يعزز الفريق و نفتك من القرد و البغل
1101009755353567232,AE,  الريال امس كان افضل من برشلونه بس ناقصه مهاجم ع الاقل ضيعوا  فرص حقيقيه للتسجيل من غير البلنتي الغير محتسب
1101010167943041024,AE, هيه نبقى نحب مدريد و ما نشجع اليوفي و مب وقت الفوز نقول هلا مدريد و وقت الخسارة نتشمت في مدريد يا متلون يا منافق يا مدريدي مزيف روح شجع اليوفي و فكنا ترا من بينقص من الريال شي
1101010443164889216,AE,  عادي انا شفتها نقطه اجابيه عشان بيريز يتحرك بالصيف
1101010998859829248,AE,قسم بالله من العهر ان واحد مثلك يشاركنا نفس الميول او مسوي عمره يشجع من مدريد يا رب نفتك منكم 
