id,dialect,text
1105957561986101248,BH,"بعد المطر  فاح العبير 
وأحزاني شافت دربها  

دعيت ربي من ضمير 
يارب عذب قلبها "
1105959229884715008,BH,"تدري إني من خيار الناس ومن الندر
وتدري إنك لو تدورني ما عاد تلقاني"
1105959369529790464,BH,"ترى قربك لا صار كله مكابر
ينعاف لو راعيه بالحيل غالي"
1105961103941664768,BH,"ما نرتجي من خاين العهد قيمة 
ولا ننتظر من ناكر الطيب معروف"
1105961589390348416,BH,"دامك رحت واخترت احد غيري 
الله معاك روح عسى جديدك يكسرك"
1105961629366345600,BH,"ما أجبرك دامك تبغيهم لا تجيني
روح لهم وإنتبه لا تردك خطاويك"
1105962192137084800,BH,"رح لاتجي يعني نسيتك ولا ابيك
ما دام مع غيري زمانك صفالك"
1105962418499452800,BH,"ما عاد تفرق وش تخبي لي الأيام
جاني اللي كفى وخاطري طاب "
1105962671227195392,BH,"مالي مزاج اعاتبك عيش دنياك
بعض العتاب  يزود الطيين بله "
1105963065827307648,BH,"ماني بـ نادر بس ب اقولها لك 
مو كل شيء يمرني التفت له"
1105963181653004416,BH,"عزت النفس تمنعني من اني اعيش
في رجا مقفي ما جاه مني خطا "
1105963972807835648,BH,"نورك طفى ماعاد لك عندنا ضي
حـب مضى ما أظن ينعاد كره"
1105965244596322432,BH,"ما راح تلقاني متى ما ودك
هالمرة بترجع  ولا تلقاني "
1105965865021902848,BH,"دامك نويت البعد الله معك
ودامك اخترت غيري الله يهنيك"
1105966132752777216,BH,"كل اللي ابيه منك لا نويت الفراق  
خذ ذكرياتك معك والله يستر عليك"
1105966856274435968,BH,"ما تجي كبر الجروح الا من اللي 
 ما  توقعت  الجروح تجيك منه"
1105967473998946432,BH,"غيب كثر ما ودك تغيب 
لكن لاتجي بعد غيابك "
1105967561508904960,BH,"غيب كثر ما تقدر ماني بـ راجع لك
ماعادني ذاك انا  متغير وربك"
1105967668438491136,BH,"كثر ما ودك تغيب ياخي غيب
لكن بعد ما يبرد شعوري لا تجيني"
1105967810579185664,BH,"ان كان ودك ولا قل ياخي ما ابيك
وابشر وتم وسم وتامر امر"
1105967964778622976,BH,"أبيك تعرف اني لا نويت ابديها بالمكابر 
أبنهي وجودك كنك ما عشت يوم فيني "
1105968798400761984,BH,"خلك على صدك ترا خاطري طاب
نفسي عزيزه  والعرب خابريني
اللي يبي فرقاي  قدامه الباب
واللي يبيني  فوق راسي وعيني"
1105968900703961216,BH,"خلك على طبعك عسى الله يهنيك 
وابشر بطبع جديد يعلمك قدرك"
1105968983012978816,BH,"لا عاد ترجع  وصلك ما عاد يعنيني
خلك على غيبتك و ايامنا سلم عليها"
1105969130329596032,BH,"يا تجي كلك على قدر اشتياقي 
او كذا خلك على  آخر ظهور "
1105969605523185664,BH,"تدري غيابك وش ترك لي فوايد
الناس حبتني من حروف فرقاك"
1105969900584083584,BH,ماعاد يهمني وجودك ولا يأثر فيني فرقاك 
1105969970872287232,BH,"ودي اندم بس ماني على فرقاك نادم 
ودي اتحسف ولكن ماعلى مثلك حسافه"
1105970158256967552,BH,"تدري اني على فرقاك مجبور حيل
بين دربي و دربك مايفيد الوصال"
1105970586449260416,BH,"خلهم ينفعونك دامهم يعجبونك 
اليوم تضحك شفاتك بكرا تبكي عيونك"
1105971190068404224,BH,"ماعاد لي نفس أعاتبك على افعالك
سهل الله دربك دامك نويت البعد"
1106162999968972800,BH,ناس يجوفون نملة يحطون صبعهم علشان  تغير مسارها  تبيهم يخلونك بحالك 
1106359017327214592,BH,"اشلونج
تمام
ليش ردك بارد 
تمام ع الفحم"
1106365259814785024,BH,"ماودي اذكر عيوبه واحسب ذنوبه 
حتى لو انه جرح قلبي و بكاني 

جعل الله يسامحه ويسمح دروبه 
خلاني ابيع خلاني  و خلاني"
1106365309462679552,BH,"كلامك جرح قلبي وذكر علي مافات
علامك تخلي دمعة العين ذرافه "
1106365458918313984,BH,"مريت داره  وجدد جرح تذكاره
وانا احسبني نسيت اللي تذكرته"
1106365905930518400,BH,"لا صار جرحك ما تداويه يمناك
محد مداوي بهالزمن جرح غيره"
1106366032472690816,BH,"تدري وش اقوى جرح ياجارح الجرح
لاجاك جرحك من مداوي جروحك"
1106366170645565440,BH,"والليالي مالهـا معنى بـلاك
المفارق جرح واللقيا شفى"
1106366586112348160,BH,"لا تنتظر من المقفي رد اعتبار 
خله بدرب القطاعة يحصد مراده"
1106463274307108864,BH,"خذها من الأخير اما تجي الجية اللي 
بـها وصال زين  ولا رد القطاعه بالوداعه"
1106715978820407168,BH,"ماني من اللي يحب يومين ويخون
انا من اللي لا عشق  مات وافي"
1106716539921883136,BH,"ماني بعـاف قبالك الحـلو الثميـن 
أنا في رجـو وصالك اللي ما انوصل"
1106716840468930560,BH,"أنا مانـي مثـل اللي يمـرونك
انا لا جيـت مـره ما اجي ثـاني"
1106717268686319616,BH,"من تغير يجيب الله الف غيره 
ومن نسى ماني بحاجته لا ذكر"
1106717487536766976,BH,"تطمن ماني بواقف على بابك
أنا مثل العمر إن رحت ما أرجع "
1106720116920733568,BH,"ما أخذل اللي خذلني ولا أتبع من رحل 
أنا طبعي كذا بين حسن نية و ثقل "
1107333569477775360,BH,"اللي يبي الوصل ما يطالع عذاريبك
الحب عينه على شوف الخطا عميا"
1107373833445654400,BH," اشخاص حافظ عليهم وصونهم وشبعهم بالكلام الحسن والعطايا والهبه ولا تكسر باللي بخاطرهم علشان مايشحذون عند غيرك  
 امك  اختك  زوجتك  بنتك  "
1107630165071400960,BH,من شوي وانا طالع من الكلية مر يمي واحد وسلم رديت عليه السلام قال لي تره ما سلمت عليك قلت له في واحد في مخي سلم علي ورديت عليه 
1107966228545589248,BH,"صون اللي يصونك 
ولا تشره من اللي يخونك  "
1108645952330576000,BH,"مو مجبور أحافظ عليك طالما إنت
 عابر سبيل وكل من بغاك طالك "
1108646102746742784,BH,"أحب النادر اللي ما له بخلق الله شبيه 
وأحب الثقيل اللي من الصعب ينطال "
1108646265175314432,BH,"اشتقت لك وادري ماني على بالك 
تعرف اللي عايش الكذبه و مصدقها"
1108646394661924864,BH,"ليتك مثل طيفك راعي مواجيب
يقلط علي في كل حزة وساعه "
1108873850803154944,BH,"عسى قلبك فرح وارتاح بغيابي 
عسى طابت لك الدنيا عقب عيني "
1109064108899553152,BH,"والله ما عاد يلزمني رضا أحد
تبيني هذا انا ماتبيني الله معاك"
1109172638268735616,BH,"صامل بـ حبك لو فيه سجن و اعدام
وانا معك فـالمحبه راعي طويـله"
1109174068551520384,BH,القهوة حـب ونـت حب بس وينك مادري مضيعك ف هالعالم ذبحتني ياخي خلاص لا تتغلى تعال يلا        
1109913128781926400,BH,"خذاه الطريق اللي خذا قبله الغالين 
ولا هو على خبري ولاني على خبره "
1109913188013879168,BH,"قال ابرحل قلت ياجعلك قوي
الطريق اللي يجوز لك اسلكه"
1109913552759017600,BH,"ياجعل يفدونه قليلين الاسناع
اللي على الطرقه تعذل الهواوي"
1109914091135647616,BH,"ان بغيت  المواصل أو نويت الـوداع
باب قلبي مشرع وانت  راعي محل"
1109914212908912640,BH,"خاطري ماينكسر مره ثانيه لك
و ان نويت كسره كسرتك معه"
1109914345843113984,BH,"إن بغيت المواصل وان بغيت الفراق 
 أنـا قـد الأولى و أكبـر من الثانيه "
1109914563204518016,BH,"في هالزمن لا عاد تشره على الناس
من جاك رحب به ومن راح خله "
1109915219168579584,BH,"كثر التشره والعتب يوجع الراس 
من جاز لك جز له ومن شان خله"
1109916172210896768,BH,"في طريق الوصل ياما  وياما سعيت 
وأنت في كل يوم أبرد من اللي مضى "
1109916282479100032,BH,"مانجبرك على وصلنا دام الله مغنيك
خلك على وضعك مع الايام تنعاف"
1109916319795822592,BH,"خلك على وضعك ترى خاطري طاب  
زلـه على زلـه ليـن انهــي وجودك "
1109916514994610176,BH,"خلك على وضعك وتعلمك الايام
انك خسرت اللي بصعوبه وصلته"
1109917200331100160,BH,"و يجي بكره وتتمنى الزمان  يعود
لاترجع لك الدنيا  ولا أرجع لك أنا"
1109918042048344064,BH,"لا حبك أخترته ولا أخترت فرقاك 
الحب صدفة والفراق أختياركك "
1109918330847219584,BH,"عافك الخاطر ولا عاد بالقلب حسرات 
ذيك المعزه انت من ضيع قدرها"
1109918578004975616,BH,"رخيص الطبع مرساه الرخيص 
لو جاه من طيب الفعايل غمامه"
1109919200942928000,BH,"دامك طلبت نفترق ليه تبكي
من يطلب الفرقا عليه يتحمل"
1109920141825986560,BH,"اجي لـ آخـر مكان  مـر بـه دربك 
عسى هذا اللقى يصدف وأشوفك فيه "
1109920609046269952,BH,"والله اني كنت اعدك قريب وراس مال
لين جاني فرقاك ولاصرت اعرف اردك "
1111961411247398784,BH,"ان كان لي ذكرى حبيتها 
فأحلى ذكرياتي معاك "
1113881591321907200,BH,  في بينهم وفاء محد يخون وطول عمره محافظين على العلاقة بينهم احترام متبادل  الدلال والاسلوب موجود بينهم مهما تغير الزمن وصاروا اجداد يبقى الحب الكبير بينهم  عكس اليوم على الدلال والاسلوب الحلو بس يبقى الطمع وعدم الصبر وسيلة للطلاق والبعد حتى لو بينهم ذرية مع الاسف 
1113883098918334464,BH,"ياهـل المحرق لي معكـم وليـف
كـامل الأوصـاف ياويلـي عليـه"
1113893198093594624,BH,"عذرتك فوق خطاويك اعذار 
وسمحت لجنابك تدخل قلبي 
لكن ما سمحت لك تخون وتغدر "
1113896148580933632,BH,"تعداك لومي  و انت والله محل اللوم 
شفع لك غلاك و ساق دونك معاذيره "
1113896268349235200,BH,"برد لك هالشطر والصوت غناه
درب النقى دربي  ولا ادل غيره "
1113896483160514560,BH,"سجدنا لـ عزه وانثنينا لحوز رضاه
عسى الله يفرج كل هم شقينا بـه"
1113898307212988416,BH,"والله اني ما هقيتك على الفرقا عجول 
لين شفتك كل ليله تدور لك سبب "
1113898982906974208,BH,"خلك معاي وابشر بقلب يداريك
يصون حبك في زمان المجامل"
1114285674734157824,BH,"قبل كنت ادعي ربي يديمك لي لآخر العمر
والحين ادعي وألعن اليوم اللي عرفتك فيه "
1114285929307545600,BH,"فمان الله ياشخص رعيتك لين ما اقفيت
عسى الله يكتب الخيره لنا والله ينسيني "
1094356524766511232,BH,"يا صاحبي لو ظروفك عذاب وشقى 
بشقى انا معك لين نفرح سوا "
1094357008038457216,BH,"يا صاحبي لا تلوم  اللي عطى عمره
لعيون خله وهو  بالحيل ولهاني "
1094357166201426048,BH,"وش هالغياب اللي تمادى و طول 
كنك تقول أنسى تراني نسيتك "
1094357314734354432,BH,"أجيك حافظ غلآك وحافظ دروبك
وتركك كنك غريب لي ولا عرفه"
1094358814508412800,BH,"اما نعيش العمر بقلوب الاطفال 
ولا نشوف الحب بعيون شايب "
1094370251523923968,BH,"احترمت غيـبتك من عمري سنين 
لحد ما غلآ من جمـر الشوق وطـآب "
1094685862707761152,BH,"عليك من الوله ما يقصر الطاري على ذكراك  
نسيت الغايبين اللي مضوا ولا هان نسيانك "
1095977126094930048,BH,"يا المحرق ماعلى الخاطر خـلاف
نسمة هبوبك ماوراهاا طلايب "
1095984052312653824,BH,"ياحظ من طال وقته وهو جالس قبالك
ماهو حسد مني بس يا زين حظه "
1096027141848862848,BH,"لا حان وقت الفرآق ولزمت عليه 
اعرف اسلوبك ما يلقى مثلي شاريه "
1096129698940243968,BH,"ماعاد له طاري ولا حس ينقاد
 ماغير صوته في رسايل قديمة "
1096163561695576064,BH,"يا ليـل يـا ليت مـا اذكـره بعد هالغـيبه 
يا ليت وعـوده بالبقاء تنعاف ولا اطريـه  "
1096164392469712768,BH,"المواجع اللي تجيني من الناس غافل عنها 
لكن ياحسرة وجودي على اللي وجعني بغيابه  "
1096200607424237568,BH,"الجروح إللي يسولفها الحزين بكثره
إعرف إنها تاكله من داخله يوميا "
1096201116952477568,BH,"لكن عسى اللي قد جمعنا بدون وعود
مايعطي مكاني في خفوقك حد عادي "
1096201201228632064,BH,"ما اقسى من البعد الا وقفتي هذي
لا قادر أفارقك  ولاني قادر أكمل "
1096201409190608768,BH,"لا تامن الخوان لو زخرف حكاه
من خان بك مره يبي باكر يخون "
1096201486319669248,BH,"انا اللي عطاك من الحب فوق ماتبغي
وأخذ من الجروح الموجعة مايهد الحيل "
1096486049474375552,BH,كم لي وانا احتري جياتك
1096518878988066816,BH,"علـموك اللـي حواليـك كيف تغدر 
ومالقيت شخص تغدر به إلا حبيبك"
1096519312372830208,BH,حتى هواك عـشقـته  وخـالق وجودك تلقى مثلي يشـريـك
1096520560534831232,BH,"خـل جوالك قريـب منـك 
يحـق لي ادق عليك كل العمر "
1096521206172434432,BH,"يامحلاها من نظرة اخطفت قلبي توه 
انت لو تناظرين في الناس من حلاتك  
لكنت تشافين المريض  وداوين الجريح "
1096871218467258368,BH,"الظروف أحيان تجبرنا نغيب
بس ماتمحي محبة من نحب "
1096871464710610944,BH,اهوجس فيه  وانسى اني نسيته 
1096872004278472832,BH,"ماهوب عيب تعتذر عن خطاياك 
العيب والله صدتك وانت مخطي "
1097101067152703616,BH,"تدري وش اللي جدد الجرح ياهيه
خبلن تعطر مثل عطرك  و جاني "
1097112074486984832,BH,"ماهمني قول عذالك وعذالي
ولا الزمن لا نوى الفرقا تحديته"
1097621939521273984,BH,"مشيـت معاك بنـفس الدرب ونفس الشعور بس 
انت اختصـرته بالهجر وانا وفـرتـه بالمـحبه "
1097632005804773376,BH,مغرم الليل في حكيك آخـره  
1097982489119899648,BH,"هسـه أحب يالغالي ياللي اطع بيـا 
 وهـسه اشتا إل وهـسـه ألقا  "
1097982737393336448,BH,"ما لقيت ولا بـلقى غيرك  
درب اسيـر إلـه  "
1097983051005652992,BH,عسى روحي تلقى روحك  ياوجه الحسن
1097983313837543424,BH,ياليت بـراد هالليل  يخليني ألقاك 
1097985058542182400,BH,"ما بين الثواني والدقايق اللي يغيب فيها  
وانا امسـك الجمر احتريه من شوقي له "
1097986427080638464,BH,"تراك فالخاطر و لو ما نشوفك
و غلاك ما يمحيه قل المواصيل"
1097987577238511616,BH,"ياحبي لـ ذيــج الدار اللي ارتادها 
جعلني ما افقدها ولا افقد من فيها "
1097990448864473216,BH,ليلة باردة و بال مافيـه الا انت 
1098363799109808000,BH,يا سعد العين ونظرها ليت وجه السعد يـدري عن شآريـه  وانا دآري انـه مايدري ان القلب على شوفته يحيا  
1098493273310707584,BH, بالمواقف لانها تثبت الصداقة بـحق
1098663402409472000,BH,"الثقل و الرزانه ساسي ما
أتصنعها لجل ألفت رخيص "
1098663728646709248,BH,"أحب الثقل وأحب العقل و الرزانه
ما أحب السبيل اللي  كل يطوله"
1098665006894333952,BH,"ثقيل طبعي مـول ما أليـن  
رزين محتشم عارف ثباتي "
1098679208438624384,BH,"أعشق اللي لا نصيتـه سواليفه علاج
 لو ما عنده غير تمره و فنجال قهـوه"
1098728822843850752,BH,"لما كنت غالي شريت غلاتك 
جفتك تحب الرخص وبعت مغليك 
تبقى بالنظر وبالسمعة رخيص 
ولو طلبت الغلا ما توصل له "
1099106525866590208,BH,"لك حشمة الغالي ولك هيبة ملك 
وغلاك عندي شي ما يلحق مداه "
1099106568388427776,BH,"والله مدري من الغلا وين اوديك
تسوى عيوني ولا بعد يمكن اغلا "
1099106870877396992,BH,"اشطب كل التواريخ اللي غدت قبلك 
انا حيـاتي ابتدت  من يوم ماجيت "
1099106921917882368,BH,"مكتفي بك ولو حولي كثير 
انت واحد بس تسوالك بلد "
1099107671100280832,BH,"أجمل سنين العمر اللي تجيب 
تفاصيـل التفـاصيل اللـي منك "
1099285344581795840,BH,"سقى الله زمان ما راح يجـي يا يمـه 
كان مـا بهالدنيا إلا حب الله ثـم حبك "
1099411873286496384,BH,غلاك ما فيه عرق فالحشا ما شبره
1099412729679495168,BH,محتار في وصوفي كيف تـوصفك وتـوصـلك   تخسر الوصوف نفسها من حسـنك ي وجه السعـد 
1100190948074704768,BH,"ودي أسولف لك عن محبتك وغـلاك
لكن جبرني الوقت اغليك بسكآت "
1100191146192629760,BH,"عن الوحده يقول وليد بشير 
مليت من صمت وهدوء الاماكن 
ودي اسولف لكن اسولف لمن"
1100862691978170368,BH,"اشوف بك شي ما شفته بأحد غيرك 
يا جامع الي أحبه كيف ما احبك "
1100907779961905152,BH,"كنت احسب ان قليلي بعينك كثير
واثر اللي اسويه  ما يفرق معك"
1100910665332592640,BH,"عديم الاحساس صبرت له مرات 
كان جزآي اني اعذره وهو مآخذها لعبه "
1101056794472910848,BH,يا سيدي لو كلهم حولي انا دونك وحيد 
1101222680802541568,BH,"يبقى بـصدري كلام اعجز وصفه لـ ذاك 
يآخي انت خبل افهم اني هيام فيك  "
1101223734176870400,BH,"والله اني اصـير بخير في حكيك 
لاتترك اللي علاجه ودواه شوفتك "
1101224445946007552,BH,"يا أول صباحي وآخر ليـلي  
اتصل لو دقيقة طمن حبيبك "
1101225361705234432,BH,"خبروه وفهموا الخبل عيـا يفهم 
اني منتظر وصاله بعد هالغيـبه "
1101225814329356416,BH,"ياسيدي لا جيت ترحب و فيك بحر من الشوق 
وخالقك ما حكاك الشوق عني كيف احتريك"
1101947909812224000,BH,"فاقدك والشوق ماله عمر و أدري 
مستحيل إنك تجي بس انتظرتك "
1102299860286476416,BH,"المال لو يشري مجامل ماقدر يشري قبول
وقلوب خلق الله  لها بيبان مثل بيوتها"
1102301217336840192,BH,"لاهزك الشوق من عذرك تصوت لي
أنا من النآس ما تقوى على ودآعه

كثر  التلفات  يوم أقفيت أثبت لي
أنك على الصد مآ تصبر و لو ساعه"
1102650694417436800,BH,"غرام على درب المقادير ساق خطاه
طوى ذكرياته والحشى ماسلى منه "
1102650960814460800,BH,"انا الجيد اللي ليت حـظه غدى جيد 
وانا العاقل اللي صابه من الهوى رجه"
1102653084965236736,BH,"ليت الطريق اللي يجيبك يعجل
ويغفا الزمن لا صار وجهك قبالي"
1102669219458674816,BH,"لو يضحك الكون من شرقه إلى غربه 
ما عندي اغلى  من ضحكة أمي "
1102681823346376832,BH,"يحسبون الرجل حياته وحبـه بأقواله بس 
ما يخآبرون الرجل بفعايله يكسر قواعد حبه لـ حبيبه "
1102687521870434432,BH,"وينها عيونك أبيها أشتكي منها عليها 
أنا صدري ضاق منها وأنا عمري ضاع فيها"
1102697279344033792,BH,"تعال نصور الذكـرى  عشان نعاند النسيـان
تعال نوقف الماضي بـ صورة نجتمع فيها "
1102722134172938240,BH,"كنت أظنك جيت خيرة للي راح 
وهذا انت تروح وانا اقول خيرة"
1102722659576676352,BH, والله انه نفسي وقلبي واقفين على بابك في رجا انتظارك ولاعاد تقوى النفس بلياك 
1102723111802278016,BH,"ياليتني ما لمحتك ولا وقعت ف غرامك 
ماهقيتها الطعون منك  ظنيتك خيره وخابت ظنوني فيك "
1103329932153970816,BH,"مارخصنا رفيق ولاظلمنا عدو 
كلن على حسب فعله يحدد مكانه"
1103596490394648576,BH,"اللي يبغينا يا مرحبا به يعرف وين مكانـه  
واللي ما عاد يبغينا يعرف وين مـكانه "
1103789473987465216,BH,"يقول شريان
فيني مشاعر حب واحساس وهيام
بس وينه اللي يستحق المشاعر "
1103790060959342592,BH,أستودعوا الله  كل شي تحبونه
1103973974311088000,BH, لانه مب اصلين كله جذب 
1104159269937692800,BH,"الثوب لامن ضاق يستبدل بـ ثوب
بس الصدر لاضاق وشهو بديله "
1104187171660066816,BH,"الطريق اللي مشيته في هدب عينك نسيته
حتى قلبي اللي بصدري جيت ابيه ومالقيته"
1104498971693727616,BH,وفكيت لك باب عن الناس سكرته
1104499444320481152,BH,"وش عاد اسوي يومك اقفيت عني 
لا انا اتبع المقفي ولا احب فرقاك "
1104499515447525376,BH,"يامل قلب كل ما سج وارتاح
دارت عليه الذكريات القديمه"
1104499605373370368,BH,"وصبرت لين الصبر تمايل غصـونه
لا شفت زوله ولا جتني مراسيله "
1104499770549330048,BH,صار السهر عاده والذكريات ضيوف 
1104499830817255424,BH,"يقولون السهر يعلم الغايب يجي 
انا سهرت لك شهور وانت ماجيت "
1104499908256632832,BH,وصرت ذكرى تسولفها لي سنيني 
1104500176474046464,BH,"لو صار بيننا ألف زعل
لا تبعدين عني
لو حصل اللي حصل
لا تخونيني"
1104500498407800832,BH,"ماعاد أبي رد الجمايل من الناس 
الا عسى راسي من الناس يسلم"
1104501075619520384,BH,"ابي جيته في ليله والعباد رقود
 واناديه بـ اسمه واتحفاه و اضمه"
1104501152811503616,BH,"فاقد قديمين غابوا والغياب غياب
جعله يموت الغياب ويرجع الغايبين "
1104501469196288000,BH,"أشوفك فالدروب وفالملامح كل يوم تبين 
وأحس ان الخطاوي كلها صوبك توديني "
1104501876903591936,BH,"المكان اللي هجرته لو تمره
ممكن أن حتى جماداته تحرك "
1104502461505654784,BH,"مقادير وظروف وهقاوي وقيل وقال
 ووضع يكدر صافي البال ويعله "
1104502663742455808,BH,"خذاك الغياب اللي تريحت له وارتحت
وانا والله من اللي حصل ماني براضي "
1104502981230235648,BH,فمان الله ياخل سكن قلبي وهدهه 
1081328306555887616,BH,"دامك تشوف البعد حاله جميله 
ما توقف الدنيا على مفارق إنسان"
1081328562320351232,BH,"لا تلومني لا بديت تشوف تقصيري
أهملت وصلي ولا قدمت تبريرك
ما دامك تشوفني مثلي مثل غيري
وشلون تبغاني أميزك عن غيرك"
1081328688191426560,BH,"شوف حالي كان لك خاطر تشوف
وهاك فرحي دامك الليله معي "
