id,dialect,text
974405390115975168,PL,هو كل حاجه صارت غاليه  ولا انا اللي صرت فقير بزياده ومثير لشفقه  
974605474917167232,PL, بس خلي روحك فريش لو ضحكو عليكي 
974613304248323968,PL,انت لو عامل استخاره مش حتطلع معك هيك  
974672090845589632,PL,هو دا اناااا من يوم مكان عندي سنه  
974672142246739968,PL,هي ليه بتبعتلي  لما ببعتلها كلام حلو  هي عيانه  
974716828617531392,PL,هي بتطلع عليك مش لسواد عنيك هي بتطلع عشانك بتطلع عليها 
974717900559961984,PL," بكم هاي 
هاي هديه
بدي تنتين هديه "
975142565988241408,PL, غارات لحتى الان لليلتنا فل 
975143666229694464,PL, والله لو تقوم لقيامه كفار مكه ليعملو متحانات
975148220321017984,PL, احناااا بنتلكك ولا ايه 
975405968191361024,PL,"النفسية محتاجة وسخ الدنيا 
لانو الوضع صار نظيف أكثر من اللازم "
975422628222685184,PL,بحاول افتح الكتاب بس في حد قافل من جوا 
975437665872089216,PL, وانا بموت فيها من اول مشفت الصوره 
975439251008577536,PL, مهو انا سرقها من هناااك 
975780583614893952,PL, هات وحده زي هاي وبكرا بتجوز
975781528885256192,PL, مملوش ما اتجوزو هو احسن 
975783501806129152,PL, اه الوضع صعب يا دوبنا ماسكين حالنا 
975875396498526208,PL,انا زعلان انو ابوالعروسه خلص واللهي 
976163782257979392,PL,"بدي ياك تيجي معي دجيب اواعي انا بحب زوقك وبدي اياك تنقيلي 
بيجيب كل حاجه معجبتنيش"
976164141726687232,PL,"يعني مفش امل تبطل وساخه 
يبني امل اصلها بنت وسخه "
976179266458091648,PL,خلينا متفقين انه فش حد غني اغنيه مش تبعته الا ويكون غناها احسن من المغني الاصلي 
976516413593653248,PL,المصاري بتجيبش السعاده  بس بتجيب الامان  والامان بيجيب السعاده 
977218239079112832,PL," اللي طلب مني أمس شيكل سلف  










 دبرت لك نص المبلغ  "
977222756260605952,PL, دور ع اللي يغششك 
977249833110130816,PL,جدول ميد تيرم ايه اللي بتتفقه عليه ااانا لسه ماظبتش جدول الدراسه 
977541519749021568,PL,تلفونك هاد عشان تقلب فيه  
977610345752813568,PL,لما حد يسألني وين بتلاقي حالك بعد  سنين 
977610368020369408,PL,عدم التدخين بيخليك تعيش فتره اطول  وهاي حاجه مضره اكتر من التدخين نفسو  
977611211553607552,PL,  انا مليش ع الحرام نهائي
977611520401199232,PL, نسيت مهو الدخان حلالو
977612177682124800,PL, انا مركز بس انت شوي اللي نازل تعكف بالمواد 
977612797164081152,PL, انت امورك طيبه ع الاخر عشان هيك
977619287564341248,PL,بيكتئب  ف بيدرسش  بيكتشف انه بيدرسش ف بيكتئب  فبيعرفش يدرس تاني
977631142768795648,PL,لولا الطلاب اللي بيجيبو قلام زياده معهم عالمدرسه والجامعه كان زماني مكملتش تعليمي 
977632184990359552,PL,امي سامعه الاشعارات ع الجوال كتيره فبتحكيلي كل هدول بتكلمهم هلقد مهم يعني  بعد مخلصت تحكي صرت ابعت ولا كلب يرد عليه 
977632415068893184,PL,"للجادين فقط  ايا حد محتاج شغل دوام  ساعات براتب  شهريا وبتأمين صحي والسبت والاحد اجازه 





ينزل يدور مش غلط  وانا بدعيلو والله "
978375000074924032,PL,"اكتر اشي بيحرجني لما حد يبعتلي حاجه عشان اشوفها ويراجعني فيها واعمل حالي شفتها  ويتأكد اني بحور عليه وبعدين يحكيلي انت مشفتش اللي بعتو ليه انت مبتضحكش ليه  انا خرا اني ببعتلك 
وبيرجع يبعت تاني بضان ويخنقني 
وبرضو مش حشوف "
978377418686783616,PL, الله عالم بحالنا بعتلنا الشبيبه يأجلو لمتحانات   كناااا  حنتهزأ
978378138488098816,PL, وغير اللي مزنوق وعايز فلوسو 
978378317056364416,PL, شخصية مراة عمي بس بتستهبل 
978857411162312832,PL,انا بنزل البيت برجع بحب خمسه  
979423562498019200,PL,"قوليلي عيوبي 
بارد رخم  غلس ومعندكش دم 
ياااااا عمي بقولك عيوبي مش مميزاتي  "
949295938232832000,PL,شاف الماده قلها بسبس قلتلو ملحق 
949296176863612800,PL,هي لمتحانات هيبتها راحت ولا احنا اللي بطل عنا دم 
949297435477716992,PL," كلو ضرب مفيش شتيمه 
اكيد حيبطل عنا ضمير "
949298999323971584,PL, والله مهي حجه الامتحانات صعبه وصعب على امثالي ينجح فيها هاد ظلم 
949300705503928448,PL, لازم ترجع خاوه دتخرج قرفت عيشتي 
949310509194543232,PL,ادعو لناس اللي عليها متحان بكرا ولا عارفه حاجه عن الماده 
949310980743401600,PL, والله بتعب بس علفاضي
949614619148025984,PL,انا خايف ارجع البيت الاقيهم عاملينلي متحانات بالبيت 
949614702891593600,PL,احنا بنروح الامتحان بنهزأ نفسنا ونرجع تاني 
949614773993443200,PL,"لو سمحت ممكن ورقة اجابه تانيه
متجبلوش يا دكتور  انا هديه ورقتي "
949614882248302592,PL,انت مش بائس اكتر من واحد قاعد اول بنش في اللجنه 
949614945628549248,PL,"انا هيك مستقبلي ضاع 
طب اهدا وان شاء الله حنلاقيه"
949696303272996864,PL,كمية الوقت اللي بضيعها كفيله تنجح دفعه كامله واللهي  
949710104454160384,PL,اللي يقهر في الموضوع انه هادا كله الترم الاول ولسه في تاني  
949908157446414336,PL,"في ناس قليلين زوق قاعدين يزعقو
كل شوي يصحوني وانا بزاكر "
949910943181533184,PL, هي الجلطه جايه جايه فلميكرو 
949913397319085952,PL, اوعك توهملك نفسك انو العطله حتكون خرجات وعزايم  
950323197211303936,PL,"اذا تشابه حضورك مع غيابك ارحل
بيسيب قاعة لمتحان وبيمشي"
950323197240627200,PL,الواحد اجتو مناعه صار يطلع من الامتحان يضحك وهو مش حالل حاجه 
950323197479497600,PL," الو كيفك يا ماما 
تمام يا حبيبي  كيف كان متحانك 
وخالتي اخبارها ايه"
950383836545912832,PL,هقوم اراجع المنهج اللي انا مش زاكرو اصلا  
950412344756141952,PL," بكرا تقعد جمبي عشان تغششني 
ولما انا اقعد جمبك مين حيغششنا احنا التنين "
950429855283318784,PL, حفرح لو ناجح فيها 
950432709108748416,PL, ت إيش  احنا بننجح بالعافيه حضرتك 
950437740528766976,PL, ل ليش الاحراج هادا هههههه
950772323573026816,PL, هما المفروض اللي يخافو 
950774909910835200,PL,  انا صحبه معهم منخافش من بعض 
950849625417748352,PL, فش حد ابدي لزمن تنتهي هاي المهزله 
950851028634742784,PL, ازا تسيبك منو وقتي 
950858461704793984,PL, احنا كنا بنتحاسب يا جدع
950861734625104000,PL, قطه لعبة ف  هي اللي جابتو لنفسها
951059295415783424,PL,حضرتك ممكن تكون بطبطب عليه مش حنيه  ممكن ايديك تكون وسخه وبتمسحها فيا
951113606980145152,PL,"دوق ورق العنب شوفه ستوى 
اه خلص
طب اطفي عليه 
 بقلك خلص 
طيب ما انا بقلك اطفي عليه 
ياااا ماما خلص مش ضايل حاجه  "
951465141362724864,PL,يا ريت اللي مرتبطين يسيبو بعض ونوزع من الاول عشان انا مخدتش 
951567665444933632,PL,"انت بتخاف من الكلاب 
انت اهبل  ما انا قاعد معاك صرلي ساعه  شفتني خفت ولا حاجه 
 "
951867264034221952,PL,"لما اطش بتروح وين 
اطش 
لما بتبقى مبسوط يعني 
مبسوط "
951872327456870400,PL,انا عايز فلوسي اللي صرفتهم على تزيين الفصل وانا وصغير 
951941139355111424,PL,انا في حاجه مستنيها بس مش عارف ايش هي  بس حاسس انها حتيجي وتغير كل اشي 
952597806463799168,PL,"بيقولو كل البنات نكد 
إلا انتي يا حبيبتي 
قصدك انا مش بنت  "
952625798518845440,PL,"ما تيجي نرتبط 
هي حياتي ناقصه خراا"
952626523156238336,PL,اخلق معي حديث عشان انا اللي خلقتو المره اللي فاتت 
952936809255882752,PL,بتفك  شيكل عشان محتاج  شيكل بتصرف  وبتسيب ال  زي مهي 
953013372777389952,PL,اللي بيحبك جد عمرو ما يحسسك انو في حد اهم منك 
953281651030839168,PL, كان بنجح من اول مره  
953315778945781760,PL,"ابوك عمل ايه بعد ما عرف النتيجه 
قلي ولا يهمك فداك  "
953365814110928768,PL,اللي يخلي الحريم تجارتو يبقى يااااا خسارتو
953365897586073600,PL,الجمال لما يدور  ع المال بيبقى شمال 
953713713432973184,PL,"انتو صحاب ولا مرتبطين 
احنا بنحب بعض بس مش مرتبطين فاهم "
954119881410179200,PL,انا الوحيد اللي مجربتش شعور حد يزعلني وبعدين يجي يصالحني بهديه حلوه وبحبها  
954432021337726976,PL,يا ريت الناس اللي وزنها اقل من  يقعدوا بالبيت لانه الناس بطير في الشوارع 
954432144167853952,PL,  املأ الفراغ اللي فيااااا
954434183010676736,PL, ومحتاج حد يعزمنا قبلها 
954437606217060352,PL,لما اقلك غور في داهيه متغورش او غور شويه وارجع تاني 
954797472194449408,PL,صاحبك الحقيقي هو اللي يفهم اسئلتك الغبيه ويوصلك الاجابه بنفس درجة غبائك 
955096068655669248,PL," امها بتدخل عليها الاوضه 
بتخبي الجوال 
طبعا مانتي متعوده  انتي في اجازه يا هبله"
955222037617872768,PL,بينفعش تلوم حد عشان غيابه بيضايقك  هاي مشكلتك مش مشكلته 
955465864911998976,PL,لما أشوف الكرش معلق عند حدا تاني  
955869352749948800,PL,ابعد عن اللي بيتجاهلوك  وخليك مع اللي بيتجاهل الناس عشانك 
956188459537916032,PL," نفسك تطلع ايش بس تكبر
 اطلع برا غزة"
956230169567617024,PL,"شايف الجو ما ابردو 
انا الكراش تاعي ابرد منو "
956230268339269632,PL, نص في عينك يا شلب 
956231310485356416,PL, ولك صرلي شهر مش شايفك هاد اقل اشي ممكن اطولو 
956232575974068224,PL, ع قولتك ملكاش فايده والله 
956232849677586432,PL, لزمن تصبري عليهم  برضو لعياط الو دوره 
956233174371262464,PL, عشان انا اللي خلقتو المره اللي فاتت 
956233806545027200,PL," مزال الكل عارف الباسورد
انا حاطه ليش وقارف نفسي كل ما بفتح الجوال"
956233978037571584,PL, الحق عليكي اهمليهم  وادي دقني ازا حد لاحظ 
956235304851136384,PL,  لمصيبه انو في ناس مصدقه 
956236001931865984,PL, كمان مستكترين علينا الراحه يا عمي اكزبو 
956236275132059648,PL, امي بتلبسني جاكيت عشان هي بردانه 
956964744937857024,PL,الحاله اتطورت وبديت انسى الموضوع وانا بتكلم فيه 
957584145894596608,PL,انا كل ما اشتاق اليها معرفش اروح وين  الصراحه معمولي بلوك في كل الابلكيشنز
957972597785980800,PL,"مشكلتي بعرفش ارد ع الكلام الحلو 
يعني مره واحد قالي تشرفت بمعرفتك قولتله انا اشرف منك  "
957989375865958400,PL,"بيفكر نص ساعه
بيطلب  
بيجيب  
برمي الشده بوجهه وببطل العب  "
958042841619582976,PL,"حاسك متغير معايا 
بطلت اشتمك 
لا 
يبقى مش متغير ولا حاجه "
958043315714314240,PL,"احكيلي عن موهبتك 
بعمل اللي بدماغي 
وبعدين 
باخد ع دماغي"
958366283711631360,PL,"ايه اخبار الاكل يا باشا 
احتمال يكون زاكي لو سبتني اكله "
958437732304515200,PL,"مالك 
تعبانه شوي 
بتصلي 
اه بصلي 
عارفه لو بتصلي كان زمان حياتك حلوه
بقولك بصلي 
 بعرفش  انا حفظها هيك "
959446263791063040,PL," انت عمرك شوفت واحد في عمرك بيعمل اللى بتعملو هاد 
 اه يا ماما كلهم 
 احنا ملناش دعوه بحد "
959479187064188800,PL,الواتس اب بحسو عامل زي التلاجه بحب افتحو كل شويه حتى لو محدش بيكلمني 
959538997444870016,PL,"اوعك تحكي انا هبدأ التيرم من اوله وهشد حيلي   هادي وسوسة نفسك المريضه اللي بعد شوي حترجع وتقلك
  العب يلا  "
960075844168404992,PL,خليك فاكر انو اختك اكبر نعم ربنا بعد أمك 
960174480202006400,PL," فش زمه في توزيع الكهرباا
احنا خطنا آاااااااكل هواا"
960174900907474944,PL, المشكله مش هان الفاتوره بتزيد بتقلش 
960177683534663552,PL,شوية شعارات نضحك ع نفسنا فيهم انو احنا مش هفأ  
960181948579745792,PL,"شايف الراجل اللي بيرقص هناك 
 اه  مالو
كان متقدملي من  سنين وانا رفضتو 
يااااا ومن يومها وهو بيحتفل"
960226004022251648,PL,ع فكره احنا سناجل بمزاجنا 
960229977689149440,PL,"أقولك الصراحة  
اه طبعا اتفضل اكذب"
960266356770918400,PL,"بنتي وحبيبتي وكل حاجه ق الدنيا ليا معقول كبرتي والعمر عدا بالسرعه دياا  
يااااااااااااااا محلاكم

مدحتصالح
ابوالعروسه

"
960278037295255552,PL, مفيشاوسخ منهم اللي بيقولو
961231102445850624,PL,العبرة مش بكتر اللي حواليك العبرة بفايدتهم لما تحتاجهم 
961340319571816448,PL,هلأ حليمه شو كانت عدتها القديمه 
962002607446347776,PL,متحبنيش ولا تكرهني ركز في حياتك الله يحفظك 
962003046187393024,PL," عايز أشوفك
 وراك ايه السنه الجاي "
962038599402188800,PL,"بعدت ليه 
مكانش مكاني لوحدي  وانا مبحبش الزحمه "
962038648509145216,PL,"مرحبا   زاكرني 
اه طبعا هي الاشكال الوسخه دي بتتنسى "
962432949454098432,PL,سند البنت بعد ابوها فلوسها انما انت شفلك كلبه 
962433025656147968,PL,اوعى تطلع مع صاحبك اللي بيروح بدري 
962725263477010432,PL,لما تكون عامل عمله  
962734069510541184,PL,انا من الناس اللي لما تحكيله حاجه بسألش عن تفاصيل زياده عن اللي بتحكيها 
939923518627737600,PL,طمني عليك وبعدها نكمل غياب 
939923700673073152,PL,"لمتحان لوين يا مستر 
لحد ما وصلنا "
939992673808801792,PL,يعني اكون مدايق منك وحشني بنفس الوقت 
940009698517975040,PL,حبها بجد لانو في غيرك مستني منها كلمه 
940249902730407936,PL,  تدهاش فرصه انها تسيبك   اقتلو مسلا
940250130992779264,PL,انا بحبش الكلام لكتير  بس بحبو مع اللي بحبهم 
940261147013472384,PL,"كل مشوفها بصير اضحك 
يا شتات الشتوت يباااا رشدي "
940284651947556864,PL,احساس جميل لما تكون بتفكر بحد وفجأه تلاقي بيكلمك 
940285564766605184,PL,"لما شفتها قلبي دق  دقات
 هما تلاته بس 
لا ما انا شفتها هي وصحبيتها "
940286147703472000,PL, حيكلمك بس اصبر شويتين تلاته
940287438882263040,PL," راجي نفسك ح تتأكدي 
انا بعرفش الباقي بس الاسد متخلفين رسمي "
940288914228760576,PL," طولتي وانتي بتفكري بس انو مين نقلك ياها 
مستحيل انتو ازكي كتير وهادا غريب "
940290434408034432,PL,كل ما بفتكر الامتحانات قربت بخاف خمس دقايق وبعدين بمسك الجوال عادي 
940310627171610624,PL,قال يعني لما تعمل كوباية قهوه  قال يعني هتخلص المنهج 
940536370707288064,PL,"   
قديش عمرك 
 سنوات 
من امتى وانت بتغني 
من وانا وصغير"
940607780750274560,PL,الواحد حقق رقم قياسي في عدد الناس اللي بطل يكلمهم من غير سبب 
940626755815124992,PL,بروح الجامعه عشان انقص درجات وصحه ومصاري وطاقه ومجهود واروح تاني 
940964717912317952,PL,تحيه و اجمل تحيه لكل راجل لسه بيلبس لبس رجالى
940988705808044032,PL,"نفسي اخس عليك الاقيك قاعد بتدرس 
انا اللي نفسي تخش عليا وانا بدرس "
941007893700268032,PL,بحب الناس اللماحه اللي تفهم تلقيح الكلام اللي عليها ع طول 
941340380506869760,PL,في ناس حتى وانت فاضي تحس انك مش فاضيلهم 
941340494591942784,PL,كل سنة بحكي ما أهون السنة الي قبلها 
941707591675203584,PL,تمزحش مع حد محتاج تقوله بعد المزح انك بتمزح 
941719248514310016,PL,اضحك بوش اللي بيكرهك  خلي يكرهك اكتر 
941743283189010432,PL,لما اعمل لحالي اسئله بعد مزاكر  
942010392133406848,PL,عيش حياتك بطريقه تخلي الكل يسألك  انت شارب حاجه 
942093551827026048,PL,هاتو لكراش يدرس معاياااا خلي السنه هاي تعدي ونخلص
942093854035103616,PL,السنه هاي بالدراسه غير اي سنه مرت عليا  كمية برود ولا مبالاه مش طبيعيه 
942096208780198016,PL, انا اتكلم انجش لبلب بس مفهموش الصراحه 
942439075860111360,PL,"لما امي تنزل معي تجبلي اواعي 
بكرا تكبر وتصير ع قدك "
942439195842351232,PL,"انا مش حزنق نفسي لآخر الترم انا حدرس من هلأ
ضميري  احنا في اخر الترم اصلا"
942439381134184448,PL,"دكتور 
 نعم 
 اللي سقى كلب دخل الجنه فما بالك باللي بنجحه 
"
942442938407309184,PL, انا حدعيلك دعاااا بس انجح  
942444968198705152,PL, هاي نفسية لمتحانات امن الدنيا هيا هيا 
942816406608990208,PL,متخيل انه في شخص رغم انه جدوله نزل بس لسه عنده لا مبالاه ومفتحش كتاب 
943131688250544000,PL,"يبني انت مخك نضيف مبتدرسش ليش 
عشان موسخهوش "
943137718808260608,PL,"درست حاجه 
اول درس 
بتمزح ولك لمتحانات كمان اسبوع 
يخي مدرستش حاجه حنسقط رتحت "
943231367600660352,PL,تخيل لو انت الكراش تاع الكراش 
943231563071917952,PL,"شايف اللي بيتمرجح هناك 
اه 
هاد ضميري الدراسي "
943234770661789568,PL, لسه مجبتلهاش اشي بس تقلقش حنتخوزق مع بعض 
943236937124589568,PL,"هتروح تنام 
مين جاب سيرت النوم انا حسهر لصبح بكره اجازه 

"
943487374151049216,PL,"عجائب الدنيا كام 
سبعه 
حيبقو تمانيه لو نجحت الترم هادا "
943545924885807232,PL,الاعطل من انه حد يزعلك  انه ميكنش شايف في تصرفاته حاجه تزعل 
943546391133073408,PL,"احنا محتاجين زاكره قويه 
محتاجينها  في ايه  
هي ايه "
943554526744805376,PL,"كلو مقهور من كلو 
لو هو مش مقهور منك بيزعلكاش 
وانت من زعلك مقهور  "
943555932755243008,PL, انا تخربطت انتي يعني زعلانه ولا فرحانه مش فاهم 
943556255909646336,PL, هو لو بيشوف مش حيزعلني 
943862215928672384,PL,انا معترف انو صوتي مش حلو بس حغني مع الاغنيه اللي شغاله برضو 
943918443732111360,PL,اللي مصبرني ع قعدت الدار  إني باكل ببلاش لا وعندهم واي فاي كمان  فاينال
943960586135789568,PL,احنا بندخل السنه   ونطلع منها  اللي هو سلمني نضيف اسلمك نضيف
943960586190249984,PL,ع فكره الحرامات بتدفي بس احنا اللي بندور ع الاحضان وقلة الادب 
943960588845244416,PL,طلع ع نفسك السنه هاي والسنه اللي فاتت وتف ع التنتين وكمل
943960596906762240,PL,جوع بالليل في الشتا حقير ووسخ وحقير 
944259099600064384,PL,اللي كنت بحكيلهم صارو جزء من الحكايه  ومضلش حد ينفع ينحكالو 
944259453423161216,PL,شكرا يا حظي انت الوحيد اللي متغيرتش   طول عمرك خراااا 
944265126231888000,PL,يا رب انجح السنه هاي انا عارف اني مستهلش  بس اهلي والله ناس كويسين 
944266319960203264,PL, نص ساعه وانا بضحك  لسه مبارح صايره معي 
944269902822637568,PL, هو اللي عمل فيها راجل وعزمني 
944283980639145984,PL,"ما تجيب شويه 
ديش افتحها هلأ "
944296310265536384,PL,هي الوجبات فالشتا  ولا  عشان بحبش ازود في الاكل 
944587108836093952,PL,اخدناهم عند سطح الواد حماده وعلمنا عليهم  هلا برشلونه 
944610627280146432,PL, انتو لسه مبينين فيكو حيل تتكلمو كمان 
944626453022420992,PL,مش فاضي لحد الكراش واخد كلو وقتي  
944634160563544064,PL,لما تدرس إتغطى منيح بلاش تبرد و إنت نايم
944636089695965184,PL," كلنا حننجح ببركات دعاء الوالدين 
لا تقولو مجهود ولا نيله"
944952483805323264,PL,"انا مش حسقط سقوط عادي 
انا حسقط بتقدير"
945229707838218240,PL, ربنا يسعدك يا زووووووووق 
945249112441655168,PL,يا جماعه يا ريت لو حد طلع فيا من يقولي  
945315091414732800,PL, انا معنديش مشكله بس اهلي ناس كويسين والله حرام 
945710211523842048,PL,انا نفسي اعرف انا كنت وين لما نشرح كل هادا المنهج 
945725597325648000,PL," يا ويلي طلع الجوانب كتاب 
اكسم بالله ما احنا بحوزير رمضان 
الواحد دوبو فاهم منهجو 
شو كنتي حتخسري لو من الاول "
945726506965315584,PL, كلناااااااااااا بنغرق   ومحدش حيلحقنا 
946040838773145600,PL,المفروض الامتحانات تكون في الاكل اللي اكلناه في الجامعه 
946073575248793600,PL,انا زعلان عشان محليتش اشي بكرا 
946393616464928768,PL,"انت ع طول تايه ومش مركز 
 قول تاني منتبهتش "
946409751830781952,PL,حتى الفرصه التانيه اللي بتعطيهم اياها بتثبت لك انو الفرصه الاولى كانت خساره فيهم برضو
946412611205202048,PL,"شكلنا داخلين ع ايام سودا 
داخلين  شكلو الاخ كان مهاجر ولا حاجه "
946414036228468736,PL, ولا ميرضناش مش حتفرق
946415033629757440,PL," احنا نقصين توهان 
والله لمتحانات مكفينا 
ليش بتعقديها"
946416384556269568,PL, مهو انتي بطلي الحوزير تبعتك وحتبقى الدنيا لووووز
946418569180602368,PL,انا افقر منكم انتو  الجووووز  
946660776470831232,PL,عنا فش حاجه اسمها احترام النايم يعني  بتصحى تلاقيهم بيفطروا وحاطين الشاي بين رجليك عادي
946678278416461824,PL, مش قلال ال  شوي 
946710839339507584,PL,ضحكتك لحالها بدها قلب يحبها 
946715356197998592,PL,لما حد يسألني عملت ايه في الفاينال 
946763748961898368,PL," ولا في بالو 
ما بيقرأ اشي "
946763959763373952,PL,طول ما اختي عنا مش حنجح  
946780420368105600,PL," الله يكرمك ويحيي اصلك 
انا محدش قلي كدا قبل كدا "
