id,dialect,text
775706131553484800,JO,"شب كاتب  
يا شباب لازم حدا يتبرع و يتجوز حبيبته البنات صاروا ما يصدقونا بالمرة  
هههههههه "
776351313458241536,JO,في ناس لما تحكي معهم بتتعلم اشياء كتير  و منها انك ما ترجع تحكي معهم مرة تانية 
777069971222433792,JO,                 
777946542401617920,JO,"طيب بلاها هاي بدكم تقاطعو قاطعو صح وروحو وحطو دفتر فاضي بدل ما انتو لا حس ولا خبر تقولو عرس عند الجيران 
الاردنينتخب انتخابات"
778478416383336448,JO,الحبر كاين حنا ريحه اصبعي حنا 
778498959065096192,JO,بعض الأحيان اذا دققت بكلامي استغرب كيف فهمني اللي كنت بحكي معه 
778502719858434048,JO,بعض الصدمات اللي تمر عليك بحياتك وظيفتها إنها تعدل نظرتك للأشخاص بحياتك وترتب لك أولوية الأشخاص بالطريقة اللي يستحقها كل شخص
778503055641808896,JO,"النفسية اللي يكتب  الله ياخذني 
طب انا شو ذنبي لمن اقرأها
و اكتشف اني دعيت على نفسي  الله ياخذك انت 
حيوان "
781495644385075200,JO,"لما تكون مشغول طول اليوم 
وترجع لتلفونك ما تلاقي لا مكالمه ولا مسج 
هووووون بتحس حالك  اللونالابيض الي بعلبة الألوان 
"
785392553604550656,JO,"من هواياتي الجميلة ابتسم ل شخص بعرف انه يكرهني 
"
787645390090821632,JO,حتى مخي صار يرفع ضغطي بفكر بأشياء ما بدي أفكر فيها 
787645965469614080,JO,نبع الحنان لما تزعل من حد تسوي   
787652068278427648,JO,"نفسي افهم البنت اللي بدها حبيبها يحكي معها ليل نهار 
يعني هو ما وراه بنات غيرك 
ناس غريبة الصراحة "
788350779723776000,JO,اذا احد اتصل عليك ومارديت بتصير مشلول الكترونيا ما بتقدر تدخل ولا برنامج
788353934112980992,JO,كل شي اذا زاد يصير بايخ الا الفلوس
789027940025663488,JO,"إذا جا وقت الصلاه ما يصلي بس يطفي الاغاني 
لانها حرام  الله يجزاك خير"
789028645192990720,JO,الكسل اللي فيني صار يمنعني من النقاش والرد النظره بتكفي 
789050242599706624,JO,"والله الحياة حلوووة 
بس انتي اللي بتلاقيكي مهندسة "
789187284977328128,JO,"اكثر جملة تورطني  ضححكونآ معاككم 
لا حول ولا قوة إلا بالله  محنا قاعدين نضحك عليكي كيف نخخليكي تضحكي عليكي "
789805130292011008,JO,صار عندي تمزق برقبتي من كثر ما ألتفت للجانب المشرق بحياتي 
789832995465224192,JO,لما الواحد يمشي  كذبة  مش لأنه  أهبل  بس على الأغلب قرفان يعاتب  
789836485394632704,JO,"ما أملك طولة البال اللي تخليني أبرر اي شي عني 
طالما أنت مصر تشوفني بصوره سيئه الله يقويك "
790558813166469120,JO,الدنيا بسيطه لدرجة ان كلمة مو شغلك تسكر نقاش كامل وحوار مزعج 
791194581576605696,JO,اكثر شي ممكن يريح ضميرك ان الله دائما يعرف نيتك 
791196434901106688,JO, لا الشتا راضي يجي ولا  راضيه تخلص ولا حظي راضي يتعدل  
791282364475465728,JO, تنسيق الملابس اللي بمخي احلى من ملابس جويل بس سبحان الله اول ما افتح الخزانة تتبخر جويل ويجي عبدالله بالخير  
793074993273966592,JO,"كانت تحكي عن الميرندا  برندة  
وحاليا بتحكيلك ما بصحصح الا على فنجان ئهوة من ستار بكس  
الدنيا دوارة"
794630708417482752,JO, ما انا عشان عارفه انو راح تيجي الفرصه يوما ما مستمرة وما برد ع الحاسدين 
805758956790513664,JO,"معدتي العزيزة 
اللي عم تحسي فيه ملل مش جوع
ركزي لو سمحتي دمرتيني"
805760203828461568,JO,الراتب عندي زي علبة اللبن صلاحيته  ايام وبنتهي
814877018479333376,JO,"صوتي ححلو مع الاغنيةة  بس 
ازا وقفت الاغنيةة  بتسمعو صووت غساالهه"
878300946798792704,JO,كم رتويت جبت  افهم بعدين علق  
878308158258552832,JO, ممكن صح و ممكن كان لازم حكيت بنات ببشعو حالهم اوضح
940888299325083648,JO, هو هاد الطبيعي بس في ناس بتحملك جميلة فيه زي كانه مكافاه
741565159739555840,JO,انا تعديت مرحلة اللي يصير يصير  وصلت مرحلة عاد والله هذا اللي صار 
741952341633564672,JO,اعرف قيمتك عندهم بعدين ازعل  لاتزعل على ناس حاطينك ابجوره
741954417772134400,JO,"ليش كلمة مع بعض بتنكتب منفصلة  
وكلمة منفصلة بتنكتب مع بعض  
يا انا  يا نيوتن 
اثر الصيام"
742515791069884416,JO,صايره ازا رمشت بالخطأ بنام 
742674297634852864,JO,بحترم الشخص إلي يعرف اني ما أطيقه ويحاول يتجنبني وما يحكي معي فعلا إنت حيوان نادر
742674436990619648,JO,انا اذا زهقت بصير مثل الختايره بتمدد بنص الدار وبتدخل بكلشي 
742691325888192512,JO," لاانا بنتقده كشخص هواسلوبه خطا اناما بعجبني حقي صح 
بعدين الانتقاد للحكومة اوالبلد لازم يكون عن وعي انا بنتقد وانتي بتنتقدي"
742692112202924032,JO, وحق الكل ينتقد بس الي ينتقد المفروض يكون فاهم مش المهم احكي واذم وخلص  وحتى الحرية بنظري لازم الها حد ولا بصير مفعولها عكسي
742692729185050624,JO, هلا انالو تعديت عليكي مش حقك تردي علي باي طريقة بتشوفيها مناسبه وبنظرك بتكون صح وطبعاانا اكيد بكون شايفتها هجومية
743341683383799808,JO,"صباح الناس اللي تملي حياتنا حب و راحه وأشياء حلوه 
الله لايجيب اليوم اللي ممكن نفارقهم فيه "
743386549891407872,JO," حبيبي أنا ما بفطر الا سلطه ومي 
وبالعيد الفستان بعلق عند رقبتها  "
744157965477879808,JO,طبعا لو حلفتلك اني شفت كلامك ورديت عليه بعقلي وسكرت المسج ونسيت ابعتلك الحكيمش رح تصدقني 
744159706751569920,JO,البنات الي ما بحبوا الكرة وفجأة بصيروا يحبوا الفريق الفلاني  الموضوع واضح حبيبتي معاه امشي بدربه احب الي يحبه
744463942890721280,JO," انتي ليييشش بتاااكلي كثيييير 
 عشاني حزينة 
 طب ليش حزينة  
 عشاني نصحانة "
749925150863265792,JO,يوم و بنبطل نلاقي الشغلات يلي بنخبيها بالثلاجة 
749928239435579392,JO,"العيد قرب 
تعرفوني او ما بتعرفوني  بحب احكيلم  كل عام وانتم بخير 
تردو او ما تردو انتو وذوقكم "
752019618156404736,JO,"تعال اقنعهم 
انو كيفك كيف حالك شو اخبارك شوعامل شوبتسوي شو بتعمل شوالوضع كيف الجو معك
كلهم نفس الجواب عفكرة "
752020333654335488,JO,انا هلأ نشيطه وتعبانه ونايمه وصاحيه ومروقه وزهقانه ومشغوله وفاضيه 
752835563066122240,JO," ممكن نجيب الأكل من المطعم ب  دينار عادي  بس البيبسي لازم نجيبه من اي سوبر ماركت عشان المطاعم بتبيعه غالي 
هههههه منطق اعوج بس مزبوط"
752837768330510336,JO,"لو تلفوني بيحكي كان سألني شو مشكلة اهلك معي
ولا شي حبيبي بس غيرانين منك
"
752843790726098944,JO,"يا رب بهاي الساعه الله يوفقكم و يفرحكم و يفرجها عليكم ويهدي بالكم يا رب
"
753149474130845696,JO,"أنا بتأثر بالنصيحة اول  دقايق 
بعدين برجع ل طبيعتي مرة ثانية "
753149688627531776,JO, كيف نزلت معك مش موجوده ع   
753150161644322816,JO,"هلا تخيلو قال الواحد بطلع من البيت وابوه يساله وين
يابا رايح اصطاد بوكيمون
الله يوفقك يا بني"
753531291669139456,JO,أمي هي الوحيدة اللي تسبني بوجهي وتمدحني من وراي ماتتقارن بهالعالم المنافق
753701539936690176,JO,لما حد يطلب مني الشاحن او السماعات بحس انو بطلب مني اتبرعله بكليتي
754275493206233088,JO,"الغلط   عمرهم مآ بنسوه 
آلصح   معجزة لو تذكروه   
"
754282328155881472,JO,عادة البنت لما تكون زهقانة بتحب تعيش جو الدراما 
754319531472977920,JO,"عيناها سبحان المعبود
بس شالت الرموش صارت عبود"
754346348514832384,JO,خففو مجاملات او ما تجاملو اصلا خلي الناس تعرف قيمتها
754587037639016448,JO," مين زعلك 
تحس هالكلمة حضن على هيئة سؤال  "
754631519826739200,JO,"ضاع عمري وانا انزل تويتات
ولحد هلا ما اجا حدا حكالي حبيتك من تويتاتك"
754662467263950848,JO,"انا لو اجيت اصالح حد زعلان مني ازعله زياده بالغلط
"
755001555368157184,JO,"ويا دني شتي ياسمين 
عالي راحوا ومش راجعين "
755002012975173632,JO,"لما أغسل وجهي وتشحط الكحله والمسكرا لازم اعمل مشهد درامي قدام لمرايه 
أنت اايه مش كفاايه عليك تجرحني حرام عليك  "
755700164166320128,JO,قبل لا تحس أن اللي أسويه غلط حس أن مالك دخل 
755703488076718080,JO,انا ما أعرف شيء اسمه فضفضه للناس اتكلم بيني وبين عقلي واتناقش واحل المواضيع وانهيها ولا من شاف ولا من درى 
755819383369457664,JO,عفكرة انا ازا زعلت منك مش شرط انت كمان تزعل  مش مسابقة القصة بسبقول
756034101363216384,JO,"مش ضروري بس تضحك البنت وهي ماسكه الموبايل تكون بتحكي مع شببجوز قرات نكته
"
756040143962865664,JO,"اذا قعدت هاديه معاك مو معناها انا هيك طبعيبس انا بكون مو مرتاحه بالقعده معك
"
756091120917110784,JO,تزعلوش كلنا ماكلين هوا 
756091841293025280,JO,"من مميزات البنت
لما بدها تعمل شي مستعدة تاخد رأي  وحدة وبالأخير بتعمل الي براسها"
756098264827588608,JO," الزعل بيروح بلمة حلوة  والتعب بيروح بحضن  والعصبية بتهديهاا مسة إيد 
قلوبنااا بسيطة  بس البرياء مرض
واهم شي الجوع بروح بالشاروما "
756823673139499008,JO,مشكلتي بالحياة حتى لو طلعت مشوار بس ارجع عالبيت لازم انسى واحكي زهقانة 
757882524450299904,JO," انسب رد للي بتشوفك كل مرة وبتقلك نفس السؤال متى بتتخرجي او بتتزوجي 
 صار وماعزمتك 
"
758274454967517184,JO,"ما بعرفوا الحرام الا لما يشوفوا شبشب مقلوب 
"
758275324836712448,JO,"ألحيآة كل مآ شآفتني أضحك  
قآلت  
عطوهآ مصيبة تستآهل "
758280550016770048,JO,إللي بقرأ المسج من برا مش أقل حقارة من إللي بعمل  وما برد 
758567250173562880,JO,"الحمدلله النعس مابيجيني الا لما اكون لازم اصحصح
و بس بدي انام بيختفي
"
758589117806575616,JO,"في ناس بتفوت ع حياتك هيك وبتطلع من حياتك برضو هيك وانت بتسأل حالكطب ليه هيك
بس بتعيش وبتكمل حياتك هيك او هيك"
758589494459236352,JO,شعوري وأنا اشيل الورقة عن ساندويشه الشاورما نفس شعور العريس لما يشيل طرحة العروس 
758624085907734528,JO,"قد ما صار اعراس ب هالشهر اتوقع حتى زوجي المستقبلي أخدوه
راح الغالي "
758624317441712128,JO,بستغرب من اللي لما يرن موبايلهم بنبسطوا أنا اذا حد حكالي بتصل بعمل حالي ميتة
758630364931772416,JO,"بس إمي تحكيلي اعتبريني متل صاحبيتك واحكيلي اسرارك 
بهاي اللحظة بستوعب اغنية ما فيش صاحببيتصاحب 
ههههههههههههههههه "
759116050403356672,JO, ما انا مش فاهمه قصتهم عشان اعرف من شو ازعل 
759123561659437056,JO,بحس انو فرق العمر المناسب بين اتنين مش لازم يتعدى عشر سنين ابدااااا
759125099609980928,JO,الليل وسماه وسهره وقمره 
759391990702276608,JO,مشكلتي بالحياة اني بزعل و بنسى من شو زعلت
759393837185900544,JO,في نآس لما أشوفهآ بقائمة البلوك يكون نفسي اعملها بلوك ثاني 
760438284178878464,JO,"خليني ساكته أحسن
تقريبا بعد هالجملة بينحكى كلام و فضايح و مواضيع بعدها بتخرب عالم 
"
761445872576131072,JO,شو صبح مصحيني مش عارفة 
761862120271122432,JO,إنه يكون إحساسك دايما صح شغلة بتخوف
761932485064331264,JO,"      
 خلص بمر عليك باخدهم"
761934077247254528,JO,سبب تدهور حالتي الماديه انه اول ما يصير معاي مصاري بفكر ع طول شو رح آكل  
762239940117889024,JO,"احكيلنا عن موهبتك
موهبتي اني كل ما بجي اكحلها بعميها "
762552462616174592,JO,"كل كلمة بتنقال ورا ضهرى بتوصلني  
ثانكس ي دنيا "
762715716307017728,JO,جرالي ايه جرالي ايه الدنيا حلوت كده ليه
762718160558690304,JO,جوي جميل وبكرة معطله وبغني للهوا الطاير من الفرحة
763263066419130368,JO,صبحوا ع اللي منتظر منكم صباح اهزموا البعد والمسافه والخصام
763378065284161536,JO,انا ذا حبيت شخص حتى الناس اللي نفس اسمه اعاملهم معاملة خاصة واذا كرهته بحقد على كل الي اسمهم نفس اسمه
763378525525204992,JO,"براحتك  الله بعين  معلش 
هاي الكلمات لما تشوفو حدا زعلان لا تحكوها  طنشوه اشرف "
764345462736449536,JO," هو بيكتب   
 هي بتكتب   
انا       "
764531028551753728,JO,معقول يكون في حد عامل تحدي عشاني وكمان شوي الاقيه منشني 
764805373157117952,JO,"مين عنده شاحناكثر لحظه اعمل حالي ما بسمع فيها
"
765155838386401280,JO,في ناس من خفة عقلها كانت بدها تطير بس تقل دمها أنقذ الموقف
765431498963030016,JO,"اقتنعت انو محد بنفعني الا فلوسي واكتشفت انو ما عندي فلوس   
 
صباح الافلاس والناس لسا بنص الشهر"
765457534664708096,JO,ازا بترشح للانتخابات معقول انجح زي زي هالناجحين
765488184482562048,JO,"وينك
بستنى الباص
طيب استعجل
طيب رح استنى بسرعة"
765514823077601280,JO,"تفضلي يا خالتو اقعدي مكاني
الله يرضى عليكي يا بنتي
ابنك هداك اللي هناك
اه قاعد بيستنى خطيبته
قومي قومي ياخالتو أقسم بالله منتي قاعدة"
765824863714025472,JO,يلي بزعل منك بدون سبب خلي بدون سبب يراضيه 
765896520700981248,JO,لازم نلاقي حل للناس اللي بتعجبنا في الشارع وما بنشوفها مرة تانية 
765984283009908736,JO,محاسن الصدف هي الصدف المالية اللي تغير حياتك للأحسن مش صدف البشر الي ما وراها إلا الهم و الغم 
765984911840931840,JO,لما تبين لأحد قد إيش هو بيعني الك بتحس انه بتزيد هرموناته الحيوانية
766151203503890432,JO,"يارب ايام حلوه تورد الدنيا بعيوننا
صباح الخير"
766232185871499264,JO,المفروض يعملو نظام اسمه سافراذا مرت سنة و انت ما سافرت يسفروك غصبا عنك
766256058889306112,JO,"من معتقدآت بعض الشباب  انه بمجرد مآيعضل  يصير حلم كل فتاة 
"
766982950592270336,JO,"انت ممكن تلاقيني بحبك  بس بكرهك برضو عادي يعني
 منطق البنات "
766989560353959936,JO,الحياة حلوة بس مخربها وجهك الله يهديك 
767063842266415104,JO,خليك طبيعي وتلقائي وصريح مع كل الناس  صدقني رح تخسرهم كلهم 
767243328228323328,JO,صباح الخير  لـ الناس المتفائلة اللي تدرك أن الصباح فرصه ثانيه لها بالحياة و تبتسم
767655084712988672,JO,"اي واحد بحكيلك بدك شي 
احكيله بدي فلوس 
لمتى بنظل نجامل ونقول سلامتك 
 
 "
767655294713430016,JO," قديش بتحبيني 
 شايف الرة الأرضية هاي لها  
 آه  
 أقسم بالله منا طايق  ولا طايق اي حدا فيها  
نفسيةة تايم "
767973831512297472,JO,يا رب أيام حلوة ترفعنا للغيوم من حلاوتها
768372709185257472,JO,"انت من متى بتحط كحلة  
 و الله من لما مرتي شافت قلم الكحلة بسيارتي "
768749815685582848,JO,الراحة بتتلخص في حاجتينأولهم النوم والتاني انه ما حدا بصحيك من النوم 
769248854583697408,JO,أكره أنحط بين شعورين ما بدي أعاتب عشان ما أخلق زعل وبين والله إنها حزت بقلبي 
769249218812928000,JO,الحلو بالاجازه انه كل شي ما اله وقتيعني طبيعي جدا اتابع فيلم بعز الظهر و اتغدا الفجر
769891879236300800,JO,صاحبك الحقيقي هو الي بس يدخل غرفتك ما بخلي عطر غير بحط منه
769896592790937600,JO,كل شي بحياتي ماخذ وضعيه الطيران إبتداء من حظي انتهاءا ب فلوسي  
769923305721761792,JO,شعور زفت تكون ناسي مفتاح البيت وتروح ما تلاقي حد بالبيت يحدث حاليا
1154432323137495040,JO,"  ياي كلهن تركيات
من وين جبتيهم"
1154507024127778816,JO, صحيح يكذب ويقلك ما اقدر احكي وهو كذاب وخوان
1155183724486639616,JO,  بغض النظر عن حكيك في فرق بين الغدر والخيانة الغدر بطعنك من وراء ظهرك الخيانه يخونك مع شخص ثاني وانا ما قصدت حبيب قصدت صديق بس انت واضح على قد ماهو راسك معبىء تبن فاهم الحياة غلط الي بحب مابتهم حبيبه بالخيانه اصلا اتهمك اله  أكبر خيانه وكيف حبك والشخص مابعرف ا
1155184541532905472,JO,  في فرق بين الكذب وبين ما يرد او يعطيك رد الكذب واضح يكذب مابده ينكشف بس عدم الرد مش معناها يكذب وبخون معناها انك جرحته وسكت عشان مايخسرك ياغبي
1155185854316503040,JO,  ناس فاضيه ومفكره الكل تفكيرها خايس وماتفرق بين الصح والغلط
1155186361902731264,JO,  ترى واضح قصدك مفكر حالك ذكي محمل الشخص الي بتحبه الخيانه والغدر روح ياشيخ تفكيرك محدود الله يعينها عليك مدري ليش حبتك
1155186643734687488,JO,  اوكي واذا كان الي مقابله تفكيره ع قده وش رح يقنع جدته
1155189213723340800,JO,  لو بحب جد ما جاب طاري الي بحبه غير يا احلى الأوصاف مايجحد بكلامه
1155189551389954048,JO,  يفهم اوكي بس مايتهمه لو بفهم عليه ماكان شك بحبه لحظه
1155191047322046464,JO,  انت ادرى فيه هاظ اختيارك وحبيبك انت بدك تحب اتحمل
1155191724748214272,JO,  بتوفر خلها تشوف غيرك عقلك ما يساعد تستمرو
1155194887010172928,JO,  مش عارف إيش احكيلك انت مثل المد والجزر من وين مانجيك بترد ومقتنع بحالك وما رح تقتنع غير باللي ببالك
1155195537244733440,JO,  عشان هيك انا مارح احكي أكثر 
1156216954811834368,JO,"اليومالعالميللصداقه
طبع الزمن مايدوم الصاحب"
1157090426052104192,JO," عامل هاشتاق إردوغان ع فكره الهاشتاق مابمشي غير بينكو 
يعني الأتراك مابكتبوه مثلك يعني انقعه واشرب ميته تاتعرف تكتب اسمه بالاول"
1157128158677733376,JO, ياخي خانت اوكي ليش باقي تلف وراها لو قلبك متاكد من خيانتها ماظليت تراقبها خلص ليش تتعب حالك على اشي ماله وجود ترى انت مزودها كثير لو انا مكانه بوقفك عند حدك يكفي اتهام وظلم كافي
1157129571688280064,JO, هاظ الي كان ناقصهن من دون هالواسطه ولي أمرها ماكل هوا
1157413711100960768,JO,  تفهم ولابكيفك كافي ثقتها بنفسها كافي رغم اتهماتك مطنش ومش سائله عن حكيك الي هو اصلا بحد ذاته خيانه
1157424875755188224,JO,"  مجنون وعاشق روح اقلب الصفحه نعيش حياتك وسيبك من كلام الناس العمر بضيع مننا
والحياه قاسيه بلاش تكون قاسي"
1157431441648738304,JO,  نرى انت جارح نفسك بنفسك وقت تعرف الحقيقه وتعرف حالك قديش كنت عبيط ساعتها مين رح تلوم ولا على مين رح تحط الحق ولا مين رح بينفعك وقتها وايش خسرت وشو ضيعت من غباءك
1157478444617412608,JO, جهنم الك ان شاء الله
1158507826198789888,JO," انسرق  مش بس واحد
 هاي ايموجينالله لا يوفقه الي سرقني"
1162458163297378304,JO,  لا تروحي خدماتهم سيئة بطئين ومش طيب اكلهم ليل نهار اطيب
1163744459387035648,JO, من هون وهون بتوصل ربع مليون
1163746069651623936,JO, ان شاءلله ربي يحفظك ويسعدك
1170823129649881088,JO, خلص هو مافيش غيرها يزم ولله مات مليار محد سأل عنهم قرفتونا
1173229454925148160,JO, انتي ماتطنشي ليش بتلاحقي المنتقد اتركيه يحكي لحاله لما بتردي بتعطيه أهمية اله وقيمة لكلامه انسي شو مغلبك كلام الناس للناس
651086584117395456,JO,في ناس بنمغص بس اشوف تويتاتهم
651086652249653248,JO,مش عارفة ليش عاملتلهم فولو
651485629059043328,JO,الله يعدي هالحياة على خير
651811713730387968,JO,  البنات بكره بلبسو جزمات صبرك بس هههههههه
651812532378836992,JO,  هههههههه فاهمين الجو خطا عادي لا تاخذهم 
651813668338991104,JO, طب والله انها حلوة بس انتو نكدين
652825417133486080,JO,مو كل فاضي فاضي لك
652825570229751808,JO,بعض الناس بكون نفسك تحط دعايات بنص حكيهم من طول قصصهم
653169355040104448,JO,"بدك الناس تصدق حكيك 
وشوشهم ياه وشوشة"
653217978222292992,JO,خليك انت الشخص الي لما يروح بيفرق بحياة كثير
654360934945824768,JO,صحيح الحياة ما بتوقف على حد بس ممكن المشاعر والاحساس يوقف عند حد
654584174758764544,JO,من لما عرفت حالي لليوم ما شبعت نوم
655089162350104576,JO,كانه الناس كلها صايرة تتزوج 
655089237432401920,JO,الله يديم الافراح على الناس
655710724698828800,JO,أمك جابتك واحنا ابتلينا
656124516591079424,JO,التصنع بخليك تفقد كل شي حلو و اولها انت
656447051614539776,JO,أعوذ بالله من افكار الشيطان الحلوة
656448626374397952,JO,لما واحد يغلط عليك وتقوله بصوت عالي شو قلت  ويرجع يعيد هون بتبطل تعرف شو تسوي ويمكن تتهور
