id,dialect,text
1115524996787515392,JO,شباب المحافظات قعدوا ايام بالبرد والمطر وما سمع الرزاز ولا استنظف ينزل يحكي معهم بس ليش الحكي جماعة المشاريع مرتبين ومو لابسين شباشب وفروات وجايبين مشي من اخر الدنيا 
1117666303404331008,JO,اعطوه منصب وارحمونا من هالتلميع اللي بلا طعمة ما ظل مكان ما طلع فيه وهو زاهد كيف لو طامع بمنصب 
1117668839599132800,JO, ما خطر ببالي شخصية زاهده اقارنه فيها الله يصلحه 
1117675383921500160,JO, لسا المحتوى اكثر ابداع
1117682858070556800,JO,وزير خارجيتنا اعلن انه الاردن لا يمتلك معلومة عن الصفقة بالوقت اللي اكثر من تقرير صحفي ظهر مبارح يحكي بتفاصيلها 
1118062822733303808,JO,  حق اي شخص يدافع عن نفسه لكن الموضوع تحول مع رؤساء الحكومات لعمليات تلميع والحق طلع بالاخير على الشعب وناكرين لجميل انجازاتهم البس نشوف نتيجتها اليوم واذا بده يرد على المتواجدين بالخارج يقدر يصدر بيان بس اللي صاير مو رد
1118063268671696768,JO, وعنده محبين يدافعوا عنه بس الحق مو عليه الحق على صحفيين يركضوا عشان يرضى عنهم مسؤول سابق او حالي
1118075997415518208,JO, هههههههههههه لا بعيد الشر بس والله في ردود فعل غريبة
1118186363881500800,JO,احنا نعمل منصة حقكم علينا بدل ما نعرف 
1118187978344542208,JO,صفقة قرن وصفقات على البيعة
1118189276460666752,JO, دراسة الوضع القانوني هي للشرط الجزائي واعتقد التلميح عن إمكانيه إلغاءها يعني عندهم طريقة ما يدفعوه الا اذا خصموه من مبالغ صفقة القرن ان تمت بالطريقة اللي يروجوا الها
1118201424549163008,JO, السب والاساءة مو مقبولة بكل الحالات لكن غرايبة قال اللي ما حدا تحرش فيهم عفيفات وكانه البنت اذا حدا سمعها كلمة صارت مش عفيفة وحاول يرقع انها مزح وما اعتقد فيه اساءة اكثر من هيك
1118201598231158784,JO, اكيد مش صحيح لانه النسبة اكبر من هيك 
1118589119381348352,JO, انت شفت الجهة الوحيدة اللي ما رضيت تشترك بالمخطط  وبعدين مين النواب والإعلاميين والحراكيين  ذكروني بقائمة  تبعت الذهبي 
1118589660803080192,JO, المهم راح فيها ابو الطحن 
1118749446479732736,JO,كله بالريموت  اعطونا مجال شوي 
1119172624368771200,JO,اختيار مبهر القبس الكويتية 
1119837317592768384,JO,الله يرحمهم تلاقي اللي نفذ بده يثأر لحادث نيوزلندا والضحية ناس معثرة وفكرت انها بمكان امن 
1119838094981726208,JO, لا طبعا دايما فيه المقصد انه التبرير جاهز لعمل ارهابي وإجرامي ضد هالناس
1119838450142842752,JO, لا ابدا لكن واحد من هالاحتمالات تلاقي هالمبرر
1119968831454228352,JO,الحكومة والإجراءات عشان رمضان ظل تقول فطور الشعب علينا بس ما تتظاهروا
1119996431727845376,JO, ما رح يقطعوا المي والكهرباء عن الناس وطلبوا من البنوك يأجلوا اقساط القروض بدون فائدة 
1121047540915408768,JO, هو قبل ما يصير ابنه وزير كان ينتقد وسكت بس تعين وهسا رجع لنفس الأسطوانة أنت متخيل بوقت ممنوع الطخ بالمناسبات طلعوا بفيديو يطخوا احتفالات بتعيينه وزير وما حدا حكى معهم جماعة العصور الوسطى
1121122513273094016,JO, صحتين على قلبه اللي هربهم
1121345229775306752,JO, هو حكى اذا صار رفع رح يكون بالحدود الدنيا بس الحكومة اتوقع ما عندها خيارات اما رفع لانه الاسعار عالميا طايره او يثبتوا
1121482775486443648,JO,احنا عنا مشكلة جد بالشخصيات اللي بدها تهت علينا اذا كان مسؤول ولا واحد مصدق حالة انه مشهور مخالف قانون معروف وفي جهات رسمية يتوجه الهالكن لا كيف يتوقف ويمنعوه لازم الشرطة تعمل بحث عن كل شخص واذا مشهور يسمحوا له يخالف القانون وحالة استحقار البلد انه مين الاردن مقارنة مع غيره 
1121483685440700416,JO,الفكرة اكيد مش بتعليق مجد يوسف لكن بمحتوى الفيديو اللي شب عايش في جو غرور كان ممكن يشرح قضيته بكل بساطة وبدون ما نحس انه احنا شيء تافة وهو جاي يرفع من مستوانا
1123235328159096832,JO," ما بعرف اذا شفتيه لكن هالفيديو محزن جدا 

"
1123235451916169216,JO, الاثنين فلكيا واذا ما شافوا الهلال يكون الثلاثاء
1123267547384696832,JO,وفيه مؤسسات وهمية رديفة كمان 
1123289716873363584,JO, والبنية التحتية اللي غرقت
1123493150415306752,JO, مو متاكدة من موضوع قانونية التصوير لكن الشب ممكن يتحاسب
1123496465958100992,JO, مش بالضرورة مناطق عسكرية ارجع اقولك مو متاكدة من المحاسبة القانونية لكن هو مش مصور مكتب خدمة الجمهور هو داخل مصور مكاتب المدراء
1123578847801200640,JO, كان متوقع بعد الإحالات اللي صارت قبل فترة
1123657153972244352,JO,والناس بدل ما تلومه تحيي فيه على الأقل احترموا دم الشهيد ابراهيم الجراح الشب اللي انقتل بنفس المنطقة واهله لليوم محروق قلبهم عليه وما عرفوا كيف مات ابنهم التطبيع ما اله تفسيرات ووجوه
1123659898548641792,JO,هم ضيوفي هيك حكى رئيس البلدية للشرطة السياحية اللي رفضت دخولهم للمنطقة ووصلهم لها ومكيف على حاله انهم ما رح ينسوا موقفه بس الاكيد لما يصيروا جنود بجيش الاحتلال رح يقتلوا الشباب والأطفال وضميرهم مرتاح
1123661029370662784,JO, عملته قذرة ول عليه الشرطة منعتهم اقوللهم في اجراءات وانقلعوا
1123663140816863232,JO, رافع إيديه يبتهل يقول مسني الضر قاعد يتعبد بالبيت الابيض
1123675658528481152,JO, تصرفه يتحمله لوحده وعلى اهل الكرك إظهار موقف واضح ضد تصرفه لانه في حالة تجاهل من نشطاء السوشيال ميديا اللي ثاروا على اللهجة وهذا يحتاج نتساءل ليش
1123679507028816000,JO,  اذا اهل الكرك سكتوا واعتبروا التصرف لا يستحق الذكر فهاي المشكلة
1123679675069411200,JO,  والله يا انس اللي يحتاج يقرا التاريخ هو اللي يسكت على تطبيع وغزل صهيوني
1123680183641358336,JO,  بس وهذا يكفيني وهذا الكرك اللي نعرفه
1124338500629823616,JO, ممكن اسالك ليش يعبط فيهم ويبوسهم ليش درع التكريم شو الغاية وهو صار عارف جنسياتهم وساعدهم
1124340166695489536,JO, الزلمة يرقع بصراحة ومش زابطة معه كان اعتذر ويخلف عليه وأهل الكرك طلبوا استقالته وهم انتخبوه وهذا قرارهم
1124369934887399424,JO,  فكرة لينا وموضوعها محترمين جدا وفعلا الكاتب عنا يا دوب يحقق ربح وسوق الكتاب اساسا ضعيف ومجرد انك تخلي التبرع وطني فهذا يدعم التجربة وتبتعد عن تهمة التمويل الأجنبي وبنفس الوقت كان ممكن لينا ودار النشر يشرحوا ليش التمويل الثاني بعد نجاح تجربتها الاولى وكيف تحقق ونتيجته
1124605964022419584,JO,  دخول كثيرين على النقاش اكيد رح يفتح المجال امام كل الاراء بس النقد زاد لما اتضح انه فكرة الدعم لغايات التفرغ وحتى نكون واقعيين انا ما شفتها مكتوبة بالتغريدة اللي تطالب بالدعم وهذا اللي اثار الموضوع  ومن جديد الفكرة مهمة والنقاش مهم حتى لو صار فيه تجاوز نقدر مع الوقت نحوله لدعم
1124608808989470848,JO,   الاستفسار طبيعي واي اسئلة توجه لفكرة جديدة كمان مشروعة وعلى سلامتك انت ما اسأت ولا عقلك قاصر واعتقد كثير اشخاص كان عندهم نفس تساؤلاتك
1125062299587358848,JO, الحمدلله على سلامتك يا رب وسلامة البنوتة والف مبروك الكم 
1125082781963493376,JO, الاسماء كل مرة تتغير وما في شي اكيد
1125094168932626432,JO, ههههههههههه هذا منصب جديد
1125094256920735616,JO, التعديل اللي بعده  رئيس الحكومة يحب يعدل كثير
1125112828459929600,JO, بالضبط المشروع من سنوات في شغل عليه وحتى الحكومة الحالية رئيس الحكومة ووزير المياه حكوا عنه وصار زيارات لإسرائيل بسببه الوزيرة كل مرة تطلع بتصريح اسوا من اللي قبله
1125715347900968960,JO, ما في شي صحيح بالمطلق لكن في كيدية بالتحرك
1125715815716802560,JO,  يعني شو المشكلة لما يصير تغيير على النظام الداخلي بالعقوبات وتحديدا لما تطلع قصة انه زميل سرق جهد زميل ثاني ويسكتوا الصحفيين عنه هاي وحدة من مواقف الصحفيين
1125719940126924800,JO,  اذا في خلل بالنظام القديم التعديل طبيعي ومطلوب خصوصا اذا حصلت تجاوزات النظام القديم يحميها وانتي بنت الجريدة وتعرفي اللي يصير فيها بعد تجربة العرب اليوم عندي قناعة راسخة انه الحوار هو الحل والتصعيد نتيجته قد تكون اسوا من اي توقعات
1126178783218819200,JO, مبارح واليوم في ناس تواجدوا هناك بس مع هالبرد اتوقع بدها قلب قوي 
1126217360648621952,JO,سعادتها شادة حيلها كثير بلكي اسمها بكرا بالتعديل
1126456687244861440,JO,  كويس ما جاب وزير ردي شعراتك كان كملت
1126533294709977216,JO, التعديل اثبت انه ما حدا يتدخل بقرار الرزاز كونه كان يعتبر الديوان والمخابرات يتدخلوا وبعد التغيير فيهم قالوله تفضل اختار المناسب واتضح انه ما يحتاج حدا يضغط عليه كويس انه الرزاز عمل هالتغيير حتى اللي كان متأمل فيه يعرف انه الزلمة مفلس سياسيا اولا واقتصاديا رح يقضي على اللي ظل
1126936979902533632,JO, الحكومة واضح انها فعليا خالفت الدستور وتجاهلت الاراء بهالخصوص
1126939104590086016,JO, دولته ما يتصدق لهناك 
1126945912096473216,JO,  طيب ليش ما يصير شكاوي عليهم
1126947244819792000,JO,  اكبر ظلم انه طالب يشتغل بأيديه فعلا وياخذ علامه قليلة على جهده مقابل شخص ياخذ اعلى علامه بسبب نفوذ وعلاقات وحتى مشروع جاهز
1128758388945490048,JO,راح عمر كلاب سالخ بوست انه لاجىء ومستوطن وكانه الجرائم اللي تصير بالبلد على حسب الاصول والمنابت 
1129074855092072448,JO, والراعي سارح بأرضهم كمان 
1129109512454066176,JO, يسعدك  الواحد يحاول بس
1129121240537603968,JO,حكومة النهضة واضح انه الطيارة الخربانة اللي تقودها رح تتوهرف فينا وفيهم  حكومة قمع وتكميم افواه
1130108471976894464,JO,  ما تجاوزوا بالعكس مارسوا عمل اعلامي محترم لكن العقلية القمعية هي اللي مسيطرة ورافضة تتقبل النقد
1130111000479457152,JO,"هذا رئيس لجنة مش رئيس حكومة
السيستم معطل "
1130526462098968576,JO, هاي منطقة الهاشمية الزرقاء قبل اسبوع تقريبا
1130529880511324160,JO, ما في مشكلة بالعكس تقييم الأداء واتخاذ اجراء بس اللي عمله الرزاز اليوم مثل ادوار ياسر العظمة بمسلسل مرايا  مشهد من هالمشاهد
1130536193035264000,JO,   تقييم المؤسسة موجود عند الحكومة يفترض تم زيارة اولى وإبلاغهم واذا ما تحسن يزورهم ويتخذ نفس الإجراء اللي صار اليوم
1130738649920876416,JO, مش انا اللي انتقدت ترى  هذا وزير سابق
1130896297370763264,JO, مو واضح اذا مفتعل ولا من الجو لانه الدفاع المدني ما يذكر اسباب
1130896598278508416,JO, الاميرة ديانا تتقلب بقبرها الله يرحمها 
1130921718443315200,JO, فعليا الواحد لازم ما يعتمد على ردود فعل الناس لانه تكتشف بعد البحث انه رد فعل عاطفي اكثر من عقلاني
1132667071274393600,JO, فعلا ضعيفة وما بعرف على شو اخذت الجائزة
1133068722854350848,JO, ان شاء الله بس تكون اغلاق بدل ما يتوقف على اعتبار ترويج
1133073000620810240,JO, راح بجنب النسخة الاصلية 
1133461456027037568,JO, كارثة اذا يفكروا يزيدوا الفاتورة
1133676340484476800,JO, من ناحية الحياء ما اظن جماعتنا عندهم هالصفة
1133688224902201216,JO, كيف كان مستشار يا حسرتي
1133729505137373184,JO,  بدهم منشن طويل بهالحالة
1133731551311802368,JO,   التقاط رد فعل الناس اللي كان استهزاء وسخرية وتوظيفه من نفس الشخص للسخرية من نفسه وسؤاله وبطريقة تحصد إعجاب الناس ذكاء خصوصا انه الفيديو الاول نسبة كبيرة ما اعتبرته عفوي  وطريقة التصوير وكأنه حدا من الحضور نقطة إضافية يعني شطبوا على الفيديو الاول بفيديو ثاني فيه حس كوميدي
1133801030339190784,JO,  من جهة محايدة  في تحريض من قبل شباب تخرجوا من القرية وبدهم يرجعوا يعيشوا فيها وهذا مخالف للقانون الشباب أعمارهم اكثر من  سنة وفي بعضهم بالثلاثينات هم مش ممنوعين من الزيارة خصوصا للأمهات لكن برمضان صاروا يزوروا القرية يوميا ولفترات طويلة
1133817441631506432,JO, ما في تكريم  في تعاطف ويمكن المستشفى حب يكسب شعبية كونها صارت قضية رأي عام  لكن عموما التوظيف حقها وضربها او ضرب اي انسان امر مرفوض
1134026924626460800,JO, صحيح وعطلة العيد دايما  ايام وما اتوقع الحكومة حبت تخلي العطلة اسبوع من باب الحفاظ على الإنتاجية يوم السبت 
1134048014002216960,JO,زيادة الضمان الاجتماعي اللي الحكومة طبلت وزمرت الها طلعت من دينار ل  دينار  والمتوسط  دينار 
1134048255216668800,JO, لا كل هالتفاصيل تبرعات ومنح والحكومة عامله حالها انجزت  فعليا ارقام واستعراض وهمي
1134162806603997184,JO,اسوأ شيء ممكن تقرأه انه الحرائق متعمده عشان الناس تعمل حطب للشتوية 
1134191450026119168,JO,امير الكويت شخصية محترمة جدا
1134193232328499200,JO, شكرا الك الله يخليلي لقطة بالقمة الخليجية عي اللي خلتني اكتب
1134204221992124416,JO, بصراحة مش طبيعية تصرف واضح انه مجاكرة بعدين هسا بالجزيرة بدها تهاجم السعودية والإمارات اللي كانت تسبح بحمدهم  وكانت توزع مبادىء وهي وين في فلوس ماشية
1134211333191274368,JO, بالضبط  يعني توجه الجزيرة واضح
1134545350407217152,JO,"ومفاوضات شاقة مع صندوق النقد خلال أشهر لصياغة اتفاق جديد

الواقع انه البلد واهله هم اللي يعانوا مراحل شاقة "
1134548039039967232,JO, وزير التخطيط كمان من كوكب جديد
1134562554938908800,JO,  وتتوقع جماعتنا يحلقوا يسكروا القرض الجديد اللي قيمته مليار ونص بطلنا ملحقين على صندوق النقد والبنك الدولي قروض وتدخل بالسياسات
1135192325187964800,JO, مع الاسف ما عندي فكرة بس الحكومة ثبتت الاسعار ويفترض الضريبة تبدا من الشهر الجاي وهذا يعني لو انخفض السعر العالمي وشو ما صار السعر الضريبة تحصيل حاصل
1105162982701576192,JO, ما اعتقد بهالسهولة لكن القرار بحد ذاته مهم
1105163358532239360,JO, جيد اكيد  لكن المرحلة الجاية صعبة وان شاء الله تمرق على خير  واعتقد الجزائريين مروا بتحارب صعبة لذلك اتخذوا القرار الاهم
1105168924688175232,JO, اتوقع بعد ليبيا فرنسا عندها تخوف من الوضع بالجزائر لذلك ما كانوا شادين كثير باتجاه بالمظاهرات
1105477347241873408,JO,اللي قاعد يصير قلة حيا 
1105482184859758592,JO, فعلا الهم سنوات وهسا يطلعوا بهالتصريح
1105528007836471168,JO, التصريح كله مشكلة مع الاسف
1105814389783965568,JO,  الامن يقول في اعتصام لكن للان مش مبين شي حتى المتواجدين هناك ما حدا شايف اعتصام
1105815863519858816,JO,  بالضبط في حدا مصور المنطقة ما فيها اعتصام ويمكن هذا اللي اربك الامن انه دعوات وبدون اعتصام
1105852499938942976,JO,اللي يعرف المنطقة يعرف الاسكانات  سيناريو مكرر لسكن كريم 
1105855628709379968,JO,على اساس الغاء الكلمة رح يغير واقع الحال 
1106123163660894208,JO,  لا طبعا اللحمة ما تنسلق 
1106125157599531008,JO,  اللحمة الكبيرة بدها يوم كامل حتى تستوي  وعبير اتوقع تسال عن السلق عموما 
1106136727079608448,JO,  هي بالأصل ما تنسلق مباشرة تنحط باللبن وتستوي معه
1106155968184889216,JO,الغالي والرخيص بهالبلد مغشوش 
1106474494485581824,JO,الله يرحم الشهداء ويشفي المصابين ويصبر اهاليهم ما في كلام يوصف بشاعة الجريمة وبشاعة التطرف
1106507325077102592,JO, اكيد ما في شك بس حتى هذا ما يكون خطط لحاله هو تواصل مع الجهات اللي ينتمي الها  مرات اتابع قضايا المحاكمات عنا تلاقيه صحيح لحالة بس تواصل مع جهات واتفق معهم
1106875820612767616,JO,ونكون واقعيين اذا بدنا نقول داعش لا تمثل الاسلام فإذا الجرائم اللي يرتكبها اتباع اليمين المتطرف تمثل فكرة متطرفة ولا تمثل المسيحيين بالعالم
1106884503799242752,JO, بس اللي شايفته انه العالم كله قاعد يشجب ويستنكر ومتعاطف وننسى الجانب الرسمي لانه جزء من الازمة لكن الشعوب ما الها علاقة
1107227690694860800,JO,وكل هالاجراءات وين راحت 
1107585658112172032,JO, هو للأمانة الطراونة استمع وتعامل عادي بس يبدو صار شي هو اللي خلاه ينفعل
1107955490179424384,JO, هههههههه بدك حدا من الشباب الطيبة يجهز حالة
1107960720724057984,JO, لا هظول ما الهم على الهوش الا شوي 
1108088249468235776,JO,هاي اوبرا مش هوشة  
1108237401737056384,JO,  احنا لازم نشوف الجانب المشرق المسيج بعناية وحرص الحكومة
1108237681518088192,JO,  بس فنانين حتى بالمخابز
1108669279891787776,JO, لانه المتعطلين عن العمل ما كانوا يعملوا تحرك لذلك كانوا منسيين ويبدوا تحركهم اقلق الحكومة لذلك بدهم يلحقوا حالهم وحتى اخر السنة يقولولك وفرنا  الف وظيفة
1108818084226322432,JO, هي انفعلت بالرد وكان بامكانها تطنش بس ما زبطت معها
1109018798865162240,JO,  قرات تعليق اسوا بس معلش
1109026401825509376,JO, صندوق الزكاة موجود بس بدك شغل صح
1109032875700248576,JO,وين كانت الشركات وقتها 
1109044304633315200,JO, عملتلك متابعة حتى تقدري تبعثي
1109196094095978368,JO,  انت متخيل هالتحليل يكون منطقي يعني 
1109395374354108416,JO, اهم شيء يشوفوهن الغارمات  مع انه الفزعة بهذا الشكل مو حل
1109398893803028352,JO, كل التفاصيل والله مو بس العمر
1109412987641782400,JO, كل التفاصيل تستحق الوقوف عندها 
1109521845932429184,JO, في شركة جرش اللي تسجلت بالبورصة الامريكية تبرعت ب  دينار ما معهم يكملوا حتى ل  الاف
1109522515620179968,JO, شكله حسبها بالدولار  وكمان شوكة اورنج تبرعها لا يذكر  عموما كم جهة تبرعت بمبلغ كبير والباقي يعتبر متواضع جدا
1109765144056393600,JO,بحسب النائب قيس زيادين راتب بيشلر نصف مليون يورو 
1109765319546060800,JO, هم يشتغلوا للامانة بس المشكلة انه بدنا نتيجة
1109775432914780160,JO, هالمرة ما حكى بالاسماء لكن اعتبر مشكلة الملكية ومؤسسات البلد وراها اشخاص محددين وفريق نسوي يعبث بالاردن ومقدراته
1109789967797104640,JO,من اغرب الاشياء اللي ممكن تشوفها انه الحكومة تطلب من مجلس النواب تأجيل طرح الثقة ببعض الوزراء بسبب الظروف الصعبة اللي يمر فيها الاردن شو دخل الظروف بالثقة وعمل الحكومة
1109814301768994816,JO, الطلب وتبريره ما كان بمحله خصوصا انه الموضوع ما كان مطروح بجلسة اليوم اساسا ويفترض هذا شغل مؤسسات دستورية لكن على الاغلب في تعديل لذلك بدهم يتأجل
1109867383001415552,JO, اعلان خط الفقر بتحدد عليها كثير تفاصيل من بينها رفع الاجور والحكومات ما بدها تعلن لانه رح يبين الكوارث وعلى قوله جمانة اذا رفعنا الاجور شركات بدها تروح موظفين وتزيد البطالة 
1109867652837752832,JO,ايه شو عليه  ملكية ومملكة صعبة 
1109868297129025536,JO, ههههههههههههههه انت فاهم ومدكن على قولة المصاروة
1110257837912088576,JO, رح نشوف لبكرا شو يصير
1110478967813877760,JO,مجلس النواب الان رح يصوت على تحويل قضية اسهم الملكية اما للنائب العام او هيئة النزاهة ومكافحة الفساد
1110479547508641792,JO, ما تحتاج ذكر  واضح مين هو بس ما بده تقوم القيامة
1110480159516315648,JO, لازم هاي المعلومات تتقدم للنائب العام بس المشكلة الفساد متغلغل
1110483993626112000,JO,الاكيد ان المجلس ما رح يخلص اليوم النقاش
1110488760293183616,JO, لا بالعكس اللي صاير كثير سيء
