id,dialect,text
593782946978516992,EG,"شيكا بيكا وبولتيكا  ومقالب أنتيكا   ولا تزعل ولا تحزن  اضحك برضه ياويكا
هتقولى الشيكابيكا ايه هى   هى "
594817841288847360,EG,"هو الكفيل حالف عليه مايباتش على أرض السعودية 
كل مرة يجيبه ويمشيه بعد ساعتين
يا أخي والله الواحد مكسوف لك"
595204646202925056,EG,النهاردة عيد ميلاد أبو الفساد 
596217480823099392,EG,"صباح الخير وعلى الله 
صباحكوا زي مابتتمنوه للناس "
596788316760059904,EG,"وهايطلع أبوتريكة هو أبوبكر البغدادي  بس متنكر 
فكر كأنك كائن شيت لاند "
602485830494457856,EG,"زي ما قولت إمبارح
إبتسم  فإن إبتسامتك أمل يقتلهم "
603473162894868480,EG,"إيه الحر ده 
ليه كده يا مااااسر "
605018646176538624,EG,كنت بأقول الكلام ده من سنة 
607142916302077952,EG,ومازالت مافيات البطن بتتعارك وإحنا اللى بندفع الثمن وأخرتها
608362857600806912,EG,"إوعى تفتكر انك لوحدك اللي بتقول وأخرتها 
فيه عشرات الملايين مافيش في دماغهم إلا السؤال ده"
608988559035342848,EG,"اللى خلى المياه بالفوسفات حلوة ومفيدة
يخلي لحم الحمير حلو وجميل 

هي دي مصر يا عبلة "
610722991572299776,EG,"من الواضح إن مسلسلات رمضان بدأت بدري 
مسلسل عودة البلوفر شكله هايبقى مسلسل شيق 
"
611295681484095488,EG,"كل عام وكل قرايبي وأصدقائي وزملائي بخير ولله أقرب
ورمضان اللي جاي يكون أحسن بإذن الله "
612368426690981888,EG,الفزورة دي صعبة شوية 
613119291655753728,EG,"العجول اللى شحتناها من الإمارات إتسرقت 
إشمعنى هي يعني "
613857406154440704,EG,"القائد الركن اتكلم النهاردة
ومن الواضح انه قال درر كالعادة
الحقيقة اني باخاف على البلد اكتر كل مابيتكلم اكتر 
مش "
616001602839838720,EG,أنا كنت شاكك  بس متأكد  
616221924373471232,EG,يارب سلم على كل أحبابنا وقرايبنا وزمايلنا اللى في سيناء
616645567201058816,EG,"الحقيقة واحدة
لكن كل واحد بيشوفها بنظارته ودول ناس مميزين وربنا بيحبهم
لأن السواد الأعظم مش شايف حاجة اصلا ومتلبس العمامة صح"
616725605887905792,EG,"طول عمرنا بنسمع عن اللي بيدن في مالطا
لكن بقالنا سنتين بنعمل كده بالفعل"
617352247832375296,EG,"قلع البدلة اتبهدل
قال أما يلبسها تاني 

ماتكبروش المواضيع يا جدعان دي كلها شكليات 

هو مش وزير الدفاع كان معاه هو "
617965326916034560,EG,"بصوا  هو مهما حصل يعني 
ماحدش يقدر يظبط البلد دي إلا رئيس عسكري 

"
618388627916214272,EG,"واحد بيقولي بلاش تنشر أخبار زي ال تريليون بتوع الدين الداخلي و ال مليار بتوع خسارة البورصة 
لأنه شايف إن دي "
618516622559563776,EG,"تخيل ده مابيحبش يشتم ولا يسمع شتيمة
 ده اكيد يميني
اه طبعا ده حتى عمره ماسب الدين 
 لا ده كده يميني متشدد كمان 

"
619592453906165760,EG,"ممكن يغيروا المكتوب وممكن يشيلوا المتصور وممكن يلغوا المتسجل

لكن مش هايقدروا يشيلوا ولا يغيروا ولا يلغوا اللي في "
619778020828708864,EG,"المبني ده كنت باحبه قوي معمول بهندسة وفن وشكله رائع
عربية مليانة متفجرات وصلت بأمان لمربع وسط البلد اللي مليان "
619977722182397952,EG,محامي وماشي بسرعة  إيه ده   ده لازم يتضرب بالنار
620401597726752768,EG,"مش متخيل أن لسه فيه ناس بتسأل هي البلد رايحة على فين
البلد راحت خلاص "
620981712194027520,EG,"نتيجة الثانوية العامة 
ماتفرقش كتير انت جايب كامظبط واسطتك وحضر رشوتك
وتبقى من اسياد البلد 
اللي ممكن يعتقل "
470696791969906688,EG,هما عايزين صورتك مش صوتك
470702096363581440,EG,"وطنيتك وجنسيتك مالهاش علاقة بإنك تنتخب أو لأ وتنتخب ده أو ده 
إنت بتدفع ضرائب ودمغات ورشاوي وأتاوات وتمن مرافق "
471757548488769600,EG,"ايه ده السيس كسب
مش ممكن 
مش معقول
مفاجأة رهيبة 
  "
472829865277014016,EG,"إوعى تفتكر إن عهد المخلوع والفساد والسرقة والفقر والإهانة والمرض والموت هايرجع تانى
لآ
اللى جاي أوسخ بكتير "
474076400774041600,EG,برغم إن المقدمات توحي بالنهايات وبرغم كل الحاجات اللى عرفتها وإتعلمتها فى ال سنين اللى فاتوا وتوقعاتي الغير 
474869132421525504,EG,"من غير ما اقول مصطلحات اقتصادية وتفاصيل مالية عن المنح والقروض اللى بناخدها من الخليج
تخيل واحد عنده مرض خطير فى "
476254668163907584,EG,"الأول  ها يا ريس هاتيجي النهاردة 
الثاني  لأ يا عم المرة اللى فاتت إتأخرت قوي
الأول  يا معلم الدنيا هايصة "
476453122668527616,EG,من كام سنة كده كان كل الناس بتاخد الطريق الدائري بسرعة جنونية أيام ماكان لسه رايق وكانت بتحصل حوادث كبيرة كل 
476640994931519488,EG,"ليه تشارك فى مظاهرة علشان البلد تبقي أحسن وتتحبس  سنة
لما ممكن تبقى مدرب كاراتيه وت اللى جابوهم وتتحبس سنتين"
478135271197003776,EG,"يعني هايبر سعودي طلع إخوان ولازم يتقفل ويصادروه والاف الشباب اللى شغالين فيه يتشردوا قبل رمضان بأسبوعين  
دول "
478429022549196800,EG,صباح الحرية  جاية جاية 
480065237425848320,EG,"طلع لولي نعمته وراح له لحد سريره  طيب ماكنت تروحله لحد الحمام 
الله يخرب بيتك ياجحش "
480247985260228608,EG,"هو على فكرة ماكنش بيبوس دماغه 
ده كان بيبوس العقال 
حصاوي فعلا"
481766481093750784,EG,"فى الشغل القديم كان ختم الشركة معايا
وفى الشغل الجديد سلمونى ختم الشركة برضه
"
482509025448587264,EG,وليه تتبني قضية وتضيع سنين من عمرك علشان ناس مش عايزة أو مش فاهمة وبتتهمك وبتخونك وبتصدق أى زبالة تتقال عليك  
482897721444298816,EG,"وبالمناسبة السعيدة ديالنهاردة هاكل كفتة 
تشيرز يا عبعاطي"
483178323435327488,EG,من الواضح إن إحنا أسفين يا مخلوع وبنحبك يا جحش  نزلوا التبرير ليه جهاز الكفتة طلع كفتة خلاص  
483501682853441600,EG,"اللى باقي من  مايو   كوبري  مايو
اللى هايتبقى من  يونيو   إستاد  يونيو"
483598886926581760,EG,"الإرهابيين  على فكرة إحنا هانفجر المنطقة الفلانية بالشكل الفلاني 
الداخلية  اللى يجرب يقرب وإحنا مأمنين المنطقة "
484070893849964480,EG,"صلاة التراويح كانت السنة اللى فاتت صفين أو ثلاثة بالكتير
النهاردة الجامع كان مليان 
إمنع  تجمع "
485360813386260480,EG,ماحدش شاف جمال عبدالناصر بتاع الغلابة 
485372393284993024,EG,أنا مش عايز أحلف  بس أقسم بالله كل حاجة هاتغلى بجنون
485735204641075200,EG,"الفرع الرئيسي للبنك الأهلي عاملين إضراب وقافلين النهاردة 
مش عايزين يطبقوا الحد الأقصي عندهم "
486820815208714240,EG,"للتذكرة  إنت حر فى دماغك 
بس ما تقرفنيش بيها  "
487966998111207424,EG,"متهيألي الحجش ده هايولع وهو ماشي من كتر الدعى عليه 
يلا  كله بأوانه"
488234402808598528,EG,"مساكين بعض الناس اللى الأذرع الإعلامية للجحش إستعملت دماغهم كالمباول 
دول مش محتاجين مناقشة  دول محتاجين سباك"
489007436347756480,EG,"كل وإشرب ونام  
مش عايز   طيب إتحبس وإتعذب وإتقتل "
489018273523322880,EG,"على فكرة الكهرباء والمياه مش بتقطع عند كل الناس
اللى هما السبب ومتحكمين في قطعها  مابتقطعش عندهم ومابيدفعوش فيها فلوس"
490139820250132480,EG,إنتوا إزاي تمسكوا الناس فى بيوت الدعارة  
490160189530988480,EG,"حلقة الكبير النهاردة  جامدة جدي 
ماتفوتهاش"
490483620503879680,EG,المواطن السيس  اللى عايز يروح غزه يتفضل  
491708598029131776,EG,"ليه عايزنا في ضلمة بعد ما شفنا النور
ليه خايفين من كلمة  يا عباد المأمـور
لسه الحق مجاش ومفيش دم بلاش
قطر "
493019125749665792,EG,"الجحش قالك هانشيل الدعم علشان ننعش الإقتصاد ومانلجأش للقروض
طيب قرض البنك الدولي ده إيه مهلبية
وقرض الوكالة "
494463425368842240,EG,"العقوبة جزء من النشاط
كل اللى قرر إنه يشتغل فى عمل عام علشان قضية مؤمن بيها لازم يكون مستعد لدفع التمن
من وقته "
494492079893258240,EG,"إيه الأخبار 
 والله الراجل طيب قوي ومن الواضح إنه إتزنق فى الحكاية دي
قولتله اللى إحنا إتفقنا عليه 
 أيوه "
494830317346516992,EG,اللى عنده مخ  يحرص عليه 
496182659488681984,EG,"الديب محامي المخلوع ومحامي عزام عزام 
مقالة كان كاتبها فى  عن موكله وبيقول إنه رأس الفساد 
اللى إختشوا ماتوا  "
496273402853089280,EG,"الكهرباء غليت وبتقطع أكتر مابتيجي
شوفت اللى بيحصل فى العراق
المياه غليت ومابتجيش أصلا
مش أحسن مانبقى سوريا "
497324281848938496,EG,"وزي ما المرضي إتعالجوا بجهاز علاج الإيدز
وكل شاب عاطل إستلم عربية وشغال فى العبور
وكل اللى ماعندوش شقة إستلم "
499112135457534016,EG,إنت مروح يا هندسة  أه  طيب ينفع تنزلني فى طريقك  أيوه طبعا  بس أنا رايح رابعة  وإيه يعني  مش إنتوا 
500616544582643712,EG,محتاجين كام محطة كهرباء وحقل غاز طبيعي على الناشف 
501980666641518592,EG,"موضوع تعليق الخارجية على اللى حصل فى أمريكا مالوش قيمة خارجية بس دمه خفيف 
والكائنات السيس اللى زايطة فى "
504005489957830656,EG,"والله حرام اللى بيعملوه فى عقول الناس ده

جثة ماتت من البرد  "
504913153889927168,EG,"فيه ناس بتدخل الدنيا وتخرج منها وماحدش بيحس بيهم 
وفيه ناس بعد موتها الناس تفتكر شرهم وأعمالهم السوداء
وفيه ناس "
506516180245676032,EG,تعتقل واحد يطلع   تقتل واحد يطلع   إحنا مابنخلصش
509813092948385792,EG,مش عارف ليه ما إختارتش الزرقاء  
510023831667634176,EG,"فائدة   
الكلام ده السنة اللى فاتت وكان فى كل البنوك "
511151963548180480,EG,سيبك إنت  إحنا اللى فتشنا كيري 
514138424996298816,EG,مابقدرش أعدي من هناك لحد دلوقتي  
514750341943160832,EG,"وطبعا الكائن السيس اللى كان طاير من الفرحة إن أوباما هايقابل الزعيم
هاتلاقيه بيشتم ويلعن فيه بعد ماطالب بالإفراج "
515079008380542976,EG,"عدت سنة على تركي لعملي السابق واللى قعدت فيه  سنة
ومعايا عدد من زمايلي بسبب إدارة فاشلة خافت من توجهاتنا "
522338378743050240,EG,الحكاية متشبكة تشبيكة مايعلم بيها إلا ربنا 
523580431690920000,EG," وهو اللى بيحصل ده فيه أي نوع من العقل أو العدل أو الصدق  إحنا رجعنا ورا قوي يا حضرة الضابط 
 إنت باشمهندس قد "
523794931782262784,EG,أيوه بقه  وهو قاعد مع البشير كان وراهم خريطة مصر كاملة وفيها حلايب والشلاتين 
523843049785659392,EG,"وجوم وزهق وقرف وإحباط ويأس  ده ملخص وشوش الناس اللى بتشوفهم في يومك 
مقدمات سيئة للي جاي"
524470015425523712,EG,واللى مابيشوفش من الغربال  
525211657816264704,EG,"إنتوا بتحبوا مصر قوي كده 
إحنا بنموت فيها  حرفيا"
525217929764556800,EG,"الفاشل بيقول لو الإنتخابات إتعملت الإخوان هايكسبوا 
إزاي يا فاشل والصناديق واللى بيراقبوها تحت إيدك 
يافاشل يافاشل"
525961558879645696,EG,"المساكين دائما هما اللى بيدفعوا التمن
 سواء الغلابة اللى بيخافوا ويحزنوا ويستحملوا 
أو الغلابة اللى بيموتوا"
526844432092774400,EG,مش هو إبن مين علشان تتعاطف معاه  ده مستقبل البلد اللى بيدفع تمن خطايا الحاضر 
527105582260813824,EG,"ده اللى كنت شايفه قبل يونيو  
ناس معينة هاتفتكر كلامي  الملاحة "
527439986753540096,EG,"قرار تهجير سكان رفح  قرار سيئ جدا 
مش بس علشان مش دستوري وضد الإعلان الدولي لحقوق الإنسان
لكن تبعاته واللي "
528245308753735680,EG,مافيا وعصابات بتتخانق على نصيبها من التورتة المنهوبة مصر
528683823287238656,EG,ماحدش فينا مش خسران ولا مجروح
529268354880929792,EG,فرج زعلان علشان فيه ناس سرقت كابل التليفون والخط إتقطع من عنده وبيقولي  هو ده الشعب المتدين بطبعه قولت له  لأ ده الشعب الوطني بطبعه 
529536913708171264,EG,مكتوب عليا ابص لفوق و اجيب لقلبي شوق على شوق و الحلو دايما حلو و ذوق يا حلو ياااا  يا حلو صبح 
529915807271514112,EG,"فين اللى كانوا ماليين الدنيا نواح على أتوبيس الصعيد السنة اللى فاتت
فيه  و تلميذ قتلوا في حوادث طرق في سوهاج "
531423507998343168,EG,"قبضوا على طالب في جامعة القاهرة علشان معاه رواية  لجورج أورويل

ده اللينك بتاعها  "
532088235686907904,EG,البلاعات إتفتحت والصراصير طلعت وملت البلد
533896906175696896,EG,وأنا باسمع الراديو باعرف من نشرات الأخبار والبرامج هما عايزين يقولوا إيه للناس 
534259608899293184,EG,"وأقولك إيه 
طريق الكره أخرته إيه "
534319119387357184,EG,لازم ننتقم من اللي قتلونا وهما بينتقموا للى إتقتل منهم وإحنا بننتقم من اللى قتلونا وهما بينتقموا من اللى قتلوهم ووووو
534613916924780480,EG,"في طريقي للشغل النهاردة قررت أبص على وشوش الناس في الطريق اللي بياخد
حوالي  دقيقة من بيتي للشغل
ماشفتش إبتسامة "
535412174165131264,EG,"أجمل حاجة في كل اللي بيحصل إن اللى شاركوا في الثورة وإختلفوا وإفترقوا وتخاصموا 
كل مجموعة منهم جربت بالتمام "
535450161938706432,EG,"عزيزي الكائن السيس 
إسكت مش قطر ماطلعتش دولة عدوة ولا بتدعم الإرهاب 
وكمان هايطلع قرار عفو رئاسي عن صحفيين الجزيرة"
535573305282293760,EG,"إعتقال بشر تطور مش كويس 
بعد سنة ونصف وبعد ماكان همزة الوصل المعتدلة بين النظام والاخوان
زي مايكونوا بيثبتوا وجهة "
537152340747632640,EG,"الدائري تحول لمستنقعات إمبارح مع إن المطر ماستمرش كتير
مشروعات بتتعمل بالدراع للدعاية  ده مصيرها "
537297333021847616,EG,"صدقي صبحي ومنير  
مش عارف  "
537370262749315072,EG,من المؤكد أن التاريخ مش هايكتب الفترة دي من تاريخ البلدهايسجلها صوت من جيوبه الانفية 
537988537766129664,EG,"الحقيقة بكره مش شاغل بالي 
اللى بعده هو اللى فيه الإجابة على كل تساؤلات المنتبهين لتسلسل الأحداث"
538320774747398080,EG,"أكتر حاجة صعبانة عليا النهاردة بعد دم الأبرياء
هي دماغ الناس اللى ملوها طرطرة لحد ماطفحت"
538326001156382720,EG,"أنا مش عايز أحلف  بس أقسم بالله مافيش إرهابيين بيعملوا مظاهرات ومافيش عمليات إرهابية بيتم تحديد موعدها قبلها بأسبوعين 
أين أنتي يا تاهيتي"
539133785737269248,EG,"الناس زعلانة ومحبطة
بس انا مبسوط ومتفائل

الحق كسبان كسبان مهما طال الوقت"
539348222435938304,EG,لسه فيكي أحرار يابلد  مش هايخلصوا 
539721347048702016,EG,"في خلال الأربع سنين اللى فاتوا فيه حالة كبيرة من التطرف تم نشرها في المجتمع المصري للتقسيم والتفريق
لو ربنا كرمك "
540193510226657280,EG,"يا بنات فاتنات مابلاش للنظرة تاخدني في لحظة طيش
حسام حسني"
540652145323040768,EG,دي مليشيات البطن بتتخانق 
542286786912092160,EG,موضوع السفارات مرتبط بالتسريبات  اللى ماحدش سمعها 
542690835914293248,EG,"النهاردة اليوم العالمي لحقوق الإنسان 
العالمي  إحنا مالناش فيه "
542951667004895232,EG,حال كتير من الناس الفترة دي  
543014763174047680,EG,لو داعش عملت أوبن ريكروتمنت داي  حايلموا بتاع  مليون أبليكشن 
543872950341206016,EG,"السؤال اللى محير العالم 
أخبار الصعيدي وابن عمه البورسعيدي ايه
لسه بيتنططوا "
544043430369042432,EG,وزي ماقولتكلم قبل كده  
544241528794005504,EG,"قبضوا على اتنين بيتكلموا انجليزي في المترو
اكيد هايحطوهم في الحجز اللى فيه أبلة فاهيتا
الوضع بقه كوميديا سوداء في اروع صورها"
544403792541020160,EG,"بين البشر تاهيين من كل كأس شاربين
مع إننا بنموت لكن تقول عايشين
 
ياقطر  حمزه "
544796333190955008,EG,"شوفتي حتي ابن الليئمة بان له صوت وبقي له قيمة
والجبان لقي فرصة يتشطر عليه"
545162542960873472,EG,"أنا قولت مرة أعمل فاهم وخلعت من الزحمة مزأطط
ما وعيتش غير فى صلاح سالم فركنت على جنب اعيط
اه يا غلبى يانا يامه "
545204826226040832,EG,"محافظة الغردقة فيها مدينة البحر الأحمر 
ودي معلومات عامة يعني كل الناس عارفاها "
545228548500635648,EG,"البورصة ضاعت يا ولاد  البورص غوها وحطها في الوحل
"
546414482038472704,EG,"المهيب الركن قال  منه لله مبارك هو اللى خربها البلد
الكائن السيس اللى من ابناء المخلوع مش عارف يعمل ايه دلوقتي "
1000476428994076800,EG,يابن القديمة ياراموس الزفت   
1001909139335974784,EG,"مش عارفين نفش غلنا في الواد راموس ده 
جتك نيلة يازفت يا راموسالكلب"
1006123929382027264,EG, اهو انت اللي رزل والله
1007616868742557568,EG,"اللهم ثبت ادائهم

مصراوروجواي"
1008799863230824448,EG,"تونسانجلترا
احنا مالناش كاس عالم بعد كده"
1008828961944756224,EG," اه والله 
حتى كاس العالم بيبقى ممتع اكتر من غير توتر ونكد "
1009153892519641216,EG,"روسيامصر
فالحين يافسدة يانحس 
جتكم ستين نيلة "
1009155680190844800,EG," عشان مسفرين راقصات يشجعوا
مصرروسيا"
1009163556045115392,EG,"روسيامصر
خلاص خلصت بقى كاسنا ومزيكتنا "
1009175853148893184,EG,  ومش مكسوفين على فكرة
1009425293084446848,EG,"افورة عصام الشوالي
 والله"
1011049196873552000,EG,خافوا من الهاشتاج شالوه 
1011291163796664448,EG,"كأسالعالم

خدنا على قفانا"
1011328476325007360,EG,"مواليد التسعينات اللي كانوا زعلانين علشان ماشافوش منتخبمصر في كأس العالم 

شوفتوه"
1011355975587188736,EG,احنا بيتحفل علينا جامد 
1011387256056303616,EG, مش ده المنتخب اللي كنتم متشوقين تشوفوه في كأس العالم  اشبعوا منه بقى
1011661912206184448,EG, يا نهار اسود ع الكلااااام   بصوت اللمبي
1013482226753900416,EG,نعمل ريتويت ونص كمان  
1018530837485285376,EG,"النهاييالكبيرفرنساكرواتيا

جتك نيلة يافرنسا "
1022400917331750784,EG,"كفاية كيكي بقى والله زهقنا 
اصلا دمها تقيل جدا"
