id,dialect,text
896608493821710336,LY,معاش نسمع في صوت العصافير يغردو ع الصبح بدو  ينوضو موخر الباين
896613833879498752,LY,يلي يفصل علينا في تاكو الضي يا ترا خيره مريض ولا قاعد راقد 
902902173171949568,LY,"انتم متخيلين انا سعر الخروف وصل لعند   ا شوي
اعتقد هذا اسراف وتبذير وحتى ذبحه فيه الشك "
902918696548610048,LY, مش زم نوصفه خليه في حاله هههههه
903376328648482816,LY, وانتي بألف خير زهوره ينعاد عليك بالفرح يارب 
904852684863352832,LY, وبعدين في هالحال لعند امتا ياربي
904857905526132736,LY, لا قانون ولا من يردهم واخذينها بالطول والعرض 
905061890426068992,LY,"نمشي ما نمشيش نمشي ما نمشيش 
لا خلاص قررت مش حنمشي 
هذي عزومه لعرس جيرانا ما عنديش جو لا لعرس ولا غيره 
"
905518322661425152,LY,انا يوصلك شعور انك مش مهم لشخص تحبه ومستعد تضحي بكل شي علي خاطره  
905520157510029184,LY,بس خالتي اتصلت عيدت عليها وما حد اتصل بيا كان فيه رقم بس وجعني انه ما دور بس عادي كله يفوت 
905525019324928000,LY,والله واني نبي نفهم شني القصه حاسه اني اطرش في زفه 
905528132777766784,LY," عرفته السؤال ع الدلاع شي ما يطمنش من طريقه كتابتهم عليه هههههههههه
فضولي خلاني نسأل بس "
905566632893980800,LY,  كانت ليها جزء من تربيه الطفوله بغض النظر انها كرتون انها تقدم في رساله وتساهم في التربيه
905778245269901184,LY, تلاقيها طالبه طب بشري مأثر عليها 
905779574285504384,LY,حطيت راسي ع المديد لقيته علي الوساد لقيته سريب ليلته البارح لي ناسيته يا ميمتي  
1078291332635000832,LY,البنت هذي ادير في قلابات سحرية 
1078291967799378048,LY," نبي لعبد هذ
عنده دكتوراه في حاجات ماسبقهنش عليه عبد قبله"
1078982058163298432,LY, ليا اسبوعين نمشي خميسات بس خخخخخ
1079067320990007168,LY,مشكلة اللي يعامل في التواصل الاجتماعي أن تواصل اجتماعي حقيقي
1079068583207071616,LY,"هذا واحد ينزل في قصة حياته من صبح بالقهوة بكل لعند يرقد في ليل وحتى ترت القايلة شوي وينزلها 
تلاقيت معاه صدفة قالي كنك مااديرلش في لايكات وتعلق  في عقلي راني حاطة انفولو بس قتله مانفتحش واجد ومانتصفحش
الطير قعد أي حاجة ينزلها يدزها ليا في الماسنجر "
1079338293731430400,LY,يأكلو ويقيسو هذي مش في الأمن بس هذي ثقافة ماشية في الحياة اليومية في كل حاجة  
1079445348001742848,LY,"في اللي داير روحه بيساعدك وبيخدمك وهو حولي يشحورك أكثر ما يخدمك
معش تعرف تسبه ولا تشكره "
1079445907882561536,LY," ي غالي في مكان فاز وبسعر سمح بس مانعرفش كيف صار فيه المكان 
بكرا حنشوفه لك وبالنصيب"
1080008193395384448,LY," سيارة طفت واحد مخطم يولعلي بس تمنيك عليا خلاني نربربله علصبح 
ناك صبح بكل"
1080084337163419648,LY,مايضرك إلا اللي لكي
1080524675548098560,LY, نعنديسكم ازف ي عواقير لانقنه وقتها
1080972983638864000,LY,نحن كان معطلنا الثني مافضينش نديرو شيء 
1081497130882220032,LY,"سوس القراية حتى عند اليهود ماتلقى زيهم
عجب"
1081612540646432768,LY,لانقنها تويته اطيب بكل 
1081612725938212864,LY, شن لامور عندكم أستادنا 
1082380769098719232,LY, كيف صار فيك ي باشا
1082571000645066752,LY,قالك مشكلة لما الواحد يتعرف عليك و انت جوك سمح يحسابك ديما هكي
1082901220543602816,LY,"مزاط كل يوم
 المشكاة أغلب الاسباب تفاهات لكن لازم جرعة مزاط عالصبح "
1084160266449940352,LY,يقولك احكم على الظاهر بس الغل اللي في العيون مش عارف كيف اتبلطه
1085629749848879232,LY," ماعرفتش
نلعب ماسنجر بس"
1085632027867656192,LY, خليها بكرا او الجمعة عشان مانفجركش بكذبة 
1085810208511807616,LY,هذا بالنفخ متاعه عالصبح يخرب في كل خميس
1085849316864991232,LY, ممرضين لعندنا مشكلتهم في الفيرشلات ضاربات
1085891332680368000,LY, ناقص شيطان يجي يخش في الاسلام
1087347924911177600,LY, هذا بعد بتخلق جو سمح فيالوهم لعايشين فيه 
1090148786276651008,LY,"عالصبح شايب خذا معاه فينار ومسكرة قرمشهن بذيل كنتر 
ونزل قالي يومك مبارك ساهله "
1090916866418192384,LY,هذي معش قعدت قراية
1090917984686784384,LY,"يتعبو مع رأي المشاهير والمعبين متابعين مايتحملوهم بكل 
لذيل ذيل ماعندك مااديرله"
1090918307392299008,LY, هذا لماشين بيه بس المفشكة قعدت نظام روتين
1092092284387164160,LY,يقول اللي مافيك وأنت عايش بعد تموت يديرك حقيقي ومتاع مواقف
1092872282538684416,LY,"  كن ماعلقش بوشقمه راه ماعلقتش
اكبر هذينا حركات بنات أول سمستر نت"
1093986041722269568,LY,نسخه لجماعة قروبات القراية على الفيس  
1094190911020519424,LY, معش تطلع عكسي بس خخخخخخ
1095458427327954944,LY, والربا كيف يصير فيها
1095705633641455616,LY,رابع واحد نرن عليه مايردش
1095715881693470848,LY,شماته ومعاها سمايل قردة متاع الولد المون 
1096452713024552960,LY," نفس لجو نبي نهرب 
شارع غارق سياره وصلها اميه مابتش تولع "
1096771847549579264,LY,فتحت الصراحه لقيت فيه تفاهات قدم بكل 
1097085782848929792,LY,يا عوينكم بعقولكم لتناقشو في مواضيع ميته هك
1097406899560038400,LY,"موظف مصرف جايه عن معرفه درست عنده تسعه وربع 
قالي كيف جيت بنشرب قهوة وسبسي نصحصح تعالي بعد ساعه
وفوق منها يحكي ويقلب في الاوراق"
1097408350134915200,LY,اللي دازني لك ضعيف فرق سرعات
1097414861510922240,LY, قاعد فيها خلا خالي
1097607080201121792,LY, تبيلنا بطاطا ليليه ترد ذكريات و نكبروها زيك هههه
1098603530171105152,LY,"يوم لخميس الوحيد مستحيل تقدر تقيل فيه
وتجي عشرة ترقد"
1098605506040602624,LY,عبي فراغك بأي حاجة إلا أنك اتناقش أو تفتح تعامل مع سويسري
1099294016095571968,LY, ناقصهم تغليف ويقعد سياق
1099312705427685376,LY," مشكلة العقل يبي راحه عندك ماتكتب بس عقل فصل ومعش في حتى نيه
 مفروض كملوها تسجيل صوت "
1099498403980025984,LY,شن تطلع الوعية توا
1100475119120588800,LY,"احتفال شعبي على تواصل الاجتماعي عشان فتح طريق عادية وهيا كانت مسكرة مؤقتا
حبيبات اووو بنغازي"
1100747013963071616,LY,الغراق قعد لونه عجاجي
1101094204724469760,LY,يانا ويانا من اللي قل هنانا
1105410774141415424,LY,مافش أحسن ماتقعد مش قاريء في الامتحان وتمشي معاك وتحل 
1105412835465744384,LY,ربي مايحرمكم من هالشعور الاطيب
1105566889558896640,LY,عليك ملعب مايل ميله
1105937550198431616,LY,"مسكر النت من القايلة لقيت هجوم من رسائل عبيطة
شنو هالعقليات اللي امودرين لحسبه"
1106683362817818624,LY,لانقنه في وحدين تبيلهم الهبل متاع نيوزلندا  من مزاط آرائهم اللي يجيبو فيهن من التفكير من مؤخراتهم
1107048857664401408,LY,"ماشاطرين إلا يركبو خيط ويصورو تلاه ويقولولك بنغازي روحت 
اتفو ي كمشة فساد"
1107301247663656960,LY,المزاط يجيك مرات على هيأة أنك تركب مع واحد حولي سواقة
1108091831903051776,LY, شكلها فرشيله ارتخت عندك
1109356807850549248,LY,هذا الجو بينقلب عجاج اخرى 
1109872939145613184,LY,وسط ثقيل مش قادر يوصل كورة
1109874317330968576,LY,القول حيجي بس المشكلة أنهم هك هيسجلو
1109874755396620416,LY,  بن لي فنان بس يبي حد سريع معاه هو فيه الثقلة
1109880425462358016,LY,العب بتسعتين ازف تي خاسر على ارضك
1109883518488903552,LY, روما بروحه ازف ماوصلتلش
1109883611493355648,LY, وحق ربي اول مرة نشوف ريقولي هك
1109884012900827136,LY, بعقلك تي اللي امبدري يد على صدره
1109886420800466944,LY,هذي كن نشنوش راه قعد يتفرج عليها
1109888873025409024,LY,مفروض الجمهور ينزل للملعب ويخربوها بيش الفيفا تحرمنا كمشة سنين ياعليك عار ازف
1114564736228712448,LY,"   زيد طنجرة طبيخه اخرى بلا ملح وخلطيها على متاع لملح وكولوها لمده اسبوع
غير هك كلام فاضي"
1115198162136907776,LY,مايمزطك إلا اللي عايش برا ومندمج مع مجتمعاتهم وأموره طيبه ويجي على وجوهنا يفسوي على الحرب
1118251556053372800,LY, مازال ماشيه معاهم مفروض 
1118266940559065216,LY,ينعنجد قالك اليوفي بيجيبو المشير الموسم الجاي يأخذلهن الأبطال
1119609616147648384,LY," بالزبط لكن باختصار التعامل مع العقليات الرخيصة تخليك رخيص
فوت هالوسط وخاصة التخرج والفاتحات "
1121110251393179648,LY, برهم رايح تعزق في شبك بالصورة الصحيحة
1122051216127725568,LY,عليك صبح مش قاعد
1122135061019668352,LY,  نا معش بنشوفه استكفيت من التزليط معاه
1123858871464931200,LY,اللي راخين الفرشلات رايحين كاثرين عالصبح 
1124345981498208384,LY,تبي تبلط قايلة الجمعة اشربلها قهوة الصبح في العاشية
1124456428750684160,LY,ماعمرهش وقفت على حد اللي يمزطك لمسه في الساس وخليه يعيش وأنت عيش عليش النفخ هذا كله
1124605001345773568,LY, بدير خير عادي جيبه ليا معاك في جامعه
1125079437261848576,LY,ترن مرتين مانردش خلاص ماعندك عليش ترن في  وال ي حولي
1125186009883402240,LY, امتى السحور عندك ي قايد
1125842739407536000,LY,لانقنه ماني فنان وهو اللي فارق
1127021584156327936,LY,  ماهو بعدها قعدتو زيكم زي التربونه 
1127032698034372608,LY,مااديرش خير عشان مايجيكش شر 
1128719331397963776,LY,"  تي انتا واضحه
شن مدراس قريت فيهن"
1128719905312968832,LY,"  تو نشوفوها وين قرت 
تعال ي اقدوره قول كلمه كويسه  نلمو راسين في شيشه"
1128726715486867584,LY,     بجديات والله نفس المواصفات اللي قالتهن هي مكرشه من زمان مازال هو يخش فقط
1128744416351539200,LY,"     غير قوليلنا هو بس والباقي علينا
هو حشومي بس موافق غير يبي تأكيدك"
1128748053673009152,LY,"      مش قتلكم نفس مواصفات
برهم خش عليها دي ام البنت طلعت حتى هيا اتحشم"
1128756104400461824,LY,     تو هو بعد يشوفك حنشوفوه ينزل في تويتات ي يتغزل ي بيهرب
1130167822703878016,LY, ادير فيها من عمرك  سنين
1130198250861059968,LY, عواقير امتى عرفتو نسكافيه اصلا 
1130291186428723200,LY,ي صديقي راهو ماعمرها رفقة جماعة الفولو اديرلك قدر
1130637408616222848,LY,حتى بكرى حمو عليك بخت
1130886486184870016,LY,  هذا عادي موضوع مفتوح لكن في واحد تيس اخرى دارها كبيرة ان شاء الله يشوف التويته لمش راجل
1130887360374333440,LY,"  حشرة كلب فلوس تشقش بيه 
غير نا لغلطت وعاملته كانسان "
1130903926092517376,LY, شنو تليفونك في شراي
1131010868332966016,LY,الفيس معش بيفتح ي عليك طاجين مش وقته
1039100377323516032,LY,"مسكر سيمافرو شارع دبي اللي يعرفه يقولك انت برج الكلب يا كلب 
ملاحظة القزاز ماتشقوش بيه "
1039102298969055232,LY, عارفك حتسقط بس بالتوفيق حبي
1039256708428771200,LY,البرجوازيين واللي يقلدو في حركاتهم رقو علينا سوق البنات 
1039487556503707648,LY, ماتفرقش نتعاطى في اي حاجه 
1039488915940495360,LY,"الليبي يديرلك تره ترد عليه باسهال يزعل 
كيفيبيها"
1041725719347453952,LY," بترد قطوسه لهلها وتعزم على كفي 
شن صايرلك بس"
1042056076651323392,LY,جوا التقوى الزايد اللي يديرو فيه بعد يخشو للجامع  هل هذا تقديس واحترام حرمة بيوت لله ولا يحسابو ربي جوا الجامع بس
1042529575601954816,LY,ليبياتك عليها كلها مزاط هالايام ولا عندنا بس 
1042552823672659968,LY, التك ماكانش هك ازف 
1042710027801374848,LY, راه يطلع مشكله عندنا بس 
1043151105520295936,LY, تعدي للموزعين وتشيل معاك رقم العقد يعبولك اللي تبيه
1043439134625476608,LY,  والله ماصارت كلمت سي جي قتله اسالي
1043622224966705152,LY,  دير سكرين مافتحتش عندي
1043623766767624192,LY, تبيلي سنه نرد لياقة قبل
1044180651900055552,LY, باهي اعزمنا على حبشكتانات ليديرو فيهن
1044230298215624832,LY, راس سنة وشتاء والنتاين وبطاطين 
1044348859512705024,LY," يعني كن قلتلكم راهي حقارة راه وطيتو الصوت وتفرجتو عادي 
اتحشمو من لعبد واللي خالقكم لا "
1044359676928954368,LY,لو بتعيش صح في ليبيا امشي مشية ليبيا وماتزقبش 
1044918559514808448,LY,ترقد متأخر وتنوض بدري وماتقيلش تقعد حسبة ناقصة
1044961762272006016,LY, حسستني عايشين في دبي  يعني اللي فيها خدمات ومستهدفة الشعب و منها وكللل طبعا
1045430712365711360,LY,لقطة كل خميس شكلي حنرقد توا
1045659952713519232,LY,"  حتى ايام دولار  ماكنتش انجدد 
قوله يجي ي حمادي"
1046022791877791616,LY,بنغازي يوم السبت زي بنغازي زمان
1046352017483026432,LY,"كنها البلاد زحمه هكي 
شن في "
1046431213853044736,LY,تقعد ادير في حاجه مش مقتنع بيها يرقالك  يابال تعيش روتين حياة مش مقتنع بيه 
1046526806352973824,LY, السنه ايام معينه حاجه زي هك مانش عارف بالزبط
1047485328280506368,LY,نضت الصبح فتحت رواشن الدار الاثنين على اساس جو جميل والدار اتهوا  روحت توا معش عرفتها دار ولا اسطاح 
1047582938769100800,LY, حطيها بروفايل بكتشر وخلي صحباتك يقولن اووو تشبهلك نسخخخه 
1047599893324468224,LY, صلاح موسم الجاي يجي للنصر 
1047809365896585216,LY,"  باهي ي   ي مزبرين 
تعباي النت من البوابة مسكر ولا تيالي"
1048927326602518400,LY, مافش من قهر هذا واقع قعد زي العرف مافشي اي استغراب
1049207997413675008,LY,ليبيا بلاد ماوراء الجو السمح
1049584573561143168,LY, بعد اطلع روابط تورنت من اللي اقترحولك دزلنا لينكات 
1050132188820332416,LY,اللي يعرفك وينقص من قدرك قدام البرانية هذي مش بصارة هذا يشعر بالنقص قدامك ولا يتمنى يكون زيك  حتى لو أنت زباله هو يبي يقعد زباله زيك أو أكثر
1050361025302880384,LY,يحبو اللف والدوران ومعش عندي نية نركز معاهم
1051147303975903232,LY,ماوجعني الا محمد بركات معش عرف وين يحط وجه
1051215278573543424,LY,تي يلعن العاطفة اللي ودرتنا وخلاص  
1051382104167071616,LY,يعني الزحمة هذي كلها عالمصارف هذوما موظفين  تي والله لو هذوما كلهم يشتغلو ويداومو راه حياتنا مش هكي
1051430228034240384,LY, عيال ومحصلين لهايه سمحه فرحانين بيها
1051430820114780160,LY, من يومهم يا باشا بس ليا زمان عليهم نحسابهم كبرو
1051459534097698816,LY, عمرو دياب فنان أداء واليسا بالاحساس وتامر صوت وشيرين صوت واحساس
1051555894247473152,LY,لانقنه النفخ متاع العويل الصغار خاصة العيل الثقيل الحكية اللي تلقى هله فرحانين بيه عشان يفلم وقليل تربية ويقولو عليه ناشط الحكاكي 
1051557188685193216,LY, يبي ولده يقعد اطيب 
1051579221502509056,LY, عويلة ومحصلين مكان يشوفو فيه سمح ويلعبو فيه مايكلمهم حد
1051742986269282432,LY,"حقيت طابور حقيقي على التجارة والتنمية  مش عارف اللي يجي يصبي في نهاية هالطابور كله كيف عنده امل وصبر هكي بس  
شعب مرن مع الالم"
1052477872760348800,LY,نسيت اخر مرة رقدت فيها ساعات متواصلة حقيقية لعند تنوض معش تعرفه صبح ولا ليل
1052854244750057600,LY,ماتشكرش حد اصلا حيجي يوم وتلقى شكلك شين من الشكيرة لشكرتها لاه
1052985225888915584,LY,قصه كل خميس ساعه  عد تنازلي للنوم
1053644493642186752,LY, شنو نايض اللينكد نهدو زعمك 
1054318804703068160,LY,مشكلتك يا صديقي أنك يجرو بيك الوهميين ومخلينك عايش ملك في الوهم متاعك
1054495118126972800,LY," الفرق اللي نشوف فيه تعديلات بسيطة بأول برنامج اديرهن 
وممكن حتى من الكامرا بروحها"
1054809438614445952,LY," تفرجت على  دقايق ومقارنتها غلط وغبية  هذي زي اللي تقارن في سيارة امسخه بغبار واللخرى تلمع وتقولك شوفها كيف تلمع يا الهي  
المقارنة مفروض بامكانيات المحرك  
وتو نديرلها لفه ونقولك "
1055208774787653632,LY,"ليقعد معاك كويس بس مع أغلب الناس مش كويس 
هذا شن تقيمه "
1055869996746838016,LY,"أغلب الحاجات اللي اديرهن ويضحكو عليك مجموعة من الناس ولا يقولو لانقنك فاضي  بعد كم سنة تلقاهم يديرو فيهن 
ماذا تستنتج "
1056607126527840384,LY,"  مش هك النفخ 
اغسلها"
1056627244175671168,LY,أول مره نشوف سباق على 
1056670288627277824,LY,اللي يدير فيه خير يديرك زلحيقه
1057984892078841984,LY,اللي لك ومايتحشمش ماعندك مااديرله
1058825162311774208,LY,ليا زمان ماحصرت فيلم
1058835879681318784,LY,"اللي يسكن بصور التخرج بالخرقة المحمضة واللي عنده عيل صغار قذر وساكن بيه 
يحسسوك دايرين انجازات"
1059178528166555648,LY, عواقير ماتعرفوش تشرو راحتكم بكل واساسا كنتو تحلمو تيجلو حاجة مكتوب عليها بنغازي  دنيا
1059179458073116800,LY," على اساس سمستر الجاي بس اعتقد بيشفروهم للسنه الجاية 
معلومات عامه اقل من عاديةشكلية ومقابلة شخصية"
1059180797700259840,LY,الزبدة في اللي ماشي معاك ي وجه النكد 
1060098159056244736,LY, اتعوضها ي باشا في اللي خير منها
1060245133885616000,LY, مشكلته يبي شويه جهد
1060288218766233600,LY,ههههه شن اللي صار بس
1060860401246760960,LY," جميع كتالوجات السيارة كاتبين مايسخنوش فيهن واكثر تسخينه دقيقتين
بس لو لسيارة قاعدة في ليبيا كم سنة ماسخنتهش تخرب اصلا تعودت"
1060976887751676032,LY,حتى الثقلاء قعدنا نعرفوهم بسبب المش ثقلاء عطوهم مجال ويتناقشو معاهم ويخلونا نشوفو ثقالتهم
1060986285224087552,LY,كن يديرو قول اخر تنوض نوضة السنين
1062359627726233600,LY,  المدار في التلفون مايقيدكش واساسا للتصفح نادر ماتحمل بيه
1062465573630676992,LY,عليك اللي مايبوش يكبرو
1062802870167318400,LY,شعب قذر اللي هذا يزقب في الاخر ويحسب فيها لمصلحته
1063388612266475648,LY, معاك حق والربح مضمون بس لانه ليبي يبي ربح سريع ويرد رسماله من اول شهور
1064230659957362816,LY,الليبيين في الزقوب ابدعو 
1065158248729378816,LY, امزط قراية قراية الثانوي
1065159428830314368,LY, عدي افطر فطرة كافرة تو يتغير جوك
1065246397967028224,LY,  خخخهه حتى انا من هضا ازف
1065559868852105216,LY, خخهههه قولوها لروحكم ي عواقير ي متاعين وسط الحوش
1066348209415643136,LY,حي على امهم اللي يخسرو 
1066426327966863360,LY,"   ي امحمد وين ناقلينها 
جماعه سكاي مش جايبينها ازف"
1066427341705027584,LY,"   ترددها صعيف ماتفتحش من لبخت
مافش غيرها ي خونا"
1066449173426376832,LY,كل حاجه ولها وقتها في اللي ماتوصلش لعند يشلفطه ساس الواقع على خشمه
1066717833361588224,LY,ضغط قراية مع ضغط عمل الحسبة تهرب منك
1068152136750505984,LY,شبه اغلب الايام تقيل فيهن إلا الخميس من البخت تعلقها من  لل  ليل تلقى روحك راقد 
1069189173372993536,LY,باهي هيا مسكره وامبه غارقة عليش نافخهن وتبيب عساس بيابتك تحول في الغراق ولا شن وراك ي يويسري غير بوست عالفيس
1069190492074725376,LY, سيبهن فارغات او حط ارقام وهميه
1069241292838842368,LY,وين نحصلو خيط شحن ايفون نايض ولو بالموبي كاش اجمل ولو في مكان مافش غراق يقعد احسن واحسن
1069323497158127616,LY, مش غاسلينها تقول جاي تشحت
1069331559474479232,LY,تاريته السماعات فيهن جو
1069367206075609216,LY,بلا مبالغه حاليا قدام حوشنا تقدر تزقب صالتو محترم
1069892709509423232,LY,نبو مكان فيه هاردسكات نايضات
1070023267853975552,LY,الضي طافي والميه قريب تخش للحواشين في الشارع 
1071008187946557440,LY, لهلال نعرف رجاله والكشافه غير بوزعكوك مانعرفش
1071009416332435584,LY,"اكثر بوستات فيس شفتهم عالشهر 
عندي فيزا التجارة والوحدة فاضية بيش تخدم من يشري
شعب يبي يستغنى كله ويزمطو فيهم في الربا زي السلام عليكم"
1073631884947714048,LY,حتى بنزيما يعلقها هذي
1076579283986976768,LY,"هيا العطلة يوم الإثنين وزمطو معاها الأحد على أساس بين عطلتين بس هو السبت في الجامعة مش عطلة
كيف حسبوها مش عارف والله  
هبلة ولقت سبلة"
1077176242997260416,LY, وين هضا احسبونا في تجمع عشاء اي حاجه لخميس 
1077242212277256192,LY, لو ماحصلتش دورني عندي لك طلبك
1077299170682249216,LY, اذكرت يوم تلاقينا في لحمو في باركي الجامعة ولسيارة خاربة 
1078290737144451200,LY, هههه انت هك خشيت على حب لعبيد
1013094704295088000,LY, الارجنتين زي ايطاليا قرينتا ازف مفروض شجعتهم
1013292271305940992,LY,نومة الليل مافش خير منها تخليك تنوض  رايق
