id,dialect,text
974966183412813824,QA, أنتم منبع الإرهاب سعودين اللي يفجرون أنفسكم حكامكم ماخذين حقوقهم بطالة وفراغ البلا منكم
974967293708029952,QA, أدري إنك مستوجع بس هذي حقيقة
974967822475497600,QA, بعد تكذب هذي حقائق ليش السعوديين زياد بن نحيت سجنه وغيره
974968515588444160,QA, نفس البدون اللي عندكم المهضومين حقهم اللي في حفر الباطن وشمال السعودية ولكن الذين ذكرتهم كانوا مجنسين عندهم جوازين ومنهم من شارك في الانقلاب وتم سحب الجوازات حسب القانون
974968686468616192,QA, يخسي يقولها لو قالها كان مافي شي اسمه سعودية تستهبل شكلك
974969561895358464,QA, تعرف عبدالله بن علي اللي كنتم تريدون حاكم قطر  رفض وتم تصفيته حينما رفض الغدر منكم ياخونة
974971703431499776,QA, النقاش معاك عقيم ادري انك ماعندك دليل تقولين السنة اللي راحت انا اكلمك حاليا عشان تدرين انك مغيبة راجعي عقلك نصيحة اللي يعينك زوجك أذا انتي متزوجة أو بتزوجين
974973331123462016,QA,  هذا دليل أنكم رافضين حكم سلمان  وولده الداشر واضحة مب محتاج منكم تعليق قولها وفكو أنفسكممقدر خوفكم من الجمس الأسود
974974285981855616,QA, اهم شي وش صار في موضوعكم سلمان خدعكم بيتي مفتوح لكم قلنا لكم أنتم في دولة مهلكة ممكن تفسر كلامكم عندكم مشاكل من حكومتكم الضالة 
974975055879958400,QA, عندهم جوازين وأكثرهم يعيشون في السعودية عندهم حلالهم
974975323845681152,QA,  أدري إنك مصدوم بس مقدر الصدمة اللي انت فيها وثاني تعال انت أشتبي انت مخلفات حجاج وش دخلك
974976811661750400,QA, غير صحيح لم يعطيهم ولا عندهم جوازات سعودية بعضهم عندهم غيرهم ماعندهم
975000727486631936,QA,  أنا من شفت صورة العرض وانا غسلت يدي لو أسألك سؤال متى تأسست السعودية بتدخلين قوقل تسوين بحث هههههههههههاي
975002326946770944,QA,  حتى أبوجهل مافكر قانون منع التعاطف أخرب بيتهم سمعت انا إسرائيل أقتبست هذي الفكرة قانون التعاطف مع المسلمين  
975002744808451968,QA,  أتحدى أي سعودي انه يقول انه ضد حصار قطر يجرونه من أذنه ويقولون وين المكان اللي يوجعك يستهبلون فيهم كذب غير طبيعي اقولهم قانون موجود يقولون لا
975013816105951232,QA, شفت أقولكم أنا أتكلم مع من هذي الصورة خليه لك ذكرى  
975137320377683968,QA, الغبية والله أنتي مانحتاج أي تعاطف منكم روحي تعاطفي مع اللحوج اللي نفسك 
975138036794232832,QA,  غبية وعطيته بلوك تضيع وقتك
976769236222840832,QA, أوعى تصدق المصريين مش أنا حبيبك عمرو أديب الأقرع وكلامه صحيح  هههههههههاي 
976771648794832768,QA, بتتكلم على أسرائيل وأنتم علاقتكم مع إسرائيل زي الفل خليك في أكل عيشك يامعلم برعي 
977193809967812608,QA,   وين جيش سلمان وحنا دولة كبيرة طلعت مهياط تحميكم 
977398445119065984,QA,    مليار  اللي دفعتوه لمعزبكم ترامب جزية مالت عليكمأمحق سعودية
977671795951193984,QA,  هؤلاء كانت عندهم أموال والحكومة ماقصرت معهم ولكن خسروا فلوسهم ولكن ابشرك انحلت أمورهم ونقول الحمدالله  زين وش تقول اللي انحرموا من الماي مواطن سعودي يصرخ من القهر ممكن تشوف وتسمع شي محزن شيبة يصارخ هو وعيالة فيما بالك بغيره من المواطنين والسعوديين مرسي الله يفرج عنهم 
978514434506280960,QA,بوتينيكرشتميم أحاول أنسى الصورة ماقدرت وجه الدب الداشر ولا أن ترمي غسل شراعه   
978514943728324608,QA,بوتينيكرشتميم  هذي سوالف  حمود ريكي  
978515036195971200,QA,بوتينيكرشتميم بعد ضرب الرياض بالصواريخ اها اليمن نزلوا شيلة  
978518104593588224,QA, إلا هيبة دشيرة صاير سبورة
978518376854278016,QA, الفيديو قدامك اي حرقان  لو فيك خير يلي تسوي امك شمري كان دافعت عن ابن رشيد  شكلك مضروب جنبك
978518703909363584,QA, لا لازم نوضح  لكم  أنكم مخدوعين قال ايش يشتري أسلحة  شنو ماقصرت وهذا المواطن من وين  جوع كلبك يتبعك 
978519963588849664,QA,بوتينيكرشتميم الشعب السعودي تمللوا من حكامهم اللي ما وجدوا منهم إلا القمع والاعتقالات وعدم الاهتمام  
978527386252796032,QA, ادري انك مصدوم بس تحمل وش تسويكافي صدمة ياحبيبي
978528618329583616,QA,بوتينيكرشتميم الرد على الهاشتاق بفيديو   
978530343874637824,QA,بوتينيكرشتميم ضاحي خلفان يقول يقول سيدي حمد بن خليفه غصب مب طيب ياولد النعاشة 
978530662562050048,QA,بوتينيكرشتميم  الدب الداشر مايعرف يتكلم انجليزي أمحق ولي عهد 
978536037210296448,QA, أي تربية بس غصب عنه قال سيدي حمد مب طيب ولا الحقد فيهم نفسكم تماما سالفة عاق هذي سالفة من روؤسكم ولكن القتل أشنع  
978538053676552192,QA,بوتينيكرشتميم مواطن سعودي يشتكي من سالفة الشبوك داخل السعودية يعني محرومين التنزه من الشبوك هذا دليل انهم تحت طائلة الشبوكاسمع  
978617124741623808,QA, انا جبت من مواطن سعودي  يعاني من الشبوك عندكم داخل السعودية المشكلة عندكم 
978617469786083200,QA, تبون تخلونا انا حنا داعش ياعيال الذين القاعده بن لادن سعودي أكثرهم وأكثرهم اللي راحو داعش سعوديين  واجيب لك أدلة ولا اقول برسلك بغسلك ياللحجي
978618119957762048,QA, ولد ملك يعطي جزية  مليار  اي ملك وسرق اللي في الريتز بحجة الفساد قال ولد ملك
978642078107348992,QA, حبيت أجرب أرسل وجات بالغلط 
978642593826435200,QA, بو محمد للحين مع سالفة صبرنا سنة  مرة يزيدون ومرة ينقصون المشكلة يبين أن كلامهم كذب
978646587307167616,QA,  الجمس الأسود عندكم اطلع 
978951489627525248,QA, لازم تعرف أن مصر والإعلاميين المصرين يتعاملون معكم بالدفع ولا أنتم عندهم ولا شي شوف يامسعود 
979106055471976448,QA, اللي يتكلم ويسب مواطن سعودي مقهور وشدخل  أهل قطر تاج روؤسكم 
979115755714334848,QA, وش دخل إسرائيل أدري إنك مصدوم
979116642180435968,QA, أسمع اليوكن وش يقول  
979117526104846336,QA, شكلك منفعل عدل لأنك مصدوم ماألومك
979118293691838464,QA, شو الرمسة هلا بولد النعاشة شو بلاك شو تبا كيف يحكمها ترى فكرة حمود  ريكي عمك قال حق ابوه ابونا مخرف 
979128658995679232,QA, بس الكعبة في مكة المكرمة اللي بعدو
979130880999424000,QA,  شو بدي أحكي روحي شوف لك شات تتكلمين هذا تويتر  
979130951262490624,QA, كلامك متخربط ترى ماقلت شي غلط تنكر مافيه بدون لحظة ندري انهم قبايل ولكن مالهم حقوق نفس المواطنين 
979136599991701632,QA, نفس ترامب اللي تشوفونه حاميكم ولا ترامب من أمام المسلمين عندكم 
979142239363501952,QA, ليش مجبورين  ترضون أهل الإمارات بس عشانك بشيل الريتويت عشان سلامتك من ربع دليمابشري بشيل الريتويت
979144005660368768,QA, يعني شفتيه ماسك صقر بعدي يعني متابعة للشيخ تميم المجد كثري من المتابعة
979146755374747648,QA, للحين تدورين مالقيتي لأنه مب راعي سيوف 
979147175874715648,QA, شوفي مسكة السيف والله انه هيبة فديت ذا الزول جعل ربي يحفظه عز شعبه الله يعزه 
979147645066366976,QA, نص ساعة  ولا شفنا  محمد بن سلمان ماسك سيف 
979149317150781440,QA, وين أنتهى  للحين موضوعكم  أنتم تاريخكم كله خساير ميليشيات ماقدرتم صار لكم أربع سنين ومنكم دول لأن جيشكم خكر 
979149450030604416,QA, ادري انك مستوجع روح لقط تمر بس
979149812510707584,QA, شفتي اقولك محمد بن سلمان ماتتشرف فيه السيوف
979152875795505152,QA,   بن غيدة غسل شراع ولد النعاشة كفو  ياولد قحطان مابقى الا ولد النعاشة يقول القصيد جاك رد طير جبهتك
979153419385655168,QA, مشكلة ما أرد على البدون 
979154967209619584,QA, لا تقولون الرياض رقعة يامرقع أما السيف اسال بن رشيد اللي خلا ابوك في الكويت سنين وبنين 
979161268027346944,QA,  لهجة  اللحوج ما أعرفهاراحت الجبهة 
979176894338863232,QA, لا والله تحرك  ترى فيه فيديوهات اقدر اطرش تشوفون حالتكم بس انا ما احب اتشمت ولا أتمنى هذا يصير ولكن مالكم الحل إلا في صعدة
979177820063747968,QA,  هلأ سوير للحين سهرانة 
979178620928356352,QA,  سوير  صورة العرض ماله حل ترى بجونك الهيئة أي صح طلعتم علمانية 
979179102895779840,QA, ادري انكم مستوجعين للحين ماشفتوا شي 
979192754285744000,QA,   الحبيب يبي يضبط مع سوير شوف ربعكم يجون عندنا من طريق عمان هذا دليل مايقدرون يستغنون عن قطر بس شوف شنو يقول وبتعرف انك حثالة 
979196147821670400,QA, صار كذب انا جبت لك دليل تاكلون حمير لا بعد جبن أخرب بيتكم وش الكبد اللي عليكم
979197002922823552,QA, زين لحم الحمار يصير تطبخونة مع العريكة عادي عندكم
979197250059624448,QA, يعني تعترف ياخي تعجبني يالعسيري مافي شاي عالجمر كثر الحبك ولا عليك أمر
1147992507168567168,QA, ربي يحط حيلهم بينهم
1149275868310777984,QA,  الشبك لكن يا السعوديين  حكومتكم حاصرتكم ولا تقدرون تنتقدوا اللي يصير في بلدكم من فساد خلكم في الشبك 
1150372525605609600,QA," سارهظرنطاوي
  ماخبرنا في السعوديين عائلة الدندراوي هذي من بقايا الحجاج شوفوا وشو أصلها"
1150679680606986240,QA, هذي  قطر  بلدك والأهل أهلك 
1155983647456940032,QA,هذا سناب  سلوىالمطيري 
1156296821955842048,QA, حسبي الله عليه هذي هاشمية 
1156710226055376896,QA, ربي ينصرها على من عاداها
1156711843777404928,QA, الإمارات ماتجي إلا بالعين الحمرا خايفة من إيران فراحت تتودد لها وتركت حليفتها السعودية
1160010154177388288,QA, من زين جمالهاشكلها كله مصنع  وإلا من زين أخلاقها وإلا من زين دينها ومن الخبل اللي بيدف مهرها مليون مغرورة لأنها استغنت من الإعلانات 
1160306385466339328,QA, طلعت عاصفة الجزم   يتحاذفون بالنعل والجواتي  أو الجزم 
1166269234449649664,QA, هذا رجل وكفؤ  مسؤول أمام الله عن زوجته فلا يحق لها السفر إلا بموافقته شوفته تبي تطلع من طوره  مايصير لازم القرار فيه حفظ للأسرة لا تدميرها
1166281207396675584,QA, لأنكم حبايبهم اتسوون اللي تبيه أمريكا
1166469589326282752,QA, مسكين راتبه ريال مايسلفه البنك  متى بيسددها
1166727796531564288,QA, عقبال طرد عيال خنور من ليبيا
1167172764165398528,QA, بنت عمها حقيرة تغار منها 
1172623622353166336,QA,  ليه الحسد ليله الحسد ليله الحسد  الرز اللي وصل لمصر كان لكبيرهم فقط ليه الحسد 
1174521016992915712,QA, تسلم ويسلم لنا  ولكم  تميمالمجد
1174607909113794560,QA, ماذا يقصد من ذلك  أعتقد  أنه يقصد  محمدعلي   لأنه حرض على التظاهر وأن يقولوا  لـ   السيسي  كفى    عندنا في للخليج نقولمايمدح السوق إلا اللي ربح فيه  والسيسي نصير الأقباط الرحيلياسيسىاوالنزولللشارع   نازلينالجمعهليه    كفايةبقيياسيسي  محمدعلىفضحهم
1174852948528160768,QA,اوصفالسيسي   أبو تلاجه
1174980333491507200,QA, إيه أمي ما تقدر إلا على أبوي
1175149700032401408,QA,قول ماتخفشي السيسي لازم يمشي   قولمتخافشالسيسيلازميمشي   ميدانالتحرير  ارحلياسيسي   ارحلياسيسي ارحل   جمعةالغضب 
1175523250857742336,QA, ييب  لهم شي يشربونه وياكلونه اتعبوا وهم ايتحون ماشا الله ما يوقفون  ولا تنسى اتبخرهم عن العين والحسد
1175716552362123264,QA, أحمدي رب واشكريه ع نعمة الصحة محد بيفيد غير التقرب لله
1176200144150310912,QA,  أساسا المفروض تكون في الألعاب النارية في مكان مرتفع وبعيدة عن الجمهور 
1176614746046574592,QA, الحمد لله ع السلامة وربي يمن علي بالصحة والعافية أما بالنسبة للهدايا فزمنها  راح  الهدايا الحين كل شي موجود بالدوحة  والواحد موب كل عشر سنين  يسافر مرة الحين في السنة ع الأقل يسافر خمس مرات الحمد لله ع النعمة 
1177989872088469504,QA, وانتوا مافيه حدا منكم  ينقتل  ياعيب الشوم ليش بتكزبوا
1101477047564730368,QA,  كل ساقط له لاقط  بس رز من قطر ما فيش
1101941523481014400,QA, أمي ماتقدر إلا على أبوي
1102051942753320960,QA, تعليقي     قطر تصعب على من بغاها
1102253262030491648,QA,  اتخسي ما عندنا مشاكل وإحنا موب غاليين عندكم  خلاص اللي يعادينا ما نبيه  طسوا
1105031941747806208,QA,  خلك في  المحمياتالملكية   يا عملاء الصهاينة   ياإرهابيين  ياقتلة العلماء  الدور عليك  في السجن محد يحميك اللي اتعنز عليه بيتخلى عنك  يا إرهابي 
1105379639021596800,QA,   خل المراعي لك   بلدنا  أحسن منتجات  الألبان  الفيمتو من يشربه كله مواد مسرطنة وسكر خله لكم 
1106067474464886784,QA, أعتقد عادي  بس على الحفة   والله أعلم
1107108037112799232,QA, ربي يرحمهم ويصبر عائلاتهم على الفراق
1109281935791193984,QA, سووله تبيض أسنان وتبيض عقل 
1109481185598529536,QA, اليهود عندكم اللي تحالفوا مع اليهود وبلوك 
1110870397887672448,QA, بالعكس إحنا القطريين ننطر ساعات عند باب الدكتور والسبب إن غير القطري داخل عند الدكتور يقعد يسولف معاه وينصحه ولين دخلنا أقل من دقيقتين عنده الأجنبي ماخذ حقه أكثر من القطري يدق الباب ويدش أما لو إحنا سوينا ذلك قالوا لنا ليش تدخلون قبل دوركم   وإذا موب عاجب روحي خاص 
1111648962874871808,QA, من تكفخ الخدود صارت حمرا
1112047598641258368,QA,  منهو اللي لابس برنوص 
1113046539738415232,QA,  أنت موب صاحي  هذا وين يا غبي  
1113130372219330560,QA,   شفته بعينك احلف إنك شفته بعيونك اللي بيجيها يوم وبياكلها الدود  لا تبلى وانت ما تعرف شي  غير القصيم وحايل والحساثقف نفسك 
1113336333970415616,QA,   اللي حرض السعوديات ع الهروب  هو الشريان في برنامجه في قناة سعودية  انطموا وكلوا تبن  يا رقيصة  الملاهي السعودية 
1113336751794393216,QA,   وبناتكم برع وقويات  طقاق يطقكم ويطق بناتكم 
1113548086654251008,QA, والله دول الخليج اللي فيها انفتاح ماسوت اللي يسوونههذا معناه تدمير جيل ليبعدوه عن دينه من أجلك يا  إسرائيل
1114184986645749760,QA, والله لبس البنت الكويتية المعتدلة موب هاالبس  رحنا الكويت وشفنا الكويتيات محتشمات حتى اللي غير محجباتأما هي فأتذكر أول ماطلعت كان كلامها العربي مكسر  
1114200342844067840,QA, الحمد لله إحنا افتكينا من المنتوجات المصرية الخايسه
1116059596257419264,QA,  لعنة الله عليك  تستخدم فاحش الكلام  بلوك  بلوك بلوك 
1118714997088108416,QA, من عمره ماتبخر  تبخر واحترق
1122398705435521024,QA, ياخياس خلاص إحنا مانبيكم  ههه اتحاصرونا وتبون اتدخلون بضاعتكم الخايسة تخسون حتى لو ادخلت بضاعتكم محد في قطر بيشتريها ياحيوانبلادك اخسرت الكثير  واقتصادكم هزته قطر انجلع ياحيوان
1123872826119815168,QA,  ورا محطة بترول أبو هامور  عند بداية الجسر اللي في شارع مسيمير اللي رايح ع المطار بيكون على يدك اليسار إذا أنت جاي من شارع مسيمير 
1124373959636594816,QA," اتخسي هذا الترند أنتوا اللي رفعتوه
أووووه مشكلة قطر صغيرة صغيرة جدا جدا  لكن الرقعة تكبر وتكبر وتكبر   أنتوا ماكلين شاربين نايمين قايمين ماعندكم إلا قطر كم أنت عظيمة يا  قطر  "
1125491234586406784,QA, أبوظبي ساس البلا ماتبي الصلح مع قطر
1125890740909957248,QA, مالت على الاثنين  هذيلا شيوخ الفتنة يشتغلون بالريموت كنترول يقول لهم ولي نعمتهم  ياللا سبوا قطر وإلااتعرفون شاسوي فيكم وعلى طول سب سب سب  المضحك إن القرني يقول إن المغردين القطريين يقولون عني شيخ السلاطين
1128099856365571968,QA, عين  حاسدة ماصلت على النبي 
1130062726682894336,QA,  مخك ضارب وإلا أيه
1130238967486586752,QA, القرقيعانأوالقرقاعوه هواحتفال للأطفال في منتصف شهررمضان يفرح به الصغارلأنه يغير اليوم الرمضاني الطويل بالنسبة لهموفرحة للكبار  بانتصاف الشهروهو موروث شعبي لا تعارض فيه مع الدين ومن يحرمه ماعنده سالفةسنحتفل به ولن نتخلى عنه أبدا أبداواللي موب راضيه الكلام يطق راسه في الطوفه
1130458228192685952,QA, كل شي تغير  القرقاعوه الميس ماله حلاه  حلاته ياخذونه من الجدر أو المسف  ويحطون في أباس اليهال  الحين التقرقع في المولات 
1130801336466006016,QA, ماتخسي  لا طاعة ولا سمع له ولا غيره  مصلحة  قطر  فوق الجميع  حفظ الله قائدنا  تميمبنحمدآلثاني    وبعدين كل شوي نطيتوا ع قطر خلاص حبل الود انقطع  خلاص اللهم باعد بينتا وبين من يريد ذلنا   وانصرنا على كل أعداء الدين 
1132425101486493568,QA, إيش ها الكلام الفاضي 
1132532253882560384,QA, عيال الحين غير الود ودهم الريوق والغدا والعشا من براالله يصلحهم ويهديهم  زمنهم غير زمنا
1133726217146969984,QA, لله دره من صبي
1134878074485518336,QA,  من مخابرات بن زايد 
1135797621904334848,QA,  اتعرف من اللي لاعب باليمن وليبيا  هم السعودية والإمارات ليش تتهم قطر
1137854112312176640,QA, بالنسبة لي ما أشوف فيه شيء  لأنه صورها بدون وجود أشخاص 
1138181127359930368,QA, ليش حاط  الأمير تميم كنت حطيت محمد بن سلمان اللي هواه صهيوني 
1139101608548192384,QA, هذا دليل على انحطاط من شغلهم كذباب إلكتروني 
1142156062260375552,QA, ضرب الحبيب زي الزبيب
1143448290886868992,QA,"ياحمام الحرم ماعاد فينا دهاه  
العذر والسموحه ياحمام الحرم

الخليج اصدروا باسمه شهادة وفاه
والعروبه لحقها في نحرها  ورم 

طاح سوق المشايخ  كلهم والدعاه 
وارتفع سوق ابو نوره ونجوى كرم 

شاعر مايوقف في حلوق الطغاه 
والله ماهوب لامبدع ولامحترم   معتقليالرأي "
1143456838853246976,QA,  التبن واللي فوق التبن يترس حلجك   يا علماني
1143457275430014976,QA,   التبن واللي فوقه يترس حلجك يا علماني لعنة الله على اللي حرمنا من الحرم   عسى ربي يحرمه من ريحة الجنة 
1146392487117955200,QA, تمثال الحرية وصل جدة قدام نافورة جدة تقريبا 
1162120562262597632,QA," كلب نبح عند الغنم ينطر الشيك
يمكن  معازيبه ماتعشي كلابها
كلامك اللي يشبهك منك وعليك
لا تقرب الداب ومايعضك نابها
يمدور الشرهات ماعاد يمديك
ترامب روح بالخزينه ومابها
شحاذ لكنك بأجنده وتكتيك
ارجع ترب دلال ياصبابها
صياحكيطربني"
1162542856759906304,QA,"انتم كذا مابين راقص وقواد
بلا شرف وبيوتكم للوناسه
يسوقكم دحلان جاحد ومنقاد
اطهركم اللي يدرسون النجاسه
ولاالعرب لهجاتهم تتبع الضاد
وانتم دمرتوا الضادوحستوا مقاسه
صرتوا على الأشراف شرطي وجلاد
وعاديتوا الأجواد بحقد وخساسه
علمتكم بالعلم  وان زدتوا نزداد
بالعز والنوماس وفطنه وفراسه "
1164087261023088640,QA,"ليا صار  أولها على عزوته غار
ماعاد داشركم يملك قراره
الشور والكلمه غدت عند غدار
ذاك النغل راعي الخنا والدعاره
دليم وتريكي مذيعين الاخبار
دحلان يعطيهم كم استشاره
قد قلتها لاشك صار الذي صار
هذا البزر ماهو كفو للأماره
ضيع بلادبشعبها وسط الإعصار
ياليت من جابه مصلى استخاره
السعودية "
1164124483931820032,QA,"  ماني مناقش واحد ضارب الطار
مايعترف بأسمه يشوفه عياره
يكفيك هالبيتين عن نظم الأشعار
وماظنك بتفهم كالحرار الإشاره"
1164142455773679616,QA,"وابشر بجيش مايسوق المعاذير
دون الوطن واميرنا ولا نتباها
واجب علينا كلنا له مغاوير
ندعس على العايل اللي نواها
تميمالمجد "
1164152486212583424,QA,"كل الديار ديار لكن  قطر غير
نعشق هواه وبحرها مع ثراها
ذي كعبةالمضيوم ياديرة الخير
نتعب نعد  أوصافها من غلاها
حنا ب تميمالمجد  مانشبه الغير
يعجز من يحاول يرتق لمستواها
لرقاب عدوانك نسن السواطير
خسران منهو بالردى قد نواها "
