id,dialect,text
964399378436734976,KW, دلال الى السبت واقولج اذا في نسخة زايدة 
964399867907854336,KW, اللي اتحدث عنه من دار الخيال  لكن صح كلامك الدار ابدعت هذه الفترة بالترجمة 
965108065170280448,KW,اللي طافهم المطر المره اللي فاتت خل يطلعون يشوفونه الحين  
966277816441589760,KW, ههههههه منال ضحكتيني صج  فكرتي بالهدوم والمكياج  
967765972349345792,KW,"اللي يحب يبدي تمارين الامتنان مع سراب

"
968717534810828800,KW, جاوبي على سؤال لماذا مازلت متمسكة فيها  شنو مستفيدة في كل لحظة عندك قرار اما تكملين يومك معاها او دونها  لكن الـ  تساعد 
968718397482684416,KW,المهم  اختار مدخلات عقلك بعناية  مثل ما تلبس اللي تحبه وتآكل اللي تحبه  اختر انك تشوف وتسمع اللي تحبه على كثر ماتقدر والباقي خله يطلع من الإذن الثانية فلتر فلتر
969218781879918592,KW,احنا عايشين بعالم واحد  لكن كل شخص عايش بواقع مختلف  موجودين بنفس المكان  لكن كل شخص فينا يشوفه من زاويته 
970638528832000000,KW,حتى الأغلاط الإملائية توصل ترند  من كثر ما اشوف الأغلاط صرت أشك اذا كتبت صح  ماهياسبابكثرتالطلاق
970961607454089216,KW, بالسماح بالرحيل ديفيد هوكنز ينصح بتسليم الشعور نفسه  مو الفكرة  الشعور خليه يمر لا تحللينه  لهي نفسك بأي شي وانتي واعيه انك اخترتي هذا الامر عشان تغيرين الشعور  اما التعامل مع الفكرة حطي الفكرة البديلة وحطي اثباتات للفكرة البديلة
974372367957979136,KW,انت بس ركز بالموضوع  
977481430312935424,KW,اللي بالكويت حياهم الله  الكتاب موجود في مكتبة ذات السلاسل  
978913154125189248,KW,هل صحيح ان لكل فعل ردة فعل ولا العنوان فيه شي يحتاج تضبيط   انا اقول يحتاج تضبيط  اللي بالكويت حياهم الله  
979322711318122368,KW,لقائنا يوم السبت  بس مو لكل فعل ردة فعل  
979400652924309632,KW,من صور التدمير الذاتي اللي المجتمع يمارسها التهوين بالمقارنات  مثل  الحمدلله بس زايدة  كيلو مو    انا بس رفعت صوتي ما غلطت عليه  على الاقل انا متأخرة اسبوع مو شهر  انت بالاثنين عافس الدنيا
981247358116814848,KW, الله عطر المطر  خوش نك
986528911134621568,KW,استمتعت جدا مع مشاركات ملتقى كوني أنت في الرياض  التفاعل رهيب والحضور جميل جدا  اللي لفتني 
987780134865432576,KW,قلنا من فترة ان المعرفة مهمة و هي تؤثر على الادراك  اللي يخليك تفهم الرسائل عشان تصيد 
991776598646026240,KW, عدل ما فكرت فيها 
992079538657079168,KW,مساء الورد  شنو الكتاب اللي بين ايدكم هالايام 
992133949156659200,KW, كنت قاعدة اعدل قائمتي في   وسوه شير على تويتر  الكتاب قاريته من سنين لكنه ممتع وجميل حتى لو اقراه مره ثانية  انصح بجميع كتب واين داير للقراءة
993795465929023616,KW,كل شيء له قيمة حتى اللي تصنفه ان ماله قيمة بالنسبة لك
997165600182071168,KW,بقال خووش مسج  بس لا تعيدها  لاتفشلونا  
997911572646432768,KW,"تفاصيل الدورة على الانستغرام
 "
999062963607801984,KW,المسلسل الوحيد اللي متابعته برمضان قرار وزير التربية والغش  وردة الفعل العجيبة لرفض القرار
999612337895206784,KW,حق اللي يبون يرفعون تقديرهم لذواتهم والابتعاد عن المقارنات  تقدير الذات من اساسات الاستحقاق  
688330148689637376,KW,استمتعت و انا اقرأ هذا الكتاب  اللي يفكر في سؤال كيف اتغير الجواب في هذا الكتاب  من مكتبة 
688479543917694976,KW, كلها و نبدأ بالاكثر طلب
689547411707052032,KW,تكلمني متضايقه و زعلانه  تقول بديت بشي احبه اشتغلت فيه و نجحت و الناس صارت تعرفني و صار تأثيري 
690130976614289408,KW,الناس اللي ما خطوا خطة حق  هذا الجدول يساعدكم لوضع خطة صغيرونه شهرية  الشرح على السناب و في 
690944258837192704,KW,اليوم رحلتنا طويلة من الظهر في المباركية  اللي يونس ان الجو حلو و تزامن مع اليوم الأول في 
693177948501860352,KW,عجبتني سالفة كل ليلة كتاب  القراءة بالليل لها طعم ثاني 
693179183791472640,KW,اليوم كنت مع ومضاتمنفكر لـ محمدبنراشد  حماس و تحفيز على تأمل و حب و كل شي  تقدرون تنهونه في جلسة وحدة  
694126344934932480,KW,على موضوع التسويف اللي تكلمنا عنه اخر مره و قلنا ان اهوا من التدميرالذاتي  اقترحت ام ناصر 
694799609365925888,KW,اربع محاضرات لمدة يومين مع تدريبات على الحديث الارتجالي  بعد ايام في الكويت  اللي يحب يشارك 
695211828364845056,KW,اللي يحب يشاركنا في تحدي السلسلة الأطول    
695222771538857984,KW,الناس اللي تتعامل مع ايميلات وايد مثلي  ماودكم تنظفون الانبوكس  على فكرة وجود كثير من 
695231073651941376,KW,"الناس اللي تبي تركز استخدموا هالتكنيك 
 اختار الامر اللي تبي تسويه
 وقت التايمر على  "
695270526722375680,KW,شكرا يا قطعتوا علي كل شي  السياسة الجديدة الغريبة  خليتوني اكمل قراءة 
695574290054381568,KW, الله يسلمك و شكرا لك  واتمنى لك التوفيق 
696699034732462080,KW,هذا الدعاء جميل و مريح  ساعات نفكر وايد عشان ناخذ قرار مهم  او خطوة مهمة في حياتنا  وقتها 
697831114782724096,KW,في كتب  الله يسامح اللي كتبها 
698181811965464576,KW,النقاش راح يكون بالكويت  راح نجتمع في مكان في الفترة الصباحية 
698935877951741952,KW,مادة كوكو شانيل هي جزء من مادة البسيتاجك  حطيك لكم السلايدات كاملة وتقدرون تقرونها  دورة 
699167484298002432,KW,ساعةفنغشوي  درج مكسور مكالمة ضروري تعملها حديقة المفروض تنظفها  كل هذه الامور تاخذ من طاقتك اكثر بالتفكير فيها وطاقة اقل لو عملتها 
699525104401829888,KW,ساعةفنغشوي عنصر النار مثل مادرسنا ايام الابتدائي الالوان الحارة احمر برتقالي الاصفر القوي وشكل النار شنو
701080097734971392,KW,ساعةفنغشوي الخطوة اللي بعدها راح يشرحها مجمان في الدورة  واذا مستعجلين على الجواب سألوه في حسابه 
701080481232715776,KW, اخت انعام كتبت عن هذه النقطة قبل ايام بالتفصيل ارجعي للتغريدات الاولى بنفس الهاش تاق
701319501258821632,KW,"صباح الجمال  المشاعر 
ابي اقول نقطة مهمة جدا بخصوص الشعور  اللي يبي يتعامل مع مشاعره "
701340196097409024,KW, نعم تؤثر على البيت لكن مجمان راح يجاوب بتفصيل اكبر
702436136665411584,KW,في السناب الان اتكلم عن معلومات دورة البسي تاجك  جاوبت على سؤال كيف ما اعيش شعور انتظار 
703099582134128640,KW,"انا من ديرة  
نسايمها محبه 
و البشر فيها محبه 
صدورنا للخير رحبه 
و طـيـبنا للطيب "
704271043964379136,KW, بطلة  واصلي واصلي  كل ماكانت السلسة اطول تعززت العادة
704998206770454528,KW,مساء الورد  خلونا نسوي تمرين حلو ياخذ منا دقايق  غمض عينك وفكر بأمر تحمد الله عليه  اشعر 
709303748879884288,KW, لها اكثر من تفسير  ما اقدر اعطيك تفسير محدد لكن ارجع اعمله مره اخرى واهتم بالطفل اكثر وحاوره
711119225952272384,KW,"علامات اقولك انت محتاج لايف كوتش او موجة شخصي 
 تحس انك ضايع وماتدري شنو تبي الكوتش بهذه "
712196203941855232,KW,صباح الانشراااح   الحب المطلق مافيه لماذا  مافيه اسباب  حب مو تعلق  
718880299531300864,KW,"النقطة الاولى  عشان اليوم يكون عجيب اصحى قبل موعدك المعتاد بربع ساعه بس  
النقطة الثانية  "
718880395303993344,KW,"خلك معاي وصحصح 

مبدأ باريتو  اللي اهوا مبدأ  يقولك 

  من ارباحك نتيجة عشرين "
720530938371969024,KW,"اليوم ركز على الاحداث والاشخاص اللي يخلونك تشعر بالسعادة  ومن خلالها تأمل 
 تتوقع ماذا "
721242737601867776,KW,الشغف  الكلام اللي راح اكتبه الان مو للكل  بس للناس اللي ما يحسوون بالحماس بالغالب في 
721281940524003328,KW,وحدة من الدراسة  اللي صارت على بناء العادات تقول ان يبدأ بناء العادة من  يوم الى  يوم واكثر 
722145089556987904,KW,في السنااااب الان تمرين خطير  اللي يطبق يكتب لي النتايج  
722468000130052096,KW,بعض النتايج من تمرين امس  
722753470802038784,KW,تفاصيل الاشتراك بالتغريدة اللي قبلها 
723763860977684480,KW,اكتملت مجموعة الثقة بالنفس  راح نبلش بااااجر ولمدة  يوم ونقولكم النتايح  شكرا لكل من ارسل 
724152902307176448,KW,"اليوم الخريطةالذهنية على السناب 



واللي ماعنده سناب عادي راح ارفعها على اليوتيوب  "
724913798977572864,KW,بكج وصل عمان وبكج رايح داخل الكويت  
731004243067469824,KW,صباح الحب  تخيلو لو نمرر كل شعور جميل احنا نحس فيه  شنو المشاعر والاشياء الحلوة اللي راح 
731376038480105472,KW,اللي يسجل عن طريقي له خصم وااايد  انا راح اكون مسجلة  هالدورة مهمة  ابحث واقرأ عن منهجية كايزن 
732679003862077440,KW, ان شاء الله بعد رمضان
733306265133273088,KW,عن دورة فن برمجة الذات  
735717396338479104,KW,"فيه شغلك
وفيه شغلهم
وفيه شغل رب العالمين
لو تهتم بس لشغلك
وتتركهم يهتمون بشغلهم
وتسلم "
735723459058098176,KW,كل يوم احط توكيد صحي على بطل الماي  اشجع نفسي واشجعهم في السناب  وكل يوم عدد المتأثرين 
738259304420106240,KW,صباح الورد  ماراح اقول لكم شنو خطط شهر   راح أسألكم شنو خطط رمضان هالسنة   مافكرت تسوي شي 
738343142097850368,KW,الحمدلله هذي وحدة من النتايج بعد دورة فن برمجة الذات  واهيا اللي طبقت التمرين بروحها انا بس 
738703526839341056,KW,     علامة الشرق لاو تزو  صلاح صالح الراشد 
739100380127191040,KW,هذا الكتاب الثاني اللي خلصته في تحديالقراءة  الكتاب ممتع جدا وواضح وأسلوبه جميل 
740929031160401920,KW,كل سناباتي السابقة تلقونها مسجلة بتطبيق موجز  بس نزل البرنامج واعمل بحث على اسمي  تطلع لك كل 
743913841185144832,KW, شكرا اخت شروق واتمنى اني التقي فيك قريب جدا 
743913963004530688,KW, كل السنابات موجوده على تطبيق موجز في الستور 
743914137747623936,KW, شاركينا المعلومات الحلوة وفاء  بالتوفيق
747823431056506880,KW,  اليوم بلشنا اليوم الثاني
755037750089379840,KW,الدورة القادمة  البسي تاجك 
755862963911876608,KW, اغلب كتب لويز هاي
759331426185732096,KW,الان برنامج تعزيز الصورة الذهنية موجود كامل مع الشرح لكل الايام على موقعي  اللي ما بدت فيها 
760012666815537152,KW,صباح الوناسة  اهلا أغسطس  راح ابدع فيك شنو نواياكم  بس هالمره لا تخلونها من غير خطة عمل  
763710235735359488,KW,"انتهيت من فصل      
اندمجت ونسيت نفسي وانا اقراه لان الكلام اللي كاتبة صحيح "
774667003172888576,KW,"عندي رغبة اني اقرأ هالمجموعة القصصية  منو قراها 
"
776370179206963200,KW,النقاط البسيطة اللي فاتت خلتني أفكر بتأثير الفراشة 
789176940385017856,KW,"اللي يبي يحضر يحط في باله دهاني ما يغشمر بالاجتياز  للمهتمين بالكوتشنج هذه الدورة هي الاختيار الأفضل عن تجربة
"
805703987592839168,KW, دوم ان شاء الله هالمشاعر 
813622843397246976,KW,ابتسم الان  ثانية بس ولاحظ بعدها مشاعرك   صباحكم بركة  
813712037272580096,KW, راجع الصورة مره ثانيه 
815942837078556672,KW,سوالف المجموعة اليوم  راح نبلش بعد نص ساعه  دورة متعةالتخطيط 
816197247708921856,KW,أنا هذااا اللي يفرح قلبي  اللي يشتغلووون من قلب  متعةالتخطيط 
828598459578081280,KW,دورة البسيتاجك يومي  و  مارس اون لاين  التسجيل عن طريق الرابط فوق  كل الاخوات اللي 
831799819358334976,KW,"نكمل القلق 
الناس اللي يصاحب عندهم القلق ضيق في التنفس ابسط وأسرع شي تعملونه هو التركيز على "
832534262586961920,KW,دورة البسي تاجك تابعي نقاط الدورة على السناب  
832882189398323200,KW,في السناب قلنا  ان تقديرك لذاتك يعني ان تعطي ذاتك قيمتها بمعرفة من انت كإنسان بغض النظر عن ما 
840242414799462400,KW,عشان جذي ما ينفع دورات اون لاين بالبيت الا وانت مسيطر على الوضع تمام  
846218725074370560,KW,تمرين التنفس الصباحي  ريحة القهوة   صباحكم عسل 
850018917825343488,KW, الف مبروك دعمار  
852927839062151168,KW,تغيير جو  نبيل شعيل  هايمين حصريا   
853905465360736256,KW,لما أكون في الشرقية ما اشعر ابد اني غيرت مكاني وإني في ديره ثانية  كلمة صدق  بنات الشرقية فيهم لطف و ذوق ما اقدر اوصفه  شكرا لكم  
853921655143493632,KW, مثل الريشة بالهوا  مع الهوا
855100789425131520,KW,لحد يقول ما شفت الاعلان  من اقوى الدورات للكوتشز والمدربين والمهتمين  
865123862148771840,KW, ليش الاحباط  بالعكس رسالة تقولك كملي شغل على نفسك  أنت وعيتي لردة الفعل وهذا شيء ممتاز
870240579803893760,KW,شنوالكلمهالليماتحبتسمعها  ما أقدر  الظروف 
873970046174990336,KW,علمتنيالحياه ان اللي نرفضه اليوم ممكن بكرة نقبله واللي نقبله اليوم ممكن بكرة نرفضه
874248363134390272,KW,الان خلصنا تلخيص فصول الكتاب  باقي شرح الامثلة  راح اختار اهم الامثلة من  مثال
875070472785973248,KW,نقرأ الان كتاب تألق وأبدع في السناب ات  اللي يحب يتابع معانا حياكم   
875346243890933760,KW,يعني يوم قررت اشوف تلفزيون اليوم اشوف رقية النسرة   شهالآدمية اعوذ بالله كانفيكلزمان
875647269994770432,KW,تلخيص مثال الوزن بكتاب هكس للمشاعر 
875696553087913984,KW, شكرا لك أخ احمد وأتمنى للكل الاستفادة
875992564943519744,KW, شريته من تطبيق جرير
876142745789894656,KW, راح نلخص المثال الثاني عشر  بعدها  ونربطهم ببعض
876195043639472128,KW,المره القادمة راح انزل التلخيص  لان في ناس قاعدة تطبعه 
876197608582254592,KW, عشان الطباعة تكون واضحة 
877123939658600448,KW,كنت ابي اكتب عن بنك الخليج لقيت العالم مكفيه و موفيه  
882197238084026368,KW,خيار واحد في حياتك ممكن يغير قصة حياتك كلهااا وحياة من حولك  ومن بعدك  صحيح ان الفلم خيالي 
886598025895923712,KW, هو مكمل للكتاب الاول  ركزت اكثر على المشاعر  الكتاب الاول اقوى  تقدر تسمع تلخيصي على الساوند كلاود
888306554939854848,KW, بحر سلطنة عمان مازال محافظ على جماله وصفاءه وروعته  من أجمل الشواطئ اللي شفتها  مكان لعيش الجمال والتأمل  وفيه هالأشياء الحلوة 
902436037095550976,KW,تويتر تغير شوي  في أشياء ماني عارفة اسويها 
902439472528273408,KW, الرد على مجموعة بتغريدة وحدة  الرد على التغريدة كإقتباس بس اكيد راح اتعلم الطريقة
903148262944800768,KW, كاتبة ملهمة مؤثرة لها مؤلفات وكتب وصوتيات رائعة بحب وتقدير الذات والتعامل مع الحياة بحب وتسامح 
1151451807194996736,KW,"هذي أول مره أحط لكم فيديو لشغلي بتويتر  
مكياجي "
1151779844008685568,KW,ليش في ناس مصره تطيح حظ نفسها  بنفسها 
1151779993334272000,KW, مناسب وطقيت مو مناسب
1152791513895772160,KW," اعتقد اهيه قوانين اساسيه انحطت  وبعدها طلعو مجموعه متضررين من هالقانون يبون حقوقهم  شوي شوي يغيرون بالقوانين ويشيلون منه ويعدلونه
بس هل الرياييل هناك يطالبون بالزواج المتعدد هل يعتقدون انه حق من حقوق الرجل انه يكون له اكثر من زوجه بحياته"
1154136781601853440,KW, عاد من اشوف شي جذي ادري ان المنتج قوي واخذه
1155013725285507072,KW, دانه قاعده مهمه ولكنها صعبه جدا
1155217130465439488,KW, تركيزج حاليا على شنو
1155237048212688896,KW," كل الي تقولينه هوايات  وشغلات تحبينها تسوينها  مو شي تبين تكبرينه وممكن تستخدمينه كمهنه او مصدر دخل  
و الرسم الميك اب وتقريبا الملابس كلها مرتبطه ببعض كفن فتحسين ممكن تتعلمينها كلها

بس لو تقولين مثلا  انا امثل
و ارسم
واصمم ازياء
و اطبخ حلويات
مستحيل تبدعين فيهم كلهم"
1156276732682539008,KW,ما وده يتناسى ولو يبغى نسى 
1156276879541919488,KW,"مالي خلق افتح اكاونت سئلوني واجاوب وخرابيط
الي يبي يقولي شي خل يقوله دايركت"
1156302794107830272,KW, ههههههه عادي جدام الكل
1156672956615090176,KW,يارب تحفظ لي كل رفيجاتي و تخليهم لي وتسعدهم وتمتعهم و تمسح على قلوبهم وتعطيهم ولا تحرمهم من اي شي بخاطرهم 
1158269180820566016,KW,شلون تحفظون اسعار الشغلات الي تشترونها
1159178762572959488,KW,"مافي احلى من مكياجي
 الا مكياج انفال عبدالحسين  
ماقاوم جمال مكياجها "
1159540188403720192,KW,  ما يعرفون الشبه عندهم كل البنات واحد
1159681343812526080,KW,  ييبيه وايي وراه ركض
1159684787973623808,KW, اذا شخص اول مره التقي فيه  مو مريح تبدي السوالف بنقاشات قويه وعميقه ووجهات نظر وشد وجذب  مواضيع المكياج والطله تفتح الباب كانها سناكس  بس ممل طول الوقت سوالف تكون جذي  مشكله اذا ماغيرتي الموضوع وخليتيه اعمق ادري ماراح تلتقين فيها مره ثانيه
1159829912963842048,KW, لا تشوفينها مره ثانيه 
1159841129002463232,KW,لا خلا ولا عدم من فزعتك 
1160597970502463488,KW,اذا رايحه مكان ضامنه محد بشوفه يعرفني  البس دلاق و نعال بو صبع 
1162848623681527808,KW, الله يسلمك والله والنعم فيييك  سنين تركض وانت للحين تتحلطم عالبنك 
1162850044359380992,KW," اي ارام تره معجبينها يزيدون وانتي للحين تمخمخين الموضوع
يبدي يصير دور تره ها"
1162851129325232128,KW," فاونديشن سامر خزامي 

ناعم جدا عالويه  ملمس مخملي  فل كفر او اقل حسب اشكثر قاعده تحطين
ما يخطط  والوانه حيل حلوه

موجود بسيفورا
رقمي رقم 
بس احب معاه رقم  يعطي لون تان

ماراح تحبه الي بشرتها جافه "
1162852792819695616,KW," جل حواجب بينيفت

احلى جل جربته للحاجب

ميزته انه جنه شدو  مطفي  بس يلزق
مو نفس الجل مال الحواجب الي يعطي لوك تاتو  لا هذا يعطيج احساس شدو باودر بس الشدو ما يثبت هذا يثبت

لوني  او 

 الي بتستخدمه يوميا ممتاز  ما ينفع استخدام مناسبات لان ممكن ينشف "
1162853967078014976,KW," فوطة ميك اب ايريزر  نار التعريب

حق السفر ضروريه جدا جدا جدا  بلليها ماي دافي  صابون الويه او مزيل الميك اب  تشيل الميك اب بثواني خصوصا المكياج الثقيل

جربت كذا براند  هذي احلى شي  ضروريه للشاليه للفندق للسفر ماحبها للبيت لان احب القطن احس انظف

 لا تشترون السوده "
1162854570508333056,KW," صمغ غليتر نكس

عندج شدوات منثوره غليتر اي شي غثيث يطيح يعفس الدنيا يخرب الرموش 

حطي نقطه ووزعيها قبل اي شدو منثور يخليه ثااااابت الى مالا نهايه

من فرع نكس بالافنيوز

مافي اكس  "
1162855585584431104,KW," ايلاينر ميم و نون

ارخص اقوى ايلاينر يظل صامد  عيوني ما يثبت عليها اي شي  حتى جل انجلوت ما يثبت 
هذا يطول  حيل  حيل
في غيره بس هذا رخيص و حلو 

محلهم بمجمع سمفوني الدور الاول

مو وايد اسود
شوي يلمع "
1162857529476550912,KW," مسك الجسم ماركة عود ميلانو

انا جربت اثنين ورديت شريت مجموعه  ماعجبوني 
احلى اثنين  افروديت  و  كليو

ثابت جدا  وانتي تشمينها طول الوقت  وريحته تحوس دار مدارج و يهفهف كلما برد بريحة حلوه حيل

 غالي اوفر اعتقد المسك  دك بس كميته كبيره "
1162859321060990976,KW," لوزيان

مو ستايلي اشتري شي مو شامته  بس شريته ورشيته وكل من يسالني عنه
مو نوع عطوري المفضله بس عطوري المفضله محد يسألني عنهم
علقت على هذا وصج حلو
رحت وخميت  غيره  سرمد  مرمر  مزن  ديم

مزن اهوه التوب عندي ولوزيان
من عطورات مرمر 

ثااااااااابتتتتتتت "
1162861134568939520,KW," 
مادري اذا للحين في احد ماجرب هالحمر

الوان النود والمشمشي والوردي  كريمييين حيل  ثانيتين يصير ثابتين حيل مات  جميلين جدا جدا

 لما ينشفون ممكن يفتفتون اذا حكيتي شفايفج ع بعض
 ما يصير اكثر طبقات او اخلط الوان فوق بعض يكتلون

سعرهم ممتاز "
