id,dialect,text
1059414057743204352,EG, ياست الكل دا أنا بتعلم منكوا 
1059458675809640448,EG, ماعنديش مشكلة فى دا على فكرة
1059523357069266944,EG,"فرحة الفوز  حرقة دم جماهير حرس الحدود بتخلي الفرحة فرحتين 

الزمالك"
1059539057699635200,EG,"السيسي عايزين بلدكم تبقى ذات قيمة ولا ندور ع البطاطس 

الشعب ندور ع البطاطس طبعا"
1059547063418060800,EG, دا شرف ليا ياست الكل ميرسي على ذوقك وتحت أمرك فى اي وقت 
1059724091668742016,EG, أنا جزء من الذكور اللي فالمجتمع وبتأسف نيابة عنهم لأن اللي بيعمل كدا مابيبقاش له عين يتأسف
1059778441023754240,EG, اوعى تدفنوا  خليه يطلع 
1059791290471198848,EG,العادات والتقاليد لو غلط إنت مش مضطر تمشي عليها التيار لو ماشي فى طريق غلط إنت مش مضطر تمشي معاه الأغلبية لو بيقولوا اه وإنت شايف إن هو لأ  قول لأ إنت ربنا خلقلك دماغ علشان تقول اللي إنت شايفه مش علشان تقول زي الباقي
1059808851581648768,EG,دايما البطاطس بتكون ال   ممكن أفضلها عن الباستا او السوتيه مع ال  طبعا  لكن أعمل مقارنة بينها وبين تقدم البلد  ياخي أحا
1059862852574605184,EG,وبسأل نفسي كتير أنا الجاني ولا المجني عليه أنا اللي غدرت ولا إتغدر بيه أنا اللي سبت ولا إتسبت  طب لو إتسبت  كنت إتسبت ليه 
1060253917534134400,EG,وادي دجلة بيقدم كورة عالية فشخ والله العظيم  فريق السيكسي فوتبول السنه دي فالدوري 
1060273006344372224,EG,لو سمحتوا أنا أول مرة أكتب حاجة زي كدا واول مرة هاطلب منكوا تعملولي ريتويت  صاحبتي محتاجة عملية زرع كلى ومحتاجه متبرع بمقابل فصيلة دمه  والسن من  ل   صلواتكم ودعواتكم ليها
1060277780649296000,EG, حبيبي إنت مش هاتتبرع بالدم   انت هاتتبرع ب كلى  فاهمني 
1060287170626379776,EG, انا مش عايز دم  ركز فالتويت ياعم مالك 
1060901928098508800,EG,"ماضحكش عليكوا طول عمري فى ماتشات الأهلي فى افريقيا لا بشجعه ولا بشجع الفريق اللي ضده وبنسبة كبيرة مابتفرجش ع الماتش أصلا كوني زمالكاوي ومابهتمش غير بالزمالك بس المره دي حاسس إني متحمس للأهلي  مش هاشجعه بس عايزه هو اللي يكسب

افريقيالاسيادالقاره"
1061001137506209792,EG,"الفكرة مش فى إن الترجي كسب وعمل   دا طبيعي فالكورة وبيحصل كتير  بس أنا مشكلتي إن مش دا الإسكواد اللي يكسب الأهلي   صفر 

مبروك للترجي ويستاهل هو ومدربه الذكي الشاب ومش  للأهلي لإنه حتى مايستحقش الشكر

الترجيالاهلي"
1061004993212436352,EG,"خايف أقول إن الحكم ظلم الترجي فى بعض القرارات تفتكروا إني بقول كدا علشان زمالكاوي رغم إني فعلا من المرات القليلة اللي أبقى عايز الأهلي يكسب

الترجيالاهلي"
1061005715240820736,EG,"دا أسهل دوري أبطال افريقيا شوفته فى حياتي الأهلي ضيع أسهل بطوله فى تاريخه 

الترجيالاهلي"
1061006683554672640,EG,"الشناوي كوليبالي حسام عاشور ميدو جابر حمودي  حاليا ماينفعش يكملوا مع الأهلي

الترجيالاهلي"
1061020109404286976,EG,ولا يعلي فى عماير مصيرة مستقصده
1061028339681386368,EG,"إيه دا هو  دا تمن الجاكت ولا دا الكود 

دا الكود يافندم الجاكت ب  جنيه"
1061237046239547392,EG,حد يعرف موضوع الميدالية اللي الخطيب حطها فى جيبه دا ايه وليه 
1061237997348233216,EG, ياسيادة العميد والله أنا سؤالي فعلا بجد مقصدش بيه اي تريقه او هزار
1061241764718227584,EG, ياباشمهندس أنا بسأل عن السبب  ماحدش يعرف سبب اللي حصل لحد دلوقتي
1061242258643734400,EG, ايوا يعني حطها فى جيبه  السؤال هنا ليه 
1061282254436089984,EG,  شكرا على إهتمامك ياست الكل 
1061283647699984384,EG,فيه حد من أعضاء الإتحاد الأفريقي قال إن الميدالية اللي الخطيب حطها فى جيبه هي ميداليه فضيه بتاعت لاعب من الأهلي ماخدهاش  السرقة من التهم اللي ماينفعش نلقيها على بعض بدون إثبات او حتى للهزار دي سمعة ناس و فيه اولادهم واحفادهم بيقروا وبيسمعوا الكلام دا إتقوا الله
1061387082315296768,EG,بكبر فى نظر نفسي لما أتعرض لإغراء مادي او جنسي وبقدر أتحكم فى ذاتي وأقول لأ  رغم إن الموضوع صعب وبتبقى مضغوط وفيه مليون مبرر يخليك توافق بس بعد فترة هاتشوف نفسك قوي ونضيف وهاتحس إنك إنسان مش حيوان او بلا ضمير
1061541053151494016,EG,"كل سنه وإحنا طيبين 

اليومالعالميللعزاب"
1061542443395571584,EG, آمين يارب يا ايمو 
1061645381216493568,EG, واضح إن ابو العيال مزعلك شوية 
1061727265871015936,EG,صوتك مافيش أي شعب يقدر حبيبتي يوصفه 
1061730855318642816,EG, فيه واحده جامده تتكسف برضه 
1061732179737280384,EG, أحلى لوزه فالدنيا كلها ياست الكل 
1061746641466810368,EG,"النهارده روحت تجمع رابطة مانشيستر يونايتد وعملوا سحب وكسب وخدت جوايز وانا اصلا مش فالرابطة ولا نيلة بس كنت رايح مع إصحابي 

ديربيمانشستر"
1061896465767981056,EG, يابني إنت فاكر إني خدت عربية جاجوار 
1061896757397852160,EG, إهدي ياحبيبتي انا ماخدتش تلاجه يعني  دا ايس كاب والله 
1061897028253478784,EG, مش اوي كدا ياست الكل  دا انا حتى زمالكاوي 
1061913841456550016,EG,امنيهتريدهاتتحقق  فلسطين حره 
1061917823797211136,EG, يكفيني أقولك إني زمالكاوي علشان تعرفي أنا محظوظ ولا لأ 
1061918579807920000,EG, اه والنبي الله يسترك يالوزة 
1061920501373825024,EG, يبقى عمرك ماكنتي زمالكاوية الزمالكاوي حبه وتمسكه للزمالك بيزيد مع الهزايم مش العكس 
1061940435646595200,EG," امك لو مابتعرفش تطبخ هاتسبيها وتقعدي فى شقة لوحدك 

بلدك لو فقيرة وضعيفة هاتحاربي مع البلد اللي ضدها فالحرب 

جوزك لو حصله ضعف جنسي هاتخونيه مع حد تاني "
1061953376613814400,EG,والنبي ياخونا أخوكوا بقاله  سنه نفسه يعرف حرف ال ج بتلت نقط بيتكتب إزاي ع الموبايل 
1061955305263763584,EG, تفتكر انا بالغباء دا ياكوتش 
1061962810169671552,EG,  مش فى كله ياكوتش
1061966370219442176,EG, الله اكبر عليك يابني والله 
1061995012131602432,EG, اذا كنت انا مش مشترك  بس عامة استنى هاجبلك اسم البيد على الفيسبوك
1062080476649787392,EG,ليه غاده رجب مابتنزلش اغاني  البنت دي من أجمل وأحن الأصوات اللي مصر جبتها حقيقي
1062084657611706368,EG, ممكن يكون دا سبب من الأسباب  بس أكيد مش دا السبب الاوحد لإختفائها  لأن فيه فنانات كتير حالتها زيها وماختافوش
1062091548618305536,EG, ميرو ياحبيبتي  إنتي عربية فوقي
1062100661045772416,EG, بالعكس كلمة البنت دا توقير منها مش العكس  ولا إنتي تقصدي علشان هي كبيرة فالسن يعني 
1062103130312241152,EG,اللي بيشكي حاله لحاله 
1062103764369334400,EG,بتصعب عليا الناس اللي بتحاول تفهمني وبتتوقع ردود أفعالي ببقى عايز أقول لهم إن أمي وأبويا نفسهم لحد دلوقتي اقسم بالله مابيعرفوا يفهموني او يتوقعوا ردود أفعالي  لو بقيت كتاب مفتوح اللي رايح واللي جاي هايقراك
1062286443677184000,EG,لو مش هاحكي عنها أتكلم بس فى إيه  مين يستاهل بعد حبيبي أحكي عليه  
1062359792688250752,EG,"لو حبيت تعلم حد حاجه ماتعلموش بالكلام او بالوعظ  علموا بالمواقف المواقف عمرها مابتتنسي ومهما كانت قاسية فى وقتها بس بسببها هايتعلم عمره كله

يوماللطفالعالمي"
1062366170215530368,EG, يوووه هووو  يلا الله يرحمها بقى 
1062368349554925568,EG, وانا سامعه من عندي هنا اهو 
1062438364484382848,EG,يمكن أكون مش من الناس اللي بتسمع تامر حسني بإستمرار وبتستنى البوماته وكدا بس ع المستوى الشخصي بحترمه جدا ع المستوى المهني والإنساني  واحد بيألف وبيلحن وبينتج لنفسه وهو اللي بيغني واحد بيتعب وبيجتهد علشان يوصل لجمهوره ويفضل محافظ على صورته قدامهم  شابوه تامر حسني 
1062445526799605760,EG,القهوة الفرنساوي والقهوة بالبندق والقهوة الزيادة دوول بتوع العيال التوتو القهوة الساده و ع الريحه والمظبوطه هما بتوع الرجاله 
1062454058852720640,EG,فيه اي برامج ممكن ترجع الحاجه اللي على  الموبايل 
1062652193327714432,EG,إلا عيونك إنت دول بس اللي خدوني 
1062654135089000448,EG,النوتيلا  جرام ب  جنيه مكسوف أقولكوا إن أختي بتجيبها فى إيطاليا  جرام تقريبا ب  يورو
1062657716890537984,EG, ماحسبتيش تكاليف الشحن ياست الكل  اللي هي هاتبقى اغلى من الموتيلا نفسها 
1062659390338162816,EG, اللهم صلي ع النبي عليكي 
1062689715713925248,EG,معرفش ليه خبيت عليه 
1062722132705243136,EG,تخيل بقى  الجنه كلها هاتنكحك دا لو كل واحد باسك بس من بؤئك هاتبقى حامل فى نص ساعة  
1062722753768423424,EG, أنا واخد الموضوع بهزار ومعرفش اصلا مين الشيخ دا وقال كدا فعلا ولا لأ 
1062778808833589248,EG,هو دا ماسك ولا ال حاصلها قرصنه من   
1062791349269872640,EG, لا يا لوزة  سماح واحده بس 
1062807928011399168,EG, كفاية قر هايتعملي بلوك 
1063032853733298176,EG,"رسالتي للرجاله

لو بنت لمحتلك او حتى إعترفتلك بشكل مباشر او غير مباشر إنها بتحبك بس إنت مش حاسس من ناحيتها بنفس الإحساس ماتقولش فرصة وتتسلى بيها وفالأخر توجع قلبها وبرضة ماتكسرش خاطرها وتكسفها  حاول على قد ماتقدر تفهمها موقفك وفى نفس الوقت تكسبها صديقه ليك"
1063063765254594560,EG,وكتير بيشوفوها الناس مش واحده زي كل الناس  دي ملاك يا ناس 
1063144645239156736,EG, أسئله بسألهالك  عندك الجرأة تجاوبي عليها 
1049398337873563648,EG,أحب أشكر أمين شرطة قسم التحرير اللي خلاني أركن قدام القسم بكل صدر رحب وبشاشه لما لاقاني داخل عكس ومش لاقي مكان أركن 
1049399585020567552,EG, وعهد الله ولا اعرفه ولا يعرفني بس أنا بيبقى شكلي إبن ناس فتقريبا صعبت عليه والراجل طلع محترم 
1049403024265883648,EG,  بصراحة كل اللي عمله دا ماكنتش اديته جنبه بس عمو كان بيشتري حلويات من العبد وجبله علبة  بس الراجل ماطلبش حاجة الشهادة تتقال 
1049404805851082752,EG,ياتمر حنه ياتمر حنه خليتي بينا وبعدتي عنا 
1049405341811843200,EG,  تفتكر أنا لو كرمشت كنت هاخبي دا أنا ماحلتيش غير شوية ضمير صاحي نفسي اموتهم 
1049579684483264384,EG, إنتي واخده بالك إن لونك بيتغير مع مرور السنين 
1049580816823713792,EG, بغض النظر إنتي جميلة وبحبك 
1049647328620146816,EG,للمرة المليون الكدب جريمة مش مجرد خطية
1049662551397736448,EG,كل واحد يقولنا المعاكسة فى بلده عامله إزاي 
1049684003446513664,EG,حبيت الدنيا اللي بتضحكلي معاك على طول 
1049684586064740352,EG, دا كدا دا مؤدب ياست الكل 
1049689767653376000,EG, فكري فالموضوع بمنطقية أكتر ياروحي 
1049690685484490752,EG, ممكن صدف لكن إيه اللي ممكن يخلي الطريق يمشي لو هو واقف بالكلاكس لتاعك  إلا إذا بقى كلاكسك بيخرج طاقة غير مرئية بتزوء العربيات 
1049702763410673664,EG, دا عرض مش معاكسة 
1049703049575485440,EG, خلاص بقى يا مونيقاا مش ناقصة قر  إستحمي وتعالي عايزك
1049769935151554560,EG, مانا عارف بس بستعبط 
1050018426394222592,EG,"أسافر  وبعد ما سافر وارجع أسافر تاني ولما واروح أتغدى وأسافر تالت

شيتتمناهحاليا"
1050038206635347968,EG, نامي بس دلوقتي يا منى وبكرة نسافر أنا وإنتي وماما ونهى وكلنا 
1050038755975938048,EG,شو حلو حبيبي شو حلو 
1050050673545494400,EG, أحلى مون مون فالدنيا كلها 
1050071712308633600,EG,أنا لسه جاي من بره حد بس بيفهم كورة بغض النظر عن إنتمائه الكروي يقولي فعلا الأهلي كسب بجول اوفسايد 
1050076296368263168,EG, مانا دورت مالقتش  انا بثق فيكي  قولي
1050131184385236992,EG, تمام يعني لو لمست اوفاسيد مالمستش مش اوفسايد  صح كدا 
1050380416279031808,EG, إنتي يا مروة إنتي 
1050382187776872448,EG, كنتي بتهربي إزاي بقى يا مروة 
1050504489394991232,EG,أمي بتعزم على أي حد بيجلنا على إني أنزل اوصله بالعربية كأني شغال كابتن فى اوبر
1050668272847208448,EG,يخرب بيت عيونك يا عليا شو حلوين 
1050768513365872640,EG,الغريب إن بقى فيه ناس كتير على تويتر بتتاجر بالمرض والآلم علشان تلم فولورز للدرجة دي وصلنا للمرحلة دي 
1050873627980259200,EG,قلبي بيسألني عليك أتاريني بفكر فيك  معقوله أكون حبيت  
1051026932798803968,EG, فهميها إن الصليب اللي في إيدك وإيدها دا تاتو صور القديسين اللي بيدقوها على الدراع دي تاتو بس دا بيصنف تاتو ديني مش أكتر لكن فالأول وفالآخر يدرج تحت مسمى تاتوا
1051030044318081024,EG, حلو اوي الكلام دا كدا إنتي موقفك بيزيد قوة يا بندقة 
1051085788761510016,EG,طب وأنا يارب هي كريستينا أحلى مني فى إيه  
1051107903829106816,EG, اه إذا كان كدا ماشي
1051112694399557632,EG,"مين هنا من البنات قلبه مات ناو 

وركزوا فى موضوع مظبوط علشان لو بتشربيها زيادة تبقي بتحبي الدنيا "
1051113720456388608,EG, أحلى دماغ متكلفة ياكوتش 
1051230554518110208,EG,"فيه نظرية عظيمة من آلاف السنين بتقول نام بدري تصحى بدري

ماسمعناش عنها دي 

لا إزاي دي نظرية عظيمة "
1051231435355500416,EG, ياااه  وحشاني يا سوسو 
1051384386027999232,EG, كدا إنت ميته أصلا 
1051435473707720832,EG, لأ كدا بقيتي عبده موته 
1051602048733642752,EG, يارب تكوني دايما مبسوطة وفرحانة يا بندقة 
1051779383277641600,EG, كان فيه عصير زي بيست كدا بس أصغر شوية مش فاكر إسمه
1051794234267893760,EG, والله خايف اصدمك واقولك إن أنا أكبر منك بعدد كبير من السنين 
1051794848183975936,EG, حضرتي ايه يانونو  مش اوي كدا ياست الكل 
1051808591253045248,EG,هما مش هايطلعوا الهدوم الوسخة موضة 
1051811734145703936,EG, دا إنتي جاية القاهرة تتفسحي فالمترو بقى 
1051813094874329216,EG, ركز فى تمن الفول علشان كدا فيه حاجة غلط 
1051813659012419584,EG, انت بتقول ااساندوتش ب قرش  ولما غلي بقوا الإتنين بربع  ركز كدا فالحسبه دي شوية 
1051817762924969984,EG,"اوبااااا  دي كدا إحلويت اوي وزهزهت 

ربنا يخليكي يا جميلة  وعدتك مش هافضحك  "
1051848500542132224,EG, كان بيحصل كدا من  سنه تقريبا
1052119113466871808,EG,فيه لاعب أرجنتيني فالدوري الأمريكي إسمه           حرفيا مالوش حل ميكس بين ميسي ونيمار واجويرو وهازرد  حاجة كدا أبيحه معرفش إزاي مافيش فرق اوروبية إشتريته
1052122612468473984,EG, ياجدع حرام عليك فيه حاجات معينة كدا بتبان فاللاعب مهما كان بيلعب فين  إتفرج بس على أهدافه وإسلوب وطريقة لعبه وإنت هاتفهم إنه مكانه فى فرقة كبيرة  مش لازم من الخمس فرق الاوائل  بس ع الأقل مكان افضل من الدوري الأمريكي
1052139919840354432,EG,أنا عمري ماشوفت يوم التلات زي ما أغلب الناس بتشوفه يعني عادي بشوفه يوم زي اي يوم  كله خرا وبيعدي
1052155312730460160,EG, ايه يابت انا كلمتك 
1052158474036097024,EG, ياستي مافصحتهاش اهو انتي عرفتي هي مين  
1052250963875127168,EG, اهو صحي لقى نفسه فاضي قال يمدد قانون الطوارئ
1052494126355234816,EG,حاجتين بيخلوني أصحى وأنا مبسوط لما يكون فيه ماتش للزمالك او لبرشلونة وأنا عارف إني هاعرف اتفرج على الماتش  بقوم مبسوط وفايق رغم إني ماببقاش عارف هانام مبسوط برضة ولا الماتش منكد عليا
1052605774298578944,EG, ربنا معاكوا ياريس ويديكو صبر
1052870066977599616,EG,حد هنا بيفهم في كاميرات المراقبة 
1052912314897375232,EG,"كلو خميسه ويك إند إلا أنا ماعندي ويك إند  ليه بس كدا بس كدا بس 

الخميسالونيس"
1052965592226045952,EG," 

ممكن أتريق عليك يا باشمهندس  أصل أمي قالت لي ماتتريقش على حد علشان ماتبقاش زيه"
1053051153171312640,EG,بيقولك مصر ذكرت فالإنجيل  مره وفالقرآن  مرات وحالنا بالشكل دا  امال لو مكانتش إتذكرت خالص كان حصلنا إيه 
1053215050746466432,EG, معنى كدا ان أنا ميت بقى 
1053218039586582400,EG,الست لو عرفت إمتى تطلب الطلب من الراجل كان زمان  من المشاكل بين الطرفين ماحصلتش اصلا  الفكرة كلها فالتوقيتات مش أكتر
1053219036182528000,EG,مبسوط فشخ فالناس اللي النهاردة يوم أجازتهم وبيصحوا بدري  نيهاهاها 
1053233964083757056,EG,جربت حلاوة الرشيدي الميزان  
1053244136919326848,EG, مش كلهم والله يا اوس  بس اه فيه فيهم كتير نكديين مقدرش انكر دا 
1053265790760349568,EG,إيه أغرب أكله كلتها 
1053404385257144448,EG, ربنا ولا المحاضرة يا طه 
1053561224124882944,EG, لا نجاح بدون الله يا أخ عبده 
1053564940957741056,EG,أنا مبسوط إني مابقتش أتابع سياسة  صباح الخير
1053607690671255552,EG, طب روح اتفرج ع الماتش بقى 
1054355306606718976,EG,فيه ناس حرفيا بتبقى عايزه تعرف كل كبيرة وصغيرة فى حياتك  اللي هو لو إتنفست اوكسجين وخرجت  هاتبقى عايزه تعرف نسبة ال اللي خرج من جسمي قد إيه
1054355656743026816,EG,هي مش شركة بريزينتشن دي اللي وجهت الدوري للزمالك من  سنين ولا إيه 
1054460260323192832,EG,"كل ماهو تابع للدولة هو فاسد

بريزنتيشنبراالزمالك"
1054491117264232448,EG,"يافرج الله  مرتضى بقى ينفذ مطالب الجمهور ع السوشيال ميديا  لا لا أكيد فيه حاجة غلط 

بريزنتيشنبراالزمالك"
1054497190511546368,EG,"بيقولك فيه كلام كبير على إن شركة صلة هي اللي هاترعى نادي الزمالك بعد فسخ التعاقد مع الشركة اللي طبخت الدوري للزمالك فى  

بريزنتيشنبراالزمالك"
1054497797502844800,EG,"إمبارح كنا بنتكلم أنا و واحد صاحبي فى مين ممكن ياخد الدوري وفعلا قلت لأ الدوري السنة دي صعب ومقدرش اتوقع  بس بعد اللي حصل النهاردة أقدر أقول وبكل ثقة إن خلاص الدوري تم توجيهه رسميا

بريزنتيشنبراالزمالك"
1054498388467703808,EG,"ميدو يا جماعة دا حاجة كدا تحسوه إبن ناس بس صايع ومن التالتة يمين زيينا 

بريزنتيشنبراالزمالك"
1054498673923637248,EG,"بيقولك رئيس شركة أجهش بالبكاء  طلع جمهور الزمالك ركبه 

بريزنتيشنبراالزمالك"
1054502587427368960,EG,"اه يابلد فيكي التطبيل والتمثيل هو اللي ماشي

بريزنتيشنبراالزمالك
المباحثوفولورزرايقين"
1054727390327439360,EG,والنبي فهد العتيبي يعلق على أي ماتش للزمالك  واحشني منه إيه دا كله يا زمالك  زمالكاوي جمييييييييل 
1055081874568163200,EG,أخبار حلوة أوي بالنسبة لعقد الرعاية الجديد لنادي الزمالك  واحد صاحبي صحفي هو اللي قالي كدا بس مرضاش يقولي تفاصيل بس اللي فهمته إن فيه مفاجأت 
1055221180955799552,EG, ياريت والله المهم إن كيد النسا دا يجي بفوايد على الزمالك 
1055221327915876352,EG, زي الفيسبوك كدا بس بتاع روسيا
1055413771303354368,EG,"أنا بحب الجو المغيم بحب الهواء وجو الخريف و ورق الشجر اللي بيقع على شعري فالشارع  بحب شكل الشجر وهو ع الأرض شكل السما من غير شمس 

صباحالخميس"
1055482249343393792,EG,فيه اي بلد فالعالم بتقدم ميه السلطة مع الأكل زي مصر ولا دي حاجة  لمصر بس 
1055511208130883584,EG,ماتقولولنا أغرب شتايم سمعتوها خلونا نتعلم حاجة جديدة 
1056138340649582592,EG,ربنا مابيسبش لا اللي قلبه حلو ولا اللي قلبه وحش 
1056139042897780736,EG, العطايا دي بتاعت ربنا لكن ربنا دايما مع الكل و واقف مع الكل
1056220638166302848,EG,التويته بتاعت الشتا طلع ارجل من ابوكي وخلاكي تلبسي إبتدت تنتشر ع السوشيال ميديا وحاجة بسم الله ما شاء الله زفت
1056507717727281152,EG,إمبارح اول ماحسيت إن الجول فيه شك ماعرفتش افرح حتى الإعادة ماوضحتش صحة الجول من عدمه  ومارتحتش ولا حسيت بطعم الفوز غير بعد الماتش لما إتأكدت إن الجول صحيح   الحمدلله على نعمة الضمير الحمدلله على نعمة الزمالك 
