id,dialect,text
946796461492227968,PL,"هستأذن انا ي جماعه 
 ليش ما لسه بدري 
غصب عني والله مش طايئكوا"
947481032386805760,PL,هو انا ليش كل افكاري محتاجه فلوس 
947894727894012032,PL,"شايف الزكاء اللي في عنيا
اه
محتاج نقل لمخي"
947923170799079424,PL,"عرفت هتعمل ايه لو إجا السؤال بهادا الشكل 
اه 
وحتعمل ايه
حعيط"
948230271320690816,PL,اكتر تنين بتخانقو مع بعض هما اكتر تنين بيقدروش يستغنو عن بعض 
948230952093999232,PL,بتظبط المنبه  بتصحى  بترجع تنام  بتصحي 
948254746565062784,PL, احنا بنتهان حرفيا ف الفاينال 
948583880591732736,PL,الاسئله كلها بنص درجه اللي السؤال اللي مش عارفه عليه  درجه 
948584234255601664,PL,"وقتيش بتحس مستقبلك بيضيع 
لما واحد باللجنه يطلب من الدكتور ورقة اجابه تانيه وانا يدوب اللي حالو كلمتين ونص"
948592267253645184,PL,"مش بتدرس ليه
انا بحب زنقت ليلة لمتحان 
يبني ما بكره لمتحان
ايه "
948655271194349568,PL,انا بكون عارف الاجابه بس بعرفش الدخله تعتها اشو  
948937542883270784,PL,هي الناس كلها ما بتدرسوش بجد  ولا انتوا بتغفلوني وحرسب لوحدي 
927238562348662784,PL," هادا هبل لازم ابطلو لانو الوقت عم يضيع عفاضي 
قال يعني خايفين ننسى الاسم"
927271756225708032,PL,فكرة اني مشغول بالدرسه و انو ورايا دراسه اكتر من الي درستها  مخلياني مش قادر استمتع بالوقت الي بضيعه 
927273386581151616,PL, انا مش متأكد من حاجه انا مش دارس حاجه 
927627952195596416,PL,وفي علاقات صداقه بتضرب علاقات الحب بالجزمه 
927628359718310016,PL,في كل دار في واحد شاطر بس لو يشد حيلو
928146783934603264,PL,الناس اللي ما عليهش متحانات ايش مصحيكو 
928147984776335360,PL, هدول الكليات اللي بتريح طلابها 
928304879713517568,PL,"بكرا متحان وتأجل وفي كمان تلاته قبلو
لليش مغلبين حالكم وعملين جدول 
هل انتو جامعه ولا حضانه "
928348951706816384,PL,"بتحبك 
اه
بتنكد عليك
لا
يبقى مبتحبكش"
928349942040662016,PL, في ناس غبيه بدرجه 
928350520582049792,PL,انا مؤمن انو الناس فترات في حيات بعض  بس في ناس والله ما ينفعش تمشى من حياتنا 
928507701793120384,PL," يخي عبرو ايش بدك اكتر من هيك تلميح 
باركلو "
928521549824581632,PL,انا مش فاشل بس زي  
