id,dialect,text
1140627389267009536,LY,عزانا واحد يا خوي 
1140633353395289984,LY," منيش عارف 
لكن ازبرت وخلاص"
1140634290914549760,LY, انت مش عارف انك نور عينينا ولا ايه
1140736904738091008,LY, هههههه يستر الله كان ما الموز يكون زاعل وهوا ورا الموضوع
1140737155125383168,LY, حسابات ليبية واجد اتصكرت
1140737614540148736,LY, نبوا شوي جدية مش ديمة قطاف 
1140738286710902784,LY," 
عيب عليك الكلام اللي تقول فيه"
1140914138249596800,LY, ليلة كاملة واني انقنع في امي ان الدلاعة اللي جايبها مافيها شي اتقولي هذا اكيد دلاع سرت المداوي منيش واكلاته 
1140916842116132864,LY, حرام دولة زي مصر رئيسها السيسي والله
1140946599616634752,LY,  امس كتبت تغريدة على تعطيل حسابي تشمت فيها
1140947357909114752,LY, ماظني الا اريح حق
1140950402898256000,LY, ردلي الحساب من جديد يقعد عندك حولي كامل نص قبل ونص تو 
1140955690569228416,LY, والله يا كلب الموز اللي عندك ماعندي منا حاجة 
1140956591635779584,LY,مصدر رسمي يأكد أيضا تعطيل حساب عليعبداللطيف على الفيس بوك  
1141038388608458752,LY,علاش اجي شعور عدم الرغبة في اي شئ و اطير منه النية في الوقت الى قربت و تحصله او حصلته  والله ماني عارف  
1142369193117065216,LY,المصريين جو فستري واجد بكل  
1143213178047881216,LY, الناس مش كلهم زي بعضهم
1146312347780341760,LY,بعض من المجاملات و الوهم  
1146340963712983040,LY, بوشقمة فات شكير بمراحل
1147575767099936768,LY,يا كحلة  غيرصورتك الشخصية أرجوك على كم من مرة نقرا في كلامك نسحابك غير غسان سلامة وانوتي في شحة هكي كبرها بنرد في الأخير تطلع أنتليش عليك هكي  تاخد رايي حط صورة الصديق حفتر تتناسب أكثر مع شخصيتك 
1147900552203972608,LY,الناس قناعات وكل واحد حر في رأيه بس شخص مقتنع بفبراير ودعمها من الأول وتوا يبي حفتر فهذا غير منطقي وغير معقول وحالة مناقضة كل يوم حفتر يثبت إن مشروعه مضاد لفبراير ومسخرله دعم لا محدود من الدول المناهضة لفكرة الثورات زي السعودية والإمارات يعني كيف ايفكر صاحبنا هدا مش عارف 
