id,dialect,text
879122006754676736,LY, انت مش في رمضان اجازة 
879346202512416768,LY, واحد سأله شنو اول تجربه في حياتك قال لهم الكرة والحلقة
879361248885968896,LY,خليك عادي جدا علمتنيالحياه
879873177257746432,LY,النوم هذا تبيله حل
879894237957017600,LY, اهم شي خام بشدوق كم وصل
880085420004048896,LY, ههههههه قاعدت صامد لعند الثمانية في الصبح بعدها فقدت يعني اليوم صباحي  وتستمر المعاناه
880226419179216896,LY,حكام دول الخليج  العالم  كله سلم من شرهم الا المسلمين
880635182700797952,LY,بعد تحرروا جزركم  تحريرقطر
880638392173768704,LY,  هههههههه قالك لها سنتين
881357124776980480,LY,اعترفبحاجهبخاطرك  لاتقل كل شي
881902153958338560,LY, خضر من انت واصغير
881913982063345664,LY, أقصي حدهم متشي مليانه علفه للسعي لذلك يبعوا القضية بسرعه
881914510940024832,LY, حتي في حركة امتاع صبعين علامة النصر لكن تكون بالعرض مش بالطول مدوختني
881919541986635776,LY, اكيدة لما كنت في روضة المدرج الاخضر
881924532407324672,LY, ملامح وجك تدل انك كنت  ضاربها
882028304936685568,LY,  وما اكثر الصراصير فيها من إعلاميين ونخب ومطبليين
882074695000088576,LY,نسال الله ان يرزقك بواحد مثلك كلمهللييتدخلونبغيرهم
882088985325178880,LY, شن خذيت اليوم يا حسين
883677460944101376,LY, حلاق الاناقة عرفته ههههههههه
883811078618181632,LY, كل شي علي البركة
883811502901350400,LY, اعتقد انه يغطي علي قتلاه في بنغازي
883824566824562688,LY,ابرد راس من الفيس بوك قولشيتحبهبتويتر
884487442358833152,LY, اعتقد مغارة ال سعود مليانه رز
885139734024081408,LY, علي حسب نوع الاساءة وعلاقتنا بالمسئ
885654346423312384,LY, ما تبيش تكمل ههههههههههه
885916562867269632,LY, اول مره اشوف يهودي لابس دشداشة
886361235486363648,LY,نسال الله ان يغفر لك رسالهلغايبلنيقراها
887371824836882432,LY, ان شاء الله ربي يرزقنا بهذا اليوم
887372235773800448,LY, هو ضارب اثنين ويفكر في الثالثة وسايب الشعب فقير
887654218399715328,LY, اهم شي ما تنحاز لطرف علي طرف
887656998141079552,LY, البيجامات الي حكي عليهن بالك يوزعوهن في الاسواق العامة
887671722572435456,LY,  النظام السابق واخذين حقهم وتص الباطل اما ملف تاورغا كلها تجار بيه
887846089495388160,LY, شكلها الكفه بدأت ترجح ضد ال سعود
888021193382559744,LY,   مصطلح طلعوه السيسي قال حكام الخليج عندهم فلوس زي الرز
888474631157501952,LY, تخصص عرب مسلمين بس
889276421620846592,LY,امنيهتتمناهاتتحققلك ربي ينفس هم كل مهموم
890047608521203712,LY,  حتي بانكس ما تقدر اتقولها عليها
890170528266366976,LY,  حتي حطة صوابعه الثلاثه في الجمة وينزل شعره اشويه ما يصير منها
890594686058078208,LY, نص بالدحي ملفوف في شكارة مكرونة
890703483095199744,LY, يبي يكون في المظاهرة ولا غير يبز في اباري
890772973640196096,LY, يوتوا لقطيط سوقه ماشي علي الخبر
891089035518717952,LY,"يا الرايح وين مسافر تروح تعيا وتولي
شحال ندمو العباد الغافلين قبلك وقبلي"
891457181014425600,LY,  لاحظت في تقريرك واحد زقب السيارة من الرصيف ولا انا تهيالي
891662940427997184,LY," اعتقد 
يقصد حرب البسوس وداحس والغبراء"
892395264509714432,LY, المشكلة حتي خبز مش عارفين يطيبوه
892399639021973504,LY,  عنجد الإذاعة الي وراه
892558199546667008,LY,  البلاهة في وجه واضحة
892567622813986816,LY, انا خش عليا واحد قالي انت بلال والله معبي شولات شكله  يبي يكبهن
892912291141873664,LY, ما لهش حل والله
892913385825869824,LY, يارب حتي المشير مرابط الحوافر مش فاطنين لها
1078954356135915648,LY," صحيتي يا بنت الاجواد   

توا كان داروها في صالة مناسبات  ما علينا  لكن قهوة  ومختلطة هذي  جديده  ويخلن  الي ما يشتري يتفرج"
1110484585018736640,LY," القاضي  ليش قتلت زوجتك 
الزوج  دايره قناع في وجهها بالفواكه و العسل و الخيار وعليهن لبن وزبادي
و دايرتلي الغداء دحية مقلية 
القاضي  براءة
اللي على وجهها يدير عزومة"
1150197956324352000,LY, شن الغلط في الموضوع
848609488395526144,LY, معلق ثلاث دبورات في راسه شنو يطلع  عقيد ركن لقاق
849070399489028096,LY, بالهريسة وطماطم وماحدش يقولك كسرة
849145306629500928,LY, منهم فيهم  اصلا الضيف موظف عند المضيف
849402231480885248,LY,عادي كلمهلشخصخذلك
850339003954065408,LY, المشكلة اننا نعطي في الناس اكير من حجمهم
850500608851365888,LY,لا شي مافيخاطركقوله
851861750924406784,LY,  دخلت علي حسابه ما القيت الي انت  مصوره
852097441302183936,LY, الحلقة الرابعة عرضتوها  ام مازال
852160329727574016,LY, زعما يجيب غزل المحلة وبتروجيت يلعبوا السوبر في ليبيا
852534715559145472,LY, خوفي يجيك جن حافر  كيف تبي اتحزها معاه
852882556836077568,LY, قعد  ينافس في الناظوري في اشنبات
853285885776941056,LY, ربي يشف صدوركم فيهم
853575964370096128,LY, من احسن مدن ليبيا  ربي يحفظها ويحفظ هلها
853594326521307136,LY, ربي يحفظكم ياريتها عضاتك في وذنك
854091619527786496,LY, هههههههههههههه زمان جاري يخوط علي المصري البناي عشان ياخذ منه لفه سلك قالي أوتار مش عاديات
854279677812375552,LY, الجنة ان شاء الله
854408988091461632,LY, السنة شكلها عجاج واجد المحروسة
854698523161485312,LY, كنه حاط صورته  مكشف بروحه
854784278663766016,LY,معلومهعنحبيبك في قبره
854960931125829632,LY,  ربي يحفظ درنها وهلها
855003886591119360,LY,  ايدوروا في واحد يسطي لهم  عجل 
855416089148313600,LY, ههههههههه بالك المقصود بيها الجنون  مش الحيوان
855416217129164800,LY, كونه منكلب علي جماعة  امشرق منكلب
855654821495439360,LY, ان شاء الله ربي يشفيها ويمتعها بالصحة والعافية
855712958940418048,LY, انتوا خليتوا فيها  اخوة او محبة
855728750666887168,LY, ربي يفرجها ان شاء الله
855845049246117888,LY, والله نفس الشعور بعد شفت المقطع
856234560400621568,LY, بعد قرب النهائي نط  كويلر قال لا مربع ذهبي
856264957192806400,LY, كان تعطيه زنقيرة تقعد لك تهمة سياسية
856265160792649728,LY, ما يصيرش منا يلعب باصة
856795167969423360,LY, ما قدر يتحمل شكله ريحته طيبه
856796891773886464,LY, حاج وذيب ما يصرش منها 
856810842024792064,LY, يا ميه مرحبا شنو حالك وين الغيبة هذه
856811178852536320,LY, ان شاء الله ساهلة
856811934485803008,LY, دفع الله ما كان أعظم
856903504904028160,LY,قولحاجهبتويتر حاجه بتويتر
856951459727986688,LY, اخزاهم الله ال معيز
857141663030026240,LY, ملك ياخذ السفينة غصبا
857544519566413824,LY,  انا اول مرة اسمع بيها
857546702840049664,LY, ليبيا ما خربها الا حكام الخليج وليس ايران
857558466432561152,LY,  الامارات محسوبة علي دول خليج شئت ام اييت
857566242177257472,LY, احسن شي الحرف بالإنجليزي يكتبوه
857704205309677568,LY, في الي ذيل ما عندك ما ادير له
857708624961052672,LY, من حطوا علي المحروسة
857716355876966400,LY,  المشكلة بعد يكون الواحد فهمه سطحي
857725966705205248,LY,  مشاء الله ربي يحفظهن ويحفظ اهلنا في درنة
858067333692182528,LY, زمان حلم حياتي اندير كروسة لكن ما حصلتش فرشيلة ههههههههههه
858071040282558464,LY, كلاب اخزاهم الله يجي اليوم الي تاخذ فيه حقك منهم
858430840820379648,LY, الحقني يا حليب السعودية الزموا بيوتكم توا فتنة
858580123695665152,LY, اكيد الا من رحم الله
858986911716839424,LY, ايران ونظام ملاللي  لم يقتلوا الليبين والمصريين   ما قتلهم الا الرز الخليجي
859026275377217536,LY,  السعودية لها دور في الرز بس
859128278707298304,LY,  من يحارب فينا حكام دول الخليج
859128939914121216,LY, انا لعند داري حظر كنت طايح له مقص
859148975907250176,LY, الله يغنينا عن رزكم  صحتين وهنا علي قلوبكم
859178273355567104,LY, علي الخبر مع جبرلو
859335604978548736,LY,مسكين حديثمحمدبنسلمان
859347957438705664,LY, شفت كيف بتكلم وجعني والله ما يندري عليها وين تفتح اللقاء في الليل توا نحضري
859348568624246784,LY, جايتني عليهم الايام هذه
859366473734684672,LY, اول مرة نسمع بيه شنو يطلع هذا
859404152232923136,LY, انت الخيرة والبركة بالك الكنتيرة  أتخوف
859636275409801216,LY, خليك منه  باذن الله الدنيا تبرم بيهم ويردوا علي المعيز
859636506981433344,LY, الغريب انهم قلبا وقالبا مع الثورة المضادة حتي حثالاتهم
859717546727133184,LY, احسن شي في البراك بعد ادير بيه نص
859718651733307392,LY, حلوتها ما حد يقولك كسرة سلملي وخلاص
859720717260161024,LY, ماجد لعبة خشبية السراح
859729526053646336,LY,  هولاء اقصي حدهم تغريدات اذكار  الصباح والمساء
859735034932187136,LY, يارب انت أقوي وأقدر واكبر
859864261446836224,LY, هذا شنو قصته  حسابه كله شور ليبيا
859870141642928128,LY,  وواطين عليه الفرس محتلين بلاده
860141285763579904,LY, حذفوا ليبيا من القسم امتاعهم
860189827333062656,LY,  ياريت اميرك يقدر يولع عود كبريت اتجاه ايران   الله يرحم صدام الوحيد الي كان قدها
860197544000933888,LY, صدام ماسك محور برج خليفة
860357798806335488,LY, وعليكم السلام متيسرة باذن الله
860495079173222400,LY, عندك انور مالك ضارب الحوله بكل ما اتقول يعرفنا  ولا في ليببا ومصر ماسك خط ايران السعوديه  شغل ليه لهو  يضرب في الرز ومافي واحد يقدر ينتقده
860555100858843136,LY, معش تسمع في الكلام  قعدت 
860595699586674688,LY,  لا حول ولا قوة الا بالله الله يرحم الجميع
860596431190712320,LY, حتي انا مرات نسمعها ومرات لا
860603178294923264,LY, حاطينهم فوق التلاجة ولا تحت الدولاب
860608506222825472,LY, ما عينتش والله اول مره نسمعها
860613050050777088,LY, الي تقهر ما حد يندري عليهم  ما محصلين شي
860615072237981696,LY, امتاع شربه حتي  هو امتاع عواطف عقاب الليل
860770149246394368,LY,  ما فهمتش مش درنة محاصرة ليش محتفلين
860772244213125120,LY,  جت عمتك  سرقيوة قربعت الموضوع
860844922710224896,LY, يارب يرزقك  حجة وعمرة
860970432832434176,LY, انا هذا يمكن سادس رمضان
860971111663759360,LY, خيك حده شاي خضرة ودحي
861208172505292800,LY,  اجبن من يولعوا عود كبريت اتجاه جزرهم  المحتلة
861291922782121984,LY, عنجد الي حاط مفتاح دولاب المطبخ في رقبته
861436959541035008,LY, احسن شي صاحبنا مطبقها محافظ عليها
861584582382112768,LY, ان شاء الله في صناديق لوح يروحوا
861609660578762752,LY,  لا مش خوتي كان شي خونك انت
861911530413150208,LY, قالك الحوافر ماسكين واحد داير مسك شالوه  للأمر  امتاعهم قالوا له مسكنه واحد بنته جامع
862417494958645248,LY,يتعدلالمزاجاذا سمعت الله يربحك
862624551817142272,LY,            وين طلعت  الزهران مش معاهم
862782794535186432,LY, المشكلة شاعر اجرب لاوراه ولا قدامه لقاقه زائدة
1001306739269165056,LY,  طول عمرك   ح تتجوز يعني و لا لسه 
1009981975992635392,LY, انت اللي خليك واقعي في مونديال البرازيل  وصل للمباراة النهائية و خسرو قدام ألمانيا و وصل مع منتخب الارجنتين لنهائي مووبا امريكا مرتين كيف ما يعرف يلعب مع المنتخب  ولا نقزوهم تنقيز للمباراة النهائية
1032245801555247232,LY,يا لبنية يا لبنية و يا لوليد يالوليد يا للي لبستو كل جديد يا لبنية و يا لوليد مبروك عليكم هالعيد يا لبنيه و يا لوليد
1069341176703188992,LY,اظلمك يالعين عزيز وبسكاتك ظلمتي خاطري
1071507146838302848,LY, السترات الصفراء يطالبون بالعدالة الإجتماعية
1072600374270398464,LY, انا مش شوري مغرد بيه للتسليه
1118786338315210752,LY, يا بنتي إرضاء الناس غايه لا تدرك كل واحد حر ف صفحته شن يكتب فيها جماعة يا معاي يا ضدي كاثرين هالايام
1118925048029560832,LY,الواحد هالايام يقول  خيرا او يصمت  احسن له
1121064517822230400,LY, لما واحد يقعد ف مدينته و قليل السفر يسمع سمع من الناس ولا يشوف التلفزيون تتكون عنده فكره غلط ننصح الشباب كل ما يحصلو فرصه و فضوه يشرقو و يغربو و يمشو شور الجنوب بعدها عالاقل يراعو ظروف كل مدينة ومنطقه مش كل واحد مندمر ف الجلوه بتاعه يسب و يشتم عالفيس و تويتر
1122648411306692608,LY, في اللي مقتنع قناعة و في اللي عناد و تسكير راس
1124405392732299264,LY, هلت ليه ليه  ربي يحفظه
1124409858130947968,LY, بالتوفيق كان ناويه خير
1125144829137170432,LY, ينعاد عليك بالخير و الهني إن شاء الله 
1125314838060773376,LY, تعيشي و تشوفي هوليود  ينعاد عليك بالخير و الهني إن شاء الله
1132202264372944768,LY, مسكر ع  و خاش عال  يا عيل 
1133732153244692352,LY, واجعك حال الصياع اللي يضحكو علي بنات الناس و خايفة عليهم ياخذو منهن غايتهم اللي هي في الاغلب نزوات جنسية و يفوتوهن وفي اللي بنت بيتيه محترمه يخلوها تنحرف ياما ضحكو على بنات ناس و مشو تزوجوا غير اللي كانوا يواعدو فيهن يا داير يا لاقي و كل واحد علي قيس نيته ربي يعطيه في آية يتبع
1133737656175742976,LY, يندمرو في التراكين وين ما يخطمن بنات الناس و يقولو نبو نصطادو فريسة قصدهم بالفريسة البنت ينظرولها نظرة شهوانية حيوانية تلقيه مداير وريقات كاتب عليها ارقامه و اللي تجي تخطم يعزقلها وريقة فيها ارقامه و يروح كان ما رن تلفونه يقول ما شدت و يعاود بكره نفس الموال هذا خاطي موال الجامعات
1133739174698344448,LY, و تجي اطلعيهم ملايكة و تقولي سحر ما سحر بسبوسة ما بسبوسة العرب الأوله قالو  ما ادخل ايدك ف الدغاريق ما يلدغوك العقارب و اللي ما يدير شي ما يجيه شي يضحك عالاولي و الثانية و الثالثة لين يطيح ف بنت حرام توريه جنس حوا شن شكله
1148103589132480384,LY,  ما دام الصبح الحافلات يكلكسن ف الشوارع بعدها يطلعن يجارن و يقربعن البيبان وراهن و يركبن يمشن للجامعات و يقرن عادي بعد فترة نلقو ليبية في منصب الصديق الكبير و لا مصطفي صنع الله  كلا البنات الحق عندهن صبر و وسعة بال للقراية شي طبيعي يحصلن شهايد و يخدمن ف الدولة
1148107091091103616,LY,زمان لما كنت مراهق نقول في نفسي لما نوصل ل  نتزوج بعد وصلت ال  لقيت الحكاية مش ساهلة زي ما كنت متوقع بعدها قلت ع  نتزوج بالكثير ع  نوعي علي روحي امس خاش  حتي خطوبة مش خاطب هذا اللي يقولك العمر يجري
1150863277876006784,LY, في المحصلة ما في حد عنده سلطة خارج كتيب العايلة بتاعه سوي كان متحرر و لا متزمت هي طالعه من حوش هلها راسها عريان ولا متحجبه لابسه عباية و لا عارضه ما عطاها ربي برا بوها و خوتها ما اعترضو شن يقدر يدير البراني يعني غير الدوا
1150866596094730240,LY,وفي اللي متحرر و متعصب ما يعجبه بنات الناس اللي يلبسن في العبايات و اللي يتخمرن و يتهم فيهن انهن تحت لحت و يتسترن بالخمار والله وحده اعلم بالنوايا 
1153478084177334272,LY,  موقفهم ف اللحظة هذيك وعدم استسلامهم رغم عدم تكافؤ القوة شجاع حتي بعض اعدائهم اللي ما عندهم فجور ف الخصومة اعترفوا بفرسنتهم بغض النظر إن صدام حسين كان يحكم بالحديد و النار و أولاده عايشين ف بذخ و عز و دايرين عبيتر شين ف العراقيين لكن لحظة الحقيقة بانو ف الميدان و دفعو الثمن  قصدي
1153479964731281408,LY,  الحكاية مش انبطاح و لقاقة زي ما تفضلت حضرتك لكن علي حسب الموقف تحكم هذا اللي يقولك الرجولة مواقف و اللي ما يتقرع للتريس ما هو راجل و المتنبي يقول إذا كان من الموت بد  فمن العار أن تموت جبانا ف الاخير بكل اللي يموت علي مبداه سوي صح و لا غلط خير من المتلون اللي كل مره يغير طارقه
1154475535772397568,LY,اقرا يا قاري ف اللب الخالي
1154800613559021568,LY,الدراوشه اللي عندنا حارقين دمهم شادينها تخربيش من امس علي خاطر تونس تي اشقو بهمكم
1155271660678914048,LY, يوم تخرجي ف الجامعة نضت الصبح اول بدلة عربية و فرملة لقيتهن معلقات لبستهن وجهي مش محلق و شعري شبه مطنش خشيت الجامعة و ناقشت و لا عدلت علي حد و اللي ينشدني نعطيه إبتسامة و كان كثر النقان نقوله مش حاسب فيها حد و من هذاك اليوم لعند توا كاسر الروتين و اللي يريحني نلبسه
1155282176533024768,LY,  نتفق مع الاخوة اللي قالوا إن أحد الأسباب هو العلمانية المتطرفة مثلا نذكر زمان جابو ف نشرة الأخبار عال  أيام نيكول تنوري و محمد عون جايبين خبر إن في عهد بن علي منعو مضيفة طيران من ارتداء الحجاب ف العمل و صارت ضجة و قضية رأي عام
1155385795601215488,LY, الموال بتاع حقوق المرأة هذا قد ماله يزيد ع تويتر عندنا مش عارف الفيمينس ولا شنو يسمو فيهن واخذات الموضوع بجدية و عندهن افكار و بيأسسن منظمات و يوعن المجتمع و يحاولن يساعدن المظلومات و يكافحن ع خاطر قضيتهن ولا متأثرات بجو معين ولا موضة هالايام ولا معاش لقن موضوع يهدرزن فيه
1156106426265288704,LY, صباح النور يا وجه الغمه  
1156204665387855872,LY, كيف صار مش جامعة سبها ف الترتيب الثاني  
1156208519168897024,LY,جامعة سبها فخر فزان جاءت في الترتيب الثاني بعد جامعة بنغازي متفوقة بذلك علي جامعتي طرابلس و مصراتة لعام   الشباب اللي من الجنوب ماشين  للشمال عشان يقرو  تي روح انت وياه وفرو المصروف  
1156325374160248832,LY,  هو بالنسبة للبنت معذورة لأسباب إجتماعية كلنا نعرفها لكن عالاقل من وجهة نظري انها تكتب اسمها الاول وكان ما فيش ضرر تكتب فلانة بنت فلان أما الولد شن عذره يتستر ورا اسم وصورة مستعارة و بالنسبة للنشطاءت و الحقوقيينت  نعذروهم لأنهم مهددين بالخطر
1156633543763800064,LY, ربي يحفظه و يعطيه الصحه
1156825855970152448,LY, ف ميزان حسناتك إن شاء الله
1156834571624861696,LY, صباح الصبح المصبح الصبوح
1157651588716142592,LY,غير يردو اللي تهجرو بعد  
1158963206053912576,LY, دايرتله خطين كتيبه امالا 
1159632299530625024,LY, مش عارف من وين زارقه علينا الفترة هذي ف اوقات نحسابك تحكي عن السعوديات مش الليبيات في إنتهاكات و حقوق مهضومة بس مش للدرجه اللي تصوري فيها في قصص تحكي فيها قليل ما تحصل او تصير في بيئة محدودة ولا نطاق جغرافي معين وما ترتقي لمستوي إنها تكون ظاهرة المجتمع مش يوتوبيا بس مش ديستوبيا
1161397440899100672,LY, و كنك ما تعافر معاه و تغلبه
1161403441471733760,LY,رسم ابداع حطيته خلفية لشاشة تلفوني  هذا اللي يقول نرسم  
1161742852856197120,LY,  قولتك تقتل الروح اللي ف بطنها بالاجهاض و لا شنو
1161750122298073088,LY,  يقتلوها و لا تقتل روح برية ما تصلح الخطأ بخطأ أكبر
1161754929117171712,LY,  حسب عرفهم يتصرفو و بالنسبة للدين أظن الآية واضحة الجلد للزاني و الزانية اللي مش متزوجين و المتزوجين الرجم و القانون الجنائي الحبس  انا مش متحامل عالبنت زي ما إنتي متصوره بس ضد قتل الجنين اللي ف بطنها مثلا لو اجهضت خوفا من إن اهلها يقتلوها ح يعرفو عاجلا ام آجلا بعد يجيها قسمها
1161756749780664320,LY, لدرجة الناس فقدوا الثقة ف المستشفى العام و شادينها ف جرة العيادات الخاصة و اللي اموره مبحبحه يطلع للخارج مع إن نفس الأطقم الطبية اللي ف المستشفيات العامة يشتغلو ف العيادات الخاصة بس الفرق ف المعدات و التجهيزات الطبية مش الدكاترة غير أكفاء و ما ينفعو زي ما يقولو
1161761991192653824,LY,  الطرف الثاني يتحمل المسؤولية يدير عملته و يكرس ولا يهرب ف احسن الظروف يتزوجها مجتمعاتنا البنت هيا اللي تفقد عذريتها وتتعب وتحمل وكلام الناس وفوق هذا كله دمها هي اللي يهدر عشان يغسلو شرف العيلة و كان رحموها يتبرو منها فوق كل هالعذاب تبوها تقتل و ترفع رقبه ف الآخرة و تقابل ربها 
1162376272485527552,LY,النوعية هذي ما ينعزمو علي لحم العيد  
