id,dialect,text
1081329333728350208,BH,"دآمك اخترت البـعد مني 
أجل ذوق الفرقا من غيري"
1081655696553361408,BH, لانه الناس مقامات اختي  فمن جذي اللي يبوق يبوق من شخص  ممـيز  الله يسعدج
1081659262500262016,BH,"لا تقرب من شخص تعرف انـه 
نهـاية علاقتك معاه بيخونك  "
1081659731557543936,BH,"كل مـا جيت لـ ذاك المـكان 
ألقى الصـده من قلبي لان لقـانـا فيه  "
1082391283182850048,BH,"لا عمري راح ولا عمرك راح 
بس انت مشيت بدرب السهل 
وانا مشيـت بـدرب الصـعاب "
1082407149223972864,BH,"اللي يحسب إنا نعزه لجل شي 
كل شي بالدنيا ترانا خذيناه "
1082407303314321408,BH,"وإن عافني شخص وجازله غيري
ف انا قد الغياب اللي بلا رجعه"
1082408364276109184,BH,"اقول لـ ذاك البعيد اللي مقفي 
لا رضيت بغيابك شريك وانا معاك 
ولا رضيت بحضورك شريك وانا بدونك 
يا كامل الاوصاف  "
1082408975050727424,BH, خله ايي يغسل موتري بس 
1082410736872230784,BH, ولا وش شورك يا بعد حي
1082414092441305216,BH,"يا قدييمي ويا در الثمين وينك
كم لي وانا احتري اتصالك "
1082415199225823232,BH, الحين البنت تبغي واحد مثل اللي تشوفه فالمسلسلات التركية  يتحجه وستايله وشكله تركي غير جذي مافي 
1082434143156342784,BH,"في زمن كان حبيبك يعتبرك غالي بالنسبة له
واليوم الغالي صار رخيص وباع حبيبه "
1082435665441316864,BH,"أغروك الناس بـ كلامهم وقولهم عن كرهك لحبيبك 
فرقوك عن اللي شاريك وضحى بحياته لك ارتحت من عقب فرقاك لحبيبك "
1083080836872851584,BH,"طالبك لا نسنس النسناس ليلة قمرا
اذكر اللي حال من دونه ودونك حظه "
1083081240864083968,BH,"من كان له حظ في دنياك يا حظه
يا واحد ماتت حظوظي على بابه "
1083082190827806848,BH,"لا تعذر بالظروف اللي تحدك 
لو نويت الوصل بتحد الظروف"
1083082647742701568,BH,"مرحوم ياللي عليك الدمع منثور
وحشة غيابك لليوم بالقلب حيه"
1083082878035087360,BH,"اللي فقد له من صدوف الزمن غالي
اصبح وريث الحزن والحال يرثاله "
1083083714706460800,BH,"ذكرى السنين و غيبتك و اخر الليل 
تجرح مشاعر و احدن مشتحنن لك "
1083084268715290624,BH,"من تعلق شف قلبه على الشي القديم
والله ان يبطي وقلبه معلق بالهوى"
1083085473034186752,BH,"سايق  روحي على شوفك ظما 
من هجير الشوق طاويها هيام "
1083095930092568576,BH,"إما تجي الجيه اللي ما وراها وداع 
ولا على الفرقى اللي ما وراها مجي"
1083096113916333952,BH,"اعذرني ان خاب ظنك ياسمو الضمير
بغت تزين الظروف   وغيرت رايها "
1083096762380886016,BH,"وجودي على اللي ماتهيأ على مشهاي
عليه الحسوف تجر روحي وتوجعها "
1083104703360176000,BH,"كنت اداري قلبي وابشره بالعوض 
لكن الحين والله م عاد تفرق معاي "
1083122587914387584,BH,"ماتدري كم لي وانا احتري هاليوم  
يوم اللقى والصدف يا اجمل خلايا القدر"
1083136089106378752,BH,"حافظت عليك وتعنيـت لي بابك 
بس ما لقيـت منـك إلا الصده والنكران "
1083516065479618560,BH,"طوينا سجلات كثيره عشان نعيش
ما ندري إن سجلات المقادير تطوينا "
1083516133033037824,BH,"الله يزيدك داخلي ياحضرة العمر السعيد 
والله يكفينـا   من عيون العباد وفـالها"
1083516449572950016,BH,"صدوف الليالي مابها يمكن و بعدين 
وسنين العمر ماهي على كيف راعيها"
1083516847528525824,BH,"يـاحي ذا الطلة ويـاحي عينك
انا اشهد انك عزوتي لاتعزويت"
1083518045774065664,BH,"انا والله من كثر حبي لك 
اسابق روحي على شوفتك "
1083518464705347584,BH,"يا معودني على الحيـاة 
وينك قطعت الجيـات"
1083519794048045056,BH,"عزاي اني وفيـت لك وعزاي اني احبك 
ولا اني هقيـت منك الطعون والنكران "
1083840411658055552,BH,"فرحة يـم لقيـتها صعـبة وصفها 
لكن ما هقيت الفرحة وراها فرقا "
1083841247008166016,BH,"انا قدام الناس ابتسم  واضحك  واسولف 
لكن يعلم الله بداخلي من ضيقة الصدر "
1083842949971087360,BH,"انا اكثر إنسان جرح نفسه بنفسه 
بعد ما عطيت قلبي ووفيت بكلامي 
لقيت منه الجحود والطعون "
1084777749531803648,BH,"مهما كنت تقول وتحب اللي تحبه 
اذا ما عطاك قلبه لو تجيب له 
كنز ما راح يحبك دامك مب بقلبه "
1084777982626017152,BH,"لا جيت ادواي جرحك دواه ولا تجي 
وتحب فوق جرحك حب جديد وتنجرح "
1084778667199422464,BH,"لا تسلم قلبك وعمرك لشخص 
ونت داري كثر زلاته راح يبعد عنك "
1084909919390834816,BH,"رجعت لـحبيبك بعد ما طلبت البعد منه 
واستحليـت ضحكتك لغيري وانا ما خبرتك 
ما راح تلقى الوفآ وصدق الشعور من غيري 
ما عاد لك مكان عندي خلك بدربك وانا بدربي عايش سعيد  "
1084913119636410368,BH,"من اول لقى اعتبرتك الدر الثمين 
وما هقيت بأن الثمين باع قدره 
وصار رخيص"
1085459760252637184,BH,"وينه اللي كنت اكيـف يومي على طاريه 
كنت احسبه من اللي يدومون لحبيبـه  "
1085611784143277952,BH,"لا اني جيتك وطلبت حبك ولا اني جيتك وطلبت فرقاك 
انت بنفسك جيت وحبيت ومن نفسك جيت وطلبت الفراق 
لا اني بموت بوجودك ولاني بفقدك من غيابك 
خلك على ما انت والباب يوسع الجمل "
1085635094331752448,BH,"متى اللقى
ويرتاح القلب"
1085635313790316416,BH,"بعدك ماخلاك قدرك يجينا
ولا ماودك بـاللقى خلاص"
1085635590400458752,BH,"ألف يمين وألقى لك شبيه 
ولا لفيت يسـار ألقى ضيـك"
1085999547363586048,BH,"ابتسم لا شعوريا لا جتني 
مع نسايم الهوى مراسيلك "
1085999700065611776,BH,"يا محلاه من شعور اللي يجيب طاريك 
هسـه شنهو بعد هالشعور ماظنتي اعوفك "
1086000249011884032,BH,"لاعدمني الشوق ولا شوفتك 
ولا عدمتني الحياة منك يا كل كوني "
1086001916495216640,BH,"انا من كثر ماكنت احبك عميت عيني   
بأني اناظر غيرك وحتى عذاريبك عشقتها "
1086002727849738240,BH,"لا تهنيت بـ عمري ولا تهنـيت بـ زماني 
يامعذبني بالحب وش اللي جاك من الجفا"
1086007682660777984,BH,"شفنا وعفنا   والتجارب تخليك
ماتحزن لـ مقفي ولاتفرح لـ جاي "
1086008569596702848,BH,"كان عادك تحسب اني في رجاك اتعود 
ف اي خبرك ذا قديم و اي ظنك مخطي "
1086009229738196992,BH,"ما الله خلقني للحب واحب لاني افقد اللي اشتريه 
لكن الله خلقني بأني اسعد اللي حولي دايما "
1086009362051727360,BH,"مابين برد الشتاء والوقت وسكاتك
ضلوع صدري هبوب الليل يطرقها"
1086414232294510592,BH,"لاتعاتبني لما اعاتبك ماهو عتاب مني 
اهو اني زدت في حبك وصار وجودك مهم "
1086414761246507008,BH,"لما كنت احبك وامشي ورا دروبك 
كنت اقدر كل شيء منك حتى عذاريبك "
1086423282029682816,BH,"سيــر علينا يا رآعي الكيـف 
ولو باتصالك طمن رآعيـك"
1086436455801651200,BH,"محد ماخذن فكري غيرك يا وليفي 
 لاهب البراد بـليالي الشتاء يجيني طاريك"
1086436883171811200,BH,"انا ثقيل قدام الناس ولايهزني حد منهم 
لكن لما اشوفك قبالي لا شعوريا ابتسم "
1087081516432351232,BH,"يخـآبر ذاك القلب اني على دربه اتعنى 
وآخابر انه قلبه ما يطاوعه يبعد عن دربي  "
1087090827728506752,BH,"جحد حبيب القلب بعد ما رفع من قدره 
وخابت الظنون فيه ولا عاد القلب لـه قدر يطيقه "
1087780159560798208,BH, اهو التعود والتغير بس  اهو دآري انك متعود عليه ويدري انه متغير ومزاجي بس السالفة عنده عناد ومناحس
1087781801995784192,BH, كل وحده مكمله للثانية تحصلها ورا بعض من شخص واحد انت تعزه وتغليه وتقدره بس تخبر الناس مب مثل اول تتغير معادنها في ثواني
1087782993601744768,BH,"ياكثر الجروح والطعنات منك 
ماهقيتها منك ظنيت ألقى فرحة منك "
1087796605410004992,BH, لما يكون ناشب لي وانا كلش مب فاضي له
1088027618593640448,BH,"انا معك بالدروب الا دروب الوداع
لا تذوق النفس شي مابعد ذاقته "
1088027772226818048,BH,ذكرياك مارض مثلك  غغيب 
1088097651768377216,BH, اخوي لو سمحت بس مكآفأة التفوق متى تنزل الله يسعدك 
1088588046554071040,BH,"كنت على نيتي وآفـي لك بالحب والوعود 
احجبك عن الناس وحافظ غلاتك بـالصون 
ماهقيت انك ترد المحبة بالطعون والجفا "
1089173125349167232,BH,"ان كنت باقي على وعودك ولك جيـة 
فـانا احتريك وانا على الوعد ببقى لك "
1089173673033040000,BH,ليت اسرق من زماني الدقايق اللي اجمعتني فيك  يانعيم الصدف وتبقى مع اللي شاريك ولا تبعدك الظروف 
1089174316166582400,BH, طول عمره الوداع كان للأبد مع الاسف محد خرب القلوب الا هالوداع
