id,dialect,text
1158008173200064512,LY,"بالنسبة لكيفية حساب كمية لمية حسب وزن الجسم تقدروا تحسبوها من خلال عملية حسابية بسيطة جدا اللي هي 
الوزن بالكيلوجرام  الكمية باللتر
مثلا
  
يعني  لتر الا شوية

وعلى فكرة بالنسبة للناس اللي تمارس في رياضة حتزيد كمية لمية لأنها كتعويض للي فقداته خلال الرياضة"
1158009178537037824,LY,"الحاجة الجميلة اللي عجبتني في التطبيق إنه لما نوصل للهدف المطلوب ايديرلي حفلة وألوان وقصاصات 
يعني هي حاجة بسيطة بس تحسسك بالإنجاز وعلى مستوى شخصي وجسدي 

هاهو حاجة تغير الروتين وتخليك تفكري بطريقة صحية أكثر وتحافظي علي صحة جسمك وبشرتك

وبس  "
1158010670446776320,LY,"  على حسب كلام دكتور زمان في قسمنا قال إن السكر البني خاصة لو كان مش مغشوش أقل في الحلاوة من السكر العادي وطعمته اللي قريبة من الكراميل تقنع وتغني عن السكر ابيض
وقال إنه مع الوقت اعتمده في روتينه اليومي وتخلص هو وكل عائلته من السكر الأبيض"
1158010991378145280,LY,"  الدراسات متناقضة بخصوصه للعلم
فيه اللي تقول أقل خطورة لأنه مش مكرر وفيه اللي لا"
1158011325064372224,LY,"  هو السكر البني أصل السكر الأبيض غير الثاني مكرر ومضاف له مواد باش يوصل للونه الأبيض 
والدراسات علي السكر البني متناقضة بس عالأغلب يقولوا صحي أكثر لأنه طبيعي ومش مكرر"
1158053716567760896,LY," عوديهم يرقدوا بكري 
ولو إنه مع هالحر وهروب الضي صعب يرقدوا "
1158054139848470528,LY," شن هالبطر بالنعمة
قصدك ساعتين ضي مش عاجبينك"
1158054706738094080,LY, ربي يفرج ويصلح الحال وحسبي الله ونعم الوكيل فاللي كان السبب
1158091644920651776,LY,"من شوية صارت مطاردة بين مجموعة مسلحة وشخص أعزل
الله أعلم شن قصتهم لكن سببوا الرعب في الشارع
والشخص اللي يجروا وراه نقز علي سطوح الحياش وزاد رعش الجيران وأكيد هو بروحه صايرة فيه حالة والله أعلم نجا بحياته ولا كيف صار فيه 

امتى بس بيرجع لنا الأمان ونقدروا نعيشوا أيامنا مرتاحين"
1153418822424104960,LY," مقوى قلبك
الزقرلو أهون تقتليه وتمت
لكن فار تي غير نشم ريحته ولا نشوفه تجيني فوبيا"
