id,dialect,text
1185084817035137024,LB,"نانسي السبع صارت بتمون عالمتظاهرين
مقداد قطعو قطعو
"
1185358916177350912,LB, ايه بدك تضلي عراق
1185368876361629696,LB, هيدا مبنى مالية بيروت يمكن يكون في ايادي خفية ممكن يكون شي عفوي
1186496536198467584,LB, يلا رح نزلو صح
1186690849553440768,LB,"اللي عم يسأل وين المستندات  تفضل 

لبنانيتنفض 
نحميونبني 
معالمقاومةضدالفساد "
1186917824079585280,LB, حسب لوين رايحة قلب بيروت فاتحة
1186935720209997824,LB, مزبوط بس مش قادرين يسيسوه تحت لان في كذا طرف و في تواجد لمناصرين من الكل
1186942906877337600,LB,"كلن يعني كلن و سامي الجميل و مظاهرة و وطنية و لحمة بعجين هيدي صارت مسرحية مش تحرك سلمي بل تحرك سياسي 

ذوقمصبح"
1187039734486446080,LB, احقر من عليها هول المستفيدن من المصارف 
1187755596642226176,LB,"السيد مزح و قال اللي بخاف من الاصبع يخاف  كيف لو رفعه فعلا  

سلماحربابايعناك "
1187768944855277568,LB,من الواضح السيد متابع ادق التفاصيل عالسوشيل ميديا بدليل واصلته قصة السعلة و السعلتين 
1187777781465255936,LB, مصلحتنا في التشخيص الصح لمصلحة البلد بكافة طوائفه  مش عم نشتغل ضد حدا بس ما حدا يشتغل ضدنا
1187778454726598912,LB,"هيدا البوستر لازم يوصل لكل شخص متظاهر هلق بالشارع  هيدا خطة الحراك المطلبي لكل انسان بده لبنان يصير بلد 

لنحافظعالانجاز "
1187814838342443008,LB," يطلعو يحكو بإسم الحراك و يتحاورو بتخلص غير هيك رايحين على شليمونة 

و عندك هلق اسامة سعد عم يدعي لاستقالة الحكومة"
1187816042086719488,LB,عطسة وحدة نزلو عطستين طلعوا  
1187822950818467840,LB, الناس عم تخون حالها بحالها 
1187870191381815296,LB,عن فيديو جل الديب اللي بدو يجر المقاومة بجمهورها و اهلها عالشارع عبر الشتم و الهتك لسماحة السيد تمهيدا لصدام مسلح دموي  واهم واهم واهم حتى انقطاع النفس 
1187879463985569792,LB, هول بالعراق فيفا زلاطة 
1187886406909288448,LB," مسرب من الكلمة الجاي 
رح يبلش ب اعوذ بالله من الشيطان الرجيم "
1187887302732931072,LB, اي شي تاني حكيني عالداخلي 
1187970087891984384,LB, انت اكتر واحد ممول بالكوكب لدرجة ريحتك بهار كبسة سعودية 
1187979834502328320,LB,  انت اول وحدة يعني
1187980340633178112,LB, هيدي فرصة لنحقق مطالب بس بعض الناس بدها تقلب بلد و تركب نظام جديد ب  ساعة
1188080847251038208,LB, بعد المراجعة كذا فيديو طلعوا عم يحيو كذا ضيعة صوب الشمال و ما قالوا إدلب حتى إذا بتلاحظ الصوت هون مش  واضح
1188488138932527104,LB,الجلموق بس تطلع ريحته  بينزل بيقعد معك بنفس الخندق و بصير يشتكي من الريحة اللي هي اساسا ريحته  
1188515183037157376,LB,  منيح ينسف مقولة ادارة الجامعة و رئيسها اللي كان اليوم بالشارع
1188543667306455040,LB,اولى خطوة صحيحة باتجاه الحراك الاصلاحي  قديش اللي بالشارع بيتبنوها  هون السؤال  
1188547586883489792,LB, جاي دمك حامي حاج تحرق 
1188549037307432960,LB,"أميركا

 بتعمل عقوبات اقتصادية على لبنان 
 بتصنف لبدها ياه على لوائح الارهاب 
  بتحبس اشخاص برا البلد متل قاسم تاج الدين 
 بتسكر المصرف اللي بدها ياه ب لبنان اذا ما تعامل معها متل ما بدها
 بتمنع تسليح الجيش اللبناني من دول غيرها

بالاخير بيطلع مدير ال  يحكي بثورة هزلت"
1188568919386275840,LB, لا هيداك رامي عليق  هيدا اول الثورة السورية كان بدو يوصل الثورة عالضاحية
1188709324882927616,LB, يلا شاطرين عالشعب هول
1188713665790431232,LB, بوجود شخص متل سماحة السيد لا خوف عالبلد هيدا لبعرفه  اللي بدو يلعب بالبلد رح يحترقوا اصابيعو
935630575486021632,LB,لهونوبس  هشامحداد قديش قابض عليها هاي الحلقة  كتييير قوية 
1145603594508472448,LB,نطالب الحلفاء و الاصدقاء يحطولنا موعد للمشاكل تاعتهم هالاسبوع مع اللوكيشن  لنعرف أذا طلعنا عالجنوب هالاسبوع ننزل الاحد بالليل او الأتنين الصبح 
1146623665779482624,LB,"ما حدا اكرم من ربك  جملة كفيلة بتغير مزاجك بأقل من جزء بالثانية  لأن عندك ثقة بينك و بين حالك انو الله قادر يغير كل شي بحياتك  

صباحو"
1150274662976368640,LB,خفها عالعالم يا أبو ملحم  إذا ما بدكن تتقبلوا رأي الناس من بعد ما تستفزوهم بكلام مش بوقته  روحوا عملوا غروب واتسآب و احكوا بين بعض  بعيدن انتوا بدكم رأي عام و رايتنغ لتضلوا تمسكوا معاشكم كل اخر شهر  
1150681540294324224,LB,"لا تثق بشخصين  

 رجل قال  بدي  دقائق و بكون عندك 
 إمرأة قالت  أنا حسب ما سمعت عم بقولو إنو 

متفقعليه"
1150681795089850368,LB, كل اللي حضرو الماتش 
1150682093590069248,LB, بس يا سردين بس يا بو قلب كبير
1151446732947033984,LB, مش ناقصنا حرب اهلية فوق الفقر و الفساد 
1151893023065812992,LB, في عالم مفكرة الحزب متلها و مش عارفة انو ما بيوقف على اشخاص و هيدا الشي اللي بميزه عنهم 
1151893446942216192,LB,بغير احزاب المسؤول اذا غلط بطعمي الجلابيط الزغار لتحته حتى يضلوا يزقفولوا شو ما عمل  
1152562413562208384,LB,التعرض للشهداء اوسخ عمل عم يصدر على هالمواقع الزرقاء  و التجربة اثبتت انه يوم بعد يوم عم تتحول هالمواقع لمستقنع من القرف يغزوه القرف و قلة الاخلاق 
1152638125606342784,LB, معقول شي بارجة طالعة عالجنوب
1152915227115233152,LB, يا عمي المظاهر و الفرح المصطنع عم ياكلنا  و وسائل التواسل عززت هالشي 
1152916054915653632,LB, الناس عم تقلد بعضها لتحس حالها مبسوطة مش لانه هي بدها تكون مبسوطة  الواحد مثلا صار يقعد بمكان فاخر بس ليختبر شعور الفرح  لان غيره قعد هونيك و بين ممبسوط 
1152971278573297664,LB, يخليك فوق راسها يا رب
1152999404347035648,LB, مارك مش عم يرحمنا لهيك اعتزلنا
1153281937907302400,LB, فرقة بتغني اشيا مش مفهومة و بتعمل حركات مش مفهومة على وقع موسيقى مش مفهومة  شي متل السمك مع لبن
1153306127792254976,LB, عم يجمع مصاري بدو يزرع شعر
1153320913166884864,LB, بسسس يا غبصصص بسس
1153455726167244800,LB, بحياتو الزمن ما كان منصف 
1153712002990313472,LB,"لا محروقة و لا مقطورة و لا بمليتا معروضة  

يارضااللهورضاالكورنيت 
نصروكرامة "
1154724016848101376,LB,"صار الواحد بنزل صورته و بقلك    خفها علينا يا لويس السادس عشر 

شحار"
1155107926715117568,LB, اكتر بلد بالكوكب بركب جنوطة و فيميه للرابيد
1155110287118389248,LB,"بآخر  سنة قطع  حروب عالبلد و طلعوا الشيعة تراند من ناحية العدد  كيف لو في سلم 

اكلوناالمحمودات"
1155533057300017152,LB,  يا ويلي عالنكد قلتيلي تزهقي يا إم فتنة  عالعموم اللي ما بينضب بكون واضح ما عندو قضية يحكي فيها بقوم بنقر عالناس
1155536538295513088,LB,  ما ضروري حدا يلبد المهم بأي مناقرة او اشكال ما تدخل قلة الاخلاق عالخط و كل الهبل اللي بصير هون ما بيعكس  الواقع لان كل واحد بمثل نفسه مش اكتر و كل حدا بفتح بواب عحاله طبيعي يسمع اجوبة 
1155672856640000000,LB, لما يكون حب صادق و طاهر الله يرحمها و يطول بعمره
1155678403313512448,LB,شفتوا حتى بأميركا بيفقعوا مواويل و بروح قتلى  
1156047926315012096,LB, رايحين عالهاوية  كلو صار الالكتروني حتى نمط الحياة
1156302339533410304,LB, هيك منكون صرنا صلح
1156656223502131200,LB, بوجود التجميل كلو بصير 
1156907731682565888,LB, في شبه بس بالرسمة عاملها دقنها متل المشطاح و منخارها فايت اوف سايد
1156909061197172736,LB, قلتلك من زمان انا عندي نظرة فنية بس ما صدقت 
1157060306973204480,LB,رايحين يلعبو ببيت الله حتى ما حدا يزعبر عالتاني   
1157061410427420672,LB, شو هيدا كوكتيل افكار فايتة ببعضها
1157061930705674240,LB, هلق هيدا عمق بربك
1157201909666734080,LB,  ف هي اكتر حدا ببينو تويتاه عندي و اكيد مش زعلان
1157274926430203904,LB,لما يكون عندك موقع اخبار مكلفك   
1157300749820452864,LB,الوضع بمخيم عين الحلوة  عالأخير 
1157330574685724672,LB, انت كلو بالقصبة روق 
1157352337750548480,LB,يا ريس إذا بدك يانا نضحي رح نوقف دفع قروضة للمصارف بالدرجة الاولى المتحكم بسيارتنا و بيوتنا و اذا حدا منهم طالبنا رح منضحي فيه كرمال البلد  
1157396248489529088,LB, ما بحلها غير حزب الله يدقو تلفون يقلبو النتيجة 
1157441007941820416,LB, بيمشيش الحال نام ساعة و نص يعني 
1157575290052403200,LB,للأمانة بحياتو التويتر ما كان في هلقد كمية من السخافة و الهتك و قلة الاخلاق  وين في واحد يمكن مريض نفسي يمكن مش طبيعي بعقلاته صار مادة دسمة للتداول و الهتك و الشماتة باساليب مقززة كلو كرمال نضحك  لحولينا 
1157595119983452160,LB,  العمى طلع مكذب على نص العالم 
1157596470213849088,LB,  حسين مبارح قلي رايح جيب قهوة كمان و شمع الخيط  
1157598573149790208,LB,  بدنا نشوف مين الطرف التالت لاخدها لعندو 
1157637246696197888,LB,"الوزير محمد شقير وقف شراء مبنى  بس ما وقف يقبض صاحب المبنى بالسوليدير   

  اللهيغمقللبالي"
1157792013196173312,LB, بدك تسافري على كندا او الاسكا او شوفيهم يوتيوب
1158020386329698304,LB,"وحدة مش دافع اجار بيتها و عاملة مشاكل مع الجيران و كل الضيعة  إجا مالك البيت قلها فضي البيت  شو بكون خص حزب الله و امة محمد بالموضوع 

 بزمن السوشيل ميديا و موقع يا صور و بعض الحاقدين صارت الحبة قبة  و الحكي ببلاش و ما عليه جمرك اخلاقي 

فتبينوا"
1158022252518154240,LB, عم يتسوق للموضوع من دون حد ادنى للاطلاع شو صاير و نحن عم نحكي بضيعة مش بمدينة  كل واحد عندو مشكلة مع الحزب صار ناطر اي حدث ليسوق ضده و يبهر في من عنده 
1158357118661136384,LB, بدو يعرف وين يقعد الواحد
1158358955736870912,LB, ايي اكيد عالشاطىء اجمل  و اروق
1158469266271821824,LB,العقصة بالجنوب ما بتفارقك تقول يتيمة و كافلها تروح معك وين ما تروح 
1158486486695776512,LB,كل ما داقت فيك الدني تذكر انو رياض سلامة بيقبض  مليون ليرة بالشهر و ما عندوش ضمان 
1158497987724828672,LB, بالعزا حطو حامض كرمال اللحمة بعجين
1158717526097956864,LB,الاشتراكي  لو بدنا نقتل صالح الغريب قتلناه  الله عالاخلاق يا فخر الجبل 
1158761801586282496,LB, بس يا علي  اني من ميس عفكرة
1158766347465220096,LB, يا من مركبا يا من ميس
1158766843382947840,LB, يا ريت تحس فيهم  الناس لتعاطفت معهم وقدمولها بيت و معاش و حتى ولادها دخلوهم معهد  فضلت تكفي موالها و ترفض كل شي و تطلع على قناة الجديد
1158783062563545088,LB, هيديك المرة كنت عم فتش على شجرة ميس سالت نص الضيعة ما لقيت 
1158784258850381824,LB, بكون لف السجادة و اخدها معو
1158805013357088768,LB, لو كفا كان صار يقول للمريض  اكيد اكيد اكيد بدو دوا
1158821835515056128,LB, طيب مش الف مبروك
1158890823443976192,LB, مش عم بعرفك بس تحكي فصحة
1158900462474661888,LB, هيدا الواحد بس يصير معه مال و يكون جاهل و بلا فهم  بصير صباطه اغلى من عقله 
1159174782950285312,LB, لازم يتركك ترجعي بالتاكسي 
1159435783683620864,LB,"بلدنا صاير يشبه  

كوت رتويت"
1159436225423597568,LB, كنتش لاقي شي من كتر القرف
1159467904502571008,LB,الله يرزقني فضاوة بال رئيس الحكومة  اللي صرله اسبوع عم يحتفل بعيد زواجه مدري عم يعمل شهر عسل قضاء عن ما في الذمة  
1159908506713174016,LB,الشيطان بس كان بعدو زغير  قبل ما يتلمذ على إيدين آل سعود  
1160273399907852288,LB, حتى الحرامي طلع عالضيعة
1160280371445063680,LB,  راجع الواتس و ركزلي على كلمة منشوف 
1160604976130998272,LB,   و الحجة سوسن عيدك
1160616274730336512,LB,البنت بس تشتري فستان الخطبة بتاخد معها كل رفقاتها البنات حتى رفقاتها لكانو معها بصف التمهيدي بالمقابل بس خطيبها بدو يشتري بدلة بتصير بدها تعطي رأيها ب لون زر القميص 
1160960588798992384,LB, طفل و شي  كيلو لحمة و طاووق للشوي و طنجرة شاي  و رواق كتير 
1160963290077548288,LB, هيدا لابتوب مش تلفون 
1160988239349653504,LB, اهم ش هالايام هو الشارج  على ذمة الراوي
1160993847826141184,LB, يلا شوي و بيوصلوا لان بلشوا يفلوا
1161585154751700992,LB,"فداك بيوتنا يا سيد 

نصروكرامة "
1162097367140708352,LB, خلصت او بعد في كفاية
1162312123529277440,LB, طيب طل بعد الظهر
1162397757627408384,LB, المسيرة ماشية و الرب و حزبه راعيها
1162417062838509568,LB,"الحكي الاهبل بالتوقيت الغلط  

نصروكرامة "
1162700756199399424,LB, هيدا كان يا دوب بعده هافت عالقاع
1162723130936320000,LB, شايف كل الجماهير عم الطالب برجعتك 
1162746091256856576,LB, اللي من ذوي الاحيتاجات الخاصة هو الواعي  و اللي ضربه هو المضروب بعقله
1162781441266200576,LB, في هتك للشخص بالصورة كمان من باب اخلاقي كمان هيدا الشي مش حلو ابدا 
1163066728240361472,LB, كل واحد بيحكي عن حاله 
1163108949324906496,LB,  حمد الله الله تكرم علي بشال لسماحة السيد  رح  يتبروز ببروزا كبير و ينحط بنص البيت
1163340914334556160,LB, لا عمي مش رح تزبط
1163469546386337792,LB,"قعدة بتسوى افخم مطاعم المدينة  

جنوبيات
شكرالمنحرر "
1163509020562509824,LB, ريحتها بس مخيفة  بتضل معلقة بالبني آدم ليتحمم
1164249456335867904,LB," اللحمة بينشاوش ببيروت خلقت للضيعة 

نيتشيه"
1164506621747367936,LB," اسم الاستراحة الوفاء مش عفيف شومان  بدك تنضفو النهر او بدكم تصفوا حسابات شخصية مع الناس 

ثانيا نظموا اوضاع الاستراحات بالتوجيه مش بالقمع و التشهير لان في عيل و شباب عم تعتاش منها 

ثالثا فرجونا شطارتكم بالمعامل و المصانع اللي عم تكب قرفها بالنهر "
1164510452203884288,LB,صفحة مصلحة نهر الليطاني قرروا يعلوا الرايتنغ تاعهم قام دقوا ب عفيفشومان قالولك هيدا عنده متباعين و مشهور عالسوشيل ميديا بجبلنا جمهور 
1164535566077181952,LB, شوفي اخر كم تويت صوبي بتاخدي فكرة 
1164708014219300864,LB, انت عم تجرح فينا 
1164962230422691840,LB,"السيد شخصيا في ارض المعركة مش شي سهل  الله ياخد من عمرنا و يعطيك يا سيد  انت البلد و الارض و الاهل  منحبك لانك قائد مش لانك زعيم  القائد اللي بحط دمو على كفه ليحمي ارضنا و عرضنا 

حاميالبلدياسيد"
1165130723734544384,LB, صرتي فيجيتريان سوبهان الله 
1165247123274838016,LB, زهورات مع عسل و حامض   عصير ليمون  شقف حامض مع الاكل
1071426201355476992,LB, تأكدي انو بعد ما يكون وصلك تخانق هوي وحبيبته 
1086406476254597248,LB,اللحمة الوطنية صارت ملسة عالتويتر 
1086902216353632384,LB,"والحشا نص لجاين عالقمة ببيروت 
جاين يتروقو و يتصورو و يفلو "
1087776490404700160,LB, و انت كنت منظر لثورة الارز و اللحمة بعجين و هلق ادمن لصفحة اربعطعش اذار عالفيسبوك 
1089180579852181632,LB,"صايبنا متل لمقدم بروفيه و ناطر النتيحة تطلع  و الحشا اطول  ساعات حاليا عم نعيشهم  

بتوقيتنصرالله"
1089183967792848768,LB, بتعرف مين بحط فرو عراسو 
1092804884674560000,LB,  صديقتي معك خبر كم شخص توفى بحرب تموز من ورا القذائف لكانت عم تكبها إسرائيل علينا و كانت بتحمل مواد سامة  سببت بعدين كانسير  مش لازم ننظر ابدا انو إسرائيل هي دولة بتهمها الإنسانية بالعالم ابدا  ثانيا موضوع انو عندها دوا هو مجرد إشاعة مش اكتر  و سؤال جو معلوف مش بمحلو ابدا
1092808483169357824,LB,   من اهلي توفو بهيدا المرض ما تسأليني عن المعاناة  فكرتي ما لازم ناخد نظرة إنسانية عن إسرائيل بأي شكل من الأشكال
1097559808654430208,LB,و الحشا انا اول مرة سمعت عن الزواجالمدني من شي  سنة راح بالي للدفاع المدني و قال اللي بيتزوج بيعمل عرسو بالاطفائية 
1098642306528362368,LB, سوق عمهلك احسا ما المدام تاخد غيرك
1099013300313051136,LB, مجرد ما انت شجعتي يعني خسرنا يا آنسة ديبة 
1099015601081724800,LB, بكون مستعير الجيب من البابي تاعو حشا لخلقه
1099023378973945984,LB, ما حدا اعلى من الله  كلو الله بيبعتلو مين يكسر راسه
1099626691620683776,LB, منجربو او مندعيلك او مندعي عليك 
1100043375040966784,LB, عم بحطولنا بالهريسة شي يمكن
1100488621885480960,LB,رئيس رابطة الاشخاص اللي ما تابعو مسلسل حنين الدم و لا بيعرف مين هنادي و مين قتل مين و مين بي مين 
1100493614818516992,LB, مسلسل المخرج مش عارف مين بين مين و خي مين و مدري مين
1100511114629206016,LB,هي الحقارة بتلبش من لما الواحد يتاجر بصحة ولاده ليعمل قيمة لحاله  رياض المنفلوطي نموذج
1100837872763064448,LB, واضح اني متابع منيح 
1100838030234054784,LB, والله لان ما بحضرو سالت حدا بيحضرو قلي هيك الله يجرصو 
1101961912097669248,LB,ضربتين عالراس بوجعو  ريال بربير 
1102095758248108032,LB, طعمرك ما خصك لا بسياسة و لا بدين و كمان ناقل خبرية مش صحيحة
1102103872674381824,LB, نازل يجيب سودة و نية
1102273474750566400,LB, بكير اكلنا كنافة هلق
1102755674231054336,LB, هيك صاير جوك بعد ال 
1104030211992109056,LB,"اللي عندو أي ملف أو تهمة فساد على حزب الله أو على حدا بحزب الله يروح على القضاء 

السيد نصر الله    

حزبالشرف"
1104193689574932352,LB, لازم تحط اول شي دوار صيدا
1105590748081241984,LB,احلى شي الريالي لي عامل حالو يوفي الليلة كرمال رونالدو
1106324943590096768,LB,بلد في الادامي بيطلع على سوريا او عالحدود ليحمي كل اهلو و ناسه بمين فيهم الآدامي و الازعر  بينما الازعر بيستفيد من فسحة الامان لندفع دم كرمالها ليمارس زعرنتو و بلطجتو و حقارتو على ناسه و اهله 
1106983486739632000,LB,جماعة   حتى الساعة لا حس و لا خبر  بخصوص اللي صار ب  نيوزلندا  للاسف حتى التعاطف الإنساني عند البشر صار عبارة عن برستيج طائفي و سياسي و عرقي
1107053823988764800,LB, دور القازان  طفي القازان راحت الكهربا
1107059209684873216,LB,  هههههه لوف يو لوف يو وحياة غلاوة بو نبيل
1107819717358686208,LB, صاير بتنشط بالليل انت
1109554177477271552,LB, مفرق حسينية الخنسا  متر عاليمين كول و دعيلي
1109864462075478016,LB,قبل اختراع المولينكس كان إسمها لحمة مدقوقة عالبلاطة  بعد المولينكس صار إسمها ملسة   
1110418403167219584,LB,لما يكون عندك شغل بكير و مش نايم منيح  
1110442825672548352,LB, اذا بقلك اي بكون عم كذب
1110689510394859648,LB,بالنهاية مش كل واحد ربط شعره و لبس بدلة من عند آيشتي بكون عندو قيمة فكرية  هيدا الزعتري بليلة ما فيها ضو قمر عم عليالديك بطل قومي 
1110983462973001600,LB,"اذا شاب انعجب بصبية مارقة من حده 

اذا وقفها بقولو عنه بلا اخلاق 
و اذا لحقها بقولو عنه بلا شرف  

طيب كيف بيتواصل معها اذا نيته خير "
1110986335073042432,LB, ممكن ما توقف اذا شاب غريب وقفها 
1111008243827032064,LB,  تخيلي تكون رايحة عند رفيقتها 
1112747416783151232,LB,لما تشوف بعض التويتات اللي فيها مغالاة بالوصف  
1118209916743888768,LB,الكابشن هون مش كتابة  دقات قلب  
1118297792169033600,LB,بعد  يوم متل هالوقت منكون عم نسمع يا نسيم السحر 
1122032302832398336,LB, استغليتو العالم المشردة خي بدكم تمصو دمها و مصرياتيها مقابل ولادها عالجبهات عم تقاتل إسرائيل  بعدين ما تزعل اذا انقال عنكم يهود اليهود شي منيح ديانة سماوية الله حاكي عنها  المهم تفهم انو بأي حرب جاي مش رح نسمح لحدا يربحنا جميلة لان كرامتنا فوق الكل و منوزع شرف عكل لبنان
1122155740389675008,LB, لازم تعطي دورات و دروس للجيل الصاعد
1122175001426313216,LB,لما يجتمعو ولاد العيلة بفرصة الربيع بالضيعة  و انت على اساس طالع تروق راسك 
1122206630286897152,LB, في ولاد بيقربوك بتشوفيهم لاول مرة بحياتك
