id,dialect,text
1098809203983040384,JO,احترامهم للزباين عظيمم  عظييم جربوهه وادعولي انكلاوكاسا  
1099013416654655616,JO, بنقدر نحكي راحت عليكي
1100034667233702016,JO,  معلش ما ححكي صحه 
1101502025039257600,JO, في بالسابع فوتتشيني هاوس وبشارع مكه جريل مارك بيرجر وفي فايرفلاي وبافلو
1107022913612460032,JO, لاااااا هاي عباره عن تعويذه بتدخل المخ ما بتطلللع
1107024456671772800,JO, انا مابسدق ولاد خواتي يروحو وبتيجي انتي
1114211828094074752,JO, جربتو طلع جد زاكي
1129772317184286848,JO,"في عائله انحرق بيتها بالكامل 
جميع الأثاث انحرق والأشخاص حمد الله مافيهم اشي 
محتاجين لسا اثاث الي عندو خزانه او اي اشي ممكن يفيدهم يتواصل معاي 
واليوم حتيجي سياره كبيرة تاخد بعض التبرعات 
الي حابب يتبرع يتواصل معاي رجاءآ "
1129814208558882816,JO,اي شخص حابب يوصلهم اشي في شخص اتبرع هو يجيبلهم الاغراض هي رقمو 
1132086657849671552,JO, الاردن بس حمد الله تامنلهم كل اشي 
1133383629411880960,JO, والله وانا تحممت وطلعت من ششمس لمكيف بارد حاسه حالي بودع
1134954831343443968,JO, ما حد قدك الناس بتدفع فلوس لتنشهر انت ع القاعد الشهره اجتك
1135681482134098048,JO, ومع هيك بكرة حتروحو الدوام يطلعو عنين اهلكم انو انكشف انو اخر يوم ويعملو غزو وتكونو صايمين يوم  وصيام موفق 
1136295759555584000,JO,محتاجه شخص ملتي ملياردير يعاملني كإبنه اخته ويعيدني  والعيد فرحه 
1146125605542551552,JO, اخوي ماجد اذا بتحب يكونلك زوجه ثانيه وتكمل الدين اختك جاهزه
1154841895643832320,JO, يا هالفخمه  شفتي شو فخممم فخممم
892099583291142144,JO, من فترة ما اخترت ولا رديت يعني لولا مانحبك ونستبشر بتفسيرك مانرسل
892500787431174144,JO,  لا مو متزوجه عزباء بس المصور  بالرؤيا اعرفه
896341180023283712,JO,  طيب لما يسألك عن وضعك ويعدد الأسئلة بعدين يجاوب عالرؤيا لكن ما صدقت ولاارتحت مين اصدق احساسي او هو
896506506404913152,JO,  ال زعبي وين ما رحنا لنا الصفوف الاولية
897250553604034560,JO,    كيف انا اقصد السلالة واحنا ماحكينا شجرة العائلة 
898647887118307328,JO,كل صادق بالهـوى  حظـ قليل 
902950774396858368,JO, وانا وانا حاجز موعد 
903925108691128448,JO, هلا مافي شي خاص للعيد كلام حلو
903946983550984192,JO, شو رايك تفسرنا عيدية منك
903948696664100864,JO, شيخ شو تفسير الي بده يسافر عشان يكمل دراسع
903949516029788160,JO," امين يارب العالمين 
شو تفسير رؤية شخص بده يسافر  عشان يكمل دراسه"
903987526242902016,JO, واحنا وعقبال عند حبايبنا مافي عبارة نهديها من كلامك الحلو
904233416979304448,JO," في بس مرتبط بالانستا
بس ماهتم فيه
"
904813956287561600,JO,      عبد القادر من ذوقك واخالقك العاليه كلكم فخر لمكة يعطيكم العافية يا رب
905152807556317184,JO, خلي نصيب الي زمان ما رديت عليهم مثلي
905458296085204992,JO,  بالنسبة للصور و خليها توخذ حقها بالانتشار هاذي اجمل صور بالحج 
914552798410268800,JO,"بين غلاي  وعطني الحب لهـ 
جدد رجاي بوصل اللي رجيت 

 "
922160589690081152,JO, اذا هذي كلماتك ابدعت بالكلام
923263715222441984,JO, زرته بس مامذكر اسم المكان 
931228833923117056,JO, رأيت شخص اعرفه راى رؤيا انه باان عسكري اداله التحية ومرة ثانية الشخص نفس شفت ع جبينه مكتوب رقيب
940661757718286336,JO,  كاتبنا الكريم ماناوي تيجي عالاردن
960972946490712064,JO,ياماشاءلله على هالنهاية الله يكتبها النا 
962796950272794624,JO, رائع قمة الكلام الحلو
966583491709357952,JO,"بعدك على بالي يا حلو يا مغرور
يا حبق و منتور على سطح العالي "
967131822856589184,JO,"عسى تالي الايام للصابرين  إفراج
ويالله على من ضاق  صدره تفرجها
انا ماني لغير الله  بفزعته محتاج
هواللي خلق خلقه ويقضي حوايجها "
968506247300382848,JO,"كل ماحامت طيورك في سماي  
 قلت في نفسي عساها جابتك  "
969697085934243840,JO, كونك نزلتي تغريده حابب احكيلك حاولي تتعاقدي مع مكتبة جرير عشان كتابك روح كتاب يستحق الانتشار ابدعتي اللغة والمضمون ممتاز
970431406747787264,JO, حطب مولعه فيه النار
971034487898431616,JO,"على درب الامل سقنا خطاوينا
يالله عسى خيرة الأيام تسعدنا  "
971048272226848768,JO,  يزم الله يكثر من امثالك جد ومنكم نستفيد ماشاءلله عليك قدوة اها مكة
972227384647864448,JO, شيخ الخطابه حلوة بس المشكله بالفصحى صعبه
973963328157569024,JO, ما شاءلله بلدنا حلو بس ما حدا بعرف او مكتشف جمال الاردن
974429400375718016,JO,  لا بالعكس شوف هالصوره من امام بيتنا تصوير عادي 
980558370401812352,JO, عااساس ماحد بخون كله بخون مالي حد صادق ما بيكون صادق مع نفسه كيف رح بيكون صادق مع غيره
982270851415355392,JO,"إيقافحسابالشيخسعودالشريم
ليش يعني احلى حساب افصحى خطيب واجمل تغريددات واصدق شيخ حتى الحساب وقفتوه الله يستر مايعملو اشي بالامامة برمضان"
982347230920102016,JO, منور الله يسعدك دنيا وآخرة ويرزقك شو مابتتمنى
986072288314486784,JO, يارب كرامه للنبي محمد
986302502961336448,JO," الاولى ضيعوها عشان الثانية 
الثانية مع تطور التكنولوجيا ماحد بقف قدامها 
كفو"
987755817196802048,JO,  الله يرزقنا ونجتمع صدفة
988104726003834752,JO," في أشياء بسيطه تستاهل نحب الحياة فيها 
زي اللحظات العفويه  والناس الصدفه  
أشياء توصل قلبك لمراحل عميقه من الفرح "
988145428569968640,JO, مجرد جاري الكتابه من شخص تحبه شعور روعه كيف لو قال اسمك
988535903340716032,JO,هو صحيح شكلنا يوحي بالسعاده بس للأمانه الأيام ماسحه فينا الأرض
992550478721486848,JO, مابدها كل هالعجقه امسك ورقة واكتب خواطرك وبعدين احرقها وخلص
992572636478738432,JO, بالسلامه وادعيلنا معاك الله يرزقنا الزيارة لمكة والمدينة 
993263192435552384,JO, المواقف وحدها تبرهن مثالية كل شخص فينا منصلي منصوم قيام قران بشكل مستمر بس بيجي موقف بخلينا نغلط من دون قصد ونضيع الي بنينا فلذلك اهم اشي الثبات مافي شخص معصوم عن الغلط كوني مثل الطفل وشوفي العالم بعين ثالثه حاولي تغيري الادوار وشوفي شوممكن يكون موقفك بكل دور
994343832471957632,JO, لما بفتح التويتر بشوف اول تغريده الك بشعر بشعور حلو مابعرف ليش بحسك انسانه رائعه لامست شعور بنت طيبه فيك
994705974513602560,JO, ياهلا بصاحبة الذوق والتغريدات الحلوة
994920503629500416,JO, المجتمع رحب بالحب فيه لكن واحد من الطرفين غدر او خان مابتروح غير على الي قال رح اكون مخلص ووفي وهضاك مش سأل عنه
995027701185613824,JO, معناها بتحبي الكتب مثلي
995048616053047168,JO,   على القهوة خفف من هسا عشان ماتنقطع فجاة ويصيبك صداع
995298519320842240,JO,"بعاد كنتم ولا قريبين
 المراد إنتم دايم سالمين  "
995571072081825792,JO, هلا صباح النور مافي كتب قيد التنفيذ
995789763658608640,JO, واو حلوة كثير ابدعتي بالوصف
995957867416047616,JO,  لا بالعكس خذي راحتك سعرها تقريبا ع ريال الكيلو ب ريال
996311841583353984,JO, في كلمة غلط خاتمة رحنا ندعي بااشي عكسي
997253568359841792,JO," لان احد الطرفيين مشاعره راحت لبعيد 
يااما لشخص ثاني 
الاحساس دائما مابيخذل 
لان اذا شعرت بتغير بالمشاعر اتاكد انه في طرف ثالث دخيل 
داخليا منعرف انه في تغير بس بيبقى في امل دائما"
998537654122762240,JO,اول ختمه قريب ان شاءلله لاجلك والله يتقبل منا ويقومك بالسلامه يا رب 
998660263665717248,JO, الف الحمدلله ان شاءلله الايام الجايه ماتشوف الا الهنا والفرح الله يسعدها يارب
998707227648196608,JO,  وين موجوده لو بدي احصل عليها انا من الاردن
999078489558077440,JO, هههههههههههههههههه كوارث رح بعملو
999265244676542464,JO,  بالعكس  ذكور العصفور بفتح ثمه عشان الاكل ومين بحب الاكل وبصرخ عالغدا
999423139577778176,JO,"   اي الم بأثر على النفسيه والصحه والأرق وقلة النوم وتعب 
كيف لو كان الم القلب كانه شخص بقايضك على قلبك وبعذب فيك الله لايذوقه لحدا وان شاءلله ربي بعافينا"
999427881460797440,JO,  ههههههههههه جايين بالانثى اليوم من جميع الاتجاهات عااساس انكو ملائكة
999450835942813568,JO,"خلها على الله ما بقى شي ما راح
حلمي وهو حلمي  تحقق لـ غيري  "
999673717432180736,JO,  فعلا احلى عطر بشانيل
1001894869202358400,JO, حبييبي والله  مش غيبه بس الحياه والله السيئه ما بتخلينا بحالنا المهم اشتقتلك والله جدا جدا 
1003760897683320832,JO,  زي هاليوم صار هالموقف الجميل واشتقنا مر اربع سنين بلمح البصر 
1008050068245577600,JO,العيد  بدونك يا ابي  
1026702756827029632,JO,شيتشوفنفسكمبدعفيه التصوير ابدا ما بحسو اشي عادي بحسو اشي مزروع جواتي  
1031878136475074560,JO,فيايمدينهراحتتعيد بكره راجعين عالدوام 
1031893414424530944,JO, ضهر الي فيني كافيني بليز
1034257744046563200,JO,تنهيده ويطلع كل اشي موجع معها  كلمانحتاجههو
1037151647896686592,JO,افضلصورعندك وهالصوره 
1043491636137865216,JO, اكتر مكان سفاح بالاررردن
1043508230851387392,JO, هو بس الجو بتحسي حالك بالجنه الله ع اللطافه
1059875721726828416,JO, جربي البيك وكوكييز جولدن براون وجبيلي كوكيز بس تيجي كتييير عبالي
1062400777254301568,JO, واي خدمه اسأليني اي اشي حابه تعرفي مكانو ارجعيلي بس حاولي الاستشارات تكون بالأكككل بسس 
1063119218906947584,JO,صايرة حياة الأطفال قصيرة كتير ببلدنا 
1063515852719472640,JO,حافظوا على سلامة من يسعدكم 
1064804629467316224,JO, اسوم ثانك يو والله 
1084329055254704000,JO, رحتي شهر كيف لو عشتي طول حياتكك زيي واستقريتي بالاردن بفصل الشتا  طبعا ما حد حيحس الا الي جرب  قلبي معك
1086373450804092800,JO, حيرجع ينور المكان بوجودك يا وردةة الوردات
1086376557873188864,JO,للمره المليون انا عمري ضاع وانا بدور ع مكان بالسياره احط الكولا وما توقع  
1086509516382982016,JO,"ايه يا دنيا 
هفضل آكل ومتخنش لحد امتي "
1087981489172725760,JO,"أنا تعديت مرحلة انو بآكل وما بنصح  
انا صرت آكل وأنحف انا بختفي يا جماعة"
1089931790695960576,JO,برموك بالصيدليه الداخليه وبحطوك بشفت مش كويس وبقولولك اضحك  سرقو بسمتي 
1089932488456195968,JO,لمولمو كل التاسكات الصعبه وحطوها بشفت ال  وبرضو بحكولك اضحك ليش مكشر هو خليتو فيها ضحك 
1089933015579574400,JO, هو في مقوله بتقول لو انت ما بتهتمش بشعرك اتحجب بس محدش بفهم  شعب ما بنقراا
1089933435576176640,JO, بحكو ع سنادي الله يسامحهميا الله وداد كميه حبب الك ولشوفتك ضلي تعالي عنا بالله عشان شعاع الحب والتفاؤل يوصلني
