id,dialect,text
1159433988219576320,LY,"تو مش كان داروا مشروع طاقة شمسية واستفادوا من هالصرهادي والمحماطي خيرلهم 
كان هذا راهو ليبيا توا منورة كلها من حدها لحدها

خسارة تدهك فينا الشمس ومش مستفيدين منها عالأقل ككهرباء بدل من المحطات المتهالكة اللي كل مرة تعطل محطة منهم"
1159544253942566912,LY,"   الله يرحمك ويغفرلك
لما لقيت التعليق قعدت نشوف للتاريخ ومازال مكذبة خبر وفاتك"
1159545624678805504,LY,نفس أحلامي غير ماعنديش حبيب بس 
1159562002651656192,LY, اللي عندي نتيجة اللغة الفرنسية في طفولتي ومعقدتني
1159570732403318784,LY,"مرة أختي مروحة في افيكو وتحكيلي قالت أكتشفت منطقة أول مرة نسمع أسمها وطول تفكرتك
ترا قولي غرررغوررر 

أنا  "
1159594080193667072,LY," هبي عيد 
وشن رديتي عليها لما فهمتي إنها تعيد عليك"
1159594262167719936,LY," حبك ربي 

أما لكن والله حاجة تعقد "
1159595028043436032,LY, مرات ماهوش عارف الصح من الغلط ويبي من اينبهه
1159595098407153664,LY," صفية قداش ليها رامية عدتها 
أما هما لا"
1159600185208639488,LY, عندنا  في الحوش ومشيبينا وما توقعتش نلقى تويتر مليان بيهم 
1159600339881988096,LY," قوليله المهم الحرية 
الضي يمشي ويجي"
1159813880518008832,LY," ربي يهديهم وهما عارفين غلط اللي ايديروا فيه
في الأخير معمر بشر وسيوره بيموت زيه زي بقية البشر
والأمن شي بيد الله وحده 
لذلك كانهم يفهموا بدل من النحيب كان يتحركوا ويسعوا ويحاولوا يلموا شتات هالوطن ويدعوا لله يفرج كربهم خيرلهم من كلام بلا فايدة ومرات وراه ذنب ولا وزر"
1159814336975724288,LY, كان تفتح لهم بيه مشروع غادي مرات ينجح خصوصا وهما مدمنين افوكادو
1159814476658552832,LY," كل بلدان العالم 
مانبيش نزعل ولا بلاد"
1159815569446715392,LY,"بنات نصيحة في هالأيام اللي درجة الحرارة فيها الله المستعان إنكم ديما تخلوا معاكم جل الصبار وأستخدموه للوجه
راهو ايبرد البشرة وقتي سبحان الله
ويقلل من دهنيتها لأنه يرطبها كويس ويخليها رويانة"
1159816170444349440,LY,"تصوروا مكياج زي هذا طالعة بيه لمكان عام عادي جدا 

دوختني وأنا ندور في عيونها الحقيقيات  "
1159817129761394688,LY,"كان الله في عون اللي واقفة في الكوجينة في عز هالحر والصهد ومتحملة حرارة الغاز ولمية اللي تطبخ والكوجينة اللي في عين الشمس والضي اللي هارب باش ادير للعيلة ما ياكلوا

شهادة لله جهاد في هالصيف وربي يجيرنا ويجيركم من حر نار جهنم"
1159818244217331712,LY," توا توا كنت ندور في أسمك بنديرلك تاق ونقولك رد بالك تقول واحد شي 

ياأحمد طابور الكوجينة يومي وعلى مدار اليوم وشتان بينه وبين طابور المصرف والبنزينة"
1159819825344065536,LY,"  ترضية هذي 

بس والله فعلا كلامك وربي يفرج علينا ويعجل بالفرج"
1159820180987322368,LY," اووووو ما شاء الله 
إن شاء الله ديما تساهيل وتعبي في وقت قياسي"
1159820935437922304,LY," للآسف زي سراويل بنات زي شباب ما يجيبوا كان في النوعية الضيقة والمشحطة أو مشمرة
خاطري يردوا موضة السراويل المحترمات للجنسين"
1159821418269425664,LY, تي باهي ياأحمد باهي 
1159821987088404480,LY, أمس مشيت بنعالجها وبدا فيها الدكتور وقال تبي علاج عصب بعد العيد 
1159822864985591808,LY," سبحان الله موتتها زي الكذب 
لليوم نفكر فيها ونحس تويتر نقصه شي 
مع إن علاقتي بيها في التعليقات بس لكن أثرت فيا هلبة الله يرحمها ويغفرلها ويسامحها ويوسع عليها نهار هالجمعة"
1159825956175065088,LY," علاش ما يقولوش لصغار خالاتهم ياخالي بما إنه بالأساس صغار خالاتهم 

وطبيعي أمها بتقول لراجل أختها ياعمي لأنه كبير ومن باب الإحترام ومش من جيلها وواضح إنهم يتعاملوا معاهم برسميات هلبة 

قصدي هو ولا هي مكبرين الموضوع علي مافيه شي"
1159826505029050368,LY,"تأمرون بالمعروف وتنهون عن المنكر
آية صريحة في القرآن بالأمر بالمعروف والنهي عن المنكر وإنكاره
ويجيك شخص من جيل هالوقت ومداير روحه واعي ومتفتح ويقولك مش من حقك تنصح أو حتى تنكر منكر لأن هذي حرية شخصية "
1159862719471898624,LY, ما شوفتاش الفيديو كامل لكن كلمة عيونها لصلصن حرقتها الجبنة قوية 
1159864065579261952,LY,"  يالله ذكرتيني 
مشناها اللقطة وفعلا نبدوا غالفين وولا علي بالنا لين يضحكوا 

مرة دارهالي طالب نقري فيه لاحظ اللدغة وجا يعرف بنفسه قال أنا أسمي رامي
قولتله أهلا وسهلا
قال أسمي شنو
رامي
هاه شنو
رامي
ايوا شنو أسمي
باش انتبهت إنه مركز عاللدغة ودار فيا مقلب قدام الطلبة "
1159864765436571648,LY,  اللهم آمين وحسناتكم يارب
1159865010933391360,LY, واحنا اللي شعرنا كيرلي خلقة ولى زي الشمس أشرقت بسبب الرطوبة والحر ودار انتينات انتينات 
1159869211239428096,LY," باهي فيه اللي عايشين في بيئات أسوأ من ليبيا وأخلاقياتهم الله يبارك 
البيئة ما عندهاش علاقة بالأخلاق"
1159871740614455296,LY, مافيش شبه نهائيا بصراحة
1159873919282794496,LY," صدقني خوي السنوسي فيه بيئات أسوأ معيشيا من ليبيا 
ما ننكرش إن الوضع لا يطاق وربي يفرج كربنا ويصلح حالنا"
1159904674973175808,LY,"أكيد كلكم عندكم دعوات وأمنيات وحاجات حتدعوا بيها غدوة وتطلبوها من الكريم القادر 
رجاء ما تنسوش ليبيا من دعواتكم
عسى ولعل دعوة منكم تكون مستجابة ويعجل الله بيها الفرج علينا وعلي بلادنا "
1159904717922848768,LY, ولحم العيد من بياكله 
1159910415775780864,LY, نحسها جميلة جدا ولا دمها حلو
1159911561156276224,LY, كان شخصيتها قوية ما يبهدلوهاش هكي
1159911822377590784,LY, ما عندها ما بتفك فيها لأن بتلقاها ذابت وساحت مع الحر
1159914788635496448,LY, أنا الحق واجعتني نحسها 
1159918798717235200,LY," حتى أنا لليوم خاطري فيه 

كنت على أساس بنهديه لنفسي لما أناقش رسالة الماجستير "
1160236709805809664,LY,"الإنسان لما يذنب بالنهاريولي عليه خاطره وتحاسبه نفسه فالليل ويقعديستغفر ويتوب ويطلب الله يتوب عليه
ونفس الشي لو أذنب بالليل
وهكذا دواليك يومياعلى نفس المنوال
فمابالكم برغبته في إن الله يغفرله ذنوب سنةفاتت
ربي الغفور اللي يغفر ذنوب كل يوم واعر عليه يغفرلك ذنوب سنةويحققلك دعواتك"
1160304689084280832,LY," نص مليون بس في يوم زي يوم عرفة 
شن بيديرولك أصلا نص مليون هالوقت 
حتى حوش ما يجيبوش"
1160305382612512768,LY, لين لساني لصق في حلقي 
1160307355042664448,LY,"  مش كأنه زودها وهو متقمص شخصية بنت 
المفروض يركز علي شغله يحكي علي كريماته ومكوناتهم أحسن له من هالعباطة"
1160308306835099648,LY,  معناها استمروا راهو الطوابير مطولة مازال
1160311591864324096,LY, من عواده يارتيل وكل عام وأنت وأسرتك بألف خير
1160312833390862336,LY, غير راهم يقروها غلط ويولوا علي نساوينهم
1160315901465497600,LY, عيدك مبارك حنونة ومن العايدين الفايزين أنت واميمتك وأحبابك
1160316897180704768,LY, حجه مبرور وذنبه مغفور بإذن الله وإن شاء الله بعودة
1160318954247774208,LY,  الله يرحمها ويسامحها كلنا انصدمنا بخبر وفاتها ووجعتنا جدا
1160319390333771776,LY, اللهم آمين الله يرحمها ويغفرلها ويوسع عليها
1160321302886014976,LY," لا باس عدولة

عيدك مبارك يارب"
1160324986181214208,LY," ممكن تقصد تاكلوا عصبان عند اصحابكم الليبيين مش مصدقاتها
أو مش مصدقة انك سعودية وتعرفي العصبان "
1160325220395298816,LY, عيدك مبارك سمر ومن العايدين الفايزين يارب
1160326545497645056,LY, عيدك مبارك تشادي ومن العايدين الفايزين
1160341912110403584,LY, نحساب الوضع غير عندنا كئيب
1155988220770807808,LY, الزوز ربي يحغظهملي ويطول لي في أعمارهم ويمتعهم بصحتهم
1155991017738215424,LY, درتلهم إحصائية امتى بالضبط
1155991285896843264,LY," كوكب الأرض كله قاعدلكم
بحبحوا فيه "
1156061072069210112,LY, امالا خليها عندك مانبيش نحرمك من ذكرياتك 
1156061938373275648,LY, سعدودهم بالليونة اللي عندهم
1156170627046395904,LY,"  قريت بقية الكلام وشوفت حكم الشرع في تزويج البنت بغير موافقتها
وعندك علم إن تزويجها بالإكراه يعتبر عقدها باطل وتقدر تطلق بكل سهولة لأن الشرع والقانون معاها 
بعدين خيركم مع اللي قاعدات تقول توكلوا فيهم من جيوبكم
كان قعدت وعندها نصيب في الدنيا تو تشوفه"
1156173417193906176,LY,باهي ردولنا الضي عالأقل نشحنوا نقالاتنا 
1156561221824516096,LY,"الفرق بين البنت والولد لما يرجع الضي
البنت
تولع الغسالةتغسل جبل الحوايج بتع العيلة كلها
تولع المكنسةتمشي عالحوش
تسيق الجنان والحمامات أكرمكم الله
تنظف الثلاجةكيف عاد ماهو الخضرة انضربت من هروب الضي
تغسل لماعين وتحط غداها عالنار
الولد
ايدير جلف خبزةوطاسةشاهي ويمتد تحت التلفزيون"
1156561360983138304,LY, هاني رجعت ومقعمزة على قلوبكم 
1156561532114935808,LY," منو اللي دارلك انفولو 

لكن طريقة ذكية عموما"
1156561672536023040,LY, احنا من أول أمس بلا ضي ورجع اليوم بس
1156562478370828288,LY, ايواااا نفس الحال والله 
1156566680191012864,LY, تمبلة هذي مش ربح 
1156567039106002944,LY," عقلي 

تو بيعلق محمد ايقول وتيلي صندوق
"
1156575508253106176,LY, واااو ما شاء الله لو هكي يطلع مشروع تجاري مليح لو حد يبي يبيع
1156576123951755264,LY, في هالحر وحقق هدفه هنياله
1156576601179676672,LY,مش إكتئاب لكن اليوم انقالت لي كلمة قعدت نبكي منها ساعة ونص 
1156577256619282432,LY,"بهلبة بهلبة بهلبة
بهلبــــــــــــــــــــــــــــــــة

أبسطها لما يضايق يطلع طول يوسع خاطره
بينما هي تقعد زي عصفور الزينة محبوس في قفصالبيت وتسحن وترحي وتبكي لين يفرج الله عليها "
1156585133912334336,LY," شكرا 

ربي يصبرنا فعلا"
1156597286270590976,LY," سبحان الله
صايرلها زي ما صايرلي مع خواتي يعاملوا فيا كأنهم هما اللي أكبر مني "
1156598682847994112,LY," كلامك كله عين العقل 
وعجبتني أكثر شي جملة 
ما تعباش عالشخص الاخر يفك شفرات عقلك ويخمن أنت شنو تبي 
أنا نختصر فيها بكلمة أنا ما نوحاش من الوحي"
1156630204888027136,LY," شكلك نسخ لصق من اللي عندي 

ربي يحفظكم لبعض ويدوم الود بينكم "
1156630498631987200,LY,  شكلك عطيتيه علي راسه 
1156631200682905600,LY,"  لا لا مافيش سباقات نهائيا
كل واحد عنده بريزة وشحن ومتهني علي نقاله"
1156636302625972224,LY,"  من أول أمس ما عندناش ضي 
وأمس ردوه شوية وفصلوه وحاليا من ال مافيش ضي"
1156636529571389440,LY, مبارك يا أيمن ومن تقدم لتقدم ودائما موفقين يارب
1156748780924014592,LY,"  عادية كيف 
لا تاكلوا لا تغسلوا في اماعينكم لا تمشوا علي حوشكم
بالك تروح تلقى في الحوش نظيف تحسابه روتين ساهل وماياخذش مجهود 
والغسيل لأن صيف والضي يهرب فتغيير الحوايج شبه يوميا لو مش مرتين في اليوم
والغسالة لولا الضي راهي  ساعة والعة
لدرجة أمي تقول ريحوها المسكينة"
1156748903041183488,LY,  خلاص احسبني معاك في كم طاجين باشميل
1156751687010410496,LY, طلع صوتي اللي يستحق التقدير 
1156771843220692992,LY, اغلب معلوماتك من قرون ماضية عالعموم
1156772228337413888,LY, أنا كان نومي معدل لين عطوني دوا كحة يسبب في الأرق وليا كم ليلة نقعد نفنص للصبح 
1156772734166360064,LY, وجع بوه بس لما دار عليه إنقلاب ومنعه يخش عمان
1156831549821804288,LY," شن صار 
هروب الضي ما خلانيش نركز في الأحداث "
1156834767075254272,LY," وين نندري عليها 
لقيت جماعة الفيس هكي يقولوا "
1156835628853727232,LY, توا كان لقيتها المرة الجاية نقولك عليها 
1156835804603396096,LY, نظام رومني ولا نكسر قرنك
1156910978925256704,LY,أنا علاش تفاعلت معاها هكي وبكيت مع إن لفتة حفيدها لطيفة جدا  
1156918330583846912,LY,  خسارة كان خاطري نصلح باقي المعلومات المغلوطة اللي كتبها 
1156922233778003968,LY,"الله لايقولها أولا

قريت مرةإن سبب توهان اليهود  سنةفي الأرض هو باش يطلع من أصلابهم جيل أبي مايرضاش بالذل زي جيل أجداده وعارف معنى يكون عنده وطن يقاتل من أجله ويسعى في حضارته وتطوره
لعل وعسى اللي نمروا بيه حالياعلمنا معنى يكون عندنا وطن وأمن وأمان ونحاولو نحافظو عليهم مستقبلا "
1156926293830774784,LY,"  قداش ليه هكي 
تلقيهم أحزاب أحزاب وكان صار نقاش بين شخص من أي حزب يتشمتوا فيك الباقيين ويبدوا يكتبوا في تويتات مدح وشكر لشخصهم اللي ناقشتيه

حاجة صراحة منتهى قلة العقل"
1156927936760557568,LY, الفنان حاس روحه محور الكون ومافيش رجالة الا هو
1156929612359884800,LY," عندهم حق 
مرات ياخذ الفلوس ويلوحها"
1156932151058845696,LY, فئة عشرينات ولا خمسينات
1156933847185076224,LY," احنا ندلعوا ومش حامدين شبعتنا 
وحسبي الله ونعم الوكيل وخلاص"
1156933928424550400,LY, اي والله من أعمارنا
1156934464662122496,LY," وفي الموروث التونسي
لاموني اللي غاروا مني 
وفيها خوذوا عيني شوفوا بيها"
1156934891562577920,LY," خليهم يستمروا هكي أحسن وما ينسوش اللغة 
هاني في هالعمر ونادمة اللي ما سمعتش نصيحة بوي وكملت تعلمت اللغة باش ما نسيتهاش"
1156934991143677952,LY, حييي عليك وكان تخرب بشرتها 
1156940115035512832,LY, تحسيهم كأنهم من كوكب غير كوكبنا 
1156950250600435712,LY,"اللي عجبني إن اللي كاتب التويتة أب 

ربي يحفظ له صغاره ويقر عينه ووالدتهم بيهم "
1156956863461597184,LY, والله البقلاوة والكنافة حتى    ما عندك ما تقولي فيهم
1157049396191793152,LY," ماهو شنو نوع بشرتك وشنو روتينك اليومي ليها 
مرات فيه شي في روتينك ولا أكلك ولا حتى نفسيتك هي اللي مسببتلك الحب"
1157049537506230272,LY," قصدك أنا رقيقة باش شدت معاي 
تي من وين جتني الرقة مسكينة "
1157049625536278528,LY, هذي تتاكل خير مش تنحط عالوجه 
1157049858911604736,LY," أنا باهية والناس قالوا ح ر ف ة
هما الدروج وأنا عليهم غرفة "
1157050009818423296,LY," أنا باهية والناس قالوا ش ي ن ة
وشن جاب ورد العطر للعفينة "
1157050561855987712,LY, نحبها الأغنية هذي غير شديت روحي بالسيف كان هذا شن ايوقفني 
1157051918780444672,LY," عبيط وطريقة شرحه مستفزة 
ياكل في كلامه ويجري تقول من بيشده 
ويبدالك بمعلومة ويضيعلك تركيزك في نص الكلام وتنتبهي في أخر الكلام إنه جاب سؤال عن أول معلومة قالها والسؤال عادة ماليشي جواب 
والنهار كله ياكل تقول ميت بالشر"
1157052299505782784,LY, بري عالجيهم بكري قبل العيد
1157054161218916352,LY," أنا ما نعرفش روحي من أي نوع من المغردين 
لكن مش بشرط اللي بيقول مواعظ ضروري يطبقهم 
فيه حكمة تقول فيما معناه
إن الحكمة أحيانا ينتفع بيها الشخص الموجهة له وما ينتفعش بيها الواعظ 

لو كل شخص بينصح لأنه يطبق في كل شي ايقوله أو يكتبه راهو مافيش حد نصح بعد الرسول عليه الصلاة والسلام"
1157054528296050688,LY, حتى في اللحظات اللي نحس روحي مش عاجبني أسمي نحس إن مافيش أسم ثاني يليق بيا غيره
1157054630054047488,LY," يا اهلا وسهلا 
نور تويتر "
1157054732311117824,LY, والحروب والصراعات اللي تصير بسببه 
1157058565296676864,LY," لا ما شاء الله في تطور 
عمنول قولتيلهم ما تفرحوش
والعام هذا لطيفة معاهم ولو إن كلامك نفس المعنى "
1157059894056562688,LY," يعبوا علي أرواحهم
تقدد لحم اليومين اللي فاتوا في ثلاجتنا وثلاجات المحلات لا بل لحم العيد 

ديروه شواء يوم واحد وتمت "
1157060217353510912,LY,"  محمد وحملاته الجميلة 
بجديات شباب زيك شي مشرف وربي يكثر من أمثالكم ويعطيكم الوقت الطيب"
1157222349604700160,LY, ربي يرزقك ببنت الحلال اللي تقر عينك وتعيشوا حياتكم مرتاحين ومتفاهمين مع بعض
1157223323497050112,LY," ربي يحفظك 
إلا ما تلقى من يفقدك ويدور عليك"
1157224086466179072,LY," في الجبل الغربي قطعوا الشجر وحولوا الأراضي لمنازل وقلة هلبة المساحة الخضراء
والمشكلة الشجر اللي قطعوه كله زيتون"
1157227043958005760,LY, بديتي في الطريق الصحيح باش تولي مليونيرة 
1157227176946741248,LY, علاش تمنعوا فيه مسكين شن دارلكم
1157298950300475392,LY,"شنو جابوا جزء جديد لمسلسل زنقة الريح 
كاثرة الهدرزة على رجوع اليهود لليبيا هالفترة
وهلبة ناس يبوا الليبيين يقبلوهم ويقبلوا رجوعهم 

تي أنتم غير اقبلوا بعض اللي قسمتوها شرق وغرب وجنوب وحلوا مشاكل بلادكم بعدين فكروا لليهود

عجب"
1157299113454637056,LY,ما ضميتي حوسة حوشك لا بال اديري عصبان 
1157354361636499712,LY," هلبة مغرر بيهم زيها ومتعاطفين جدا مع اليهود 
ما يحسابوش اليهود فعلا كل همهم الفلوس وبس"
1157355062425001984,LY, ربي يعوضكم بجيران خير من اللي فقدتيهم
1157356357454049280,LY,"  والله متم نوره 
وكان ايديروا ما ايديروا"
1157722692025552896,LY,  خلاص معناها بنرجعوا لشبه الجزيرة ويرحبوا بينا السعوديين
1157723316360241152,LY, يبوا تعويضات وأخر همهم العودة لليبيا
1157723616940830720,LY, الافي والتفنيصة ماشية مع التويتة 
1157726248233242624,LY, بهدلونا حسبي الله ونعم الوكيل فيهم
1157726423316160512,LY, ويحسسوك انك عبء عليهم
1157728124689403904,LY, مبارك التخرج ياعيساوي وبالتوفيق يارب والفال للشهادات العليا يارب
1157729300751290368,LY," قولت نفس كلامك
ايديرولهم مقابر خاصة وإن إكرام الميت دفنه حتى ولو كان مش مسلم 

ومافهمتش لوين يبوا يوصلوا بعدم دفنهم وتصويرهم بالشكل هذا"
1157754895002472448,LY," هما جماعة الكهرباء خلوا فيها أليفة ولا متوحشة

تي كلنا توحشنا مع هروب الضي وشدينها دعاء وتكشيح عليهم في هالأيام المباركة ويارب يقبل ويبان فيهم دعانا"
1157768993056407552,LY, على حسب لو خاطره يفهم ولا خاطره نسكت
1157942205513949184,LY, كل أحد هكي ولا السبوع كله هكي 
1157965908536700928,LY, تخلصي منه بالتدريج لو مصممة وعندك عزم وما تقطعيهش مرة وحدة لأن الجسم حيصيرله زي الصدمة وتطلع لك أعراض إدمان السكر ومنها العصبية والمزاج السيء وقلة الجهد والتعب السريع
1157970379002077184,LY," ألف لا باس عليها وطهور بإذن الله وربي يشفيها ويحفظها

احمديلي ليها السلامة ياحنونة"
1158001551979495424,LY,"لمية أو بالفصحى الماء
هلبة خبراء تغذية ودكاترة ينصحوا بشرب لمية عالأقل  لتر يوميا أو بحسب وزن الجسم اللي حيطلع  لتر أو أقل أو أكثر شوية
ولمية مهمة جدا لكل العمليات الحيوية في الجسم ومهمة للبشرة والشعر
بس اللي هلبة مايعرفوشي إن الجسم مايتحملش أكثر من كوبين امية في الساعة"
1158002559971467264,LY,"يعني لو شربتي أكثر من كوبين في الساعة الجسم حيتخلص من الكمية الزايدة ومش حيستفيد منها وهكي كأنك يابوزيد ما غزيت 
فشنو الحل هنا 
الحل إنك تقسم ال لتر على مدار اليوم
لنفترض مثلا كوب امية كل ساعتين
بداية من الساعة  الصبح للساعة  الليل
فيه تطبيقات حلوة تقدري تنزلوها باش اذكركم"
1158005476497534976,LY,"التطبيق فادني جدا وإكتشفت إني ماكنتش نشرب في امية بكمية كويسة تناسب جسمي وهذا أثر لي علي بشرتي اللي زادت دهنيتها ومشاكلها بسبب قلة شراب لمية
بس مع الإلتزام بالتطبيق وتوزيع كمية لمية علي مدار اليوم لاحظت تحسن ملحوظ جدا في بشرتي
الغريب إن حل مشاكل بشرتي كان بسيط جدا وكنت غافلة عنه"
