id,dialect,text
958446666197164032,DZ,"  ادا كان رد على انتقاد تخطبي شعب كامل وتزيدي تقول شعب خائن
هدا هما فنانين لي يجيبو عار لبلادهم انتي خائنة"
960843421832433664,DZ," لو كان جاو عندنا
يكلوهم "
961549283374845952,DZ, راح تكون متوجدة بالجزائر في ايام قليلة اكييد راح تقوم بوجب ضيافة أحلى اعلامي ربي يوفق
963029592041803776,DZ," ممكن نتوقع بصدفة 
راح تكون عندك حفلة كبيرة ربي يوفقك"
969924347661045760,DZ,الله يشافي رئيسنا والله يخليك كامي صاحبة واجب 
976752007792021632,DZ, كل عام وانتي بخير والله  يحمي ليك ولادك وخليهم لولديهم نحبوك بزاااف تحية لك من فانز سهيلةبنلشهب  لي بيحبك الجزائر
977289614686908416,DZ,امال صوتها حضور يسحر يخلي كامل يسمعوهاااا 
977825566190702592,DZ,    فنانة  عالمية سميرة ومستوها اكبر من فنانين عربيين روحي شوفي لما دخلت برنامج فرنسي  عملت ضجة 
977825871590576000,DZ,    بس هدي لجنة عنصرية  تهتم لشكل فقط وليس لصوت يا ليت يقلبوب برنامج أحلى شكل
984790838218665984,DZ," اشقاء يشتمو ويرقصو على ضحايا وكل عالم عزات وهما حتى واحد 
خلوها عندكم يا منافقين ميشرفنا يا خونى"
984897197861949440,DZ, ااااه يا دزير  وش ركي رافدة
986226228700090368,DZ, عواطف باش يولي صاحب مصنع مسكينة ديرتو يحبها صح
986926847060529152,DZ,   خسارة سهيلة راح لبنان تتكرم موركس دور كنا نتمناء نشوفها معها هما يحبو بعضهم
987408667334119424,DZ," نشاءالله بريم جاي تغني معاهم
ويا ليت تصوري في حصة فندغودي ماشي عادي مع ضيوف مشاهير"
987683508234711040,DZ, كي تدو دزيري وحنا شكون يدينا
987797829014970368,DZ,ضدتوقيفتلكالايام  و ضدتوقيفرايسقورصو
987815258449416192,DZ,    صح كلامك  هدي اهانة وزيد تشوف جمهور ها واش تختار
988176271145340800,DZ," هدااا اسلوب
يا زبلة وتموت على فتن الله يدلك  يااااحيوان وجعش حتالة مجتمع"
989138034225446784,DZ,اكيييد رغم حقدبعض العرب ماننساء هدو هما اخوننا العرب لي ياخد جائزة يصير في نظرهم وحيد لو يجي لعب اخر وياخد جائزة ينسو شكون صلاح 
989431457000120448,DZ,  بالتوفيق بنت بلادي كنتي رائعة صوت كبير يليق يوقف في مسرح كبير اكثر اغنية حسيتي بيها بلادي غربة صعيبة صح نشاء الله نشوف في جزائر
990548094235406336,DZ," شكرااا بزاااف اهل مصر جدعان
يستاهل حسينبنالحاج  لقب احلى صوت وفنان محترف على مسرح ومتمكن من كل الوان اغاني حسينخاطييير"
990549201615507584,DZ, ميرسي اخي بزاااف على دعمك رغم ان مش فاتحين خطوط ل جزائر لكن حمد الله عندو شعبية في وطن عربي واكييد راح يدعمو فنان محترف يستاهل
990552320453865600,DZ,"  لالا
مش رقم  هما كل اسبوع يتغير رقم ياااليت تنشرووو كامل باش ما يروح تصويت لغير و"
990999340092219392,DZ, كنت بتمناء تتكرمي في موركس ونشوف مع جزائرية سهيلهبنلشهب  دور عجبني بزااف مسلسل وتفرجتو على جالك الف مبروك تستاهلي جائزة
991997807371448448,DZ,"
هدو هما ناس مختلة عقليا واش تتوقعين منهم حرف ميم يقولو هدا سين مش مهيم وأصلو من وجدة "
992159533047873536,DZ,ميرسي كنوز نشاء الله نشوف دعمها يوم السبت باش تتاهل لنهائي وتاخد لقب 
992163923767029760,DZ,"    لالا منسينهاش يوم السبت يفتح تصويت مدة دقيقة 
نكثفو لها تصويت رخيص ب دج برك"
992514062805360640,DZ,   علاش ما نقولها لالة واش هدا تقافة لي عندكم نتاع سرقة
992676943765102592,DZ,   شكرااا بزاااف وماتنسا ممثلين لي معها سارة علامة وسهى وكل حاضريين
992691448612052992,DZ,   يا ليت تكثفوو تصويت كل اعلامين وفنانين مش بس جمهور ولزم توصل رسالتنا لوزير اتصال يخفض تسعيرة
992766724155101184,DZ," خير واش صااار
ياليت اهلنا بسعودية توقفو جنبنا وتكثفو له تصويت تعرف حنا مش فاتحين خطوط رنى نصوتو بدولي غالي بزااف"
992850417662005248,DZ," رقمها 
مرة لي فاتت كانت  كتبوها على شاشة"
992880179063160832,DZ, خليبرنامجدفيسيتحرق يتبلوكي  يفلس
993818001467150336,DZ,"قتلتيني بضحك مالا نتي  طفلة توووب
قصدي عوطف توووب "
993897278774632448,DZ,  من صغرك ونتي حلوة بزاااف يا شابة يا شابة يا شابة بنت شامي
996870450927030400,DZ,أكيييد نعم استهزاء به حاب يبين بلي محليين نتاوعو احسن منو وكي خسر حاب يرجعو  
998735971553366016,DZ," هدا زي جزائري
شابة بزاااف قمر طالعة ب قفطانجزائري
لباستقاليدجزائر"
998738299857588224,DZ," لو تشوف مسلسل وردة شامية
ابداع في ابداع شكران مرتجى وسلاف معمار وسلوم حداد احلى مسلسل عربي لحد الأن شفتو"
999576706640998400,DZ, شح فيه امين يا رب وربي يتبهل على اقل بعشرين بيتوقت صوالحو جاء يعيط ليهم وين راهم محليين نتاعك
887990231856803840,DZ,"اكييد كلنا ايد وحدة وانا سهلاوية وندعم كامي تاني لزم جزائريين يوصلو فن نتاعنا للعالم مثل لي قبلهم
دانس اموتهبايديا 
 "
888383280973742080,DZ," أكيييد راح تكون روووعة مثلك يا سندريلا 
حنا ناطرين ليوم لي تغني رأي جزائري يا قلبي فانزسهيلةبن لشعب
دانس  اموتهبايديا"
888482861048877056,DZ,"  الف مبرووك نسرين نتي عندنا تسوي هدا كون اغنية تهبل بزااااف  وتاقنة لهجة  جزائرية 
   فيفا للجيري  فانز سهيلة يحبك "
889204171496452096,DZ,ربي يعيشك ويخليك كامي تستاهلي كل خير و سهيلة نشاء الله نشوف تكريمات مع بنت بلادك ونجاح اغنية اموته بايديا و دانس  
889208550656016384,DZ,"تستاهل واهم شي مباركة ولد بلادك وفنان عالمي عقبال نشوفو ديو معاه اغنية راي جزائري
دانس
اموتهبايديا "
889556841407107072,DZ,  لا سهيلة حتى فانز ترد عليه وانتى لالا يمكن كانت مشغولة وما تدخل لتويتر و موقع تواصل
889800902252560384,DZ,"  والله غير جبتها شاب كان قلها يمكن 
تجيه  في عين
"
892366348835328000,DZ," الف مبرووك من فانز سهيلة لبنت بلادي تستاهلي نجمة قادمة لوسط فني راح يحسبلك الف حساب
   فيفا للجيري"
895619880858341376,DZ, خلينا منو مغتصب كيما داك خلي يسمع غناء في حبس
896794477565812736,DZ," مرحبا بيك في جنوب كبير
ولا جايه غير على دهب"
897039492388970496,DZ, لي يقول لعكس لي حابين يوقفوها من غناء وشهرة ومن غيرها مسمات ملكة طبعا عرفتوها
899959887941316608,DZ,ماشين بمنطق الي عندو فلوس يغتصب براحتو والا ما عندو يعدم انحطاط اخلاق للاسف خلاهم يفرقو بين بشر 
901197056907386752,DZ,   ميرسي نتمناء راح نشوفها معاك ضيفة وديما جديدها عندك في برنامج
901418654713221248,DZ, وركزو على طلابات جمهور باش يحتل صدارة برنامج ديرو اخبار فنانين عرب مش تركزو على مغربين موهب  وناطرين فنانة عالمية زاهو
901428857273810944,DZ,"  ايه بصح بلا سحور لخاطر ما يدوم انا نجيبو على حب وما ندلوش 
قدام ملايين يضحو علية ركي فاهمة"
901429622243557376,DZ, نقعد بارة وافتخر على نجيبو بسحور ومنبعد يرقوه يروح عليا 
901794205407866752,DZ,خلتو يزحف على رجليه ويجي يدير عرس في مرووك وبعادتهم هدي هيا مرووكية مبرووك ربي يهنيه 
901842990003622016,DZ,  اولا انا مشركت فمي نتي اعرفي واش تقولي هدا ريك متعجبك بصح مش تقولي مقرف على واش رديت عليك
901843852599984000,DZ,  اي شخص ممكن ما يحب اكلة من اكلات عادي بصح على اقل يحترم اكل  وما يقول مقرفوانا منعديش وقت لتفاهات
901844285842186240,DZ, مهم فهمتي كلمة وحدة خير من مكانش
901846171622281216,DZ, زعما كاينه يااااخروطييي برك اعلامين وتعرفيهم يبالغو يقتلو بنادم وهو حي
901915934755086336,DZ,  شوفي يا بنتي رني مليحة معاك احترمي روحك كان خلطوهاء معاك تجي تفشي غيطك فيا نخليك تشوفي استعرض
901917954585088000,DZ,"  تقودي نتي تلعبي مع دراري وتفاهات نتاعك يااازبالة
ماتزيديش تغردي عندي يا وجوه بخس اففففففياااخي"
902282569458130944,DZ,مالقاو غير يلغو حفلة فنانة عالمية محبوبة زاهو يا خسارة  مازالهم في خطىء تقني ناس تطور وهما مازال 
903678035299364864,DZ,حنا رنى نشوف غير متسول وعارعلى بلادها وقناة صاحبة فتن غير نتي نهار عار تفوو قناة كي 
903707522967760768,DZ, يااا الله ربي يحفض اهلها ديما ناسها تلقاهم هكا مش غريبة علينا مش اول مرة تلقاهم في حشود 
904094693897719808,DZ, علاش هدي كرة يوم ربح و يوم خسارة وعلاش كي يربحو تحبوهم وكي يخسرو تجو ضدهم تبقى مجرد لعبة كرة مش نهاية العالم
904404589809684352,DZ, هدا انسان سبب مشاكل نتاع دزير حاليا شفت رامي هدا شخصين جاهلين دايرين علم بحرين مش قطر 
904453882633494400,DZ, وحد يروح يعيد واحد يروح لبرشالونة واحد يروح سياحة يومين واش هداكل وحد يمثل فريق بلادومش نادي ليلعب واتحادية زفت اساس فوضى
905194482232152064,DZ,  عقوبة ليكم يا اصحاب ترمب ونتانياهووو كلب صهيون واش يجي منكم تحسو غير على بعضكم نشوفو واش ديرو
905330501640212352,DZ,أحلى جمهور بالدنيا جمهور جزائري راقي 
905331664850739200,DZ,شكر لك الله يخليك ما نسيتي بلد كانت فخر للعرب وكانت عائق كبير ل المانيا بطل العالم 
905718464010178560,DZ,  شفتي كي لعبو في بلادهم سجلو ستة بسحورهم وكي لعبو في مالي حتى دربت جزاء ما قدرو يسجلوها تبقى حاير
905869065566244864,DZ,  علاش هدك لجنة شكون حماقي عندو خبرة وهدك احلام لي ماسكة أم بي سي أكيد فريقها ياخد لقب غصبا عن الكل 
906273628517490816,DZ,   سنوات وهو يلعب مليح هدا جزاتو يجي سي طرشي في حاب يخرجهم يتمسخر بينا هدا راح يهدم لبلاد ومنتخبنا
908045538678976384,DZ," 
ادا هدا اميغهم هكا شعب واش نقولو ميمي "
908649327186333568,DZ,"  
يسلم فمك كلام صح واش يجيك من تحلاب وفي أخير يربحو شعر"
909027667705499648,DZ,  عيب وعار مش اخلاق فنانة كبيرة هدي مسخرة فنانين
909517616913432576,DZ,"   
نهار وتفاهات  حسيتها اكبر مني ومنكم علاش هدي وينتا كبرت "
910176307119558784,DZ, هدا كلب طرشي ولا واش يسموه راه حط منتخب في هاوية  وقضى عليه تماما افرحو بخروج محرز العرب كل تضحك علينا لزم يربحو باش نحبوهم
910429649590800384,DZ, لزم نديرو حملة ضد طرشي في كل موقع التواصل ومجموعات ونخليه عبرة لكل واحد حاب يدمر لبلاد هدو هما مزبلة جزائر
910484201207713792,DZ, شكون هدا شكلو بيدرس في متوسط
911191247901069184,DZ,"هدي قالت ليهم ارقدو وتغطو
وشنو هدا بن غبريط هدي تمادات ياسر
السنهالهجريهالجديده "
911195551894564864,DZ,  عجبتك هدي اقري مليح 
911204924368785408,DZ, ايه فهمتك عندك حق انا معاك اشد ما اكره انسان منافق
911212616483209216,DZ,"ضعواحدالبنغبريط
ضعواحدالبنغبريط
ضعواحدالبنغبريط
ضعواحدالبنغبريط
ضعواحدالبنغبريط
ضعواحدالبنغبريط
ضعواحدالبنغبريط"
911558839895457792,DZ,"علاشحبيتسهيله
علاش يا درى نسقسي قلبي هو راح يجوب شكون ما يحبها كي يشوفها ساهو ربي يوفقها "
911871661422661632,DZ,   وعتدرت على مسلسل مقدرت تحضر  تصوير كان في نفس وقت تصوير عاشور هدا واش خلها تعتدر
912023767949479936,DZ,"علاشحبيتسهيله
طيبة قلبها وفخرها بلهجتها وثراتها وين تروح تتكلم عن جزائر"
912346359000387584,DZ,  اكييد اخطأت وراح تتحاسب كلام الله وتجلس عليه الله ينعلها
912348786911059968,DZ,  تهنينا من مخرركة جاونا برشابرشا
912349649641656448,DZ,  هدا راهم يطبخو في طبخة الله يستر وما تنسيش جمعة اتحاد تلعب معاهم
912356752548663168,DZ,  على فكرة مثل ما بتقولو انا بعشق سعودية يا حتالة واش دخل سعودية علاش سعودية في شخصين
912357316758003584,DZ,  حتالة وزبالة انت غير نح صورة حسابك منافق ودافع على وحدة تجلس على شهادتين  الله ينعلك تفووو
912420371642687616,DZ,من فانز سهيلة بنت بلادها راح نستنى لقاء بفارغ صبر توحشنا امولة بزاااف 
912633306562384000,DZ, من نهار لي دخل للحكومة دزير ما شفت ربح اااااااااه وينك يا تبون
912663882937901056,DZ,   صحافة ما ديرش عليهم نصهم كدوب وخير مثال نهار 
912664291655995392,DZ,  وااالو كاين كامليا وحدة مريم حليم كل مرة يعجبك ستيل لي يخيروه
913148511650279424,DZ,"انااااااعلاش ما درتو رقمي  
وصلت مقارنة حتى شكون لي لبس ياااخي حارة "
913151640101884032,DZ,"هدا حاب يقول خلصو على كل خطوة في طريق
تخيلو دودنى غاليه بزااف وطرقات كلها حفر ودودنىهربىتسلك "
913341598213209984,DZ, كاين بزااف كاين مريم حليم وسهيلة معلم وتؤم شروق ونسرين طافش وكامليا وبزاااف
913738182830718976,DZ, يا ليت تحطي صورة مع نجمات وطن عربي ومع سيرين عبد النور وسهيلة
914087772947976192,DZ,  في هدا ايام مباركة ربي يحرق كل اصحاب فتن وناس لي تعمل فتشوب صوة مثلك يا كلب الله كبير راح تحرقو في نار يا كلاب يهود
914098247765020800,DZ,  امولة يا عسل كل ناطرين حصة توحشناك بزاااف طولتي يغيبة تحية من بلادك   من فانز سهلاوي   
916635515000119168,DZ, انا رني مسافرة في طريق
917012514793250816,DZ, منتخب رسميا صار دخل قاع هامونوينك سبونج بوب طلعهم من قاع
917077513532211200,DZ,     شفتي راح ينتحر مطرب لي غناءها لو سمعها
917307138271215616,DZ,"  مكانش منها
هدوك ناس مازالهم عايشين"
917308979025514368,DZ, هنا عندنا بلجملة كان جينا نبيعوهم  كان رنى مش متقشف لي رنى فيه ليوم
917437064903348224,DZ," 
مازال قاعدين يبهدلو في روحهم"
917820094931185664,DZ,تعرفي في كل كوكب كاين عقدة وحدة هيا جزائر  راهم قريب كي يجو ياكلو يسمو بينا 
917857320255852416,DZ,ألف مبروووك تستاهلو كل خير يا ابناء قدس 
917876671541334016,DZ, لا خلي نخبوها للعام جاي خليهم يلعبو بعرق جبين ويجيبو نقطة مثلنا جبناها بعرق جبينا
918164973368565760,DZ, عجبا تكون قاعد يجي كلب ينبح وتبلى عليك حسيت روحي زعيمة داعش او ترامبالله يهديهم ويطرطق كل عرق فيهن
918165857695666176,DZ, أكييييد موبليس والكل يتألم
918209470152564736,DZ,على انجاز لي عملو في منتخب وهدك زطشي لزم يتعاقب ويسلك دهم من جيبو 
920031605451878400,DZ, اااهيا منافق اكثر شخصين منافقين ماجر وبن شيخ في عهد حليلو قال مدرب مش اساس لعبين محترفين مش حليلو لي طلعهم في مونديال
920325075580211200,DZ,الجيرينو عالمي وكل اغانيه دايرة ضجة في دول اجانب كامل يحبو اغانيه تلقايها في كل اماكن حتى حفلات بالجزائر ناجحة جدا معشوق جميع 
920402051351351168,DZ,جبت ليك أخير صيحات موضى نتاع مجرد  
921419946655142016,DZ, عواطف وشنو حسابك على انستغرام
921630364233273216,DZ, كلام في صميمصح كل اموال بنوك من زطلة ومخدرات يعني كلها حرام في حرام
922910181243150336,DZ, نورمان مو زوجة مساهل ولا مساهل ماشي ساهل
925080929177161600,DZ, هدو لعرب عاسين دزير واش دير تكلم على بلادك لدعم صهيون اسرائيل وتوقف ضد كل دول عربية
925082149837066240,DZ,"مناوجر
وين مكان أمل بشوشة تولع لحلقة وترند  نجمة نجوم "
925251701891850240,DZ,الناس واش تفكر يستغلو صلاة في مسجد باش يرشحوهم الله يزيدنا عقل 
925256531586805760,DZ, وكي تكون راقد في صالو ويدخلو عليك ضياف متعرف تنوض ولا تلعبها راقد
925805306059292800,DZ,  اخي كان حاضر في سباق لي عملوه في منيعة وقال اتنين من احصنة ماتو واحد جريح واشخاص طلعو من مشفى بخير
926345737495040000,DZ," نورمان مو من التلاتاء خبر سمعتو  كان نقصنا قمر تانيشعب محضوض من تقشف حتى لقمر ما قد يصبر باش يشوف  
جمال "
926540040750141440,DZ, طليت من راس كاس ولقيت حوش جيران 
927149488850030592,DZ," 
 واش منك بصح هدا ويحيى حاب يبزنس بينا"
927152942171459584,DZ,     شكون هدا حمارة وبلغة منين جات حبت تشهر روحها خلي كلاب تنبح وتصيد لحم بنفسها
927464240834859008,DZ,"  حسب اخبار 
عيطو ل كنزة وسهيلة لل حفل لكن كنزة رفضت لسبب تصويرها اغنية جديدة في مصر  حطو مكانها ابو حواجب"
927608481246535552,DZ,شفتها خبر في برنامج هشتاج  وضحكتني منشطتين  قالو يااااويلتي من كليب وهدي متشرفناش من دزير ونقول للمخرج واش هدا لا صورة ولا صوت 
927647933461417984,DZ,    جايين كي دبانة لصقين هنا شوفي يا زبالة نكتب واش نحب دا كلمة صحرا الغربية تكركرتو هدي مشكلة زطلة
928270850163388416,DZ,"
شكون راح يصوت في انتخاباتالتشريعية "
928320557346623616,DZ," ربي يرجع حق مظلوم 
مهم تستاهل احلام وكانت تفكر واش راح تلبس في مباشرلهم لا شماته"
928533981259288576,DZ," 
اقصفي اقصفي يا بنت بلادي"
928709622436900864,DZ,"سمعتو يا جماعة خبر
كاظم وشرين وصابر ما نسحبو كيما كنا متوقعين ادارة   هيا لي مانداتش  ليهم وصابر هو لي صرح على اقل تشكرنا على نجاح موسم"
929096755802726400,DZ, طبعا حاكم يكوز مناصف شفتي  كم هائل من اخطاء ما تحسبتش على نيجيريا كان كنت في بلاصتو نعمل كثر
929249124393914368,DZ," دزيري ودهمو حامي ولد صحراء
لقطة اسطورية نتاع زيدان"
1012691096021950464,DZ,يبدعون في الكلام يبدعون في الفلسفة يبدعون في نشر الحكم ومع ذلك يبكي الواقع منهم
1026827856259760000,DZ, بنحبك بكيتينا و خوفتينا عليكي بس الاحلي شجاعتك و تغلبك علي المرض ألف الحمد الله علي سلامتك ما علي قلبك شر بنحبك بزاف بزاف الجزائر
1052618429805531136,DZ, الله يحفظه لك ويطول في عمره يارب
1069695946534068224,DZ,جالسة اتصفح مواقع التواصل
1072172985325359232,DZ, يالطيف ألطف وشنو هاذ التصرف والله حرام
1072939452119609216,DZ,أنا مش كاملةلكن مش نقصاك
1076595611485569024,DZ,طبعا ربي يخليك خويا ويبارك فيك 
1134057751380942848,DZ,"
المصاروة وين كاين بروجيكتور طفوه رحمة على الولدين ماتعمولناش السيد "
1142848460917497984,DZ, علبالي مي نحتاج الفريكونس
1144340661824606208,DZ, اكيد راح تتغير التشكيلة خصوصا اللاعبين لي تحصلو على بطاقات ماضنيتش راح يدخلو
1148183609104375808,DZ, مشاء الله عليهم كلهم نجوم
1150864148571525248,DZ, لي ماخرجش هوا زفان وفيغولي وباينة علاش كون مايبقى حتى لاعب من لاعبينا القانون يسمح لنيجريين لعب الكورة والناس لي تهدر ماتفمش فلبالون
1152516767983505408,DZ,  ههه فات مقرمد هذا لي يقلك طاحو في مول الفول
1152546948538404864,DZ, مايعرفش ينافق نستعرف بيه
1175517531685249024,DZ,   روح ياود اجري اتغطى ونام محرز جاب كاس افريقيا للجزائر انتو بوشعور نكد عليكم والامر انو ذلكم في ماتش الكونغو بعد تسجيله للهدف ولا دعمو للمتحرش عاجبكم كل ده يابتوع وردة
1183111992904687616,DZ,  حليل ربي يداوي لحوال
1183114072365113088,DZ, ههههه كارثة كيما يقولو المصاروة عوزين يحوشو على كلو  سرقة عيني عينك
1183117210774048768,DZ,   ههههه من نيتك والقفطان لي هوا عثماني والشدة التلمسانية والبلوزة والكراكو وغيرو وغيرو حتى الموتى نسبتوهم ليكم كيما يوبا وماسينيسا  واكبر سارق ايمن سرحاني وللمهم من كثرتهم ماشي راح نذكرهم كامل والعجب كلشي تسرقوه تقولو انو وجدي وكأنو وجدة قارة وهيا ماتجيش في ربع مدينة جزائرية
1183334853468659712,DZ,   الفرق بينا وبينكم الجزائري لما يعيد اغنية ينسبها لصاحبها عكسكم السرقة في ةضح النهار
1184859741786386432,DZ, سلامات نشالله ربي يشافيه ويعافيه
1186391361286823936,DZ, ياريت جات على الاغني فقط ماتركو لا اغاني ولا لبس حتى الموتى بقدرة قادر اصبحو مغاربة والاكلات وغيرو وغيرو
711581699629514752,DZ," انا منحبش نهدر بصح كثرو  ربي يهديهم 
لازم يحترمو أي واحد يشجع سوها حتى لوكان يشجع فنان آخر 
انا شخصيا سهلاوية تحترم إيهاب"
712726117736706048,DZ,"   
وين يلعب و قتاش مين فيها جزائري نشوفه و ندعمه اكيد"
