id,dialect,text
778655151615832064,KW, لا طبعا  بس حلوه 
779646755973595136,KW,مع الحمل أحب ألبس الفساتين  هذا اللي سألتوني عنه بالسناب  
779780485178355712,KW, شلون صاير طعم كجب ماك
781978224918163456,KW, والله الي شغلهم واضح ماينخاف منهم
782569396782895104,KW, كل نفس بما عملت رهينة 
782604614847913984,KW, احب الفلسفه عاد انا
782605420263333888,KW, اييي بس انت قاعد تتكلم عن المعنى الحرفي للكلمات  الكلام بالشعر بمجازيتها وتشابيهها
782606932242825216,KW, صح اذا اللفظ اول مره تسمعه  بس اللفظ معرووووف ووايد يستخدم بمعنى ادخلت السعاده بقلبي
782608776767631360,KW, انت استحرمت اللفظ لا اكثر وماحبيت تخليها بقلبك 
782609533160087552,KW, يالله عاد قاعدين نتناقش 
736145414387306496,KW, تحب المجكنم اخذ هذي  
736146158276497408,KW, هههههههه قاعده اتخيلك راكبها جتفك مطلعه من الدريشه
736789569400672256,KW, مو موضوع حلال ولا حرام  مو حلوووو مو انيق  
737997598204801024,KW,ولها عين تدزلي اياها بعد
738102987319545856,KW,  ههههههه مريوم بنخسر بعض
740882039944192000,KW, امبي احساس الفضول عندي مثلك تماما  من زمان انا جذي  احسه من العظمه 
741219099850735616,KW,"أفهم ليش البنات يحطون صور ممثلات بدل صورهم الشخصية  عادات وتقاليد وتخوف أو غموض
بس ما افهم ليش الرجل يحط صورة واحد ثاني بدل صورته"
741529534432960512,KW,مكياجي وتصويري عالمذيعة نورة الحميضان   
741534228945489920,KW,مكياجي وتصويري للجميلة   بدون فوتوشوب كلللش مشالله 
741546166060453888,KW, شلووون ادري متى اقرب شوي اكثر  
741565101371707392,KW,وانا لو تشوفني أمي لابسة نفس اللبس مرتين بسناب تزفني  
741565357962461184,KW, خل يحط علم الكويت لا يحط صورة شاعر 
743383206964133888,KW, القلاص اذا مو مندي ما يشووووقك
745417453887455232,KW,دراعتي اليوم  انيقة ببساطتها  تمثلني حييييل من  
746647640587251712,KW, اي كل شخص انت ماتحبه بعطيه
747076194173063168,KW,الريتويت من بعض الناس  غييييير 
747567106548441088,KW,شوفة عدد اليوز على فيديواتك بالانستغرام  يرد  روحك
747721936076148736,KW, مع ان ماكو شي اسمه ميتاقيزيا 
747725718285651968,KW, بس انت الي تسولف بالميتاقيزيا بدرب التبانه 
747726365919711232,KW,  اييوا  وانا لما ما يعطوني هالتمييز ويخلون كل مكان زحمه  اضطر اني ادفع و اروح مستشفى خاص في كويتيين مو مقتدرين
747728527982731264,KW, زين ريلاااكس كنت قاعده اتصيد الاخطاء بس 
747758848618934272,KW,"    
وين المساواه وانتي ما تدخلين المستشفى الحكومي الا عشان تاخذين طبيه  كل شغلج بالخاص"
748452749902217216,KW,الناس الي عندهم احد يخلص أشغالهم بدالهم تره طااايفتهم سوالف ومواقف ما تتعوض
748454853379252224,KW, ها بنهار رمضان عاد
748515774785069056,KW, اييييه جان زين يعود الشباب يوما
748817486334746624,KW,لازم احد يدوس راسج عشان تحسين انج مره 
748818008106151936,KW," اوف استفزتني  اشعلاقة السياقه والشغل بانها صارت ريال
اهيه تحب تكون ريال"
748818822090469376,KW, وما يخليها تلبس الا دراريع 
748823536370847744,KW, لووووووول مفروض تخش الفلوس تحت الكاشيه عشان تصير مره 
748824110646657024,KW, الكلام مو مربط ببعض نهائيا  مافيه اقناااع
748853237932056576,KW," المراه كل شي تسويه لان اهيه تبي تسوي كل شي  بعدين تستوعب انها قاعده كل شي تسويه بروحها
المراه بذكائها كل شي اييلها"
748870932136157184,KW,  فاطمه اعتقد الموضوع يفرق من مره لمره  شوفي امهاتنا  الي تحب تتدلع بتتدلع  الي تحب الشغل بتشتغل
748872685699100672,KW,  صحح كلامج  الريال مو مضطره تعيشين معاه اذا كان جذي  وماراح يتغير لانج ما سقتي او لانج محبوسه او ماتسافرين
748873102759718912,KW,  اييي ممتاز كلامج بس ماله علاقه انها ما تبي تسوق ما تبي تسافر ما تبي رصيد بالبنك  ماتبي طموح 
748895461243748352,KW,  عطيتها اكثر من فرصه 
748897412530466816,KW,غسيل مخ مسوييين انهم حبوين 
748904134968049664,KW, مالتج كل الشعر فيها على مستوى واحد
748921654403821568,KW,فعلا لما المرأه تاخذ دور الرجل  الرجل بيحط ريل على ريل وبتصير اهيه الرجل بالبيت  بس هذا ماله علاقه بأنها تسوق ولا ان يكون لها طموح
748928071307292672,KW, لا غلطانه  الموضوع السخيف ماخذ  لايك باليوتيوب  مشكله في ناس تفكر جذي
748928622271037440,KW, مو واضح عندي هالشي
748951118462451712,KW, اي شي يصير عليه دعايه تدرين هبه وتروح
748985965289537536,KW, ممتاز كلامك واتفق معاك اعتقد بهالزمن صار في شغلات المرأه تسويها كانت حصر للرجل بالسابق لان بهالزمن محتاجين بعض عشان يتكاملون
749567674582171648,KW,  الله ساتر عليج بس 
749573039474573312,KW,  لووووووول وافقي على شنو شصار شنو دريت
749573791555129344,KW,   والله والنعم فيك انت
749597653361623040,KW,  اسلوبها خذا  لايك للامانه يعني
749612499973070848,KW,   واحد كتب ان هذيله عندهم متلازمه حب التعذيب 
749696940972048384,KW,منو هالممثل ويهه كوميدي بدون ما يضحك يضحك وينحب  
749704667655962624,KW,"الشرهه علي  لما اعطي السواق ويه
عطيته مجال يطلع من المسفط  عشان يسفط بمسفط اقرب منه بسيارتين "
749705310881939456,KW, صفة الحرص في الصرف   يشوفها الشخص صفة حلوه وذكاء وتوفير ويلقى مليون تبرير يجمل هالصفة  وغيره يشوفها شي حيل سيء
749705687312326656,KW, بعد شنو بعد شنو قاعده اعصر مخي 
749738161371226112,KW,  ما يجوزلنا حتى نقيم الاوضاع 
749739985268535296,KW,  عزمتها توني  شفتي وين الحرص بالموضوع
749789862497251328,KW, اخيييه تاخذين قلبي جذي
749790573893148672,KW," تخيلي مثل وتساب برودكاستات بس تضيفين من نك نيم مو لازم رقم
واللسته ما يشوفون بعض
وما يقدرون يردون
يعني بس تقرين معلومات واخبار"
749790804575649792,KW, ماحب ستايل بني شربت
749791386568884224,KW, مو كووول يعني كشخااااااههه
749907414506434560,KW,راح أمشي معاك للآخــر 
750215958350925824,KW, احتياجات الناس بطنهم ويههم ومخهم 
750881388174401536,KW, مريووووم يبيله طلعه نختمه 
753114458550075392,KW,  هاااا بلشتي جنه جوجووو
753115000743559168,KW, سكرت اللعبه فتحتها طلعولي وااايد
753115688491966464,KW, عاد ردك كان مال واحد هاااوي
753116374717853696,KW,  وانا الي كنت ابيج تترجيني عشان انزلج اياها
753116557543374848,KW,  عندي موعد  بطلع وياكم بعده رجاءا
753117146784342016,KW,  يالله بينا كونفرس كول 
753117835933716480,KW,   ميمي خلج جاهزه يوسف يقطني عندج رجاءا ولا عند جوجو
753182240192987136,KW,"مشتاقلك ولا هدا بالي 
ولا حالي يسرك
طمني إنت اشتقتلي  نسيتني تسهر  تنام "
753183532760043520,KW, افا عليج بس في ناس لي دشوا ما يطلعون 
754942917672861696,KW," اخييييه شالكلام ماتحمل والله  شكرا أسماااء فرررصة سعيييده
وتذكري دايما الواسطه اقوى "
755515762631118848,KW,"لا جد جد في ناس ودك تقولهم
اشعندك قاعد بقلبي خلصت الاماكن
ماعندكم بيت"
755515842129985536,KW," هلا بالورد  لا غلط
هاللون مفروض مطفي "
757330918021496832,KW, الي فوقها توصيل  اللي تحتها يستعبطون
757331102579167232,KW, لوووووول العدسات البنفسجيه الي داخلهم مربعات ومثلثات
757335483236122624,KW, لا في ربع ثانيه تحتهااا
757343733755052032,KW, نحن نأكل والحشم يطبخون وينفخووون
757515719215046656,KW, لوووول يمكن كل شي حلو ما ينفع مريح
758215051903991808,KW,الفرق بين اليوم الحلو  واليوم العادي  إنك شلون تبلش يومك
758216261486731264,KW,مع جبن كرافت ولا جباتي ساده 
758216482752962560,KW,في احد غيري ضاق خلقه 
758219202306121728,KW, اعتقد في مفتاح يقدرون يقفلون الثلاجه  والله ضاق خلقي ماكو مسؤوليه
758245737138417664,KW,  الخطأ يصير  لما اصوره واضحك يعني اني غير مسؤول وانه مايعرف يدير باله على اطفال جان زينه عايش اللحظه بس ما وثقها
758403183349755904,KW,  لا مو بذاك الاهميه  بس البنت تحب تشوف نفسها بنفنوف ابيض وطرحه 
759812275725144064,KW,محاسب مكتبة جرير دفعني  دك زياده  لو ما جيكت وراه  بالصدفه جان دفعت مقابل  شي مو موجودين بالجيس عندي
759812917218844672,KW, جد في احد يعطي صدقه بالاكراه
759857596698275840,KW, تكلمي بالتفصيييل احتريت زيااااده
759858733744726016,KW, شلون يغلط بهالمبلغ اليوم عطيته حجي عن الاخلاص بالعمل  وانه محاسب عاللي يسويه مفروض ما يغلط
759860671353724928,KW, لووووووول اشدعوه ماعندج ست تالاف  
760095715959922688,KW, مايلوقلج تره  احس تكرهين الروتين
760360541160349696,KW," اتهبل اعشقها جمال عالعين
فيها لمعة لون ازرق"
760728086455447552,KW, انت شخص ذو اراده قويه  اصحاب النفوس الدنيئه يأثر فيهم فوق ما تتصور
760747816847286272,KW,  عشان لا يصير هجووووم
760755922637623296,KW,"  لووووووووووول مريوم ينفعلج هالموقف

أسهب رجاءا"
760757257726464000,KW, كل هذا عشان تقولينلنا جمالج طبيعي
760757596882075648,KW, في ناس مايقدرون يخلون شي داخلهم
760758100781633536,KW, ماقط سألت  الشي الوحيييد الي ودي اتجرأ واسأل عنه اهوه العطر  ماعرف اختار عطر اشمه وافهم انه بيعجبني بعدين
760759197197799424,KW,"  اهوه صح  بس دايما العطور لما اشتريهم  ريحتهم غييير بالبدايه وغييير بعدين
يصير فيهم ريحة جنه بف باف"
760759825194188800,KW," عندي  امل منهم 
احب اغير وماعرف اغير
شريت عطر بولغاري احمر بريحة الشاي الاحمر
غرييييب يازلي  ذوقي ما اثق فيه لما احصل مدح"
760761057942044672,KW, انشالله اول يوم اشوفج فيه بحطه وشميني 
760763627976654848,KW, من بعد هالصوره كم عرض زواج تلقيتي 
710615537471119360,KW, مشكله مافي طلبه يبنون 
710615785845219328,KW, هههههههه ضروري طالب طب 
710616047167139840,KW, ههههههههه طالب بجامعه معتمده
711850189817044992,KW, هههههههه محد يذكر هالشي
711879345674055680,KW, شلون عيل تسمع اغنية آه يالنذن
711880144160432128,KW, هذا انت عين السيح  
711924254896431104,KW,منو ملطخ ويهها  ومصورها غصب 
711926103414276096,KW, اهوه مو انها مو حاطه  انه مو نظيف ومو مرتب  حتى الحواجب اومبريه 
711926995878281216,KW," يبيله قوة ملاحظه وشطاره  مثال الحاجب واحد نازل وواحد صاعد
عشان نساويهم راح نصعد النازل وننزل الصاعد وبيصير حيل اوفر عريض"
711927166884319232,KW," بس انا احس عادي الاختلافات  اهم شي مانوضحها
مثل عين كبيره عين صغيره  مانحط ايلاينر عريض نوضح هالاختلاف  لا نموه برموش وجذي"
711927325529677824,KW," تعجبيني
متصالحه مع نفسج
في مرحله اذا ادمنتي الميكاب الثقيل ماتحبين ويهج بالاقل"
711977926284025856,KW,البومه الي يمي وياه مرته ولاهي بالتلفون  
711978111512907776,KW,  اسفه لما توصيه اول
712022003205562368,KW, ثنكيووووو عوومري الفال لج يارب
712022349420204032,KW, تخيل ان بالكلاسات ما تستوعب شي مع ان الوقت ما يمشييييييي كلش
712595859637198848,KW,اعوذ بالله من الشيطان الرجيم
712596575357378560,KW, افاااءء  انا الي عبالي انك تسبني لما تقولي الفدعه 
712596975070420992,KW, شنو هذا مضيعه انا 
713064594319753216,KW, شلون تحلل دراسة  سنين
713113902456958976,KW, عندي خطه بعد انا  عؤبال ما اكتسح اكثر منك
713116013819215872,KW, الله يرزقك تستاهل احسن شي
714569916393865216,KW, كل عاااام وانتي بخيييير 
714873922701942784,KW," بأناملي  
المكياج  سويته بمعرض    لايف  والبنات شافوني شلون سويته "
715929944019349504,KW, من منطلق الحب اخو الفستق فينطبق
717257453109379072,KW, قريت اول شي بغيت اتهاوش
717261152829501440,KW, ههههههه بعد قلبي اذبتي قلبي 
717261324481404928,KW,ممممم  لا جد جد تبون نحول الخط  
717616598123720704,KW, شلون تيين الكويت وما تقولينلنا 
718075911111909376,KW, الي يحطلج خل يحطلي
718078253332873216,KW,  خو موجودين بس اهيه تبي وحده موجوده بالبيت  تخيل لو خدامتنا تعرف تسوي الايلاينر  عجيييب مو
718078814031585280,KW,  افا عليك قرييييب جدا جدا
720243873344331776,KW,في ناس موجودين بالدنيا بس عشان يعززون ثقتنا بنفسنا 
722077979581509632,KW,أي واحد مأذيك ببرودكاستاته بالوتساب ومنحرج منه  إمسح إسمه ورقمه من عندك  ولا برودكاست بيوصلك
723586757632110592,KW,هذي سالفتنا كلما يينا الصالحية ناس تطلع بجيس ماركة واحنا نطلع بجيس مكسرات من المطحنة الدولية
723657630774906880,KW,  بالصوره بس اشوف ماك الي حلو
723658250483339264,KW,   لا شكرا كافي صور باستا وفوقها برغر مشوي 
723813245614731264,KW, طلع متسلق على افاج  
723847826602643456,KW,   تمون عليهم ريم المكاحيل 
724687489592647680,KW,يارب  أرح قلبي وفكري 
724687719264346112,KW, كنااااكيييين  والله  سبحان الله الموضوع فطري بحت
724687972193452032,KW,انا باجر عازميني سنسكيب وانتو خلكم 
725039324870356992,KW, اعطيج اياها اسبوع واسافر 
725270320626671616,KW, اللون تان بس مو تان شمس الكويييت اكيد ماتطلع هاللون
726145492778909696,KW,كلش مو نوعي احط صورتي خلفية محادثات الوتساب 
728141792672014336,KW,ما قلتلك قبل الفراق الدنيا ماهي دايمه
729046035222409216,KW, كل عام وانتي بخييييير حبي   نيولوك 
729554411861741568,KW,  احسج قاعده تشوفيني من فوق  وتشوفين البراءه 
729623609178730496,KW, لا تحاتين اهيه تحب الاكل الي يدغدغ مشاعر المعدة  كل انستغرامها ممنوعات تسمح فيهم
729908674395840512,KW,والآن مع فقرة  سوالف الهم والغم  بالدوام
729910971460943872,KW, هذا لو ينلبس على جسم متروس شوي 
729924030619385856,KW, عاد تدرين ما اذكر ان عندي صوره هابه بشي ضحكت عليه بعدين تذكرين لقطات مصورات العروس سويتيها
730291590137262080,KW,من بدت المصانع المصرية تصنع الككاو  اخترب طعمه 
730291878801903616,KW, خاله ونايمه وينج ليش ما رحتيلها المستشفى قعدتي عندها
730292112089042944,KW,الفلوس ليش موجوده  مو عشان تستانس فيها ولا عشان تخشها لما تموت
730292224018272256,KW, اخيييه اعتذر عيل  مبروك ما ياااااكم
730292647294849024,KW, بحجزلك العلاج النفسي في حال قررت 
730293729895063552,KW,مصر  توقفي عن تصنيع الشوكلاته  
730293854021287936,KW,كل ككاو احسه اكسترا حالي  مصنوع بمصر
730294265520230400,KW,الي نايمين ومشتاقينلهم  قوموا 
730294361381023744,KW,الي قاعدين ومشتاقينلهم  دقوا 
730294449381707776,KW,الي عنده كلمه حلوه  قولها 
730294557376708608,KW, عاد اهني تكلمت خبرة الاحساس ووالتذوق  نسكت
730294953985855488,KW, بدير بالي أخاف امتن 
730295521252933632,KW, اييييي منو انتي  الصوره توفي
730296639299129344,KW, مشالله  الحلج مميز الحنج مميز
730298092470292480,KW,بالوتساب  أحب أقرا السوالف اكثر من اني أسمع فويس
730300766485884928,KW, جنه اهمه نفسهم الناس الاوليين والثانيين
730313445661356032,KW, سبع سنين هندسه نطلعهم من جبدكم
730313564603469824,KW,انا اشرب قهوتي مره   
730433508217335808,KW,   تخيلي  يسوونلج دعايه شامبو  على شعر خفيف
730434499855650816,KW," انا مع التغيير والتجديد بكل شي  دايما مع كل تجديد الناس تعترض لما تكتشف الفوايد و تتعود عليه
الا التغيير اللي يشيل ميزة مفيدة"
730434637114298368,KW, عيل اقولج ان هالشغلات الي مافيها مصداقيه هم تمشي  يا ما شرينا شامبوات عشان دعايتهم
730435068053868544,KW, لان سويت مكياج حق جياكر ما يلفت 
730482416108875776,KW,من فضولي  ودي كل واحد يكتب شعر حب أعرف منو يحب 
730482513659998208,KW,بشوف يلوقون على بعض ولا لا  بتطمن على ذوقه
730482857676804096,KW, عاد انت كلش ما تكتب حب
730482958709231616,KW, يعني مافيني فضول  مع اني شايفه حبك  اسم الله
730483274934587392,KW, الله يخلييييكم حق بعض يااااارب 
730483977258192896,KW, واي شباب ماتعرفون تكملون الفلم
730485838816104448,KW, جيكت جيكت  والله حسيت
730487059824160768,KW, ههههههه لا ممتاز تطمنت على مستقبلك
732268232468516864,KW,وكالعادة رايحين الصالحيه عشان مكسرات 
732511493384732672,KW, انا ومريوم تنطرني بالسياره  تنحسب شلون
732512639163731968,KW, عدررررك عدررررك  ها وضحت
732512681664630784,KW, هاااا ناويه على شر
732512919116763136,KW, بس يعني ما تحسها مليقه يوم وضحتها
732562520205099008,KW, اهو شويه لاهوب بس مستحمل 
733372682679517184,KW,عالبركه التخرج بش مهندس  
734296020910247936,KW,مادري شنو كنت أحس فيه يوم شريته 
734628142812368896,KW,ماقدر أتخيل إن في ناس ممكن تنزل هالكم الهائل من الصور  حتى مافي عدد متابعين يشجع 
734752288049364992,KW, انك توصل مبجر بالوقت وتنطر المتأخرين 
734753498617765888,KW,  حافظها غلط و تتفلسف
734790521193910272,KW,يارب  شافي جرح قلبي 
735152818424844288,KW, مرحبا تسمحين اتواصل معاج 
735365869627445248,KW,"  اوافق على كلام الاخمفروض تدفع مو تداحر العاملوبعدين تشتكي عشان يرجعلك حقك
العامل موجود عشان يستلم الفلوس مو يناقشك"
735740746301476864,KW, هذا ويييييين كله ادور مكان اكله جذي ما القى
735741237303476224,KW, الي فيه نينو جنه رايحتله بس 
735860012967448576,KW,المنجا اللذيذه اهي الي لما تاكلها تندمج ويوصل المنجا لي كوعك
735873976229072896,KW, لا انت شكلك من النوع بسرعه تصبغ
736144671559258112,KW, مو حلوه السبورت حق الرياييل 
688488628062916608,KW,  هذا يبيله توتوريال باليوتيوب
688488982183817216,KW, اييي هذا القصد عشان احلاهم ياخذها 
688489156893405184,KW, ليراكس  الجيل صعب ماتقدرين تصيرين صعبه وياهم 
688489677691711488,KW, مشالله الحين  اطول منج  وشخصيتها قويه  انا احس عادي الموضوع  اعطيها هالشي الي موو خطير نسبيا  وامنعها من شي قوي
688490009746370560,KW, لا  التفتح والاطلاع على الدنيا كلها بوسائل المجتمع يسوي جذي وكل جيل يحس الجيل الي بعده اسوأ  بس اثنينهم نفس الشي
688490459916824576,KW,  اكييييد كل واحد وقناعاته  انا كنت اتخشخش عشان احط شامه من عمري  اعتقد  فاماحسيته اثر على اخلاقياتي 
688490793842143232,KW, اخذي ايباد اليهال سنين شوفي شيدورون باليوتيوب  فضول  لازم تكونين فوق راسهم  ساعه اذا تقدرين بهالوقت
688491530756222976,KW, والله شكلها حلوتك اهيه الي مصبرتك كتكووتها
688496090446999552,KW,  اهيه بعد هبله  شنو  سنين
688622505641275392,KW,وااايد مو حلو لما أحد ما يمون عليك يدلع إسمك
689029199278043136,KW, محسوبين بس مو منكم 
689031612877647872,KW,يمكن انا الوحيدة المشهورة الي تلفونها شاشته مكسورة من اسبوع محد راضي يتبرع يصلحلي اياه بالصدفه
689718393532973056,KW,  اخاف تقصد واحد ثاني
690186983478530048,KW, هذي مو وحده نعرفها 
690194018584629248,KW,  مكياج العزا مالها مضبوووط نوميك اب ميكاب
690718140083376128,KW,تدري بوجودك يطيب يومي ويحلى عيشي 
690943091080065024,KW,مو حلو ولا ذوق إن يكونون الحزام  الجنطه  الجوتي  السوار  السلسله  الشال  ماركة 
690943807639134208,KW, مادري قاعد يحوشني احساس حيل كبييير  الواحد اهوه الي يكشخ اللبس  وان كان مافيه ولا ماركة
690945388371664896,KW,ما احترم اللي يمنتجون مقاطع غير محترمة ويدخلون معاها مقطع مضحك  ما يضحك   وعيب
690947897303638016,KW,ماحس بالاحساس الي يحسونه بالناس لما يشربون القهوه
691020490794745856,KW, ودي اطرشلج صورة السمايل الثاني اللي انتي مادري منو معلمج عليه
691311023941353472,KW, ويع عساني مارافجتلي وحده جذي
691315823995162624,KW, اصلا هالنوع من البنات مفروض تكون منبوذه بالمجتمع  محد يرافجها  شالدعااااله
691907161467789312,KW, سويلهم بلوك ما يطلعونلج بعد 
691907961430609920,KW,  عشان ثلاثتالاف فولورز وشوي  
691908503615729664,KW," بالايفون نفسه  اناكنت مشتركه علاج بصالون  كل يوم يدقون عشان ياكدون موعد بعد شهر  
كل رقم بلوك
ولا عشر ارقام "
691908611388379136,KW,  اي دام ضميرك مرتاح  بس تناجر منو بعدين بالتايم لاين
