id,dialect,text
997060430353776640,QA,"    ترا مايفرقونفي سيارات قطريه يملكها سعودين وفي قطرين عايشين او كانوا عايشينمثل الشيخ عبدالله اللي حطوه رئيس لقطر يبون يمشون العالم على كيفهم ولو فرضنا انهم مامنعوا بس حطوا قيوداسافر عن طريق الكويت واقضي اكثر من  ساعةلين اوصل مكه واحتمال يرجعونك بعد 
حسبنا الله ونعم الوكيل"
997065679512612864,QA,"    احنا قلنا 
الله يحرم الجنه على من حرمونا من زيارة بيته  وبدون تحديد 
اذا مثل ماتقولين ماحرمتونا  ليش اللقافه   خلاص   والا مثل مايقول المثل  اللي على راسه بطحه

عارفين نفسهم  و يكابرون 
المهم  اللهم اني صائم 
وسلام "
998449855579095040,QA,    مش بس الخلا  الا بعد انجلع  
998511714961272832,QA, اي صح كلامك  ام العيال هي المقروده  طاحت فيك 
999763731826393216,QA, انوثتك هي اللي مغلوب على امرها  انقلعي
999841224998694784,QA, وحنا مانبي حبكم ولانحب حكومتكم
1022120393967058944,QA, لا يكون تقصد سلمانكو بالذيب  امسح امسح الله يهداك تقول عن بغل ذيب مايجوز
1140874084110209024,QA, كلن يشوف الناس بعين طبعه
1142158557950939136,QA, والله مانعرف حتى اسمه 
1142174665873481600,QA, يعله مايقوم عقب ماقتل مرسي
1142733938248564736,QA, شوف الردود عليك من العرب وبتعرف قدرك عندهم
1144025224419127168,QA, كوشنر شكله يشوف افلام وايد
1144663763712454784,QA, مايستاهل الاخ ناصر وان شاءالله يطلع وهو رافع الراس
1145964510035030016,QA, للأمهات دور كبير ولكن بعض الصديقات تسحب معاها البنات على فكرتها
1146359559088480384,QA, اذا خلصت المياه الجوفيه اللي عندنا بنسحب من النهر اللي عندكم اما الصومال فاليوم الدولار عندكم وغدا عندهم بإذن الله
1147782817960615936,QA,  شفايدة المساحه اذا كلها تحت امر القحطاني وتركي ال الشيخ
1148907317502586752,QA, كلش عيب تغيرون اللون وتنشرون الصوره كلش عيب
1149636622360596352,QA, جايك زمان الصمت اللي سكت سعود القحطاني بعد ما كان منتفش بالباطل والآن دورك يا جندي الفرعون
1151008100629061632,QA,  اهم شي مثلها مثل دول الخليج  يعني كلنا في الهوا سوا
1151102794436415616,QA, رد القطريين عليك خلك مع الدندراوي وايد عليك
1151956462173872000,QA,   خل تتحد الدول العربيه وتترك عنها الاحقاد ذيك الساعه اطردوا الامريكان أما لما يكون عدوي هو اخوي فللأسف أحتاج أربي كلب عندي عشان يحرسني
1152245910367342592,QA, انت ماعليك شرهه البلا في اللي وراك دازينك عشان الناس تتساهل في صلاة الجماعه شيسوون في المساجد يعني يسكرونها وكل واحد يصللي في بيته 
1152247965907640448,QA, طاعة ولي امره واجبه
1153244985887735808,QA, يانعيش بديننا يانعيش بحريه منفلته بدون قوانين والله سبحانه عطانا الإختيار  وماأصعب الطريق إلى الآخره إذا لم نحسن الإختيار
1154332955155845120,QA, على كثر ما استهزء فيكم ترمب مازلتوا تحبونه أكيد بيبيع لكم سلاح مادام فيها فلوس ولو غرقتوا ماتفل عليكم
1154640377544155136,QA, الشرهه مب عليه على اللي انتخبوه
1154706426616516608,QA, عقبال ما يروح عنهم الياثوم العود
1155396479856648192,QA, اكثر من قطر والا اكثر من ابوظبي على كل إذا صار ومالهف السيسي الفلوس قولوا له هلله هلله فيكم لاينساكم من فضلة خيره
1155940944803352576,QA, البيت شكله مبني في الخمسينات والشيخ محمد بن ثاني ولد قبل سنة  ميلادي
1156119002189619200,QA, يعني لازم نكون معاكم في الحفره اللي وقعتوا فيها والا احتجتوا حق قطر الحين 
1156421849754087424,QA, احتجتوا حق شريفه واستقبلتوا اهلها افضل استقبال للحج
1156674237303808000,QA, خلاص الحين تصالحتوا مع شريفه
1157296560675405824,QA, جاهزين ومحلقين وجايبين ماي زمزم ولبسوا ثيابهم شنبي احسن من هلحجة بعد
1157757591268839424,QA, خلاص الحين بتتصالحون مع قوى الشر والارهاب وبيوقف المعاش
1158262037832753152,QA, تقهقرنا عشان مانطيح في الحفره اللي انتوافيها خلوا ولد زايد ينفعكم
1158855550257549312,QA,  جعل يسقى لي مات قبل مايكمل الرؤيا
1160860088430669824,QA, تخاف تجيب طاري معازيبك في بوظبي هم ساس البلا
1161090651896930304,QA, لو فيهم مروه ماسجنوا عيال عمهم عشان الفلوس ولامنعوا اهل قطر عن الحج وش جاب ذيلا لآل ثاني اللي حكمهم قبل حكم عبدالعزيز ال سعود
1161546159871209472,QA, يستاهلون ياريت يعطونهم كلهم
1163529694110724096,QA, الله يبدل الحال وتخضر فياض عقب ماهي يباس
1164490654640160768,QA, صح لسانها وعز شانها 
1164844231200005888,QA, لا تجيب الطاري حق معازيبك عن الإحراج بس
1165926346331176960,QA, قرت عينكم يا هل الكويت 
1166200299775770624,QA, انشهد البلا كله من رابط الكلب
1166266839309213696,QA, طيب ايش بقى لا الشمال ولا الجنوب  بس ذنوب على الفاضي 
1166298610226606080,QA, يارب ترجع اليمن حره
1166346083695566848,QA,  لاتلومونه معازيبه خسروا تعب اربع سنين في اليمن لأن الله يمهل ولايهمل وبييجي اليوم اللي بيبكي لما يشوف انتصار قطر على الدول الاربع
1166352692488396800,QA, وهذااللي صار الحين بين الحكومه السعوديه وحكومة ابو ظبي
1166658723563134976,QA, اربع خليلات ممكن واربع زوجات مش ممكن
1167009092600303616,QA, الله يرزق من اوسع أبوابه 
1167010241101357056,QA,  واضح انهم مختلفين ولكنهم ماسكين آخر خيط بينهم
1167269700188983296,QA, الاخوان المسلمين بيحكمون الامارات بإذن الله وانت ومعزبك اطلبوا لجوء سياسي عند الهندوس حبايبكم
1167753889040478208,QA, اللي يحط يده في يد داب يلدغه ياأخ ناصر خلهم يذوقون المر من ولد زايد وولد سلمان لين يعرفون ان الله حق ذيك الساع بيتغيرون
1168437446134194176,QA,  بيقلب بعد ساعه هذااللي يقولون عنه لاتاخذ منه حق ولاباطل
1169883684855377920,QA, الحمايه لهم مب لنا عشان استعراض انهم قوة عظمى وهم ماعندهم الا السلاح ولولاه بيزه مايسوون
1170517058808877056,QA, انه فكر وقدر فقتل كيف قدر
1171008222574108672,QA, الحكومة السعوديه ماصارت سند لشعبها المتضرر منها بتصير سند لنا مافيه أكبر عندالله من منعنا من الحج والعمره
1171433989350907904,QA,  فكرت انه مطرش الرساله قبل تاريخ 
1171435049213759488,QA,  الله يكتب اللي فيه الخير يارب
1172587589699887104,QA,  جاته الطعنه ممن كان يدافع عنهم سبحان الله
1173420990619144192,QA, المشكله اللي قاعدين مصدومين 
1173423409730138112,QA, الضو شابه تحته وهو يبي يرقص 
914580022584897536,QA,"لبناني يقول

اذا السعودية ضلت شادة حيلها هيك  رح نسهر راس السنة بالرياض  "
914585116646805632,QA,كل من انسحبت جنسيته خاين او عنده ازدواجيه الجنسيه وفي الحالتين قطر غنيه عن اشكالهم  نطهرها من الخونه قطرتجنسالعملاءوتهجرالابناء
914775347769593984,QA, هم ادرى بشعبهم ويدرون انه ما يمشي غير بالتهديد و  والشعب راضي قلعتهم
914777930789728384,QA, خاين ووصخ قلنا معليه بس بعد غبي  والله مصيبتك مصيبه  يبيلك  في حلجك ياولد سحيم بالخاين 
914778830618923008,QA, بكره المفتي يطلع يقول الرقص بالوردي حلال وغيره حرام  لازم يحلل وبسرعه
915023940728377216,QA, مب منه  من الي جاه الله يعينه
915027105058115584,QA, شعب حافظ مب فاهم 
915030903327477760,QA, هذا الله يسلمك ايام الجاهليه 
915704748308926464,QA,حقوقنا حاصلين عليها كامله وبزيادة الحمدلله  خلكم في حقوق المرأه عندكم ومالكم شغل فينا  حقوقالمراهالقطريه
915705134084104192,QA,  شنهي حقوقج الي ما حصلتيها ممكن نفهم 
915706017589194752,QA,هاشتاق وحاله وبالاخير تبي تجدد جوازها بدون ولي امر  ترى نجدده عادي بدون ولي امر  سعوديه غبيه هي الي مسويه الهاشتاق  حقوقالمراهالقطريه
915706784752574464,QA,ملك الحزم وملك الحزم وبالاخير ما جاه بوتن يستقبله ومطرشله رئيس جمعيه  بافعالهم ضيعوا هيبتهم القديمه   الملكسلمانفيموسكو
915708141479890944,QA, سلمان كبير الخليج ولا نسيتو كلامكم  كبير عمر ومقام على قولتكم
915709086867628032,QA, اي ترجاه  طبعا طبعا
915713138590470016,QA,  امحق مصدر  مب مستحي وانت حاط المقطع ومصدرك مذيع يقول ما يؤمر بقوله من ولد النعاشه
915714335623847936,QA, روح طلع اخوك من قضيه الحشيش صارله  شهور فالسجن خاس وريحته طلعت 
915718343918850048,QA,تعلمتمنالازمهالخليجيه ان السعوديين من كثر ما ياكلون في مطاعهم لحم كلاب وحمير صارو مثلهم
915718956845068416,QA,شعوب دول الحصار ما تمشي الا  مثل حكامهم
915746912938098816,QA,اشم ريحه سعوديه مخنزه مدري ليش  هذا مب كلام بناتنا  حقوقالمراهالقطريه
916083476499193984,QA,  كفو والله  والله يوفق بناتنا وشبابنا في كل المجالات
916504220815298560,QA,  بكره يسوون حفلات في مكه ويحللها مفتيهم
916508328704045056,QA, ليش ما كسر البروتوكول على قولتكم وراح استقبله بدل ما ذله ووقف عنه السلم الكهربائي ومرسله واحد حتى الروس نفسهم مايعرفونه 
916533497262759936,QA,  احنا اخونجيه تقولون  اشلون نفتح مراقص  صج متخلفين
919179222194708352,QA, اذا جا العيب من اهل العيب ما صار عيب 
919179833619366016,QA, صح لسانك الفلاسي  جبتها صح
920106813181198336,QA, الا تخلينا نتلفت لك  ولا حد داري عنك غير حريمك سود الله وجهك
920108268466274432,QA,سلطان بن سحيم ماتعرف تتصور وحلجك مسكر  كنك رقاصه في لقطة اغراء سود الله وجهك  اقتحاممسلحلقصرسلطانبنسحيم
920111554795728768,QA,الله يرده لاهله  وديرته يارب  يناديكمفالحجمعانالعازمي
920727577458823168,QA,بيض الله وجهه  مرزوقالغانم
921970473340203008,QA,هذا رأي ترامب فيكم  
922239199222403200,QA, اعوذ بالله  ان شاء الله ما يجي هاليوم
922707358907691008,QA, شبابنا طلعو رومانسيين  ما اصدق  محمدالنمران
923303038479081600,QA,  كفو عليك ادعس ربي يقويك
928136063658483584,QA, ميحد حمد كان ميت ولا يتهيأ لي  اكيد طلعوه من قبره بأوامر طقعان  قولوالقطر
928809904873320448,QA,  والكل يشهد على كلامك
928812637521108992,QA, ماعجبتني تغريدتك ابدا  قلعتهم مانبيهم  مانبي غير مكه والمدينة عسى الله ينتقم منهم حرمونا من بيت الله
930648522847813632,QA,اصدق شي انقال من يوم الازمه  نعم نحن بألف خير بدونكم  نحنبالفبخيربدونكم
930648844127424384,QA, ما ننتظر حد وخل عنك المجاملات  مانبيهم وخل شعوبهم لهم 
933870119897436160,QA,ماعرفنا ياقطر نصير مثلك بالاخلاق  ماعرفناياقطر
933870982514823168,QA,اهم شي الذباب الالكتروني الي كاتبين فالهاشتاق الاغنيه نااار  عسى النار تحرقهم قولو آمين  ماعرفناياقطر
933872001718071168,QA, مستحيييل  القطريين عندهم اخلاق في كل تصرفاتهم 
933874014342303616,QA, والله ماهمونا لا الامارات ولا السعوديه واحنا بألف خير بدونهم مانبي غير زياره مكه حسبي الله ونعم الوكيل فيهم حرمونا منها ربي يحرمهم جنته
944823247874482176,QA,بتتم قطر ذابحتكم   وشاغلين نفسكم بها   منتخبالمجنسينالقطري
945665855307833216,QA,كنت دايما اسأل ليش يسمونك تركي بعر  بعد ماشفت لك هالمقطع عرفت  واقتنعت انك بعر  فيتنستايمالسويديقطر
885506638618042368,QA,قطر فيها وفيها وفيها  احنا راضيين  دول الكفار الثلاث شالي مزعلكم  قطرتعيشحالهمنالشيزوفرينيا
885641003008311296,QA,     امحق ريال الي مثلك ينشر هالسوالف  كنك مره خسك الله
886394801456861184,QA, يقولون وقتها كنت تبول في هافك  من علمك هالكلام ترى درسوك غلط 
886395249320488960,QA, هذا تسأله عن وكر دعاره ولا خماره اعزكم الله مب عن الأقصى بس ممكن تسأله عن ربعه اليهود  بيجاوب صح
886400743690915840,QA, الف طز واحنا الربحانين والله  ونخلي حلف الفجار يسوون مجلس مع السيسي
886403201045602304,QA, ردود السعوديين احناحررناكم اكلناكم آويناكموأنتو نكرتوا الجميل وصدام ومعاير ماله نهايهالحق محدله فضل ع الكويت تحريرهاواجب و أمن لكل الخليج
886533637839224832,QA,طبعا قوم  مب محصلينهم هني  اغضبللاقصي
886534493837959168,QA,  كان سبب الرفض ارتفاع نسبه التلوث عندهم فالجو  نسبه عاليا جدا
886804136846602240,QA,  ولا نبي نشوف وجيهكم بنحول سفراتنا لأصدقائنا فالخارج ابرك منكم حلف الفجار
886806533891387392,QA, وصلتوا مرحله الطراره  ترى عادي تبون صدقه بنطرش لكم
886809340178554880,QA, يدزونه يتكلم بإلي يبونه وبعدين ببساطه يقولون مايمثلنا وبكذب خلاص حلوها يعني
886812461499912192,QA, دول الفجار الحين لازم كل واحد فيهم يبلع له هههههههههههه
887049480243163136,QA,كل ردودكم تنابحون نفس معزبكم بن زايد تعيدون الكلام بدون فهم اصلا متى فهمتو علشان تتكلمون حاطينكم نفس الطوفه تشوفون بس الي يأمرونكم به 
887049820183162880,QA, البحرين امعه وهذا شي معروف ما يزعل 
887456342071541760,QA,  ردودك تبين اخلاقكم  ماتنلامون تربيه بن زايد تربيه وسخه
887460694211391488,QA,  هذيله ما يفهمون حتى الرد عليهم خساره 
887461300648816640,QA,  ماعنده غير سواد وجهه
887464007875035136,QA, مب منهم من الي يشربونه ليل ونهار 
887464391041593344,QA,كل اماراتي يزعل لما نسال هالسوال  صج والله مدري ليش  مانعينهم يمكن يسألون   اينخليفة
887731043859673088,QA, حتى كلامك مثل الحريم والله يعز الحريم عنك  عموما مانلومك منهار انت والمعزب 
887731608744341504,QA,عادي يا جماعه هم شعب ربوهم على تقبل الذل والاهانة هم مب زعلانين احنا ليش نزعل عليهم  اميريعتديعليمواطنين
887748013149614080,QA,شعب ما يمشي الا بالجزمة  عادي هذا السعودي  اميريعتديعليمواطنين
887753895124107264,QA,ههههههههههه زعلو الجماعه من  
888278764555087872,QA, يخسون مايستاهلون حد يتعاطف معاهم
888281570796158976,QA,يارب يرزق عيال زايد شوية دم  يارب ارزقهم شويه احساس يمكن يحسون  وبعدها دمرهم وخذهم من على وجه الارض  يارب
888282862113275904,QA, ماعليك من عقول شعب قطرالي صارشقيق  خلكم فنفسكم شعب قطر مايبي اخوتكم وراضيين بعقولنا الي مب عاجبتكم ومقتنعين بالي نفهمه مش الي يملى علينا
888284538140450816,QA,   ولا يهمك اخوي ابن الدعله  تميم وأردوغان باذن الله بيساعدونهم ولا تستبعد يحررون امثالك بعد من الي انت تعرفه
888751061036617728,QA,  تدري انك مهزأ  ولا ماتدري
889528191454457856,QA, لا تنصحهم ولا شي خلهم  دام وافقو ع انهم يتبعون محمد زايد خلهم يغرقون معاه
889532462765834240,QA, والله محد بينفعه بعد الله غير اردوغان  عيل من الي بينفعه سلمانكو وأشكاله 
889540621819662336,QA,بتتم قطر قاهرتكم لين تنجلطون باذن الله ومهما روجتوا اشاعات  ما يسمعكم الا السفهاء الي مثلكم وتبقى قطر   قطرتدعمالارهاببالكويت
889953473969762304,QA,اهل الامارات شعب السرسري اشوف طلع لهم صوت في تويتر  اكيد جاتهم أوامر  اكثرمايغيضالقطريين
889954901014523904,QA,المهم طلع لهم صوت السرسريين  سوو هاشتاق ينابحون فيه الإماراتيين  اكثرمايغيضالقطريين
889955676457508864,QA,عصبو عصبو الجماعه  عادي نابحو اهم شي ترتاحون  اكثرمايغيضالقطريين
890507873540812800,QA, اكثر شي ضحكني اليوم 
890643549728915456,QA, حرمت عليهم عيشتهم ما يستاهلون حتى الكلمه الطيبه  انا اتضامن معاك
890646785584222208,QA, اتمنى تكون خطبتك قصه وموعظه عن واحد اسمه وسيم ماله أصل  باع دينه لالي يدفع اكثر  خل امثالك يستفيدون
891400860483428352,QA,واحد ديوث مثل هذا والعياذ بالله شنو تتوقعون منه  العتيبهيريدالسعوديهعلمانيه
891402822331359232,QA, مع حلف الفجار يصير قطع الارزاق فيهم حلال وبعد مأجورين عليه ان شاء 
891404344544944128,QA,كميه نباح من السعوديين في هذا الهاشتاق ما تنوصف  الله يعينكم معذورين من الي مسويينه حكامكم فيكم داعسينكم بالنعال  تميميمنعحجالقطريين
891409474463956992,QA,  عنده موافقه مسبقا انه يتكلم عنهم
892674563749928960,QA, يستاهلون هالشعب الي قلوبنا عليهم ويدشون ينابحون مب عاجبهم  خلهم يعلهم فالشارع يعيشون مالنا خص وعساهم في هالفقر واكثر 
892675659054678016,QA,لحد يدخل علي خاص يقولي لا تسبينهم  بسويله بلوك انا متطرفة في حب قطر واميرها وما أتعاطف مع اي حد يقول عنها كلمه 
893156187562266624,QA,عرفنا فيهم ان أنجس شعب هم السعوديين من ردودهم ونهيقهم في كل هاشتاق وشفنا كميه الحقد الي في قلوبهم  ستينيومعليحصارقطر
893157835865018368,QA, قندره في حلوجهم  ما يبون يفهمون
893174467723177984,QA, يعني متعود ع التهزيء  سود الله وجهه اكثر من ماهو اسود
893309935857127424,QA, عمار يا كويت  ولو انهم مايستاهلون
893310135145291776,QA,  في مقاس   يناسبهم اكثر
893315796298072064,QA,حد صرح ان قطر لها يد بالموضوع ولا للحين   حريقمارينادبي
894065977159241728,QA,نقولهم ثور يقولون احلبوه  شعب غبي ماشي ورا إعلامه مثل الحمير  السعوديه خلاص مافيها عاقل  السعوديهترحببالحجاجالقطريين
894069499644825600,QA,اكتشفت مع الازمه  ان شعب العماني خلوق جدا  الله يديم عليهم الأمن والامان
894260336555110400,QA,ليش كل مارديت او رد اي قطري يردون عليه السعوديين مرتزقه ومرتزقه  من قالهم ان قطر مافيها شعب 
894260595352064000,QA, ههههههههههه مافيكم حيله حسبي الله عليكم 
895028626411880448,QA,  ليته عقيم ما جاب عيال الله يرحمه
895045721078059008,QA,يعني لو تهتم الحكومه السعوديه بشعبها وتخلي عنها محاوله التدخل في شؤون غيرها مب أفضل  
895214846152757248,QA, نعم نعم  لازم يتطمنون  شوي وبتليفون واحد من طويل العمر يوقف القصف بعد
895302339116093440,QA, محد من ربع بلحه جا ينهق هني غريبه 
895305029866983424,QA,  هههههههه الموضوع كبير بصراحه
896102644434878464,QA,من صجكم  سيفاللهالمسلولمحمدبنسلمان
896444160961642496,QA, من دعواتنا عليهم  ياعلهم في هالحال واردى
896485709338468352,QA, وانا بعد عمي الكبير الله يرحمه كان موظف في أرامكو  لكن ما نقول غير انهم يستاهلون كل الي صار فيهم والجاي اكثر
896676268070121472,QA, الكلام عن خليفه فالامارات يخوفهم لي اهل هناك واسال عن خليفه يقولون مريض ويخافون من ذكر اسمه  والحين تبرو مني لاني قطريه ع قولتهم
896676915188305920,QA,  هذه المصيبه   الشعب ما يشوف غير الي تبيه حكومتهم وممنوع يشوف اي رأي اخر 
896739550617358336,QA,    ممكن حد يقول لنا من سمير  وايش قصته 
898643694202396672,QA, طلعت اشرب شاي وارجع قبل الحظر  
900987593730510848,QA, السعوديين الحين وضيفتهم الوحيدة ينبحون علينا في تويتر  بعضهم طبعا
900988334176120832,QA, اي والله يا حظنا  ربي يديم علينا نعمة تميم 
901516613987557376,QA,  العز والخير شفناه ع يد قائدنا تميم هو عزنا وخيرنا
901564018757955584,QA,  كم دفعولك ع كل تغريده 
901564981854040064,QA,  قلعتهم يستاهلون دام عاجبهم سود الله وجهم
901760262335864832,QA,لكل وقح اساء الى قطر  تقوللميناتفوو
901761115448905600,QA, قابوس مأدبهم من كثر مايصيد شبكات تجسس عنده  عارف لهم عدل
902265792775028736,QA, ما قلتو الله يطول بعمر الشيوخ 
902929316958412800,QA,  يكلمون حمد ريتويت  خل يساعدهم
902961288808103936,QA,بيعتكم تبونها فالكويت  وجبتو واحد وقلتو نبايعه فالسعوديه علشان يكون حاكم قطر  من أنتم  صج صج من أنتم  لابيعهالاللشيخصباحالاحمد
904110471451639808,QA, العز والخير شفناه مع تميم وان شاء الله الجاي اكثر  الله يديم علينا تميم
905046437909725184,QA, في يد فيفي عبده وبكره اذكرك ان ما لجأو لها 
905046755405959168,QA,بدو ينابحون ويطلع صوتهم  
905077427319304192,QA, ويشهد الله ع اننا نحبهم 
