id,dialect,text
305472069230030848,KW,"تكبر وتنسى ياوليدي مع الوقت
ياما سمعناها وحنا بزارين 
من يومها نايم بالاحلام مافقت 
وعاده ف بالي مانسيته لهالحين

عادي تكبر وتنسى "
307915504012640256,KW,"ازعاج يا ضجة شعوري ابرتاح
ارجوك انا محتاج خلوة مشاعر

خلوةمشاعر"
308412646934315008,KW,"تشوفني سآت ومستغرب الصمت
وأنت  السلام إن جيتني ما تسلم

أبعتبر  حبك   خطآي وتندمـت
وأنت إعتبر هـ الصمت ضربه معلم

 صح لسانه "
308414041393614848,KW,"لا تحط بـ ذمتك إني  نسيت
النوايا  ما يترجمها جفا 

"
308415777650925568,KW,"قلبك اللي غرني كبره وطيبه 
ما اشتكى هم الفراق ولا تأثر 

شي عادي افقدك بس المصيبه 
كل ما جيت اكرهك أحبك أكثر 

اعجبتني"
308416835622158336,KW,"أثر الزمن كل دروس ومفايم
والبعض من غبن  الصدور يتدفا

الصاحب اللي قد رفعت الى الغيم
في الموقف التاف تصدد وقفا

"
308420460574556160,KW,"مثل أنآ  فيني من آلحزن غيمــ
 عندي  وعند خير  واجد جراحي

لا تنبش أدراج الجروح القديمــ
ياخوف تلقى جرح للحين صاحي "
308588708104388608,KW,"ياجماعه لستتي كل يوم تنقص  

فجأة اللقى ناس يقولون ليش حاذفني انا والله ماحذفت احد حسابي مدري وش مشكله ترا ماحذفت احد "
308978589464944640,KW,شيلة العذب  ـ محرينبالخير يا ضوح براق       اهداء بدل دربه سريت 
309177237184319488,KW,"انعجبتي بمظهري ولا كلامي 
كلها الثنتين ماتفرق معي 
المهم انش تحسين بغرامي 
قبل اعض شفاي واذرف مدمعي 

خلوةمشاعر"
310589635325747200,KW,"
وخل العيون اللي لها عشقي تنام"
311663255472979968,KW,"اعشقك كثر النصر  وكثر حبي  للكويت 

واكره الفرقا معك مثــل كرهي  الهلال  "
313727900216078336,KW,"منت ناقص حلا يوم اتميلح 

الحلا ماليك من راسك لرجلك 

"
314065994245083136,KW,"ليه ساكت  وين وديت الكلام 
حاكني يمكن جروحك ذي تطيب
اعتبرني واحد  مـن هـ الأنـام
جا غريب وراح مـن عندك غريب"
314066288534253568,KW,"ليه احن  وليه احب وليه ابيك 
 ليه انا الليء دايما ما لـي صبر
 لو بـ اشره  شرهتي ماهي علي
  رح وانا بـ اشوف لـ اشواقي عذر"
314066628050554880,KW,"ودي ابني بيت في طارف سحابه 
و في وسطها إبل  ترعاها بدويه 
حلمي اللي احلمه هذا يشابه  
 واحد مطنوخ  و  إيدينه خليه  "
314258219964977152,KW,"حتى وانا ماخذ على خاطري منك
لو ما أشوفك  راح يومي حسافه
لا صرت طيب قلب من طيب معدنك
ما عاد به شي بـ غيابك  اخافه

مشاعرمغموره"
314258678897332224,KW,"ترى غيرتي من يوم ربي خلقني نار
 لاحبيت مابي تسأل الا عن اخباري
 لو انك تسولف سالفه فـ الجماد اغار
 فما بالك اليا جبت لي للبشر طـاري"
314271256117653504,KW,"ي صاحبي م عــدت  اكثــر رحاب
عذر الرحيل أقسى مـن البعد والظلم
خذنـي معـك يمكـن نلاقــي سحاب
مطـر امانينـآ علـى  ربــة الحلــم"
314382221396017152,KW,"شاعره ماعمرها قالت قصيده 

بس كل اهروجها مثل القصايد

يدل دربه "
314783593526341632,KW,"ليا قلت لك بخير لا تقول لي دوووووووم 

لاصرت موجود بحياتي انا بخيـــر"
314811628023595008,KW,"ي حبيبي ضمني بين اياديك 

والله اني حيل محتاج لدفاك 

مشاعرمغموره"
315133090362183680,KW,"عطني قلم  عطني ورق  عطني أجـواء
عطني بعض منك وأنا أعطيك كلـي 
باكتبك قصة للبشر كلها  إغـواء
عنوانها كل  الغـلا  باسـم  خلـي"
315450437455212544,KW,"ليه ساكت والسكوت اللي كذا وشهو له 
والله إني أحترت فيك ومافهمت أحساسك
يااخي إن عاتبتك وما معك عذر تقوله 
أضعف الإيمان طالعني وحرك رأسك"
315453919113388032,KW,"من باب   لا تحزن  و من منطلق ذوق
تآخذ و تسأل بـ  ارتباكك  شلونك 
وش هو له أكابر على الحب و الشوق 
والله ما أدري وش بـ أسوي بدونك "
318097272002994176,KW,"سعيت في وصلك ولآ جآك تقصير
ولآ أطري آلفرقآ  ولآ انآ أتوقع 

خطأ الحبآيب  له دوآفع و تبرير 
إلآ  الخيآنه يآ الغلآ  مآ آترقع "
318097500739342336,KW,"هاك الجروح وهاك معها المعاذير
آسف ترى كنت أحسب إني أهمك 

لاتذكر اللي فات وأشوفـك بخيــر
ولاتحسب إني في غيابك  أذمــك"
318097636999696384,KW,"آنا بديت الحب وشفني تخرجت
وآخذت الاول مع شهآدة ندآمه

تدري وش عيوب آلمحبه ليا احتجت
ي تبيع حبــــك ي تبيع آلكــــرآمه"
318977743725412352,KW,"تصد ثم تعتذر  وتعاود الكره 
وتقول قلبي على الهجران متعود 

انا اعرف اصد  لكن صدتي مره 
ماهيب صدة ثلاث ايام  وأعود "
318978121237929984,KW,"قولو لحسادي قبل مسك الختام
لاتنثر الاشواك ثم تلمها
حب على وضح النقا ماهو حرام
يخلي أهل السم تشرب سمها"
318978537241591808,KW,"وش تبينآ نسوي  وش تبينآ نقول 
والله إن السكووت أحيآن مآله ثمن 
مآله إلآ التمني  يآ ثقيل الحمول
لآ تضآيقت  عود للخيآل و تمن "
320533385929977856,KW,"حتى ولو ودك تجي  لا تجيني 
ضيعت ما يكفي من العمر وياك 

محتاج اعيش اللي بقى من سنيني 
ما افكر بوصلك ولا اخاف فرقاك "
320533757624991744,KW,"عقبـ قسـم بآلل  مآ للفـرح صـوت 
وادري غيآبـي   صآيــر ــل ـمـ
اشتـقت ل بذمتـي اشتقـت ل مـوت 
مـحد وحشنـي ثر  اسمـي  بفم"
321131396087300096,KW,"طيب وحالي زين لاصرتي معاي 

والله اني بخير  مادامش   بخير  

"
321543679028371456,KW, اي مقيوله القرد ف عين امه غزال 
132272933979684864,KW,"الله يرجع كل الحجيج بسلامة  

 جعل الدروب اللي توديك للحج 
نفس الدروب اللي تـردك علينا 

 آميـن يارب العـالميــن "
132276357957828608,KW,"

جعلي فدا خدك ودمعات عينك 

وجعل عيونك ماتطــول حزينــه

"
135475857836875776,KW,"

تدري وش اقسى شي عشته بدنياي 

 انكـ تــروح ورجــعـتك مـسـتحيـلـه

"
136212033304662016,KW,"تدرون  وش تعني لنا كلمة  كويت 
يعنـي وطـــن عمــري وداري وبيتـي
دار الصبـــاح اللــي بذراهـا تربيـت
واكبــر فخــر بالكــون انـي كويتـي"
136212748202815488,KW,"

مابي رسايل بالمسنجر وايميــلات
و الا ابغي الايميل لجل الصداقه
انا كــذا مـرتاح مـالــي علاقــات
عـــلاقة انتــرنت ماهـي عـــلاقــه
 
"
136215664598847488,KW,"يامن يبشرني بخبر موت بشار
البعثي المجرم عـــديم المراجــل
عسى خبــر موته تناقله الأخبار 
في نشرة الأخبـار نقـراه عاجل"
158358444812943360,KW,"

فديت روحش جعـل ربي يخليش

لعـيـالـش الحلـوين ولـوالــديـنـش  

وياجعل عين اللي يحبش ويغليش

تسعد مع الايام في شوف عينش

"
158358814557614080,KW,"

يمه انا اكبر  غايتي كلها ارضاكـ

ياصدق مشاعر عشتها في حياتي

"
168905019146518528,KW,"

ياقلب عبدالله وش اللـــي مــزعـلك
لادق جـــوالـي ولا جــاه مـرســول
صديت عني ماعرف ويش مشغلك
قدلك ثلاث ايــام لاهــي ومشــغول

"
168906201587912704,KW,"

لاصــرت انـا ويـاك اوضـاعي بـخيـــر
ولاغبت عني علتي مستحيله
مادامني اسمع صوت الصبح وعصير
ابشــرك كـل الليـالي جميـله

"
168907289896562688,KW,"
انتي لعيني رمش  لاواقـــرب شــوي
وتبقــى حبـيـب الروح لو بان شيبي
حلفت انا ما انساك مادامني انا حـــي
شــلون بنسى وانت اصــــلا حبيبي
"
168908195677474816,KW,"

كـثـيـر امـثـال اسـمعها ولكن ما عجبني شي
سوا اللي يقول يامـقـفي مرد الكلب للقصاب

"
168911177584357376,KW,"

اخطي عليها ثم تجي تعتذر لي
ماكني الغلطـان واطلـب رضـاها

"
168913264242204672,KW,"

تدري وش اللي يرفع الضغط عندي 
لاجـاك جاهـل وايتفلسـف عـن الـديـن 

"
168914157616365568,KW,"

يلي على شانك كتبت القصيده
هــو فيـه غيرك تنكتبه قصايد 
واليوم شوفيها انزلت فـ الجريده
كله عشان ارضيك ورضاك كايد

"
169710509480869888,KW,"

يالله عساني فدوة ادموع فطوم
اللي على شاني بكت واذرفتها 
فطوم تسوى في نظر عيني اقروم
و لها الشرف  عيني   ابمعرفتها
 
"
174394886794125312,KW,"
احيان تجبرني على شي مابيه  
واحيان انا ودي ولاهوب ودي  
اموت في همسك إلى قلت لبيه  
لاقلتـلي لـبـيـه ياعيـون جـــدي 
"
174396107005231104,KW,"
لبـى عيـون اللـي تدز  الرســايــل 
اللي رسـايلها تجـي فـي بـريدي 
امــا على الأيميـــل والا الـموبـايل 
تنشد عن علومي وتبغي جديـدي 
"
176934419339284480,KW,"

انا كـويتـي وللخـليـج انتمـائي 

اموت غوغائي ولا اموت خاين

"
179418439964827648,KW," 

يقول شسم أمك وانا اقووووول   شاهه 

فديييييتها  مـن    راسهـاا    لقدااااامها

"
179451586806939648,KW,"اليوم احس اني تغيرت وااااجد  

ماكني اللي قبل يومين ضايق "
179802859519488000,KW,"لبيــه يادموع الملاقــــا ولبيه  

ياشفتن عقب الدموع ضحكتلي"
181545065586495488,KW,"مما اعجبني  

المغازل زاد في تالي الزمان
نقص عقل وعرض وجه ومصخره

كل ما ميلت وجهي في مكان
شفت لي رجال يلحق له مره"
181546175890067456,KW,"مما أعجبني  

هذي ثلآث أيام  والعج مآ راح 
والنآس في لندن تسوي رجل ثلج 

جوي كئييب  وصرت مآني مرتآح 
يمكن من الضيقه أسوي  رجل عج "
181565690845732864,KW,"مما اعجبني  

شفت القصيد اللي كتبته عشانك  

ذلحين لامني قريته تحسفت "
181970395027603456,KW,"مما أعجبني 

تحب  و تزعل و إتغلى   يا لبيه 
في كل حالاتك  محليك ربك 

تبي تعرف السالفه كلها ليه  
لاني قسم بالله ميت بـ   حبك "
182559207160164352,KW,"أحس وقتي على ضحكة شفاتي غيور
كم ضحكتن ماتشوف النور بعـيونها

كلمات مرزوق الثبيتي 
شيله بصوت مهنا العتيبي

 "
184648864475783200,KW," يابنت وشلش في السياسة والاخبار 
 خلش على جو الشعر والقصايد  
 انتي ابداعش في القصايد والاشعار  
 والا السيـاسة كل ابيها نكايد "
184737043585306624,KW," مما راق لي 

الصاحب اللي تناسى وقفتي يمه
عز الله انه عطاني درس مجانـي

"
184737557249146880,KW,"

قوليلهم يلي  بتحدون     تبطوووووون  
وقولي لمن تبغي تحداش    تبطيييييييين 

"
184738993487888384,KW," مما راق لي 

كل شي في عمري فقدته تساهيل
ما اندم على حاجه لو إني ابيها

حتى اللي كنت بجد محتاجها حيل
راحت   وقلت الله يستر عليها

"
184860281921482752,KW, يمقن اي يمقن لا 
188084660100804608,KW,"يلي تقول ان البحر فيه راحه 
جيته وزود صوت موجه حنيني 
جيته ادور للخفوق انشراحه
وهلت مدامعها من الضيق عيني

"
188085190676066304,KW,"ماعاد للضيقه بصدري مساحه 
من كثر ضاقت  لاحاسيس فيني

انتهى"
188089750081650688,KW,"بكتب شطر وابيكم تكملونه  

تدرين لاغبتي وش يصير فيني  



ي الله شدوا حيلكم "
188094414055411712,KW," 

صدقش 

يازين وشهوله علينا تغلا 
ماتدري انك عندنا غالي حيل"
188095769247629312,KW, يعني اخر حرف من البيت تبدين فيه ببيت ترا مو شرط من راسش البيوت عادي قصايد اغاني
188096538810138624,KW,"مثال  

ابعتبر فرقاآك من طيب ذاتك
و منت بـ خساره لا بغيت الحقيقه

اللي بعدي  

هذي حياتي عشتها كيف ماجات 
اخذ من ايامي وارد العطيه "
188096744133890048,KW, بس بشرط ماتكرر الابيات
191835136285876224,KW,"

تدري وش اصعب حب ممكن تعيشه 

انك تحب انسان ما عنده احساااااس 

"
193370808633139200,KW,"شاعر وفبحور الشعر كلها عمت
واتعب على بدع البيوت الفريده
افطر على جزل القصايد اليا صمت
ماتعسر الساني بيـوت القصيده

 وسلامتكم "
193532264339095552,KW, باللـــــ قلي  كيف تبغاني احب وانا من احساس المحبين تايب  الحب الاول مالقى للحزن طب  للحين انا ويااه ندفع ضراايب
194825308589916160,KW,"بطاقـة السحب الالـي يابعد راسي 
العين فـي شوفتـش تنـسى بلاويهـا
إليا حداني الزمان و طحت رواسي
أرقـامـش الأربعـه مـانـي بنـاسيـهـا 

"
196575410950123520,KW,"من راح جعل الله يسمح ادروبه 

مانيب متحسف على كل من راح"
200508907456696320,KW,"تقول ابغي اكرهك قلي شلون 

الا انا وشلون ماقد كرهتك

 اللي يحب مايكره "
200511598941585408,KW,"عمرش سمعي بشخص يعشق اخناقش  

هذا انا لاغبت عنش وعوودت  

 خناق الحبايب دلع"
203791878339047424,KW,"ترا السماحه في محيا هل الخير

مثل القمر لامن كمل في شهوره"
204106804572065792,KW,"بعد ماعافك الخاطر تجي وتقول سامحني 
لك الله حتى لو اني عذرتك عافك الخاطر

اشهدنه عاااايف "
204207459873726464,KW,"معادني بعبدالله اللي تخبرون  

تغيـرت كـل الامــور القـديمـة  

"
204710416721510400,KW, ناس تضيفك لجل تقـرأ قصيدك وناس تضيفك تبغى منك الاضافه الصنـف الاول ودهم في جديدك والصنف الاخـــر تعتريهــم لقافه
211701462563172352,KW,"صار عندي من الضيقه مناعه 

من كثر ماني طول الايام ضايق"
211722207980822528,KW,"تقول ظالمتك ولا سويت لك شي

وتقول حارمتك من ابسط احقوقك

واقول جعل الله يدومك لنا حي 

وعسى الليالي دوننا ماتعوقك"
218325183205867520,KW,"كيف ابضحك والصدر دايم يضيق 
و انت ماتدري عند الخافي بعد
عايشن محتار ماعندي صديق 
اسهج الخطوات ماعندي احد

"
228332969260093440,KW,"يابورما ندري بوضعش ولكن 
حنا شعوبا عزنا الله بالدين 

وشعوبنا ماحركت اي ساكن 
ياللأسف بالدين صرنا ذليلين"
230066298841882624,KW,"يحبيني ويموت فيني ويبيني 
لكن  مع  هذي وهذي مطنش"
230193714444771328,KW,"النوم ماله في جفوني معشا 

عزي لمن مثلي عيونه اجياع "
232092447184941056,KW,"قبل  راسلت  ابغي احاكيك 
ورديت  لي بالخاص  لحظه فديتك 
قعدت اقلب هاتفي  وانا  احتريك  
مرت ثلاث  ساعاات فيها احتريتك 
"
232092737510457312,KW,"لاصرت صامل بالعلاقه وانا ابغيك 
مابيك تخسرني وانا قد بغيتك
لكن تأكد اني اليوم شاريك 
لو يرفع السوام سعرك شريتك
"
232095023339016192,KW,"اضحك وصدري ممتلي ضيق وهموم 

مدري متى ضيقااااات صدري تعدي"
232325496329863200,KW,"عزاااه  يافروح وعيون فروح 
اللي بسببها حولت دمعة سعود
عزالله ان سعود ضايق ومجروح 
ماله جدا الشكوى ويشكي لعبود

"
232325608871456800,KW,"غيابها كنه مثل نزعت الروح 
وغيابها طول ولا يمكن اتعود
عزالله انها بالجفا هدت صروح 
ماكان بينك وبين ذا الصده اوعود

"
232325719307481088,KW,"واقفى يجر الصوت والصوت مبحوح 
ضيقه صدر ودموع وحجاج معقود
يخفي اعلومه لكن السد مفضوح  
أنا الوحيد اللي درا اشفيك مضهود

"
233075911833051200,KW,"الطعنه اللي منك ماهيب طعنه

هذا غرامك غارس الشوق فيني

 قبل النوم "
237003950577045504,KW,"نهار عيدي لابس الهم ثوبي

ودمعات عيني للمقفي عيادي"
237004330039914496,KW,"العيد ماهوب بالرسايل حبيبي  

العيد والله شوفت عيونك السود"
237236877772611584,KW,"لبيه يلي كاشخه في ضحى العيد 

تمشي بغنج بين البنات وتباهى

اهداااء يدل دربه "
238088528012136448,KW,"والخفوق الي من البعد امحزون 
هزه الطاري لشوفش وارتعش
لاسما طيفش على روس الغصون  
ردت الروح لخفوقي  وانتعش

"
238088776969228288,KW,"لو كتبت الشعر بدموع العيون 
ماوفى حقش ولا ارضى مطمعش
ماحد غيرش على قلبي يمون 
فدوتش قلبي ولا احد يمنعش

وسلامتكم"
239852778283991040,KW,"انتظارك شي اصعب من جفاك 

تعااال والا روووح ياخي وفكنـــي"
242600074478235648,KW,"دامك تبيني ماعلى حالي خلاف
ما ابي ولا حاجه مدامك تبيني

"
242814624318251008,KW,"انا عشقتك صوت من قبل اشوفك 

شلون لو شافت عيوني  عيونك 

يدل دربه  "
245531217192165376,KW,مابيك تفهمني غلط لو تكرمت  دوبي ودوب اللي يحرف كلامي
246747150984310784,KW,اكتب قصايد واتنغى مع الورق  والناس ماتدري وش اللي ف بالي
247214966288031712,KW,ياناس أنا مدري شسوي معاها من اللذي سوت بقلبي  سوايا صعبه إلى من جيت بوصف حلاها فيها من الهام الفضاله مزايا
247943232170913792,KW,حاولت اسج ولا قدرت اني أسج  ودمعي عليك من المفارق ذرفته
252638915738075200,KW,غايب جسد لكن عن البال ماغبت  وبيتك امره بين فتره وفتره
255395806457253888,KW,غصبن عليك اصلا ولاهوب كيفك  هذا كلامه كل ماقلت احبك  
257795311630704640,KW,حنا لو الله يفكنا من الخرابيط  كان حنا بخير والدعوى سهاله
257988944988348416,KW,مابي احد عقبي يحل بمكاني  وهذا مكانك ماسكن فيه مخلوق
258028948280193024,KW,السموحه ياخفوقي بفرش فراشي وانام  ليلة البارح حزينه ليتني مأعشتها
259679978596208640,KW,أنا بديت اعجاب قبل العلاقه   من عقبها صارت غرام ومحبه   لكن صدمني وقال خلنا صداقه   انا بحياتي شخص غالي واحبه
259692305823440896,KW,ايه ابيك   ايه ابيك   وبقتناعي  كيف ما اقنع وانت اجمل من عرفت
259706599684321280,KW,تحط صورتها ولا همها الناس   وتقول كيفي صورتي وبجهازي
263849083620433920,KW,"من قال  بس اليوم في كل الاياام
كالعاده انت تناام بدري و انا اسهر 

و عادي  إذا بتنام  كلمني  و نام 
بس الخيانه و الجفا  خط احمر  "
263849165363236864,KW,"تقول أنآ في غيبتك مآقدر  أعيش
ويقول أنآ في غيبتك مآني ب حي

كلآم كله كذب في مرحلة طيش 
شفهم تخلو عن بعض مآحصل شي"
263849261077241856,KW,"يافارق التوقيت بيني وبينه 
غلاه متعدي الزمان بمسافات 
حسه وضحكاته وصوته وعينه 
تسوى الحياة بكبرها والملذات"
263849340416688128,KW,"يـاليـت للصـم ـت صـوت وسوالــف 
ويخبرك صم ـتـي عن اللي بـ جـوفي 

المشكلة اني على الصم ـتحالف
مـا أتكلـمـ حتى لو اجبرتني ظـروفي "
264011144086306816,KW,"مدري وش أقول لكن جعلها خيره
لو إن بعـض السوآلـف  مـآ لهـا دآعـي

إن جت لـ طآري المعآتب فضها سيره
من كف غيرك  ترى مآ بريت أوجآعـي"
264012104359620608,KW,"خذني بقآيآ مآبقى من  بقآيـآ  
وإن مآبقى بي شي  خذني ولآ شي
وآكشف عن جرحي بوسط آلحنآيآ 
تلقآنيـ آلميت ل آ آلبدحي"
264012305249992704,KW,"زعلااان مني  لا تقول الحطب طاح
عااتب على كيفك  و  ريح ضميرك

أخطيت في حقك و  عييت لا أرتاح
يا ليتني مخطي مع   إنسان غيرك"
264022154545344512,KW,"من فضولك مابقى فينا فضول
لتفت صوبي تحسب آني ابيك

كنت اغني واشر بيدي و اقول
 ياشبي صويحبي حسبي عليك "
264022557810884608,KW,"سيوف الصراحة سجنها ماعليه افراج 
لان الصراحة يازمن غير مرغوبة

نمثل بطولة فيلم لكن بدون اخراج
وقصة سيناريو الفيلم ماهيب مكتوبة"
264024641054593024,KW,"تدري وش آللي يذبحك عقب آلفرآق 
وتحس بـ  أنك في حيآتك تكفنت 
إليا إتصلت بـصآحبك و آنت مشتآق 
وتظن  كله شوق  ويقول  من أنت"
1134856464537915392,KW,"نعيش ونشوف
عالم السياسة ملوث فيه المنافق والمرتشي والكذاب والخنوع والسفيه اللي كل طموحه الشهرة والوصول
لا همهم إدارة بلد ولا درو عن أحوال الشعب وكل تركيزهم على هالكرسي المحصن الملعون
ولا اعمم فلو خليت خربت"
1137462790267035648,KW,"والعجز ان  وجد منو اللي سببه الشعب ام سياسات الحكومة اللي خلقت الاتكالية ودعمت الواسطة وأقصت الكفاءات واهدرت المال العام
ومازالو متشبثين بالكراسي "
1138467588097413248,KW,ما فهمت يعني مو المفروض يتصلح الخطأ 
1139818484257476608,KW,"الناس أذواق

اللي يصبغ بيته بلون فسفوري فاقع شنو يقصد هل يود تمييز بيته ام هذا هو ذوقه
مجرد تساؤل"
1139864625397358592,KW, لا ما اعتبره استسلام بس ما كانت عاجبتني بيئة العمل كانت جدا سلبية
1139920566444601216,KW, العصا السحرية نفس خلطتهم السرية اللي عفست الشورارع
1140550797861773184,KW, لو كان الكل يعاني ماكان شفنا الهوايل الي نشوفها بالشارع كل يوم 
1140592012418265216,KW,"ودي اعرف المحسن اللي تبرع بمبلغ يقارب المليون دينار ككفالة للازاريفا قبل أن تحسم القضية
"
1140600981828395008,KW, وهل هذا يعني نشوف ونسكت
1140843049922310016,KW, عذرا ممكن ايضاح نقاش وين
1140870504477286400,KW, لاني بالكويت لازم استغرب
