id,dialect,text
974486913007566848,QA, ابركها من ساعة  وعلى فكرة الدوحة من الأبد وهي معزولة عنكم فكريا والحمدلله جا اليوم اللي غباءكم خلصنا من شوفتكم في بلادنا  جزيرة معزولة ولا شبه جزيرة بجيرة البقر الأخضر
974501461311725568,QA,   وانتي شكلج من الطبقة اللي تبي تغيب طول السنة ولاتبي حد يحاسبها 
974503432982679552,QA,  مع احترامي الشديد كونج موظفة في المركز وماتعرفين القانون اللي تعمم عن طريق الايميل حق كل موظف في الموسسة والمراكز يعني انج في عالم اخر وكلنا نعرف ان اللي ضايقكم انكم ماتقدرون تلعبون لعبة المرضي اللي كنتوا تلعبونها  ولا نظام الاجازات الجديد احسن من النظام القبلي 
974506031874109440,QA,   تسمع الشكاوي لان في مجموعة من الموظفين يبون يسرحون ويمرحون ويغيبون طول السنه ولا يبون حد يكلمهم وإذا حد كلمهم ولا نبهم قالوا احنا مظلومين  واللي اكتبوا عن إلغاء الاجازات كله كذب في كذب مفروض نسال متى تفتك قطر من هالفئة اللي تبي راتب وهي قاعدة في البيت
974526776717144064,QA, بتموت ولا راح تشم هوى الدوحة يالخسيس
974873713173610368,QA,   الصياح اللي صاير الحين لان تم اتخاذ اجراء ضد التسيب اللي كان صاير  والدليل ان فئة صغيرة في مركز واحد من السبع مراكز هم اللي تكلموا ضد القانون
974893138685788160,QA,   ماتنلام لانعدام وجود البنات عندكم ماتعرفون الأسامي كل اللي عندكم صبيان ومتحولين لبنات وابصم بالعشرة انك واحد منهم
975044888462020608,QA,      لا احنا شباببنا يتزوجون بنات  زواج البقر يصير عندكم بس يالبقرة
975058479139426432,QA,      ندري ماجبتي شي جديد ندري انج بقرة واللي حواليج بقر يالطرارة لو فيج خير مااشتغلتي دلالة نسوان
975061254556569600,QA,  احنا عايشين حياتنا بالطول والعرض  وهم لا وظيفة والمعاش مايكفي وان تكلموا راحوا في داهية واللي عنده بيزتين راح إقامة في الريتز وطلع بدون فلوسه اقول لافج شبكم تعال تكلم
975068663316283392,QA,      طيري انتي وياها ويا الاعلام اللي رازتها لابوكم لابو الكلب
975071875285110784,QA,  خير هل قطر ولله الحمد ويالغبية قالج عطو من زكاة هل قطر حق عوائل في قطر محد قال انها عوائل قطرية يالبقرة
975214161566290048,QA,      اقول اولا ترى انا وحدة مب واحد  وثانيا صراخج على قد الالم والله يفك عوقج وثالثا فلوسنا حلال غصبن عن اللي خلفوج  وهملوج
975554938032996352,QA,      لو انج كيوت مااشتغلتي خطابة نقاب النينجا وتدابجين من بيت لبيت
975557734463553536,QA, لو انهم قطريين ياحظي كان اعرفوا ان الهاش تاق غبي ومحد بيصدقه استغفر الله  المشكلة يوم تعاديك البهايم ماتدري تضحك ولا تشفق عليهم 
975559986494431232,QA, رجاء لا تعمم سمعة أمك اللي ماعرفت تربيك على الأمهات الشريفات اللي سخروا حياتهم لتربية عيالهم
975567398437666816,QA,الحين عقب اللقاء قلنا بووو خل الجيش يستعد سليطين ناوي عالشر واخرتها هاش تاق كأنه ويهك ما اقول الا طيح الله حظك انت وأمك اكثر ما هوطايح 
975571475720675200,QA,يقولك بحلته الجديدة جعلك الحلة اللي ماتفارقك طبعا امامالدعارة يحاول ينسي الناس حقيقته اللي انكشفت ويحاول يرجع ثقة الناس فيه لكن الحمدلله رب العالمين اللي فضحه وكشف أمره وياوسيم النجس بقولك شي كل هل قطر  مب محللينك وبناخذ حقنا منك يوم القيامة   
976812670438576000,QA, بدليل ماترقدون لا ليل ولا نهار بسبتنا
977417175098159232,QA, ماشايف خير  ماصدق يمسكونه شي ذبانه وخلوها تصير رئيس الذبان حاله مثل الخدام اللي يصير رئيس خدم ويعد روحه اهم من صاحب البيت نفسه  السعودي الخايس
978330814743117824,QA, اخبار بدلة المهرج البنفسجية للحين تلبسها
978331249784717184,QA,    والزقتين فيكم وفي اللي ذكرتهم
978583749301547008,QA, اي حد يحترمك فهو على شاكلتك ومانحتاج احترامه اقول خل يعطونك حارة تصير رئيسها ولعبوا لعبة استقبل وودع نفس كيدز موندو  مالت عليك وعلى من رزك
978584436626337792,QA, عساكم التليف الكبدي وعسى مايتم فيكم عود صاحي
978591488157331584,QA,  وين المشكلة الجيل اللي في اعلى المناصب اليوم والجيل اللي وقف في وجه الحصار هو الجيل اللي درس على هالنظام وأشد من هالنظام بعد شرايك نمتحنهم في فنادق ومنتجعات الله يهديك بس
978671135502954368,QA,  وهالطنا وينه يوم سبو رموزنا  خل يستريح ولا يدور الشهرة من ورى عيالنا
978822787962847232,QA,  موضة المجنسين صارت عندكم علامة مسجلة على كل حد مايعجبكم هذولا بناتكم ومن سنين معروف ان عندكم فئة من السعوديات لا اخلاق ولا كرامة
979211883633958784,QA,     عساكم بهالقهر وزود ياحثالة الخليجيات
979573110058901632,QA,اللي يختلف مع رموزنا يختلف مع شعب قطر بكبره وأي حد ضد الحمدين احنا ضده  خلافنامعالحمدينلاالقطريين
979574358082384000,QA, على اساس بهمنا خلافك معانا  وفر جهودك وكلامك حق أشباه الرجال اللي مثلك وحولك واللي لعب بكم النظام الملكي وخلاكم مثل الدبش وسط الشعوب
979702941438431232,QA,اذا كنت تقصد قطر بالدولة الخبيثة فقول أمين عسى الخبيث ياكل جسمك وثانيا اذا الفيديوات بتنحفظ حتى هالفيديو بينحفظ وبنرجع نحطه يوم توقف شرهات الكلاب شرواك وبيخيس حلجك وبتجي عندنا مثل الكلب تقول سامحوني تراني كنت مغصوب  
979740683908116352,QA,     احنا موجودين وبدليل شاغلين بالكم ليل نهار
980634486307143552,QA,  ولكم مثل مادعيتم به وزيادة انتي واللي رازة صورته في البروفايل
980636745233387648,QA, اولا البلا منكم فيكم وفي اعلامينكم وثانيا ماعاد لكم امان حتى لو انحل الموضوع سياسياقطر برية من أمنكم الداخلي  والله ينتقم منكم ممكن اعرف شلون نأمن في بلد يحكمها طايش قام الفجر وقرر يسكر الحدود ويمنع حليب الاطفال والادوية عن جاره انت لو فيك خير وفر جهودك في الدفاع عن شعبكم
980644467026796416,QA,حلم سوسة يتحقق و عيالموكلي بتصير عندهم فلوس يشترون فيها ثياب يسترون عمرهم عقب ورق الشجر 
980645187151003648,QA, يستاهلون عيالموكلي يسترون عمرهم بهالفلوس هاي اذا شافوا منها شي
981026282640232448,QA,الأخ متاثر بكرتون جزيرة النخيل  بلوط وعلقم شريران على الأذية متفقان  اللي لحنها انت من جيل الطيبين  
981032179185717248,QA,تقصد الموكلي موكلي  ياعيال موكلي لاتفشلونها خلكم موكليين مع خبر النفط 
981035651071127552,QA,انتي بالضبط مثل الطرارة اللي تحاول تقنع الناس انها كانت بنت البشاوات  باختصار بكيزة الدرملي 
981235762447265792,QA,يوم تنحشر انت وأشكالك ورب العالمين ياخذ حق هل قطر اللي تحسبوا عليكم ليل نهار منكم 
982148068458901632,QA, قرارهم غبي نفس ويهك الخايس  لان لو فيهم مخ ماسوو منتجع على صبخة
982149913336164352,QA, احنا نستورد بقر  لكن انتو والبقر واحد
982212434915045376,QA, مصيبتكم انكم احتكيتوا بشعب وفي لبلاده وماتنلامون انكم ماتصدقون ان هل قطر هم نفسهم اللي واقفين في وجوهكم لان لو الازمة كانت عندكم كان اول من خون فيكم شعبكم وانت وأشكالك مقطوطين في أقرب درام زبالة
982222383850205184,QA,  شعب قطر اللي كسر خشومكم يالبهايم
982565222664765440,QA, يعني بالبحرين ترى مالكم راي ومالكم حكم على حدودكم السعودية تدخل اللي تبي عليكم وبتغزوكم مرة وحدة وانتو تضحكون
982966447478521984,QA,    هالآفات معروف انها من عندكم 
983264927740641152,QA,  صحيح غيره بغباءه ومسح تاريخ بلاده وقريبا بيمسح بلاده بكبرها
985727389522124800,QA, شوفو من يتكلم عن الكرامة  بنت الطراروة اللي نسوا شعبهم الكرامة وخلوهم اذل شعب وافقرهم 
985733297274785792,QA,طبعا التقطت هالصورة قبل قليل عقب مازحروا الضيوف وفي بريك المقهوي دليمالفلس والرقاصة توتووناسه  وبعد قليل بفز المقهوي يصب القهوة وتوتو يرجع يربط خصره ويتهزهز ناقصهم بس امامالدعارة وسيم يجيب النعاشات 
985895181068234752,QA,الأخ من السعودية يقول ان قطر باعت دينها  مفتي السعودية شوضعه أئمة الحرم شوضعهم ماعليك شرهة ومعذور لان كلامك ياخايف يا مدفوع لك وفي الحالتين بهيمة 
986618484984635392,QA,يا الثور جواسيسك مغلطين تراهم يتكلمون عن زيارة بو بدلة الخيمة وربعه 
987076113473130368,QA,  كلي فخر اني بنت موزا  موزا اللي لو تجمعين كل نسوانكم ماتسوون اصغر أظافرها  امنا وتاج راسنا
987172599061823616,QA,    ردي كان للحماراتي اللي علق فعدلي نقاب  النينجا وامشي عدل
987173871865376768,QA,   سوطه مايتعدى حظيرة كلابه  قال سلمان الحزم قال الحوثي لعب فيه ومرمطه ومرمط كرامته هو والدب الداشر بالخيمة اللي لابسها
987174909959782400,QA,    يحليلكم شكلكم تبون تكونون من النعاشات اللي يتاجر فيهم امامالدعارة والا يمكن انتو من ضمن الشبكة النعاشية ولا في حد يدافع عن هالكلب الاجرب
987177538978852864,QA,    وانتي شالمشروب اللي عندج هالحزة يالنعاشة
988284317834064000,QA,الكلام اذا طلع من غفراني اللي خبري خبرك فهو عبارة عن في سوق الصفافير   والله يحشم ال غفران من هالاشكال رجلامنقطرييفضحالحمدين
988574201719095168,QA,  قطر مأمنة نفسها من حيث الماء  والاستفادة من الانهار  من باب توفير الرفاهية للشعب  والله يهنيكم بالسعودية والخمة اللي حواليها
988574666640912384,QA,  على اساس الانذال اللي حوالينا لهم امان انت لو ساكت ابرك لك
988619218173157376,QA, الصور من المجموعة اللي نزلت قبل افتتاح المطار يالثور شفت المنطقة جنب الدبدوب بس حبيت أقولك افتتحوها وفيها ارقى المحلات والماركات
988619571912359936,QA, وديور اللي ورى الدبدوب كان معرض وقت الافتتاح وكل مرة تنعرض ماركة غير
988620374899224576,QA, واااااااااو انزين وتعطيل الوظائف عندكم ومعاملة بن كلب اللي يعاملونكم فيها والبيوت اللي ماعندكم انت لو منطم ابرك لك  وأبشرك سياحتنا ما ازدهرت الا بفرقاكم ياويه النحس
988621683857678336,QA, انزين يالمري وشتبي بعد شرايك نعطيك راتب اعلى من راتب شبكة الذبان الالكتروني وتكتب اعترافات سعودي اشتغل ذبانة من الفقر و مستعد يبيع امه وابوه
988624000937901952,QA, وانت بتموت ولا انت بشايف نص الخير اللي عايشين فيه اهل قطر
988631736505401216,QA,قاعدة كونية ثابته طول ما حلاب البقر يحلبكم خل يخلص حليبكم مب كفو توقفون في ويه احد  كسر شوكته قال  
989973873398501376,QA,       الفرق انه يكتب نحن باللغة العربية لكن الثيران اللي مثلك يكتب نحن بالعامي لغة ام علاية ودقني مالت عليك وعلى من يدفع لك  
990248267035430784,QA, خل درع الجزيرة يعطيكم حقوقكم كسعوديين وكبشر بدال معاملة البهايم اللي يعاملونكم فيها
990249079195230208,QA, يالناقة عالاقل شيل صورة الشيخة هند والسفيرة الامريكية  صج انك ناقة
990249864465404032,QA,وين المظاهرات نبي نودي البسطة وفوالتنا نتفرج   مظاهراتفيقطرضدالحمدين
991195855020441600,QA,   الكويت تحكمها رجال وتعرف الصح من الغلط مو مثل بعض الناس روح روح تعال تعال
991330637004115968,QA,   الديوث هم أشكالك اللي ساكته عن بلاوي لجنة الترفيه روح بس روح الله يستر على هلك
991545699878629376,QA,   الحمدلله على نعمةحكومتنا اللي تعاملنا احسن معاملة  والله يعينكم على معاملة حكومتك اللي تعامل البهايم احسن من معاملتها لكم 
991586842523844608,QA, بكلمك باللغة اللي تفهمها أمريكا بتدق لكم دقني دقني وانتو بتهزون على الاغنية  وبتنهون حصار الفلس اللي محد تضرر منه غير بلادك يابو وزار حلي
991752619226906624,QA,   الطريقة اللي تعاملكم فيها حكومتكم هي اللي تخلي تفكيركم محدود وتصدقون اللي هم يبونه وكانكم ماجرين عقولكم عليهم
991918820993351552,QA,لعلمك فقط يا امام الدعارة والنعاشات ما سامحناك وبندعي عليك وبنتحسب عليك لين اخر يوم في حياتنا ولا تفتكر ان الكم شهر اللي سكت فيها عن تاج راسك قطر بتنسينا فعايلك النجسة يالنكرة 
