id,dialect,text
1158791264688582912,AE,  هذا اللي يقول لك   ان تبدى لكم تسؤكم هههه
1159394200892448768,AE,  كب عليهم عشاهم ههه
1159427417473265664,AE,  الحمدلله عالسلامة اخوي مبارك  والسعيد من اتعظ بغيره 
1160245250771824640,AE, الله المستعان  انا في السعودية واستغربت من صرامة وزارة التجارة عندهم في حفظ حقوق المستهلك كل شي واضح ومكتوب و عندهم خط ساخن ابليكيشن ويردون عليك بنفس اليوم من التطبيق الالكتروني بدون ماتراجع وتضيع وقت  تراهم  قاموا يغلبونا السعودية في حقوق المستهلك  شدوا حيلكم ربعنا
1160448234118164480,AE, من العايدين والسالمين ياطويل العمر
1161026420308684800,AE, انا اشوف غير مقبول لانه ماله اي حاجة يدخل غير انه يتطمش وبس طبعا ومع الغير محتشمين
1161026852485554176,AE, غيرمقبول لانه  عازب وجاي يتطمش وبس وماله حاجة غير و بيسوي زحمة مال امها داعي 
1161758287207047168,AE, اول مرة اشوف ردود بهذه القسوة  اللي رايح يضرب  واللي جاي يضرب 
1161946445878046720,AE," التوحيد هو ان تشرك بالله  

 يلعن ابو الصنف اللي يتعاطاه"
1161981467850883072,AE," اذا ما كان يسخن اموره طيبه عموما  للتأكد ضعي رقم الجهاز في الرابط و يجيك العلم اليقين من شركة التفاحة 

"
1162198758311919616,AE, وش حكايتهم نخلص من واحد يطلع لنا اخر مثير للجدل والفتنه
1162478794432753664,AE,   الشبك لابو من جمعكم
1162726188240003072,AE, الي يسوونه هو الصح
1163423672020942848,AE, اقسم بالله  انك جبتها بالمللي  لافض فوك ياسيبويه الامارات
1163487137041457152,AE,"عطوني   بس و خذوا الجديد

خواطر"
1164941271733084160,AE, كفو واللهناقصين احنا
1164948311440265216,AE, اخوي سالم الوحش الجميل ابوكشه  خله ينتبه على عمره  تراها واصلة عند ركبته الحلقة البطان  وحتى العيناويه نخاف عليه نباه للمنتخب  ومبروك الفوز الكبير على خورفكان 
1165664457680404480,AE, ههههههه  ما شفت في حياتي زي كذا  و السواووويخ  وينها
1165691048577949696,AE, يتهيأ لك يا سعد
1166432594667458560,AE,"  يا وجه استح

شرقسلوى"
1167413331575095296,AE, للاسف هذي صارت اهم اختبار منتخباتنا الوطنيه  يالله الفرج
1168111703680323584,AE, الف مبروك ام ناصر وتستاهلون الفرح
1168963929223180288,AE,"الصورة فيها كلام وايد و تمثل اشياء وايد بس ماقدر اتكلم 

بهرجه "
1170062572403535872,AE, هههههه  شدوا حيلكم  الوضع عندكم مش ولابد 
1170654933043097600,AE, يصير اللي من خارج الامارة يعطون اصوات 
1170792967080222720,AE, ما باذني ماي  يا سعد   بس طلع مايصير للاسف
1170914888656576512,AE, تحت رحمة خالق فاكساي
1171041724296286208,AE, ليتني اقدر اعطيه صوتي  للاسف خارج دائرتي الانتخابيه
1171409319017013248,AE,  انا بعد عرفته  و يعجبني شاورما قريب منه بعد 
1171771306624409600,AE,  ماله خص والرأي العام مكفول قانونيا  بأدب و احترام  الجمس الاسود ربى وايدين سلامي عليه
1172197942406582272,AE," اليوم مووووولللللع القلم  تغريدات كلها واقعيه و حقيقية  من الصبح 

عيد عيد عيد سمعني يا قلم  و الي يرحم والدينك عيد "
1172464720974110720,AE, يمدحون البلوك والميوت يابوراشد
1172469781129302016,AE, ياطويل العمر  يتحججون بان المواطن الخريج راتبه  الف مع انه يدفعون الكثير للرسوم والكفالات البعض منهم يعمل بمنهجية اضرب واهرب  خذ ماتقدر تشيله من ارباح  ولا كأنهم جزء من مجتمعنا 
1172516765726912512,AE,   مش اول مرة بو مبارك  ما نسينا احداث عدن
1172599851747614720,AE," للاسف نسمع بعض أولياء الامور يقول ليش اخليه يدرس خل يصير لاعب كورة بيلعب بالفلوس 
و الحين مع تطور العصر يقول خل يصير مشهور بيطلع فلوس 

الدولة ليست بحاجة لشعب ثري الدوله بل بحاجة لدم من الابناء نقي"
1173487768359579648,AE, ايوه كمل تقولي جمهور الجزيرة اكبر من جمهور العين 
1173772979702026240,AE,   من انت يالوبير  انت اصلا نكره والشيخ علم كبير 
1173829794544455680,AE," سابقا نشوف مواطنين في البنوك فالكاونترات و نشوفهم في الشركات يوم ندفع فواتير موبايلاتنا الحين إذا تراجع تشوف شخص تقوله السلام عليكم و رحمة الله و بركاته ما يجاوب إذا قلت كمستكا يقولك مبوتي و إذا قلت كيساهي يقولك تيكي 

وين التوطين بالضبط "
1174207731076669440,AE,  يبغي يراويك البوردينق باس بطريقة احترافية و إذا حصلته قالب البوردينق يعني الحبيب ايكونومي مع مرتبه الشرف  و إذا بزنس يعني يقولك انا قوي و فالأخير ابقريد من نقاط سكاي وردز بسبب كريدت كارد مب مدفوعه فاتورته 
1174696148705132288,AE,  تفرحنا عودة الجماهير بعد قطيعة الموسم الماضي بالتوفيق لفخر ابوظبي   مشجع عيناوي
1175115331762868224,AE, الصورة فيها تشكيك في نزاهة حكم مواطن وهذا تصرف مرفوض وماتوقعتها منك
1175459572619911168,AE," انتقائك متنوع و دقيق 
و هذا دليل على نجاح الموسم بالفعل الرجل المناسب فالمكان المناسب 

محنك انت يا بو ناصر"
1177172332328226816,AE," ارجع لأول كلمه فالتغريدة الى كتبتها بتعرف ليش زعلانين 

فضائيلاتكلمني"
1177272622117261312,AE,  قوله تشاااو  المدرب ماعنده وقت لهالسخافات 
1177302197413011712,AE, بوعيسى  مقتنع بالمدرب ليكو 
1177579894982815488,AE,  لسان حال الولد الوصلاوي يقول  هذا ما جناه ابي علييا 
1178268926326779904,AE,  الغلطان اللي دعم من الخلف مع ان مافعله السائق الاخر في نظري جريمة تستحق العقاب
570564058899992576,AE,"كثر العطاء اكبر خطاء 

"
574034118268305408,AE,"ملينا من الحكي ودنا الأفعال تحكي

حكي"
574344613550411776,AE,"و ما حزنت إلا على ذيك الفرس
               الي مالقت فارس يعسفها

بخاطريكلمة"
574369254327259200,AE,اسماء المنور  خطوة اشواقي 
576424364054196224,AE,"اصعبشعور 

لا شفت نفسك فاقد نفسك"
579994402174545920,AE,"ليت الحكي كله اقدر اقولهو ليت وصله اقدر اطوله

اخاف منه و اعشق ميوله

نفسالشخص"
590206491056996352,AE,و كم غائب فالحقيقة حاضر
590207678443429888,AE,"تعويض

من قال أحتاجة

حشى والله ماني بحاجة عوض

 "
726918588972564480,AE,النظرات قد تكون نداءإستغاثة
796746249680650240,AE,"و بعض الشخابيط تتعلق بالجغرافيا 

الرياض "
814876469998583808,AE,اجمل شعور هو الا شعور
829909850624815104,AE,اللهم صلي و سلم على محمد و ال محمد و صحبه و بارك و سلم
833379866749853696,AE,"زحمتك بداخلي سرت بي للعزله

إعتقني"
871196595458629632,AE,"الشي المشترك عيا يشركنا

نداءإستغاثة"
952866990502416384,AE,دع الخلق للخالق يا انسان 
1004324902743236608,AE, الله يبارك في الله عرضوا منتوجاتهم وماجربتها  لكني شريت من  شهور تقريبا كاميرا ترانسند ممتازه و تتحمل شمسنا الحاره وانصح بها    
1004673327087149056,AE,"اليوم الخميس  يونيو و درجة مئوية في منطقة الحفار ابوظبي 

شكله هالصيف بيكون باربيكيو  "
1004885900587949952,AE,  كويتي شريف  تستاهل كل الخير
1005416385760104448,AE,بدهاش تزبط  مش عارف لويش 
1005509282534711168,AE,  راح فيها القطري المسكين  الله يعينه
1007615333686005760,AE, سبحان الله  ليش دايم الاخونجي غبي  ورطوا انفسهم في مصيبه  
1008405531722223616,AE, اقترح ادخالهم دورات عسكرية للصغار لترويض عدوانيتهم و لامبالاتهم بممتلكات الوطن 
1010521280251092992,AE, اول مرة اتحمس للاستديو التحليلي بعد مباراة في كاس العالم
1014241177615454208,AE,  ياشباب اللي مب عاجبته الدراسه يراجع الاتحاد الدولي 
1014241744722984960,AE,  تخيل ان اللي حطوا نقطه تهكرت تلفوناتهم 
1014465372014239616,AE,  وين اخونا  الشقيري عنهم  يبييلها حلقة خاصه 
1014870263740198784,AE, علشان تعرفون ان الانسان الخليجي غيييييييير عادي و مش طبيعي 
1019149696105894016,AE, ماشارك وفاز  يخرب بيت تحرير  النصوص عندكم 
1024135184957026432,AE,  صح لسانها الشاعره وانا اشهد بكل حرف قالته 
1026377484907044864,AE,  بو يعقوب  ارجع ارجع
1028344761630040064,AE, مو شي  ما طلعت زي الابداع
1029641402764984448,AE, يارب يسويها  يقول لك عط المجنون حبل
1031654497024716800,AE, حارق دمهم طالع نازل  راقي كالعاده يا بيب
1033733473356394368,AE,  تعرف تغني ياليل مااطولك 
1034118960315359232,AE, الشبك يا مسيلمه  الشبك
1034303505585111040,AE, حبيب يا عياد ربي يبارك في عمرك
1034304774794035200,AE, ربي يبارك لك في عمرك اخي الجميل ويحسن خاتمتنا
1037794622733467648,AE,"اطالب بتشفير جميع ماله علاقة بكرة القدم المحلية 

اقالهزكيرونيمطلبشعب"
1039910452053065600,AE, المصيبه انه بعدها الكل بيقلد ابتكارات الايفون من الجوجل و انتهاءا بالايبوووو  ياعييبوووو
1043191524966785024,AE, ولايزالون يضحكون على التوافه والسفهاء وهم غالبية العرب للاسف
1043393789388316800,AE,"تطبيق الكتروني  ماله علاقة بالوسائط المتعددة ابدا ابدا   ياخذ مني تصريح  من دون ما ادري البارحة بفتح كاميرا و ميكروفون يعمل بالخلفيه ليييييييش  ليييييييييش 

انتبهوا على اجهزتكم من التجسس تراه زي الماي  وشكرا لنظام اندرويد  على التنبيهات والتحذير  "
1053400225115725824,AE, طيب طلعوا لنا خطيبة خاشوقجي 
1055744197637083136,AE, راحت عليك ياصاحبي  لعبها صح الزمالك
1056861690195832832,AE,"منالاخر

معازيبنا تاج راسنا 
راحوا يمين معاهم  
راحوا يسار  معاهم 
ولاعزاء لتجار السياسة "
1058341679894282240,AE,"   حسابات ال 

هذي بلوك وخلاص لانهم كلاب الحمدين ولاتستحق الرد وحرق الاعصاب"
1059857714560548864,AE, ههههههه  لاتعليق  يابوسعيد  اخاف من روحة المحاكم
1060786019392544768,AE, استغرب كيف فرطنا فيه بسهوله وخلينا دوغلاس
1060789244485123968,AE,  شكرا للتصحيح بوخليفه  الحالة كسيفه في نادي العين  اتمنى بوذياب قاعد يسوي شي مانعرفه للشتويه  الجماهير زعلانه 
1061338860347645952,AE, ربي يحفظكم ويحرسكم بعينه اللي ماتنام
1062626499373813760,AE,  للاسف اقولها  لا تلومهم  اللي تكسب به  العب به
1063726868925476864,AE, محشوم والدنيا تجارب يابوعلي
1064861942618165248,AE,"تبي سلمان 
 ناظر للسماء 
كانك تبي سلمان 
تخيب ايديك  ماطلته 
ولا طالوه اسلافك  "
1069502319371407360,AE, الحمدلله على نجاتهم اثنينهم
1069609063745576960,AE,  مادرينا بهرج  الخوان  ابد
1069635813103800448,AE, حياك ياامجد  انت ضيفي يالغالي
1069637784703565824,AE, ضيفني و تراحيب المطر نشوفك
1073131454295670784,AE, تنمر وكسر قواعد السلوك التربوي  و ضرابة بالصف العاشر واخرتها يقولك مشكلة بسيطه الخلل واضح وين
1073583437787922432,AE, ههههههههههههههههه  بطني وجعني من الضحك 
1077286136869990400,AE,  عندنا ابراج وتطور  وعندنا ايضا مذهب و اخلاق ودين والتخلف هو ماتدعين اليه
1078376164643737600,AE, هذا الجو بس يبالك تلبس له كوت مطر و نظاره وقفاز حر اغسطس يبالك مكيف متنقل على الظهر
1079423197794221952,AE,  المطلوب يتأقلم بسرعه مع سرعة لاعبي السيتي وينسى ايام ليستر  وبس
1084516335864999936,AE, المصيبه انه كنسل خاصية السبليت سكريين  شي محبط وسيئ
1084516801185226752,AE, للاسف الزين مايكمل  ولكن الجاز كنج والتحديث رائع
1086881122808672384,AE,"  لاكرامة ولا حسرة عليكم وعلى المذلة اللي انتوا فيها 
المذيع يبرر للفارسي هجومه و تعاليه وعنصريته "
1086905740705648640,AE, يا حبذا لو تكون ليوا مع هبان ههههه
1089430994044838016,AE, تم شراء فقط تذاكر الجمهور الاماراتي    في ذمتك كل الفجور اللي صار في المنشن  و البعض من الجمهور العماني اللي يريد يشجع قطر  محد بيمنعه بغض النظر 
1089608800515039232,AE, ماادري ليش عيال شريفه معصبين ومنرفزين   شكرا يابوفارس عالتغريده
1090294781719298048,AE, قويه ياخليل صعبه ننساها
1090843943321915392,AE,لو صار اللي في بالي  الجمهورالثالث  بيكون في ورطة مايعلم بها الا ربك  يارب
1090850987848462336,AE, ههههه صدقت والله تائهون مب عارفين نلعب مع اي منتخب ومن اي قاره و نحن في اي بطوله ومن هالفريق اللي جدامنا بالضبط  صباحك ورد
1091046015715688448,AE, جيش عزمي الالكتروني مابيقصر معاك  
1091438056027185152,AE,  امجد  مالك حل هههههه ربي يحفظك
1091452273128030208,AE, ابعد عن هالاطفال احسن لك
1093091733511041024,AE, اللي يعيش ياما يشوف 
1093560074679795584,AE, معقوله انكم تمدحون كندا وتسوقون لها       
1094804116382064640,AE, شكرا زاكروني والشرهه مب عليك
1095008639033724800,AE,  الشبك الشبك لا بو من جمعكم
1096623688659714048,AE, ههههه انا خدتها بروح رياضيه وهذا دليل على حجم العين ومكانته 
1099373662942228352,AE,زوران مايريد روبين ويفكنا منه  العينالنصر
1099662246018470016,AE,  مقدما اقولك انه بيطلع نجس وكذاب و المصيبه انه اهبل بعد  على اساس بيسوي فتنه ههههه
1102242519759417216,AE, بوحده محناية و مشربة بزيت
1102588497872015360,AE, اذا تركت مسافة لو متر  دخلوا جدامك  و لو ما تترك مسافة تتخالف 
1105154323946918016,AE, تعودنا  الللي رايح يضرب واللي جاي يضرب 
1105323332562505600,AE,"كفو يالذيابه 
 السعوديهتلغياحتكار "
1106462833221476352,AE, يالربع شو الحين  ناخذ بالاحاديث والا ما مانخذ بها  اونخلينا على القران بس  حد ينورنا 
1109031209311571968,AE," صدقني يابوحمد 

ماعاد يهمنا الاتحاد  ولا اخبارهم ولا وعودهم 

النفس طابت منهم"
1110016924539383808,AE, الله يعزك ويحفظك يابوناصر 
1111525357218344960,AE, صح لسانك شاعرنا عمر اللهيميد
1112184520910864384,AE, نحن رحلنا  يا خوي راشد خلاص الى متعة كرة قدم حقيقية وصعب جدا ترجعنا 
1113294850114195584,AE,"وينك يا    

حقيقة افتقدنا حضورك  ربي يحفظك يالاسد  

 قطرتحرضالسعودياتعالهروب"
1113454224203862016,AE, بين اهلهم وناسهم  تشيلكم العين والقلب والراس
1113670561522000000,AE,  برافو   بنك دبي وصدقتك  يا حسن  الاماراتيين طلعوا منهم بمكاسب  وشروها برخيص  غيرنا راحت استثماراته و راحت حتى مبادئ دينه و  اخلاقياته 
1114109293937287168,AE,  نفس اللي كان يحركهم عندما كانت تقترب ساعات حزم الامور في اليمن ياطويل العمر
1114130279495557248,AE, ابلع العافيه  تجيك العلوم ياكلب الدواعش و يامطية الشيطان
1114427178274443264,AE, من كشكات السجاير بالشوارع الرئيسيه يبيعون شحن  او محطات البترول 
1114824011450671232,AE, احنا الجمهور ما نفهم 
1115679734350921600,AE, حمدلله على السلامه ياام ناصر  سلامي للشباب والاهل
1115896393699401600,AE,    الله يشفيه يارب  و يبارك في كل رجال الامن 
1116424669693923200,AE, قردوبه  ههههههههه رجعتنا للزمن الجميل
1116776034756628352,AE, الشحن اللاسلكي في ابل تقليد  الكاميرا  الثنائية ابل تقليد  شحن الايبود لاسلكي تقليد  شاشة اوليد تقليد وانتظر التقليد القادم من ابل كاميرا  الزاوية العريضه و الزوم انتهى زمن الابداع برحيل ستيف 
1116843885114855424,AE,  مش غلط وبدون تعصب احنا المستفيدين
1117145319366627200,AE, خخخخ لا يكون انت اللي تهكر حساباته
1117382964302758016,AE, الف شكر اخونا عتيج على الجهد و مقارنتك محايدة واتفق معاها
1119548739801288832,AE,  اشبكه بسلك الشبكة مع خطوط اللان خلف راوتر اتصالات الاسطواني و يشتغل الجوجل بنفس السرعة الاصليه اللي مشترك بها
1119979261476077568,AE, بيرنللي متخصص في الليفربول ههههه
1121800434627178368,AE,   انا مااعرف هالدكتور ولكن اخ مصري درس شرطة و غير لبكالوريوس طب و خذ ماجستير وكتوراه بالطب  وين المشكله
1123262030809530368,AE, وماذا عن السيدة و  اللي راكب البونيت  اتمنى لو يقبض عليهم فورا
1124374601923014784,AE, بتصلون فيه اول رمضان باذن الله 
1126511001388454016,AE, وقته قانون وديمه وليتها توصل للاعدام عند ثبوت الحريمه
992048175715405824,AE,  يستاهلون علشان يتوبون ويحرمون 
992078704804286464,AE,  كفو و نص اهل العين ترا وصلاويه
992367882003730432,AE, رمتني بداءها وانسلت  سلم لي على الربيع العربي و ابوها وامها اللي قاعدين في التوحه
994899409480617984,AE, احسن الله عزاكم اخوي منصور و بارك في اعماركم  و اعمالكم و صبركم 
994967112551751552,AE, استفزاز لمشاعر كل مسلم
998953414712352768,AE, اعانك الله يا بوراشد  اضرب سلمت يمينك
1001353829089234944,AE,  أوصخ شعب وخاصه اللي في المطار مش جديد عليهم هالتصرف متغطرسين وشايفين عمارهم انا وحده ماره بموقف وياهم لابركتن فيهم
1004624909786664960,AE,   بيضاء الله ويهج ياليت يوصل هالكلام ويتخذون اجراء  عقدوا العيال وكرهو الدارسه
1007420529953959936,AE,كل عام و أنتم بخير و عساكم من عواده
1009559552495357952,AE, شريفة علي سليمان الهجان
1028930837931282432,AE, حسبيا ونعم الوكيل فيه مافيه رحمه طفل رضيع لاحول ولاقوة الا بالله
1034511314834612224,AE, يبالنا يلسه وياك فالكوفي نسولف عن السفر 
1046634323850539008,AE,  يارب اطل في عمره ذكرني بحياة ابوي 
1046635578412990464,AE, مايسوى عليها المسكينه يمكن يخونها حقها تحافظ على حياتها أصلا  عيب يسجن زوجته ام عياله وسبب تافه لو هو ماكان يخون ماوصلها انه تشك فيه وتفتش تلفونه 
1049531962476646400,AE,  ليته يطبق عندنا بعد اسعار مبالغ فيها وماتكمل شهرين شردت
1051389601682735232,AE, الله ياخذ هالويه اللي يجيب الجلطه على كثر فلوسج اللي تاخذينها من الاخونجيه نظفيها  
1051773360751996800,AE,  ترى بعد الام قبل لاتتزوج خذت ريلها عن أمه هذي سنه الحياه لايقصر في زوجتة ويهملها ولايقصر في أمة
1053971937947475968,AE,  الدين يسر مب عسر فاهم الدين غلط شوه اللي يطلقها
1055020883654467584,AE,  نحن موظفين مايعطونا غير شهر في السنه والعاملة يبون يعطونها كل اسبوع من غير الشهر اللي بتاخذه الله يعينا على هالقرارات 
1055397007836225536,AE,   خذيها بروح رياضيه هذا حال أمهاتنا الله يطول بعمارهم
1056410258967531648,AE, فايزين ان شاء الله 
1057680797287833600,AE, الله يعافيك و ترجع بالسلامة 
1058827343156965376,AE,   طلال الرشيد الله يرحمه
1060550523462541184,AE,  صحيح بس هذا مايمنع انهم يرتبون يوم في الاسبوع
1062947549995327616,AE,        حبيب بو علي نتشرف طال عمرك
1064135476452491264,AE, هي من صميم الذات ولا أجنبية
1064972348502261760,AE,   بس كان جو الصراحة
1071290837068377984,AE,  لاحول ولاقوه الا بالله الله يطول بعمر امي ويرحم ابوي هذيلا مايحسون بقيمه الوالدين 
1074690428547620864,AE,  مدرب حماسي جدا لكن عنده عقده النهائيات للأسف
1075701610981019648,AE,  ماشوف فيها شي وبعدين مب عيب ولاحرام يعني الحين المطاعم مافيها رجال يشتغلون المفروض تنبسط على انه شباب البلاد يشتغل ويعتمد على نفسه ومب حلوه تتكلم على البنات بطريقه هذي  ذيلا بنات بلادك  
1084447849071415168,AE, أتوقع جبل حفيت في العين
1086188078354567168,AE,  الله يشفيه ويطمن قلوبكم عليه
1086623793915879424,AE, أبوها طبعا  الله يرحم ابوي ويغفرله ماحد سند مثل الابو 
1087274606820581376,AE,في حياتي ماشفت نشبه مثل جذيه  
1089845514370191360,AE,  ومعنى الفوز لما تحقق ما تريده
1090298501718831232,AE, مرتزق قذر ما نتريا منك الاعتذار يالسفله
1091263570132770816,AE, بياح و قباب مشواي و عيش اببيييييض
1091326898460860416,AE,  العيون عيون عيل مو عيونك يا مرعوب تقول قذوب ملاس 
1092417713316810752,AE, هدي يا ريال ترا كلكم خمه
1098993901300531200,AE, جان احتسيته قبل الغدا ويانا 
1098998873543098368,AE, كله ولا الوالده الله يحفظها 
