id,dialect,text
1155932024726704128,JO, تخيلي كتبي اشي مثل هيك على تجمع المهندسين الاردنيين  كمية الفلسفه يلي راح تيجي
1155937075868254208,JO,بعد  ايام بعثنا ايميل من  اسمه قريب من ال  تاعنا مشان نتوههم شوي ونشوف مين راح يفتح اللينك يلي بعثناه و مين راح يعرف أنه في لعبة من وراء الموضوع
1155937086270103552,JO,كل اشي اعملناه على الفاضي
1155939644808155136,JO, منيح انك بتعرفي بالاشياء هي وكيف بتتعب وانت تحكي وبالاخر هواء  حطمونا
1155942242986500096,JO," ما هو انت لازم تنتبه على الصغيره قبل الكبيره مثل 
  "
1155945449787813888,JO,حاس حالي على مطل ما بعمان مش بالشغل  
1155949179589370112,JO,ما في ثلاجه في كافيتريا بحالها كل  دقائق واني جاي اشق عليهم 
1155951050345463808,JO,"كلمات بتلفت انتبهاي لما اسمع حدا بحكيها






"
1155968868369567488,JO, شو ما مسكت حالي شوي كنت راح اعيط
1155979472643866624,JO,واحنا صغار كنا نشوف يلي عمره بالعشرين كبير كيف صار وشو صار بالفتره هي واحنا صرنا بالعشرينات حتس حالي نطيت مره وحده
1155979475227561984,JO,و النفسي اعرفه هو الصغار بطلعوا علينا نفس ما احنا كنا نطلع ولا هذا جيل مش شايف حدا
1155987860421349376,JO, انداري يعني في  سنوات من بعد ما صرت مسؤل بعد الجامعه كيف مروا ما بعرف وشو صار فيهم كمان ما بعرف
1156059023814381568,JO,كيف الشعور لما انت تروح من الشغل هسا و الناس بتطلع على الشغل هسا
1156259781583282176,JO,اذا بلشت في مسلسل مستحيل اتركه الا بعد ما افرطه بكم يوم
1156260469277122560,JO,مره زميلتي بالشغل حنقة  مرحلة ما قبل البكاء  بحكيلها ما عليك الامور بتنحل وهون بلشت تعيط  وخذلك يا بهاء شو بدك تعمل 
1156276473185087488,JO,انا واحد من الناس يلي لاقيت صعوبه كثير في اني الاقي أشخاص اركن عليهم حتى اخواني ما بركن عليهم
1156417993980747776,JO,ومثل كل مره بما اني عكس الناس بحكيلكم تمسوا على خير
1156563005561298944,JO,هو أنت راح اضل كاتم في قلبك لحد ما تلاقي حالك بتعيط مشان حدا عملك القهوه وسط وانت بدك اياها ساده
1156563008417611776,JO,الإنسان الخجول اللي ما بعرف يفضفض وبضل كاتم بنفسه راح يتحول لأنسان محطم من جوا هش و أقل كلمة كفيلة إنها ما تخليه ينام من الحزن
1156563011731120128,JO,فضفض وكمان مره فضفض ولو لحيط لبحر لحجر فضفض
1156569241346347008,JO,"اذا كان التريلر مثل هيك شو بتتوقع 

   "
1156608524136398848,JO,اذا حكينا صراحه بزعلوا واذا لمحت ما بفهموا
1156609353643909120,JO, جماعة المراهقة على كبر 
1156637901943447552,JO,جربت اشياء كثير بس هذا السؤال لحد الان ما لقيت اله جواب 
1156791079200595968,JO, الله يسامحك عاد ازرف مني ما فيه 
1157434493181059072,JO,المكيف درجة حرارته  ويا دوب مجاوب
1157434810727567360,JO,لسى قبل ساعه بسيرته أنه لازم اسجل  وما راح اسجل 
1157435215465332736,JO, بما اني  اقر واعترف بالمكتوب لاني شايف حالي 
1157435652721512448,JO, هذول بلوك قليل عليهم
1157452037782720512,JO,راح اكون مداوم أول يوم وثاني يوم وباليل كمان 
1157552551665045504,JO, تلحلحنا مره وطلعت مش فاضيه وهذك يوم وهذا يوم
1110304108358090752,JO,تفيد بإيه إيه يا ندم يا ندم يا ندم وتعمل ايه ايه يا عتاب 
1111299876032266240,JO,بتعرف متى بكون بقمة السعادة لما بالي يكون فاضي وما بفكر باشي ولا بيشغل تفكيري اشي
1112628206157418368,JO, يا رجل بكفي انكم ما كنتوا تطبخوا برمضان مشان احنا و الجيران ما نشم ريحت الاكل  يسعد قلبهم جيرانا
1112628523687129216,JO,يا رجل بكفي انكم ما كنتوا تطبخوا برمضان مشان احنا و الجيران ما نشم ريحت الاكل  يسعد قلبهم جيرانا ويكفي اسمك طارق زياد  
1113863967477239808,JO,بتتهرب من الموضوع بطريقة ادبيه بس بيجبروك تحكي الحقيقه و بزعلوا
1113932818680307584,JO,ما بدهم يعملوا طريقة يوزعوا فيها مكونات ساندويشة الفلافل بشكل مش طبقي 
1114945596790640640,JO,ودارت الأيام   ومرت الأيام ما بين بعاد وخصام
1115255398557266048,JO,"أعذرو كل الشباب الي بيقعد برا بيته بال  و ال ساعه و يدوب يلحق يرجع البيت عشان ينام و يقدر ينزل ثاني يوم 
حتى أمه و أهله يا دوب بشوفهم
الشباب الي عايشين في دوامه مابين الشغل والبيت والإلتزام والمسؤليات والضغوط الي بتمر فيها البلد
منقول"
1115368719730053248,JO,"رح يجي الوقت المناسب والعمر المنتسب والظرف المناسب والشخص المناسب
بس إنت رح تكون زهقان وفاقعه مرارتك ونفسك تنتحر"
1118633881928904832,JO,الملوخيه البايته  اسوء شي ممكن تاكله بعد مال اليتيم
1118815702469812224,JO,"   ب
  

      "
1119012955662815232,JO,بالعاده بقراءه المكتوب وقليل ما اشوف مين يلي كتب بالمحصله خلصت ثلاث ارباع اغاني محمد عبده لما اكتشفت أنه   هي الكابسه معها على اغاني 
1119013150043594752,JO,وانا المسكين يلي بحكي شو هالصدفه يلي بين كل تويته و تويته في اشي لمحمد عبده
1119015168443334784,JO,ما تقنعني انك تقدر تعمل اشي عظيم بدون ما يكون فيه مخاطره شو ما كان شكلها
1119015394256269184,JO, يا حبيبي شكلك لسعت على كبر بس انت فخم
1119016127781396352,JO,ومثل ما بحكوا استغل فرصتك ابشع استغلال وما تتوقع ترجع مره ثانيه
1119018733543067648,JO,شغل ال  يا الله شو أنه مرهق يعني قاعد بستنى الساعه تصير  مشان افصل  لمده ربع ساعه
1119371942145011584,JO,ما حدا بيعبي مطرحك بقلبي
1119630830173921152,JO,لقيت اشي اضيع وقتي فيه
1119631290100330368,JO,حدا عنده كيبل فايبر مقطوع خليني اللحمه 
1119631722201714816,JO,كيف بقدر افاتح اهلي بموضوع النقوط لما انولدت 
1119659160151515136,JO,معقول في عندكم شتويه اي انا نفسي اطلع الشتوي
1121905626010071040,JO,في عندي موظفين اثنين و بدي اروحهم لاني غيرت سياسه شغلي ومش عارف كيف بدي اجيبها الهم
1121905789503983616,JO,و راح يضل عندي واحد يلي هو اخوي
1121906348277551232,JO,حاولت المح الهم انه سياسة الشغل راح تتغير ومش بحاجه اربع اشخاص بس مستحي احكيلهم
1122050658306273152,JO, فكرت كثير في كيف ممكن اوظفهم بالسياسه الجديده مش طالع بحل  انا بشتغل في مجال ال  و ال  قبل كنت ابيع و اركب و أخذ مشاريع وهسا بدي اصير  بس
1122164279858409600,JO,معقول يرن على بنكا ما ويحكيلي مبروك اربحت معنا ولو دينار انا موافق
1122165878752202752,JO,وات ذا فك لو عندي  من روقانه 
1122204451182395392,JO," يالله شو بكره عمان وبكره جوها وما راح اوصلها 
 مين ينزل معي على عمان 
 انا  "
1122205132702265216,JO,الشغلة الوحيدة اللي مش مقتنع فيها هي كيف المصاري معي بتخلص وانا ما بشتري اشي
1122205415142559616,JO,معقول المصاري كبرت وصارت تشتري لحالها وتصرف حالها من حالها
1122222941368921984,JO,لحد الان ومن انا وصغير قرايبي بنادوني ابو الخبز وكل ما حدا يشوفني بسال معك خبز بجيبتك 
1122966603245735936,JO,لو استحملت على حالك و جرت على نفسك وضليت ساكت  اذا استحمل طول عمرك
1124739919648309248,JO,انا عندي قناعة انه افخم مجال هو تكنولوجيا المعلومات و اولادي ما راح يدرسوا الا اشي بخص تكنولوجيا المعلومات
1124740045896933376,JO,هذا اذا خليتهم يدرسوا اصلا لانه هذا المجال بده من الصغر يبلش فيه
1129758709473795968,JO,   خمني عن مين بتحكي  
1132089339352104960,JO,بعدين مع هذا الروتين الرمضاني الممل يعني ما بتعرف تنام الا للفجر ولازم كل يوم تصحى على 
1132804181767708800,JO, هات اقنعهم أنه في اشياء ما بتتشير مع الناس
1132806145201057792,JO,وداع دي روسي ما يليق عليه غير اغنية  
1132806514417311616,JO,عادي أنه صارلي  ساعه صاحي مش نايم الا ساعتين
1134170591953657984,JO,لما ارجعت على عمان انفتحت نفسي على الحياه  قال عقبة قال
1134206949053128832,JO, ما انغفت  ما انسرقت 
1134770115407482752,JO,مع هذا الجو ما تروح تعيد غير للي عنده مكيف
1134822204607254400,JO,وتأكد لو أنه الك قسمه ونصيب في اشي راح يكون الك ولو الك رزق في الدنيا راح توخذه وما راح تنتهي حياتك غير لما يخلص رزقك مش ينتهي عمرك
1134951421093306368,JO,بما أنه بكرا يوم جديد في عندك فرصه ثانيه
1134952838990352384,JO,"لازم اسجل بجيم بعد العيد 
 "
1135211749806919552,JO, اعطوني فيزا بكرا بكون بنص ستوكهولم
1135212634167488384,JO, طلعوا نتائجها بلاش تنتحر 
1135215190725791616,JO,انا بضعف قدامه يا جدعان 
1135310317339197440,JO, من سبع سنوات تقريبا كانت اخر مره اشتري اواعي مخصوص للعيد
1135310793346563968,JO, حلال شنقة على باب الدوام
1135425022208688000,JO," مش ملتزم فيها 
مزاجي كثير"
1135428713376600064,JO,ناس بتخاف ما بتستحي
1135510359165550592,JO,والله بالنسبه الي جد تعبت لانه ما اختلف معي قبل رمضان وبعده كل يوم لازم اصحى ع  و بروح ع  اذا مش بعد الفطر وما بتعرف تنام الا للفجر 
1135510731938508800,JO,ويا الله شو اني مدووش
1135553975007240192,JO,اي مسؤلية اشيلها وانا وانا الشاحن بتعرقل فيه لما اشيله
1135605407571824640,JO,بعد ما افطرت اكتشفت ما في معي قداحه  نمت لحتى ييجي حدا معه قداحه ولا اقوم على المطبخ
1135606573726875648,JO,اسمي بهاء وما في اي قصه وراء هالتسميه مجرد اسم اعطتني اياه جدتي الله يرحمها اهلي بنادوني فؤش تيمنا في ابوي فؤاد لاني بشبه اطباعه كثير اخوالي و خالاتي بنادوني فخه  اصحابي بنادوني ابو الزرف لانه طولي   وكان بالله بالسر  عليم 
1135607786782547968,JO,انا من النوع يلي ما بحب انقطع عن الشغل اكثر من يومين و ما بصدق تخلص الاجازه وبستغرب من يلي بوخذوا اجازه طويله
1135609601666166784,JO, ملل العطله الطويله مع اني بكره الشغل بس اهون من القعده حتى الطلعات بتنمل
1135611198601404416,JO,الضو هذا لحاله كفيل منه أنه يطلعني من اي حاله انا فيها 
1135611511127314432,JO, يمكن انا طبيعة شغلي ممتعه وما بتنمل عكس العطله يلي انا بضل  منها بالبيت
1135612060094664832,JO, ما احسنها الحكيمه  مؤانث حكيم  
1135613442201722752,JO,ردت فعل اي دكتور لما أزوره واحكيله حكيم بدل دكتور من باب ازرع ذكريات 
1135875206617194368,JO,معقول امبارح كانوا مركبين سكوب  بدل سكوب 
1135875676396040192,JO,افخم فطور راح ينعمل اليوم قلاية بندوره
1135901864850055168,JO,مستحيل ارتاح نفسيا الا إذا رفعت ضغط الشخص القدامي
1136042766281203584,JO, مدمن   راح تنقابل و امصع اذانك
1136044289878843392,JO,شغل ايديا وحياه عنيا 
1136207079251873792,JO,بشتري باكيتين دخان باليوم و بدخن نص واحد و الباقي بولع السيجارة و بنساها
1136704159649021952,JO,من العصر بستنى الانترنت مشان انزل هالصوره هي 
1136831156991791232,JO,لا لا مش طبيعي انا بعد ما خلص رمضان صرت اسهر
1136831662447218816,JO, هسا هذا المقطع و صورة البروفايل بنفس الوقت  لانه بصراحه من زمان بشوف هي الصورة
1136836948461408384,JO,مع هي الصورة بقدر احكيلكوا صباح الخير و تمسوا على خير لاني ما راح اصحى قبل ال  
1136841732119678976,JO,المشكلة مش ب انك تسهر المشكلة انك سهران مع الحيطان والسقف
1137147852776497152,JO,مع اني سكان العقبة ومرت علينا وبتمر أيام الواحد بذوب من الشوب بس مستحيل انام على مكيف مروحه فقط
1137268131351674752,JO,مين اليوم مداوم خليني ابدل معه لأنه روحي طلعت من العطله
1137317587392630784,JO,"اول يوم شغل بعيد العيد
 انا كنت بشتغل ازاي "
1137353583353950208,JO, الو ابعثولي لوكيشن الشغل شكلي نسيته
1137363504992837632,JO, ما في حدا مسكين 
1137517519055597568,JO,من كمية الهدوء المخيفة صرت اسمع صوت الكهرباء وصوت الساعه بحسسك بكل ثانيه بتمر   من عمرك
1137699706291855360,JO,كنت حاب هندسه حاسوب وخلصت اتصالات بس قلبت تخصصي بعد الجامعه لمجال ال  
1137700264247484416,JO, اتمرمغت بالطين بدون هالسيارة سقالله وانا جايب وحده ثانيه
1137741613323751424,JO,"بعد صفنه قاربت ال  دقايق قدرت احلل كلمت هايايلاينر وطلعت عباره عن ثلاث كلمات 
 
  
  
مزبوط ولا في اشي غلط"
1137744277017174016,JO, فكره جديده هي بصير نعملها براءه اختراع
1137744402070352000,JO,  بحط نفسي في مواقف بيخه 
1137744733730758784,JO,  ركزت زياده عن اللزوم
1137748179120807936,JO, انا شو يلي فوتني هالطابق هذا 
1137777007239081984,JO, وشو فيها لو زودتوا ميزانيه الفايبر شوي و عملتوه كيبل ارضي صح ارتب
1137785980990164992,JO,  اشكيك لمين يا سبأ  انا الهاي
1137800222745255936,JO, هي ال    بتبكي وهي بتزبط المنبه 
1137800657493270400,JO,طيب وين الرينج يلي بنتمي اله اطول من  
1137802624395337600,JO,لو شبابك ع شباكي
1137806964824653824,JO, بينت اللهجه الكركيه  منتي علي اشر و دشر
1137933324389928960,JO, هاتيلك كم سمكه معك 
1138025823544520832,JO,والله شايفك بس وين
1138058024264880000,JO, خليني امسحه و ارجع أنزله  بحط نفسي في مواقف بايخه
1138085058038968448,JO,والله ما هو جاي على بالي اروح من الشغل
1138085209231040384,JO, ما انت  من الاول خلص خربت فرحتها
1138088119293661184,JO, نزلته مره ثانيه وقصيته مشان تويتر يوخذه ع قد عقله
1001176608194088960,JO,"الاضرابالعام
 الاربعاء 
الشغله مو شغلة معابطه وتظاهر وبس  الشغله اكبر من هيك  احنا مع البلد ومع الحكومه  بس مو عحساب ثلاجتي الفاضيه ولا عحساب جيبتي المخرومه  الموضوع زاد كثير  صار اكبر من انه احرم حالي "
1006879866334208000,JO,"كل ما اتذكر انه ايطاليا برا كأس العالم بتنكد 

 "
1018211701316038784,JO,ايام ما خطر في بالي انه راح تمضي و تخسرني اشياء ما توقعت كيف ممكن اعيش من دونها و تحكمني في اشياء ما عمري فكرت فيها ومازلت احكي الله لا يقطع علي عاده
1019220046718144384,JO,ما بكفي انهم قصيرات كمان تمنعوهم 
1019651136079396864,JO,طول عمري بفكر الادارة سهله وما بدها اشي لحد ما اضطريت اشتغل ادارة طبلت الشغل
1019830673429926016,JO,بحلم وبضل بالي شهر مشغول
1020024589173362816,JO,وبعدين مع شهر سبعه كل سنه بطلع في قصه هذا لازمه شطب من التقويم
1020214477772468224,JO,كل مرة بطلع من عمان بيخطر في بالي اغنية فيروز  الله معك يا هوانا يا مفارقنا 
1020215001792082048,JO,لما تتحول من انسان لروبوت  اخ يا رقبتي
1020596116285517824,JO, حاولت بس شكله بدها سوفت وير
1021726637950480384,JO,"ما ليك حس  الترجمة وين مختفي 

بالكركي احلى"
1021884248331112448,JO,اذا السياره بتحرف على الشمال بزبط اعمل ال 
1023916180069933056,JO,شو في دواء بيمحي الذكريات
1024063766290489216,JO, شو بشتاق الها وبتندم هلى كل يوم ما استمتعت فيه فيها
1028648613772226560,JO, بتلاقي اشخاص كثير من هذا النوع وبنتاسف على كل لحظة ضاعت معهم
1034784029982294016,JO,يا ناطرين التلج ما عاد بدكن ترجعوا
1035123272982192000,JO,اول شخص فقط وظيفتة مشان بسبب الذكاء الاصطناعي 
1035143068050223232,JO, اقسم بالله ما كنت متعاطي بس مش عارف ليش هيك طلعت معي 
1035322998079873024,JO,خلصت سهرة وبلشت ثانية
1036024241785905152,JO,"غير انه هرمون الطز عندي عالي بس انا عندي إعاقة في التواصل يعني عادي جدا اكون بحبك واعزك بس ما اسأل عنك عادي 
"
1036169380734935040,JO,لما تعرف انه النوم مكافئة مش عقاب بتنتهي طفولتك
1036215664124538752,JO,الله يعدي هاليوم على خير
1037491626321563648,JO, ساعه وانا واقف و اخيرا وصلت البيت  الحمد لله
1037492900043665408,JO,هيك لعاد وانا بقول ليش هسا وصلت البيت من  ساعه شغل  عقلي الباطن حاس اني راح اصير رجل اعمال 
1037605420657987584,JO,بعرف اني كثير مهمل بعلاقاتي ومقصر مع ناس كثير وانه وقتي حاليا مش الي بس انا حاليا بمر بمرحلة مصيرية بحياتي يا بنجح او بفشل بتمنى يسامحوني وما اخسر حدا بالنهاية لا نجاح بدون خسارة
1037608600838070400,JO, والله هذا الشي يخصك 
1038109972289269760,JO,حاسس حالي عايف حالي ويلي براسي ما بيعنيك  اول مرة اعرف كلماتها
1038112776374370432,JO, يزم والله طقينا كل يوم نفس الاماكن نفس الروتين نفس الاشخاص نفس الاكل
1038127036370497536,JO, يمكن يصير مغص بالابهام 
1038128997564121216,JO, ما جابتلك سيرة ايلاينر او الكنتور 
1038178319227920384,JO,ويلي ما بيعشق وبيسهر لشو حياته
1038189397630439424,JO,انه يكون بدل صورتي هذا الاشي  بس عندي او عند الكل  
1038190940614270976,JO,الحمد لله اني ما حجزت معهم كان انسرقت  ما في بعد القعده بالاردن 
1038679087311712384,JO,يحس زياد الرحباني لما آلف اغنية كيفك انت معه حق خصوصا بمقطع  شو بدي بالبلاد الله يخلي الاولاد   وكيفك انت 
1038766733656567808,JO,بكرا احلامنا بتصير حقيقه
1038895510805983232,JO, خصوصا يلي جنبي هسا 
1038902607815892992,JO,ابوس قلبك ابوس روحك ابوس عينك خلي قلبك صافي
1039033001332617216,JO,صباح الخير للامداومين اما النايمي مطول صباحهم
1039041955630653440,JO, اه انت اداوم يعني 
1039069341684301824,JO,اكثر صوت مزعج و اكثر صوت بحبه صوت السيرفرات و الداتا سنتر روم
1039226922260226048,JO, ويلي قرفان البحر يصعد جبل
1039261680734220416,JO,بدها صحن كنافة يرد الورح
1039264049920442368,JO, هابي بيرثداي تو يو هابي بيرثداي تو يو  كل سنه وانتي سالمه
1039444490354917376,JO,الاحلى من النوم انك ترجع كمل نوم
1039803818387681152,JO,مساء السنونو لما ينونو
1039855520398696448,JO,عادي اني استشير كل يلي عندي بموضوع وبالاخر اعمل يلي براسي
1039978599389057024,JO,عادي انه انثى ادخن اما ادخن  احمر هي مش انثى
1039979091510939648,JO, رجال بالشمس حلو وخفيف
1040379722029576192,JO, في واحد من الاشهر قررت انصح فيه اكلت البيت في يلي فيه و وجبات سريعه لا تعد وكل مشاويري بالسيارة بالاخر انحفت  ك 
1040596620985945984,JO,"نفسيتي نفسية واحد ختيار ولاد ابنه سحبوا
 فاينات قدامه مع بعض"
1040973159091110016,JO,تيجي الرياح مثل ما تشتهي سفينتا على محرك
1041133958828843008,JO,بنزل فايلات من النت بحجم  جيجا خايف انام ويفصل الداونلاود شغل افلام ما هو
1041258169245290368,JO, ما راح اعرفهم على اصحابي اصلا مش ناقصني وجع راس
1041271907432243200,JO,مساهمة القطاع الخاص بالتعليم عنا معدومة اكثر اشي بتيجي شركة زين تحط مقاعد بالجامعه
1041622041919729664,JO, ولا عمره كان يطمن
1041656487196717056,JO,ليش التايملاين فاضي من نص ساعه نفس الاشخاص ونفس التويتس  عايش لحالي
1041748400998375424,JO, هي عاد كل واحد مكانها بختلف عنده 
1041954872604741632,JO,حبيتك بالصيف و حبيتك بالشتي
1042388132254162944,JO,خلصت موضة الرد المتاخر و اجت موضة بشوف الرساله وما برد
1042418935793180800,JO,وانا راح بالي على  فيروول  
1043136876964704384,JO,في عشق الحواجب العريضة
1043281666742136832,JO,رابطة اللي فاتتهم الحياة بسبب موقعهم الجغرافي
1043423097360183168,JO,مبسوطين ع دوام السبت حضراتكو 
1043855752937574400,JO,كلمة ازكاها ما بتلبق شب يحكيها او يكتبها
1043926742581366784,JO, لانه مش قارد ارجعلهم  و بزيدوا يوم عن يوم
1043997807370211200,JO,لما تنكسر شاشة تلفونك ما صارله معك شهر
1044004405954187264,JO,مش كل كتف بتميل عليه قوي ومش كل ايد بتنمد الك وقت الحاجه قويةاعتمد على نفسك وسير بخطئ تابثه نحو هدفك
1044571224557461632,JO,لسى اوراق التسجيل مش مجهزها صرت كاتب  او  ليش يا اخي خلص الفصل الاول يعدي طيب
1044572244255617024,JO,بقول ليش الحركة عالشبس والبسكوت نايمة بالمدارس 
1045623229304303616,JO,طب يلا اوم بالليلة اوم بالصبح اوم بالليلة اوم بالصبح اوم بالليله اوم بالليله
1045805071529848832,JO,وخايف اكون عشقتك و حبيتك تراا ويكون الهواء راماني ببيتك تراا
1045921904408883200,JO,بس كانه سبت مليان مباريات
1046030469081510016,JO,متخافوا ميسي و بوسكيتس راح ينزلوا على الشوط الثاني و يحاولوا يعدلوا النتيجه يزم منك لله يا فالفيردي  
