id,dialect,text
1113155458422984832,EG," والله من ابلغ ما قيل واتفق جدا
 محمود شكسبير ده جهبذ و بيقول درر"
1113156169672089600,EG,  ربنا يفرج كربه ويفك اسره
1113156406553841664,EG, ربنا ينجحكم ويوفقكم معلش دا من كتر الضغوطات اللى عليهم
1113157363027054592,EG, لو بيتقزقز مفيش مانع
1113158358293471232,EG," نقطة ضعفي ليه بتفكريني بذكريات أليمة طواها الماضي واتردمت في حفرة الاحزان 
بتنبشي الجرح القديم وتحطي عليه سبيرتو ليه يا افتنان 
تفتكري الزمن ممكن يعيد اللي فات ويحيى اللي مات"
1113158681410121600,EG,  ايوه بس دي بتتحط ع القلقاس
1113159820390133760,EG,  ارزاق بقا هي تحلم ويتحققلك انتي ان شاء الله
1113161281559781376,EG, ياريت والله والشرف ليا وان شاء الله لو جيتي مرة هتحبي تكرري الزيارة كتير
1113269231641091968,EG,  هو مش اختك بتحلم ببلاش ولا هي بتشحن عشان تحلم  لو بتشحن يا ستي هندفع كارت الشحن المهم كل واحد حلمه لوحده عشان ميحصلش لخبطة
1113279774649090048,EG,  ايه اللخبطة دي هو انا فهمت صح ولا غلط ولا ايه
1113282523528945664,EG," الأطفال ملهومش كتالوج في التعامل عجبتني طريقتك خليتها تخاف على اختها وتبرر لها وفي نفس الوقت تعرف ان اللى اختها عملته دا غلط فعلا ويعاقب عليه 
هو ده المهم واعتقد فعلا انها مش هتفتن على اختها تاني 
اصلا الأطفال بيفتنوا بالفطرة ولما بيكبروا بتروح منهم طالما مش بتشجعهم عليها"
1113296123597340800,EG," الف مبروك ربنا يباركله في حياته اللى جايه ويا بخته بأجمل ام واخت في الدنيا 
ربنا يخليكم لبعض"
1113581022363496448,EG,  مش هنحشيه عشان واضح عليه انه سؤال خدعة
1113581590767112192,EG,"  هي تحمد ربنا اني كنت مشغولة ومردتش عليها
الحلمين بكرة الصبح يكونوا عندي والا هيكون لي رد فعل لا يحمد عقباه"
1113583479676125184,EG,"  طب اهو قدامي والحشو مش هياخد ثواني 
عايزاه محشي ايه يا سنيورة"
1113584012973547648,EG,  سهلة دي دقيقتين ويكون عندك
1113584499508613248,EG," كنت فكراها بتقول ما انتوا وحشيني 
بس فهمت بعدين انه اسم بني ادم"
1113585228604375040,EG,  اوبر ايه انا مشغلة معايا عفاريت
1113589154158391168,EG,  شفتي مش انا لوحدي اهو انوش معايا
1113685697192517632,EG, احس الصباح ده تقطيم اكتر منه دعاء
1113686761924907008,EG, متخيلاه كده اللى هو لاوية بوزك ورافعة حاجبك وحاطه ايدك في نصك
1113690404120141824,EG, مش جاي معايا دعاء اغشك يعني
1113788782933872640,EG," يا بنتي ده عدم ثقة في رسايل الاخرين 
عشان كده بيكتب الرسالة اللى على مزاجه وباسلوبه وينتظرها ترجعله
الضنا غالي يا ناس"
1113789184819568640,EG, جايز عشان انتي اللى قيلاه
1113832486000369664,EG,الغروب بتاعنا الحلو المتكلف 
1113833152655577216,EG, اه انتي قوية ومفترية ويجي منك اه اه منك كل دا ممكن يطلع منك 
1113833661844082816,EG, تعالي شوفيه طيب واجبري بخاطره
1113847736187723776,EG, اكيد كلام يافندم هو انا هكدب عنيا واصدق افتراكي ع التايم يعني
1113897042097655808,EG,  اعملوا قرعة وشوفوا هترسى على مين والفايز هيكسب رحلة للاقصر غير شاملة المصاريف او الإقامة وهيدفعلي جنية ضريبة رحلات
1113897616406908800,EG,  في شرط جزائي ان اللى هيرفض الرحلة ويقرر انه يروح عمرة لازم ياخدني معاه
1113898045480079360,EG, اتصلت بجاك قلتله شكل اسمي مش عاجبني قالي عنيا ليكي شوفي الاسم اللي يعجبك وانا احطهولك
1115707088087527424,EG," كلهم ليكي طبعا شبيك لبيك عفريتك بين ايديك
فاضلك  امنيات"
1116030060908240768,EG, بتتكلمي بثقة شكلك دارسة وعارفة
1116030742373523584,EG, لا معنديش والله ولو مش مصدقة حاصري المكان وفتشيه ومن غير اذن نيابة
1116031692790280192,EG," يافندم انا بدخل تويتر من الخلاط ومعرفش يعني ايه تليفون من اساسه
يا باشا احنا ماشيين جوا الحيط وبنقول مياااااو ميااااو"
1116032218281934848,EG, ربنا ينجيكم ويبعد عنكم كل شر
1116032517788848000,EG, فيمتوثانية ويكون عندك بالعصير اللى جواه
1116459583533473792,EG, كل سنة وانتي طيبة يارب تكون سنة جديدة سعيدة عليكي فيها مسؤوليات اقل وسفر اكتر وفلوس اكوام اكوام اكوام وصحة وسعادة وراحة بال ويحقق لك كل اللى تتمنيه 
1116461531561172992,EG, اصل انا احبطت لاني بعد ما كتبتلك شفت التويتة اللى كاتبة فيها عن عيد ميلادك
1117514522204561408,EG, مهو نفس المواصفات اهو
1117515550094241792,EG, هطلع عليكي كل اللى عملتيه فيا
1117515702800351232,EG, يارب قادر يا كريم
1117782528457367552,EG,"صديقة سألتني اسألها على أحسن دكتور مخ واعصاب في القاهرة وانا طبعا اتفشخرت بالفلورز بتوعي وقلتلها ورايا رجاله وستات قمرات بس بمية رجالة 
الا هتكسفوني ولا هتبيضوا وشي ولا اشتري فير اند لفلي "
1117787263168131200,EG," هنشتري فير اند لفلي 
وبعدين اعملي ريتويت جايز حد من فلورزك انتي اللى يبيض وشنا"
1117788469248647168,EG," وماله اعملى برضو للعبرة والتذكرة جايز ضميرهم ينقح عليهم ويعترفوا
وبعدين انا بقولك رتوتي تويتي انا مش ردك عليا"
1117790073959874560,EG, عقلك الباطن مش عايز يرتوت لي
1117791168891359232,EG, تسلميلي يا ست الكل
1117797035846111232,EG, تسلميلي يارب ما يجيبها الا نهيلها
1118573401260601216,EG,"كل سنة وانتي طيبة وجميلة وقلبك صافي وروحك حلوة كده زي ما انتي 
كل سنة وانتي صحبتي وحبيبتي واغلى الغاليين 
يارب ايام كلها سعادة وهنا ويحقق لك كل اللى تتمنيه ويجعلك الخير فيه
يارب تسامحيني "
1126809550894575616,EG," بعادك يا جميل طول  وده اول بعاد بيطول
تلات تيام يا روح قلبي  وانا جمبي حسود وعزول
يقسوني عليك مااقسى  ينسوني هواك ماانسى
يا مالي الدنيا فى عينيا
تلات سلامات وشويه  تلات سلامات"
1105181676974555136,EG," اصبتي كبد الحقيقة
جبتيها ازاي دي"
1105183128870637568,EG,"    شكرا يا مريم انك اظهرتيلي حقيقتها 
بتكروتي كلامي وتقري نصه بس يا نوجه  مكنش العشم"
1105183617343516800,EG,"  متسمعش كلامها هتغرقك 
مترددش كلام متعرفش ابعاده
انت بتلعب في عداد عمرك"
1105310693056749568,EG,"  للأسف ان اي حد بيقول اي كلام والناس بتقرا وتاخد العلم من تويتات المغرضين لا حد بيفتح كتاب ولا بيشوف الحقيقة فين 
حرق دمي ع اول الصبح"
1105314381640941568,EG,"  طب انا اول ما قرأت التويتة عملت لايك عشان احتفظ بالثريد عله يديني معلومات مفيدة عنه لاني عمري ما كلته وشايفة ان كل الناس بتذم فيه فقلت أخيرا هنشوف فوايده 
هوب الثريد انتهى قبل ما يبأ وضاعت معاه كل امالي
اما اشيل اللايك بقا"
1105319259020951552,EG," بكرهها عشت فيها فترة اتخنقت منها ومش عارفة اهلها بيحبوها ازاي وليه
حاسه ان فكرهم مشوه انهم يحبوا مدينة بالقسوة دي"
1105319750890995584,EG,   اكيد في فوايد ربنا ميخلقش شئ عبث ابدا وبفكر فعلا في يوم اشتريه واعمله
1105341755661127552,EG,  بتضحك طيب اضحك وابقى شوف من يوم يسامحك لما تندم على اللى ضحكته ندم كبير
1105351582357417984,EG,"من العادات المبهجة اللي بشوفها كل يوم الصبح
ان جيرانا كل يوم لازم يملوا الطواجن دي مية عشان العصافير وقطط الشوارع  "
1105352506752860160,EG," هما طيبين و محترمين فعلا بس فيهم عيب صغير ااااااااد الفسفوسة
انهم سيساوية متعصبين"
1105352764824211584,EG,  جايين تحبطوني وتكرهوني فيه لا انا لازم انول شرف التجربة واحكم بنفسي
1105354934940299264,EG,  هو له مواسم ولا بيكون موجود في وقت
1106510484663140352,EG,  حبيبة قلبي احنا معملناش حاجة ربنا يسعد قلبك ويفرحك ونشوفك دايما  في هنا وراحة بال وبعدين يا ست الكل انتي القرب منك امتياز يعني انتي هبة ونعمة في حياة كل اللي يعرفوكي
1106512065303363584,EG, اللهم امين ربنا يراضيها ويرزقها كل اللي تتمنيه
1106547223985303552,EG, دي كانت زيارة بمناسبة عيد الام وكان بيغنيلها ست الحبايب يا حبيبة
1107362680417988608,EG, وفي ناس كل ما تقرب حبة تزيد محبة
1107365493965578240,EG,  نزيد طبعا دا احنا اتنين نور وشوفي انتي بقا
1107367434623860736,EG,نفسي افهم السناب شات وفكرته
1107367557248499584,EG, معلش معلش كلنا بنعمل كده وكله بيعدي
1107369190837702784,EG, فين التايم لاين والكومنتس
1107370708114571264,EG, واتس  الكلمة دي لوحدها كفيلة انها تخليني اكرهه
1107539748871131136,EG,"  هي اللي راسمه العين  مقالتش انها بتعرف ترسم
ليه يا مريم  هو انا هحسدك "
1107541673691832448,EG,  مش انت قلتلها يسلم قلمك اللي في الصورة ده
1107547267043598336,EG,"ضميري بيمشي على سطر ويسيب سطر 
المشكلة انه معاندني بيمشي ع السطور اللي مش عايزاه يمشي عليها وبينام في السطور اللي محتجاه يصحصح فيها 
وادينا على دا الحال لحد ما نشوف له حد يصلحه"
1107547657004859392,EG,  متقولش على مريم كده لسه فاضل في قلبها ذرة رحمة وانسانية هي صحيح تايهه جوا بس موجودة
1107549285934076032,EG,  انا مقدرش ادافع عنها اكتر من كده هي تيجي ترد بنفسها الموضوع كبر وبقى فيه نار
1107557183842148352,EG, لازن نتأكد الاول من صدق قلوبنا
1107605062367526784,EG," والله حضرتك دا عشم مش في محله 
يعني انا هجيب حد يصلح وجايز يقولي الموتور عطلان وادفع قااااااااد كده ومتوقع اقولك الطريقة ببلاش"
1107609048994729984,EG, اللي هو انا ولسه هدخل اليوتيوب يقوموا رازعين الباب في وشي
1107629070081245184,EG, هي حجات بخصوص العزيمة والإنجاز في حجات عايزة اعملها او اهداف محتاجه احققها لكن مفيش شغف ولا طاقة
1107629818508726400,EG, كرامتي وكبريائي مانعيني ازاي اخد حاجة بعد ما فودافون استخسرتها فيا
1107631062186901632,EG, بس انا ممكن اتفاوض معاهم واخليهم يوافقوا عادي يعني والناس لبعضيها
1107631692293001216,EG, اتفاوض مع كرامتي وكبريائي واخد ال ميجا منك مش اتفاوض مع فودافون
1107641373832949760,EG," دا رعب بالنسبة للام وللبيبي يا حرام 
حصلت معايا كنت اول مرة اخرج ببنتي وكان عندها شهرين عند صحبتي ونامت فحطيتها ع السرير ولما جيت خارجة انا وع باب بيتهم صاحبتي بتقولي مش ناسية حاجة قلتلها لا قالت متأكدة قلتلها ايوه شنطتي معايا اهيه
قالتي طب وبالنسبة لبنتك"
1107650629550387200,EG," اه فعلا ايه ده 
طب ايه العمل دلوقتي نمسح هنا ونكتب هناك ولا تردي هناك ونخلى دا هنا ولا نعمل تويته جديدة ونبتدي من الاول"
1107650975379193984,EG,  بيقول عليكي حريقة ومقتنع انه مظلوم 
1107651731394056192,EG,  وقال حجات تاني بس مسح المنشنات اللى قال فيها
1107654055013335040,EG,  يا عم دي الكاميرا الخفية خلاص وقف التصوير يا رائد
1107654415698153600,EG,"   من غير هكربه هو بيعترف لوحده وقال ان انت شريكه بس احنا مسحنا الجزء الخاص بيك في المحاضر 
شوف بقا اللى انت بتدافع عنه يا سي جزر بيقول في ضهرك ايه"
1107655115702452224,EG,   هو حضرتك تايه ولا مش من الدنيا اللي جمبنا
1107655232627113984,EG,   تاخد اربعين جنيه ونص وتسيبهولنا
1107655580741709824,EG,   يلا يا ابني معاك فومين هكربه لازم تخلصهم
1107655916269305984,EG, ضحكتيني جدا متخيلة معاناتك بجد حالتهم صعبة
1107656594693779584,EG, دول كلهم احلى من بعض
1107657583777771648,EG," خليهم يجو هنا ونلعب معاهم شوية
من الطف مخلوقات الله"
1107658443463245824,EG," دي فضايح 
المشكلة ان الناس مبتكلفش خاطرها تبحث في جوجل الاول وتعرف الحل ولو غلبت تبعت في الجروب 
لو عملوا كده هتلاقي معظم البوستات دي اختفت وفضل المفيد وبس لكن ازاي لازم ارغي ارغي ارغي"
1107662917720256384,EG, اللا مش هتفيده بس هدعيله ربنا يرحمه ويغفر له
1107869411912966016,EG, هو انا اللى هقول رأيي فيكي برضو يا استاذة
1107869569874644992,EG, فودافون بتعاملني معاملة مرات الاب
1107881465700860032,EG, ربنا يكرمك ويوفقك دايما يا ست الكل
1108028782164828160,EG, وانا مالي يختي هو انا اللي عزمتهم
1108031515949260800,EG," معلش مشغولة جدا اليومين دول
العزومة الجاية ان شاء الله"
1108040785210036224,EG, رديت طلعت واحدة معرفة وبتتصل من تليفون بباها والغريب ان بباها دا رجل قمة في الاخلاق والدين مش عارفة ليه حد يسميه الإسم ده
1108042500604919808,EG," ترو كولر بقا بيوريكي عاهات 
تفتكري انا مسميني ايه"
1108250289818222592,EG,   سؤال بس  انا مش لسه بعتالك ثريد مفيد ومثمر 
1108250876890669056,EG,  جميل المكان فعلا وشكله رايق بس صورت الصورة  الجميلة دي ازاي
1108251478383386624,EG,  لا لازم يحلف انا موسوسة في الحاجات دي
1108252200755752960,EG,"  انت كنت معاه  لا
يبقى نستناه"
1108253005906919424,EG,"  اهو شفت يا إبراهيم قالك معدية مشاه 
اصل مستواها عالى فعلا عن مستوى الكوبري"
1108253214460256384,EG, زبديه دي بكام  اكتر من جنيه مبصبحش
1108256613985644416,EG,  تسلم يا شريف ربنا يكرمك
1108257049270517760,EG,    خليهم  لمون انا هشرب  كوبيات عشان عندي برد
1108257493350862848,EG,  مش قلتلك هو فاكر عشان عمل اقرار في الاول كلامه هيبقى مصدق في كل حاجة 
1108257724201091200,EG, تشرفي في اي وقت وكلميني ونتقابل ان شاء الله بس تعالي
1108258586898120832,EG,    لا انا عندي ازمة ثقة وبتعالج منها هات الفلوس انت وملكش دعوة
1108260413169455232,EG,  عايز يقنعنا قال يعني فنان بالفطرة وشوية وهيقولنا جدو الباشا حرمه م الميراث عشان طلع فنان وانه ضحى بكل حاجة عشان الفن رسالة عظيمة
1108261545698578432,EG,  دا برضو مش هيمنعنا اننا نطالب بالعزومة
1108265560004009984,EG,"  المنشن دا بتاعي ومطلعش منه خسرانه 
انا هسيبكم دقيقة تتشاورو وتقرروا"
1108270438772363264,EG,"  دا مش شكل ناس جادة طلبت رقم الحساب وبعتهولك الخطوة الجاية الاقي الفلوس فيه
مش ناوي تبعت قول مش ناوي وسبني ألقط عيشي في حتة تانية دي ساعة صبحية"
1108416637022150784,EG, اه ازاي دي مجتش في بالي
1108417048181424000,EG, مبيحصلش معايا كده الحمدلله
1108550462721134592,EG, انا تعبت من الفرجة ومقدرتش اكمله بس مفيش فيهم واحد فيهم عنده مخ
1108565429843300352,EG, متقفليش على نفسك زي ما في الوحش في الكويس خدي وقتك بس متخليهوش اسلوب حياة الاصدقاء من نعم الحياة ادعي ربنا يرزقك الصحبة الصالحة
1108654020665794560,EG, طب حلو عندك حصيلة كويسة متركزيش مع اللي ندلت دي اهي خدت الشر وراحت
1108686596709191552,EG, انا هاخد عناقيد الرضا بس ياريت اورجانيك
1108689573918461952,EG,  لو تمرين هنسامحهم عشان خاطرك انتي بس
1109026791266619392,EG, هو كان قصده يقول انه فاسق اوي فاجر اوي حقير اوي بس خانه التعبير
1109353263420326016,EG," مبروك الاكونت الجديد والف لا بأس على الاكونت القديم 
خف ايدك من على زرار الريتويت اكيد هو اللي عمل قفلة في الاكونت"
1109360827747000448,EG,"  دا شكله متورط في قضايا تانية كتير 
بس هنبلغ عنه الانتربول وهيجيبوه وهيمثل لحكم محكمتنا الشامخة"
1109377672143167616,EG, ممكن ياخد يوم ولا اتنين ويفتح ان شاء الله اصبر عليه ومتحاولش تفتحه كل شوية تويتر مبيحبش الزن
1109388581620068352,EG,  يا بنتي دي جمعية واحنا داخلين بحجات فخيمة ومتوقعة اننا هندخلك جمعية الفسيخاوية المتحدين بالحلاوة والشيكولاتة بتوعك دول  انتي بتحلمي
1109389093660696576,EG,  دي حجات العيال التوتو
1109389866704490368,EG,"  دا انتي الاب الروحي بتاعهم 
التيتاوية الكبيرة"
1109390074184155136,EG,  جاك ملوش ذنب هو تقريبا عمرو مجابش هدية عيد الام للحاجة ام تويتر فتويتر متضامن مع امه
1109424332844003200,EG, اصله عارف اللي فيها
1109466609029181440,EG, ماشاء الله شكله جميل ويشهي تسلم ايدك متيولة متيولة يعني مفيش كلام
1109467953999868032,EG, متيولة يعني انيقة وشيك
1109481080908857216,EG, عادي يعني لما تطلع فاشوش مخسرناش كتير
1109481205077081984,EG, الله يكون في عونك دي عالم مستفزة
1109483672665763840,EG,انا بس اللى جبت هدية عيد أم ومعجبتهاش ولا احنا كتير
1109485212440952832,EG, هي مبتحتجش اي حاجة دا الطبيعي
1109531074063937536,EG, انا لسه صاحية محدش ينام
1109532075751849984,EG, انا معنديش وبعدين دا مش مبرر طبقي عادي يعني
1109534797603442816,EG, يسلم قلبك الحلو انتي عشان معجبه لكن لو عملتي استفتاء ع تويتر هتكون النتيجة عكس كده خالص
1109535373674320000,EG, قطعتي قلبي طب والعمل نتصرف معاهم ازاي حبايبنا الحلوين دول
1109535581116268416,EG, ربنا يراضيكي ويجبر بخاطرك يا جميل
1109536020486344832,EG,  اركني انتي يا مريم على جمب بقا احنا هنعمل قمة عربية ولا وجود للامريكان فيها
1109536311742992384,EG, اه جميل موضوع الغنائم ده انا عايزة اشترك معاهم
1101892157160521600,EG, لا دا انتي عشان حبيبتي بس لكن هي ببلاش وبتتقال لكل من هب ودب
1101912450792861568,EG, ماشاء الله فنان مفيش كلام واضم صوتي لصوت نور وسيب الهندسة وخليك في التصوير وحركة العربية دي جامدة انا صدقتها وافتكرتك مصورها بره مصر لولا شفت شرحها في منشنات تانية
1101912976486002816,EG, عشان عارفين انك مش هتشتكي
1101916922071916416,EG, اه مش حلوة طبعا الانسان من جواه ضعيف وبيحتاج يحس بالاهتمام وان في حد بيطمن عليه
1101920182900015232,EG,  مشروع فنانة بداية جميلة كملي وخدي كورسات وهنشتري منك ان شاء الله
1102349268453601152,EG, وليه في اسوان  ليه مش في المنوفية
1102659940731244416,EG, ارجوكي تعملي حملة تثقيفية انهم  وكل الناس لازم تثبت على كدا لان كلنا بنوحرج مش انتي بس
1102666997731651584,EG, هما ياما تلاته او اربعة يعني الاختيار يكون ما بينهم تخليهم انتي اتنين ازاي عايزة تبثي روح العداوة بين افراد الشعب الواحد وتفرقي شملهم 
1102667235653533568,EG, اول مرة اشوف حد بيحب نوال
1102667906293424000,EG, ممكن تحطي يافطه جمب وشك مكتوب عليها اتنين بس
1102796399912079360,EG,  للاسف كنت عاملة مقدار احد بس لمريم انت ممكن تتفاوض معاها وتخليها تتنازلك عنه
1102796659493425152,EG,  خلاص اجرب ان شاء الله وطالما انتي اللى رشحتي الاغاني دي تبقى اكيد جميلة
1102797074700083200,EG,   مجاش في بالي كنت عملت حسابه م الاول وعملت طبق ليكي انتي كمان يا انوش
1102797473389645824,EG,  زوج بنتي دا ايه مهو اختار الامريكانية وساب المصرية ولا عزاء للإنتماء
1103135736264568832,EG,                       جزاك الله كل خير يا باشمهندس ربنا يتقبل منك ويجعله بميزان حسناتك
1103138796869242752,EG, متفتكريش انك عشان عايشة في العريش وسط القنابل والمدافع وشبح التهجير انك انتي الوحيدة اللي بتعاني لا في غيرك كتير بيعاني في صمت زي الاخت دي وبعد الحاح تكرمت وشرحت معاناتها وانا شخصيا متعاطفة معاها
1103139880849362944,EG," حاليا مش فاكرة غير حاجة واحدة بس هكتبها وع مدار اليوم كل ما افتكر حاجة هكتبها هنا
 لو بطاريتي خلصت بفصل فجأة وبدون سابق انذار او تنبيه"
1103141246049095552,EG, كده انتي قلبك حي وضميرك صاحي وبتشعري وعندك انسانية
1103144557217230848,EG, لولاهم الحياة مكنتش هتكون حياة
1103145946945339392,EG,  زمان كنت باكل بسرعة بس ايام الجامعة كنت ساكنة مع بنتين اكلهم بطيئ جدا فوق ما تتصوروا في رمضان كانوا بيفطروا من بعد صلاة المغرب لحد اذان العشاء فكنت لازم ياما اتكيف او اتشل ففضلت التكيف وبقيت بطيئة ومملة زيهم بس هما لازالوا متفوقين عليا
1103188891169902592,EG, واضح انه كان عنده كبت وواثق من نفسه ماشاء الله
