id,dialect,text
1162657931504115712,LY, زميلاتي في الجامعة والمدرسة والحق يقال ما شاء الله عليهم
1162658380953071616,LY, تحسيهم مقيدين ومش واخذين راحتهم
1162659439259918336,LY,"بنت أختي الصغيرة عندها الكورة هذي اللي ادير في ضي لما تضربها عالأرض
أول ما يوقف الضي بتعها تزعل وتقول حيي هرب الضي 

تحسابها فيها طرح أحمال زي ضينا المصون  "
1162660415840669696,LY," والله اضحك لما تشهق تقول الضي فعلا هرب 
ويحفظلك غواليك يارب"
1162861075806793728,LY,   مقوى قلبها اللي تزوجت في  أيام
1162861357009723392,LY, هو فعلا أريح لأن العيلة كبرت ومش الكل يقدر ياخذ راحته
1160342494443425792,LY," ربي يحفظها 
خايفة عليك وعندها حق"
1160342694092259328,LY, قبل لا ناخذ حصتي نبي نقولك عيدك مبارك ومن العايدين الفايزين يارب 
1160343565467340800,LY," مقدار صغير 
كاشيك زبدة اذوبها واضيفلها كاشيك دقيق وتحركهم شوية لين الدقيق يتغير لونه شوية
بعدين اضيف كوب حليب علي مراحل وتحرك وتوسع بالك لأن الخليط حيتكتل
وبعدها كوب حليب ثاني علي مراحل وإستمرار التحريك وكوب حليب ثالث تقريبا هنا حيكون قوام البشاميل سايل شوي
خليه علي نار هادية"
1160344109497888768,LY," خليه علي نار هادية لين قريب يغلي وضيف ملحك وشوية فلفل أكحل وجبنة مودزريلا ولو ما عندكش حتى مثلثات
وحرك لين تحس قوامه ولى خاثر شوية وطفي عليه واستخدمه في المكرونة ولا اللازانيا
والقوام أنت تتحكم فيه لو تبيه خاثر وغليظ ولا مايه وسايل شوية وحياخذ وقت باش يخثر في الكوشة"
1160344897645416448,LY, عندنا أناني متعبنا ومش حاس بحد وهالأنانية مسببة مشاكل ونكد
1160529390482181888,LY," الله غالب عليا وخلاص 

عيدك مبارك ومن العايدين الفايزين يارب"
1160529594316972032,LY," سألته طول 

حسيت أسلوبه مش غريب عليا لهذا سألتك عليه "
1160530033234108416,LY," 

عيدك مبارك ومن العايدين الفايزين يارب"
1160530304274194432,LY, خلاص ياقنوع كان حصلت نص مليون عطيني نصهم 
1160530996590256128,LY," تجيب الا وين غين لاصقة في را  
ربي يعين 

كل عام وأنت وأسرتك بألف خير ومن العايدين الفايزين يارب"
1160531815154823168,LY," كملناها وعلقت فينا الريحة 

عيدك مبارك عليوة ومن العايدين الفايزين يارب"
1160535961501089792,LY, عيدك مبارك فطوم  ومن العايدين الفايزين يارب
1160568771284754432,LY," حاشاك 

بس عناق معروفة ياسمحة ياطويلة والصفات هذي بالإجماع راهي "
1160574538528231424,LY,"  بالضبط وحسب شن ياكل 
عشب ولا علفة"
1160578019624390912,LY, عيدك مبارك ريم وكل عام وأنت وأسرتك طيبين وبخير يارب
1160894766340608000,LY," ربي يحفظهملك ويفرحك بيهم وتشوفيهم في أعلى وأحسن المراتب 
وكل عام وأنت وأسرتك بخير يارب"
1160896593954070528,LY," عيدت عليك يادوك 
لو ما عيدتش كل عام وأنت بخير ومن العايدين الفايزين

ولا  الحمدلله ما ننتظرش في رسايل ومريحة دماغي "
1160896841250234368,LY, طلعت معاييرنا بسيطة قدام باقي الشعوب 
1160897182075105280,LY," اووو رمان 

اللهم آمين والقايل يارب "
1160897815251443712,LY," العاطي حي
ربي يعطيك وتعيش فيهم"
1160900991165841408,LY," لو فيه حاجة تعلمتها من مخالطتي بالناس فهي إني نخلي ديما سقف توقعاتي بيهم منخفض وما نتأملش منهم هلبة 
باش كان صار ما صار ماتكونش صدمتي فيهم وخيبة أملي قوية ونطلع بأقل أضرار ممكنة في مشاعري"
1160901902349025280,LY,"حاولت نعيد علي أكبر عدد ممكن من اللي قابلوني عالتايم أمس 
وعارفة إن مش الكل أمس علق أو غرد وأكيد فيه من ما عيدتش عليه 

لذلك عيدكم مبارك ومن العايدين الفايزين ويارب عيدكم العام الجاي في عرفة 
وسامحوني لو فاتتني تغريداتكم وما شوفتهاش وما عيدتش عليكم "
1160902000508309504,LY, عيدك مبارك ناصر ومن العايدين الفايزين يارب
1160902387554557952,LY," ما شاء الله 
ربي يدوم الود ويكثر أحبابكم "
1160903851412787200,LY," ياخية علي الكلام الحلو اللي خجلني 
وأنت بخير وسلامة غاليتي "
1160904584119742464,LY," كلام جميل 
اليوم كنا في سيرة هالكلام أنا وخالتي وقالت اللي يده مبسوطة بالكرم هو اللي ربي يرزقه ويغنيه

عيدك مبارك بات ومن العايدين الفايزين يارب"
1160905095120326912,LY," اللهم آمين والقايل يارب
عيدك مبارك أحمد ومن العايدين الفايزين"
1160906273665294336,LY," خليني من الدبش اللي تشوط تحته 
الفركيتة شن وضعها "
1160909150597124096,LY," عيدك مبارك زهورة ومن العايدين الفايزين يارب

سبع صحيحات"
1160980343714930688,LY," لو أعجابها بيك متبادل مستحيل ترفضك
ماهو أنت هنا مش حتتقدملها لين تتأكد من موافقتها عليك وإنها فعلا تبادلك الإعجاب ومتقبلاتك"
1161021874689794048,LY," العلة فيها هنا 
لأنها من الأول مش مقتنعة بيه ويبدو لقت اللي في نظرها أحسن منه"
1161028437169135616,LY, هما اللي ما ينفعوش مش أنت 
1161030009362030592,LY," أحلام مستغانمي تزوجت مرة وحدة ومازال لليوم زوجها
المتنبي قاتل بنفسه قطاع الطرق اللي قتلوه وما كانش جبان
محمود درويش حب يهودية وسيبها لما خشت الجيش الإسرائيلي
هنا فعلا مش كل شي تقراه تصدقه 

وعيدك مبارك وكل عام وأنت بخير"
1161030837720223488,LY, اهرسها وزيدلها شوية زبدة واعتبرها ماش بوتيتو وكولها
1161033139734683648,LY," نهار أبيض 
باهي وين المشكلة في نسكروا
قصدي عادية الكلمة غير شكلها مسكينة عيلتها خنايسية

أنا نكتب فيها بالسين وننطق فيها بالسين عادي"
1161065472919592960,LY, شكلها بزبدة الكاكاو لأنها بيضا 
1161069445986639872,LY,"   على فكرة كلمة صكري أو صكر ممكن نفسها سكر لكن الناس مع مرور الوقت فخمت السين وحولتها لصاد زي ما حولت هلبة حروف في كلمات ثانية 
ممكن اللي قالوا كلمة صكر كانوا أعاجم مش عرب وخذوها منهم العرب ومشت فيهم"
1161071662567165952,LY,  رد بالك راهم زي الرادرات يسجلوا ويوصلوا
1161077661374078976,LY," بسم الله ما شاء الله 
ربي يحفظهم ويقر عينك بيهم وتشوفيهم عرسان يارب "
1161278858156544000,LY," هكي حتتعبي هلبة
عودي نفسي تجتازي فكرة إن مزاجك يتعكر لو ما درتيش اللي تبيه 
وحاولي ثاني يوم اديري الشي هذا وبهدوء وحتلقي نفسك هكي انجزتي وبالك مرتاح"
1161279100440461312,LY, من الأسم واضح إنه خاش عناد مع الكفر الله يعافينا
1161282304473522176,LY," ما شاء الله لا قوة إلا بالله شيماء 
سلم ايدياتك وربي يحفظها اميمتك ويفرحها بيك"
1161282834969059328,LY, أنا خاطري نمشي وينصهد وجهي من الشمس وامية البحر 
1161283318027030528,LY," أول مرة يقابلني حد يحب الأحياء 
وينكم أيام نقري ما نلقى كان اللي يشفع منها الحصة وقالق "
1161285146294849536,LY," سلمها يارب وسلم جمالها 
أصلا صهدت البحر تبين الجمال أكثر وبعدين لما يصير زي التقشير للبشرة حتطلع بشرة حلوة وكلها نضارة
 شوفتي أنا لشنو نخطط "
1161285911570714624,LY," أول شخص يتكلم عن الموضوع هذا من زاوية مختلفة 
أنا زيك فكرت إن هو كان يستنى لين يوصل عمر معين ويرجعلها
هو كان ضامن حبها ليه وإنها مستعدة تستناه العمر كله 
واستهان بعمرها وضيع سنينها فعلا وما فكرش أبدا إن من حقها تعيش وتشوف نفسها وحياتها والموت كانت من أبعد الإحتمالات عنده"
1161286188411564032,LY," نذكر جربتها عمنول لكن نسيت النتيجة 
كان ما نطلع  ذكر "
1161286469778071552,LY, راجل ايعيد مع اهل زوجته
1161288679886901248,LY,"  نفس الكيبورد بتعي 
جميل فعلا ومريح"
1161315976304123904,LY," المليارات اللي قعدت بعدها حيتحاسب عليها حساب الأغنياء وياريته حطها في البلاد واستثمارها وطورها وما خلاش كل من هب ودب يطمع فيها 

في الحالتين هالمليارات ما شافهاش الشعب ولا استفاد بيها لا قبل لا توا"
1161333704473677824,LY," توا ايدير بنات ويردوهوله ازواج بناته ثالث ومثلث
وتلقاه اغلب وقته فاضي ولا شادها هدرزة وزرادي مع جماعته تقول ماعنداش مسؤولية يتحمله
بإختصار اللي مش قد مسؤوليات الزواج يربح راحته خير"
1161353961359773696,LY," الموت مافيش مهرب منها وكل من عليها فان 
وأنا زيك الحق فكرت في الصغار لأن مافيش من يحس الصغار زي أمهم 
ربي يحفظك ليهم ويطول في عمرك وتفرحي بيهم كلهم وتشوفيهم خير مما تتمني يارب"
1161354832583843840,LY, منظر ايمرض ولا حول ولا قوة إلا بالله
1161355639488163840,LY," التعامل مع الكائنات الدقيقة الحية مخيفة ما بالك لو كانت فرعونية 

شد أنتباهي كلمة تقنية التعقيم الدقيق 
خاطري نعرف شن الخطوات اللي دارها باش ضمن إن الكائنات اللي استخدمها مش حتكون سامة"
1161372776755802112,LY," أنا نحب الحلو 
وليا يومين اندور في حاجة حلوة وباخلة نطلع نشري "
1161595595456425984,LY," يالله 
كوووويس غيرتي جوك ووسعتي خاطرك 

ربي يقرب المسافات ونبدو جيران "
1161596089549709312,LY," حاجة جديدة عليا ولا 
كان يسمعوا العيلة يضحكوا "
1161597012585963520,LY," البشرة تبي بال رايق باش تبان رايقة 
والبال الرايق يفرج الله "
1161597413137756160,LY, عندي أختي برا وشادة فينا تعالوا تعالوا تحسابه طلعوا عيلة كاملة حاجة ساهلة 
1161597698828636160,LY," قيسي الضغط بتعك بالك يطلع نازل 

لما كان عندي هبوط ضغط كنت هكي قد ما نحط ملح يطلع صامت"
1161606685615644672,LY,"  التاغية من يومين قال الجيش بتع حفتر مشطوه وخذوا المولد بتعه
أنا بديت نقرا في الأخبار من الطرفين وما نصدقش"
1161606939526213632,LY," 
آسفة بس سؤالك ضحكني 
يعني الزوج أساس النكد لو فهمت السؤال صح "
1161622649287663616,LY, غير اللي تسلم أنت ياعبسي من هالأمراض الوراثية والشعب السويسري اللي زيني ليه الله 
1161622970705633280,LY," الزوجة قبل لا تتزوج كانت في قمة سعادتها وفرفشتها وروحها المرحة فشوف العلة من منو  

لا مش متزوجة 
تتوقع سبب النكد من شنو زعما "
1161623213744513024,LY, ما قريتش باش نعرف 
1161623414991458304,LY, اها بتع رياضة وجسم رياضي وعضلات سويدية وهكي معناها 
1161625495097815040,LY, كانوا خايفين زمان من الشرطة لكن توا نظام غاب القطة ألعب يافار
1161625775931633664,LY," مانحبش التفكير اللي يمشي بعيد لعلمك 
ونحب نتكلم بعفوية وبدون قصد 
فلو فهمت كلامي غلط الله غالب عليك وخلاص"
1161626648338472960,LY," مدربها حطم رقم قياسي فوق ال ساعات 

شوف كيف حاطة سماعات وتلعب بالنقال ومنسجمة ولا كأنها حاسة بالألم والتعب 
وشوف عضلات ايديها كيف بارزات من البلانك"
1161627690794921984,LY, ما عاشتش مرتاحة معاه وكان يوصف فيها بالغبية وفي الأخير انفصلوا وما خلا ما قال عليها في الجرايد
1161628371350118400,LY," ما قريتكش

الحروف اليوم نصهم طايرات مني"
1161633621654036480,LY," ولما يوصلوله يفوتوه طول 
تقول كانوا في تحدي إنه يوصلوا وربحوه وتمت القصة"
1161648742962991104,LY,"أختي تنقنق تبي تمشي البحر وتبي تطلع لينا قداش ما طلعناش الحق ولا مشينا للبحر 
فتحكي قالت يا والله حياة تقول حكم بالأعمال الشاقة  انوضوا نخدموا ونولوا نرقدوا لا طلعوا لا خشوش "
1161649900775497728,LY, أنا نحط ونقول صامت لين تصير مشكلة ويقولولي مالح 
1161657415311532032,LY,مرة مرة فيها أخبار تبرد عالخاطر زي هكي 
1161658935910326272,LY,سبحان الله شبه يوميا يقابل فيا حسابها الله يرحمها ويغفرلها ويوسع عليها ويسامحها ويجعل قبرها روضة من رياض الجنة 
1161713198766182400,LY, ما فوتناش عتبة الباب برا في هالعيد
1161719324899454976,LY," فرحان هاه 
باهي سجلته بروحك بلا ما تغرر بيا "
1161720088174764032,LY,"فيديو الجيم اللي في إيران 
يرقصوا علي أغنية هندية تاميلية من بكري وأنا نتفرج عليه ونعاود 

الإيرانيين اللي نساوينهم فارضين عليهم هلبة قيود واللي تحاول تاخذ راحتها شوية يحبسوها طلعوا رجالاتهم يرقصوا عالهندي في نواديهم وعايشين حياتهم بكل مرح 

مش عارفة بمن فكروني "
1161724503908597760,LY, نحسابك بتقولي لكن عالواقع مشغولة وما نتكلمش هلبة
1161725117178744832,LY," ما شاء الله 
سلم ايدياتك وسبع صحيحات علي قلوبكم "
1161736375701594112,LY,"رهيييييييييييب 
يخليك تتفاعل معاه وتبتسم طول الوقت 

طريقة إلقاءه يالله  "
1161737529546235904,LY,العبيط مدايرلي بلوك فعلا وأنا لاني صينية ولا كورية  
1161741637372002304,LY, ما شاء الله تبارك الرحمن ياموسى راهو العين حق
1161743086747303936,LY," خطرت عليا حوش جدي زمان الله يرحمه 
قعد كله حديث 
حتى يلتموا توا لكن مش زي زمان الحق"
1161743254439845888,LY, مرات سامعها في شارع ولا في مدرسة
1161743335981244416,LY, ويرحم من عندك غالي
1161743686096629760,LY," الشوكولاتة لما تسيح في الصيف 
حتى تعطيها فرصة ثانية وتحطها في الثلاجة مستحيل ترجع زي قبل"
1161743947502379008,LY," يعني تفضفضي
لو فضفضة الندم اللي حتحسيه بعدها أسوأ من شعورك قبل المكالمة صدقيني"
1161745471620177920,LY," كان الله في العون 
حاولي أنت تتواصلي مع وحدة من صديقاتك وتكون هدرزتكم ضحك وتعليقات باش تغيري جوك شوية وتنسي"
1161746839303065600,LY, هذولا وين ماشيين ووين أمن السرايا
1161748142016159488,LY," شوفي جت هذي قديم بعد تعليقي عليك 


 "
1161752910134480896,LY," ويخصصولهم في أيام يتفرجوا علي سينما 
ويرفعولهم في مجلات ترفيهية وكتب وجرائد 

يلا لينا الله احنا "
1161753582015844352,LY," ياعبدو كل واحد ينظر للموضوع هذا من زاويته
مرات بنت الناس ما لقتش راجل كان معاها قد كلمته
ونفس الشي فيه من رجالة ما لقوش بنات ناس قد كلمتهم"
1161753776472150016,LY, انخلعت قولت تويتر خيره ولى أبيض كان مش تسكر حسابي 
1161754414174130176,LY, نحس تويتر مخترعينه مخصوص للتلقيح
1161754728130326528,LY," الزووووووج
ما جابوش سيرته معناها انطلقي ونكدي عليه "
1161755793705918464,LY," أنا ظروفي تغيرت وبالسيف استسلمت باش نريح روحي ونكسب أعصابي 
ممكن أنت ظروفك غير ومع الوقت تلقي نتيجة "
1161869705348624384,LY, سلم قلبك ربي يسعده 
1161869874861355008,LY," من ذوووقك 
تعودتوا علي رمانة "
1158092399190650880,LY, ربي يحفظها لك يارب ويطول في عمرها ويرزقك برها ويفرحها بيك
1158092499690381312,LY, ما شاء الله الفال للفرحة الكبيرة
1158108569264431104,LY, إلا أنا رد بالك تجي في طريقي ايوا 
1158113968394780672,LY,"المترو هذا اللي تحكوا عليه بالفلوس ولا مجاني 

خاطر أنا من الطبقة الكادحة ومرتبي ينزل كل  ولا  شهور مرة والمصرف ايوفر في السيولة مرتين في العام

يعني يصلح بينا احنا الكادحين ولا نكملوها كعابي"
1158129036931063808,LY, معاش قدرت نكمله زي ما يصيرلي بالضبط مع أفلام الرعب
1158139436464578560,LY," الماء اللي ماشي للسدرة الزيتونة أولى بيه 

المتحولة مذبالة ولو كان يبدوا عروقها في بير"
1158318124678176768,LY,اللي صدمتني قوانين السياحة في البندقية 
1158330284691079168,LY, القراقشة مش في طرابلس يعني
1158378762469347328,LY, وينعرف قدع وطيب لما يضرب بايده المعرقة ويلصق اللي ضربه عالحيط
1158379336719900672,LY," هو الضي يهرب ب ساعة في مناطق وبال في مناطق ثانية 
والمناطق الثانية هذي معروفة تجارية ومعبية محلات وإنارة واللازم منو 
يعني هنا حنفهم إن اللي يهرب عليهم ب ساعة يستهلكوا في الكهرباء أكثر من اللي يهرب عليهم ساعتين بس"
1158386346928541696,LY, ليا  أيام نحاول نعبي كرت واي ماكس وشركة العازة مسكرة راسها
1158403775230599168,LY, ربي يحفظه ويدوم الود بينكم ويفرحكم بيهم
1158410913256542208,LY,  مافيش داعي لأن اللي علي راسه بطحة حيحسس عليها
1158415313647677440,LY," شهادة حق وانقالت بكل صدق 

ربي يحفظه ويقعد ديما صديقك الصدوق "
1158418379763585024,LY," 

زمان اللي يقول لي سمنتي نقصي انقول له لا مازال بنزيد شوية 
حاليا ضعيفة مافيش من مدورني "
1158441611224899584,LY,"علاش كل شي ياخذوا فيه بروح رياضية ومرحين هكي وجوهم حلو 

أنا أستمتعت بالمقطع لا بال هما اللي عاشوا الأجواء "
1158442581753257984,LY,"  بتستهطروا 
هي نفسها تستهتروا من الاستهتار"
1158443692669243392,LY, المهم أنت مقتنعة وهما يمشوا ايملحوا 
1158445293807050752,LY,"الناس اللي مدمنين شوكولاتة وعارفين انها ما تقاومش في هالحر والرطوبة 
وكان حطيتوها في الثلاجة بالأكيد حتختفي

كيف مدايرين بالله عليكم "
1158461691216191488,LY," عالأقل عندك مكان ادسي فيه 
أنا مدرسة وشوفي جوك 

النوتيلا سبحان الله ما اطولش مع العيلة"
1158508297089146880,LY, واللي معاي في الكوجينة 
1158508364869099520,LY, باهي اللي لحقت عليك بارك الله فيا
1158509233610067968,LY, فيه كاندي شوب في طرابلس
1158509511042318336,LY,الوقت المناسب اللي ربي كاتبه  مش اللي أنت كشخص تبيه وتعتقد إنه مناسب ليك 
1158515046751846400,LY, قداش ما حشيشتك تنرفز غيرك وتحرقله دمه 
1158515806608744448,LY, السطر الأخير حسيته زي الغصة 
1158516139959472128,LY, واللي خلقها ربي صوتها عالي خلقة كيف اديرله 
1158519078199484416,LY," مش خطبة هذي 
هذا عرس"
1158692318653927424,LY," لما كانوا ما يجيبوش في كوسة كانوا يعطوا في فلوس 
أما اللي في الصورة تبوديع جديد يوروا فيهم للناس ويحملوا في العائلات فوق طاقتهم"
1158692791729426432,LY, و هذي حيجملوا علينا بيها تقول زايدينهالنا مش واخذينها منا
1158692905592250368,LY,  غير إن شاء الله في تحسن ملحوظ ولقيت نتيجة 
1159124639081213952,LY, المهم فهمت كلمة كسوة مع إني كاتبتها كوسة 
1159124788604022784,LY," مرحبتين وتعيش وتشوف يارب 

هو الضي مخلينا نشوفوا شي أصلا "
1159126557392347136,LY," لا إله إلا الله حتى زوجها توفى 
والله العظيم وجعتني هلبة والبارح الليل كله نفكر فيها وماعنديش نت باش نتأكد من خبر وفاتها ولما تأكدت يشهد الله لين بكيت الله يرحمها ويسامحها ويوسع عليها قبرها زي ماكانت ديما موسعتها علي غيرها وديما تضحك "
1159129962391252992,LY," ربي عارف الظالم من المظلوم ياطارق
وعارف منو اللي مذوقنا المر"
1159130543092641792,LY," بالرغم واجعتني جدا ولليوم متنكدة بسبب خبر وفاتها لكن سبحان اللي زرع لها القبول في قلوب الناس والكل مصدوم ومش مصدق وزعلان
الله يرحمها ويسامحها علي قد كل من زعل علي خاطرها وترحم عليها 
وإنا لله وإنا إليه راجعون"
1159131488757198848,LY, الله يرحمها ويسامحها كانت إنسانة مرحة ومحترمة
1159132557922971648,LY, يالله فعلا كأنها فرد من العيلة
1159141381732012032,LY,"  مش اي حد يانوما
روز روحها حلوة وما عندهاش عداء مع حد وديما كلامها طيب لهذا وجعتنا كلنا الله يرحمها ويغفرلها ويوسع عليها"
1159384477384228864,LY,"من هروب الضي وقلة توفر لمية شوية ونخشوا علي التيمم باش نعطوا حق ربي 

حسبي الله ونعم الوكيل"
1159427632678805504,LY, وكلهم أسماء زمنية لييييييش
1159430363678199808,LY," انطردوا 
والفلسطنيين المطرودين من أرضهم وبيوتهم اللي تحولت لمستعمرات يهودية عشان تسكن فيها سعاد وأمثالها مش من حقهم حتى هما كفلسطنيين وأصحاب أرض وحق يرجعوا لأراضيهم وبيوتهم"
1159431365760311296,LY, واخذين أراضي الفلسطنيين وحياشهم بالغصب والقتل والدمار ويستعطفوا في الناس  تقول هما حق اللي مظلومين
1159433190773350400,LY,"  

الفيديو ما قدرتش نفتحه لأن قلبي مش قوي 
لكن  علاش بتنتحر كنت زيه ولا شنو"
