id,dialect,text
1162861382896934912,KW,"وبس  اكتفي بهالقدر

بين فتره وفتره بحطلكم شغلات دشت مزاااجي وليش"
1163366478617423872,KW, ماعرف اشرح  بس تحسينه نفس طقة عطور استي لودر
1163712132418080768,KW," انا حاليا في القمة

اسعدتييييييييينيييييي حيل طاقتج طاقتج"
1165356407908196352,KW,"يما
احب طبااااخج  شلون 
ما اتطرشيلي كل يوم جذي اكل "
1165358484319277056,KW,الكويت مو حلوه بدونهم 
1166962485854949376,KW,"صباح الخير 
يا وجه اذا شفته اكون بخير 
وأشوف الخير "
1166996860625653760,KW,"متأكده إن فيني  يخلصالشحنوبيا  

اللي فهمها يحط لايك"
1167321105926770688,KW, كل عام وانتي بخير يا لطيفه
1167885608842194944,KW,"سيد جروحي شمس عمري وظلي
البعد طول والخطا منك واضح
اذا غرورك يمنعــك تعتــذرلــي
تعال جنبي وابتسملي وأسامــ ـح 

"
1169263157212303360,KW,الصديقة الي صعب صعب تخلي أحد ياخذ مكانها 
1169287228188745728,KW,سوالف الي يمي بايخه جدا جدا جدا
1169677667744079872,KW,عيني مشتاقه وقلبي ذاب 
1170044119059746816,KW, موجود بالبدع اتوقع واحد ثاني ماخذ وكالته
1170049540751335424,KW, اي شوفيه مطعم اسمه دستركت الدور الاول
1170082204816420864,KW, وايد زمال مريح وايد
1170250317537193984,KW," شنو مووضوع الناس مع الذكريات
سوي ذكريات يديده احلى"
1170366131510611968,KW,"كل عمر وله جماله فعلا
بس ما تلقى مثل الاستقرار النفسي الا بعمر الثلاثينات"
1170722322329812992,KW,المشكلة مو بالحجاب  المشكلة باحترام الانسان حق جسمه 
1170945931430305792,KW,"بناتي اول يوم مدرسة 
الواق والويق خليناها حق اليهال 

    "
1170949401659002880,KW, يسلمك يارب بوراكان ويخليلكم راكان يارب
1171886048814780416,KW,داري على ألبي وإحساسي الياش 
1172259729474838528,KW,"اللعبة اللي مضيعة وقتي 
وفلوسي  "
1173136956160655360,KW, لا عاد تطبخ وتصور 
1175412320006225920,KW, والله ماصدق ولا شي تحطه 
1177915993940730112,KW,  عاد انت مايعجبك شي ليش مسوي ريتويت
625229802602131456,KW,"

صباح الورد 
بالنسبة لسؤال الامس  شنو نوع التدمير الذاتي اللي تستخدمة  هذا رد على اللي قالوا "
625236473084641280,KW,  صح  اذا مو عارفه وين تروحين شلون راح تخطين خطواتك  
626004104670769152,KW,من أمتع الجلسات اللي اقدمها هالأسبوع  جلسات التخطيطالشخصي  
626396278868447232,KW, حلو السؤال  صمت لحظه وإحساس وأجمل ان حددتي مكانه بالجسم
626396378709622784,KW, يصير  ما نعرف لمين  
626396635736600576,KW, اختاري الأفكار الصح  اجلسي مع الناس الصح  تكلمي بالامور اللي تحسسك بالمشاعر العاليه  فرفشي
626397278547259392,KW,مع الجديه اترك مساحة للفرفشه في حياتك عشان ما تنسى ملامح الفرح 
626436619814469632,KW,كمل قروبنا لمناقشة كتاب قوة الان  واعتذر عن كل من ارسل للمشاركة  لكن الاكيد راح نشاركم بالتلخيص  
628874166612029440,KW,الساعه م اليوم بتوقيت الكويت راح اتكلم عن قانون الانعكاس في السناب جات  سنابي 
628957829785886720,KW,خمس دقايق ونبلش قانونالانعكاس  
628989977884397568,KW, كملت ام سلمان  اتمنى لك الاستفادة 
628991569975189504,KW,"شنو اللي معطلك انك تأخذ خطوة اتجاه امر تريده 
لو كل مطبه اعتبرناها جبل  كان ما وصلنا بيوتنا أبد "
630347390642466816,KW,بالتعاون مع حساب   راح اقدم غدا ورشة تفاعلية بالانستغرام  لمدة ثلاث ايام بالمحاور اللي في 
632902521443516416,KW,احلى هوبونوبونو سمعتها من هالإصدار  تقدرون تشترونه اووووون لاين  انا آسفة  أرجوك 
632924134788362240,KW, نعم جربته من فترة
634320004855529472,KW,لا تسأل كيف اذا ما كانت عندك نية واضحة اتجاه التغيير  لان النية فيها عزم وارادة  اللي ينوي جاهز 
634334441276510208,KW,  بس انا ما قلت هالكلام  في اليوم الواحد نقدر نحقق اكثر من هدف إجرائي لكن يفضل ان تكون اهدافنا العامة محددة
634689498979389440,KW,نكمل حديث عن التعلق في السناب جاب  في ناس يسمونه سناب جاب  
634731255037202432,KW, صح  وكنت اقصد التركيز على الهدف عشان النتائج تكون واضحه وعدم التشتت وخصيت اكثر بهالصورة التوكيدات
635811496380002304,KW,"

هذه الرسالة حق اللي يرددون كلمات كسل وملل   انا ودي بس احس بكسل    انا حطيت خطة بس "
636905079988162560,KW,باقي يومين بس  على دورة لأنك تستحقين اون لاين 
637622291225018368,KW,أتكلم عن التدمير الذاتي الان في السناب جات 
638252013906604032,KW, هذا اللي راح يصير 
641768978499674112,KW,أتكلم عن تمرين السيناريو بالسناب جات الان   
642437668819836928,KW,"

فلم اليوم اللي ارشحه لكم اسمه العمى
 يعرض افكار كثيرة لكن اهمها  كيف تحب الروح بعيدا عن "
643107843336478720,KW,عملنا جلسة اي اف تي للتخلص من رهبة قيادة السيارة  تربيت مع ضحك وحماس  سمحت لي اني اصورها  
644150341131440128,KW,من التمارين اللي تتعرف فيها على نفسك وبطريقة الخريطة الذهنية  ترسم شجرة فروعها قيمك او محركاتك 
644160444123488256,KW,"

من خريطة هذا الانسان تفهم ان انسان يحتاج ياخذ قرار و من شخابيطه على الورقة عرف الحل اللي يحتاجة "
644223156266344448,KW,"مساء الوناسة 
عفست الصورة عشان ماتبين  واستأذنت صاحبتها بذكر القصة ونتيجة الإي اف تي   "
649169776653172736,KW,غدا راح نبدي بإذن الله دورة خطوةللداخل  شرح المادة الان على السناب جات  للي يحب يعرف اكثر 
649252320031539200,KW,"

أتكلم في السناب جات الان عن مراحل الصحوة اللي تكلم عنها واين داير في كتاب "
650319865933201408,KW,فن برمجة الذات الكويت 
659100320644145152,KW,كانت السوالف ممتعه  شيء مهم جدا في حياتك انك تحدد لك رؤية تمشي اتجاها عشان ما تثيرك التوافه في 
660925811071954944,KW, ان شاء الله أعيدها اون لاين
663709502097764352,KW,"في السناب جات الان  حديث عن الرؤية و الرسالة و التسويف  

اللي ما عنده سناب ينزل السناب و اللي "
663710700397834240,KW,حسابي في السناب جات  
663800006525235200,KW,فتحت قناة على التليغرام  راح أحط فيها كل الفيديوات اللي سجلتها بالسناب  بطاقات  تمارين  معلومات 
672510631472402432,KW, شكرا لمشاركتكم و كلماتكم و لوجودكم  خلصنا دورة البسي تاجك الحمدلله 
676340765312856064,KW,البدليات كثرت  لان الخط صغير على الشاشة  وين النظارة 
676681863050756096,KW," من الناس ما عندهم اهداف واضحة ومرتبطة بغاية
 يملكون اهداف غير مكتوبة
  عندهم اهداف مكتوبة
 يملكون اهداف مكتوبة و يراجعونها"
677467347574198272,KW,مع الاخت موضي العجمي من رائعات ثمينالكويت 
677475778662023168,KW,الناس تقول ما اقدر احافظ على حماسي مدة طويلة و ان الحماس ما يستمر  و اقولكم ان الحماس مثل 
678122613399515136,KW, صراحة من أقوى الحسابات اللي اتابعها بالسناب  يعرفك بحقوقك كمستهلك بالكويت  الله يعطيه العافيه 
683624082441646080,KW, ان شاء الله  و شكرا لك 
687185738618781696,KW,صباح الحب  اعتقد ان الامر اللي نجح فيه السناب ان حقق فكرة التواصل المباشر مع الاشخاص  لذلك 
1091947678936809600,KW,"  عمري  الله يخليكم لبعض 
من طيبج يا خديجه وتستاهلين الطيب"
1092696343280340992,KW, ليش حاطينلج اكاونتات بالسعوديه
1093765057471746048,KW,"واحلى التفاصيل  على البال

"
1093769014155927552,KW, لا لا الا المظهر المكسوره مو عالبال 
1093769384244506624,KW,  ايش ذي المصخره ايش ذا الجبن
1094551192468889600,KW,الانسان بدون مبادئه شنو يكون
1094899861273616384,KW, الاسلوب مو مال مدرس كلش
1095015387232694400,KW,صـح ما متت من فرقتك بس ناسي راحة بالي 
1095378041830805632,KW,باجر بناتي يكونون نجمات الاسبوع بالحضانة  طلبو مني لوحة فيها اهتماماتهم وشنو يحبون  هذا الي سويته 
1095395408854110208,KW,"بالميك اب الموضوع نهائيا مو الوان يم بعض و غليتر  الموضوع شلون تركبون الالوان عالملامح وتبرزون الملامح 
ملامح نهديها
ملامح نخليها اكثر حده
اجزاء ننعمها
اجزاء نخشها
وبالنهايه مفروض الميك اب يجمل  اذا ما طلعتي اجمل بالميك اب مسحييييه"
1095396079485575168,KW,"مفهوم الميك اب الناعم مفهوم غلط
البنات ما يبون يشوفون ميك اب يطغى على ملامحهم  عجبتكم يطغى
يبون يشوفون ملامحهم قوويه واقوى من الميك اب"
1095586263187496960,KW, ماشفتي ارام واهيه تشرح اللوحه  شرحت قلبي
1095586476396630016,KW, ليش احط ميك اب  اذا  اكون نفس الشي
1095606956138614784,KW,"شغلات صغيييييره
لي سويتها عبالك ما راح تأثر
ممكن صح ما تأثر على حياتك
ولكن تأثر على قلبك
ونفسيتك
وبعدها  ماراح يرجع الوضع مثل ماكان  أبدا"
1095909757108580352,KW,كل عام وانتو حبي 
1096784059886379008,KW," ماشوف في عدالة كلش اسقاط القروض
عندي قرض اشكبره ومابي يسقطونه 
ممكن موضوع الفايده يضايق حيل  لو يقللون الفايده  يشيلون الفايده  اهني ممكن حل حق المشكله صج مو حل كبير  بس يساعد وايد ناس محتاجين قروض بس ما يبون يدفعون دبل القرض عشان فوايد"
1096786869340303360,KW," اللي محتاج لازم يسوونله صندوق يساعدونه فيه  ما يعطونه الا دارسين سبب حاجته  اما القروض مختلط فيها الحابل بالنابل
مادري اصلا في كويتي مو ماخذ قرض  على هالاساس شلون نعرف منو محتاج ومنو مو محتاج
ومانقدر نسقط كل القروض 
في ناس خذت الف
ناس عشرين الف
وناس مثلا ما اخذت"
1096848203910045568,KW,"   يبيله انجيل منكم
شلون الاسعااار"
1096874064696745984,KW, عادي احبج من اول نظره 
1097446928281944064,KW, حبيييبتي  توني استوعب اشكثر تشبهين ابوووج مشالله
1097446966110363648,KW, هههههههه حب ولا اجرام هذا
1097447906183913600,KW,"من وقت الي انطر للحين ناطره  رقم وااااحد بس  بفتح حساب في بنك التمويل  والله ما افتحه

هذا للحين مافتحته وجذي نطره
لو زحمه بالبنك شكثر بنطر"
1097448389967519616,KW," عندي حساب بالبنك الوطني
بس كنت ابي شي معين منهم وهونت"
1097806561341308800,KW,فلتر بو رموش  على ويه ريال 
1098996721575694336,KW, وحده من البنات اهون  شباب 
1099032411692822400,KW,عمره ماكان المقياس الصجي  شكل 
1099040077018288000,KW,"انا يالغالي رضيت
واكتفيت بكلمتك
هذا بس اللي بغيت
ودي تحس بغلطتك "
1099040200959901568,KW, موضوع الفانز طبيعي  المو طبيعي كمية الناس الي تكرهك
1101106709379075968,KW,"كل نصيبه على الله
كل نصيبه على الله  
طاارررااارراان"
1106233622149910400,KW,الله يرزقني على قد نيتي 
1107891101279621248,KW, حتى لو يخلونها تشب ليتات هم بتطيرين فوقها 
1115905281995739136,KW, يالله قووووومي نااااكل اشحلوج بالخدود
1115905722074767360,KW,يا يمشي اللي ابيه  يا فلا 
1115906259587424384,KW,"شاركناصورتكوانتصغير

وف وف جميل صغير "
1116426542056464384,KW,ليش نتوقع توقعات جدا عالية  شي طبيعي بنكتئب ويحوشنا احباط
1116427067401408384,KW,استغرب شلون الحظ خلاني أكون بنت من الكويت من العايله الي انولدت فيها  من أم مثل أبوي وابو مثل ابوي  شلون جيناتهم كانت حلوه وطلعت بالشغلات الي احبها و الي انا فيها الحين 
1117439788347424768,KW,لما تشوف الكل يبوق  ما يحللك إنك تبوق معاهم
1117511606194323584,KW,لما تحط ثقتك بشخص ويخون هالثقة ويغدر فيك  مايخليك الوضع تقط مبادئك واخلاقك ولا حتى دينك من الدريشة  مالهم علاقه ببعض كلش
1120980518613528576,KW, عاد توهم داقين علي
1122424069540995200,KW, شلون انسات وبيسوون حق عيالهم
1122425707940937600,KW, مع ان مزهب الدرس عدل و حاط له ورقه يقرا منها 
1122541443548176384,KW,الي جدامي مسمي نفسه روميو بعلبة ستاربكس 
1122816969919614976,KW, يعني زين ولا مو زين انا اشوفه مدح
1123015209973690368,KW, موضوع الذبح مو هين  شي طبيعي بتفكر مليون مره قبل ما تدفعله الديه  لو انا ادري ان لو ما مسكت اعصابي باي موضوع واهلي بيطلعوني من اي مشكله لان عندهم فلوس  وين الرادع
1123529542960844800,KW, اييي بس انت حر بتدفع ولا لا  ما تجبر العيم يدفعون
1125124369703952384,KW,"كل عام وانتو بخير
وحب "
1127933985240301568,KW, اشهر عطورات جنيد بالافنيوز فيز   صارلهم جم شهر فاتحين
1128626121812135936,KW, نفسه دق علي وسكرته بويهه مالي خلق حنه  
1128712339392552960,KW,كل وحده عينها سايحه صارت تشابهني
1128976343234961408,KW, حبيبة قلبي احلى دكتوره
1130402945005182976,KW,"عشق
حب
يذبحني

الشخص المخلص  اللي يحلل معاشه"
1130403259905138816,KW, كتبتي الي براسي باسلوب جميل 
1130794122904784768,KW,ارام قالتلي مو على كيفج  
1130955997953122432,KW, قصي صبعه بكبره خل يتعلم الادب
1130956149140926464,KW, وبسسس ماتعرف تختار كل شي تبي تاخذ راينا فيه
1131117943125958784,KW, كل مكان يتيمعون فيه يحشروووونه
1131154979690045440,KW, المكان اللي فيه حريم ريحته 
1132949669099778048,KW, ماشالله  وبالله ليش تسوي شغلك ببنك ثاني
1132949912243589248,KW, صح  والدليل مليونين فرع
1132950135095418752,KW," لازم تغير هالقرارات التعسفيه 
خلك انت التغييير
خلك انت المستقبل
تقدر
نقدر
كويتجديده"
1132950392663359616,KW, عطيها تجربه ثانيه تستاهل
1132950926824759168,KW," انا نقيت كويت ماجيك  عالبحر  و اعتقد تقدر تييله من  اتجاهات  
ولكن اسم كويت ماجيك غير جذاب ولا شكل المجمع  فلو مبنى جديد كليا"
1132951380895948800,KW,  هجوم العمالقه مفروض يكون مدبلج بالعربي بالانقليزي في
1133122175601381376,KW," يسئلك  اسئله ماتجاوب الا على واحد  شي طبيعي يحن
جاوب عدل حبه حبه"
1133122205922070400,KW, بس خوش ربع محترمين
1133295395826745216,KW,"جون سنو 
شنو فايدته بالمسلسل  
شنو فايدة المسلسل بكبره اصلا شنو استفدت"
1137375813068906368,KW," حلو الشباب فيهم قوه
ومنتجين
ومبدعين
ومبتكرين
بس لما يصير تحتك 

 شخص مسؤول عنهم
وانت مبلش من موظف عادي
تخيل وحده تتزوج وتصير أم حق  بنفس الوقت"
1137377414114422784,KW,  اذا الوحده عندها مثل خشمج  وشفايف متفوخه مثلج ليش تسوي تجميل
1137563871772925952,KW,   بش اب كل صبح 
1138105633654354048,KW,ليش تحطين شدو وايد عالفرشه وبعدين تنفخينها
1138105948902449152,KW,"ليش تحطين خطين كونتور الخشم يمين ويسار
وتدمجين ويصير كله بقعه بنيه"
1138142190557945984,KW,"انزين صج صج

تحطين ميك اب العيون
قبل الفاونديشن
وبعدها من تحطين الكونسيلر يروح كله ليشششش"
1138146918125703168,KW, تشدين حيلج تصعدين الكونسيلر لييي فوق 
1139252326609432576,KW,السياره من بعد  دقايق مع الاليه معطرة مبخرة 
1140383244929654784,KW, شكلي بعزمج عندي باول مناسبه تصييييرلج
1141248313884315648,KW," المشكلة مو فيهم في الي سقف طموحاته ما يعدي سقف غرفته

مهندس بال كان اقوى شي قبل  سنين ومن كثر التفلسف
مو بس يتفاخر بمعاشه و وده يبروز هويته يحطها قبل اسمه بالبايو 
حتى لو كان عقود"
1141248718240440448,KW," الحين عقب تكدس الموظفين المهندسين المحامين و المنافسه القويه بينهم
ماصار المهندس اقوى شي
اقوى شي اهوه المميز
الي شغله يميزه ويحط سعره
طبيب عام حاله حال وايد غيره  ولا طبيب اشتغل على نفسه و رسمله خط
و اشتغل تسويق
مو نايم على عمره و يطالع غيره"
1141249208026062848,KW," الشركات  ماراح تدور موظف حكومي ولا حتى كي او سي عشان يسوقون منتجاتهم
راح يدورون مؤثرين
نفس لما يسوون اعلان عند لاعب مثلا
ونروح نركض ناخذ الماركه الي لابسها
ولا الشامبو مال الممثله الفلانيه
وهم تره اعلاناتهم مو ببلاش و مكلفه جدا
ولكن  بهالزمن  الفاشنستا اهيه طريقة التسويق"
1141250343466127360,KW," يمكن انت ما تعجبك  بس هذي شهرتها وتاثيرها ولها قاعدة الجماهير الي يتابعون كل شي تحطه وتسويه
و حتى بدون ما تذكر جم مدخولها بالبرامج  كلنا ندري 
يعني  اعلانات  باليوم كل اعلان مو اقل من  ولا   دك جم بيطلعون بالشهر"
1141285353061527552,KW, احب اكون مخلصه دراسه و مجابله شغلي ما يمنع  ماراح اكتفي بدراستي واطالع دار مداري ويضيق خلقي واحباط نفس صديقك
1141285753764364416,KW,  اييييوا  ما اوافق طريقة حياتهم او الثقافه الي ينشرونها  بس مو نايمين 
1141285927354032000,KW, مافيني شي  اذا عنده كل هذا وهم مو عاجبه بعد هذي سالفه اكبر 
1141286638259179648,KW," احس في فئات مدخولها ما يتكافئ مع جهدها  او صايره كأنها بمكانه اجتماعيه اقل بسبب الماده  الدكاتره واللي بالخفارات والضباط  بس حاليا مثل ما قلتلك الي يدخلهم المدخول مو الحكومه  اهيه شركات خاصه بتمشي تجارتها
طبيعي يكون مدخولهم اكبر من الموظفين الحكوميين وان كانو يستاهلون اكثر"
1143087239364300800,KW, اسم الله ما يبين عليج
1143268132490031232,KW,"جميلة
بس مليقه مليقه مليقه  "
1143268665128837248,KW,احلى ناس بتويتر السعوديين 
1143604380194738176,KW,شيطلع حجاب بو نسفه
1143918047230615552,KW, بس حلو والله ستايله
1143918166063628416,KW, كل عام وانتي بخيييير عمري
1144291590548197376,KW," مادري اذا شايفه   
شوفي حلقتين وحكمي   احسه بيعجبج"
1144607592800559232,KW,الاشباع العاطفي للطفل له علاقه باخلاق ومبادئ الطفل لما يكبر 
1144639466574962816,KW," ماتحسين الشخص المضطهد بطفولته مبادئه بتكون متزعزعه   
مهما يحاول يكون قناعات  يظل الاساس مو مستقر"
1146442014139064448,KW,"يصير شي اذا ماحطيت صورتي خلفية تلفوني  
وخلفية الوتساب"
1147646011814363136,KW, العادي والحلو مقاييس شخصيه تختلف من شخص لثاني حسب شيحب  او التجربه بشكل عام  الاشخاص اللي معاه 
1148536478571683840,KW,مره بيتيت حلو  ريال بيتيت كلش مو حلووووو
1148604309401194368,KW, لا يصور نفسه كيوت وبتيت
1148606079254892416,KW, الله يسلمج هذي ميك اب ارتست احبها  انصدمت يوم عرفت اسمها انوشا نوره
1148606773961666560,KW,  صارلي سنين معاها ماقط يا ببالي اسمها مو نينا
1148932587324432384,KW, يعني شعار ابل مميز
1150648047573057536,KW,في ناس أتعب وأقول اشكثر راقين 
1026501323808796800,KW, اييييييي الحين الحين فهمت
1026578251244859392,KW,"صراحة 


للي يتمنى ردي 


في وايد شغلات ما نقدر نرد عليها لان ماندري شنو بتكون النهايه  
ولكن أغلب الأسئلة المطروحه بصراحه ما اعتقد بالاجابات المعروفه مالتها  باعتقادي الموضوع حيل مكبرينه لاسباب سياسيه نفس ماذكرت بالسؤال   وفي ناس محتاجين هذي الاجابات الواضحه"
1026579637139369984,KW,"وعلى فكرة  تره ماحب افلام الرعب  
ماحب اخاف
ولا احب اخرع روحي"
1026585314696069248,KW, بالضبط   سوالف حريم داثرين
1026592172664082432,KW,"مو مريحه  الجوتي  
مو مريحه  الكعب  
مو مريحه  الشوز   

ماتضبط  ماتضبطططط "
1026596370654871552,KW, يبيله وحده مثلها داخل مخي
1026596952832659584,KW, تلفها يمين يسار فوق تحت مو راكبه كلشششش
1026597778515009536,KW, منو ثقب الاوزون ألوووو 
1026787680703655936,KW,"المهتمين بالتسويق  وزيادة مبيعات الاكاونت وعدد المتابعين  
لا تطوفونها 
 انا مسجله  

يوم السبت "
1026881845106028416,KW,"صراحه


كلميني بعطيج رقمي واكلمج  
بس اذا ماتحبين 
راح اقولج  بالحياة مو ضروري نعيش يا ابيض او اسود  
انتي كنتي اسود  والحين ابيض 
في منطقة وسط رماديه  مريحه حيل تخلين درجة الرمادي الرمادي الي يناسبج "
1026881943735095168,KW,"الرمادي يناسبج انتي  مايناسب احد ثاني
قناعاتج انتي مو قناعات احد ثاني "
1026895942262423552,KW,لما تدري إنك ما بتزيد ولا بتفيد بالعلاقة  اهني بتدري إن العلاقة انتهت صلاحيتها
1027493183645736960,KW,اهداء البوم اليسا  بحذافيره 
1027503979528433664,KW, ايييي بالضبط وفي ناس ماترضى شكلها يبين محتاجه
1027655749349122048,KW, عدم تطابق  فاتورة المطعم مع فاتورة طلبات شنو يعني  اكلم المطعم يقولي المشكله من طلبات 
