id,dialect,text
1169652724964761600,KW,هذا حل الزحمة عندنا 
1169661311778775040,KW,"الله بيقردها عندنا يخلونها تتفرعن و بعدين يجيها طراق يطشر خياسها و يعلمها ان الله حق
اشتكوا عليها و بتنشال و لا بفيدها لا ظهر ولا واسطة "
1169663652775022592,KW,برامج نفس واتس اب و سناب و انستاغرام صارلهم سنين يقدمون خدمات البرنامج بالمجان و للملايين  و وربعنا ينزل برنامج يومين بلاش و بعدين يقولك اشترك و بسعر مبالغ فيه عقلية جشعة نتنه عمرها ما تتعلم فن الانتشار و التسويق
1169707745777524736,KW,"كراسي الملاعب وصخة مغبرة
نظفوا المدرجات قبل المباريات حطوا لوحات توجه الناس الى التنظيف قبل المغادرة
ماتقدر تقعد على الكرسي من وصاخته تحط جريده اخر المباراه يقولك اللي وراك لحظة شوي خل اقرى الخبر
ولا الجريدة طابعة على الدشداشة 

احد دش الملاعب الاوروبيه و شاف الوضعشي مرتب"
1169741708122382336,KW, الله يشافيكم و يشافي كل مريض
1169945394689859584,KW," كل يوم مطلعين قرار
و كل يوم عندهم اقتراح
يا اخي ريحوا عمركم
و منعوا تويتر
مثل الصين مانعه بعض البرامج

ولا تخافون مستوى الحريات ينزل  احنا اصلا نازلين بآخر تقييم لمستوى الحرية و السياحة و بيئة العمل للوافدين
فلا تحاتون ما راح نخسر المراكز الاولى بأي تصنيف منعوه و فكونا"
1162081296224595968,KW,"تقول كأنه واحد طالع الحداق و يقول حق رفيجه ترى اذ ما جبت اليم بنتوهق

هذا تصريح نائب او تحذير من خلل معين في البلد 

بنتوهق احنا متوهقين و خالصين يا حجي "
1162082218325479424,KW, اغلب المقاهي غير مناسبة للاطفال بتاتا ادخنة و شباب لسانهم فالت يا اخي ليش تجيب عيالك مادري شنو يبيهم يتعلمون
1162090654610153472,KW,"كلامك ميه ميه
ردوا عليها حاوروها علقوا على كلامها مو مشكلة
لكن البعض ما يعرفها ولا يدري ليش تكلمت بالموضوع و فسر كلامها على كيفه و اتهمها اتهامات خطيرة و بيرفع عليها قضية 

يواش يواش يا حضرة الملاك التقي النقي

ترى الظلم ظلمات حتى مع الناس اللي نختلف معاهم او ما تعجبنا افكارهم "
1162134195596070912,KW,"اللي يبوق غبي
وين بتروح
صايدينك صايدينك
هذا بالدنيا و غير حساب الاخرة
هم لو يفكرون بالاخرة كان ما باقوا "
1162269061171912704,KW,"   الاخ محمد الذوق بعبر عن وجهه نظر معينة والحوادث اللي ذكرها ممكن تحصل في اي بلد عربي

تصدق و تآمن بالله انا جيت القاهرة بعد الثورة بأسابيع و بعدها جيت مرة ثانية وكنت على كوبري الجلاء جاي من  المطار وقت احداث مسجد رابعة مش سهلة ان حد يشوه السياحة في بلد له معزه خاصه زي مصر"
1162294935867076608,KW,كانتونات كوتات فنايل قمصان هذا الكلام ماخوذ خيره حجي شنو كان وضعكم انت و صفاء في استجواب وزيره الشؤون  سكتم بكتم الحين ليش قرقر واجد 
1162296210297954304,KW," يعني تبون فلان ولد الفقير المسكين  يصير مدير على عيال الحمايل حاشا و كلا
لا مايصير شالسالفه شنو احنا في لوكسمبرغ مثلا"
1162299064559517696,KW,"مطعم تركيايطالي على مارينا بودروم اسمه 

تركيا "
1162305173898899712,KW,لما تقول كلهم يعني اتصور انك جيتنا الكويت وحصلتلك تحرشات كثيره المفروض تشتكي 
1162322417353728000,KW,"في دكتور اعرفه محترم جدا  داش انتحاري على وزارة الصحة
انتقاد بناء و اقتراحات و حلول و صراحة تعور المسؤلين

مابي اذكر اسمه لان اخر مرة مدحت واحد من اللي زاملتهم  بالدراسه لفتره انطرد من الوزارة و عليه حكم قضائي 

ان شالله هذا مو نفس هذاك اللي فشلنا"
1162338600576532480,KW,لو انا من اصحاب البيتين على اليمين و اليسار اشتري الشارع الميت من الحكومة و اسكرة كله و افك عمري 
1162339618529906688,KW," لا ما حزرتي
علشان مانعين السيخ  من اقامة صلاة جماعية في سكن خاص بالكويت

خل يخلونهم دام بمكان خاص ولاهو معبد رسمي"
1162341072271532032,KW," 
اتوقع مكان خاص بكيفهم اذا مو مزعجين احد

اذا ما نبيهم المفروض ما ندخلهم البلد مرة وحده
او لما يقدم على الفيزا نقوله
اسمع رفيق دخول كويت اوكي
صلاة بروحك اوكي
صلاة جماعة نو اوكي
"
1162346308415496192,KW,  صحيح بعثت بنفس الرد قبل اشوف ردك
1162347525833142272,KW, البيتين يبون خصوصيه حيث ان بيوتهم على البحر و السكة هذي تفتح المجال للمواطنين الدخول على الشاطيء
1162383878599974912,KW,"   كلك ذوق يا بطل
و حصل خير يا شباب
و يقول المثل ما من محبة الا بعد عداوة و ان شالله دايما محبة و مافي عداوة "
1162473434720477184,KW,يا ملاقة بعض الناس ترى مو كل شي ما يعجبك علبالك ما يعجب غيرك خلهم سافطين شالمشكلة 
1162480988653592576,KW,"والله جرأة و قلة ادب
صج زمن اغبر "
1162489806640832512,KW,"عافسين اسم ام الجبل او المضيق
اسمه 
  "
1162493041879474176,KW," انت شكلك ما كنت موجود بالازمة ولا اي ازمة مرت على البلد
لا تتوهق فيهم ولابطيخ
بكل ازمة الوافد يشيل قشة و يمشي لانهم يدلون طريق المطار و المنافذ البرية 

انت شوف وضع البلد الحين مو حضرتك شايل هم لو صار شي "
1162493768907546624,KW,اللي تارك دراسات الفقر و الجهل و التربية و الصحة و المجاعة و التصحر و بس فالح يعمل دراسات على قدرات الرجل الخارقة وينشرها  حقير 
1162495598119006208,KW,"كانو ياخذون علاوة مشاركة النجاح وكانت توصل  الى  اضعاف الراتب
عطوهم ترقيات على السلم التقني و درجة تساوي درجة رئيس فريق او نائب مدير
و الكويتي ما يحصلها

السياره برادو

السيارة يوكن و في النهاية شنو انجازاتهمالزبدة الكويتي يكرف و يشتغل لكن محارب

الترقيات بالقطارة  واسطة "
1162522197015126016,KW,"مشكلة  المخدرات
ليش ما تتكلم عن الفقر

مشكلة الفقر
ليش مو القروض

مشكله القروض
ليش مو الرواتب

مشكلة الرواتب
ليش مو الصحة

مشكلة الصحة
ليش مو الوافدين

الوافدين
ليش مو الجناسي

الجناسي
الشهادات

الشهادات
الرياضة

الرياضة
توم و جيري

يبونك تتكلم عن كل شي و بوقت واحد اشلون"
1162527478293913600,KW,"في مليون مقطع للاعتداء على المسلمين
مادري ليش ينشرون مقاطع مفبركة"
1162536620056354816,KW,عندنا اخضر او ابيض او احمر 
1162772352616337408,KW,"النائب ما يمثلني
النائب يمثل نفسه
الاخ بعد ما ينجح
يصوت على قوانين و طرح ثقة بكيفه

مرات انصدم لما يصرح مع اوضد اي موضع انت تمثلني طيب اشلون تصرح و تتصرف بكيفك
لازم تشاور الناخبين بكل صغيرة و كبيرة و اذا دهنوا سيرك الحكومة تعطينا نسبة مو كلة بجيبك

ترى نوابنا  مستغفلينا"
1162821618961436672,KW,"انتبه لهذي المعلومة اذا بتروح بودروم
 تفتح  بتحجز فندق في بودروم بيعطيك خيارات منها فنادق في منطقة ياليكافاك
هذي منطقة جميلة فيها مارينا مطاعم محلات مقاهي وتبعد تقزيبا كم عن بودروم
اذا مخطط تقعد في بودروم لا تحجز في ياليكفاك
تركيا "
1162954590796615680,KW,"ما عندك سالفه
روح بلغ عن السرقة
خل يصيدونه
هذا يبوق منك ومن غيرك

بسكم سذاجه "
1162959149921165312,KW,"قابلت شياب قعدتهم ما تنمل
يتكلمون عن قبل و الاحداث التاريخيه و خبرتهم في الحياة ينصحك يشور عليك
 الله يطول باعمارهم 

و قابلت شياب اتفه منهم ما شفت هذيل وين كانوا عايشين تحس انهم من بيئة واطية جدا مافيها ابسط مقومات التربية و السنع"
1162961761693327360,KW,الناس تصدق اي شي اي شي
1162965268567613440,KW,"اعرف كم واحد ما يتصلون الا اذا عندهم شي سلبي بقولونه
الدوام العيال القرض البنيان الخدامه الوزارة 

بس يبون يفرغون ترسبات الزمن في احد

صارلي فتره ما ارد على كل اتصالاتهم مو فاضيلكم عندي اشياء اهم من اني اسمع مشاكلكم بشكل يومي"
1163031063968538624,KW,"  انا بغيت اكحلها و انت عميتها يالحبيب 

على العموم 
سؤالي هو ليش الناس و من ضمنهم اخوانا المصريين  افترضوا ان الموظف من الجنسية المصرية و اخونا عبدالله ماحدد او حتى لمح لاي جنسية محددة"
1163031978779795712,KW,طلبت كوب كابتشينو جابولي هذا شنو هذا بيبي سايز ليش يا شباب  
1163070349724069888,KW,"قصة خيالية تجيب ريتويتات ولايكات و تعليقات بالهبل نفس هبة انا مريض بالسرطان وبموت بعد يومين
و صارلهم  سنين و مازالوا يغردون "
1163112995158921216,KW,"لو سمحتي ممكن اخذ الكرسي هذا

لأ

اي صح انا اسف
 ماشفت جنطتج المصونة قاعدة عليها

ترى اللبس و الكشخه من غير اخلاق و ذوق يخليج يخليك انت و البقرة واحد"
1163121272093577216,KW,تراخيص و عقود الله يبشرج بالخير زين والله طمنتينا 
1163203425863184384,KW,سلامات يالغالي سلامات ما تشوف شر يا يبه و تقوم بالسلامة و مأجور ان شالله 
1163210807011893248,KW, شكله شاري سياره قير عادي و عنده مشكله لما يبدل 
1163213167729815552,KW,"المشكلة مو في دخول الوافدين
المشكله انكم مو شايفين زحمة الشوارع و لا المستشفيات و لا الاسواق و الاماكن العامه
البلد مو جاهزة لاستقبال هذا العدد
طوروا البلد و الخدمات و بعدها دخلوا العدد اللي يعجبكم"
1163226675947200512,KW, قلة ادب مايشوفون الواحد داش مع عياله و اهلة و محتاج جم كرسي زيادة و المطعم مزدحم معلش ضحي شوي وحطي جنطتج بأي مكان مو شرط ان معاليها تقعد معاكم 
1163227643858362368,KW,اخي العزيز لو تقرا بتمعن اللي انا كاتبه بتلقاه مقارب لكلامك  
1163372632273760512,KW,"تخيل نفسك بالسوق تتمشى مع صاحبك تسولفون و يدرعم عليكم واحد ويقولك برفع عليك قضية لانك قلت لصاحبك كذا و كذا يا اخي ونت شكو

هذا ينطبق على معظم اللي يرفعون قضايا بتويتر هذا المفروض ما تدخله ديوانيتك لانه ممكن يرفع عليك قضية لانه يفسر اي كلمه على كيفه"
1163375869307604992,KW,"ترى عيب لما تكون كويتي و تكتب ان الشعب الكويتي كسلان و تعود ياخذ معاش وهو قاعد في البيت 

لو تقوم الصبح نفس الاوادم اللي تشتغل وتكد من فجر الله و تشوف زحمة السيارات كلهم كويتيين رايحيين دواماتهم كان ما قلت هالكلام

ما نختلف ان في فئة غير منتجة لكن لا تعمم على الشعب كله"
1163377695180414976,KW,يا اخي صج انه ملك العود 
1163560231147847680,KW,"بس اسفين
الله يعز الخطوط الجوية الكويتية

مرة دزيت شكوى للكويتية و بمساعدة المضيفين بسبب تغيير الكراسي اللي كنت حاجزها بدون اذني

الشكوى كانت اثبات حالة فقط حتى تنتبه الادارة اذا كان في تلاعب لا سمح الله

لكنهم ما قصروا بعثوا بكتاب اعتذار رسمي للبيت مع هدية
شكرا  "
1163576949542985728,KW," كاتبة من غير زعل 
 بس حبينا نضحك معاج "
1163578022521430016,KW,"بكل قطاعات الدولة
فلان يتقاعد و يردونه بمنصب اعلى لين يموت على مكتبه و لو بيدهم يحنطونه و يقعدونه على الكرسي لكن الحمدلله ان الميت يندفن ولا كان علوم "
1163584049644015616,KW," من فترة طويلة وانا اسمع بهلسنكي بسبب اجتماعات رؤساء الدول و المنظمات الدولية
توقعت سنتر هلسنكي بكون شي مشابه لبرلين او لندن او جنيف

صارتلي فرصة من مده اني اخذ ليلة ترانزيت بهلسنكي
طلعت مدينة صغيرة مو مثل ما تصورت
لكن عجبني منظر البحر المتجمد
اتوقع الطبيعه خارج هلسنكي اجمل"
1163588536433553408,KW,"ياريت بس تنمر
اذا ماعجبه كلام الشخص الاخر اتهمه اتهامات مالها علاقه بكلام الشخص وراح اشتكى عليه "
1163657097785106432,KW,شعوري الداخلي و انا بكمل نومتي و الناس رايحة دواماتها الحين  
1163659908409151488,KW,"يحطلك صورة نفس هذي و يألف عليها قصة عبيطة
و بعدين يقولك انشر تؤجر او ابعثها لعشرة و بتسمع خبر حلو و اذا ما ارسلتها بتصيبك
مصيبة

واتعجب لما يوصلني هذا النوع من  الرسائل من ناس مثقفة و متعلمة "
1163715776089612288,KW,"احنا شعب يهودي

في ناس ما عندها مشكلة تخسر الاف المتعاطفين بس اهم حاجة انها ردت على كم شخص مسيء هذا اذا اساؤا فعلا "
1163721984213225472,KW,"البداية شهر 
يدخل الاب البيت ومعاه طلي ويقول لعيالة الصغار شوفو شنو جايبلكم يفرحون العيال ويسمونة كوكي وكل يوم يوكلونه ويشربونه ويلعبون معاه
النهاية شهر 
 الاب بيذبح الخروف وبتغدا فيه
هذا كان صديقنا يا يبه كيف ناكله
يقولهم الاب عن الخبال ويذبح كوكي
 حال العيال و الام "
1163723843745308672,KW, قواكم الله يالربع و القانون فوق الجميع
1163726661684277248,KW,"اول مرة اسمع بمدارس المستقبل

ذكروا الشباب نظام المقررات
والله كان نظام جميل لكن أسيء استخدامه

يعني ايامنا كانوا ال  بالدفعه الوحدة عددهم بسيط اخر كم سنة نص المدرسة صاروا 

و بعدها عرفنا الاسباب بعض الادارات صارت بطيخه و اولياء الامور شغالين دهان سير "
1163747588669149184,KW,في نواب سابقين  كانت لهم صولات وجولات بالماضي و الحين لا حس ولا خبر
1163749641281843200,KW,"رسالة خطيرة جدا
و تمس جمعية خيرية عملاقة

فلوس الناس ان شالله نار في بطون اللي سرقها "
1163751977945354240,KW,"احنا بس نشارك بالاتراح و وقت الافراح تسقط اسماؤنا سهوا ثكلتكم امهاتكم يا اصدقاء الاتراح

تخيل واحد يدزلك مسج عزا فلان تفكر تحاول تتذكر لا ما تعرفه
تدزله مسج منو حضرتك و منو المتوفي

يقولك افا ما عرفتني انا كنت زميلك بأولى روضه و هذا جدي اللي توفى

روح اذلف زين انت وجدك "
1163753874949386240,KW,"ايام الحراك
كنا مصدقين نفسنا
ندافع عن الحكومة
و بالدوام كانت تدور نقاشات مع زملاءنا المؤيدين للحراك و يطلعون مع المسيرات
كان ردي يا جماعة المطالبات صحيحة لكن الطريقة غلط

بس الحمدلله زملائي يوم ترقوا و صاروا مسؤلين علي عاملوني معاملة حسنة ونسوا اللي صار 

تغريدةلابدمنها"
1163817174466568192,KW,"شكر المسؤل الذي يؤدي عمله يتميز و أمانه واجب حتى وان كان العمل من مسؤليته و  صميم عمله المسؤل يحتاج تشجيع و مسانده

و بعدين يستاهل لانه احسن من المسؤل الثور اللي قاعد و مو راضي يسوي شي"
1163835424546050048,KW,"ليش يستمر
ليش مو خايفين
هل العقوبة غير رادعة "
1163850945148674048,KW,"القصاب عليمي ما يعرف يذبح قالوا الثور ما مات  معجزة 

ما الوم الملاحدة لما يضحكون عليكم"
1163862765251059712,KW,"  ما عليكم زود يالربع
و الله يوفق السمي"
1164103062216171520,KW,"الوزيرة تنفذ خطة الدولة
 ولا تبونها تغير الخطة بكيفها

وجهوا الكلام او الانتقاد للجهة المسؤلة حتى يكون للانتقاد قيمة "
1164109108326424576,KW," هذا مو نقد
النقد لما تكون عندج معلومة موثوقة عني وتنتقديني بسببها مو تتبلين علي

ترى في فرق لما تسئليني الوزيرة تصيرلك

او انت تدافع عن الوزيرة لانها تصيرلك

وبعدين ليش الاستهزاء"
1164176687367688192,KW,ادارة تويتر يدرون بهالقانون 
1164190784251285504,KW," الف مبروك لابراهيم العنزي خلطة النجاح ترى ماهي سرية
عطوا الكفاءات مجال و بتتقدم البلد"
1164196574769143808,KW,"اعرف واحد في مؤسسة حيوية
يقول عينوا علينا مدير
كانت مهمته هدم المؤسسة رأسا هلى عقب
شجع الموظفين على التسيب
وقف اي عقوبة على الموظفين بحجة انة كويتي ما يتعاقب
خربط نظام الترقيات اللي عنده شهاده وللي ماعنده شهاده ياخذون نفس الدرجه
  خدمات المؤسسة صارت الاسوأ على مستوى الخليج"
1164218634841067520,KW,أنا ومتابعيني احس مغصوبين على بعض لا سلام ولا كلام بس نبوق تويتات بعض شرايكم تبوقون هذي بعد
1164219093936934912,KW,انا اقترح انكم تسوون دوري كوت بوسته بين الوزرا و النواب و الفريق اللي يفوز تعطونه سلة ميد 
1164222871822114816,KW,"مع الحكومة قلبا وقالبا في كل خطوة حتى ولو كانت صغيرة باتجاه التنمية ولاصلاح

ليش الناس تتطنز 
لان الناس تشك في مصداقية الحكومة
الحكومة موقاعدة تطبق القوانين
 موقادرة توقف الواسطات اذا ماكانت هي اصلا جزء منها
و ما اتخذت اي اجراء حاسم تجاه مشاكل البلد

اشلون ما تبون الناس تتطنز "
1164249459267710976,KW,"يقول الشاعر المغربي

ياك أجرحي جريت وجاريت
حتى شي ما عزيت فيك
واسيت وعالجت وداويت وترجيت الله يشافيك
أجرحي واليوم اليوم تهديت
انا بالي بيه ولا بيك
أنا جريت وجاريت وعييت وتهديت 

الله يهدك مثل ما انا تهديت هذي من كيسي"
1164250206910722048,KW,"شنو هالمجمع اسمه ماركا و مافيه ولا ماركة

سائحة خليجية نيروبي"
1164327954907840512,KW,"الشخص اللي يكون متهم و مطلوم و بعدين يطلع براءة مو معناته ان نرفع فيه و نصنع منه حكيم و فيلسوف و قدوة
ترى ممكن يكون مظلوم بس خبل"
1164455372586926080,KW,"طيب اذا بناخذ بهذا المبدأ
 احنا جنب بيتنا في براحة و يتجمعون فيها مصبنة و سواق اسيوين
ممكن احوطها و اخذها حقي "
1164667157596319488,KW,"و الشهادات المضروبه اللي عند بعض الموظفين في النفط اشصار عليها

ولا هذي خلاص
عفى الله عما سلف "
1164846734096420864,KW,"في شباب تقولهم سالفه صارتلك يروحون يسولفون فيها كأنها صارلتلهم

مرة قلت حق واحد تصدق كنت قاعد اتريق بنيورك بمطعم علي بابا الهندي اكل جباتي و قيمة
وقفت عند باب المطعم  سيارات سودا نزلوا منها حرس شخصي و نزل اوباما دخل المطعم طلب جباتي وشاي كرك اكل و مشى

اخونا نقلها حرفيا "
1164861337052295168,KW," لا لا الله لا يقوله ثلاث ارباع الدول هذي طايح حظها  دول بمجاهل افريقيا بعضها موموجود على الخريطة
نبي شي مرتب مثل بورا بورا او سيشل يبه راضين بجمايكا "
1164862307392004096,KW,اتوقع لو يقعدون مع بعض بتشوف تحذف طفايات بأول لقاء على فرض ان جميعهم اصلاحيين لكن مافي توافق بينهم 
1164891003746181120,KW,"ليش مطاردات
عطه انذار اول و ثاني ما وقف طلع الرشاش و غرق الطراد باللي عليه "
1164893420361605120,KW,اسمحولي انا ما اتابع اللا  اللي جنب اسمه 
1164899004422991872,KW," لا تخلطون بين قضية آمنة  الخالدي اللي انخطفت من منطقة الصليبية وقتلت و كريمة الباكسانية اللي انخطفت من منطقة خيطان و قتلت
وتم اعدام المتهمين في كلتا القضيتين

وبين القضية التي يذكرها
 اخونا بوحسين"
1164908816204554240,KW, هالزبوط اتوقع  امه للحين تسبحة  و تلبسة صرواله لا يتفلسف وايد
1164917589782540288,KW,"تعال فهم الربع فلوسكم زايدة
مافي احسن من السماعات العادية بووايرات
رخيصة و بدون شحن "
1164922553032462336,KW,"شي عجيب لما كنت صغير  اتعجب من كمية الادوية اللي ياخذها كبار السن

 ومع التقدم في العمر بديت اخذ حبة ورا حبة ثم دخلت مرحلة الامراض المزمنة و الوراثية

اليوم حياتي صارت كلها حبوب
الصبح حبتين
قبل الغدا حبة
بعد الغدا حبتين
بعد العشا حبتين

و الحمد الله على كل حال  "
1165011693312909312,KW,"في ناس ما تعرف الاصول
ياخذ السيارة و يردها البنزين على الصفر
ياخذ منك جهاز و يرده خربان

ياخذ عده سبانات ترجع ناقصه

ماياخذ منك شي
 الا راده وفيه عيب

يا اخي استح شوي"
1165015574575026176,KW," هههههه لما تسلف احد لازم تقول على الفلوس السلام
تعطيها للشخص بنية الهدية

ماتت الناس اللي بترد السلف"
1165031952950452224,KW,"اليخندرو سويتوه فيصل المطيري انتو ما تشبعون من  الكذب

 "
1165110813352505088,KW,"ان شالله بتسمعون اخبار طيبة و بتسركم الاسبوع الجاي

يمكن تضبط معاي "
