id,dialect,text
1177888613754912768,JO,على قد ما سمعت ناس تشكي من وجع الاسنان واللي طاحونته توجعه واللي سنانه ما يقدر ينام من وجعهم بكرا راح اروح ع دكتور الاسنان يكشف عليهم وأنا ما فيني شي بس بشكل وقائي وهيكا
1177891607879790592,JO,  هلا أبو غلا الغالي
1177892078459789312,JO,  عايشه بتصدقش اذا ما في دليل 
1177892677800603648,JO,  هههههههههههه الا اللبن المخيض
1177894756921364480,JO,  توبه بعد هاليوم اذا اغيب
1177908407824797696,JO, هههههههههههه اسكت بس والله لك ثلثين الخاطر
1177909492303978496,JO,"لو افضى  دقائق اكتب قصيده
بس مشكلتي ما افضى"
1177909682708635648,JO, هههههههههههه اللي بالقلب بالقلب 
1177915158980681728,JO, هلا بالذيب هلا بالحشم
1177922514481291264,JO, ع الهولو كمان بطلع ممتاز
1177923350997413888,JO, اسمك مش واضح عشان اضيفك
1177924371224186880,JO,طق الكاسه دق العود 
1177927216518316032,JO,"والله لااخطب اللي على راسها جلال
لو كان مطلبها ثمانين حايل
السالفه دم بها العرق سايل
يابنت دام الدم بعروقنا سال
كل على عقله من الفكر شايل
لكن لو قلت لي المهر بريال
والله فلا أعنز عليك السلايل "
1177929193029586944,JO," وليا خطبت أختار لعيالي الخال
و الدين عندي هو سيد الفضايل"
1177933964553674752,JO, عشان كذا ما رح اتزوج 
1177970594719113216,JO,"  هرج بهرج 
والحكي هذا مستحيل يصير"
1177988038686838784,JO,"وين تنصحوني أقضي الشتويه  

بأي غرفه "
1177989337990008832,JO,"للاسف الاعلامية الكبيرة مبلكيتني 
الإعلامية اللي تكتب  كلمات اربعه منهم خطأ وكلمة صح
راح علي تغريداتها عن المعلم  أكيد شلت بختهم

معالمعلم"
1177989459494817792,JO," هههههههههههه شكله هيك 
وعن الشاحن كمان"
1177989803578740736,JO, لا يزم سولف والله غير تسولف
1177990003336630272,JO,والله النومة جنب بريز كهرباء تسوى النومة جنب كثير ناس 
1177990005878349824,JO,يكفي بريز الكهرباء ماله ريحه 
1177991613534146560,JO, والصور اللي من تصويرها
1177991717284397056,JO, ي هلا ي هلا
1178009219267739648,JO," والله تصرفاتي مش راضي عنها 
كيف اللي اعرفهم"
1178009436507574272,JO," كل اسبوع اداوم يوم عادي يعني
في شي اسمه اجازات مرضيه كمان"
1178011743542550528,JO," اهم شي افلامه حلوه
هو احنا بدنا نناسبه"
1178011826023469056,JO,تدعي ع الحكومة بالاردن 
1178012117884194816,JO,"مين الفئة اللي راح تطلع وتعتصم وتطالب بزيادة رواتب بعد المعلمين  

معالمعلم
اضرابالمعلمين"
1178012585553223680,JO, ترا مو بس انتي عندك ع ال
1178012962126274560,JO, اسكتي يا بنت الحلال لسا ما داومت وصار علي غيابين
1178013599413014528,JO," احا 
هذا طاير مش مهدي"
1178015055536951296,JO,يا لحون العود ولا يا مجارير الربابة  
1178020139398242304,JO, عندي بالفيس بس مشتاقلك والله
1178030444895444992,JO, الله ينور قلبك يالحبيب
1178045395051655168,JO,والله انت اللي يا بختك 
1178046178044366848,JO,نامت عيون الناس وعيوني عيت تنام 
1178048690273050624,JO,اخ بس لو صوتي حلو
1178053073085849600,JO,مو حرام هيك سهرانين بدون فعاليات 
1178056002786213888,JO,مع مين بتحكي بس ما تلاقي حدا تحكي معه
1178056041340264448,JO,عيونك الحلوه وش مسهرها
1178064325589770240,JO," خله مثل ما جاني يروح عني 
والكل منا اليوم ياخذ مساره"
1178070663489314816,JO," نامت عيون الناس الا عيوني
هالناس حبو والا انا بس حبيت
مرات اقول شلون عايش بدوني
مرات اقول اني بشوقي تماديت"
1178078740129222912,JO,شفتوا بس آخر ما سوى 
1178079005972586496,JO," ماله حل حظ 
أنا تاركه ع راحته"
1178087559500615680,JO, اكثر من الزيادة اللي عرضتها الحكومة على المعلمين
1178095857012547584,JO,نام نام سوي روحك ما دريت 
1178113870914826240,JO, لعاد ما عندك روح رياضيه 
1178122196683776000,JO,يشوفه نفسه مهمش ومحدرابه يروح يسوي نفسه ملحد عشان يكسب اتنشن وكذا  
1178186949129048064,JO, والله هيني بالمحاضرة وبلعب تركس
1178200609150906368,JO,"احيانا تصيبني نوبات ضحك بدون سبب وبوقت غلط ما بقدر امسك نفسي ساعتها عن الضحك 

وااااهههههههههههههههه وااااههههههههههههههههه"
1178211859591303168,JO, بتعلم منك يا عبدالله والله مشتاقلك
563300442734465024,JO,يعني والله ماهو منطق اضطر اشوف العزا مباشر عقنوات عير التلفزيون الاردني خلو البث مباشر بعدين مقابلات وبرامج 
563311848070463488,JO,كنت احكي  سنه زباله طلعت اللي بعدها ازبل منها
563440515002032128,JO,طول عمري فخوره كوني اردنيه بس هالايام يوم زاد فخري  اضعاف نفسي حد بالشارع يسألني انت من وين عشان احكيله انا من الاردن انا من النشاما
563450946382876672,JO,  نشمي واصيل انشالله بفرحتنا بالنصر احلى قهوه بس قبليها صدر منسف
563451545400770560,JO, هههههههه حقيره ضحكتيني وانا ما بدي اول ضحكه من الصبح  مش طايقه حالي وحياة ربي بحبك
563452204435009600,JO,  يخي غريبه انتانا للمره الثانيه مصممه انه فيكي اشي مش مزبوط ب عقلك يا انك فعلا وسواس خناس اعوذ بالله منكوحده منهم
563460821875830784,JO, ههه والله بستاهلو احسن من ناش كتير جنسناهم عالفاضي
563468714004082688,JO, بالناقص من كلامها المقرف خلي  الواحد مرتاح
563469587832791040,JO,بعترف اني وقحه ولساني طويل مع اللي بستاهل اما نظام اعاملك ب اخلاقي ف لا هاد مش عندي اخلاقي عاليه مع العالي وواطيه مع الواطياستمري ام السوس
563631765256818688,JO,    لما اللي مثلها بحكي لازم تدققي ع كلمه كلمه عشان تشوفي شو القصد
563644466146193408,JO,مين الشيخ اللي بخطب يسعد ربه
563646742445297664,JO,    ايش اللي صح  انه كان رح يموت كلنا كنا عارفين انه رح تكون في حرب كلنا كنا مستعدين
563647578667896832,JO,كل ساعه كل دقيقه بقول خلص اكتر من هيك مستحيل يصير اشي يخليني فخوره اكتر ببلدي وشعبي وكل ساعه وكل دقيقه بصير اشي يخليني أغير رأيي وافتخر اكتر
563648889912168448,JO,    اشي اكيد واخر كلمه بحكيلها ياها الا اذا تفلسفت كمان  كل إناء ينضح بما فيه     
563649092987809792,JO,    يسلم تمك هاد هو الكلام الصح يعني مش ضروري فلسفات زايده خصوصا الان
563697480328417280,JO,    انا نور حبيبتي قصدها عني بس اسمعي خيتي انا مش الدولفين انا البنت الحلوه اللي معو
563899387915403264,JO,عاديلما هالكلمه تصير ردة فعلك لكل شي عم بصير حواليك اعرف انه الوضع صار بخوف
564092301278846976,JO,  اعوذ بالله  شكلو سفاح او مغتصب يا حسرتي عليكي يا يمن
564099536465846272,JO,كفو كفو كفو يا عيالزايد يا صقور  داعسعلىداعش  صقورالاماراتفالاردن
564100922863677440,JO,  يسعد ربه وربي يحميه هذا الشبل من ذاك الأسد
564308366315376640,JO, يا الله كلام في الصمييييم وبالاخر ما برضو  جعلهم عمرهم ما رضيو
564315746776272896,JO,   كنت حاسه انها هي ههههههه يلا كتر خيرها  خليها اتخ معنا شوي   مش غلط هههه
564317235171164160,JO,   ههههههه يا سخام البين عليكي يا جيسي بدها تجيبنا كتاف
564318680771604480,JO, اه والله يا سامر
564319071458443264,JO,  هلا عرفت جورج وسوف لمين غنى في عز الكلام سكت الكلام
564319978652835840,JO,   اقل اشي لص اغنام انا لسه عند رأيي اول ما شفته اول كلمه اجت ببالي اغتصاب وبس
564322476029521920,JO,"الربيعالعربي رئيساليمن 
بقولو كان لص اغنام الله اعلم بس اقل شي شكلو سفاح ومغتصب يعني لص اغنام هاي حكوها عشانها اخف تهمه"
1152977204466393088,JO,   قليل النط كثير الصيد 
1156263274704461824,JO, هههههههههههه يزم يسعد دينك 
1156263418913087488,JO,"تخيلوا اخطب  
طيب وحبيباتي  "
1156264096129589248,JO,بالله عليكوا لا تنزلوا صور مكمورة أو اعزمونا  
1156264303533707264,JO,بتعرفي غابة بن جازي  
1156264394768211968,JO,كل واحد يخلي باله من لغاليغه  
1156264455149359104,JO,  يمكن وجهها ما يساعد
1156264592714211328,JO,"قاعد اسولف ع الخاص مع واحد من بني حسن 
ودي اقول لاخوي اعطيني ملح ليمون قلت له اعطيني بني حسن "
1156270827018555392,JO, ما شاء الله ما شاء الله
1156272174841368576,JO,  كان رنيتي يا بنت الحلال
1156272286900662272,JO,  هههههههههههه أنا مع الخوف غير اليوم رديت ع المنشن
1156282370905059328,JO,أعوذ بالله من ثقيلين الدم
1156318139220672512,JO, سكايكا وين تجي هذه
1156318548656119808,JO," اقلط علي جاي 
شيكاغو مني وغرب"
1156477882987962368,JO, ان صار معك شي ما نقصر
1156531911818457088,JO,"ودي أنام 
ومتأمل أصحى الاقي اهداء جميل  اغنية لخالد عبدالرحمن مثلا  

اشوفكم على خير"
1156590999545798912,JO,  عايشه يا القلب الطيب
1156613047655567360,JO,"ثـريـد  

بالناس اللي تعرفت عليهم من تويتر 
اصحاب واخوان التقينا بسبب تويتر
وأكيد اخذنا صورة في اول مرة التقينا فيها 

أصدقاءتويتر "
1156613081927229440,JO,"بالبداية بالبداية وأول شخص تعرفت عليه ع تويتر في منشن كان ع السريع ع السريع وعرفت انه معي بنفس الجامعة ونفس تخصصي كمان 
الحميدي الغالي ع قلبي والخوي المؤدب المحترم  
جمعتنا الطشات والطلعات والمطل والقعدات الرايقه وبحمد ربي ع معرفتك والله يا أحمد  "
1156613195437629440,JO,"وطبعا الوحداتي المزاجي الرايق الطيب الفخم القطاعة شفته مره وحده ع أمل ارجع اشوفه ويجيني ع الطفيله نغفه أنا واحمد 
الشييييييييخ الشيخ لسا لي عندك منسف والفيديو لسا موجود عندي 
 "
1156613304795709440,JO," الصديق والاخ الشهم الكريم الأصيل عز الرفق والله ويسعد دين تويتر اللي عرفنا عليك ايام وسهرات رمضان ما تنسى 
المهم المهم خليك مجهز حالك في خلطات وبستنى منك الغرض وطلاقه  "
1156613325960163328,JO," أخوي الكبير محمد بيك الضروس واحد من الناس اللي عرفتهم عن طريق تويتر ويا ريت اني عرفته من زمان زماااان بحبك يخوي وبحب قعداتك وسوالفك ونظل نتناقش ونسولف وان شاء الله اشوفك قايد جيش ونفرح بعرسك يا رب 
ودها قعدة مع صاجيه مع موضوع نتناقش فيه  "
1156613336970252288,JO," بعرفش شو اكتب وبقدرش أعبر عن اللي جواتي وللاسف انه ما اخذناس صورة مع بعض  
حبيب القلب أبو غلا الغالي والله كان لقاء طيب بوجود ناس طيبين غانمين 
ولسا بينا موعد ان شاء الله "
1156613438161981440,JO, الشب والخبير الاقتصادي والغطاس الرايق الفهمان المتكتك الكايف حبيب القلب يا محمد عقبال ما نفرح بعرسك وعرسي أنا كمان ووعد حلاقة العرس غير تكون عندك طبعا  
1156620624124624896,JO, راحت علينا شوفتك والله
1156629057880121088,JO, انت معانا ولا علينا
1156633314553409536,JO, ومشاهداته ع السناب ما توصل  
1156633679302725632,JO, احيانا يدفع من جيبته كمان
1156636290827390976,JO, طلعت الصورة لبنت وطلبت مني احذفها 
1156636725680230400,JO,البنات بس يتغزلوا في بعض ع تويتر بس ودك تقرأ وتغمض عيونك 
1156642358894759936,JO," الله يسعدك يالحبيب ويطول بعمرك يا رب
في تحديثات وتطورات جديدة سمعت "
1156643384473325568,JO, مو جو يا رجل
1156643583920869376,JO,شكله الشاي خالي من الحبووووب  
1156647416801701888,JO,"  عبدالله الذيب والخوي الغانم  
انت وكل حويطي والله بالقلب ونعم بالجنوب واهله والله حي بعضنا وخلي الرادار شغال  "
1156648512081334272,JO,"يا الله يالشعور المتعب 
اتحسس من العطور واذا ما تعطرت اتضايق واحب ريحة الكالوينا عنجد انداري"
1156651755968585728,JO," الفكرة براسي من زمان هذا رقم واحد
رقم اثنين مش ع العمر الرئاسة 
رقم  انتي حرمه وأنا زلمه"
1162414658093015040,JO, في كل مره اخت صفاء بتكبري بعيني وعيون والكل وتعطينا دروس في القيم والاخلاق وتعلمينا انه البني آدم في أخلاقه ودينه وتصرفاته وبتحطي ايدك ع الجرح والله
1162414688124231680,JO, بس لو ان حظي مثل خطك
1162414922015432704,JO,شوفوا كيف بآخر  ثانيه ماسكه دموعها وتتنهد ومو قادرة يا حرام وتنفخ بتحسها من جوا ولعت 
1162415007407230976,JO," يسعد قلبه الحج الغالي
والله اني بحبه واجا مره ع المديريه عنا"
1162416006863699968,JO,"خلاصة هالغياب 

اني مشتاق لكم فردا فردا"
1162416702753333248,JO, دقيقه دقيقه هو عنجد في ناس فاقدني 
1162417070501502976,JO, يسعدك ويسعد أمل كمان
1162418282269425664,JO, ينور قلبك يا محترمه 
1162418416722022400,JO, طيب اقسم بالله اني اكتب بالتغريدة وشايفك تنطط قدام الشاشه
1162418588382371840,JO," حبيبي يا محترم
بتفقد احوال الرعيه "
1162419951342370816,JO," صح لسان من قال 
ويمسيك بالخير أبو غلا الغالي "
1162421007921164288,JO, والله انتي الخسرانه يا امرأة 
1162421197692440576,JO,  عنجد شو الهدف من هيك تغريدة
1162425172877565952,JO, هههههههههههه بتعملها انت بتعملها
1162428813193699328,JO," هههههههههههه هلا وغلا رغد 
لا والله اني صاير بسيط 
بسيط ولا مستر سلطع  "
1162430235670908928,JO, هههههههههههه الله يديم الضحكة علينا يا رب 
1162437124953694208,JO,الحين انتوا مثلي قاعدين بالغرفة الجوانية
1162437653020782592,JO,وجنب الشاحن كمان صح
1162439444621864960,JO, نياله اللي قاعد معك أبو بنطلون جينز ازرق
1162444422258278400,JO, محد كنج بوجودك يالذيب 
1162448221609893888,JO," والله انك قلبي 
بس كان عندي تفتيش اداري "
1162458463928238080,JO, لاني مقيد ولاني مفكوك
1162463092741160960,JO," ناسي الاسم بالزبط
بس اتوقع هيك"
1162466198086455296,JO,بكرا بيكون يوم الصراحه العالمي
1162478047729205248,JO, وصيلي ع سته او سبعه
1162478534486458368,JO,اذا ما ذبحت سرب من البعوض ما اعرف أنام
1162479483598901248,JO,وهذا الشي اللي مانعني اني ما اسافر
1162482204917850112,JO,  خليك من خليل عطية وشوف الغرض
1162483664455950336,JO,"  لو سمحتوا أنا زلمه عزابي 
طلعوني من المنشن"
1162490571887456512,JO,هههههههههههه نامت عيون الناس وعيوني عيت تنام
1162490809767354368,JO," تبشر بالجنه مازن الغالي 
عزمني أبو عمر خلص"
1162490989933731840,JO,حطيت راسي على تختي جتني هواجيس يا بختي
1162493727270682624,JO," هلا هلا يما 
الله يصبحك بانوار النبي"
1162495296137510912,JO, الله يسعدك اجيك بالافراح ان شاء الله
1162763434959810560,JO, هيك احنا المهندسين حياتنا صعبه
1162764449893236736,JO, ربي ينور قلبك يالذيب
1162764917591744512,JO,"أنا اللي أقول آمين
آمين آمين آمين  "
1162768425388838912,JO,اتوقع انه الشعور متبادل  
1162770328432652288,JO,ابشر من الاثنين ما تشوف وجهي 
1162770685833437184,JO,ويسعدج يا رب بعد جبدي والله من ذوقج هذا  
1162773330140770304,JO,كيف لو تشوفي اشباهي الخمسطعش  
1162777075717160960,JO,هذا السؤال اللي يكذبوا فيه الشباب دائما  
1162778001479733248,JO, اوك هسا بعمل الها ريتويت
1162780732219113472,JO," أنا اصلا عندي اكثر من حبيبة 
تمويه تمويه"
1177616630014255104,JO, هلا بالحبيب الطيب الغالي
1177620579286958080,JO, والله انت عارف هالشي
1177621021341434112,JO,قصي حاب يقولكم كلمه  
1177621907107188736,JO,"عملتها وتركت تويتر فترة طويلة 

يعني اي شي بعد هيك ممكن اعمله صار عندي حماس اكثر وأكثر سقالله اترك الأردن كلها "
1177623548325765120,JO," يا هلا وغلا 
هلا فيك يالحشمه "
1177623705566007296,JO, الله يسعدك ويمسيك بانوار النبي
1177624195884302336,JO, سواليف حصيده يا رجل
1177628567468941312,JO, لا والله مو عيب
1177628801997709312,JO,لي زمان ما غيرت صورتي بتويتر
1177628803381768192,JO,شكلي راح احط صورة أبو نايف
1177630304158277632,JO, ان شاء الله انك دايما تضحك
1177631089378123776,JO,مل اردني جواته محمد علي بس مو راضي يصحى  
1177635719587782912,JO," هلا وغلا 
هههههههههههه لا والله صاير مسكين ومسالم أنا 
الله يسعد مساك يا رب"
1177636659766185984,JO, هههههههههههه طول عمري مسكين وعلى البركة أنا والمهرة واللبؤة تاكل عشاي 
1177637254686285824,JO, والله يا غالي بدك تتعمق بعيونها
1177637563043139584,JO," والله يا قلبي عيب علي اذا اغيب من يوم وطالع
ودي اظل بوجهك  ساعه"
1177637747902820352,JO,مسكين اللي ما يعرف فتى رحيمه 
1177644593472573440,JO,غلطان مرخص بني عمه
1177649732145094912,JO,"تويتر بهيك وقت ما له طعم 
وين أيام كأس العالم 
ورمضان والعيد 
والتوجيهي 

"
1177665073948643328,JO," هلا بالطيب الغالي
الله يمسيك بانوار النبي"
1148333495871258624,JO,احكوا لصاحب التغريدة اللي تحتي اني احبه 
1148492111509098368,JO, تمردغنا واللي كان كان
1148498207560937600,JO, هههههههههههه والله مشتاقين يا بيك  
1148520639730466816,JO,مو مستاهله ارقص وادبك عشان زبطت بالامتحان صح
1148524892519829632,JO, لارقص ع دوار العيص 
1148542617115906048,JO," 
يسعد ربكي 
هذه الدبكة اللي احبها"
1148595958629961600,JO, شيخ يا دكتور حي الطله
1148697002554920960,JO," هلا باللي علي اقبل
نوره ولا نور القمره"
1148700304017383424,JO, يا غايب عني ترا للبطا لوم
1148704553145131008,JO,التفاهه هالايام سوقها ماشي 
1148704728777469952,JO,يا بنيه قولي لأبوجي قصي راح وخلاني 
1148704949230080000,JO,  عن النسوان اسالني أنا
1148720030835777536,JO," تستاهلي والله ما نوفيك حقك 
بس سالفة التمويه ما اعرف دائما انكشف"
1148952675230330752,JO,ما يصير أعمل بروا تخريج الحين 
1149053879927095168,JO,في ناس يحط نفسه بمواقف بايخه ونرجع نكمل قرايه ع امتحان بكرا 
1149054780251225984,JO,"لو عندي ألف امتحان بكرا 
هذا ما يمنع انه ما أفوت ع تويتر لو شويه 
ياخي احبكم احبكم مو بيدي والله "
1149065591019491200,JO, ممكن حرف الدال بس
1149066459471106048,JO,بعدك عم تخطر على بالي 
1149104236074033152,JO, هنا منور بالسناب منور بكل مكان منور
1149210095286403200,JO,"ماني لاقي ميمز أو ايموجي يعبر عن شكلي بس طلعت من الامتحان وشفت القطاعات يتانقشوا 
واحد بحكي يزم نسيت احط الوحدة بالغرام
الثاني بحكي بروح علي علامتين بالكثير
الثالث بحكي يلا  كويسات 
الرابع طلع وما حكى نهائي
 أنا الرابع "
1149214989649141760,JO,البطيخ ع الريق زاكي
1149218095774519168,JO,أنا ليش بحس جيل ال وطالع كلهم عيال  
1149227971263250432,JO," عادي 
يمكن معه وسطة"
1149229381593776000,JO,ااااااااااااااه ظالم ما ترحم حبيبك 
1149229532727132160,JO,هذه التجربة أنا اللي ادفع لهم بس اجربها 
1149453791021993984,JO,والله ونامت عيون الناس وعيوني عيت تنام
1149453897238482944,JO,"وقت ما في 
ما في وقت"
1149455701191905152,JO,"التايم بهيك وقت بيكون صريح جدا 
كل واحد اللي بقلبه ع تويتر"
1149755243858731008,JO,"  
هذا الشي الوحيد اللي اخذته من سنة بالكيمياء 
القانون العام للغازات بس"
1149787981336760448,JO," كفوك الطيب
وكمان قانون هذا شسمو شارل كأنه"
1149798899898552448,JO, الحرمه اللي تحط ثوم ع الملوخيه الله اعلم باكر شو تسوي كمان
1149803706109571200,JO, تقول انها رحلة مدرسية
1149804189708705792,JO,  صب لها نص كاسه اقول
1149833215118585984,JO,  خذ العرص عامل مشترك بيظل عنك كاذب حسن نصرالله
1149833518027083776,JO," العفو والله
بس الحين كيف ودي امدحك لحالك طيب شو مفرد نساء "
1149965078478934016,JO, أو تطحن حبة شسمو وتحطها عليها
1149969976285114368,JO," خليهم عندك 
وديري بالك عليهم"
1149983607332774016,JO," اشكرك وبارك الله فيك 
أنا لسا اعزب وبحكي من باب المزح"
1150001474262458368,JO, ليش انتوا هيك الشمالات
1150017204500553600,JO,  شيخ من رباك يالغالي 
1150028474264018944,JO, خلاص بقطع فتوى وارجعك
1150030299679657984,JO,  ما يشبه فؤاد نماس 
1150037705184690176,JO," اجبد 
يلعن ابو ام الفخامه والجنتله والمابعرف شو 

يزم انت ماخذ الفخامه خاوه "
1150101436061159424,JO,يا بنية قولي لابوجي قصي راح وخلاني
1150102938506973184,JO,"خلاص عزمت اسافر يا نظر عيني
بروح للمفرق وأرجع لكم ثاني "
1150106911934701568,JO,الحرمة اللي تحط ثومة ع الملوخية 
1150107897227042816,JO," انتي شو عرفك 
قديش علبة النوتيلا الحجم العائلي"
1150113109530615808,JO,   ابو محمد الله يمسيك بالخير يا قرابة 
1150121649670373376,JO,    هههههههههههه حبايب العريني والله
