id,dialect,text
859537346307510272,LY, هههههه معليش أنا من الصبح نقرا في الاسم ايمان توا ركزت لقيته عماد عاشت الاسامي يا سي 
859544652642488320,LY,  المثل يقول ضربوه ف راسه طارن شلايكه
859545922782597120,LY,  هالشعب المسكين اللي يجي يصنفه علي مزاجه و هواه أي مركز دراسات اللي دار دراسة مستفاضة علي ستة مليون ليبي و استنتج ان  ما يستحقو الجنسية 
859634739480866816,LY, قيل عباسيا يوم السفر ياما ردحت فيه
859744296743964672,LY,    الاسلام واضح و قوانين الزواج خاصة في ليبيا يراعي فيها الجانب الشرعي كان بنستنبطو من الدين يلحق بابيه و اللي مش معروف باته حاشاك ينسبوه لأمه
859745073390596096,LY,    قانون غربي مستورد قبل كم عام ما فيش اثارة لهكذا مواضيع بس النشتاء اللي مجندينهم الاحزاب و المنظمات المشبوهة يبو يفرضو عالناس قوانين جديده
859750482226663424,LY, ايه نتكلم عالنسب لأن نعرف ولاد أجانب متزوجين ليبيات تنصلو من نسب أبهاتهم و لا بوهم جابهم و هرب لبلاده دايرين روحهم ليبيين  ناسبين علي خوالهم
859751929018187776,LY, يا أخت نحب نكون واقعي المجتمع قبلي عشان هكي الجنسية ليها علاقة بالنسب لأن احنا مش أمة لما تقولي ليبية يقولو لعيت منو  يذكرو قبيلتك و منطقتك
859754205921333248,LY,لما مغرد أو مغردة تناقش معاش بواقعية يوصل لطريق مسدود و تنعدم حجته ينوض يشتمك و كان ما نزلت لمستواه يديرلك بلوك ما يبي المغردين يشوفو عجزه
859756934517456896,LY, تاخذ قسمها اللي ترضي بيه هي و هلها ليبي و لا أجنبي الليبي اللي يتزوج أجنبية الدولة اللي واخذ منها يعامل حسب قوانينها احنا شورنا قوانين ليبيا
810315202512257024,LY, سيبته و لا مازال
810315697528115200,LY,   ما زال تشكوا من مشاكل عاطفية و لا صار منكم ههههههههه
810322877404876800,LY, هذي آخر مرة معاش ادوسي مش ديمة بنفوت راه   
810332529748275200,LY, نجرو و ما ندرو ههههههه
810336478178017280,LY, لكن عصيدة الميلود ناكل فيها 
810338263852584960,LY, وين هالرومانسيات و المشاعر و الاحاسيس توا ههههههههه
810345244067766272,LY, بلي ما اقدمك قاعد تغرد ههههههه
810347642265944064,LY, الدولار راقي السكر و الدقيق و الدحي بهاديك الحسبة معاش تعبو عالكيك و الشاهي بتاع خالتكم فجره انسو الدلع
810653620102397952,LY, يا سلام وراكم وراكم لين نعرفو مصدرها هههههههه
