id,dialect,text
1103190189667770368,EG,  وعشان منقضيش على مستقبل التعليم في مصر فاحنا هنخليكم وزراء تعليم بالتناوب انتي يوم وهي يوم يبقى يوم اجازة ويوم يروحوا الساعة عشرة
1103242638797475840,EG,  انتي بتاعت الاجازات وتخلي اليوم اللي يعجبك اجازة يا فندم
1103257349052092416,EG, دي غلطتك ومس من حقك تشتكي
1103258285434724352,EG,  هو ماله التلات بس يا جدعان والله يوم محترم وحلو وابن ناس واخدين منه موقف ليه
1103259727134371840,EG,شفت واحد في البلكونة واقف بيتابع المارة  انا مشوفتش المشهد ده من سنة  اكيد في مشكلة في الواي فاي
1103259961910546432,EG, ما تعزميني انتي  انتي اللي كتبتي التويتة الاول يعني واجب عليكي
1103260133881245568,EG, ماره في الشارع اللي هو واقف في بلكونة من بلكوناته
1103264706033303552,EG, هو حل حلو في التعارف لكن برضو يفضل الجواز بطيخة مهما افتكرتي انك عرفتي اللي قدامك لان العشرة حاجة تانية
1103265486308081664,EG,   مالى ارى اليابان سايبة تقدمها العلمي وتكنولوجيتها وروبوتاتها وسلطاتها وبابا غنوجها وراشقة لنا فى منشناتنا
1103265902714384384,EG,    دا منشن بسيط على ما قوسوم مشوفتش انت ايام امجادنا الاولي لما كان بيدخل معانا كوكب اورانس والمشترى والمريخ هييييح كانت ايام
1103266551594135552,EG, انتي بتاخديني على قد عقلي
1103286913602080768,EG,واضح ان حضرتك بتتريق فياريت بلاش تستهزءوا بآلام الناس ممكن تكون شايف الموضوع تافة من وجهة نظرك لكن هو قوي وعنيف بالنسبة للبسكوتة جيب حتة فحم وارسم حواجب وحط نفسك مكانها هتلاقيك متعاطف مع مشكلتها جدا 
1103293342438313984,EG,"الجماعة اللي بيتعصبوا لرأيهم دول مريبين
يعني بيكلمك ويقنعك بوجهة نظره وانت مش مقتنع بس بتقول اه عشان تمشي حالك
هوب يروح يسألك عن رأيك تقوله اقول يعنيبتطلب الامان
يقولك اه طبعا
 فتقول رأي مخالف يروح مهاجمك
طب كنتي بتسألني عن رأيي ليه"
1103299613258329984,EG, المهم انه اتصرف وعمل حاجة مش مهم انها غلط كفاية شرف المحاولة
1103300885340393600,EG,  انتي جواكي روح مناضل لكن انا مش بتاعة فرهدة
1103301109324619776,EG, صوتها حلو بس بحسها مش بتعرف تختار اغانيها كويس
1103304217601732608,EG, يا فندم مش محتاجة ابرر انا اصلا معترفة وماضية على اقوالي
1103320565107052416,EG, يعني زمان كنا نسمع لقيوا طفل ع باب جامع او ملجأ دلوقتي كلهم مرمين في الزبالة ايه الجبروت ده
1103321143702941568,EG, امهات عايزة الشنق والله ربنا ينتقم منهم
1103324533350694784,EG,  هما اصلا كانوا رايقين جدا وهاديين موت  وتحسيهم نايمين بس في هيئة الصاحيين ومن اطيب الناس وانقاهم عشان كده كنت مستحملاهم
1103352048207179776,EG,  اقري الحلقة الثانية من التويتة يا مريوم لانها بتوضح التويتة الاولى مفيش اي مثالية في الموضوع بالعكس دي مشرداهم
1103475413660156032,EG, دي اجمل حاجة هتعمليها كان نفسي اتعلمها من زمان لازم لازم تتعلمي عشان تعلميني
1103476334599257984,EG, ايه الحجات الحلوة دي ماشاء الله تستحقيها وبجدارة
1103477529686487040,EG," دا اجمل جبر خاطر في الدنيا ياسلام لما تفتحي عينك على حاجة جميلة زي دي 
ايه العظمة دي يا ست 
هي كلمات طيبة بسيطة لكن لها عمل السحر"
1103489555418763264,EG," مش دلوقتي بقا في لضامة 
الدنيا بتطور يا اعتدال ومفيش حاجة ملهاش حل انوي بس انتي وادخلي في الموضوع وهتلاقيها مشيت زي السكين في الزبدة ان شاء الله"
1103554284254302208,EG, بس بيبان حتى لو مقولتيش سيماهم في تويتاتهم
1103554970589319168,EG, مانا قلت والله وردودي كلها ما بين ايوا وصح وفعلا وتمام بس هو طلب رأيي قلتله اقول يعني قال اه قولي وبس قلت عينك ما تشوف الا النور
1103555399540768768,EG,  حتى الابلكيشنات زهقوا من قلة اكلك و بتبعتلك نصايح بعد كده هيمسكوكي ويضربوكي
1103555979898179584,EG,  هي الوحيدة اللى لفتت نظري برضو وحاسة انها مفيدة وعايزة اشترك في العرض عشانها
1103557111286587392,EG,  استفسار في محلة برضو وياريت يكون في عروض مثلا اركب انياب وخالب واخد قرون استشعار للولاد هدية مثلا
1103567504679583616,EG,  امال لما يحبوا يكلموكي يخاطبوا مين
1103570014861447168,EG, هو القولون العصبى سارح ع التايم اليومين دول ولا ايه ع كل حال بجانب كل النصايح اللي اتقالت لك لما يكون تاعبك متشربش لبن ولا تاكل اجبان عشان بيتعبوه بزيادة
1103585566233382784,EG, ايوا يا ابني دول اخوات اللبن الانتيم وابعد عن التوتر والاستشارة بعد اسبوع هنا في نفس المنشن وخد تمن الكشف وانت خارج عيب دي اختك صحبتي وحبيبتي
1103585777655693184,EG,  اه ناخدها طبعا دا هي الخير والبركة
1103588633817333760,EG,  البنت بريئة الكيبورد بيكتب من وراها انا شيفاه وهو بيبعت بينما هي بتعمل ساندوتش جبنة في المطبخ
1103621880177660032,EG, لما تخف عشان ياخدك معاه
1103660410870280192,EG,  الافضل تروح محطة رمسيس تحجز من هناك اضمن والحجز بيبتدي قبلها ب  يوم وكل ما يكون بدري يكون افضل عشان تلاقي حجز
1103702415260438400,EG, في ناس كتير عندها عدم رضا وبتعظم مشاكلها برغم انها ممكن تتعايش معاها او في ايدها حلها بس مستسهلة والابتلاءات درجات فعلا مينفعش باي حال من الاحوال اساوي بين فقد البصر او الاصابة بالسرطان بواحده زعلانة انها اتطلقت مثلا  واقول كل واحد عنده ابتلاءه
1103704437539958784,EG,  ياريت تتعلمي الطريقة مظبوطة من صاحبتك السعودية عشان ناخد منك الطريقة لاني شربت قهوة هناك عجبتني جدا ولحد دلوقتي مش ممكن انسى طعمها بس مش عارفة معمولة إزاي
1103895526515236864,EG, اكيد مش مقياسي الشخصي لكن مقاييس عامة متفق عليها بين الناس هي اللى بتحدد درجة ابتلاء كل شخص وعليه اقدر اقول ان فلان او فلانه اللى بتشتكي دي بتدلع او بتنكد على نفسها بحاجة تعتبر منغص من منغصات الحياة اللى ممكن تجاوزها لكنها لا توصل لدرجة الابتلاء
1103903417615900800,EG, بس انتي مش بططساية انتي فرولايه
1103904118777643008,EG, لازم تغيريه واسم خديجة من احب الاسامي لنفسي
1103904669397467136,EG, عرفت هي مين واتفق مع كلامها جدا ربنا يكتبلك الخير دايما يا جميلة
1103916400651821056,EG, ودا كان نفس كلامي من قبل ما اشوف التويتة دي
1103916544927494016,EG, اتفق جدا جدا اصواتهم ملهاش زي
1104011519845634048,EG," جميل جدا ايوا كده 
وقولي الطريقة والمقادير عشان الست الغلبانة دي كانت نفسها تعرف وتكتب اسمها
"
1104011873349976064,EG,  هو كان تحدي مهبب ولميتي الناس علينا ميصحش كده
1104083660993712000,EG, وانتي يعني جبرتي بخاطر اليوم وعملتي فيه شئ مميز هتمشيه مكسور الخاطر
1104083783559643136,EG,  وانا برضو كتبت نور ومطلعليش حاجة
1104083973196652416,EG, ايوا فعلا دا بيحصل
1104106402849718400,EG,"تصويري 
وكل اللي عنده صورة من تصويره بيحبها يحطها تحت التويتة دي
فرجونا ابداعاتكم "
1104108356195807232,EG, دي لازم تكون من تصويرك فعلا حاجة كده اخر رومانسية
1104110025419776000,EG,"  اهو جه اللي يعقدنا 
كله يلم صوره ويروح 
انا بقول امسح التويتة وخلاص
ماشاء الله تبارك الله ابداع"
1104111441462915200,EG,  صور فيها سكينة وتوقعت انه خليج فيه شبه من خليج البحر الاحمر
1104111797559279616,EG,  ليه الشمس بتحبهم للدرجة دي
1104113118035275776,EG,  جايز عشان مفيش موج ولا اي احساس بالحركة هو اللى خلى الصور هادية
1104270345211728000,EG," تعرف ان انا كنت هكتب في اخر التويتة ماعدا الباشمهندس شريف
التويتة دي للناس الغلابة مش الفطاحل 
اهو كل اللي منشنوا بصور هيتعقدوا ومش بعيد يعملولي انفلو"
1104270751539097600,EG, ماشاءالله شكلها جميل ولسه مرسومة طازة انا عايزة من ده يا حزومبل
1104271278830247936,EG,  ماشاء الله مناظر ولا اجمل لا دا انتوا حضراتكم نعملكم تويتة مخصوص للناس البروفيشنالز
1104456146977472384,EG, واشوف الودع واوشوش البطيح ابين زين ابين
1104456652558921600,EG,"  جميل جدا ماشاء الله 
فين البلد الحلوة دي"
1104459220051812352,EG,  هسيبلك تويتر بحاله وهتبقى انتي اللي طفشتيني
1104471565952012416,EG, افتكرت عجبتك جبتيها في شنطتك وحطتيها في ولايتكم
1104471793874669568,EG,  انتي اللي بتيجي بعد مواعيد العمل الرسمية بنكون بنقفل
1104472015463960576,EG,  هنتعلم منهم مؤقتا لحد ما تشوفولنا حد يعلمنا
1104472285027753984,EG," صوري لنا التشيري برضو عشان نشوفه منك اول مرة 
وتبقى انتي متعهد اول حاجة حلوة"
1104472448517459968,EG,  ربنا يسعدكم ويديم عليكم التريض والتصوير
1104472570924011648,EG, ابدعتي صورتيه كأنه بحر فعلا
1104473392005173248,EG, هيسيبوها ويرسموا ع الحيطة برضو وتحدي
1104473711468576768,EG, في ناس بتأجل حياتها كلها وبتنسي تعيش
1104474061919395840,EG, حسب الموقف في ناس بيكون غصب عنها فعلا وفي ناس بتتحجج بالظروف
1104474564602589184,EG,    ايوا فيها طبعا يعني انا هضحك عليكي ومريم اللي طبخاها
1104989133057986560,EG,    كفاية انه يكون فيها بحر عشان تكون صورة جميلة وتصوير جميل دا كفاية أن انتي اللي مصوراها
1104990566721441792,EG, بيبرروا لنفسهم عشان ينيموا ضميرهم
1104990870410018816,EG, انا عندي سبورة اكبر من دي خمس مرات بس الحيطة لها سحر خاص
1104991822537994240,EG, جميلة جدا يا نهي ايه الحجات الحلوة دي طلعتي سهونة
1104992115766018048,EG,  قولها يا ابني دانا حتى صعيدية يعني احسنلك تخافي
1104994209881354240,EG, دي عصارة السنين يا نعومة يا بنتي
1104994605089652736,EG, الكاميرات جابتك بس قالوا مش هيقاضوكي عشان اول سابقة
1097773000907284352,EG, هي حاجة تخوف وتقبض القلب ربنا يبعد عنكم كل سوء يارب
1097773209993314432,EG, مهو اللي بيستحمل دايما بياخد على دماغه
1097785721799233536,EG, الناس دي ايه بالظبط اعوذ بالله المفروض يراجع عقيدته
1097786018252636160,EG, حاشا لله ربنا يرفع قدرك
1097788114318385152,EG,  مش متخيلة التويتة من واحد مفروض انه مسلم
1097788284531625984,EG, مفيش حد غريب بيبعت باسكت شيكولاتة اكيد هو قريب بس هو مش عارف
1097794366205247616,EG,"   قنوات الشرعية اللي بيشفوها مقتنعين فعلا
والسوشيال البلوكات شغاله على ودنه محدش بيشوف الا اللي عايز يشوفه"
1099636079899148416,EG, وهو حد بيحط حاله الحقيقية فعلا يعني
1099705763084288000,EG,"  لا دي مؤامرة بقا انتي مشاركة ب  الف
وانا  الف 
واوشا ب  الف تويته
وبما ان اكونت اوشا اكبر يبقى حلال عليكي وانا زي ما انا واوشا ياخد اكونتك 
يلا اتنططي وهللي يحيى العدل"
1099706686447730816,EG, جميلة الاغنية دي خلتيني اسمعها وكرت وراها كام اغنية حلوين
1099708527155863552,EG, اه جدا وصوته واحساسه روعه
1099708794085482368,EG,"  هو انا اي حد 
ما تشوف كلامك رايح فين وجاي منين يا ريس زنكلوني"
1099708994044813184,EG, أحلام بسيطة كأنه بيتمنى راحة البال
1099709428381692032,EG, ربنا يحققلك كل اللى تتمنيه
1099710196027408384,EG,"  ولحد دلوقتي انا مبفكرش في حاجة 
لو انتوا بتفكروا انصح بعدم التفكير"
1099710775697068032,EG,  من حقبة هات الاكونت ومتكسرش قلب الولية اللي عشمت يرضيك تبات بعدد فلورز قليل وانت على قلبك أااااد كده
1099712743094042624,EG,  وهي دي حاجة تتنسي دا انت لو عملتلنا غسيل مخ بالاريال والبرسيل محناش ناسيين وعجبي
1100047144336138240,EG," انا مش طموحة بالمرة وبعيش اليوم بيومه ومليش اهداف في الحياة ومقصرة دينيا جدا
فاتمنى انهم يكونوا طموحين لهم اهداف ويحققوها مختلطين اجتماعيا في اعمال خيرية ويكونوا ملتزمات"
1100152912641224832,EG," محمد صلاح اتولد واتربى في مصر ولعب فترة فيها وبيتكلم عربي ومسلم ومرتبط بمصر لان اهله هنا فالناس حاسة انه واحد منهم دا غير ان كرة القدم لها جماهيرية عظيمة 
لكن معظم الناس متعرفش مين رامي مالك اصلا وكتير جدا مبيفضلوش الافلام الاجنبية وغالبا هو هيبتدي يتشهر في مصر بعد الاوسكار"
1100234310811086848,EG,"  جمال روحك اللي شافنا بهذا الجمال
ربنا يجعلنا عند حسن ظنك واحبك الله الذي احببتنا فيه 
بس عشان منبقاش خدعناكي احنا مش بالجمال اللي انتي متخيلاه ومبلكين ومتبلكين من نص تويتر 
لزم التنوية "
1100236652272893952,EG, مشفتش ردت فعل سلبية عشان كده مفهمتش قصدك كل المصريين اللي شفتهم كانوا فرحانين وفخورين بيه جدا
1100236815716548608,EG, دا سؤال فيه فخ 
1100237113323413632,EG, هييجي يوم وياخد بعضه كده ويمشي من كتر اللي بنعمله فيه
1100238202789601152,EG, الله المستعان ع كل حال دا مينفيش اني بعتبر نفسي محظوظة بفضل الله وكفاية الدفع المعنوي والتقدير اللي جايلي من أمريكا ده بالدنيا كلها
1100243892514025600,EG, فكرني بحصص الكيميا ايام ثانوي مكنتش بالهرجلة دي بس المدرس كان كل ما يعمل تفاعل يكون الغاز الناتج بيجيب مصيبة ياما بيعمل عقم او بيسبب النعاس او او  ويصر اننا نشمه
1100245417336471552,EG, انا مشفتش الفيلم صحبتي شافته وحكتهولي وقالت يستحق الجايزة وانت لازم تشوف الفيلم وبعدها تحكم
1100246484073828352,EG,احنا مش بتوع فرهده 
1100247280496590848,EG,  القمة ضيقة ومفيهاش غير كرسي واحد
1100247962175897600,EG, انت من ساعة ما بقيت لبناني وسميت نفسك طوني وانت محدش عارف يكلمك
1100248995849560064,EG, هو كان رجل عنده حماس رهيب وكنا نحب نستفزه اي راسب مش في قاع الانبوب ميبقاش راسب فلو في راسب معلق نعمل مش شايفينه وكان يتجنن ويتعصب بطريقة لطيفه
1100666521544810368,EG,"  انا بتصاب من الفرن او الزيت
امي بتقول مثل كده معناه ان الخايبة هي اللي بتتلسع م الفرن كل شويه 
تستريش عليا وتجيبي لي ارشادات ليهم"
1100667738962440192,EG,"  وهو جوجل اتعمل ليه غير للحجات دي
مش العيب اني ابحث عن المعلومة العيب اني هقعد بروطة مش فاهمة حاجة وزي ما قالوا اهالينا زمان من جد وجد ومن زرع حصد
هذا وبالله التوفيق واقول قولي هذا واستغفر الله لي ولكم"
1100668502636154752,EG, احنا مش بتوع الكلام ده
1100675641853255552,EG," مهو هيلف من ايد لايد ويشتري حجات كتير وهيقع في ايد الغني ويعطيني لطفل محتاج يفرح بيا ويشتري حاجة بيحبها 
مفيش اغلى من كده"
1100677163022512000,EG,البلد دي مفيهاش امان في اي مكان الفساد مستفحل فيها وضارب في الجذور واحنا ماشيين فيها بستر ربنا
1100677611812995200,EG, بس اخترت عملة قيمتها عالية عشان لما يروح السوبرماركت يلاقيها بتجيب حجات كتير مش زي الجنية مبقاش يجيب حاجة
1100696973043265536,EG, حمدلله على سلامة اخوك وربنا يرحم اللي ماتوا ويصبر اهلهم
1100706164445273984,EG,  مهي هتقولنا احنا الاتنين
1100721295216517248,EG,  ازاي مجاتش في بالي الفكرة دي انا بحقد عليك يا جنيه دهب انت
1100721644992110592,EG, دول مش هيحترموا نفسهم الا اما المصيبة تكون في بيتهم
1100960324491055232,EG, تسلمي يا جميلة كفيتي ووفيتي ربنا يجعلها بميزان حسناتك ويجازيكي عننا خير
1100975351260479616,EG, هتلسع دا اكيد ومما لا يدع مجال للشك بس هحاول اطبق نصايحك ويارب اعرف
1101063725627379584,EG,  استلام الجايزة امتى لو سمحت وبالكوبون ولا البطاقة الشخصية
