id,dialect,text
1162381543890915328,LY, الكنايس اللي مطرطشه ف شوارع طرابلس و الاجانب الوافدين اللي عبو الساحة الخضرا و ما حولها ف طرابلس أيام العيد و اللي مسميات روحهن فيمنست دايرات زعزاعه  كل يوم فاتحات راس موضوع في احد محاور الجبهة التويترية
1162691845002006528,LY, عن نفسي كذا مرة نمشي الجامع الشيخ يكلم ف الشباب بعد الصلاة عاللبس و بعض التحليقات المخالفه يقوللهم في لباس ما يجوز تلبسوه اصلا و في لباس ما يجوز تصلو بيه لا في الجامع و لا ف البيت يعني البسوه وقت ما فيش صلاة مش ضروري تتقيدو بالبدلة العربية و ما تلبسو الضيق اللي يرسم تفاصيل الجسم
1162702423649148928,LY, مش ضروري النقاب اهم شي الحجاب و اللبس الفضفاض المحتشم اللي يستر الجسم و بعدين المتزوجات جاهن قسمهن و تنقبن لكن البنات اللي ما زال ما جاهن قسم و لبسن النقاب كيف يشوفهن الشباب و ينعجبو بيهن و يخطبوهن و يتزوجوهن و هن منقبات مش معروفه ملامح وجهن يبونا نتزوجو  قطوس ف شكاره ولا شنو
1162704194815635712,LY, كل شاة معلقه من عرقوبها
1162767125662109696,LY, مجتمعاتنا فيها الواسطة و المحسوبية والرشوة هذا ولد سيدي و هذا نسيبي و هذا قريبي وهذا جاري هذا ولد فلان و هذي بنت علان يعني لو يطبقو الحدود الشرعية ح تجي علي راس رقادي الرياح الناس الواصلين والمبحبحين مش ح يوصل فيهم شي زي ما صاير في السعودية
1162825579365838848,LY, الف الف مبروك يا بوعنقود صغير 
1162833843906383872,LY, نبو الزردة بالتوفيق إن شاء الله
1162842592939323392,LY,  ليبيا دولة كبيرة المساحة مترامية الأطراف ما ظنيت زرتي  مدن علي بعضها عشان توصفي وطنا ب  و شعبها أكثر من  مليون فيهم مثقفين و دكاترة و كتاب و شعراء ووو الخ وفيهم  ما ظنيت تعرفي  نفر علي بعضهم  فخليكي ف جلوتك  شده و تزول علي الوطن والشعب ما يدوم حال
1162854909315878912,LY, حي علي امه حي مين زرقو علينا هالبلاوي ديرو بلاغات سكرو الهايك هذا ما زاد مصايب
1163081183498035200,LY, ناعلي منك يا حبها 
1163449598364540928,LY, هو كلامك صحيح بس الحظ ف جانب الولد اكثر في الواقع شوق شباب ليبيين طلبة و غيرهم سافرو برا و تزوجو أجنبيات رغم وجود الفوارق اللي تفضلتي بيه حضرتك عندنا جار طلع من  لبريطانيا للدراسة تزوج بريطانية من الطبقة البروجوازية و قعد غادي
1163451682933620736,LY, الفريق علي كنه رتبته مش لواء تقريبا كان ما كذبني ربي قبل سقوط النظام علي كنه و مسعود عبدالحفيظ بس من ضباط الجيش في الجنوب اللي عندهم رتبة فريق
1163471794084503552,LY, قبل ما يقلبوهن ثانويات تخصصية  سنين كان في ثانوية عامة زي توا  سنين آخر عام للثانويات العامة دارو دور ثالث للي ما نجحو ف الثاني لأن العام اللي بعده يبو يقلبوهن ثانويات تخصصية تقريبا وقتها احمد إبراهيم كان وزير تعليم توا في اللي يخش معايا نقاش نقوله اسكت انت متخرج من دور ثالث 
1163481760065314816,LY, مزبوط و مراعاة هذي الفوارق و أخذها بعين الاعتبار مهمة لنجاح الحياة الزوجية مستقبلا
1163514658390794240,LY, جعنها ما ولت ريت هالفن و لا الطرب اللي تقدم فيه حسستوني انها ماجدة الرومي و لا جوليا بطرس
1163517424739766272,LY, كانهن مستورات و يعومن ف جلوه بروحهن باهي لكن كان الشط مولي زريبة معيز وضان يرعو في البحر حي علي امه حي
1163561108319493888,LY, يبدو أنك داير صوب و متليع
1163564411006717952,LY, ارسطو قال الإنسان حيوان ناطق 
1166258551184089088,LY, علي حسب العيلة اللي تقدمتلها بس الوقت هذا قليل من يرفض عريس ما يعيبه شي البنات معرمات في البيوت بالهبل وين يجي قسمك تاخذ إن شاء الله
1166260124194934784,LY, نورت تويتر يا حميدة تي وين راحن ايامكم مغردين ال   المغردين الجدد كلو عليكم الجو كله
1166400043508744192,LY, اصبر جميل الصبر كان قدرته راهو الصبر ما كيفه دوا حقاني
1166417163227475968,LY, بيت شعر مش حكمة يا حكيه 
1166423488648876032,LY,"لما بنت تنزل صورة اختها الصغيرة معناها شوفو منتجات عيلتنا انا ما نقدرش انزل صورتي 
منقول "
1166605662392147968,LY, صباح الخبزه و التنور يا ساكن لي 
1167491252549509120,LY, لمن هالغزيل يا ربي  ناعلي منك
1169877323161538560,LY, مهتم ب القطاف و الخراف الزايد
1169882296054210560,LY,  الزواج استقرار و مسؤولية و كفاح كل ما يكون بدري خير كان الظروف تسمح للولد و البنت كان جاها قسم بش يكبرو الصغار معاهم ناس زمان تزوجو بدري هذا ليش احنا لحقنا شفنا جدودنا و جداتنا و قاعدين ابهاتنا و أمهاتنا ف عمر معقول بش يلحقو يشوفو صغارنا كان ربي عطاهم عمر إن شاء الله
1169883106226032640,LY,  المجتمعات اللي الزواج عندهم مش في قائمة الاولويات اصبحو يعانو من الشيخوخة  يعتمدو عالمهاجرين عشان يشغلو مصانعهم
1169886762342109184,LY, تحساب روحك عقلت امالا 
1170245724916916224,LY, يا سكر انت يا 
1170509229800771584,LY,طرابلس منقع الميليشيات ف الترتيب الرابع 
1170733857148211200,LY, هاذوم لا جو هكي لا هكي يقرو كتابين و يتابعو كم صفحة ف مواقع التواصل و يمدو زومهم عالتلفزيون شوي يحسابو روحهم تحضرو انصاف متعلمين جهلهم مركب افكارهم مزيج من عقد نفسية واهواء شخصية و نزوات كان عالليبرالية ولا العلمانية مش ايدلوجيات جديدة موجودة من زمان ف المجتمعات الشرقية و الغربية
1170743564529221632,LY, لما الواحد يعتنق فكر معين عن طريق دراسة و قناعة ويكون ليه مرجعية وطرح افكار مش كيف ما صاير توا طهقة الفيمنست والعلمانية هرطقات نقان سب و شتم و شخصنة يخلو المحتوي و يشدوها فلان صفته نعته يديرو كت تويت للاستعانة بالانصار تكبر العركة يبلكو بعضهم ولا يتربصو ببعض ما فيش حوار افكار بكل
1170768008156983296,LY, طيب فيك اللي تقري علي قد ما تقدري نوعي
1171121003436683264,LY, حتي في مصر داروها قبل
1173132472751730688,LY, صباح الخبزه و التنور
1174414415476736000,LY, سيورك تردي تشربيه كان عزومك مش قوي و ديري بالك كان ضيفوك قهوة ح تضطري تشربي من باب المجاملة لأن كان قلتي ما نشربش فيها بيقولولك نجيبولك حاجة ثانية و انتي عاد ما تبي اتعبيهم و هما ما يبو يحرجوك
1178023578652041216,LY,تجامل الناس علي حساب نفسك تتعب
567750791348645888,LY, كل فشل  تجربه  وكل تجربه نستفيد من الخطأ
569169368929701888,LY,"
مافيه شيء بـ قلبها   ما تقوله  
توصل الموضوع لـ اعلى  المراتب 

يا ضيقة اللي حب وحده  زعوله 
ما تعرف من الحب  إلا المعاتب"
569184578465894400,LY,"حكينا الحكي يمكن يطول 
إختصرهاا وضم يدي في يدييك 

وشوف عيوني يا عيوني ويش تقول 
والله إني يا بعد أبيك"
594977138576629760,LY, من قبل من حيتم سحب الثقه من الثني
602969185124220928,LY, أغلب الليبيين ما عندهم علم بيه
609497377607712768,LY,"ظروفي والياس وفرقاه وطول رجاه وموحه زادن نار غلاه
بعزومي فالنار انطفيوريافي يبرم ويطفي  "
622169895250341888,LY,لو ما سد غلاى نزيدك  نهديلك عمرى في عيدك  
654385135429812224,LY,عزيز ومن حذاي يريد   ايشيل ولمواهيم يقعدن 
818528882626330624,LY,  حتي البنت متاعت العيال ننقرف منها ياااي
863824134412939264,LY, اكادمية شنو لو سمحتي ومكانها وين
863834564258615296,LY,احساس الفشل لما يقعد جماعي يطمن 
933017820060946432,LY,اطول اتقصر يا عزيز عليا  ايطول الزمان نجيبا نجيبا
934479554697146368,LY,فيه أشخاص لما نكلمهم يضيع شعورنا بين الصحبه والحب  بس نقدر نسميهم راحه نفسيه 
983415488196857984,LY,"زعلهآ  بس متـرقدهش زعلانة مـنك
تعارك معاها  بس مش تسيبها 
أنصحها  بس مش تهزبهآ  
أسمعها  بس مش تقوللها اسكتي 
بكيهآ  بس آعرف كيف تسكتهآ  
لما تكون فرحانة متنكدش عليها 
خليك راجل معاها مش عليها 

"
995663026605916160,LY,"قمة الورطة
إن ترقد بالصالون
وتنوض تلآقي جنبك ضيوف
ماتعرفش تنوض تسلم
ولا إدير روحك ميت
أنا مرة درت روحي بطآنية تمشي"
1001065129688096768,LY, تي عن جد الشورخ هههههههههه
859760412824350720,LY, قالو الصحن الصغير ما يطلع ضروري من الصحن الكبير وين عدا دماغك ما نقصد صحن الأكل راهو نقصد صحن الستلايت 
859761728720076800,LY, مش قصة وطنية يا أخت بس للتوضيح علي تهكمك الليبي لما يتزوج أجنبية الدولة اللي واخذ منها يعامل حسب قوانينها هو وعياله و احنا نتكلمو علي ليبيا
859770025296711680,LY, خلينا واقعيين المجتمع قبلي و جهوي مش أمة زي مصر و غيرها لما تقولي ليبية أو ليبي يقولو لعيت منو تذكر نسبك قبيلتك و أحيانا حتي منطقتك مش دبل
859773978029830144,LY, معناها عولو علي واحد كبير أفضل حتي متوسط يمشي الحال المهم مش صغير بكل
859873553835069440,LY,  لا ما ينفع يتنكرو لابهاتهم و يتنصلو منهم ياخذو جنسية أمهم هي مش ضربة حظ و لا قرعه كل واحد ياخذ جنسية بوه زي قبل و يا دار ما دخلك شر
859875883997425664,LY,  توا ماشيين بقوانين النظام السابق و الاعلان الدستوري بتاع المجلس الانتقالي و كل  مجموعة يديرو اللي يبوه نتكلمو علي مسودة الدستور القادم
859886700784386048,LY,الواحد لازم يبدا منصف و يقول الحق حتي في عدوه و ما يكذب علي حد و يتبلي عليه لأنه حاقد عليه أو كارهه أو متعارك معاه و ما يكون فاجر في الخصومة
860220098719739904,LY,    لينا ثلاثة أيام نرغو و نزبدو في الموضوع هذا اللي عندي قلته ياسرها تقدر تراجع المنشنات مع المغردين لأنك تؤول ف كلامي غلط و تحرف فيه  تحياتي
860223273996607488,LY,اللي زمان رافضين مزدوجي الجنسية و سموهم دبل شفرة نفسهم توا يبو الدولة الليبية تعطي الجنسية لولاد الليبيات المتزوجات من أجانب تناقض
860293771199643648,LY, اخص عليك يا بنغلا ههههههههه
860705529978638336,LY,   كالعادة للأسف واحد يقتل شخص ينوضو هله بيردو الثار يصير قتل عالهوية تنوض فتنة يمشي فيها الظالم و المظلوم و يمشي فيها ناس ابرياء ما ليهم علاقة
861015478747226112,LY, يا شماتة أبلة ظاظا فيكي 
861297019415035904,LY,نفخوها بالجنسية الليبية زي قلتها وووغيره من هرطقات جلد الذات راهو البلاد مش في فوضي من الأزل مرحلة و تعدي نعتز بليبيا في الشدة و الرخاء
861630915214278656,LY,انت عارف و أنا عارف 
862463575792734208,LY,نوم القايله الطويل للعشية يخرب عليك نوم الليل لذلك حاول تاخذ غفوة عالخفيف في النهار عشان ما تقعد سهران في الليل و تنوض الصبح تاعب و متكدر
862464492470497280,LY,طبعا نحكي عن تجربة و العرب الاوله قالو انشد مجرب و لا تنشد طبيب 
863381457485647872,LY,و بدا موال الضي اربطو الأحزمة قبل الشهر الكريم
865478501389942784,LY,تعازينا لأهلنا في براكالشاطي انا لله و انا اليه لراجعون  عزانا واحد يا أهل فزان
866134936557957120,LY,القطاف و الخراف الزايد ما يمشي الحال لز الهايك من فزان لا قوة تالفه لا نم احرف يمشو يولو علي تالياتهم من وين جو  الجنوب يشقو بيه أهله
875161245271371776,LY,مرات واجد تبدا واخذ صورة سلبية عن بعض الناس لأنك سمعت من فلان و لا علان يتكلم عليهم بالسو لين تتعرف عليهم و تخالطهم تلقاهم ناس خيره يعجبوك
927323422044106752,LY, أي حرب هو انت لسه شفت حاجه
927375933379620864,LY,العار اللي صار و قاعد يصير من  لا صار في العهد الجماهيري و لا في العهد الملكي خوذ و لا خلي
927702567437701248,LY, بالجوده بيك  آهو مشاغل الدنيا
927703767696510976,LY,  آهو نجري علي أيامي  ليا وحشه امالا
927704447282765824,LY,  ايح هلال عيد مره وحده ناعلي وخلاص  هلال عيد قرعة الهالوين 
927729032405372800,LY,أيام ينذكرن و ما ينعادن  
928919195399671808,LY,مرحلة انتقالية من  و ما فيش دستور مستفتي عليه الشعب و منتخبين رئيس و لا حكومة و لا برلمان  أجسام مؤقتة مبعثرة في طول البلاد و عرضها و اللي هذا يجي يصدر في قرارات مش مدروسه مرة متعاقدين مع شركات و مرة طابعين عملة جديدة و اليوم رافعين سن التقاعد من  ل   يرفسو و ماشين
929353155997065216,LY,اللي مات في حرب البسوس مات علي روحه الزير سالم و جساس مصورين سيلفي  
931954989794250752,LY, ما هو أكبر طموح للمرأة الشرقية ايجاد رجل تتزوجه و أكبر هواجسها ان توصف بالعنوسة  في عالم آخر النسوة يفتخرن بكونهن مفكرات طيارات طبيبات و عندنا اللي يتكلمو فيها تجي تفشك علي بنات الناس اللي ما زال ما جاهن قسم
931961761330270208,LY,بعد كل هالدم اللي وصل للركب ما زال في اللي يطلع علينا في الشاشات و يقول ما عندنا مشكلة في اشراك رموز النظام السابق الذين  لم تتلطخ أيديهم بالدماء  في العملية السياسية  كان رجال النظام السابق موسخة ايديهم بالدم معناها رجالات فبراير ما تلقي وين تحط ايدك تي يعومو فيه الدم
932155863409753984,LY, تي نطي حتي من البلكونه من شادك 
932326834473140224,LY,  اللي قلتيه موجود و عقلية التزمت موجودة بس ما ينطبق عالكل و توا يفرق عن قبل مثلا جيل امهاتنا كم وحدة متخرجة من جامعة و عندها وظيفة توا الخريجات و الموظفات أكثر الموضوع ليه كذا جانب و مش عيب انها تحلم تتزوج بس قصدي مش تخلي هدفها في الحياة الزواج بس و يكون كل همها في الدنيا راجل
932575851513831424,LY,  انتي تأولي ف كلامي غلط و تحرفي فيه تكلمت عالتعليم و العمل اذا استطاعت اليه سبيلا حسب البيئة و المحيط و العائلة اللي تعيش فيه مش التحرر السلبي اللي تكلمتي عليه و قصة ان تبي تصبح ربة منزل و تهتم بعيالها بدل العمل هذا يرجع ليها و لزوجها كيف يتفقو يمشو أمور حوشهم لأن في أزواج يتعاونو
932604140567564416,LY,  باهي توا سناء يوسف محيدلي اللي زمان قرينا عنها و قادت سيارة مفخخة فيها أطنان من المواد المتفجرة و استهدفت تجمعا للجيش للاسرائيلي و فجرتها وسطهم نعتبروها مناضلة و فدائية عربية و لا انتحارية و لا شنو 
932607986203324416,LY,  في كتاب للثقافة الاسلامية سنة ثالثة علوم اجتماعية متداول هاليومين في  مواقع التواصل في احدي صفحاته مكتوب اللي يفجرو ف روحهم عشان قتل عدو و لا  القضاء علي معسكر للعدو و لا فتح ثغرة في تحصيناته ما يعتبرو منتحرين بل  شهداء  السؤال اللي نبي نسأله هو التالي يتبع
932608213270352000,LY,   سناء يوسف محيدلي اللي زمان قرينا عنها و قادت سيارة مفخخة فيها  أطنان من المواد المتفجرة و استهدفت تجمعا للجيش للاسرائيلي و فجرتها وسطهم  نعتبروها مناضلة و فدائية عربية و لا انتحارية و لا شنو 
932880201360473984,LY,حاولت نسمع لأغاني فيروز عالصبح ما قدرت حسيت راسي بيصدع غيرت موجة راديو السيارة 
932896714318647168,LY, عن جد التشبيه عصاير يا راجل
933133031023321216,LY,  باهي توا السؤال اللي يطرح نفسه سناء يوسف محيدلي اللي زمان قرينا عنها و  قادت سيارة مفخخة فيها أطنان من المواد المتفجرة و استهدفت تجمعا للجيش  الاسرائيلي و فجرتها وسطهم نعتبروها مناضلة و فدائية عربية و لا استشهادية و لا انتحارية و لا شنو 
933324440070443008,LY, و لا بيرفعوه عاليوتيوب شكله موضوعهم ما صار منه لأننا كنا لهم بالمرصاد  قوللهم ان عدتم عدنا   يعيش أنصار الفكر المتزمت 
933327629419196416,LY, مش عنصرية علي فكرة أنا ممكن أكثر من خالط الأجانب من مختلف الجنسيات و الفئات لأن زمان قبل ما ينتشرن مواقع التواصل و الكروت الدولية كنت في تشاركية اتصالات دولية و تعاملت مع الأجانب عن قرب و خذيت و عطيت معاهم و عندي أصحاب أجانب لعند اليوم نتواصل معاهم
933331112750997632,LY, وضحت موقفي و مخاوفي مسبقا بس قوانين زي هكي مفروض بعد فترة من الاستقرار و الرخاء الاجتماعي أفضل توا حاليا أنا ضد حتي الليبيين اللي يتزوجو أجنبيات لأن ح يكون علي حساب الليبيات و نسبة العنوسة ف ارتفاع المفروض يفرض قانون  سنوات عالأقل ما حد يتزوج أجنبية بش نحلو هالمعضلة الاجتماعية
933426081520111616,LY,تويتر كان يديرو ميزة يقدر الواحد كيف يشوف تغريداته القديمة زي خاصية ذكريات فيسبوك عشان الواحد يقدر يمسح التغريدات الغبية و التخريف و الخزعبلات اللي كاتبهن قبل سنة فاتو  
933427328138579968,LY, أنا معاش نزربح زي قبل الهاردسكات بدن بهاذيكا الحسبة عندي زوز قريب يتعبن الافلام القوية اللي تستاهل انزل بصيغة  و اللي غير هكي  بش كان جا فيلم تجاري غير هكي نحذفه طول بأقل الخساير
933486616630431616,LY, قصدك البنت هذي كلمة فر مش حلوة ف حقها البريئة
933497122992918400,LY, أنا في الليل قبل ما نرقد نبدا التحميل و نولع اي مقطع صوتي عندي في اللابتوب علي مشغل ويندوز ميديا بلاير و نخليه علي وضع التكرار و نكتم الصوت بش ما يقعد وضع سبات انوض الصبح نلقاه متحمل لأن الليل تالي يقوي النت جربي بالك يمشي معاك
933497661600223232,LY, الطريقة هذي مملة و صعبة لازم شركة تويتر اضيف خاصية زي هكي بطرق ميسرة
933504849102155776,LY, الواحد لازم يعرف يحذف و يعدل لأن الافكار و الآراء تتغير
933993208996122624,LY,واحد جهوي مغرد ليش ما فيش أسواق بيع عبيد في مشرق و بلا بلا بلا طلعله جهوي غرباوي قاله حتي انتم زمان تبيعو في البنغلا و بلا بلا بلا  العالم طالعين مظاهرات و حرق اعلام و بيانات استنكار ضد لـــــــيــــبـــيا و كان بياخذ اجراءات بالخصوص برضو ضد لــــــبــــــــيــــــا
933997083673100416,LY,  لما أطلق سراحهم كان في دولة و استخبارات اتابع و ما قدرو يقومو بأي نشاط يعني النظام ضامنهم بس ركبو موجة الثورة الوهمية تي لما قالولهم اركحوا نشوفو مطالبكم في ناس قالو ما نبوش فلوس نبو قطاعين الروس و لما سيرولهم قافلة حملت أغصان الزيتون للمصالحة رفضو رمو فيها و ردوها
933998124808458240,LY,  و الانتقالي بتاع بوشنه رفضو التفاوض و حطو شرط مسبق مغادرة معمر القذافي و ابنائه من ليبيا مستقوين بالناتو و الدعم الخارجي وقتها و بعدها صار اللي صار ياسر تعليق شماعات عالنظام اللي هناك ف الطبق
934000418090377216,LY, معناها هذي سقطات و بنعاودو نمشو ان شاء الله
934014566207455232,LY,  عليك صحة وجه ليه قداش عام في دهاليز السياسة والدبلوماسية و تجارب دولية عاشهن و يفترض ان يعرف اللي فوق و تحت الطاولة و ما يحاك في الخفاء يكون عنده بعد نظر و حنكة و ان لوبيات الرأسمالية العالمية عندهم تاريخ استعماري و ثارات مع معمر مش ح يجو لحماية المدنيين و يروحو ف حالهم
934041068697419776,LY, خطرها معظم مسؤولي النظام السابق هلهم و ناسهم و مناطقهم يشكرو فيهم محصلين منفعة و مصالح و واسطه و تعيينات و لاهفين فلوس من الدولة من وراهم لما كانو يخدمو في الدولة  لما نمشو نزردو ف قبرعون نمرو بقرية شلقم الغريفة  ما تلقي حاط فيها بلكه و قليل جدا من يشكر فيه مش نزاهة منه طبعا
934362444641853440,LY, هذا جو قروب الفيسبوك ما يمشي ف تويتر
934372166782595200,LY,قصدي من كم سنة قاتو 
