id,dialect,text
1077213046903324800,QA,  تغريدة غبيه من شخص غبي ايران داعستكم ماتمشون الا بدعس
1079397033205817216,QA,  العلم واضح مير ماودكم فيه
1080592295089660032,QA,  تافهه و غيرة حريم الله يكفينا شرها
1080593199150833664,QA,  لو شاف فيه خير ما كان نابح يبي العنابي 
1081581046267814016,QA,   الاقربون اولى بكلامك ف جده كل ساقط ولاقط فيها نظفها من الاسيويين المجنسين وبقايا الحجاج واتوقع انت منهم قبيلتك ليست من الخليج بالاصل روح لديرتك واترك الخليج لاهل الخليج  ابتلينا بالخليج بناس امثالك قعد كم سنة وعد نفسه منا وهو لو يجلس مليون سنه ينعرف انه دخيييل 
1082944821470216192,QA,  لوسمحتي مدخل القانون ما يسجل عندي لازم 
1084186644062920832,QA, واحنا ليش برا الموضوع 
1085250180918722560,QA,   داعس عليش وعلى معزبش ياطراره
1086042902512455552,QA, انتم حوثي مجننكم موريكم الويل له سنوات وموصل صواريخه للرياض والا تدري اسمح لك تهايط بانتصارات وهميه هذا حدك 
1086049040402472960,QA,  ياحمار نطالب بفك الحصار مو عشان وجيهكم الوصخه عشان بيت الله وعشان الاسر المشتركه والا انتم فرقاكم عيد يو اندر استاند
1086055678161158016,QA,  الحصار وقع على قطر في شهر فضيل من دول جيران  وبشكل مفاجى وبدون اسباب مقنعه  وبغير وجهه حق يحق لنا المطالبه بالتعويض على غدركم وعلى فبركات النيه منها تشويه سمعة قطر
1086059946662379648,QA,  عساك ماتشوفه الخير شكرا
1088823534879686784,QA, مستحيل تكمل جميلك لازم تخربها 
1088843162800537600,QA,  الله لايبارك فيك يا حمار
1088992896613867648,QA,  تبطي منت شايف العنابي خلك منبوذ فالسعودية 
1090294278323081216,QA,  حطها ف خشمك ياقليل الاصل
1090296337835454464,QA,  ميت قهر صح عسسى 
1090299460612251648,QA, موتي قهر  دعسناهم و دعسانكم فيها
1090463468149452800,QA, اذا كنت راعي حق شوف نعالات الجمهور الهمجي مفروض بعد تعلق وماترضى بلي صار  يا كعب ايفانكا
1090463756717564032,QA,  انت بالاول شوف البلا الي عندكم عقبه علق و انتقد العالم عشتوو عشنا وشفنا 
1090692560568360960,QA,  راح يجيك مسج الايداع 
1090700998706974848,QA,   تاج على راسي تخسيي ما احط فوق راسي حيوانات  يلا قدم الولاء والطاعه ياعبد
1090915067909025792,QA,  لو سمحتو ارحمو الطلاب ترا يوم من الأيام كنتم نفسهم  مايسوى علينا ينقطع نفسي وانا اركض للمحاضره 
1090929020005433216,QA,  معليش الالفاظ مرره خايسه بس قهروني
1091343791695544448,QA, ليفاندو اذا خذنا الكاس العشا عليك
1091353154829148160,QA, خلاص لا تغرد قاعده ادرس وتركيزي تشتت معاك ومع المباراه  ومع الكتاب 
1091356817165377536,QA, يهود مو غريبه عليكم لكن ابلع قولين 
1091380432329945216,QA, ايي والله عمان ما يجي منها الا كل خير
1091421275610849152,QA, لو سمحتو لا تحطون عينكم عليه هذا حقنا 
1091421524014305152,QA, ارجوك اتفل عليه لا تصكه عين نبيه 
1091421747696545792,QA, بعدد انت ختمت على حقوتنا 
1091449989342154752,QA,  ياكبرها عند الله يشتتون شملك  اذكري  ربش يا مره 
1091683439932305408,QA,  ماحنا بحاجتك  يعني الكويتيين مو بحاجته ريال سعودي والا ريال  قطري  لادافع هذا المطلوب بيض الله وجهك 
1091685329294246016,QA,  انت شفيك تدور سوالف 
1091997930758856832,QA,   انت وخزامى على شحم يعني بتأثر انا   تعرف الشحم يو نو شحم 
1091999298949185536,QA,      بابا رحيمان امسك كلابك ازعجونا لهدرجة منقهرين من قطر  والا من  والا من  حددو وش الي معور قلبكم 
1092169424386342784,QA,  الله يرحمه ويصبر قلب ابوه وامه 
1092292529838534784,QA,   خايف تقول حق عشان حكومتك انا عارفه وضعك المزري الله يفك عوقك وتصير حر 
1092296785786294400,QA,   لاتنسى بس تزيد الكيله في مدح بن زايد  عشان عيشتك الصعببه تزين يا مذلول
1092297627868299264,QA,   اهم شيء شد حيلك ومحد بيلومك لانكم ضعوف 
1092298401641832448,QA,   مو شايف الحيوانات الي جنبها ولا فصيلتك غير عن فصيلتهم  
1092298849933234176,QA,   داعس على خشومكم و موريكم الويل مخلي معزبكم يتصل فيه شخصيا شكلك كنت خارج التغطيه  انتو تلاقونها من الحوثي الي موصل الصواريخ العاصمه والا من التركي مدعوسين من كل الجهات 
1092522210911228032,QA,  انزين يا مستحمر شايف صحيفتك وش كاتبه والا انت ماعندك عين يعلك العمى
1092686354981535616,QA,   شيخ انت خلك فالثلاجات ابرك لك وشيل المتابعه لو سمحت 
1095273525848559616,QA,  لانه مايجي منكم الا المرض يا شحاتيين
1095354821052379136,QA,    خايف تقول شيخكم وينه يا شمرر افااا بس 
1095378039230381952,QA,    وين بالرياض تحت الارض والا فوق الارض  ترا تختلف خلوه يرجع يكمل دراسته والا تحت الاقامة الجبريه
1095639387336032384,QA,    اعطيك الي تبيه مقابل انك تصوره لي صورره حصريه
1095658038881644416,QA,    اهاا نواف ورى الشجره يمكن 
1096022702199054336,QA,  عطنا  تصريح واحد من حكومتك تقول انه قطر دعمت الحوثيين عقبه بيجاوبك
1096065285457620992,QA,   ترا اتكلم جد لا تجيب لي كلام ناس من السوشل ميديا بدون اثبات و أدلة  اقل شيء طلبت تصريح من جهة حكومية مختصة من دولتك تفيد بأن قطر دعمت هالفئة
1096231683660148736,QA,  انت خلك ف الشعر يا مال العمى ماباقي الا الناقصين يتفلسفون على روسنا
1096409895191105536,QA, جوابي انك قليل اصل يالعتيبي
1097538130805211136,QA, الناس صار عندها تضارب فالمشاعر مايدرون مزح ولا جد 
1097601506289897600,QA, لانه معجبينها شيبان حطوها معليش هذي الحقيقه
1098467179622776832,QA,  السعودية اذا ما دافعت ف حرب الخليج صدام بيستحل الخليج بكبره 
1098496057267421184,QA,  ياختي بعد في نقطه  حرام السواق يزهق و يموت حر والا تضربه الشمس وهو فالسياره ارحمهم  وصار في نفس التعاون بيني وبينهم اذا يبي يطلع يقول تعالي اخذي المكان 
1098496284300886016,QA,  الله يهديك ترا السعودية هي الي جنب الكويت يعني بالعقل اذا اخذ الكويت عقبها السعوديه على طول 
1098657333289332736,QA,   و جندي سعودي الي استشهدو من يومين دمهم مايعنيلك شيء انت لو فيك ذرة رجولة ما تتسدح على التويتر تروح الحد وتدافع عن ارضك
1098658659763142784,QA,   عيل فهم خويك الي ينكر وانت لا تسوي فيها مستهين
1098660288306601984,QA,   شوف بخصوص نقطة الخيانة  اذا انت رجال تطلع لي تصريح واحد  بسسسس من حكومتك تقول فيه احنا خونه و دعمنا الحوثي 
1098660686304022400,QA,   ما جبرتك ترد علي  
1044058749663682560,QA,  وانتو مثل الحمير كل شيء قطيتوه على قطر
1044337827742388224,QA,  اسمك مو ابو جود ابو حمار 
1044430361625808768,QA, انت فاهم قصدي عدل واذا مو فاهم ادعي ربك يريك الحق
1044431757003681792,QA, ظهر وبان الي يبغاه المزروعي من سنوات  والا وين بن نايف و  وين متعب  الافضل  تقول الله ينتقم من كل ظالم ومن كل شخص يعرف الحق وساكت 
1044744316864934016,QA,    خله يغرد باقي مادفع  فاتورة كهرب 
1045797587679432832,QA,  انزين لايوقف قلبك وانت تمدح شوي شوي 
1045805448367083648,QA,  الخاين مكانه عندكم مو دعمتوهم خلاص خذوهم وعيشوهم وانتم اصلا يالله تعيشون اهل الديره حتى تعيشونهم 
1045812302514188416,QA,   ليش حارقه كبودكم تركيا دولة مسلمه وبينا وبينهم عهود ومواثيق ولم تخطط لغزونا نفس دولتك الغداره الغبيه الكلبه
1045813592237506560,QA,  هاا يعقب ويخسي عزمي و شيخنا تميم بن حمد يلا بتكون معاي 
1046205364298010624,QA,     اهم شيء عرفت اني اقصد مبس  
1047197175359393792,QA, والله وتالله وبالله لو يوصلونها لاخر الدنيا  قطر مالها الا بوحمد
1047250858369532032,QA, هذا يطبل بشكل مو طبيعي يضحك
1047255347185033216,QA,  انت امير  اي درجة الرابعة والا تركي نزلك الخامسة 
1047345320143835136,QA,  انا مو هيئة الترفيه حتى تجي تغني عندي
1047717128235880448,QA, عطه الف يقلب لك على امه وابوه وجماعته
1048215932571717632,QA,   الدب الداشر و سلمان شوضعهم مع ما شرشحكم ترامب طبعاا تاكلون تبن ما تردون
1048936587722194944,QA, يالهاجري ليتك ساكت والله ارودغان اشرف من أشكالكم مو طبعه الغدر مثل الي خبري خبرك 
1048950374323949568,QA,  الشبك الي معيشك فيه الدب الداشر  ومخليك ذبابه عشان تسدد فاتورة كهرب الله لايبلانا
1048965498241728384,QA,  اذا انا طفله فالابتدائي الاكيد انت بالروضة الصواريخ وصلت ويوميا تجيكم  ومافي اي رد لها هل هو خوف   وايران لاعبه فيكم لعب و ترامب مشرشحكم روحو انتحرو ابرك 
1048978676300300416,QA,  الصحف العالمية كلها مصخرتكم ومصخرة مبس وبشكل يومي وانتو حيلكم على الجزيرة وخايفين منها لهدرجة تتاثرون بلي تعرضه  وتبونا نصكرها يبه تخسى ويخسى شاربك وشارب معزبك تتصكر بتفضحكم وبتلعن خيركم صبح ومسى قلت لي عظمى اجل 
1049009414131408768,QA, انت كحلة والا مسكرا مافي عنابي مافي قطر اذلف في حضن ابو ايفانكا 
1049015724927279232,QA, اهم شيء اخواننا  ليش خايف منهم  
1049613873215692800,QA, شكلش ماشفتي نفسش بالمرايه انتي وكيلو المكياج الي بوجهش وبعد شينش فوق شينش 
1049708949908410368,QA,  مهجدكم  يا شعب سهل استحماره وحلبه 
1050037193719378048,QA,  عسى تفقد اعز ماتملك عسى تنحرق كبدك
1050098120896508032,QA,  جد تنغثون والا مزح 
1050283315364810752,QA, اكون اخر كورس في الجامعة للحين ماسجلت بالجامعة بكبرها 
1050498893274902400,QA, نبي اخر تحديث أنت امير اي درجة نزلك توركي للعاشره والا للحين 
1050499345940909952,QA, طويل العمر ليش عمرك بيده والا رزقك بيده والا متعود يالقبيلي تكون تحت الشيوخ ياااحيف 
1050546897092571136,QA,  ياعنز اسحب كلامك يا امير درجة عاشره يالي ريموتك عند تركي شيك بدونه ماتسوى نعال 
1050556768710025216,QA, شمر ليش ما تسكت هالسافرة 
1050761434018263040,QA,   كلامه واضح دولة لها سيادة مو تحت اباط السعودية هذي اوضح   
1050762189240508416,QA,  شوف التغريدة الي حطيتها وتعليق الامير السعودي وبتعرف هدفهم وهدف الهشتاق 
1050765132471644160,QA, محد نجس و قذر غيركم داعس على خشمكم ترامب موووتول بغيظكم الكويت معانا وراح تبقى معانا
1050817969696268416,QA,  يا شحيم بو الشحم 
1050835365500776448,QA,   أنت من حتى تحدد من خليجي ومن مو خليجي تراك مجرد نكره كلمتك محد ياخذ فيها حتى ف بيتك  انصحك روح شوف اصلك من وين لا تقعد تخون وانت اصلك مضيعه وابناء الخليج اعلم واعرف منك انت برا برا منت صوبنا
1050840382207082368,QA,   كل متابعينك وانا شعلي من متابعينك شخص نفسك ما يفتخر بقبيلته ويستحي يطريها شكلها فضيحه عشان كذا ما تشرفك جنوب والا فوق الوكاد انها  ماتشرفك ابدا
1050846018202419200,QA,   انت الي جاي تنابح بحساب قطري ومو غريبه عليكم القتل والغدر  في دمكم 
1050908008824365056,QA,    يعني السبيعي من المستعربه  اجل ماتنلام 
1051109469294383232,QA,   ليتها على التصريحات بس  وجهه بوجهه ي بابا خل عنك الهياط اهانة في الروحه والرجعه وابن امه يتكلم 
1051119036656963584,QA,  اسكت لايسمعك معزبك يحطك في سجن حايـر انت حدك تتمنى بس 
1051331224315281408,QA,    هذا حدكم كلنا امن  رجل وجبان ياحييف
1051332335642320768,QA,   وعندما يدفعون لك تنابح كملها  
1051420781375365248,QA,   والله واحد منهم وفيهم معترف احنا شعلينا يبه
1051512178761760768,QA, وانت شدخلك يالعتيبي بـ قطر وتعتقد من الوطنية انك تطري قطر والا ضعف شخصية  الوكاد ان قطر ما سوت تحالف  دولة عشان تحمي حدودها وللاسف وصلت صواريخ الحوثي لديرتك يالسلق
1051516104735113216,QA,  مو شرط حتى على الموتى تدققون
1051544425900515200,QA, والله هالانسان كفو ويعجبني ليتك تصير نفسه
1051546593160237056,QA, اعوذ بالله مجهز الرد 
1051547913208438784,QA,  خفف من الدراما تكفى 
1051548371859792000,QA,  والله منت بكفو على شحم
1051549101567987584,QA,  انت ومعزبك تحت نعال اصغر قطري
1051728841604046848,QA, عسى من ذا الحال واردى
1051730220384948224,QA, واحنا شعلينا وبعد علوم  
1051788736168628224,QA, تسوية بين الدولتين وبيضيع دم جمال 
1051842571184590848,QA, يعني راح دم جمال 
1052224686820593664,QA,  ياحمار اذا ماتبي تترحم على المتوفي اذلف
1052279983786381184,QA,  زمن صارت فيه المرأه ارجل منكما ياحييف بس
1052649975690203136,QA,  دامه كذاب ليش متعب نفسيتك وتتابعه
1052650219010228224,QA,  شدراك انه بتاع نسوان الا اذا تواصل معاك 
1052654884615536640,QA,  اعطيك  سمعت كل الي مطلوب تقوله خل معزبك يصرف لك اليوميه كااااملة
1052662915688480768,QA,  وين ألفاظه البذيئه ابي اشوفها 
1052665443369009152,QA, حابه ابلغ على هالشخص يتابع قناة الجزيرة   خلاص رحت فيها 
1052820092969472000,QA, يبي له شرده من الدوام
1052989439834755200,QA,   حوثي لعب فيكم نبي نشوف جيشكم المصون عنده  سنووات شدعوه السعودية مافيها رجال
1053305905104723968,QA,   لا يبه مو يـه 
1053306193282822016,QA, لا يبـه السـالفة فيها الجـزيـرة 
1053316841916039168,QA, فعلا ودي اكتب لهم شفايدة هالتطور والي يدخل قنصليتكم مفقود 
1053356722377629568,QA, كويتي بذمتك ابي اشوف الاتراك مو معقوله هو بس الي يشوفهم وانا لاشتفرقه
1053405561226715136,QA, حسبي الله عليكم زين اعترفتو يالقتله المارقين
1053406749045280768,QA, حسبي الله عليكم ياقتلة
1053406907262754816,QA, ابي اشوف الذباب عيال الكلب يردون
1053408941215043584,QA, عالبركة اكيد مو اسعد منا 
1053411462193053568,QA, ابي اشوف شكل قناة العربية يوم قالت مخطط قطري يممه منها 
1053413647828033536,QA,  بسبب ضغط قناة الجزيرة رضختو  واعترفتو بجريمتكم ياقتلة ولاتنسى مطوعكم يصارخ اليوم فالحرم الله يعز الحرم منكم يا مارقين
1053414029534916608,QA, فعلا وشو الي شجار  شخص وش كانو يسوون فالقنصليه 
1053419134833360768,QA,   شوضعك ياولد روق  ياقاتل
1053419375485698048,QA,  العذبة لايطوفك القنصليه بكبرها مصرحه انه خرج شوضعها الحين 
1053420635106500608,QA, عيسى القنصليه شوضعها بعد هالتصريح 
1053421178965102592,QA, كلكم هاجمتوا قناة الجزيرة الحين شوضعكم بعد ما طلع كلامها صح
1053423970354126848,QA,  شوضعك الحين ياقتلة مارقين
1053425078392766464,QA,  لحظة شدخل قطر شوف قنصلية بلدك الكذابه مصرحه انه طلع شلوووون واليوم يقولون انه قتل فيها  وش ذا التخبط شغل مافيا 
1053431226873376768,QA,  والحين شرايك فالجزيرة بعد ما طلع كل كلامها صح 
1053431672182575232,QA,  الدب الداشر  تجيني لوعه 
1053431835462692864,QA,   قنصلية بلدك تقول انه طلع شلون الحين تصرح انه قتل ممكن تفهمني 
1053432903814782976,QA,  طلع جثه الرجال اكرام الميت دفنه انت ودبك الداشر مستانس عليه وووع 
1053434605930450944,QA,  ليش تأخرت اجراءات  فتح القنصليه لتفتيش دام القنصلية ماتدري بلي صار سبوع كامل تماطل سعودية  عشان تفتيش قنصليه ومافي اي تعاون    شخص تشاجر مع شخص واحد وتقول لي القنصل ماعنده علم 
1053576200218706048,QA,  وين المحزن فالموضوع  شايف في شخص قاعدين يقطعون فيه 
1053576997354553216,QA,   ومنظر الشخص الي مقطعين خاشقجي و مخفي جثته الرجال ميت من سبوعين ممكن تحس على دمك وتتكلم بالموضوع
1053577193509543936,QA,  جثه خاشقجي لها سبوعين مختفيه اكرام الميت دفنه وينه يامارقين
1053577542232346624,QA,  وجثة خاشقجي وينها مو اكرام الميت دفنه
1053580381621022848,QA,  دامه مو حرام خلاص ما نفتي ونقول اهانه للميت وعياله كانو موجودين يعني كل شيء امام عينهم
1053581414292221952,QA,  ترا ما شالو الجثه بالشيول شالو بس التراب وحطوه على قبره الله يغفرله وجهة نظرك وصلت
1053624159199248384,QA, وانت حيوان ناطق انطم وخلك في ديرتك المارقه
1053625588802576384,QA, شفتك بتبكي تترجاهم ما يجيبون سيرة الكويت حالتك صعبه 
1053651062308200448,QA,    اظن حالتي مو اصعب من حالتكم يا مارقين 
1053656506611257216,QA, الا يطلعون لهم مبرر قسم بالله ناس غريبه 
1053758617533497216,QA,  معزبك جاب لكم منشار يقطعكم فيه ولا في رجال من ظهر رجال يتكلم
1053759143671160832,QA,  غبيه وحماره محد يلومش
1053998884370952192,QA, بوغانم شدخل احمد عسيري بموضوع خاشقجي احس هو والعتيبي ماله شغل 
1054028455577292800,QA,    أهم شيء هاجتمو الجزيرة وانها كذابه وعقب سبوع دولتك رضخت  وصرحت بمقتله على يد سعاوده انذال  مارقين غدارين
1002625074250174464,QA,  من اصلا متقبله بو فازلين  
1002626480122105984,QA,  لا حتى يوم كان بالكويت القطريين ما كانو متقبلينه ومو محتاجين وقفته
1004092463030652800,QA,     تعال خذ عمره  شدعوه ورى بيتك هي 
1004453180560822400,QA, الصراحه ما حبيت تقليد البلام للسودانيين واليمنيين شدعوه يطلعهم بصوره مو عدله
1004479415949168640,QA,  طيب ليش جاي هنا انقلع تابعها 
1005485897264050176,QA,  فوبيا قطر  خفو على اعماركم 
1005948561861693440,QA,   اشوفه داعس عليكم ومربيكم  الواحد مايقدر يفتح ثمه 
1007015546955747200,QA, من ملقبكم قوم قريش  
1007032754817650816,QA,  بكأس العالم كذا تنكتب يا نفر 
1007039682557948032,QA,  احنا لنا حق نتكلم  في كل شيء دامنا بنستضيف كأس العالم  وبتكون ضيف عندنا  البخ  
1007042117145948160,QA,  انت شتبي متعود على قمع حكومتك قال صمت ما كذبو المغاربه قوم قريش 
1007099152466145152,QA,  حرام وش ذنبهم كله من محمد بن زايد
1007234440697925632,QA,   على باله كل الناس نفسه تنشرى بالفلوس
1007301813631094784,QA,  على كيفك هو الهلال ما يطلع الا بسماهم
1007449974332895232,QA, وانت بخير زين حطيت هالكلام عشان احط له كوبي 
1008747485702082560,QA,  جعلكم بذا الحال و اردى  عيل حل المشكله 
1009508608458022784,QA,  بو مشعل على بالك العالم نفسك ما تمشي الا بفلوس 
1009893401746079616,QA,   يقولون ماقد سمعنا بواحد اسمه تركي 
1009980027407097984,QA, ما الكبير الا ربي  و دارنا من دونها الموت الحمر 
1010191739083214848,QA,  وش يذكرك رقم خمسه
1010355037904699392,QA,  خبره في النعالات يا مجرم شكل نعالات الفريج عندك  
1010957260183437184,QA, حوثي مقابل  ضابط اماراتي شيء غريب ومعزبك يتبكبك عند أمريكا يبي الحل سياسي مايستوي بووويه
1010993940567412736,QA,  مشكله اذا على بالك الناس نفسك ما تمشي الا بفلوس وجنود قطر مو محتاجين  ابدا ابدا لكلام عبد نفسك يشكك فيهم اثناء تواجدهم فالحد الجنوبي
1011002803953823616,QA,  يا كتلة الغباء هالقوات داخل  الاراضي السعوديه  يعني حماية لكم عشان تكتب على راحتك في تويتر ما يجيك صاروخ في وسط بيتك يلاا ارقد وخل عنك التفلسف
1011278297815273600,QA, شنو الله أكبر بتروح تفجر 
1012069440731648000,QA, بيض الله وجهك وندري انكم تتعرضون لضغط و سب من دول الحصار 
1012935126710476800,QA,   مع إنك كذاب بس بيكون عايش يدور رزقه أنتم يختفي من على وجهه الارض  
1013737304479928448,QA, ومتعب نفسك بعد واضحه الفضاوه موصله حدها عندك 
1014125232125341568,QA, شاهي مع حبق وكنافة ياسلااام 
1015414641990791168,QA, خافو يطلعون بسواد الوجهه  قدام شعوبهم
1021128500009406464,QA, حتى لو هو بيتزوجها هي من الصدمة بتموت 
1029462531914559616,QA, وضعك صعب يالمالكي تنابح على الفاضي من سنه 
1029789884356157440,QA, اذا في صعوبة فالنطق ليش يجيبونه ف برنامج يجاوب على أسئلة المتصلين 
1029790375689498624,QA, ماشفتك تدافع عن قطر 
1032678648669724800,QA, تطورت صرت تتكلم في الاعراض خلق الله ما فادك بشيء نباحك في حساب الجزيرة
1032725115820236800,QA,    اظن مو اكيت من معزبتك ايفانكا 
1032746429259890816,QA,   ايي علي فاتورة كهرب ابي ادعي لتوركي شيك عشان يسددها لي
