id,dialect,text
1071638286584680448,BH,"لي الجفا  والكلام العذب للزوار
هو عاد بالارض روح تعوضك عني

متى بترجع  يقولون الزمن دوار
ماودي  ان المفارق يبتدي مني"
1072444276473257984,BH,ليت قلبي مايحس  ينشغل في حاله بس
1072725152700530816,BH,"جاني اهتمامك بعدما خاطري طاب
بديت تحس في نفسك ومتحسف 
خساره جيت متاخر انا مابي عتاب
ولايفيدني دمعك ولا قلبك المتاسف 
هذا قرارك وانت اللي اخترت الغياب 
تذكر انك الخاين وكنت بيوم متفلسف
سمرالبحرينيه"
1073003622781382784,BH,"ترى الذكرى ولو حلـوه 
طـواريهـا تهـد  الحيـل "
1073046702662266752,BH,انكسر قلبي وهم ماظن بيا يحسون
1075364728166379648,BH,فديت قلبج فنانتنا تسلمين ياكل الذوق ياخطيررررره  
1075799975676780416,BH,هلا بالززززززين هلا بالمليونيررررر 
1076449049841152000,BH,"فرق السما والأرض بينك وبينه
عشقت أنا فيك الزين والشين 
بذمتك وش جاب عينك لعينه
مايوصلك حتى ولو حاول سنين
سمرالبحرينيه
نبيلشعيل فرقالسما"
1077152001815924736,BH,"يابرودك اللي مايحرك سكونك
ياقساك ياغرورك ليه طول سكوتك
للهجر تنفيني وانا بالماضي كونك 
ياعذابي وياذل انسحابي لصوتك 
تصرخ عيونك ماتبيني آه ياجنونك
ماتبيني وانا كل احاسيسي يبونك
اناديك ارجع قطار الحب لايفوتك 
سمرالبحرينيه"
1077152195844419584,BH,"انا اللي ضيعتك من  ايديني 
كثر الدلع غرك وزود الاهتمام
كثير  الصدق ماينفع  تخليني
الوفا في هالزمن صاير حرام

سمرالبحرينيه "
1077153755076939776,BH,"شوف عيني  متى منك بترتوي  
نام الهجر في هدبها ومااستفاق
هزها الشوق وذاك الجرح القوي
لين انتثر دمعها يوم اعلنت الفراق
سمرالبحرينية"
1077851143609466752,BH,بذمتك وش جاب عينك لعينه
1077851404939743232,BH,على الدلع والصد ياكامل الزين 
1079795868574863360,BH,"ماتخيل ينتهي عامي وماشوفك
كيف تقدر تكمل السنه من دوني
غبت بلاسبب وانا اجهل ظروفك 
مدري وحشتكوالاعيونك مايبوني
خليتني وانا اللي حالف ابد مااعوفك
وهجرت قلبي يااغلى انسان في كوني
سمرالبحرينيه"
1080921585362657152,BH,   الف الف الف مبروووووك اخوي نص فاخر وفلسفه شعريه رائعه ابدعت ابدعت ابدعت وفالك التوافيق يابطل 
1080924075734773760,BH,"جازت له الغيبه وللحين غايب
مايدري ان الشوق في داخلي حي
من طول الغيبات عنده حبايب
ماعاد فيها لاغنايم ولاشي"
1081706440077860864,BH,"تحسر قد ماتقدر 
عسى يصيبك اللي صابني منك وبعد اكثر
عسى عيونك تشوف الهم بدال الدمع تبكي دم  وحسره تضيق وتخنق عبره ولابهتم ولابتهز بي شعره ياقاهررررررني هند"
1082501315010404352,BH,انت تتغلى وغيرك ياخذ مكانك  شايف الموضوع كيف بسيط 
1082821759542456448,BH,الله يرجع لي فرحة رابع ابتدائي يوم دريت اني بكتب بقلم حبر
1082824051771523200,BH,"حتى ولو ترجع و تخذل غيابك 
فقدت فيك اشياء ماعاد ترجع"
1083290296346165248,BH,الواتس صاير مثل الثلاجه تدري مافيه شي بس لازم تفتحه
1083909265537020032,BH,"فرق السما والأرض بينك وبينه
عشقت أنا فيك الزين والشين 
بذمتك وش جاب عينك لعينه
مايوصلك حتى ولو حاول سنين
مجنون فيك وقلبي الله يعينه 
على الدلع والصد ياكامل الزين
طبعي عنيد وكل البشر عارفينه
إلا معاك إنته  لك أخضع وألين
سمرالبحرينيه"
1083909916467871616,BH,"محتاج  لحنانك  تعبني  البعاد 
ابي   اشوفك  خذني   إلييك 
طول  غيايك   يكفي   عناد
حتى  قلبي  مايبيني  يبيك 
سمرالبحرينيه"
1083910154448527360,BH,"ماتليق لي ولا قلبي يليق بك
عزتي  على مثلك صعبه كثير 
يجي غيرك مثل ما الله جابك 
مافي شي  بهالدنيا  مايصير
سمرالبحرينيه "
1083910837692219392,BH,"ضعت وضيعت دربي والمواني 
ضقت وفاضت بدمعي المناديل
تعبت مابين احزاني والاغاني
كلما اقول حبيت طفى قنديل
عجزت ارجع احساسي الاولاني 
وضاعح عمري بالليالي المقابيل
عجزت اضحك وبكاني زماني 
لين صارت قصتي مواويل 
وعجزت انساه بعدما نساني
سنه ودمعي على فراقه يسيل
سمرالبحرينيه "
1083911115623596032,BH,"تحتري مني اجيك واخذ بخاطرك
وانت اللي مزعلني ومعذبني كثير
هالمره اعذرني لا والله سلامه عمرك
كل مره تخطي وانا اعتذر  مايصير 
سمرالبحرينيه"
1083911441655173248,BH,"لاتثق فيني تراني منجرح منك
والالم  يوجع  على  قدر  راعيه 
وانا كل  مغز ابره يشتكي عنك 
تخيل لو اموت دمي تبتلش فيه

شمرالبحرينيه "
1083912196890022016,BH,"الطيبه العميا وحظي الردي واصحابي
هذا عيبي واللي كسر ظهري وخذلني
اقسى طعون الموت خذتها من احبابي
اللي كنت له قنديل راح بالعتمه وتركني 
هو نفسه اللي بعز جرحه فتحت له بابي
قابلني بالجفا بعدما بنيته بيده هدمني

سمرالبحرينيه "
1083913831213158400,BH,"حدك  زمانك  اللحين  تكلمني 
تسهر للفجر وعشاني ميت قهر 
جاك  اليوم  بالاغاني  تسمعني
وتشوف اسمي وانا اكتب  شعر  
ماعندك انا ولاتقدر بيوم تملكني 
لو ملكت الكون كله مابتملك سمر

سمرالبحرينيه "
1084347210001772416,BH,"يا كم من جروحي انخذلت 
لقيتك دواي واغلى ماحصلت
انت اجمل اقداري والمواري
واغلى امنياتي واللي نلت 

ياغايتي واقصى طموحي ودنيتي
ياحاجتي واصدق شعور بمهجتي
كتبتك في دروبي حرف ماينمحي
واعذب غرام اسعاه وقمه لذتي 
سمرالبحرينيه"
1085449142032318464,BH,"النجاح والتوفيق من الله والنيه الزينه
والفشل من نفسك ومن نيتك الشينه يعني مايصير انت فاشل وحقود وماتتمنى الخير حق احد وتبي تنجح وطول الوقت تنتقد الناجح وتقول ليش ما اصير مثله صفوا نيتكم والله بيرزقكم على قدها"
1085529288147898368,BH,"لحد يقول لي والله ماتوقعتج جذي 
توقعوا مني كل شي خلاص انا موصاحيه انا جذي"
1090038113680936960,BH,"حتى الزعل مايجي لايق على غيرك 
تقول كن البشر تزعل على الفاضي 
تأكد اني ابيك بشرك وخيرك 
فديت وجهينك الزعلان والراضي"
1091117740952379392,BH,من يوم كنت اقص الفلوس اللي بكتاب الرياضيات واحاول اشتري فيها وانا داريه ان المستقبل ضايع
1091117870950612992,BH,فيه اصحاب ماكرهتهم بس اختلف شعوري اتجاههم صرت احب اشوفهم بخير بس قربهم للأمانه ماعاد يهمني ابدا
1091166753403650048,BH,"الحين توك تعتذر لي  يامسكين 
خل العناد اللي مشيته  يفيدك"
1091341728978792448,BH,"انا عن رجعتك تايب ومتصوف
بديتك خطا واليوم بيدي نهيتك
شلته من اعماقي ولوكان متجوف
ومليته بحب نفسي وانت عديتك
بترجع لي ولو قابلت غيري الوف
وانت خابرني لو تموت ماترجيتك
بتشكي فراقي ولابسمع عذر وحلوف
وتذكر يوم قفيت مالتفت ولاناديتك 
سمرالبحرينيه"
1091404901165473792,BH, قتلني ذي مالنا ورا هلون
1091446416956948352,BH, انا بعد لو عندي فلوس جان شريت حتى كنتاكي وماك وحطيت عليهم صورتي 
1091513872232734848,BH,"صرت احبك وغيرك ما اشوف 
ويارب انك تحبني كثر ماحبك 
ماتهمني لا مسافة ولاظروف 
مابي الا قربك مابي الا قلبك 
سمرالبحرينيه "
1091514304048836608,BH,"انت مو مستوعب غلاتك ياغلاي
انت عندي الكون باقماره ونجومه
بس انتظر يومي بس تكون وياي
الله يعين القلب والله بتضيع علومه
شوقي لك تعدى حدوده لي سماي
ياللي ضحكتك تنسي قلبي همومه
سمرالبحرينيه"
1091514401205743616,BH,"احساسي  وانا معاك احسه غير
شي جديد مايشبهه  اي شعور 
يابعد عمري انا من شعوري اغير
تصدق اخاف يزاحمني هالشعور
ايه انا بقربك حبيبي يتملكني كثير
شوق طاغي وصوتك سعاده وسرور
سمرالبحرينيه"
1091514612456001536,BH,"انت عيني وغلاك لمد البصر 
حارت بك عقول ياكامل الزين
انت ملاك لكن على هيىه بشر
صعب المنال وابعد من التخمين
اللي حاول يوصلك يفشل ماقدر
انت  لحالك  وين  وهالناس وين 
سمرالبحرينيه"
1091514697432612864,BH,"نادر وجودك مالك شبيه الا قمر
انت بوسط قلبي وعيوني الثنتين
واقرب من انفاسي وشوقك جمر
معاك مايكفيني قلب احتاج قلبين
سمرالبحرينيه"
1091515285847359616,BH,"تجرح وانا ماسويت لك شي
قول مابي عندي احد ثاني
قول انتهينا ولاتغلط علي
انا برحل بلاتجريج وانساني
وبجمع كسر قلبي انا بيدي
خلني بعيد اعيش احزاني
تصدق انا استاهل ماصار في
عطيتك فوق حجمك واذاني
سمرالبحرينيه"
1091517297334866048,BH,"انا ماعدت اعرف اللي بقلبك
وكيف الطريقه حتى اوصل لك
تدري ان قلبي مريض وتتعبني 
وانا من حبي اخاف ادوس ظلك
سمرالبحرينيه "
1092268657227558784,BH,دامك معي شفني تركت التمني  انت امنياتي الماضيه والجديده
1092588371719974784,BH, اي والله يا ام فاهد جبتيها عالجرح
1093599014099054592,BH,ابدعتوا يعطيكم الف عافيه وفالكم التوافيق 
1094777622536614016,BH,"ماهو على شان المحبه عشاني 
مع المطر مابي عيوني تغارق 
ناوي تفارق أختر أي وقت ثاني
هالجو ما يصلح أبد للمفارق"
1095138560267767808,BH,"اللي جفاني بكيفه لايجيني
ولايفكر بيوم يسال علي 
اللي بضيقي ترك يديني 
وانا احسبه اقرب من هلي
خذلني للاسف واندا جبيني
نام قرير العين ولاهمه زعلي
تركني وقال ان العيب فيني
وبظهري سدد طعونه لي 
خبروه طبت ولاعاد يحاجيني
واذا عنده كرامه لايسال علي
سمرالبحرينيه"
1095139752607735808,BH, من اسباب تخلف العرب  بوقت فيه الناس تموت من المجاعه وتدمر وتخرب بيوت والفقر المدقق منتشر  يجيك بعير بملايين  طبعا كيفهم حر مالهم  بس هذا دليل تخلف وجهل بعض العرب
1095334568628899840,BH,"كان ودك تكسب رضاي بسهوله
ما أبي منك سوى حاجه وحيده
الكلام اللي يضايق  لا تقوله
والخطأ اللي ما أحبه لا تعيده"
1095370569053335552,BH,"حال حولك والوله عشش في بالي
والغلا الي شلته لك شق جيبي 
بان ضعفي خف شوفي شان حالي
خوفي بكره على حالي يبان شيبي
مشتاق له انا يصرخ يملي البيتهيبه
يبتسم بعدها ومسباحه في جيبه
حمدالعماري"
1097544312261353600,BH,"وطيفك مابي يتبعني ولايزودها معايه حيل
وانا مابيك ترجع لي كلمه وخذاها قدامك 
انا برحل عن دروبك وابعد عن دوربي وميل
انا لو بنسى كل شينكمحال انسى كلامك 
سمرالبحرينيه "
1097814361270300800,BH,"نفس الشعور الي تحسه أحسه
ونفس السكوت الي يحدك منعني"
1097995829829353600,BH, بالضبط انا الاسبوع الي فات جيت الكويت بسياره وصج تكسرت من الشوارع 
1098964613373353984,BH, يمكن مايحب المغني اللي تسمعين له
1100336592420515840,BH, الالبوم ادمان طول الوقت بمخي
1100861056342200448,BH,"عسى ايامي كلها افراح ونجاحات واوعد نفسي قبل الكل اني اكون افضل واحسن وانجح  والله يحفظ لي كل اللي احبهم ويحبوني  ويبعد عني كل شر  
كل عام وانا بالف خير
سمرالبحرينية
 "
1102045561811845248,BH,"حين يخذلك الوفا 
وتنهزم من كل صوب
وتذرف دموعك افا 
ويمك ماتلقى قلوب
تحترق لجل يدفا 
وهو يجرح ولايتوب
وعن ذبحك ماعفا
ويقطع عليك دروب
ماهزته كلمه كفا 
ولاذكرى مع الهبوب
ماغير يزيد الجفا 
والروح منه تذوب 

سمرالبحرينيه"
1102618318710681600,BH,"ياللي تعذربنا وتبحث خطانا
راجع حساباتك وتلقى العذاريب
وان كان تنشد عقبها وش بلانا
حنا بلانا الطيب ونموت بالطيب"
1103451974480084992,BH,"تاخذني الطيبه واجيم من اقصاي
وبعض الأوادم فيم الطيب ضايـع "
1104931822260154368,BH, ناوي تروح وتشعل الشوق فيني
1105655983316131840,BH,"انا صحيت وماشفت ابد منك اتصال
وانا متعود تغمض عيوني وتفتح عليك
وش جرا لك تبتعد وتقطع حبل الوصال
بلا عذر مدري زعل تقسى على من يبيك

سمرالبحرينيه"
1106049583057121152,BH,"ادور  في  وجيه الناس عنك 
ويرد  قلبي خايب  ولا  القاك
ليتني  اقدر  ارد شويه  منك 
ويظل طيفك  بعيني وذكراك 

انا ضايع انا تايه انا محتار
ابي ترجع كفايه قلبي بنار 
تعال ارجوك مابي منك اعذار
على وصلك حزين وبديت انهار

سمرالبحرينيه "
1106049926214094848,BH,"عايش على ماقيل تحصيل حاصل
لاراحه شفت ولافرح ولا ارتاح قلبي
مدري وش حدني عالمحبه اواصل
ازرع دربهم ورد ويرمون شوك بدربي
سمرالبحرينية"
1106050136180957184,BH,"حدك  زمانك  اللحين  تكلمني 
تسهر للفجر وعشاني ميت قهر 
جاك  اليوم  بالاغاني  تسمعني
وتشوف اسمي وانا اكتب  شعر  
ماعندك انا ولاتقدر بيوم تملكني 
لوملكت الكون كله مابتملك سمر

سمرالبحرينيه"
1106054236100591616,BH,"ياكثر ما انا بكذابتك غرقت 
ولانفع وفاي فيك ولاطيبتي
روح بكيفك مايهمني لوعشقت
اللي مثلك صعبه عليه شخصيتي

سمرالبحرينيه "
1107555502131740800,BH,"ماخذاك الوقت بس غيري خذاك
ماخذلك الزمن بس انت الي نسيت 

مابين استغفر الله وبين ربي يهداك
كنت اتمنى نتفق ولكنك قسيت 
سمرالبحرينية"
1107555814942916608,BH,"كبريائك كان حيل وده اتبعه واترجاك
وانت تدري لوروحي بيدك ما انحنيت 

شموخي ماتهزه ولاتفكر امشي وراك 
لو دوا القلبعندك صدقني ماجيت 
سمرالبحرينية"
1108215026895277952,BH,"جابك الله والا الندم جابك 
مدري افرح لو ابكي عليك
كثير اشياء تغيرت بغيابك 
ودي بك بس عقلي مايبيك
انت مثلي البعد زلزل صوابك
وعيونك من كثر الدمع ترجيك
ولا طرا الشوق مامر عند بابك 
ولاطيوفي عانقت لذه ايديك 
سمرالبحرينية"
1110328994174550016,BH,الحياه حلوه  بس يبي لها فلوس
1112038692833628160,BH,قدرتي وغيرج ماقدر يا ام فاهد  فالج التوافيق وين ماكنتي 
1114698648061923200,BH,"أكبر دليل إن المحبه  من الله
كل ما بغيت أكرهك حبيتك أكثر"
1114700371249774592,BH,"ماعدت اعرفك صار يقهرني اسلوبك
تغير فيك كل شي حتى زادت عيوبك
ماكنت قاسي ماكنت بيوم كل ناسي
اشوفك ا ثاني لبست ثوب مو ثوبك
سمرالبحرينية"
1114700778214703232,BH,"صار لك غيري موعلى خبري وطيري 
منت مسجون بغرامي وحبيت غيري 
مو مثل اول حبيبي كنت لول حبيبي
عفت دربي واختلف دربك عن مسيري
سمرالبحرينية"
1114701119668858752,BH,"طفت شمعه سنيني وانطفى الغرام
بيدك كنت تشبها وبيدك هم طفيتها 
ماهمك قلبي يموت لين مات الكلام 
واحترق فيني شعور وعين ابكيتها 
سمرالبحرينية"
1114701298929106944,BH,"صارت افكاري تصيح ومنك ما انام
كيف قصه غرامي بسبتك انهيتها 
وتحكم جور على روحي بالاعدام 
واحلى سنين عمري بقربك فنيتها
سمرالبحرينية"
1115055644552433664,BH,"مدام كبدك على مغليك محتره
معذور لوكان في صدك تبي تزود
انا اعرف اصد لكن صدتي مره 
ماهي بصده ثلاث ايام واعود"
1115433534091616384,BH,"ماهمني غدرك ياشاطر
عادي ترا بنساك باجر
لاني شلتك من الخاطر
كافي وقتي ضيعته معاك

انا اشره اصلا عليك 
كل بلاوي الدنيا فيك
روح للي يسليك 
لانه هذا مستواك
سمرالبحرينية"
1116169697744101376,BH,"هو جابني الود مدري الود خذاني
المهم جيته بكيفي وذوقي واختياري
شفته يشبه الورد ويسمع لي اغاني 
مستغرب  ليش اكتب اسمه بأشعاري
سمرالبحرينية"
1116170676958826368,BH,"واسدل ستار الليل عالوجه العليل
وطاحت كل الاقنعه والوجوه اعترت
والفراق اعلن قدومه ومايستره ليل
احسن لنا نفترق دام شمعتنا انطفت
سمرالبحرينية "
1116170807187792000,BH,"يتبعثر التفكير ويجمعني شتات الزمان
تصحيني الذكريات وعلى غفله تبكيني
ابي استوعب اللي صار واللي جرا وكان
صدق احنا افترقنا وانتهى مابينك وبيني
سمرالبحرينية"
1116171259908362240,BH,"وخذ جوابي من هالقصيد وكلمتيني
هذاك اول اخضع لك وانا عالي شان
هذاك اول اتوسلك ارجووك لاتخليني
ذليت نفسي شي ماكان ابد بالحسبان
وانا اللي  ابد ماحنيت غير لله جبيني 
دارت الدنيا وحظي كافئني بالخذلان 
وخلاك انت ياللي ماتسوا لعبت فيني
سمرالبحرينية"
1116171971430113152,BH,"وتغير الوقت وبالسيئه جازيت الاحسان
طلعلك حس ياصغير و قلت ماتبيني 
غريبه هالدنيا كيف فجاه تغير الانسان
تعلي الردي اللي رفعته انا بإيديني 
سمرالبحرينيه"
1020484574198067200,BH,احبه كثر ماصلوا وقالو بالصلاه أمين ولكنه عجز يحفظ غلاه وضيع دروبه 
1020497614406586368,BH,   تسلم فديتك لاخلا لاعدم 
1021161638236483584,BH, متى هالسبلان بيصير عندهم مخ
1021305689472422016,BH,"ساعه بجنبك لو مضت كلها صمت 
تسوى السنين اللي مضت من حياتي "
1021316357902741632,BH,"أحب الرفيق اللي ليا شافني زليت
يوضح خطاي وكلمة الحق ترضيني
صريح بوجهي يحترمني اليا صديت 
ليا ضاقت الدنيا علي  ما يخليني"
1021903942287085568,BH,"ياملاذ الجرح اشتقت لك وينك
ذبل عمري وانا  اتحرى عينك 
سمرالبحرينيه "
1022279299808800768,BH,"اللي مزعل قلبي ماهو انت 
انا زعلان من نفسي كثير
لاذكرت قبلك  كيف كنت
بلا شعور لا احب لا اغير
سمرالبحرينيه "
1022309445961965568,BH,"من آخر اللي  بقوله و اختصار الكلام 
خوفي من إني أخسرك  مرحله طفتها 
من شفت ما عاد في وجهك حيا واحترام 
عيوبك اللي ما كنت اشوفها شفتها 
الخاطر ان طاب من حاجه عليها السلام
  لو إنها اغلى من عيوني علي عفتها"
1022435513578471424,BH,الشعور الموجع لما ينضغط على قلبك بكلمه او فعل قاسي ما توقعته من شخص  لما تحاول تكذب على نفسك وتحاول تقتنع إنه والله ما كان يقصد
1022981981360021632,BH,"وإذا بتقفين أنا ما أتبع المقفيين
أنا أستقبل    المقفيين من الألام"
1022985672741867648,BH,"أنا ما أبي كلمة أحبك أنا أبغى أهتمام 
أحذر تحسسني إني في حياتك ثقيل
لأنك ليا أهملتني ماراح أعاتب كلام 
أنا مع أي شخص يهملني عتابي رحيل"
1023082510555774976,BH,"اتابعـك فـي صمــت واكـره غـيابــك
وارتاح وستانـس ليا صـرت مـوجـود
ودايـم على بالي اراقـب حسـابـك
واقــرا كـلامك ذوق واشتـاق لك زود"
1023369309685526400,BH,ادري بتجيني وعينك بالشقا غرقا  وبتحاول بقد ماتقدر ترجعني  الله يسعل لقلبك سكه الفرقا  وانا على قولتك ربي يوفقني
1023555754870169600,BH,"مايدري ان العتب من زود حبي له  
مايدري اني عليه آغار  واتضايق  
وشلون قفى ولا جتني   مراسيله  
معقول يقدر ينام  وخاطري ضايق "
1024341988542492800,BH,"ياسمار اللي مابعده سمار 
بين الخلايق كنك معجزه 
طبيعي كل هالعالم تغار 
وكل زين  زينك يتجاوزه 
سمرالبحرينيه "
1024382837485707264,BH,"عاذرك وأنا أدري انك ما صدقت
امنعتني عن عتابك شيمتي
راح تعرف قيمتي  لكن بوقت
ما يفيدك فيه تعرف قيمتي"
1024400647188369408,BH,"ياكثر ما انا بكذباتك غرقت 
ولانفع وفاي فيك ولاطيبتي
روح بكيفك مايهمني لوعشقت
اللي مثلك صعبه عليه شخصيتي

سمرالبحرينيه "
1024409938515373952,BH,الخبث والخبائث طلعوا من الحمام وصاروا بحياتنا 
1024430084634108032,BH,"من زينهم عاد
 تحرني فيهم
من زينهم عاد
 تركض تبيهم
أنا مو لأي أحد 
مثلك تكملة عدد
ولا اتبع الي صد 
ولا افتكر فيهم 

من باعني بعته
 كني ولاشفته 
ولا اللتفت لفته
 وبلحظة انهيهم
سمرالبحرينيه
محمدالشحي
منزينهم"
1024435116142206976,BH,"بس اللي صدمني باخر لقا كنت تضحك
ودعتني  وانا  مادري انك  كنت توادعني
كنت مبيت النيه قبل ومامهدتني لجرحك 
حضنتني باخر لقا وانت عارف انك بتتركني

سمرالبحرينيه"
1024777505113362432,BH,جابك الله لي هديه من السما  جيت مثل الشوف لعيون العما 
1024782037276917760,BH,"انا من نظره عيونك حبيبي ما انام الليل 
تمنى يابعد عمري واشوفك بس قدامي
سمرالبحرينيه"
1025062899780386816,BH,"لك عين ذبلانة ولك رمش زعلان 
هديت حيل الزين من زود زينك"
