id,dialect,text
1089799731709177984,KW,طيب هذا  رقص مصري ولا إيش 
1089854552185151616,KW,مشغولين بالرقص وكل يوم خريج طرب ومزيكا 
1089915092634910848,KW, صارلي اسبوع مو نايم  وانت الله يطول عمرك ماتشوفين  
1090088859730411648,KW,"ما اجمل الفزعه لما تجيك من الله 
ومن واحد ماتعرفه"
1090192091265814400,KW,دايما مثل الزبالة ملقون في كل وادي 
1091374971673292800,KW,وبده المسلسل كان بكل مرة بيعجب بحد غيرك 
1094269991296422016,KW,هههه بتظلين خالة الكبيرة بالسن 
1094677244407095168,KW,الله يشلهم واحد ورى التاني 
1095182422637990016,KW,صباح الخير والورد وتغريد الطير  
1096665608949772416,KW,صباحالخير بجو ديرتي الكويت الجميلة وقت المطر  
1097261320645341184,KW,بس مومع وحدة سمينة عشان ما يتوهق  
1097552966914068352,KW,والتعبير إلنا إحم إحم 
1097555814406070400,KW,ببساطة أقرى على نفسي وأقوم بطيء وأنحاش 
1098514347280813952,KW,الله لا يبلانا على شنو بس 
1099189014945562624,KW,الله يفتح عليك يا شيخ 
1100507991701446784,KW,صارت بس أشوه في تغيير بالفستان إلي يدقق يلاحظ الصراحة الفشله إذا كان بعرس شخص حيل قريب مني وكنت أخت المعرس أو العروس ههه 
1100700945812476032,KW,محد توهنا غير عبارات الأغاني وشجن الست يومه 
1101446642765648000,KW,الثالثة عاليسار باين عليها موهامها شي وأصغرهم 
1102271862602633216,KW,تذكرهم بالله  عشانتحبكالناسلازم 
1104181493985886208,KW,هههه لا تلومهم ذول بس للإعلانات التجميل والتسويق وإلي يتابعونهم مثلهم 
1106992054461218816,KW,ناس موكفو مروا بحياتي 
1110141577022893952,KW,"

صوتوا له وفرحو اليتيم الرجاء التصويت للولد أمه متوفية وحاط لها بوست بمدرسته تكفوون لا تخلونه ربي يجبر بخاطره ويجازيكم عنه كل خير "
1111803010978640000,KW,بهالسن هسه هههه والله 
1115302789733916800,KW,الدنيا صارت خربانة خصوصا عندنا بالوطن العربي والغرب ينعم بسلام حسبي الله ليبيا
1119629437669126016,KW,أنت ممكن ما سمعت أحد يقرأ قرآن بحياتك كلهم صوتهمجميل وهادي يفرق في طريقة القراءة تبالغين جدا الله يهديكي عندك الشيخ عبدالرشيد صوفي 
1120601043899961216,KW,نفس الشي بس الإحساس معدوم عند غيره بضمير مستتر وعندها بضمير متكلم 
1121680977531527168,KW,يا بختها سواء شي حقيقي أم مجرد شعور 
1125454265588363264,KW,الله يرحمه بهاي الشهر الفضيل ويحسب من الشهداء 
1125467622894702592,KW,الله ياخذهم وسيارتهم معاهم 
1127617216860565632,KW,تقريبا ناكل هي كل يوم شنو المشكلة 
1132670215806959616,KW,طيب هو لما خذاك ما أرادك تغني ليه بعد وفاته غنيتي من وراه مادري 
1134002372135591936,KW,ليش البنت دايم تحط تفاصيل حياتها بالانستغرام وتويتر وصورها شنو يعني خطبوني ودلوا بيتي بتفاصيلي حقيقة شيغريب
1137307270478540800,KW,ما شاء الله الدكتور العجيري الله يعطيه الصحة والعافية حاسب لي  م رمضان وكل حسبته طوال هالسنوات صحيحة ما شاء الله  
1139032878292111360,KW,صباح المحبة بكل حزه  
1140642586681647232,KW,باين كاتشاب موكو دم هي  
1147186490113478784,KW,البنات صاروا رخاص ليش الكل يعرف يرقص وحلو الله يهديكم ويستركم 
1147857493177053184,KW,عطنامشهوروالكليبلكه مشهورة بالطق للأطفال ديروا بالكم 
1149293579078197248,KW,نفس طريقة الأجانب بكل شي الخبال والفعل ما أعرف ليش المسلمين والعرب غالبيتهم من يروحون الغرب يتغيرون ويصيرون نفسهم كوبي يست 
1150466320720367616,KW,كثر الرويبضة الكويتخطاحمر
1153303202865065984,KW,ياما حذرنا من هالجالية 
1157627701383049216,KW,زوجي يحبني وايد اشهركذبهعندالنسوان
1157628049652965376,KW,كل البنات يسألوني عن اشهركذبهعندالنسوان
1158806598728474624,KW,ههه شكل القطوه يمثلني 
1168439270685782016,KW,ما شاء الله طيب بعمرها شنو تستفيد بالشهادة دامها عجوز ما تقدر تشتغل بالشهادة وشنها سن أكثر من التقاعد 
1168946778726633472,KW,نفس اسم رنا وهي عجوز 
1178358968839589888,KW,ما شاء الله موفق 
1032967775168417792,KW,نريدك ترجع وأحسن من قبل راعيالحرشا
1033631359754010624,KW,بأني لازم أشرب ماي  وشتفكرفيههالوقت
1033631413688586240,KW,لأيامي القديمة اشتقتلكتقولهالمين
1033794809704730624,KW,تقول وصل مرحلة ماقدمة من المرض لكن مثل ما قلت كل شي باذن الله له شفاء 
1034164511329140736,KW,يعني حتن لو حاط بأنه تعبان وزعلان عادي  
1035103728049811584,KW,حاغات ما أحقول لكم هههه وشلكبتويتر
1035795117926506368,KW,لا تصيرون هوائيين بزيادة  هواء واحد يكفي مواليدسبتمبر
1036631449309507584,KW,وبعدين مع هالوزارة عطلتكييفالمدارسزهقعيالنا
1036644254678966400,KW,ياليت لو هادل إمام يتعلم من سمير غانم الغشمرة بأدب والبعد عن التجريح 
1036981184541220864,KW,يحبون يفلمون يعني الأفلام والمبالغات إنهم يستخدمون السينما لتغطية بلاويهم 
1037223943692791808,KW,والله بس لو نظرة أشوف ربي 
1037371292612214784,KW,الله يقطع بليسكم ناس فاضيه خخخخ 
1038006906126786560,KW,أجمل يديو شفته هالسنة 
1038294018608844800,KW,نلغيك معاها ولا يهمك دام عقليتك ما تفهم بنبي حسبي الله عليك 
1038378733109952384,KW,فوز منو معاها يا حرام ما عندها زوج مخلينها بروحها  الله لا يبلانا 
1038741543144890368,KW,يطيبيومكاذا ضحكت شوي  
1038743319805915136,KW,شخباري الحمدلله طاف فوق  سنين عن هاي الشغلة  
1038746083114078208,KW,يا رب تتعدلين جامعهالكويت
1039469903248588800,KW,أكتب شنو راح أنجز اولشيبتسويهبالعامالجديد
1040190001089273984,KW,يا رب أشوف الخميس شخصيا وأشكره بنفسي هههه الخميس
1040271484093190016,KW,كل شي رخوي ومن مخ الحيوانات وأمعائها  اكلهمستحيلتاكلها
1040271559007645568,KW,ولا واحد بيهم  وجهكطويلاوقصيراودايري
1040498709476397056,KW,أثبتي بأن صج بنت وبأنك صج ريال تدخلمزاجياذا
1040502988585021440,KW,بالتوفيق والله يخليهم ل 
1041889673663209600,KW,علشانتحبكالناس صبح عليهم بنفس حلوة  
1042050377636630400,KW,الله يرحمك ولو إني ما أعرف منهي وشنو سالفتها عايشهالمطيري
1042581842078118016,KW,يعدي اليوم على خير بالليلههذيودك
1043920263203704832,KW,الحمدلله راضية ومقتنعة باللي الله قسمه لي بوظيفتي وظيفهتمناها اقتنعوا يا عالم ولا تبصوا للمال وبس
1044703632657141760,KW,لو تساوي مليون طريقة لي ماكو فايده آني بالرياضيات مخي يوقف هههه 
1044704000199872384,KW,جسدها مو نفس جسدك وأمك جابتك وتحملتك ومع ذلك حبتك المراهوشهي
1051181526786949248,KW,صح بدليل لو حس رجل بأنها موموجودة بحياته صارت مشكلة هههه 
1051298827913895936,KW,بس بصحة وعافية ياليتينزلوزني
1051458137134432384,KW,ليتالعمر ما يفرقني عن رفيجاتي السنعات الطيوبات والجميلات قلبا وقالبا  
1053485483102216192,KW,صباحكم قلب أبيض وفطور بسيط  
1054802966492954624,KW,عجز يغيضك واحتار يوصل مثلك يكرهكالشخصاللي
1055784914296209408,KW,يومالجمعه حلو مع قعدات زمان وأهل زمان  
1055785051458334848,KW,هم اليهود عفن على مدى الزمن 
1056086756393713664,KW,دمهم عسلللل ما أرضى عليهم  كذبهمشهورهللمصريين
1056180321564221440,KW,خقيت على رذاذ المطررررر  امطارالكويت
1056180548241158016,KW,لا بعد يبيله يبرد شوي  الجوجوكشته
1056912062813818752,KW,للأسف خربت بغناءها الأغنية  الله يخليك خليك عالعود وبسسس 
1057251573347303424,KW,لما أذب هههه معاذ بالله أكون صاروخ متيستذهبللفضاء
1057665897903648768,KW,أكييييد محنا جياكر ولا ثقتنا ناقصة 
1057666286149427200,KW,والسؤال موجه إلكم تقدرون تطلعون والصلعة باينه براسكم بدون قبعة أو قتره وعقال وقحفيه 
1059429298791239552,KW, شهيد العمل باذن الله الله يرحمه
1059460771049029632,KW,مسكين يضحك على نفسه أول شي وشرايكبالكذاب
1060394400231157760,KW,الخميس صبحوا على من تحبون  
1062030439710449664,KW,وإنتي ليه ما استفدتي من بلاوي زوجك مادري طليقك واشتغلتي شغله سنعه بدل لا تتكلمين بظروف ناس دارسين ومتعلمين لكن أجبرتهم الحياة إنهم يشتغلون ينظفون ويرتبون 
1063347485186379776,KW,لدينا نواب يخافون الله ولذلك من يخاف الله الله يبارك له ولكم بدولتكم كذلك 
1063748795039694848,KW,يا رب تنتهي سالفت جولي شيك إنقرفنا كثيييير 
1065522255755706368,KW,الخميسالونيس ورد وورد وثم ورد  
1065892075726667776,KW,ما عليش المصور اشعرفه بالتوقيت في رجل بينزل وبتصير عالسالفه كلها 
1066327173370454016,KW,والله الواحد لا يتفلسف قدام ناس وهو ومو ملم بالموضوع كله عشان ما ينحرج ويسوي نفسه فاهم وقصب صح 
1066353374898077568,KW,إنه يعرف إنه ناقص مومثالي صفاتالشخصالمثالي
1067466967337046016,KW,مشاعري الشرقية شيتحبهفينفسك
1068878563879866368,KW,يا رب وياك يا صعلوووك 
1069221701421056000,KW,إن ما أتحسر على شي فات ولا أتحسف على شي سويته امنيتكبهذهالحياه
1069603490740211584,KW,خصوصا إلي مغرقينا برسايل وأشعار حب كأن حياتهم حبيب هاجرهم 
1070398737812463616,KW,آني الخنزير مخلينه كأنه كلب صغير وشي عادي هههه ضاحكين علينا 
1070901870636478464,KW,عالله ننتظر للناس المديونة للي عاشت فوق مستواها الاجتماعي وتحسفت اسقاطالديونوالقروض
1070980392587575168,KW,ما نطلع من جزا مهما سوينا معا كلمتينلنبعالحنان
1071167217054769152,KW,لكل مغرد عنده حساب تجاري بسوي لك بلوك مراتودياقول
1071261609891414016,KW,مراتودياقول صباح للي نحلين اليوم  
1072213110419787776,KW,بعيونك قبل يدينك تعالاحضني
1072431986109767552,KW,أظن لو كمل كلامه وقال بالسخافة والميوعه 
1072432581826830336,KW,الله يخليكم إلي ما بيفهم بالدين لا يشكك الناس بدينه فتن الدنيا كافية ولا تكبرون كلامها وهي موفاهمة سؤالها 
1072941667827748864,KW,بس هاشتاغات عن القروض ما تملون معاوضداسقاطالقروض
1072962927035121664,KW,كلينكس  وشاكثرشيتشتريه
1072963048074293248,KW,مليانة إضاءة بسبب كثرة المطاعم  لياليالكويت
1072963200038113152,KW,معاوضداسقاطالقروض عالم مليان فتتوقعون شنو 
1073068773794611200,KW,ما اهتميت أبدا والأفضل إلي مومتقبل تغريداتي لا يتابعني بالأساس كمشخصمعطيكبلوك
1073643085471604736,KW,مبروك بار يطلق مثل ما يبي دامه ما تعب وسعى ورا 
1074734964120436736,KW,آمين أجمعين دام تمنيتها لنا 
1075770480936738816,KW,يشتغل بالمخ والمخيخ ههه وشيشغلبالك
1075969840614162432,KW,لاجلالحبكلمه صباح الحلا لأهل الغلا  
1077181536640880640,KW, ظلمت الكثير من المواطنين سواء من المعاقيين او خواتنا الارامل والمطلقات طلبت منهم طلبات تعجيزيه وقطعت معاشاتهم من غير وجه حق ماقالت عندهم ايجارات وقروض وعيال  قرارات عشوائيه ضرت اكثر ما نفعت وطبقت المقولة اللي تقول ان عدوة المرأة هي المرأة شوف فرحه الناس بتوتير وانت تعرف السبب
1077203174342180864,KW,  اي والله صاجه ماكو احساس موليه
1081833430655078400,KW,"اختباررياضياتثانيعشر  
انا مدري شنو يبون يوصلونه صعبوا اهم امتحانيين يبون يسقطون العالم وتقل النسب هذا طموحهم جابوا النفسيه واليأس لعيالنا حسبي الله عليكم فلوس ومدرسيين وسهر وتعب كلها راحت علي الفاضي الله لايوفقكم من وزاره حوبه عيالنا ماتتعداكم ان شاء الله"
1081848716418600960,KW, الامتحان صعب انا ولدي متفوق كل سنه والحين بس يتمني ينجح من صعوبه امتحاناتهم  عارفين انهم يبون يكيرون النسب عشان الجامعه  بس شذنب عيالنا يدرسون ويسهرون ومدرسين وفلوس وذاكروا كل الامتحانات السابقه وسووا اللي عليهم  وتالي يصدمونهم بالامتحان هذا ما اقول الا حسبي الله ونعم الوكيل
1081851353234837632,KW, خاف الله في نفسك  لاتعمم علي غيرك ويحوشك حوبتهم  انا ولدي متفوق كل سنه وناتقل نسبته عن  واليوم اول مره بحياتي اشوفه طالع من امتحان وهو مصدوم  تعب وسهر وذاكر ومدرسين وعطا الرياضيات فوق حقها والنتيجه امتحان تعجيزي عشان مايقبلونهم بالجامعه لاتعم علي العالم وتقول دلوعيين
1081903932216102784,KW, ماتخافيين من الحوبه  سؤالين اكثر من  من الطلبه ماعرفوا يحلونه  انا ولدي متفوق من صغره نسبته العام  اول مره بحياتي اشوفه طالع من امتحان متضايق شلون تقولون مو دارسين ولا اغبياء اتقوا الله بكلامكم نفسيتهم تعبانه وانتم تزيدونها بتعليقاتكم السخيفه بدون مصداقيه
1081937461813612416,KW, استاذه فجر  انا ولدي كل سنه من المتفوقين ونسبته ماتقل عن   اول مره ولدي يطلع من الامتحان واهو مصدوم واول مره يطلع متضايق من ماده وهو طول عمره من الفائقيين  جابولهم النفسيه واليأس والاكتئاب مهما درسوا وتعبوا مايحصلون ثمن جهدهم يرضيج الظلم والتعسف عشان ماعندهم اماكن بالجامعه
1084854564350816384,KW,  الله يشافيه ويفرحكم بسلامته
1093439768942297216,KW,  من  فبراير واهي عندكم وللحين مانزلتوها  شناطرين العالم تبي معاشاتها
1093831319958835200,KW,  والله يا اخوي كلامك صج  شلون تنظف الديرة من هالفاسدين ووراهم ناس تطبل لهم وتدافع عنهم عشان مصلحه وواسطه اوصلة قرابة  مانقول الا حسبي الله علي كل ظالم وفاسد باق من الكويت سواء قبيضة او سراق مال عام عسي تصرفونها في علاجكم
1094614147797581824,KW, اختي ممكن خاص بسألج سؤال
1100780334747139968,KW, ضمير الامة والله لك وحشه فاقدينك بالكويت  الله يفك عوقك يارب ونشوفك بينا مره ثانيه
1133051565164650368,KW,  الله يشفيها ويقومها بالسلامه
1134370098368655360,KW,   يعني اللي يبي هندسه وبيروح للبعثات الداخليه يقبلونه من غير قدرات
1134989359588007936,KW,"مبروكالتفوقفاطمه 

مبروووك التفوق يا فطومي عاشت بنت الكويت غصبن عن اللي مايرضي وان شاء الله نشوفج دكتوره يا رب"
1134990100163629056,KW,"مبروكالتفوقفاطمه
حطينالج قائمة  بروحج في ترند بتوتير يعني شي فخم يليق بنسبتج وتفوقج  وتستاهلين يابنت الكويت"
1141291705142038400,KW, مايمثلنا ككويتيين ابدا  وبعدين الغزو اظهر لنا نماذج الرجال الحقيقيين اللي دافعوا وحاربوا واستشهدوا عكس النوعيه هذي  واظهر لنا الصديق والجار اللي وقف معنا ومعروفهم  علي راسنا من فوق ومحشومين يا اهلنا وعزوتنا من اقوال بعض السفهاء
1153994194295435264,KW, مصعبين علي عيالنا يدخلون الصيدله بسبه قدراتهم ويخسفون بنسبهم ويروحون يطلبون من برا قبلوا عيالنا وخلهم يصيرون صيادله وتكتفي الديره فيهم  خو مايصير عيالنا نسبهم فوق  وماينقبلون صيدله بسبه القدرات ومصر تقبلهم بنسب 
1154001850615644160,KW,  المستفيد الحراميه والبواقيين والقبيضه واهل الرشاوي والواسطات واللي مايخافون علي مصلحه البلد ولا علي شبابها اللي اهما عماد هالوطن واساسه مانقول الا حسبي الله علي كل شخص انتهك حقوقنا وحقوق عيالنا 
1159040368853340160,KW," 
 الحين ولدي عمره  الا جم شهر ترفضون تفتحون له حساب ليش ابي افهم  شلون ياخذ اعانته الجامعيه ترسلونها له بالبريد مثلا تعقيد بالامور بصوره مو طبيعيه سمعه بس حجي ولافعل ماكو"
1162680362163683328,KW,"الخشرمالبدونمخلفاتالسعوديه 
اخواننا السعوديين والكويتيين لاتفرحون العذال بالهاشتقات اللي تسبب فتنة وفرقة وسب بين الاخوان  ترفعوا عن هالامور  الكويتي اخو السعودي والعكس صحيح  تربطنا قرابة ودم وجيره  لاتخلون الاعداء يوصلون لهدفهم  اميتوا الباطل والفتنة بالتجاهل"
1165688367180333056,KW,"صباحالاحمدالصباح
الله يخلينا ابونا صباح ويطول بعمره وحسبي الله علي اللي ينشر هالاشاعات  خاب رجاهم يعله بعدوينه مو فيه"
1167295310038745088,KW, ياعل الجني يركبك قول امين
1177648448495116288,KW,   الله يحفظ مصر من هالفتنة  ما ادري ليش يحبون يضرون بلدهم  مايشوفون سوريا وليبيا يبون يصيرون نسخه ثانيه منها  اتقوا الله في بلادكم لاتدمروها ولاتخلون الاجندات الاجنبيه تستفيد من ثوراتكم الباطلة 
1177721669466693632,KW,   الله يحفظ مصر هذا اللي نقدر نقوله
1001533768178561024,KW,"دعوهخيرلصدامحسين  
مو محللينه ليوم الدين والله ينتقم منه علي اللي سواه بديرتنا وشعبنا وحسبي الله علي كل شخص يدافع عن هالمجرم"
1002691487929389056,KW,  بنتابع غصب معاكم بكل شي  شمعني نشوفكم بكل سالفه قاطيين ويهكم  الحين دورنا
1002746785381670784,KW,"محاكمةمنىالمذبوح
انا سافرت مصر كثير وشفت سلبيات كثيره مثل اللي ذكرتها مثل التحرش واوبر  لكن هالامور موجوده بكل بلد مو مصر بس  المفروض انتقدت بطريقه راقيه بعيده عن السب والغلط المفروض تطبق المثل اللي يقول ياغريب كن اديب لكن التطاول علي الجميع امر مرفوض لازم تحاسب علي كلامها"
1003291519284113408,KW, شنو ذنب الطلبه اللي يتعبون ويحصلون نسب عاليه ويضيعها عليهم القدرات شلون الواحد يضمن القدرات احسها هم ثاني غير هم النسبه
1004915961667964800,KW, دنيا اصلا ماصار لها حوار مع اي شخصيه غير ندا وكله تستخبي وتطلع في اوقات غريبه اتوقع انها خيال وكانت ميته مع ابنها من البدايه وطلعت لها من كثر حزنها علي بنتها
1005679815448563584,KW, وييه ماتسوا عليك هالتغريده كلهم اغسلوا شراعك كنت برد بس ماقصروا فيك  عشان جذي رحمتك 
1020719000152690816,KW,"الشهاداتالمزوره
هي واقفه علي الشهادات بس  الديره من الفسااد قامت تحتضر الكويت قاعده تضيع منا بسبه هالعالم اللي ماتخاف الله حسبي الله ونعم الوكيل بكل من ضر الكويت وشعبها عسي حوبتنا ما تتعداه وياعل كل فلس خذاه بالحرام يعله زقوم ببطنه اهوا واهله يارب ياكريم"
1020757305292468224,KW,"الشهاداتالمزوره
انا دارسه في جامعه الملك فيصل انتساب وطبقت عملي متوسط وثانويه وامتحنت ونجحت وسقطت اليما تخرجت ورفضوا يقبلون شهادتي الصجيه بحكم انها انتساب وانحرمت من التوظيف بسببها  وغيري شاري شهايد ومزورها وماسك مناصب وله كوادر وحوافز شنو هالظلم لمتي ديرتنا تمشي بالمقلوب"
1043618161805922432,KW, أخت منيرة ممكن خاص  بسالك بخصوص الايتلس
1046136669869670400,KW,"الكويتترحببمحمدبنسلمان   
مرحباااااا مليون بولد سلمان الحزم 
يا هلا ومرحبا باللي لفانا يا هلا 
الكويت كلها ترحب بمحمد بن سلمان"
1058685225298026368,KW, الله ينصرهم بس ليش ما ذكرتوا الجيش الكويتي
1063378830860140416,KW, هذا اللي ناقص بعد  مايبون الشعب الكويتي اييهم ويحاكمونه كله بالمره ومنها يصادرون البترول شنو هالمسخرة
1077153122504589184,KW,  انا منصدمه معقوله اكو امور جذي تصير بالكويت  خو ندري اكو بوقات وسرقات وقبيضه لكن اغتصاب وشرف ومن الداخليه الصراحه مصيبه لو هالحجي صج  لاحول ولاقوة الا بالله وربي مصيبه منو يحس بالامان بعد هالسالفه
1077153985004474368,KW,"هندالصبيح
الحمدلله من دعاوي حريم الكويت وكره الشعب لها فرحانيين انها فكتنا من شرها  قطعت معاشات الارامل والمطلقات والمعاقيين عشان توفر جم دينار للحكومه علي حسابهم  والكويت كل يوم ملايينه لبرا  واحنا بنات الديره مناشبينا بجم دينار اللي يعطونا  لابارك الله فيج من وزيره"
1077155033878355968,KW, شنو انجازاتها  غير تفضيل الوافدين  وغير انها تسلطت علي بنات الديره وضايقت الارامل والمطلقات والمعاقيين بطلباتها التعجيزيه خااف الله اي انجازات شوف شعب الكويت فرحان بخروجها
1077155983519113216,KW, ياشين الشعور لما يصير الانسان مكروه ومنبوذ  هذا شعورها حاليا
