id,dialect,text
713144814636806144,DZ," 
اكيد وانت مرحتش ترقص رحت فقط تحضر حفلة بش تستقبل سهيلة 
والله يرحم كل مؤمن يارب 
معيشينش معك وما يعرفوش وش في قلبك بش يحكو"
713838331424030720,DZ, شكلي اطرش في زفة خير وش صاير
714418204332924928,DZ," أولا هذا هشتاق يدخلو غي لحب و لي ميحبش يدخل يقدر ما يدخل ما يشوف
مش ضروري
كاين هشتاقات انا مندخلهاش لأن منحبهاش"
714610925475643392,DZ,"      يمكن متعودة تشوفه بزاف وتعرفو كثر
لكن هي تحب كامل فانزها 
الله يبارك في ولاد بلادي "
715166318295662592,DZ,"     ليست شتيمة
لكن لازم تنقال بين أصدقاء فقط 
عادي بينتهم
اعتذر نيابة عنه"
717364852621197312,DZ, انا من زماااان عملتلك فولو 
717708218756165632,DZ,"    
خيرها في غيرها
واكيد رح تروح لمصر ان شاء الله 
لسى أيام جاية"
717861290002292736,DZ,"لاجلسهيلهمتحدين 
سهيلة توحشناك بزاف برشا هلبا وايد هوايا اوي كتير
 ربنا معاك و معانا ان شاء الله  
"
737417099228909568,DZ, حاب يقول جيبولي يماه ومن بعد ساهل ههههه
794521541467897856,DZ, يالطيف وين يروح من ربي
812396680129769472,DZ, كامي غدو غني فور قهري لبقر ههههههههه الامبراطورةكاميلياورد
817356258512666624,DZ,  ياعمري صاحب واجب  بصراحة
847771273610637312,DZ,  ما تقوليش دورك يغنو تورق ويتكلمو كيفهم ويقولو لهجة وجدة خخخخخخخخخخ
848446341592363008,DZ, ربي يخليك نحبوك بزاااف ونموتو عليك
848447438146994176,DZ,"ومشكلة اكبر شعب لي متحرك يدافع على ثرات
اما وزارة قاعدة تتفرج وهدا لي مخليهم يزيدو
يسرقو وهدي مش اخير  
 "
848448322809602048,DZ, شكون هدو ومنين خرجو حبو يشهرو نفسهم بسرقة ثرات دزير ويعملو ضجة  بصح راح يدفعو ثمنها غالي
848501442566656000,DZ, علاش ما عرفتهم على غناهم وغنات اعطني صاكي بغا نماكي بغا نبان ليوم زوينة تشوف يمدو لها باااز فضي ههههههههه
848581377746497536,DZ,سهيلهعشقلاينتهي  نجمه شابه شعبيتها توازي كبار النجوووم تكلموا عن جمال بشرتها وعيونها الواسعتينروتانا قالت كذا مو نحنافخورين وفرحانين
848588352278462464,DZ,سهيلهعشقلاينتهي عجبني مقال موقع روتانا عنك سوسو مقال نجمة  ومازال اللي جاي واعر واعر 
850521621651652608,DZ,أ لف ألف مبرووك امولة بنت بلادي ربي يخليها ديما جنبك وتتربى بعزك من فانز   سهلاوي جزائري   
850645502534316032,DZ," ربي يجازيه على افعالو وينتقم منو  
رئيس يقتل شعبو بيدو ويحطم كل ثرات سوريا عتيق"
851075001604337664,DZ, اداهو حافض عليها راح تحطو جوات عيونها
863153784645660672,DZ, حمد الله لم اتفرج على حفل عار و اكبر تزوير وسهيلة نافست فنانين في صف اول واخدت اصوات هائلة مفروض هيا فائزة لكن صارت تشرى
864008088092901376,DZ,   امل ممثلة كبيرة يعني افضل ممتلة عربيا وسهيلة وجوه شابة  
864128175126831104,DZ,   فانز امل على عين وراس لكن نشك نتي منهم مش معنات دايرة صورتها منهم فانز رقي ومش نتاع تفاهات مرهقين مثلك حرباية
865707499772661760,DZ, تسلمي يا بنت شام كلك زوقنشاء الله نشوفوك في جزائر  تغني في حفلات  نحبووك بزااااف فانز سهيلة بن لشهب
867143524583702528,DZ, بنت عمي شابة الله يبارك
868428648923136000,DZ, الله يشافي ولدة ويكون معاكم
868479686506143744,DZ,  الف مبروووك كاااامي صوت و احساااس و لا اروع ابدعتي بنت بلادي حساسك مش معقول الله يبارك هذي الاصوات الي تفتخر بيهاالجزائر
869712201967382528,DZ,شكون حنا حنا لي في معركة رجال ومايخفوش من موت 
869714463208996864,DZ,  تحية لكل عرب وتحية المتألقة سيرين كل مرة تخلينا نعشق اكثر يا ليت نشوفها في دراما جزائرية  الخاوة
870074234579668992,DZ, الف مبروك ستاهل صوتك ساحر بصح ما كنت بعرف انك تلحني وتكتبي برافوو
870747391485513728,DZ, حبيبتي كنتي ولازلتي خير سفيرة اللهجة الجزائرية
870820520027189248,DZ," كامي هنيك لحبك ودعم ولاد بلادك برفوو كاين مسلسل  عاشور عاشر  كوميدي على شروق   
الخاوة  صمت أبرياء 
ببيشة وببيش "
874027149791027200,DZ," مرسي يارا ربي يخليك 
ان شاء الله جزائر تفوز"
874384363013775360,DZ, صدق والله عاشور عاشر بيموتنا من ضحك ويحكي واقع نتاعنا
875880310407397376,DZ, كامي اهم شي في فن أخلاق وراح تكوني فنانة في صف اول و الله راح ياخد حقك فلا تبالي خليك كبيرة وراح تشرفي
876774674574848000,DZ,  الله يحطك مكانها ورخيس لي ما يحس بإنسانية وكلب اوفى واحسن منك يا اشباه رجال
877229927208280064,DZ," تحيات لك من فانز سهيلة بن لشهب تستاهلي أكثر نفرحو بزاااف لو نشوفوك عندنا في جزائر ومع أمل بشوشة في مسلسل واحد
نحبوك بزاف"
877294646434648064,DZ," رابعة  ربي يخليك ديما كلام عسل نحبك بزااف ونشاء الله نشوفها ضيفة عندك وامل بشوشة وسهيلة بن لشهب راح نفرح اكثر 
"
878375781289914368,DZ,  حسان تووووب برك هو لي غضاء على اخطاء ممتلين اخريين وخصوصا جدد
878380858847223808,DZ," الخاوه
حلقة الاخيرة نهاية مفتوحة ومشوقة واهم شي حسان هو محرك مسلسل تووب وغطئ على كامل ممتلين  وباخص بعض جدد"
878381175147962368,DZ,مبروووك يستاهلون ومزيد من نجاح 
878678067136409600,DZ, جزائريين كان حبو يحبو من كل اعماق قلب اروحي زورينا وراح تشوفي نحطوك فوق راس وتفكري ترجعي مرة اخرة لكرمة جزائريين وحبهم
878683393042649088,DZ, صالعة قمرررتهبلي بزااااف ربي يخليك 
878685801063874560,DZ,  واش صار بعد في رواء وايف و حد ما سمعهم
879664581014151168,DZ, احنا جزائريين ما بنخاف الا من لي خلقنا الله سبحانو وحنا معاكي ولاد بلدك وجمهورك تحية لك من فانز سهلاوي
879665270457085952,DZ,جزايري راسو مرفوع خليك هكا ولاد بلادك معاك والله راح ينتقم من ظالم حسبي الله ونعما وكيل فيها 
880152839514935296,DZ,  كلامك صح رجاء يقول حق وما بيخاف عكس بعض اعلامين يهمهم مادة وارضاء اصحاب النفود وتحلاب للبرني
880547146784583680,DZ,  قلتيها يحبو غير براني خليهم يقفو مع كامليا منبعد يجيبوها تغني في حفلات حسيتها عدوتهم ومش دزيرية
881121347216211968,DZ, جمالك جمال جمالك جمال مش عادي   بصوت يارا تهبلي بزاااف
881659207870795776,DZ,"  تسلمي ربي يخليك نحبوك بزاااف 
فانزسهيلةبنلشهب 
الخامسجويليةكنجزائريا  "
882656007196946432,DZ,  تسلمو انتو وفنانتكم حبيبة يارا معشوقة جزائريين كلنا نحبوها بزااف
882694312638787584,DZ,ادا حب جزائري حب من كل اعماق قلبيه ونحنا نحبووووك بزاااف يا بنت شام الله يحفضها 
883027002013491200,DZ, شو بيها امل وعلاش صحفتنا ديما تهاجم ولاد بلدها لهدا حد صار اعلام متدني
883659966183346176,DZ, هدي فموقع بصح نلبسو هدا ثرات بلادي ونفتخر بيه
883772331604291584,DZ,  اول مرة نشوفها صح صوتها رائع تستاهل عالم عربي يسمع صوتها
884004971016052736,DZ, هدا مسبح متنقل في اي مكان تحب تسبح
884117970385088512,DZ,هدا اصوات روووعة وين كانو متخبين استادة احلام ركي مهتمى ب فايا يونان تستاهل دعم 
884118970181320704,DZ, يااا نجيبو ليهم جن بالحمر يحل ازمة كرة ارضية ومريخ 
884536348891385856,DZ, اكيييد ياروووو ونتمناء تجي للجزائر وراح يعدبك هواء هنالما تجي معذبنيهواء  جزائر 
885217855251394560,DZ,     كلهم حلوين لكن سيرين طبعااااا
886319636320583680,DZ,"اموتهبايديا 
 ألف مبروك من فانز سهيلة اكيد راح تكون قنبلة وتنجح ومزيد من نجاحات"
886345518238097408,DZ,هدا هو نجاح أكبر 
887067681953898496,DZ," مليون مبروك من فانز سهيلة فحلة ما يقدروش عليك
وكل ولاد بلادك معاك حتى لو ما غردو دزيري ما 
 يخلي أخوه"
887987956023255040,DZ," انا سهلاوية من فانز سهيلة بن لشهب نقول ليك لكي تعرفي دزيريين وفانزك توكلي على ربي وتشوفي راح تولع لعالمية
دانس
اموتهبايديا"
908438424138534784,DZ, يلبس وحدة بأربع حروف
912080409890115584,DZ, ههههه  سرك في بير
933453829898678400,DZ,أنا على دين أبي ونقطة خارج السطر
961315608817164416,DZ,"الجزايريينبطبعهم
عندهم كلمة وحدة يتعجبك يمتعجبكش"
970391355380895616,DZ, و الله عندك حق 
970709117315813376,DZ, و الله الطعنات الثلاث بيوجعو جربتهم كلهم
971455041990287360,DZ, حلوة حبيت العراقي كثير انجاز عظيم 
971800226267836416,DZ,متت يا أمي و أنا علي قيد الحياة 
972888324426919936,DZ,"تمشى عدل ما حد يحبك و يغليك 
خليك حقير تشوف عز و معزة 
اسمع كلامي يالخوي بدي اوصيك 
إلي ما يعزك باهالزمن لا تعزه "
994630891078070400,DZ, راح نقولو لي راح أو ولا واش من بنة خلا 
1004781600385785984,DZ,     الخضر كان كبير قبل ميجي هو اه ياربي واش او صاري
1004881292616519552,DZ, يعني احمد عز معندوش تويتر او انستجرام او اي وسيلة لتواصل عندي مدة وانا نحوس على حساباته بس للاسف معندوش
1005245703524888576,DZ, عندهم الحق انا منهم منجيش المشكل مارهوش في اللاعبين رانا نشوفهم كامل في النوادي دياولهم المشكل راه في ماجر وزطشي لي رجع المنتخب تبزنيز
1006909987929673600,DZ, الجزائر معروفة بمواقفها منداك نحس انه حنا كشعب وحكومة مكاش كيما حنا مواقنا تدرس
1007327620202225664,DZ,     حسبي الله ونعم الوكيل في لي كان سبة ومتأهلناش
1007754363769680000,DZ, يمكن تونس و مصر اذا عدلت الهجوم ويحبسو لعب للورا
1007755015686156416,DZ, يمكن تونس انا حاسة ان تونس راح تعمل شي
1008389388819206016,DZ, حتى انا مفهمت والو واش صرالهم 
1014844622458249216,DZ,  كامل ملاح انا هدا وين كملت سمعتهم كامل
1024992247744552960,DZ,  قنوات الصرف الصحي هدا فاش فالحين ماشي نحطو اليد فاليد باش اوالي المنتخب قوي لا م الاول يعطوه الله اعينه بصح راح يقدرلهم على هذه فرحت كي جابو جزايري
1035944989551943552,DZ, الشعب ديالنا حاشا ليميستهلش متمشيش معاه عقلية التحسيس لزم تدنالو لجيبو لزم ليرمي اخلص ولا والله ما راح يخدمو ويتربو
1042482143740547200,DZ,عم شوف الحلقة ومع كل لقطة اتحمس اكتر  
1045636811685580800,DZ,    صحيح القصة مأثرة بس مثل ما قلتي كارادينيز ماتركلنا مجال نتابع اي شي بعده بس حكايتنا نسبته عم تقل حلقة عن حلقة مقارنة بالموسم الأول
1050066091819638784,DZ, عم يطلع كان التاسع اد
1057788909508349952,DZ, اول تويت عجبني بعد الإعلان ههههه حتى انا فكرت مثلك اكيد راح اصير هيك
1111683606525689984,DZ, العبيد ميحملوش يسمعوا كلمة الحرية حنا ولدنا احرار ونموت احرار اما هم ملي زادو وهما ابوس في اليدين على هذه ميعرفوش نعمة الحرية
1112469218375753600,DZ, والله العظيم انا مخي حبس
1113458782955344000,DZ, مكان حتى وجه شبه واش رانا عايشين حنا دوك هما اعشوه على سنة
1129896230287532032,DZ, الهيبةالحصاد المعذرة لكل الممثلين بالوطن العربي كلكم على راسي بس تيم حسن غير غير عن الكل هو بكفة والباقي  بكفة الثانية اقل مايمكن ان يقال عنه مبدع إبن سوريا ع
1146770594530234368,DZ,  على شو راح نتخانق هما بس بيحبوا اكبروا الموضوع واصلا اذا كان على حكاية أم درمان خلاص القصة اتنست وطوينا الصفحة واحنا اخوات
1147609262736269184,DZ, خلي غدوة باش نهدروا
1148565911642812416,DZ, اصلا مين طلب منك تشجعي
1148566842878976000,DZ, مشان هذي النوعية من الناس ما راح نقدر حتى نحلم انه في يوم من الأيام راح نكون وطن عربي واحد موحد
1149339787050045440,DZ, واعرة ليوم تتوقعي الكوديفوار واعرين وراهم اقولو السخانة بزااف في السويس
1149356197616726016,DZ,واشنو هذا يازح كرة قدم ولا قتال وزاد خرج عطال اه ياربي استروا ما يكون بيه والو 
1151503222818955264,DZ, اخاااااه لوكان اروح اسمعوا وسخ ودنيه غير اريح وين راه او مليح
1152293098132824064,DZ,يا الخاوة انا منيش مامنة مربوحة ان شاء الله 
1153267598999654400,DZ, مين قال لك تعال شجعنا اصلا انت لو شجعت الجزائر تبقى إساءة كبيرة لينا
1184189113735548928,DZ,حنا عالميين واحد ميحبسنا شكون حنا حنا الجزائر 
1187717695145480192,DZ, ياخي لحاس ياخي كي خلاص الحراك علاه راهم خايفين حلو الطرق لي غالقينها للعاصمة تشوف الحراك لحبس تحبوا الذل والعبودية متحبوش تعيشوا في دولة القانون والديمقراطية لزم تحسوا كاين لعافس عليكم باش تعيشوا
848218642890326016,DZ, كمال مو غبي يعترف بشي ما عملو اكيد فيه خطة بديلة
848279209298362368,DZ,  انت مو انت وانت زاطل ههههه
848292195258040320,DZ,   اعطي بلوك بنت بلادي محملهاش كي قتلو راك زاطل عدمي التراث اسرقو ويزدو هوما يحلو فمهم
848296535301521408,DZ,  ههههه قوليلو اروح الم خياتو من الخليج على خاطركش انا اعطيتو بلوك هذا زطايلي
849620175892729856,DZ,  انت قبائلية ونص الهدرة كيما حنا برك نتومت تزيدو ش وحنا لالا
849708145962344448,DZ, انا كمان مو فهمانة شي
849726739819450368,DZ, طوفان يستاهل هذي النهاية لان كمال ساعده ولقالو امه بعد سنوات كان مفكرها ميتة وهذي اخرة ليعمل خير
852238332729987072,DZ, انا بدي اقتل اسو وخلاص صرت ما أتحمل اشوفها الزرافة
852242159499714560,DZ,  يعني شو هدف الكاتبة من هذا المشهد لور مو بوراك موجود بالمسلسل لسحبت عليه  من زمان يعني الكاتبة بدها تجننا بففففف
852244680813236224,DZ, الكاتبة راح روح لتركيا خصوصي مشانها يعني مشاهد دينيز وامير ملها داعي ابدا يعني بدها توصللنا شو بففف واسو امتى يعرفو حقيقتها تعبت
853288504121593856,DZ, اشوف الكل متشائم حب كمال ونيهان ماراح يخلص راح يرجعوا لبعض تفاءلوا ياكرتسفداويين
853914380441968640,DZ, اذا تفترقت نيهان وكمال ومارجعو لبعض الحلقات الجاية فاكيد فيه موسم ثالث
854691980495990784,DZ, انا كتير متحمسة لهذا المشهد اكيد راح ابكونا معهم 
854762915366305792,DZ,    انا بحياتي مشفت انسان بلا كرامة مثل زينب حقيرة غبية شخصيتها ماتغيرت من الموسم الاول وهي الزفة بأمير تافه
854810052884090880,DZ, يعني هذي الحلقة بينت مدى قوة حب نيهان وكمال وتشبثهم ببعض  مدى خبث امير لي ما أتمنى نده ولا ذرة كرامة ليك يا اخي  سنين وانت تحاول
854810877308043264,DZ, اورع عائلة شافتها عيني وتز في امير مهما تحاول ماراح تقدر تفرقهم سنوات وانت تحاول ماقدرت بلا كرامة تف عليك 
854811454939287552,DZ, الله ياخذه امير مايخليهم يتهنو بيومهم 
855010203376463872,DZ, بوراك ونسليهان ابدعو بالحلقة
855152815987204096,DZ, اليوم بوراك قال لصحفي انو باقي  حلقات وبينتهي المسلسل ومافي موسم ثالث يعني خلاص حب اعمى
855152989929164800,DZ, هههه قصة فريحة يعني بمشوار امير
855153624258936832,DZ, بوراك صرح لصحفي سأل كيف المسلسل قالو باقيلو  حلقات وبيمتهي يعني مافي موسم ثالث يعني حب اعمى راح يخلص  
855170803561893888,DZ,  لا راح ينتهي وقال عنده فيلم بالصيف
855408853747462144,DZ, وضعية ليقلون نيهان متليق مع كمال وووو شو رايكم بالاعلان حيبولي لجمع هذول الثنين بمسلسل افضل كوبل مر بالدراما التركية اعطيه بوسة
855409939791085568,DZ, اجمل من هيك مافي افخم كوبل الاعلان يهبل 
856122797436882944,DZ, الكاتبة اذا عملتها وانهت شخصية ليلى بتطلع غبية يعني بكل مرة يجتمع كمال ونيهان يدفعو الثمن وغالي والسيكو دائما الربحان
856123155206868992,DZ, انا مابدي امير اموت لان بموت راح يرتاح تنا بدي ينشل ويعيش ويشوف نيهان وكمال اجتمعوا مع بعض في بيت واحد مافي شيء  راح يعذبو اكتر
856123514579038208,DZ, انا مافهت الكاتبة شو هدفها بكل مرة تطلع امير الكسبان وبكل مرة نيهان وكمال يدفعو ثمن اجتماعهم بففف الكاتبة اما غبية او غبية لول
856540412898660352,DZ, يعني امير مجنون وماراح يستحي على حاله بدو البنت بكل عين وقحة 
857314056142819328,DZ, السيكو حتى امه وطفشت منه   
857926680387694592,DZ,  مو صحيح بس صحافتهم غثيثة سألوه عن اللايك لعملو ازجان دينيز لفهرية حبيبها السابق وهو عمل نفسو ماسمع وما رد على أسئلتهم
858364310720057344,DZ, الاعلان مافيه شيء جديد مبين انو كمال ماراح يصرلو شي بس انا انتظر لحظة خروج كمال ونيهان تجري عليه شو وضعيتو امير هههههه
858364681756475392,DZ, بيطلع ونيهان تجري عليه وانت متحمسة لهذا المشهد بس لحتى اشوف وضعية السيكو ههه
858365361502265344,DZ, هو مريض نفسي سايكو مابيحب حدا شخصيته مقرفة حتى امه طفشت منو
858377388014673920,DZ, في اخبار تقول ان بوراك بقالو بس  حلقات شو يعني راح اموت ولا شو
859044521698619392,DZ, الاعلان      وايهان بدا انتقامه وليلى مابظن ماتت مستحيل وضربة كمال لامير يستاهل
862744140664242176,DZ,  انا خايفة من اسو تهرب وتقتل كمال او نيهان
863126650988482560,DZ,  حبيت سويها كل جمعة
864184224416505856,DZ, ايه صح كل الشكر لستار تيفي والمنتج على الكوبل لماراح يجي مثله بالدراما التركية
864185111868301312,DZ, واخيرا لقيت فهمنين متلي متفي من كاريزما  بوراك وكان قدامو بيضيع
864874108714196992,DZ, ليش ما تسافر بلدان عربية  أحبك لؤي موفق
865295286394138624,DZ,  هههههه لا و الله حلوه انا بلدي حلوه كثير في اماكن ما راح يلاقي مثلها في اي مكان بالعالم و لا شنو 
865648544161476608,DZ, برافو نطق صحيح  والميكس طلع بزاااف شباب رائع
865931201881808896,DZ, واخيرا هرمنا عشنا وشفنا خطوبة نيهان وكمال
867059608367620096,DZ,مكآنش لي لقآهآ كيمآ بغآهآ  لحآجة لي مآشي مكتوبة  مآ تكسرش راسك معآهآ
868080083973623808,DZ, ناس لغربة تحسو بيها خاصة في العواشر كيما رمضان العيد ربي معاكم
872285155322363904,DZ,"لساني طويلبس مؤدبه
وجريئةبس بستحي
وسكرانهبس مابشرب
وكل شي خربان بس زابطة معي
كيف الله اعلم "
873200209790205952,DZ, ريم كانت مثال حي عن جزائرية النيف والخسارة وميهمها حتى  واحد
873202699898163200,DZ, في اخبار تقول انه بوراك ماراح اكون في الموسم المقبل بس ان شاء الله اكون الخبر صحيح ونشوفو كمان الموسم القادم
