id,dialect,text
1129402894741135360,AE,  في فترة من الفترات تم توزيع جوازات مختلفة عن جوازاتنا نسيت شو يسمونها لكن تم سحبها وانطلب منهم استبدالها بجزر القمر أعتقد الله يكون بعونهم أعرف شباب عندهم جواز من غير جنسية اذا قلنا أساميهم ما أتوقع حد يصدق ان لليوم ما نعتبرهم مستحقين للجنسية
1129415289668550784,AE,   تراهم عيال البلاد أقسم بالله ما يعتبرون أعمارهم إلا انهم منا وفينا و ولائهم للبلاد وإخلاصهم بعملهم بمؤسساتنا ينضرب فيه المثل اللي بيتكلم عن شواذ كأمثلة ترا يا كثر الشواذ بمجتمعنا كذلك طموح ولاة أمرنا كبير والتحدي محتاي لكل رجل مخلص يشيل الأمانة ويانا فأتمنى تجنيسهم ودعمهم
1129488770103947264,AE,  السنة الياية النصر بينافس على بطولة الدوري احفظ هالتغريدة بالمفضلة 
1129677170790608768,AE,   كنت ناوي أودي اليهال الألعاب و أطبخ اليوم خلاص هونت
1129891174628646784,AE,  أتفق اللي قهرني محد وقفه عند حده
1130452707473543168,AE,  والله انك صادق المشكلة تبعاتها بتطلع بعد  سنين وتعال رقع بعدين
1130760438201892864,AE,   كثير الكلمات اللي تنقال بالبداية والنهاية تثير العواطف حتى نبدأ بأنفسنا نحسن النية وبالتأكيد أخذو موافقتهم لاحقا
1016657055141322752,AE,  ودي أرد بس الردود تبين مستوى الوعي واستحالت الاستيعاب
1017326160357838848,AE, يا سلااااام عليج عموه المهم شو تحطيلنا عالطاولة  وما تسألين ماك أي سؤال وقت اللعب
1017762409438728192,AE,   يايني ريال مطعمي يباني أدفع له للدعايات قلتله راويني كم واحد بيتابعني بدعاية وحدة وبعدها نتفق غصبته سواها واللي تابعوني  من أصل  ألف متابع 
1024164266998476800,AE, انت شو عرفك أكلات عالمية تكون صالونة بالروب بالهند والبرتغال وغيرها انت بس أطلق العنان للشيف اللي داخلك 
1024563390579138560,AE,  أخوي أحمد بارك الله فيك الحمدلله نحن بخير ونعمة وما نحتاج حد يذكرنا بالذات على قناة رسمية وبتوجيه الكلام لشخص معين كأن اللي ارتكبه ينتقص من شيوخنا ولا من النادي سرد الأمور بهالطريقة وبإصرارنا ان لازم نقول من وين يا  كأننا نلمح انه ملك للنادي وأتوقع هاي العبودية الي فيصل ذكرها
1025739642224685056,AE,    تعبانين بعد  حاجز مرتين وبالمرتين يكنسلون حجزي بآخر لحظة كلهم تعبانين قمت أتصل دايركت بالفندق وأريح راسي أو تعامل دايركت مع أبناء السويدي
1026071566965268352,AE,     ماشي مقارنة أخوي لأن الهنود معظمهم شغالين ببيع الرخص وبحكم علاقتهم ببلادهم فسهل يجلبون عمالة أرخص وفوق هذا يدفعونهم قيمة الرسوم مكدونالدز وغيرهم عندهم قاعدة ضخمة تتوزع عليها التكاليف بعكس اللي عنده مطعم واحد
1026154484425285632,AE,     أستاذي الغالي هل عندك خبرة في هذا المجال عندك فكرة عن اللي ينحط بالأكل الحمدلله عيال البلاد عندهم وعي أغلبيتهم وما يرضون باللي يسوونه غيرهم الوافدين اللي تتكلم عنهم مثلا يبيعون المشاوي مع ملحقاته أرخص من سعر اللحم بالسوق ما سألت عمرك كيف
1026451240484564992,AE,     بارك الله فيك اخوي انت تقارننا بالهنود والوافدين اللي ما يشتغلون بهالمجال فالمقارنةغير عادلة اذا قارنتهم بالمواطنين بنفس السوق واللي تتكلم عنهم معظمهم جداد بالسوق وتكلفتهم التشغيلية عالية والدليل ان لو يشوفون التشبع بالسوق من البرغر ما كانو دخلو فيه
1026452297583349760,AE,     أعطيك مثال بسيط الشوارما رخيص لأن اللحم المستخدم برازيلي وحتى يرخص سعره يشترونه من المورد قبل ما ينتهي بأيام معدودة يعني صالح للأكل ولعلهم يحطون فيه الملح الياباني المطري للحوم واللي يعتبر من أكثر المواد المسرطنة وما عليه أي منع صحي بالبلاد يعني كل شي بالسليم
1026454231056834560,AE,     بالنسبة للبرجر مثلا تعرف ان الخبزة الوحدة تكلف  دراهم عند البعض لأنه يستخدم خبز بدون مواد ضارة ومش اللي متعارف عليه بالسوق التعميم غير عادل وأنا معاك ان البعض زودوها حبتين بدون جودة والسعر عالي يبقى نقول عليهم البعض
1026831574246072448,AE,  شي نوع يكون مكتوب عليه كريم أحلى بوايد
1029110321150078976,AE,  الغالي شو السيارة نبا ندعمك
1033066152120004608,AE,"  السموحة منك أخوي بس لكن شفت تغريدتك بعد المقطع هذا وسألت نفسي هل يحق لنا نضحك على هالشعب وهل تعتبر غيبة

"
1033375335264530432,AE,  دكتور لا تسو فيها برئ شكلك عارف بيفهمونك غلط من قبل ما تحط هالتغريدة 
1035060367632859136,AE, انت حالف يمين تفجر مرارتهم 
1036296781271851008,AE,   يا رجل مستحيل تصير بالبلاد
1039460594221543424,AE, برنامج غيث اللي شفناه برمضان كان أكثر من رائع وأتمنى يستمرون فيه
1039463343709454336,AE,  تذكرتج هاك اليوم شو سويتي بالكوفي عالماي
1040537982145646592,AE, هههههه خير ان شاء الله  انت بس بتفكيرك بتوديك أم مايد ورا الشمس
1044539213864214400,AE, اذا تواصلنا مع أي مركز تسوق تابع لإعمار يقولولنا ما تقدرون تاخذون أي محل الا اذا سويتو الديكور عن طريق موردينا السعر أضعاف الطبيعي مو كفاية الايجار المبالغ فيه
1045585903656349568,AE, كمية النباح والنياح مش طبيعية بالتعليقات  لهالدرجة معورنكم بوفارس
1047149980610367616,AE, يعني مرخوصين ننتقدك أخوي دايفر 
1049259503651356800,AE, يزاها الله خير اختي وحرمتي اللي أصروا قبل زواجي ان بيكنسلون الزواج اذا خذيت بيزات ربا  بفضل من الله تيسرت أموري و الله بارك فيهم
1049375662283378816,AE,  كل ما الأطفال أعمارهم قريبة كانت علاقتهم أقوى ببعض ويساعدون بعض ويتنافسون من بينهم بشكل ايجابي أتكلم عن اللي بينهم سنة وهذا عن تجربة
1049699514859352064,AE,   هههههه أذكر يوم عرست تسألني الوالدة وعمتي ليش حرمتك مو حامل بالله شو أرد عليهم كل شهر يتذكرون هالسالفة يحسسونا ان مصير كل من يأخر الإنجاب هو الطلاق سالفة ليش متنان بدت بعد ما الحرمة حملت ههههه
1051151149720588416,AE, قدمت شكوى لهم وتوقعت يعدلونه
1056219203064266752,AE,  انت قول الله يتقبل منا بالأول على كثر الذنوب ما يحتاي نسير تايلند اللي نشوفه حولنا كفاية الله يرحمنا برحمته
1056221453677408384,AE,  المصيبة باللي طلع وتكلم وقال بندرس تأثير تعديل السرعة على شارع الامارات وبنشاركها الجمهور بعد  شهور مرت سنتين وما شفنا شي
1057247913145962368,AE, بعد ما جربت الاسكافي ما لبست غيره
1057361741351395200,AE,  عطني مقاس ريولك ويوصلك ما طلبت
1059132710202019840,AE, ودي أفضفض بس أخاف تحاتيني الله يرحمهم فوق الأرض وتحت الأرض
1059644433199710208,AE,  سمعت قول ان البرامج اللي تدفع عليها للخصم لا تجوز مثل ال
1061823754274291584,AE,  هههههه عاد أنا كنت جبان أذكر رحت لمدير المدرسة عالبوابة وقلتله خاطري أسير للخباز وما أبا أشرد شرات الشباب الله يذكره بالخير فتح الباب وقالي سير بس لا تصير شراتهم
1062621340849455232,AE,  هههههه تخيل يايبين مقص وإبرة على أساس أن تركيا ما فيها حليب حمير شو تتوقع
1063705849187745792,AE,  أسأل الله العفو والعافية هذا شي بسيط من اللي توقعته بعد الإعلان عنه الله يستر باللي ياي
1064485859339264000,AE,  دريولي يخبرني انه يوم رد الخدامة المكتب رشوها كف يدامه وهزبوها تمنيت صار هالشي جدامي كنت بأدبهم بس الدريولية يخافون حتى يشتكون
1064502935948877824,AE,  هاي لو تشوفك راعي مزاج باجر بترد البيت نسأل الله العافية الحمدلله شردت وما خربت أخلاق اليهال
1066314884483305600,AE, اليهال قامو يسمونهم علماء ويا ريت اذا طالع منهم شي
1067314504617345024,AE,  كذلك فرق كبير باللون وتقدر تفرق بينهم من بعيد بالنظر أما العضوي واللي بالزراعة المائية فطعمه يكون أقوى وأقل مرورة من العادي أحسنهم الفلسطيني تلقاه مختلف عن الكل وأجودهم ما تلقاه غير بكارفور محد يوقف يصفق شباب حلفت اتمون يالسين 
1067457317724131200,AE, والله شفت مواقف بعيوني الثنتين ههههههه بس ما يصير كل ما صار شي قالو عين
1069815524966707200,AE, المطوع هو اللي كان يحثنا على مكارم الأخلاق وكنا نستحي في حضرته لهيبته و وقاره اللي كان يعاتبنا اذا تأخرنا على الصلاة ويسأل عنا اذا غبنا ذكريات المطوع بفريجنا جميلة لا تشوهونه من باب الدعابة
1069970125246394368,AE,  استمتعت باللقاء وسعدت أكثر بالتعرف عن قرب على الشيخ كلامه بالصميم في ان نحتاج اهتمام أكبر بالتعليم و أكثر ما شغل تفكيري موضوع التطوع حسب مجالنا كلامه صحيح ان معظمنا نتطوع وتأثيرنا يكاد لا يذكر لأن أي حد ممكن يسو اللي نسويه الا اذا كان التطوع في تخصصنا
1070305953143230464,AE,  طال عمرج انتي تسألين اذا لحم بقر أو غنم لأنج ما تاكلين لحم بقر وعقبها تبينه مستوي عدل وبدون دم يسمونه ماي اللحم ولازم الجبن زيادة وأهم شي يحط فيه خس  زيادة واذا عنده جرجير نعناع بقدونس أي شي أخضر يحطه بعد بس بدون طماطم  نسيت شي
1070692029447979008,AE, يمكن شافت الموضوع نفسي وماله دخل  متعود يدلعونك بالبيت والدوام ومحتاج حد يقسي عليك شوي وبس  عالعموم لا بأس عليك أخوي وأجر وعافية
1072335815441874944,AE, طال عمرك نحن نزين الغرفة بالورد حتى اذا فتحت عيونها تشوف الورد وتتغير نفسيتها نحطلها طاولة عليها كل اللي بخاطرها لها ولضيوفها مع وحدة تخدمها نعسكر عند الباب حتى اذا فضت الغرفة من الحريم نونسها بالسوالف واذا نامت نمنا عندها نقوم بخدمتها والوالدة الله يحفظها تتصل كل شوي تتأكد
1072745207567917056,AE, قبل أي رتويت أتأكد انه بدون موسيقى وبدون أي شي جارح أخاف تحسب سيئة جارية نسأل الله يتجاوز عنا ان زللنا ويرحمنا بعفوه
1072873612141485952,AE, من كم سنة اشتريت شنطة من  شريتها من الفيستيفال سنتر وعطول سرت المطار مستعيل  كان عندي ترانزيت بمطار لندن وانصدمت يوم شفت سعره أقل ب بدون تنزيلات حلفت من عقبها ما أدخله
1073211015691726848,AE, تواصل معاي عالخاص اذا تريد تأجر مساحة فيها ممكن أفيدك
1073578755392724992,AE, لابس الفست الأصفر وهو راكب وفاصخه يوم نازل يعني مو لهالدرجة غصب يبون يمشون الشركة
1074950309028524032,AE, من يومين دخلت شارع لأول مرة صوب منتجع باب الشمس بدبي والسرعة مكتوبة  وسرعتي  بس مسكني الرادار و وصلتلي المخالفة من مرور بوظبي شدرااااني دخلت بوظبي
1074950581243076608,AE, يفكونا ويحطون لافتة مكتوب عليها رافقتكم السلامة مع تحيات مرور أبوظبي أهلا وسهلا بكم مع تحيات مرور دبي
1075420664314675200,AE, ضيف الكورنفلكس مع القيمر ودبس التمر وادعيلي
1075443870979252224,AE,  ها اللي قلته للحرمة بس يوم جربته يريت الصحن بكبره
1078551304790781952,AE,  المصيبة محد يشوف التقارير من يوم ما بدينا عملية الاستمطار لازم تكون في محاسبة ومراجعة للي صاير كلمني خبير عالمي أثق فيه وقالي انه شاف التقارير وانصدم من الإصرار بالاستمرار فيه لأنه رفع عدد المرات ولكن خسف في كمية المياه لتدخلنا في مجرى الرياح وعملية الاستمطار الطبيعية
1079400500393635840,AE,  خلنا نحسبها  يعني اذا وصلنا لسرعة  المفروض تتأخر  دقيقة فقط ههههه
1080415306420498432,AE, الحين المفروض ما نقول شي عسب محد يطلع ويقول انت ضد توجهات معازيبك ههههههه
1080885739037122560,AE, الحمدلله عيالي ممنوعين من الانجليزي بالبيت
1081523456523620352,AE,من كثر ما حشرونا عن المنتخب وكل مكان دعايات سيريالابيض حاس انه بنتمنى ما شاركنا من ورا صدمة النتائج
1082288799135211648,AE,  شو دخل اللي كتبتيه باللي قاله شكلك مغلطة بالعنوان
1084330850555179008,AE, مادري ليش اول شي على لساني كان فاه فاه شباش صح لسانك يالشاعر 
1084411704098898048,AE, أنا عني  أيام ومن عقبها أكره عمري أبا أرد البلاد
1085084565700575232,AE,    ههههههه تخيلتها الصراحة تخيل عاد الوالد كان يوعينا الفجر ويوم شافني مضيع الصلاة كم يوم دش الحجرة بسكين وطبعا كنت مستغرب قلت لا يكون راح صوب المكيف وقص وايره الأسود المتين من الطرفين ونزل فيه عظهري طبعا كان عسل عقلبي دام مافيها سكين وانحرمنا من المكيف أسابيع صج اصطلبت
1085570160705064960,AE,  شو رايك بهالرمسة يا سعادة المستشار الأسري
1085984739939491840,AE, الغالي ما أظن عندك غير الفنر دامك تبا الإماراتي واذا تبا شي ثاني تجربته مميزة ودهم مطعم أستادي وادعيلي
1086304159027134464,AE,  جرب السكر بدال الملح و إدعيلي
1087663863846371200,AE, وأنا ما أتخيل كيف كنت بطلع من غير عقال الوالد وخيزراناااااته اللي بالكبت
1087802733489516416,AE,  ذكرني بواحد الله يذكره بالخير قال جملته المشهورة انتو كله تبون فوز فوز
1088448387471437824,AE, بمطعمي بالامارات وقت الصلاة كنت أخلي الموظفين يصلون واذا حد دخل نقوله الحين وقت الصلاة فبيكون في تأخير بالخدمة  الحمدلله معظم الشباب كانو يتوجهون للمصلى ولكن كمية الشكاوي كانت مقرفة بس اللي مو عاجبه يقدر يطلع بكل بساطة
1089135538014224384,AE, كثير يصير أكون بإجتماع ونرمس انجليزي وأستوعب ان ماشي أجانب ويانا  أقولهم ليش نرمس انجليزي الكل يضحك ونقوم نرمس عربي  المصيبة ما أنتبه غير يوم حد خاطف ويعطيني نظرة شرات نظرتك ان عرب ويتفلسفون بالانجليزي ههههه
1089137211595984768,AE, طال عمرك عيب يعني يزورون مريض ولا يسوون مقابلات
1089861022385610752,AE,  صح كلامك أخوي  السموحة غاب عن بالي  بس يوم يكون ببلاش البيبان تكون مفتوحة وما يشلون بطايق دخول
1090180032570507264,AE, الله يخليك سو كابجر  مبلك نصنا وما نشوف شي عسب نضحك
1091076875282202624,AE, صادق ولكن محدودي التفكير ما بيستوعبون صفحات نملأها بالحب 
1091080437068374016,AE, ههههههه هاي من وين طلعت فيها
1091595269769216000,AE,  شيف أنصحج تسيرين دلق سهيل بالمباركية واطلبي من عنده حمسة فقع وادعيلي
1091988788732149760,AE, ههههه اللي يسمعك يقول كنت ماخذ شهر
1092073372966621184,AE,أعزائي من يومنا ونحن نرحب بكل الديانات والمذاهب وما نرضى عليهم بأي شي ما نرضاه لنفسنا معززين مكرمين وسطنا الحمدلله عيالي بمدرسة أمريكية وما عرفو عن المصخرة اللي تصير بالمدارس الثانية وما علموهم يغنون ويطلعون بالبدع اللي أشوفها بالمدارس الحكومية كترحيب للبابا
1092074111872974848,AE,نحمد الله على منهج دولتنا الوسطي ولكن استغلال الليبراليين وابداعاتهم اللي طلعت جرفت كثيرين عن جهل نسأل الله لنا ولهم العافية بحق ماشي فرق بنظري بينهم وبين الإخوان
1092126321705189376,AE,قررت مسح تويتر من تيلفوني لأن اللي أشوفه شي مو طبيعي أسأل الله لنا ولكم العافية الله يرحمنا برحمته لنا عودة بعد أسبوع ان شاء الله 
1092319237752930432,AE, بعد طلب الجمهور قررت أرجع 
1093028281908150400,AE,  الله يجملك بالايمان الغالي رووووعة التغطية وان شاء الله رمضان الياي بسير أتطمش
1093390652870659968,AE, حد يعرف وين العزا
1093920405511987200,AE,  ما أتوقع اذا فورت نايت ممكن
1095739465321058432,AE, عيب يا ليلى انتي لو تعرفين كم تعبت عشان أصيغ تغريدتي 
1096840255536279552,AE,  أخوي طارق فديت الكويتيين أهلنا منا وفينا وما عليك من اللي ينابحون يبون يثيرون الفتنة
1096847216558460800,AE, لك وحشة يالغالي وان شاء الله نتلاقى بالمعرض يوم الاثنين اذا الله أحيانا وكان لنا نصيب بشوفتك
1097125035276488832,AE,  موجود وعندهم فرع بدبي مارينا
1097442305374588800,AE,    ميراس وما أدراك ما ميراس حتى المطاعم المفتوحة هم يملكونها ويزاحمون اللي مستأجرين منهم أبا أعرف هاي كيف تصير
1098895162737155968,AE, أخوي عندي عاملات بالمنزل الحرمة تشوف ما لهن داعي يطلعون ويانا لكني أصر حتى يغيرون جو وأحاول أنا اللي أشوف عاليهال وحاجياتهم كأنهن مش موجودات
1099722120672829440,AE,   اشتكيت من قبل ولا حياة لمن تنادي يمكن مشيت نص ساعة حتى لقيت تاكسي وما طلعو سيارتي لين ما دفعت مخالفات عمري ما سمعت عنها عمرها سنوات قالولي ما تنزل عالسيارة والمكان اللي وقفت فيه مافيه أي علامة ويوم اشتكيت وصلني مسج تم رفض الشكوى
1100078204214300800,AE,   أخوي بدر اسمحلي عالسؤال بس بغيت أعرف عبير هي حرمتك الأولى بديت أتخيل من الحين واحد راقد بالشارع بوزار وفانيلة 
1100245734149050368,AE,  قال شو كان يسوي بالجزيرة غير الكتابة قابلته شخصيا وصدمني بكلامه لما خبرني عن عزلته بجزيرة والطقوس الغريبة اللي مارسها بمعبد
1100318395835265024,AE,  مريح نفسي وحاط شريحتين بتيلفوني لاتصالات و دو اللي يخون فيه النت أحول عالثاني والأمور سهالات الجود بالموجود
1100452882317565952,AE,  المصيبة الحرمة تقولي الجمعية رخيصة ويعطونا أسهم وأرباح بنهاية السنة يوم شافت الفاتورة والفواتير الثانية تخبلت مثل ما قلتي المفروض تكون أرخص أو عالأقل تكون بسعر السوق مش أغلى
1102668709867516032,AE,     اوووووه ما كفاكم تتنمرون على خلق الله قمتو تنمرتو عالحيوانات بحديقة الحيوان ولا نسيتو يوم فتحتو الأقفاص
1102807439295041536,AE," ههههههه أمسات ولدي عمر عمره  سنين يرمس بالضبط شراتها بالمول لا شعوريا قلتله ليش ما ترمس عربي اللي يسمعك يقول سيلانية ما أنتبه غير حولي ناس ناقعين ضحك والحمدلله انه ضحك وقام يرمس عربي مع انه يرمس انجليزي أحسن م
عنها يمكن"
1103153684530319360,AE,  بالضبط أذكر سوولي اياها سالفة يوم خبرتهم قبل العرس اني ما أرضى أدش على حريم وأصريت يوم العرس وقلت اللي بيزعل بكيفه رضى ربي أولى من الناس ومو على كثر حسناتنا نعين عالمنكر طالعيلنا بحركات أونه غطو العروس وخلو الأهل يدشون يا جماعة وين الغيرة
1103550048858713984,AE,   يا حظك بتطلع من وراه فلوس اذا اشتكيت عليه
1103553171346079616,AE,  قبل الزواج كنت ماسك الكتاب أقراه ونسيبي شافني عالغدا وقام يتمصخر علي قلتله بطبقه على اختي حرمته وبشوف النتيجة قالي أتحداك يفيدك خذيت ورقة صغيرة وكتبت فيها الأسبوع اللي بعده دشت اختي البيت وقلتلها شي بأذونها دمعت عيونها وضمتني وقالتلي والله انك أكثر واحد أحبه من أخواني
1013508901894066176,AE, بصراحة امبارحة كنت مستعيل في صناعية مصفح والبترول مخلص تخبلت يوم شفت الطابور الطويل الصدمة كانت ان الخدمة المميزة ما فيها غير سيارة وحدة واقفة كانت فرصة بس قلت لعمري شو ذنب اللي مجبور ما عنده
1015269593282203648,AE,   هههههه والمشكلة في ناس لليوم تكتب هالسخافات وتنشرها
1059996353982541824,AE, وربي ماعنده كرامة خاين لوطنة لعنة الله عليه
1059997274632281984,AE, ماسمعنا هالخبر اله من عندك كفاية اشاعات
1064485501074382848,AE, الله عليك يا سيسي 
1071160072888303616,AE,   دبي مدينة اشباح يالجزيره 
1074530987680382976,AE, ياخي استح ع ويهك شو هالانحطاط
1075214509734850560,AE, الله يلعنك يارب العالمين زايد الخير مانرضى عليه لو انت ريال قول هالكلام جدام اي شخص مواطن او مقيم فيها
1075259841457860608,AE, شو هالمهزله الي عايشينه
