id,dialect,text
1062105698329333760,BH,"بكيـته  و رمش مآ يبكي على  غآلي  ترى كذآب 
عليـم الله مآ فآرق عيوني دمـع يكويني 

فدآه الدمـع و حروف القصيـد ومآ لقلبه طآب 
عيون و روح  له فدوه ولو إنـه معنيـني"
1062588751627608064,BH, ذكرتتي بنكته المحشش ضربه اخوه كف قال ليه مزح لو جد  قال جد قال المحشش تراني ما احب المزح ابد 
1063252601427366016,BH,"إشتقتلك وجيت بتصل بس هونت 
قلت دامك بقلبي ليش الخساير "
1063661498923393024,BH,"المفروض اي نائب طاح اعلانه من الهوا يسحبون ترشحه 
لان اذا لنفسه مو قاعد يدير حملته عدل ما ثبته اعلانه عدل او ما عدله عقب ما طاح شلون تبيه يدير مشاكل المواطنين  
اعلانه طايح من اسبوع ما درى عنه الصراحه "
1063981347495206784,BH,"يا دنيا عدلي ويانه ونصفي 
نصف بالشمس ظلينه ونص في 
شوكت نتراضى ما ندري ونصفي 
و ترد ايامنا ذي الزهيه "
1064852051040133248,BH,"خل كفك ثلج والعازة مشعل نار 
حتى يذوب كفك لمن تمتد له "
1066604891462873216,BH, ويش نوع الحشيش اللي تستخدمه 
1068672041207902208,BH,"من لا يحس بقيمتك وأنت موجود
ما هو بناشد عنك لا صرت غايب 
حاول تفرق بيض الأيام والسود
يا قلب ما كل الحبايب  حبايب 
اللي يبيك يجيك لو دونك قيود
يكسر على شانك خشوم الصعايب 
واللي يبي فرقاك لو دربك ورود
ما جاك لو إنك من أدنى القرايب "
1069912879414038400,BH,"العله مو بالناس العله بيه 
انا الجبت بلواي بثنين اديه "
1071339820339916800,BH,"مقفوله من كل صوب ما الها مفتاح 
والـفـرج صـار سنـيـن مـابـيــن ولاح "
1072302871700476032,BH,"اسوي المعروف من طيب ذاتي
ما همني منهو جحد ما فعلته 
رفيقي الطيب عطيته حياتي 
 وحتى الردي لا حام صوبي اكرمته "
1072303357509939200,BH,"الطيب حيد دون دربه تسانيد
من هامها بالهون لازم تضده 

والقصر وان شيد على غير تجويد
تجيه صلفات الرياح وتهده 

من لا يخاطر ما يحصل مقاصيد
ومن لا فعل ما اغناه فعل لجده "
1073568891857707008,BH,"خذاه اللي على خده علامه
سوادة غيم في شمس مطلـه 
سرقني مادريت إنه سرقنـي
سلبني و أحسب إني فاطن له "
1075585185670946816,BH,"عاشرت كل الناس حتى المقاريد 
أقضي العمر مرتاح كلشي أنا ماريد "
1080424573697486848,BH,"اقوى هوشه في السنه الجديدة 
خل واحد يصالح بينهم  "
1081745402766995584,BH,"هيا روح وراحت بحضن الغريب 
والخذاها ما يحس بجروحي 
ربي مو عندك ملك ياخذ الروح  
شلون ترضى انسان ياخذ روحي "
1082024549909172224,BH,"أنا اخترت الفراق وما دريت إن الفراق وصال
أقول إني نسيتك بس مدري كيف توصل لي 
تجيني في الأغاني في السوالف في سؤال الحال
تجيني كل ما شميت عطرك ويتخيلي "
1084635892566892416,BH,"تدري وش اللي من الدنيا تعلمته
ان الوفاء بالزمن كله حجي فاضي 
عودت قلبي على النسيان وارغمته
وريحت بالي من التفكير بالماضي "
1084836643423641600,BH," ههههههه اصدر ضجه يقول  محد درى عنه 
والشي الثاني هذا حدث يستحق انك تذكره  احترم متابعينك لو سمحت"
1085827845329424384,BH,"في دلالك في عيونك ليل هادي 
ليل شاعر صار خله من نصيبه "
1086858292356399232,BH,"ازعل ولكن الغلا مثل ماهو
لان الزعل ماله دخل بـالمحبه 
ماني اللي كل ليله له جو
يمدح حبيبه وان زعل منه سبه "
1089154735855357952,BH,"من يقول اني بنسيانك نويت
وإن تناسيتك يذكرني التعب 
مستحيل أنساك لوحتى قويت
وإن قويت أنساك نسيانك صعب 
في دقايق غيبتك ياما بكيت
ياما لعيونك تجاهلت العجب 
كنت ادور فيك عيب ومالقيت
وان لقيت العيب يعجبني عجب "
1089653072513642368,BH,"صدفه تلاقينا على باب دكتور 
انا مريض وهي زادت الطين بله "
1091067957827026944,BH,"ملعون ابو الناس العزاز 
اللي لما احتجنا ليهم طلعوا انذال بإمتياز "
1091886130616828032,BH,"تايبين وللمحبه مايرجعنه الحنين
غلطه ودفعنا ثمنها أجمل أيام السنين "
1093198906446491648,BH,كله ماشي ياحبيبي  مالي في الطيب نصيب 
1093478323022430208,BH,"رب لك كلب ممكن صديق يصير 
احسن من صديق وكلب تكتشفه "
1094365551391056000,BH,"قال الفراق وقلت لعيونك فراق 
أنا وعدتك كل ماتطلب يصير "
1095722767910137984,BH,"تبي تعـرف بقـلبي وش مكـانك 
تبي تعـرف وش اعمل كل ليلة 
عـزيـز الـدمع ذلـيـتـه عـشـانك 
وعـزة نفسي لك صـارت ذليلـة "
1096600620805562368,BH,"كون بظلام وليل والدنيه هوسه 
حتى أركض أنه إعليك واخذلي بوسه "
1098995613469937664,BH,   متى نشوف دويتو بينه وبين عبادي الجوهر 
1099623169860743168,BH,"عركه واخوك الطاح والي طقه خالك
قلي شتسوي بهاي وامك اقبالك 

رد 

انهض وافز فزاع وابن امي غالي 
والبينه راد ايعيل ما احسبه خالي "
1100208547416150016,BH,"و غنت عيوني بآخر الليل موال 
ياطول صبري متى حظي يزين "
1100212310927392768,BH,"حلفت باللي غيب الشمس مناك 
والصبح بأمره تظهر الشمس منا "
1101831277148286976,BH,"مالي ومال الناس  مالك ومالك الناس 
لما حبيتك ما خذت رأي الناس "
1102391922478456832,BH,"شفتي هذاك الفات  اي يمه شفته 
لو ما خوالج جان هسه انتي بنته "
1104215163027288064,BH,"متروسه روحي هموم محد حملها
مدري من اشوفك ليش انساها كلها "
1105996866376871936,BH,"لــك تهانــي صاغهــا صــدق الشعــور 
ياعســى عيــدك مــدى الأيــام عايــد "
1107326388175020032,BH, السلاح اللي في الصورة  
1108598997579644800,BH," هاه  
ههههههههه ساعات تطلع بحركات مو طبيعيه 
عالعموم  تاش بيقيري "
1108860495681998848,BH, ما عرفتك  انت منهو 
1108994979748298752,BH,"جنها زينب هاي بت حامي الدخيل
بس عجيبة انشوفها بلايا أهل 

كون اخت عباس تركب عالزهيل 
يعني ياستار عباس انكتل 

هي زينب هاي عالناقة وتميل
ومن تميل الريح يسندها بخجل 

بيهه هيبة حيدرة وزعل الكفيل
وبيهه صبر حسين لاح اعله الزعل "
1109339177542393984,BH, ما شاء الله على الزهد اللي فيك 
1110133230827642752,BH,"أي لوف يو صار سنين أي لوف يو كلش 
وينك ولك كم هير في نص القلب دش "
1112760699497971584,BH, تراها قمبله وبتنفجر في حبايبك 
1113413782347362432,BH, هههههههههههه ما تقدر توصفهم 
1114138750559371264,BH, جاي حليب فيه شموليه اكثر 
1116107142317182976,BH, ياخي لحيته مو طبيعيه بلاوي 
1116116348961210368,BH,"تصدق حبيبي تاخذني الأشواق 
نصايف الليل ويمك توديني "
1116900365256069248,BH,خلها تجي هي بالاول  
1117215021816320000,BH,"الجروح احيان للمجروح خيره
لا تعد الجرح بالعشره خساره 

لو درينا عن هوانا وش مصيره
كان قبل الحب صلينا إستخاره "
1117966119225184384,BH,"ودعتها ربي وربي يعلم 
أني بحب حبيبتي لمتيم "
1118256179187203968,BH,"ما تستاهل يا بعد عمري ارجع يا حبيبي ارجع 

"
1119787868388560768,BH,"                        

الترجمة
 اللي يحبك بالكلام حبه على قد الكلام 
واللي يحبك بالفعل حقق لعينه ما فعل  "
1119788296190726016,BH,"من طمع في حق غيره ما ربح 
من عيون اللي يحبك لا تطيح "
1120276040939704448,BH,"هي خل تجي بالاول ههههههههههه 
بعدين انا بطير عقلها  "
1120366256127979648,BH,بالضبط  جبتها جيب يالاسطورة  
1120843691206283264,BH,"تعبت أرقع غلطتك وأنت ما تتوب
أقول صون القلب  وتشب ناره 

أمحق حلا لا صار ما عندك أسلوب
يعني الحلا والزين كله خساره "
1120997115986173952,BH, اكيد جتها طلقه بالاوم  
1121934917967982592,BH,"ان كتبت اكتب شعور ماشكت منه الخليقه 
وان سكت اسكت غياب مانقص جل احترامه 

ادري ان الحب بلوى من لقاه ما يطيقه
ماذبح مجنون ليلى غير حبه واهتمامه "
1121957001565810816,BH,"مو بس الميت يحتاج دفان 
الميت احساس هم لازم ندفنه "
1122305657665986560,BH,"خل اعلمنك نصيحة وانت خلها بين اديك 
اليحجي يمك على غيرك  يحجي يم غيرك عليك "
1122311873670590464,BH,"لا صرت مؤمن بالعسر و التياسير
و عينك بعين الله ما يكسرونك 

و لو سكروا بيبانهم بالمسامير 
بيبان ربي ما تسكر لعونك 

وقف  ولا تهزك رياح المقادير 
 اضحك كثر ما حاولوا يجرحونك 

لا تطيح في وجه الليال المعاسير 
في ذمتي لا طحت ما يرحمونك 
 "
1123235261943619584,BH,"وياك وياك حبيبي وياك اروح 
ما اقدر على فرقتك وياك اروح "
1123370724251590784,BH, انزين عرفتين ويش السالفة 
1123407376776929152,BH,"الردي لو يستره ثوب وش يستر رداه 
دام مايحشم قرابه ولا يحشم وجيه 

إنصحوه يبيع ثوبه ويشري له عباه
طاح من عين المراجل ولا عادت تبيه 

والسفيه إن ماتبلاك ماتسلم غثاه
حاول إنك ماتجي درب يسلكه السفيه 

وصافح كفوف الزمن وإبتسم لأجل الحياه 
وإعلم إن الله اذا حب عبده يبتليه  "
1123409332765380608,BH,"                         

الترجمة

تبيني اعتذر آسف ولكن وش هي الزله
تبيني اجرحك حاضر انا همك وغربالك 

ولكن قبل ما تنساني وتنسى ما مضى كله
امانه بس علمني وش اللي غير احوالك "
1003124639713947648,BH,   بدل ما تقول خوش سحور 
1009329526697021440,BH,"كـل مـا اغمـض العين رسمـك يجينـي 
مدري انته نور العين مدري انت عيني "
1010437012577574784,BH,"ان كان ودك تجي صوبي و متردد 
تعال و سود الله وجـه من يردك "
1010688446439088000,BH,"وتحسب اني عنك سهيت و لهيت  
الله معاك و انا معاك بس من بعيد "
1011049648524529664,BH,"انام وما يجيني النوم 
وامل من السهر واسهر 

تحشيش"
1011539222245855232,BH,"كانت الدنيا مسافه و كنت لي إنت الطريق 
صارت اللحظه كلافه و الأمل دربه يضيق "
1011540035156537216,BH,"حاولت أصدق فرحتي 
و أعيش هالفرحه برجاه 
لقيت نهاية قصـتي 
تبدا ابنظره معاه "
1012861862357151616,BH,"من زود حبه كل عام يتجدد 
لو عشت بين الناس والحال ميسور 
خوي دربي يوم كلن تصدد 
لا من طواني الهم اسريه مجبور "
1014428730142404608,BH,"أشتقت لك واللي خلق حلو الإحساس 
يامشغل قلبي وروحي وعيني 

حبي لك أكبر من هوى الناس للناس 
تبعد  تقرب  أنت موجود فيني 

أنت الحبيب اللي على العين والراس 
قربك هوى قلبي وأحلى سنيني "
1014429126701273216,BH,"ادري انك تدري بشوقي وتدري ويش عيبي 
لو يعاقبني الحزن من غيبتك ما قلت لك عود "
1015357069501915136,BH,"شوفك  شفا  يشفي جروح  بلا  شاش 
و شوقك شقا يشقي  كبود  معاطيش "
1016334011894034432,BH,"بعض البشر طبعه مقدر ومحشوم 
وبعض البشر عيب عليك احترامه 
الي ستر عيبه على الناس بهدوم 
وش يستره لاصار عيبه كـلامه "
1016810294666985600,BH,"شارط شرط عالروح ما تنسى حبك 
لو صرت سم بالماي اعطش وأشربك "
1017934489815797760,BH,"والحين روح ارجوك ساعدني انساك 
ولا تجي حتى لو اني بغيتك 
وان مر في بالي بقايا لذكراك 
بحاول انساها مثل ما نسيتك "
1018474286649143168,BH,"بحر حبك غدابي وانتحابي 
ولا فزعه ولا ديره قريبه 
اصيح صياح ما حي درابي 
مصيبه وان حكيت اكبر مصيبه "
1019024596639666176,BH,"لين كسر في خاطرك شخص تغليه 
حتى المعاتب  تستحي من عتابه "
1020855415217840000,BH,"جدد الميعاد وايام الوعد 
خلني أفرح واشاهد ضحكتك 
انت حلم العمر تكفيني وتزود 
تسوي كل الناس عندي جيتك "
1020861114865930240,BH,"ياشينها لا طابت النفس من شخص 
ما عاد ودك فيه لو كان غالي "
1021574900635639808,BH,"كل درب يوديني لغيرك أجهله  
وكل عين من بعد عينك ما تشدني "
1022189752836141056,BH,"من راح من كيفه يروح 
مافيه غيره في البلد 
مادامه أختار الفراق 
وفضل بعاده وأبتعد "
1022656880429215616,BH,"اناديك وانت المقفي القانع المنزاح 
وتشوف البلا جاني من الهجر وتكمل "
1022850145619243008,BH,"بيك اقهر الشمات واتحدى دنياي 
وكل صعبه سهله تصير مادامك وياي "
1023014637103722368,BH,"انت حاجه تبتدي عند النهايه 
وين اروح وكل وجهاتي  جهاتك 
كنت دافع للحياه وصرت غايه 
اخذ كل اللي تبي مني  وهاتك "
1023752822461005824,BH,"كنا أنا وياك
و الثالث الليل 
ويضيع كل الليل
بيني وبينك 
حنا تعودنا على
بعضنا حييل
هذا أنا  والليل 
بس إنت  وينك "
1024031912216723584,BH,"غديت انا وياه مثل امس و اليوم 
نتبع بعضنا لكن صعب نتلاقى "
1024033542492315648,BH,"شوف الزمان شلون حيرني وياك  
لا اقدر اوصل لك ولا اقدر أنساك "
1025436134460076032,BH, شالوم فيك يا حيوان شالوم 
1025550206736183168,BH,"العمر كل   مازادت  ايامه  نقص
والنفس  تكسب  طيبها  بأخلاقها 
 
الناس غير الناس والدنيا  فرص
لو  كان  ماتعلم   بغيب  ارزاقها 

لكل  شارب  لو فتل طوله مقص
ولكل  لحيه   بهالزمن  حلاقها 

كم واحد قلبه على الدنيا حرص
واقفى  وخلاها  وهو  ماذاقها "
1026172171880734848,BH,"الحب ورده لكن  الشك شوكة 
والبعد لامن طال دمع  المقل قل 

واللي مربى ع الجبن في سلوكه
يموت مايلقى من البيض له خل

كبده تطوى يوم مافل بوكه
ومن مايبي الفلات عمره فلا فل"
1026205114149822464,BH, بكرة انت في كزا 
1035711862002909184,BH,"وش أخبار السهر ولا وش أخبارك 
كرهتي الليل أو عادك على خبري  

أنـا يـا سيدة عمري مثل دارك 
كبرتي بي وأنا أحبك على كبري 

أنا أول قلب هاجر لك وأنا أنصارك
مثل ما أنت غياهب برزخي وقبري 

 أحبك حب ما يطري على أفكارك  
يخلي صفحتي تضحك على حبري "
1036060792620232832,BH,"ولو أتوب من الذنوب الي جنت الأيام ضدي 
ماقدرت اتوب عن ذنب يعن القلب صوبـه 
كيف أتوبك يا أجمل ذنوبي وأوقف عند حدي
وانت  ذنب لا غفره الله ولا لي عنه تووبه  "
1036408068358238208,BH,"خدك ورد رمان ومربى مشمش 
اجيك مثل الذبان وتقولي كش كش "
1037039001801248768,BH,"كنت اصعد اعلى الخيل وانا بحديدي 
هسه من اقوم القاع ادفعها بيدي 
"
1037125591378604032,BH,"مودريتش 

شيحلوبحرفم"
1037398019258368000,BH,"قلبي مكينه فاضيه مابها زيت 
من زيت حبك صب لي لو شويه 
قلبي قبل فرقاك ماينقص الزيت 
واليوم ازيده كل روحه وجيه 

كراجحياك"
1037530818892189568,BH,"            

انا اسف بيتزا هت "
1037531098002194432,BH, ويش اسمها خل نشوفها في اليوتيوب 
1037863307682766848,BH,"اشرب وادير الكاس من عسل شفتك 
وابقى العمر سكران لو مره بستك "
1038972454889246848,BH,"مالي ومال الناس  ومالك ومال الناس
لما حبيتك  ما أخذت رأي الناس 
خلينا في الحاضر  ننسى اللي كان
لانشغل الخاطر  نحسب لرأي الناس
لاقالوا لاعادوا  لانقصوا وزادوا 
مالي ومال الناس  ومالك ومال الناس
لما حبيتك  ما أخذت رأي الناس "
1038980394283147264,BH,"مو تدري بيه أهواك مو تدري أحبك 
من كثر مو مشتاق كل ساعه أسبك "
1039686598143758336,BH,احنا غير حسين ما عندنا وسيله 
1040303132151083008,BH,"قلها يا طوعة اليوم ماتحصل سلامة 
اوصيج جان بهالبلد طبوا يتامه 
قولي ترى مسلم يبلغكم سلامه 
و اجرج على الله و النبي سيد الكونين "
1040645026026545152,BH,"إن جان هذي كربلا بشروا ابلايا 
نزلوا ترى لاحت علامات المنايا 
ولازم ابجانب هالنهر نقضي ظمايا 
واجسادنه تبقى على الغبره سليبه "
1041484062551158784,BH,"عباس وافي والوفى شيمه وطبيعه 
شلون يروى وينسى بوسكنه ورضيعه  "
1042940583462006784,BH,"نص الليل يا ابن امي ولن طفلة فقدناها 
اثاري فرت بدهشة تحوم ومحد وياها 
وحدي طلعت ادورها وادور وين ملفاها 
شفتها وياك ممتدة وعلى خدها دمعها يسيل "
987102879063429248,BH, صنع ايديا وحياة عينيا 
987322965179142016,BH,"يجيك الخير من شخص مهو في حسبتك محسوب 
ويجيك الشر من شخص من الخرفان عشيته  "
987519122232799232,BH,"وين أنت
وشخبارك
يا مغرب عن ديارك 
أنا كل يوم  أكحل ناظري بدارك "
988028462664437760,BH,انا حبيتها من يوم السبه  
988234411975041024,BH,"ماتدري بيه شصار من رحت عني 
شامت وقف عالباب باسمك يغني "
988430615363145600,BH,ويقال انهم وقفوا انتاج هالسيارة  
988553009457135616,BH,"امحق حلا لا صار ما عندك اسلوب 
يعني الحلا و الزين كله خـــســارة "
988583937600520192,BH, هههههههه انا طالعت فلم كوميدي بس حزين 
988586445869904000,BH,"المفروض كوميدي بس لو كان وثائقي بيكون ناجح 
تقييمي 

   
"
988589483535814784,BH,"اذا احد قالك في شي احلى من النوم سبه  

المادة"
988889130435309568,BH,هلكني جذبه والله  وتاليها بعدين 
989148724357197824,BH," مرتاحين جدا مو شايلين هم الناس ولا الناس شايلين همهم  
ويغنون دائما اغنية لنا الله  "
989317350783705216,BH,والله كنت اطالع على اعصابي اشجع العقرب  
989324624243683200,BH,"حبيبي مابقى عندي صبر يتحمل التأخير 
رحلت وعقبك الدنيا غلاها طاح من عيني "
989485226320629760,BH,"حلفت باللي غيب الشمس منـاك
والصبح بأمره تطلع الشمس منا
ان اسعد الايام شوفـك ولقيـاك
وان اقشر الايـام غيبـت عنـا
ودك تلاقيـنـي وودي بلقـيـاك
لاكن ظروف الوقـت ما ساعدنـا
ولازلت احبك واتحمـل خطايـاك
ماني من اللي قـال حنـا وحنـا
شعر الغزل يصلح لمثلك وشرواك
وان غنت الورقا مع الصبح غنا "
989708267101224960,BH,انا اعرف ناس واجد ما تطوروا موليه  
989709395943571584,BH, حتى رد مودريتش تحس كانه صناعه هدف  ساحر 
989868873481670784,BH,"لافـاحت الـدله وفـنجـالـها دار 
ناخذ لنا عن ضيقة البال فاصل 
دام الدروب وساع ويمين ويسار 
على الدروب اللي تناسبك واصل "
990033765782249600,BH,"فلم كوميدي جميل عن مجموعة فتيات يعاد شملهم بعد سنين  تقدر تقول فلم مال بنات
تقييمي للفلم  

 
"
990245896423182336,BH,"عيون كانت بتحسدني علي حبي 
ودلوقتي بتبكي عليا من غلبي "
990406563868356608,BH,"قصة الفلم المفروض عن حياة الكاتب سيدني هال بس شوي على دراما وشوي على رومانس وقزره لما يخلص
تقييمي للفلم 

    
"
990407583822499840,BH,"لولا الحيا لاحطها صورة  العرض 
وأكتب على الحاله هذي نور عيني "
990612210404781952,BH, والله السيرك انت وعائلتك  كل يوم تطلع في تويتر والناس تضحك عليك وتسبك  حيوان واحد 
990965428611666048,BH,"لاطرى فالراس من بعض الطواري 
رحت للي يبعد الضيقات شوفه 
الرفيق اللي على الفزعات ظاري 
لا لقيته ما على غيره حسوفه "
990983174380547968,BH,"وقت غروب الشمس واقف على البحر بعيد 
عمال أحكيله وأشكيله وأشرح وأعيد 
فجأة لاقيتها وكنت فاكرها عروسة البحر 
خارجة من المايه وطلتها أقوى من السحر "
991330514849140736,BH,"خلوه يراقبني ويحتار فيني 
يالله عساني طول الايام همه "
991332524566745216,BH,"قلبي مكينه فاضيه مابها زيت 
من زيت حبك صب لي لو شويه 
قلبي قبل فرقاك ماينقص الزيت 
واليوم ازيده كل روحه وجيه 

سمابادكراج"
991489219230142464,BH,انت وش لك بالاسد  
991730844489437184,BH, هههههههه يهف كل شي 
991861426234052608,BH,"يوم جيت وثم سألتك ما وحشتك  
كان ردك بالبرود
وبالتمادي 
بس تدري شلت هالوحشه وشلتك 
كنت فرحه وكنت دنيا
وصرت عادي "
992221305469628416,BH,"ليتك على كبر الهقاوي تسنعت 
لكن ردي الساس مافيه حيله "
992222468881440768,BH,"شلنا حمول الناس والناس خانت 
والي عطيناه خير جازانا نكران 
ما همنا لو سود الايام شانت 
نشمخ شموخ الحر مثل اهل كرزكان "
992519365638656000,BH, فعلا  ليش افيخاي ضارب لك لايك 
992574359029022848,BH,"العتب نصف الخصام والتعب كان النصيب 
جيتك و عندي كلام ورحت ما عندي حبيب "
992576362320924800,BH,"لا تغرك وحدتي والليل ساكن 
الزحام بـ ذكرياتك يالحبيب 

والله إن العمر بعدك حيل داكن 
موجعه ذكراك وغيابك كئيب 

مرني مشتاق لك مازلت ساكن 
مستحيل آحب بعدك لو أشيب 

ماوحشتك روح وأسأل هالأماكن 
كل ما مريتها كني غريـب 

إنت أول شخص حبيته ولكن 
كنت آخر من توقعته يغيب "
993632175638663168,BH,بيني وبين اخوك حسينوه  دزه 
993636737569181568,BH,مشروع سعد الاسطوري  وكعادته حسينوه نفس البحارنه تكسير مجاديف  
