id,dialect,text
957654846840197248,KW,كفووووو ابا الكباتن دووم بالحضوور سباق  
957668557675991040,KW,ادريبك دووووم حياوي ي بعدي  
958058729806680064,KW,المطار ماجانا له عام واعوام مادري من ردى  نصيبنا ولا ردى نصيب اربوعنا الماريد  
958409282151702400,KW,الحضر اخويانا ولا نا عنهم غنات حتى لووا ازعلوونا ترانا نوباتن عليهم نعيل والعتاب يقوولون تراهـ صابون القلوب ويلفطين مالك من ابن ديرتك غنات
958428528055410816,KW,الوجه السمح والطليق له اجواد تحشمه بزود والوجه السمج ومايستحي خله يفي ورراه  
958955156900589568,KW,ماهوو بلوانا نتابعك ع شان ندري ماعندك سالفه  
958955450816450560,KW,انت تبي معاش بعد وانت ماتشتغل  
958961939836817408,KW,وانتي ربنا مايحرمنا منك 
958963032163540992,KW,وييييين هالغيبه ومن طول الغيبات جاب الاخبار الزينه  
958965626558656384,KW, تهريب الزكاير يعرفها كرباجووو ماخذها وراثه 
958967464267865984,KW, الضب هذا ي تحرش ب كرباج عندك اياهـ اغسل شراعه 
960402517787139968,KW,مايصير اتمرن معاكم معي واسطه  
961319449759494016,KW,هذا تكتيكات الكباتن ولكن شلون وكيف تكتيكات اصحاب التكاتك ب ش الهرم ب مصر وتكتك ي متكتك  
961571866031919232,KW,الله يحيييه يبشر ب حليب نياق ماهو ب مرندا  
961586422443540352,KW,الذيابه ارحم هذووول ثعابيين سامه ومميته ي عيني ع الناس الغلابه  
961588332156342400,KW,  شكلك مؤيده تعدد الزوجات الحقيني بكام وحده وحيات عيونك 
961620044479377408,KW,آهـ هـ تو فهمت عندنا عادي وعندكم لاء ابشرك عندكم اكثر منا عندكم الزواج العرفي والزواج الشرعي وغيره وغيره وحسبي  
961684772983632000,KW, الصراحه والمصارحه قد ماتعجب البعض 
962038943062503424,KW,الا والله خلاهم ارانب وديعه  
962255095743295616,KW,انا خابرك ماتشرب زقاير تشرب تتن لف والسعوديين هم شرابة التنباك وش مزعلك  
962576181555073024,KW,خله اول يصلح احوال شعبه من الداخل بعدين يفزع ل كام واحد بالكويت علمي حتى حبة البنادول يبيعها بمستشفياته عليهم  
962577883284885632,KW,سباكين مصر ع الأقل احسن من سباكين فلبن اللي كل ساعه ريسهم هاد علينا  
962635570605383552,KW,من اي جحر طلع الضب هذا يوبا 
962673755297369984,KW,ليش انت ماتعرف هالجلاوزه نهبوا ثروات العراق والشعب المسكين مغلوب ع امره وردوا علينا نعطيهم نهيمه نخاطبهم بلغتهم  
963683664063320064,KW,المزيووووونه سامحوها والجيكره احبسووووها  
963705713225805824,KW,العنز  طالع لشدق اليفتها وهي تجتر وتضحك ماتدري عن شدقها  
963794286776078336,KW,دللني ع هـ المترجم اللي خلا ريسهم ي شتمنا ويمنع الخدم عنا ابي اوريه نجووم الايله  
964084857021321216,KW, افا يكرباج مادرينابك تشرب القهوا ب كوب ازعلتنا 
964087033714086016,KW,مانحصل وراكم كوود الهوسات اللي ماخوذ خيرها عسى يقزر بعيونكم ولا ندري هبيل ي طابخ الفاس يبي مرق من حديده  
964088971033800832,KW,بس ماندري الورده كوود حمرا مايصير بنفسجي والا اصفر جبت لعجوزي شدة ورد مخلوط وزعلت علي تبي كود حمرا  
964504211634491392,KW,  الكويت عومه ماكوله مذمومه وش ترجا منهم طول عمرهم حاقدين ع الكويت واهلها منهم لله 
964507343680614400,KW, هلا بالقبيله واسمها وان سمعت طاري الظفير شاش راسي المطنوخ 
964774476834640000,KW, لا تلووومهم ترى البعض منهم متسلف التذكره مثلي ي خويك تراني اتسلف واحجز ع البزنس 
964827220807208960,KW,ادريبك زعلان ع ربع اللي ي هوسون ويشتمون الكويت  وعلمتك زييين الظفير مابهم حصايه الخكره اللي تعرفهم اهل الهوسه  
965196907827122176,KW,انت واهم هذولا يشجعوون كرباج ماتشوفني معاهم وحاط صورة كرباج  
965614137534566400,KW, ي خوي لاتلوووومه الرجال خربت مراجله 
965615324262535168,KW,ماهو انت دوووم دربك خضر  وكاد ماوراك كووود العجاج  
965903727587745792,KW,متأكدييين انه غيم نخاف انه عجاج علمووونا الصج  
918421837960359936,KW, صافيه لبن   قووول حليب ي اشطه وب الكويتي طاح الحطب وتم الصلح 
918497003960721408,KW,هذه المكتبه انا خابرها ب سوق الشيوخ شنو فتحوا فرع لها بالعباسه  
918768611417903232,KW,هذا ضد الأرشاد والتوفير بالماء والكهربا اقطعو عنه الماي قال اغسل الغاز بالماي ي خرطي  
919220557626953600,KW,من هو اللي ينخى الظفير  عسى ماهو مظيوم  
919615508638396416,KW,ندعيلكم بالتوفيق والنجاح ان شالله  
920232418103177216,KW,صح اقووول وين شايف هـ الشارع الهادي والمشجر ويلق بالنظافه اثاري بالصليبيه تذكررررررت  
920235763853418368,KW,ي ام عثمان الضعيف تاكله الضواري  وعزززززاه لحالي  
920238027359833984,KW,عندي فكره ونوفر الملايين من شراء البصمه وسهله وهي كل مسؤل بوزارته يجي قبل الموظفين وب مكتبه يصور بالنقال كل موظفيه 
920243394558996352,KW,ي خوي خل الناس تعيش ليش تصير حسووود  
920347142417461248,KW,الزوجه النكديه هذه ماعندها اخت نزوجها لواحد من الربع باط بدي ع شان طلع ثاري من هـ الخوي النكدي  
920363425913589760,KW, فيييه ناس لهم مصالح ب تأخير شركة الدره حتى يتمصلحواهم واهل الكويت هم الضحيه هزلت 
920538273700867968,KW,ماعرفنا الحب لابوه ولا لغيره ماكمل  
920546306136969216,KW,اذا تندف شباتي سهالات يمكن الربع يحللونك عادي بس البلا خاف تندف شي ن  آخر وثم ع جهنم حذف مايفيد معك التحلل  
920942116565549056,KW, هي ترى ماتقصد المذيع كانت تقصد كرباج 
921097663034126336,KW,ناقه وعرجه بعد اشوى مابها جرب   
921099912112230400,KW,البعض ينقد ع لهجة بو فهد  خل ي ورونا ويسمعونا لهجتهم  
921397343240577024,KW,شنو حساب المطر صار بالساعات مادري تنجيم ولا توقعات ولا سحرتوووو سحركم عطل وبطل الله يرزقنا بالخير اللي مابه شر  
922050272385527808,KW,  اللي حصل كله خطئ الكل موظفين دوله ووجب محاسبتهم جميعأ نحن تحت القانون ومن يخالف ي عاقب حتى يكن عبره لغيره 
922052076330463232,KW,من يصدق هذا ريوق كرباج انا خابر ريوقه خبز تنور وشاي حليب وانز  
922144816401612800,KW, ي حسافه وين ضباط الداخليه زمان كانوا قدوه ومثل اعلى للكل  معقوله ي حصل هذا بين رفقاء السلاح 
922152888658521984,KW,ماجابو بعد شماغ ازرق منقط وعقال سكس ويل  
922153270457532416,KW, ترى له شرايه ب الجهرا واجد 
923245232220725248,KW, صار مخامط اجل مع الخيل ي شقرا 
923451584687820800,KW,وانا اقوووول كرباج طالع ع منوووو  توني عرفت طالع ع خواله  
923499783595143168,KW,من صجه هـ المشعوذهذا لو يطيح بيدي لاربطه ب دعاميه وانيتي العربانه من كرعانه وسحبه ع بطنه ع الشوك والشجر  
923826999143124992,KW,والله ماوحشني الا مصر ونيلها  
923827926281392000,KW,وان دليتكم ع بياعين النفسيات الزينه  وش لي انا  
923903708710174848,KW,ويش ملهيكم عن وغدانكم تخموون ب السوقه وتضيعون الوغدان اللي مالهم حيل ولا قوه المهدي الله  
924222037584998400,KW,هـ خوالك راحوا السعوديه متى  
924222408403423232,KW, ماعليكم كرباج راح شمال يبي يوهمكم 
924225335549480960,KW,السوووق هذا ينافس سوق الحراميه بالجلب وهم اللي سلطو البلديه عليهم  ي هبى سوق الحراميه اثاريه مارهـو ب هين  
924593419695116416,KW, وهذه عوايد الشيوخ دوووم كبار مايهمهم بعض سفهاء خلق الله كبير ي بو فهد 
924677973206290432,KW,هذيل متهاوشين ولا يرقصوووون  
924679317040386048,KW,والله ي كرباج بعض النوبات اعيل عليك  بس لايكن تعاملني مثل الجمله الاخيره تراني ماستاهل  
924708409076801536,KW, علموووونا خلونا نروح ل الدسكووو التعاوني ترانا من المساهمين ي بعد حيي 
924948440118939648,KW,قوالي الله يعينه ع بلوااااه  
924948805656735616,KW,دوووووم العنز  تحب التيس الغريييييب  
924949706085748736,KW,وهذا الرد البليغ والكلام اللي ي جمد ع الشارب  
924969296681488384,KW, الا تلقاه حصني والا الذيب مايغدر 
925400485158445056,KW,بس كافيه وراهيه نحن مانحب التبذير  
925401295611158400,KW,صج فيييه عشا تراني جاي اجيب جدر معاي  
925402244459220992,KW,عنتر العبسي ماكتب شعره الا وهو غرقان بالرمال المتحركه ب الربع الخالي  لكن عمه النذل ماجوزه عبله  
925403859996070016,KW,اففففا مبارك سندويه بطلنا من الجدر  
925405066978300032,KW,اجيب ربع الدوانيه معاي ولا تطردنا  ادريبك عينك ضيقه  
925407580108836864,KW,انا رزيتي خيامي في هـ العجاج تهووون البلديه ماتجيني وتشيلهم بس هوتي لو جوني اعشيهم سندوي يمكن يغزر ب عينهم 
925409375002427392,KW,ي ول سفري وحنا ندفع فلوسه منين  
925411352113565568,KW,شكلك ناوي ع تسفيرنا انت عنصري  الله ي كفينا شرك مانبي عشاك هونا  
925638155298115584,KW,اتركوه وحقروه هذا يغرد خارج السرب ومحد درى عنه  
925639054175211648,KW, يضحك معنا ولا يعيرنا  ياشين ضحك الخبال 
925642851895185408,KW,بس البلا لو سولفنا نحن الكويته مع بعض واحد من ربعنا ينقل كل سوالفنا للسعوده  وبعدين وش يفكك ي طلابه  
925645333220200448,KW,شكله يقووول هذاك اللي باق الشنطه  
925768181553287168,KW,ح سافه ماني بالشرطه يوم تقول انا كرباج  لحجزتك انت وسيرتك وحتى السياره اللي وراك  
926035287763050368,KW,اللي يعزمك واهم وخسران  وش يبي ب هالطلايب  
926036465049534464,KW,طول عمرك فتينيييي وتربط عصاعص  
926038185054035968,KW,خلها تاكل خبز زعتر وزيتونات وملووووبه  
926719068006215552,KW,رزق الناصابييين ع الخبوووول  
926723302109872000,KW, احسن شي شم عرق الرقاصه وهي شاربه منكر بعد فاصل الرقص تلعن بو الساعه اللي عرفتها 
926767427475554432,KW, ع خدك غمازه ماتصير شوف مكان آخر لعل وعسى 
927842716641349632,KW, الا والله غثتنا وغثت اهل الخليج هي وسلويها الله لايردهم 
927845041514704768,KW, كرباج مخاوي اوباما ويدعي ويشحي ع ترامب لييييه بس هـ الحقد 
927846430408048640,KW,ابدددد بنوب ترامب طير شلوى ماعنده كيري ميري  
927848140547510400,KW, ماحنا ناقصييين معزا حتى تورينا صخووولها 
928249812348219392,KW,ماخلتها ب قلبها كله حره وزعل ع كرباج  احذر منها  
928250659530567552,KW, والله قلتها ي كرباج القافله تسير   والتكمله معروفه 
928949542329995264,KW,ازل لحيتي لو صبرت ع الرجيم ادريبك بطيني وتخلي الاكل حتى ب مخباك  
