id,dialect,text
1125468851116880000,LB,لما تشوف الجلابيط كيف بينطرو كل شي بيعملو حزب الله لينقرو عليه حتى لو كان قذيفة فاضية  بتعرف ليش هوي فوق فوق فوق 
1125585566001766400,LB, الله ياخده عند هالصبح
1125920064543383552,LB,ليش جماهير الريال و اليوفي و البايرن و نجمة المصيطبة عم يبهدلو فيك هيك  
1126123185143992448,LB,يعني ابنه لرياض سلامة الوحيد عن جدارة اللي صحابه فيهم يزنخو عليه و يعيطلو  يا ابو ليرة 
1126192932090974208,LB,بتحس لبيعلق مع جريدة الاخبار متل اللي بيعلق مع واحد إسمه علي على اوتستراد السيد هادي 
1126670347837804416,LB, المستورد عم يجي مضروب كيف عالشوب 
1129503253908135936,LB,لما حدا يخبطلك تويت و ينزلها عندو  
1131240701923155968,LB,الموازنة ب لبنان تقريبا بتشبه  كيلو القطايف ب  تلاف  مع قنينة قطر بصير الكيلو ب  الف هيك شي يعني 
1133380227957165952,LB,  مش عارف اذا بعدو عايش اصلا
1133864411674943616,LB,اب من اباء هالوطن  
1134552471534280832,LB,هو مجرد ما تتخيل الملك سلمان عم يقول خوش امديد  لوحدها مسرحية 
1134561595412156416,LB,من هلق لبدو يشتري صواريخ من الحزب يحكيهم انبوكس  
1134953970647146368,LB, بتمون يا غاليييي بتمون عالدمات
1135009550250250240,LB, قال جاي عبالي تسحر شاورما تركي 
1135428177600417792,LB,  طلعت وحدة الصف لاقية على ضفر الست فاطمة  
1135428962837024768,LB,  عسلامتك انت يا فاطمة فش متلك الا بالمراية 
1135439834640781184,LB, ان شاء الله ما يكون اخر مرة بهالعمر  الله يتقبل منكم
1135440278796558336,LB, نزلت بنك دفعت من صباح الله  وينك طلعت مستسفى
1136312879752331264,LB,رابطة الناس اللي ما طلعت عالضيعة 
1136485770980667392,LB, انت عم تبرر تصرف الارهابي لاستهدف الجيش و القوى الامنية بمعزل بأي منطقة و عم تحرض عاستهداف غير مناطق   الغير طبيعي هو اللي ما في خير لا لأهله و لا ابناء بلده و ضيعته يا بياع الماي
1136675518651273216,LB,"أحقر شي ممكن تشوفو على الطريق انت و طالع عالجنوب 

الله لا يوفقك يا نايمار  "
1136936720388280448,LB,بتجي لعندي عالشغل معك صفيحة بعلبكية من عند صفوان  
1136949912506175616,LB,مش لتعرفي تلبسي بالاول بعدين نزلي تويت  
1137050107256479616,LB, هو افضل شي تشوفي حدا مشحر متلي و خلي يفتحها و تقسميهون معو 
1137327489670438784,LB,  كلوو طيب يا ابو نورر اضرب قلوبات دجاج و دعيلي طبعا بعد الروستو
1137409948927844352,LB, طيب ينزلوا  احسى ما ياكلوا غول
1138055195106168832,LB, و انت الفهيم اللي ما اشبو شي 
1138059741173694464,LB,  هياني عم بنصحك بكل اخوية  و عفكرة خي مقدم على وظيفة من خلال مجلس الخدمة و ناطر التعينات
1138114628096012416,LB,الملفت انو اغلب الاعلاميين اللي استنكروا كلام باسيل وبلشوا تطبيل بيشتغلوا بوسائل اعلامية ممولة سعوديا  يمكن لما حكي عن العمال السعوديين كان قاصد هيك فئة 
1138196014777733248,LB,"الشيخسعد طالع يعيد بالسعودية او طالع مرابطة  المشحر صرله  أيام غايب 

وينسعدالحريري"
1138205225213448192,LB, اللي ما عنده ماضي ما عنده حاضر  ما عنده اصل 
1138814407583174784,LB,"الإمتحانات في اليابان بدون رقابه حتى لا يكون هناك ضغط نفسي على الطلاب 
عنا بيجي الدرك والجيش صافف الدبابات عالباب وبتكون مدرستو بالجنوب بيجي طلب ترشيحو بالشمال وممنوع تسأل ولا تتنفس والوزير شايف هالشي مش كافي عم بطالب بتقنيه ال   "
1138838348934635648,LB, بسس بقى اذا عمل منيح ما بيخلص  و اذا تركها تفوت بالحيط بتقلو ليش ما قلتلي وقف
1138856316355710976,LB, شركات التأمين اصلا فاتحين كرمالكم 
1139589645518479360,LB,"في داخل كل مجموعة اصدقاء هناك انطونيو صغير   بس الله بيعرف لوين ممكن يقلك امشي نضهر  

انطونيوليهنحنهون"
1140353517137420416,LB, يقال انه قبل بيوم خيو انكمش لان كان عم يحاول ياخد خوة من المطعم
1141002787125420032,LB, حزب الله فوق اي يافطة  بعدو عن زواريبك و يافطاتك و ليكات الافتراضية  مين ما خدم الناس الله يكتر خيره و مشكور عليه
1141042931773726848,LB, اللي عالغبيري مفرق حسينية الخنسا
1141114149558243200,LB, بالنهاية مش غلط الكل بدو يسترزق بس بيبقى الكتابة بمصداقية و انصاف و حق هو الاساس
1142401848051163136,LB, هيدا غايب عن الوعي
1142801859951943552,LB,و بلد رح يمشي 
1142856440652152832,LB, سعيد محمد و هالقرطة 
1143312013671784448,LB, هيدا لبدو يحكيني مبارح
1143460108619386752,LB, تاني مرة خبرينا قبل بوقت يعني
1143669258213367808,LB, يا ريت نجدد شوفتك كمان
1143887009913692160,LB, هيك الواحد ببين قديش معو مصاري و شحارر
1144196694965477376,LB,كل ما داقت فيك الدنيا تذكر انو دكتور الجامعة اللبنانية بيقبض اكتر من  مليون ليرة بالشهر و مش مرتاح و صرلو شهر مأضرب 
757349488524746752,LB, هههه  هي سهلة انت بس بتمشي و بتلاقي اشارات بدلوكي وين في بوكيمون بس بتسبب مشاكل كتير
759709272619950080,LB, هههه هيدا هتلر مش خيك 
760258014569963520,LB, انشالله ههه اذا فقت بكرا غود نايت 
763414633738825728,LB, هههه ايه اكيد هوي ما شافها 
1173904152512147712,LB, هني اللي بيتخرجوا بصيروا لؤما
1179765077555236864,LB,"ما دمنا على قيد الحياة الموت لإسرائيل 
بالأصفرالعزانكتب "
1179769199687852032,LB,"وأعدوا لهم ما استطعتم من قوة
بالأصفرالعزانكتب "
1185483325579751424,LB,"قالها الامين
الحاقد لو نزلنالو كتاب من السما بضلو اعمى "
1185974836536991488,LB,"فداك نفسي ودمي 
السيدنصراللهثقتنا "
1186030676488916992,LB,ديماالواطية وحتفضل طول عمرها واطية 
1188089374967246848,LB, عال  قبل شوي وناطرين المراسلة ت توصل ت يطلعوا مباشر
1188096587760832512,LB, حطوه عال  بس ما بعرف بالتأكيد مين لي قوص
1188100609834135552,LB,"طب أنا سمعت الشباب بالبداوي عم يقولوا إنو
وصلت الأوامر من إيران إنو تنفتح الطريق معلش الهبل ما إلو بي وإم
هتافات الشعب يريد إسقاط النظام
هيدي الثورة سلمية
هول ما بيتسموا متظاهرين طبعا بغض النظر عن مين لي قوص وشو صار أو منبقى ع مجموعات مسلحة لبنانينتفض"
1188101645516922880,LB, مش فهمانة شي خبيصة 
1188102718134640640,LB, يا خيي ملايين المرات قلنا حزب الله مادد إيدو للكل كرمال البلد مش معناتو نحنا نجي نعبطو لجعجع ونساويه بأنفسنا فشر ع رقبتو هوي وغيرو
1188104602446696448,LB, هني فتنة بحد ذاتهن تسوكي
1188105953339674624,LB, والله لي شفتو إنو لاء مش عم يحكوا أي شي 
1188107235429355520,LB,  وين شفت تبرير  عم يعرف الزلمي ليلي ما بيعرفو  وين التبرير 
1188108131538231296,LB,  لا حول الله وين التبرييير  وبعدين المجرم في عندو وقت معين لإلقاء القبض عليه أو كيف  ان شالله بيفطس مش نحنا منعلم الجيش شغلو
1188109093912875008,LB, بعدك عامل تويتر وجايب ع التغريدة  لايك بس لأنو السيد دعمك  سأخبر الله بكل شيء 
1188110724591210496,LB,   طولي بالك أختشي شكلو انعقص أبصر ليه 
1188111071946653696,LB,   وين هون  الجديد أصلا قناة الفتنة  هيدي هيي اللطشة لي عم وصلها خفها علينا
1188119355550326784,LB, كلو ركز ع الشحاطة 
1188121775462387712,LB, هلأ شوي تانية بركي بتعطينا خبر 
1188123164762611712,LB, كنير كتير شو بعد يهديني من الضحك هلأ 
1188124179700375552,LB, ولك شو بدك فيهاااا  اضحكي وبس 
1188129733726425088,LB,معلش يا طونط  طهري نيعك قبل ما تجيبي سيرة السيد ع لسانك إجرو بتوزع شرف ع الكل انضبي 
1188134581662302208,LB,لي بيعرف حسابها يقلها عني أوعا يطقلك شي عرق  تمويل أفيييييش  لبنانينتفض صارالوقت 
1188138504670400512,LB,لا حول ولا قوة إلا بالله العلي العظيم  عم يحرموا العالم يشفقها قلبها ع المحتاجين ويتعاطفوا معهن يلا خير عند ربنا ما في شي بيضيع  
1188166010660106240,LB, هيي لاطشة وعاملة مهرجة خصنيش 
1188170781513129984,LB,  صار فيني موت بسلام عشت وشفت عم ينحلف فيني 
1188193360508534784,LB,  الصيت إلنا والفعل لغيرنا هني سرقوا وحطوها بضهرنا حشالله ما طلعلن شي 
1188204175043244032,LB, قال انو بيعتبر مقاومة إسرائيل إرهاب
1188350984579358720,LB,  هيدا مريييض اتركييييه لاطش 
1188351431272742912,LB, طول عمرو حيوان تسوكي
1188352847919882240,LB,  حدا دعسلك ع طرف  تسوكي أكيد مقصودة 
1188362117713448960,LB, بدنا نركز شوي نص الخطاب 
1188371393764876288,LB,الحل لي طرحو السيد بالنسبة للأدوية وطرقات لبنان بس لااااا نحنا ما بدنا لأنو من إيران هول ليش ما حدا بيحكي فيهن لأن ما فيهن لا نصب ولا سرقة ولا إحتيال نصراللهأشرفمنن 
1188378065656860672,LB,الكهربا لي صرلها الدولة بتحكي من التسعينات إنو ح تصير   السيد حسن قدم حل من إيران لي ح تحل هالمشكلة بأقل من سنة كمان هوووء ما بدن لأنو هالحل خالي من النصب والسرقة والاحتيال  نصراللهأشرفمنن 
1188380660085465088,LB,"كيف البعض لي مركب راس حمار بدو يفهم إنو السيد ما قال عن المتظاهرين عملاء سفارات وإنن بيقبضوا ولا حتى قال إنو هوي ضدهن قال في تمويل وما شمل وقال نحنا اعتصمنا أكتر من سنة ومنعرف هالشي وقال انا بحكي من معلومات وقرائن مش مجرد تحليل
لي ما بشوف من الغربال بكون أعمى لبنانينتفض"
1188406027399684096,LB,"بالنسبة لخطاب السيد وحكيو عن المتظاهرين ومطالبهن من جهة وعن التمويل من جهة أخرى بحب قول للشوي الكتير
فهمتوا الخطاب أو ما فهمتوه إيه ان شالله ستين عمركن إذا بتفهموا لبنانينتفض"
1188406276411318272,LB, كلو وارد يا أخي 
1188410707244654592,LB,"طالما وضحت الصورة وإنو السرية المصرفية لا يعول عليها ليش كنتوا عم تطالبوا فيها وتتحدوا السياسيين إذا بيرفعوها أو لاء 
بعد في عنا الاموال غير المنقولة ت نشوف شو هني هالعقارات لي بإسمن ومن أين لهم هذا  شبعرفني إذا بيطلع إلها مهرب هاي كمان  لبنانينتفض"
1188412531683090432,LB, بلبنان سهلة رفع السرية المصرفية لأنو مصرف لبنان بيطلع قرار واحد بيبعتوا لكل المصارف الموجودة بالبلد بس الفكرة بالحسابات برا
1188414834825728000,LB, أهااااااااا مين المسؤول يعني  مين بيطلع بهالأفكار 
1188431302397173760,LB,  يلا ولي هبلة انتبهي يطقلك شي عرق طعمرك شو لاطشة إنت وياه
1188484981913456640,LB, أو جعلوك ما بعرف العيلة الصحيحة
1188487628208967680,LB,"  لحظة زحلي هيك شوي خينا علي
ليك يابو مصطفى هيدا الشخص لي عم تتوجهلو بالحكي هوي جريح دفاعا عن أرض هالبلد مش هني لي بيقعدوا ببيوتن رغم جراحنشايفتك نازل تعليقات شمال ويمين وماشي الحال النقاش مهم بس لما توصل لعند هول الشباب أوعك تجرب تقلل من قيمتهن هول بتنخ وبتبوس الرينجر تبعهن"
1188492511658074112,LB,  يا المش عزيزي كل شاب ترك حياتو ت يدافع عن حياتي اقلو بوس الرينجر الخاص فيه وهالشي بيرفعنا مش بيخلينا ننذل ما حدا قلل شأن حدا لو ما كان لبنان أولا وأخيرا عنا ما كانوا طلعوا الشباب دافعوا عنو منن استشهد ومنن جرحى ومنن بعدن ع الجبهات وصلت
1188492786405904384,LB,بتول ح تتدعوس شي يوم  
1188499279603785728,LB,"سوري جواد أنا بحكي الحق 
دارلينغ لي بينادي بنزع سلاح المقاومة ما يسمعنا صوتو  عم تناشدي السيد بتأديبنا   الأدب عم يشرشر منك ما شاءالله جيبولي هالسطولة ت نعبي أدب يا جماعة 
آه سوري السطل مفخوت انطري ت نجيب غيرو  "
1188499798141394944,LB, نفس إحساسي لما قريت المناشدة 
1188507170415038464,LB, شبعرفني والله مني وعليي ما دعستلها ع طرف
1188509111836643328,LB, ابعتيلي سيارات الجيران كمان 
1188510005617659904,LB, مين خبرك  اصلا السنيورة هونيك 
1188558629479288832,LB, يا الله مش طبيعي 
1188563984653443072,LB, اسألو بالله بيختزلنا مين يعني نا  هوي وبيار حشاش  طب يعمل ورقة هوي كمان مع لي بيألبوا الرأي العام بركي بيمشي الحال
1188564310081048576,LB,  مش موجودة هون روح فتش عليها ع الفيسبوك
1188564391857479680,LB,  أمان يا ربي أمان
1188564985405988864,LB,  فكرت بدك حسابها حرقولها ياه هون بس بعدها ناشطة ع الفيسبوك
1188694266861760512,LB,يلي بيسأل عنك مين بدنا نقلو إنت مييينك  و نصراللهأشرفمنن  
1188697413336350720,LB, هيدا المنشد علي العطار
1188699183001284608,LB,  مش بس عندي يعني
1188720500316528640,LB, هيي بذاتها يا سوووبهان الله 
738678714091769856,LB, أولع بنفسي  أبخش عيني أشرب ديتول  أأرمش أزاز ولا ايههههه 
739079274758471680,LB,لما حط التلفون عالشارج بتصير العلاقة طويلة جنب البريز الكهربا 
741347047182204928,LB, فين الذكور يا رجالة 
742418061043458048,LB,"الام انا رايحة عالعمرة حبيبي
الابندعيلي يا امي الله يوفقني و يرزقني من حيث لا احتسب 
بس اوعك تدعي الله يبعد عني ولاد الحرام لان بحب رفقاتي"
743864981020508160,LB, و اول وحدة اجمل من التانية
745085550030315520,LB,"   
 
اخواتي شو قصة هالحيوانة نازلة اكل خرا كتير  "
745085932798238720,LB, هههه خيي شو بدك فيها  هاي مختلة عقليا  مش بس انت مخانقة معك حتى انا و اصحابي بدا تشهر حالها بس مش عارفي كيف 
745086748259033088,LB, و اكيد هيي حكتك عالخاص و رجعت قلتلك ما بقى تحكيني و بلوك و حكتك من اكتر من حساب و تقلك حتبلش الحرب هاي هبلة شو بدك فيها معا انفصام
745235085679439872,LB, وحدة هبلة نقصني عقل فاضي و مصدي  و قال شو صورت التشات و ما صورت انو هيي يلي نقبرت تحكي بالاول
745237305506430976,LB, جاي هيي يلي بتحكي على اساس مفكرة حالها شي ملكة جمال لنتخانق على جمالها  انو عنجد عندها مشكلة بعقلها
746741836677419008,LB,"انو بتجيب المسبة لحالها و لأهلها 
و متل اجري انت و حكيك كلو 
عفوا اجري اكبر من انو شبها فيكي  
 "
746743186383462400,LB, هههه عم ضل سوي عنجد الانفصام طلع اضرب من داعش  لعمى بقلبها اذا بتذوق  مش عارفي انو اخر همي شو تحكي حكيها و خريتي سوى
746744372301959168,LB,  اصلا انا كتير بحب رمدان خلص نسيتا و الله و حفل لحالي 
747190119736586240,LB,   هههههه انا عم قول كل ما جيب منقوشة مين بيكلها هاي معها انفصام بسخصيتها والله هبلة
747442840230191104,LB,"مرة صيدلي حكالي نكتة 
مش هون الموضوع 
الموضوع انو نسيت اسألوا بضحك قبل الاكل او بعد الاكل 
ما حدا يدفش بفل لحالي "
751256087597355008,LB, ما اقدر والله ما اقدر  انا ابغي سيغارة بني 
751257510984704000,LB, هههههه متلي متلك يا كبير اوك ما عندي مانع 
751261302840930304,LB,  ملاحظين انو تنيناتكون معكون نفس الفرد شو هالصدفة بعرف الطريق حفل لحالي ما تدفشو 
753402563362426880,LB,انو عنجد في عالم وسخة بعمري ما شايف متلون الحمار بيفهم و هني ما بيفهموا  كل شوي بتعمل حساب بإسمي متل هيدا  روحي تربي تقبريني
754048712201084928,LB,"شوي و بتلاقي حاطين على  انو حزب الله الو علاقة بالانقلاب 
تركياتحتالانقلاب"
754341126509854720,LB,  ايه بس الدين يسر مش عسر  يعني ما قصدي اتجرأ خيي
755289323205951488,LB, و أنت بخير حسون  عالم بتنام هلق و عالم بتروح عالشغل
756520470871216128,LB,  ايه صح و اغلبكم كمان ما بيعرف او بيتأذى من شوك الورد هوي و عم يدعسون 
756778116358561792,LB, ما بك شي بلا دلع 
757230779470610432,LB,"صرنا بزمن لعمرو  سنة عم يدور على حب حياته 
و يللي عمرو  و طالع عم يدور على بوكيمون"
757244451739820032,LB, بوكيمون انساها يا حمودي  كرمال ما نكلها بلوك و يسكرولنا التويتر بوكيمون 
757245507865640960,LB,  لا والله ما نبطل  احنا كدا و حنبقى طول عمونا كدا 
757246198919098368,LB,  اوكي اوكي اذا ما اكلناها شي ريبورت محترمة 
757248710669729792,LB,  أنا بقلك هيدا ما بيتعاطى مخدرات او حشيش او ايي شي تاني هيدا بيتعاطى كلسات 
757251576893440000,LB,  هههه هيدي بتطلع مفاجئات حك و اربح 
757258022800556032,LB,  ههههه ليش هي رومنسية  اذا ابو جهل لكان يدفن البنات هني و عايشين بعدو ارحم منو منو دمر البنت لي بدو ياها من رومنسيتو
757259039671717888,LB, هههه هيدا لي وصلنيلو 
757260768488357888,LB,  انا زعلان عليكي  ضيعتي من ايدك فرصة العمر و مسلسل تركي ما بيفهم 
757261476474347520,LB,  ههههههه انا بعترض و بطلب وجود المحامي 
757262976680329216,LB,  هههه ما بأسر انا قبلان بعدني بأول عمري مش حأنهي حياتي دغري مش مستعجل 
757263803285434368,LB,  هههه يمكن اضرب يمكن بدها شاب يعوض عنها حنان اخيها و بيها 
757264455306735616,LB,  بس بدها تعيش قصة هندية انو يخطفوها و يجي عريسها يقتل نص الشعب  و يأنقذها 
757342235868401664,LB, انا بعدها ما نزلت عندي عالتلفون 
873512728643723264,LB, والله رهيبة يا ام شيماء
949276061862330368,LB, عم تضحكي وانت بهذا الشكل استبعد صدقا
1187245986340573184,LB,ما في شي حارق الثورة غير هالحركات  
1187257955718193152,LB,المدينة الرياضية مسكرة وليليليليييييش  لبنانينتفض
1187266543761146112,LB,  إيه إيه حلو الإعدام لجعجع 
1187278359044198400,LB,  من وين المعلومات  يبعتلو مليون علة
1187301645559959552,LB, كمان حل ولا أفخم 
1187306596709392384,LB,"متظاهر من برجا لبنان ما بيمشي حالو إلا بنزع سلاح حزب الله
أنا ان شالله بنزع روحك من شروشها يا معفن انقبر انسد يا بلا شرف لبنانينتفض يسقطحكمالمصرف"
1187309324303028224,LB, مصدق حالو  بتعجبني ثقتهن المعفنة متلن
1187309754634440704,LB, هاهاهاهاها  طب بحياة الله معقول راسو إنو هوي القوي يعني 
1187310501308633088,LB, هاهاهاها منشن لما تنزلها 
1187316144757190912,LB, لا وزير ولا نائب  بس هني البلا شرف بيحبوا التصويب ع سلاح الشرف
1187318603974152192,LB,  عم تحرقولي نهاري يلا ما مشكلة في كتير غيرن 
1187330985790246912,LB,"  لما مون مع العهد مش يعني راضبة عن كل شي وتتاقشنا بهالشي قبل وكنت وبعدني مع حق الطلاب بالتوزيف
ويلي صاير معهن موضوع طائفي بإمتياز وهاجمت جبران والرئيس بهيدا الموضوع اكتر من  مرة  واقوال الإمام علي ع عن الظلم والظالم بعرفهن تمام المعرفة وبدافع وقت اللزوم وعملتها"
1187350617553014784,LB,  اكيد بمشي أنا ومغمضة بس المسؤولية كتير كبيرة وبدها تفكير صراحة بخاف ما كون قدها
1187353215307800576,LB,"  يا شماتة أبلة ظاظا 
 أبلة طازة مين 
هيدا السيناريو "
1187355178791591936,LB,  إنتوا قناة العهر   هيدا لي عرفتو
1187355347310264320,LB,  كلن يعني كلن والسيد أشرف منن برياض الصلح هجموا ع بعض 
1187357193512861696,LB,"ليك يا ديماالواطية كلمتين ع الماشي حزب الله مش ضروري يقول انزلوا يا غشيمة حزب الله عندو شعب بيدبك بنيع كل واحد إبن كلب بدو يحكي كلمة غلط ع السيد
والسيد أشرف منن  "
1187357675341922304,LB,يا شبااااااب ادبكوا بنيع كل واحد بيحكي ع السيد كل الحب  ونصراللهأشرفمنن
1187361622735621888,LB, نزلوا الشباب يقولوا رأيهن برياض الصلح 
1187366714406854912,LB, ع شو يا عيب الشوم  يلي بدو يتهم السيد بالفساد متلو متل زعيمو الفاسد الأكبر ويساويهن ببعض بدو ينرد عليه كل يوم ساكتين كنا لليوم ليش ما حدا سكت الباقيين لا معلش يردوا عليهن معلش
1187367787683045376,LB," ما حدا تبنى وقلنا ملايين المرات والسيد قال لما الحزب بدو يعمل شي بيعملوا بالعلن 
نحنا مؤيدين لحزب الله وعنا السيد بعد الله ما منسمح لحدا يجيب سيرتو بالعاطل يتفضلوا المهضومين يبقوا متل اول يوم نحنا معن بس لما سيرة السيد بدها تنقال ع لسان الأنجاس فهون اسمحلي فيها"
1187368449997185024,LB,  ما عم يخربوا شي مش هني عندن مطالب  ونحنا كمان نفس المطالب بس السيد خط أحمر 
