id,dialect,text
1063174138695745536,QA, كلهم مجرمين المخرف و ولده واللي يحلب الفلوس منهم
1063390986783592448,QA,ان شاء الله قول  ان شاء الله قوووول  
1064488186754318336,QA, اشبيقول يعني  بيقول عن سواد وجهه
1064492314805116800,QA,ولاعمره راح يكون قدها 
1065135582895107968,QA,"الوعد باذن الله 
في ظل قايدنا تميم وابونا حمد "
1065517077375696768,QA, أهم شي ان البنات يشترون البيت  ماتبي بعد يدفعون المهر  نفس الهند  مسكين وين يقدر على اربع مهور 
1065520804719456384,QA, نفس مهور قطر مش مهور الجيران اللي داقه
1065705650385272832,QA, اليوم فيك شي من الصبح
1065706006938861568,QA,  امحق خرفنه  لا المخرفنه عدله ولا المخرفن عدل
1066191538299039616,QA,اجملصورهمنمدينتك الدوحة  
1071717064363134976,QA, بسك لعنت خامس خامسه 
1075393282425925632,QA,"    فرق بين ميت مسلم و ميت كافر 
لو مهما عمل وواثقين من خططهم الدنيئهحسابه عند رب العالمين مايظلم حد 
نقول ونفضح خططهم بس مانعيب على خلقة الله
اناأتكلم عن مبدأ اخلاقي اسلامي 
وما ادافع عنه وعن اولاده اللي طغوا اكثر منهالحب يطلع عاى بذرهيعني عياله من وين بيجيبونه الا منه"
1075466559143989248,QA,   احنا مستمتعين  وهم مقهورين 
1075498666868256768,QA,"   المشكله انهم يدشون حساباتنا ويعلقون حتى لو مالهم شغل و يراقبونا و يجون يقولون لك قطر صغيره جدا جدا 
واهم شي لين قال لك مش انت يالقطري تعلمني بقطر فديت قطر بس واهلها  قاهرينهم"
1076923018381848576,QA, كل شي عندهم دعاره  كل يرى الناس بعين طبعه
1077503733175439360,QA, يكفي ان ال عبدالغني واغلب ال مفتاح عايشين هناك 
1077532195907141632,QA,"  والنعم في البوعينين حبايبنا والله ماعليهم قصور  
ضربنا مثال فقط للعد وليس للحصر أكيد"
1077605979955568640,QA, كل يرى الناس بعين طبعه  طال عمرك 
1077997912880279552,QA,"     انا مش من سكان الوكره  بس يمكن البيت بو طابقين على اليمين بيت 
حسن بن احمد وبعده  يجي بيت جاسم المفتاح  والمسجد اللي على اليسار الحين جددوه 
احنا من الطيبين بس الصوره اطيب من الطيبين "
1078002693929615360,QA,"    لا والله احنا من سكان الجسره الجميلة  بس اهلنا واحبابنا في الوكره 
اول بيت على الشاطى الي الحين متحف الوكره بيت عبدالله عبد الغني ونفس المنطقه هذه فيها اول شي بيت ماجد بن سعد وعقبه جاسم المفتاح  
هذا اللي اعرفه بعد العلم عند الله 
بنشوف جيل الطيبين وسكان الوكره شيقولون"
1078919478090489984,QA, حلوه والله يقول  الحرمين ملكنا    ان شاء الله بسبب تغريدته وتفكيره  ينحذفون في النار  اولهم على تاليهم
1079716847606530048,QA, خوش  واضحه آثار الخدمة الوطنية
1000451873189527552,QA," عليكم بالعافيه 
 وحنا مو بحاجتها بنتبرع فيها 
لكم الفلوس ولنا الاجر باذن الله"
1000689967071408000,QA," اللي ماتعرفه ان المنتجات جديده و صارت تدخل عن طريق تجار الكويت وعمان  وانتجها جديد بعد اكتوبر  وبعضها 
والحمدلله ماعندنا اي شي منتهية صلاحيته يبقى على ارفف الجمعيات"
1000692202069286784,QA, واللي ماتعرفه انك ماتعرف شي  توك تقول منتجات منهيه والحين تقول اردوغان 
1000829312352780416,QA, اي حد يقول اي كلمه ماتعجبهم  صار بالنسبه لهم خاين وعميل لقطر 
1001588483792736384,QA," اذا الشرف حلف لك 
واضح الصنف اللي تتعاطاه "
1002825796761866240,QA, هذول ذباب الكترونيه  لاهم قطرين ولاشي  ريح نفسك
1002829068885209216,QA, ذابحكم وباط كبودكم حمد  عسى كبودكم البط  آمين
1003728051551629184,QA, شكرا على المداخله  خلكم انتوا بس  راضين على داشركم  ومالكم شغل بتميمنا
1003788849405988864,QA, محد اضربك على ايدك وقال لك علقي 
1003799950835306368,QA, انتي اللي قلتي الخلا  بعد اقدر اقول لك تويترك هو
1004301942401748992,QA,"الذكريالسنويهلمقاطعهالارهاب 
الحمدلله قطر اطلعت سالمه منكم ومن تخطيطاتكم 
والله اللي حنا بنحتفل بمناسبة انقطاع العلاقات بينا وبينكم  وابركها من ساعه 
وحنا بخير بدون حلف الفجار
ولله الحمدوالمنه"
1004423748626202624,QA,  لا مامنعتوا وصارت اشيائكم تدخل عن طريق الكويت وعمان  لو منعتوا كان ماوصلت لنا  بس حنا اللي رمينا كل منتجاتكم وتخلينا عنها وعنكم  ومن عافنا عفناه  والله الغني
1004810438390009984,QA,   وش تقول عن الانقلاب اللي كنتوا تديرونه ضد حمد عام  واعتقد طلع برنامج كامل عنه  مايحتاج نسب بعض  خلاص روحوا وبلا رده مانحتاجكم ولاتحتاجونا 
1005030587286028416,QA,  يا اخ فيصل  ليتك تسكت بس  وتفكنا من شرك
1005537634775719936,QA,     هذا احنا نطقطق عليكم وحاطين شبوك  يا بوشبوك  المثل يقول  وين رايحه ياطنازه  قالت اتطنز
1005542602328985600,QA,     يا حلاة بلادنا ومساحتها  انعرف ناس مساحة بلادهم كبيره بس عقولهم اصغر من النقطه اللي في اسم قطر 
1005684181010206848,QA,     واحنا نرد عليك ونقول  عقولكم اصغر من النقطه اللي في اسم قطر  اللهم اني صائم  سلام   شريفه اشرف من الجيران الفجار 
1005687663184269184,QA,     خلك واقعي على اسمك ولاتردد مايشاع في السوشيل ميدياواكيد الله يدمر من دمر المسلمين وراح نقول آمينوبنشوف من اللي راح يتدمر ومن تآمر  على المسلمينعلى فكره انا ما ادافع عن ايرانلكن اذا كنتوا تشوفونها دمرت كل هالعالم بمساعدتنا ليه ماتحرمونهم من مكه مثل ماحرمتوناسلام يا واقعي
1005687980739170432,QA,      انصدمت لمى شفتنا نقول آمين صح   الكلام معك مامنه فايده 
1005694734793256960,QA,     اتصدق ماعندك سالفه  حرام الواحد يضيع وقته معاك
1005695141200347136,QA,     الله شاهد على تغريدتك الغرافه غصب عن اكبر خشم عندكم اعتمروا لان الرحله كانت رحلة عمل وراحوا للعمره 
1005695630633627648,QA,"     انت تكذب نفسك 
انت قلت ايران قتله ومع ذلك انتوا اتخلونهم يزورون بيت الله  وانت اللي قلت احنا نساعدهم مع ذلك حرمتونا  فتح مخك وطلعه من الشبوك اللي محبوس فيه"
1005863227111235584,QA, لو تيزاب بعد مايتنظف
1005942320406192000,QA,"   المها  واحنا مانجادل ذكور  خليه  شكله مستانس ان القطرين ياخذون أكثر من  ساعه لين يوصلون جده وطبعا لازم تصريح مسبق كانه فيزا 
 ان شاء الله يتم منعه هو من بيت الله عشان يحس  آمين"
1006046858483888000,QA,    بتصريح  ومانعرف من وين نطلع التصريح لان مافي لامكتب ولاقنصليه ولا شي  ركز في اللي مكتوب
1006130965738147840,QA,"  قطر مامنعتكم من متابعة الحدث
هذه حقوق نشر محفوظه للقناة المملوكه من قطر واللي يبي يشارك حياه الله 
بس دولتكم امنعت الاشتراك
لو حقوق النقل عند اي دوله ثانيهودولتكم قطعت عليكم الارسالهل راح تقول للدوله الثانيه انكم تسلبونا حقوقنا وشدخل الموضوع باللؤم والحقاره شغل مخك شوي"
1006205588747894784,QA,"  خل دولتكم تطلع اعلان رسمي وصريح بانه مسموح للقطرين وكذلك تعطي تعليمات صريحه وواضحه للفنادق باستقبال القطرين  مش تخلون الخطوط الكويتيه تطلع تصريح 
 بعدها مع بعد المسافه ومشقتها علينا راح نستحملها  مع انكم صعبتوها علينا لكن هذا في ذمتكم  محد راح يخاطر بنفسه بدون تصريح واضح"
1006210010798411776,QA,"    اي عقوبات الفيفا  
واضح ان كأس العالم لاحس مخكم 
هذاك شغل يختلف عن عباده 
هذول فريق متخصص لتنظيم كأس العالم مش الشعب كامل 
لاحول ولاقوة الا بالله 
يا اخي خلاص  احنا راح نقول حسبنا الله ونعم الوكيل  اذا انتم تشوفون نفسكم مش مقصرين فخلاص ليش تخافون "
1006214646905298944,QA,"    مانقول الا الله يصلح الحال 
كل اللي صاير وحاصل فتن لها أول ومالها آخر  وكل واحد شايف ان هو على حق الله يكفينا ويكفيكم شر الفتن  آمين"
1006226555574480768,QA,    ولايهمك نعتبرها بطوله و يتضاعف الأجر لنا فيها  والآخره خير وأبقى بإذن الله
1006254071324528640,QA,"  لاتصريفه ولاشي  والشعب هو اللي متضرر  اما البعثات الرسميه فعادي  وكلامك صحيح مامنعتوا الايرانين ولا حتى صعبتوها عليهم   بس صعبتوها وطولتوها وزدتوها مسقه علينا احنا بس 

وفي النهاية مشكورين وماتقصرون  والله يكفينا ويكفيكم شر الفتن  والله يصلح الحال"
1006678917107933184,QA, ياريتك خليت هذرتك  في الرياضه بس  كان ابرك لك
1007043318755315584,QA, روح يا شيخ وانت تعرف انكم كذابين بس الحين بديتوا تسمحون وبعد ماتسهلون    نسيتوا ايش سويتوا ف الناس من بداية الازمه  واسأل فنادقكم واسال حدودكم  وعن الكذب  الله يصعبها عليكم دنيا وآخره  والله يصعب عليكم  سكرات الموت  آمين
1007045899804119040,QA," لو قلنا ان عمرك ما اعتمرت   بنتقبلها
لو قلنا حج وفريضه  وتخاف يجي اجلك  بعد بنقبلها 
بس شنسمي هالفعل 


 أنانيه مطلقه"
1007061625361268736,QA,"  مانسينا شلون طردتونا في اول ايام الحصار  وكان في رمضان 
ومانسينا لمى رجعنا للفندق لقينا اغراضنا مرميه في الممرات
 والفنادق رفضت استقبالنا
ومانسينا كم قطري وصل للمطار ورجعتوه 
الحين قلتوا مامنعنا لا بس الحين صرتوا ماتمنعون خوفا من عقوبات الدنيا والمحاكم 
ومانستوا عقوبات الآخره"
1007062742547812352,QA,"  لا مو فكرة مانطلع كذابين 
انتوا الكذابين لان كنتوا مانعين ومتسلطين وبدون اعلان 
الحين فتحتوا المجال نعم بس مع صعوبات لانكم خفتوا عقوبات الدنيا
لكن الله يصعب عليكم دنيا وآخره  آمين"
1007062985746108416,QA,   الله يصعبها عليكم دنيا وآخره مثل ماصعبتوها علينا في الدنيا  آمين آمين
1007073377012600832,QA,  عساهم في هالحال وأردى
1007090120409931776,QA, اللي على راسه بطحه  يا تابع الداشر
1007099844236861440,QA,  الله يهدينا ويهديه  بس لاحظ ان انا ماقلت شي عن الرجال بس رديت عليك  اعتمادا على كلامه هو لكن ماعرف ليش حضرتك تقول هالكلام لي  سلام 
1007102677174620160,QA,  والله الواحد يتحرى  الافضل نشوف حساب الشخص الاماراتي المدعو  لو هو منزل هالفيديو قديما ام حديثا  وراح نعرف الحق من عدمه  بشكل عام الموضوع مايستاهل  والله يهدينا جميعا
1008426710117879808,QA," هذا المثل اللي يقول  وين رايحه ياطنازه قالت  رايحه اتطنز  اللي بيته من زجاج لايرمي الناس بالحجر  الكلام اللي يقوله ينطبق عليه هو قبل لاينطبق على اي حد ثاني
وسيمالمرتزق"
1008433736109776768,QA,"   وانتم من حولتوا الموضوع من عبادة لسياسه 
وانتم من حولتوا الموضوع من أهل لسياسة
وانتم من حولتوا الموضوع من فن لسياسة 
وانتم من حولتوا الموضوع من رياضة لسياسه من البدايه
ضربني وبكى  وسبقني واشتكى  الحل في الرياض للشبوك اللي عندكم  اما نحن فلا "
1008773413366743040,QA,اي والله كلها حسابات وبلاش  عبالهم بطوله الحين لمى يهكرون  وراح نقول كلتهكيرهفيهاخيره  والقادم اقوى باذن الله  
1009163209121681408,QA,    مانقول إلا الله يستر علينا وعليهم  هم اللي عملوا الهاشتاق ومعارضينهم هم من رفع الهاشتاق  ويجون يقطونها في راس قطر  حنا كقطرين مانرضى بهذا الشي لا لبناتنا ولا لبنات المسلمين من أي جنسيه كانوالا في بلادنا ولافي بلادكم  الله يستر علينا وعليكموالله يكفينا ويكفيكم شر الفتن 
1009163455629324416,QA, واضح من الكلام انهم مش سعوديات  الله يكفينا شر الفتن ويهدي بنات المسلمين
1009789137254305792,QA,"  اللهم لك الحمد والشكر 
هم عندهم يا تحب اللي نحبه  يا انت وطوايفك وهلك وبلادك غلطانين 
عقول صغيره لاتنزل نفسك لمستواهم 
شكرا لأهل الكويت 
قطروالكويتعينينبراس"
1009966048693628800,QA," بس مثل ماشهرت في قطر على قنوات دول حلف الفجار الأحق انك
ترجع تعتذر لقطر في نفس القنوات  مو جاي تعتذر في التويتر 
لاتتبنى قضيه وتطلع تتكلم فيها علني قبل ماتعرف معطياتها  اعتقد المفروض انك اتعرف هالشي كمحامي مايحتاج حد يعلمك 
حسبنا الله ونعم الوكيل"
1011583810918420352,QA,     اكيد نعرفكم وانتوا اتعرفوناوبالعكس انا معاك واضح من اللهجه انهم مش سعوديات والعلم عند اللهانا اقصد الهاشتاق الناس يقولون ان من قطراول من غرد ونشر في الهاشتاق هم معارضينكم السعودين مش القطرين هذا اللي اقصدهواكيد حنا مثل مانرصى على بناتنا بعد مانرضى على بناتكم وبنات المسلمين
1013725793262952448,QA, حلم ابليس بالجنه  حتى الفوتوشوب مش فالحين فيه
1013727298292535168,QA, هذا اذا ملكم يشوف عدل اصلا
1014578320200040448,QA,"عرفنا سالفة قطرتحاصرالغفران
وهالسالفه كررتوها الف مرهوالغفران واهلهم اللي في قطر نفسهم عارفين والكل عارف معطيات القصه وسببها بس انتوا ذباب غبي
 اذا اصلا الاتهامات اللي تقولونها صحيحه من الاصلعطوهم جنسيتكم  وخلصونا
اللي بعدوه
شنو الجديد اللي بتطلعونه بعد  

ننتظر جديدكم"
1015863484846727168,QA," ويجيك واحد يقول  يا اخي كنتوا تتقضون حاجاتكم عندنا  و انتوا اللي ميتين على الاشياء  واحنا اصحاب فضل عليكم و و و   وكأن حنا كنا ناخذ منهم ببلاش  او هم يتصدقون علينا كانوا مستفيدين ومايمنع بعد حنا كنا مستفيدين من رخص الاسعار 
الله يصلح الحال في جميع دول الاسلام"
1016181411072618368,QA,"اغتيالملاكمسودانيبقطر 
الله يرحمه ويغفر له  ويعوضه بالجنه ويصبر أهله 
حتى الموت دخلتوه في السياسة 
اهله هم الأحق بمعرفة التفاصيل  اما الباقيه فهذا يعتبر فضول منهم وتعدي على حرمة الميت  اصبحتوا بلا ذمة ولاضمير  احترموا حرمة الميت
حسبي الله ونعم الوكيل"
1016661226426806400,QA,  تعال شوف الحرس اللي تقول عنهم  لو لقيتهم حابسينا او مقيدينا او مخوفينا  لك اللي تبيه  لاتكرر الكلام نفس الببغاء  وراح تكون هالتغريده شاهد عليك ليوم الدين
1016679458793803776,QA, الحين انت تكلمت عن مصر  اغلب الردود اللي تحت  ابي اعرف  من حارق خبزهم   اللي على راسه بطحه 
1016745974289649664,QA,فرنسابلجيكا و تميمالمجد ربي يحفظه ويبلغنا ب  على خير 
1017083691032567808,QA,"استقبالمهينمناردوغانلتميم 
ذباب 
كنتوا مشغولين بكأس العالم وساكتين
والحين على النهايه فضيتوا 
الله يشغلكم بانفسكم زياده"
1017118978915913600,QA, ركز عدل وبتعرف هم من وين
1176240828450267136,QA,  كل اللي يصير لكم ولاتعتبرون فانتظروا انا معكم منتظرون
1176242775202902016,QA, حرامية بعضها من بعض
1177448023992832000,QA, دافع عن بلدك بالأول وخل مصر يعرفون لها اهلها الله ينصرهم على فرعونهم ويمكن للاخوان المسلمين والشرفاء في مصر
978664933335404416,QA," الهاشتاق من اللي يطلعه ويدعمه وكل يوم مطلعين هاشتاق جديد 
ابحث عن   "
978665702302408832,QA, خلاص شارك في الهاشتاق اللي ضدكم واللي تزعم ان حنا مطلعينه
978683870299246592,QA, بالفعل هذا ينطبق عليك  انت اللي ذميتنا
978720355941535616,QA, وانت شوف البايو مالك وشوف تمجيدك ل 
981143958041628800,QA, حاولت افهم  بس ماقدرت 
982265796024877056,QA,"يالله اذا فيكم خير  سووها خلنا نشوف  قناهسلويالبحريه 
منت بقدها والله"
983023859048828800,QA,  اكيد باسوي لها ريتويت  وبنفس الوقت ابني بلادي   ومااهتم للذباب الالكتروني  وخلك انت تراقب وتنقهر
983045184769396736,QA,   الا انفجر   مو منه من النك نيم حقه 
983045689457377152,QA,   اقول  دير بالك ترا وراك حوثي وانت ماتدري عنه 
983224513247826048,QA, والله ما ارهبوا الا نفسهم  كان طلعوا قوتهم على الحوثي اللي  شخص ماقدرتوا عليهم  خلوا عنكم الهياط وكثرة الحكي
983373338184683648,QA,    اعترفت بقيمتك  مايرجع للزق الا الزق  مكرم السامعين 
983375307158818816,QA,    يبي لك بلوك كبر راسك يا ذبابة
983559803489406976,QA,"قطرمندولهاليجزيره 
اشدعوة مسوينه حديث الساعه 
حتى هاشتاقكم غلط غيروه من شبه جزيرة لجزيره عشان تكون المعلومه صحيحة يا غبائكممايمنع ان الجزيرة تكون دولةبريطانيا جزيرة استراليا قاره و جزيرةغيرهم كثار وعايشين احسن منكم 
قطر بخير بدونكموابركها من ساعه
ومنتوا بقدها اصلا"
984091561293172736,QA, خلهم ينابحون ولاحد مفتكر فيهم
984303019360768000,QA," لو جات ع اللي عايشين برا من السعودين اكثر من القطرين اللي عايشين برا 
فمافي داعي تتكلمون عن الشعب القطري  وتقولون نصهم مسحوبه جناسيهم  
الغرض من الهاشتاق اصلاح البين فياتتكلمون خير في الهاشتاق اللي يراد من وراه خير  يا تسكتون"
985603720602882048,QA," هو يتكلم بالعربيه والمفروض يلفظها بالعربيه بالستيه ومايخلط العربي بالانجليزي  ومايلفظها بالاستيكيه   
هذا اذا فرضنا ان هو لفظها بهالطريقه على اساس نطقها بالانجليزي 

بس المطبلين كثار 
يعني وين مايرقعونها عوجه  بلاستيك يعني بلاستيك"
985754778281172992,QA,"البوعينيناحرجنا
ويا زين البوعينين بينهم اكثر واحد رزه بينهم  وطبعا ابونا صباح  والا الباقي زيادة عدد 
مايحتاج انقول و نوصف المترديه والنطيحه اللي حضروا الاجتماعات 
مقهورييين "
986114728521940992,QA,"  يحليلك مالقيت شي تتكلم عنه فجيت تضحك على غلطة مطبعية ج او ح   وربطتها بالعروبه و الثقافه  شفت مستواك 
شكرا على المداخله  
وما احب انزل مستوى المناقشة لمستواك  وواضح مستواك من ردودك البلاستيكيه 
سلام "
986588245747208192,QA,  وينه الامارتي خاف وعطاني بلوك 
986690925673009152,QA,"المواطناحقبالتجنيد
يا اخي احنا مرتاحين وانتوا كل يوم طلعوا هاشتاق اغبى من اللي قبله"
989858955298996224,QA,"مظاهراتفيقطرضدالحمدين 
صج عاد   مابلغتونا عشان نشارك نصور على الاقل سناب 
المظاهرات فقط في عقول ذباب دول حلف الفجار الالكتروني  والا حنا اليوم الجمهة وقاعدين مستمتعين بالاجازة وجمعة الأهل  وقافلتنا تسير وغيرنا "
989859855472062464,QA,"مظاهراتفيقطرضدالحمدين

 مظاهراتفيقطرضدالحمدين
 وين  
يمكن شافوا جمهور السد ودحيل مجتمعين لنهائي كأس قطر  وعلى بالهم مظاهرات  "
991711807927701632,QA, كل تبن انت اللي المفروض يقبضون عليك متنكر باسم حساب قطري
991720362256863232,QA,  يعني بذمتك لو قطري  وضد الحكومه مافي مشكله  بس كل تغريداته كره لقطر لو ضد الحكومه زين وين ولائه لبلاده  ترا انتوا قلتوها  قطر صغيره جدا جدا  واحنا القطرين انعرف بعض عدل
992062893679136768,QA, عسى الريح تاخذك لاخر الدنيا وتنتفك نتفه نتفه  وترميك في صحراء كلها كثبان رمليه وتجيك الثعابين تلعب في حسبة اللي خلفوك  وعقب خل هلك يلقون لك طريق  آمين آمين آمين
992385999153004416,QA, محد منبوذ غيرك  انقلع منت بقطري ولاشي
994678406976622592,QA, لان بلاويهم كلها بالخش  
994870666364145664,QA,  المهم الحين خلصت صلاه ورجعت والا الغيتوا الصلاه من ضمن جدول هيئة الترفيه  بعدين فارس وسعودي وماتعرف تكتب حاقدين  وليس حقدين حقدين 
995180534702714752,QA, ترا نشتريها بفلوسنا  لايكون حضرتك متصدق بها علينا
995569041208160384,QA,"   خفت من الدعوى صح بس شاطر تطعن في اعراض الناس  
ترا انت اللي دشيت وعلقت في حسابي 
انت توكل على الله  والله يهديك 
الحمدلله على نعمة قطر  وبس"
996512982170525568,QA, انزين انت شكو بعد حاشر عمرك 
996615366540324864,QA,   ما شاء الله على اشباهك 
