id,dialect,text
1118923990267879424,JO, هههه لا لا راح فكرك ل اشي ثاني 
1118942482404921216,JO,  اهه للالله لالله حلوووة ما اقلك يعني 
1118942865512701952,JO, سسامر مالك ي حياتي  
1118945524059660416,JO,  مش ذنبي والله ي عموو 
1118992222689611776,JO, ابدا ابدا ما شافوو 
1118992389446615040,JO, وضعكك ابصر مالو ي شب 
1119218546096128000,JO, الله يخليلك ياه ويضل تاج فوق راسك وعساه من طويلين الاعمار 
1119344853098406016,JO,"كنت بصف رابع يمكن 
فقعت راس صاحبي بـ فاس ع نص راسو 
الدم صار زي الشلال 
شكرا عفوا  "
1119345770396827648,JO," اقل واجب 
الحمدالله اللي ضربتو معناتو "
1119996252941422592,JO, هههههه ليش كنتي بالجامعة 
1119996428443688960,JO, مي تووو مي توو 
1120012562794450944,JO, هو تذكر الله تالي هالمساا 
1120052105295822848,JO,"الحر عبد اذا طمع 
والعبد حر اذا قنع "
1120110002021253248,JO," حبيب القلب عمر بيكك ربي يسعد قلبكك 
وعقبال عندك يالحبيب "
1120454693560422400,JO, له ي ابو المصري عساك من طويلين الاعمار 
1120455631268405248,JO,لياان ليااان ليااان يخوان  
1120551402009432064,JO,"  هههه ادعوولها ي جماعة 
نازلة توزع نيرات ملعون اللي طرقها لونها هاشمية بدهم يضلو يدعولهاا للممات "
1122279081079463936,JO, الحكي بتقدر تسمع صوتوو 
1122583354556203008,JO," ربي يبارك بعمرك والف مبارك الك كمان 
فالك البيرق "
1122583729220747264,JO," اخوووي الرججل ابو الكووز 
ربي يبارك بعمرك يالحبيب "
1122583875467632640,JO,  اخوي ينال ربي يبارك بعمرك ويسعد قلبكك 
1122584464222297984,JO, ههههه يسسعد ربكك ابو بدوووور 
1122598515576921984,JO, الله يبارك بعمرك ي رب وعقبال عندك 
1122598634485370752,JO, هلاا وغلاا  الله يبارك بعمرك ي قلبي وعقبال عندك 
1122614892475953152,JO," هلاا وغلاا بالرججل 
ربي يبارك بعمرك يالحبيب وعقبال عندكك "
1122615443771011200,JO," يسعد قلبكك سلطاان بيكك 
ربي يبارك بعمرك يالحبيب "
1122812576533024768,JO," المهندسة الراقيةة هبةة  
ربي يبارك بعمرك ويسعدك ويوفقكك بحياتك 
الحمددالله "
1122812904573755392,JO, الله يبارك بعمركك ي رب 
1122812976858320768,JO, الله يبارك بعمرك مهندستنا اية 
1122813150884134784,JO, يبارك بعمركك ي رب 
1122813266269487232,JO, الله يبارك بعمرك لميسس 
1122813392610373632,JO,  ههههههه مبين انو اهه 
1122813449959038976,JO, ربي يبارك بعمرك جووري 
1122849372339875840,JO," وونعم الرفيق ابو المصري 
الله يبارك بعمرك يالحبيب وميت اهلا وسهلا "
1122949701291081600,JO," رهاا 
ربي يباررك بعمرك ومبارك عليناا 
بأذذن الله "
1122949899262353408,JO," اخووي الغاالي ابو الووتين 
ربي يبارك بعمرك ويسعد قلبكك 
متعلم الفخامةة منكك "
1123304240074698752,JO,"موعدنا بكرة وشو تأخر بكرة 
بكرة اليوم الوحيد اللي مش لازم اجيب العيد فييه 
اللهم قوووة "
1124025389511266432,JO," حبيبي ي غالي 
كأنك موجود وزيادة يالحبيب 
وربي يبارك بعمرك وقلبك وعقبال فرحتنا بيكك "
1124025756504526848,JO, ربي يسعدك و يبارك بعمركك شكرا شكررا 
1124093460708036608,JO, ربي يبارك بعمرك وعقبال عندك ان شاء الله 
1124237013715124224,JO," اخوووي 
ربي يسعدك ويباررك بعمرك ي قلبي 
يسعد عمركك وقلبكك 
وعقبال فرحتناا برسالة الماجستيرر ي ووححشش "
1124237384718090240,JO, الله يسعدكك ويباررك بيكك 
1124243770311049216,JO," ووونعم ووالله 
ربي يبارك بعمرك وقلبكك يخوي 
طول عمرك راعي اولى وما تقصر 
هههه عقبال اي اشي حلو عادي 
ومبااارررك علينااا "
1124272753203449984,JO," الله يبارك بعمرك ي رب وعقبال عندك ان شاء الله 
الله يسعدك واجمعين ان شاء الله "
1124285757265534976,JO," هلاا وغلاا بالمهندس المرتب 
ربي يسعدك و يبارك بعمرك يالحبيب "
1124298368455409664,JO,"القطر والقطريةة  دوا لهيك صراصيرر 
الحمدالله منتخبنا الثاني قطر تاهل وكسر عين بعض ناس بعد  "
1124315450295378048,JO,"  ربي يبارك بعمرك يالحبيب 
افـلحـت 
سـحـاب العز "
1124359592656424960,JO, الله يبعدو عنا وعنك 
1124361243366711168,JO," ربي يبارك بعمرك ويسعدك 
وعقبال عندك ان شاء الله "
1124369803727208448,JO," ربي يبارك بعمركك ي هندسسة 
يسعد قلبكك ي ررب 
ومبااارك علينااا "
1124372754348814336,JO, لا خلصص يررجع مووافق 
1124655890353786752,JO, ربي يبارك بعمرك يالذيب 
1125024187339485184,JO, وونعم وطيب بيكي وبهالشخص والله 
1125024652135469056,JO," الله يخليلك ياهم ووعساهم من طويلين الاعمار 
وكأنو امك نسختكك  "
1125051355083812864,JO, ههههه عفيةة ع دينكك وقلو بعد الامتحان غشيت دق خششوم 
1125095959707508736,JO, شعبناا الو بالعادة مش غريب عليه 
1125105823330525184,JO, احكي ي حياتي احكي 
1097129739947523968,JO, ههههه مهو الصحيح يعني 
1097185774292951040,JO, ما شاء الله  صحةة صحةة ابو الريكك 
1097288840711159808,JO," حبيب ومشيناها 
وصديق طيب وين المشكلةة  "
1097417042892865536,JO,"صحيت من النوم الصبح الشباب حكولي الدوام تعلق رجعت نمت 
لما صحيت لقيت الثلج كاين معبي الجنوب 
بس انا ما بدري وما توقعت انو ثلج وحركات واجوااء والله "
1097417838774624384,JO," عند السكن والجامعة ثلج واجواء  
وهان بمعان ما في غير برد وهوا وشمس 

المهم صباحك خير خييرر"
1097452711413469184,JO," احسدي اللي شافو ولعبو في 
انا كنت نايم "
1097491303934410752,JO,"يخوان اكثر اشي مبسوط منو هالفترة
اللي كانو يسحجو ع قروب رئاسةة الجامعةة 
وهسة بعد ما شافو نظام الدوام الجديد والقرارات 
قلبو وصارو يحكو غير حكي زمان  
والرئيس بطل يقبل بوستاتهم ولا يشيلهم من ارضهم 
اللهم لا شماتة "
1097629894740197376,JO,  سنين من العذاب اهه 
1097631200330551168,JO,  مهندسسس بذكرهاا زي اليووم 
1097632246897491968,JO,هههه بحسس فايت درفت وسباق ومين اقوى واسرع  
1097947774249848832,JO,ولا حدا رح يعرف صدقني  
1097948199535415168,JO," مين رح ينسى ي ابراهيم  
بلعبو بهالشعب وبوخذو قرارات البلد بهيك قعدات "
1097948846104153984,JO, والله ما بدك ياهاا 
1098136460857933824,JO,"شو دخل الكيماء بهندسة الحاسوب  
حد يفهمني  
المهم صباح الخير  من اقرف محاضرة بهالفصل "
1098139502063820800,JO," لا لا مش هاظ  كنت منزل عند ابو يامن 
بس نقلو الشعبةة عند واحد ثاني اسمو عبدالعزيز كمان "
1098139925042614400,JO, هههه شكرا لمشاعرك اللي ما فادتني بأشي 
1098268896820367360,JO, الله يخليلكو ياها تاج فوق راسكو 
1098269034599063552,JO,ي هيك الشبابيكك ي بلاش  
1098368954236579840,JO,  ههه وحدينا الله ع هالمسا مهندسة 
1098369333179371648,JO,"حسبي الله ونعم الوكيل فيهم 
الله لا يسامحهم وينتقم منهم  "
1098523428796157952,JO, حكم حكم ما شاء الله 
1098704483843035136,JO, هههه الله يعنيكك معناتو 
1099397451797200768,JO, ههه احنا بنقول ي رب 
1100049088517754752,JO,الانسان بس يفقد غالي بذبل 
1101053378258521984,JO,"مبارح كل الجامعة بتقلو علق الدوام وهو معيي يعلقو 
قلنا الرجل خايف ع مصلحتناا 
اما يخلينا نداوم وما اشوف ولا دكتور بالجامعةة
طيب معقول هو بـ معان ولا بـ عمان قاعد بدارو "
1101056291320016768,JO," مهو ي ابو الشمري كلهم ما شاء الله بهددو 
الغياب بغيابين واللي بقلك بعلامتين 
واخر اشي ما اشوف ولا وجه واحد بيهم"
1101057440546779136,JO, الحق ع الراس الكبير والله 
1101071801264812032,JO,فطيين ما شاء الله  
1101076935856279552,JO, ي هبة مش عارف الذكاء من وين بجيبو 
1101077904304283648,JO, بالناقص منو ومن قروبو 
1101148274084511616,JO,بنستاهل ولا ما بنستاهل   
1101265230410199040,JO,معقول هيك بنكون ختمناا ولا في اشي كمان  
1102105759851204608,JO, هاردلك ابو الريكك رايح جاي خذني جيتكك الله وكيلك 
1102491434689679360,JO,"         الراس الكبير عندكو معروف بالجامعةة مش بس عندكو ترى 
ورئيس رابطةة مشجعين بعد ي هملالي "
1103006027774128000,JO,"هههه علقو دوام الجامعة بكرةة 
ولغاية الان الاسباب مجهولة 
لا حول ولا قوة الا بالله "
1103006260079878016,JO,"   الاسباب مجهولة ايش طيب 
يلا الحمدالله ع كل حال "
1103013607044988800,JO, ههههه يخوك انسا الموضوع بجبروك تحكي مهم 
1103013721520119808,JO,  زي ما قال يزيد هاظ الخبر لا يقدر بالمال 
1103016187263369216,JO, ما شاء الله شغل مفاجئات يعني  
1103018841469341568,JO," اهه سمعت والله 
وكلامكك مية بالميةة "
1103078583914979200,JO,"ههههههههه ي حررام 
ابو الريكك تعال مطلوب هان لو سمحت 
 "
1103079750015295616,JO, ههههههه الله يهونها عليك يخوي ي ابو الريكك 
1103080096460615552,JO, ههههه اقل واااجب يخووكك 
1103080596795019264,JO, هههه وونعم الرفق والله 
1103080810494771200,JO, اقسسسم بالله السكن ما الو طعم ولا لوون كلها ولدة وعجب اخخخ على هذيكك الايااام 
1103081617046847616,JO, ههههه بتروح ذكريات وسوالف 
1103088756096204800,JO, احكيلهم سهمك وصل ي صاحبي 
1103089170845785984,JO, هههه عاد في اغنية خيااانة خيااانة هاي جاية صح مع الموضوع 
1103247755957407616,JO,  ههههه له ي ابو الريكك مشتاقلكو كلكو والله 
1103248393235775616,JO,  يسعد عمرك ابو الريكك 
1103327385284460416,JO, ههه انتي قطعتيهاا ع الكامل 
1103330457721204736,JO, ههه مش كل الناس واحد 
1103330990951415808,JO, الله يكون معكو مهندسس 
1103422211791179776,JO,"يخووان انا بـ معان من وعمري  سنةة 
هههه لا الوضضع صعب والله 
العمر اللي المفروض تعيش في احلى اشي بحياتك "
1103570040056614784,JO, هههه ان شاء الله ي رب 
1103619764239384576,JO,هاي جامعةة ولا طشة او رحلة   
1103796885654028416,JO, على ما اظن تقريبا وصلت اغلب دكاترة جامعتنا 
1103797137580666752,JO," ابو غنيم شو اللي ع شو  
انت عارف اللي بصير بس تخلص واثناء المباراة "
1103798657764204416,JO, كره عظيم للهندسة من طرفك مش عارف ليش 
1103816964122787840,JO, الله يرحم ما فقدتو 
1103852321040224384,JO, هههه الله يهدي البال 
1104533313635696640,JO,اياام ما كان بالبلد خير  
1104839235461357568,JO,الله وكيلكو اغلب دفعتي عرفتهم بس ع فصل تخرجهم  
1104855095781527552,JO, الكو صورة بالمدرج ي خونةة 
1105108140666880000,JO,احكي هالحكي لبعض ناس   
1105791072758886400,JO,حدا يجي يقعد ع رقم المقعد تبعي بالاقتصاد الهندسي  عشان الغياب 
1105796775959515136,JO, ههه لازم تحليهم كلهم 
1105896044213293056,JO, ووحدالله  طيب شو صاار الصلاحات دري بالموضوع 
1105905344105119616,JO, هههه لو بدري من اول ما حضرت والله 
1106171763996717056,JO,"الهوا بمعان طبيعي هيك  
الله يجيرناا "
1106246351732596736,JO, هههه يسلم عمركك مهندسنا 
1106271908507475968,JO, مهندسسنا شكلو امورك خربانةة 
1106272534205513600,JO,هههههههههههههه مش طبيعيين احناا  
1106286641742778368,JO, كانو اهه الامور خفت شوي 
1106674044903006208,JO, وظفو  شخص والباقي رح يوخذو  دينار شهريا لما يتوظفو
1106853782229536768,JO, وزمان عنكك وعن طلتكك البهيةة مهندسنا 
1107254375012028416,JO," دايما بتحكي مش رح اشتاقلها وبتكرهيها 
بس هي اول اعتراف ولسة ما تخرجتي كيف بس تتخرجي "
1107720976974917632,JO,"       هههه والله ي ريت 
المفروض بدلتي من اول لحالك "
1109098385527705600,JO,"متغير ياما عن زمان قافل على قلبك البيبان  حبيت وفارقت كام مكان عايش جوااك احساسك كل يوم يقل 
تخطي وخطوتك تذل من كثر ما احبطوك تمل 
فين تلقى دواك   "
1109118973134716800,JO,هههههههه يخوووان الكرك الكرك  
1109236778433539968,JO,الله والجماعة بس اللي بعلمو  
1109433726738542592,JO,  وونعم وطيب خاطر بيكك وبالذيب 
1109434160484110336,JO,بالعيشة برة البلد اكيد  
1109590567615430784,JO,"مليون فكرة تجي 
ومليون فكرة ترووح "
1110099378189099008,JO, هههه اصلي ي ابو الريكك 
1110100009003991040,JO,"ووين الشتى والثلج  
الواحد بصحى متاخر شوي ما بشوف اشي "
1110618889858310016,JO,قروبات جامعتنا عبارة عن قروبات صف تاسع حرفيا وفعليا 
1111001295303991168,JO, وونعم وطيب خاطر والله 
1111172745616941056,JO," طول عمرك قدهاا وكفوو ابو الريك الحشم 
يسعد صباحكك "
1112578460206157824,JO,"صباح الفصل اللي رح تخلص في روحنا وهو ما رح يخلص 
يسعد صباحكو تويتر "
1112626165942882432,JO, هلا وغلاا يسعد صباحكك مروان بيكك 
1112695683574886400,JO, اسكتي حرارتي مليون من هاليوم اللي كلو نكد 
1112760700873687040,JO, ي ررب  ربي يسعدك ابو الريكك 
1112966562330415232,JO, يسعدلي هالصبااح ي مرتب 
1112966721122549760,JO, يسعد صباحكك وكل اوقاتك بدور 
1113031433763860352,JO, زي حمامات جامعتنا بالزبطط 
1113078207606153216,JO," يسعد عمرك وقلبكك عمر بيكك 
اميين ي رب "
1113078759572242432,JO," عطاررري الغالي  الله يسعدك 
امين ي ررب "
1113492721996578816,JO, ربي يبارك بعمرك ابو الريكك المرتب 
1113493432880832384,JO, اميين ي رب  يبارك بعمرك ي غالي 
1084982597095178240,JO, عاارف عارف طول نهارك تدعي ع هالجامعةة واللي فيها 
1084990381706612736,JO,الناس اللي عمرها ما رح ترجع  
1085551181760548864,JO," والله امورهاا مشت الحمدالله 
عقبال عندكك ابو الشمري "
1085551392062869632,JO,"  الحياة مراحل 
موفقةة بالجاي "
1085680029751750784,JO," ما بلتام يوم احكي 
دفعةة المدني العظيمةة "
1085910425684844416,JO,"مين الاسود بالزبط  
والله ما في حثالة وازبل من هيكك منتخب وهيكك لعيبةة 
تصريحاتكو قبل البطولةة بدل ع تخلفكو 
بس اجا الرد بالميدان 
يلاااا مع القلعةة 
منتخبالبراميل "
1085929194704568448,JO, ونعم بيكي مهندسةة بتوول 
1085968280387489792,JO, يسسعد عمركك ابو بدور 
1085973228563116032,JO, هههههه انت وين طلعت ولا لسةة 
1086013960971788416,JO, ونعم من ساسكك مهندسةة 
1086016886113030016,JO," كلو بتعوض ي خاال 
بدها شدةة حيل ورح تخلص 
كل التوفيق "
1086239937454837760,JO,"مثل ما في كلام فاضي  فيه سكوت مليان 

جمعةة مباركةة "
1086254878668796032,JO, اهه شو لعاد ههههه 
1086439276475281408,JO, مش عارف ليش بتستخدموه اصلا 
1086439834372190208,JO,ولا اي اشي مفيد  
1086649153105612800,JO,"تقريبا كل العالم جاي ع الاردن 
المططااار في كثير ناسسس ايش هاظ 
شو في "
1086707349254033408,JO," هههه والله معطلين ولسةة ع وشك انو نزهق 
وصحيح بنرجع وبنذكر طلعنا ب  ساعةة ومنهم اهم مادةة بالتاريخ كالكولس زفت 
لهسةة مبسسسوط من جورهاا "
1086712099462659968,JO," الله يسامحكك كل هيصةة وكل واحد يخلص نطلع نزفوو 
كيف ما بيينت ييه "
1086718899524112384,JO,"    ما في شخص معين  
بس بالمجمل اهلي وصحابي "
1086719697016508416,JO,    احلى سنةة بحياتك الجامعية وليش 
1086722331597328384,JO,"    مع انو انا ما حضرت المناقشة لضروف كثير صعبةة لانو جماعتنةة كثار وانتي عارفة كهربا واتصالات وحاسوب وما قدرت وما كان في وقت
بس انا بعزمكو ع مناقشتي من هسةة ما الي دخل رح تحضرو هههه "
1086725789951901568,JO,"  للوهلةة الاولى قلت عاد انا مليش دخل 
بس عدلتيهاا ب مش كلهم 
المهم مشت وعدت والحمدالله كل اشي نصيب 

وانا جاهز اذا بدك تسألي   صراحةة "
1086727945866170368,JO,"  كانو عارفةة شو بدي والله 
في فكرة قوية ب انو اكمل ماستر 
واذا صحلي اشتغل او اسافر او اهاجر طبعا مية بالميةة ما رح اقول لا نهائي "
1086999720923406336,JO,"انداااررري ي الله 
والله فيتنااااام كانت بالجيبةةة كيف هيككك صااار  
اكلنااا اللي اقوى من فيتنااام 
ليششش
 الاردنفيتنام"
1087003972618076160,JO,"اقسسسم بالله نكد وضيااااق لاخرررر حد 
ما عمرها كملت ولا رح تكككمل ايشششش في 

 الاردنفيتنام"
1087507284626980864,JO, انا شايف كل الشعب منحوس ومطروق عين 
1087684725072892032,JO, ونعم مليون ابو السلامين 
1087723441875288064,JO,"بجامعتي 
اكثر حدا طول بالجامعة واكثر حد بحمل مواد بالعالم   الونش  بمصطلح اخر  "
1087784162482929664,JO, هههه لا ما ظنيت ابو خليفات 
1088031555363192832,JO, هلا هلاا ابو الشمري 
1088102735457775616,JO,"عناا هان بالاردن 
الدولةة زي الهرم اذا القاعدةة فاسدةة معناتو خلص ومين هي القاعدة  الشعب طبعا 
احنا شعب ما بدنا اصلاح وما بدنا نحارب الفساد 
قرايب واحد فيناا بنمسكك ع قضية فساد بتلاقي عشيرتو قامت وما قعدت 
ششعب لا يستحق الاصلاح ولا يحق له المطالبة بمحاربة الفساد لا والله "
1088196100597661568,JO,الله يلعن كل واحد واقف وبدافع عن فاسد  
1088208091416543232,JO,يخوان لحد يعطي الناس اكثر من قيمتهم 
1088396381298065408,JO,"الانطباع الاول
وجهي مش مريح  "
1088407014743699584,JO," هههه انداري ي هبةة احكيلهم 
"
1088418344976502784,JO,"احكوو واعطوني رايكو  
ان شاء الله نهايةة كل فاسد ومرتشي نهاية سووودة  "
1088464596174807040,JO,  هههه يزم عالوين كل الناس بتخوف وشايفةة حالها زيكك 
1088858369916653568,JO, ياسمين شكلك عاملة وحدة فيهن وبتحاولي تدافعي 
1089237087218487168,JO," كماان برةة البلد 
الله يبشرك بالخير "
1089476864983400448,JO," هههه اكيد كل حدا ورزقتو 
ي ررب "
1089490308683964416,JO,الحمدالله على نعمةة جامعة الحسين 
1089493242947751936,JO, والله ي هبةة روحي شوفي تخبيص الجامعات الثانيةة ومجتمعتاهم رح تحمدي الله 
1089592421627977600,JO, هههه صفي قلبكك تجاهاا ي هبةة وخلص 
1089592544625868800,JO, ههههههه ان شاء الله دايم الدووم ابو الريكك 
1089592619716538368,JO, ههههه لا مش هيكك انت عارف الصحيح 
1089594419555324032,JO, بكرة بتتخرجي وبتحنيلها وبتحني لـ مرممطتهاا 
1089595123216855040,JO," هههه اووف اووف الكره طالع من القلب والعقل وكل اشي 
ربي يتمملك ع خير "
1089599622769790976,JO,"  ههههه اكيد هيكك ولقعداتهاا وسوالفناا وتعاليلناا
مش معقول احن للامتحانات وللدكاترة المحترمين 
الرفقةة الحشمةة شروااك والله ابو الريكك "
1089599992745086976,JO,"  هههه انا ما جربت اتخرج قبل هيكك 
الواحد زي ما قال راكان قعدات وسوالف ورفق مرتب وخلص "
1089601490535284736,JO,  هههه حبيب القلب عطاري مشتاقين والله 
1089638905064947584,JO,  يسسعد عمركك عطاري الغالي 
1089803641043763200,JO,العراق رهييب بالاصوات الفخمةة  
1089882532076797952,JO,لا تشرح علومك بأدق التفاصيل  بعض الأوادم للأوادم فضيحـه 
1090576020170772352,JO,بحس انو احنا شعب عايشين تحت جو المؤامرة 
1090692234834571264,JO, ههههه خليها ع ربكك ابو الريكك 
1090767832638546048,JO,ي حررااام شو عملو بهالبلد 
1090768052898140160,JO,هاااظ اللي بحكي فييه  
1090926690417680384,JO,اللي زي هذوول اللي ضيعو الدين وهيبةة الاسلام  
1091041728205934592,JO,ما حد بفهم شو في جواك وبشو بتفكر 
1091071833275805568,JO,بدرس الله لا يخسسر  
1091348324358242432,JO,معقول انا الوحيد اللي شايفها مش حلوة  
1091364773206388736,JO,"قططر ي قطررر عفيةةة عليكووو 

 قطراليابان"
1091418425438732416,JO," وحدة اسمها روان بن حسين 
بس مش عارف ايش بتسوي والله هههه "
1091737320397701248,JO,اقسم بالله هاي ثقافةة مجتمع رااائع  
1091746719283531776,JO, ما في حدا ملاك هالايام ابو عباد 
1092033952611741568,JO,"مش المفروض التعليم يكون مجاني  
زينا زي باقي هالعالم 
ولا احنا مش من العالم شكلو  احنا خارقين"
1092055427616043008,JO," حوالي  دينار ع الرييق 
كيف رح يكون يومي برأيكك "
1092119937223745536,JO, ههههه لا والله مكتشفه من زماان 
1092120130509787136,JO, هههه هاظ تأثير اللي دفعتو الصبح الله لا يوفقهم 
1092143152348176384,JO, يمسيكي بـ أنوار النبي مهندسةة 
1092181113227956224,JO, نيالكوو طيب هيهم مدلعينكو 
1092194955571924992,JO," اذا ع  ساعةة هينات والله ههههه 
بضلي احسن من غيركك "
1092204659295563776,JO,للكلمات ايد حنونة أحيانا 
1092322431769952384,JO, يسعد صباحكك ابو خليفات 
1092508205580800000,JO,اممل اعطت عمرهاا من زمااان  
1092838328175640576,JO," الله وكيلكك جدولي زي جدول المدارس 
كل يوم لازم احضر شو عندي بكرةة حصص"
1092934583669137408,JO,"هههههههههههه انا مش متذكر موادي الفصل الماضي  
ههههه هاااظ تعدى كككل مراحل الحركشةة  "
