id,dialect,text
1123801321218420736,BH,"الله عطا المحرق من الحظ حظين
زودن على نسمة هواها وجودك  "
1123848393154076800,BH,"يا مرحبا باللـي نوده ولا ينشافي 
مادرى ان العين في شوفته مفتونه "
1124023116668313600,BH,"أنا لو ما أذكرك ليلة
يعاتبني عليك الليل "
1124436245415903232,BH,"خايف يطول البعد  وتسج مني 
وياخذ مكانك شخص ماهو بـ يسواك"
1124436531119312768,BH,"اكثر رجل ماهو يحبك تضيقين 
ضيقتي الدنيا عليه  ومشيتي"
1124437505405869952,BH,"مابغيتك من فراغ ولا تمنيتك عبث
ولا ابي لك نهاية ولا ادور لك بديل "
1124438922501738368,BH,"مكتفي بعيونك و صاين حبك 
و أصد عن ألف عين حشمة لك"
1124439186524839936,BH,"يدور الزمان  وكل يوم يطيح قناع 
وتظهر لك وجيه الناس وطبايعها"
1124813242122088448,BH,لو يفيـد التمنـي قلت ليـته قبـالـي
1124816801299406848,BH,"لا ضاقت الدنيا  بتلقى بديلي 
لكن قسم بالله  ماهو بـ شرواي"
1124817114299338752,BH,"لله درك منت من ضمن الأشياء 
اللي تجي و تروح و اصد عنها "
1125840573435469824,BH,ياللي وحدك من بين هالناس كافيني
1126082966147555200,BH,"اخترت وتبسمت لـ طريق كلن يطولـه 
وانا اخترت لك طريق محد يطوله غيري "
1126083716810407936,BH,"بعتني وعفتني عن دربك وارتحت بغيابي  
عسى الله يجازيني يوم ماكنت انام الا واشوفك بخير ومرتاح  "
1126083846179622784,BH,هذاني صابر على فرقاك بس ما قدرت انساك 
1126969558701617152,BH,"والله ان ضلوع صدري كنها الجسر المعلق
ما سكنها الا غلاك وسبب الزحمة لحاله "
1127329496296820736,BH,"بتشوف نفسك  شوفها بالمرايه
علي أنا لاتحاول تشوف نفسك "
1127329585450844160,BH,"أشوفك مقصر وأحسك تغيرت
وأخاف لـ أعاتبك وتضيع مني"
1127329727067435008,BH,"للود والمعروف مانيب جاحد
بس الخفوق اظن مايعشق اثنين "
1127330110762356736,BH,"انا لي وليف كل منه طرا طاريه 
نسيت الطواري كلبوها على شانه"
1128025909951434752,BH,"حبك سقـى قاع الضلوع المهاديـف  
ياللي غرامك في يوف قلبي تربع "
1128116389552824448,BH,"شعور الخيبه محمد السكران  
لو أدري إن ذا كلامه ما تحريته"
1128116469068439552,BH,"تصبح على خير وإن مرك لذيذ المنام
قله يمر العيون اللي ذبحها السهر"
1128286440348057600,BH,الوصل مـا مات بعده يحتريك حتى لو ابعدك الزمن 
1128410613225611264,BH,الفقير اللي تتكلم وتطنز عنه ما تدري انه مخلص في عمله  ويكد على روحه علشان اسرته يعولهم  مايبيهم باجر يجحتون في الشوارع  وطول عمره محافظ على كرامته ويصون الامانه اللي الغني يلهى فيها ويضيعها  اهو يضحي بكل مافيه وانت شسويتورب العالمين يقول ولقد كرمنا بني آدم   خوشفقير
1128488921137020800,BH,يا أقرب من اللي في يدي وابعد علي من السحاب
1128489011624992768,BH,ليت اللقى ما ينتهي يوم اشوفك 
1128795070549901184,BH,"حب كبير لـ دار الخليفـه م يهون الصد 
اثر غاليي فيها وساكن بوسط المحرق"
1128801972465885184,BH,"واللي يعزك ما يدور لك بديل 
ما ينكر العشره و لا يبعد أبد"
1128802459588157440,BH,"انا ماشوفك لحالك اشوفك لي أهل واحباب 
مداين شوقي اللي ما اداني يوم افارقها "
1128802905631416448,BH,"انا مانيب ملزوم أجامل ضعوف الخلق
ضعوف البشر تلقى ضعيف يجاملها "
1129549487834374016,BH,"واللي على اصغر عيوبي ماتحملني  
يامرحبا بالظروف اللي تقفي بـه "
1129549951053291648,BH,"تبي تجي  تبي تروح 
يا مرحبا بـك  بالحالتين "
1129555998006501376,BH,"ان جيت يامرحبا بـ اللي يوده الخفوق  
وأن رحت ياعسى ربي يحفظك بـ دربك"
1129556269541539840,BH,"لاشفت زولك قلت ي سعد عيني فيك 
ويا مرحبا يا اعز مخلوق يهيم بـه الخفوق"
1130239034918408192,BH,"غيبتك م خلت لـ فرحتي مجال
سود الله وجه من كان السبب "
1130239734649896960,BH,"مالي درب فالهوى غير دربك
ومالي طاري بالمحبة غير طاريك"
1130240991020114048,BH,"ياللي ساكن بالخفوق دق وقول غلطان بالرقم 
وانا بقول حياك يالغالي واصكره بس اسمع صوتك "
1130244492542582784,BH,"و أذكر إني مانسيتك ويغريني الرجوع 
ياغرام تنشد الناس وينه ياتـرى"
1130249960841207808,BH,"وانا والله كل ما مريت شارع بيته 
دق قلبي يمه اشاره  ولفت عيني "
1131318017651040384,BH,"خافقي مع واحد منتو بـ صوبه 
لو يقول ابي عيونك قلت جاتك "
1131318394148536448,BH,"كيف الد العين واسلا في بصرها 
وانت شوفي وين ما راحت عيوني "
1131321610768723968,BH,"طواري غرامه شرعت بابي المقفول 
وسـاقت ذعـاذيع الغـلا بينـي وبينه"
1131381952689430400,BH,"دامك هويت الفرقا اجل علـمتني حاجه 
انـه وعودك اكاذبيك وراح يجي يوم من يكذب عليك "
1131382261499211776,BH,"واللي يتمناك ويريدك له حبيب 
يا كثرها الدروب اللي توصل لك "
1131383519253586048,BH,"هذي جـروحك يعودني الزمن ف ذكراها 
واناشد عمري فيها ليته كمل دربه بلا جروح"
1131710473055932416,BH, هالاخبار الحلوه كثروا منها 
1131711183042613248,BH,"طبع جدي علـمني على طبـع الوفا 
وطبع ابوي ربـاني على طبع الرجاجيل "
1131770532037312384,BH,في ناس في السوشيل ميديا كنا نعزهم ونقدرهم وناخذ ونعطي معاهم  لكن مع الاسف الوقت يطلع لك حقيقة معادن الناس وكل واحد يجوف نفسه عليك مع الوقت  الحين حالهم حال الجماد لا بينا سلام ولا غيره كل واحد يختار قدره بنفسه اما يكون غالي ويظل او رخيص ويبقى
1132451798936170368,BH,"ما اقدر ارد البحر واغير امواجه
لكني اقدر اغير وجهة شراعي "
1132476674413650048,BH,"لو يلتهي ب دربي ب ستين هاجس 
فضاي مامره هوى غير طاريك   "
1132810440751407232,BH,"كل همي كان سعدك ودربي اكتفى فيك 
ونت خذت درب السبيـل اللي كلن يذوقه "
1134625689070657536,BH,"مـحـافـظ عـلـى نـفـسـي وصـايـنها ومـكـرمهـا 
ولاني مخليها سبيل بين قول وقال الخلايق  "
1134631789459366016,BH,"ما تطير طيور غيرك في سماي 
انت فوق الغيم والباقي تحت  "
1134632100836102016,BH,"غريب في طبعه وفكره ومجراه
كنه تنقى في الطبوع وخذاها "
1134632871044538368,BH,"امشي مع العالم ولي قلب مسروق
يا الله عسى اللي سارقه ما يبيعه  "
1134633033359875968,BH,"واللي خلق غيرك من الناس غالين
انك ورى حدب المحاني لحالك "
1134987577554026368,BH, هههه كلهم بيقولون الاخلاق بس لا صار الصج ولا عرفوه 
1134988563119058944,BH, عندي الطوفه اهي اللي تسمع بس
1134989896291147776,BH,"ليه الوداع  يخون سلم المحبيين 
وليه العزيز يروح  من غير جيه "
1134991182227005440,BH, اعطيه كف على عينه علشان مايجوف حسابي حتى
1134992513251590016,BH,"حنا مع الطيب مثل سهيل في حله 
نجـم ليا بان كل الناس تـدري به "
1134993068577513600,BH,"قالو تحبه  قلت والله احبه
قالو يحبك قلت مدري وش اقول

بس اذكر انه قد حلف لي بربه
اني على باله ولو كان مشغول "
1134993736948166784,BH,"نفس المرحلة اللي وصلها السميري يوم قال
 عزلتني عن عالم ماكنت انا عنه معزول"
1134995128500871168,BH,"كم كنت اقول ان المفارق سهالات
لين انتثر دمعي  من اول دقيقه  "
1135991344319684608,BH,"هذاني اقصدك بالكلام ايـه انت ومزاجيتك  
دامك استحليت حضنك لغيري لاشوفك "
1136041449605214208,BH,"لو يدور الزمن وتلقى لي بديل تبطي 
ويبطي اللي معك ما وصل شرواي "
1136041673644023808,BH,"وان رحت ماتلقى من الناس شرواي 
وان خسرتني ماعاد ترجع فـ حياتي"
1136101922136612864,BH,"ارتجي شوفتك في المحـرق 
عسى شوفتك مابها صعايب"
1136102177171288064,BH,"مهما زانت كشختك بالعيد 
يبقى الزين لاهـل المحرق "
1136102301872078848,BH,"لو على البحرين شرهة و دمعات ونحيب
كان ما خلتك تقفي عن حدود المحرق "
1136102856757567616,BH,"الا ياحظ عيدي ب لقيـاك 
اجمعتني المحرق بـزيـنك  "
1136415426152468352,BH,"والله إن الوصل ما نقفل مجاله 
غير عن ناس شريناها وباعت "
1137143590394716160,BH,"يا سيء الظن والاسلوب
مثلك  ما يمشي معه ظله
خلاص انا كل ابوي عيوب 
انت اللي كامل وماشاء الله"
1137500416424521600,BH,"من صار صمتك كلام ولحظتك ساعة
وأنا أدري إنك تخون  شلون ما أدري "
1137500718326263808,BH,"العهد مانخونه من عشقنا نصونه
سلمنا تعرفونه في دروب الغرام"
1137501320154423168,BH,"رعى الله صدر ما حد داري بـ خافيه 
يكن الحكي و اقفا له سنين مانعته"
1137502150693675008,BH,"سليمان المانع  
 لي عتب بس آه من يسمع عتابي
 بدر بن عبدالمحسن  
 العتب  ما عاد تاسعه الحنايـا "
1137502294222758016,BH,"يقول سلمان بن خالد 
تصدق وش ابي دايم من الدنيا 
ابيك انت وابي الدنيا وابي الثنتين"
1137503737839267840,BH,"تذكر كيف كنا نكره طاري المفارق 
واليووم نتباهي من يزيد البعد اكثر"
1114285973121175552,BH,"كثير اشياء بالخاطر ولا تنقال 
عسى الكتمان ينسيني قساوتها"
1114286492304715776,BH,"لو تدري وش أسولف عنك عند الغريب 
تمنيت إنك الغريب و تسمع سواليفي"
1114286569127591936,BH,"شف عشانك بعت واجد واشتريتك
وانت ماضحيت في حاجه عشاني"
1114287037857894400,BH,"اصعب شعور ان تدعي الله ينسيك 
من كنت تدعي يا عسى الله يديمه  "
1114287877020635136,BH,"ماكرهتك ولا عفتك بس طاب خاطري 
اللي انكسر مليون مره من افعالك "
1114287985216950400,BH,"بكره إذا ردك شعورك وحنيت
اذكر أني قد ماكنت أحبك عفتك"
1114288145858691200,BH,"ودعتـك الله مابقى شي ينقال
إلا أنك اجمل شي غاب بحياتي"
1114288392802590848,BH,"ودعتك الله ثلاث ولا تخليها  
روحك وقلبك وأنا لا أغيب عن بالك"
1114288534880489600,BH,"اذا نويت تغيب فالله يحفظك يا أغلى غرام
ودعتك الله يوم ربي ماتضيع وداعته "
1114288594322165760,BH,"ودعتك الله وأنت فيني ومني
ودعتك الله وانت اغلى وداعه"
1114289075702444032,BH,"سلامي سلام مودع مايبي فرقاك 
ولا له على شوفتك قدره ولا سلطه "
1114290978498711552,BH,"يا موجع قلبي عسى خاطرك طاب
 بشر عسى لك راحة في عذابـي "
1114291217867653248,BH,"صكيت باب العتب ماعاد له داعي
وعودت نفسي على الفرقى وطاريها"
1114291716893347840,BH,"وأنا شخص كل ما احاول انسى 
 عندي ولاء لـأشيائي المنسيه"
1114292628395298816,BH,"أكثر مايكسر خاطري بعد المفارق والغياب
ما عاد فيه أحد بعدك أفرح وأجي وأبشره"
1114292713619382400,BH,"فاقد كل التفاصيل وقديم عتابك
وفاقد حبك بكل مافيه حتى قصوره "
1114294186340122624,BH,"من يطمني عليه وكيف حاله 
والله اني ما فقدت انسان كثره "
1114294330741665792,BH,"شطـر لـ بن فطيس 
ي مصعب وصالك وياشين فرقاك "
1114294469258612736,BH,"ما مسحت محادثتنا كل يوم اقراها 
وكل يوم يطيح دمعي لأقريت حروفك"
1114294609792909184,BH,"لو خذوا مني جميع الذكريات 
بسمتك فـ اول لقى مـا بعتها "
1114505122967691264,BH,"ماني من اللي لا بغيته تدله 
انا من اللي لا جفيته خسرته "
1114505631782797184,BH,"عندي قناعه مايكررني الوقت
وتبطي بك الدنيا ولا شفت مثلي"
1115022219774767232,BH,"يا شين البعد وياشين فرقاك
وياشين وقت ماسمح لي اشوفك"
1115022618783047552,BH,"ما دريت  إني بدونك ما غفيت 
و إني على طول المدى حنيت لك"
1115022675880095616,BH,"ما دريت  إني أراقبك و ما حكيت
وإني على بعد الفضا إشتقت لك"
1115023036489588736,BH,"وأراقبه من بعيد ولا جات عيني
بعينه اصد ماكني متشفق لشوفه"
1115023165686730752,BH,"من جهل قيمتك خله ولا تلتفت له
بكره يدور الزمن و يعرف وش خسر"
1115023443777532032,BH,"يراقبني بعينه وانا اراقبه بالعين
نبي بعضنا لكن الاوضاع تمنعنا"
1115023530788302848,BH,"يامن أراقبه والوصل منقطع
كيف السبيل لإعلان أشواقي"
1115025727089512448,BH,"بتدور الايام وتعود على قلبي
انا ادري ان الغريب يحن لدياره"
1115025907880734848,BH,"عابر ولا لي فرح موعد ولا طاري    
وأمر مثل الغريب بشرفة أهدابك "
1115026166027628416,BH,"تصورتك حياه وماتصورتك
تجي عابر تعلقني وتنساني"
1115026315151908864,BH,"وين انت يا غايب غيابك يذبح
اضحك مع العالم وقلبي عندك"
1115027685020000384,BH,"ما علموك بغيبتك وش جرالي
حتى الخبل لا شافني قال عزاهه"
1115028025949728768,BH,"والله اني شبه حي و شبه ميـت 
في غرام اللي خذا قلبـي وقفى"
1115028109336641536,BH,"ضم الثرى حزني وضميت راسي
ذي حيلة اللي حن لإنسان رحل"
1115648989259497600,BH, هاي يدل على ان العقول بدت تتغير وأصبحت تافه  وهالشيء اللي ادى لانفصال او فراق علاقات وايد  وعدم وجود الصبر وسعة الصدر ومراقبة الزلات والاخطاء اكثر من المحاسن 
1115655814356902016,BH,"عيوني لغيره بالمحبه ماهيب تشوف 
غلاه القديم اللي مضى معمي عيني"
1115655895172702208,BH,"انا ذاك القديم اللي عليك ينوح
انا صابر إلين الحين وانتظرك "
1116322164414795776,BH,"ما عاد يكتب لي  ولا عاد يشتاق 
جازت له الفرقى وعلى غيابي تعود"
1116322681702494208,BH,"سلامي على آللي ماتنكر مع الايام 
غلاه ونباه وموقف الطيب متجدد"
1117025934064877568,BH,"داويت جرحه يوم صكته الاقدار 
ورد العطى فـ جرح ماله مداوي "
1117031332490686464,BH,"وانا اقول لـيه نفسي محسوده من البشر 
ياحظي اللي عطاني مثل تباسيمك  "
1117032162371547136,BH,"اقول طلبتك ياربي مثل م جمعت سحابك
اجمعني مع ذاك اللي لاجمعتني فيه افرح"
1117032497546657792,BH,"انت م انت بـ مرحله تمرني وتعدي 
انت عمر ودي أعيشه بكل فصوله"
1117207304791834624,BH,"الغالي غالي لو رحل عنك وخلاك
يبقي غلاه  بداخل القلب منحوت

سقي الله  اللي لامن ناديت لباك
يفهمك نظره وشلون عاد بالصوت"
1117207448920711168,BH,"يوم بان  لي عدو على هيئة حبيب
احترمت أعدائي الي على وضح النقا"
1117207716433420416,BH,"مرحبا باللي له القلب من شوقه يذوب 
العيون اتوق له والحشا يشتاق له "
1117207858540613632,BH,"العام قلبك معي واليوم ناسيني 
أحلى ليالي هوانا كيف تنساها "
1117208407428280448,BH,"وانا حالف مادمت حي مع الحيين
ما ياتي محله بـ الغلا واحد ثاني"
1117208553394200576,BH,"هذه الأيام تنطوي تحت شعار 
 ياكثر ودي  غير ماهو بكيفي "
1117209703556235264,BH,"ساكت ويحسبني ع البعد مرتاح
وانا الحزين الي ملى الدمع كمه"
1117210504882282368,BH,"ما فيه احد كثرك بقسوه طعني
وانا اللي دوم اقول فيني ولا فيك "
1117210722776363008,BH,"ولو تحبين كل الشباب من بعـدي 
لا هم انا   ولا اسلوبهم اسلوبي "
1117211166693036032,BH,طواني الشوق يومك للهجر شاري
1117211517550829568,BH,"من باب عذر الحبايب  
 هو ماهو بـ ردي  لكنه تردى"
1117518724599361536,BH,"كثر ما ودك تجرح اجرح ولاتسمي الجروح حب 
لـأنك اساسا عدمت المحبه يا عديم الإحساس"
1117519360095072384,BH,"ليت الليالي تمحي طيوفك وزولك 
لعنبوك مامشيت وكفاك الجروح اللي فعلتها 
خذ ذكرياتك معاك ويلعن اليوم اللي جابك"
1117519594162458624,BH,"بين خذ راحتك معاه وقبل اعرفك 
انا وقفت على لحن المودعين واودعك "
1117520837073080448,BH, عطه فين الكتاب اجل  بعته 
1117534934070189952,BH,ليتني امسك الجمره ولا امسك درب الوداع
1117536063025811584,BH,ماكسر فيني شيء الا اني عطيتك اغلى شيء عندي 
1118123489834217600,BH,مسآء الأمراء يا امير الذوق والرقه  
1118123932975095808,BH,ياحظي بالقدر اللي جمع لي في وصوفك اغلى امانيي  
1118132861608001536,BH,"ايه والله انك على كيفي ولايق لي 
كن ربي مفصل اوصافك على شاني "
1118134269296173056,BH,"الوجيه اللي عليها من الخالق قبول
ودك انك كل يوم  تجـي وتشوفها"
1118134635911897216,BH,"والله إني على شوفه وقـربه شفوق 
ليت عيني تشوفه والمواجه سـهل  "
1118424469645737984,BH,"انت أغلى ماعطاني حظي المحتوفي
وجعلها في ذمتي ماهي ريا او سمعه "
1118425021876199424,BH,"اي اكابر والمكابر ساس طبعي 
ما انحني لو اخسر اغلا محبيني "
1118425168878219264,BH,"ما شكيت الحال لو شفت العجب
عزتي تكفي وأنا طبعي صبور "
1118426110625243136,BH,"عزاز النفوس مايذلنا عابر سبيل
ذي طبايعي وطبايع شايبن رباني"
1118439273072664576,BH,"معك ما أخاف أبد طول الطريق 
 اللي أخافه لانجي في  مفترق "
1118439800644751360,BH,"من لفاني بالوصل ما أرده كسير 
ومن تباها بالهجر تركته للهوى"
1118445344650596352,BH,"والله انه احلى سنين بدت 
يوم جابك الله لي كني ولدت تو"
1118445579045097600,BH,"شفيج زعلانه 
إسأل روحك
وأنا قاعد أسأل منو بالله 

اعتمدوها شباب"
1118445645927538816,BH,"كل ماشحت وجية الناس وجهك يرهي 
سعد عين اللـي فنا عمرة مقابل وجهك "
1118446172849475584,BH,طواريك تمر البال و تسره 
1118446244270047232,BH,"كل يوم يمر وإنت  
أغلى من اللي قبله "
1118446452693450752,BH,"ضحكتك جذابة و وجهك طفولي
وأناقتـك تفرق  وطلتك جنـة "
1118446545047838848,BH,"وشلون أعيش العمر وأواجه الناس
وأنا عشانها معتزلهم من سنين"
1118446753466998784,BH,"يمرون في ذاكرتي الناس ويروحون
تغير  منازل غيرك  ومنزلك ثابت"
1118448318613458944,BH,"بين احب صوتك هذاك ويابعدهم كلهم 
ألقى احلى سنين عمري يوم بدت معاك"
1118448905316904960,BH,"اذا كان الطريق اللي تمشي به 
يسر الخاطر فابشر بـ روح لقت روح"
1118451734316187648,BH,"يازين لهجة بعض الاحباب زيناه
صـرنـا نردد حكيـهم لا حكيـنا"
1118452178270793600,BH,الله يسامح ضحكتك نستني اختار الكلام 
1118816305535168384,BH,"لايغرك كثر الوصايف والملذات بهالزمن 
عليك من الطبايع هي اللي ديم الوجيه"
1118981875291361152,BH,"الناس واجد والمحبه لها أبواب
مير الغلا واقف على باب بيته "
1118983956827914240,BH,"محبة انسان واحد صادق وفيه خيير
أبرك من ألفين شخص يحبك مجامله "
1119914097687003136,BH, يبيلج راعي طويله يهديج شوي  صاير مثل الجو شبه 
1119914337181798400,BH,مواصل من امس وعيوني جذي صايره  فيني نووووووم 
1120023024227495936,BH,"ياشين وجهك السعد ذبحني من الوله 
ويازين اللي يصاحبونك احسدهم على شوفة اغلى الخلايق "
1120619728085704832,BH, واضح فترة الصيف بدت تأثر  الكل مآكلها
1120622284400676864,BH,"تشوف الوريد اللي ع القلب فـ المثناه 
تـرى ذا مـكانك  لا خـلافه  ولا توه "
1121020545578016768,BH,"حفظته مثل حفظ السنافي وصاة ابيه 
وكسبته مثل ما يكسب الطيب جداني "
1121020901024309248,BH,"ي لطيف الروح مايسقي الخفوق الممحل
كون  وصل  تلتحم مزنه و برقه يبرق "
1121021183623860224,BH,"ازعل على الوقت والدنيا ولا أزعل عليك
يا أكبر من ظروفي اللي ما تعديتها"
1121147580359032832,BH,"أقسم بمن خلق  عيونك  الوسيعه 
أن عجزت عيوني على غيرك تمون"
1121147773787811840,BH,"أزعل عليها من الشهر يوم يومين
وأشتاق له تسعه وعشرين ليله "
1121748878695522432,BH,"ياحلوها تفتصيل التفاصيل اللي 
تحكي عن الود والوفا بين اثنين "
1121868701081460736,BH,"واللي خلق هالليل يا سيد الليل
للشوق في صدري مواويل وعلوم "
1104503305693220864,BH,"ان تشالا الجرح ولا ما تشالا  
والله إني خالص منك وسامح "
1104503362920296448,BH,"الله  لو ترجع أيامه ويرجع لي 
وشكثر أبضحك الدنيا و أزعلها "
1105392640995086336,BH,كلـن على راحتـه وحي الله من سأل 
1105416677897003008,BH, هالكلام لزمن الأولين مـاهو بهذا الزمن  اليوم نعرف ونشوف من اللي يسحدونه واللي يحقدونه
1105508820535725952,BH,"سر حبه فالحنايا مادامه فالوجود
حافظه حفظ المطوع لتوقيت الصلاه"
1105509073921982464,BH,"اللي يحبك بالكلام حبه على قد الكلام
واللي يحبك بالفعل حقق لعينه مافعل "
1105509542199201792,BH,"ليه جيت من البداية دام تدري 
بالنهاية  كل واحد له  طريق "
1105509618606845952,BH,"والله اني بـ حاجه للغياب الطويل                     
دام كل شي احبه بالحياة اخسره  "
1105509713935040384,BH,"طريق المراجل كل كيلو يجي دوار
يديور معه ناس تردت عزايمها "
1105510961887235968,BH,"ما بنيت الحواجز ولا هدمت القصور 
 كل حي بنى له في الهقاوي محل "
1105957353730527232,BH,"على شوفتك يـ اللي مليت المحاجر دمع
شفوق ولو طال المـدا ما انقطع شفي "
