id,dialect,text
531811371604656128,PL,يا قصص عم تكتب اسامينا دندنه
1150198304829054976,PL,انا كنت زي اي طالب ابوه وامه فوق راسه في الثانوية العامة عشان يطلع دكتور بلا بلا بلا اللي حابه اقوله ان في كتاب اسمه علاقات خطرة ضرووري تقروه يا جماعه فكرته انك مش لازم تخلق نسخة تانية منك في ابنك او تكتسب طبع وخبرات او امنيات من ابوك وامك عشان هم ما عرفوا يحققوها كتاب روعه
1150396478973784064,PL,كل ما اتصل بحدا عنده ثانوية عامة اطمن عليه الاقيهم قافلين الموبايل
1158404556683919360,PL,المهم يعني حدا عنده لينك لشيرنوبل
1158536244026117888,PL,حرفيا أحلى فوتوسيشن شفته في حياااتي 
1158538677271846912,PL, خللي طعم البيبسي على جنب ركز بس انك مستحيل تنام بعدها
1158538851817852928,PL,لو مش لابساه بحس في حاجة غلط في رجلي 
1158539261953658880,PL,اللي بيتعامل معاه هلفوت سواء المستقبل او المرسل 
1158540305479720960,PL, اما سبتك كنت انشط من كده ايه اللي حصلك
1158552713640259584,PL,وعهد الله انا سرحت فيكي وفي ايه اللي ضحكك اكتر ما ركزت معاه 
1158751558680678400,PL, اللي بيكون مكتوب عليها   مفيهاش امونيا وحلوة جدا
1158751994351411200,PL, حسب لون شعرك لو اسود غالبا مش حيلقط بسرعه ابعدي عن الاسود المزرق بيكبر الوش
1159056017113702400,PL, شكلك نايم زعلان بس
1159056646674558976,PL,مفيده لما بعمل راس شيشة 
1159056871342444288,PL, ومسقعة وخرشوف بالبشاميل سمعان فيهم
1159057245637959680,PL, حديك رنة ومتفتحش عليا
1159057819632578560,PL, جايب بدلة جديدة قمت حلمت انها بدلة فرحك  زي العيال اللي بتجيب بدل العيد
1159073988955578368,PL,معروف ان كل انسان له حياة مزدوجة بيكون شكله قدام الناس شي وبينه وبين نفسه شي تاني وغالبا طبعا الظاهر للناس هو الكويس بس الغريبة لما تعرف حدا يكون ظاهره وباطنه اوسخ من بعض ملهمش حل
1159337415456251904,PL,لازم في كل مرة غبائي يطلع قدام اي الدغ واقعد اقوله مش فاهمة حاجة على ما استوعب انه الدغ 
1159411214709080064,PL, مع اللي هم مش بني ادمين
