id,dialect,text
1165116954526519296,KW," هالجملة صارت موضة
بعض المغردين من سنين يكتبونها بين فترة و فترة لعل وعسى يضبط معاهم شي و ان ضبط معاهم شي بالصدفة يقولون شفتوا شلون قلنالكم قلنالكم حركات مغردين

و الله يستر على صندوقنا"
1165118488702345216,KW,"الفاشنستا حتى وهي مسافره بره الكويت وفي بلد ثاني تكذب و تبالغ روحوا هذا المطعم في شارع رينق بينق بشنغهاي  اكله لذيذ واسعاره مناسبه

تروح ويطلع اكله مو لذيذ و اسعاره غاليه ليش الكذب يا كذابه"
1165172336636698624,KW,"ما كل من ضاقت
 بك الارض تلقاه
 ولكن رجل
 بالمساري دليله
رجل ليامن طحت
 شالك بيمينه
هذاك لا من طاح
 واجب تشيله "
1165207642198990848,KW,"ليش لما نشوف ناس مستانسة و ترقص في امريكا و اوروبا و شرق اسيا نوقف نصورهم و ننشر الفيديوات و لما نشوفهم في المباركية نشتكي عليهم

و سياه نرما نرما  "
1165238788303544320,KW,"من فترة طويلة
قررت اسوي جولة اوروبية

رحت النمسا و بعدها جوله في انحاء المانيا و بعدها لندن و باريس

الخليجين كانوا عاديين في جميع المدن الاوروبيه اللي مريت عليها عدا اللي شفتهم في باريس
حسيت انهم مرضى نفسيا
لانهم من بد كل اللي شفتهم في باقي المدن يلبسون ماركات بشكل فاحش و مقرف"
1165362894692896768,KW,"تبي تفكر بصوت عالي
فكر براحتك لكن تويتر ليس المكان المناسب تاخذ راحتك شوي ولا واحد مشتكي عليك 
يا اخي وش دخلك انت بمخي

عاد تعال رقع
حلم حلم اقولك حلم"
1165385269601865728,KW," بالمختصر لكل صاحب قرار اذا لم تستطع ان تصنع فرقا وان تجعل الكويت أفضل مكان العيش فيه فأنت لا تستحق المنصب فهو تكليف وليس تشريفا

احسنت

ربعنا ما يردون مناصب حتى لو يدري انه ردي وفي ناس بالوزارة افضل منه هذا اذا مو حاط واسطه علشان يصعد على ظهور ربعهمطبقين مبدأ من صادها عشى"
1165411472345882624,KW,تويتر لعب بالشعوب العربية ولا الشعوب الاخرى ماشوف عندها مشاكل كثر اللي عندنا
1165518638495010816,KW,الموضوع هذا يحتاج مجهود اكبر ما اعتقد طرح الاعفاء على وزير خارجية بولندا كافي 
1165521728199647232,KW,"يقول ليش ما تردون عليه طايح سب في الكويت يا الطيب
 ايادو الحيوان ترد عليه بأدب  يعطيك بلوك اشلون نرد على واحد جبان نفس هذا الوصخ"
1165529471056830464,KW,لما المواطن يروح للحكومة و يعرض عليها مشروع فيه توفير بالملايين ما يعطونه وجه يا اخي من قالك انهم يبون يوفرون انت ووجهك
1158479093819744512,KW,قانون من غير آلية واضحة اكيد بيفشل 
1158498938586042368,KW," الله يعلي مقداركم
و الله يديم المحبة و الشعور متبادل بلا شك يا اخ معاذ"
1158511046002434048,KW,"الامريكان يسوون عقد اتفاق قبل الزواج و يتم تحديد ما للرجل و ما للمرأة اذا حدث طلاق بعد الزواجاتوقع ممكن نسوي مثلهم لان الوضع صار صعب
اليوم في رحال ما يطلقون خوفا من النفقة و يبقي الزوجة معلقة و الزوجة لا تتنازل عن فلس واحد لانها بتخسر ثروة و العيال ضايعين بينهم "
1158512414343749632,KW,"  لو تكلفة فتح الملف تكون معقوله  او  دنانير مثلا نقول مو مشكله لكن  دينار او اكثر ليش و على شنو
يا اخي مابي افتح ملف عالجني و خلاص"
1158515151563382784,KW,"تدرون ان شارع الوفرة لحد الان ما خلص

هذا الشارع صك على سور الصين العظيم و ياليته شارع بجسور معقده و مخارج و مداخل على جميع الخطوط السريعه شارع عادي مافيه زود

 كيلو ب  مليون دينار كويتي يعني الكيلو بمليونين
اشدعوه اخاف القار مطلي بماء الذهب"
1158519575375417088,KW,"كل يوم والثاني طلعلك وزير او مدير بعين مستشارين عنده
مستشارين مره وحده

طيب جربوه موظف عندكم و اذا فلح بعدين رقوه لمستشار

و الامريكي او الاوروبي يعينونه خبير خبير على شنو لو تشوف سيرته الذاتيه بتلقى  اغلب خبرته  بمطاعم وجبات سريعه"
1158658969155624960,KW, هذا يتحرش و لما ترد عليه يعطيك بلوك هذا نفس اللي يقولك نكتة بايخه و يضحك عليها و لما تقولة ترى النكته بايخه وعفنه مثل وجهك يزعل
1158660622713794560,KW,"صديق يقول قعدت مع فلان  تاجر معروف
 الرجل نصحني اذا بدأت اي مشروع لايكون حجم رأس المال اقل من مليون دينار
ومنها الاكتتابات في الشركات تحت التأسيس
المهم قلتله من وين بتجيب مليون

قالي سألت التاجر وقال تروح اي بنك و يعطونك

قلتله يعطونه لان اسمه فلان اما انت ماراح يعطونك فلس حمر "
1158701202349199360,KW,"واحد من الربع شكله يشتغل بجمعية خيرية

ما ظل رابط تبرع مادزه لي
اي شي و كل شي
 كل يوم 

حجي انت صاحي ولا مجنون
لو بتبرع لكل رابط تدزه لي بينخرب بيتي الله يخرب بيتك"
1158784258489688064,KW, ما شالله ياريت يحطون اعلانات بالتلفزيون و الشوارع نفس بعض الدول يحطون الاماكن الترفيهيه على لوحات الطرق
1158791965594533888,KW,"ما ان تدخل المطار او تمر على المطار او تفكر تحجز تذاكر سفر الا وانهالت عليك عروض شركة الاتصالات ايا كانت
للاشتراك في باقات التجوال و الانترنت المفتوح

تشترك وكله يطلع كلام فاضي
الانترنت بطيء جدا ولا تستفيد منه بشي اما الاتصال المحلي و الخارجي قد يكون افضل حالا"
1158796568037867520,KW,"  هذي فضيحة
رفعوا عليك قضية و يتبلون عليك وينكرون فيها  المخالفة ويخسرون القضية

هذي ام الفضايح
اتوقع لو بدولة اوروبية كان الوزير والوكلاء والمساعدين كلهم استقالوا

اسمحولي بس هذي لها مسمى واحد وهو البلطجة

اتمنى انك طلبت رد اعتبار وتعويض يا بوعبدالرحمن
تخيل لو ماعندك ادلة"
1158832469526888448,KW,هذا سوق السمك بقانون واحد تسنع تخيل لو الحكومة تحط قوانين اصلاحية في كل جهة حكومية اشلون يصير حال البلد 
1158832863233609728,KW, الا وين اللي يقول ارتفع السعر علشان السماح للصيادين بالصيد في الاماكن البعيده اعمل حالك ميت
1158836997500428288,KW,المفروض هذي الفيز ما تتحول الى فيز عمل اكثرهم يجون زيارة و يظبطونه ربعه بعمل حتى لو كان وهمي علشان يبسط في الكويت 
1158852151084539904,KW,"ماشي ماشي
طيب تعال نقاشني لما تكبر "
1158935928401989632,KW,"  ليش  عام
ليش مو  او 
على اي اساس حطوا العدد 

اذا في دراسة المفروض تنشر

وبعدين  شنو اللي بتغير يعنيبتحفظ النشيد الوطني ولا تبي تضبط اللهجه مثلا
 اذا تبي تطلقه راح تطلقه حتى لو تحطون انتظار  سنة ترى مو فارقه مع الزوجه الاجنبية"
1159076339296677888,KW, سرديفي ما يجوز  الفيس بريسلي ممكن
1159190589407186944,KW,"يوسف كفتجي
اشهر مطعم كفته في جنوب تركيا و غير معروف في  اسطنبول و ما حولها

هذا الفرع بالذات عباره عن بوفيه تاخذ اللي تبيه من كفته و دجاج و شاورما و سلطات و حلويات و تدفع عند الكاشير
في استراحه على خط اسطنبول  اسكشهير
تركيا"
1159191269329051648,KW, الظليمة شينه عاد مو    نصرت له حلاوته لكن سعره مبالغ فيه
1159191685705936896,KW, صح اللي مايعرفه ممكن ينخدع بالاسم مشوياته حلوه و الخدمه ممتازه
1159194456807092224,KW,"سألت مختص عن الاجسام اللي تسمن بسرعه و تحتفظ بالشحم

قال لان السلاله من فئه العمال و العمال يحتاجون طاقه اما السلالات الملكيه على الاغلب تكون انحف و اجمل

الله يرحمك يا جدي العود من قالك تصير عامل و تورط السلاله يعني ما تعرف تحتكر عقارات تاخذ مناقصات طيب بالميت تصير تاجر اقامات"
1159237211293933568,KW,"خمسة عشرة سبعين ثمانين

وين الارقام اللي بالنص
خوش حراج لا واضح مافي تلاعب "
1159386943765004288,KW,"يقولون في استجواب قادم لوزير الصحةشنو يعني اذا الوزرا اللي قبله كانوا يدشون الاستجوابات وهو يضحكون و يطلعون وهم يضحكون

اتوقع ان وزير الصحة
 يعلم بأن الاستجواب 
بكون نفس لعبة الجندول
 بعد اللف و الدوران و الصعود والنزول ينثر عليك شوية ماي وتنزل من اللعبة بسلام  

  "
1159394947361062912,KW,"يقولك السمك ارتفع سعره لان الكمية قليلة انتو مصدقين هالكلام

سمحوا بادخال السمك اللي عند الصيادين كله و بعدين قولوا ماكو سمك مو تنزلون سمك بالقطاره علشان ترفعون الاسعار و تقولون الكمية قليلة

صارلكم  سنة ونتو تلعبون بالسوق و الحكومة تتفرج للاسف"
1159432781908385792,KW,لندن صارت مزبلة السياحة في اوروبا اول كانوا الحرامية انجليز الحين الحرامي اللي مو لاقي شغل بديرته يروح لندن يترزق الله 
1159433035818971136,KW, بس تكفه مو على غرار شركة الدرة
1159434287357317120,KW,"اليوم تلومون الصياد اذا باع السلة ب  دينار

يا اخي في ناس عندها فلوس و تدفع تلاعب او مو تلاعب في ناس مستعدة تدفع

المشكلة بهذيل اللي لاقين فلوسهم بالشارع يدفع ولا هامه لو توصل السلة بألف الله عطاهم فلوس بس ما عطاهم عقل محد كامل"
1159476890555625472,KW," شالمشكله
اشرب شاي حتى تنسى
اشرب كولا حتى تنسى
اشرب لبن حتى تنسى

يعني لازم تلكه علشان تنسى ولا ما يصير احسنوا الظن
عسى ما واحد قال كلمة الا فسروها تفسير سلبي و طالبوا الوزير باتخاذ اجراء ياخذ اجراء على اي اساس
على اساس ان في مواطن فسر بعض الامور على كيفه"
1159492810069938176,KW,ما شاء الله ما شاء الله شكلك اشتقت للقدس و اهل القدس 
1159521784904986624,KW, اخوي ظاهر ممكن توضح هذا الفيديو بالمؤتمر لان فيه شي غلط و يحتاج توضيح 
1159575666561564672,KW,ناس ما قدرت تقاطع شركة البان تهقون بقاطعون سوق السمك
1159600838853177088,KW," صدقت والله
ل كنت اشتري كيلو الهامور الايراني بدينار وبعدها تدهورت اوضاع السوق وارتفع سعره فقمت اشتري السمج اللي طعمه حلو بس ماعليه طلب مثل الوحر وسعر الكيلو كان ب  فلس
نفس ما تفضلت حتى هالاسماك حاشها طشار ارتفاع الاسعار
اخر مره اخذت وحر كان الكيلو بدينار ونص التونا زين"
1159603081480458240,KW,"  اي والله افا
مو قالوا بيلغون هالمنهج الفاشل"
1159606872325931008,KW,"                                          

اتوقع بتكون التغريدة مفيدة للهنود لو تدزونها بلغتهم"
1159611150029533184,KW," حتى المستورد كميته قلت مو نفس قبل و سعره ارتفع
لان حطوا عوائق على دخول المستورد"
1159615858806837248,KW,ردوا اشرب حتى تنسى ابرك من هالصور 
1159784676791410688,KW,"الطامه الكبرى  سنه على حرق الابار والى الان البحيرات النفطيه موجوده

توهم موقعين عقود الازاله تو الناس صح النوم  وينكم كل هالمدة "
1159832568394420224,KW," بومحمد مو مشكله ارتفاع السعر بسبب العرض و الطلب او ندرة السمك مثلا اليوم ليش ما المستهلك يطالب بتخفيض سعر ال  علشان الكل يشنري لان السيارة معروف سعرها عالميا ولا يمكن ان تنزل عن قيمة معينة

لكن ما يصير نسكت عن اللي قاعد يصير بسوق السمك لانه تلاعب واضح ولازم تتدخل التجاره"
1159835890912387072,KW,"قبل خابر يحرجون على  او  سلة  فالكل يطلع كسبان لان اللي يبي سلة وحدة ما يزايد 

اذكر من زمان دخلت مزاد على ميد كلمت الدلال قلتلة ابي سلة وحدة ولد الحلال قالي تمام اهم شي لا تزايد معاهم واذا عجبك السعر النهائي خذ سلتك وهذا اللي صار المزايدة كانت بين  مطاعم و بسطات "
1159836823234813952,KW, صدقت و هذا اللي يفرق عن الوضع الحالي 
1159838210047873024,KW,"يا جماعة ترى والله فرق لما يكون الدلال كويتي

لحقتوا على حراج السيارات
يا اخي من توصل السيارة الى السعر العادل قالك الدلال بيع خلاص لاتطمع 

دلال سوق السمك عارف اللي يزايدون كلهم يدري ان هذا بنغالي مدزوز وهذا من طرف الصياد و هذا فلان مع هذا يزيد لو كح اي واحد فيهم"
1159840582396628992,KW, اللي اعرفه يا بشمهندس انه   الامم المتحدة حددت مبلغ التعويضات و تم دفعها لكن ما تحركنا الا لما اضغطوا علينا الامم المتحدة في الفترة الاخيرة لان في مدة محددة وهي  سنة للازالة والا تسحب التعويضات
1159842376178794496,KW,مانبي اراضي بديلة نبي تثمين علشان نشتري بيوت بالضاحية 
1159855121985093632,KW," ما شالله اللوز عندكم المفروض يوزع بالمجان من كثرته اذكر كنا نقطف من اشجار اهلنا بدبي
 نفس البمبر و الكنار عندنا قديما كل بيت كان فيه شجره او ثنتين
 الحين اشجار السدر و البمبر صارت اقل من قبل في البيوت"
1159860733368328192,KW,تحكم في عضلات الوجه مو طبيعي يبيله ملا يقرا علية و شوية خيازرين يطلع الجنانوة اللي فيه 
1159902761565261824,KW,"يا جماعة المسؤلين عندنا وقت الشغل يعرفك عدل و يعرف اشلون يوصلك و يعرف كل ارقامك و اكاونتاتك في مواقع التواصل الاجتماعي ولما يشوفك عادي يقولك سلم على الوالد و قول حق امك تسلم يدج على ملة الساقو

لكن لما تدخل عليه وتبي منه شغله
 اول سؤال يسئلك
 ذكرني باسمك

تبا لك زين"
1159903877979881472,KW,ستاربكس الكويت و اقطع ما جربت الامريكي لكن في اغلب دول العالم ماله طعم
1159930479270932480,KW, حاضرين و بالشوفه يا بشمهندس انت ارفع و احنا  نكبس  
1160083906021994496,KW,الله لا يوفق اللي نزل المسلسلات التركية باليوتيوب
1160135775515807488,KW,"يا اخي هذا الاخ او اللجنة اللي اختارت موقع مدينة صباح الاحمد ما درست جغرافية وجيولوجية المكان و الممرات الهوائية و حركة السافي
علشان تضع حلول متكاملة للمدينة قبل ما الناس تسكن

ربعنا يسوون المشروع و بعدين اوووه نسينا هالشغله او تفاجأنا بهالموضوع التخطيط عندنا ميه ميه "
1160307159630012416,KW,"اردى دوري في الخليج موجود عندنا فاشلون تتوقعون نفس اللاعبين اللي في الدوري بكونون منتخب جيد يقدر ينافس في البطولات الدولية

اتحاد الكرة رد نفسة طيب من هذا الاتحاد نفسة اللي اشتكو الناس من اداءه و انتقلت الرئاسة للشيخ طلال
اشلون رجع مرة ثانية

الكويتالبحرين"
1160309393809915904,KW,"يالطيب انت وربعك ما تلعبون صح و بعدين تقول مو مكتوبه لنا

لا اسمحلي كابتن هذا الكلام مو مقبول"
1160460323750633472,KW,"ما شالله عليهم
مسوين لجنه
من ادارة هندسة الطرقات
و الاشغال و الشؤون
خلصوا الشغل المطلوب على طول
ترى الافغاني هو مال الاشغال  "
1160464005149933568,KW,"حرامية المناقصات و سراق المال العام و المتلاعبين في البلد  قاعدين من الفجر رايحين يشترون خرفان

يا غبي انت وياه فلوسكم حرام و الله سبحانه وتعالى ما يتقبل منكم
 و ترى الخرفان اللي شريتوها و ماتت مقتولة على الفاضي اشرف منكم عند الله"
1160604373061394432,KW,خلوها تخيس  بس الله يعينا على الخونة من المواطنين و الوافدين
1160623968946200576,KW, بآخر مقاطعة كان في خونة و لا و بكل بجاحه ينزلون تغريدات وصور وهم بسوق السمك و يصرحون ان الاسعار مناسبة و ان المقاطعة فشلت طاح حظ ام ن يابتهم
1160701065437876224,KW,"نكتتب وحالتنا حالة و ننطر الشركة تشتغل سنة سنتين ثلاث اربع ماكو خبر ولا تدري شنو صار نشاطها
طيب فلوسنا شنو مصيرها

لا رقيب ولا حسيب ولا احد يسأل الشركة اشقاعد تسوون "
1160787780915605504,KW,و انا احسب انها خايفه على الرجال اللي تعور   
1160868546450251776,KW,اشلون يدخل من ضمن الباعه الجائلين بدفع لنفسي ثمن الذبح مثلا لا تمصخونها عاد الواحد اللي فيه مكفيه 
1160869475194941440,KW,"ماشالله عليك
رفعت راسنا رفعت راسنا
رفعت راسنا بس
بس يارجال كفاية "
1160875888252280832,KW,"في ناس تقول ليش تبي تمنعون الوافد من التجارة في الاسماك و الاغنام و الخضار
الكويتي يقدر يفتح رخصة ويشتغل

اعرف ناس جربوا يشتغلون في كذا مجال محتكرينه بعض الجاليات
 من يفتح الكويتي محل يكسرونه بالاسعار و يتعرض لمضايقات الى ان يخسر ويطلعونه من السوق

ما تعرفون عن السوق صكوا حلوجكم"
1160877318426058752,KW," المفروض يكون السوق مفتوح للجميع حتى يكون في تنافس
على فكرة السمك موجود لكن المشكله في الاحتكار و التلاعب و نتمنى نشوفكم قريبا عندنا بالكويت و حياكم الله"
1160881323260731392,KW, يعني عندنا  ملايين وافد اشتبونهم يسوون بالعطلة خل يستانسون على راحتهم بس حطوا ضوابط مكتوبه على الواجهه البحرية للمحافظة على النظام و النظافة مع توفر الامن و شرطة البيئة و عليهم بالعافية
1160884290131025920,KW,اللي على اليسار شكله باشا مثل اللي في الافلام العربية 
1161015091531341824,KW,"يقولك الوافد ما لازم يتمتع بالخدمات اللي توفرها الدولة و لا بالاماكن العامه و الترفيهية لانه لازم يدفع رسوم او ضرايب

طيب الكويت مو نفس بعض الدول اللي تفرض ضرائب على المواطن و المقيم

شنو الحل

نحبس الوافدين الى ان تقر الضرائب مثلا

تذكروا ان الوافد لا يتحمل اخطاء الحكومة"
1161043053525778432,KW,لو سمحت عن الغلط 
1161191710933835776,KW,"الصوت الواحد صار قانون وانتهى الموضوع
ما تشارك بالانتخابات انت اللي خسران"
1161255171332198400,KW,"قالوا نفاق بس مو جذي واضحة يا انسان

بالمناسبة افتتاح المشاريع هو اخر مرحلة و اسهل مرحلة في المشروع كله

يعني ننسى الناس اللي تعبت على المشروع و نجير النجاح لمن افتتح"
1161259290608447488,KW," اخونا ظاهر الله يرحم والديك
الناس متفهمه وضع الصيادين و الله يرزق الجميع
الناس تبي اسعار معقولة غير مبالغ فيها فقط لا غير

يا خوي ظاهر انت ابن المهنة و تعرف اشلون تحافظ على الاسعار من الارتفاعات الغير مقبولة

يا اخي مانبي الا وعد منك انك بتسوي اللي عليك علشان تكون الاسعار مناسبه"
1161260972155310080,KW,"فلوسنا و فلوس عيالنانعم اخوانا و نحبهم و نساعدهم  لكن احنا بالفلوس ما عندنا كيري ميري
يدفعون القرض السنتات قبل الدولارات "
1161266009799581696,KW,"تويتر برنامج غبي
لو تناقش موضوع عن الفريج مع جارك درعم عليك واحد من امريكا اللاتينية و سبك انت و جارك وانت اشدخلك يالهيس

في امور يناقشها اهل البلد في المملكة او الامارات او مصر و غيرها من الدول مواضيع داخلية بحته ما يصير ترز وجهك وتتكلم بالموضوع معاهم
مو شغلك

من وجهة نظري "
1161349146382655488,KW, انا اقول الوافد لازم يلبس مايوه قبل لا يدخل اي وزاره
1161349790296346624,KW,    ان شالله يصير خير
1161410067574533888,KW, يبون السيخ يتعبدون فرادا ما يبونهم يصلون جماعة هذا لازم قبل لا تعطيه فيزا تقوله رفيق صلاة جماعة بالكويت ممنوع علشان يعرف القوانين مو تدخله البلد و بعدين تكبس عليه بتهمه صلاة الجماعه
1161557954094673920,KW,"بعد ما الكويتية و الجزيرة و فلاي دبي طلعوا من المطار و كل شركة خذتلها مبنى ركاب منفصل صار الوضع افضل بالمبنى الرئيسي

المفروض ما نشوف الازدحامات القديمة المقرفة "
1161567809731739648,KW,"كان عندنا مدير
و تقاعد
يا اخي كان حقير متقلب المزاج اليوم يضحك بوجهك باجر يعطيك نظرة وصخة

المهم قلت بدزله معايدة بمناسبة عيد الاضحى لعل الله يشفي النفوس المريضة

دزيتله معايدة شخصية يعني بالاسم
شاف الرسالة و مارد

مادري شنو تبي تثبتلي
انا ادري انك حقير بس توني ادري انك كلب بعد"
1161587239039713280,KW," بس ريوق
الا مفطح حاشي من اللي يحبه قلبك
"
