id,dialect,text
1150126562148343808,JO,واللي ما ياخذ حبيبه يمشي بالدنيا مصيف
1150137973222125568,JO,والله ما صدق فيكوا غير ابو طارق
1150139086172303360,JO,يا بقايا الامس دام اني نسيت
1150156403035820032,JO,ليش هو احنا طايقين شكلك هسا  عشان تجيب صورتك كمان  سنه
1150156784906190848,JO," لا بالحرام
انت غانم والله يالأصيل"
1150169987115618432,JO,"بعد  ساعات الدكتور راح يحكي قصي 
وأنا اقول موجود 

وبس والله"
1150172767175811200,JO," يا ضيقتي بالله خفي
الصدر فيه اللي يكفي"
1150190946228854784,JO,يعني اذا ما حضرت محاضرة ال راح يزيد ثقب الاوزون مثلا 
1150197912770662400,JO, لازم منك نسخه بالاردن
1150210577945563136,JO,"نامت عيون الناس
يا عين بالله نامي "
1150216497568129024,JO,انثر سعدهم في زمان المطزة 
1150301606073766016,JO,"شو الجامعة هذه 
الواحد ما يلاقي قاعة فاضية يشحن فيها تلفونه"
1150307322343972864,JO, حاس امي مهكره حسابك تغرد منه
1150307378493120384,JO, شي خربان وشي محجوز
1150311355569848448,JO,"  والطفيلة تشتاق لك 
وتقول لك مشان الله زورها"
1150327373042278400,JO,شرايك أنا ازعل وانت تراضيني بأغنية لخالد عبدالرحمن  
1150343900898430976,JO," ما افطرت
بس شربت شنينه"
1150380350528466944,JO, اه شفناك كيف ع السناب فوتوغرافي
1150380674643369984,JO, هههههههههههه الله يخليلك اياه
1150455764005400576,JO,"رسميا هيك صار لي  ساعه صاحي بشكل متواصل ولا غمضت عيني ابدا ابدا  الخلاصة انه النوم سلطان وفايز وعبدالعزيز وفهد وكل شي 

النوم احلى شي بالحياة بعد النسوان 

اشوفكم على خير "
1150456674144149632,JO, اسأل وتقرأ الجواب في نظرة عيوني
1150633671319330816,JO,أنا حبيبي بسمته تخجل الضي
1150648429103779840,JO," يصبحك بالنور والسرور 
والله أنا جبت التغريدة نسخ لصق 
عجبتني وحبيت اشاركها"
1150649416069603200,JO," حي نباك اخوي أبو زيد 
تسلم تسلم يالشهم الأصيل "
1150650410870484992,JO, أنا ودي ادبر إجازة واسمطها الاسبوع الجاي كله
1150650888463298560,JO, هههههههههههه أنا زمان خلصتهن
1150681503984181248,JO, والله شوية شوية اقتنع انه الحب فعلا هو من ورا اسباب الطلاق
1150685261585670016,JO," عاد والله ودي أقول لأمي شوفي لي بنت حلال

بس بطلت "
1150685743641182208,JO, منك نتعلم أبو عمر
1150765288461352960,JO, هههههههههههه نزلتها  وأنا مدري شو السالفة
1150769919144923136,JO, صح الصح يا هبه
1151172729913171968,JO, طمنا شو صار معك
1151174384352149632,JO," حي نباك يالغالي
الله يحفظك ويفرحنا فيك "
1151176192361455616,JO,"  الموقع لو سمحتي هبه
وفي اوراق مطلوبة او فحوصات او اثباتات ولا كيف"
1151929323017900032,JO,يا لايمتني ما بقى لي شفاعة 
1151934680075243648,JO,الفطين اللي تظاهر من شقاه انه غبي
1151936159720837248,JO,المشكلة انه النية مو موجودة 
1151936447051686016,JO,دن دن دن دنننن ددن
1151939406913257600,JO,والله ع حطة ايدك
1151962413123690368,JO, لازم اكثر من صفعه
1151962695333240832,JO, اللي بالقلب بالقلب يما 
1152671363502608384,JO,يا رب والباقي عندك  
1152671736900542464,JO, ما عليك زود تسلم يالطيب
1152672462947213184,JO,"  نطيت نطة ردية 
وفعلتك ناقصة 
وحركتك رخيصة
وانشاءالله انك تكون تعلمت وتصير رجل وتبطل هيك سوالف وقصص منت قدها يا مروان واذا سكتنا لأنه قلنا ولد صغير مو ضعف لا سمح الله واللي اخوي عبدالله فيه أنا فيه اعتذارك مقبول مروان وحصل خير "
1152675129152954368,JO, يكفي انك محامي أبو نايف
1152675540651974784,JO, تغريدة انظلمت وما اخذت خقها
1152675620335357952,JO, أقل ما فيها يعني
1152675738383998976,JO," ساره احمد وكل شويه بصوره  
قدامي ع الفيس"
1152691657109843968,JO,وين الحبيب يا ليل أرجوك وينه 
1152691709777719168,JO,عنجد أنه القلوب عن بعضها 
1152716462655791232,JO," تدعي لها بس 
ما ودي احطمك بس انتوا البنات اذا تدخلتوا في شي يخرب بزيادة"
1146873602693836800,JO,كيف اقنع جدتي انه احنا ما ادمنا التلفونات بل ادمنا الناس اللي ع التلفونات قولولي كيف
1146874713760850048,JO,"لاتحسبين اني على البعد ندمان
بعدك  ترى  ماهز  شعره  براسي
توي دريت اني من سنين غلطان
متحملك وانتي سبب كل ياسي

خالدالزواهره "
1146877054106918784,JO,انتي أكبر هم عشته في سرور 
1146877403261820800,JO,"                 

اللي ما تعجبه اغاني خالد عبدالرحمن شخص قليل ذوق "
1146877615715868800,JO, عمو فادي يسعد سكسوكتك
1146877741058416640,JO,اقسم بالله مو أنا اللي ماسك الحساب 
1146878167556251648,JO,"أنا يوم احكيلك  قليبك وعميرك بدل  قلبك وعمرك يعني أنا قاعد أدلل وأدلع فيك

يا حظ حظك بس "
1146879230527135616,JO," والله احيانا اتكاسل 
فادجه دج واللي يطلع يطلع"
1146880201554636800,JO, هسا اصورهن وابعثلك اياهن خاص 
1146880532082503552,JO, واصور لك كمان اللي معاك خبره 
1146881170526875648,JO, لا حلفت يمين غير لك
1146886035042983936,JO," نيالك 
أنا التفلزون خربان"
1146894114958598016,JO,شفتوا بس آخر ما سوا 
1146895020030607360,JO,  ودي ارنلك بس الرقم دولي
1146900766910812160,JO, الله يجيب وقت اللقا
1146904462415581184,JO," له له 
يزم من الصبح نازل فيهم طحن والله عادي تفك الحظر ببرنامج "
1146907068512821248,JO, والله سويت ريتويت بعدها شلته ع السريع 
1146908321036820352,JO,"هههههههههههه هههههههههههه هههههههههههه هههههههههههه هههههههههههه هههههههههههه

ولا شي والله بس تذكرت الصحفيه اللي معنا بتويتر
 "
1146908724122046464,JO," حبيبي 
والله انت مدلعني"
1146911312926183424,JO, لعاد خليكي سهرانه معي
1146911642002907136,JO," ونظفوا الصحون لا تخلوا شب وراكوا 
كله دافعين حقه"
1146917268238098432,JO," نامي يابا نامي 
بكرا عشان تحكيلي شو الهستو وشو الكلب"
1147071304589201408,JO, مو لاقية سالفه انتي
1147071627487862784,JO, لو قريب كان تعللنا مع بعض
1147071847403593600,JO," هلا يابا 
الله يكون بعونكي بدعيلك بدعيلك بس انتي شدي حالك شوي"
1147072124827381760,JO, هههههههههههه الله يسامحه اللي ذكرني فيها بس 
1147073496255803392,JO," بسم الله الرحمن الرحيم
أنا رديت ع منشنك بالغلط "
1147074908310134784,JO, دايما ثنك في مكانه 
1147099618020384768,JO, هههههههههههه بس والله أنا بتسلى فيها 
