id,dialect,text
910230215992987648,JO,"الله يحمي هالبلد من هالمطاريد على كثرة مسمياتهم
يوم شباب ويوم قاعدة ويوم دويعشة
   "
912439548902346752,JO, إن شاء الله بنرتاح من همهم وغمهم  بدنا نعيش مثل باقي هالناس  نشتغل ونعمل  على شان لقمة عيش لعيالنا
913452804320190464,JO,"بتقول داعش عن تسجيل صوتي لزعيمه أبو بكر البغدادي
معقول يا ناس شو بعده طيب"
913453924862087168,JO, هذول شلة زعران بتنططوا هون وهون ما يغرك الحكي عنهم نهايتهم قربت بسبب سوء عملهم
913454343680069632,JO, ما يعدمن هالذوايل قال بقلك كان ومان  هذول ما عمرهم بيشوفوا جنة إسلام
913462902769807360,JO,"وين متخبي يا أبو بكر البغدادي 
صارلوا زمان ما بان"
913491465166344192,JO, شكله ما تم عنده عزوة هذا  يطلع بكلمة يوم ما في عنده 
915223841227644800,JO, المهم ما حد انصاب بأذى  الله يحمي مصر واهلها الطيبين
915657863854469248,JO, والله شكله مثل الغريق بتعلق بقشه  ما تم حدى حواليه
915658205098921984,JO, كيف بده بقاتل وهو متخبي بجحرهالله اعلم في اي جحر قاعد
915658845715881984,JO, ما حد جابنا الهم والغم غير ابو شيبه هالظواهري وهل تسمى اذاهم بالجهاد
915660244365308032,JO,        والله كلشي بصير يا ميمتي
915661733028605952,JO, والله يا ميمتي ما في حد مصلوخ غير هذا الشايب العايب
915661913312366592,JO,مثل عادته ما جاب إشي جديد 
916280518051852416,JO,  والله يا ميمتي ما وصلنا لهالمواصيل غير هذا الشايب بعده بشرق ويغرب ما في وراه لا عزوة ولا سند
922901949472747648,JO," والله يا ميمتي ما بعرف بطل شو
اميت صار القتل شهامة لشلة هالزعران"
925846191493074944,JO," خلي شيخه ابو شيبه يدافع عنه إن كان عنده مرجله 
لكن ما بساويها جبان من يوم يومه"
934395465910685568,JO, الله يشفيهم والله يرحم الشهداء
944929769757474816,JO,شو صاير هالايام الواحد ما هو قادر يسافر ولا حتى يركب طياره
944932298683830400,JO,خليها بالقلب بيجيهم يوم  من عند ربهم من كثر فعايلهم الشينه إلي ما بتعرف اي شي من تعاليم ديننا الاسلامي الحنيف
946844700836810752,JO," ان شاء الله ما يشوفوا جنة إسلام هذول شغل خراب ودمار وما عندهم غير طريق الشر
القاهر"
961315527200264192,JO,"  يا ميمتي هذول اصحابك لو كان فيهم خير لما رماهم الطير
طل حواليك واتعلم من دروس هالدنيا
الله يوفقك ويرضى عليك"
962661751186739200,JO,"يسعدلي شدوقق يا مسمسم        
الله معك عمي"
962662652630781952,JO,أكيد بكون متخفي زي النسوان أو نايم بإحدى الجحور 
966283846353289216,JO, والله يا ميمتي هذا الشايب العايب ما عنده سولافه جديده أخباره مثل سوالف جدتي
966797363309416448,JO,   اي نعم هم من نفس الشله
972125717646467200,JO,"الظواهري يقولفشل الربيع العربي و عاد الفساد القديم 
شوفوا مين يحكيوالله ما في فشل غير جماعتك وزباينك يا أبو شيبه"
976458191000219648,JO, الظواهري هذا يا ميمتي مثل  حية التبن   الله يكفينا شره
977281126422204416,JO, والله يا ميمتي هذا هو نفس الإسلوب والطريقة وينهم من نار جهنم  بكفينا عنف وخراب
977917695927701632,JO,والله الدنيا اخر زمان  شله ما بتعرف غير طريق الشر والأذى  هذول الشباب ما بعرفوا غير هذا الطريق المظلم 
980887497650704384,JO,نفس الطريقة ونفس الإسلوب ما في غير هذول عديمين الذمة والضمير شلة القاعدة ومن سار على دربهم 
985858108777009152,JO,يا حيا الله بطلة هالملائكة 
986570654567804800,JO, الله يكفينا شرهم ويبعد عنا اذاهم  ما شفنا منهم غير الهم والغم  ومنين هذا ابو زقول
993082812348715008,JO," هذول ما بقدروا على ذبح جاجة خذ منهم سوالف وبس
الله يحمي أهل سيناء ويبعد عنهم هذوال الزعران"
995964391861510016,JO," إن شاء الله خير وما حد ينصاب بأذى
الله يحمي الأردن ويديمه شامخ وعزيز باهله وناسه "
995999822887911424,JO,"شكل الظواهري ما بده هالصحبه مع الريمي 
هو أصلا ما في عنده شيء يقدمه لا لليمن ولا  لغير اليمن"
996001460897927168,JO," الظواهري اخر واحد يسولف عن النخوة وغيرها
بدي اعرف وين هالشايب متخبي"
996002292569603968,JO," ما علينا من كلامه شفنا فعايله الشينه
ما عنده غير الكذب والنفاق"
1040130838460071936,JO,"
ضحك وقال بصراحه توجع المستريح
تكفييين  خلي أمانينا على قدنا"
1041095711096537216,JO,"في سلم البدو  طرد المقفي عيب 
يعني على وجه وكمل غياابك "
1041431357656912000,JO, من بعدك يا الوافي
1041480931176013824,JO,"ان راحو الطيبين ابشرك حنا
ربوعنا طيبين و ما بعد راحوا"
1045028693582761984,JO,"الغلا محفوظ والسيره جميله 
والزعل احيان من كبر المحبه"
1045032025642741760,JO,"شـآفني أبـي ولآ سمى علي 
معجب منظر عيوني بـ الدموع

كل ماقلت أره مآبيـ لي 
يضح ويسألني من اللي فالضلوع

          ء"
1050160479786688384,JO,"وهقونا على الجيه وجينا 
يوم جينا فخلونا وراحو 

ما رحمونا ولا حنو علينا 
ليتهم ريحونا واستراحو 

ودنا بـ البكى ولا بكينا 
ندري انهم لاطاح الدمع طاحو "
1050162727979835392,JO,"عز الله اني ماهقيت انه عن وعده يميل 
مير ابرقي ياخيبة كبار الهقاوي وأرعدي "
1050901977792696448,JO,ياونتي ونة الجالي   اللي جلا عن بني عمه   أمس الضحى عندهم غالي    واليوم مطلوبهم دمه
1051252310976987136,JO,"ودنا نسلا وندله مع اللي يدلهون
غير ياشهب الليالي وش أنت ناويه"
1052416276188917760,JO,"ويطيح منه رذاذ
وضلوعي مبلله بالشوق

ومن
رماد
المصابيح
جيتك قمر دربي

وماودي
احاكي
صاحبي
والا اسألهبيقولخلنا نسري"
1053053544742424576,JO,"يا نفس توبي عن خفا كل وسواس 
خلي القلوب الكاذبه في  مرضها"
1059221013613944832,JO,"

علشانه تهاونت المصايب  
من يستحقها "
1059222970504278016,JO,"لبي 
ي ريح المطر  والسماء غيم 
لبي 
ي صوت المطر  من بعد غيب"
1059230552916746240,JO,"المطر ذكرى تجيب الغايبين
و أنت ذكرى بس ما جابك مطر "
1062127670572519424,JO,كثر ما جيت لك واضح  تجيني من ورا الأبواب  يا قلبك الخواف 
1062132183584915584,JO,"ي اليوم  
   شلون أعيشك
 أنآ من الشوق     ت ع ب ا ن "
1062499990986256384,JO,  الله يحماكم ويديم اميرتنا الغاليه
1062861328895893632,JO,يالله بحظ كنه وجه وليفي لاضحك 
1062866068392292352,JO,"لا أشتقنا مانعرف نقول وحشتونا 
 يا شين الطبع بس"
1062866167486910464,JO,يا شين هالليل كنه طايل عمره 
1062870334859329536,JO,"
صوت المطر عود بذكراك
والغيم كنه يداريني"
1063233414617280384,JO,"كلن على همه سرى 
و انا على همي سريت"
1063598605091639168,JO,"بن فطيس يقولك 
انت شكلك تحسبني في نعيم 
لاني اخبي صوابي واستره  "
1065398396914188416,JO,"يا فكري الساهي  يا دعوة الـ امين 
لا قالوا عسى اللي مشغل البال يتهنى"
1067574521681637376,JO, يسعد قلبك ي الحشششششم تسلم ي راعي الذوق
1067575078387372032,JO,"  يسعد قلبك ما عليك زوود والله
صباحك كل الفرح والسسسسسسعاده"
1068286897380884352,JO,"عـيش الـأمل لـو كنـت غـرقان بـاليآس
يـا كـم بـلاوي جـت مـن وراهـا عـوافي"
1068305834495614976,JO,"فاقدك مدري فاقد الكون كله
توي دريت انك تساوي هل الكون"
1069386142460649600,JO,"تدري العنا 
اللي و أنا في غيبتك
أصد عن عالم كثير
وهذا فقط  في غيبتك
وشلون لا شفتك  أنا
يا كم مره  
آخذ من آحزانك  حزن
و أقسم أفراحي  عليك
يا حليلك 
تاخذ الواجد و تعطيني 
قليلك"
1070486307166674944,JO,القلب عيا يطيع الشور  قلب هوى ويش اسوي له
1070489787151380352,JO,"الشرهه
 على اللي نايم والدنيا مطر "
1070492677689479168,JO,"ليت المطر يروي عطاش الروح لي هل 

مير عطاش الروح ما يصلها مطر"
1070832758476423168,JO,"تشرق الدنيا على الكل لكن الغروب 
يوجع قلوب المجاريح  بس لحالها "
1071200729535270784,JO, عسى الحظوظ الزينه تصيبك
1071206754199974016,JO, كفوك الطيب ما عليك زوود
1073382373004333056,JO,  يسعد قلبك والله ما عليك زود
1075914406532444160,JO,"المربعانية يا بتشرق يا بتغـرق   

الله يصبحكم بالخير "
1076999267749904384,JO,"يابقايا الامس دام اني نسيت  ما ابي يبقى اثر من ليل فات
ودي اكمل دربي اللي قد بديت  بالامل اشوف فيه الفرح آت"
1077003306239705216,JO, انت منبعه ي الله يحييك
1077005411813863424,JO,"ليـل الشتا ماهو بـ راعي جميل
شره على الي مشاعرهم  قليلة صـبر"
1077242026234704000,JO,"يقول
من زود حلاتكعيت العين ترمش"
1078444506482163584,JO,"من يلوم القلب في حب البدو 
       كنه يلوم الارض في حب المطـر"
1082991698584784768,JO,"ماسدوا مكاني  الواجد وانا واحد
لو تمطر لك الارض اصحاب واحباب"
1082992645981507584,JO,"مطـر معلق بنصف السما 
لا ينهمر ولا يرتفع 
وكل ما بغينا نجتمع 
تحت المصابيح الزرقا
يطيح منه رذاذ 
اما انهمر فرقا و الا تقطع وصل 
يا ماطر الليل 
لا تاقف بوسط السما 
لك هالشوارع  انما تكفيك 
ساعة  ساعتين 
بنشيب وحنا واقفين 
تحت المظلة 
ماهو خوف  لكن حنين "
1083156840148594816,JO,"كل ماجيت اشتكي منه جيت اشكي عليه 
وكل ماجيته على جرح ثاني دلني"
1083372002239484032,JO,"هقوة الند بالند ويا زين الهــــقاوي بنده
النشامى"
1085505756244385792,JO,"ااخذ من الحطب واولعه جمره    
ويروق لي مسانا والهوى عادي"
1086413634618753024,JO, ي الله يحييك ما عليكم زوود
1086794858554163200,JO, تشهدلك فعاايلك الطيبه ي الحشم
1087040028834959360,JO,يا نشامى الاردن عشتوا ولا هنتوا ما قصرتوا ولا عزاء للحاقدين
1087490196717953024,JO,"تدري انك ساكن الثنتين هذي 
وتدري انك ساكن المسكين هذا "
1087849292692418560,JO,"ليل الشتـا طويل
تمادى بالشعور وسولـف"
1088953528058609664,JO,"اضحك لي دام هالليلة شتاء
والله ان ضحكات وجهك دافية"
1092022439234732032,JO, ي الله حيهاا كفوو ي الحشمه
1093852730584694784,JO,  يسعدك ربي ويطول بعمرك
1094482335393828864,JO, ربي يرحمه ويوسعها عليه وألف مبارك يارب وعقبال شهاده الجامعه
1096742431909970048,JO,"آحس مع وبل المطر ل مآ طآح
ف من الذرى يصآفح خفوقي

وآتعب ثر مآ نت فيه أول آرتآح
لآ آبتل ثوبي والضما في عروقي"
1096743015597703168,JO,"العيون كباار والخااافق كفيف
والضما يتوسل غيوووم المطر"
1096744817110016000,JO,قلبي لـ غيرك بالهوى م تنقى 
1096745857037279232,JO,"دموع المطر  بلت وجيه الزجاج 
وصار كلامي بهاللحظات ماله اهميه  "
1096747097213292416,JO,"عسى غر السحايب يوم تقبل بالحيا والخير
مـا تقفي لين تروي دارهم وتربـع   فياضه"
1098011708659060736,JO,"من عرفنا سماحة وجهك ما عاد 
نردد إلا عز الله إني للمخاليق عياف"
1099068298271039616,JO,"والدرب خله سمح لا تزرعه شوك
يمكن يجي يوم  وتمر حافي  "
1100377965563703168,JO,"تنفخ فيني جفـآ و آنآ عمري 
        رمـآد 
يـآ لين قـآلوآ   
    رآح عمــره مع الريـح "
1100378313137234048,JO,ذب الملامه لطيش الريح  ي  عنادي   واقتل جفا الحنايا  واهدني غيمه
1100530759406928000,JO,والله يا ثلثين الخساير  غنايم 
1100532235378278400,JO,"راحوا مراح الريح وأمر الله مطاع 
ما راح معهم الا الفؤاد ومرقدي "
1101264744357470208,JO,"ترفق بي يا مطر 
ترا المشتاق تبكيه الهبايب"
1102674550695825408,JO,"يامعوووود

  أفطن لخلك ترا لأيام سراقة "
1103452619203334016,JO, ألف ألف مبروك تستاهلهاا
1104534335108071424,JO,"لو كل حظ يجلب اللي تمناه 
يا ليت حظي جابني بنت عمه"
1104669206031814784,JO, رؤؤؤعه ناظرك ي الحشم
1109966448796073984,JO,"جعل مزن هل وأرخى بالرعود
يمطر بدار الغلا يوم أرعدت"
1115666879664861184,JO,أرش عطرك على الكفين واضمه
1115751167596822400,JO,"اشهد انه صادق اللي قال كثر الشوق عله

تاكلك كبدك وتبحل بك وسيعات النحايا"
1115946033962475648,JO,"عليك أصوت وأنا مشغول في شاغليك 
ولافيه ريق من الأشواق لك مايبس 

لا تقول ويني وأنا للحيني ما أجيك 
إن كان ودك تجيني مرحبابك وبس"
1116456995270397952,JO,"داويت جرحه يوم صكته الأقدار 
ورد العطى في جرح ماله مداوي"
1122024938871959552,JO,عشان العمر مره  لاتخليني 
1122996762036326400,JO,"عقبك تراني مثل ماهم يشوفون
كومة حنين وذكريات وقصيده "
1132998905942237184,JO," متصنــع السلــوه اللي غصــب عنه قنوع
واضح عليه شيـن الايـام لو ادعـى بالطرب"
1135359790815883264,JO,"أنت حظ ما يجيبه غير دعوة ساجد
راضي ربي عليه ورازقه بر أمه "
1138223968446504960,JO,العتب ما عاد تاسعه الحنايا 
1145470163371929600,JO,ياطي حالي من غثا حبهم طي 
1146385057331986432,JO, واضح الجواب بني صخر
1148004449547276416,JO,"اللي يبيك لو دربه الشوك بيجيك
ناس شربت ملح البحر لاجل دانه"
1148555856860077952,JO,"لا حبك بدوي تجود فيه
ترا قلوب البدو ما تخون "
1149841965321789440,JO,وصلنا الى زمن صرنا فيه نتعوذ من الناس اكثر من ابليس 
1152362566368288768,JO,"ليت عذبـات الليالي لها نقـطة رجـوع 
حيها ما ازين ضماها وما ازين جوعها"
1157441019912359936,JO," 
  وشلون أعيشك حب وأكسب بك أجر  
وانا أنتظاري ذنب وغيابك حرام "
1159985897355583488,JO, انت راعي الذوق كله
1161035891172925440,JO,"أقول  كل الشوق سويته أغاني 
ولا أعاتبك وأقول 
تصورت الجروح اتطيب 
في لحظه وثواني 
ولا من الخذلان أقول 
تعب صوتي ومليتك
تعب قلبي وخليتك
ولا أنهي الكلام واعتذر وأقول 
أنا آسف إذا في يوم حبيتك "
1162160777261977600,JO, بالعكس كل الشكر للي صور الفيديو خليها النااس تشوف قديش وصلنا لمرحله بعد عن الاخلاق قبل الدين الشب مسكين مو قادر يمد ايده عليهم وعم بختصر لكنهن اوسخ من الوساخه نفسها
1163583579269545984,JO, ما عليكي زوود ي الحشمه
1168312584321347584,JO,"قم غن ياحادي حنين الربابه 
يمكن يطيح الصوت في مسمع الريم"
1169390472873332736,JO,"حنا  القديـــمين مهما الــوقت غيرنا 
نحط نفس العطر  ونثقل القهـــــوه"
1169390577496072192,JO,حنا بدو وأبسط عباراتنا أرحب
1172279967461400576,JO,"الله على وقت بقا والله على وقت مضى
ليت الليالي واحده فـ اشكالها واوصوفها"
1172303593086443520,JO,مردها بتزين دام ربي موردها
1174798831948615680,JO,"وش يضرك  لو اخونك
مرة  واختارك عليك"
1000105145504542848,JO,"عيدكم يا ناس مفقود حلاه   دام عيدي ما حضر قلبي عليل 
واحد ما نافسه شخص بغلاه  لو ابيع العمر و اعطي له قليل "
1001027811291869184,JO,عشقنا للخيل ما يبغى دلايـــل
1002191639421636608,JO, رمضان كريم ما رح اجاوبك كل على قد فعوله ي الجاهل
1006717266916986752,JO,يا فقير الوصل حنا في غنا
1009587674678775808,JO,"ضايقـــوهآ واخنقـــوآ مبسـم خجلهآ 
وعاتبــــوها  واسستمــرت تبتســم  "
1010308439388643200,JO,في غيبتك الجو غيم  عيت غيومة تنجلي 
1010409427936141184,JO," يديمك علي 
ي صباح السعاده وراحه البال "
1010441025553395584,JO,"يقول بدر عبد المحسن 
يوم شافها متضايقة من الغيرة قال 
تغآرين  سمي من بغيتي أبعده  
"
1010760063399743616,JO," اللي عاش بحضنه دله
اخلاقه تطلع هيل "
1010760370372440064,JO,"حــــلاة الـرجــل

لــــو زاد هـمـه ثبــت مـاطــاح

يـصـارع صــواديـفـه ولاتــفـتـر عـزومـه"
1010836479826956416,JO,"مـن أول تقول  م قدر خـلـيـك 
و ليوم طال البعد يا زين وش جاك  
ء"
1011507893751906432,JO,الكل طيب  لين يقضي لزومه 
1011521438707339264,JO,"فيني طبايع خـــالفت جملة الناس
ارقى سما واللي يبـي الغيم يـرقى "
1011522049079169024,JO,"توسد آلغيم ي إحساسي النادر
مكانك آلغيم دون آلغيم لآترضى "
1012236849849520000,JO," أنا ادري إنك سحاب ماتبل القلوب 
مير البلا قلبي اللي من بروقك خضر "
1012237170575323136,JO,"لـو الغـلا بالعـيـن يمـكـنتشـوفـه

ميـر البلابالقـلب وشلون أوريك"
1013334104174137216,JO,ياحبه إللي توسد وريدي وتمكن بي 
1013334815670767616,JO,"

أبيك بـ سالفة قلب 
لا يجي عقلك معاك  "
1013361556632031232,JO, صحت هقااويك ي الحشم
1013400035990654976,JO,شينها لازان لك غالي ثم ألتوى
1013583343189929984,JO,"اصبر ويطلع لك رفيقن من القوم 
ويطلع من الربع الموالين عدوان "
1013687297777241984,JO, تحياا وتدووم ي النشمي يسلمك ربي
1013688810494779392,JO,"يا مبعد عني مهاجـــــــــر دموعي آخر علومي الجديــــده

أسافر و أبتعد عنك و ألاقــي رماد الشك للخافق حصيــــــده"
1013696861599928448,JO, الويل لعدااك ي الله
1014062370300350464,JO,"يقول 
البـدو شـدو بعينـك من نهارين  
ورى بروق في كحلك خايلوهـا  "
1016475878933647360,JO,"

فيني من الإحباط ما يخلق لـ حسادي طموح
ياوقت لا تفرح بي الشامت وانا ضلعي قوي "
1016475956150701952,JO,"الصدف بـ العمر ما تخلا من حاجتين
يا تلاقي  عمر  وإلا  تضيع عمر"
1016476719908302848,JO,"وخلاني  وأنا لاضاق  خليته 
يشوف شكثر أحبه لين يتبسم "
1016476876330749952,JO,"حي راسي كل ما ضاقت عليه
 حجم  الدنيا بفنجال قهوه"
1016477265192996864,JO,"يا راسي إن هبت عليك المشاريه 
اثبت عشان ينقال لك حي هالراس"
1016478123788046336,JO,"حطيتك بـ قلبي اللي ما يخونك و طحت 
الظاهر إن المكان الزين   عالي عليك "
1016480798252388352,JO,"
اخير من طرد الزمان وشدة ظروف الحياه
ذكر الله اللي لا إله الا هو الفرد الصمد "
1016484337049657216,JO,اصعب تفاصيل  الحزن  صمت مغبون 
1017924523562332160,JO,"ليت الزمان اللي مضى كله يعود
لو كان زينه شين يا زين شينه"
1017925176607027200,JO,"مع العمر  تكبر مطامعنا
وعزومنا ماعمرها هانت 
نضحك ليا زادت مواجعنا
وقلوبنا  يا كثر ماعانت 
الوقت   عيـا لا يطاوعنا
نبغا نزينها   و لا زانت "
1017928047633358848,JO,"وجيهنا تندى حيـــا  
و دروبنــا ماهيب عــوج"
1019358663419617152,JO,الحظ عجه  والحبايب قراطيس
1019359718211555200,JO,"
آنت لآ تسأل عن آخبار القصيد 
قل آحبك وآسمع اللي ما انكتب 

                "
1020635452934672384,JO,"العطر يبقى والحبايب يغيبون
شطر طرالي يوم رشيت عطره "
1020817265938362368,JO,"الحظيظ الـلي مايربط حاجته بـ احبابه
السـعاده في يديـنه  لانوى يصنعها"
1021021645769773056,JO,مشتاقلك شوق بدويه ضاعت أغلى نياقها
1021022552662118400,JO,"مانلد انظارنا فالكثير من الامور 
الكبود من الحكايا واهلها شابعه "
1021191680224002048,JO,نفسيتي نفسيت بدوي ذابح ناقته لضيف حضري وقاله سوري مااكل لحم
1022265252342321152,JO, قلبي الهاقي  ليته ما هقى 
1023713791094214784,JO,"قلبي يموت بدونك وتوقف الأنسامي 
أرحم ترى مضنونك متشفق ولك ضامي "
1023722319099977600,JO,يا شين وقتي دونـك 
1024076980730437632,JO,"حزة سهر وآروآحنآ فآضت ب شي
نآموآ عسى آحلآمكم مآ آتبخر

وآذآ صحيتوآ سولفوهآ على الحي 
حتى ولو عمر الآمآني  تأخر  "
1025773085151125632,JO, وتمرني مثل الـ أفا في غبنة الهاقي  
1025775323001094016,JO,"احبك كثر فزة الصخري بالضيف 
وكثر ماقيل ببيوتنا اقلط يابعد حيي"
1025776548035485568,JO," أقالد ذكرتك جواي 
و أعيش باقي العمر رحال "
1025890775392026624,JO,"تنام العيون و راعي الجـرح ما نام 
يسهر يعاتب ف السهر  جارحينه  "
1026246865954787200,JO,"دايم نشوف العمر
بأول لياليه
والعمر يمشي
والزمن يختصرنا
على كثر مانقدر
الشيب نخفيه
ماودنا نكبر
ولكن كبرنا"
1026255073826021376,JO," نبي ضحكة من قلب لو نشتريها دين
صح بوحك"
1026256229922951168,JO, خاطري في ضحكه من القلب زي زمان
1026795179985063936,JO,على بيتك خذاني الشوق من بيتي ووداني على بيتك
1026909578250866816,JO,"نوماس فـكري يرتفع فـوق ويحوم
ولا تلتفت عيـني على غايب غـاب
اللي يبـي قـربي وفي راسه حلوم 
حلمه بـعـيد متعـب  قـبلـه احباب"
1027689936827412352,JO,"حب البدو دايم على النقى مرسوم
ماهو مثل حبكم ولا شبهه بالمره "
1027719767472398336,JO,داري وأنداري وأناا صعب أداري 
1027720585890152448,JO,"
  لو يفيد الـبوووح ماكنا سكتـنا
بس عقول اليوم ماتفهم علينا"
1027720785761390592,JO,"انتظرت والليالي تودي ماتجيب 
وأنتخيت الحظ والحظ ماب رجاء"
