id,dialect,text
1098596219146915840,AE, تعبنا منهم والله للامانه بعضهم عاقل لكن اغلبهم اطفال
1098596544402653184,AE, المفروض يشترون بنزيما بعد عشان يستفيدون
1098602414213611648,AE,  مشكلتهم ما يفهمون هالشي يعني لازم تكره ريال مدريد عشان تطلع محب حقيقي للدون استغفر الله بس
1098603278085046400,AE, كلنا اوفياء للدون بس للامانه في بعض من شبيحته كرهتهم تحيه للعقلاء منهم بس
1098627382674669568,AE, مشكلة المدريدي مب مع الاسطوة كرستيانو رونالدو و انتوا تعرفون هالشيء زين مشكلتهم مع بعض من شبيحته الي طلعوا وقللوا من الريال و تاريخه بس لان كريس طلع هاجموا مدريد
1098637790705786752,AE,  يعطونه الشركه يستاهل الغالي
1098659617830326400,AE, يا عمي طير انت و امكانياته فكنا عاد
1098662961713946624,AE, يا رب ينقلع بيل هاي بكبرها صفقه للريال
1098695025012211584,AE, الله يسمع منك يا رب 
1098820926102257664,AE, انقلع اذلف عساك ما تتوفق في ولا مكان يا النكبه
1098882500691193984,AE, راح علينا هازارد يعني
1098882830468374400,AE, زين اصبروا لين ياخذون غارث بيل و نفتك منه
1098883048651833216,AE,يعني ماشي هازارد و بنفس الوقت ماشي فكة من القرد بيل وش هالحظ ياخي 
1098906015616118784,AE, للاسف يقولون ممنوع يتعاقدون بالفترة الصيفيه و الشتويه القادمة فأكيد ما بيفرطون فيه
1098906570983919616,AE, والله الي يهمني هازارد بس ذاك عادي بس هو لاعبنا ترا راح لهم اعاره
1098948913422307200,AE,  يخسي البنز يجي نص بوتركي
1098949532304445440,AE,  اتفق في موضوع بنزيما جاحده و نص بعد
1098949820558032768,AE,  بوتركي يستاهل اساسي في مدريد اكثر من بنزيما 
1098950288810086400,AE,  انتي لج راي و انا راياهم شيء ينقلع القرد بيل من الريال
1098951750239826048,AE, ترا هم ناوين على اكثر من اسم في الصيف
1098952350654439424,AE, يا رب اي واحد فيهم او الاثنين بعد
1098954010508316800,AE, عاد قالوا في حساب الشبكه نزلوا خبر الريال ناوي يدخل صيف قوي و يتعاقد مع اكثر من نجم كبير مثل نيمار و مبابي و هازارد و  ايركسن و غيرهم هالاسماء مطروحة يعني ع الاقل اسمين منهم
1098954699741556736,AE, ليت سولاري بس يفهم هالشيء و يفكنا من عناده
1099007741593616384,AE,  يا رب بالصيف من نصيبنا
1099051089582833664,AE,  امييين ولا منك والله 
1099054859129683968,AE, ههههههههههههههههههههههههه ليلتها الصياح في كتلونيا
1099056723292242048,AE, سلامتك بوتركي شكلها بشرى
1099056962665414784,AE,   خذ الحين صاروا يقتبسون منها بعدسارونه المجد
1099192220517875584,AE,  ام و فرحانه بطفلها الله يرزقنا كلنا هالشعور يا رب و يبارك لها فيه
1099198882762969216,AE, والله مشتاقه لريال مدريد طولوا علينا هالمره
1099201151910715392,AE,  مختفي عمار ما نشوفك
1099201522985037824,AE,  اي والله صدقت لوعوا جبدنا حركات اطفال
1099219355911507968,AE, يعني صباحي انتي يا ورده 
1099225906252599168,AE, الاستفزاز من الطرفين بعض من شبيحته يتمصخرون ع الريال في كل تعثر و لما بعض من شبيحة الريال يردون بس يطلعون هم الجاحدين الغلط من الطرفين ترا بس في فئة تلوع جبدي انهم وقت الفوز انا مدريدي و وقت تستوي مشاكل مع الشبيحة يحطون نتايج تعثر مدريد مادري هالكلاب شو نوعهم
1099230038355001216,AE,  الله يشفيها و يعافيها يا رب و تقوم لكم بالسلامه
1099336461634203648,AE, أنا من محبين كريس لكني من مشجعين ريال مدريد
1099354180811218944,AE, مثل شبيح كرستيانو الي يستنقص من الريال و مكانته كفريق نصبح عليه بتفله و نمسي عليه بتفله
1099355691108704384,AE, ما علييه بيرد باذن الله الدون مكانته كبيره و خسارة لكن فريقنا الأكبر و الأعظم بين الفرق 
1099355898840039424,AE, يا رب ما يكون في يومه يخرب بيته
1099362479082270848,AE, يخرب بيته ما يتعور متى بيعتزل متى نفتك منه
1099369145840340992,AE, بعض من شبيحته زباله والله
1099378773965836416,AE, الريال كان كبير قبل وصول كرستيانو و زاد بريق مع كرستيانو و راح يرد و يتألق و يتوج بالبطولات حتى بعد كرستيانو حتى لو تعب شوي يرد اقوى انا بسالك سؤال انت مدريدي
1099381500146081792,AE, الا في استنقاص كلامك ان كرستيانو جعل الريال اكبر مما كان كلنا نحب كريس و اسطورتنا بس يغثك الي مسوي عمره مدريدي و طايح ليل نهار يستنقص من مدريد و يتمنى تعثره عشان يقول شوفوا مدريد فريق عادي و صنعه كريس بس عشان ياخذ رتويت و يرضى شبيحته و الي البعض فيه كريه جدا
1099382057422278784,AE, اختصار الكلام لو الريال ما كان كبير من البدايه ما كان بينتقل له كريس و يصير أسطورته الفريق هذا راح يبقى الافضل و الاحسن عجبكم ولا لا و طز في شبيحة كرستيانو المرضى والله قسم بالله نحب كرستيانو اكثر منكم لكن زودوها
1099383294704185216,AE, قسم لوعوا جبدنا الله ياخذهم
1099393286601691136,AE, ما قللت ادبي عليك هذا اولا ثانيا كلنا نحب كرستيانو بس ما نوصل ان نقلل من الريال و مكانته مثل ما تسون انتوا هذا و انتوا محسوبين ع الريال مشجعين
1099393529162485760,AE,  معهم اقوى صح بس الريال قبلهم كان كبير
1099396178788188160,AE,ترا نحبه اكثر من بعض الي فجأه صاروا شبيحة له عشان الرتويت و هم كانوا اول من يقلل منه اذا تاخر عن التسجيل الحين صاروا هم الي يحبونه سبحان الله 
1099396748815015936,AE, والله منافقين  لا و مسوين جو و مسوين كل هالمشاكل
1099397384629563392,AE, هههههههههههههههههههه عندهم لازم تكره الريال عشان تطلع محب حقيقي لكرستيانو او لازم تنتقل تشجع اليوفي عشان تطلع من محبينه ياخي نحب كرستيانو رونالدو و هو اسطورتنا بس ما نشجع غير ريال مدريد نحن
1099397742118486016,AE, قلتها ترا بقر ابدا ما راح يفهمون
1099398320072650752,AE, بيردون بكل تاكيد والله يضحكوني هالاطفال اذا كرستيانو رونالدو بنفسه قال انا مدريديستا
1099398826908106752,AE, و قلل منهم و الغي دورهم في البطولات بتطلع انت بهالطريقه محب حقيقي للأسطورة كرستيانو بنفسه لو عرف عنهم دفنهم
1099400961603391616,AE, هاي خبلة المفروض تكشخ اكثر عشان الاسطورة والله اخرتها بيسحب عليها اذا اهملت نفسها
1099403627309993984,AE, عليه ذوق رهيب في كل حبيباته ذويق
1099405449298874368,AE,  ارينا ما كانت تحب ام الاسطورة تطلع معاهم كانت تتضيق منها كفو عليه سحب عليها الام بالدرجه الاولى
1099410950069895168,AE, واثقين من اهل عمان الطيبين و نحن و انتوا واحد
1099545564176437248,AE,  استغفر الله وين وصلنا بس وش هالعقليات
1099546782344847360,AE, الله ياخذهم جمهور فاق اقوى انواع القذاره
1099547427915399168,AE, ما صدقنا ان صاحبنا كبر شوي و بنفتك منه لا وبعد تحس فيه شبه
1099554243810340864,AE, الدعوة ترد على صاحبها عفانالله هالاطفال مشكله وربي مسوين فيها شبيحة و متعصبين و ما اجمل كريس و ميسي و ما أقبح شبيحتهم
1099560207871606784,AE,يوم نقول اطفال يزعلون شوفوا التغريده الاولى له امس و الصور الباقيه تغريداته قبل عن ميسي كون منافق و ناقض نفسك و سب الريال و جماهيره و خذلك رتويت هالفتره قال محايد قال 
1099562936119504768,AE, اهلنا و سندنا و عزوتنا العفو و تستاهلون الزود
1099566074591358976,AE, اوووف اشوفهم جي مطرودين يمكن تبرد في قلبي حرة انهم يستفزونه بمرض امه يلعن الكورة اذا راحت عنهم الانسانيه
1099570332069957632,AE, لو ما تفلسفت جدام جيرونا يمكن فزنا و كنا بالمنافسة ضيعت علينا البطوله الله يعينا لين نهاية الموسم بس
1099571915033858048,AE,   اخر مره توج فيها الشارجه بدوري كان نفس سنة ميلادي  يعني من  سنه تقريبا
1099572412138557440,AE, والله انا احب هالاعب مادري ليش ما تحبونه يفيدنا اكثر من القرد بيل
1099576038684852224,AE,تكفى يا سولاري اشتقنا له و لفرحته عطه فرصه يستحقها مثل باقي زملائه 
1099580002994130944,AE, بس قبلها اشوف منظر موراتا يسجل و يحتفل و الفار يلغي الهدف تكتمل الفرحه
1099580887652540416,AE,بياتيك لاعب جميل يا بيريز و مدريد مدينه جميله يا بياتيك 
1099581009220255616,AE,  ههههههههههههههههه هيه والله مسكين ما عنده مطبيلين
1099583345409904640,AE, الله يغثك يا بيريز كثر ما غثيتنا هالسنه
1099584654577930240,AE, السموحه ولا توني اعرف بس زين ما عندي مشكله مع جمهور ميلان
1099584861730492416,AE, الله ياخذهم جمهور مافيه شويه ذرة انسانيه عساه يجلدهم و يطردهم من الابطال نادي قذر و جماهير قذره
1099585221031329792,AE, هههههههههه ما تدري يمكن لانهم بعاد عن المنافسه يا خوفي يصيرون مثل جمهور بوزلقه وصلوا نهائي الابطال طلع الطعميه افضل من كريس و ميسي و فان دايك و لوفرين احسن عن راموس
1099585735575900160,AE, على قولة جهاد اذكر القط يجي ينط
1099586522590912384,AE, احس الي وراه هو الي بيسجل
1099588732037066752,AE, مب ذنبنا ان فريقك مب كفوو يعدي نفس الدور في كل سنة ينداس يعني شو نسوي نخسر و نترياكم لين تعدون الدور و بعدها نفوز و نواجهكم جمهور غايه بالغباء
1099589328320249984,AE, يا ساتر وش الجمهور الغبي و المصخره الغلط منى المفروض نطلع من دور  كل ما فشل برشلونه و طلع
1099594101832466432,AE, والله هالجمهور يفوز بجائزه اغبى جمهور بعد جمهور ليفربول
1099594315985232000,AE, كان قريب و ضيعه بيريز و بعدها بسنه راح يكون سعره عالي
1099594599855726592,AE, الله يغثه كثر ما غثنا هالسنه
1099599545028304768,AE, ههههههههههههههههههههه يشبه فنان مصري قديم متوفي الله يرحمه
1099617221574303616,AE,   يا ليت دوم اكون منحوسه اذا ما بتشمون البطوله الا كل  سنه
1099617849402974208,AE, اصلا لو بيتركه ما بيكون اقل من  مليون و يمكن اكثر ضاعت علينا الصفقه الله يغث بيريز
1099618358511718400,AE, يا رب يتعثر ليفربول  و يفوز تشيلسي بالنهائي 
1099620550509584384,AE, الله ياخذهم كرهونا في عيشتنا بعض من شبيحة كريس هم عادي يشجعون كل حد ضد ريال مدريد اغلبهم اطفال  
1099627472444899200,AE, تكفى ركز في مباراة كلاسيكو الكأس بليز
1099638994609033216,AE, هههههههههههههههه احمد ربك ان بيريز صاير بخيل هالفتره
1099639486605078400,AE, ههههههههههههههههههههههههههههه انتوا خذوهم ولا تعطونا راضين والله
1097582158846128000,AE, اي والله حرام الي يصير مع ايسكو و بيل و بنزيما ما يستوي فيهم شيء يلعبون أساسيين و يخربون علينا متعه الكوره و بالذات بيل هالفتره زودها
1097599352812593152,AE, بيدفعون ولا بيريز لازم يدفع لهم عشان يأخذونه المهم ينقلع باي مبلغ
1097601522236563584,AE, بيع بيع بيع باي مبلغ المهم ينقلع الله ياخذه القرد
1097602101709078400,AE,  اتفق يا ليت والله تصير
1097734821093298176,AE,   ما بيكون لحم خنزير بعرس ناس مسلمين
1097749244906258432,AE, تو الناس يا ريال
1097749420144295936,AE, تتوقع برشلونه بيتاهلون ولا بينقلعون
1097749618660646784,AE, يا رب ننصدم و يطلعون
