id,dialect,text
1089314118203510784,EG," ويتقال لها
دي مصر يايات"
1089325103467450368,EG," اغريه بس مش اوي
علي راي سكيننه فري ريا وسكينه"
1089330818646986752,EG," الدهن في العتاقي ياعم جورج
عندنا واحده  في الشغل  بتدور علي بوي"
1089331490905825152,EG," لا حصل معايا موقف اطرف مره يوم عيد داخل محل ليكر اجيب نبيت واقف علي باب المحل واحد هوملس بيشحت فبيقولي هات دولار قلته ماعيش قالي يعني معاك تجيب ليكر ومامعاكش تديني  
"
1089334666937753600,EG," ولو اتكلم تزعق فيه وتقوله 
اييييييييه اوضه النوم الي جايبها لي اهلي اشكر ربنا اني بخليك تنام فيها"
1089337539415207936,EG," هاهاها 
 ايش تاخد الريح من البلاط"
1089338215423770624,EG, لا بجد بقي احنا هنا مافيش حاجتي وحاجتك كله مشاركه اسمي واسمها عليها  حتي لما تعملي تسجيل لعربيه مثلا يقولك من المالك ومن الشريك  الحمد لله ماعندناش الكلام ده حاجتي وحاجتك
1089340212050833408,EG, ده حقيقي زي ماتعلمنا من اهلنا طلعنا
1089361053560066048,EG, امال لما توصل في النصف الثاني من الخمسينيات هاتقول ايييييييييه
1089621520199180416,EG, هو موضوع ان ربنا وعدهم يظهر الحق ده حقيقي ربنا اظهر الحق بعد اكثر من  سنه غش وخداع وخلاهم ياما في السجون او في الشتات
1089622618624405632,EG," كينج كونج هيرقل شمشون
بس زي مافيه ناس بترمي للعصافير رز وعيش  نفس الناس بيصطادوهم وياكلوهم
مافيش نقاوه عايزه بيتزا وشاورما لسه"
1089678846306086784,EG, ايوه بس ارجع كده هتلاقي التواصل مع الناس والردود اختلفت انا متابعه من زمان قوي هو من اوائل الي تابعتهم منذ عملت الاكونت  كان كل فين وفين ينزل تويته الان يقضي وقت طويل علي التويتر ويتحاور في كل الموضوعات
1089679207473516416,EG, وبعدين انا مابتكلمش علي ساويرس بس مشاهير كتير
1089679679735451648,EG, كده ميعاد جلسه الكهرباء جه 
1089935756813090816,EG, اوه ارت حل علشان لو الام ماطبختش قولوا لها ماطبختش له طبخت احنا مابنحبوش
1090282226107981824,EG," عملت اه تان
د عامله ز الراجل بتاع ماتقدرش ف مسرحه محمد صبح"
1090388273061642240,EG,"     قلت قبل كده ماتحسبش الحاجه الي بالدولار او الدرهم وتضربها وتحسبها بالمصري
انت بتقبض بالدولار بتدفع بالدولار يعني علاج العصب ب وحده من دخلك الي هو  وحده من دخلك المصري
يعني علاج العصب ب مصر  اضعاف في امريكا ده لو عايز الحسبه صح"
1090405634162507776,EG,     انا قصدي ان الوحده الماليه متساويه لكل بلد ماينفعش نقول بتقبض بالدرهم يروح  محولين الدراهم لجنيه ويقولك انت بتقبض كذا بالجنيه وايضا الدولار لانك بتقبض بالدرهم وتصرف بالدرهم وانا اقبض بالدولار واصرف باالدولار ماينفعش اقبض بالدولار وانزل اصرف في مصر بالجنيه
1091109978088316800,EG, لسه داخل من بره قاعد قدام الهيت بفك التليج
1091807215374213248,EG, طب ممن تقول ده اه بنت جابتهول  ب  دولار 
1092166654757425152,EG, فاهم مدد الرئيس هايعدلوه ويعملوها  سنوات الناس الي عايشه هناك عاجبهم وموافقين انه يقعد  سنوات هايقولوا نعم مش عاجبهم وطهقوا منه يقولوا لا والاستفتاء بقي مراقب ومحدش هايقدر يلعب فيه لكن انا بره ماعرفش ظروفهم ايه اعرف الانجازات ولكن لااعرف السلبيات
1092571966337372160,EG, في السبعينيات  لما كنا اطفال لما بدات ظاهره الحجاب كانت جاره لينا اتحجبت هي وبناتها الاربعه  وكانوا ناس بسطاء وكان منظر جديدعلينا و  علي الناس فجاره لينا سالتها ليه كده قالت لها في الجامع بيدفعوا شهريا  جنيه للي تتحجب واحنا اولي ب جنيه
1092579521964978176,EG, انا فاكر لما كنت صغير ماكنتش بفهم الاغنيه ولكن كنت بحب الموسيقي كانوا في البيت يولعوا الراديو علي الحفله كنت اقعد جنب الراديو لحد ماتخلص الاغنيه ومازلت بعد كل هذا العمر افتح ام كلثوم علي اليوتيوب واستمع لاغانيها وكانها اول مره
1092580304982810624,EG, كان لينا جار بيعمل في شركه كرونا للشكولاته كان كل حفله لام كلثوم يدعوا اصدقائه وزوجاتهم ويقعدوا يحضروا الحفله وكانهم في المسرح وكان لما تجي له فرصه يروح المسرح يحضر حفله كان يفصل بدله جديده ومراته فستان سهره علشان رايحين حفله ام كلثوم
1092795674708639616,EG, وممكن يكون زي الطربوش
1092815168835408000,EG," كده ده كان حد جايب في سيرتك وعمال يقطع في فروتك 
الف سلامه"
1092890644396368000,EG," انا عارف الرد وهاقوله قبل مايقولوه علشان اقطع عليهم خط الرجعه 
اي حد غير السيسي 
مشكلتهم مع الراجل ده انه بوظ كل الي كانوا بيخططوا له"
1092924899822354432,EG," النوتيلا عندنا في علب بلاستيك
الف سلامه"
1079047825814708224,EG,  يعني واحد  من داخل المطبخ وحضر الاحداث  وشاف بعينه وكتب شهادته مش مصدقينه وبنصدق الهري الي علي تويتر بلاش ده مبارك في شهادته قال نفس الكلام  فتحوا السجون بلاش ده مرسي لما خرج  كلم الجزيره من تليفون ثرايا مين في وادي النطرون عنده تليفون ثرايا وبرضه بلاش
1079088759478669184,EG," ماكل واحد بيشتكي علي قده
يعني دحيح الدفعه ضاع منه  ربع سؤال يقولك ليه كده لطشت معايا والفاشل ماعرفش يحل ولا سؤال يقولك برشه لطشت معايا"
1079421180875063168,EG,  ياستاذه اكيد عارفه قصه حجا و ابنه والحمار جحا ركب الحمار وابنه مشي جنبه قالوا الاب الذي ماعندوش رحمه راكب الحمار وومشي ابنه الصغير  نزل وركب ابنه قالو الواد قليل الادب راكب هو وابوه الكبير ماشي نزلوا الاتنين وشالوا الحمار قالو الراجل المخبول وابنه شايلين الحمار
1079461661294190592,EG," معني ذلك انك مش من جيل اكتوبر اي ماحضرتيش حرب اكتوبر
احنا بقي الجيل الي ماحضرش الملك ولكن وشنا كان حلو ودخل في عهدنا التلفزيون
تقدري تقولي كنت في سنه كام ساعه الاغنيه دي"
1079463284066214016,EG,  تقريبا بس للتوضيح  احنا الي بدا معانا البث الرسمي للتلفزيون المصري وليس البث التجريبي
1079465197042061184,EG,  البث التجريبي والبث الرسمي سنه  قالولنا كده اياميا كنت لسه مولود ماعرفش
1079465539943178240,EG,"  جيل الثوره تكسب 
بس خايف حد يخش يعلي علينا ويقول من جيل الملك  "
1079465943603073024,EG,  الله يحفظك بس كنا اطفال  بس كانت الناس طيبه وماتعرفيش تفرقي مابينهم
1079466288328654848,EG,  ايه ياجدو متكبرناش قوي كده
1079467293174915200,EG, ايه ده هو خلف امتي ماقاليش  
1079467729738977152,EG,  متهيالي التويتر وقف عند جدو فتحي الي قبل كده قاعدين متغطين باللحاف والبطانيه وبيسمعوا ام كلثوم في الراديو
1079468005426368384,EG,  كان معايا واحد بس مش لاقيه
1079469533566590976,EG,  جدو لو انت من عصر جمال الناس كانت بتقول ايه في جنازته انا كنت صغير بس فاكر كان عمارتنا  فيها بس شقتين فيهم تلفزيون ابيض واسود  وباقي العماره  ال   شقه اتقسمت علي الشقتين علشان يشوفوا الجنازه
1079470169968263168,EG,  جدو انت الاول قلت في الخمسينات والان بتقول  وان اختلفت الشهاده بطلت القضيه
1079471364334067584,EG,"  اسف بوظت التويته بتاعتك ورحنا  لموضوع تاني خالص نرجع بقي لمسلسل هو وهي والبنات البنات الطف الكائنات والسنيوره سعاد حسني
هو ليه مافيش مسلسلات ذي دي دلوقتي"
1079472507625897984,EG,"  الناس كانت بتقول ايه في الجنازه 
افكرك ولو مش صح قلي
الوداع ياجمال ياحبيب الملايين ده الي فاكره الباقي جبته من اليوتيوب
"
1079472784072425600,EG,  بهزر مصدقك مافيش لازمه لنشر صوره البطاقه
1079474283775250432,EG," امال هانعمل بيها ايه ده عندنا هنا بنعمل كده
كيس زباله صغير في العربيه كيس زباله لحاجه ممكن تعور مثلا كوبايه مكسوره لازم نستفاد بكل كيس دفعنا فيه فلوس غير مباشره لانه سعره محمل علي سعر السلعه الي اشتريتها"
1079494121805565952,EG,  اكيد سمعت عن انفجار حدث من ثلاثه ايام في نيويورك قرب مطار لاجورديا واضاء سماء نيويورك باللون الازرق المنير كان انفجار محول كهرباء عالي القدره المهم الناس بقي تفكيرها ايه ان ده هجوم كائنات فضائيه علي الولايه  الناس حسب مودها بتتوقع
1079623256179646464,EG,  اصل من غر معادته مش هانعرف نعد 
1079836972129153024,EG, روح التايم سكوير النهارده باليل وانت تتاكد انهم موجودين 
1079838179849588736,EG, بيبقي يوم زحمه وصعب لانه كله موصلات مافيش عربيات خاصه الناس بتحجز مكان وقفه من الان انا بشاركهم واشوفهم في التلفزيون
1079860267138338816,EG,"هسال سؤالي التقليدي كل عام
ياجماعه يالي دخلتوا  شايفين ايه جوه
ونخش ولا لا فاضل لنا سبع ساعات ممكن نتصرف
كل عام والجميع بخير"
1079863122754760832,EG, لسه ياجدو انا بكلمك من سنه  فاضلي  ساعات علشان اخش معاكم
1079907861227073536,EG,"  هو بيعيد علينا بتهنئته لينا ان الي هايهنينا يبقي كافر 
لو مطلعش وقال الجمله دي يبقي ماهناناش"
1079908477072564224,EG,"  اذا كانوا مهتبرين السلام الجمهوري والوقوف له حرام  ناس عايشه في الحرام فليس عليهم حرج 
يعني الناس المثقفه مثل حضرتك فاهمه دينها كويس هاتسمع كلامه هي بس فرقعه كل سنه"
1079917761730670592,EG,"فاضل  ساعات علي بدايه السنه الجديده هنا بنيويوك 
ادينا قاعدين بنشوف الي دخلوا  عاملين ايه  وبنشوف الناس الي بيتويتو لنا من السنه الجايه بيكتبوا ايه"
1079922795230965760,EG, وايه اخبارها  مستنين تطمنونا
1079923784759607168,EG, اصل المثل بيقول البضاعه الحلوه دائما علي وش القفص انتوا لسه في اول اربع ساعات من اول يوم من اول شهر من السنه نستني بقي لما نغوط في القفص مايو واغسطس هيبان البضاعه علي حقيقتها 
1080121875118940160,EG, بصراحه السفر بالذات وتشيلي حاجه مش  بتاعتك ده يخوف انا لما سافرت اول مره زميله اخويا في الشغل عايزه تعب دواء لامريكا خدتهم بس كنت خايف وفتحت العلب وشفت فيها ايه وسالت علي الادويه دي مسموح بنقلها ولالا ولاتنسي الست الي خدت عمره من ابن بلدها وشيلها مخدرات
1080122340674076800,EG,  شكرا جزيلا اهو انتي التانيه الي بقول عليها وماطلبتش من حد نهائي الطلب ده بس ساعات الواحد بيحس اننا بقينا اصدقاء من غير مانعرف بعض
1080124063664742400,EG, لسه صاحي صحيح علي صوت رياح شديده الهواء هايوقع الشجر
1080125782763208832,EG,  ياامي الاسم جني الاسم الرمزي ايمن بس انا بعتز علي التويتر بحورس
1080129952555651200,EG, فكروني الله يعمر بيتكم
1080138307709878400,EG, فكرتيني في الثمانيات عند بدء  اصدار العمله فئه العشرون جنيها ماشي في الشارع امام قهوه والناس قاعده علي الرصيف واجد تحت الرصيف ورقه بتطير مع الهواء امام الجميع ولم يلتفت لها احد مسكتها لقيتها  جنيه واكبر مبلغ لقيته في حياتي مصورها ومحتفظ بصورتها للان
1080151065633439616,EG, يعني هو كل لاعب كوره زي محمد صلاح  مش معني انه لاعب مشهور لازم يبقي مثقف
1080152757590524032,EG, الغريبه ان لما كنت في مصر عمري ماسمعت عن سيكرت سانتا واول ماسمعت عنها لما جيت هنا وبدات في الشغل مع جنسيات تانيه فؤجئت السنه دي ان بيكلموني من مصر عن السيكرت سانتا ومبهورين بيها
1080153676889706368,EG, احنا عملنا السنه دي بقي ديرتي سانتا اتفقنا كل واحد يجيب هديه بمبلغ معين ويغلفها ونحط الهدايا جميعا علي الترابيزه وكل واحد ياخد رقم عشواقي اول واحد ياخد هديه ويفتحها التاني امامه اختيارين اما ياخد هديه من الترابيزه او ياخد الهديه الي خدها الاول وهكذا  كانت ممتعه برضه
1080182677519679616,EG, كان ليها هيبتها برضه كانت قيمتها اكتر من  بتوع الان 
1080231992321630208,EG, في كل حته في العالم الاسعار بترتبط بالعرض والطلب وكل شئ موجود وكل واحد يشتري مايناسب ميزانيته لكن عايز اكل مكسرات وميزانيتي لاتسمح فاقول للحكومه لازم توفروا المكسرات مافيس الكلام ده علي الاقل عندنا
1080232863654645760,EG,  في الجون معناها كبير قوي
1080256009959018368,EG," كلام حقيقي كنت بروح احضر  كتب كتاب اصحابي في الجامع كنت بروح جنازات جيران لنا في الجامع بس كنت بقف بره مع مسلمين كتير كنت بخلع الجزمه واخش ماكانش حد بيسالني انت مسيحي ولا مسلم
صح مين فعل بنا هذا"
1080271153539756032,EG,  كان في بيتنا مبني ملحق كجمعيه مسيحيه تخدم اولاد المنطقه من الاقباط   وكانت في الاعياد توزع هدايا علي الاطفال وكان الاطفال المسلمين في المنطقه يتجمعوا ياخدوا كيس الهديه زيهم زينا لافرق اهم العيال دي لما كبروا وربوا دقونهم بلغوا امن الدوله ان المبني هايتحول لكنيسه واتقفل
1080271503340515200,EG, زيه زي يوم  ديسمبر لاجديد
1080272381850108032,EG, الساعه اتناشر ونصف الا خمسه
1080626263331667968,EG, تخلي واحد صيفي وواحد شتوي
1080631397721739264,EG," لا من ده كتير وفيه اصعب من كده
لما اتنين يبقوا قاعدين في مواصله وفاكرين هما العرب بس في المترو وياخدوا راحتهم في الكلام وكلام من المنقي خيار واحنا سامعين وعاملين امريكان"
1080631728186765184,EG, المهم النوع ده من الناس تسمعي له بس ماتبصولوش لانك لو بصتيله هايفهم انك بتفهمي عربي وهايلم الدور
1080647032744960000,EG," انا مابقولش مايحاسبش انا بقول يتحاسب ضعف الافكار المسمومه دي اصلا لاتسيطر علي انسان طبيعي بتسيطر علي انسان مختل باي طريقه من الخلل
وان المرض النفسي لايعفي من العقوبه"
1080648289995890816,EG," انا كاتب التويته دي بعد ماقرات خبر عن مرتكب حادث دهس في المانيا مضطرب نفسيا 
فهل هايسيبوا المختلين يقتلوا في الناس بحجه انهم مختلين"
1080649304782585984,EG," اهه في حته واحده فيه حوالي  كلاب ضاله التصرف معهم ايه
زمان قدام عمارتنا حته ارض فاضيه ووراها مزارع كان يجي باليل كلب صغير يقف في نصف الارض ويهوهو وفجاه تلاقي مالايقل عن اربعين كلب اتلموا من فين ماعرفش هو يهوهو وهما يهوهوا وراه يقعدوا شويه وبعدين كل واحد يرجع من مكان ماجه"
1080810638585327616,EG,  طب ماممن حط صوره مش صورته علشان تتاد من الاونت ال هاتتابعه خش الاونت واتمش فه شوه هاتعرف افاره وموله
1080819815319826432,EG,  بتلم عل امنتات بتعجبن اتابعها ولا لا اشوفها الاول مابهمنش لا اسم صاحبها ولا صورته همن بفر ازا
1080824307385859968,EG,  عن اتابع حد ماعرفش موله اه مامن ماتوافقش معاا
1080889553957937152,EG, ال شرب لبن ببلاش ماشترش البقره
1080994086738366464,EG," اهو كله موجود بس الي يدور 
"
1081597080920039424,EG,"انا ماليش في الكوره بشجع بس لما تكون مباريات دوليه من باب الانتماء والكلام الكبير ده
بس الي قراته امبارح عن مباره بيراميذ والاهلي وقفت عن كام نقطه
ماتش كوره  وفيه فائز ومهزوم عادي
بس الي مستغرب له جماهير الزمالك مالها بالموضوع ليهم حق يعملوا الكلام ده لما فريقهم هو الي يكسب"
1081605826035548160,EG,   لامتابع قوي ومش لازم خلط الاوراق انهي جمعيات اهليه الي اتقفلت وتبع مين وبتصرف علي ايه اهه فيه جمعيات اهليه اتقفلت علشان بتصرف علي الارهاب فبلاش الطريقه دي احنا بنتكلم عن العمل الخيري الي في النور
1081607707361243136,EG,   ايرادتهم بتروح فين ياستاذ كفايه علشان زهقت
1081609262374273024,EG,   بيمولوا بيهم الارهاب وبيشتروا بيهم سلاح وبيفجروا بيهم الجوامع  
1081610685451329536,EG,"   ياستاذه بدايه التويته خالص لشخص علي التويتر بيسال لماذا لاتنتج المساجد كما تنتج الاديره 
الاستاذ ده خدنا في حته تانيه خالص"
1081655628492357632,EG," المثل بيقول اييييييييه
القط بيحب خناقه"
1081656129749467136,EG, ماعرفش حتي عمرو اديب تعبيراته بتتغير لما الاهلي بس ينغلب
1081668441893937152,EG,"  المواقع لها بتقول بجانب سور النسه
حت س ت ف"
1081691144071860224,EG, علي فكره دي حقيقه وليست قصه من صنع الخيال جدتي كانت اكبر ست في العماره سنا قبل التلفزيون والتليفون كانت ستات العماره كلهم هي كاتمه اسرارهم وتحل لهم مشاكلهم مش هانسي لما كانت تاخد الطرحه وتقول طالعه لابو فلان اشوفه مزعل مراته ليه
1081692614611660800,EG, سهل دلوقتي علي النت موجود وتكرار جمله جمله لحد مايتحفظ وفيه ايضا مواقع منزلاه بالهزات للحفظ
1081730291562135552,EG," ز مابقولوا  جات تحلها عمتها
بس جمله انا خساره ف البلد د ف ساقها جمله دارجه بقولها ل الناس"
1082000136828604416,EG," 
الريس اتكلم عندينا وانتو  لا"
1082001680349229056,EG, هو انت فاكره ماتش الاهلي وبيراميذ هانردح لبعض
1082004510783033216,EG, عندنا دكك الي هي الكراسي 
1082041114109100032,EG, مش كنتي قضيتي العيد في مصر  كنتي زمانك بتاكلي اللحمه
1082296636368396416,EG,  هي دي مصر الي نعرفها
1082297297495568384,EG,هي دي مصر الي نعرفها مين فيهم مسيحيه ومين مسلمه ولكن الاتنين اكيد مصريين 
1082328877945536384,EG, صح انا شفت الزياره من اولها ماضحكش ولا اتكلم باريحيه الا بعد استقبال الناس له في الكنيسه ومش مسيحيين بس لانه كان موجود مسلمين حاضرين وبكميه كبيره  شيوخ ومحجبات حب الناس نعمه من ربنا
1082354394665046016,EG,امبارح بتفرج علي افتتاح المسجد والكنيسه عند الجزء بتاع اذان العشاء فبنتي بتقول لمامتها بابا بيتفرج علي قداس المسلمين
1082416863827685376,EG," مش عايزين تبقوا زي كندا واوربا وامريكا جربوا بقي حاجه من ريحتهم
لما تكون جوه البيت درجه الحراره وتروح فاتح الباب ومطسوس في وشك درجه حراره 
تبقي دي بسطره ولا مش بسطره يادكتور"
1082701016104095616,EG, انت هاتحقق ل امنه بحلم بها من زمان انهم عملوا فلم وف نهاتهلموا ل الممثلن وقع علهم سقف البت ولهم موتوا ونزل تتر النهاه
1082705880028758016,EG, رههم للسس خلاهم تنازلوا عن مبادهم  وخافوا عل ال انوا بفروهم وستحلوا دمهم سابقا
1082770540778143616,EG," كل سنه وانت طيبه
 الواحد عمل ربع ده ومش قادرين نخلصه وقاعد في التلاجه المعده لسه مزيته تاخد وقت لما تحول للفطاري"
1082772027570864000,EG," سجلي الفكره علشان تحتفظي بحقوقها
انا في الثمانيات ايام فوازير رمضان نيلي كان يوم النتيجه تطلع المذيعه  وتجيب حجره مليانه جوابات وتقولك استقبلنا  مليون جواب بالحلول ففكرت وقلت طب ليه مايعملوش استماره بجنيه للحلول ويبقوا لموا  مليون لسداد ديون مصر تاني سنه لقيتهم عاملينها"
1082772208244715648,EG,انا في الثمانيات ايام فوازير رمضان نيلي كان يوم النتيجه تطلع المذيعه  وتجيب حجره مليانه جوابات وتقولك استقبلنا  مليون جواب بالحلول ففكرت وقلت طب ليه مايعملوش استماره بجنيه للحلول ويبقوا لموا  مليون لسداد ديون مصر تاني سنه لقيتهم عاملينها وبقيت تتباع مع الجرائد اليوميه
1082775166084616192,EG, دي كانت نكته من زمان وخدوها تقريبا وعملوها مشهد تمثيلي
1082776853226639360,EG," عيني في عينك كده
الواحد المعده عنده باظت لسه ماتعودتش علي الفطاري"
