id,dialect,text
1148373413301555200,EG, وانت كنت معهم وشفت بعينك يا اهبل يا إبن الهبله وسمعت بودانك اللى هياكلها الدود
1148374338183323648,EG, بس يا ابو كرش
1148376985200201600,EG,  انا مش مختلف ان البنت ترقص بس يتعمل لها فيديو وهتشوفى اللى هيتكتب عن ابوها
1148518982045052800,EG,  بلاش تحسديه وادعى للى عندك ربنا ينفخ فى صرته
1148927994859311232,EG,  ليه كده هى السرقه مش حرام ولا انتى وهدى ناوين تقسمو مع بعض وللعلم هدى دى بنتى
1148932214702465024,EG,  مسائك فل ودايما منوره تويتر والبلد
1148963578663358464,EG, االعربيه دى بتضرب التجار فى مقتل وبيحاولو يشترو الكميه اللى معه بنفس السعر اللى بيبيع به عشان يخلص عمل ايه اتصل بصحابه يبعتو عربياتهم لنفس المكان وهو باع للتجار ومشى بعد ربع ساعه كان فيهعربيات فى المكان وهو راح جاب بضاعته ورجع تانى اتحرشو به الشرطه جت حرستهم لغاية ما خلصو
1148965054957707264,EG,  محدش بيقول على برازه كخ والناس دى ما بتشمش
1148965822192377984,EG, ههههه دى المكحله اللى بيتحط فيها الكحل بتاع الستات العظماء زى امى وأمك
1148966550348664832,EG, إذا كانت ارجع يامرسي هترجعه يبقى ارحل يا سيسى هترحله طظ فيكو شوية انجاس
1148995665265135616,EG, عشان كده تستحق منى بلوك لأن واضح ان الرابط معفن زيك
1149007308913094784,EG,  بس حظه ان الكوبرا عمياء وإلا كان الوضع تغير تماما
1149008722552901632,EG,  الواد نادر ده واد شرموط حاولت اعرف منه اللينك فيه مش رضى يقول لى بلكته وريحت دماغى
1149010068597366784,EG,  تفى انتى عليه هيخف على طول الرياله دى بلسم والرياله مرات الريال وكله بلسم
1149060515639042048,EG, خلاص يوم المباراه الغدا عندك
1149062404195704832,EG,  دى حاجات عندنا فى الريف المصرى وبتجيب نتيجه مثلا واخد دماغه مفتوحه بيقفلو الجرح بالبن بتاع القهوه واحد بينزف من مناخيره يحطو له ميه بملح فى مناخيره وفيه كتير من ده
1149106987680063616,EG, هتتحسدى وهتتجوزى غصب عنك
1149107788506960000,EG, هيسيبو منه الرخصه هو ومراته عشان ماشيين عكس السير ربنا ينتقم منهم
1149368329590780032,EG, انتى بتنبشى فى الماضى ليه
1149407241331564416,EG,  فيه ناس مريضه بمرض اسمه الترشيح لو مرشحش نفسه فى اى شئ يموت
1149409303582978048,EG, وانت مال امك هو انت مصرى عاجبنا كده لأنك قليل الفهم خالى الذهن ومتلحم ومش فاهم حاجه افهمك انا عشان تبطل حك فى البمبه التجنيد بيختار الأصحاء الأقوياء للتشكيلات القتاليه واللى كان مفروض يطلع لعدم اللياقه بيتم تصنيفهم حسب المهن ويوزعو على افرع الجيش المنتجه حتى يكون عبء على الدوله
1149433439072018432,EG, انتى عارفه عنى كده انا لو عاوز اثبتك ها أقول لك اثبت محلك
1149455662100951040,EG, بلاش الفتله خليها بالملقاط
1149665445743489024,EG, وحاجات كتير تلاقيه هربان من البيت يا عند امه ودى صلة رحم يا فى المسجد ودى شدة ايمان يانايم ونوم الظالم عباده النكد له فوائد كتير
1149665903874695168,EG,  رزق الهبل ع المجانين
1149754226249256960,EG,  دم حوار بين ترامب وتميم بيطمن على موزه
1149757050236391424,EG, مادام قلتى متهيألى تبقى مش متأكده ونصيحه احترسى من الشاب اللى لسانه بينقط سكر وخاصه اذا كان لايملك سوا الكلام
1149780994687491968,EG, هتعملى ايه بكتر العدد
1149784311253655552,EG, والله ياهبه كتر العدد دوشه ومحدش بيتفاعل معك الا القليل
1149786389938147200,EG, العيار اللى مش بيصيب بيدوش
1149787609591402368,EG, انتى هنا بتتعاملى مع ناس متعرفهمش منهم شاب وعامل بنت وعجوز متصابى وست شمال وشاب منحرف ولسانه بينقط سكر المشاكل هنا كتيره وال  مفسده
1149864984660402176,EG, ملعون ابوك على ابو سيد قطب ياعالم نجسه
1149874443273080832,EG,  دول ولاد كلب مش بيمشو غير بالضرب بالجزمه
1149875539668156416,EG, وحياة دقنك اللى مالهاش لازمه طيب مش بتنفذ ليه
1149877793230077952,EG, مصيبه من مصايب المجلس
1149878412644953984,EG, طيب قولى ان شاء الله بدل ماتعنسى
1150005907360821248,EG, أفيد من فريق ابو ريده
1150447172866989952,EG, هههههههههههههههه وهتلاقى الأوائل فى قطر مصريين وفى معظم دول الخليج ربنا وزعها هما ياخدو الفلوس واحنا ناخد العلم
1150447368036392960,EG,  مين ده الف مبروك
1150448227856125952,EG,  برضو الف مبروك وتهنئه للشاحن
1150464085626167168,EG, البقر دول ايه فهمهم فى تطوير التعليم اللى كله فساد اذكر لما كنت مدرس مواد تجاريه كنت ملاحظ فى لجنه من لجان الدبلوم وكان الغش بالنسبه لى ممنوع نهائيا تحت اي ظروف والطلبه ماحيه بطبعهم اللجنه اللى كنت الاحظ عليها تقريبا كلها تروح للمفتى الأهالي اشتكونى دخلت الكنترول وارتحت وريحت
1120097010080735232,EG,  لا علاقه بالدوله بهذا التصرف مستقبل مصر بيعملها كل سنه قبل رمضان والكرتونه ب  جنيه وليس من اجل الإستفتاء وأهل الكرم هما اللى بيدفعو تمنها وانا واحد منهم شارى  كرتونه وكل عام بتتوزع فى نفس هذا التوقيت المره دى كان مفروض تتأخر شويه لكن الناس كانت بتروح المقر تسأل عنها
1120100848951025664,EG,  مفروض لو كان التصرف خطأ يكون اللى خد البون غلطان لأنه بيبيع صوته وهو عارف انه بيبيعه اما المشترى انا متأكد انه لم يقصد دفع رشاوى للناخبين لأنى قريب منهم والله شباب يشرح القلب طيب ما هما ودعى بطاطين على الناس في بدايه الشتا وفى العيد الكبير بيدبحو وبيوزعو لحمه اشمعنى مسكو فى دى
1120101889771737216,EG,  من الآخر فيه ناس بتكره مصر وبتكره السيسى وبتكره اى حد بيساعد البلد ودول مهما أقنعتهم بأن وجود السيسى ضمان لإستمرار تقدم مصر عمرهم ما هيقنعو
1120103013073469440,EG,  يا اخى الكراتين دى بتتوزع كل سنه في شهر شعبان وليس لها علاقه بأى احداث طيب ماهما بيوزعو من اول شعبان وهيوزعو باقى شعبان وفى رمضان البلد فيها ناس غلابه كتير وكيس مكرونه ب جنيه يفرق معهم
1120103612435324800,EG,  الظاهره دى واضحه فى القرى بيستنو الكرتونه كل سنه في الميعاد ولما مش بتوصل لهم هما بيروحو المقر يطلبوها
1131909853973241984,EG, يارب وازور ليبيا قبل ما اموت عندى امل انه هيكون قريب
1136274418341163008,EG, اسرقينى كل عام وانتى بخير 
1139647850873274368,EG, والله كان طعمها فل عمايل ايديا وحياة عنيا ولا الحوجه لحد 
1141074508897542016,EG, ياعم للموت حرمته وإحنا احترمنا موت ابوك مع كل المصايب اللى عملها فينا انت بتجر شكلنا ولا ايه احنا ناس كبار ومحترمين اذا كان ابوك مظلوم فوض أمره لله وإذا كان جاسوس وعميل واستبن اهو ربنا خده وريحنا اتلم يا ابنى سيسى مين اللى ركبه بتخبط ده ده رئيس مصر يا أهطل
1141079645053497216,EG, ربنا يكرمك بموته زي موته ده انتو ناس مواشي شهيد مين محمد مرسي اللى عمل فينا كل الكهن والموحن خلال حكمه السنه السودا اللى ربنا ابتلانا بشويه خرفان كانو هيضيعو مصر لولا السيسى والشعب
1141080005994328064,EG, قول له انت خروف
1141080801905430400,EG, يا راجل بقى مورسي كان كده ياراجل اتقى الله وقوم اغسل وشك وفوق ده إنت خروف فعلا
1141080965860794368,EG, يعيطو عليك ساعه وينفضو يا بهيم
1141081259470479360,EG, ماهو اندفن جمب اخواته في مقابر المرشدين اللى محدش بيقرب منها
1141081577906216960,EG, طيب واللى عامل يعمل تانى ازاى
1141083050509557760,EG, عندك حق مورسى شهيد دقنه
1141270899787751424,EG, بيان جامد وكلها أسبوع وهينسو مرسى ولا حد هيتفتكره
1141451758209785984,EG, بو جاسم خروف زيه زى مرسي حتى مش عارف يكتب اما عن مرسى والخرفان فمعروف انهم بتوع نسوان دنيا وآخره
1141705231996248064,EG, هو كل ما ينقح عليكى هتخرفى يا أم ايمن لو وحشك للدرجه دى حصليه قبل الحور العين ما تخلص عليه
1141792883915272192,EG, دعائك مردود عليكى ان شاء الله يانعجه عمل لك ايه السيسى عشان تدعى عليه ربنا يحميك يا سيسى وتكبدهم اكتر واكتر
1141797117570310016,EG, ياعم سيبك منه ده خول ولا له قيمه عاوز يولع الدنيا
1141808176964222976,EG,الواد القطرى اللى كان بيشتم في مصر والمصريين نشيته بلاغ جاب اجله 
1142517977344073600,EG,الحمد لله صديق لى كنت مديه اللاب توب ينزل عليه نسخة ويندوز جاب اللاب بعد صلاة المغرب عشان يعرف البرنتر عليه حكيت له المشكله ماخدش  دقايق كان مرجعه اللى سرقه غير الأيميل شال منه رقم وبعد كده غير الباسوورد بس نسي يغير رقم الموبايل والحمد لله
1142523388407230464,EG, ما انتو ناس مابتشوفوش ده ماكيت والناس شايلاه يا خيبتك تيجى في الفارغه وتتصدر
1142524763161673600,EG, طيب ليه ماحضرش الإفتتاح هتقولى ممنوع من دخول مصر ومسجل على قوائم ترقب الوصول ها أقول لك طيب ليه مسجل مش هتعرفى تجاوبى معقول هتعرفى اكتر من صقور مصر السهرانين على حمايتها ابو تريكه مهما كان مش اعز من مصر وتحدى إرادة الشعب عيب وسينتصر الشعب
1142525096067813376,EG, اللى فى الإستاد أضعاف مضاعفه لتعداد سكان قطر
1142526399334539264,EG, ههههههههههه زمانه عملها هلى روحه هى الناس دى ما بتحسش ازاى فاهم ان موضوع يخص السيسى هيعدى كده ايه الغباء ده اهو ضاع فى الوبا
1142531317554397184,EG,  اى خدمه وبلاش شيل الهدوم
1142532015192977408,EG, طيب لو مصر طلبت عنيك والمرشد طلب عنيك هتديهم لمين زنقتك فى خانة اليك يا ابو تريكه
1142532282445643776,EG, وهنستنى منك تقول ايه غير كده وجهان لعمله واخده انت وهو
1142546798990516224,EG,  هما  واحد بأرقام الكراسي ومعروف بياناتهم الشخصيه لأن نظام تذكرتى بالرقم القومى واتعمل معهم اعلى واجب
1142574383174770816,EG,   كل حماس تحت البياده
1142703114962833408,EG,امبارح كنت ب احور على بنت دى ام وافهمها انى صغير فى السن ونسيت انى حاطط صورتى وهى تاخدنى على اد عقلى وماشيه مع الكذب بتاعى وفى الآخر طلعت ننجا فاهمه انى ب اكذب عليها وبأحكى لها قصص من الخيال وفى الآخر صدمتنى وقالت لى تصبح على خير يا جدو تسلمى يا ملاك ذكائك غير عادى وضد الشقط
1142704104646557568,EG, الست ام اسماعيل والحاجه آمنه عرفو من الفيسبوك لما ابنى كتب ادعو لبابا فإنه محتاج دعواتكم ونقلو البوست ع تويتر وناس كتير اتصلت على للإطمنان بس ماكنتش با ارد لأنى كنت فى العنايه المركزه  يوم والحمد لله ازمه وعدت شكرا يا حاج فتحى
1142708319599177600,EG, ياعبد الله بلاش استفزاز لمشاعر الناس بالكلام النص كم ده ابوك شهيد بأمارة ايه هو ممكن يكون شهيد بطنه واكل البط طلع على نافوخه اهدى يابنى المشرحه مش ناقصه قتلى
1142710983934337024,EG,  اتاريها محروقه اوى اوى
1142981165231562752,EG, منوره بس عجبتينى ذكائك حاد وخارق انا فخور انى اتعرفت عليكى دماغك توزن بلد صباح الورد
1142982160837685248,EG,  الله يخرب بيوت الخرفان
1143138562357026816,EG,"إزاي تكون مواطن خروف

  حب كل الدول اللي بتعادي بلدك
  تكتب على مواقع التواصل إن البلد بتنهار 
  قلل من قيمة أي إنجاز مهما كان عظيم
  ممنوع تشتغل وتكون منتج لازم تكون مستهلك بس
  دايما تقول مش لاقيين ناكل ورايح يشتري سلاح

حضرتك كدة وصلت  حمد الله على السلامة"
1143143622721908736,EG, يا افوكاتو اللى يتجوز امى اقول له يا عمى خليكى فى حالك احسن
1143184163660599168,EG,  ميجا وبياخد فيتامينات ومحدش بيستخدمه غيرى
1143220841653723136,EG, ايوه انا اللى بأحقنه بنفسي
1143489746238431232,EG, وخاصة لو كنتى واقفه فى ميكروباص والكل رافع ايده
1143631188680237056,EG, الف سلامه وان شاء الله تكونى موجوده بكره بالليل
1143631676855206016,EG, يارب انصر مصر فى كل المجالات ووفقنا بكره
1143633067929669632,EG,  طول عمره عميل وخاين
1143633270241972224,EG, مريام لحمها طعمه حلو
1143634202602221568,EG, اتلم يا إبن إلماما المشرحه مش ناقصه محرضين وأوعى تفتكر انك هتحرض وهتعدى
1143635634311114752,EG, أنت عبيط يا جزمه السليم مش بيخاف من حاجه ده هيخلى الإرهابيين اخواتى يقعو فى المصيده
1143635769116045184,EG, انا عملت له بلوك وريحت دماغى
1143636183932690432,EG, ده آخره يقف قدام حمام شعبى وماسك علبة مناديل يا ولاد الكلب
1143643021554200576,EG, الحقو حساب احلام قبل مايضيع
1143643362123272192,EG, انسو هوجة مرسى اللى بيحاسب بعد ربنا السيسى
1143644056653913984,EG, اما لسه شايف التويته الآن
1143709158723727360,EG,                   ولا كل من لبس العمامه يزينها ولا كل من ركب الحصان خيال تعيش وتاخد غيرها يابغل
1143713034491351040,EG, ربنا يهدى شيطانك بتجيبى الكلام ده منين ده انتى ولا أجدع خبيرة علاقات زوجيه
1143714041514397568,EG, ملعون ابوك خنزير جيفه
1144295772739055616,EG, هو ده حد عمره هينساه ده زيه زى اردوغان لما ركب الحصان
1144315164306677760,EG, المنصوره كلها الغام تبع الإخوان واى حد ممكن يلزق اى صوره على حسابه وهل انت متأكد ان دى صورتى
1144317477507280768,EG, دى دردشه يا احمد وعاوز اقول لك لاتثق فى حد ولا كلام من الميديا سلى نفسك بس وهتاخد فولو ولا تزعل يا صديقى
1144376369398341632,EG, دى مثاليه ع الآخر هو لازم تكون لابسه نقاب يعنى بتطلع زكاة جسمها عاوزه مثاليه اكتر من كده ايه ماهو الميزان اتقلب
1144376715382333440,EG, اهو تم ياخرم ومات فطيس كمان
1144378886148546560,EG, الله يخرب بيوتكو انتو بتفسرو كل حاجه هلى مزاجكو
1144379660056301568,EG, لما امك تتقلب دكر وأبوك ينهق يبقى ده هيحصل
1144578298451812352,EG, انتو قناه زباله واللى يتصل بيكو زباله زيكو
1144583275677147136,EG, انا هااقول لكم اعمل حساب على اى موقع تواصل وحط صورة واحد وقور ووظيفه محترمه زى استاذ جامعه او وزير وأتكلم عن عائلتك ومراكزهم الإجتماعيه هتلاقى شراميط العالم كله بتراسلك وتجرك فى الكلام الجنسى جاريهم بعد شويه هتلاقى كل اللى انت قلته اتعمل فيديو واتبعت لك مع رسالة ابتزاز يا تدفع يا
1144726480372621184,EG, العالم دى مخها تعبان طلعو كل الخرفان من أهل الجنه ومن آل البيت
1144726989414252416,EG, كبير يا ابو مكه
1145025198950891648,EG, وهو انا ورايا غيرك أحسده اخبار مازن وماما ايه
1145047755209007232,EG, دى معرصه مش مدرعه
1145049122950582400,EG, ايه الهبر دى يا ايمان
1145051181217190016,EG, يارب ولا تنسى رب ضارة نافعه ربنا يوفق ابنك السنه اللى جاى
1145053405997674368,EG, بتجيب حساسيه خللى بالك
1145053916087890048,EG, انا ما اعرفش اسمه ولا هو فى سنه كام لكن سنه من سنه قريبه وممكن يجيب مجموع اكبر مستقبلا
1145055188274860032,EG, وده طبعا كايدك وحارقك لأنك ملكش قيمه ولا تأثير
1145060359667105792,EG, نفس إصابة احمد فتحى طيب من كان سبب إصابة احمد فتحى كل حاجه عاوزين يلزقوها للأهلى
1145067922085372032,EG, وأنا فاكر انى عملت لك فولو وانتى مطنشه
1145069608828899200,EG, لو ورده مش شخصيه معروفه شخص عادى زينا وعمل اللى عمله والبنت شهرت به لإبتزازه كان مين هيلتفت للموضوع الغرض من السؤال ان البنت دى مختاره شخصيه مؤثره ومعروفه لإبتزازه ولما رفض شهرت به انا لا أدافع عن ورده ولكنى اوضح ان الغرض منتخب مصر وورده اكيد غلطان هو اللى حط نفسه فى الموقف ده
1145070554820554752,EG,  ربنا يشفيك يا جنش
1145347666823602176,EG, يازينب يا اوخشى انتى شكلك من خرفان الشرعيه وحقك بالقانون والمساواه بين الكل وعيش وحريه وعداله بلاش يامحترمه عشان انتى ست تجيبى لنفسك الكلام هى بلدنا وعاجبانا كده اما انتى واللى زيك لهم أماكن تانيه هتلاقي فيها اللى انتى عاوزاه يامودام مايزيد البنزين عندك عربيه بلاش تلفى كتير هتوفر
1145348011121369216,EG,  طنطك بتاكل رز بلبن بالليل روحى صفحتها هتلاقيها هتندبح في عيد الضحيه وهو بتقول ماااااااء
1145348300138274816,EG, احمدى ربنا غيرك بيتمنى ضفر بنت وتاخد عنيه
1145348610105708416,EG, مساء الخير يا عم علاء بلاش تتفذلك وحياة ابوك
1145348939853574016,EG,   مفيش حد زيك انت ياقمر
1145349292468637568,EG, بس يا حرامى الغسيل يالص هتتفذلك فيها وتعمل محلل سياسى انت آخرك محلل لنسوان رابعه
1145361343190577152,EG, الحساب ده بيسخر من قطر ياعماد زور صفحته هتعجبك
1145407245494231040,EG,  ولا ناكر ده ولا ده بس مفيش تقدم من غير ضريبه ولازم الشعب كله يشارك لغاية ماتقف مصر على رجليها بأولادها المخلصين اللى مش زيك طبعا انتى خساره فيكى تشمى هوا مصر ياناكره للجميل ياللى همك على كرشك يا ام كرش زى كرش محمد مرسي ملك البط ومن ناحيه سفرك غورى بلاش توجعى دماغى
1145420941444485248,EG, اول مره تقول كلام يعجبنى
1145421206365097984,EG, كل عام وانت بخير يافنان
1145422161076785152,EG, ولا عمرك هتكبرى هو انتى بتشيلى هم البركه فى الحاجه الكبيره وانتى عليكى تدلعى نفسك بس
1145784410257723392,EG, انتى بتجيبى الدعاوى دى منين ياسحر هههههههههه اول مره اسمعها
1146421369879650432,EG,الجدع جدع ولو حظه علي قده وأبن الاصول بيتعرف حتي لو الزمن هده  حتي وانتا قاعد ولا بتهش ولا بتنش هتلاقي ناس بتحسدك علي عدم هششانك و نششانك  وعجبي مسائكم ورد
1146634210205208576,EG,نجم خلوق وطنى معشوق الجماهير ابيتم ام رضيتم فهو محل احترام العالم ادعممحمدصلاح
1146716245347262464,EG, جالها هطل من كتر الرجاله اللى بتكلمهم
1146799103172644864,EG, كفايه الحراره اللى فى خرمك ياجمال عيد اصلك ما عندكش احساس
1146828662618173440,EG, يعنى يقطعو أرزاقهم عشان حته ارض تراب معفن دول ولاد كلب عايشين على خراب العرب بس
1146833305851092992,EG, كل عام وانتى طيبه وبخير
1146838578628050944,EG,  مين قال ان البنزين زاد انا فولت العربيه امبارح  بالسعر القديم بدون زياده هو لسه هيزيد خلال شهر يوليو
1146907591680937984,EG, آه لسان المزمار عارفه
1146908356071841792,EG, امال هيخدمها امتى يا معرص
1036390304809713664,EG, تقولي لمين الطماعين كتير
1040030031920222208,EG,الإحتواء ياجماعة كلمة ليها معنى كبير مش أي راجل قدها
1040032041784561664,EG,وييجي لك شخص لزج وتافه مالوش أي تلاتين لزمة يديك نصيحة دينية ده أرخم شئ يومي ممكن تشوفه
1040034161095073792,EG, بنسمع ونفوت بس دووول ناس كتييير
1040358145841922048,EG, هو إفتكرني عشان ينساني 
1040360263206285184,EG,  صرنا صلح  وائل كفوري       
1041845027327143936,EG, أو متحطش في دماغك عيش حياتك
1045786320927412224,EG,مهرجان الجونة السينمائي حاجة مشرفة وحلوة وسط قبح وتلوث بصري عايشين فيه
1045798560430739584,EG, ألف مبروك ياباسم ربنا يسعدك
1045974836063993984,EG, ممكن طبعآ أودامك شهر كمان
1046549701787627648,EG, قصدك إتعرف وشكله بقى وحش أوي
1046885777840517248,EG, أه ديه حقيقة مش معنى إني أهلاوية إني أنكرها 
1046886280666263552,EG, مش كلنا في مصريين محترمين
1046887877530046464,EG, صاحب الوست رجل محترم
1046917051120537600,EG,دايمآ فكرتي عن الناس بتطلع صح مهما عملوا
1047193090484842368,EG, هو الماتش شغال على قناة إيه
1050196666450681984,EG,المية جنية بقيت بتجيب علبتين سجاير ياأمي
1050200180698558464,EG, لغاية دلوقتي محدش عارف
1050201422086713216,EG, كمالة المية جنيه أسفة نسيت
1053066787133317248,EG, وآه من الصبر وآه
1053413504823242752,EG,طيب فين الجثة ياهبل
1053773330849951616,EG,"لما أسيب حقي شوية ده لإني هاخده وبالفوائد
العقرب"
1054496359334715392,EG,المفروض يدوا الجنسية السعودي لعمرو أديب
