id,dialect,text
1082779161096269824,EG, بيقولك واحد راح اوروبا ونزل ضيف عند عائله الصبح بنت العائله سالته تحب تفطر لوحدك ولا تفطر مع بابي قالها لا بحب افطر لوحدي جه الغداء تتغدي لوحدك ولا تتغدي مع بابي قالها لا لوحدي داخل ياخد حمام تحب تستحمي لوحدك ولا مع بابي قالها ايه قله الادب دي لوحدي طبعا
1082779224019214336,EG, دخل ينام تنام لوحدك ولا مع بابي قالها مابحبش  انام مع حد وايه كل حاجه مع بابي مع بابي هو ابوكي ده مابيتكسفش دخل اوضته وتقالها تصبحي علي خير بس نسيت اسالك انت اسمك ايه قالته بابي
1082795144489943040,EG, زي الي  راح يصطاد سمك ماصطادش بسريايه وهو مروح عدي علي بتاع السمك قاله اوزن لي  كيلو وحطوهم في المشنه وروح البيت بيقول لهم انا اصطدت السمك ده فتحوا المشنه لقوه  سمك مشوي
1083142909573107584,EG, خدتي بالك وهو بيقول والدي مشيل باخوم وعمي محرم الجمله دي وقفت عندها لحظات وافتكرت ان اكبر شركه استشارات هندسيه كان شركه باخوم ومحرم
1083194880250261632,EG, الحقيقه وهما واقفين علي باب الكاتدرائيه وعلشان الجو كان برد جدا شيخ الازهر كان لابس الكوفيه ولكن لما وصل الرئيس وبدا الاحتفال خلعها ركبوا الصوره من كده والكوفيه مش عيب والراجل صعيدي واغلب الصعايده بيلبسوه
1083347209167482752,EG,  حقق حدث من سنوات طوال جاره لنا جوزها تعب لفت به عل جمع الاساتذه ولم شخصوا حالته بدقه اشار علها بعض الجران الذهاب لدتور صغر فاتح عاده شعبه ف المنطقه عرف التشخص الصح ودواء رخص والراجل بق ز الفل
1083359599070232576,EG, بصراحه ده ال حصل اللحمه دخلت التلاجه والواحد رجع للال الخفف المعده عندنا بتاخد وقت لحد ماتتعود
1083754329545367552,EG,هو وصل الحال ان ال بستحم ف الجو ده بعمل توته انه استحم
1083780813664256000,EG, ماء بدون ا املاح او لور
1083790233903222784,EG, طبعا فه ناس بتبع باسبورها وتقول انه ضاع
1083794999366557568,EG, اهه ببعوه للمزورن زوره ودخلوا به حد  ده اتر السرقات ف الخارج سرقه الباسبورات
1083889498419798016,EG," عادي هنا لازم يكون ليها بوي فريند
عندنا واحده في الشغل  سنه فركشت مع البوي فرند وبتدور علي بوي فرند جديد في الخمسينات"
1083890223405301760,EG," بحكي مع زملائي في الشغل  بيسالوني بنتك عايشه معاك ولا لوحدها قلت طبعا معايا احنا ماعندناش بنت تطلع من بيت ابوها الا لما تتجوز
قالولي طب لو ماتجوزتش قلت تقعد لحد ماتموت في بيت ابوها وترث معاشه كمان كان هايغمي عليهم من الدهشه"
1083895160356982784,EG," خد منه بقرش وغمز 
واخدلي بالك"
1083902659759952000,EG," اول مره اعرف
ده اكيد ده طشت ام وجدي"
1083903366445584384,EG," اعظم شئ ورضا ربنا عني ان ربنا ياخدني وانا واقف علي رجلي
ولا يجعلي ثقيل علي احد"
1083904055439736832,EG,"  متعود لما اجي اخش غرفه في الشغل بابها مقفول بخبط قبل مافتح واخش 
زملائي بيستغربوا انت بتخبط ليه
عايز اقول لهم لاحسن حد يكون خالع راسه ولا حاجه بس بالانجليزي"
1073388080894238848,EG, ممكن اقول احسن منك في الكلام ده للصبح ولكن الغير محترم لايرد عليه يامتطرف يارهابي
1073391961560756224,EG," بقولك مش طبعي رد الشتيمه بالشتيمه للدفاع  
ويقال من فضله القلب يتكلم اللسان
انا كاتب رائ مش عاجبك بكل احترام ترد او كانك لم تراه تشتم هو ده ردي تعبتك قوي متطرف وارهابي ورد مايتعبش  مش مهم"
1073392512973324416,EG," علشان انا متعود هنا من ده كتير بس مش مهم 
ماقصدك ب  يا ناكر الجميل  مش فاهم فهمني اي جميل  تتحدث"
1073393660291661824,EG," مش عاجبك في ايه المحافظ المدني مش عارف يسيطر عليها وكل يوم عنده مشكله 
بس قولي والنبي  ايه هو  الجميل الي بتقول عليه يا ناكر الجميل"
1073394954528002048,EG, والحاكم العسكري من كولارامبور مامن الجيش المصري بس هايدير المحافظه بالضبط والربط  اسمها استشهد  واحد في عمليه ارهابيه في جامع ولكن الحياه اليوميه محتاجه ضبط وربط يبقي محتاجه حد ليه في الضبط والربط
1073395729090125824,EG, بس انت توقعت انك اول ماتشتم مش هارد عليك ولكن العكس الي يشتم يبقي حجته انتهت فلازم تكمل معاه لحد تفهمه وجهه نظرك يبقي النقاش بالشتيمه وانا كنت ممكن اقولك  من الي قلته بس انا مؤدب  يامؤدب  كفايه كده
1073662110578691968,EG," ماهو البضه ولا الفرخه ان وقف خدمه بسلاح وقتل به حد نقول له معاهم سلاح لو وقف من غر سلاحوحدث عمل ارهاب نقول فادته اه من غر سلاح بصراحه جب ان الداخله تنتق الخدمات عل الناس
ولو مش واقف خدمه وحصل بنهم المشله ان هاحصل برضه ال حصل"
1073662768920825984,EG, ماعرفش اامنا نت تطلب طبق فول واطباق المخلل قدام والعش قدام تال ز مانت عاز بس ف ظل ظروف الغلاء المعامله بقت ازا
1073716193670897664,EG, انا في الخارج وماسمعتش عنها ولو فيه مش هاخرج الي في الخارج ومتحمس لاهله بالداخل يرجع يقعد في وسطهم مايقعدش بره وينظم لهم حياتهم الناس عايشه وربنا معاهم ومقويهم علي ماهم فيه وكفايه الكنيسه في مصر بها روح وتقوي وصلاه الواحد بيشوفها في القنوات بيغير منها  لانه يجرح ويعصب
1073716342270889984,EG, مين ده الي عايز يخرج
1073721988512931840,EG, ماهو معروف  مجدي خليل مش عارف يشتغل سياسه ولا دين خلاص اقباط مصر رافضين حد يتكلم باسمهم في الخارج وهو مصمم يبقي وصي عليهم ماحدش عطاله توكيل هو و الي زيه
1073740676175679616,EG, الناس في مصر عايشه ومتعزيه وربنا حارسهم والصوره مش قاتمه للدرجه دي فيه مشاكل اهه ولكن مش عامتا احنا بس عايشين بره وكل حاجه بتوصل مكبره لمصالح خاصه
1073755767335997440,EG," اهه اهه اهه    
 وحتي لو هاتبلكني لاابيع مبادي ولا اقول غير الحقيقه "
1073766668256624640,EG," داحنا بندعي لك دعا 
دوق من الي دوقتوه للناس"
1073769044845715584,EG, يناير قرب اهه بيدوروا علي اي مشكله يشعللوا بيها الجو اي مشكله بدوا يناير بتفجير كنيسه القديسين والمحاولات مازالت مستميته لاثاره الراي العام علي الدوله والكنيسه
1073947890974949376,EG, لما محافظ العاصمه ماعرفش دخل المحافظه ال بصرف منه امال بدرها ازا انا ف بت لازم اعرف دخل بت عل اساسه اقدر مصروفاته
1074164310161670016,EG, هو موضوع المنا ده وصل عند مان ل الناس بق اغلبها مناوه
1074166023849426944,EG, ماعندوش ف جرس اصل عندنا هنا ف نوور تر وفجاه النسه لها بقت مناوه
1074406715704164352,EG, هو مال اولي اعدادي تضخموا كده
1074423286099005440,EG,  ولو بنص مليون مش خساره فيه واحنا عاجبنا 
1074424637793206400,EG,"  هو لو عدي جنب اي مدافن مش هايلحق يترحم بنطلونه هايتبل
حدث بجد مره واحد ماشي جنب مقابر الشاطبي بالاسكندريه باليل في الشتاء وهو ماشي لقي واحده واقفه من علي السور بتقوله الساعه كام من الخضه خدها جري من طريق الحريه الي البحر طلعت واحده من الساكنين جوه"
1074426615671721984,EG, بيقول بيشتغل في صيدليه مش صيدلي تفرق كتير
1074438848279646208,EG,  ايام زمان مش قوي يعني في الثمانيات والتسعينيات كنت امش في الشارع في الصيف الاقيها محتله من المصيفين اقول استني الشتاء الاقيها محتله من الطلبه المغتربين وبالذات ترام الرمل اقول ياربي امتي تبقي بتاعتنا وحدنا
1074455748925632384,EG, الي طلع البيان ده ونشره انسان سئ النيه بيحاول يستغل طيبتنا انسان له اهداف تانيه غير غيرته علي الشعب القبطي لانه لو عنده غيره مقدسه مكانش خدع الناس
1074475231211859968,EG,اكتشفت فجاه اني كاتب  تويته مش عارف كتبتهم امتي ده غير التعليق علي تويتات الاخرين التي لاتحسب والايكات علي تويتات
1074476170136219648,EG, يعني هي هاتقوم علي برج العذراء بس
1074476302068006784,EG,  زي السنه الي فاتت
1074476482347585536,EG, انتوا بتعتقدوا في الابراج بجد
1074478288159031168,EG,  معاك ابعت شويه بس قبل بدايه الحرب العالميه
1074692384439632000,EG, محبه اهه اجبار لا
1074838722498232448,EG, هي دي عقليه ومدي تفكير اعضاء البرلمان اذا كان دول الي بيقرروا قوانين البلد اذا ماحال الشعب اللذين يشرعون لهم
1074849498986352640,EG, المحامي بتاعه اذا فيه لعبه قانونيه ومضاه علي عقود  بيع بدون علمه خيانه الامانه
1074858079286689792,EG, كلام كلام  بس لحد مايقع في المصيده  
1074858985092800384,EG, الحمد لله انها جات علي القمصان اصل الملايكه لما بتزودها بتوصل لسكاكين واكياس
1074859898071064576,EG, مش بتاع الدليفري اسمه الطيار علشان بيروح بسرعه بالموتوسيكل اهه برضه المسعف ياخد المريض دليفري بسرعه ويحطه في البوكس الي في جنب الموتوسيكل
1075219364549419008,EG, ايه الحكايه اول ماستوردوه كان اصفر ولما جددوه دهنوه ازرق ولما اعادوا دهانه دهنوه اخضر المره الجايه هايدهنوه احمر
1075220150436225024,EG, اهه عربات الترام دي جابوها لما حبوا يستوردوا من نفس نوعيه العربيات القديمه المفصليه كانوا استودوها سنه  بمبلغ ربع مليون جنيه للوحده ولما طلبوها تاني في التسعينيات قالوا لهم خط الانتاج توقف ممكن نعمل لكم منها الواحده بمليون وكان غالي فقرروا استيراد الوحدات دي
1075220506524163968,EG,   علي فكره بقي شكل وشها بيقول دمها يلطش 
1075222407147872384,EG," مش ده ترام كافيه اصل انا بره مش متابع
اهه الوحدات اول مانزلت سنه  كانت مكيفه وبستائر وميكرفون واتصال بين الكمساري والسائق وصلت الان علي ماسمع حديده ماشيه علي حديد"
1075222685049872384,EG,   امال عايز تعمل ايه
1075226804879798400,EG,   عيني في عينك كده 
1075372577525260416,EG, اهه ا حاجه متوبه ممن تال معاه وال هو واتباعه عملوه ف الاقباط ان اه شا بحلب
1075568201566748800,EG, طب هافتح معاك موضوع بتكلم فيه كتير مع نفسي انا سايب مصر من  سنه كنت مهندس كان مرتبي بالحوافز  جنيه وكنت بشتغل عمل حر بعمل فيه  جنيه دخلي كان  كنت فاتح بيهم بيت وكان عندي عربيه صغيره لما باقراء المرتبات الان والمصاريف بصعق
1075568907606466560,EG," بيقولك ماهي البركه
انك يعدي عليك الشهر بدون مرض احد من افراد الاسره
بدون ماتلاجه تبوظ ولاتحتاج سباك
ولاتحتاج  تصلح العربيه ولا لوح زجاج الشباك يتكسر
كده تعرف ان ربنا مبارك لك في دخلك"
1075571881414197248,EG," خايف انزل مصر ماعرفش اتعامل بالجنيه
لما نزلت سنه عطيت واحد بقشيش ربع جنيه الي كان في جيبي كنت هاضرب رحت القهوه عطيت الجرسون بقشيش  جنيه صاحبي كان هايضربني"
1075582712541536384,EG,  كان زمااااااان هو الكلام ده لسه بيحصل عندكم
1076143486703931392,EG, مش ا حد لان الجل ده قلل ال بقعد منهم عل التوتر
1076164170448539648,EG," قدمه ف هاقولها
راجل وابنه واحفاده الاتنن الابن حشاش وبلعب قمار الاحفاد وقفن صلوا فالراجل بقول لابنه ابن مش تتسف عل دم انت  حشاش وولاد بصلوا قاله علشان تعرف فرق تربت من تربت"
1076164987687706624,EG, ان سابهم له من الاول والحومه عنده اخوانه  ده رد فعل لامتصاص الغضب العالم
1076275219948626048,EG, انا عن نفسي بخش المحل فيه اكتر من نوع عدس من كذا بلد اول مايجي التركي قدامي بسيبه واخد اي نوع تاني
1076584971165417600,EG, احنا بقا عندنا تخشي محلات يقولك اكل حلال يعني الي احنا بناكله مش حلال
1076613680056451200,EG," لما تعجبني والاقي فيها حاجه ممكن تفيد غيري او خبر يهم ان الناس تعرفه بعمل ريتويت
لكن لما اشوف تويته عاديه من صديق بعمل لايك يعني شفتها"
1076614278331932800,EG, اقسم بالله حصلت الاسبوع ده زميله سوسته بنطلونها مفتوحه واحده زميله خدت بالها قالت لها قدام الجميع اقفلي السوسته عادي بس دول مش عرب دول جنسيات تانيه
1076624274390175616,EG, اتعودت علي كده ومش كل تويته في الصفحه بعملها لايك تويته عجبتني ولكن لاتحتاج الي شير
1076914843293310976,EG, والرجاله علي فكره مابتحبش الستات اليمابتحبش الرجاله الي مابتحبش عصير الجوافه  
1077343897263763584,EG, علي فكره مش كل المغتربين فيه ناس عايشه كانها في مصر والي بيقلدوا تقليد اعمي دول  الي بيقال عليهم كانوا في جره وطلعوا لبره
1077347413063593984,EG,  سؤال بس علشان انا بره ومش متابع وخايف لما انزل اتصدم اخر سعر حضرته للرغيف الشامي المدور عند محمد احمد مثلا  قرش وصل كام دلوقتي
1077420033553432576,EG,"سيكرت سانتا السنه دي حطوا الهدايا مغلفه واعطوا كل واحد رقم ويختار هديه ويفتحها
انا اخترت اصغر هديه طلعت فلوس
زميل طلع طقم  داخلي حريمي
زميله طلع لها علبه واقي
واحد طلع له لفه ورق تواليت
دول اغرب هدايا جات السنه دي"
1077553869364908032,EG,"  انت شيك بس في لبسك
اللبس  اللبس 
ومن له اذنان للسمع فليسمع
والكلام ليكي ياجاره"
1077614028850192384,EG, واحد بيقول بشوف حفله الكريسماس وبيهني العالم  ايه الحرام في كده مش كفايه بقي تخلف وعقد وحقد علي باقي البشر طالما عندك موبايل تشتم منه مخاليق ربنا يبقي علي الاقل عندك مايكفيك ويزيد لشحن الموبايل كفايه عقد بقي كل سنه وانت طيب ومصر والعالم اجمع بخير
1077614568292171776,EG, مين بقي فاروق العامري
1077615294875684864,EG, عامل زي القرع بيمد لبره
1077623908734550016,EG, ياواد  امال بتطفوا النور لييييييييييييه
1077624909432532992,EG," حقيقي 
بحث صغير علي جوجل
دي صديقته بعد ماخلف كل العيال دي قرر يتزوجها قانوني"
1077625608165884032,EG," ياعم عارف بنكشك 
اصل كتير معتقدين اننا بنروح الكنيسه علشان نبوس ونحب ونتحب كانه مافيش حاجه اسمها كافيه ولا رستروان نعمل فيه كده ومالقيناش غير الكنيسه"
1077666706343034752,EG,  دي ليست ثقافه ولكن مخالفه للدين والقانون البوي فرند والجيرفرند وبكده بيتهربوا من اي مسئوليات قانونيه تنتج عن هذه العلاقه لانه لو متزوجها قانوني تستحق ان تاخذ نصف مايملك ووو من المسئوليات لكن بهذه الطريقه اختلفنا باي باي وكل واحد يروح يشوف له فرند اخر
1077667441830961152,EG,  انا بتكلم علي اغلب التعليقات شتيمه وتريقه علي ايه الراجل قال كلمه طيبه الي مش قابلها ومش راكبه مع عقيدته كانه ماشفهاش  لكن لازم يخش يبصم ويبث سمومه
1077667808866197632,EG, اممممممم  جمبري كندي بقي  بالهنا والشفا
1077672841712226432,EG, معاهم هو ليس الله ولا ابن الله وللم يقتل ولم يولد اصلا مشكلتهم ايه بقي احنا عاجبنا الخزعبلات دي حد ليه شوق في حاجه خليهم هما في الصح واحنا خلينا فيما نؤمن بيه ولا  الي علي راسه بطحه
1077673173519425536,EG, قبل كده كان فيه برضه من تقريبا  سنه اسمها انجيل برنابا وعدت زي ماعدي غيرها وهايعدي غيرها برضه
1077674507501035648,EG, لا مانت مش واخده بالك هي اصلا مصيده فيران وبعدين الي عمل التويته قعد يتاملها فلقاها  تشبيه عملي مبسط لشرح مصيده الزواج
1077736675588083584,EG,    كفايه كفايه بقي الرحمه بقي اخواتنا الكاثوليك بيتمرمغوا في اللحمه والفراخ 
1077737703859544064,EG, احنا عندنا كل سنه في الشغل بيعملوا حفله للكريسماس اخوكم بقي بتاع  يناير يقعد ينقي الحاجات الي تمشي صيامي سلطه ويعدي اليوم السنه دي قالولي بدل انت صايم هانمشيها اسماك رفضت عملوا اوردر سمك سلمون وجمبري وارز وسلطاته بعد ماكلوا قالولي الحقيقه اجمل اكل اكلناه صحي ومختلف
1077921027659911168,EG,  الحساب واحد والله كلامه واحد
1077929271165964416,EG, كلام حقيقي وتنظيم اسكندريه زمان كان اعلي عماره علي البحر  ادوار اتفرجوا الان  و دور
1077961396825059200,EG," 
ده عارف دبه النمله عارف النكت الي طلعت
عارف موضوع لبس الفنانات
دا خايف لايكون انه عارف اني برد علي التويته الان
 ربنا يديله الصحه ويبارك له"
1077997504468267008,EG, بقول اه واحد راح حفله راس السنه ونشن  عل واحده حلوه قو ولزق لها علشان لما النور طف بوسها النور طفا راح حاضنها ونزل فها بوس النور نور لق نفسه حاضن الخدامه حظه عدت بنهم لحظه طف النور
1078022546354827264,EG, الموضوع فه امن قوم ولو اتلم وقال الحق بما رض الله هاحصل مشال مع دول تانه
1078029685475417984,EG, ز مافه راجل وراجل  ولهم اسم طلق علهم اضا فه ست وست ولهم برضه اسم طلق علهم الم تسمع عن قوم لوط
1078075158634684416,EG, بيسيح للي بيتابعوك ايه نوع الجهاز الي بتويت منه علشان محدش يستغلب ويعمل فيها شهيد  وهو شايل    ب جنيه  وكاتب مش لاقي ياكل
1078075808055468032,EG, مالو قال كل حاجه هايوقع البلد في مشاكل مع بلاد مجاوره وهاياخدوا شهادته ويقاضوا بيها مصر انها كانت بتكسر القانون الدولي فيه حاجات لايمكن تقال امن قومي وايضا اشياء حدثت في يناير لايمكن تقال ايضا
1078113153148485632,EG, في حته قالها مبارك ولكن تم تعديتها وهي الاجتياح الغزاوي للحدود ودخلوا سيناء بالالاف واتذكر اياميها ان مبارك امر بعدم اطلاق رصاصه وسابوهم ياخدوا الي هما عايزينه ويرجعوا ورجعوا بعد مالارهابيين تسللوا في وسطهم ودخلوا البلاد لم اتذكر سنه كام
1078123773595996160,EG, ماهو قال الكتره بتجعل الامر عادي
1078426719286112384,EG, لو بتاعه القوس شوفتها توفق عاشه
1078428519468802048,EG, وصلت ال عازه تتطمن قبل الضمان ماخلص
1078465594977107968,EG,لو مكان خلف تعمل ايه 
1078466354599129216,EG," عارف انك مش متابعني علشان تشوف التويته دي
 بس حبيت اخد رايك في مذكرات خلف "
1078468613240168448,EG, للاسف مالهوش نهايه غير الحرص في الملح والبعد عن النرفزه
1078744898340355968,EG, بصراحه الامن شايل شيله صعبه مش هايمشي في كل شارع ويبص في كل كوم زباله هما وجدوا ان الكنائس عليها حراسه شديده بدوا في ضرب اماكن اقل تامين
1078746964639039616,EG, شارع المريوطيه طريق الهرم الاتوبيسات بتقف هناك علشان يشتروا من البزارات ومنطقه سكانيه صعبه التامين
1078748024493490176,EG, الجزيره نازله تحليلات وتوقعات  لما يحدث لمصر سنه  مابعد الحادث 
1078750196811657216,EG, اكيد اسم صاحبها عليها او ممكن توصل للبنك والبنك يدلك علي صاحبها
1078804097573314560,EG," الاكل مابتصورش بيتنظر  قالت جدتي
بالهنا والشفا اللحمه قربت
مع اني بحب الاسماك اكتر من اللحوم والفرخ"
1078804865046974464,EG," يالا نكمل تويتاتنا عادي مش دول الي يخلونا نغير مود التويتر بافعالهم
نكته ربع ساعه بس امبارح لسه النهارده  بس افتكرت انها كوميك للواد الي كان عايز ينام ربع ساعه في الفصل"
1078805403843158016,EG," سمعت ان المجرم بيخش السجن مجرم صغير بيطلع مجرم ضليع
وان الاسلاميين بيخشوا بمخالطتهم للارهابيين بيطلعوا ارهابيين خطرين"
1078808103473299584,EG,  ممكن نعمل نفسنا نايمين ونشوف هايقولوا ايه
1078814772286636032,EG, ده كلام جدتي ماليش دعوه بس عمر ماجدودنا قالوا شئ وطلع غلط
1078815856979779584,EG," برضه فيه مثل كنت باخده علي انه هزار لحد ماطلع صح عن تجربه
بيقول
اللي يتداري وينبسط احسن من الي يتفشخر ويتحسد"
