id,dialect,text
1139821208021688448,SA," لامرني بالسوق مااقدر احاكيه 
مصيبتي ياكبرها من مصيبه 

صح لسانها نوره الحوشان 
قصيده مشهوره ولها روح"
1139905446100291584,SA, انتوا الله يكفينا شركم
1140358110340665216,SA,"الحين بسألكم 
وش معنى الجدال البيزنطي"
1142397625251090432,SA, وياويلي وش ذا بنت ولا لد
1143130926119030784,SA," لو يحط معها جاريه 
اكيد انها راح تتعلم وتطبخ وتستمر الحياة"
1147715543534919552,SA,"  فمان الله يأول من سكن بين الضلوع العوج 
عسى دربك سفير ويا عسى الله مايخليني"
1147748677332738048,SA,"  فدوتك ماراح من الايام والي عاد جايه 
يابعد عمر مخاسيره معك عندي غنيمة"
1148124878706491392,SA," بتروحون وبعدين بترجعون لنا 
مالكم منا غناه"
1148488505514954752,SA,"محبوبه القلب نعمه من كبار النعم 
تبي اعززلها في الي تكلم عنه 

تاكل من السكري وتقول ماله طعم 
تبيني اقولك قدمه حاجه احلا منه "
1148608371735650432,SA, كرك في ذا الحرر
1148814669102100352,SA, متزاعلين قبل الزواج وتواجهوا وقرروا يحلون الموضوع
1151732620214120448,SA," 
علشان ذا الحاجة شرع له في الاسلام اربع"
1155006638052532224,SA,"الغلا غصن رقيق ومرهف احساسي ثيابه 
مثل غصن الورد يومن الهبايب يطرقنه"
1161007371273080832,SA, هلابك شموخ كل سنه وانتي طيبه
1161837735675604992,SA, الفلوس  تعلمك كيف تحب
1162228747866533888,SA,"يقول 

مانسيتك لو دقيقه كيف تنسى من يحبك 
غرتك دنياك عني
بعتني الله يجازيك "
