id,dialect,text
1032749081729396736,QA,   اتمنى فعلا تعزون نفسكم ولا يشغلكم توركي شيك عنده ويلعب فيكم  خصوصا راعي الحساب يترك عنه النباح المستمر  عن دولة  قطـر  لانها تصععب عليه وعلى معزبه  
1033046908061794432,QA, انزين ليش متحمس وتبرر بمليون تغريدة اركد يا شيخ 
1033047482874384384,QA, ياليت تحط على جبهتك تاريخ اليوم وتطلع بمقطع عشان يصدقونك المتابعين مجرد اقتراح وانت بكيفك
1033227719868391424,QA,  ال  حطه في ثمك انت لانك متعود عليه بديرتك
1033231278135488384,QA,  ماعرفته لاكانك  ابخص ومتعود عليه
1033516582469885952,QA, بسم الله دخت من الفيديو 
1033576165057986560,QA, طبعا هذي التغريدة  بعد مسج معزبك دليم لك لانك تحت رجوله 
1034758653444804608,QA, اظن مو اسوء من الي ف سوق واقف ودك انت تشيله مو هو يشيل الاغراض 
1035673273315610624,QA,  اول دولة تشغل عيالها  العاطلين ف تويتر ينابحون ضد قطر سددت حق فاتورة الكهرب والا باقي لك كم رتويت ترا بساعدك عادي 
1037080154391175168,QA,  حاط في اطهر ارض ولا تنكر المنكر  يا منكر
1038428658116059136,QA, نبي سالفة الكابتشينو خاطرنا نضحك شوي 
1038522890302509056,QA,   انت عيش مثل خلق الله بديرتك عقبه عود على قطر 
1038523309690969984,QA,     واحد مدعوس ماله كلمه بديرته يعنني خايف على القطريين يستهبل 
1039077052392132608,QA,   الله يقويك وتاخذ بثأر  طلال الرشيد  بس
1039105964278992768,QA, كلب تنابح بين الحسابات هذي خطتك 
1039253209284521984,QA,  امانه لك وجهه ترد  استحى  
1039262592907272192,QA, احذف الفيديو انت مستانس عليه 
1039267384698261632,QA, انا ناوية اسجل فوق الضيقه ضيقه
1039396024685494400,QA,  طلعتو خرفاان ايفانكا وحليمااه 
1039415448683651200,QA, محد جاب طاري سارقين النعل 
1039465126884192384,QA,  اقول يالعنزي انطم بس
1039526907434475648,QA, اقول ماجد ايران دعست على خشمك وقدمت لها ورد وابتسامتك شاقه الحلج
1039579785733853184,QA, يا مشعل يا قليل الاصل يانكره
1039579868692918400,QA,  قليل الاصل ماعليه شرهه
1039582646010105984,QA,  لانه مو داعس شعبه نفس دعس معزبك لك
1039583297330995200,QA,  لين متى تنابحين يا كلبة حمود ريكي
1039958570895335424,QA,  محد درى عنا وجاي تنابح هنا ليش
1040050739463286784,QA, يبي لك تسافر تغير جو وترتاح نفسيتك
1040055550720003968,QA, صدقت والا عنك ما صدقت الرجال ماكان مقيم ف قطر  كان جاي ترانزيت 
1041355183282905216,QA, نبي نقرأ بس مافي وقت  
1042161694754185216,QA, جايتك ضيقة بسبب العذبه والا حاله نفسيه 
1042162255524184064,QA,  ي ورع ال شيخ ارقد حالتك صعبه وحاول تمسك نفسك مايصير كرامتك انمسح فيها الارض  
1042436768400855040,QA,   ياسبحان الله الحين ماتبونا نتدخل ودليم وطقته يغردون عن قطر يوميا ما اشوفك استرجيت واسترجلت تكتب لهم كلمه
1042487334573404160,QA, لا كذا بيزعل امال ماهر 
1042492692503162752,QA,   رفعي في ال شيخ عبدتهم صايره 
1042505153654542336,QA,   افضل طيران في العالم متوفر في ديرتي ما يسهل علي التنقل لافضل دول العالم بساعات قليلة  الشعب القطري طيب مع الطيب وليس المنافق والغدار و الجبان امثالك   تتوقع ديرتي تحدني اتوظف هالوظيفه ليش عشان القى لي سكن ولا اسدد فاتورة ولا ضريبه محتاره 
1043686233329885184,QA,    شصار لـ نواف  الرشيد  ولا مافيكم رجال يفتح ثمه ويسال عنه  امحق رجال
1043686850219704448,QA,  اصبر عليه راح يحذف حسابه بكبره
971590741591052416,QA, شكلك حالم فيه يكفخك ياخرفان
978230620915732352,QA,  انت خلك في غزلك  ابرك لك 
978376987067764736,QA, يغطون على سالفة الصواريخ واضحه
983254067492392960,QA, ماتوقعت تركي الدخيل رخيص لذي الدرجة ومستعد حتى يبيع ديرته عشان الفلوس   ياعبد الفلوس
983309746655649792,QA, اشوف الامارات شاده حيلها اكثر من السعوديه 
984288965967663232,QA,   مقدره وضعك اوجعك التقرير بس تراه بسيط  دقايق فقط 
984920618209562624,QA,  دامه مسيلمه محضر عنده ليه 
984941134165282816,QA,  كلامه عدل عشان كذا انت اتابعه
985253974977675264,QA,   ونبي بعد حجم  الطبيعي لـ تركي وناسه و دليم
985498696761651200,QA, ترا مفروض حنا هزار  
985582945120419840,QA,   حاط رجله في وجيهكم ولا رجال يقدر يفتح ثمه كفوووو يا بوعينيين قاهرهم
985710677242318848,QA, كان ودهم بالامير لكن  بعيد عن شواربهم قليلين الاصل
986933746371891200,QA, ما عرفتك وأنـت مشتط  
988213732294742016,QA, محد بيتابعك غير الخاين نفسك  الله يأخذك ويأخذ من يدعمك
988435086071816192,QA, وقالها المريخي منت قدها واشهد انه قصف جبهته 
990366722950656000,QA, اعوذ بالله  الله يحفظ اهل الكويت
990366925262917632,QA, شسالفه بيجي رمضان وبدت خططهم 
993585985157058560,QA,  ايران بموقفها  اشرف منك ومن معزبك دليم الفلس
993586389219504000,QA,   يا ابو مناكير  على بالك  الناس نفسك 
993810289853390848,QA, اهم شيء انت حارق دمك وين راح شيخنا و وين رجع 
994974284257878016,QA, أنا ابي اشوف اهل الهشتاقات بيطالبون بمحاسبته والا وش وضعهم   انسان متخلف
995492325202808832,QA, لاتشوفها قبل لاترقد  احتمال تجيك كوابيس 
995715442319782016,QA,  قول انك ماتعرف ومزعجنا هياط ممكن اتابع وانت منطم 
997825929610252416,QA,  لا مو  خايفه عندنا بديل والي هو انت 
997842089860894848,QA,  احرار    الصايم اثر عليك  القاعده كانت عندكم يا كعب ايفانكا
