id,dialect,text
1046317416681230336,JO, حسب علمي انه في اشي مش كويس عندك حاليا وراح يختفي يعني زوال مرض او هم او تعب
1046634218598600832,JO,ما اطول بالي وما اقصر الحياه
1047240638146777216,JO,شو هاليوم المتعب هذا
1048640466646982784,JO,ليش حاس مشجعين مدريد انقروضوا وبطلنا نسمع ليهم حس معقول هذول مشجعين لاعب مش نادي 
1048670601953640448,JO,مقالب الكهرباء بتوقعك على وجهك من الضحك بس نسيت اصور 
1050342575792672768,JO,هسا اعرفت انه اليوم الخميس لهدرجه صارت ايامي واحد ونفس النسخه
1050447897983111168,JO,هسا اكتشفت انه حبيبت اخوي القديمه خلصت صارت مخلصه ماستر و رجعت على الجامعه و بدرس اخوي يلي بعده ما تخرج لحد الان  وقعتك سودا
1067690017609277440,JO,يا رب ما تخليني افقد الشغف في الأشياء الي بحبها 
1068095179297562624,JO,لا عرفوا اسامينا ولا اعرفنا اساميهم  ع موقف دارينا
1071457971224358784,JO,قديش كان في ناس  عالمفرق تنطر ناس  
1074989666766647168,JO,اجت الشتويه وانت ما اجيت
1075173149560446976,JO, ابونا بكرا انشاء الله بكون قاعد على قلبك
1075174394396377216,JO,انا كشب عربي طولي  صعب شوي يكون الفرق بينا سم  
1075303731191824384,JO, اعوذ بالله والله مو انا انا سرقت طول ناس غيرك 
1099598331163086848,JO,معلش رح تتعب شوي أول فترة بس بعدها رح تنهار وكلشي حيكون زي الزفت لا تقلق 
1099941996045762560,JO,معظم الناس صاروا يفكروني بشتغل بالسياحه قد ما بنزل على وادي رم و البتراء ما بعرفوا اني مهندس  مسخم 
1107063950749982848,JO,لا فلحنا مع الفالحين ولا صيعنا مع الصايعيين 
1108154503923224576,JO,الحل الوحيد لاطلع من هالجو النكد كم حلقه ل 
1108439371873689600,JO,طول ما انت بتشوف    لسى 
976769279986151424,JO,ليث  بس بهاء احلى 
980421455870652416,JO,وجددت غشتراكي نت عفق
981965234264035200,JO,ماسورة ناس مكسوره بالعقبة
982687233898680448,JO,في بجسمي  غرزه  كلهم وقعات و عمليات
982688796511784960,JO,مش مستعد اضل انزل فيديوهات مشان احطهم على الستوري بعتبرها سخافه
986996259696398336,JO,مش جاي على بالي اروح على العقبة    
994153007607578624,JO,  مشان البس حالي القصه و اطلع باقي الاردن منها  منتي علي
