id,dialect,text
992830004936499200,EG," 
لو سمحت ممكن اطلب منك طلب
ممكن لما تيجي تعلق ع مباراة للاهلي واي فريق تونسي تكون حيادي
لان بطريقتك دي هتخسر جمهور بيحبك جدا"
992833210508771200,EG, يادي النيله مالك يا مؤمن ارجع الاهلي بقى محتاجين لك والله
992833902371893248,EG, مش ناوي تيجي تعمل حفله في مصر يا حلو انت
994563049863499776,EG,"على فكره اسلوبك دة هيخسرك ناس كتير
طب وإيه يعني مايغوروا في داهيه"
995069084369907584,EG, ياريت ترجع الاكاونت بسرعه يا ازارو عشان الولد اللي سرقه مبهدل الاكاونت اخر بهدله
995436569753456640,EG, ليه اسمه روبرتو وعينه زرقه وشعره اشقر يعني إيه اسمه وشكله مش مصري مش فاهمه
996409070683910016,EG, يعني كدة في امل لو كسب الاهلي الاربع ماتشات اللي جايين ولا خلاص راحت البطوله
996820461039312768,EG," كلامكم شبه الصعيدي عندنا
بس على فكره بيكونوا عارفين وكل اللي احنا بنشوفه دة بيكون تمثيل"
996825542551916416,EG, والله بيكونوا عارفين كله طلع ووقع بلسانه وقال كدة
996826563697102848,EG, والله يا مروه كله تمثيل وبيكونوا رايحين وعارفين ان هيتعمل فيهم مقلب وبيكونوا ماضين على ورقه تثبت دة
996827697895571584,EG, دة مين اللي عايز يغزه دةوعايز يغزه ليهمش فاهمه
996879592936927232,EG,"سكعلىاخواتك
اتصل بالواد طمني عليه
اتصلت وبيقول الهاتف اللي طلبته مغلق او غير مرتاح
غير مرتاح يا حبيبي يابني
هههههههه مسلسل تحفه"
998272805564223616,EG,"المليارات اللي بتتصرف على المسلسلات بحجة انها بتمثل الواقعلو اتصرفت على الواقع نفسه كانت غيرته للافضل
مسلسلاترمضان"
998281767210668032,EG,"كان نفسي الواد ياخد بنت خالتهإيه اللي جاييهالنا ديخلاص ياحاجه وحدي الله كله قسمه ونصيب
 الزفافالملكي "
998626056629379200,EG, يزعلوا هو دة المطلوب
998991404738187264,EG,"عندي إحساس إن مروحة السقف هتتفك وتطير في الاوضه وتقعد تقطع في رقبتي وكل جسمي
إحساس مش راضي يسيبني من ايام الطفوله
الموجهالحاره"
999004037541396352,EG, انا كمان عايزة اخد الخطوه دي
999437501377990784,EG, كنت فاكره إني لوحدي إحنا طلعنا كتيييبببر اوي هههههههه
999683392148004864,EG, حلو الخبر دة ربنا يفرحك
999690434535444352,EG, لا إحنا كتييير متخافش مش لوحدك
999708831813980160,EG, صحيح متخافش من الهبله وخاف من خلفتها بترول إيه اللي معيشنا ده معيشكم انتموالمجاعه دي كانت عندكم انتم قبل سنه واقرا تاريخ واعرف اصلكم كويس
