id,dialect,text
970733171821211648,KW,انا اروح اشوف الوضع وتالي اقولك تعال  
970733449400279040,KW,سلامه قلبك بوعلي شيبت بسرعه من هالمجلس  يبيلك استراليا 
970734221772902400,KW,ودي اوقف مع الاستجواب بس ليلحين مو صايد وزاره عادل الخرافي مو فاهم 
970755910598610944,KW, يبا غشمره مو كل شي صج
970782671893926016,KW,تستاااااهل ياصديق الدراسه وموفق خييييييير  
970785527820668800,KW, بتييك فلوس من ريلك
970786522462146560,KW,اخوانا وحبايبنا السعوديين لا عاد تاخذون زقاير من عندنا نشفنا ندور مارلبورو ابيض جني ادور الماس 
970786975988043776,KW, يبا اقصد الاخت الماس
970787428792487936,KW,حددث افتخر فيه ولاده اخوي علي الزلزله  سيطره  كل العرب مادري شنو باجي الاغنيه  اللي لحنها يكلمني دايركت
970982119534145536,KW,منو اللي عينكم وصايا على البشر ومن انتم كائنا من كنتم حتى تدخلو وتحاكموا الناس في نواياهم انثبروا فبيوتكم وبلا تفاسف مصخت وزودتوها 
971136313813622784,KW,باريس من صجهم ولا يتغشمرون
971155542638055424,KW,قاعد بدوانيه دياحين واسولف معاهم عن التشاوريه قالو انت شدراك قلتلهم الله يخلي سعود الركيبي
971178797100949632,KW, قلنا هالحجي محد صدقنا 
971486031500455936,KW,عندكم احد يبي غسيل اموال
971489867363508224,KW, قبل عندي فلوس الحين مفلس عمررري
971526774600462336,KW,انزين بو جاسم ووليدان ليش ماوقفو حفلات الاوبرا ولا الاوبرا اكبر منكم  
944131345210658816,KW, نو اي ول نوت فورقيت اند هوب ول سبند أ وندر فل تايم ان يور 
944219674627264384,KW,انزين بهالمناسبه السعيده متى تنادوني العم عبدالله بهمن والقى مليون طايحه مو مالت احد
944227856065933184,KW,هذول اشرف من اهلك وقبيلتك مجتمعين اللي مافيهم رجال لو انك من ظهر رجال ماتحط صور بنات وتتكلم عليهم بس شكلك ياولد السواق او ولد الخدامه 
944259465007771648,KW,انا قايل ما يظبط المنتخب الا العوازم عزاااااه يابني عطا رجاااااا
944350320280424448,KW,يارجل خلني ساكت فيصل الدخيل قالوله نبي نصورك تقول كلمه حق فلم وثائقي لمنتخب  قال ابي  او اقل شوي 
944460580248842240,KW, حاولت اتكلم معاك واعاملك على اساس انك انسان بس اثبتلي انه الانسانه ممكن انها تنجب حمار مثلك
944613629403565952,KW, اي بس شرط مو ماله احد
944615884936621952,KW,اتوقع انا الطفل الوحيد اللي عمره  سنه ماياله بابا نويل ياخي مر حتى لو من بعيد
944617626243862400,KW, كنترول خلاص لا تدقون عالشرطه
945146613164593152,KW,موضوع فهد الانصاري مافي اي شي غلط شباب ويتغشمرون بينهم الشرهه عالحيوان اللي عدوه ريال ونشر المقطع وعادي هذي غشمره بين ربع لا تكبرون السالفه لانه غشمرتكم فبيوتكم العن من جذي
945147218524360832,KW,   ولاني احب السعوديه ماارد على امثالك اللي مايواجهون 
945147393397481600,KW, غشمره شباب بينهم وتسوب الفيديو اللي اقل مم عادي انا اشوفه
