id,dialect,text
1091629185695661952,QA,عزي له  وصح لسان الكواري 
1091662541116329984,QA, اكيد له طعم خاص لان من يد شيخ الشيوخ حمد بن خليفه  الحمدين   واكيد كنتوا تستاهلونه واذا مافرحتوا وماسويتوا نفس اللي سويناه كيفكم بس الحمدلله لمى اخذتوه ماكنا محاصرينكم ولاقاطعين ارحامكم ولامانعين مشجعينكم وبعثتكم الرسميه من الدخول لاراضينا وكنا فرحانين معاكم خل عنك الهياط
1091769631415652352,QA,  على بالك حنا خونه نفسكم  الخلا خلك مستانس لان الحمدين تاج راسكم سلمكم الكأس     ولا نخرب فرحتنا بخونه نفسكم 
1091770007623745536,QA,ملعب النعل في بلاد النغل 
1093762345992707968,QA,حصه حصابي  اشعنده اللي ينابح راد عليج  اعتقد الحمار يشوف العالم كله عباره عن حمير   الله يعز السامعين ماعدا حلف الفحار   
1094187799266377600,QA,"احلامغيرمرحبفيهافيقطر صح 
لكن بما ان احنا مو محتاجين تهنئه او إشاده او مباركه من حد في نفس مستواها  طقاقه و حماراتيه   فأنصحكم لاتعطونها أكبر من حجمها 
قاطعوها وطنشوها واحقروها وخلوها تولي"
1094187941876953216,QA,  طنشوها ياجماعة احقروها  مستواها 
1094241362030092416,QA, بعد ياريت فقع زين 
1094260088586555392,QA,"  صحيح احنا مش ضد انها تمجد في شيوخ بلادهاماعندنا مشكله تبعيتها لجنسيتها
بس دام موقفها حساس خلها تحترم زوجها وعيالها وتكون حياديهبما انها ماتجيب طاري قطر في اي شيومانبيها تحيب طاري قطر اصلا ماتشرفنا فحياديتها تفرض عليها انها ماتمدح تركي وناسه وربعه
ودام امدحتهم تتحمل ماجاها"
1094310695670370432,QA,  تولي  وتروح بلادها وتريحنا من غثاها  حماراتيه بتخلينا نختلف  ماتستاهل الا التطنيش  هي ومن واللي وآلتهم واللي يدافعون عنها
1094908427992793216,QA,  مستعده واجيب لكم ناس شفوا الحمدلله من المرض
1094916743770894336,QA,  ماعندهم سالفه  يا كثر الكلمات اللي لها معاني مختلفه في اللهجات الثانيه
1094980388924076032,QA, ومشكلة الحمير يشوفون العالم كله عباره عن حمير  الله يكرم السامعين 
1094981174563344384,QA,  ما شاء الله وتعرف بعد كم شهر فيزة لل  ط  واضح خبره الأخ    واجد عليك 
1095275686619742208,QA,  قاعد بس يتحلطم  لا طلع لا راح وشاف ولاعمل  رياضه 
1095973648580702208,QA,كلام صحيح  المشكله  ربعنا تاخذهم الحميه ويبون يردون  والأولى تجاهله لانه نكره والكل عارف انه كذاب و خسيس 
1096096841911930752,QA, خلوه يولي لاتسون له ريتويت  احقروه عسى مصرانه تتقطع هو ومعزبه
1097931070975197184,QA, اشحلاتهم بعد ماشاء الله  عنده ذوق
1098271492335435776,QA,     من اول يوم في الحصار واحنا مقاطعين  صرنا انركز في بلد المنشأ والمنتج  ولايدش شي في بيتنا من بلادهم واحنا بخير بدونهم
1099763763778121600,QA,"  كلامك صحيح القطريه جدا غاليه علينا والعذر ان السفره دايركت   مليون طيران دايركت وارخص  
ولكن اتوقع سبب لجوء اكبر للمحاكم  لان القانون لازم تستأذن من الشخص قبل ماتنشر شي عنه او تنشر محادثه بينك وبينه  وانت مااستأذنت بس قلت له احطك سبيكر وهو رفض  الله يصلح الحال"
1099781712412901376,QA,"  كلامك صحيح مانقلت شي على لسانه بس ذكرت اسمه 
بس اعتقد هو اشتكى لان القانون مايسمح بنشر اي شي فيه طرف ثاني الا باخذ موافقته   
وهو دام اشتكى هذا يثبت ان هو كان على الخط معاك ومش موافق على النشر 
والعلم عند الله 
مالها داعي اصلا المحاكم و عوار الراس 
الله يصلح الحال"
1099783487928918016,QA," اكيد مب ماعطينك لانك ماحافظ عدل اول اعرف اي يوم احتفالاتهم  
 و   اما  هذه زياده على الحسبه"
1099784512320536576,QA, خلهم ينبحون لين ينبح صوتهم وتويترهم
1099979871462268800,QA, عاد خلنا نذوق الفول ونقيم اذا اوكي او فول ممتاز احلى
1100044213931122816,QA,"   انا ليس مع أكبر 
بس انا اذكر السبب اللي خلى الباكر يشتكي  قد يكون هذا السبب  والعلم عند الله"
1100096877083742208,QA,  شكرا  بس مايمنع ان اسعارها نار واكثر من اسعار الدايركت في خطوط ثانيه وتقريبا بنفس المستوى
1100115741003693952,QA,   مسامحه اختي ومابينا زعل  ومايحتاج اعتذار ان شاء الله
1100280688002170752,QA, والمشكله عنده عدسات  جديده في السياره 
1100866884604432384,QA,  انت الخسيس الحمدين تاج راسك غصب عن اللي جابوك
1102262933239804032,QA,"    يا اخي شنو اللي يعجبك 
عنا وعنكم الفتن تراها دعوه يعني حتى انا لو كنت معاك في نفس البيت هذا مايمنع ان نقول عنا وعنكم  
واضح انكم تنتظرون الزله 
لاحول ولاقوة الا بالله  مايعجبكم شي  لايكون اذا قلت عنا وعنكم كفرت"
1102265094472380416,QA,"   المهم خلك على مافهمته 
وجزاك الله خير على تسويد وجهي على قدر فهمك لكلامي 
والسلام عليكم ورحمة الله وبركاته 
اي رد بعد هذا الرد راح احطك على الصامت   والله يغفر لنا ولكم"
1102628727614291968,QA,"  ركز ان حنا مامنعناكم عشان نستقبلكم رغم عن انفنا  ركز  شوي في كلامك  واسأل السعودين ياكثرهم اللي يشتغلون في قطر وبعد مازالوا يجون زيارات بالخش ولايبون بلادهم   الحين طلعت على أصلك 
احسن علاج لامثالك ومستواك هو  ميوت  "
1104503972172361600,QA,  بنحطه هو حارس  ناطور للخيام
1105515393056157568,QA, الله ياخذهم اخذ عزيز مقتدر
1106532773727215616,QA,ان شاء الله ينحط في موقف اطلاق نار وبنشوف ايش راح يعمل 
1107364764366323584,QA,   واضح انك انت موبس شارب حليب حمير الا انت الحمار بعينه
1107365953933922432,QA, الله يرزقنا وجميع المسلمين يارب
1107700899047186432,QA, الله يعين لامقبضين عربي لا انجليزي
1110837534567923584,QA,  الصور اللي حاطها هالرخمه شكلها مالت حرب الخليج  او يمكن حدود السعوديه هذه 
1110841485900087168,QA,اضغط لايك وشوف اللي راح يطلع لك بصراحة ابدااااع    
1110886022366326784,QA," احلى شي والله  يبي له رحله ثانيه 
 بس اتصدقين من كثر ماهم نظامين اتحسين عمرج ضايعه بينهم "
1111191015812149248,QA, شخبار محل عبايات خنور 
1111247411190603776,QA, ذكرتني بالاسد اللي يطلع في بداية توم اند جيري 
1111728716210688000,QA,يا طالب اعتذارك مقبول  اما تعيش في قطر وتاخذ الجنسيه مش بوزك  ارجع للي جيت من عندهم ودام هذا تصرف شخصي منك ومن عائلتك مثل ماتقول  ليش من بداية الازمة تتكلم وتقول شيخ المره وباسم المره  المره مكرمين عنك  ضف وجهك 
1111729891752509440,QA,ضف وجهك يا طالب 
1112368452134678400,QA," وهروب سلمان وش تسميه 
انا اقول لحق تاج راسه تميم"
1112368790476599168,QA," وهروب سلمان ايش تسميه 
 لحق تاج راسه تميم صح "
1118241272563629952,QA, على فكره بعد رجعت ادوية دول الحصار في السوق 
1118599990937640960,QA,  واذا ينصرف الدواء بدون وصفه بعد عادي ممكن انجيبه لك  عندنا ناس في بريطانيا اذا حبيت  بيجيبونه
1120311872132141056,QA,"  اما سالفة الفيجن هذه بروحها سالفه  
اشوف ناس حاطين ان شعرهم قام ينبت من عقب ما حولوا اكلهم للنظام الفيجيتيري "
1124595133855481984,QA," الله يعينك 
 بس اذا تقصد العربي  محااال مافي  جفا  راح نمشي معاه للآخر"
1126239174363840384,QA, صدقتي  انا صرت استخدمه للشغل وفقط للرد ع الأهل  اما الباقي ف امسححح
1127682178341646336,QA," عليهم بالعافية  
الحمدلله عندنا اللي مكفينا"
1128179847820447616,QA," خله يروح يصف معاهم ويعيش عندهم 
الصلح يتم بعد مايعتذرون من رموزنا  ويعاقبون المسيئين لهم 
بعدين انفكر في الصلح 
غير هالكلام مافي"
1130245294992576384,QA," حبيبتي  ترا هذه انشوده تراثيه شعبية لمنتصف رمضان  وفيها دعوه لزيارة بيت الله  
 عطونا الله يعطيكم  بيت مكه يوديكم  يعني ماكفرت لمى كتبت على الصوره بيت مكه يوديكم 
فلاتخلطين الأمور جزاك الله خير"
1134203864725561216,QA, غصب عن خشومكم بعثتوا له دعوه 
1134206360957128832,QA,  الذل واضح في نظرة اللي واقف وراء 
1134206719595352064,QA,  لكن مانقول وحنا في رمضان الا  الله يعز قطر وتميم  والاحسن عشان ماناخذ اثام بسببكم  انتوا  
1137469730669957248,QA," انا معاكالطريقة مقرفهو صحيح طريقة اكل هذا النوع من الأكل في المطاعم هي نفس طريقتهابس اكل ساخن في بلاستيك وينصب على بلاستيكوبهذه الطريقه يتم سكبه على الطاوله بصراحه شكله مقرف
واكثر من شخص من السوشيال ميديا طلع ياكله بنفس الطريقة لكن مش شرط نقلدهم مابنخسر شي لو سكبناه في اناء"
1137694688222371840,QA,لأن اللي على راسه بطحه  
1137702575820722176,QA, عساهم مايرضون ليوم الدين  نسوا فعايلهم و علم قطر وخرابيطهم
1139527794793308160,QA,   نوقف معاهم وهم واقفين ضدنا بأي منطق هذا
1140840233392640000,QA,  وانت احجز على طيارة قطر
1141080509927370752,QA,  خلوه يولي سفهوه وسفهوا حسابه  له رب يشوفه  وحسابه قريب باذن الله
1143971961107861632,QA, لاتعطونها اكبر من قيمتها  احقروها
1144061185072992384,QA, كلامك صحيح  وطقاقه فأكيد أكبر أحلامها بيكون له علاقه بالطق والغناء  بس اقصد لاتنشرون لها شي 
1154650276068020224,QA,   والله يكفي قاعدين مرتاحين ونشرب قهوه وناكل الرطب اللذيذ المنوصف  اللي بيفوتهم
1154784911779401728,QA, ولأسباب لايمكن ذكرها  يعني افهموها انتوا وحطوا الف سبب و سبب 
1158066007660998912,QA,  ماعليك من البطريق  هذا الفيديو قديم  ذابحهم كأس العالم عساهم ميتين قهر دوم مو يوم
1158454291377598464,QA, اييي نسيت اتصدقين  فجأه طلع الدخان و انفجر البروجكتر  والله رحله حلوه لازم نظيفها لقائمة شميم و د فاطمه و بقية القصص 
1158454573360697088,QA,  والمفاعل النووي  من جذي طلع نايف مينون 
1161561739739181056,QA,متسعود  لو انفعوا شعبهم بينفعونه 
1166929453567619072,QA,عذبة انتى   اهم شي بالألف المقصوره مش بالياء عشان تصير للمذكر عربي زعيف 
1167177697333796864,QA, مرتاحين والله  مطلع هالسؤال من مخباك ولا في أي حد درا عنكم والا سأل هالسؤال  انت كذوووب
1167324006032146432,QA,   ماله داعي كلام صغار وأسياد  ترا كلها كوره و مشجعين
1168985440440979712,QA, من كثر المشانق اللي عندهم  يشوف كل شي حبل مشنقه
1168985685983989760,QA, اهم شي مايقدر يسوي اربعه بيد وحده يخاف يطلع شعار رابعه   فمسوي  بيدين 
1169584119883489280,QA, اطري اطري ولايوقفك شي  عسى عمرهم طويل الوالد حمد  والقايد تميم
1170372865679659008,QA, وشدخل  قل خيرا او فصمت   في سالفتها اللي اطلعت فيها من الاساس  طيب هي ليش ماقالت خير او صمتت من البدايه
1017131046050164736,QA,  عساهم في هالحال وأردى  آمين
1019075365283610624,QA,ثواره مابعدها ثواره  والمشكله قاعدين يحللون ومسوين نفسهم فاهمين  
1019289825571168384,QA," كل تبن  كذاب ومحد منع حد  بس كل حد يتحمل مسؤلية قراره روح خل بميكونك ونفتك منك  
وانت منت بقطري "
1019492995035361152,QA, زين خلكم على عماكم  يا ابو العريف 
1021275900992606208,QA," حياك في قطر   وفي اي وقت 

وللناس اللي ترد وتكتب  حنا مع الشعب اما الحكومه فلا 
نحب نقول لهم  الشعب والحكومه عينين في راس 
واللي يحب شعب قطر لازم يفهم ان الشعب القطري مع الحكومه  شئتم ام ابيتم "
1021350012993777664,QA, يعني في هالعشرين دقيقه الا حنا ماكلين الاكو والماكو 
1021745878569299968,QA, خلود  اظن تحتاج نظارات عشان تقرا عدل حكم محكمة العدل وطلعوا دافعين  باوند للمتظاهرين اكيد ماعندهم فلوس يعطونك للنظارات 
1021836537967898624,QA, حلف الفجار  شخبار العشرين باوند لكل متظاهر   والله ببلاش 
1026117394979123200,QA,"  
عدد المشاركات في هذا الهاشتاق من الدول العربيه  ليست بالقليله
المشكله ان مافي حد فاهم معناه بس مع الخيل ياشقرا  
ترا الهاشتاق ياباني وليس صيني  وله علاقه بلعبة البيسبول عندهم "
1026187799928528768,QA," مغصوبه ماتغني لقطر  قلنا معليش لان جنسيتها اماراتيه
مغصوبه اتغني لبلادها ولبلدان دول الحصار  قلنا معليش لان جنسيتها اماراتيه
بس شاللي يغصبها في كل صغيره وكبيره اتهنئ للي اساؤا لنا وعلى اشياء تافهه 
وياريتهم بعد من جنسيتها  كان قلنا من حقها  لا تروح بس لجنسيات دول الحصار"
1026190585466482816,QA,"لاتشرفنااحلامفيقطر 
تدافع عن بلادها لانها تحمل الجنسيه الاماراتيهماعندنا مشكله
لكن بما انها عايشه في قطر وزوجها وعيالها قطرين لو تستحي شوي تحترمهم وتحترم قيادتهموتكون محايده ماتمدح في دول الفجار وتهنيهم في الطالع والنازل  
بس الشرهه على اللي يجيبها في اعراسه"
1026222678858817536,QA,"   هي مش اول مره تسئ بطريقة غير مباشره ومع ذلك يجيبونها  تدافع عن بلادها ماقلنا شي  بس دامها عايشه في قطر تستحي شوي ولازم ماتمجد دول حلف الفجار وتكون محايده
خل انشوف الحين بيجيبونها او لا"
1026916636027043840,QA,  حبها بروحك  والله يهنيك بهالحب  وحبتكم القراده انت وامثالك  لاترد بالنيابه عن شعب كامل  مثل ماقال الاخ حساب جديد وجاي تستعرض على اساس انك من الشعب القطري
1027081802689568768,QA," لاويقول هم ابناء السعوديه وكندا مالها شغل فيهم  صحيح كلامه  ولكن شننو تعليقه على قضية ال غفران  بعد هم من قطر ليش السعوديه اتدخل خشمها في موضوعهم 
والا حلال عليهم وحرام على غيرهم "
1027811644208902016,QA, مسوي استفتاء يا خرفان  والا كالعاده مخرف
1028408033200631808,QA,"   يضحكون لمى يقولون كنتوا تجونا تاخذون مقاضيكم  والله كنا نشتري بفلوسنا  نفيد ونستفيد  ولا بعد كانوا يبيعون القطرين اغلى من الناس الثانين  لو ماكانوا مستفيد ما باعوا  
لايكون كانوا يعطونا ببلاش  بس  والا يتصدقون بالاغراض علينا 
لكن الحمدلله الله عوضنا عنهم بالاحسن"
1028549864190173184,QA,    تفكيركم هو اللي تفكير حمير   
1028897348942851968,QA,  سود الله وجهك وانتي 
1029836984196390784,QA, ومن قال انك قطري  واذا انك صج قطري وكفو قط الجنسيه وروح قول انك من اللي انت مأيدهم  الخلا
1030031114713292800,QA, واللي يقول لك  الحقران يقطع المصران ويفجرهم بعد 
1030053077741580416,QA,  ماشاء الله  بس دايما المعارضين منكم 
1030053328695128064,QA, اي اي خلهم مساكين  على فكره ترا عمر الذباب اسبوعين  وعقبها يموتون
1032170961796128768,QA, خلها تنجلع محد يبي تهنئتها
1033319251271016448,QA, هي تكلمت عن لبنان وقطر  المشكله في اللي ينابحون من دول حلف الفجار من جاب طاريكم في الاصل
1036337689254080384,QA, يستاهل ما جاه  اللهم لاشماته
1042380999362002944,QA,"   
لانهم مايشوفون الا العزب "
1045235207669010432,QA, من امس وانا احاول افهم  هالثعل
1045252198635122816,QA,  ماعندنا بو شنب الا ناصر خان   بس ماغير صورته 
1047589362349879168,QA,   الايمان واضح من الفاظك   من قذارتك
1048540120167506048,QA, الظاهر الخاتم فيه زر القنبله النوويه اللي بيطلقها على ايران 
1048887185901010944,QA,خوش قنصليه  وخوش عذر 
1049379358211805184,QA,  وراح يجي واحد يقول لك قطر دافعم لهم
1051025096251445248,QA,   عساهم في هالحال وأردى  والله ينصر الاسلام والمسلمين
1051573233093234816,QA,اطلعت ريحتهم وفضايحهم  وين مايطقونها عويه  اللهم لك الحمد والشكر 
1052170060586987648,QA, سخافه  وبلا هدف  وعيب  فعلا صاروا يعملون من نفسهم أراجوز مهرجين بس للشهره بدون حساب لمشاعر الآخرين
1052277402745823232,QA, اي والله  هبل هبل 
1052576129540714368,QA, شردوه امس وقطوها في راسه اليوم
1053649773813739648,QA,  الله يرحم ابوك بس
1053670199361191936,QA, اللي ماله حاجه وماعنده شي ضروري المفروض مايطلع اليوم  عشان مايزيد الزحمه
1053687712241332224,QA,"امطارقطر ما شاء الله 
اللهم صيبا نافعا "
1053732706591408000,QA, الكل يغيب عياله ولا عليكم منهم وخل الوزارة اتقدم امتحانات للطوف  من اهم تاجيل امتحان ام سلامة الطلاب  وزارة تفكيرها مقلوب
1055120734127824768,QA,وين اللي كانوا يقولون اقتصاد قطر ضارب ونازل   اللهم لك الحمدوالشكر  بس مانحتاج شهادة واحد معتوه نف مبس 
1055129882957676416,QA,"قطرستبقىحرة 
وترجع لي ترجع لي يا  "
1055131584146428032,QA,"تومازانمرماها 
تميمالمجد "
1055139508881162240,QA," وين جماعة الصلح خير 
 "
1055154809647566848,QA,دايما معلوماتهم ضاربه نفس مبس 
1055156802021720064,QA,حاط نفسه على الصامت  
1055159235493982208,QA,"وليالعهدفيمنتديالاستثمار
محمدبنسلمان 

اجلد  السعودية  تشتكون من الجزيزة  الحين ايش بيفكك يا مبس من لسانهم  اللهم لاشماته "
1055489514356068352,QA, يبي لك ماي مقري عليه ومتفلين فيه  وشب وسويده
1055543888201609216,QA,  بن سلمان هو اللي جرم نفسه بنفسه يمدح قطر غصب عنه لانها الحقيقة بعد ماتبلى على قطر وبعد ماطلعت فضايحه
1056145094846398464,QA, اي والا ليش حاطين بير في بيتهم  الظاهر لطمس معالم جرايمهم
1056156366325407616,QA, مايحتاج  يوصل لكم الفقع لين باب بيتكم ومعاه هدية بعد  ويا عواذل فلفلوا  
1056228620115545984,QA,  مصدق نفسك  خل شروطكم لكم  ومرتاحين بدونكم
1056821420498526208,QA, ومتى فازوا  صاروا نفس المعجزة يفوزون نفسهم بالغصب
1056905798721380352,QA, بنساعدهم وبنمولهم بعد اذا يبون وفرقاهم عيد
1056963347697016832,QA, من حقنا نلتزم باسلوب التعالي على قولتك يالخسيس  لان انتوا اصلا من اوطى ماخلق ربي  الخلا  لانببكم ولانبي جيرتكم
1057592989151870976,QA," اي كلام  هذا الواقع  وليبيا اهلها هم اللي ثاروا على حكومتها  وسلامتك واضح من اسألتك انك تبين توصلين لهذا الكلام الأخير 
الله يصلح الحال"
1057598278316056576,QA,  يعني جاي ياخذ العلوم ويروح  طرطنقي بالعامية 
1057755421362970624,QA,   شغلهم كله فوتوشوب وكذب اينجثةجمالخاشقجي
1057960135614742400,QA,"    صحيح كلامك 
ويستاهل ماجاه واكثر 
سبه لقطر  لو بنطوفه بس اللي مايغتفر له سبه للذات الإلاهيه  وهذا جزاه"
1057967170590785536,QA,"    اكيد ماعندهم اعتبار للدين وهذا شي مفروغ منه  وكل اعتباراتهم شخصيه  
لو عندهم اعتبار للدين كان ماقطعوا جثث واخفوها مو بس قطعوا بعثه دراسيه"
1057968003629887616,QA,  الحمدلله والحلويات التركيه تارسه السوق عندنا 
1058459175305601024,QA,نحاسب الدب والخمه اللي معاه 
1059386805814996992,QA,جاء يكحلها عماها  الله يعميهم دنيا واخره 
1059424959892807552,QA, عسى في هالحال وأردى
1059459091398045568,QA,يبي يكحلها   ليته سكت 
1059817689756123136,QA,نعم حرية الرأي عندكم مكفوله بالمنشار والساطور 
1059826203018834048,QA,   اي والله انخليها بينا عشان المترديه والنطيحة مايفهومنا
1060631256101257216,QA,تميمالمجد ربي يحفظه في حله وترحاله 
1060642737903599616,QA,تميمالمجد ربي يسدد خطاه 
1061711635361001600,QA, قطوها في راسهم وهذول يموتون على الرز  صدقوا السالفه
1061897538209492992,QA, لو لابس كروكس ابرك له  يجمع مابين الصندل والجوتي  وانتوا بكرامه  
1061961907236675584,QA,عربي  زعييييف   مايعرفون معنى الأدعم 
1062107595761160192,QA,"  التكمله  
إليا اعتزينا خيل العليا تميـم
نقلط على الميدان في وقت المحن

أهم شي غصب عن خشمكم تتغنون بالأدعم و بتميم تاج راسكم  حتى من غير ماتحسون "
1062985887657668608,QA,"حط عاجل
اكتب استقبال 
 والا مصيرك الرتز  "
1063036526450434048,QA,لا خلك من صوره تقريبيه  الحين تركيا تبي الاسم والرقم  بعد واحد ماخذ الجثه معقوله مايعرفون عنه الا صوره تقريبيه   
1063123232876830848,QA,   شايف شلون اسلوبك هذا مستواك 
1063124266152091648,QA, بس يعرفون طريق الرتز 
