id,dialect,text
886310894178840576,AE, الله يحفظك ولا يضيعلك تعب 
887378432430145536,AE, هذي خبيره تجميل ليش ما جملت عمرها
888664760404889600,AE, صحيح هو ليش حاط صور العاءله  المفروض يحط صوره شخابيط المجد عشان تضبط مع الخطاب 
888721638057009152,AE,  هو بيتكلم على حجم  الدول  ويقصد القصير ما يناطح الجبال عشان ما ينفشخ راسه  وهذي مو سخريه اعتقد نصيحه 
889916872954703872,AE, وهي لين الحين ما خذته يا اعوج 
899874086201032704,AE, هذا إلزلمه يا عبيط يا بيستعبط  صهيوني حقير 
903714001108033536,AE, ما اعرف هذي الأشكال الي انهدوا علينا مره وحده  منو وراهم واكيد في أسباب مخفيه  يعني معقول  لا حيا ولا خجل وين اهلهم  هذي منو رباها
905859674058223616,AE, هو انته لين الحين بدقق 
905866321740648448,AE, انتي عندك تسريب شو دخل شركه ديوا  الشركه مب غلطانه اي خدمات تريدي يحسنوها عيوني 
906536141691785216,AE, يمه شو هذا معقول 
907496946746757248,AE,ما اعرف ليش الفانشيستات يعملوا مصيبه ولما ما يعجبهم رد فعل يهددوا يرفعوا قضايا ليش يعني إنتوا حلال ونحن حرام  لا ويصورا سناب بمركز الشرطه
907864820850073600,AE, كلهم مرتزقه شو الي يخليهم يعترضوا 
919658350622789632,AE, وشو المطلوب مب فاهمه يعني الامريكان اشراف ابو شكلك 
920892202276057216,AE,اهم شي انها تقدر تنحاش ياحضها  
937698993986985984,AE,  اي زعيم   ارهابي علي كيفكم الزعامه 
938832475085856768,AE,  وين جيش المهدي وله الحشد ابعثهم اذا فيك خير
940307667117101056,AE, لا لا معقول ياريت الزعفران الي عندي ما وصله شي  سعره غالي الشغلة مو هينه 
940817476694298624,AE,    يمه فدوى شون يتكلم إنكليزي شعر 
943819180167614464,AE, بالعافيه عليه يتنهى ويسعد قلبه  فلوسه وهو حر انتوا ليش محرورين  اذا موب عارفين اعرفكم هذا هو حفيد الملوك 
945336051559731200,AE, وين حماس وين بيت المقدس وين الزلمات صفت على عهد  ونسوا الكضيه يلا منتظرين عهد
945668741609803776,AE, مجبوره شو تسوي تريد تاكل 
945671464698642432,AE,يا حليلها شرين رضا ما تقصد الاذان كلامها واضح تقول وحدوا الاذان  وما يرفع صوت المكرفون وخاصه لما صوت الموذن مو بالصوت العذب  ليش التطاول عليها 
1002909909283991552,AE, من الذب ليشتذب
1005360944472641536,AE, عشان محد يذب ليشتذب
1006246886985142400,AE, بنزيما موجود مهاجم بواصفات مدافع جدام القول احسن واحد يشتت وساعات ممكن يسجل 
1007330716659666944,AE,  هيه والله مب قادرين نتصل
1007330975439884416,AE, يا رب نقدر نتصل هذا والحريم متحنيات والشبكة ميتة
1007921277825404800,AE, اتوقع بتنجح الخطة بنسبة كبيرة
1007926196183752832,AE,  اكيد فيه افضل من منديز ولكن اذا منديز تم موجود لا محالة توقعي انه الخطة بتنجح بنسبة عالية وخاصة لو كان فيه واحد في الدكة ممكن ينافسه عالمركز 
1014167640946937984,AE,    ان شاء الله يسير اليوفي الكريه 
1014870207289090048,AE, وفوق كل هذا ما يابوا الدوري للحين
1021441292721631232,AE, هههههههههههههههه واللي يطلع لاعب يكون مال نص موسم
1021481805365633024,AE,   معروف عنكم لكن غيركم شغال بلوكات 
1024035677338521600,AE, ياخي هذا الشي الغريب اللي يستوي تحس الشغل عشوائي ولا مش منظم ولا كل واحد يشتغل بكيفه
1024050866368774016,AE, اذا ما مشى حاله ممكن تاخذونه ويا الالتراس شكله ينفع حق الصفقة
1026908267912544384,AE, للأسف مب واضحة المميزات 
1027159643624288384,AE, السنة اللي طافت خذنا تذاكر ال في اي بي  ونص اللي يالسين داخلين ببلاش لانهم ربع فلان وعلان  ولا اللي يدخلون ويا اداراة الفريق الثاني اللي هم مب في الادارة بس عندهم معارف
1032430099973525632,AE, صيف كامل يعلنون عن تيشرت الفريق ويصورون سناب جات
1036365010761605248,AE, يا ريت اللي في بالي 
1037453279062646784,AE, الصبر زين يجيلك يوم يا هذا 
1038846614704676864,AE, اللي يسجل اكثر اييب البطولة الوصل
1039116566330331136,AE, اللي يسجل اكثر اييب البطولة
1048232333193728000,AE,  نحتاج ادارة يديدة قبل الملعب اليديد
1049712935298314240,AE, شفت قبلها احمد عيسى كيف خلص الكورة 
1050034997992804352,AE, يا رب الفرج قريب لكم انتوا اللاعبين ونحن الجمهور  الله يبعد اللي كان السبب
1051462503652315136,AE,     اللي صاير انه الإدارة ماخذه الموضوع شخصي ومحد من الإدارة يطلع في الإعلام ويتكلم في شي ما فيه شي واضح
1051552452259041152,AE,  قبل كل شي الإدارة كفت ووفت  ويزاهم الله كل خير ولازم يعطون الفرصة لغيرهم
1052502596567662592,AE, يا رجل الاجار  الف منو اللي بيدفع هالمبلغ في مكان مافيه زباين
1053296039720091648,AE, عشب الملعب اللي بيتمردغون عليه 
1053741720645578752,AE,   يا رب اللي في بالي يتعلمون 
1055157901394886784,AE, شرد قبل ما يصفر الحكم 
1055167023603425152,AE,احين صدق انه اللاعب رفض يجدد عقده الا بزيادة راتبه جان ايلسونه عالدكة  الوصل
1055389895710130176,AE,   قاله سجل على عمرك بعد 
1055405085293973632,AE, واحد يبا يجدد عقده ويا زياده راتب 
1057248146831609984,AE, هالرحلة قيمتها نفس اللي الرحلة العادية
1057738361128058752,AE, اذا بتقرا بسبة الوصل  دور كتب وروايات تعلمك الصبر 
1057971146790965248,AE,يا رب توفيقك  عودةالذهب الوصل الوصلالفجيرة
1059141881081315200,AE, حالنا ويا اللي بالي بالك 
1059415824522469376,AE,    سندويتش فلافل اللي بدون طحينية وفيه حبة جزر 
1059682731230220416,AE, ويقولون خفوا عالإدارة شوي  
1060582681682104448,AE, ما يسوون الربع توله حتى 
1060582905276186624,AE,  لو المنتخب فايز بالنتيجة الكبيرة  بيتغنون بيها
1061357898788413440,AE,  قال مب شغل الجمهور حوارالوصل
1061380416089849984,AE,  خلنا نشرب من هاكي العصير  
1061985100458528768,AE,   هو قال مب شغلنا  لازم ما نتدخل 
1061996269399355392,AE, شكرا لكل شخص يستحق الشكر أما الباجي مالهم شغل 
1062806311556050944,AE, يا سعود الضرب فالميت حرام 
1064955883434717184,AE,   انته بدون هالاقتراح تستاهل احسن تكريم 
1065246661742653440,AE,  بيردون إن شاء الله  محد يقدر يصبر عن الوصل    
1065658049719926784,AE,شكراحسنالعبدولي الوصل شكرا لكل اللاعبين والجمهور والمدرب  فقط اللي بالي بالك مبشغلنا فيهم 
1066095512925941760,AE, لا لا عنده زياده بس وايد اييب العيد يوم الهجمة علينا 
1066904488320163840,AE,  قالوا  الله يسامح اللي كان السبب
1066949297722281984,AE, ما يستوي يطلع ربعه غلطانين 
1068960308595748864,AE,   تراه يعتمد منو ربعه  ربعه اللي يقولوله قول هالكلام
1069860531350241152,AE, مب شي يديد  يقولك الطلب زايد عالفنادق
1069939139737513984,AE,  عسب جي حصلت انه الموظف هذا يسجل مجموعة ارقام تحت شركة وعقب يشرد
1069939519443619840,AE,  قطب وطبل ولا بس قطب ولا بس طبل 
1071685698737062016,AE,    ما تشوف شر ان شاء الله
1072060600375754752,AE,  شاورما وواحد ميلكو همبا
1073157345025376384,AE,  تراه البلنتي الاخير مب بلنتي والقول الرابع قبل سنتين كان تسلل 
1075033459310166016,AE,   والسستم عطلان اسبوع كامل لين خلصنا المعاملة
1075813967916871552,AE, المشكلة مب فالمدرب  لو تيب اللي تيبه في ظل الأجواء الحالية ما بيمشي الخلل واضح وكلما عارفينه
1076843976475492352,AE,   موظفين توجيه كانوا يقولون السستم عطلان ارجع بعدين  تقريبا خذنا اسبوع لين خلصنا المعاملة
1076871967012212736,AE,    صح كلامك  كل واحد يعق اللون عالثاني
1077148633877876736,AE, جان قالوا مب قد الطموح
1077187644675764224,AE, اهم شي نفوز لو فالسلع 
1077488649334390784,AE, وتمر الدكان تاخذلك ميلكو عسب تكافأ نفسك
1077939105504415616,AE, مب اول مرة تنفون خبر وعقبها يكون صح  
1079762025398587392,AE, نفس اللي انته تبا 
1080031485363715968,AE,    التذاكر من وين نقدر تشتريها  للحين ما اعلنوا عنها
1082353707533172736,AE, سلامات بو حمدان ما تشوف شر
1083827084877881216,AE, يقولون موجود في   اللي في سيتي ووك
1087329374502817792,AE,  دي جي البطولة فاشل في مباراة المنتخب مشغلين إلعب يلاه
1088876025193353216,AE, خلصت  انا خذت  واحين مووول ماشي
1089734765555658752,AE, اتوقع مدير نجمة الوصل السابق بيقدم التقييم في نهاية الموسم
1090336123770028032,AE,   هههههههههه أم الدنيا بتستناك
1095595937710465024,AE, حد مقتنع فاللي سوته الإدارة  ووصلت الفريق لهاي الحالة
1095743410714169216,AE, لو ايي ميلان شوف كيف بيشتغل 
1095743953440256000,AE, هههههههه الفريق المويض حاليا  بس راجع اقوى بإذن الله 
1095744651003416576,AE, والله انا اتمنى الانتر وميلان يرجعون مثل قبل عسب العيوز تنطب 
1095882803701526400,AE,  ما ابغي امدحه وايد  لكن هو لين احين ممتاز 
1097871193544130560,AE, اخيرا حد يوافقني الراي
1098481162316599168,AE,   المشكلة اني كل ما اسجل يقولي بيطرشلي مسج للتفعيل ولا يوصل المسج
1098613946326630400,AE,الله يسامح اللي في بالي الوصلالوحده الوصل 
1100717458602762240,AE,  هيه اكيد  نحن نقصد ادارة دورتموند الالماني اللي هدفها تنافس كل سنة ومش مهم ايبون بطولات 
942339869786935168,AE, الموضوع انمسح  شكلكم حطيتوا صورة الشخص الغلط  ولا الخبر كله غلط
946842108832501760,AE, صح كلامك وانا شفته لانه كان يالس وراي 
949277004649652224,AE, تحت امرك  افا عليك
956901108022161408,AE, اهم شي انهم خذوا خطوة للأمام لمصلحة الكرة السعودية
958925707140370432,AE, القول الاول يا قبل ما الاندومي يستوي افا عليك الحبيب بنعزمك عالبرجر مالهم
963277322353889152,AE,هلاااا هلا وصلاوي هلااااا وصلالوطن الوصل دبي آسيا آسياتنادينالدعمنادينا دوريابطالاسيا 
974029823331909632,AE,كورتوا لازم يلبس وزار 
976787972786974848,AE, الفلوس والضغط العالي ممكن يخرب عليهم
983651256123174784,AE, كيف القانون اخر واحد حارس ولا عشر دقايق او قولين 
984092188928827392,AE, عيل اللي ضيع والقول فاضي شو
984167136871448576,AE, الله يسامح اللي في بالي 
986850917805953024,AE, المشكلة مب في اللعيبة ولا المدرب المشكلة في اللي بالي بالك
987354979693457408,AE, هههههههه انا اقول اللي بالي بالك كلهم ينشلون احسن سنين هم في النادي وما سوو شي
991622061058600960,AE, نادي واحد يساوي هالاندية كلها
992076681086164992,AE," 

عقبال ما تنشل الادارة خذتوا كل وقتكم وما منكم فايده غير كم آخر آخر كم"
992126714829524992,AE, اتمنى اشوفك فالتشكيل اليديد للإدارة
999994072784949248,AE,  ههههههه انا عسب جي منشنتكم عسب نيجيريا
645998566813470720,AE,الله يعينا عليك يالجنيبي  النصرالوصل
656547088558256128,AE, عقبال الإدارة اللي في بالي تسعى وتعمل لاسعاد جماهيرها  قلب اصفر مجروح
658579246995009536,AE, وايد اخطاء في البرنامج وغير واضح
660364153794621440,AE, تمشي الهوينا كما يمشي الوجي الوحل
661149776352669696,AE, قبل كل شي الحكم لازم يكون مفرغ ومحترف  كيف حكم هاوي يحكم مباراة دوري محترفين
661859998306168832,AE,  صدقني الدفاع اهم  المهاجم ممكن تحصله بديل الدفاع شوربة 
661860615267315712,AE,  هممممم بس مب اي لاعب ممكن يدافع ويكون زين بس كل لاعب ممكن يسجل لو شو كان مركزه
668145066813210624,AE, اوصخ لاعب في تاريخ كرة القدم
670191847084392448,AE,   يا عمي ادارتك مب قوية انها تضارب عسب تلبس هاللبس انتهى
670268873770467328,AE, لو تحصله تسوي خير  لانه الرابط الموجد مش شغال
670972773561274368,AE, الحمدلله ما فاز  لانه لو فاز مالهم حجة يغيرونه بو نتايجه كانت سيئة لانه الصراحة عليه وايد اخطاء في الفترة الاخيرة ولازم تنحل
670993337227210752,AE, كلامك سليم شيخنا  بس نحن تعودنا انه يوم العزا كل يوم حد يشل الاكل والضيافة عن اهل الميت
671377638162694144,AE," سؤال ثاني آسيا وين جمهوره ولا اعتزلوا التشجيع خلاص الاهلي 

"
674877882573844480,AE,  وين بيكون موقع النادي
680439480025616384,AE, وعبدالله كاظم شكله يبا يسير عند الجماعة 
680439965642129408,AE, بس تدري لو ادغار موجود بيسحبلك كم مدافع  واللعيبة الثانيين بيستانسون
690954072359239680,AE, ليش مب بدال ادغار
691206806589280256,AE, اليوم بإذن الله خسارة مذلة
691207743005392896,AE,  ههههههههه  انا قصدي الارسنال يفوز  
691236888636600320,AE, والله درر انته حكيم 
693763729205243904,AE,  صح كلامك استوالي نفس الشي
698035524393566208,AE, فيه برنامج يستوي تختار اي رقم يطلع للي بتتصلبه رقم وهمي يعني
698108322986102784,AE, ههههه انا اقول غير رقمك
698959699794722816,AE,تصبحون على ما تتمنون 
701358147018039296,AE, يعني ممكن تنزل وسمه ثانية فيها احصائية الدوري بس بدون الكأس
701359382739730432,AE, يعطيك العافية حلو يكون في رسم بياني شامل ورسم ثاني مفصل
703245526880362496,AE,الله يعدي الوقت  يااااا رب الوصل الوحدة
703249499972624384,AE,الله يستر من الفرص الضايعة  الوصل
703972162688978944,AE, يبون جماهير تحضر والمباراة شهر 
706038437510586368,AE, انا ما اعرف ليش ما لعب ليما او روجيرو في مركز صانع الالعاب بدال ما يخلي هذا المركز فاضي 
710105802925862912,AE,  يمكن الشارع طاح على قبة السيارة
710371147607576576,AE, اذا ييت بكلمك بإذن الله
719025023638482944,AE,  ياخوي كل من يرى الناس بعين طبعه  اخوي حميد صديق عزيز علي ولا مره سمعت منه اي اشاعة
719787932282986496,AE,"توقعي الشخصي للقرعة 

تصفياتكأسالعالم الامارات"
719829513283178496,AE, منتخبا هو اللي قسى على نفسه ووصل لهاي المرحلة
720340790749315072,AE, لازم يجازف  بس للاسف يخاف
721124627007860736,AE,  انته زي الفل بس فيه احتمالية بقاء ادغار  وروجيريو يلعب وسط يسار وليما وسط يمين وخذ مزيكا 
721774904211861504,AE, احسن عن لعب برشلونة اتوقع  شو هااا
723926594365038592,AE, هيه يايبين واحد يلقط كور محترف  ويايبين واحد يسوي كرك زين
723963474708172800,AE, مانشستر يونايتد كانوا يبونه خله ينحلع
731473636566171648,AE,دبابيير دبابيير جمهور الاصفر في حبه دبابيير الدبابيير
733026716667523072,AE, الاثنين بيصلحون لنا الباك ممكن يكون اساسي والثاني احتياط قوي
735994084834324480,AE,أتوقع الكاس جزراوي  وانت شو تتوقع توقعشاركاربح العينالجزيرة 
737421265858924544,AE,معاك   ما فيه اي احترام للنشيد الوطني 
737502688905043968,AE,  عندهم بطولة رمضان يخططولها اول
738005493587775488,AE,ددن ددن ددن ددن 
739366828166815744,AE, من احسن المدربين اللي مروا على الوصل في الخمس سنوات اللي مضت
741458838663106560,AE, شكلك يوعان ولازم ترقد
745392049608921088,AE, كفو  افهم ياللي بتفهم ميركاتوالوصل
746851873810948096,AE,  وايد مسوين جو لرنالدو اللي ما سوى شي في البطولة ياب قول كعب قالوا من اي لك هذا  خل يتعلم من عمه ميسي
749469698874638336,AE,  صح كلامك سيف  بس كان ممكن يسرع تبديلاته ولا يذبح اللعب عشان يوصل البلنتيات وما عنده لاعبين كفؤ يشوتون
759983968343166976,AE, عنا بيرفعون قضية وبيسوون سالفة وبينجرح اللاعب ونفسيته بتتأثر
770353659054059520,AE, احمد بهجة وعلي كريمي ممكن 
780786792240975872,AE, اظني تعبانة  لو يزيدون نسبة الضيف كحد اقصى لين  على حسب الحضور الجماهيري
785924528530714624,AE,شكرا مهدي كفيت ووفيت  خلك على عنادك  انته مش رجل المرحلة
789408375184384000,AE, على فكرة في بوظبي شي كوفي شوب اسمه مارادونا ممكن تزوره 
798576775206989824,AE,الاماراتالعراق مبروك الفوز بعد انقول شكرامهدي كفيت ووفيت سويت اللي عليك وسلم الراية
799232851849908224,AE, نقع التلفون في ماي وملح وزيده كلوركس
803126959605694464,AE,للوصل جينا  من كل مدينة   نلبسأصفر
803328220477222912,AE,خبريهم يالحبيبة آه والله حبيبة 
803338020413915136,AE,الناديالاصلع خلصنا منه اللي عقبه شو 
805350860524048384,AE, امس لعبنا كوت وغلبنا حمود ربيعك 
808410295744004096,AE, صادق ياخي المفروض ما يشوت البلنتي لو شو ما صار
813733984769282048,AE, الكروت فالدوري وكاس اتصالات ما تدخل في كاس رئيس الدولة
815946335039918080,AE,  عموري على راسه بطحه يعني 
816936227966308352,AE,"   

كل واحد منهم عنده قصة نجاح بيشاركها معاكم في فعاليتنا "
819489267630149632,AE,يباله لاعب نفس رقم  
822457167185936384,AE,كفاااارة يا ليما الوصل 
825094211976458240,AE,اووووص ناموا يا عيال  الوصل دبيصفراء  
829755588292677632,AE, لا اسولف ان شاء الله قبل 
829772293039497216,AE,  لو سمحت  شكلك ما ركزت
834042298384187392,AE, انا دايما ضد اني اسير اشجع فريق غير فريقي لانه يمثل الوطن بس انا ما ابغي خصمي يفوز بأي بطولة محلية او خارجية
838842161600868352,AE, اللي صبر عشر سنين عاللي بالي بالك  يروم يسوي كنترول على اعصابه 
844958442200748032,AE, الموضوع كله انك لازم ما تخلي اللعيبة يبطرون  البطرة توصلك للحسرة
844964603654258688,AE, قص رواتب  نحن نشتغل عالمكاتب ونتعب وايد واخر شي يقولولنا هالسنة ماشي ترقيات لانه ماشي مزانية
844965079611269120,AE,واللون على اللاعبين اللي ما يحسون بأدنى مسؤولية 
849686957961687040,AE, ياخي ميسي يوم يبا يسجل يسجل ومحد يقدر يقوله شي
852429825113567232,AE, المنتخب يحتاج مدرب يعرف دورينا ويعرف اللاعبين  مب وقت تجارب
853131272935395328,AE, حتى لو مستواه كان نازل وتحسن هاتوه
853296029453647872,AE, هذا دليل ضعف الإدارة اللي مب قادرة تسوي شي كل المباريات المهمة ما استغلوها
854195163408863232,AE, نص جمهور الفريق الفلاني استووا يعرفون في الهجن
854315839423696896,AE, مسحوا التغريدة ما لحقنا نقراها
856376114725347328,AE, في المدرسة كانوا يركزون على اللغة العربية واللغة الانجليزية ضعيفة جدا سرنا الجامعة قالوا نبا انجليزيداومنا قالولنا الايميل لازم بالعربي
858399560917553152,AE, هذا هو المنتخب اللي لازم يسووله سالفة  مب اليهال المدلعين
860905420579381248,AE,  اليوم فيه مشكلة في هالباركات  حتى الاهل تموا في السيارة ساعة كاملة لين طلعوا
870763058272104448,AE, كل اغانيهم مب حلوة يحاولون يقلدون اغاني الكويت
891721566681169920,AE, يقولون وقع ويا النصر
901847968424370176,AE, وده يتكلم عن نيمار 
901899148890431616,AE, دام انه  نجم  المنتخب مصاب  كيف تبا حملة اعلامية والحث عالفوز
907304120956198784,AE,زين عموري ريح عشان هاي المباراة  الهلالالعين
909090203608010752,AE, ادري  بس حسستني يعني
909142167783985152,AE,  كفيت ووفيت  منها للأعلى يا رب  الله يوفق ويسدد خطاك يا بطل  كلنا ثقة فيك 
911265621488422784,AE, اتوقع تقدر تشوفها على برنامج اسمه  نزل البرنامج وتدفع رسوم شهرية
918945656982724608,AE,      الله يبارك فيك  هاردلك
919295610779467776,AE, هاذوووه شات كورة زي الخره
919299201405804416,AE, شكله بيسجل قول الفوز
926719134083223552,AE, السنة اللي طافت عنده صورة  وهو يحتفل  
933270069177708416,AE, كيف هاي التفاهات اطوف عالرقابة 
933752683437154432,AE, عبدالله صالح القولين اللي سجلهم الوصل من تمريراته
935410487721975808,AE,  ليش المدارس اللي في دبي اغلى من اللي نفسها في بوظبي ولا الشارجة
1049418685520203776,AE, من باعني بذهب ما أشتريه بتراب
1049727549314613248,AE, الله يحفظك يامن تغيرت دورت درب ماهو بدربي
1051812612999171968,AE,المملكهترفضالتهديدات يوم كلن يدورله عضيد اخو نوره وأخو شما اخوان شعب واحد مصير واحد 
1055194175333982208,AE," ياليل  تكفى  علمه  كيف  الأحوال 
  قله  ترى  ياليل  ياما  ذكرته 

قله  ترى  جرح  المحبه برى الحال 
و أنا  معك  ياليل  حزني  سهرته"
1070419854296002560,AE, مزاجىمراتيكون  رايق لأطول الحدود من بغى قربي شريت قربه ومن بغى لبعاد يبشر بالجفى
1073131205850218368,AE,"خلك بحر يبلع ولا يشتكي ضيق
  لا هاج موجه  صار كلن يهـابه 

    "
1073177926559039616,AE, انه شخص يغص قلبه بحكاية عشق بحكاية حزينه والم
