id,dialect,text
1056533945813291008,EG, جدع وهو ده الصح إنك تتعادل او تخسر بشرف افضل مليون مره من انك تكسب او تاخد بطوله مش من حقك  برافو يا درش إنت كدا لسه ضميرك صاحي 
1056670263268532224,EG,"لفت نظري الجماهيرى الأفريقية اللي فالصالة اللي كانت بتشجع الزمالك 

ملوكالصالات"
1056674919306665984,EG, اه حلوة  بس دي إيه علاقتها بإحتفالي لكرة اليد بنادي الزمالك   انا لا جبت سيرة كرة القدم ولا سيرة نادي غير نادي الزمالك 
1056675548326453248,EG, ربنا يديمها عليا نعمة 
1056676324276924416,EG, ماحدش هايحس إحساسي غير الزمالكاوية الزمالك حالة مش هايحسها غير اللي اتولد زمالكاوي  خسر كسب إتشقلب حبه بيزيد وبس  وبشكر ربنا كل يوم اني اتولدت زمالكاوي 
1057624721720856576,EG,هو إيه موضوع الست اللي من المنصورة اللي إتقبض عليها علشان إتحرشت بقرد 
1057740301270503424,EG,مين يعرف مواقع او اي حاجة اونلاين بتبيع روايات جديدة 
1057943389562396800,EG, إلعبي خدود يا موناكو علشان تنزلي الفاتس اللي فى خدودك دا 
1042392418052657152,EG, انا قلت اولع فيكوا يتقطع لساني 
1042428319906627584,EG,"ياجدعان أنا طلع عندي ناس من المنوفيه كتير فشخ 

على رأي الفنان دياب اللي يخاف من العفريت يطلعله "
1042430154130247552,EG,من كام سنه وأنا 
1042430606142066816,EG,ليه كل يومين ألاقي بحال  طب دانا ميال 
1042742648287711232,EG,"ماعرفش طعمها ايه وماعرفش بتتعمل من إيه وعايز ادوقها  مين هايعزمني عليها 

كل سنة وإنتوا طيبين أحبايبي 

عاشوراء"
1042807725724496000,EG," يابني إنت فيه حاجة فى دماغك 
فيه اكلة اصلا بإسم اليوم "
1042829860186599424,EG,انا لو راكب مواصة ومغمض عيني بعرف انا فين من روايح الأكل اقسم بالله 
1042888567507304448,EG, اول مالاقي اللي عملها هانادي عليك 
1042901917070966784,EG,النهاردة غيرت لبنت كاوتش العربية البنات بتوع فيمنست وكوكب البنات بس دول مين هايغيرلهم الكاوتش 
1043047349176688640,EG, امال هاعرف المكان بعيني   دا انتي غريبة اوي
1043265425134502016,EG,ماروحتوش ليه مهرجان الجونة 
1043420676466638848,EG,يارب إنت العالم بالحال  دبرها وإفرجها من عندك لأن مافيش حد بإيده التدبير غيرك 
1043487430555385984,EG,لو فى إيدك تعلمني حاجة هاتفيدني بقيت حياتي  تعلمني إيه 
1043493122490159232,EG, الأديان مش مادة تعليمية انا ممكن أعلمك الإسلام وأنا غير مسلم  الأديان إيمان والإيمان مابيتعلمش
1043495362886012800,EG, يارب وعلى فكرة أنا تحت أمر هزارك ياست الكل 
1043498573097259008,EG, يارب أتعلمها انا كمان لأني انا اسرع واحد يثق فالناس
1043499455474016384,EG, يووووووه  ادعيلي ابقى زيك يا بندقة 
1043505141482184832,EG, يا لوجي مااتحبيكهاش كنتي إلبسي طقم ال مؤقتا وعدي اليوم 
1043506146974273536,EG, طقم الافاتار بالصندل أحلى من الفستان ياست الكل 
1043513425530445824,EG,فيه بنات بتحط خرزة كدا فى مناخيرها مش عارف إسمها بصراحة  بس بحبها 
1043588810225975168,EG, لأ مش حلق يا رانيا دي بتبقى خرزة صغيرة ملزوقة كدا
1043588910675300352,EG, إلبسي زي منى الشاذلي 
1043615031152332800,EG, اللبس كله محترم ياست الكل  لازم عنينا احنا وعقولنا احنا هي اللي تكون محترمة
1043619057520525184,EG,"فيها إيه 

هما مايعرفوش الراجل بيتعب إزاي  ولا هما بيستهبلوا   "
1043996984791707648,EG,حلمت إن بنت باستني من بؤئي وبعد مابستني ببص لاقيت عندها شنب وكل مافتكر أحس إني عايز أرجع وحاجة بنت وسخة مقرفة 
1043998134504951808,EG,النهاردة كنت فى جامعة عين شمس علشان بسأل على الدراسات العليا عايز اقولكوا إن إحنا ماكناش طلاب اللي أنا شوفته بيخليني أتأكد يوم عن يوم إن البلد فعليا رايحة للهاوية
1044138877731115008,EG, لسه اهيه إدعي لها تروح للهاوية بالسلامة
1044141640011714560,EG,يا صباح يا كريم يا رزاق يا عليم  إفرجها من عندك يارب 
1044227058589724800,EG,هو فيه رجالة  اصلا  
1044232740609163264,EG,ساعات بيتقالك كلام صعب اوي يترد عليه باللسان بتبقى نفسك تعمل المستحيل وأكتر من المستحيل علشان تفضل بالشكل دا دايما جرب حب بكل قلبك للي بس يستاهل الحب دا  وإنت هتلاقي المقابل أضعاف  أنا بحبك  
1044239987745718400,EG, انا قبل العملية ماكنتش بشوف فى اي وقت 
1044241091929755648,EG, لأ دا مالوش علاقة بالشوف  دا له علاقة بالغباء والتخلف وبس
1044339226857414784,EG,طب أمي عاملة بلح بالسمن وأنا عندي برطمان نوتيلا كيلو إلا ربع  بفكر أعمل ساندوتش ميكس بينهم وأكلم الإسعاف أبلغ عن نفسي وأنا باكل 
1044339961233837952,EG, طب ودي اجبها منين ياعم امجد 
1044340485064732800,EG, انزل اغتصب اي حد فالشارع طيب ولا إيه 
1044342398401347584,EG, نغتصب مع بعض اااه  إن لعد الظن إثم 
1044348948633321600,EG,قررت أسمى ساندوتش البلح بالنوتيلا أباحه  لو مافتحتش تويتر بكرة إعرفوا إن الساندوتش جاب آجلي وأنا نايم 
1044628067950489600,EG, لأ إنتي بتدلعي ياست الكل
1044919274853289984,EG,"مانستكيش اهوه 

كل سنه وإنتي طيبة وجميلة وضحكتك مبهجة  كل سنه وإنتي مونيقااا وموناكو يا لوزة يا جميلة 

 "
1045248513616084992,EG,بحترم جدا عربيات الفول اللي بتقدم بتنجتان مخلل 
1045328929698066432,EG, أنا بحب البتنجان الخلل أكتر بصراحة 
1045332059269549952,EG, الشاطر بيأثر بطباعه على اللي حواليه  مش بيسيب اللي حواليه يأثره عليه ويوقعوه نفسيا  وإنتي شاطره يا إسراء 
1045332635097210752,EG, طب ماتشرحلنا علشان أستفاد والناس تستفاد ياكوتش
1045333887445069824,EG,أنا أكتر حاجة بحبها هي النوم لإنه بيبعدك عن كل حاجة وبينقلك لعالم تاني بتاعك وأكتر حاجة بكرهها النوم لإنه بيسرق وقتي وبيضيع سنين من عمري الواحد كان ممكن يستفاد فيهم أكتر من النوم
1045341121705123840,EG, لا عايز اجرب ولا عايز أقولك  خلينا حبايب يا نونو احسن 
1045349022058393600,EG,اللي يعرف واحدة إسمها إسراء من التجمع الخامس يقولها إن إصحابها راكبين معايا دلوقتي وبينموا عليها وبيكرهوها فشخ
1045423507973263360,EG, مافيش زمالكاوية مش شاطرة 
1045627611798474752,EG, بصي يابنت الحلال شقة ماعنديش شبكة معاييش فلوسها  كل اللي أملكه عربية هانتجوز فيها وشوية حنية هاديهالك  نقول مبروك 
1045633852750860416,EG,جمعهمباركه  هي ممكن ماتكنش مباركه اوي بس معلش زوقوا اليوم 
1045639829235601408,EG, الف سلامة عليكي يا لوزة إشربي ميه كتير
1045641521276571648,EG, سيبي بقى الموضوع دا مع الوقت يالوزة وإنتي اللي هاترجعي بعد شهر تمسحي التويتة دي 
1045699294098002048,EG, قلة المية والأكل والنوم هما اللي بيسببوا الصداع وإن شاء هاتبقي كويسة يا جميلة 
1045785391998136448,EG,بلح بالنوتيلا يعني صورة فيها  مليار سعر حراري  توكلنا عليك يارب  
1045796497571401600,EG,السؤال هنا ليه تخرج من البيت و وشها يبان أصلا  
1045798420961788032,EG,"جوز أختي مالوش فالكورة اوي وكان بيتفرج معايا ع الماتش بيقولي هما رجعوا الجماهير تاني  قولتله لأ دا علشان الماتش فى الكويت  قالي دا الملعب كله جماهير الزمالك  دا أكتر من جمهور البلد نفسها 

القادسيهالزمالك"
1045928866831912960,EG, هو انا قايم من النوم دايخ شوية بس كويس 
1045950697085243392,EG, المره الجاية تصلب فالشرايين 
1046149329336045568,EG, أجبلك ساندووش أباحة زي بتاع إمبارح 
1046159081185177600,EG,طب دلوقتي فيه بنات إصحابي بيقولولي إن مرات أحمد الفيشاوي دي عمليات نفخ وكدا  وفيه بنات بيأكدولي إن كل دا طبيعي  وانا مش عارف أصدق مين وبعدين فالجمل اللي محير اللي جايبنا دا  
1046308902961393664,EG,مضطر أحاول وأعافر فى مكان مش مكاني لحد ماوصل للي عايزه وفى يوم هاوصل  صباح الخير 
1046396301200510976,EG, ياجيمي هما بنات ويفهموا فى إمكانيات بعض 
1046401123278618624,EG, يارب تبقوا كلكوا وحشين زيها 
1046701986375225216,EG,الدنيا دي فيها الحلو والوحش 
1046703183593197568,EG,أنا عمري ماندم على حاجة عملتها لأن دايما بعرف إن قراري كان صح بس فالوقت المناسب  ممكن الوقت المناسب دا يتأخر بس بعد النتائج المترتبة ع الأحداث بعرف إن كان قراري صح 
1046704619777331200,EG,ماهو أكيد ربنا هايفرجها وهايفرحنا بس كل شئ فى وقته  أكيد صح 
1046861995767713792,EG,"وأنا صغير  او  سنين كنت بتفرج مع بابا على ماتشات الزمالك بإعتبار إن بابا زمالكاوي كنت بلاقي المعلق بيقول كلام حلو او ما لاعب معين يمسك الكرة الجماهير تهيص اول ما لاعب معين يعمل حاجة بالكرة ولما سألت بابا قالي أصل اللاعب دا هو حازمامام 

"
1047071436911927168,EG,نازل المحطة الجاية يا أستاذ  
1047109247090270208,EG,لتاني مرة أحلم حلم مش كويس خالص لحد ماينفعش اطمن عليه ولا هاينفع اطمن عليه
1047113840645804032,EG, تعالي اركبي المترو عندنا وانتي كل شوية يتطبطب على كتفك 
1047114186071974016,EG, تعالي مصر وانا هاركبك كل وسارل المواصلات 
1047118865526853632,EG, لا لو كدا تعالي بعربيتي ارخص بقى  المواصلات فى مصر دلوقتي غالية 
1047127655559106560,EG, ربنا يخليهولك ياست الكل
1047129193304285184,EG, هاهاهاها  مش بتاع الحورات دي انا ياست الكل  بس شكرا جدا لمحاولتك معايا 
1047502677452750848,EG, هو أنا مابروحش جيم علشان البسه أصلا بس اللي عرفته من اللي بيلبسه إنه بيساعد كتير فى إحكام الأوزان  بطلوا بقى سوء الظن فالرجالة  حسبي الله ونعم الوكيل فيكوا 
1047504315227799552,EG,آيه عايزه طيار دليفري مش عريس 
1047576199210446848,EG,فين البهايم اللي مش بيعجبهم راكيتتش 
1047577523985559552,EG,"الضربة اللي ماتموتش  تقوي
 وممكن تفرتكك برضة"
1047903556454555648,EG,لو جتلك الفرصة إنك تقابل حد من المشاهير لمدة ساعة تقابل مين 
1047955378355539968,EG, ماتفقناش على كدا يا آيه عايز إسم واحد
1047956399580491776,EG, ماتحطيش رسول الله فى مستوى واحد مع المشاهير  رأيي 
1047958270894383232,EG,  كلم يا كابتن   لو حد ثبتك إعرف إنه كان جيمي 
1048100212626132992,EG, إنت خدت بالك من كلمة حد من المشاهير 
1048100545381224448,EG, ياعم فطوطة شخصية تليفزيونية 
1048107115783643136,EG, أنا برضة حسيت إنك مستعجل 
1048123659779551232,EG,"إحنا لو فى دولة بتحترم تاريخها وبتحترم إنتصارتها الحربية كانت أجبرت القطاع الخاص على إعطاء أجازة نصر أكتوبر ومش يوم ولا يومين  لأ دا الشهر كله أجازة دا سينا رجعت لينا تاني ومصر اليوم فى عيد يا جماعة

صباحالخير
جمعهمباركه
عيشنصراكتوبر"
1048143286937047040,EG, صفحة وورد على طول بقى 
1048185068957655040,EG,يااارب اللي بفكر فيه يحصل 
1048198186043621376,EG,  يجننوا من أنهي إتجاه معلش  
1048200138563489792,EG,"خرسم علاج لكل الأمراض اللي مالهاش علاج هرسم سلام لكل الدول اللي بتحارب
هرسم أمان لكل اللي محتاجه
هرسم كرامة للمواطن المصري
هرسم ضمير للحكومات والسلطات
هرسم محبة لكل البشر  "
1048244229565296640,EG, تحس    لا إحنا فعلا اللي عواجيز يا سوما 
1048657022500200448,EG,"اووووووه زمالكاوي  اووووه زمالكاوي 

الهلالالزمالك"
1048659460665819136,EG, ماله  هايلعب كمان يومين فالدوري المصري 
1048660830827556864,EG," أحلى إستهبال ياروحي 

بس أحب اوضحلك إن اللي هياخد حقكوا  اخر بطولتين قدام الزمالك خسرهم  واخر ماتش فالدوري خسره برضه "
1048661923888332800,EG, أحلى عم عبده فالدنيا كلها 
1048832144922091648,EG,ملحد صالح أفضل من مؤمن فاسد  صباح الخير 
1049047105803865984,EG, دا اللي المفروض يحصل  بيحصل بقى ولا لأ  دي حاجة مش مضمونة
1049053625446793216,EG,يعني واحد زي وليد سليمان دا إزاي ماينضمش للمنتخب 
1049054871947804800,EG,أنا وزني زاد  كيلو  ناقصلي  كيلو واوصل للتارجت اللي عايزه   إنتوا فاضل لكوا قد إيه ع التارجت بتاعكوا  يجوز الإجابة بالسالب  
1049279933829341184,EG,الصفقة الجاية بإذن واحد أحد  
1036728445890424832,EG, لأ يلا شد حيلك دا أنا رايح بكرة 
1036754397055856640,EG,فى مره حد مني إتوجع 
1036868505478615040,EG, لا عادي دي مش اول مرة 
1036890163698429952,EG,يقال أن اربعين دعوة من غريب مستجابة مش عارف مين اللي قال بس ابوس إيدكوا إدعولي 
1036913005114654848,EG, فيه تكييف تعالي إنتي بس ومالكيش دعوة 
1036920748185665536,EG,وست الكل لو تإذن 
1036980527889346560,EG, رايحه تتفرجي ع الأجانب بالمايوهات يا رانيا  
1036989756314448000,EG, ياستي مش لازم المايوهات البكيني المايوهات الرجالي بتبقى مغرية برضة  سيبيلي أنا البكيني 
1037073605857865600,EG,لا فرشتلي بستان ولا حتى بر أمان  أعيش عليه إنسان والدنيا فى إيديا
