id,dialect,text
677946265297149952,JO, وال منشنهم ما عرفت ولا حدى 
677948094923821056,JO," خلص احكيلي ياهم دي ام يزم فضولي بدبحني
هو جلد بعقل أشك إنو أنا الحدى يللي معمولي ميوت اصلا"
677949197681864704,JO,جيتار كلاسيك للبيع أي حدى مهتم أو بيعرف حدى مهتم يخبرني 
677951842635145216,JO, هههههههههه شايفه والله بموت فيه ولهلأ بحبه وبسمع بس ما زبط معي اتعلمه 
677953185793908736,JO, ما هو متعبني نفسيا عشان كتير بحاول اتعلم ومو زابط معي 
677955052527558656,JO," اه لأني آخر فترة أهم اشي نفسيتي
والله أنا مشتاقة وبسطيني انك لسه متزكريتني"
677955244832215040,JO, ماشي يا أبو العريف ازا اجاني دور خبرني بالله 
677958303188692992,JO, ههههههه بتهيئلي هاد بكون بالغلط
677961555372306432,JO,"  اسمع ترى مغمى علي ضحك هلأ لانتبهت مع اني متأكدة كنت عاملة 
خص سامحني"
678127440842092544,JO," مس يو مور والله
بس تيجي راية لازم نتشاوف وبنحكي لكي كي وربى"
678150909185163264,JO,سرعة عصبيتي أسرع من سرعة الضوءليه
678190977526407168,JO, من الصبح وأنا أفكر وقررت ما أغسلها
678195110618656768,JO," بالمرة مو مشجع
هههههههه أنا أسبوعين"
678196592940326912,JO,عقلي شارد بالي محتار
678237387055628288,JO,"  جد إنك لئيم
أصلا بخاف عسيارتي من العين عشان هيك بحب إضل وسخة"
678238943519875072,JO," نيسان جوك وانت 
بردلك ياها تخافش"
678241891494838272,JO, ايه ايه صدقت حالك انك نشيط
678301170532790272,JO,"لازم كل يوم أتنهد تنهيده طويلة وأختمها ب
     "
678301806997426176,JO,يللي بفكرونا إنو إحنا هبايل 
678302039529627648,JO," شو أجنبو 
معلش سامحهم قلبك كبير "
678314569291456512,JO, وبيقولوا الحب بيقتل الوقت
678336062310215680,JO,ما عندي وعم بستنى بلكي حدى جابلي ياه بعيد ميلادي 
678612389089161216,JO, الشغلة مو شغلة تفاهم الاشي بيرجع شو بيئتك وشو تعودتي
678615029936205824,JO, مممممم انداري بس كمان البيئة بتلعب دور كبير
680106703778611200,JO,طيب يللي بيتهبل وبيعمل حالو مو فاهم كيف نفهمو
680421785456766976,JO,بدك مليون سنة لتعرف أنا مين
680728964235661312,JO,"لألألألأ
ليه
هيك أنا عقلي"
681236318416973824,JO,"عن لما يضيع مصاري منك وتكون حارم حالك وضاغط عحالك عشان تجمعهم لأنك بحاجتهم ضروري
انداري كيف الدنيا"
682938649835651072,JO, حمدلله نشكر الله هيني عايشه وانت شو اخبارك
683053590580191232,JO, خص يزم سيبك منهم تعال عازمتك بس روق
683348475887677440,JO,يا جماعة شو في ليه الكل داق ببعضو
683416894687330304,JO,بالي ضايق ضيق كايد
683423597721960448,JO,نفسي أعيش لحالي ببلد ما بعرف فيو حدى
684131666265280512,JO," بصير أحسدها
جد نيالها
أبدعت"
684470275447087104,JO," ههههههههه نوم الهنا بس جد هاي النومة بتكون جدا غميقة
ألف ألف مبرووووووووووك ومنها للأعلى يا رب وعقبال ما تحقق يللي ببالك"
685251966839209984,JO,عأساس الدوا بنيم وينو هاد النوم
686663382926245888,JO,ليه كل الناس يللي بحبهم فجأة بروحوا
687001604084609024,JO,بكون أكتر من صاحب كمان 
687736847414484992,JO,سيارتي بسرعة بتتوسخ وبعدين
687738315265708032,JO," هههههههههه لا بتقطعش 
عإستعداد أجرب بكمل عيللي عندي تعاندش"
687738866007171072,JO, ما انت عارف الجواب ليه بتتغشمن
687739667148615680,JO, ما بحب وما حبيت ولسه بستنى بالحب العظيم الحب غذاء الروح
687747157026275328,JO, صح لسانك بس هات حدى يفهم ازا الشعب بحكي عنو معاق كلمة معاق لحالها حط تحتها مليون خط أحمر هاي هيك ألفاظنا ما بالك أفعالنا
687747507867258880,JO, هو حاليا سبيكر بس هون ممنوع يشتغل لأنو بنظرتهم هو إنسان عاجز ما بيعرف يعمل اشي ومو من برستيجهم
688427368134881280,JO,تعالوا شوي خنتسولف بدل سكوتكم 
688427934856704000,JO, ههههههههه تعالوا والله ما بنزعلكم
688428427876126720,JO, ههههههههه هو يكون في واحد وبعدين بنتفاهم عهالموضوع
688428624882577408,JO, عروضنا لفترة محددة اغتنموا الفرصة
688429755851476992,JO, مشاكلنا بينت انت عندك خلل بالماركتنغ وانا مشكلتي بنفسن بس حدى يبعتلي دي ام
688434736230957056,JO,عجبني تنسيق الكلمات عنفس النوته 
688438909794148352,JO,مزبوط واجاني نمرة من هالنمر 
688792681611407360,JO,يا الله ما أكترهم بحياتي 
689888434316517376,JO,إمتى الزمان يسمح يا جميل
689889364961280000,JO, لحتى الفار يلاقي اشي يلعب فيه بالأول
690509193774788608,JO,"من كتر ما احترمت بعض الناس وحطيتهم بعيوني ورفعتهم عراسي فكروا حالهم اشي كبير وصاروا يتكبروا علي
بحب أحكيلكم ترى بطلتتفرق معي"
690849935059738624,JO,يا رب بعض الناس توصلهم 
690850126219321344,JO,ازا حدى عرف كيف يخبرني 
690994068139184128,JO,المكيف يللي بالشغل خربان طيب انا بكرا شو حيصير فيي
690994257524555776,JO, وعصااا تضحك بلا اسنان
1157682822938857472,JO, اكثر موضوع لما اشوفه بتنكد و بتحسر على الايام هي 
1157691596986618112,JO,انا مقرر انها    عجبها عجبها ما عجبها برقصها لحالي  
1157695050912075776,JO,وبما أنه هذا الموضوع انفتح مش متخيل كمية الحكي يلي راح ينحكى أنه كيف منظرهم 
1157695052958879488,JO,لانه اقل فرق طول راح يكون من    سم
1157697094620073984,JO, لما تقيسها اطول بنت  وانا   راح الغي والفقره هي و أزيد المهر اشتري راحت بالك
1157698207142633472,JO, ما راح ترفع معنوياتي هي بالحضيض 
1157745801201934336,JO,عندي عاده اذا بلشت احكي في موضوع عارفه كثير وفاهمه ما بسكت
1157746064147046400,JO, هي اكله اختلف عليها العلماء ناس بتكرهها وناس التشعاتشيل بتمشي بدمها
1157746866991374336,JO,حطوا اي صورة ثانيه بلاش هدى تزعل على حالته 
1157747878972071936,JO, أو بور شيل بزبط معها 
1157749500661915648,JO, بالمقابل راح اداوم العيد بس لا بأس بفرقش عندي
1157750048962338816,JO, قسم بالله صار عندي وسواس الفيل القهري قد ما بشوف اسمك  هــــدى 
1157751180271017984,JO, الدوام عندي متعه ما حدا بستمتع بالشغل يلي بشتغله قدي
1157751478091751424,JO, لل  يعني بعد سنتين لما اعرفت شو يعني سبتويت  ايام ما كان تويتر تويتر
1157753334339686400,JO,مره قررت اسجل بجيم مشان أزيد وزني لاني طويل و مسلوع شبه فرعون وهو محنط
1157753336441053184,JO,رحت اشتريت اكثر بروتين فيه نسبت فات و خذلك اكل من حنب وطرف بعد شهرين انحفت ك وقفت كل اشي خفت اختفي
1157753877174861824,JO, اكثر جملة بخاف حدا يحكيلي اياه  منك لله  ومن قلبه
1157756684590338048,JO,"ال  حولينا في كل مكان كل اشي حولينا بما انه ماشي بنظام اذا هو ماشي ب 

بسبقول"
1157757249005203712,JO,   انت راح اجيبها من تحت الارض لازم يعني لازم
1157772269437050880,JO, قولتك  هيك هيك بتخلعي البلاط و بتنظفي تحته بهندسة و بدون  بالنسبة الك
1157773063259414528,JO," اي اشي ب
ثاني بالخدمة احنا"
1157776862082469888,JO,شعور كثير بخزي واذا كان من ناس كثير قراب عايك وحتى هذا الاشي صار معي اليوم 
1157787175393607680,JO,حرفيا هيك راح يكون منظرنا  
1157942862362947584,JO,"صرفنا وادلعنا 
وهسا طفرنا وولعنا"
1157943709188743168,JO, احذر منه صاحبك هذا  وبحياتك ما تأمنله
1158044690249371648,JO,طيب ما انا للرايحه و الجايه بحكي يختي ولا صار اشي 
1158045470159245312,JO, والله يختي طلعت انا فاهم غلط
1158048230497837056,JO,الحلو أنه اليوم راجع على عمان
1158048810322550784,JO,طيب بما اني برشلوني متعصب و ارسنالي متزمت راح اعمل مثل كل مرة بلتقوا فيه اروح انام و الصباح رباح
1158750290386071552,JO,في ناس ال  ادمان عندهم
1158750482183217152,JO,مجرد زياده طيب ليش  هيك بس 
1158751302270279680,JO,كمان ثلاث ايام عيد ميلادي ال 
1158759625426186240,JO,انك تدرس اشي و تشتغل اشي  وحتى لو بنفس شهادتك لانه يلي بشتوفه بالدراسه غير عن الشغل 
1158761382038425600,JO, والله هذا يلي شايفه صارلي  سنوات متخرج و  سنوات شغل ما شفت حدا ميكانيك استخدم قانون باسكال 
1159047740174868480,JO, صرت حاكيها عشرطعش مره اليوم
1159095928839712768,JO,يلي مهون علي الامور أنه بعد بكرا مداوم
1159180408862531584,JO,ولا بحياتي استخدمته واذا فكرت استخدمه اجيب سطل دهان اوفر 
1159523557065539584,JO,مرتين بحياتي التقيت في بنت طويله لو شديت حالي شوي بروح اخطبها عمله نادره  
1159577851995348992,JO,وبكون هيك كملت ال سنه
1159577937693290496,JO, يسعد قلبك جاري الفخم
1159833015716999168,JO, لما يبلش جزء جديد كنت ابلش فيه من الاول
1159860431386796032,JO,اذا على ساندويش الزعتر بحط حار 
1159948188012482560,JO,متت ضحك على حالي مش قادر
1160152264486641664,JO,صحيح شفتها متأخر يوم بس شكرا 
1160152571828416512,JO, لانه الناس صايمه كابسه معك 
1160211119539183616,JO,المشمهندس غابيتو  زمان عن هذا الاسم
1160264966613741568,JO, اطلع اتنكد بلندن ولا اتنكد بالدار
1160307943188979712,JO, والله انتي مش عارفه شو بدك مره   ومره   ومره   
1160308797023424512,JO, خليني اختصر احسن شو بالشني هالبلشه 
1160309301325508608,JO, منتي على بكيفك وكل سنه وانت سالمه 
1160323582196670464,JO,طبعا الهدف اني اوصل البيت تعبان و انام على السريع
1160476725949734912,JO,انا انفلمت من الشغل المفروض اداوم وهي عطلونا 
1160477217266311168,JO,وكل سنه وانتم سالمين
1160477694339031040,JO,وين بلاقي خرز وملبس حبال 
1160514334071644160,JO,يلي مصبرني انها الخريف قرب
1160541677800611840,JO,الله يسامحك يا شغلي كان خليتني مداوم اوفر وما بدي اضافي 
1160558126606761984,JO, ما في بعد دوام العطله
1160592640682995712,JO,يمكن صارلي اكثر من  سنوات مش مشتري اشي للعيد خصيصا
1160594827005833216,JO, كنت المفروض مداوم العيد كامل ومبسوط عطلونا ونكدوا علي
1160595121869611008,JO, بضيع وقت بدل القعده
1160595715338510336,JO,هسا هو كل محامي ناشط حقوقي أو كل ناشط حقوقي هو محامي
1160605129101467648,JO,والله العقبة مش شغل طشة
1160606495500845056,JO, انا بكره الوظيفة وانتي الأشخاص للشغالين هي الوظيفة 
1160607368679448576,JO,ما ازكاه لحمه مفرومه ناعمه على طنجرة كوسا  
1160610331665817600,JO,معقول في ناس لسى شغالين في التسويق الشبكي
1160618047645917184,JO, رتويت خلي بكرا تويتر يعوفك حالك 
1160627625158750208,JO, كل واحد بحسبها على جوه لما اكون بعمان بوقف بصفك
1160656497698836480,JO,قررت اشتري بك اب هايلوكس
1160671602993967104,JO,وات از ذا ميننج اوف كشخه 
1160675204391198720,JO,اهم اشي محترم وخلوق  
1160680087559311360,JO,اول مره تصير اخواني الخمسه و خواتي الثنتين مع بعض بنفس الوقت
1160680233898524672,JO,بالمناسبة ابو متزوج ثنتين 
1160687238512041984,JO,بتنكد لما اتذكر أنه صارلي  سنوات مخلص توجيهي وأنه كيف الوقت مر بسرعه هي
1160691741198098432,JO,جاي ع بالي احضر مسرحية الواد سيد الشغال
1160849301645549568,JO, يا رجل بطلع من العقبة على الراجف طريق الملوك مشان اشرب قهوه و اروح
1160850657512972288,JO,كأنه قاعدين بنكبر على الفاضي
1160923870737707008,JO," شو بتعمل 
 والله شوي مشغول "
1161046507686154240,JO, ما الك غير تيجي عندي  غرفتي شغل نوم بمعنى الكلمة
1161047413609639936,JO,بعد غاد شوي خشوف  اه اه هو احنا بالتمام الاردنيين 
1161074072438157312,JO,   صاحبك وانت أدرى فيه
1161079729786642432,JO,احسن اشي صار بحياتي اني درست هندسة 
1161238679123353600,JO,مش فلسفة بس النظارات الطبية على البنات احلى من الشباب
1161345188285091840,JO, الايناث في الحفلات ثلاث انواع الاول بدور على عروس لابنها النضوه و الثاني بتسوق للمنتج يلي عندها و الثالث شغل انتقاد
1161378094390939648,JO,"هكونا متاتاحكمه نغمها لزيز

هكونا متاتاإنسى الماضي الي يغيظ

إنساه والمستقبل إديه كل التركيز

هذا هو البهريز الفلسفي"
1161388854693285888,JO,وانا في صف اول لغاية الصف الثالث في الكرك كان في بنت معنا اسمها سلسبيل العمري كنت معوفها حالها قد ما كنت العب في شعرها واذا بيوم اجيت ولقيت حدا قاعد جنبها على الطاوله الدائرية اسرق اشي من شنتته  
1161402219520024576,JO,لما تشوف القلم بيد الجاهل و السلاح بيد المجرم و الفاسد في السلطه اهرب بسرعه وبدون ما ترجع
1161403737266630912,JO,كل اشي يمكن يتغير بلحظه فجاه والى الأبد
1161404563238326272,JO, بتستغني عني بالسرعه هي يا عشري 
1161405516620414976,JO,متى راح ييجي اليوم وكل الامور تكون بخير
1161651612567429120,JO, والله الدوام مش عاطل على الأقل كل يوم بتطلع من البيت
1161684872999706624,JO,اكثر اشي مريح نفسيتي والفترة أنه الدوريات الاوروبية بلشت و راح ارجع اشوف برشلونة
1161918737576026112,JO, مثل ما صار معي بعد ما خلصت جامعة  قعدت متوحد ولحد الآن متوحد
1161998678443384832,JO,يلي اخترع اشي اسمه اغاني المهرجانات المصرية الله يخرب بيته قمة في السخافة و الازعاج و التلوث السمعي
1162048376336199680,JO,نصيحتي ما حدا يرد عليه 
1162157383579242496,JO,بتقلي شوف القمر وياي شوف القمر
1162157857443328000,JO,ما بقهرني غير الشب يلي بكف بنطلونه من تحت شو يا حليوه بدك تفرجينا شعر رجليك ولا خلخالك
1162163681435815936,JO,القدرة عن التعبير صفه مش الكل بمتلكها انا من النوع قد ما يكون عندي حكي صعب اني اشرحه
1162332205886115840,JO,"لما اشوف حدا مذايق
 ما تهكل هم يمكن تطلع من البيت و تندعس و تموت خذ الامور ببساطه "
1162378703311179776,JO, اقعد يا بسام العزام
1162467893210169088,JO,فات ادوريز من هون جاب جول من هون
1138135434268225536,JO,يعني يا هالامانه كان سكرتي على هالتصميم و اعملتيه مفاجاه وسكتينا بدل ما تجيبي الحكي لحالك 
1138159457744171008,JO, لما تتخرجي من الجامعه راح تعرفي شو معنى ذكريات
1138177055122739200,JO, راح يجي هاليوم وتحكي والله ابو الزرف معه حق
1138284927181627392,JO,عادي اني اصحى على  وكل يوم اتاخر عن الشغل
1138318863072989184,JO, من  مادة تقنيات عددية وتفرق معاي تفرق ما بتفرق لا تفرق مش فارقه معاي مش فارقه معاي 
1138376899984527360,JO, بعرف اسباني كثير منيح بس حاب اصير متمكن منها أكثر يعني لغه كامله
1138377938083176448,JO, ولك انت لو تغير هالصوره بتتحسن امورك
1138395304246599552,JO,بكل بساطه لا مش حجاب هذا ديكور للي مش متحجبات 
1138516503878352768,JO,خلصنا من جماعة ال  طلعنا في موضة ال
1138666208360882176,JO,اشتقتلك اشتقتلي بعرف ما راح بتقلي لكن أنا عم قلك اشتقلك 
1138698645375803392,JO,الفرحه و الصدمه بنفس الوقت  
1138704155244204032,JO, اكيد ساعتين نوم زياده هذول حلم
1138711446626459648,JO,جملة  يا ديرتي  من وراء عمر العبداللات بطلت تليق غير على الكرك
1138711940900032384,JO,هذا صحيح كافتيريا هي نفسها   
1138766999075610624,JO, بالله عليك وزير تكنولوجيا المعلومات اذا بدك واسطه موجوده ترا
1138770321610334208,JO, طيب  دنانير بتسافري اسبوع و واصلات لعندك 
1138872331659612160,JO,صراحه و بدون اي مبالغه  يعني واحد صارله عايش عزابي  سنوات اكيد خبص لما أتقن 
1138908173258108800,JO,احكيلنا عن شو بتشتغل 
1138908907114520576,JO,حظي بالشمام و البطيخ هالسنه بفلق الصخر  يا سلام
1139112923434016768,JO, قعده جيران الصبح ما في مثلها
1139113561022783616,JO,  من كل التايم لاين ما لفت انتباهي غير هالهذربات هي 
1139115544337092608,JO,انا بشوفك كثير و امبارح حلمت فيك حلم حلو  ما هو لازم ينفتح موضوع 
1139176856966566016,JO,  اي كره بتيجي عندي بفقعها يلا انقلع 
1139200629862273024,JO,منيح اني اعرفت من الصبح وانا بفكر المشكله بتلفوني 
1139220137905725440,JO, اكتشفت أنه مشان السوادن بس شو التفاصيل الله اعلم
1139359396830433152,JO, وهيك صارلي  ساعه صاحي
1139511104785256448,JO, وانا معك بس الناس بتحب تتفلسف يعني لو كان الممثلين اردننين وتصور برا الاردن عادي بس لانه جو الاردن لا وهم مش مقتنعين أنه هذا المسلسل مش لتلفزيون الاردن وأنه الاردن كانت مجرد موقع تصوير لمنصه عالميه
1139569121396502400,JO,انت لما تشوف واحد الله معطيه انت بتشوف الخلاصه ما بتشوف شو كان كامل وشو بعمل بحياته
1139569445641302016,JO,كل اصحابي الغاليين علي كانت معرفتي الهم بعد هوشه 
1139581291748319232,JO,يا اخي ما تتصنع مشان تقدر تمشي مع الجماعه وتسوق مثاليه مشان كم بنت
1139596699389890560,JO,لما تتعود على ال  ببطل يعبي عينك ال  المجد للينكس
1140024311048286208,JO,في اغاني ما حبيتها غير لما اسمعها لشخص عاملها 
1140212884900909056,JO,لو اشيلهم كلهم اموت احسن 
1140242407650398208,JO,بقول ليك يا رايح شثر ملايح
1140519832611414016,JO,بما أنه احنا لا لصد ولا للرد وشغل تكاثر روحوا اشتغلوا و اصرفوا علينا روحي افتحي بيت روحي اتمرمطي بالحياه مشانا 
1140571397837734016,JO, راح اطبخ مجدرة اليوم احطها قدامي و اضل اتغزل فيها
1140577017580183552,JO,عندي عاده اطلع على عيون البنات وبشوف خط الايلاينر زابط او لا  طبعا قبل ما اعرف معناه  
1140589331389800448,JO, الأغلب عين مزبوطه وعين لا  ويلي زابط بتكون نعسانه لأنها صاحيه من ال  الفجر 
1140589528824131584,JO,  وقتها يا دوب تلاقي  بنت
1140598594837389184,JO,ما اكثر كلمة  من اليوم وطالع طالع 
1140599401401978752,JO,"قد رسبت اه
اخذوك رحله اه 
هربت من الصف اه
أحلى ماده معك رياضيات 
أكره ماده معك  الدين لانه ولا مره درسني اياها استاذ منيح
عطوك فصل من المدرسه اه
عطوك تعهد اه
هربت من المدرسه اه
سويت مشكله اه
نسبه آخر سنه  
ودك ترجع ايام  بتمنى "
1140699157247795200,JO, ولو عملوا كان طنشت انا كمان 
1140701461279649792,JO, اقلها كان في نيه الحفله ال حنا ولا فكروا  عملوا قفز حواجز علينا
1140701590401224832,JO, الحكي هذا معي من  أو خمس سنوات 
1140703473446608768,JO, هذا من يومي طلعت مريض ايلاينر 
1140865899076956160,JO, لو حكيت  لحاله كنت راح احكيلك   
1140899420369821568,JO, ومع الكعب العالي كمان يا دوب توصلي كتفي 
1140979942898860032,JO, احتمال اخبصهم ببعض اه
1142057836802973568,JO, ليش هالتناحه والله منا عارف  و مثل ما حكيت انا
1142058242098573184,JO,و المشكلة لو حط رقمي على اي  راح يطلع بهاء الشواورة 
1142058667350601600,JO,  والله التكنولوجيا ما خلت اشي كيف بتصرف هيك والله ما بعرف
1142058973429993600,JO,ومشيت معه شوي على أساس بنت بس احزنت عليه  بلاش يبني امال
1142314099424014336,JO,جايك يا سيرفر يا ويلك مني 
1142347432119951360,JO,العلم يلي ما بأدب صاحبه مايلزمناش
1142408330226425984,JO,في حدا لما يدخل على نفق بعمان بتنزل نقط مي على سيارته ولا بس انا ما هذا الحظ العاثر
1142426499796164608,JO,عادي تبين على حقيقتك ما بوزعوا جوائز للمثاليه
1142532424292798464,JO,نفسي ابطل ادمان الحلويات ومش قادر بطلت اقدر اكل مثل الناس
1142543872855302016,JO,ابوي واشم اسم امي   ويا خوفي يكون واشم اسم مرته الثانيه  معقول بعملها 
1142837108643631232,JO, انا لو اسمع اسم جامعة الطفيلة بصير بدي اعيط من كمية الذكريات يلي فيها ما بالك لو أمر قريب منها
1143187473708834816,JO,  من اول مرت شفت هالشغله انتشرت وقفت ولا وبلشت الأسئلة تغمق 
1143258955940028416,JO,"مش طبيعيه هالتايلور ديفز

"
1144270584265826432,JO, اي مكان كبيتيهم  أو ابعثيلي اللوكيشن
1144558572606558208,JO,السؤال اعمارنا بتزيد أو بتنقص
1145576225479516160,JO,اليوم دوام بكرا عطله بعده عطله بعده دوام بعده عطله بعده عطله  ضروري هاليوم الدوام هذا
1152774283241971584,JO,لما يطلع الصبح وانت لسى بالشغل 
1152957798231265280,JO, من ثلاث ايام عالقة براسي اغنية حبيت ما حبيت ما شاورت حالي
1152959797320388608,JO,  ما بتصفن هي في المرايه بعد ما تعمل هالعمله شو بتهيئ الهم
1154133122159693824,JO,بحس حالي انا ال   الوحيد يلي ممكن يشتري   مشان تلفونه 
1155571265274621952,JO, نزل الراتب  وافقنا على عرض سعرك  شيكك جاهز تعال استلمه
