id,dialect,text
912728938807472000,SA,"يا جماعة الخير اللي يسوي سالم شيء كبير والله أسيست بالهدف الثاني
وأسيست آخر ولا أروع لعمر
أجمل النسخ والله 
الهلال "
912732547032985600,SA,تكفى ياسالم بالثمانيات والله
912976633002446848,SA, الله يبارك فيك  يامدور الهين ترى الكايد أحلى
914507543770255360,SA, للأسف أنه يبي المترجم يظلل علينا كزملاء له قبل الجمهور  
920350390427713536,SA,لا ياخذك غيري ترى خاطري فيك  
920635928762306560,SA," كيف حالك كيفها ايامك بدوني
انا حالي بعدك انتي مختلف
انخطف فرحي ولوني 
والعقارب ما تلف"
923593229832016000,SA,كما توقعت عطيف يواصل سوء المستوى 
924721635961254016,SA,يا جماعه تعبيرات الأمير فيصل طالعه من قلب 
932264025148272640,SA,"كذا أوفر 
كانت الخطة الناس يتجمهرون بس للأسف فشلت 
ترامب ما سواها يالمنشد والشاعر الكبير 
 "
944966481250529152,SA, محد يختلف على كلامك يا دحمي بس حرام عدم إستثمار خانة الأجنبي دام قناعات المدرب هذي
944993621853470848,SA,مع دخول فتحي خيبري والشلهوب ولا بنشوف شوارع 
950433255924232192,SA,ثالث تبديلات الهلال خروج عمر خربين ودخول مختار فلاته
950491904294248448,SA,"إعلامي نزيه وجريء من يومك يابو فارس 
سؤال جريء 
"
952228560332259200,SA,جحفلي وحبسي يواصلان القتال لأجل الشعار قسما بالله بكفه والباقي بكفه 
954764455434362752,SA,"هههههههههههههههههههههههههههههههههههههههههههههههههه يا ذا المنتخب ومصلحته اللي يلزق فيها كل شيء 
لعب كبير والقادم أسوء من كذا "
954776882762911616,SA,"دياز إنكشف بعد إدواردو
الهلال هو إدواردو
طيب الفريق اللي كلكم صفقتوا له قدام الأهلي مين 
تسريب التشكيلة والصويلحي والحنيان هم المشكلة
ياخي إذا ماتبي تتكلم بواقعية إلزم الصمت مو لازم تنتقد للإنتقاد فقط"
954777265321201664,SA,والأسوء من هذا كله من يبتز النادي بدعمه بحملة ادعمناديك يا أخي كيف كنتم تطالبون أعضاء الشرف وتعتبون عليهم بدعم بالملايين والآن لأجل إختلافات بسيطة مع الفريق تبتز الفريق بريالك عيب اللي يصير
958824505966780416,SA,"وش فيكم زعلانين للمصلحة الوطنية 
الوضع صاير يجيب الهم والمرض  "
960189318911414400,SA,"الرباط ما يخليك تزحلق كذا
الضغوط ما تخليك تزحلق كذا
أخرج مع الباب الصغير يامجاهد للصبر حدود"
960192144131673984,SA,دياز يتوج نجومية كنو بتبديله 
964144765406273536,SA, كله كوم ويوم يقول الطيارة تطير يييييييييييين طع وتوقع أقنعني حقيقه 
964557522282704768,SA,والله حقه بالنعال برى النادي 
964582220311736448,SA," وش فيك يابو فيصل مدرب الأهلي غريب
والله هو اللي ولع
مبروك ياحبيب القلب "
966254980297625600,SA,"مدرب كبير حطم جميع أرقام الفرق بالدوري
قدم مع الفريق مستويات جباااره
خاض  لقاء لك يخسر سوى  لقاءات مين اللي يشيله مين "
966255559258398848,SA,"الرجل قاعد يعبث بالرياضة
يبي يسوي كنترول على الجميع
يبي يكون بالمشهد دائما
ولا أحد يشوت مارفيك وفريق كامل قدم لنا عمل إحترافي للتأهل للمونديال
تخبطااات تخبطااات مالها نهاية "
968897616141529216,SA,محتااجين نستنخ من هالنادي اذا نبي رياضتنا ترتقي 
969654019990880384,SA,"كل نبض في خفوقي لو نطق قال الهلال 
مبروك يا زعماء"
969901276657078400,SA, الظاهر حنا نمونا على النمط البطيء 
969927440092090368,SA, أتذكر حديث  بالسناب عنه هالآدمي مجرم باللي يسويه
972190477004009600,SA,"فوق على المستوى الشين لسانك قذر
نعم أفضل لاعب سعودي "
976503685428793216,SA,"تضيع المحبه يوم تهمل شعور الشوق 
مثل ماتضيع أغلى العطايا من المنـه "
980842887578640384,SA,"صحيح البلنتي صحيح لكن قبلها هناك طرد واضح لـ إسماعيل أحمد 
عهر تحكيمي"
981261575532306432,SA,"يخرب بيت بيت بيت بيتك 
وش هالعظمة وش هالهدف
مدريد"
984170218909065216,SA, اهدى من كذا يالطخيم هههههههههههههههههههههههههههههههههههههههههههههههههه
988935424298180608,SA,   الله يبارك فيك أخوي فهد 
989013718750121984,SA,   الله يبارك فيك يابو مشعل آمين الله يجزاك خير
989082232626339840,SA,  الله يبارك فيك ياصاحب الصوت العذب وافي يابو عمار 
989431567234797568,SA,  الله يبارك فيك ياحبيب أخوك 
989910452523225216,SA,  الله يبارك فيك أميره عقبال عندك 
690220896561303552,SA,جمهور الهلال بالشرقية مختلف 
692422344623702016,SA,"رأسية الزوري تحسم كل شيء 

 نقطة هاتوا اللي بعده"
695691326768209920,SA,الله لا يلوم اللي يلومك ي وجه السعد هههههههههههههههههههههههههههههههههههههههههههههههههه الأهلي 
698254221280415744,SA,"مصيبه اللي شفنا جد 
مو لهالدرجة ي 
 وشالسعد"
698539741013270528,SA,خاميس ي يسجل هدف خرافي  ولا ما يسجل 
699315501634351104,SA,"الصدارة ماتبي غير الزعيم 

بس دونيس ما يبيها "
700635967099502592,SA,"هذا هلال المجد أقواله أفعال 
دايم وله في العز صوله وجوله 

الـ "
700789878280347648,SA,"ألف ألف مبروك الذهب 
 بطولة وهلالنا من يطوله "
702483047040618496,SA,هدف يتحمله البزر سالم الدوسري 
704746938722340864,SA,خل ثقافة الإنبراش والمرجلة تنفعكم الحين 
705141429128065024,SA,مبروك ي زعماء ثلاث نقاط مهمة 
706544041681408000,SA,"على العموم لا مدرب ولا غيره معه الحل اجلللد اللاعبين وحسسهم بالمسؤولية 

بتشوف نتائج ورجال بالملعب "
708045739071557632,SA,"ريشششه تجلللد في الصباح والمساء 
رشيدلايوقف "
708268800391716864,SA,"لا ثارت الهيجا لها منا الفعول اللي تسر
حنا هلا الهيجا ويشهد باللقاء دخانها
رعدالشمال "
708714850374000640,SA,"الموضوع صار جد يا جماعه 
النصرالتاسع "
717400677744582656,SA," يا رجال يطلع لهم الحين ويزبد لهم ويقول تفكيري منصب على كأس الملك 
بس تتوقع يتمنى يقابل الهلال  "
722462280500305920,SA,شوط ثاني أتمنى وأتوقع تواجد الشلهوب أو كعبي بديل لديقاو 
726150879519367168,SA,اعضاء الشرف جحدوه وهو حطهم بوجه المدفع 
726165804920754176,SA, جحدوه بس خوينا طلع ذيب وحطهم بوجه المدفع 
726496868495138816,SA,فيصل بن تركي يقلل من فريق الإتحاد بعد تسجيله الهدف  هالريس تحفه 
727514037324550144,SA,اذا ابدع سالم أختفى نواف والعكس صحيح 
741363859693375488,SA,"ديمتري باييه حرام يكون في نادي زي ويستهام  أسطوري هاللاعب 
فرنسا "
742095673915498496,SA,"بياتوف حارس أوكرانيا مو طبيعي أفضل اللاعبين في اللقاء بعد توني كروس  
 "
748947315763867648,SA,"يا هلا باللي لفاني يا هلا به 
الهلال "
760000253990957056,SA,"من عرفتك ما أذكر اني قلت ليت 
إلا ليت اني عرفتك من زمان 
للمبدع فهدالمساعد"
760060301710598144,SA,"ريشه سامهه 
رشيدلايوقف 
 "
760239907436716032,SA,"محسودين بوجه السعد 
رجل يملك نظره فنيه  ويعرف متى ووين يطلع الكاش 
"
762731758102147072,SA, بوجود تياغو وإدواردو ونيكولاس بإذن الله مايطقها 
766710072638599168,SA,"ياعمري يالفدائي يالمعيوف 
الهلال"
766726343484661760,SA,عبدالملك الخيبري خلص الكلام فيك ياوحش 
771329186581585920,SA,يارب وفق الأخضر محتاجين هالفوز 
771428762688819200,SA,"ألف مبروك ثلاث نقاط مهمة 
معاكيالأخضر "
773138528834293760,SA,"اللهم لك الحمد 
يارب ثلاث نقاط ياكريم 
معاكيالأخضر"
773140288042852352,SA,"حرام والله يغيب هالمنتخب عن المشهد 
تكمل أن شاء الله 
معاكيالأخضر"
777583548467441664,SA,"كل ما تضيق يالأهلي يفتح لها التحكيم طريق   
الشباب الأهلي"
777593786427904000,SA, والله ما فيه عور غيرك  
778997306926530560,SA,"تخبيص 
والله مهزلة اللي صاير 
الهلال إلى أين مع هالجهاز الفني الفاشل "
779039771888873472,SA,"جهز شنطتك يا كوتش 
الحمد لله 
الهلال "
779655634757251072,SA, ممتع ممتع جدا اليوم  في المباريات الماضية قتل اللاعب بجانب فيلايني وروني
780441008064569344,SA,"لا لا مستحيل اللي يسويه العابد موسم خرافي 
الهلال"
780825686042902528,SA,"ألف مبروك للأسطورة 
الشباب أصبح فريق ثقيل فنيا مع سامي
ماودهم يخلون دور الـ  قرعة   "
781899433600573440,SA, من ورى التريلات ذي 
784101511332782080,SA,فهد المولد  ناصر الشمراني مطلب في الشوط الثاني نبي رجال تقاتل مستحيل البرود اللي في نايف 
784387332979863552,SA, ألف مبروك يابو حنان الله يصلحه ويرزقك بره 
787358308155985920,SA,إدواردو راجع يجدد المواجع 
789174829345759232,SA,والله زمان يا هلال  
790361668274585600,SA,سرت بي هواجيسي ولا عاد جابوني  
791640694171529216,SA,"فهد الحربي وش اللي قاعد تسوي 
إستعراض مهارات بهدف "
791652546150621184,SA,"هجومنا قوي ودفاعنا هش للأسف 
 للأخضر تكمل بإذن الله 
معاكيالأخضر"
793912011642011648,SA,"كان بـ عيوني حكي  ليتك قريته
قبل لا يذبل  و يتعتق بـ رمشي

و الحزن هذا  تمنيتك خذيته
مثل ما تاخذ معك روحي و تمشي "
794960624719691776,SA,الهلال بحاجة الشلهوب الفريق مشلول بلا صانع لعب 
794966334362816512,SA,هههههههههه وش تسوي بس 
797098108752658432,SA,"تشوفون اللي قاعد يسوي ميليس في الملعب 
حرام هاللاعب مايكون أساسي 
فترة التوقف ستفيد دياز كثيرا في إختياراته "
798486774242754560,SA,"ضعف إتحادنا يجعل من الإتحاد الآسيوي يشخبط منتخبنا وأنديتنا على ما يبي 
حكام آسيا النخبة وينهم قمة التصفيات أعين محمد تقي 
لك الله يا أخضر"
800090975892668416,SA,"تلعب بدون 
راموس
كروس
بيبي
كاسميرو
موراتا
تفوز وتتسلطن في الكالديرون 
أي مدرب أنت ياعظيم  "
800400989169786880,SA,ياسر الشهراني يضيف الهدف الأول للهلال 
809813204377473024,SA,عشان يحسب لك فاول هالحكم لازم تشيل رجلك بيدك 
811587091343745024,SA,إدواردو يحرج الهلال أمام الباطن بتصرفه الأرعن 
811605626069676032,SA,سالم يضرب مرمى الباطن والحكم القرني هو اللي يتألم 
813440506822873088,SA,"مهزلة تحكيمية من الخضير 
كرت أصفر ثاني للفريدي وطرد للتمثيل 
جباااااان"
815176243188469760,SA, ياقوكم قواه البيان جاهز من أمس 
825441162605510656,SA,"هذا ماهو إختراق هذا عايش بناديهم
وبدون ما يطلق على نفسه لقب 
ويرتوت للي يمدحونه  "
829765229022216192,SA,القادسية وش يسوي بالأهلي يا جماعة 
833701049286455296,SA,"مساء الخيرات
الله يديم هالأجواء الجملية "
834080384790958080,SA,"آه يالوالي 
قليل منك نبي بس 
الهلال يعود للقاء"
834473364148338688,SA, سرب أن الهلال بيتعاقد معك وشف كيف العروض اللي تجيك 
836495306841804800,SA," فالك التوفيق في وجهتك المقبلة يابو حنان 
اللي مثلك وشرواك مثال للجميع نعم الرجل ونعم الخلق "
839592696775868416,SA,"مباراة مجنونة تاريخية مستحيل مستحيل
برسا خورافي مجنون مباراة للتاريخ"
841357640659816448,SA,"هدف عالمي يا فيتفا 
غلطة كبيرة من خالد عيسى واليوناني مايرحم"
843870209664581632,SA,"للتنوية 
دخل  طفل للطوارئ بسبب حماقة مدير التعليم 
نطالبباعفاءمديرتعليمالرياض"
848284797302693888,SA, يا زينها من حسرة  جعل هالمشهد ما ينقطع 
849728384397705216,SA, الله يشفيه ويعافيه قدامه العافية 
849732076706443264,SA, كذا ولا كذا حنا على المدرج ونتفرج ومستمتعين 
851091932495446016,SA,"الصملة يارجال
الصملة رجال
الصملة للرجال
وآخر شي خايف يترحل رغبتيالسعوديه  "
851482032303742976,SA,وش ضيعت يا ميليسي 
851495241718935552,SA,"أرضية الملعب فيها مشكلة ولا وش السالفة 
 إصابة ياسر
 زلة الخيبري 
 ضياع فرصة ميلسي
الهلال"
851839635928043520,SA,"نظام أنا اللي سببت البلنتي أنا اللي أشوت مشكلة 
التعاون"
851840036538601472,SA,ريبيرو نشب فهد الشمري بالشبك 
