id,dialect,text
1057744087632277632,EG, لإنهم أصلآ خوازيق والطيور على أشكالها تقع
1057744823464198016,EG,كل حاجة في البلد ديه بقى دمها تقيل
1057745444384718848,EG, أيوة لإن مبقاش في غلابة
1061755480022888448,EG,"ومنتظرين الدولة تمنع النقاب     طلب متأخر بعد ماالإخوان والسلفيين توغلوا في المجتمع ونشروا ثقافتهم مافيش حد بيحكم هايخاطربمنصبه
الواقعية"
1061756443177693184,EG,وإلي داق حلوك ومقدروش دوقه مرك ومتحرموش
1066074639091359616,EG,"إنهاردة كان في مطر فتحت فيس بوك لقيت الناس كاتبة دعاء نزول المطر ده على أساس إن ديه كارثة بيئية 
تخلف"
1066084393637302400,EG, طيب متنساش تقول الدعاء أول ماينزل عندكم المطر
1066085870422421632,EG, أنا عمري ماكلمتوا  هنا عندنا بيكلموا دار الإفتاء
1068254946615861248,EG, المفروض بس ده مصمم للأجسام النحيفة
1068609123300855808,EG, أنا نزلت تويت بدون إعتراض على لبسها لأني بعتبر اللبس ده حرية شخصية أنا كنت معترضة على إن جسمها لا يليق بموديل فستانها لإن الفستان محتاج جسم رشيق إتشتمت من طوب الأرض
1068609972655788032,EG, أه ده مش جسم يلبس فستان زي ده
1068809466940981248,EG, حبيبتي وإنتي وحشاني أكتر
1068877651044110336,EG, مسا الورد على الناس الحلوين
1068979423729332224,EG,تويتر هنا علشان كل واحد يقول رأيه مش عاجبك  رأيي لا تقرأه أو أسهل عندك خاصية البلوك إنما الإسلوب السوقي والواطي في التعليق على رأيي مالوش عندي إلا البلوك لأني مبنزلش للمستوى المنحط وأرد عليه نقطة
1068986194967621632,EG, مقدرتش أصبر يوم على بعده ده الصبر عاوز صبر لوحده
1069368411124363264,EG,  المشهد ده لخص فيه حياته وبعدها مات ألله يرحمه
1069380341750738944,EG, علشان كان قديم مع بدايات السينما بس عمل مسرح كتييير بس ماتصورش طبعآ وعاد مسرحياته عادل خيري
1069716591200403584,EG,أنا شايفة إن ديه حركة ذكية جدآ من رانيا يوسف أخدت بيها شهرة مكنتش تحلم بيها ومكاسب أخرى هي بس إلي عارفاها وكمان حدث لهى الشعب عن القرارات الجديدة
1079857411970740224,EG, كل سنة وإنت طيب يامحمود سنة سعيدة عليك إن شاء ألله
1079857922329464832,EG,  كل سنة وإنتي طيبة ياشوشو سنة سعيدة عليكي وعلى أسرتك
1082379224122605568,EG, ميرسي ده من ذوقك صديقي العزيز
1085332913904865152,EG,وعاوزنا نرجع زي زمان قول للزمان إرجع يازمان
1088586848354619392,EG,"ترووح مول تحس إن مصر كلها في المول تروح سينما تحس إن مصر كلها في السينما تنزل الشارع تحس إن مصر كلها في الشارع تروح مستشفى تحس إن مصر كلها في المستشفى
بجد إحنا كتييييير فشخ"
1088589669833547776,EG, كفاية إنت ملاحظ من زمان هايبقى في إتنين ينيس في مصر ده يبقى كتير
1092924714513772416,EG,نفسي أشوف حد لما ياخد قرار يبقى قده بس
1092925318048948224,EG,المبرر إن الدولة إلي كانت بتدفع للناس الوسخة ديه علشان تروج للحجاب بقيت دولة منفتحة باختصار السبوبة راحت 
1092927773402894336,EG, كل شئ قابل للنسيان وديه سنة الحياة
1093293202013151232,EG,  اطلع فيه كارول سماحه      
1093991576177651584,EG, ياأحلى أحلى شئ فى الكون ياروح الروح يانور ياعبير عيونك أحلى خطين لون وصوتك وشوشة عصافير عصافير ألله ألله
1095130320926588800,EG,كفاية تدخل في حياة الناس الشخصية وتصوير ونشر خصوصياتهم أنا بجد قرفانة
1096193506194964352,EG, خلينا ساكتين أحسن لما ييجي الإستفتاء نبقى نعرف ده لو الشعب قرأ أصلآ
1099072558064902016,EG,سهل تلاقي حد يحبك لكن صعب تلاقي حد يحتويك
1099434124673200000,EG,تركي أل شيخ مقدرش يحتفظ بكرامته أكتر من  ساعة
1105635433977917440,EG,وإلي يحاول يكسرك إكسره 
1109143716793630848,EG, ده علشان في ناس بتقول إنه إنتصار للإسلام
1115389807910359040,EG,ودوول طبعآ شبه الناس إلي بينزلوا لنا صور سعادتهم على فيس بوك 
1115394153750441984,EG,وفين العقرب هو كخة 
1115396358876299264,EG, شعر إيه ده الكلام إلي في عينيك خلى أحلى كلام يغيرعطر إيه ده العبير إلي في إيديك بيقول إيديك هي العبير خبيني من الزمان خبيني وبعيد عن عيونه داريني على الفرحة الكبيرة ياخوفي لاياخدها ولا يخليني
1115415712850428032,EG, براحته بس ده مش مبرر لتجاهله حتى لو كنت شايف ده عيب فيه
1120081214424088576,EG, والواطى هيفضل واطى مفيش منه فايده
1120849225791750016,EG,إحنا عايشين في فيلم هابط من إنتاج السبكي
1121192408790839168,EG,تبيني لك متل الأول بعد ماصار لك أرع على عيني ولا تزعل وإيش إلي بس لك يشفع
1121930406964732032,EG, كل سنة وإنت طيب وبخير
1136097303507415040,EG,علشان من الشعب ميعرفوش 
1136395697681571840,EG, وإنت طيب وبخير وعيد سعيد عليك وعلى كل أحبائك
1137298731102085248,EG, بالهنا والشفاكل سنة وإنت طيب
1137528313784733568,EG, كل سنة وإنتي طيبة عيد ميلاد سعيد عليكي ياسوسو 
1137857145699856384,EG,التليفزيون الرسمي السعودي وجه دعوة لإسلام البحيري وإحنا هنا لما طلع إتكلم في تليفزيونا حاكموه وسجنوه حتى البداوة تتقدم للأمام وإحنا مليون خطوة ورا 
1137857366442033152,EG, هي حقيقي شبهها واضح إن ذوق عمرو دياب واحد
1138211560986435584,EG, القوس مبيحبش حد يقيده وخدوم بس من غير ماتؤمره والصبح بقرار وبالليل بقرار عكسه تمامآ شخص مهير بزيادة
1138592550145671168,EG,وجود كلب في بيتك وحياتك إحساس إن عندك طفل حنين وبيحبك ووفي لك وعمره مابيكبر ويتلوث
1139315656678158336,EG, لو دخل ناموس بيتي بيقرصني لوحدي ومش بيقرب لأولادي وجربتها مع ناس كتيير
1139327648038051840,EG, لا خالص متقولش كدة أكيد المكان إلي حضرتك ساكن فيه مافيهوش شئ جاذب للناموس
1139589859117588352,EG, في ناس كتيير زيك
1142083478101667840,EG,معنديش قنوات أرضية أقدر أشوف الماتش على أي قناة
1142971726038482944,EG,لما توصل لمرحلة لا إنبهار بأي شئ مهما كانت قيمته ديه بقى بيسموها مرحلة إييييه
1144015725176197248,EG,"ناس قاعدة تتفرج على ماتش منتخب بلدها وتفرح بفوزه وناس تانية بتستشهد في سيناء
مصر ياأم العجايب"
1147671448615624832,EG, ألله يسلمك ومنورة بيك صديقي العزيز
1151643125955387392,EG,علشان هو مش فنان بجد 
1156711533034037248,EG, سيبك إنتإنت منور ياماهر يسعد مساك بكل خير صديقي العزيز
1156712092185059328,EG, ومييين سمعك وأنا كمان
1156712433538535424,EG, حاجة بقى دمها تقييييييييل
1159526455094759424,EG, يسعد مساك بكل خير وكل سنة وإنت طيب
1166832335972646912,EG,على قد مابصبر وبستحمل بس بيجيي عليا لحظة بزهأ وماعرفش بتيجي إمتى
1166841547222073088,EG, النكديين مش بالضرورة يكونوا أشرار في ناس طبيعتهم كئيبةبالرغم من إنهم طيبيين ومن غير تعميم ياستي بس إلي نكديين منحبش نزعل القمر داليايسعد مساكي بكل خير حبيبة قلبي
1166844184751431680,EG, حبيبتي إنتي وحشاني أكتر
1167194991237705728,EG,تنذكر ما تنعاد فيروز   العظيمة فيروز وألحان العبقري زياد الرحباني
1167208931929841664,EG,"يلي خايف من الحسد وإنت متسواشعلى رأي المثل
هايحسدوا الغجر على ضل الشجر"
1167931997496332288,EG,المصريين إلي بيحطوا في كل جملة كلمتين وفاكرين كدة إنهم يبقوا راقيين بجد عقدكوا بتبان أكتر وبيبان مستواكم الحقيقي خليكوا طبيعيين أحلى
1167932684200366080,EG,مرة واحدة في حياتي وندمت ومعملتهاش تاني 
1168285054646272000,EG,بشوف مطلقات بتقولي أنا وطليقي دلوقتي أصحاب أحب أقولها لو المتزوجين عرفوا يبقوا أصحاب أكيد مش هايتطلقوا بس خلاص
1168286580936757248,EG, ده بيبقى سلام بارد ومؤقت وخصوصآ لما بيبقى بينهم أولاد
1168287944010076160,EG, إنتي فايتك كتير طوول مانتي بعيد عن بلدك آخر فكرتك عنها لما سيبتيها الدنيا هنا إتغيرت جدآ
1173355119896858624,EG, ميرسي يادكتور كلك ذوق
1173364550428704768,EG, ده كلام كبييير وده من ذوقك إصلآ ميرسي
1173514973953368064,EG, ده من ذوقك صديقي العزيز
1173741388929884160,EG,"وصفه سهلة تخليكي جميلة وشباب علاطول
حافظي على برائتك وجمالك الداخلي
خليكي دايمآ في حالك
متبصييش لغيرك
حبي الحياة بحلوها ومرها
إرضي ب إلي عندك
متركزييش مع كلام الناس
إعملي إلي يسعدك ويكون مناسب لظروفك من غير ما تمسي حرية غيرك
بس خلاص"
1002189234424475648,EG, مسائك ياقمر ياأذوق وأحلى داليا
1004470004828516352,EG, ديه ريحة قديمة بس نضفها شوية محمد صلاح
1004494512838860800,EG,ذوقك في إختياراتك للبسك أو عفشك مالوش علاقة بفلوسك أو بمعرفة الموضة أو إستعانتك بمهندس ديكور ذوقك له علاقة بعينيك إتربت على إيه
1004495609922015232,EG,"كله متسجل بس الحساب متأجل
العقرب"
1004497066750631936,EG, وإنت طيب وبخير وإنت وأسرتك يارب
1004499218956980224,EG,حاولت أبعد عن تويتر وأساير تفاهة وسطحية فيس بوك مقدرتش
1004510842505842816,EG, أنا مبشوفش أصلآ بس ساعات أقلب في القنوات وأنا لاغيه الصوت أشوف أشباح
1004511846144069632,EG, أنا بدأت بتويتر ولسة جديدة في إختراع فيس بوك
1004522314434842624,EG,إنك تبقى متصالح مع نفسك ومع الأوضاع الحياتية إلي إنت عايش فيها ده أمر لو تعلمون عظيم
1004697130160795648,EG, حبيبة قلبي كلك ذوق ياأحلى شوشو في الدنيا
1007279116767416448,EG, وإنتي طيبة وبخير ياحبيبتي
1008115293854601216,EG,إيديهم وجعتهم من التطبيل
1015034449090793600,EG,هو مينفعش يشيلوا يوم الخميس من الإسبوع ده يوم العقاب الجماعي للشعب
1015035244926374016,EG, كفاية مصلحة المصلحة فقرتنا يخرب بيت كدة
1017154969768808448,EG,وخليتوا المصريات بالمنظر المتخلف ده 
1017161179867860992,EG, ده مش فرض ربنا وحضرتك راجع ثقافتك وبعدين ربنا مش مستني حضرتك تدافع عنه خلص الكلام ولازم قبل ماتدخل تناقشني تقرأ البايو علشان تفهم
1018622839811985408,EG,أنا من كتر مابخاف على إلي بحبهم بخاف عليهم مني
1020075608691347584,EG,تركي ال شيخ ده شخص مهزآ وباحث عن شهرة نقطة
1020091823803518976,EG,أنا بسأل النجوم كل ليلة عليك وبكتب كل يوم غنوة شوق بتناديك
1021131279096565760,EG,حد واحشني مش قادرة أكلمه 
1023716091175088000,EG,لما تبقى سيدة شخصيتك قوية مستقلة بذاتك بتعملي كل حاجة لوحدك على أحسن وجه صعب تلاقي راجل أرجل منك 
1028770332298100736,EG,هايقضوا على العالم وهما قاعدين ياكلوا ويناموا ويتكاثروا 
1029148184872812416,EG, ديه ناس فلوسها كتيير
1029506878534021248,EG,محدش يقدر يغير حد إلي بتحبه بتحبه بعيوبه وبمميزاته بس لما بيعمل حاجة بتضايقك وتقوله كذا مرة وبردو مصر يعملها كدة شكرآ 
1029508988147249152,EG, أدينا قاعدين نتفسح في في دماغ إلي جابوهم
1029510004972376064,EG, ديه موهبة مش أي حد يقدر عليها 
1029518211803488384,EG, وإنتي وحشاني أوي ياقمرنا المغترب
1029519964275916800,EG, كنت مشغولة اليومين إلي فاتوا وأديني فضيت ورجعت لتويتر ربنا يسعد قلبك ياأرق وأطيب داليا
1029520898099953664,EG,فض رابعة  والقضاء على الأشكال الوسخة ديه إنجار يحسب للسيسي
1029527964332040192,EG, ليه ده بيطبق مطالب شعب وفق ماينص عليه دستور بلده العلماني
1030233942547415040,EG, معرصين ومعندناش أكتر منهم
1030234225763672064,EG, ده على أساس أنك متفاجئة
1030533167726379008,EG,وياعيني على إلي كان بيحب التاني أكتر
1031208823317573632,EG, وإنتي طيبة وبخير ياحبيبة قلبي
1031295799718825984,EG,يحولوا الكورنيش والشواطئ لمزبلة ولما يحطوا لهم سور يزعلوا وعجبي
1032741323701407616,EG,شكلك مش غريب عليا أنا شوفتك فين قبل كدة 
1033459829912809600,EG, ده ميمنعش إنه شخص تافه ودلدول وعمومآ هامسحها
1033869035669217152,EG,شكرآ للناس إلي إستحملونا وإستحملوا ظروفنا 
1035680014296133632,EG,ودوول مش هايتعمل شوارع بأساميهم 
