id,dialect,text
991140269113466752,LY, ههههههه هدا الي صايرلك لين يطلع الضي
991145924771672064,LY, عيونك معبيات نوم هدا علاش
991261772031152000,LY, هههههه المفروض هكي هوا
991305263524253568,LY, امس كسدت عليا نص ساعه 
991438660032712832,LY, هههههههه مزال مملكتش ولى رح نملك
991446020226723840,LY, حلللوة غر انت نفسية 
991449208795402240,LY,  باهي عماتي مثلا يبو حصة الولد زي البنت ولى هدو مش ليبين
991453915760783360,LY,  انا مسمعتش حد من طرابلس ميورثوش في بناتهم
991687632693415936,LY, اي بالزبط زي محكيتلك انا يأستاذي والي خلاه يطول السلطة التشريعية الجديدة
991688783937572864,LY, هههههههه صدقت والله ونا عارف وطنيتك من غير متحكي والله
991789871890075648,LY,   استغفر الله ناس همها دوة بس تقول نبي هوا
992206182436745216,LY, باهي ممكن لانه صورتك اسود وابيض 
992408764232994816,LY, ربي يستر عليهم وخلاص
993216412075397248,LY,شن تغديتو                                  كلينا انصاص فاصوليا    غردزيالشراقه
993406355569602560,LY,ورقة الفلوس الي بياخدها الراجل جنب الباب والساعة وكورة في بطن المراءة وبنتها الصغيرة في زوز خصلات والشقاقة مرة بيحط فلوس ومرة لا 
993416414903111552,LY, الله يبارك علي عويناتك والله يبارك علي تركيزك
993546450842857600,LY,                         غردزيالشراقة           غردزيالغرابة 
993830314345746432,LY,واطت العين عليا كلمتها واطت العين عليا 
995419156928515968,LY,  مبروك التخرج حبها ومشكور حميدا عالمجهودات
995419903011278848,LY,  والله تمنينا نكونو جنبك في يوم زي هداو عارفين قصة الدعوات محدودة المهم نستنو منك ابدعاتك في سوق العمل
995429192794820608,LY,  ان شاء الله حبيبي
996178294843302016,LY, لالا كلمات هلبا حلوة في الليبي
996505048682287232,LY, وان شاء الله الدوري
996876291327647616,LY,كل سنة وانتم بخير ينعاد عليكم بالصحة والسلامه 
997168372814139392,LY,مفيش نجم اليوم زي الي بيأذن المغرب كلها تستنا فيه على شوق 
997816565440671616,LY,  تعالى شوف شنو الدوة  رسمية
998006835473940352,LY,روحت وملقيت شي نتسحر بيه ياربااااه
998289574664245248,LY, من غير عنصرية راه سبحانية 
999007411015946240,LY,نبي وحدة مش معربة ولادناس 
999014605514072064,LY,تاكسيعبسي ولادناس في البرامج الي شفتهم والي بانولي باهيات والباقيات شي شي
999366092811329536,LY,مش حلوة الحلقة اليوم يا ولادالناس
963194797476458368,LY, علي فقدتهم امي وبوي ربي يرحمهم
963914961201389568,LY,احلى مكان في درنة بعد البياصه الحمراء 
963917303774662784,LY, اثاري صار مش اثري
964123756280078336,LY,زمان كا لينا بيت
964241925044867200,LY,  خلاص حتا قريب يروحو
964275982269140992,LY, تخاف تخش بعضها اول منوصلو
965350782794072064,LY, صغير ويحير زي فازو المسير
965362004495097984,LY, اي ممكن لاكن عادي لو حتا مش متخصصه تقدري تبدي في الكلية وتتخصصي لو عندك الرغبة والموهبة بس
965576396247634048,LY, لا مش نفسه لوصار منه تو نقولك
966255979473010816,LY,زي الي في كفتيريات الجامعة  
966458772364374016,LY, لا واجهي وحيري باش تستريحي
967720771031392384,LY, لا طبعا تجيبلي هدية 
967721902109286400,LY,توتر مولى نفسيات هلبا
967774171202752384,LY, المفروض هكي اساسها لاكن القدام يبان كل شي
967894719215874048,LY, ايه يعني قلبك حنين
967895890395623424,LY, دي حاجات كثيرة ياما فو ناوي تحبني
969242045050171392,LY,اه ياحبك للمشاكل اه ياحبك لزعل
973703214573944832,LY,اخوتي اخواتي في كل مكان وكل صوب وحدب شن جو
974506685632073600,LY,على الله يالبعيد هلي مشا هالقلب مشواره على الله نلتقي يمكن تحن وتترك طعونك
977358232762142848,LY, اميين شوية  نظرة تفائل بس
978631367134187648,LY, هدى يتبع في الناس ميعرفش الادارة
979869754822406016,LY,  شنو فيها اوت ستوب 
979986931093311616,LY, خليها في سرك وخلاص
980078545979498368,LY, هههههههه بالك مش راضي عيه
980080270085849216,LY,تويتر مولي ممل مع البوستات الطويلة والردود الاطول
980200285791498240,LY, اذا مالي خاطر خد بخاطر طيبتي
980223811055386624,LY, بدات لما تبدي محصورة في مكان كله شجر 
980225133737627648,LY,  اقل شي في مجهودات مش حاطين ايديهم في نصهم وينتقدو
980226783533551616,LY,ترا سمعني احلى صدى صوت واحد واحد وااحد 
980229822428467200,LY, تسلمي ياودي حتا هما سادات وربي يدوم الضحكة على محياك 
980235475188420608,LY,  ايوه العكس يابنتي كبرنا ومعاش نركزو 
980367433222500352,LY,والله الى قدع الحتة شاكر باشا 
980440719641972736,LY,  مشكلة نوضت الصبح والله 
980442902512971776,LY,  ههههههه صح لاكن جهااااد
980560435026984960,LY, كلي على بعضي مش مواعيدي بس 
980561008812085248,LY, اي عارف حتا انا 
980561770132770816,LY, مع انهم زوز بس لاكن منووور سنوني ياقدع
980562190976671616,LY,تلقاه وقت العازة المبدع الطموح 
980865126466236416,LY, ليه ماقلتش انه ده الحضن الاخير
981496825923465216,LY,مقادير ياقلب العناء مقادير وشن ذنبي انا
981577795242463232,LY,ان شاء الله الميلان والانتر يخسرو الزوز وهما يلعبو لبعض واحد من جمهور اليوفي متغلغل عليهم 
981671824537849984,LY, قنا ذوقه مش منتعشو 
981672893921878016,LY,شك معدنوس واحلي مبكبكة  
981709837309566976,LY,ومعانا ثاني اجابة صحيحة  
982062503344705536,LY, حد يخش عليك ببيبسي مثلا
982063425797939200,LY, متلقيش من بيركز عليهم كدب عليك
982067301741662208,LY,عطشان يابرق السماء بموت من طول الغياب بموت من كثر الجفاء ونا على متن السحاب
982374223959162752,LY,و تقعد ف داخلك حاجه ما تقدرش تحكيها ولا تنساها  و كل ما تبي تحكيها تحس ان فيه حاجه تمنع فيك  تصبر روحك بالسكوت لكن لا تقدر تهدا ولا ترتاح
982619085811875840,LY, مرات منهتموش بنفسنا زي منهتمو بالناس
982737398391037952,LY,امس راقد موخر واليوم فايق بكري ولا مفكر يجيني النوم ولا نعست ولا قيلت
982979504900575232,LY,مبلاش نتكلم في الماضي الماضي ده كله جراح
983104865600790400,LY, اي والله ينرفزو ويحسسوك انك لاشي
983110235450675200,LY,انجاز يجعلك ندير ريت ويت لصاحبك  
983131264558518400,LY, ضروري هدا لازم تتعلمي كيف تجتازيه 
983338313179369600,LY,حقير النوووووم  ونعست القايلة
983484902988541952,LY,عودة الزخارف النباتية لتصاميم بلاطات الارضيات وبقوة 
983486217558941568,LY, مسميتاش انا هوا هما هكي الزخارف نباتية وهندسية ومركبة
983489515766632448,LY, باهي حتا انا هكي قلت 
983490211547176960,LY, مش زي التسط مثلا
983814211003445248,LY, من بكري ندور في اسم بنت ثاني حرف واو ملقيتش 
983849186180427776,LY, دا العيب فيكم يافي حبايبكم  ام كلثوم ترد عليك 
983851080286130176,LY, الحمد لله وقفت لحد هني مش ناقصنا 
983851855552876416,LY, اهل الحب صحيح مساكين صحيييح مساكين حتا تعاود فيها 
983852364867174400,LY,ياريت في مجال للحرب عليهم  
983852686675243008,LY, عيني عيني عالعاشقين حيارا ملهوفين
983855137545445376,LY,انا نشوف فيها قصة الزواج التقليدي 
984170946557825024,LY,مش حابة مع اليوفي
984171307255390208,LY,في مبارتين زوز ملاعبية بالحمراءلا ومنو بوفون وديبالى ويجيك واحد فرحان بالريال ربحو 
984176770227363840,LY,راه فرحت التاهل تنسيك انك خاسر
984780275589763200,LY,شويه نفسيه علي راس الكاشيك  
984930652943540224,LY,ليا اسبوع نستنا ومنستناش 
984948683367120768,LY, وان شاء الاه ايامك الجاية احلى
985519416921161600,LY,الجو مداير يوم بيوم
985639766535426048,LY, متتعلقي بحد ومتخلي حد يتعلق بيك 
985640308619825152,LY,لما نبي نجبد الدوه  
985642117577003008,LY, لا شاطر لاكن مش ديما 
985643123178131584,LY, نص جبنه ونص تن 
985647427830075392,LY, هكي بدينا نغمسو برا الصونية 
985648006442766336,LY, هههههههه صحتين التن بالهريسة
985664860880072832,LY,  معناها لما تحكي خودي مسافة قانونية 
985666116109336576,LY,لنتفق اننا شعب الاولاد نحب البنات ذوات الشعر الطويل وانتم  شعب البنات ديرو الف عركة باش تقصوه
985666419865128960,LY, باهي مرة في الشهر مرة في السنة مش ديما لاكن 
985802755985068032,LY, يا ريت وياريت ويامريتش
985803001804787584,LY, تأكدي من لوكشن حوشكم 
985808677423779840,LY, لو حب حقيقي مش رح تنسي ممكن تتناسي بس رح يقعد محفور في القلب على مد عمرك
985809561692012416,LY,يبي صبر وام كلثوم قالت وصفولي الصبر لقيتو خيال يعني مؤبد مع الافكار الشاقه 
985809829620051968,LY, وعنيا مداريها النوم يامسهرني
985810954737856384,LY,ليا مدة مشارك مع الناس كل مرة مشقي واحد ونبعتله باش ناخدهم في لاب توب  
986027097771651200,LY, دام انت مطلعه عيني
986051551847420032,LY, المهم مفيش نوضة بكييير
986051904554881024,LY, اي هكي عادي ههههههه
986137172632850432,LY,صباح التعب ونوضه بسيف
986195110122713216,LY,هوا صحيح صحيح صحيييح الهوا الهوا غلاااب
986415272562253824,LY,ياواخدين العقل خودو روحي
986677353513447424,LY,حساد وخشو بينا وينا ياوينا 
986719219353112576,LY,بروفيسور عصام جد لينا  
986723695107428352,LY,زرنا زمان سرق منا فرحتنا 
986756147876188160,LY,  قصدك انت معادلة توا
986760497692336000,LY, في من حلها قبلي معناها 
987863452638162944,LY,تو هدي تغريدة يحطوها  
943252222414147584,LY,تي مش جو طلوع جو متقربش فم الحوش اليوم خليك بي بطانيتك ويالله
943757878703415168,LY,صباحكم شتوي جميل بصوت الامطار
943965179431260160,LY, قنوعة تحسك متحبش الهدايا 
943966566445650048,LY, لف ودوران مش هلبا بلبل حيران احلى 
943975623722176384,LY, وراسي راس بصل ماه 
943975850554413056,LY,شوقي شوقي جاب اشواق راهي خواطر عابرة لاهي كلام اوراق
943976600793739264,LY, لالا مش انت بكل
943983300519096448,LY, ههههههه ناس وقتها مقلوب
943983846630002816,LY, هههههه اي شن منديرو هي
943990209682780160,LY, غر انت تغطي قبل
944307471811833984,LY,تبا الجمعة مشت بسرعة السبت دوااام  
944335264394174464,LY,لما دير روحك بتجتاز الصعوبات الي في حياتك 
944933943706611584,LY, زعمة نقرا ولى لالا 
945346765179547648,LY,توا شن دخل الجنسية وشن دخل البلاد وشن دخل  ليبيا وباقيت الليبين في النص 
945347913726746624,LY, كم نسيته الشي هوا من الليبين
945348927439671168,LY, لعلمك مش اكتريةالليبين هدي قلة وقليله يخي انا متحسستش من الموضوع ياسيدة انا تحسست من كلمة نبدل الجنسية بكيلو فول  وانت معممتيش هكي
945353607528025984,LY,تلقها كاتبة بوست ونازلة في الشعب الليبي من جد جده وفي الجنسية وكل حد يتكلم بالليبي وتقولك علاش تحسست انت هوا فعلا علاش تحسست ماه انا افغاني
945422784733302784,LY,متاخدش مني موعد                         كثوم                                            ديما سارح  
947223799065399168,LY, عادي مفروض طلعتي وفطرتي بره وغيرتي جوك 
947226739855552384,LY, مفيشي بساطة في الوان وفي خطوط هلبا معناها مش سمبل 
948133799291969536,LY, لا انت قديم هكي
948625382500118400,LY,سمحة ورقاحة بو مشية
949275430586077184,LY, القلب الي بيجرحنا في حاجة اكيد جرحاه
949439502585647232,LY, دفا بس اوك ساهلة 
949778203563974784,LY,عيونك حرقني منهم ماننجا ماظني ياستار خدني ونا ماني بحار
949941976308338816,LY,نحصلوش فيها غرفة نوم من ابو سريويل نفشو فيها غلنا 
950348740174450816,LY, انت مو انت وانت جوعان
950390684183416832,LY,ماتفاهمو علي رئيس حكومة واحد بيتفاهمو علي  أفضلمغردليبي 
950501972293095424,LY, الي بياخد اكتر اصوات هوا الي بيفوز من غير زعل 
951072337708900352,LY, ماه في الي يبي تصريح وفي الي يدور في سبلة 
952856660229414784,LY, تي من العالحال هوا
953034399670571008,LY, اي والله والحمد لله جت سليمة
953051752680640384,LY, ندير روحي عارف انه كرومب
953569412552019968,LY,الي بيتكلم عالدولار يتكلم عالاستعمار  
953686774945107968,LY, مفيش خوف ثاني مفيش دولار ثاني
953979995730464768,LY, رج اجي بس تستقر الاحوال مالنا غناء عن درنة 
954102451883430016,LY,ولو خلو توتر الف حرف مش رح نوفيله حقه ف تغريدة المعطاء لبلده المقاتل من اجل ابنائه ربي يرحمه ويجازيه عنا كل خير  والدكفيتغريده 
954511166167974016,LY, مرات مينكسرش هكي ينجرح بس 
954654553814814848,LY, باه بري ومتركزيش عالدرجة
954889485392728064,LY,ممكن نموت وطايرة مزال مطلعتش 
955176105933189248,LY, مفيش عيب لاكن الناس متخلي حد في حاله 
955194479224479616,LY, ههههههه رح تندمي بعدين 
955215207055446016,LY, كان تبي عادي لاكن 
955215657624309760,LY,مرواح مرواح سروال خليفة طاح  تغريداتالتسعينات
955215768291037184,LY, ابلتنا غايبة والدحية رايبة 
955216345192390784,LY, ليه الاسراف  بعدين يصرنا توزيع احمال راه 
955216797019582464,LY, مرات ميقدرش يشري ماي فاي 
955217506205159424,LY, مش وقت عومان اصلا
955220564813238400,LY, ههههههههه غر متشديد فيا
955224381722103808,LY, ندير روحي فهمت وخلاص 
955489904301150208,LY,  معناها انتم متنعطوش رقم الوايلس 
955553492390825984,LY, مصارليش اهو قاعد في الحوش
955787716494614400,LY, الشاي الاخضر مش تبع النص نحس فيها 
955902740278009984,LY, اي قهوة ممكن تركب
956157345951813632,LY,فلتر السناب ستر هلبا ناس 
956191079732338816,LY,ندير روحي حتا انا مريض عقلي  
956212116582694784,LY, معناها انت مشكلتك متأزمة 
956305670650912768,LY, ماه هما الي بيخلصو 
956307150711771136,LY, ركزي هما الي بيخلصو حق النوتيلى ليكم لانكم تحبونها 
956307811201404800,LY, هكي نبو زوز لتر مية باش نخفوو تركيزنا
956515264895553536,LY,كل مانقول انظمنت يجي العزيز ويعطبه متعمد 
956664979561811968,LY, ممكن ندير الاسبوع الجاي 
956932949361950848,LY,مفروض حتا الجمعة ينزل الدولار 
956981471268540416,LY, نشوف لو شركة سناب نزلاته
956986481825984384,LY, باه مبحوح فيه الهون
956988552948125568,LY, بصفة عامة مش توتر بس 
956989054318465024,LY,الله يبارك بدينا لما نسمعو تزف وبالعدد هوا يخطر علينا الموت ربي يهنيهم ويبعده عليهم 
956990821185872000,LY,  والباب الي تجيك منه الريح متلحساش كله 
956991482317168640,LY,  في الي يحطب لريح وفي الي ريح تحطبله
956993331850022784,LY,  علي شن تقصدي انت
956996347965640832,LY, اصلا طوارئ مفروض ميسكرش السوق 
956997669565722624,LY, ههههههه ماه معاش نبو نستنو الوقت يجري
957021873036021760,LY, يلى اهو فات المهم غدوا بينزل
957032625864151040,LY,  مرات مؤقته والجاي احسن
957039763516788736,LY, مقالو شي ياسر وانتم تقولو وتحطو في روسهم
957058036027346944,LY,خلي نرقد خير انا 
957123072674451584,LY, يحسابني بنموت كان نساني
957143830666543232,LY, والسبت يعني هدي المصيبة 
957243525078364160,LY, حتا منغير تلفون حلوة الحياة
957246724275392384,LY, هههههه لا دقيقة زي مدرنا شي
957334903359725568,LY,ديما انا وياك خاطري
957655534693478400,LY,عشت الحياة بكل سداجة مطلعتش منها بحاجة
957692607257305216,LY, من قلها تتزوجه من الاول
958001044335857664,LY, ربي يخليهالكم ويطول في عمرها
958006778607915008,LY,هيا الغمزتلي بعينه وبأيده صارت توميلي بقيت السهرة كلها رقص وغنج مقابيلي
958515951087095808,LY, لو قلي تعالي قلبي دق
959023003928588416,LY, كفيتو ووفيتو وعلي راسنا كل ناس المغرب ومنشجعوكم لين تحملو اللقب
959922116517941248,LY,مرة شفتا مكتوبة بنجوم السماء ياعيوني فيها ذوبي مأحلى مرسما
960289259872833536,LY, بوسة من عندك حبيبي تسوى عندي الدنيا كلها
960914737809764352,LY,  انت درتينا منشن فاضي
960918329228693632,LY,  علاش مصارش منه قصدك
961276056572489600,LY,باه لو الدول المتقدمة وقفت تقدمها شوية ممكن نلحقو عليها ونديرو سباق جديدسؤال اصلا مش لازم حد يجاوب 
961655624416276352,LY,لما تاخد مقلب في روحك  
962074952127143936,LY, اه تنقيز هدي فاتتني 
962075527782719616,LY, نحناجو زيك في الباق الجديد
962084876542513152,LY, والله قريتها باللحن من غير متقولي
962436506345525248,LY, ثابت الخطى يمشي ملك
962437693140602752,LY, الملك اوامره كله مطاعة يابنتي
962439330949160960,LY, لاخلاص عيت لبست حتا توته
963026849726156800,LY, ايوا ياعم عبر مين ادك
1162455665908035584,LY, صحه وعافيه ولد خالتي
1162640428178518016,LY," صباح النور 
صبحنا من مبدري ياخالتي"
1162826014671671296,LY, يبارك في عمرك يارب
1162826242539888640,LY, الله يبارك فيك وأولادك يارب
1162828205335752704,LY, ويبارك فيك وفي عمرك يارب
1162828537746903040,LY," آمين 
يبارك فيك يارب"
1162837721049718784,LY, الله يهنيك ويبارك فيك
1162837926880960512,LY, يبارك فيك ويوفقك يارب
1162838116027326464,LY, يبارك فيك ياخال ويحفظك يارب
1162838245656399872,LY, يبارك فيك نهال ويحفظك يارب
1162838446496517888,LY, يبارك فيك حنان ويحفظك وعقبال بنياتك يارب
1162843918595178496,LY, الله يبارك في ايامك
1162980693422612480,LY, الله يبارك فيك ويحفظك يا نور
1162981075037151232,LY, بارك الله فيك واهلك جميعا
1163060940419588096,LY, يبارك فيك ويحفظك ياعسل درنه
1163153782378835968,LY, وين طحتي فيها الصوره هذي
1163197838207201280,LY,"  اصلا مافيش قياده عسكريه 
هذوم شويه عصابات ومجرمين وانشالله الشفشفه جايتهم كيفهم كيف خوتهم في بنغازي 
نهايتهم اقتربت الصفق توا فوق رؤوسهم في مصراته"
1163198356136632320,LY,"  بعدين هما اللي مشوا لمصر يطلبوا منها التوسط لدا المشير أن يخرجوا من طرابلس مقابل ان لا يتعرض الجيش لمصراته
والمشير رفض مقابلتهم"
1163556771035787264,LY," الصوره الجديدة شكلها صورتك 
أمس قلتي نبي نزل صورتي 
زعمك هذي انتي"
1165367362675269632,LY," في بنغازي نقولوا الطقيره
ونقولوا طق طربق"
1165369047187382272,LY, الاثنين صح يا دكتور
1166320722265956352,LY, تسلم خوي محمد وبارك الله فيك
1166322011385319424,LY, الله يسلمك ويحفظك يارب بنت الاجواد
1166323037790187520,LY, تسلم استاذنا ويحفظك يارب
1166453037604491264,LY, ما تشوف بأس يارب
1166453298473373696,LY, تسلمي خالتي ويحفظك يارب
1166453615931908096,LY, بالجوده بيك وبالجماعات كلهم
1166453699797049088,LY, الله يسلمك ويحفظك يارب
1166663842476232704,LY," الكوره مش سوره بكل 
ما يشجع في حد"
1167039594753339392,LY,"  وما خفي كان أعظم 
لكن وين يبوا يمشوا من ربي"
1167186027989098496,LY, في الدوله كلها مش غير التعليم
1169262020845277184,LY,  صح لسانك ولد خالتي
1169705728401203200,LY, اكيد فيك شبه منه هالبوشدوق اللي ديمه منزلتيه
1169721389298987008,LY,عندي فيديو  دقائق كل ما نحاول نزله عالتويتر يعطيني فشل الإرسال
1169724453359640576,LY," بالعكس قوي  جدا 
كونكت"
1170038161646542848,LY," اللي ماتعطيش الحمص 
يصبح راجلها يتلمس
اللي ماتعطيش الفول 
يصبح راجلها مهبول
والسليقه في بنغازي
والبليله في درنه 
كل عام وانت بالف خير يادكتور"
926553234076061568,LY, عادي ديما تصيرلي كان مش نظرات السيارة 
926910857535197184,LY,لما الدولار يوصل لي الدينار 
926911904559353984,LY, مبيش انت بري روحي 
927836077200695168,LY,التوظيف الداخلي مع تغير فصول السنة تصميمداخلي  
928005293983850368,LY,نمشيها زي ماهيا ونحط تحتها خط احمر 
928308827858112384,LY,واخد بالك دون مصاصين فلوس الحرام 
929490279400341632,LY, ههههه اي هيا صح بدات مع جو اليوم هههههه
930042099277410432,LY, ممكن نقارن بالدخل عن الطريق الثروات الطبيعية بي الدخل بالقوة الانتاجية
930049041718706176,LY,  مرات يكونو ظالميني ومرات انت ظالمتني 
930097948070998016,LY, ويضيع  شبابي بين امتحنات القبول 
930105180145750016,LY,  مش معقولة هكي عاد
930389931863822336,LY, مبروك ياخالي سموه مطر 
930400537664778240,LY, اي من الاخير غر كان يفتحونا الطرق بس
930400797782957952,LY, لا مش من هدا القبيل
930401610467028992,LY, جو متع تطلعي من غير مبايل اصلا
930402049400954752,LY, حي النسكافي طلعت حلم  قصدك 
930402249628639232,LY, مالة البسي لبست الغوص واطلعي ومتستني حد 
930810499909943168,LY,رصيد عبيته امس تم اليوم حتا مكالمات غرامية معنديش 
930904161331367936,LY, ممكن الزمن يعيد نفسه
931154680226435200,LY, هههههه لا نفوتو حلقتين ولى تلاته عادي 
931189488226881536,LY, هي مالة برا انت الاول 
931206063508086784,LY, كم تبيه شهر مثلا 
