id,dialect,text
1073183920949215232,AE, منو كان يسوي هاي الحركه هههههه 
1073649739676172416,AE,دقائق الانتظار صعبه كأنها سنوات صعبه المرور
1081943982811291648,AE,صرنا نعيش فترة كل قريب يدور زلتك وكل بعيد ينتظر طيحتك وكل عدو يراقبك وكل حبيب يتجاهلك نعيش فترة تناقض ماندري مين معنا ومين ضدناللاسف
1083192858016915584,AE,"خلك بحر يبلع ولا يشتكي ضيق
  لا هاج موجه  صار كلن يهـابه 

     صباح الخير"
1084148465578455040,AE, بإذن الله ما يطلع من دارنا الا اذا راح لديارنا
1127491034148212736,AE, ها كملنا  يوم وانا انتظر الرد بس ترا في خاطري شي ودي أقوله يا   بس اخاف الله علي عكس بعض الناس وين وصلنا في الموضوع ردو علي باتصال وإذا مافي عندكم رصيد سوو كلكت كول عادي برد
1135089567474823168,AE, معاملتي قيد التنفيذ من تاريخ  وللحين لم يتم التواصل اذا تبون بكتب رقم الشكوه في الوصيه للورثه وبعطيهم رقم الكول سنتر عشان يتواصلون وياكم يمكن تردون عليهم
1140179343014092800,AE, اي وقت بس اتصلو
1142731567011434368,AE,  صدقني مافي فايده منهم اذا تواصلو معك وهو امر مستحيل مجرد كلام في تويتر
1144134974033080448,AE, متا انشالله ناوين تردون علي يا بنكابوظبيالاول  ولا اعطي رقم الشكوى للورثة يتابعون معاكم
1165258985857015808,AE, موظفكم كان مزعجني  ساعه عشان أشارك في برنامج توفير وفرشلي الأرض ورود بالبرنامج يتصلبي ليل نهار سمعت كمية كلام يكسر الحجر الين اقنعني بالموضوع وكله في الهوا
1170288416036139008,AE,  المواطن بينصحك بالي يفيدك اذا جيته والوافد يفكر بس في البونس وكيف يزيد رصيده وبالتالي تزيد فايدة البنك هذا هو لب الموضوع والفرق
1170293611214319616,AE, التوطين علي فكره المواطن لو راتبه  الف بيصرفها في الدولة وإذا ادخر منها بتكون في بنوك الدولة وإذا أقام مشروع بيكون في الدوله والوافد لو تعطية  الف بيصرف الاف او اقل وبيحول الباقي لإنشاء مشاريع في بلده الجدوي الاقتصادية وين بتكون فكرو
620449655730483200,AE, هيه بخلص عقب شوي 
620450230303985664,AE, وصيامك ياخي  قول امين 
634712215271051264,AE, اتفق معاك هم ما قصروا بس للأسف يركزون على شي وينسون الباقي وانا متأكد فيه ناس مستعدين يشتغلون على هذه الامور لو تم تكليفهم
640582747367436288,AE, ياخي هولندا في مهب الريييح
645499503936598016,AE,  اصلا لو يحطون زهران راس حربة بيأدي وايد احسن من ادغار ويمكن يكون هداف المواطنين
645527194429603840,AE,  هههه بس للتوضيح تراه والله انا ما اطنز على اللاعب زهران بس اقول واقع حاصل ونشوفه حاليا
699465843411968000,AE,"الي يـحب عشـان شكـل  يقـدر يحـب الـف غـير   

والي يحب عشان قلب عمره ما راح يلاقي غير   "
700304580568023040,AE,"آطب را  ر را اس 
      ي ك دا ى م ى "
700923588988248064,AE,إعرف قيمة نفسك وارضى بشخصيتك مو أي علاقة تنتهي تضرك نفسيا  ومو أي إنسان يطلع من حياتك تعتبره خسارة 
701210120353673216,AE,اجمل شعور لما تشوف السعاده بعيون احد تحبه   صباح الخير
701862605695143936,AE,"ارسم الفرحه ولو إنك حزين
تمضي الدنيا وتبقى لك أثر
كم حزين حزنه بصدره دفين
كاتم حزنه ويضحك للبشر"
701862771810508800,AE,هناك أشخاص يصافحون القلب قبل الأيادي  فـ أسعد الله قلوبا طاهرة  إن وصلناها شكرت وإن قصرنا عذرت 
702007339881263104,AE,"شيء حلو لما يكون عندك شخص مايمل منك ابدا مهما صاريقعد معاك يحب كل شيء فيك حتى يومياتك البسيطة

 صباح الخير"
705082505326624768,AE,عـمرنـا م تكلمنـا بشكـل صريـح لازم نخبـي كـم كلمـه تحـمل ملـيـون شـعـور 
705144897653874688,AE,"شطر يطربني وأنا حافظه غيب 
 حكمه ولا هو مثل حكي المجله

مهما تسوي للعرب من مواجيب 
عذروب واحد ينسف الطيب كله"
705310806410395648,AE,"من علامات الزهايمر المبكر 
تنزل من السياره و تدور جوالك
وناسي أنك تتكلم فيه
والمصيبه الكبيرة ان اللي يكلمك يقول لك دور زين يمكن تحت الكرسي"
706072491274477568,AE,"لو يحاكيني 
من الناس مليون 
بسمتي ماتنرسم 
الا لـ حكيه"
706561064029257728,AE,"مآتنفع الذكرى ولو تبكي العين
اللي خذاه الوقت مآهـو براجع"
707270797820358656,AE,"تدري وش إلي بالخلايق يمشيك
ويحط لك بالناس قيمة وشيمه
طيبك وأخلاقك وصادق مباديك
ونفس بشوشه بالتعامل حشيمه"
707302184673812480,AE,"استر عيوب الناس وتعيش مستور 
الله خلق والله عن النـاس داري "
707797390191960064,AE,"صبـــحكم ه بآلخـيـــر
عبير فواح ب أنفاس الصباح"
708866479199023104,AE,"إليا أحد نشدني قلت له ما علي إخلاف 
و أنا لو تطول  نشدته باحت العبرة"
708866561193467904,AE,"تدور عيوبي وأدور مزاياك
        بس المصيبه كلنا مالقينا"
708866645092073472,AE,"أثرك   تدور  طيحتي  وانكساري
ماتدري ان اهل الشرف مايطيحون"
708866705515278336,AE,"البال ضايق و السهر رافق العين 
و الفكر تايه و الهموم اذبحتنا "
709593078508732416,AE,شـعور غـريب لما تـفقد أحـد وتتذكره فجأهتجيك ابتـسامة مـزيفـة وما تدري انت مبـسـوط انكك تذكرته ولا حزين عشان فقـدته
711193906017337344,AE,"الله يـزيــد الخيــر فـي ديــــره الخير
وعسـى آلسحآبـه مـن ورآها سحآبـه
غيــم ومطر وأخبـــار خيــر وتبآشير
ي الله عســى دعـآواتنا مستجابة"
712018029589176320,AE,ضآق صدري من آلدنيآء واكتفيت ي شين آلي يجآمل وهو مآيبي
713250252829159424,AE,"الي يحب عشان شكل 
             يقدر يحب الف غير  

والي يحب عشان قلب 
       عمره ما راح يشوف غير"
715426992070516736,AE,النوم هو الشيء الوحيد اللي مهما عطيته اكبر من حجمه تحس انه يستاهل
715427430450741248,AE,"احلي شعور انك تحذف شخص 

         وهو يكتب رسالة  
تحس انك عطيته كف وهو يتكلم "
715427688043954176,AE,"يا شين طعم الصبر لا صرت مجبور
  تصبر ولا تدري وش الآيام تعطي"
721972314166988800,AE,"بوصيك يأخوي واسمع موصيك
  عشر وصايا قادحه من شراره

من تجربة دنيا وجردن مهاليك
 لقى بها الافراح عقب المراره"
721972503678205952,AE,"والثالثة خوة اهل الطيب تغنيك
  والا ضعيفين الروابع خساره

ومن يضحك بوجهك وهو مايدانيك
  كبه وخله يحترق وسط ناره"
721972664110292992,AE,"والخامسة خابرك وانا مخاويك
 ماينفعك كثر اللعب والدواره

قلط ربوعك مجلسك يوم تأتيك
وخل ألعودالأزرق يدورداير مداره"
721972724604780544,AE,"والسادسة رفيقك اللي يخاويك
سافر معه وتعرف ماكر حراره

اما رفيقن في مماشيه يحييك
 والا تغير وجهتك عن مساره"
721972932721909760,AE,"والتاسعة لو يغلط بحقك اخيك
خذها بشحم وارفع مع الناس كاره

علمه ترى علمك وطاريه طاريك
   عليك به لو كان ماله جداره"
722651723899236352,AE,"دعوة صباحيه

و عسى ل نفس صآبره ربي
يسقيهآ فرح يسوى آلون ل
صباح الورد"
736650134390444032,AE,"اعمارنا مثل الحطب في طرف نار
شي احترق واللي بقى جايه الدور
وارزاقنا مثل السحايب والامطار
اللي مهو مقسوم ماهو بممطور"
750190322026745856,AE,    شكلك منهم القطيع افهم كلامي انا أكلمك عربي وض ولا ما تفهم الا لغة الاخوان
750191895851270144,AE,انا عارف وين تبغي توصل اقلب وجهك  أحسن ما تسمع كلام يزعلك
750192386043699200,AE,    الله يرحم أبوي زايد ويطول بعمر تاج راسي الشيخ محمد قاهرالاخوان
750194822875607040,AE,    ترا اسهل من الصور والفضايح مافي وفضايحكم بالاطنان اترك أسلوبك الوسخ أحسن
750577701283631104,AE,"عيدكم مبارك وكل عام وانتو بخير وتقبل الله طاعتكم اخوكم 
بو حمد"
751867317991137280,AE,"موكل من يضحك 
مـــــــــع النــــــاس 
مبســـــــــــــوط 
ياكثر من 
يضحك
 ونفسه 
حــزيــــــــــــــــــــــنه"
758514114637463552,AE,يا صباح اللي على بالي طرى أشهد إن الصبح في عيني يزين صباح الـورد
760714529332424704,AE,"آضح ولآ يهم كلآم عذآلء
    مآ يذم من آلبشر غير آلغيور"
761458188348600320,AE,"مايذبح الانسان حاجه سوا اللوم 
من جيتن جاها ولا قدروها 
واللي تخلي مايجي عينه النوم 
الحاجه اللي في يديه وخذوها"
761458415696609280,AE,"ي قلبـي لاتشـره عل كـل مخلـوق
كلـن يشوف الناس ب عين طبعـه 

قلبي واعرفه ابيض اللون موثـوق
لا يجرح اصحـابـه ولايخون ربعـه "
761458625298649088,AE,"الحزن عمره ماعرف طرقت الباب
والدمع مبطي ماعرف يوم رأفه

كم من قريب جابلك ضيق واتعاب
وكم غريب مد لك طيب كفه"
