id,dialect,text
1061928872046981248,EG,هو احنا أحلي في مراية الحمام فعلا ولا ده شغل خبث وخبائث
1061928929286676352,EG,ركز في عنيا شويه  صدري مش هيطير 
1062071391577653248,EG,عايزة اقول اني بشوفه قمر اوي في كل حالاته حتى و هو لسا حالق وهو لسا مخلص شغل وهو مطبق و منامش و هو متعصب و مقريف و يعني في كل حالاته حرفيا بيبقى قمر و جميل و يابخت اهله و صحابه و الناس اللي في شارع بيته و اي حد بيشوفه كل يوم والله 
1063060912486207616,EG,حد يعرف أي ده 
1063412109890019200,EG,"انا بقالي يومين بشوف  و  و فيها اقتباس من قرآن او حاجه دينيه و لأ يا جماعه فيه حاجات مينفعش نعديها و فيه حاجات مينفعش نقول براحتي و انا حر و هو انت اللي هتتحاسب ولا انا ربنا يعفو عنا 

 وتحسبونه هينا وهو عند الله عظيم"
1063479498602106752,EG,في احتمال واحد ممكن يخلي عمرو وردة يلعب ف المنتخب هو أنه يكون عيد ميلاده وصحابه عاملين له سربرايز ومأجرين ملعب وفرقتين عشان يفرحوه
1063538059537469440,EG,مسموح تقول رأيك علي صوره حد في حاله واحده بس لو جه وعلقها عندكم في الصالون  لكن غير كده طول ماهو حاططها عنده علي صفحته فا يا تقول كلمه حلوه يا تقعد ساكت
1063552272150466560,EG,معلش ممكن تعتبروا الهدوم المكرمشة موضة زي البناطيل المقطعة كدة عشان بكسل اكوي هدومي
1063715620460658816,EG,"الاحتياج من اخطر مراحل الحب
لما تبين احتياجك للشخص اللى بتحبه وهو ميقدرش بتحس ساعتها انك اتعريت قدامه وبتبقى ضعيف وساعتها بينهار الحب ده وقتها بس وجودك زي عدمك"
1064018571557261184,EG,أول ما ابتدي أذاكر 
1064135180238110848,EG,  تقدر تكتب ف جوجل اي كلمه او حديث شاكك في وهتلاقي موقع اسمه اسلام ويب الموقع ده موثوق جدا وماسكه مفتي السعودية وهتلاقي في كل حاجه
1064135897585725440,EG," الحديث ده ضعيف والعلماء مش متعرفين بي وياريت تمسح التويته
تقدر تشوف الفتوى كامله من هنا
"
1064136114787750016,EG,"  ع فكره الحديث ده مش صحيح ومش معترف بيه
شوف اللينك
"
1064139245227581440,EG,شكرا لكل شاب عدي من جنبي وحط ايده ورا ضهره وكل واحد خبط غصب عنه ووقف اتاسف واعتذر وكل واحد قعد في المواصلات ضامم نفسه عشان ميلمسناش وكل واحد احترم بنت في الطابور ووقف في صفه وكل واحد استرجل ووقف دافع عن بنت بتستنجد بحد وكل واحد بيعرف يحترم حرمه الناس
1064398602313846784,EG,   سيبك من الفكر الوهابي والتشدد والإرهاب وكل ده وشوف الحديث صح ولا غلط خد الحلو من الموقع وسيبك من السلبيات وبعدين احنا اه بلد الأزهر ومفيش مشكله اخد المعلومه من مفتي السعودية عشان دي حاجه ليها علاقه بالدين والأحاديث ومينفعش اكتب حاجه غلط او مش موثوقة
1064411365140562048,EG,   انا قولت ان الحديث غلط وضعيف ومحدش من العلماء معترف بيه وتقدر تراجع الفتوى اللينك عندك فوق
1064591789212999552,EG,  المفروض صل تنكتب بحذف الياء عشان بتختلف ف المعنى
1064592725364875264,EG,"  ماشي حبيبتي بس حبيت تعرفي المعلومة
واسفه معرفتش اكتبها ف الخاص"
1064592796978462848,EG,الي يشوف التويتة دي في أي وقت يسمع الدقيقة ونص دول راحة نفسية مش طبيبعة والله  
1065254934541672448,EG, صل بحذف الياء عشان بتختلف ف المعنى
1065476988096446464,EG,"شكلك جميل انهاردة  بحب أسمع صوتك الطقم ده هياكل منك حتة القعدة مش هتحلو إلا بيك ضحكتك حلوة  انا بثق فذوقك جدآ انت اللي بتحلي اي حاجه فالدنيا 
كلام بسيط بس بيفرق مع اللي قدامك  بيحسسه قد إيه هو متلاحظ و مش مركون"
1065565409275973632,EG,انا بذات متحاولش تتقل عليا تقارنى بحد تطنشنى او تتأخر عليا فى الرد تستغل نقطه انى بحبك وتتجاهلنى الحاجات دى كلها بتجيب معايا نتائج عكسيه و بتكرهنى فى اللى قدامى جدا اقسم بالله وحرفيا ببقى من جوايا معنديش اى استعداد ان انا اتعامل معاك تانى
1065598402510155776,EG,"جمهور ام كلثوم دة عظيم مع كل كلمة يفضل يقولها الله وعظمة ع عظمة 
يعني انا لو في حياتي حد يعرصلي كدة ع الحاجات الكويسة اللي بعملها بس
ابقى من اكتر متفائلين في العالم"
1065897126285197184,EG,و انا فاتح ف المواصلات 
1065915626122870784,EG,"طالما انتي بتدفعي فلوس علشان تودي ابنك حضانة   و هو عمره شهور علشان انتي مشغولة و بتثبتي ذاتك برة البيت فحق الولد لما انتي تكبري يدفع فلوس علشان يوديكي دار مسنين علشان هو مشغول يثبت ذاته هو كمان 
أعجبتنى"
1066422353285054464,EG," مفيش الكلام ده حضرتك
الكلام ده مش صح"
1066926573612347392,EG,عندي مشكلة اني لما بحب حد بحب اكون ف حياته ال   سميه بقي حب امتلاك سميه زي مانت عايز بس مبحبش احب حد وابقي ف حياته نمره اتنين او الاقيه بيعاملني زي غيري  بحس اني حبي لحد دا حاجه غاليه جدا لما اديهوله استحق مقابله معاملة واهتمام مختلف دونا عن الناس كلها الي حواليه
1066928572382756864,EG,فاضلي المنهج كلو و اكون خلصت
1067293134592372736,EG,ردا على بتوع اشمعنى زعلانين على الكلاب ومش متعاطفين مع الفراخ و العجول والغنم و بتاكلوها  وبعيدا عن الحرام و الحلال كمان أهوه 
1067294118072729600,EG,"ف الغالب مافيش دكتور بيحترم نفسه أولا هيكشف ع واحدة بدون مرافقة معاها أو ممرضة معاه
معاكيش حد ومدخلش الممرضة امشي واستردي الكشف وروحي لدكتور تاني هو مش ابن سينا ولا معاه أسرار الطب الكوني عشان تاخدي الريسك"
1067311823563747200,EG,اعتقد أن ابسط أشكال الاحترام اللي ممكن تقدمها لحد هي التبرير أنك مثلا وقت ما تغيب تبرر غيابك وقت ما متردش عليه تبررله ده وقت ما متكونش على طبيعتك معاه تبرر ده برضه هي الأمور مفروض تمشي كده بين الناس عشان محدش يستحق ابدا أنه يفضل يفكر ويسئل نفسه هو إيه اللي حصل
1067319304578846848,EG,"سؤال عمري ما لقيت ليه إجابة هو ليه في ستات كتييير في مصر بتصبغ شعرها أصفروبتلبس عدسات ألوان
إنتي مش أجنبيه شكلك عجيب قوي ومش حقيقي ما تخليكي على طبيعتك كده وتقبلي اللون إللي ربنا إختارهولك لأنه خلقك على أحسن تقويم والله انتي حلوة ومش لازم تتفرنجي انتى حلوه زى ما انتى"
1067327375753601024,EG,"احنا نتجوز جواز اسكندراني 
ازاي
نحط ع المأذون فلفل "
1067429203669204992,EG,بابا مبعتش معاك حاجة  
1068280940861030400,EG,لما تتكلم عن المرأة ف  ثانية  هتقول ايه 
1068637470844219392,EG,أنا عازه أتجوز ثرى عربى اقولوا عندى امتحانات يا أبو طلال يقولى ما ابغى زوجتى تدرس خذى مليون دينار سوى شوبينج
1068806115662733184,EG,كسبت ميزة عظيمة جدا بقالي فترة وهيا اني مبقتش اسعي تماما ان اكسب اعجاب حد يعني بتعامل بطبيعتي وبتلقائيتي جدا بعمل الي يريحني ف اي وقت ف اي مكان والي حابب شخصيتي كده هبقي مبسوط بوجوده ف حياتي والي مش حابب عادي مش شرط كل الناس تحبك ومفيش شخص بيجتمع عليه الناس كلها وحقيقي مبسوط كده
1068888248787849216,EG," ايه ده انتي خسيتي

 انت تعرفني 

 لا بس قالولي ان الجملة دي بتجيب مع اي ست

 دا لو كنت تعرفها يا غبي وبينكم كلام وتعرفها قبل وبعد 

 انا اسف 

 خد تعالى هنا باين عليا اني خسيت فعلا"
1069530632353693568,EG,احنا لو لفينا الدنيا كلها مش هنلاقي احسن من التيرم التاني نعوض فيه 
1069884768274317184,EG,"اية عامل ايه ف الجامعة 
بص بعيدا عن انى بعدى الشارع قدام الكلية وانا مغمض عينى عشان ادى فرصة للقدر انه ياخد مجراه  فانا كويس الحمدلله"
1069978583324594176,EG,مرة واحد صعيدي لعب ف مناخيره كوعه اتحشر
1070022263477547008,EG,"مش فاهم اللي ناشر تنويه عن حد متغيب والحد ده يكون رجع أو لاقدر الله أكتشفوا أنه توفي ويفضل سايب التنويه والناس بتعمل ريتويت ويكتفي بتعليق أنهم لقيوه اللي ناس كتير ممكن ما تاخدش بالها منه
 طب ما تحذفـي الكلام طالما لقيوه ولا مستخسرة الرتويت واللايكس"
1070025254880362368,EG,"اعلان
مطلوب صديق بالمواصفات التاليه
 بيسهر مش بينام بدري
 يبعتلي اغاني علطول
 مش بيفتي
 مش بيفتي
 مش بيفتي
 بيسهر مش بينام بدري
 بيسهر مش بينام بدري
 يبعتلي اغاني علطول
 بيسهر مش بينام بدري

لايشترط عمر معين
للتواصل "
1070440246855303168,EG,"هو ليه مفيش حد بيبعتلي كلام حلو و اعمل  لأسمه و انزلها   

هو انا شفافة "
1000102390085931008,EG,"طب والله كلية طب دي سهلة  هي بس محتاجة واحد فاضي  معندهوش حياة اجتماعية  ولا عنده صحاب  ولا عنده اهل  ولا عنده سوشيال ميديا  ولا بيحب الكورة ولا الافلام ولا الخروجات ولا حتي بيحب نفسه  ومستعد نه يفضل يذاكر لحد سن ال 
بس كده  الدنيا سهلة مش عارف الناس بتعقد الموضوع ليه"
1000103998375059584,EG,طلع ورده ونزل شاديه
1000104023305879552,EG,طلع كوكا ونزل بيبسي
1000105408500043776,EG,طلع رمضان ونزل شوال هاهاها
1000376064567332864,EG,شكرا للولد للي لما بيركب ف مواصلات عامه جنب بنت بيضم رجله وهو قاعد  و شكرا للي بيعدي جنب بنات بيحط ايده ورا ضهره و شكرا للولد ف الطابور و الزحمة بيوسع للبنات و يساعدهم يعدوا من غير ما يغلس و شكرا للاهل للي بتربي الناس الحلوة دي 
1002135059602857984,EG,سلطنة عمان بلد غامضة قوي لا عمرك تشوفلها صورة و لا تعرف شكل الشوارع هناك عاملة ازاي ولا بياكلوا و يشربوا ايه و فين حتى كل اللي بيرجع من هناك بيقول انه اتبسط قوي و يسكت بعدها خالص كأن في سر هو في ايه هناك
1002135059804184576,EG,هو ليه فيه بنات بيعملوا الإيشارب  كده و بيبقى شكلهم حلو في الصور و أنا لما بعمله كل ماشوف حد يقول لي إيشاربك اتفك اعدليه إيه يا جدعان مش باين الستايل و المجهود
1002714413013618816,EG,اعتقد أن ابسط أشكال الاحترام اللي ممكن تقدمها لحد هي التبرير أنك مثلا وقت ما تغيب تبرر غيابك وقت ما متردش عليه تبررله ده وقت ما متكونش على طبيعتك معاه تبرر ده برضه هي الأمور مفروض تمشي كده بين الناس عشان محدش يستحق ابدا أنه يتساب في  هو إيه اللي حصل
1006499951994638336,EG,لما بحب حد ممكن أتكلم معاه وأنا باكل وأنا هموت وأنام وأول ما أصحي من النوم وأنا خارج وممكن مخرجش عشان أفضل أتكلم معاه والله
1006805877012271232,EG,انتو متخيلين يا جماعه اننا خلاص كمان يومين  هنسهر في اخر يوم رمضان وبعدين نروح نصلي العيد ونرجع نضرب كحك وبسكوت وبعدين ننام شويه ونصحى نلاقي فاضل ساعه ولا ساعتين ويبدأ ماتش مصر واوروجواي في كاس العالم ها كاس العااااالموحاجه اخر جمال يعني الحقيقه
1007032147008458752,EG,"  ان شاء الله 
بتتكتب كل كلمه لوحدها عشان بتفرق ف المعني"
1008214010754490368,EG,بوقف التاكسي و اقوله ثانيه واحده واروح اصور رقم العربيه عشان لما يخطفني اكون بعتاه لبابا و بعد ربع ساعه انام منه في الطريق
1008406717053448192,EG,تعالوا شاورولي علي العيال اللي غلبوكم  
1009469056574021632,EG,ماتش السعودية ومصر بقى انا من رأيي احنا نجيب طعمية وهما يجيبوا كبسة ونقلبها   ونروح اخوة وعرب مع بعض
1009671576843882368,EG,لما ترتبطي أرتبطي بواحد مجنون دماغه هربانة منه اللي يبقي رد فعله غير متوقع خالص مش واحد بينام من العشا ويقولك عندي شغل الصبح وفي اجازته اقصي احلامه يسهر ع القهوة مع صحابه ويكلمك خمس دقايق وينام دة خليه جنب أمه احسن مفيش احلي من المجانين
1009795077416382464,EG,ما تتغروش ف نفسكم اوي وتفكرو انكم مهمين دا طبق البتنجان المخلل احسن منكم
1009795078561435648,EG,"انا اكتر حد متناقض ممكن تشوفه ف حياتك  
ببقي احن واطيب حد ممكن تقابله  
وممكن موقف يوجعني يخليني ف قمه القسوه والجبروت اللي ف الدنيا وامشي من غير ما ابص ورايا او اعمل اعتبار لاي عشره  
ودي مش حاجه حلوه بامانه يعني بس ماباليد حيله"
1009979767289012224,EG,الارجنتين معاهم طيارة ولا ناخدهم معانا في طريقنا 
1013659206417862784,EG,البنت اللي بتضحك ف وسط الشارع مع صحابها بصوت عالي  محترمة اوي علي فكرا و الضحك دا كبت من البيت كبت من الهم والغم اللي ف حياتها كبت من المذاكره كبت من الشغل كبت من الزعل  كبت من كتر كلمة لأ اللي بتتقلها عمال ع بطال كبت من عدم الخروج  ومفيش حد مش محترم غيرك انت  والله
1013659718420660224,EG,مش عارفه ازاى ممكن حد يبقى بيحبك ويجى فى يوم يزهق منك ويمل مع الوقتالواحد لما بيحب اى حاجه بيفضل يحبها دايما بحلوها ومرها ومبيزهقش من انه يجدد حبه ليها كل شويه بحب اغنيه هفضل اسمعها بحب مكان هفضل اروحه بحب شخص هفضل احبه الحب مفهوش زهق وملل ياجماعه وكل ما بيقدم كل ما بيحلو اكتر
1013894641131847552,EG,"صاحبى خول ومتصاحبيش شرموطه 
 الخول هتركبيه 
الشرموطه هتركبك وتجيب ناس يركبوكى"
1013898065718268032,EG,هترتاحوا في الجامعه يا جماعه و هتذاكروا بمزاجكوا و انتوا مشغلين اغاني و مش مضغوطين ولا قرفانين ولا خايفين و قاعدين في النادي او كافيه براحتكوا و اهلكوا مش هيعترضوا و هتتبسطوا جدا من كل حاجه و متسمعوش لحد  السر في الصحاب اللي تعملوا معاهم كده بس مش اكتر
1015129620117643264,EG,انا خايفه عليكى من الناس الناس مش بيحبو حد احسن منهم 
1015130314656698368,EG,"طاب لما أنتي أونلاين أهوأومال مابترديش على موبايلك ليه
والله العظيم يابني أنا أونلاين من اللابتوب وناسيه الموبايل سايلانت وبعيد عني وأول ما شوفتك متصل جيت جري أهو على الأكونت بتاعك وكنت لسه حالا أهو والله هاعملك بلوك"
1015130498199441408,EG,وهاتلي صبر ايوب  وهاتلي حكمه من لقمان  وهاتلي حنين مايكسرنيش  وهاتلي أجابه تنفعني  وحد بجد يسمعني
1016967158323138560,EG,"لا عبايه ب ج ولا   ولا ميكاب
هما بيسيبوا كل دا 
ويبصوا على طيازنا"
1018016382531915776,EG," الموضوع مش تبعي انا شخصيا دي تويته لقيتها ع التايم وعملتلها ريتويت
عارفيين ان المبلغ كبيير جدا بس مش هيفرق معاكو  بس حياة الشاب ده هتفرق مع ناس كتيير أوى  الرجاء المساعده 
شيير يا شباب 
 
 
 "
1020610966508253184,EG,"المثل دا حلو جدا 

رايح فين يا حظ  رايح لعفانتهم 
طب والحلوين يا حظ  كفايه عليهم حلاوتهم  "
1020904717143158784,EG,"محشش دخل مطعم ومعاه  بنات طلبوا  بيبسي قال له الجرسون أجيبلك بيبسي عائلي

قالوا لأ يا راجل عائلي إيه دول شراميط"
1020910392137089024,EG,"واحدة زعلت من جوزها وبطلت تكلمه 
بعد  أيام وهي هايجة 
جه وراها وهي نايمة على السرير لزق فيها 
قالتله وهي متعصبة 
دخله كله يمكن أموت وأرتاح منك "
1021747189314449408,EG,يالهوى يا جماعة أنا لو اتجوزت اللى هحبه مش بس هتدلق ده انا هتدلق و اتمرمغ و  مش هتردد ثانية اعبرله عن حبى و أغنيله و أدلعه و أعمل كل حاجة يتبسط بيهاهى معلش الحياة فاضل فيها ايه ولا تقل ايه اللى قبل و بعد الجواز ده
1023454549640728576,EG,"حبيت الفكره بجدحاجه تفرح
انا اسميريماس 
النهارده الاحد
يوم
البوست دا مش همسحوا وهاسيبه علشان لو ربنا اداني عمر هاشوف مين فضل جنبي ومعايا
اكتبولي اي حاجه
ذكري حلوه
دعوه من قلبك
موقف بيفكرك بيا
حتي لو منعرفش بعض وبتابع في صمت خليني افتكرك"
1023454702887944192,EG,بقالي عشر دقائق بقول سبحان الله قمر ايه ده الي باين لحد الساعه سابعه طلع لمبة الاوضه عاكسه في الشباك  
1023965809998213248,EG,عندي رسالة مهمة كوننا بنات زي بعض ده مبيديلكيش الحق تلمسيني لاي سبب من غير اذني لما تلاقي حمالة البرا واقعة مينفعش تقرري تعدليها بنفسك لما تلاقي حاجة فشعري متحطيش ايدك وتشيليها متدخليش ايدك جوا هدومي لاي سبب عشان الموضوع مزعج ومايفرقش عن التحرش خالص وغير مبرر تماما
1025019331472703616,EG,مش قدامي غير اني افبرك فرح في اقرب وقت واعزم فيه ناس تيجي تنقطني زى فيلم الفرح علشان انا حتى معنديش فلوس اجيب شراب وال حريمي البسه في راسي علشان اروح اسرق بنك
1025387048994263040,EG," 
انا مش مسترجلة بس الملبن مش بيطلع لاي حد "
1025558315412193152,EG,من فتره كنت زعلانه جدا من حد قريب مني وعماله اعيط وكل ما انام احلم بكوابيس واصحي اعيط وانام وهكذا  لحد ما في مره قافله الاوضه والنور وبعيط ولسه يادوب هنام لقيت حد شبههي بالظبط نايم قدامي بيقولي هتفضلي لحد امته زعلانه كده   صحيت مفزوعه ملقيتش حد 
1025882882143862784,EG,"الرجولة انك لما تكون ماشي وقدامك بنت تسبقها وتمشي قدامها عشان متبقاش خايفة  تلم ايدك ورا ضهرك لما بنت تعدي من جمبك لما تكون فالموصلات تضم نفسك لو بنت قعدت جمبك
تقوملها وتخليها تقعد لو كانت واقفه متقولش الفاظ و اوصاف وتقول بعاكس خليها تفتخر بيك حتي لو متعرفكش خليك راجل لنفسك"
1026579515517091840,EG,لما البيب يتأخر خمس دقايق بالرد 
1027143342050733952,EG,"في رجاله مش رجاله 
رجاله بالااسم بس زي طائر البطريق كده هو طائر بس ابن وسخه مبيطرش"
1027418372437430400,EG,"سؤال للذكور و بجد مش هزار

هو ليه لمي حد يقولك لا انت مش راجل او اي جمله بنفس المعني لازم الرد يكون متعلق بالقدرة الجنسية زي تعالي اوريكي انا راجل و لا لأ

هو انتوا مش عارفين ان الحيوانات زي الحصان مثلا قدرة الجنسية اكتر بكتير و ماسمهوش راجل"
1027418392364572800,EG,هقول حاجة و أتمنى شرطة الحجاب متزعلش احنا لا نعتبر محجبات يا جماعة لا البنطلون الضيق و لا الجيبات اللي بتبين حتة من الرجل من تحت دي تعتبر حجاب احنا نعتبر محتشمات ف أتمنى اللي تيجي تتكلم عن الحجاب و يبقى حارقها اوي تكون محجبة زي ما الكتب قال غير كدة منسمعش حسها شكرا
1028141743823380352,EG,حاجه مقرفه انك تكون شخص مزاجى اقل كلمه تضايقك وتقلبلك مودك وتخليك مقريف وانك تتحول فى لحظه من حاله الفرح والانبساط لحاله من الهدوء والسكون والجو كله فجأه يبقى كئيب ومش طايق تتكلم مع اى حد انك تبقى مش بتعرف تتجاوز اى حاجه ضايقتك فى ساعتها وتاخد وقت عشان تنساها وترجع كويس تانى
1028142854093398016,EG,وجع ضهري مبقاش محتاج مساج غالبا بقى محتاج حد يجي يتمشي علييه عشان بتظبط
1028144736102752384,EG,"يا جماعة انا بحب الزرار اللي بيلم سلك المكنسة جدا
نفسي يلم حياتى بدل ما هي متبعترة كده "
1031106231631527936,EG,دعيت عليكوا فـ رمضان وهدعي عليكوا فـ وقفه عرفات تاني وهدعي عليكوا بالعربي وبالانجليزي والفرنساوي ياعالم رمم  
1032588685789855616,EG,إحنا نحشي كل ممبارايه لحمه و نحشي كل موزايه ممبارايه و كل عرق تلبيانكوا نحشيه موزات كتير و بعدين اكلهم انا 
1033446586221768832,EG," كيلو دهون زيادة في العيد الكبير
 هو احنا مش لسه زايدين  كيلو العيد اللي فات  
 يا سيدي دي لحوم التانيين كحك وبسكوت  الدهون درجات "
1033446924219760640,EG,لما يكون في حد عنده عيب خلقي ف وشه او اي تغييرات نتيجة حادث وتقوله انت جميل وشكلك كويس اعتقد دي حاجة بتخنقه علشان هو عارف انك كداب وبتقول كدة وخلاص مش عارف ايه التصرف الصح بس اعتقد يعني انك تسكت خالص ومتجيبش سيرة شكله حلو او وحش ده افضل وتكمل كلام عادي ولا كأنك شايف حاجة
