id,dialect,text
1010695053302476800,EG, انت بتحب ولا ايه
1010695395108847616,EG, بتحب مين يا قطقوط
1010880208730194048,EG,قالك خيبة بالويبة حد يعرف ايه الويبة دي يا جماعة
1010923120864186368,EG,اه صحيح ايه التيل ده  
1011044949452902400,EG, صح  انا كمان اخدت بالي من كده
1011052564622831616,EG, لا في بس مش ليك  خش نام احسن
1011053192401117184,EG,  طلع في سبب علمي  و الله احنا لماحين 
1011054306148176000,EG,انا متحمسة جدا بقى ل ماتش بكره دونا عن كل اللي فات و ح اشجع بنفس الطريقة و اكتر كمان  شجعمصر تحت اي ظرف من الظروف و دون أي سبب من الأسباب
1011059324905541632,EG, مين جاب سيرة التفاؤل انا قلت تشجيع 
1011259644742983552,EG,الحكم  شارب شاي بالياسمين كتييير
1011260347473387648,EG,الله ده انت مصمم بقى
1011266285018247168,EG,اسكت يا لساني عشان عيب 
1011267196499218432,EG,احب بس اقول بمناسبة الماتش و بغض النظر عن النتيجة أن تيرانوصنافيرمصرية و أجري على الله
1011267892732743552,EG,تريزيجيه ده اكيد عليه ندر نسي يوفيهشجعمصر
1011268857238114432,EG,يكونش كان دور شاي
1011269421984370816,EG, اصل مش ممكن بجد ملك الفرص الضائعة
1011269710162399232,EG, بس ابقى افتكرني لو قعدت في البيت أو اختفيت 
1011273086220595200,EG,لا ده الحكم شرب و اتكيف من الشاي بالياسمين
1011273650849435648,EG,طب ما نثبت الكرة للفريق السعودي و ياخدوا فرصتهم كاملة
1011276650531745792,EG,لذاذ قوي الفنانين اللي بيلحقوا يثنوا على الفريق السعودي قبل نهاية الماتش  الحق مكانك ف اسبقية الحضور مهمة بردك شجعمصر
954106041351974784,EG, رانيا هيلب   في ايه انا ح اموت من البرد
954106415500624000,EG, اه لسه واصلة النهارده  
955584903911038976,EG,اشرب كاكاو ولا قرفة باللبن
955585281377357824,EG, و الله ما انزل لك كلمة ابدا
955585530728763392,EG,و بالمناسبة دي هو اسمه كاكاو مش هوت تشوكليت
956295052413800448,EG,"بعد ما اده و بعد ما خد
بعد ما هد و بنى و احتد
شد لحاف الشتا من البرد"
956504851902615552,EG, و طار في الهوا شاشي و انت ما تدراشي
956509442815746048,EG,ازهى عصور اللي يعيش ياما يشوف
956510517824286848,EG, ههههه دي طفشت خالص
956847728746745984,EG,أزهى عصور ما بلاش نتكلم في الماضي
957386050447511552,EG,التايم لاين ملتهب جدا   وات از جوينج اون
957387054916259840,EG, هنا حتكون وجبة العشاء التالتة عندك وجبة ايه
957387650788483200,EG, دي اصدق قول مأثور قريته في حياتي
959189858576150400,EG,"يا جارحة القلب بعيونك 
يصونها المولى و يصونك      "
959413322545287168,EG,ينفع افركش مع بنتي لحد ما تعدي المراهقة و بعدين نرجع لبعض تاني 
959884566235418624,EG,  و انت كنت عارف الموضوع ده و مخبي علي 
960855139132289024,EG,ايوه  يعني الجو ده اسمه ايه
961739273820168192,EG, في كل أحواله  ايه يا عم الحلاوة دي جتنا نيلة في حظنا الهباب
962599431844651008,EG,ليه يا ربي ما خلقتنيش من الناس اللي بتصحى تفط من السرير على الشارع
962737170632073216,EG,"لايق عليك الخال ياللي الهوا خالك
مشغول عليك البال و لا حد على بالك"
963520305011593216,EG,"و الفجر لو جه ولا ماجاش 
الفجر عمره ما يجي بلاش"
964336646459219968,EG,"    بعدي عنك يا حبيبي اد ايه فارق معايا          
"
964926492982595584,EG,ايوه بقي يا دودو يا جامد 
965261543599411200,EG, ربنا يخليك ميرسي لذوقك
965307606062583808,EG, ده ابراهيم ناجي مش سومة 
965337695898755200,EG,"عيني يا عيني يا عيني عيني عليكي
كل القلوب بتدوب بتدوب حواليكي
اما اناوحدي انا 
ب اشوفك بس بعيون غير عيون الناس
و احبك بكل ما بالقلب من إخلاص
ب اشوف الحزن مداري ورا الضحكة اللي في عينيكي 
و اسمع في رنين صوتك شجن مالي لياليكي"
969868894159679616,EG,هأ هأ هأ اللي ربى خير من اللي اشترى
970704845484281984,EG,ازهى عصور الإمعان في اللي نفسك فيه
973878688465997824,EG,غياب الديب عمل للغنم هيبة 
979425481677246464,EG,  دودو اي لاف يو  انا في الشدة شديد و في القوة قوي و في الهزار قوي قوي بقى 
979425848368525184,EG,  و كفاية انك مستحملاني
979426419309711360,EG,دودو الحلوة الجدعة بتسيطني ف انا ح اسيطها بالتبعية و اقول  ان قدرتك على إدارة اكتر من ملف  على اكمل وجه و كلها بلاوي مثيرة للإعجاب و التقدير  و انا بجد ب اتعلم منك 
979439003412959232,EG,  هو انا عندي اغلى من المستمعين
979657265400700800,EG,   ايه ده انا عايزة برجي
979708362635071616,EG,   صح في جزء كبييييير
985056154572198016,EG,ذرا للرماد في العيون 
988360332103094400,EG,"و نخاف من بكره ليه 
مين عارف بكره ايه"
994380649799839616,EG,  واحشني جدا يا انصاري
994386030248808448,EG,نفسي قوي ابقى من الناس اللي بتنام بدري
999238734494257152,EG,طب والله الجو حر صحيح لكن محتمل
999240493375606784,EG, انا في الشمس اهو انت ظالم الشمس
999241093798612992,EG,  ب استغرب جدا أنكم لسه بتتكلموا جد في السياسة خليكم فريش كده اومال
999253686617436160,EG,الناس يا فرحانة في وائل عباس يا زعلانة عليه  انا بقى نفسي بس اعرف هو اتقبض عليه بتهمة ايه
999254232783040384,EG, هو ده السؤال البديهي الوحيد و محدش يسأله ولا حتى مهتم يعرفه حاجة غريبة جدا 
999255892049744000,EG, طب و انا أعرف منين دلوقتي
999294187152473984,EG,    يغيروا ايه  هو ده اصلا اسمها
913030099183816832,EG,من احلى البومات فؤاد
914235774719201152,EG,التعداد السكاني يثبت بالقطع ان الشعب عنده مزاج و بال رايق و وقت فراغ معا يدا بيد مع الحكومة  للقضاء عليهم فورا 
914986677877248000,EG,نفسي قوي لما اعوز انام ادخل انام علطول دايما اتلكع في حاجة تطير النوم من عيني و اقعد اغني ظلموه للفجر
915514294250479616,EG,بقالي اسبوع ب اقاوم رغبة ملحة في طبق عسل اسود و طحينة و الحمد لله الرغبة انتصرت النهارده 
915516826842431616,EG,  و هو ينفع برده من غير  عيش 
915721904249597952,EG, سبقتك الصبح على الفطار
915887792449835008,EG, انت اللي فين  مختفي خالص
915976498842087424,EG,عاش اللي قال للرجال عدوا القنال
916022612614054016,EG,  طيب مل تيجي نتعشى حمام بقى ههههه
916029344660803584,EG,  لا حمام محشي رز و محمر
916064862375153664,EG,و بمناسبة  اكتوبر يوم العزة و الكرامة احب اعيد على كل المصريين اللي لسه فعلا بيشعروا بالفخر و معتزين ب ارضهم و فاكرين الدم اللي اتدفع فيها
916788225456459776,EG,هي الناس دي كلها راحت تزور المنتخب في المعسكر قبل الماتش ليه  روحوا لما نفوز باركوا و هنوا  مش لازم اللقطة دي يعني 
917021696896487424,EG, اوبا فين زعبلة يجي يشوف
917105948132630400,EG,طب احنا دلوقتي حنحب كوبر و لا حنشتم فيه برده
917120536043454464,EG,و كلهم حيسموا العيل ذكر او انثى  صلاح  
917468040375226368,EG,لذاذ قوي اللي داخلين في الزيطة يطالبوا بالإفراج عن اي حد في السكة
917796809954783232,EG,حلو الكلام ده و الانسجام ده
917802864583565184,EG,     لعلمك حنعمل شغل عالي جدا
917803450645254016,EG,ادي اخرة السنين الطويلة في عالم أحادي القطبية 
917804740653735936,EG,     عيب عليكي  يا نعيش عيشة فل يا نموت احنا الكل
917890465751555968,EG, الله  هما ليهم حقوق كمان
917890680332177408,EG, و النبي سيبيه يروح  ده احسن عقاب ليهم و له
917890873257586816,EG, زي ايه كده  ممكن نبذة
917891031496085632,EG, ده احنا المفروض نشجعه على الخطوة دي
917892478983901184,EG,  هما مالهم جرى لهم اايه
917892878583648384,EG,  دي اهانة ل داليا على فكرة
918436724895899648,EG,ليه طوارئ   هو حصل حاجة 
920366461394342016,EG,في محطة راديو   شوية مزيكا لوز لوز لوز  حد يعرف دي تبع مين
920366640558215168,EG, يا عم بقى بلا شهرزاد بلا شهريار 
920367336477118464,EG, امتى  ما محصلش انت ما كلمتنيش
921146107958386816,EG, الاكل  دايما في مرحلة الأكل معروفة ههههههه
921646631329652736,EG,انا مش عارفة اعبر ب اي كلمة  كل الكلام ماسخ و فاقد ل معناه
922813613580128384,EG,  ده سؤال عشان تنتحر طبعا ههههه
923497368519102464,EG,"  أصالة  تخيل بكرة مع اتصالات     
"
923500475131088768,EG,"  مصطفى قمر  وأنا ليه      
"
923506132513116160,EG,"      شيرين  ما بتفرحشى     فري ميوزيك   
"
926956478912745600,EG, ده بجد ولا كلام جرايد
926956660186386432,EG,  اه انا عارفة  ربنا معاها
926957467455623168,EG,"ايه شغل كيد النسا و تلقيح النسوان ده اللي بين الزمالكاوية و الاهلاوية 
انعم و اكرم الحقيقة "
926962656094904448,EG, اهدي اومال مش كده  ده لسه الفتي كتير
927152779612901376,EG, اخص اخص اخص  عيب عليكم
927535263110352768,EG,اول وزير داخلية ذو انطباع عن اول رئيس وزراء مسافر  قسريا  
928380412958793600,EG, انا عايزة سنين صمت شوية هههه
929781908254416768,EG,هو دراعك بيوجعك قوي ياد يا مرسي
931909685162266624,EG,ازهى عصور محاكم التفتيش
932406250356334592,EG,ليه ابقى تعبانة قوي و مرهقة و مش عارفة انام 
932598642959110016,EG,ازهى عصور السكتم بكتم يا بجم
934328132563324800,EG,مش دايما الواحد بيكون عنده حاجة يقولها القهر الحق كاتم لأي تعبير 
934372648183836800,EG, المهم ان لسه عندهم عين و جهد يتكلموا
934448584900083584,EG, اللي يعلق على قوة غاشمة تاني  قولي له انت تافه تفاهة مفرطة
935584089893167232,EG,اذاعة الاغاني شغالة على اغاني شادية لكن فقط الوطني و الديني منها  مش فاهمة اشمعنى و فين بقية أغانيها
935589513983942784,EG,لو قلنا في البعد ارتحنا يبقى بنضحك على روحنا
935919291769196416,EG,ما تسيبوا الراجل في حاله بقى 
936609696068395008,EG,هو الجو برد فعلا و انا بس اللي بردانة
936624700645609600,EG,يا لهوي حنلاعب روسيا سخصيا على أرضها وسط مشجعينها يا خوفي من الرجالة المصرية يقعدوا كلهم ناحيتهم
936697310280601600,EG,فردة مناخيري اليمين اتسدت و زوري بيحرقنيده معناه بداية دور برد
937241433257496576,EG,اخبار الهري ايه النهارده على ايه بالصلاة على النبي
937242066278641664,EG, خلاص ح اخد لفة في السوق و ارجع تاني هههه
937258652469260416,EG,   ايه ده انا اعرفها  طلعت مرة معايا
937259791705047040,EG,   دي بنوتة لطيفة جدا كانت عاملة فيديو عن الرجالة بس الاسم ضايع مني دلوقتي
937749360787501056,EG,الضلالي اخطر بكتيييير من الكاذب 
937755345916694400,EG, معبر جدااهي محاولة لزق شفيق في الاخوان او التلميح ب اي اتصالات كده و لا كده دي نكتة الموسم و كل موسم
937765187486211968,EG,انا اول مرة اتشتم كده 
937815827969183616,EG,ايه يا جدعان ده الحوثيين طايحين و محدش عارف يلمهم
937985408947884032,EG,ايه موضوع السينجل ده
938027242147508224,EG,اليمن ده يا عيني ب احس ان مالهاش حد يسأل عنها 
939282960523649024,EG,واضح ان انا فاتني كتير  هو مش الأخ مبارك البغيلي كان بيحبنا ايه اللي حصل  مين عمل ايه امتى في مين
939908922642698240,EG,تويتة في حب لطيفة 
939915876127661952,EG,"  مدحت صالح  بقى يعني       
"
940339819636510848,EG,هو عمرو اديب عمل ايه
941104718121766784,EG,ال  دي هي اللي فعلا فعلا عبت الهوا في ازايز 
941738445650759552,EG,لا يعاتب اللي يتوب  ولا في طبعه اللوم
942012682869330048,EG, كل واحد و شوقه بقى 
942079980124729216,EG,نفسي في    قوي و  بطل يعملها  
942081206291697664,EG, برافو برافو كمل جميلك بقى و اطبخ و ابعت 
942349498394841216,EG, مالناش دعوة بصوت لي خهههههخ
942702531809079168,EG, ماكانش ينعز و الله
942816149691125760,EG,ديسمبر فقد هيبته تماما بالجو ده 
944277150240264192,EG,هو البرلمان عارف ايه هو   بتاعه 
944364149169148032,EG, و ماله مش عيب
944364434448896000,EG, ليه يا زعبلة الوش ده  ده انا حتى لطيفة
944373744914616448,EG,تويتة في حب وردة 
945279963141492736,EG,نفسي اعرف الناس ليه بتركن صف تاني على ناصية ملف فتعمل أزمةما تقدم خطوتين و تفرج علينا يقوم ربنا يفرج عليك كده بدل ما اللعن يكون من حدك و نصيبك قولوا أمين
945282622665691136,EG,امممم سنيتوا سنانكم خلاص على شيرين رضا  ما داهية لا يكون صوت المؤذن  المزعج الوحش  من المقدسات او يكونش مكتوب في كتب التراث
945579403676930048,EG,هي ايه دينية البرلمان دي  شغلتها ايه يعني اول مرة اسمع عن برلمان في دولة متحضرة عنده دينية 
945580405201211392,EG,انت جاية اشتغلي ايه
947099021390336000,EG,يا ريت الاخوة المواطنين اللي بيصوروا الحادثة الإرهابية بعد كده يركزوا و يظبطوا كادراتهم و الستات تبطل ولولة شوية احترافية يا شعب مش كده 
947630296266133632,EG," ترقب 
قلق
توجس
ولا يفرق  حنركب المرجيحة برده و ناخد بالانس"
950124997099642752,EG,الله يخرب بيت الشتاء  انا جعانة
950125607442157568,EG, كفاية ما هذا الشر 
950128071201509376,EG, مين الظابط اشرف الخولي
950184097737068416,EG,و بعدييين انا جعت تاني  يا رب الشتا يموت 
950883080117653632,EG, نواشف و مقرمشات مع شاي باللبن او شاورمة في عيش صاج ملفوف مع مخلل
950883574625992832,EG, انا كمان ريقي جري 
950884047315787776,EG, هههههه يلا بينا انا جاية في اي اكل
951140025575575552,EG,"صافيني مرة 
و جافيني مرة
ولا تنسنيش كده بالمرة"
951539558621024384,EG,  لا لازم نرد بس لما نخلص
953258839314493440,EG, لا لسه ما رحتش 
954105446398341248,EG,اسكندرية استقبلتني استقبال حافلهوا و مطر و بررررد
954105870782255232,EG, محدش فاهم حاجة ابدا 
1071176581744340992,EG,انا محتاجة أتجوز عشان ألاقى حد يفتحلى البرا ويقفلهالى ويعملى مساج لضهرى أما يتفشخ زى دلوقت كدا 
1071182574452686848,EG,ممكن ما تجملوش شيء قبيح العصبية فعل قبيح وأنا عصبية والكل عارف دا بس أنا مدركة تماما إن العصبية غلط وإن دلت على شيء فما بتدلش على الطيبة والعفوية هي بتدل على إنعدام السيطرة ولو قدرت تتحكم في نفسك فأنت هتفضل شخص طيب وعفوي لكن هتكون أهدأ وأعقل وأقل أذى لنفسك ولغيرك
1071362999565340800,EG,انتو صاحين بتتكلمو ف الكورة الساعة  الضهر ليه ياشباب هو احنا قصرنا معاكم ف حاجة يعنى
1071364091455913984,EG,محتاجين ابليكيشن لرفع المعنويات يعني الواحدة تبقى متضايقة مثلا تفتح الابليكيشن يقولها بالذمة بقى القمر دة يزعل كدة
1071423962129797248,EG,مراعاتك للحاجه اللي بتزعلني وتجنبك فعلها عندي بالدنيا اني احس اني مابهونش عليك دي حاجه كفيله تخليني اشيلك فوق راسي العمر كله والله 
1071487875382984832,EG,"البنت اللي تقف تغسل مواعين ف عز البرد ده
 اتجوزها وانت مغمض"
1071518845054128000,EG, ده جاي ع قناه اي
1071686364662509568,EG,احلى هدايا تتجاب دلوقتى جوز شرابات أو جوز بس يعني ايهما اقرب 
1071733331660812416,EG,اول مره احس من فترة اني عايزة اتعرف علي ناس جديده في حياتي  ناس نضيفة طبيعيه مس متعبين  مش مقرفين زي الخرا اللي بنشوفه واللي عشناه عايزين نعيش حياة من غير خرا وقرف وقلة قيمة وتعب وبس  عايزين نرتاح ننبسط نحب ونصاحب عاييزين نفوق من الغيبوبة دي بجد 
1071733940690542592,EG,"نظرة عين من واحدة انت عايزها بتكون مثيرة اكتر بكتير من واحدة ملط بس انت مش عايزها
تنميةبشرية"
1072138591629910016,EG,"مش فاهمه وجهة نظر المسلمين الي بيدافعو عن الشواذ وبيشجعوا رغبتهم وكأن الشذوذ ده مش مرض ولا إن قوم لوط اتخسف بيهم الأرض
 
 اتؤمنون ببعض الكتاب و تكفرون ببعض "
1072184683172106240,EG,"الاطفال دول كائنات هادية وجميلةمابيعيطوش الا لما بيبقوا عايزين يناموا او مش عايزين يناموا او يعملوا بي بي او بيسننوا او جعانين او عطشانين او زهقانين او عايزين يلعبوا او عايزين يلفتوا الانتباه
 وبس غير كده هما زى الفل "
1072205630801411968,EG,لما تسف ع نفسك قبل ما حد يسف عليك   
1072246766387499008,EG,  ده الحديث بتاع خير ما قلت انا والنبيون من قبليت 
1072255995487895552,EG,"المرايه اللي مطلعاك وحش ماتبصلهاش
الحاجه اللي مضيقاك ارميها
الشخص اللي تاعبك تجنبه
الشارع الزحمه ماتعديش فيه
انت المسؤل عن سعادتك فاشتري دماغك"
1072350037370384384,EG, الكلام اللي عليه دايره بالازرق آخره بيقول انك لا تاثم لو نشرته بس اكتب الحديث زي ما مكتوب اللي تحته خط اسود لأن تقريبا انت نسيت تكتب عشر مرات 
1072353418117898240,EG,كل يوم بتأكد انك لو بتحب حاجه بجد ممكن تستحمل اي حاجه عشان خاطرها وتضحي باي حاجه تانيه عشان خاطر متروحش منك ومهما اتعمل فيك بتفضل برضه عايزها وبتستحمل وإن اعتزل مايؤذيك والكلام ده صعب لان مهما كانت الأذيه لو جيالك من حاجه بتحبها بتستحملها لأقصي درجه
1072354230835523584,EG,حد ياخد العلاقات دي من وشي انا عايزه ارجع العب تلبيس بنات و تبقي اقوي طموحاتي ان امي متدخلش الاوضه تقولي ايه قله الادب دي
1072356128070266752,EG,صحيت النهاردة في نص الليل عندي ضيق شديد ومهمومة وبعيط جداا وبرجع بشكل هستيري اكتشفت ان اخر كام شهر عدى عليا فيهم اذى فوق طاقة اي بشر وكنت متماسكة واخر حبة حزن او زعل طلعو الليلة دي وحاسة اني صاحية نضيفة فعليا فصباح الخير من جديد
1072592155892420608,EG,استفسار صغير لبتوع بوستات هوا الجواز كده فعلا  يعني آنتي بتشوفي ابوكي مشعلق أمك وبيجري بيها في الشقه
1072608374099984384,EG,  طب هو عامل اي دلوقتي
1072613295943835648,EG,اكتر حاجة ممكن تظلم بيها نفسك هو انك تطلب اهتمام من حد مش عارف قيمتك من حق نفسك عليك أنك متخلهاش تتسول المودة والقربولا ينفع من باب الكرامة انك تشحت اهتمام حداللى بيحب بهيتهم مهما كانت الظروفابعد عن اللى رابط كل حاجة بالظروفمحدش فى الدنيا ينفع يحس ابدا انه مش كفاية
1072618397215666176,EG,"يابنتي ده بتاع نسوان

طب ما انا نسوان

"
1072799076226351232,EG,اللي مزعلك عارف أنه مزعلك ومش فارقة معاهاللي مبيسألش عارف أنه مبيسألش ومش في دماغه واللي بيكدب عليك عارف أنه بيكدب ومكمل عادي كبر دماغك وبطل تعاتب حد علشان كل واحد عارف هو بيعمل ايه كويس
1072911042441826432,EG,زمان لما عربية تبقى هتخبطنى وانا بعدى كنت بزعق أقوله شيلنى أحسن دلوقتى بقيت بقولها وانا بستعطفه اللى هو وحياة أبوك يا شيخ شيلنى أحسن و حاسة محتاجة أتأسف لكل اللى زعقت فيهم قبل كده
1073110035939631232,EG,بحبهااااا والله يا ناس  
1073118518701449216,EG,بكلم واحده صاحبتي بقولها متفكريش بقلبك قالتلي انتي عمرك م حبيتي ولا عرفتي تحبي ف مش انتي اللي تحكمي عليا ف حاجه متعرفيش فيها و دا يعتبر اقصي رد فعل غير متوقع
1073279210146402432,EG,مش عيب يجماعه ان نرفع البنطلون واحنا ف الشارع يعني اصل مش هستني لما البنطلون يقع خالص وده ال هيبقا عيب والله
1073338719866904576,EG,الراجل الحنين المتفهم المثقف السيكسي اللي مهتم بنفسه وباللي معاه اللويال العملي وناجح ف حياته اللي يشوف حبيبته يقوم راقعها حتت بوسه من غير ما يطلب اللي بيعرف يعمل أكل و سفر عنده هوايه رزق 
1073345321474887552,EG,هو ممكن يكون البوس في العموم مقرف لما تيجي تبوس حد مابتحبوش او مفيش  بينكمانما احيه لو بتحبه ممكن تفضلوا نص ساعه مثلا بتبوسوا بعض بس 
1073347199856271360,EG,مينفعش أروح لحد وأعلمة ازاى يهتم بيا أنا ممكن استحمل هبلك فى محاولة انك تسعدنى بس يكون من جواك انت انا عاوز شخص ارسيه على كل حاجه فى حياتى اللى بيضايقنى واللى بيفرحنى واسيبه بقا بمجرد مايحصل حاجه الاقيه بيلمحنى وبيلمح تعابير وشى ويعرف انا مالى
1073571665068593152,EG,انا أنسى فى شفايفك اسمي
1073583549226369024,EG,أنا عارفه ان النسيان نعمه والله بس ده الامتحان 
1073622341442252800,EG,البنت لما بتغلط بتتحضن مش بتتعاتب يا بهايم
