id,dialect,text
1154304988027527168,EG, مش موضوع مريض  الفكره انه مشجع كوره يعنى و بيتقبل السف و الشتيمه كده يعنى
1154318613307953152,EG,لحد الدورى اللى جاى ما يبدا  
1154732910378926080,EG,اهى دى صوره لو هفك الشوق حرفيا  
1155461002324008960,EG, مش لواحدك  انا كمان
1155462156688793600,EG,ده كده فيلم سكس بقى 
1155567839249666048,EG,كسمك يا نقاز على كسم الزمالك
1155568273339101184,EG,كس ام اللى كان مستنى يشمت فى الاهلى ولا طالشي 
1155576797595148288,EG,ماوقفتش ع الكوره ليه  
1155577811903688704,EG, ايه يا مزه  مختفيه ليه
1155589819533316096,EG,تصدق طلعت بتاع بليله 
1155594718492942336,EG,اتفرجوا على قناه المحور  ضحك السنين بجد
1155595138367971328,EG,مبيبقاش باكى على حاجه 
1155611851675328512,EG, عاوزين لاعيب انتقال كامل و هو عاوز أعاره ف باظت
1156295679725019136,EG, كده مش هيلعب خالص
1156334982077591552,EG, نورت الاهلى يا معلم
1156341577125679104,EG,الواد عواد ده من كتر ما هو واخد قلم فى نفسه  هياخده
1156492174034382848,EG,افتكرت اللى ورا ميسي دى دينا الراقصه  
1156619083250618368,EG,الناس دى عايشه فى حته تانيه تقريبا 
1157272706141884416,EG,مش هتاخد عبدالله السعيد معاك  
1157273863383920640,EG,اسبووووع  ده بيقعد فى القناه اكتر من كده 
1157289685900824576,EG,مش عارف الزمالكويه هيعملوا لما غالى يبقى مدير الكوره للمنتخب 
1157290193344483328,EG, يلا فى داهيه  كسمهم 
1160550483926376448,EG,فته ايه اللى من غير صلصه دى 
1160879615314976768,EG,تخيلوا الزمالك بيقارن ما بين دول و احنا عندنا لاسارتي الحمار و عندنا فرقه تقيله بجد 
1160880305802305536,EG, مش عارف ايه وجه التصميم عليه  حاجه تجنن
1116449581313740800,EG, ياعم خليك فى الشوق اللى اتفشخ ده 
1116489388794556416,EG,انتوا متخيلين انهم كانوا بيقطعوا الصوت فى مدرسه المشاغبين و العيال كبرت على الألفاظ الخارجه زى كلب و حمار  حاليا الأفلام و الإعلاميين بيشخروا على الهوا
1116490838924775424,EG,   هو الزنجى ده بس  الله يرحم دى مش كوره ده فيلم سكس و اللى جابهم حسام و فيلكس 
1116717715937427584,EG,  بس لو فتحتى اون سبورت هتلاقيهم على الهوا من دلوقتى
1116719975429963776,EG,  تقريبا عاملين برزنتيشن عن مصر  احسن من اننا نعملها
1116781401674788864,EG,البت الصغيرة اللى عملين يشقلبوا فيها دى انا خايف عليها والله
1116785308559978368,EG,الحفلة جميله  ارحموا نفسك شويه و بلاش تنظير عميق والنبى
1116797724962304000,EG, و عبد الفتاح ده معانا ولا ايه 
1117000667351212032,EG, و فعلا متجوزه اخوها ابن أمها و ابوها 
1117044915165437952,EG,"
الجماهير كلها هتتثبت وتتقلب وهما داخلين الاستاد "
1117084683211300864,EG,"قالك بنشجعه عشان بيكسب و بيب بيب
مع ان  من اللى رايحين عارف اننا مش هنصعد  "
1117087022898909184,EG, ده يبقى كسمه لو لاعب ناصر ماهر اساسا
1117129527858221056,EG,ياريت نكمل بالمجهود ده فى الدورى عشان عندنا شويه شراميط محتاجين نكسبهم
1117129981832855552,EG,فى حبه عيال  التراس على التايملاين بضان فشخ
1117463034849628160,EG,اخر كلام على التعديلات ان السيسي يكمل المده دى بنظام  سنوات و ليه الحق فى مده تانيه فقط و بعده اى رئيس مدتين كل مده  سنوات  كده انا فاهم صح ولا غلط 
1117464415476027392,EG, لو كده ممكن أغير راى و أوافق 
1117466685269843968,EG,و ايه علاقه الزمالك بالموضوع  تركى الشيخ هو اللى دافع و هو اللى هيقرر 
1117494684027375616,EG, لا دى هتزيد ل  سنين و يترشح مده واحده بس  سنين كمان يعنى لحد 
1117495898844684416,EG, اصل الاول كانوا هيكملوا دى  عادى و بعدين يترشح مرتين كل مره  سنين 
1117500720608108416,EG, خالص  دى أعصابكم انتوا يا بتوع الشووق 
1117525335405469568,EG,  طب لو سمحت ملكش دعوه بالكوره تانى بقى 
1117541736669118464,EG,ما هو فرجانى اللى جايبه تركى و هو اللى هيقرر يبيع للهلال ولا لا 
1118260516126887936,EG,معندهمش كامل الوزير ولا ايه  
1118505948933435392,EG, ايه يلغوه مع التعديلات ولا ايه 
1119275182772891648,EG,ببقى عاوز اقول لا على التعديلات الدستورية بس ادخل تويتر ببقى عاوز انزل دلوقتى اقول نعم
1119276379235913600,EG, أكيد طبعا بس الواحد بيشوف حبه ناس ولاد وسخه هنا ينرفزوا 
1119278855360057216,EG, اعتقد هيكمل بيهم الموسم لو صابت تبقى حاجه حلوه لو باظت يبقى جوزيه من اول الموسم الجديد  لان التغير دلوقتى مش منطقى ده لو لاقيت حد اصلا  كبيرك عماد النحاس لو وافق يسيب المقاولون اللى عامل معاه شغل حلو
1119279997125111808,EG, فى قطاع كبير من مجلس الاداره عاوز جوزيه بس بيبو مش عاوز
1119280414860947584,EG,عموما و احنا بنسب الدين للاعيبه بس الأسيوطي امبارح لعب  دقيقه فى الشوط الاول بس
1119645679603867648,EG,انا معنديش اى مشكله مع الريس و شايفه زى الفل و لكن صوتى كان لا عشان مش عجبانى الطريقة اللى حاصله دى كنت شايف انه يجيب اى رئيس و هو يمسك رئيس وزراء لمده واحده و يكمل مدتين بعد كده عادى لكن مش كل شويه نلعب فى الدستور  و ربنا يوفق الجميع
1119647084410560384,EG,و اخيرا وليس آخرا كس ام الاخوان اخ اخ و أخت اخت و كس ام الثورجيه و اللى بيعرصوا للاتنين
1119666736893239168,EG, كان ممكن برضو يعدلوا الدستور فى الفتره اللى انا قصدى عليها  عموما كانوا المفروض يتصرفوا بشكل احلى من ده
1119667902494466048,EG,  ده زعبله استاذنا كلنا 
1119692643489992832,EG,لو كنت طلعت الكوبري ده قبل ما اصوت كنت قلت نعم 
1119715598659985408,EG, الزمالك هيقع و بعدين انت لسه ليك ماتش مع الزمالك نفسه انت خلصت ماتشاتك مع الأسيوطي
1119716016932651008,EG, بأمن يا جدع عشان لو احنا كمان وقعنا
1119720123051409408,EG, لا ندمت لما طلعت الكوبرى الجديده اللى من عند امن الدوله لحد التجمع 
1119723914949812224,EG,  بس خلى بالك من اول فاصلين لسه مخلصوش و بعدها طير
1119724888976187392,EG,  غالبا كده هيخلص فى الموعد ده
1120099173196496768,EG,  ده رئيس حزب المعارضه اللى حزبه كسب فى إسطنبول و انقره كان بيحضر جنازه حد فى الجيش ف اتباع اردوغان ضربوه
1120417420219486208,EG,مستنى الواد ابو شيت اكسل اللى قاعد قدام التليفزيون و بيكتب فى الأرقام عشان يثبت ان ارقام اللجنه العامه غلط
1120426905512103936,EG, ده من اهم الحاجات اللى فى رمضان 
1120428585389629440,EG,   لا دول زى الفل بس المعلم ده ملوش حل 
1120438489651339264,EG,الناس اللى بتناقش ليه النتيجه يوم  ابريل و بيتريقوا و بيقلوا عشان يزورا براحتهم احب اقول لحضرتك يا جهبز زمانك يا عالم النوايا فى حاجه اسمها طعون و النظر فيها لمده  ايام و بعدها بتعلن النتيجه يا حمار
1120438917411606400,EG, اصل تبقى عامل فيها بتفهم و انت حمار ده بتبقى تقيله عليا قوى والله
1120442959688818816,EG,لو حواله هتاخديها بنفس عمله التحويل لو عندك حساب بالدولار و اتحولت فى الحساب هتوصل دولار لو حسابك بالمصرى هتاخديها بالمصرى دى الحاله الوحيدة بس 
1120998731950825600,EG, ده انا بستنى رمضان عشانه 
1121514134665822208,EG,هو المصرى كان ليه ضربه جزاء ولا ده ماتش تانى  
1121519791288795136,EG, طب ما تحسبها ان الاهلى كان ماسك الملعب قدام الأسيوطي  دقيقه و نفس الأسيوطي ده كسب الزمالك بسهوله
1121524106061582336,EG, قصدك بقت كلمه اساسا امتى
1122996944022974464,EG,حد قالك قبل كده انك عيل بضان 
1123002907635351552,EG, طول ما فى امين شرطه بيقفش  انسي و كل ما قيمه الغرامه تعلى امين الشرطه هيقفش اكتر
1123285296400031616,EG,ده على اعتبار ان اللى معاه  جنيه ده يا مش مصرى يا اما مش هيشجع من قلبه  الافوره وحشه يا كابتن هيثم 
1123301040852545536,EG,اى منطقه بالظبط يا خول  ان كنت نسيت افتح صفحه  اكتوبر  و انت تعرف مين اللى اقوى 
1123661233759059968,EG,بالنسبه لشعار الزمالك اللى عمله اسلام جمال ممكن تحطه فى طيزك عادى يعنى
1125151802146656384,EG,ايه يا ابنى الهبد ده هات سجل ماتشات افريقيا مع الانديه المصريه و اهبد بعد كده 
1125152382751580160,EG,الزمالكاوى بيكتبوا على التايملاين اى هبد حرفيا
1125155208810704768,EG,الحمدالله اتعافينا منها و ركبنا الهايجه و الخلايجه  
1125155514118279168,EG, معانا بقى من زمان و بنحب نركبهم 
1125156228068454400,EG, عنيا بس خمستى مش هتعجبك 
1125156894434307968,EG, ده على اعتبار انكوا كسبتوا رايح جاى  روح يا باسم اتسحر و نام 
1126441751718322176,EG,اللى مش صايم ممكن يشتمهم مكانى لحد ما افطر 
1127906987382116352,EG, فى ميكس الصوبيا و التمر جامد برضو
1127910843528765440,EG, يفضل طبعا خصوصا ان فى كم مبييدات بتترش و أفضل طبعا لو فى اطفال
1127912301758177152,EG, كلامك صح بس الهداف انك تنظفى على اد ما تقدرى بس طبعا الخل بينجز
1127972725874671616,EG,انتوا متخيلين ان فى  الف واحد بقراء بتكتب الكلام ده 
1128052914327641984,EG,اخويا فتح كافيه فى التجمع جنب المحلاوى  و فى سحور كمان بس مفيش بيض مدحرج  ريتويت يا جدعان و شير على الفيسبوك  
1128240366602326016,EG,"لوكيشن القهوه للناس اللى طلبته شربوش كافيه
 
"
1129353578370351232,EG, ما مرتضى و امير هارين الناس تنمر مطلعش يتكلم ليه 
1131116680300695552,EG, فى قهوه بتاعتنا اسمها شربوش جنب سوبر ماركت المحلاوى و بيقعد عليها بنات
1134474036371775616,EG, نفسي اعرف مين اكرم صفوان بقى
1135626399946088448,EG, طب تمام انا فاكر التليفون بيخرف
1135627034124857216,EG, انا فى التجمع الاول برضو  بس واضح انها مشكله عامه فى الشبكه مش عندنا بس
1135629684211900416,EG,بمناسبة الهرى السعوديه طول عمرها بتتعامل بثبوت الهلال و مش بتشتغل فلكى لكن من شعبان غيرت بقى فلكى مصر تقريبا طول الوقت ماشيه فلكى  من شعبان بقت بتتحرى الهلال و ده اللى عامل اللغبطه دى
1135632328687067136,EG,بكره متمم و العيد الأربعاء و كمان كام يوم السعوديه هطلع فديه اليوم ده زى ما حصل من كام سنه و السلام عليكم و رحمه الله و بركاته
1135862186545471616,EG,هتلاقى ابو ريده قابض ف مش فراقه معاه 
1135867904346513408,EG, و انتى طيبه و بخير دايما يارب
1135890821771878400,EG,  حاجه كده وجع بطن والله  بفكر ابلكه عشان مشفوش قدامى خالص
1135894521403907968,EG,مالها مصر ياحبيبى ايه علاقتها باللى عندكوا 
1136127360678408192,EG,طب السيسي يكمل الاحتفال بأولاد الشهداء و يفرحهم ولا يلغى الاحتفال و يسكر بى قلب العيال دى عشان اللى حصل
1136128796082475008,EG,لينا فتره معقوله من غير اخبار وسخه من شمال سيناء  واضح انهم كانوا بيرتبلها من فتره
1136133481254313984,EG, بيطفحوا على التايملاين  ربنا ياخدهم
1136142047088381952,EG,صفوانى ابن وسخه اللى كاتب الخبر ده 
1137381198995607552,EG,"انا معرفش العمليه اللى اتصورت فى فيلم الممر دى حقيقه او لا بس عندنا كم عمليات حقيقه و حرب اكتوبر نفسها تكفى السينما عشرات السنوات  محتاجين كلام من ده كتير 
امريكا اتناكت فى فيتنام و غيره و أقنعت العالم انها زى الفل من الأفلام مابلك احنا زى الفل من غير أفلام"
1138516362173845632,EG,هى البت المغربيه مالها تعبانه كده 
1138521960605003776,EG, البت اللى عماله تشتم فى المصريات دى
1138841057087709184,EG,احاااا امال لو سمعونا و احنا فى الاستاد لما يضيع فرصه و نقوله كسمك هيعملوا فينا ايه 
1138867873177194368,EG,و ميسي يجى ايه جنب بطه مامى
1139095882744381440,EG,و عندهم القدرة يبقوا  او  فى حمام واحد  ييييع 
1139824665071763584,EG,ده انتوا لو صهاينه مش هتهاجموا فيلم الممر كده 
1140178753349398400,EG,اكيد طبعا عدو و لازم كل فتره يغذى احساس الكراهية ده عشان يورث ليوم الدين 
1140245351892430848,EG, ابن وسخه من صغره 
1140684025310453760,EG,مستنى المزز لما بطه مامى يكتب نعى 
1140684838799839232,EG, كاس عالم  بس يا رانيا بس
1140707305392131968,EG,عبقرى كان عاوز يعرف وجهه نظر مرسي قبل ما يموت  ضم يا حبيبى اكتر ضم 
1140708898812379136,EG,السورى اللى يترحم او يتعاطف يترحل  ده اقل واجب
1142066815587299200,EG,اللى هيتفرج على تايم سبورت هيكون سابق بى اوت بى حوالى  ثانيه بالميت
1142066987197222784,EG,  انا كاتبها مخصوص عشانك 
1142067476680925184,EG, الأرضى بس اللى هتجيب الماتش
1098929832967266432,EG,على فكره يا بغل الاهلى جاهز لمباراه الأسيوطي يوم  فى الدورى 
1098931994074013568,EG,أى كلام  ان شاء الله هترجع الأسيوطي زى ما كنت 
1098954243535449984,EG,ده فى بجد زمالكويه زعلانين على تركى
1098980828900671616,EG,مين بقى اللى هيدفع مرتب مدرب ولاعيبه الزمالك ولا شيكات الشوال لا تتوقف لى ولاد الوسخه
1099225479540891648,EG, الدوام لله تسلمى يا عبير
1099378398571516032,EG,الله يرحمك يا رووقه متعلموش منك ازاى يبقوا ستات
1099379277131325440,EG, هو ده اللى انتى افتكرته ليها  بلوك 
