id,dialect,text
1073635918228193152,EG,علي فكرة وبدون تحيزنكد الرجالة اسوأ بمراحل من نكد الستاتالست بتفك بسهولة وبشوية حركات هبلة انما الراجل نكده دكر
1073911529513345024,EG,رسم كروكي يوضح افضل الاماكن اللي ممكن تقعد فيها في الميكروباص  
1073984197155581952,EG,"مذيع بيسأل واحده شمال  لو بابا نويل جالك فى رأس السنه هتطلبى منه إيه  

قالته   جنيه   زيه زى غيره "
1073987172632543232,EG,"الكراش  حابه تكوني أية بعد ماتخلصي تعليم 

 مراتك  "
1074176617256247168,EG,اول ما المنبه بيرن اول جملة بتيجي في بالي هي كسم حياتي 
1074414313794879616,EG," الطالب اللي بيتكلم ورا
 معلش يا دكتور كنت بسأله عن حاجة
 اسألني انا
 معاك  جنية سلف "
1074634280922464384,EG,"جمال البنت بيتلخص في  حاجات   تشجيعهاا للأهلي  حبهاا للأهلي وهي بتيشيرت الأهلي
وكلمة أخيرة طظ ف الزمالك جمهورا وناديا "
1074771416388653056,EG,هو لازم انا اللى ادخل اتكلم وأفتح مواضيع كل مره مفيش مرة كده يحصل خلل فى الطبيعة البشرية و الاقى الشخص اللى بكون مستنيه يكلمنى سبحان الله بيكلمنى من نفسه كده عادى ولا هو انا لو متكلمتش هفضل كده محدش عارف انا على قيد الحياة ولا فى عداد الموتى
1074802039484485632,EG, اللهم صل بتتكتب بحذف الياء عشان بتختلف ف المعنى 
1074886853214515200,EG,"الناس اللي بتيجي تويتر تقعد تاخد في اي تويته كوبي وبست دي بتستفاد ايه والله  لاغيين شخصيتكم بالطريقه دي ليه  
ما تكتبو وتعبرو عن نفسكم بلاش شغل الريبوتات دا 
وقبل ما حد يقول مش بيعرفو يعبرو عن نفسهم فبيلاقو نفسهم ف كلام غيره هقله اذا كان بيسرقو تويتات الهزار والأش زي ما هي "
1074888458638974976,EG,في فيديو واحد منزله بنت بتركب القطر ووقعت تحت القطر وهي بتركب انا لما شوفت الفيديو قلبي وجعني جدا ما بالك لو حد من اهلها شافه اللي منزل الفيديو مش عايز يشيله بحجه الدعاء ليها مش عارف ليه الناس بقت مؤذيه كده
1075167073612038016,EG,مش معني اني بنزل صور و سكس اني ايدي ف كسي طول الليل والنهار  ومش معني اني عملتلك فولو او ريبلايز او كلمتك حتي يا سيدي ان ده يحسسك اني وافقت اتناك منك  صعبان عليا فشخ اننا داخلين علي  وبقالي فترة علي تويتر وفي ناس لسه بتفكر كده مش بتعرف تميز ولا تفرق بين اللي قدامها
1075167832273497984,EG,"انا عمري م شوفت حد حبني زي ما حبيتو عمري م شوفت حد ضحي عشاني زي ما ضحيت عشانه
 عشان كدا انا بشوف نفسي شخصيه مثاليه ونضيفه جدا ومعتقدش اني هلاقي حد زيي وده مش غرور ده اقتناع اني مش ينفع اكون قليله ف حياه حد يا اكون كل حاجه يا ولا حاجه"
1075239250407378944,EG,"وانا بتأمل فيديوهات فيفي عبده وبحلم لما اكبر ابقى فرفوشة زيها
فكرت اية المقدمات اللي ادت الى هذة النتيجة عشان انفذها
يعني وهي في سني بالعشرينات كانت مقضياها رقص وتمثيل وبوس واحضان وتقفيش فلازم توصل لليفيل دة من الفرفشة
انا بقى مفيش اي حاجة من دول فهوصله ازاي فهقضيها ضغط وسكر اكيد"
1075395035502391168,EG,انا بستغرب الرجاله اللي بتتكلم عن مشاعر الستات بصفة الخبير يعني عزيزي الرجل احنا بذات نفسنا ساعات كتير مش بنفهم نفسنا حتييجي انت ياللي مش بتعرف تفرق بين اللون الأبيض والاوفوايت  تعمل فيها عالم الستات امشي ياض العب بعيد
1075432325377343616,EG,يا جماعة انا واحده فاضيه اونلاين  ساعه ف محدش يستغرب لما ارد بسرعه ويقولك قاعده ف الشات و مدلوقه وبتاع انا بس بكون اونلاين ف برد لاني مش شخصيه ممكن تذل حد علي ما ترد عليه او ابقي شايقه كلامه و مردش ولو في حد بيبعتلي ومش برد ف ده معناه اني مشوفتوش وغصب عني اني مش رديت
1075481435635703808,EG,ان مكنش اول اختيارته او اهتماماته الرد المتأخر و بالذات لو متأكده انه بيكلم مع حد غيري الغياب المتقطع عدم الاهتمام الاستخفاف بأي موقف جدي مبحبش الزحمه او المشاركه التراكمات الحاجات دي كفيله تخلي الشخص ده عندي مهما كانت غلاوته و اهميته في حياتي  تخليه اقل من العادي عندي
1075518587337617408,EG,"مش عايزه موبايلي يرن  ولا عايزه حد يقولي    
انا عايزه انجح"
1075744261541425152,EG,مش ببقى عايزة أصدم الناس بس إحنا كبنات بنبعت نودز لما إحنا نكون عايزين نبعت مش أكتر الموضوع مش متوقف على كونك سمووث أو ذكي أو محصلتششخصيا لو بتكلم مع حد وبنفليرت حتى وبعدين طلب مني نودز اللي هو طلب في سياقه عادي مش تحرش هتبضن جدا ومش هبعت برضه هاه
1075745969189412864,EG,من أنواع ال  اللى نفسى فيها إنى  بيك
1075797883151106048,EG," كلامك معايا واخد طريق مش حباه
 بلعكس انا بتعامل معاكي بكل ادب و احترام "
1076241522490855424,EG,لما صاحبك يكون ماشي علي  وفجأه يفضفضلك إنه عاوز يموت  
1076243294269648768,EG," مكلمتنيش ليه لما صحيت

 طيب ما إنتي صاحية أهو ومكلمتنيش
 
 دا إنت بقيت شبح أهو وبتعرف تنكد"
1076575012004470784,EG,الترند بتاع كم انت عظيم ياصلاح ده و صلاح خد الاخلاق كلها بضان ياجماعه مبيضحكش ارحمونا
1111151612695859200,EG, طب احلف كده بالله 
1111231409111351168,EG,عملك الاسود وراك وراك 
1111237496384512000,EG,ممكن يكون بيتعالج فى تركيا 
1111253963607888000,EG,المصريين رجالة وكلهم شهامة 
1111277548816789632,EG,وايران عاملة نفسها ميتة 
1111283233013055616,EG,هى اشياء لاتباع ولاتشرى 
1112240886291804160,EG,كل شيئن انكشفن وبان 
1112243996787646464,EG,ياض اخرس ده انت شركسى منتوف 
1112398866886860800,EG,"تميميهربمنقمهتونس

ما اقدرش اتحمل سماع حد بيجيب سيرة شريفة او عفيفة
اهرب علطول "
1112580295159615616,EG, دي قاعدة رجالة  هروب تميم من تونس هشتاج يتصدر تويتر 
1112630891791167616,EG,عمرو أديب أمير قطر بيخاف على زعل تركيا وإيران أكتر من زعل الدول العربية 
1113236219729780736,EG,"تحيامصر 

كل المصريين جيش بس عاملين نفسهم شعب "
1113357166096912384,EG, اللى يسمعك يقول بصحيح ناس عندها مبداء 
1113367001722966016,EG, ده على اساس ان قطر بتبيع سبح ومصاحف 
1113391331118919552,EG,ياترى مين الصبى ومين المعلم فيكم 
1113392212996440064,EG,يحرضون ويحرضون ثم يفرون الى قطر لتناول مالذ وطاب فى البوفيه المفتوح واللى يموت يموت واللى يتعور يتعور هما مالهم 
1113796687506608000,EG, خلى اكاديمية التغيير بقطر ترسل لهم مدربين وترسل مراسلين قناة الجزيرة اللى انت ضيف دائم عليها وممكن عزمى بشارة يروح يحاضر هناك 
1113845002780778368,EG, اطلع من دول يا ديب 
1114119795308486784,EG,روسيا ملتزمة بأمن اسرائيل يابشر افهموا بقى 
1114206363750629376,EG,افرمهم وزلزل الارض تحت اقدامهم ياحفتر 
1114292612373143552,EG, زى ماعملتى مقابلة مع زعيم جبهة النصرة بسوريا كده فاكرة 
1114293120575910016,EG, يسلام على العروبة اللى بتشر منكى 
1114550499368476800,EG,قناة الخنزيرة بتقول لآ 
1114550777870200832,EG,البركة فى الغنوشى وجماعته 
1114609687645835264,EG, ده على اساس ان تركيا وقطر فى ليبيا بيبيعو سبح 
1114656617830727552,EG, كده تكلوا بعض ده انتوا اخوات 
1114662162830696448,EG,شوفت انت مش لوحدك ازى 
1152860289089572864,EG,كداب ياخيشة اخرك تبكى وتشتكى بمجلس قلة الامن 
912079289822121984,EG, فضفضي ياختي و خديني جنبك افضفض
912079522601820160,EG, بس فعلا العيال الصغيرة نامت و التايم لاين لنا 
912365454311731200,EG,بس قلبي لسه خايف من الليالي و انت عارف قد ايه ظلم اللياليحليم
912464295576920064,EG, مش فاكرة حاجة منه  ح ادور عليه
912465747372384384,EG, هههههه خلاص خلاص يلا ننام احسن بكره شغل
912604287972384768,EG,جدير بالذكر ان طول عمر المثليين عايشين وسطنا و احنا عارفينهم و هما عارفين اننا عارفينهم و احنا عارفين انهم عارفين اننا عارفينهم و الدنيا بيس
912605019224014848,EG, و لا حاجة دي مجرد ملاحظة سلوكية مش اكتر
912668647071649792,EG, يا سلام عليك يا فاهمني دايما ههههه
912678981006168064,EG,الله ده طلع شقي 
912744610732167168,EG,غريبة قوي الناس اللي بتحاسب غيرها على ردود افعالها و تنسى او تتناسى افعالها  بصوا في المرايا شوية لا هو عيب و لا حرام
912745097523027968,EG,ازاي بتعرفوا تبرروا لأنفسكم كل حاجة عادي كده ده في ناس بتجلد نفسها الف مرة على اقل كلمة 
912745883200102400,EG,في ناس بتعمل تضحيات غبية جدا مش مفهومة لمجرد انها تبعد شخص عزيز عليها عن اي الم   دول اغبياء جدا جدا جدا لأن كله محصل بعضه في الآخر
913019312717394048,EG,"  فاكر لما كان  عمرو دياب     
"
1034383195960160384,EG,هانت و الشتا هيجي و كل حاجة هتتحل وتبقا كويسه  هنشرب سحلب و نسمع مزيكا ف هدوء و نلبس لكاليك و هدوم تقيله و الجو هيبرد و نتغطا ببطاطين و الدنيا هتمطر و ندعي بحماس و فرحة العيال الصغيره بالمطرة  هانت هانت 
1034794694834888832,EG,اختاه تمن كيلو شطه حمرا تمن كيلو فلفل اسود كوبايه ونص ميه دوبي الفلفل والشطه في المايه وهاتي ازازه اسبراي من اللي البخاخ بتاعها بيتفك وحطي المحلول فيها وحطيها في شنطتك اللي يقرب منك اعميه لحد مالناس تربي عيالها والدولة تحط قوانين صارمة
1035993330436505600,EG,ازاى ف ناس ليها  حق انها  تشوف ناس احنا نفسنا بس نلمحهم ولو صدفة  او نقعد معاهم ولو ساعه ازاى  وازاى تعتبروا شوفتهم دي عادية وقلبكوا ميرقصش من الفرحة 
1038000740478926848,EG,مابعرفش اعمل اي حاجه وفيه حد بيبصلي ومركز معايا  لو باكل هوقع علي هدومي لو بشرب هعمل اصوات غريبه  لو ماشي هتقلب علي وشي اقع 
1039253214158307200,EG,"المشكلة بقى مش فى ان حد قريب منك يزعلك لا ده عادي وارد الدنيا    بس المصيبة بقى انه ميحسش اصلا انه زعلك ويقلل كمان من مشاعرك دي 
صدمتك من رد فعله بتبقى اكبر من زعلك الاساسي بكتير فشخ بقى "
1039253465044856832,EG,"الناس اللي بتستخدم مرضها للشهره
إنت مريض كانسر او عندك تشوه في جسمك او وشك او قاعد علي كرسي متحرك ربنا يشفيك ويشيل عنك يارب بس ماتستعطفش الناس بصورك عشان شير او رتس والناس اللي بتشير صورهم مع امهاتهم او ابهاتهم الله يرحمهم ياجماعة متعملوش كده متبقوش مثيرين للشفقه بالله عليكم "
1039825134318759936,EG,جدتي في ذمة الله يا جماعة لسه متوفيه من شوية ادعولها بالرحمة بعد اذنكم
1041955475561037824,EG," مش فاهم انت هتفتح بيت ازاي بجد 
 بالمفتاح  "
1043829668217065600,EG,و يبقي السؤال الملهوش إجابة اشمعني هو اشمعني هو بقدر اسمعه وقت ما بكون مش قادرة اسمع حد و اقدر اتكلم معاه انا مش قادرة اكلم حد بردو اشمعني هو لما بيبعتلي فويس نوت طويلة بتبسط و لما بيغيب بحس ان في حاجة ناقصة اشمعني
1044127890500202368,EG,لما حد بيسمعني اغنيه او تبقي اغنيه مرتبطه بحد وتيجي ف الشافل وانا مخاصمه الحد ده بدوس سكيب بعصبيه وانا مكشره كده الي هو امشي انتي وهو مبكلمكوش يلا
1044659951887634432,EG," ماينفعش تلوم حد انه    ومش بيكلمك مهما كان قريب منك
 وحشة ف حق نفسك انك تشحت اهتمام حد أو تقوله خليك معايا مهما كان بينكم ايه
 اللي عايزك هايفتكر يفضيلك نفسه من نفسه حتى لو وراه مشاغل الدنيا كلها"
1044817894738186240,EG,يا بنات ياريت تحترموا ذكائنا شويه يعني ميبقاش واحده وشها ناقصله فولتين وينور  و المحاره عاليه و تقولك كابشن نو ميكب  يعني تفوت على الولاد بس هنضحك على بعضينا بقى ولا اي
1044882179409530752,EG,"قبضوا علي واحد ملحد في السوبرماركت
مسكوه و هو بيزدري حاجة حلوة"
1044894625792765952,EG,دلوقتي عددنا  مليون لو كل واحد بس دفع  جنيه هيبقى معانا مليار و  مليون جنيه لو وزعناهم بقي عالشعب المصري كل واحد هياخد  جنيه
1044917374095372416,EG,"أنا لولا الدبش اللي برمية في وش كل واحد يحاول يرتبط بيا
 كان زماني دلوقتي متجوزة و عندي ادم و لارين "
1045002728802582400,EG,اتمنى من الحياة تديني فلوس بدل ما تديني دروس وانا هتعلم على حسابي
1045068864164434048,EG,ف فيلم ريا وسكينه ريا قالتالوليه وانا بخنقها عضتني تقولش عدوتها يعني مكنش عاجبها وهي بتموتها انها تعضها الموقف ده بيفكرني بناس كتير يبقوا كاسرين خاطرك ومطلعين عينك ومطمرش فيهم جدعنتك ولما تقرر تبعد عنهم بعد ميه فرصه اديتهالهم يطلعوك انت الغلطان هوا انا عملتلك ايه ده يدوب خنقتك
1045072216080216064,EG,انا اسف لنفسي اني ف يوم قبلت وضع انا مش عايزه عشان كان عندي امل انه يتغير واخد عليه بعدين انا اسف لنفسي اني اجبرتها ف يوم تعمل حاجه مش عايزاها عشان ترضي حد هو مش ف دماغه انك بتيجي ع نفسك عشان ترضيه  انا اسف لنفسي اني مخلتهاش تعمل الي هيا عايزاه ومش مهم اي حد
1045264037204946944,EG," انتي ازاي حلوة حتي وانتي معيطة

 عشان الايلاينر  مش مضروب زي العرر بتوعك"
1045300890285084800,EG,ليه مفيش علاقة كره زي ما فيه علاقة حب يعني أكرهك وتكرهني و أغار لو حد كرهك اكتر مني
1045422399817166848,EG,"اتجوزي اللي يقول أنا رايح البيت عشان حببتي مستنياني 
مش اللي يقول أنا رايح عشان الجماعه بتتصل 
جماعه ايه انت متجوز داعش "
1045503705632722944,EG,مابحبش حد يكركب الكركبة اللي أنا مكركبها في أوضتي عشان أنا ببقى عارف أنا مكركبها إزاي 
1045610094354976768,EG,لما حد يسألك مبتسافرش بره مصر ليه  
1046514028766515200,EG,هي الناس اللي بترد متاخر بيردوا متاخر ليه طيب والناس اللي بتبدأ كلام وبعدين متردش تاني دي بيعملوا كده ليه طيب احنا ليه مفيش حد في حياتنا يرد علينا بنفس السرعة اللي بنرد بيها عليهم
1047177076841832448,EG,لما اتخانق مع اهلي واسمعهم بيطلبو دليفري 
1047854380823842816,EG," الدرس الساعه  اللي هييجي  مش هيدخل
 انا  "
1048690762022621184,EG,   شوفي الحاله دي كده
1048692102161490048,EG,"الحب اختيار انك تحب شخص عنده مشاكل وانت عارفها انك تساعده وتعمله حاجه انت مش عايز تعملها تيجي ع نفسك عشانه ان يهمك مصلحة الشخص اللي قدامكالحب اللي بجد مفهوش حاجه اسمها مشاعري اتغيرت لان مهما اتغيرت هختار احبك وترجع تاني برده
في مقوله بحبها بتقولالحب يبدأ حين ينتهي الحماس"
1049535835228524416,EG,لو مش عايز تشوف لايكات الناس اللي عندك ولا تشوف تويتس لناس غريبة عمرك ما شفتهم ولا تعرفهم على التايملاين وعايز تشوف التايملاين من غير فلسفة تويتر اتبع الآتي 
1049540021546561536,EG,الاهتمام زي سيجارة الحشيش خد و هات مش واحد يهتم و التاني يتكيف خدوا و أدوا مع بعض خمسوا مع بعض ف الاهتمام
1050431136764240000,EG,إنك تجيب وردة في وقتها أحسن من أنك تجيب نجمة من السما بعد ما وقتها يعدي  و إنك تيجي دقيقة واحدة في الوقت الصح أحسن ما تيجي سنة بعدها في الوقت الغلط  التوقيت بيفرق جدا في كل حاجة
1050434320010305536,EG,الجمله دى عجبتنى جدا         انا مش هقدر اخليك تحبنى لو انت اصلا مش حاببنى وحقيقى يعنى انا عمرى ما هفرض حبى على حد او اكون فى حياته الا اذا كنت متأكد ان الشخص دا من جواه فعلا حاببنى وبيبادلنى نفس الشعور الى جوايا ليه ومحتاجنى اضعاف ما انا محتاجه
1050453815625957376,EG,كل وقت صعب بيعدى عليك وانت لوحدك بيعلمك حاجة جديدة بس اهم حاجة بتتعلمها هى انك تسند نفسك بنفسك ومتعتمدش على حد وتتعايش وتكمل لوحدك 
1051885553568890752,EG,لما احل مسألتين فيزيا صح 
1051896785583661056,EG, منتا ادينا كلنا عشرتلاف جنيه 
1051898133997862784,EG, احجزلي من العشرتلاف بتوعي اللي معاك 
1051898554002956416,EG, لا انا عاوزه اروح بس
1051899476628185216,EG, لا مش هتمسك متخافش 
1053400466921545600,EG,"مش حضرتك شرحت 
ايوه
وأنا هزيت دماغي يعني فهمت 
ايوة
طب ايه لازمة الأمتحانات بقى ليه تهز الثقة اللي بينا "
1053590371186413568,EG,انا لما بحب حد ب   بشكل مبالغ فيه يعني ومش ببطل كتابة عنه وليه كل الناس مش ممكن متعرفش قد ايه مهم عشان طريقة كلامي عنه وعيني بتلمع دي طريقتي وعمري ماعرفت أكون أهدى في مشاعري ومش بيفرق معايا وأقل من كده بيبقى في حاجة غلط
1053631875259002752,EG,"كلنا خايفين من يوم اعتزال اللاعيبه اللي بنحبها 
بس محدش فكر مره ان الناس العظيمه دي بتكبر ف السن وقريب مش هنسمعهم بيعلقوا تاني 
تويته في حب المعلقين دول 


 
 "
1056196889987686400,EG,ال  ده فعلا لطيف 
1056589470181539840,EG,اسفة بس دى حلوة بجد 
1057140834393559040,EG,ميكى ماوس فتح بيت دعارة سماه إزنى لاند
1057153436679057408,EG,ياجماعه مفيش حاجه اسمها اللى عايز يكلمك هيكلمك مفيش الكلام الاهبل دهمفيش حد هيبقى بيحبك فعلا ومش بيكلمك الا اذا كنت انت اللى طفشته وحطيت مليون حاجز بينك وبينه وحسسته ان الكلام معاك صعب وهينقص من كرامته مفيش حد هيمنع نفسه انه يكلمك ويبقى معاك الا اذا كنت انت اللى وصلته لكده
1058013476474503168,EG,فضي نفسك دقيقة قبل م تنام او اول م تصحي و اسمع الاية دي بالصوت دة 
1058053570543665152,EG,"تويتر المفروض يعمل حاجه اسمها 
            
هذا النص موجود بالفعل ولا يمكن تكراره من فضلك أعد المحاولة مرة أخرى  عشان بجد أنا مليت من الـ اللى بيتعمل لكل حاجه بكتبها واللى بياخد معظمهم ناس معروفين فبلاش شغل ترقيع"
1059704650541289600,EG,"في تونس كل الدوله واقفه مع الترجي من اتحاد تونسي لحكومه  كل مؤسسات واقفه معاه 
في مصر كل مؤسسات ضد الأهلي  ملناش غير  راجل هيبقوا في الملعب رغم كل حاجه 
هاتوهامنرادس عشان انتوا ارجل من كل البلد هاتوها عشان الاهلي دايما بيحارب لوحده "
1059711599202787200,EG,كان فيه حد بيتكلم عن أعظم بانر أو يافطة لجمهور الأهلي  ماشفتش ولا هشوف بانر أعظم من ده  و لو هختار بانر واحد يتعلق في مدرجات الأهلي مدى الحياه هيكون البانر ده 
1059912409857618048,EG,هو فين سويت نوفمبر اللي بيقولوا عليه ده انا مش شايفه أيتها سويت مفيش الا السويت اللي بعمل بيها رجلي 
1060152223374684160,EG,الحقيقة لا أخفيكم سرا انا عايزة استسلم بس اللي هو الاستسلام اللي بجد يعني أ    وبلا مسؤولية بلا استقلال بلا مرأة بلا خرا واقعد في البيت أقور محشي وأقول أحا تقوير المحشي ده متعب أوي ويبقى تقوير المحشي هو أكتر حاجة  في حياتي
1060265639145865216,EG,لما تيجي تتكلم معايا ماتختصرش الكلام  علشان انا بحب تفاصيلك اوي 
1060923979018452992,EG,"ولسا ياما فى الجراب يا حاوى  البطولات ما تعرف غير الاهلاوى
بطوله انتوا تجيبوها  رجاله و تعملوها  تمانين مليون يستنوها 
و أحنا معاكوا  لأخر ثانيه  صوتنا حماكوا  و فرحتنا بالدنيا  أووووووووووة اهلاووووووي "
1061189814685442048,EG,مين قالك ان التقل صنعه وبيجيب مع اى حد مين فهمكم ان التقل والبرود بيخلى الى قدامك يخضع لأوامرك ويبقى تحت ايديك التقل والبرود والضغط على اعصاب اى حد انت عارف انه بيحبك ومع ذلك بتطنشه وتقلان عليه ده بيخليه يكرهك اضعاف ما بيحبك وكل لحظه تقل بتتحول عندة لكره من نحيتك بس مع الوقت
1061224020899741568,EG,حضرتك بتغض بصرك عن وشي تقوم باصص ع فخادي
1061488446538215424,EG,"دكتور بعد اذنك هو الميد ده من كام 
من  ل درجه
طاب ماتمشيهم  بس علشان خاطري 
 "
