id,dialect,text
1008137855955357568,PL, الحق اللي ضيع البلنتي اليوم مش اللي هاترك مبارح 
1008138270897827840,PL," التنين مفيش مقارنه انا برشلوني 
وبحب رونالدو كره العمى "
1008788382242279424,PL,مش شرط يكون شكلك حلو عشان تتصور ولا شرط يكون صوتك حلو عشان تغني ولا انك كوميدي عشان تنكت  اي حاجه بنفسك بدك تعملها اعملها لنفسك  مش لازم تعجب حدا
1011001908310499200,PL,"وانت مفكر انو احلامك هتتحقق لما تسافر 
اه لانو حلمي اني اسافر "
1013495752256049152,PL,البنت اللي بتحط الشال من غير دبوس يخرب بيت ثقتك يا شيخه 
1014934908123402240,PL,انا لو هطول ابلع اللي بحبهم عشان محدش يشاركني فيهم حعملها
1015564128293974016,PL," احكيلو هات تنرفع الالقاب انت تقلي حبيبتي وانا اقلك يا عمري 
ازا ما عمل بلوك راح تتجوزو "
1016340836127248384,PL,"صرت اكتب الف مبروك ع اي بوست او صوره اشوفها من غير ما اقرأ اشي 
وطلعت كاتب لدكتور الجامعه
 الف مبروك ومنو لاعلى  بهدلني ع الخاص وهددني  مش عارف اني خلصت جامعه الغلبان "
1017406295102533632,PL,  الخوازيق جايه جايه هاد ولا اشي 
1017900499759239168,PL,لمن اقلك انا هقفل وهنام مش شرط ابقى نايم في كل الابلكيشنز 
1018187282845782016,PL,لمن حد ينصحني وانا اعرف كل ماضيه 
1018238745185849216,PL, حسبي الله ع الازهر واهلها اللي حارميناااا نفرح 
1018985067635462016,PL,"التفاهه بأشو نفعتك بحياتك
ع اساس عمقك خلاك وزير الثقافه مسلن"
1019154696727089152,PL,"مسمهاش رمانيه عفكره 
هو عدس بس رافعين له قيمته شويه"
1019294079249801216,PL, انا الحرامي اللي بيفتش اشو مخبين فالثلاجه 
1019296035984813952,PL, انا حرامي مزوق بسأل لمين الاشي بعد ما اكلو  عشان محدا يشك فيا حدا 
1019346868134915968,PL, ويا ريت بتشتغلو بذمه وضمير  كلو شلفقه 
1019991091964207232,PL,هي البنات اللي في   عندهم ماما وبابا واهل وكدا 
1020000189896065024,PL, فاهمين الموضوع غلط هما 
1020243746556989440,PL, كابوس هادا مش حلم 
1020361747079794816,PL,الناس شايله شونطها ومقضياها سفر ومصايف وخروجات وانا قاعد بشيل الشاحن من فيشه ل فيشه 
1020814906730348416,PL, بكرا تقتنعي انك اخدتي اكبر قرار صح في حياتك
1020823661417312384,PL," وليه تتعب نفسك وتحسبها 
ما كلو رايح "
1020826348347150336,PL, انا من المحاربين القدامه فالازهر  اتوكلي ع ألله انفدي بجلدك من هلأ
1020827514665652224,PL," احنا بنموت عشان نطلع ورقة 
ما بالك شهاده "
1020828476738334848,PL, اداره زفت تعليم عالي جدا   يا ريت يرجعولي مصاريه عشان انا مستفدتش اشي  وفوق هيك محدش بتحرج بموعدو وفش حفلات تخرج 
1020829396083585024,PL, لا واضح انك فهمتي  اه بقصد الازهر
1020957821901463552,PL," أية دا أنت نايم  
 لا داا أحنا ندخل اوضتك نفتح النور ونقعد نتكلم بصوت عالى بقا "
1021156770729820160,PL,الله يقطع رقبتو اللي شغال ع السكينه 
1021841775730847616,PL, نسوان بتحب الراجل النحنون ونسوان من قلت الرجاله روحها هتروح 
1021842167210409984,PL, انا واثق من نفسي بعملش اشي غلط بس برضو محبش حد يمسك تلفوني 
1021853710526423040,PL,ياريت اما تحطي صورة صاحبتك الحلوة ستوري وتقعدي تحبي فيها ابقي حطي حسابها ادخل احبها معاكي 
1024052181064970240,PL,بالنسبه للبنات اللي بنطلونها مخروق من الركب  هاد اكيد من الصلاه صاح 
1024638571435773952,PL, كمان صورتين زي هيك حتوقف المعونات اللي بتصل غزه
1024784420878934016,PL,انت مش كئيب انت فاضي 
1024797147286445952,PL, يا رب انا بالاول    صرلي زمان مستني 
1025014135774486400,PL, يمكن عشان ما طلع معك راس بالمصاري  وغلبتي
1025015668918415360,PL,"انت خلصت كليه ايه
بيطري
هههه دكتور بهايم يعني 
بالزبط لما تشكي من حاجه كلمني"
1025029524961075200,PL, ازا مش عارف شكلك سحرالو
1025052960554925952,PL,"هو انت سبتها ليه 
 قفشتها بتكلم ولاد غيري 
 يعني انت مش بتكلم بنات غيرها 
 بكلم بس مقفشتنيش "
1025134300025561216,PL,"مهو مش كل اشيء يصير معك عين و حسد 

يمكن انت حمار"
999715929192894464,PL, القصه مش خير وشر بس انو دايمن  تدمير المعنويات موجود  حتى لو من غير قصد 
999732706102710400,PL,خلينا متفقين انو فش حاجه بنتمناها بتحصل 
999732832883871616,PL,"يا رب يتكلم معايا يا رب 
 عامله ايه
هكون عامله ايه يعني كويسه  
يا رب يتكلم معايا تاني يا رب"
999733175105589248,PL,اول ما تخلص ثانوي اعرف انو احلى ايام حياتك خلصت 
979423614217924608,PL," بحكي لمراته صارحيني كم واحد مر في حياتك
 قلتلو  
 قلها يعني انا السابع
قالت لأ الرابع "
980504349662162944,PL,شكل الشب اللي بيسمع ل اليسا  
980786085235249152,PL, فعلا بتستاهل الوقت اللي ضاع 
980885294214995968,PL, ارحم نفسك  مش من قله الاول ع الدفعه بتطلع 
980886361052975232,PL, تقلقش اللي زيك بنحسدوش 
981270412104536064,PL,اليوفي طلع على سطح الواد حماده ومش حينزل تاني 
981951469241945984,PL,الخدمات اتجوزت وانت لساااا 
981951798163459968,PL,"عفكره انا اخدت عنك صوره وحشه
بروزها"
982725590162829184,PL,هل عاشق  ام دارس  ام سنجل بائس  
982734293050028032,PL,انا تلفوني دايمن في ايدي فلو انت فاكر اني بتجاهلك  ف انت صح 
983371143737376768,PL,إن لم تكن لى  ف ربنا ياخدك انشالله 
983776827926773760,PL,"مبروك كسبت معانا جائزة أكتر واحد كسول فى الحياة تفضل معانا عشان تستلمها 

 إحدفها  "
983806592280875008,PL,كسم الكووووووره معلهاش كبير 
985236105120370816,PL,"أنتي عشتي ف الصحرا قبل هيك 
لأ ليش 
 أصلك حربايه "
985576793745830016,PL,حتى الماده التافهه بنخليها تتراكم لحد ما تصير صعبه  انااااا طالب مهزء اصلي 
985899838553419776,PL,فالبيت  ساعه اذاكر بس انت اسئلتك صعبه يا استاذ  
985932935630073984,PL,ياااا رب انا عندي طموح بس معنديش دم 
985982748035895168,PL,شكلنا حيبقى وحش قدام ورقة الاسئله بكرا 
985982803023224832,PL,"هخلص التراك وازاكر
هخلص الحلقه وازاكر 
هخلص شرب النيسكافيه وازاكر
هخلص الترم وازاكر 
"
986313756971011968,PL,"امي مقتنعه انو صحابي بيزاكرو 
امهات صحابي مقتنعين انو انا بزاكر "
986336962205356032,PL,كل الكون ما نساني جرح قلبي اللي من حبي 
986337210399166464,PL,يا دكتور انا بتكلم مع الدفعه كلها  فتغيير مكاني مش هيفرق في حاجه 
986344273607094400,PL,"القائد بحكي للعسكري انا مش حكتلك ما تتحرك من مكانك 
قلو صحيح   بس انا  كنت متخفي بشكل شجره وإجو تنين عشاق جمبي متحركتش ومطلعتش صوت قبلها ولا عملت حاجه  نام معاهم ولا طلعت نفس  بس انهم ينحتو اسميهم على طيزي لزكرى لأ لأ لأ "
986649465372184576,PL,احنا بنام عشان عندنا جامعه وبننام في الجامعه وبننام عشان لسه راجعين من الجامعه 
986655002709118976,PL,يارب نجح الطلبه اللي ملهمش  خلق يزاكرو الترم هاد 
986659932413026432,PL,كل اللي بتمناه هو صوت عجلات شنطة السفر  وانا بمشي فيها ع سيراميك المطار 
987400438227009536,PL,لما تحل مشاكل الناس  بس متعرفش تحل مشاكلك  
987586815988260864,PL,مش معنى ان انا صحيت بدري انى هسيب السرير بدري 
987733052729290752,PL,"امي الوحيده اللي عمرها ما حكتلي ربنا يديك ع قد تعبك  شيفاني ليل نهار نايم يا ع النت عارفه انجازاتي وتعبي فبتحكيلي دايمن روح ربنا يجبلك مراقب سهل  ربنا يسترها معك 
الدواعي اللي تحسسك انك تافه "
987733301287968768,PL,الماده بمجرد ما تمسكها تحسك انك حتجيب امتياز  وبمجرد ما تتعمق فيها تبقى متأكد انك هتشيلها 
987849224153911168,PL,سنجل بائس تعيس منسي 
988153567134568448,PL,السارق والزاني وشارب الخمر واكل مال اليتيم  ما صار معهم اللي بصير معي 
990872977200877568,PL,"بتكون جايبه  من  وبتحكي الدكاتره ظلمونا 
انا لو محلها كان ذبحت أخوي لوجه الله تعالى "
990993947962105984,PL, ولا ع الوحش وحياتك 
990994453618941952,PL, هو نفسو اللي جد لما اجاه الولد نزل هروفين ع المسلخ  بيفهم 
990995435392327552,PL, عشان مدرسه خاصه  انما هاد مستواك الحقيقي لزمن تكمل وتنساااا 
990995734697832448,PL, فعلن نفسيتك دمرت بعد مخلصت انت  
990999509193895936,PL," انتي فتاة احلامي 
 بس انا مش حلوه لهدرجه 
ما هو انا احلامي كلها خرااااااااااااا"
991002898845847552,PL, احسن عشان محدش يحسدك 
991006044045312000,PL,كنا شلة فشله حولين بعض الدكتور غير مكاني صارو يتمسخرو ويعملولي حامل عبطونهم بما انو لحالي ومش حعرف اشي حظي قعدت عند الملخصات والكتب وحليت لمتحان كلو وهما مع الاشتراك فحل الاسئله طلعت النتيجه انا  والباقي شال  فمن يومها وانا راسي مرفوع وسط صحابي  
991805730385727616,PL,كل حاجه ماشيه غلط زي ما انا مخطط لها بزبط 
992142469335838848,PL,بحبش اتسرع عشان مخدش قرار غلط  بحب اقعد وافكر واخد القرار الغلط بتفكير 
992144050500374400,PL,عشان مش حابب ارتبط  مش عشان محدش معبرني  
992147488135139200,PL,مبدأين الامتحانات بدأت وانا لأأأأأأأأأأأ  كل حاجه ماشيه غلط زي ما انا مرتبلها  بالظبط
992163962321031168,PL,الدنيا بتلف بس انتو اللي قاعدين ببيوتكم ومحدش عارف يشوفكم  
992473499221491584,PL,"الحب هو ان تشاركيني اهتماماتك 
يعني ايه 
عرفيني على صحباتك البنات "
992473565839667200,PL,مش شرط ازا حبيبتك قالتلك شيل صورتك  يعني بتغار عليك  يمكن صحباتها مستلمينها ع زوقها الخرا 
992825197408464768,PL,معقول تطلع هااااي الايام اللي بنعيشهاااا هي الحلوه والايام السوده لسه جايه 
993061657105616768,PL," انا وقتي بقي بيضيع مني بسرعه  
 ازاي 
 عارف لما تفك  شيكل 
 ياساتر"
993276579311751168,PL,"الواحد بيخجل يقول لشخص اللي بكلمه انه نعسان 
وعلى هيك انت بتقاوم النوم وبضل تتكلم  
لا بنام من غير ما اقوله "
993785131616866432,PL,اول دفعه بالجامعه بتبدأ متحانات واخر  دفعه بتخلص  هنا يزهر الامل 
993935098897731584,PL,كل تأخيره وفيها  خازوق 
993936129446633600,PL,بحبش اقعد بغرفتي والباب مفتوح  بحس حالي قاعد ع الشارع  
993940590034411648,PL, امن الشرشف تبع بتدائي 
993941816163659776,PL, معيش مصاري الصراحه  بعدين غرفتي القديمه لونها اخضر مفرقتش كتير يعني 
993971659664232448,PL,خايف يجى اليوم واقول لحفيدى ايش  الاغانى التافهه اللي مشغلها ما تشغل لنا مهرجان الو  اشغلو  مين افسح التنين 
993972388705505152,PL,لما حد يكلمني ويقول  الو ببقى نفسي  اقوله اشغلو ويرد عليه بالاغنيه ونكمل تفاهه 
993972909424115584,PL, عشان بفهمش  انتي مينزهقش منك 
993975158208716800,PL, الزنانه اللي فوق برجنا الاكزوزت تاعها مبعوط
993976210291089408,PL, الله يخدنا ويريحنا منهم 
993979718226595840,PL, بس بتنجحو وبتتخرجو ودفعتي ضيللهم سنه غير اللي جايه والمفروض مخلصين قبل السنتين اللي فاتو 
993982606919290752,PL,هو انا بدرس ولا قاعد ع النت 
993985195450781568,PL, كلكو بتقولو هيك بالاخر برسب لحالي 
993986184161488768,PL,خايف اكتب خريج  يقوم دكتور ابن حرام يتعفلني فالصيفي 
994322960340176768,PL,"بعد اذنك ممكن قلم 
جاي لمتحان من غير قلم 
لأ قلم على وشي عشان مزكرتش"
994323115885948800,PL,"انت جاي منين 
كنت بتهان 
ايه 
راجع من متحان "
994534315286556800,PL,هوا بدا يوم لحساب ولا ايش القصه  مش طبيعي الجو
995343336415420416,PL, عشان بنعرفهاش غير بالمتحانات
995344818682368000,PL, عشان قلت الطلبات ع البنات   وعشان كل بنات غزه بعرفوش يسوقو وهاد الاهم 
995412701936529408,PL,الله يكون بعون اللي بدرسو من اول الفصل انا يوم لمتحان وجالي اكتئاب 
996377543782608768,PL,فش حاجه اسمها ظروف اللى بدو ينجح  بيفشل 
996401286328266752,PL, الفيديو تاع لسنين اللي فاتت
996437823862472832,PL,محدش يبعت يقولي  سامحني قبل رمضان  عشان سامحتكم السنه اللي فاتت ولسه زي منتوا ولاد وسخه 
996462077991620608,PL,يا بخت تعون الجامعات الحكومي بيسقطوا ببلاس
996498556100988800,PL,انا خترت شوية اسئله وهذاكرهم  واتمني تيجي فالامتحان
996499003171922048,PL,"كل يوم بسهر للفجر واليوم اللي بكون لازم اسهر فيه بنام  قال يعني السهر بيضر بالصحه وبشتت تركيزي عند لمتحان 
والله ما اشي مشتت هالتركيز غير هالمخ الاعوج "
996500574379106432,PL, هات الملخص معك بكرا تاع الحيوان
996506357082853376,PL," انا مش عاوز رمضان ابو فاينال
 انا عاوز رمضان ابو مسلسلات وسهر "
996689674134610048,PL,"واللي يقولك رامز انتهى قلو ده عندها 
هيكتوركوبر 
أشيرين أحبيبت قلبي"
996697205711998976,PL,بالاخر راح تكتشف انه ما حد بيعطيك قلبو غير الخسه  
996881074327310336,PL, انا مش فاهم بس كلام رائع 
996882081966952448,PL, انت حاسس مش متأكد 
996888870640848768,PL,انا بديت اعطش من هلقيت 
997044208715395200,PL,"الحيوان اللي بيقطع شرايينه ورا 
ايوا
مفش موت قبل نص الوقت"
997149290513490048,PL,امي مقتنعه انها لو مضحكتش للمنوخيه مش حتطلع زاكيه 
997915787288555648,PL,"قاعة 
وين محلها من الاعراب وين بتكون 
جماعة الازهر حد بعرف "
998185337464807424,PL,الناس اللي بتصحي من النوم وترجع تنام تاني  احيكم 
998187864528695168,PL, جلدة راسو خميله محسش فيها 
998188023371231232,PL, سياسات معاصره ولا ايش 
998198181082083200,PL,"يا رب ازا م حققتلي م تحققلهم 
مش حزعل  "
998199097478844416,PL,احنا بنتشعبط في رضا ربنا  
998346277426524160,PL,  حد يعزمني فيكو بتوزعو مقلوبه بدي منو
998357979480166400,PL,انا زي زيكم  خلصت غدا ربع ساعه ولقيتهم بيقولولي تعا اتصحر 
998695333071868032,PL,الناس اللي بتنام بليل رمضان كيف بتعملوها 
998739277180817408,PL,في وحده زمنية اسمها راحة من المزاكره  دقايق وهاي بتتراوح ما بين ساعه ل اربع ايام 
999025114858606592,PL,"يا رب الماده هاي تعدي ع خير وهذاكر الماده الجاي 
الجمله اللي بقولها قبل كل متحان"
999560982300119040,PL,كلنا هيك بالاخر  مش حتفرق واللهي 
999616163024916352,PL,لو بدك تفقد الحماس لأي فكره اعرضها ع اهلك 
999699256444416000,PL, اموركو طيبه انتو  ربي يخليلك
999699463806619648,PL, زي بالزبط سبحان الله كإنك بتوصفيني انا 
962773388166094848,PL,كلمة انا اسف  سعات بيكون معناها انا مش غلطان بس انت فارق معي وانا مش حابب اخسرك 
962796624325107584,PL,"انا اسف معلش انتي تستاهلي حد احسن مني 
طب هات رقم كريم صاحبك"
962796700468432768,PL,لو حد تمسخر معي بدون ايموشن باخد الكلام جد وممكن ازعل 
962798579235590016,PL,هو القلب اللي بيجرحنا في حاجة اكيد جرحاه  ولا هو تربيه وسخه أصلا 
963104941756776448,PL,"مبروك كسبت جائزة اكتر واحد بينضحك عليه 
جد وهي ايه 
لا ضحكنا عليك "
963458013506961408,PL, قصدك صارت لئيمه وتعلمت 
963822224913379200,PL,يعني أنا مرتي المستقبليه بتجيب هديه لحبيبها بهيك الوقت    
965268130372178048,PL,هتعرف مكانتك عند اي حد بإهتمامه بالتفاصيل البسيطه يلي بتسعدك 
965268369674047616,PL,بحب الشخص اللي بضل اتكلم معاه ويخلق مواضيع معي بحس اني مش عبء عليه  
965298540649091200,PL,عشان نتفق بكرا كلنا نكون متجمعين الساعه  اما انت تكون عناااا ع  عشان تيجي ع المعاد 
965303410689003648,PL, ولا انا كلو اكم كيلو اللي دقتو 
965306535416160384,PL, عشانك دايمن بتكون صح
965311884927881216,PL,"انت مرديتش عليه ليش لما كلمتك مبارح 
قلبي كان يوجعني وانا رايح المستشفى خبطتني سياره ولما رجعوني كان مغمى عليه وما كنت واعي ع نفسي و معرفتش ارد ع حد 
خلاص بقيت بنسبالك حد   "
965316925512388608,PL, بس بلاش حد يصدق 
965333917225058432,PL,كل متيجي الكاميرااا ع احلام بتف ع التلفون وبكمل 
965984032671649792,PL,صرت شايف اعلان محمد رمصان بيجي مليون مره 
966039516288077824,PL,"مين بالحمام 
هادا انا 
بتعمل ايه 
بتصايد سمك من البانيو "
966039756504272768,PL,انت شكلك تافه  انا رتحتلك جدا
966345948267008000,PL,اللي يقولك انا الكبير  قوله مش طالبه فرافير 
966755062663078016,PL,انا اجتماعي جدا لدرجة اني لما بتصل بحد بتمنى ميردش 
968075323060441216,PL,لازمن اتعرف على ناس جديده لانو اللي معايا خربو 
968240441308143616,PL,ما حد يشوفلنا حل مع هرمونات نص الليل دي  انا عايز ارتبط 
968557886933815168,PL,"انتي بتفكريش غير بالأكل 
 ايش بدك يعني 
كلام رومانسي 
كلهم فول وفلافل الا انت شورمااا"
968594416947613568,PL,انا بستشير الناس عشان يوافقوني الرأي  مش عشان اخد رايهم 
968617776771420160,PL,"في حد في حياتك 
يعني بذمتك دي حياه حد يخشها "
969260234089861248,PL, مش عارف اتزكر من كترهم 
969260550579523584,PL, المحبه بتيجي بعد الجيزه 
969539078696914944,PL, انتو اللي بتعملوها كيف انتو عمله نادره ع فكره 
969612525829533568,PL," بس انا زعلان منك
 وانا والله زعلان مني وكلنا زعلانين مني فمعلش"
969619145082986368,PL,مفش حاجه اسمها يا بنت انتي مرتي طالما مكتبتش عليها تبقي مرتنا كلنا 
969649049279361024,PL,هوا في ايه الناس مبسوطه بمارس ليه  مارس يعنى ميدتيرم و امتحانات وميتحبش يعنى 
970390129268404224,PL,مشكلتي انه بحب الناس تكلمني لكن بحبش اكلم الناس  وهاد مزعل الناس مني 
970718597063610368,PL,"الكويز لحد فين يا دكتور 
 لحد ما وقفنا 
والله أبغي أسألك بتدينا مادة إيه بس أستحي"
971102232342081536,PL,اهلي مدايقين عشان طول نهاري ماسك الجوال وبكلم صحابي  صحابي مدايقين عشان بمسكش الجوال ومبردش عليهم  انااااا وين يا جماعه  
971490258574610432,PL,"بتكتئبوا بعد الساعة  
بسيطة ناموا من الساعة  "
971498459449708416,PL,بحبش حد يلزق في حد انا بحبو  عشان ملزقهوش انا في الحيطه 
971806969542652032,PL,هو صحيح شكلنا مبين اننا مبسوطين  بس للامانه الايام ماسحه فينا الارض 
971847552021692416,PL,هي اكيد الجامعه حتخلص والايام الحلوه جايه اكيد 
972033489062322176,PL, لو كبو بنزين وولعو فياااا برضو مش حصحى 
972063733022445568,PL,"الاجنبي لما يشوف قرد ع شجره بيقول  
العربي بيقول لصاحبو ليش ابوك متشعلق ع الشجره "
972191929629847552,PL,"شو ما بدنا نفرح فيك 
لأ 
ليش 
بحبش اشوفكم فرحانين "
972478730751938560,PL,"السيسي هادا تحفه واللهي 
شهادةامان"
972547901099577216,PL,بكلم امي ع النت بتحكيلي انقلع ايش رايك اضيع الكهرباااا عليك  انااا ابنك وابدى من هاي عملت وهاي سوت واللهي 
972556432997482368,PL,"مش حنفرح فيك ولا ايه
واحناااا مش حنزعل عليكي ولا ايه"
972562600323055616,PL,اللي بيحبك عشان شكلك حيسيبك لكن اللي بيحبك عشان روحك حيسيبك برضو 
972598020868067200,PL,انا باكل الاكل وانا واقف قدام التلاجه  وهي مفتوحه عشان بكسل اشيل بعد ما اخلص 
972599617136283648,PL,بطلع من البيت ونفسي مرجعش تاني  برجع البيت ونفسي مطلعش تاني 
972874203316801536,PL,"ليش قتلتو 
كان بيرد عليه متأخر 
براءه"
972938446774861824,PL,"احنا مش حنضغط عليكي في موضوع الجواز القرار في ايدك 
طب انا مش موافقه 
الله ينكد عليكي زي ما بتنكدي علينا  وحتتجوزيه غصب عنك "
972953067640508416,PL, بس قلي الناس الحلوه هي تبعت كل يوم الصبح 
972962440181842048,PL,"ماشاءالله كل ديه ناس بيحبوك بس ايه ده فيه واحده مش بتحبك
 اه ما دهي للي بحبها"
973262192752636032,PL,قلبي مقبوض من بكرا  
973538137233338368,PL,ال  عندي عباره عن صور محاضرات ونماذج متحانات بفتحهاش بس وجودها مطمني 
973643908268941184,PL,انا ده ولا ايه  
973644621367693184,PL,لليوم مقتنع انو قلبت الشبشب بتجيب مشاكل في الدار 
973666264286625792,PL,"هي ليش الحاجات الصح بتيجي بالوقت غلط 
معرفش الصراحه انا مبيجينيش حاجه خالص"
973986145708191616,PL,"هو مش انا رديت عليك بإيموشن 
اه
طب وبتفتح كلام تاني ليه "
974404485433917440,PL,انا ما بيجيني شعور الوحده غير لما فلوسي بتخلص 
