id,dialect,text
1129806914756513792,JO,"التساؤل منطقي وموضوعي جدا 
الأخ بيحكي عن واقع بنشوفه من زمان نصوص الدراما والكوميديا بالأردن دايما باللهجة الفلسطينية الفلاحية او الأردنية البدوية واللهجتين ما حدا بيحكي فيهم الا نسبة قليلة جدا من الناس 
وين لهجتنا الاردنية الدارجة اللي بنحكي فيها كلنا كمجتمع أردني  "
1129808041241657216,JO,"القصة لا عنصرية ولا تصنيف ما تندفعو بالمثاليات والقوميات اللي مالها أي داعي 
لما يتصنف عمل فني على انه أردني معناها لازم يعطيني محتوى أردني شبيه بالمجتمع اللي عايشين فيه "
1129847518647521152,JO,الوصول لنهائي بطولة العالم هو بحد ذاته انجاز ما قصر بطلنا الاردني أبوغوش  الإيطالي برغم فرق الطول والخبرة فاز بصعوبة  إن شاء الله اللي جاي أحسن 
1129848525649600384,JO, ههههههههه اتفق جدا بس لو مثلا العبادي اقصر من ابو غوش لعب معه ما بتوقع يفوز الايطالي  هذا من البداية بفوت بلعب معه قريب وقنص  مجموعات ركل ومن بعيد ما بينفع معه لانه مركب واحد ثاني على اكتافه 
1129849030115287040,JO, انا شفتهم الاثنين لاي  هذاك كوري يخرب بيت سنينه
1129850256613695616,JO, على وزن ابو غوش في لعيبة اسطوريين ومنافستهم صعبة جدا بالتالي فضية العالم تعتبر انجاز خصوصا انه ما قام من النوم لقى حاله بيلعب نهائي  في مجهود للقصة
1130233749239685248,JO,"في فرق كبير بين المتكلم وبين طويل اللسان 
المتكلم بيعرف شو يحكي وكيف يحكي ومتى ومع مين يحكي 
طويل اللسان هو انسان قليل أدب وبلاخم ملاخمة وكل مرة بيحكي فيها لازم يجيب العيد وغالبا بكون ثرثار "
1130592077434245248,JO,"كثير ناس علقوا على موضوع الطبيبة اللي تم الاعتداء عليها وأخذوا موقف وفي ناس احتد النقاش بينهم كمان
كيف ممكن نحكم ونعطي آراء بقصة ما شفناها قدامنا  كيف ممكن احكم وانا ما سمعت الا من طرف واحد  كيف ممكن اتعاطف مع طرف ما بعرفه لمجرد اني سمعته واتجاهل الطرف الثاني لاني ما سمعته 
"
1130600247502229632,JO," يا صديقي احنا قاعدين بنراقب قصة اثنين تهاوشو وبنترك مجلس نواب بتاجر فينا 
الدور الرقابي الحقيقي للشعب هو ما يؤدي لحق تقرير المصير مش لهيك قصة"
1175729161345933312,JO,يبدو اراضي عمان اللي ظلت الهدف الجديد 
1175744855395438592,JO, محلاها الحكومة وهي ما تصرف الراتب كمان 
1175822221320884224,JO, هذا اللي تحكيه النقابة والحكومة رافضيته على اعتبار هي صاحبة الولاية على التعليم وممنوع تدخل اي طرف
1176433494492438528,JO,   الاردن يا ديرة هلي حاليا وينك
1176433714395570176,JO, هيني ببلاد الغربة اباطح من اسبوع
1176472580003438592,JO, زملاء كثار كانوا يروحوا للبنك ويتلقوا دعم لدواوين وكتب بدهم ينشروها  خسارة كبيرة
1176475294955446272,JO," عشان باسم عوض الله 

"
1176611678630416384,JO,بس لو صبرت شوي  ضاعت 
1176860402484940800,JO, هالمرة استذكاره اكثر من السنة الماضية واعتقد كل سنة رح يزيد اكثر خصوصا انه الناس صارت ترجع للي كتبه سواء اختلفت او اتفقت معه  هذا انتصار اله الله يرحمه
1177344601067327488,JO, الا الملقي  ايده والقضايا عفق 
1177718008095105024,JO,"ازمة طويلة عريضة بهالبلد والوزير يقولك   

الصحيح تسقط حكومة البنك الدولي حكومة ال نو كومينت "
1177872502472761088,JO, شو دخل عبقريته بانه قبل يكون وزير ويطلع بتصريحات سيئة  اذا عبقري بشغله وفاشل بالسياسة اذا يكتفي بشغله لانه السياسة هيك حالها دايما
1177873107757027328,JO, ولا احنا نقبل واحد عبقري يبهذل حاله عشان منصب لانه هذا اللي طلعت فيه عبقريته 
1177874654536581120,JO, كثير اسئلة انطرحت بالمؤتمرات الاخيرة كانت عبارة عن تكرار ونفس الحلقة لانه الازمة واضحة والمطالب واضحة  صحيح الصحفي حكى بالانجليزي وهو غلط ومش منطقي بس الوزير قعد يفكر بالاجابة وبده يتذاكى وهذا كمان غلط ولازم يتحمل نتيجته لانه هو اللي قاعد يحل ازمة المعلمين
1177955331667828736,JO,اللي هو شو هالتشويق 
1177956743327944704,JO, الفكرة انهم اتخذوا قرار وهم حاليا بالاجتماع  شو ما كان اعتقد المعلمين انتصروا بهالمعركة المريرة
1177957535644622848,JO,امين عام وزارة هو اللي جاي يفاوض قبل يوم واحد من دوام المدارس استهتار وتعالي على المعلمين وحكومة مسؤولة عن تأزيم المشهد من يوم اعتصام المعلمين 
1177957617655787520,JO, معركة كسر عظم وبدنا نستنى ونشوف
1177978323995172864,JO,"معالمعلم 
واضح مقبلين على ازمة اكبر "
1177981005849939968,JO,المصدر ما شاف انه الرئاسة اعلنت هذا الشي قبل ساعتين 
1177999036210655232,JO, كتبوا الحكومة عددهم  واحد فقط
1177999776677318912,JO, اللي قررته الحكومة سيء بنفس تعنتهم بس ننتظر قرار النقابة
1178001296684716032,JO, فعلا كيف واحد يتعب على حالة وبالاخير ياخذ فتات وما بدهم الناس تهرب من مهنة التعليم
1178014662736125952,JO, هههههههه فكرتك كانت واضحة الكل بده الازمة تنتهي بس اللي وراء الحكومة ما بده ينهيها
1178016675574272000,JO," قرش يوميا 
سندويشة وكاسة شاي خليها للهيئات المستقلة "
1178017126214504448,JO," هذا البث مستمر ولا ينقطع 
ببلادهم وما قدرت اشوف ولا مباراة "
1178017520625815552,JO, يا ريت والله  ممتنة 
1178025008557371392,JO, والله ما فهمت عليك شو موال  ولا  عموما شخصيا موقفي واحد  الحكومات مؤقتة والوطن والشعب باقيين ودائمين وهذا اللي لازم ندافع عنه
1178245537394515968,JO,نفسه رئيس اللجنة اللي كان بده يخالف الدستور عشان ضمان النواب 
1178245786108346368,JO,برضه   اللي قبل يكون عضو بمجلس ادارة وكالة الانباء الاردنية وأول شيء عمله كتب مقال يهين المؤسسة والعاملين فيها 
1178290705128722432,JO,  بس ما حدا رد عليهم كونه جاي بالبارشوت
1178312362757107712,JO, الحكومة فعليا ما عندها اي شي الا التهديد  بدنا نستنى ونشوف
1135192782396674048,JO, بالضبط الحكومة بدها تعوض النقص اللي يصير من التخفيض والتثبيت وكمان اي انخفاض بالإيرادات
1135192942702989184,JO, ما اعتقد يزبط لانه لازم على نهاية كل شهر
1135194287564632064,JO, مزبوط التثبيت عشر ايام وبدنا نستنى لنشوف اذا يعتمدوا الضريبة مباشرة
1135602918701392000,JO,الاردنيين معتبرينه قرار سياسي ومصدقين كمان 
1135605225505665024,JO,  المشكلة انه القرار بالسعودية والاردن عادي  ناس تقولك شافت الهلال وأعلنوا عيد  والاردن الف واحد ما شافوا الهلال لو كذبوا كانت فضيحة
1135612350780838016,JO, معلش هو القرار كان مفاجىء 
1136131383762587648,JO,                وانت والجميع بالف خير يا رب ينعاد عليكم بالصحة والسلامة
1136133382398709760,JO, وانتي بالف خير يا رب وعيلتك واحبابك وينعاد عليكم بالصحة والسلامة
1136181085442904064,JO,عيدية  سجل على الدفتر 
1136724873374572416,JO, لو يعينوا مدير البنك رئيس حكومة ونرتاح
1136730987587612800,JO, مشكلتنا تراكمية من بداية اللجوء للبنك الدولي وصندوق النقد واذا رجعت لشروطهم تلاقي اغلب الخطوات اللي تمت بالبلد فرضها الصندوق مش انجازات ولا حبا من الحكومات للشعب والبلد والمقارنة مع امريكا واليابان ولا اي دولة عمرها ما كانت حل لانه الفروقات كبيرة جدا
1136755197387169792,JO, اكثر حكومة تفائلوا فيها الناس وأكثر وحدة خيبت الامال واصدق ما قيل السلطة مفسدة
1137759389706784768,JO, الزلمة قرف وخصوصا بعد الازمة الاخيرة وهذا كان الخوف لكن مع الاسف ما حدا كان سامع
1137807353452138368,JO,  لازم تجريبها بس بدها طلعة جماعية 
1138131932108247040,JO,اذا النتيجة هيك نتحمل معلش 
1138444477872332800,JO, يفترض لا بس هاي حكومتنا وتعودنا عليها
1138445573177184384,JO, اتفق معك  يعني اللجنة وخلصت شغلها وتقريرها جاهز ليش ما طلعوا بمؤتمر وأعلنوا الخلل وانه بدنا نصوب الاوضاع  لكن عبث
1138449063035199616,JO,  مع الاسف احنا اليوم امام واقع انه البلد عبارة عن جزر معزولة
1138497615367217152,JO,ما في غير كم شركة بهالبلد من اجت الحكومة واحنا نشوفهم 
1138800630020153216,JO,  اكيد في احتكار بس الحكومة الحالية تشتغل علنا مع المعارف والأصحاب
1138856655851011968,JO,من كثر اهتمام الرزاز  الوزير اللي شكل اللجنة بدون تردد روح على التعديل الوزراي 
1139243793994211200,JO,  الحقيقة انه مجتمعنا مسكر عيونه عن مشاكلنا الحقيقية اللي هي اخطر بمليون مرة من مسلسل بلا قيمة ومعتبر  حلقات هي اللي رح تخرب منظومته الأخلاقية
1139260266523373568,JO, مع الاسف الاولويات مقلوبة والقضايا المهمة في اخر الترتيب
1139261071171174400,JO, المشكلة كمان بالمؤسسات اللي ركضت تشجب وتستنكر وبدهم الرزاز ياخذ موقف
1139273209747005440,JO, المسلسل اجته دعاية ببلاش وهو  حلقات بس وبدون اي قيمة  هذا محتوى يقدروا بكرا يلاقوه على جوجل واللي ما كان عارف عنه صار عنده فضول وبده يتابع
1139275148853501952,JO, ممكن يتابعوا الهيئة وسلطة البترا والجهات اللي سهلت التصوير واذا يقدروا يحجبوا نتفلكس  بس كل هالاجراءات بدون معنى
1139276612665520000,JO, الاغلبية ضجت بسبب المقطع اللي انتشر ويبدو المسلسل منشور على مواقع ثانية  الاكيد انه المسلسل رديء لكن بكل الحالات حماية الاخلاق ما تجي بقرار وين دور المجتمع والعائلة وكل الاطراف فيها اللي تتشارك اساسا بمنظومتنا الأخلاقية
1139478173824049152,JO,او مسلسل مثل ما ملكت أيمانكم لنجدت انزور اللي كان يقرا مستقبل سوريا بين تدين ظاهر لبعض الفئات وانعدام أخلاقها تحت جناح الظلام وتحولت بعدين لمجموعة من الإرهابيين ضد بلدهم بحجة محاربة فساد المجتمع والرذيلة
1139478212885524352,JO,لو انعمل مسلسل اردني غير بدوي وغير حارة ابو عواد رح نظل نشوف نفس رد الفعل لانه ما بدنا نشوف حقيقة مجتمعنا ونقطة
1139484096764293248,JO, مشاكل البلد وضيف عليها لو العمل بلهجة عربية ثانية كان تابعوه وعادي بس الا اللهجة الاردنية ممنوع حدا يستخدمها بعمل هابط
1139484866792349568,JO, من الحزب الى السجن  كان ممنوع بس حاليا ما اعرف اذا سمحوا يدخل
1139513189698342784,JO, وقديش تكون تافة وعقلك صغير لما تعتبر عمل درامي مهم انه تشبيح وانه حقد وكره للبلد  ويا ريت عنا ربع الدراما السورية مو مثلها بس
1139520391762907136,JO, اقدر انك سوري واكيد حقك تنتقد وتاخذ موقف من اي جهة مرتبطة بأحداث بلدك لكن انا طرحت أمثلة من السعودية مثلا مو منطقي شخص يغلط على اعتبار انه كيف تمدح مسلسل ينتقد الصحوة  الفكرة انه عنا قضايا مثل غيرنا والجهات الرسمية والفنانين جبناء امام طرحها دراميا  وسلامتك
1139604860951834624,JO, فكرته حساب النادي ما انتبهت 
1139623685998940160,JO, ما في شي يمنع بالعكس
1139628508358033408,JO, ما حكيت عنك بالمناسبة وحقك تنتقد وتعري اللي بدك اياه وتدعم اللي بدك اياه كمان
1139630315708854400,JO, برضه حقك تاخذ الموقف اللي يناسبك
1139630905188896768,JO, لا والله مو زعلانة بس فعلا هم نفس الشخصيات وعندهم حقد عجيب
1139632091157733376,JO, وأحييك على مواقفك  لكن لحد الان ما عرفت شو زعجك بالتغريدة الاساسية عن الدراما الاردنية وين الشتيمة او الاساءة
1139632390043852800,JO, بالفترة الاخيرة كله غرق
1139639043065602048,JO, المشكلة انتبهت انه التغريدة مزعجتهم ومكيفين على اي حدا يهاجمني وفوقها يحكي انه يتسلى  الواحد يعجز قدام هيك عالم
1139974563364843648,JO, غريتهم بس معيين يشموا 
1169326467274158080,JO, الله يسلمك يا رب 
1169326604851580928,JO, متاخرة كثير صحيح  بس كل عام وانت بالف خير يا رب
1169468047901544448,JO, ما تفقد غالي  الله يسلمك
1169507088478953472,JO,رجعوا منعوهم  والمعلمين أخذوها مشي لعمان 
1169561160263380992,JO, الحكومة كلها الان بحالة اختفاء تام
1169697643204886528,JO,ودي معلمة ودي معلمة  
1170416163626639360,JO, بوقت الاحداث الارهابية ما طلعوا بدهم حدا يطلع للناس المهم جمانة والرزاز والمعشر ما يبينوا
1170920414601797632,JO, هذا بفضل الأهالي كمان
1170922941871210496,JO, اقل شيء  لانه شغل لا مهني ولا محترمين عقل الناس
1171062071229865984,JO, تستاهل  في احترام للنقابة والزميلات
1171116020146343936,JO, كشخص يشتغل بهالمجال من سنوات اقولك التغطية غير مهنية والمقصد منها مش تغطية الحدث
1171141131205316608,JO, هذا مطلب اكثر عمومية واعتقد رح يورطهم اكثر مع الناس مع اني اشوف تضامن الناس مش عشان العلاوة بقدر ما هو غضب شعبي صامت  اما الحكومة فهي سقطت فعليا والها من يوم الخميس تحاول تنقذ نفسها  بالضبط نفس محاولات إنقاذ الملقي باخر فترة
1171141613541834752,JO, بالضبط اسقاط نهج بشع وكرسه الرزاز باسوا الأساليب
1171370192741511168,JO, اكيد رح يعطوا الطالب حقه  بالشتوية الاجازات تكون اسبوع وما حدا يعترض والمعلمين يعوضوا ويقدموا كل جهدهم وحتى اذا صار جليد وتأخير دوام هذا كله ياخذ من حق الطالب والمعلم ويتعوض
1171373130457198592,JO, موقفك يحترم ويقدر كأم قبل كل شيء  وممكن تسالي افضل بالمدرسة كونها توجيهي حتى ما تخسر شيء
1171396645705211904,JO,"نحب نذكر رئيس الحكومة انه تعهد بتقييم اداء اشقاء النواب اللي تم تعيينهم بدون وجه حق والنظر بعد ذلك في تعيينهم وما صار شيء عليهم 

كي لا ننسى "
1171831401165066240,JO, هاي كيف راحت عنهم 
1171833021760266240,JO, التجربة جيدة بس هالترويج عشان شخصيات اعتقد مش مذكورة
1172165412714438912,JO,نفس الخطاب اللي يجيش ضد المعلمين المراسل اللي يهين معلمين وبده يربيهم بث التقارير المزيفة والفيديوهات المفبركة 
1172827576022310912,JO, سمعته كامل  الزيادين بعيدا عن جزئية الاخوان وتسييس عمل النقابة حكى بالبداية عن ضرورة الإصلاح السياسي وخلط مواضيع كثيرة وهو جاي على نقابة المعلمين الي مطلبهم محدد ويحكيلهم باقي فئات المجتمع كمان بدها وما في بالموازنة مخصصات ومن وين يجيبوا  وبده فكر جمعي وفك الإضراب
1172828354489307136,JO, صدقا اول ما بديت اسمع قلت مظلوم بالجزئية بعدين اكتشفت انه جاي على النقابة يحكي سياسة وما بده المعلمين يخوضوا سياسة وكمان مطلبهم مشروع بس الأطباء وغيرهم كمان بدهم وحقهم بس ما في مخصصات بالموازنة ولذلك رسالة الإضراب وصلت ولازم حل وهذا مو منطقي لانه الحل عند الحكومة مش النقابة
1172839798102511616,JO, الهجوم والاجتزاء معك فيها  لكن هو جاي يخوف من شيء نفسهم الاخوان هاربين منه لانه مصلحتهم مع السلطة خصوصا بعد فترة اشهر العسل مع الرزاز واذا حضرتي اللقاء تلاقي المعلمين ابعد ما يكونوا عن اللي يحذر منه ولانه حكى اخر واحد يفترض التقط هاي الجزئية بدل يوجه النقاش لمكان ثاني
1173174268240322560,JO, هذا اللي عمله  و الفريق اللي هو الوزير المعاني لانه المعلمين ما التقوا فريق حكومي الا الوزير والنائب البدور
1173175071558569984,JO,  مزبوط  والواحد مو عارف شو علاقتهم ليه مو المعشر وغنيمات وأبو يامين  بس هم متعمدين يتعاملوا بطريقة فوقية مش محترمة
1173222923966066688,JO, الاكيد حتى الذنيبات مش طالع من كيفه  بس اللي صاير استفزاز وقلة احترام للناس
1173288711569727488,JO,يا ريته حكى قناعاته 
1173292162336927488,JO, انت شفت جزئية طلاب الجامعة 
1173306398098317312,JO,من اغرب الحوارات اللي تشوفها مع نقابة المعلمين انه النقابة تقول إضرابنا عشان العلاوة والوزارة والإعلام مصر يجرها للمسار المهني وهو مرفوض من سنوات من قبل النقابة لوجود تحفظات عليه
1173310104877359104,JO, النقابة كان عندها تحفظات على كل المسار وفيه طبعا شرط التدريب لمدة سنة بس مو محدد وين واعتقد بالصورة الخلفية رح تكون الأكاديمية
1173310385182695424,JO, الوزارة مصرين على نقطة وهي مش الاساس لذلك جد طبيعي اشوفهم ينكروا اي شيء
1173310744424828928,JO, واضح انه كل هالميمعة بدهم اجباري يطبقوا المسار بس واضح انهم يحلموا
1173311553304760320,JO, الأكاديمية طبعا مش مجانية ولازم سنة تدريب فيها وكمان هي عضو بمجلس الاعتماد اللي نفسها تقرر نوع التاهيل التربوي ووين
1173311871224557568,JO, هم عارفين علاوة ال  رح تطبق بحسب شروطهم ومزاجهم بعكس العلاوة المطلوبة حاليا تكون للجميع بدون تفاوت
1173313471989108736,JO,  ما في بالمسار كله كلمة مجاني مع الاسف 
1173313910058954752,JO, فيه ظلم كثير والعلاوة والرواتب فعليا لازم تصير موجودة بموجب اتفاقيات إلزامية ومش وعود وبعدها يصير نقاش على المسار او تطوير التعليم والمعلم
1173314060877795328,JO, بحسب المسار التدريب لازم يكون بجهات معينة واحنا عارفين الوضع كويس
1173314182000840704,JO,  النقابة مش موضوعها المسار المهني اساسا حتى تناقش تفاصيله هم يطالبوا بالعلاوة
1173315529848885248,JO,  عندهم خيار حل المجلس واعتقد تحرك المعلمين رح يكون اصعب تجاه الحكومة ويروحوا للاعتصام على الرابع او قدام الديوان
1173316306491387904,JO,  المعلمين ياخذوا دورات من اول يوم قرار تعيين وانا اختي وصديقاتي معلمات وبعرف كويس قديش ياخذوا دورات لكن البيئة الصفية والراتب كلها عوامل تضغط على الانسان ومش منطقي يكون كل المعلمين والمعلمات تحت خط الفقر اللي هو  دينار والمعلمين يا دوب واصلين لنص هذا الرقم
1173316427287343104,JO,  بالعكس الطالب كسبان اذا تحسنت كل الظروف فهي تتحسن لصالحهم مش ضدهم
1173464422154678272,JO,  وفي هذه الفترة تحديدا
1173658609944801280,JO, الشركة والحكومة في بينهم خلاف وكل واحد بده يحط الحق على الثاني
1173965504412880896,JO,شهادته كانت لصالح متهم رئيسي 
1173969171694178304,JO, فرز المشروعين يحتاج عشر سنين 
1174022257737371648,JO,وزير البلديات شو علاقته بالجائزة 
1174187064142782464,JO,  الله يسعدك يا محمد  بس بهالحالة لازم ازعل منك 
1174187252555141120,JO,  انا ما قلت شي  سهيلة اللي قالت
1174210953396871168,JO, عظم الله اجركم  الله يصبر اهاليهم ويعينهم على هالمصيبة
1174211038876786688,JO,  الله يسعدك يا عبدالله 
1174212704141230080,JO,  هههههههههه الله يسلمك يا شادي 
1174213444003934208,JO,  الله يسلمك يا رب ويسعدك 
1174348142852091904,JO, تنحل بسبب قوة ضغط المعلمين وكان من الاول بدل العناد والتحدي
1174712473427087360,JO, الله يرحمهم ويصبر اهاليهم
1175328389907066880,JO, صندوق النقد في زيارته الاخيرة ناقش موضوع الكهرباء والمياه والله يستر بالايام الجاية
1175331971477770240,JO, ويعالج اكثر من شخص من نفس العيلة بنفس الكشفية
1175498412042702848,JO, الاجتماع فشل والحكومة قررت بعدها معركة كسر عظم الاحد مع المعلمين  بكرا يوم مهم كثير
1175498862515163136,JO, الله يقويكم بكرا  اهم يوم من بداية الإضراب
1175501285098950912,JO, حكومة فاشلة وتكبر راس على الفاضي
1115320733381595136,JO, انتبهت انه الجمل ناقصة 
1115335359393607552,JO, اكيد مش راي كل الناس لذلك الطرفين عندهم حق بالدفاع عن مطالبهم وبالنهاية الاغلبية هي اللي اتخذت القرار  ومن المهم انه في نقاش صار يتوسع ويكبر بمواضيع كانت الغالبية العظمى من الناس تتجاهلها وهذا بحد ذاته نقطة ايجابية
