id,dialect,text
1086659946979225600,AE, كنت أتوقع يقول هوايته السباحة و ركوب الخيل
1088414348882702336,AE,الله يوفق منتخبنا باجر و أتوقع باجر غير غير لعب و نتيجة 
1090294960904171648,AE, شكرا على نباحك و  اعتذارك و تف عليك
1091636762127028224,AE,مثل نادي الوصل في سنتين تعاقدوا تعاقدوا ويا الكوري و عقب راغوه  
1092839536630075392,AE, احد أسباب دمار كرة الإمارات هاي البرامج الكوميدية اللي ما استفدنا الا منالضحك و مصخرتهم على بعض و تهزيئهم لبعض و القيمة الفنية صفر و للأسف يسمون البعض خبراء
1094518274656747648,AE, أتوقع ماعليه ديون و عيال في مدارس خاصة بس اللي عندنا مساكين اذا استاقالوا شو بيسوون
1094906734039179264,AE,مطرشيلي هالسنيكر ع الوتس اب شو يعني ما فهمت  
1094940150717706240,AE, اول مرة اشوف هالهدف مع أي فريق كان يلعب 
1095371086043201536,AE,فينيسوس مكانه الدكة و عقبها اول طيارة
1096828182857219968,AE,"خمس مباريات بدون فوز 

الحظ مرات يبا يرتاح منكم يا إدارة الغفلة"
1097043377948971008,AE,"  و أزيدك عقد خميس اسماعيل اعلى من النقبي 

هالادارة وايد عليهم إدارة الدكاكين اللي ف النادي"
1097089646788558848,AE,  طول عمرنا ندعم نادينا بس ان شاء الله قريبا بتنجع هاي الادارة و الوصل بيديرونه ناس محنكنين مب عالبركة
1101553509395243008,AE,  ان شاء الله هذا الهدف بداية عودة خميس لمستواه اللي عرفناه 
1102114292382478336,AE, ليش كلهم مكرشين إدارة الوصل 
1104761736865947648,AE, أتوقع واخد من أعضاء نادي الاتحاد يشجع الأهلي السعودي و عينه على أراضي النادي يبا بدش شريك
1105176446916611968,AE,اللي بالي بالكم خلوه في كربلا
1105369705236316160,AE,خسرنا من النصر  و عقبها لعبنا ويا الأهلي المتصدر وملحناهم متفائل
1105850692336582784,AE,  عندهم قهوة جريب بينتهي صلاحيتها قالوا بنعزمهم
1106770209745047552,AE," لا ترحم يا بوفارس 
واللي مافيه خير لدينه مافيه خير للناس"
1107007123974750208,AE,بوسروال شو اخباره فريقه فايز
1107321742253571968,AE,محتاجين هاشتاق يوصل ترند و يكسر الدنيا
1107713592936333184,AE,"بعد كل هذا الفشل قليل من الخجل 

واللي اختشوا ماتوا"
1108045134481055616,AE, انا ما اتابعه بس يستاهل اكبر بلوك
1109071278604988416,AE,  القصد واضح مب تطبيل كثر ما هو معنى في بطن الشاعر
1109166937651724416,AE," زودولفوا بيحرز بطولتين هالموسم و الدوري الموسم الياي 
جرة القدم ادوات و عمل و تخطيط"
1109396685120290816,AE,  و الضحية الوصل وجمهوره
1109866755349008384,AE," اخوي محد انتقد راشد بالهول في شخصه و الكل يشهد له و يثني عليه 
اما شغله و ادارته للنادي صفر مع احترامي للصفر 
نادي بحجم الوصل يكون مصخره و مطنزه هذا ما نرضاه و اذا انت تطبل لاشخاص بس عندنا الوصل باقي و الاشخاص بيفارحون 
كلمة ومزطة تراها كبيره وايد"
1110103746984451968,AE,"الطبول كلهم مسويلي بلوك 

شكرا منذر علي طريت طبولهم  
حوارمنذرالوصل"
1110781547521732608,AE," اللي ما يقرا اسم ريجي كامب يحس المتحدث هو محمد العامري او حميد يوسف 

هزلت"
1110896693820772352,AE," القليل هم الاوفياء الغيورين و الكثير هم المطبلين و المصلحجية

هذا اللي تقصده صح  و انا اتفق معاك"
1111547220690653184,AE,   عيل رئيس دورتموند قال مب شغلكم 
1111610972819595264,AE,كشف تناقضات الادارة الوصلاوية الخربوطية  
1114206959467663360,AE,"بنقول الجمهور متحامل على الادارة 

ممكن حد يخبرنا عن انجازات النادي في الالعاب الثانية 

 ممكن اتجاوبون يا المركز الاعلامي 

اقالةمجلسادارةالوصل"
