id,dialect,text
1187375965380448512,LB,   لما يقولوا كلن يعني كلن والسيد واحد منن هاي بيكونوا هني زجوا اسم السيد ضمن الفاسدين وعليه نحنا عنا حرية التعبير كبير والسيد أشرف منن كلن
1187376786830692352,LB,   الشركات مسكرين ما ح يقدر يطلع غيرو هلأ
1187377918680412160,LB,لقيتلكن هالكم نفر لي طلعوا أوطى من ديماالواطية  
1187384016170819584,LB, الحمدلله منعرف وين لازم نكون ما في داعي حدا يتفلسف علينا
1187384313203056640,LB, معلش عم نحاول نتدارك الموضوع
1187385259274444800,LB, معلش لي ما بشوف أبعد من منخارو صعبة عليه  يتعرف  
1187386229840662528,LB, مش مبسوطة هالشي كتبتو إول ما نزلوا مش لما صار ابتظافع وأكيد مبسوطة بالشعار وحقي وبأيدو وبالنسبة ل  يدبك بنيعو  لي بتويت تانية فكل يوم بكتب هالشي عن اي حدا وأي موضوع بينحكى فيه ع السيد فحكيي يعتبر طبيعي وبطريقة مجازية لا أكتر ولا اقل والتدافع بيصير من الجهتين إذا شي
1187387135235674112,LB, معلش شيل الغباشة عن عيونك لأني اعترضت ع يلي صار خفها
1187388148264919040,LB,"متل إجري اعطي تبرير ووضح بس للبعض لي عامل فيها شريف مكة
هيدي التويت كتبتها أول ما سمعت الشباب عم يهتفوا للسيد وأكيد إني مش مع التدافع يلي صار ف للبعض خفوها وبلا فزلكة لأنو منكن حريصين أكتر مني لا ع السيد ولا حزب الله شفناكن فوق وشفناكن تحت
ولكل حدا هتف تقبروا قلبي "
1187389600408461312,LB, التغريدة لي حطيتلك ياها بتوجه فيها للبعض المفزلك
1187397192778178560,LB, يلي بلش يتعدى بالضرب روح تشكى عليه
1187398349370077184,LB, شو هالتناقض  انا ما قلت متل يلي عم تقولو إذا مثلا  شاب نزلوا يهتفوا للسيد وت نقول واحد منن تعدى ع غيرو كلن بيصيروا زعران تشكى ع يلي تعدى ما بدا تحليل كتير
1187399851102953472,LB, ع أساس إنت الفاهم يعني ما تعلمني شو إحكي ولا شو قول العترة ع يلي لا حافظين ولا فاهمين
1187400876379508736,LB, ما عم إفهم عليك ليش مصر تقولني شي ما قلتو  انا وين قلت إنن مع الحزب  مناصرين إيه وين الغلط  انا من مؤيدي الحزب وإذا شفت حدا عم يحكي ع السيد ح هاجمو بوجو وإرفع شعار متلن الحركات الإستفزازية صرلها  ايام وإذا كم شاب نزلوا يرفعوا شعارات مع السيد مش معناتها زعران
1187420034655801088,LB, إذا حبيت إدبك بنيعو فيني أو بينتفضوا عليي 
1187424264405827584,LB,"أكل من أفخم المطاعم حلو من أفخم المحلات عصير وماي وقهوة ونيسكافيه حمامات متنقلة شمسيات إلخ
هول كلن من ال  ليرة عم يتبرعوا فيها المتظاهرين او هول كلن تقدمة من أصحاب الأموال الفاتحين هالمصالح قبلانين يخسروا كرامة عيون المتظاهرين قولوا والله  لبنانينتفض"
1187428339117633536,LB, يا خيي شو إشبك مش مصدق شي بأي مظاهرة موجود شوف الحلال والسي سويت مثلا التلفزيونات والأخبار بينقلوا والصور مليانة
1187428541450870784,LB, هني إذا لاقوا فقير ع بابن مش ملاقي ياكل بيزعبوه
1187428867566460928,LB, أنا ما عم قول الناس هني المدعومين أنا عم قول في حدا عم يعمل صفقات ع ضهر المتظاهرين
1187429725301608448,LB," وائل جديا مش ح ناقشك 
ما بتشوف كل شي إيجابي بكتبو عم تركز بس ع الإشيا السلبية 
مبلى شفت وبعرف وجع العالم لأنو كلنا موجوعين بس في إشيا كمان ما بتقطع معلش اسمحلي فيها"
1187430016226865152,LB," لا معلش بعؤف كتير منيح شو عم احكي
هول مين دافع حقن مثلا  "
1187430560584683520,LB, ع شو نقلت هلأ  قلنلي خلي اخبارك فيها مصداقية وجاوبتك وحطيتلك المصداقية بإمها وبيها
1187431082418946048,LB, خيي سؤال كلكن لي عم تعلقوا ما بتشوفوا إلا الإشيا الشلبية تعلقوا عليها  صرلي من اول يوم مع التظاهرة وعم دافع وعم إحكي هلأ ليش انتفضتوا إذا عم نضوي ع شي موجود 
1187431920776421376,LB," ليش بتعؤفني  شايفني  عم تقلي من ورا شاشة  بتعرف وين قاعدة مثلا  خلص خيي بنسحب من هالنقاش العقيم 
معك حق اوكي"
1187433717171736576,LB," الحمدلله بحياتي ما حطيت شي واصلني ع الواتساب ولا عندي غروبات بس حضرتك أبصر بأي تظاهرة موجود تفضل هالبلاش من وين 
"
1187434222958583808,LB," انا مش عم إشمل ولا عم إحكي عن المتظاهرين المتظاهرين متلي متلن هيدا مثل بسيط  
"
1187440207718768640,LB,"كلن كلن كلن مارسيل واحد منن صارالوقت
هل من ممتعض  "
1187441798974709760,LB,ها تفضلوا اسمعوا المتظاهرة بجل الديب لي مع مارسيل غانم هلأ شو عم تحكي  قال ال   وسمت كذا حدا تاني قال عم يعطوهن أكل ببلاش روحوا انتفضوا عليها صارالوقت
1187442146791608320,LB, إنسي كلو فوق الطاولة ما بيستحوا
1187444557207744512,LB,ميشال المر من على منبر صارالوقت وكل الموجودين بالاستوديو لي زقفولك لما قلت إنو السيد طالما السيد بيتعاطى سياسة يعني هوي من ضمن كلنيعنيكلن  إيه إنت بالذات بتسوا صرماية بلاستيك عتيقة بإيام الغلا إنت ويلي معك نصراللهأشرفمنن ويلا امتعضوا 
1187445889813618688,LB, حكيت عن كذا حدا ومجدت كتير فيهن الظاهر عم يسخوا منيح
1187447175485313024,LB, هيدا لي طلع معي بلحظتها 
1187447301754773504,LB,  طب مبسوطين هون احكيلنا كلنا 
1187447527223824384,LB,  حراااام حالتها ميؤوس منها 
1187449575725907968,LB, اسكتي اسكتي لي عم إسمعو بيخليني شجع سمير جعجع يحكم البلد 
1187451179820814336,LB,أنا مع إنو جومانة حداد تصير وزيرة التربية  إيييييه بيلبقلها صارالوقت
1187454958012108800,LB, ماشي مهم متلها متل ديما عم يحاولوا يعملوا غيفارا لبنان 
1187455676978810880,LB," عيب عليك من بيت الزين هيدا أكيد أجلك 
ملاحظة ما بعرفو أبدا "
1187468070660390912,LB, كلو صار ضدا هلأ 
1187597972047089664,LB,"لما نزلوا الشباب بالموتسيكلات ت يروحوا ع التظاهرة كنا أول ناس مع الجيش لي قمعهن فلما نكون مع شعار نصراللهأشرفمنن وعم نرد فيه ع يلي عم يقول غير هيك مش معناتها نحنا ضد الثورة
لي نازل قاصد يخرب ولي نازل قاصد يستفز غيرو ت يصير مواجهة بين بعض هول هني الزعران مش نحنا"
1187600941052243968,LB, قلت لما تكون مقصودة للتخريب فهاي أنا ضدها أكيد بس إذا صارت عفوية ما بدنا نحملها كتير ونحنا كمان منستفز ومن  ايام عم نستفز هيدا القصد مش اكتر عفوية ماشي بس مقصودة هون المش ماشي
1187603105048879104,LB,بوثق فيك وبيكفي  السيدنصراللهثقتنا 
1187607705583796224,LB,"تحياتنا وطن  
هلأ هالذليل أدناه ممكن تلقوا القبض عليه أو تسوكي طنش تعش تنتعش   "
1187610128662614016,LB,  ما في شي بيضل مخبى 
1187615065593257984,LB,صح جو الفرح والأغاني لي عم يصير هوي ساهم بشكل كبير ببقاء العالم بالشارع بس كل شي زاد عن حدو نقص لأنو صرنا عم نشوف نايت كلوبات متنقلة  هول ازعبوهن لبنانينتفض
1187633592865902592,LB,  والله العظيم تلت رباع النواب ما بعرف مين هني ولا بعرف انن موجودين بس بيقبضوا ع حضور الجلسات مش اكتر هيدا اذا حضروا ولاااء الن عين ينزلوا ع الشارع
1187634673066881024,LB,"متظاهر عال  إذا بيسقط اللي حامل السلاح بيخلص الفساد كلو وبتسقط الدولة كلها جملة مقتضبة من حكيو الخرنبعي
انا حط لسانك جوات حلقك وسد نيعك بصرماية بتشبه خلقتك يا كلب إنت وغيرك وعلى الأحوط وجوبا انقبر انسد يا معفن وهالسلاح ما حدا بيشيلو غير الله نصراللهأشرفمنن"
1187638274682171392,LB,  ما في بس هني مفلسفين زيادة عن اللزوم 
1187639754130624512,LB,  يخرب بيتهن شو مفزلكين 
1187640291488083968,LB,  مفزلكين يعني بيحكوا ع أساس هني لي بيفهموا  وهني بيكونوا بلا فهم 
1187643871070736384,LB,اسمعوا يا كلاب القوات وعلى راسكن سمير جعجع السفاح إذا عم تحاولوا تعولوا ع الإنقلاب ع المقاومة فروحوا خيطوا بغير هالمسلة هيدا هوي شعب المقاومة  وإيه بهالمناسبة نهدي هالفيديو ل ديماالواطية  
1187665391956480000,LB,  إذا إنتوا بتعتبروا حالكن كنتوا غنم نحنا ما خصنا بعمرنا ما كنا وبعمرنا ما ح نكون عيدي الفيديو أكتر من  مرة ت تفهميه إذا بدك
1187666102664552448,LB,  هاهاهاهاها يعني كنت ناقشتك لو ما قلت كلنا منحب السيد بس لي بعدها مضحك للأمانة 
1187728735774093312,LB, نوووو لي حكيتو انا وضحت قصدي فيه هالمرة بريئة 
1187732137182748672,LB,دخيل رب الأصبع لي راعب العالم كلو  أثقبقرارك
1187737719448973312,LB,"منمشي ع الجمر وما منركع خلي الدنيي كلا تسمع 
يااا سيد نحنا معك  اثقبقرارك"
1187738641541582848,LB,  لاااااا ما غلطت  ولااااو يا عبير 
1187987864606429184,LB,"طيب ت نحكي هالكلمتين
السيد حسن قال سبوني ع عيني وراسي بس مش معناتها نقبل إنو ينسب ويلي عم يسب إمو للشرف كلو ف هيدا هوي وسليلتو وشجرة عيلتو كلها ولاد حرام مصفايين
ويلي بيحكي كلمة عاطلة ع السيد ادبكوا بنيع لي خلفو وإيه نعم هالمرة مش تعبير مجازي نصراللهأشرفمنن"
1187990235763920896,LB,السيد طلب من جمهورو يطلع من الشارع إنتوا المعترضين شو إلكن مع إجرنا ضرب حدا ع إيدو وقالو اطلع يلي بيصدق السيد وبيوثق فيه ح يطلع منتهية  لبنانينتفض
1187991212499832832,LB,لما السيد قال لمناصرينو اطلعوا من الساحات إنتوا يا بعض الثورجيين ع إعلاميين وهول الشوي العاملين فهمانين ليه انعقصتوا ليه حسيتوا إنكن فشلتوا هل كنتوا مسنودين ع جمهور المقاومة للتغيير طب إذا كنتوا مسنودين ع شو أكلتوا هوا وإذا ما كنتوا مسنودين ليش الإحباط لبنانينتفض
1187997662244720640,LB, ما خلاه هشام يعبر متل الخلق كل شوي بيقاطعلو فكرتو بس حكيو رائع 
1187997853999882240,LB,  هاهاهاهاهاهاهاهاها يا عيني نلاقيه مكلبش بكرا 
1188000745314029568,LB,أهل الوفا لا بينباعوا ولا بينشروا  أثقبقرارك 
1188001453505503232,LB, بتوقف الكلمة بزلعومي ما بتزبط دايما 
1188005866617872384,LB, خيفان منها يا منيل  
1188006189076013056,LB, هههههه قصدي ع القليلة في شابين بكل عيلة يعني نحنا كتار 
1188006310111043584,LB,  يعدمني ياك يا هبة 
1188021324276469760,LB, إذا ردوا عليك قوليلي ت أنا أعرف كمان 
1188041333488934912,LB,ع الشيفروليه المدام نازلة تتظاهر ضد سلاح المقاومة قبل المطالب المعيشية فلذلك نعيد ونكرر الشيفروليه أوطى مظاهرة فيك يا كل الكرة الأرضية  لبنانينتفض وسدي حلقك وانقبري انسدي يا مدام 
1188047273063845888,LB,  تضرب منك إلهن هول لي تلت رباعهن نازلين ضد سلاح الشرف هول بذاتهن بلا شرف كل يوم عم نشوفهن ونسمعهن مشينا شيفروليه قال
1188058972047192064,LB,يا تقبري قلبي ما أطيبك  
1188060035827539968,LB,  إيه إيه اليوم سمعتها بدينتي لايف
1188068149553500160,LB, تقارير أمنية وصلتلك  وينن  من وين هالتقارير  ابرزهن ت نشوف نحنا كمان
1188068515640684288,LB, وإنت شو إلك مع إجرنا يا معفن  روح خليك بالسفارة لي عندكن قبل ما تطلع تتحفنا بنظرياتك الخرائية
1188071429671182336,LB,  هيك بتفهموا الخطاب هوي قال هيك ما قال لحدا انا ضد هوي حكي مع جمهورو وقالن اطلعوا ما ضرب حدا ع إيدو ولأنو عنا ثقة فيه اطلعنا قال في تمويل مش مزبوط ويلي ما بيشوف هالشي بيكون أعمى صراحة ونحنا ما منقبل نكون بمحل داعمينو لي عم يتآمروا ع سيدنا سيدنا بيحكي معلومات مش تحليل
1188074237686358016,LB, انزلي ع الساحات بتلاقي لي بدك ياه 
1188077333871300608,LB,   حسن بأديش الصنوبر  إنت بتحط كمشة بإيدك وبتاكلهن بلقمة وحدة  شكلك غني 
1188089154518863872,LB,"  اولا هو سيد الشرفاء وأكيد إنت مش واحد منهن
تانيا ريتني أقبر أهلك
تالتا سلاحلنا سلاح الكرامة لي حضرتك مش مارق من صوبها
رابعا كمل بكي ت ترتاح
خامسا انقبر انسد"
1186566486858649600,LB,مين البهيم لي عم يعملي   معقول ديماالواطية أو ما خص   جرب حظك مرة اخرى  لبنانينتفض لبنانيثور 
1186569145044885504,LB, لازم يتضامنوا مع ديماالواطية عيب 
1186579181737517056,LB, ويسكروه ع أساس ما قادرين نفتح حساب غيرو عالم هبلة 
1186581918118273024,LB,مش كلن أبدا مش كلن هيدا السيد أشرف منن  السيدنصراللهثقتنا 
1186590527073980416,LB,الثورة قدام مصرف لبنان أهم منها من رياض الصلح وساحة الشهداء بهاللحظة المصرف هوي الأساس يسقطحكمالمصرف
1186605822975062016,LB, هلأ ديماالواطية بيبقى إحتمال 
1186616699220627712,LB, وين الهاشتاغ  هيدا قصدي 
1186617570423726080,LB,"الله ياخدك يا نصاب يا فاسد يا كلب 
حرامي حرامي رياض سلامة حرامي  يسقطحكمالمصرف "
1186619658822176768,LB, مين هوي  حط أسامي
1186619933129674752,LB, المرة التانية إققال تام 
1186620936725979136,LB, شوية كلاب أنجاس لا يعول عليهم السيد يقبرني ما منستغني عنو ونحنا والسيد من هون معكن  كتير حب 
1186633217849331712,LB,"في متظاهر إبن ستين حرام ع الجديد هلأ عم يقول سلاح المقاومة قال توجه صوب بيروت وتوجه صوب النبطية ومبارح توجه صوب صور 
أنا انقبر انسد إنت حمار يلا  او بهيم  أو كديش  أي حاجة من دول 
ريتك شو إسمو وما حكيت وقال شووووو مندفع وعم يعيط  لبنانينتفض لبنانيثور"
1186634515189555200,LB, انا كمؤيدة لحزب الله حقي إنزل وطالب الدولة بحقوقي ما حدا فيه يمنعني وفي كتار مناصرين لحزب الله بالشارع اما حزب الله بشكل رسمي لاء مش موجود هول عندن فوبيا حزب الله معلش 
1186635718589853696,LB,شيلوا سلامة وحطوا حمار  بركي بينزل الدولار  يسقط يسقطحكمالمصرف
1186637716076805888,LB, إيه إيه ع كل الجبهات 
1186644806346383360,LB,شو كانوا عم يعملوا بعض موظفي مصرف لبنان اربع ساعات بالمصرف مبارح  ليش ما حدا ركز ع الموضوع  أساسا وين قريتها نسيت بس بتذكر لي كتبها المفروض موثوق الزهايمر المقدس  أوكي باي يسقطحكمالمصرف
1186646581606604800,LB, عنجد هالشي كتير مهم
1186647722918633472,LB, فشروا ع رقبتن كلن سوا
1186648980593299712,LB, هههههه قالولي جريدة الأخبار
1186651508298915840,LB,"حرامي حرامي رياض سلامة حرامي
هاي المقولة زعزعت التويتر وخلتو يوقف لدقايق بسيطة  حاكم مصرف لبنان إيدو هلقد طويلة وطايلة حتى لعندك يا إبني يا    يخرب بيتك يا سلامة فضحتنا عالميا  يسقطحكمالمصرف لبنانينتفض لبنانيثور"
1186668114366357504,LB, ح حطها عندي هيي بذاتها
1186669675553476608,LB, لو عارفة كنت حضرتو بحب مقابلاتو
1186671978071183360,LB," سهى اولا مش من خربة سلم وتانيا شفت التعليقات بيناتكن هيي ما اختارت الهروب بل حكيت رأيها بكل أدب 
منطقك لي عم تحكي فيه إنت صراحة مش زابط كيف يعني بتتمنى إسرائيل تشن حرب ما عم نقول ما صار في مسخرة تحت بس ما بدنا نهضم حق الفئات الكبيرة لي نزلت عندها كلها مطالبها الحقاوية"
1186673967492468736,LB, هاهاهاهاها قلت نفس الشي 
1186689874516234240,LB,ركزوا ع مصرف لبنان ركزوا ع الحرامي الأكبر ركزوا ع حاكم مصرف لبنان ركزوا ع رياض سلامة ثورتنا الكبيرة قدام المصرف المركزي يسقطحكمالمصرف
1186691493056122880,LB,  شيعة بين بعض  اطلعي منها وتكذبيش 
