id,dialect,text
1001781885507461248,SD,لم المطره تنقط اول نقطه بفكر في منو الح يغسل الحوش منو الح ينضف   وووو هيا ي ببه ي عنب المربه هيا ي زينه ي حلوالمدينة هيا ي قمحا ي حلوه ي سمحا 
1003639044440551424,SD, لمن يقولو لي قومي غسلي العده وتكون ما علي 
1007131992109059968,SD, بسبب اللي يسوية تركي
1014236026561286016,SD,البلد دي قعادنا فيها مسألت وقت
1019294801374609408,SD,  الشغله مبدا واحترام لي البني ادم الاخر
1044949015656386560,SD, انا حكون وحده منهههم 
1045264150925127552,SD,المالووف جميل دا خمج سااي 
1045313642806345600,SD, عايزين تسفرونا ولا دي ونسسه سااي
1047813228103970816,SD,انا هعمل الصح واشرب حشيش 
1049570544281145216,SD,باكل لوبان واطقطقو بصووت عااالي  
1050536361911050240,SD, الف رحمه ونور تنزل عليه
1051811399805128832,SD,والله الحلق ف الولد حلوو عدييل 
1051812620548956160,SD,في حتت اصفق ليك دي اتخليتك بتردحي ليهوو 
1051819344932601984,SD, انا قلت سوداني اسسه  لاكن عليك الله ما حلو
1051891411363291136,SD, هو وينو الشتا داا انا ما شايفاهو
1052563201378922368,SD, دقوا شير امرقو برا منها العارشين ليها شنوو
1052782298356170752,SD,في مورنيق تكس بخليك تنبسط وواحد تاني بخليك تجدع التلفون ويعكر ليك مزاجك من الصبااح 
1053267756299231232,SD,اليوم داا بيزهج و طوييييل وما بينتهي 
1053345217817010176,SD,انا سعادتي في ايفون  
1054369071972663168,SD,ي  جماعه موليتا دي شنوو 
1054372579207720960,SD, اكله هي يعني انا ماا متزكر سمعتها وين معناها سمعتها عند بت سناار زااته
1055822094611693568,SD,الجمعه دي يخوانا للنوم للرااحه للناس تقعد في بيوتا اصلو اصلو ماا للزيارات ياخ
1061697078936637440,SD,"مكان ممكن اشتري منو كاب
اسالتويتر"
1063098166822797184,SD,يارب يارب يارب يارب يارب يارب 
1064816892853084160,SD,اليوم دا محسسني الجمعه الجمعه كدا
1065164298136297600,SD, عقلي راافض يستقبل المبادئ دي
1065985086699511808,SD,"اتنشن
ي جماعه الزار ما هزاار 
وشكرا"
1066586183281635200,SD,ناس المرور الليله هايجبن شديد
1067188550951727232,SD,الواحد لو بلع ريقو ساي حيكون محتاج يمشي الحماام
1069673040785694848,SD,الايام الباقيه من السنه دي حنشوف فيها وويل الويييل
1072365420793999360,SD,مارقه من البيت زهجانه وصااره وشي لاقني واحد سوري قال ماالك قلت ليو ماشغلتك ومشيت بعد شويه اكتشفت انو بنادي لي واحد صحبو اسمو مالك
1072365683743305600,SD, دقيقه باقيه لي المحاضره وما لاقيه مواصلات
1077337938063749248,SD,"لو خوفنا رااح وطريقنا موصوف بالثبات 
ومشينا للحريه صاااح 
لابد اكيد مهما طال الليل ضناهو الفجر جااي 
مدنالسودانتنتفض 
موكبديسمبر"
1077493922203615232,SD,"مفترض كان تتعمل توعيه للاهل قبل قيام الثوره قعادنا في بيوتنا ما حيعمل شي و الواحد ما بموت ناقص عمر والله ما بيموت ناقص عمر 
خلوها نطلع عشان حق بلدنا و حق كل الشهدا الضحوا عشانا
مدنالسودانتنتفض 
موكبديسمبر"
1077500373311651840,SD,"ابقو الصمود 
فجر الخلاص قررررب "
1077511174558809984,SD,وهذا ان دل يدل ع خوفهم الشديد 
273505633582592000,SD, انا جاي بس اوع تجري لما تشوفو
273511934459006976,SD, عقبالنا بحلالنا نعتبرها ثقافه لحد ما تتسهل 
273756037285289984,SD," اخخخخخخخ
مؤخره شديــــــــــــده 
يجمعني بيك يوم"
273798288560508928,SD,"  ما نركب معكم عالدراجه في الوراء
اصلو بريح المقعد الخلفي 
هههههههههههههههههي"
284397541246767104,SD,"ناس الحله سمعوا صوت بووس في بيت عزابه
اتصلوا بي
داهمو البيت

لقو مسطول بياكل في اندومي
هههه كم عجبتك خش هنا وشوف الباقي"
285444511952424960,SD,"لي إيــدينا بنــــــــرفع  والعازب كلو بيســــــــمع
نفوسنا كتير مشــتاقة  للراعي دوام نتضـــــــــرع
شعارنا "
287163048047816704,SD,     اللي تحتيها اجمل منها  ي ملكه وانتي اجمل منهم صح 
287571102320951296,SD,"ندمان علي ريدك وضياع سنيني معاك
كفاية توهاني في دنيا زي دنياك

كل ماعملت معاك شان ترضي إحساسي
لكنك إنت أبيت "
289133199995584512,SD, لا لو ما دخل فيك جوه للبيض    ما بنفع 
289630100964667392,SD,ي عرب ي فااااااااسدين ي موسعييييييييييين
476458246514147328,SD, ماحد متفاعل مافيه ريتويت
477536794775683072,SD, كده م صاح كده غلط لانو الراجل بجد يكفي اربعه مش اتنين عشان يكفو واحده ديل شكش
477934408880898048,SD,طفلنا الحب طفل من نار طفل بيعيش اغرب اطوار يضحك الحان  يبكي اشعار
477938050920882176,SD,  انتي انسانه رائعه بحيث انو بتثيريني وتعذبيني بالصور اللي عم تنشريها
680048286452035584,SD, يلااا السكه اللي توودي
685205668240965632,SD," مين كاظم الغيظ  مثلا 
هههه"
715655448452546560,SD,  معليش العتب على النظر و بعدين انا ما ضارب النظاره دي ساي
850880330320011264,SD,"بيفكرني بحد بس مش عارف  مين
 "
856657568676159488,SD,"
عليك اللة الزول دة هسه لو جيت قلت لية الحارس حق البارشا قبل تير شتيجين منو ما اظن هيعرف ويقول كل مدريدي فاشل "
913248942443450368,SD, سوأ مرحلة ممكن توصلها              إنك تعبان
914642362558828416,SD," نفسك في ايه 
 نفسي ربنا يرضى عني و يراضيني و يهديني و يبعتلي فرحه ترد روحي"
922514200131526784,SD,جر نفس وطلع كلل هموومك عن الاوكسجين اتحدث 
922882608417202176,SD,البحر مالح  والناس مصالح
923789753115467776,SD,يوم اجاازه ويصحوك بدري
924145113948983168,SD,كيف الرجوع لي زول قنع شايل رفات قلبو الحرق
924152254671749248,SD,الحبحلولما يكون في حب القيمات   
925388715475853184,SD,"انا فوق نيلك شوفني كيف بغرق 
بين رياح وشراع عايزا اموت بي  سراع
والمصير يصعب فوق نيلك "
926847611180584960,SD, البس من ملابسك لكن تلبسي مني لاااا
927203121780199424,SD, م مصدقا اني نجحتا 
930840099876691968,SD, ضد  لو كان راجل م كان اساء ليها كان احترمها وقدرا كدا بيتعرفوا الرجال
935763997105811584,SD,"اي حاجه بتكون حلوه لما تكون طالعه من القلب  
يوممميز "
935766591026888832,SD,الزول الفرحه انت الاساس والفاونديشن   
936310290756628352,SD,السنين ياريته تجري وكل يوم ياريتو باكر
937730036987285632,SD, انا وين وانت وين وين ودتنا السنين  
938825704233422848,SD,ي قلب انا كنتا قايلك تبتا من تعب السفر ومن مخاواة القماري ومن شراب موية المطر
939058648529162240,SD,بس انت رشرش بالصبر ل م يقوم للهم غبار
939245277357199360,SD, انا ك سودانيه ليه ما عندي مكان امشي اقعد فيهو لما ازعل و يجي واحد يقول كنت متأكد انو ح القاك هنا  
939249257596538752,SD, دي إجابه عقيمه جداا
939462280990863360,SD,  انووم واصحا بس م بذكروو
939526387249148032,SD,استمع الى حلاوة الدنيا من  على أنغامي  
939731997752209408,SD,"مع الزحمه الفي كبري كوبر دي الزول لو طالعه يطلع قبل يوم 
سيريسلي"
940622735268564992,SD,الله فوق زوزو ي حلات زوزو  
940974179461025792,SD,تصرفاتي وانا نعسانه اخطر من مدمن المخدرات
941209745863692416,SD,"المفروض يكون في كورس اجباري لي اي كمساري يعلموهم فيهو فن التعامل مع النااس م ممكن ياخ 
 قرفتونا"
942652087913066368,SD, حلو شعار خفف وظريف 
948958529779650560,SD, كل الابداااع وااط أفويس يو هاف 
948962793889390592,SD,لك الله يآ وطن  
952825039618965632,SD,"نعس جرحي القديم و ارتاح
عرف رمش الليالي النوم
و غسل نبعك ملح دمعي
و انزاح الظلام مهزوم"
952943471752564736,SD, حفله وين م سمعتا بيهاا  انبساطي دا من شي تااني خاالص  
952948214315044864,SD, بس الله ينور عليك
973935241080393600,SD,"ي قمري ي قمرا 
ي سنسنه و حمرا 
بسأل عن الافراح 
والخاطر المرتاح 
عن دنيا فيها السماح 
 عن الصباح الراح"
973935839594954752,SD,ي نااجي م تلووم   
974282437286088832,SD, كلهم توحد تقليدي الا انت توحد غير محدد  
975866457195274240,SD,"وين بتفوت رسايل الليل
بعد نكتبهم
ونزينهم
ونقرب نرسلهم
ونمسحهم
ونمشي ننوم 
أظن
ببقوا نجوم"
977495590782332800,SD," طين البحر  
الاندومي 
النومه البتجيك ف المحاضره  "
979072229177688064,SD, اقري عشان بكرا اخر امتحان 
988809201815343232,SD,كتير بحلم اشوف عينيك تماسيني وتناجيني واجيك باللهفه المشتاق وتخلف وعدي م تجيني واعيش احلم
992087420924407808,SD,لم اشوف الكرش واقف مع وحده  
996668088455221248,SD,الحنين ال بيا ليه ما قدرو
998720553136656384,SD,حب كتير لي الكنافه بي القشطه 
999388956449017984,SD,وبحب الناس الرايقه الي بتضحك على طول
1011675793003614208,SD, ي اخي هم عندهم هم شنو  ما كل شي عندهم ومجانا عشان كده بيرقصو  لاهم ولاغم االشعب ليهو رب العباد
1023187649979474048,SD,بتشبه بنت اخوي شبه ما عادي ماشاء الله  
1025523589930536960,SD, بقيت بحاول ابقى انسان اناني عديل عشان اقدر اصل للمرحلة دي
1031507495108444160,SD, المفروض تبقي اقوى دا شي لابد منو 
1035764146703347584,SD,  من كتر الناس اللي ب  وش وحشونا الناس اللي بي وشين
1049609419049357184,SD,معتز صدمه  الدولار بي  عاجبك كده
1049632938046959616,SD, انت ابدا ونحن بندعمك بفكره  والله يعنيك
1053589062634913792,SD, مدينة كامله فيها كم شجره ليهم حق تدفن تحت الرمال  ياخي لو كلو واحد فيهم زرع ليهو شجرة ليمون في البيت
1054625126497566848,SD, كلام صح  وهي الغريب في الموضوع وكمان في حاجات اكتر محتاجه معلاجه
1055918078620561408,SD,   ممكن وليه لا شوف دا مستورد من الهند ومعرض في السعوديه  عرديب  
1059524399471181824,SD,الرحله طويله مكتوبة علي وبمشيها المسافه  بعيده ومحسوبه خطاوي وجاييها
1060338415789596800,SD,الواحد بس يقول الحمد لله  يلقطه النمل يطاها الفيل  تطلع من ساعه  سبعه ونص صباحا ترجع البيت ساعه عشره بالليل  وانت راجع تنزل الرسال يعني تعب اليوم الله يعوض 
1076421433897746432,SD,الله عليك ي معتز مطر  مين اللي قال ان الربيع العربي هان  ربيع السودان 
1077626679969886208,SD,عفو بتع ماذا مالك ما شايف الرصاص ي جبان 
1084758591557505024,SD," في دواء لسرطان الدم  اسمه جلافيك  

سعر العلبه الف جنيه 
موجود مجانا اللي معاه الروشته 
ومعاه ما يثبت انو مريض سرطان
يتصل علي 


بلاش شير خد  عشان يظهر لاكبر عدد
اللهم اشفي كل مريض
  "
1087440443883900800,SD, وصلت الموقع ومافي حد
1089039489723494400,SD, ي رب قطر عجيب يودي ما يجيب
1115350929597980800,SD,البشير بيعلن انو قاعد في السلطه وما عوز يرحل  الناس ما تحرك من منطقه الاعتصام حتا يسقط الطاغيه 
1129394038027837440,SD, لأنهم فعلا ما جادين هم بجربوا ليهم في أي طريقه تخرب المفاوضات بس الطريقه شنو هم نفسهم ما عارفنها 
1131321371257184384,SD, سبحان الله انا قاعد في مطعم في شارع العرضة بتعشى لي زي ساعة و الله العظيم الساعة كلها الحوت فتحت التويتر لقيت الاكونت في وشي اللهم اغفر له و ارحمه رحمه واسعة 
1132415494986838016,SD, دا دليل على انو نحنا فاهمين الحريه غلط فاهمين الحريه انو انا اعمل ألفي مزاجي بغض الطرف و صرف النظر عن الشارع بقول شنو تسقط بس دي ما كان قاصدين بيها إسقاط الأدب العام ما مقصود بيها حريه الرأي النابعه من الجهل المكتسب من قهر النظام السابق مقصود كان بيها احترام الآخر حتى لو مختلف
1132417804496453632,SD,"  

ما بمسح البيانات

تقفلي التلفون

و لما تجي تفتحي تكوني ضاغطة الباور و معاها زر خفض الصوت و تستمري لحدي ما تجي علامة أبل و تختفي و تظهر تاني تفكي يدك و بعديها بفتح عادي "
1132454182835970048,SD, اعمليها تاني لانو دي مشكلة  ما  فا دا الحل ليها أو تعملي ليهو 
1133103736547676160,SD, هو دا الترابي نفذ المخطط كلو و المقرر كلو و هو قاعد و بقول في نفس كلامه بتاع دخان المرقه و وجع الولادة
1133104172230938624,SD, جرو  سنة لما اقتنع و بعد دا لما الثورة بدت عاد الاسطوانة المشلوخه بتاعته و برضو بكابس في الدخاخين و الدلكه و المسموح 
1139124192127963136,SD,"قصة الهاشتاق العالمي  

القصة وبدت بشكل عفوي من أهالي وأصحاب الشهيد محمد مطر اللي استشهد في مجزرةالقيادةالعامة غيروا صورة بروفايلاتهم للون الأزرق اللي كان الشهيد بيحبه
انتشر الهاشتاق في العالم واتحول لحملة تضامن مع السودان ككل في ثورته ضد المجلس العسكري "
1143611380190339200,SD,"لازم نكون مليون
لازم نكون لاااف
نملى الشوارع حق
يملاها صوتنا هتاف
شايلين وطنا هدف
بيناتنا مافي خلاف
حامينا خالقنا
ومن غيرو مابنخاف مليونيهيونيو"
1145210046554488832,SD,"الليله شنو             المليونيه
جاي لمنو              لمجلس برهان 
ومعاهو منو         وحميدتي كمان 
عملو شنو              قتلو الثوار 
قتلوهم متين         في نهار رمضان
عايزين شنو           عايزين التار
وتاني شنو              المدنيه كمان  مليونيهيونيو"
1159057778910146560,SD,  هم ما عارفين احساس القبضه ظابط كيف 
1164483415237746688,SD, قوم شوف شغلك يا سعلوق
1172204575241232384,SD," قلي ادب 
ليه حق 
لكن يشله نمل ضايقك"
1172242751674638336,SD, اتصور بيه نشوف تصور  نظيف
1172256170435842048,SD,  الجاي اجمل ي جميل
1172426951803330560,SD," ربنا يشفيك ان شالله
خل بالك من صحتك ي جميل"
1172575199243509760,SD," رحمة ربنا واسعة
ربنا يكتب ليه الشفا"
1172907375038259200,SD, اخف قدر من طفلة قالت دايره ابقي رقاصة 
1173608804858179584,SD,    دا عالم صايعه يابه
1174092203221757952,SD," كله وارد 
وكله عادي
الا كسفه الاحبيب الحارة"
1174673836123598848,SD,"  حل موقت
ممكن تحضنيني وانا اوصل ليهم حضنك
لخبته اقصد تكلمني وانا اوصل صوتك"
1174986993358557184,SD,"  ظروف وتعدي ماتهتم للايام
طبيعه الدنيا زي الموج 
تشيل وتودي ماتهتم للايام"
1175000188856995840,SD," طاقة لي اكتر ربع ساعه مافي بقت
حليل زمن ننوم في الخط "
1175400481977446400,SD," استاذه حنيه انتي
ي ريت يفهمن"
1175418097819422720,SD,"  ماشالله مابتظبط معاك في عزاء

الميت مات بسكته
تقول مشالله"
1175695677642432512,SD, الجاي اجمل ان شالله
1175725514423767040,SD," حليلك بقيتي خالة
عقبال شمعه"
1175845377637007360,SD," علي ما افتكر انتي عايشه في 
هنا خلي بنيه في موصلات دقيش وهبش لو لقي فرصه بغتصبه في مواصلات خلي لما يكون براهم
فشنو الواحدي تحرص وماتجي تتبكي تقول وثقته"
1175893392993243136,SD,    الناس في شنو والحسانيه في شنو
1175896835849949184,SD,"  فرد حاجة بقت تندفن مافي
بقي في فت فت تقيل "
1176074041528115200,SD,"  انتي دايره بيه شنو 
شريحتين والا تلاته
كملي عصيرك دا "
1176100836071677952,SD," يالهوي يالهوي ايه دا يشيخه ايه دا يشيخه
تويتر بقي فشخ فشخ"
1176101631848566784,SD,"  الجني اسي يشيل ويحلف والله ما انا
ايه ي جدعان بتتبلو علي ليه"
1176102734061277184,SD,"  لهاتي هينه
انت وقعته كلك ع بعضك
لكين ي فرد ماحنك كل الناس بتمد كورته
لكن قصه دبي زوده محلبيه "
1176253688094044160,SD," لمن لقاء قروش كنت ناسيها بفرح كاني ادوني هديه  
لكن طولت من الهداية والقروش بقت تتقسم من قبل راتب"
1176358327707734016,SD, يكفيك انو عيونك حلوة
1176436621203267584,SD, والله الست دا بتتكلم صح 
1176437322935668736,SD," وانا اقول ليه شباب دي مهضلم كدا
لزمه نبلغ الشيخ بالسالفه "
1176852632507420672,SD," قلع 
سمحيه ضايقة عليه الدنيا اتلقي"
1176853398517374976,SD," فهمنا
ليه تحمر لينا تهرشينا"
1176980117073092608,SD,"  ساعة ديك م حاتفكري في الهروب
حاتقعدي تبرمي في شعرك وتدندني 
ليه ي حب بتدق ع باااابي
حرام ي حب ضياعت شباااابي"
1176989548838084608,SD," العرس عشان متطلبته كتيره عشان كدا الكل بدفع
العريس واهل والعروس واهله
فشنو العرس انتحار
والعزوبية ميته ممرحلة"
1177205984248422400,SD," ههههههه ماتزكرينا
لو زنينا ما قدر دا"
1177207283606065152,SD,"   كلنا فهمنا غلط
قلنا محمد براهو براهو كدا يدوس المكرونة"
1177334625720524800,SD," كله تمااااام 
زي الفل ي معلم
طيب الحمدللله"
1177335140365799424,SD," البت دا مشت برا خربت
مايده للمثليين و لشارب الخمر
ايه دا ي شيخه اااااايه دا ي شيخه
ربنا علي ظالم "
1177521378762903552,SD," ي زين منطقكم
بستهبل عليكم وانا مطبقه "
1178040527872282624,SD,"  الملوحه و الكول
غلبني كتر علي هههههه
ماقدرته اتاقلم معاهن هنائي
ديل يهن تاكل وماتشمم يدك الجنبك"
323981334982844416,SD,الليله  عيد  ميلادي  و كلكم  معزومييين معاي
385018566556536832,SD,ياجماعه باقي لي  دقيقه و اركب الطياره جاي السودان
417292172095131648,SD,"       
         
 "
469506943418376192,SD,"إآنتهينااااا   خلآآأآص 
ي امتحانات"
495447510115053568,SD,"   أ 
    
شالوا الهنا ورحلو ا ليه ياتري "
504908474434985984,SD,"ع   فككرةة أنا بعرف  أجرح
و بعرف    أزعل
و بعرف     أوجع
و بعرف    أهين
و بعرف   "
575949539502342080,SD,عن دقة قلب لما تلم حد بتحب
595715886276808704,SD,لما توصل لمرحلة إن مفيش أي كلام هيعبر عن الي جواك والي تحس بيه يبقى تسكت و تحاول تضحك ضحك هستيري علشان تعدي يومك 
600022215376134144,SD,"دا شنو دا يااااخ 
الدكتور شكلو بيكون مسطول  وهو بضع الامتحان عشان بتفنن لينا فيهوو   "
607307309874749440,SD,ويجيلك واحد فشلوني ويقولك  إحنا اخدنا الكاس  طب يابني إنتو السنه الفاتت قادين تبصو علينا و احنا بنرفع في 
609520395486507008,SD,في ناس وانت بتكلمهم بتحس إنو كلامهم بياخدك بالحضن    
649138766758678528,SD,"تتغرب عشانها  تسيبك عشان اتغربتة 

دنيامعكوسة"
652437865843064832,SD,"ناسية انو رب الناس بياخد حق الناس بي ناس
العدالة"
659422559990099968,SD,"جيتي من وين شان تفوتي 
فايتة وين و ماكي جايا  

 فاطمةالسمحة"
661096034370772992,SD,"لوسواقينالركشاتبنات
معليش ما حا نكمل المشوار دا مع بعض بنزيني خلص و انا ما كنت عارفة انو حا يخلص 
البنزين  الريدة
عادي بتحصل "
695416888738734080,SD,صوتك لحاله يقين  و صوت باقي النـاس ظن 
707032173308678144,SD,"

في عيونها عشق يوصف بالخجل"
707855895569547264,SD, مصيبه انتي والفراغ مشكله
764165051641171968,SD,حوش الامل مفتوح ما فيهو باب شارع و الشارع المسكين فوق الارض واقع  واقع و ناس راضين نور الشمس ساطع صوت المدينة سكون من القلب طالع
800920103781072896,SD,معقوله مافي و لا واحد ممكن ادخل الادوية الجايه من المغتربين  معقوله كل الشغالين في الجمارك ما عندهم ذرة من النخوة اعيدواالدعمللادويه
800998047949918208,SD,الهاشتاق المفروووض يكون اعيدواالوطن اعيدواالدعمللادوية رجعوابلدي رجعواوطني
801115126711652352,SD,اعيدوالدعمللادويه  دايرين راجل في الجمارك راجل متربي ياخ اي راجل ما ضكر 
801285977457233920,SD,نضف كوزك اعيدواالدعمللادوية
801294870325370880,SD, صاح الوضع منتهي بس نحنا لو قدرنا نوصل الادوية الخرطوم بتصل للولايات ان شاء الله
801295187527999488,SD,"عادي جدا تمرر مخدرات من غير جمركه وحرام تمر علبه دوا بتحي انسان  
حسبي الله ونعم الوكيل 
اعيدواالدعمللادويه"
801690065567182848,SD,عشان امك امي و اختك  اختي  و ابوك ابوي و اخوك اخوي برفع صوتي لا للغلاء انتالضهرانتالسند  اعيدودعمالادويه 
836148988038512640,SD, و الله التطور ما حاجه عيب  منكم نستفيد  بغض النظر من دا كلو و انك بتعرفني  انت منو
836150419197931520,SD, في بعاتي جميل كدا  يا جمالو يا جمالو على شمالو حطهالو
836158084703797248,SD,  اللحن واحد الاختلاف في الاداء  السؤال مفروض اكون ممكن اتلقي ليها توزيع اخر  كتير من الناس بتخلط بين اللحن
836168712344457216,SD, يلا دي عشان بي بيانو فا لازم تكون هادية بس ان شاء الله بالجيتار بتكون اسرع 
906177048628080640,SD, عجبتني اول زول شفتا عندو جيتار في بيتهم دي  ياخ كل الشوق و الله يا حضران
